[I 2026-04-09 14:28:11,975] Trial 21 finished with value: 0.1036 and parameters: {'left_wall_dist_num_layers': 3, 'left_wall_dist_activation': 'elu', 'left_wall_dist_out_channels_l0': 76, 'left_wall_dist_pool_size_l0': 4, 'left_wall_dist_out_channels_l1': 103, 'left_wall_dist_pool_size_l1': 4, 'left_wall_dist_out_channels_l2': 178, 'left_wall_dist_pool_size_l2': 8, 'left_wall_dist_fc_hidden': 57, 'track_width_num_layers': 3, 'track_width_activation': 'relu', 'track_width_out_channels_l0': 58, 'track_width_pool_size_l0': 8, 'track_width_out_channels_l1': 41, 'track_width_pool_size_l1': 2, 'track_width_out_channels_l2': 143, 'track_width_pool_size_l2': 2, 'track_width_fc_hidden': 115, 'heading_error_num_layers': 5, 'heading_error_activation': 'elu', 'heading_error_out_channels_l0': 61, 'heading_error_pool_size_l0': 2, 'heading_error_out_channels_l1': 46, 'heading_error_pool_size_l1': 4, 'heading_error_out_channels_l2': 46, 'heading_error_pool_size_l2': 2, 'heading_error_out_channels_l3': 113, 'heading_error_pool_size_l3': 8, 'heading_error_out_channels_l4': 35, 'heading_error_pool_size_l4': 4}. Best is trial 20 with value: 0.0971.
[rank: 0] Seed set to 42
[rank: 0] Seed set to 42
[rank: 0] Seed set to 42
GPU available: True (cuda), used: True
TPU available: False, using: 0 TPU cores
💡 Tip: For seamless cloud logging and experiment tracking, try installing [litlogger](https://pypi.org/project/litlogger/) to enable LitLogger, which logs metrics and artifacts automatically to the Lightning Experiments platform.
GPU available: True (cuda), used: True
TPU available: False, using: 0 TPU cores
💡 Tip: For seamless cloud logging and experiment tracking, try installing [litlogger](https://pypi.org/project/litlogger/) to enable LitLogger, which logs metrics and artifacts automatically to the Lightning Experiments platform.
GPU available: True (cuda), used: True
TPU available: False, using: 0 TPU cores
💡 Tip: For seamless cloud logging and experiment tracking, try installing [litlogger](https://pypi.org/project/litlogger/) to enable LitLogger, which logs metrics and artifacts automatically to the Lightning Experiments platform.
/nas/longleaf/home/zayah/f1tenth_ng_zc/.venv/lib/python3.12/site-packages/lightning/pytorch/callbacks/model_checkpoint.py:881: Checkpoint directory /nas/longleaf/home/zayah/f1tenth_ng_zc/data/models/checkpoints/left_wall_dist_arch8 exists and is not empty.
LOCAL_RANK: 0 - CUDA_VISIBLE_DEVICES: [0]
/nas/longleaf/home/zayah/f1tenth_ng_zc/.venv/lib/python3.12/site-packages/lightning/pytorch/callbacks/model_checkpoint.py:881: Checkpoint directory /nas/longleaf/home/zayah/f1tenth_ng_zc/data/models/checkpoints/heading_error_arch8 exists and is not empty.
LOCAL_RANK: 0 - CUDA_VISIBLE_DEVICES: [0]
/nas/longleaf/home/zayah/f1tenth_ng_zc/.venv/lib/python3.12/site-packages/lightning/pytorch/callbacks/model_checkpoint.py:881: Checkpoint directory /nas/longleaf/home/zayah/f1tenth_ng_zc/data/models/checkpoints/track_width_arch8 exists and is not empty.
LOCAL_RANK: 0 - CUDA_VISIBLE_DEVICES: [0]
SLURM auto-requeueing enabled. Setting signal handlers.
SLURM auto-requeueing enabled. Setting signal handlers.
SLURM auto-requeueing enabled. Setting signal handlers.
`Trainer.fit` stopped: `max_epochs=21` reached.
`Trainer.fit` stopped: `max_epochs=21` reached.
[I 2026-04-09 14:30:54,253] Trial 22 finished with value: 0.1377 and parameters: {'left_wall_dist_num_layers': 3, 'left_wall_dist_activation': 'elu', 'left_wall_dist_out_channels_l0': 78, 'left_wall_dist_pool_size_l0': 4, 'left_wall_dist_out_channels_l1': 91, 'left_wall_dist_pool_size_l1': 4, 'left_wall_dist_out_channels_l2': 198, 'left_wall_dist_pool_size_l2': 8, 'left_wall_dist_fc_hidden': 55, 'track_width_num_layers': 3, 'track_width_activation': 'relu', 'track_width_out_channels_l0': 59, 'track_width_pool_size_l0': 8, 'track_width_out_channels_l1': 40, 'track_width_pool_size_l1': 2, 'track_width_out_channels_l2': 136, 'track_width_pool_size_l2': 2, 'track_width_fc_hidden': 114, 'heading_error_num_layers': 5, 'heading_error_activation': 'elu', 'heading_error_out_channels_l0': 56, 'heading_error_pool_size_l0': 2, 'heading_error_out_channels_l1': 45, 'heading_error_pool_size_l1': 4, 'heading_error_out_channels_l2': 44, 'heading_error_pool_size_l2': 2, 'heading_error_out_channels_l3': 104, 'heading_error_pool_size_l3': 8, 'heading_error_out_channels_l4': 32, 'heading_error_pool_size_l4': 4}. Best is trial 20 with value: 0.0971.
[rank: 0] Seed set to 42
[rank: 0] Seed set to 42
[rank: 0] Seed set to 42
GPU available: True (cuda), used: True
TPU available: False, using: 0 TPU cores
💡 Tip: For seamless cloud logging and experiment tracking, try installing [litlogger](https://pypi.org/project/litlogger/) to enable LitLogger, which logs metrics and artifacts automatically to the Lightning Experiments platform.
GPU available: True (cuda), used: True
TPU available: False, using: 0 TPU cores
💡 Tip: For seamless cloud logging and experiment tracking, try installing [litlogger](https://pypi.org/project/litlogger/) to enable LitLogger, which logs metrics and artifacts automatically to the Lightning Experiments platform.
GPU available: True (cuda), used: True
TPU available: False, using: 0 TPU cores
💡 Tip: For seamless cloud logging and experiment tracking, try installing [litlogger](https://pypi.org/project/litlogger/) to enable LitLogger, which logs metrics and artifacts automatically to the Lightning Experiments platform.
/nas/longleaf/home/zayah/f1tenth_ng_zc/.venv/lib/python3.12/site-packages/lightning/pytorch/callbacks/model_checkpoint.py:881: Checkpoint directory /nas/longleaf/home/zayah/f1tenth_ng_zc/data/models/checkpoints/heading_error_arch8 exists and is not empty.
LOCAL_RANK: 0 - CUDA_VISIBLE_DEVICES: [0]
/nas/longleaf/home/zayah/f1tenth_ng_zc/.venv/lib/python3.12/site-packages/lightning/pytorch/callbacks/model_checkpoint.py:881: Checkpoint directory /nas/longleaf/home/zayah/f1tenth_ng_zc/data/models/checkpoints/track_width_arch8 exists and is not empty.
LOCAL_RANK: 0 - CUDA_VISIBLE_DEVICES: [0]
/nas/longleaf/home/zayah/f1tenth_ng_zc/.venv/lib/python3.12/site-packages/lightning/pytorch/callbacks/model_checkpoint.py:881: Checkpoint directory /nas/longleaf/home/zayah/f1tenth_ng_zc/data/models/checkpoints/left_wall_dist_arch8 exists and is not empty.
LOCAL_RANK: 0 - CUDA_VISIBLE_DEVICES: [0]
SLURM auto-requeueing enabled. Setting signal handlers.
SLURM auto-requeueing enabled. Setting signal handlers.
SLURM auto-requeueing enabled. Setting signal handlers.
`Trainer.fit` stopped: `max_epochs=21` reached.
`Trainer.fit` stopped: `max_epochs=21` reached.
`Trainer.fit` stopped: `max_epochs=21` reached.
[I 2026-04-09 14:33:31,607] Trial 23 finished with value: 0.1198 and parameters: {'left_wall_dist_num_layers': 3, 'left_wall_dist_activation': 'elu', 'left_wall_dist_out_channels_l0': 107, 'left_wall_dist_pool_size_l0': 4, 'left_wall_dist_out_channels_l1': 107, 'left_wall_dist_pool_size_l1': 4, 'left_wall_dist_out_channels_l2': 189, 'left_wall_dist_pool_size_l2': 8, 'left_wall_dist_fc_hidden': 79, 'track_width_num_layers': 3, 'track_width_activation': 'relu', 'track_width_out_channels_l0': 85, 'track_width_pool_size_l0': 8, 'track_width_out_channels_l1': 39, 'track_width_pool_size_l1': 2, 'track_width_out_channels_l2': 102, 'track_width_pool_size_l2': 2, 'track_width_fc_hidden': 101, 'heading_error_num_layers': 5, 'heading_error_activation': 'elu', 'heading_error_out_channels_l0': 89, 'heading_error_pool_size_l0': 2, 'heading_error_out_channels_l1': 50, 'heading_error_pool_size_l1': 4, 'heading_error_out_channels_l2': 44, 'heading_error_pool_size_l2': 2, 'heading_error_out_channels_l3': 120, 'heading_error_pool_size_l3': 8, 'heading_error_out_channels_l4': 33, 'heading_error_pool_size_l4': 4}. Best is trial 20 with value: 0.0971.
[rank: 0] Seed set to 42
[rank: 0] Seed set to 42
[rank: 0] Seed set to 42
GPU available: True (cuda), used: True
TPU available: False, using: 0 TPU cores
💡 Tip: For seamless cloud logging and experiment tracking, try installing [litlogger](https://pypi.org/project/litlogger/) to enable LitLogger, which logs metrics and artifacts automatically to the Lightning Experiments platform.
GPU available: True (cuda), used: True
TPU available: False, using: 0 TPU cores
💡 Tip: For seamless cloud logging and experiment tracking, try installing [litlogger](https://pypi.org/project/litlogger/) to enable LitLogger, which logs metrics and artifacts automatically to the Lightning Experiments platform.
GPU available: True (cuda), used: True
TPU available: False, using: 0 TPU cores
💡 Tip: For seamless cloud logging and experiment tracking, try installing [litlogger](https://pypi.org/project/litlogger/) to enable LitLogger, which logs metrics and artifacts automatically to the Lightning Experiments platform.
/nas/longleaf/home/zayah/f1tenth_ng_zc/.venv/lib/python3.12/site-packages/lightning/pytorch/callbacks/model_checkpoint.py:881: Checkpoint directory /nas/longleaf/home/zayah/f1tenth_ng_zc/data/models/checkpoints/track_width_arch8 exists and is not empty.
LOCAL_RANK: 0 - CUDA_VISIBLE_DEVICES: [0]
/nas/longleaf/home/zayah/f1tenth_ng_zc/.venv/lib/python3.12/site-packages/lightning/pytorch/callbacks/model_checkpoint.py:881: Checkpoint directory /nas/longleaf/home/zayah/f1tenth_ng_zc/data/models/checkpoints/heading_error_arch8 exists and is not empty.
/nas/longleaf/home/zayah/f1tenth_ng_zc/.venv/lib/python3.12/site-packages/lightning/pytorch/callbacks/model_checkpoint.py:881: Checkpoint directory /nas/longleaf/home/zayah/f1tenth_ng_zc/data/models/checkpoints/left_wall_dist_arch8 exists and is not empty.
LOCAL_RANK: 0 - CUDA_VISIBLE_DEVICES: [0]
LOCAL_RANK: 0 - CUDA_VISIBLE_DEVICES: [0]
SLURM auto-requeueing enabled. Setting signal handlers.
SLURM auto-requeueing enabled. Setting signal handlers.
SLURM auto-requeueing enabled. Setting signal handlers.
`Trainer.fit` stopped: `max_epochs=21` reached.
`Trainer.fit` stopped: `max_epochs=21` reached.
`Trainer.fit` stopped: `max_epochs=21` reached.
[I 2026-04-09 14:36:09,889] Trial 24 finished with value: 0.1198 and parameters: {'left_wall_dist_num_layers': 3, 'left_wall_dist_activation': 'elu', 'left_wall_dist_out_channels_l0': 76, 'left_wall_dist_pool_size_l0': 4, 'left_wall_dist_out_channels_l1': 77, 'left_wall_dist_pool_size_l1': 4, 'left_wall_dist_out_channels_l2': 100, 'left_wall_dist_pool_size_l2': 8, 'left_wall_dist_fc_hidden': 58, 'track_width_num_layers': 3, 'track_width_activation': 'relu', 'track_width_out_channels_l0': 62, 'track_width_pool_size_l0': 8, 'track_width_out_channels_l1': 49, 'track_width_pool_size_l1': 2, 'track_width_out_channels_l2': 161, 'track_width_pool_size_l2': 2, 'track_width_fc_hidden': 118, 'heading_error_num_layers': 5, 'heading_error_activation': 'elu', 'heading_error_out_channels_l0': 51, 'heading_error_pool_size_l0': 2, 'heading_error_out_channels_l1': 38, 'heading_error_pool_size_l1': 4, 'heading_error_out_channels_l2': 69, 'heading_error_pool_size_l2': 2, 'heading_error_out_channels_l3': 208, 'heading_error_pool_size_l3': 8, 'heading_error_out_channels_l4': 46, 'heading_error_pool_size_l4': 4, 'heading_error_fc_hidden': 43}. Best is trial 20 with value: 0.0971.
[rank: 0] Seed set to 42
[rank: 0] Seed set to 42
[rank: 0] Seed set to 42
GPU available: True (cuda), used: True
TPU available: False, using: 0 TPU cores
GPU available: True (cuda), used: True
TPU available: False, using: 0 TPU cores
💡 Tip: For seamless cloud logging and experiment tracking, try installing [litlogger](https://pypi.org/project/litlogger/) to enable LitLogger, which logs metrics and artifacts automatically to the Lightning Experiments platform.
💡 Tip: For seamless cloud logging and experiment tracking, try installing [litlogger](https://pypi.org/project/litlogger/) to enable LitLogger, which logs metrics and artifacts automatically to the Lightning Experiments platform.
GPU available: True (cuda), used: True
TPU available: False, using: 0 TPU cores
💡 Tip: For seamless cloud logging and experiment tracking, try installing [litlogger](https://pypi.org/project/litlogger/) to enable LitLogger, which logs metrics and artifacts automatically to the Lightning Experiments platform.
/nas/longleaf/home/zayah/f1tenth_ng_zc/.venv/lib/python3.12/site-packages/lightning/pytorch/callbacks/model_checkpoint.py:881: Checkpoint directory /nas/longleaf/home/zayah/f1tenth_ng_zc/data/models/checkpoints/left_wall_dist_arch8 exists and is not empty.
LOCAL_RANK: 0 - CUDA_VISIBLE_DEVICES: [0]
/nas/longleaf/home/zayah/f1tenth_ng_zc/.venv/lib/python3.12/site-packages/lightning/pytorch/callbacks/model_checkpoint.py:881: Checkpoint directory /nas/longleaf/home/zayah/f1tenth_ng_zc/data/models/checkpoints/heading_error_arch8 exists and is not empty.
LOCAL_RANK: 0 - CUDA_VISIBLE_DEVICES: [0]
/nas/longleaf/home/zayah/f1tenth_ng_zc/.venv/lib/python3.12/site-packages/lightning/pytorch/callbacks/model_checkpoint.py:881: Checkpoint directory /nas/longleaf/home/zayah/f1tenth_ng_zc/data/models/checkpoints/track_width_arch8 exists and is not empty.
LOCAL_RANK: 0 - CUDA_VISIBLE_DEVICES: [0]
SLURM auto-requeueing enabled. Setting signal handlers.
SLURM auto-requeueing enabled. Setting signal handlers.
SLURM auto-requeueing enabled. Setting signal handlers.
`Trainer.fit` stopped: `max_epochs=21` reached.
`Trainer.fit` stopped: `max_epochs=21` reached.
`Trainer.fit` stopped: `max_epochs=21` reached.
[I 2026-04-09 14:38:50,432] Trial 25 finished with value: 0.0936 and parameters: {'left_wall_dist_num_layers': 3, 'left_wall_dist_activation': 'elu', 'left_wall_dist_out_channels_l0': 51, 'left_wall_dist_pool_size_l0': 2, 'left_wall_dist_out_channels_l1': 96, 'left_wall_dist_pool_size_l1': 4, 'left_wall_dist_out_channels_l2': 163, 'left_wall_dist_pool_size_l2': 2, 'track_width_num_layers': 3, 'track_width_activation': 'relu', 'track_width_out_channels_l0': 84, 'track_width_pool_size_l0': 8, 'track_width_out_channels_l1': 32, 'track_width_pool_size_l1': 2, 'track_width_out_channels_l2': 76, 'track_width_pool_size_l2': 2, 'track_width_fc_hidden': 83, 'heading_error_num_layers': 5, 'heading_error_activation': 'elu', 'heading_error_out_channels_l0': 65, 'heading_error_pool_size_l0': 2, 'heading_error_out_channels_l1': 59, 'heading_error_pool_size_l1': 4, 'heading_error_out_channels_l2': 55, 'heading_error_pool_size_l2': 4, 'heading_error_out_channels_l3': 86, 'heading_error_pool_size_l3': 8, 'heading_error_out_channels_l4': 46, 'heading_error_pool_size_l4': 4}. Best is trial 25 with value: 0.0936.
[rank: 0] Seed set to 42
[rank: 0] Seed set to 42
[rank: 0] Seed set to 42
GPU available: True (cuda), used: True
TPU available: False, using: 0 TPU cores
💡 Tip: For seamless cloud logging and experiment tracking, try installing [litlogger](https://pypi.org/project/litlogger/) to enable LitLogger, which logs metrics and artifacts automatically to the Lightning Experiments platform.
GPU available: True (cuda), used: True
TPU available: False, using: 0 TPU cores
💡 Tip: For seamless cloud logging and experiment tracking, try installing [litlogger](https://pypi.org/project/litlogger/) to enable LitLogger, which logs metrics and artifacts automatically to the Lightning Experiments platform.
GPU available: True (cuda), used: True
TPU available: False, using: 0 TPU cores
💡 Tip: For seamless cloud logging and experiment tracking, try installing [litlogger](https://pypi.org/project/litlogger/) to enable LitLogger, which logs metrics and artifacts automatically to the Lightning Experiments platform.
/nas/longleaf/home/zayah/f1tenth_ng_zc/.venv/lib/python3.12/site-packages/lightning/pytorch/callbacks/model_checkpoint.py:881: Checkpoint directory /nas/longleaf/home/zayah/f1tenth_ng_zc/data/models/checkpoints/left_wall_dist_arch8 exists and is not empty.
LOCAL_RANK: 0 - CUDA_VISIBLE_DEVICES: [0]
/nas/longleaf/home/zayah/f1tenth_ng_zc/.venv/lib/python3.12/site-packages/lightning/pytorch/callbacks/model_checkpoint.py:881: Checkpoint directory /nas/longleaf/home/zayah/f1tenth_ng_zc/data/models/checkpoints/track_width_arch8 exists and is not empty.
/nas/longleaf/home/zayah/f1tenth_ng_zc/.venv/lib/python3.12/site-packages/lightning/pytorch/callbacks/model_checkpoint.py:881: Checkpoint directory /nas/longleaf/home/zayah/f1tenth_ng_zc/data/models/checkpoints/heading_error_arch8 exists and is not empty.
LOCAL_RANK: 0 - CUDA_VISIBLE_DEVICES: [0]
LOCAL_RANK: 0 - CUDA_VISIBLE_DEVICES: [0]
SLURM auto-requeueing enabled. Setting signal handlers.
SLURM auto-requeueing enabled. Setting signal handlers.
SLURM auto-requeueing enabled. Setting signal handlers.
`Trainer.fit` stopped: `max_epochs=21` reached.
`Trainer.fit` stopped: `max_epochs=21` reached.
`Trainer.fit` stopped: `max_epochs=21` reached.
[I 2026-04-09 14:41:21,695] Trial 26 finished with value: 0.1022 and parameters: {'left_wall_dist_num_layers': 3, 'left_wall_dist_activation': 'relu', 'left_wall_dist_out_channels_l0': 49, 'left_wall_dist_pool_size_l0': 4, 'left_wall_dist_out_channels_l1': 100, 'left_wall_dist_pool_size_l1': 4, 'left_wall_dist_out_channels_l2': 154, 'left_wall_dist_pool_size_l2': 8, 'left_wall_dist_fc_hidden': 73, 'track_width_num_layers': 3, 'track_width_activation': 'relu', 'track_width_out_channels_l0': 142, 'track_width_pool_size_l0': 8, 'track_width_out_channels_l1': 33, 'track_width_pool_size_l1': 2, 'track_width_out_channels_l2': 70, 'track_width_pool_size_l2': 8, 'track_width_fc_hidden': 84, 'heading_error_num_layers': 5, 'heading_error_activation': 'relu', 'heading_error_out_channels_l0': 38, 'heading_error_pool_size_l0': 2, 'heading_error_out_channels_l1': 61, 'heading_error_pool_size_l1': 8, 'heading_error_out_channels_l2': 32, 'heading_error_pool_size_l2': 2, 'heading_error_out_channels_l3': 84, 'heading_error_pool_size_l3': 2, 'heading_error_out_channels_l4': 53, 'heading_error_pool_size_l4': 4, 'heading_error_fc_hidden': 36}. Best is trial 25 with value: 0.0936.
[rank: 0] Seed set to 42
[rank: 0] Seed set to 42
[rank: 0] Seed set to 42
GPU available: True (cuda), used: True
TPU available: False, using: 0 TPU cores
💡 Tip: For seamless cloud logging and experiment tracking, try installing [litlogger](https://pypi.org/project/litlogger/) to enable LitLogger, which logs metrics and artifacts automatically to the Lightning Experiments platform.
GPU available: True (cuda), used: True
TPU available: False, using: 0 TPU cores
💡 Tip: For seamless cloud logging and experiment tracking, try installing [litlogger](https://pypi.org/project/litlogger/) to enable LitLogger, which logs metrics and artifacts automatically to the Lightning Experiments platform.
GPU available: True (cuda), used: True
TPU available: False, using: 0 TPU cores
💡 Tip: For seamless cloud logging and experiment tracking, try installing [litlogger](https://pypi.org/project/litlogger/) to enable LitLogger, which logs metrics and artifacts automatically to the Lightning Experiments platform.
/nas/longleaf/home/zayah/f1tenth_ng_zc/.venv/lib/python3.12/site-packages/lightning/pytorch/callbacks/model_checkpoint.py:881: Checkpoint directory /nas/longleaf/home/zayah/f1tenth_ng_zc/data/models/checkpoints/heading_error_arch8 exists and is not empty.
/nas/longleaf/home/zayah/f1tenth_ng_zc/.venv/lib/python3.12/site-packages/lightning/pytorch/callbacks/model_checkpoint.py:881: Checkpoint directory /nas/longleaf/home/zayah/f1tenth_ng_zc/data/models/checkpoints/left_wall_dist_arch8 exists and is not empty.
LOCAL_RANK: 0 - CUDA_VISIBLE_DEVICES: [0]
/nas/longleaf/home/zayah/f1tenth_ng_zc/.venv/lib/python3.12/site-packages/lightning/pytorch/callbacks/model_checkpoint.py:881: Checkpoint directory /nas/longleaf/home/zayah/f1tenth_ng_zc/data/models/checkpoints/track_width_arch8 exists and is not empty.
LOCAL_RANK: 0 - CUDA_VISIBLE_DEVICES: [0]
LOCAL_RANK: 0 - CUDA_VISIBLE_DEVICES: [0]
SLURM auto-requeueing enabled. Setting signal handlers.
SLURM auto-requeueing enabled. Setting signal handlers.
SLURM auto-requeueing enabled. Setting signal handlers.
`Trainer.fit` stopped: `max_epochs=21` reached.
`Trainer.fit` stopped: `max_epochs=21` reached.
`Trainer.fit` stopped: `max_epochs=21` reached.
