[I 2026-04-09 13:59:05,940] Trial 8 finished with value: 0.1188 and parameters: {'left_wall_dist_num_layers': 5, 'left_wall_dist_activation': 'elu', 'left_wall_dist_out_channels_l0': 244, 'left_wall_dist_pool_size_l0': 4, 'left_wall_dist_out_channels_l1': 54, 'left_wall_dist_pool_size_l1': 8, 'left_wall_dist_out_channels_l2': 56, 'left_wall_dist_pool_size_l2': 8, 'left_wall_dist_out_channels_l3': 40, 'left_wall_dist_pool_size_l3': 8, 'track_width_num_layers': 4, 'track_width_activation': 'relu', 'track_width_out_channels_l0': 225, 'track_width_pool_size_l0': 4, 'track_width_out_channels_l1': 129, 'track_width_pool_size_l1': 2, 'track_width_out_channels_l2': 61, 'track_width_pool_size_l2': 8, 'track_width_out_channels_l3': 50, 'track_width_pool_size_l3': 8, 'heading_error_num_layers': 5, 'heading_error_activation': 'relu', 'heading_error_out_channels_l0': 103, 'heading_error_pool_size_l0': 4, 'heading_error_out_channels_l1': 72, 'heading_error_pool_size_l1': 2, 'heading_error_out_channels_l2': 38, 'heading_error_pool_size_l2': 4, 'heading_error_out_channels_l3': 103, 'heading_error_pool_size_l3': 4, 'heading_error_out_channels_l4': 54, 'heading_error_pool_size_l4': 2, 'heading_error_fc_hidden': 46}. Best is trial 6 with value: 0.1122.
[rank: 0] Seed set to 42
[rank: 0] Seed set to 42
[rank: 0] Seed set to 42
GPU available: True (cuda), used: True
TPU available: False, using: 0 TPU cores
💡 Tip: For seamless cloud logging and experiment tracking, try installing [litlogger](https://pypi.org/project/litlogger/) to enable LitLogger, which logs metrics and artifacts automatically to the Lightning Experiments platform.
GPU available: True (cuda), used: True
TPU available: False, using: 0 TPU cores
💡 Tip: For seamless cloud logging and experiment tracking, try installing [litlogger](https://pypi.org/project/litlogger/) to enable LitLogger, which logs metrics and artifacts automatically to the Lightning Experiments platform.
GPU available: True (cuda), used: True
TPU available: False, using: 0 TPU cores
💡 Tip: For seamless cloud logging and experiment tracking, try installing [litlogger](https://pypi.org/project/litlogger/) to enable LitLogger, which logs metrics and artifacts automatically to the Lightning Experiments platform.
/nas/longleaf/home/zayah/f1tenth_ng_zc/.venv/lib/python3.12/site-packages/lightning/pytorch/callbacks/model_checkpoint.py:881: Checkpoint directory /nas/longleaf/home/zayah/f1tenth_ng_zc/data/models/checkpoints/left_wall_dist_arch8 exists and is not empty.
LOCAL_RANK: 0 - CUDA_VISIBLE_DEVICES: [0]
/nas/longleaf/home/zayah/f1tenth_ng_zc/.venv/lib/python3.12/site-packages/lightning/pytorch/callbacks/model_checkpoint.py:881: Checkpoint directory /nas/longleaf/home/zayah/f1tenth_ng_zc/data/models/checkpoints/track_width_arch8 exists and is not empty.
LOCAL_RANK: 0 - CUDA_VISIBLE_DEVICES: [0]
/nas/longleaf/home/zayah/f1tenth_ng_zc/.venv/lib/python3.12/site-packages/lightning/pytorch/callbacks/model_checkpoint.py:881: Checkpoint directory /nas/longleaf/home/zayah/f1tenth_ng_zc/data/models/checkpoints/heading_error_arch8 exists and is not empty.
LOCAL_RANK: 0 - CUDA_VISIBLE_DEVICES: [0]
SLURM auto-requeueing enabled. Setting signal handlers.
SLURM auto-requeueing enabled. Setting signal handlers.
SLURM auto-requeueing enabled. Setting signal handlers.
`Trainer.fit` stopped: `max_epochs=21` reached.
`Trainer.fit` stopped: `max_epochs=21` reached.
`Trainer.fit` stopped: `max_epochs=21` reached.
[I 2026-04-09 14:02:43,120] Trial 9 finished with value: 0.1277 and parameters: {'left_wall_dist_num_layers': 4, 'left_wall_dist_activation': 'elu', 'left_wall_dist_out_channels_l0': 122, 'left_wall_dist_pool_size_l0': 4, 'left_wall_dist_out_channels_l1': 72, 'left_wall_dist_pool_size_l1': 2, 'left_wall_dist_out_channels_l2': 41, 'left_wall_dist_pool_size_l2': 8, 'left_wall_dist_out_channels_l3': 142, 'left_wall_dist_pool_size_l3': 4, 'left_wall_dist_fc_hidden': 32, 'track_width_num_layers': 3, 'track_width_activation': 'elu', 'track_width_out_channels_l0': 108, 'track_width_pool_size_l0': 4, 'track_width_out_channels_l1': 41, 'track_width_pool_size_l1': 2, 'track_width_out_channels_l2': 126, 'track_width_pool_size_l2': 4, 'track_width_fc_hidden': 98, 'heading_error_num_layers': 4, 'heading_error_activation': 'relu', 'heading_error_out_channels_l0': 75, 'heading_error_pool_size_l0': 4, 'heading_error_out_channels_l1': 46, 'heading_error_pool_size_l1': 2, 'heading_error_out_channels_l2': 61, 'heading_error_pool_size_l2': 8, 'heading_error_out_channels_l3': 56, 'heading_error_pool_size_l3': 4, 'heading_error_fc_hidden': 32}. Best is trial 6 with value: 0.1122.
[rank: 0] Seed set to 42
[rank: 0] Seed set to 42
[rank: 0] Seed set to 42
GPU available: True (cuda), used: True
TPU available: False, using: 0 TPU cores
💡 Tip: For seamless cloud logging and experiment tracking, try installing [litlogger](https://pypi.org/project/litlogger/) to enable LitLogger, which logs metrics and artifacts automatically to the Lightning Experiments platform.
GPU available: True (cuda), used: True
TPU available: False, using: 0 TPU cores
💡 Tip: For seamless cloud logging and experiment tracking, try installing [litlogger](https://pypi.org/project/litlogger/) to enable LitLogger, which logs metrics and artifacts automatically to the Lightning Experiments platform.
GPU available: True (cuda), used: True
TPU available: False, using: 0 TPU cores
💡 Tip: For seamless cloud logging and experiment tracking, try installing [litlogger](https://pypi.org/project/litlogger/) to enable LitLogger, which logs metrics and artifacts automatically to the Lightning Experiments platform.
/nas/longleaf/home/zayah/f1tenth_ng_zc/.venv/lib/python3.12/site-packages/lightning/pytorch/callbacks/model_checkpoint.py:881: Checkpoint directory /nas/longleaf/home/zayah/f1tenth_ng_zc/data/models/checkpoints/heading_error_arch8 exists and is not empty.
LOCAL_RANK: 0 - CUDA_VISIBLE_DEVICES: [0]
/nas/longleaf/home/zayah/f1tenth_ng_zc/.venv/lib/python3.12/site-packages/lightning/pytorch/callbacks/model_checkpoint.py:881: Checkpoint directory /nas/longleaf/home/zayah/f1tenth_ng_zc/data/models/checkpoints/left_wall_dist_arch8 exists and is not empty.
/nas/longleaf/home/zayah/f1tenth_ng_zc/.venv/lib/python3.12/site-packages/lightning/pytorch/callbacks/model_checkpoint.py:881: Checkpoint directory /nas/longleaf/home/zayah/f1tenth_ng_zc/data/models/checkpoints/track_width_arch8 exists and is not empty.
LOCAL_RANK: 0 - CUDA_VISIBLE_DEVICES: [0]
LOCAL_RANK: 0 - CUDA_VISIBLE_DEVICES: [0]
SLURM auto-requeueing enabled. Setting signal handlers.
SLURM auto-requeueing enabled. Setting signal handlers.
SLURM auto-requeueing enabled. Setting signal handlers.
`Trainer.fit` stopped: `max_epochs=21` reached.
`Trainer.fit` stopped: `max_epochs=21` reached.
`Trainer.fit` stopped: `max_epochs=21` reached.
[I 2026-04-09 14:05:17,820] Trial 10 finished with value: 0.1278 and parameters: {'left_wall_dist_num_layers': 4, 'left_wall_dist_activation': 'elu', 'left_wall_dist_out_channels_l0': 68, 'left_wall_dist_pool_size_l0': 4, 'left_wall_dist_out_channels_l1': 126, 'left_wall_dist_pool_size_l1': 4, 'left_wall_dist_out_channels_l2': 229, 'left_wall_dist_pool_size_l2': 4, 'left_wall_dist_out_channels_l3': 118, 'left_wall_dist_pool_size_l3': 4, 'left_wall_dist_fc_hidden': 64, 'track_width_num_layers': 3, 'track_width_activation': 'elu', 'track_width_out_channels_l0': 179, 'track_width_pool_size_l0': 8, 'track_width_out_channels_l1': 99, 'track_width_pool_size_l1': 4, 'track_width_out_channels_l2': 253, 'track_width_pool_size_l2': 2, 'track_width_fc_hidden': 77, 'heading_error_num_layers': 4, 'heading_error_activation': 'elu', 'heading_error_out_channels_l0': 255, 'heading_error_pool_size_l0': 8, 'heading_error_out_channels_l1': 176, 'heading_error_pool_size_l1': 4, 'heading_error_out_channels_l2': 126, 'heading_error_pool_size_l2': 2, 'heading_error_out_channels_l3': 33, 'heading_error_pool_size_l3': 2, 'heading_error_fc_hidden': 37}. Best is trial 6 with value: 0.1122.
[rank: 0] Seed set to 42
[rank: 0] Seed set to 42
[rank: 0] Seed set to 42
GPU available: True (cuda), used: True
TPU available: False, using: 0 TPU cores
💡 Tip: For seamless cloud logging and experiment tracking, try installing [litlogger](https://pypi.org/project/litlogger/) to enable LitLogger, which logs metrics and artifacts automatically to the Lightning Experiments platform.
GPU available: True (cuda), used: True
TPU available: False, using: 0 TPU cores
💡 Tip: For seamless cloud logging and experiment tracking, try installing [litlogger](https://pypi.org/project/litlogger/) to enable LitLogger, which logs metrics and artifacts automatically to the Lightning Experiments platform.
GPU available: True (cuda), used: True
TPU available: False, using: 0 TPU cores
💡 Tip: For seamless cloud logging and experiment tracking, try installing [litlogger](https://pypi.org/project/litlogger/) to enable LitLogger, which logs metrics and artifacts automatically to the Lightning Experiments platform.
/nas/longleaf/home/zayah/f1tenth_ng_zc/.venv/lib/python3.12/site-packages/lightning/pytorch/callbacks/model_checkpoint.py:881: Checkpoint directory /nas/longleaf/home/zayah/f1tenth_ng_zc/data/models/checkpoints/heading_error_arch8 exists and is not empty.
LOCAL_RANK: 0 - CUDA_VISIBLE_DEVICES: [0]
/nas/longleaf/home/zayah/f1tenth_ng_zc/.venv/lib/python3.12/site-packages/lightning/pytorch/callbacks/model_checkpoint.py:881: Checkpoint directory /nas/longleaf/home/zayah/f1tenth_ng_zc/data/models/checkpoints/track_width_arch8 exists and is not empty.
LOCAL_RANK: 0 - CUDA_VISIBLE_DEVICES: [0]
/nas/longleaf/home/zayah/f1tenth_ng_zc/.venv/lib/python3.12/site-packages/lightning/pytorch/callbacks/model_checkpoint.py:881: Checkpoint directory /nas/longleaf/home/zayah/f1tenth_ng_zc/data/models/checkpoints/left_wall_dist_arch8 exists and is not empty.
LOCAL_RANK: 0 - CUDA_VISIBLE_DEVICES: [0]
SLURM auto-requeueing enabled. Setting signal handlers.
SLURM auto-requeueing enabled. Setting signal handlers.
SLURM auto-requeueing enabled. Setting signal handlers.
`Trainer.fit` stopped: `max_epochs=21` reached.
`Trainer.fit` stopped: `max_epochs=21` reached.
`Trainer.fit` stopped: `max_epochs=21` reached.
[I 2026-04-09 14:08:07,956] Trial 11 finished with value: 0.1177 and parameters: {'left_wall_dist_num_layers': 5, 'left_wall_dist_activation': 'elu', 'left_wall_dist_out_channels_l0': 65, 'left_wall_dist_pool_size_l0': 2, 'left_wall_dist_out_channels_l1': 161, 'left_wall_dist_pool_size_l1': 2, 'left_wall_dist_out_channels_l2': 162, 'left_wall_dist_pool_size_l2': 2, 'left_wall_dist_out_channels_l3': 87, 'left_wall_dist_pool_size_l3': 8, 'left_wall_dist_out_channels_l4': 227, 'left_wall_dist_pool_size_l4': 2, 'left_wall_dist_fc_hidden': 64, 'track_width_num_layers': 4, 'track_width_activation': 'relu', 'track_width_out_channels_l0': 33, 'track_width_pool_size_l0': 8, 'track_width_out_channels_l1': 65, 'track_width_pool_size_l1': 2, 'track_width_out_channels_l2': 165, 'track_width_pool_size_l2': 2, 'track_width_out_channels_l3': 242, 'track_width_pool_size_l3': 2, 'track_width_fc_hidden': 68, 'heading_error_num_layers': 4, 'heading_error_activation': 'elu', 'heading_error_out_channels_l0': 55, 'heading_error_pool_size_l0': 2, 'heading_error_out_channels_l1': 135, 'heading_error_pool_size_l1': 4, 'heading_error_out_channels_l2': 106, 'heading_error_pool_size_l2': 4, 'heading_error_out_channels_l3': 66, 'heading_error_pool_size_l3': 8, 'heading_error_fc_hidden': 35}. Best is trial 6 with value: 0.1122.
[rank: 0] Seed set to 42
[rank: 0] Seed set to 42
[rank: 0] Seed set to 42
GPU available: True (cuda), used: True
TPU available: False, using: 0 TPU cores
💡 Tip: For seamless cloud logging and experiment tracking, try installing [litlogger](https://pypi.org/project/litlogger/) to enable LitLogger, which logs metrics and artifacts automatically to the Lightning Experiments platform.
GPU available: True (cuda), used: True
TPU available: False, using: 0 TPU cores
💡 Tip: For seamless cloud logging and experiment tracking, try installing [litlogger](https://pypi.org/project/litlogger/) to enable LitLogger, which logs metrics and artifacts automatically to the Lightning Experiments platform.
GPU available: True (cuda), used: True
TPU available: False, using: 0 TPU cores
💡 Tip: For seamless cloud logging and experiment tracking, try installing [litlogger](https://pypi.org/project/litlogger/) to enable LitLogger, which logs metrics and artifacts automatically to the Lightning Experiments platform.
/nas/longleaf/home/zayah/f1tenth_ng_zc/.venv/lib/python3.12/site-packages/lightning/pytorch/callbacks/model_checkpoint.py:881: Checkpoint directory /nas/longleaf/home/zayah/f1tenth_ng_zc/data/models/checkpoints/heading_error_arch8 exists and is not empty.
LOCAL_RANK: 0 - CUDA_VISIBLE_DEVICES: [0]
/nas/longleaf/home/zayah/f1tenth_ng_zc/.venv/lib/python3.12/site-packages/lightning/pytorch/callbacks/model_checkpoint.py:881: Checkpoint directory /nas/longleaf/home/zayah/f1tenth_ng_zc/data/models/checkpoints/left_wall_dist_arch8 exists and is not empty.
LOCAL_RANK: 0 - CUDA_VISIBLE_DEVICES: [0]
/nas/longleaf/home/zayah/f1tenth_ng_zc/.venv/lib/python3.12/site-packages/lightning/pytorch/callbacks/model_checkpoint.py:881: Checkpoint directory /nas/longleaf/home/zayah/f1tenth_ng_zc/data/models/checkpoints/track_width_arch8 exists and is not empty.
LOCAL_RANK: 0 - CUDA_VISIBLE_DEVICES: [0]
SLURM auto-requeueing enabled. Setting signal handlers.
SLURM auto-requeueing enabled. Setting signal handlers.
SLURM auto-requeueing enabled. Setting signal handlers.
`Trainer.fit` stopped: `max_epochs=21` reached.
`Trainer.fit` stopped: `max_epochs=21` reached.
`Trainer.fit` stopped: `max_epochs=21` reached.
[I 2026-04-09 14:09:15,431] Trial 12 finished with value: 0.1585 and parameters: {'left_wall_dist_num_layers': 3, 'left_wall_dist_activation': 'elu', 'left_wall_dist_out_channels_l0': 194, 'left_wall_dist_pool_size_l0': 4, 'left_wall_dist_out_channels_l1': 227, 'left_wall_dist_pool_size_l1': 2, 'left_wall_dist_out_channels_l2': 84, 'left_wall_dist_pool_size_l2': 8, 'left_wall_dist_fc_hidden': 50, 'track_width_num_layers': 4, 'track_width_activation': 'relu', 'track_width_out_channels_l0': 73, 'track_width_pool_size_l0': 8, 'track_width_out_channels_l1': 71, 'track_width_pool_size_l1': 4, 'track_width_out_channels_l2': 177, 'track_width_pool_size_l2': 2, 'track_width_out_channels_l3': 143, 'track_width_pool_size_l3': 2, 'track_width_fc_hidden': 32, 'heading_error_num_layers': 4, 'heading_error_activation': 'elu', 'heading_error_out_channels_l0': 57, 'heading_error_pool_size_l0': 4, 'heading_error_out_channels_l1': 32, 'heading_error_pool_size_l1': 4, 'heading_error_out_channels_l2': 76, 'heading_error_pool_size_l2': 4, 'heading_error_out_channels_l3': 42, 'heading_error_pool_size_l3': 8}. Best is trial 6 with value: 0.1122.
[rank: 0] Seed set to 42
[rank: 0] Seed set to 42
[rank: 0] Seed set to 42
GPU available: True (cuda), used: True
TPU available: False, using: 0 TPU cores
💡 Tip: For seamless cloud logging and experiment tracking, try installing [litlogger](https://pypi.org/project/litlogger/) to enable LitLogger, which logs metrics and artifacts automatically to the Lightning Experiments platform.
GPU available: True (cuda), used: True
TPU available: False, using: 0 TPU cores
💡 Tip: For seamless cloud logging and experiment tracking, try installing [litlogger](https://pypi.org/project/litlogger/) to enable LitLogger, which logs metrics and artifacts automatically to the Lightning Experiments platform.
GPU available: True (cuda), used: True
TPU available: False, using: 0 TPU cores
💡 Tip: For seamless cloud logging and experiment tracking, try installing [litlogger](https://pypi.org/project/litlogger/) to enable LitLogger, which logs metrics and artifacts automatically to the Lightning Experiments platform.
/nas/longleaf/home/zayah/f1tenth_ng_zc/.venv/lib/python3.12/site-packages/lightning/pytorch/callbacks/model_checkpoint.py:881: Checkpoint directory /nas/longleaf/home/zayah/f1tenth_ng_zc/data/models/checkpoints/left_wall_dist_arch8 exists and is not empty.
LOCAL_RANK: 0 - CUDA_VISIBLE_DEVICES: [0]
/nas/longleaf/home/zayah/f1tenth_ng_zc/.venv/lib/python3.12/site-packages/lightning/pytorch/callbacks/model_checkpoint.py:881: Checkpoint directory /nas/longleaf/home/zayah/f1tenth_ng_zc/data/models/checkpoints/heading_error_arch8 exists and is not empty.
LOCAL_RANK: 0 - CUDA_VISIBLE_DEVICES: [0]
/nas/longleaf/home/zayah/f1tenth_ng_zc/.venv/lib/python3.12/site-packages/lightning/pytorch/callbacks/model_checkpoint.py:881: Checkpoint directory /nas/longleaf/home/zayah/f1tenth_ng_zc/data/models/checkpoints/track_width_arch8 exists and is not empty.
LOCAL_RANK: 0 - CUDA_VISIBLE_DEVICES: [0]
SLURM auto-requeueing enabled. Setting signal handlers.
SLURM auto-requeueing enabled. Setting signal handlers.
SLURM auto-requeueing enabled. Setting signal handlers.
`Trainer.fit` stopped: `max_epochs=21` reached.
`Trainer.fit` stopped: `max_epochs=21` reached.
`Trainer.fit` stopped: `max_epochs=21` reached.
