[I 2026-04-11 19:03:40,817] Trial 72 finished with value: 0.11954000000000001 and parameters: {'left_wall_dist_num_layers': 4, 'left_wall_dist_activation': 'elu', 'left_wall_dist_out_channels_l0': 147, 'left_wall_dist_pool_size_l0': 4, 'left_wall_dist_out_channels_l1': 130, 'left_wall_dist_pool_size_l1': 4, 'left_wall_dist_out_channels_l2': 81, 'left_wall_dist_pool_size_l2': 8, 'left_wall_dist_out_channels_l3': 80, 'left_wall_dist_pool_size_l3': 2, 'left_wall_dist_fc_hidden': 32, 'track_width_num_layers': 4, 'track_width_activation': 'relu', 'track_width_out_channels_l0': 64, 'track_width_pool_size_l0': 2, 'track_width_out_channels_l1': 33, 'track_width_pool_size_l1': 2, 'track_width_out_channels_l2': 215, 'track_width_pool_size_l2': 2, 'track_width_out_channels_l3': 99, 'track_width_pool_size_l3': 4, 'track_width_fc_hidden': 56, 'heading_error_num_layers': 4, 'heading_error_activation': 'elu', 'heading_error_out_channels_l0': 240, 'heading_error_pool_size_l0': 2, 'heading_error_out_channels_l1': 87, 'heading_error_pool_size_l1': 2, 'heading_error_out_channels_l2': 150, 'heading_error_pool_size_l2': 8, 'heading_error_out_channels_l3': 71, 'heading_error_pool_size_l3': 4, 'heading_error_fc_hidden': 74}. Best is trial 59 with value: 0.11208.
[rank: 0] Seed set to 42
[rank: 0] Seed set to 42
[rank: 0] Seed set to 42
GPU available: True (cuda), used: True
TPU available: False, using: 0 TPU cores
GPU available: True (cuda), used: True
TPU available: False, using: 0 TPU cores
💡 Tip: For seamless cloud logging and experiment tracking, try installing [litlogger](https://pypi.org/project/litlogger/) to enable LitLogger, which logs metrics and artifacts automatically to the Lightning Experiments platform.
💡 Tip: For seamless cloud logging and experiment tracking, try installing [litlogger](https://pypi.org/project/litlogger/) to enable LitLogger, which logs metrics and artifacts automatically to the Lightning Experiments platform.
GPU available: True (cuda), used: True
TPU available: False, using: 0 TPU cores
💡 Tip: For seamless cloud logging and experiment tracking, try installing [litlogger](https://pypi.org/project/litlogger/) to enable LitLogger, which logs metrics and artifacts automatically to the Lightning Experiments platform.
/nas/longleaf/home/zayah/f1tenth_ng_zc/.venv/lib/python3.12/site-packages/lightning/pytorch/callbacks/model_checkpoint.py:881: Checkpoint directory /nas/longleaf/home/zayah/f1tenth_ng_zc/data/models/checkpoints/left_wall_dist_arch8 exists and is not empty.
LOCAL_RANK: 0 - CUDA_VISIBLE_DEVICES: [0]
/nas/longleaf/home/zayah/f1tenth_ng_zc/.venv/lib/python3.12/site-packages/lightning/pytorch/callbacks/model_checkpoint.py:881: Checkpoint directory /nas/longleaf/home/zayah/f1tenth_ng_zc/data/models/checkpoints/track_width_arch8 exists and is not empty.
LOCAL_RANK: 0 - CUDA_VISIBLE_DEVICES: [0]
/nas/longleaf/home/zayah/f1tenth_ng_zc/.venv/lib/python3.12/site-packages/lightning/pytorch/callbacks/model_checkpoint.py:881: Checkpoint directory /nas/longleaf/home/zayah/f1tenth_ng_zc/data/models/checkpoints/heading_error_arch8 exists and is not empty.
LOCAL_RANK: 0 - CUDA_VISIBLE_DEVICES: [0]
SLURM auto-requeueing enabled. Setting signal handlers.
SLURM auto-requeueing enabled. Setting signal handlers.
SLURM auto-requeueing enabled. Setting signal handlers.
`Trainer.fit` stopped: `max_epochs=20` reached.
`Trainer.fit` stopped: `max_epochs=20` reached.
`Trainer.fit` stopped: `max_epochs=20` reached.
[I 2026-04-11 19:07:53,107] Trial 73 finished with value: 0.12869999999999998 and parameters: {'left_wall_dist_num_layers': 4, 'left_wall_dist_activation': 'elu', 'left_wall_dist_out_channels_l0': 151, 'left_wall_dist_pool_size_l0': 4, 'left_wall_dist_out_channels_l1': 129, 'left_wall_dist_pool_size_l1': 4, 'left_wall_dist_out_channels_l2': 84, 'left_wall_dist_pool_size_l2': 8, 'left_wall_dist_out_channels_l3': 79, 'left_wall_dist_pool_size_l3': 2, 'left_wall_dist_fc_hidden': 32, 'track_width_num_layers': 4, 'track_width_activation': 'relu', 'track_width_out_channels_l0': 62, 'track_width_pool_size_l0': 8, 'track_width_out_channels_l1': 32, 'track_width_pool_size_l1': 2, 'track_width_out_channels_l2': 214, 'track_width_pool_size_l2': 2, 'track_width_out_channels_l3': 97, 'track_width_pool_size_l3': 4, 'track_width_fc_hidden': 60, 'heading_error_num_layers': 4, 'heading_error_activation': 'elu', 'heading_error_out_channels_l0': 229, 'heading_error_pool_size_l0': 2, 'heading_error_out_channels_l1': 83, 'heading_error_pool_size_l1': 2, 'heading_error_out_channels_l2': 145, 'heading_error_pool_size_l2': 8, 'heading_error_out_channels_l3': 64, 'heading_error_pool_size_l3': 4, 'heading_error_fc_hidden': 74}. Best is trial 59 with value: 0.11208.
[rank: 0] Seed set to 42
[rank: 0] Seed set to 42
[rank: 0] Seed set to 42
GPU available: True (cuda), used: True
TPU available: False, using: 0 TPU cores
💡 Tip: For seamless cloud logging and experiment tracking, try installing [litlogger](https://pypi.org/project/litlogger/) to enable LitLogger, which logs metrics and artifacts automatically to the Lightning Experiments platform.
GPU available: True (cuda), used: True
TPU available: False, using: 0 TPU cores
💡 Tip: For seamless cloud logging and experiment tracking, try installing [litlogger](https://pypi.org/project/litlogger/) to enable LitLogger, which logs metrics and artifacts automatically to the Lightning Experiments platform.
GPU available: True (cuda), used: True
TPU available: False, using: 0 TPU cores
💡 Tip: For seamless cloud logging and experiment tracking, try installing [litlogger](https://pypi.org/project/litlogger/) to enable LitLogger, which logs metrics and artifacts automatically to the Lightning Experiments platform.
/nas/longleaf/home/zayah/f1tenth_ng_zc/.venv/lib/python3.12/site-packages/lightning/pytorch/callbacks/model_checkpoint.py:881: Checkpoint directory /nas/longleaf/home/zayah/f1tenth_ng_zc/data/models/checkpoints/left_wall_dist_arch8 exists and is not empty.
LOCAL_RANK: 0 - CUDA_VISIBLE_DEVICES: [0]
/nas/longleaf/home/zayah/f1tenth_ng_zc/.venv/lib/python3.12/site-packages/lightning/pytorch/callbacks/model_checkpoint.py:881: Checkpoint directory /nas/longleaf/home/zayah/f1tenth_ng_zc/data/models/checkpoints/heading_error_arch8 exists and is not empty.
LOCAL_RANK: 0 - CUDA_VISIBLE_DEVICES: [0]
/nas/longleaf/home/zayah/f1tenth_ng_zc/.venv/lib/python3.12/site-packages/lightning/pytorch/callbacks/model_checkpoint.py:881: Checkpoint directory /nas/longleaf/home/zayah/f1tenth_ng_zc/data/models/checkpoints/track_width_arch8 exists and is not empty.
LOCAL_RANK: 0 - CUDA_VISIBLE_DEVICES: [0]
SLURM auto-requeueing enabled. Setting signal handlers.
SLURM auto-requeueing enabled. Setting signal handlers.
SLURM auto-requeueing enabled. Setting signal handlers.
`Trainer.fit` stopped: `max_epochs=20` reached.
`Trainer.fit` stopped: `max_epochs=20` reached.
`Trainer.fit` stopped: `max_epochs=20` reached.
[I 2026-04-11 19:11:51,783] Trial 74 finished with value: 0.12079999999999999 and parameters: {'left_wall_dist_num_layers': 4, 'left_wall_dist_activation': 'elu', 'left_wall_dist_out_channels_l0': 157, 'left_wall_dist_pool_size_l0': 4, 'left_wall_dist_out_channels_l1': 144, 'left_wall_dist_pool_size_l1': 4, 'left_wall_dist_out_channels_l2': 63, 'left_wall_dist_pool_size_l2': 8, 'left_wall_dist_out_channels_l3': 88, 'left_wall_dist_pool_size_l3': 2, 'left_wall_dist_fc_hidden': 34, 'track_width_num_layers': 4, 'track_width_activation': 'relu', 'track_width_out_channels_l0': 77, 'track_width_pool_size_l0': 4, 'track_width_out_channels_l1': 34, 'track_width_pool_size_l1': 2, 'track_width_out_channels_l2': 60, 'track_width_pool_size_l2': 2, 'track_width_out_channels_l3': 83, 'track_width_pool_size_l3': 4, 'track_width_fc_hidden': 43, 'heading_error_num_layers': 4, 'heading_error_activation': 'elu', 'heading_error_out_channels_l0': 192, 'heading_error_pool_size_l0': 2, 'heading_error_out_channels_l1': 104, 'heading_error_pool_size_l1': 2, 'heading_error_out_channels_l2': 104, 'heading_error_pool_size_l2': 8, 'heading_error_out_channels_l3': 82, 'heading_error_pool_size_l3': 4, 'heading_error_fc_hidden': 67}. Best is trial 59 with value: 0.11208.
[rank: 0] Seed set to 42
[rank: 0] Seed set to 42
[rank: 0] Seed set to 42
GPU available: True (cuda), used: True
TPU available: False, using: 0 TPU cores
GPU available: True (cuda), used: True
TPU available: False, using: 0 TPU cores
💡 Tip: For seamless cloud logging and experiment tracking, try installing [litlogger](https://pypi.org/project/litlogger/) to enable LitLogger, which logs metrics and artifacts automatically to the Lightning Experiments platform.
💡 Tip: For seamless cloud logging and experiment tracking, try installing [litlogger](https://pypi.org/project/litlogger/) to enable LitLogger, which logs metrics and artifacts automatically to the Lightning Experiments platform.
GPU available: True (cuda), used: True
TPU available: False, using: 0 TPU cores
💡 Tip: For seamless cloud logging and experiment tracking, try installing [litlogger](https://pypi.org/project/litlogger/) to enable LitLogger, which logs metrics and artifacts automatically to the Lightning Experiments platform.
/nas/longleaf/home/zayah/f1tenth_ng_zc/.venv/lib/python3.12/site-packages/lightning/pytorch/callbacks/model_checkpoint.py:881: Checkpoint directory /nas/longleaf/home/zayah/f1tenth_ng_zc/data/models/checkpoints/track_width_arch8 exists and is not empty.
LOCAL_RANK: 0 - CUDA_VISIBLE_DEVICES: [0]
/nas/longleaf/home/zayah/f1tenth_ng_zc/.venv/lib/python3.12/site-packages/lightning/pytorch/callbacks/model_checkpoint.py:881: Checkpoint directory /nas/longleaf/home/zayah/f1tenth_ng_zc/data/models/checkpoints/left_wall_dist_arch8 exists and is not empty.
LOCAL_RANK: 0 - CUDA_VISIBLE_DEVICES: [0]
/nas/longleaf/home/zayah/f1tenth_ng_zc/.venv/lib/python3.12/site-packages/lightning/pytorch/callbacks/model_checkpoint.py:881: Checkpoint directory /nas/longleaf/home/zayah/f1tenth_ng_zc/data/models/checkpoints/heading_error_arch8 exists and is not empty.
LOCAL_RANK: 0 - CUDA_VISIBLE_DEVICES: [0]
SLURM auto-requeueing enabled. Setting signal handlers.
SLURM auto-requeueing enabled. Setting signal handlers.
SLURM auto-requeueing enabled. Setting signal handlers.
`Trainer.fit` stopped: `max_epochs=20` reached.
`Trainer.fit` stopped: `max_epochs=20` reached.
`Trainer.fit` stopped: `max_epochs=20` reached.
[I 2026-04-11 19:16:03,220] Trial 75 finished with value: 0.12192 and parameters: {'left_wall_dist_num_layers': 4, 'left_wall_dist_activation': 'elu', 'left_wall_dist_out_channels_l0': 139, 'left_wall_dist_pool_size_l0': 4, 'left_wall_dist_out_channels_l1': 144, 'left_wall_dist_pool_size_l1': 4, 'left_wall_dist_out_channels_l2': 94, 'left_wall_dist_pool_size_l2': 8, 'left_wall_dist_out_channels_l3': 91, 'left_wall_dist_pool_size_l3': 2, 'left_wall_dist_fc_hidden': 34, 'track_width_num_layers': 4, 'track_width_activation': 'relu', 'track_width_out_channels_l0': 79, 'track_width_pool_size_l0': 4, 'track_width_out_channels_l1': 42, 'track_width_pool_size_l1': 2, 'track_width_out_channels_l2': 58, 'track_width_pool_size_l2': 2, 'track_width_out_channels_l3': 82, 'track_width_pool_size_l3': 4, 'track_width_fc_hidden': 39, 'heading_error_num_layers': 4, 'heading_error_activation': 'elu', 'heading_error_out_channels_l0': 183, 'heading_error_pool_size_l0': 2, 'heading_error_out_channels_l1': 103, 'heading_error_pool_size_l1': 2, 'heading_error_out_channels_l2': 107, 'heading_error_pool_size_l2': 8, 'heading_error_out_channels_l3': 81, 'heading_error_pool_size_l3': 4, 'heading_error_fc_hidden': 64}. Best is trial 59 with value: 0.11208.
[rank: 0] Seed set to 42
[rank: 0] Seed set to 42
[rank: 0] Seed set to 42
GPU available: True (cuda), used: True
TPU available: False, using: 0 TPU cores
GPU available: True (cuda), used: True
TPU available: False, using: 0 TPU cores
💡 Tip: For seamless cloud logging and experiment tracking, try installing [litlogger](https://pypi.org/project/litlogger/) to enable LitLogger, which logs metrics and artifacts automatically to the Lightning Experiments platform.
GPU available: True (cuda), used: True
TPU available: False, using: 0 TPU cores
💡 Tip: For seamless cloud logging and experiment tracking, try installing [litlogger](https://pypi.org/project/litlogger/) to enable LitLogger, which logs metrics and artifacts automatically to the Lightning Experiments platform.
💡 Tip: For seamless cloud logging and experiment tracking, try installing [litlogger](https://pypi.org/project/litlogger/) to enable LitLogger, which logs metrics and artifacts automatically to the Lightning Experiments platform.
/nas/longleaf/home/zayah/f1tenth_ng_zc/.venv/lib/python3.12/site-packages/lightning/pytorch/callbacks/model_checkpoint.py:881: Checkpoint directory /nas/longleaf/home/zayah/f1tenth_ng_zc/data/models/checkpoints/left_wall_dist_arch8 exists and is not empty.
/nas/longleaf/home/zayah/f1tenth_ng_zc/.venv/lib/python3.12/site-packages/lightning/pytorch/callbacks/model_checkpoint.py:881: Checkpoint directory /nas/longleaf/home/zayah/f1tenth_ng_zc/data/models/checkpoints/track_width_arch8 exists and is not empty.
LOCAL_RANK: 0 - CUDA_VISIBLE_DEVICES: [0]
LOCAL_RANK: 0 - CUDA_VISIBLE_DEVICES: [0]
/nas/longleaf/home/zayah/f1tenth_ng_zc/.venv/lib/python3.12/site-packages/lightning/pytorch/callbacks/model_checkpoint.py:881: Checkpoint directory /nas/longleaf/home/zayah/f1tenth_ng_zc/data/models/checkpoints/heading_error_arch8 exists and is not empty.
LOCAL_RANK: 0 - CUDA_VISIBLE_DEVICES: [0]
SLURM auto-requeueing enabled. Setting signal handlers.
SLURM auto-requeueing enabled. Setting signal handlers.
SLURM auto-requeueing enabled. Setting signal handlers.
`Trainer.fit` stopped: `max_epochs=20` reached.
`Trainer.fit` stopped: `max_epochs=20` reached.
`Trainer.fit` stopped: `max_epochs=20` reached.
[I 2026-04-11 19:20:07,483] Trial 76 finished with value: 0.13084 and parameters: {'left_wall_dist_num_layers': 4, 'left_wall_dist_activation': 'elu', 'left_wall_dist_out_channels_l0': 134, 'left_wall_dist_pool_size_l0': 4, 'left_wall_dist_out_channels_l1': 144, 'left_wall_dist_pool_size_l1': 4, 'left_wall_dist_out_channels_l2': 109, 'left_wall_dist_pool_size_l2': 8, 'left_wall_dist_out_channels_l3': 96, 'left_wall_dist_pool_size_l3': 2, 'left_wall_dist_fc_hidden': 34, 'track_width_num_layers': 4, 'track_width_activation': 'relu', 'track_width_out_channels_l0': 75, 'track_width_pool_size_l0': 4, 'track_width_out_channels_l1': 42, 'track_width_pool_size_l1': 2, 'track_width_out_channels_l2': 57, 'track_width_pool_size_l2': 2, 'track_width_out_channels_l3': 82, 'track_width_pool_size_l3': 4, 'track_width_fc_hidden': 43, 'heading_error_num_layers': 4, 'heading_error_activation': 'relu', 'heading_error_out_channels_l0': 189, 'heading_error_pool_size_l0': 2, 'heading_error_out_channels_l1': 103, 'heading_error_pool_size_l1': 2, 'heading_error_out_channels_l2': 105, 'heading_error_pool_size_l2': 8, 'heading_error_out_channels_l3': 79, 'heading_error_pool_size_l3': 4, 'heading_error_fc_hidden': 66}. Best is trial 59 with value: 0.11208.
[rank: 0] Seed set to 42
[rank: 0] Seed set to 42
[rank: 0] Seed set to 42
GPU available: True (cuda), used: True
TPU available: False, using: 0 TPU cores
GPU available: True (cuda), used: True
TPU available: False, using: 0 TPU cores
GPU available: True (cuda), used: True
TPU available: False, using: 0 TPU cores
💡 Tip: For seamless cloud logging and experiment tracking, try installing [litlogger](https://pypi.org/project/litlogger/) to enable LitLogger, which logs metrics and artifacts automatically to the Lightning Experiments platform.
💡 Tip: For seamless cloud logging and experiment tracking, try installing [litlogger](https://pypi.org/project/litlogger/) to enable LitLogger, which logs metrics and artifacts automatically to the Lightning Experiments platform.
💡 Tip: For seamless cloud logging and experiment tracking, try installing [litlogger](https://pypi.org/project/litlogger/) to enable LitLogger, which logs metrics and artifacts automatically to the Lightning Experiments platform.
/nas/longleaf/home/zayah/f1tenth_ng_zc/.venv/lib/python3.12/site-packages/lightning/pytorch/callbacks/model_checkpoint.py:881: Checkpoint directory /nas/longleaf/home/zayah/f1tenth_ng_zc/data/models/checkpoints/track_width_arch8 exists and is not empty.
LOCAL_RANK: 0 - CUDA_VISIBLE_DEVICES: [0]
/nas/longleaf/home/zayah/f1tenth_ng_zc/.venv/lib/python3.12/site-packages/lightning/pytorch/callbacks/model_checkpoint.py:881: Checkpoint directory /nas/longleaf/home/zayah/f1tenth_ng_zc/data/models/checkpoints/heading_error_arch8 exists and is not empty.
LOCAL_RANK: 0 - CUDA_VISIBLE_DEVICES: [0]
/nas/longleaf/home/zayah/f1tenth_ng_zc/.venv/lib/python3.12/site-packages/lightning/pytorch/callbacks/model_checkpoint.py:881: Checkpoint directory /nas/longleaf/home/zayah/f1tenth_ng_zc/data/models/checkpoints/left_wall_dist_arch8 exists and is not empty.
LOCAL_RANK: 0 - CUDA_VISIBLE_DEVICES: [0]
SLURM auto-requeueing enabled. Setting signal handlers.
SLURM auto-requeueing enabled. Setting signal handlers.
SLURM auto-requeueing enabled. Setting signal handlers.
`Trainer.fit` stopped: `max_epochs=20` reached.
`Trainer.fit` stopped: `max_epochs=20` reached.
`Trainer.fit` stopped: `max_epochs=20` reached.
[I 2026-04-11 19:24:11,313] Trial 77 finished with value: 0.11674 and parameters: {'left_wall_dist_num_layers': 4, 'left_wall_dist_activation': 'elu', 'left_wall_dist_out_channels_l0': 144, 'left_wall_dist_pool_size_l0': 4, 'left_wall_dist_out_channels_l1': 159, 'left_wall_dist_pool_size_l1': 4, 'left_wall_dist_out_channels_l2': 87, 'left_wall_dist_pool_size_l2': 8, 'left_wall_dist_out_channels_l3': 92, 'left_wall_dist_pool_size_l3': 2, 'left_wall_dist_fc_hidden': 36, 'track_width_num_layers': 4, 'track_width_activation': 'relu', 'track_width_out_channels_l0': 88, 'track_width_pool_size_l0': 4, 'track_width_out_channels_l1': 38, 'track_width_pool_size_l1': 2, 'track_width_out_channels_l2': 46, 'track_width_pool_size_l2': 2, 'track_width_out_channels_l3': 78, 'track_width_pool_size_l3': 4, 'track_width_fc_hidden': 41, 'heading_error_num_layers': 4, 'heading_error_activation': 'elu', 'heading_error_out_channels_l0': 168, 'heading_error_pool_size_l0': 2, 'heading_error_out_channels_l1': 93, 'heading_error_pool_size_l1': 2, 'heading_error_out_channels_l2': 153, 'heading_error_pool_size_l2': 8, 'heading_error_out_channels_l3': 87, 'heading_error_pool_size_l3': 4, 'heading_error_fc_hidden': 60}. Best is trial 59 with value: 0.11208.
[rank: 0] Seed set to 42
[rank: 0] Seed set to 42
[rank: 0] Seed set to 42
GPU available: True (cuda), used: True
TPU available: False, using: 0 TPU cores
💡 Tip: For seamless cloud logging and experiment tracking, try installing [litlogger](https://pypi.org/project/litlogger/) to enable LitLogger, which logs metrics and artifacts automatically to the Lightning Experiments platform.
GPU available: True (cuda), used: True
TPU available: False, using: 0 TPU cores
💡 Tip: For seamless cloud logging and experiment tracking, try installing [litlogger](https://pypi.org/project/litlogger/) to enable LitLogger, which logs metrics and artifacts automatically to the Lightning Experiments platform.
GPU available: True (cuda), used: True
TPU available: False, using: 0 TPU cores
💡 Tip: For seamless cloud logging and experiment tracking, try installing [litlogger](https://pypi.org/project/litlogger/) to enable LitLogger, which logs metrics and artifacts automatically to the Lightning Experiments platform.
/nas/longleaf/home/zayah/f1tenth_ng_zc/.venv/lib/python3.12/site-packages/lightning/pytorch/callbacks/model_checkpoint.py:881: Checkpoint directory /nas/longleaf/home/zayah/f1tenth_ng_zc/data/models/checkpoints/heading_error_arch8 exists and is not empty.
LOCAL_RANK: 0 - CUDA_VISIBLE_DEVICES: [0]
/nas/longleaf/home/zayah/f1tenth_ng_zc/.venv/lib/python3.12/site-packages/lightning/pytorch/callbacks/model_checkpoint.py:881: Checkpoint directory /nas/longleaf/home/zayah/f1tenth_ng_zc/data/models/checkpoints/track_width_arch8 exists and is not empty.
LOCAL_RANK: 0 - CUDA_VISIBLE_DEVICES: [0]
/nas/longleaf/home/zayah/f1tenth_ng_zc/.venv/lib/python3.12/site-packages/lightning/pytorch/callbacks/model_checkpoint.py:881: Checkpoint directory /nas/longleaf/home/zayah/f1tenth_ng_zc/data/models/checkpoints/left_wall_dist_arch8 exists and is not empty.
LOCAL_RANK: 0 - CUDA_VISIBLE_DEVICES: [0]
SLURM auto-requeueing enabled. Setting signal handlers.
SLURM auto-requeueing enabled. Setting signal handlers.
SLURM auto-requeueing enabled. Setting signal handlers.
`Trainer.fit` stopped: `max_epochs=20` reached.
`Trainer.fit` stopped: `max_epochs=20` reached.
`Trainer.fit` stopped: `max_epochs=20` reached.
