[I 2026-04-09 01:17:32,161] Trial 78 finished with value: 0.1217 and parameters: {'left_wall_dist_num_layers': 2, 'left_wall_dist_activation': 'relu', 'left_wall_dist_out_channels_l0': 39, 'left_wall_dist_pool_size_l0': 2, 'left_wall_dist_out_channels_l1': 97, 'left_wall_dist_pool_size_l1': 2, 'track_width_num_layers': 2, 'track_width_activation': 'elu', 'track_width_out_channels_l0': 90, 'track_width_pool_size_l0': 4, 'track_width_out_channels_l1': 118, 'track_width_pool_size_l1': 4, 'track_width_fc_hidden': 122, 'heading_error_num_layers': 4, 'heading_error_activation': 'elu', 'heading_error_out_channels_l0': 114, 'heading_error_pool_size_l0': 2, 'heading_error_out_channels_l1': 101, 'heading_error_pool_size_l1': 2, 'heading_error_out_channels_l2': 106, 'heading_error_pool_size_l2': 4, 'heading_error_out_channels_l3': 37, 'heading_error_pool_size_l3': 4, 'heading_error_fc_hidden': 44}. Best is trial 71 with value: 0.0953.
[rank: 0] Seed set to 42
[rank: 0] Seed set to 42
[rank: 0] Seed set to 42
GPU available: True (cuda), used: True
TPU available: False, using: 0 TPU cores
💡 Tip: For seamless cloud logging and experiment tracking, try installing [litlogger](https://pypi.org/project/litlogger/) to enable LitLogger, which logs metrics and artifacts automatically to the Lightning Experiments platform.
GPU available: True (cuda), used: True
TPU available: False, using: 0 TPU cores
💡 Tip: For seamless cloud logging and experiment tracking, try installing [litlogger](https://pypi.org/project/litlogger/) to enable LitLogger, which logs metrics and artifacts automatically to the Lightning Experiments platform.
GPU available: True (cuda), used: True
TPU available: False, using: 0 TPU cores
💡 Tip: For seamless cloud logging and experiment tracking, try installing [litlogger](https://pypi.org/project/litlogger/) to enable LitLogger, which logs metrics and artifacts automatically to the Lightning Experiments platform.
/nas/longleaf/home/zayah/f1tenth_ng_zc/.venv/lib/python3.12/site-packages/lightning/pytorch/callbacks/model_checkpoint.py:881: Checkpoint directory /nas/longleaf/home/zayah/f1tenth_ng_zc/data/models/checkpoints/track_width_arch8 exists and is not empty.
LOCAL_RANK: 0 - CUDA_VISIBLE_DEVICES: [0]
/nas/longleaf/home/zayah/f1tenth_ng_zc/.venv/lib/python3.12/site-packages/lightning/pytorch/callbacks/model_checkpoint.py:881: Checkpoint directory /nas/longleaf/home/zayah/f1tenth_ng_zc/data/models/checkpoints/heading_error_arch8 exists and is not empty.
LOCAL_RANK: 0 - CUDA_VISIBLE_DEVICES: [0]
/nas/longleaf/home/zayah/f1tenth_ng_zc/.venv/lib/python3.12/site-packages/lightning/pytorch/callbacks/model_checkpoint.py:881: Checkpoint directory /nas/longleaf/home/zayah/f1tenth_ng_zc/data/models/checkpoints/left_wall_dist_arch8 exists and is not empty.
LOCAL_RANK: 0 - CUDA_VISIBLE_DEVICES: [0]
SLURM auto-requeueing enabled. Setting signal handlers.
SLURM auto-requeueing enabled. Setting signal handlers.
SLURM auto-requeueing enabled. Setting signal handlers.
`Trainer.fit` stopped: `max_epochs=21` reached.
`Trainer.fit` stopped: `max_epochs=21` reached.
`Trainer.fit` stopped: `max_epochs=21` reached.
[I 2026-04-09 01:20:06,584] Trial 79 finished with value: 0.128 and parameters: {'left_wall_dist_num_layers': 4, 'left_wall_dist_activation': 'relu', 'left_wall_dist_out_channels_l0': 33, 'left_wall_dist_pool_size_l0': 4, 'left_wall_dist_out_channels_l1': 102, 'left_wall_dist_pool_size_l1': 2, 'left_wall_dist_out_channels_l2': 46, 'left_wall_dist_pool_size_l2': 2, 'left_wall_dist_out_channels_l3': 113, 'left_wall_dist_pool_size_l3': 2, 'left_wall_dist_fc_hidden': 76, 'track_width_num_layers': 3, 'track_width_activation': 'elu', 'track_width_out_channels_l0': 104, 'track_width_pool_size_l0': 2, 'track_width_out_channels_l1': 83, 'track_width_pool_size_l1': 4, 'track_width_out_channels_l2': 99, 'track_width_pool_size_l2': 2, 'track_width_fc_hidden': 108, 'heading_error_num_layers': 4, 'heading_error_activation': 'relu', 'heading_error_out_channels_l0': 101, 'heading_error_pool_size_l0': 2, 'heading_error_out_channels_l1': 88, 'heading_error_pool_size_l1': 2, 'heading_error_out_channels_l2': 118, 'heading_error_pool_size_l2': 4, 'heading_error_out_channels_l3': 46, 'heading_error_pool_size_l3': 4, 'heading_error_fc_hidden': 43}. Best is trial 71 with value: 0.0953.
[rank: 0] Seed set to 42
[rank: 0] Seed set to 42
[rank: 0] Seed set to 42
GPU available: True (cuda), used: True
TPU available: False, using: 0 TPU cores
GPU available: True (cuda), used: True
TPU available: False, using: 0 TPU cores
💡 Tip: For seamless cloud logging and experiment tracking, try installing [litlogger](https://pypi.org/project/litlogger/) to enable LitLogger, which logs metrics and artifacts automatically to the Lightning Experiments platform.
💡 Tip: For seamless cloud logging and experiment tracking, try installing [litlogger](https://pypi.org/project/litlogger/) to enable LitLogger, which logs metrics and artifacts automatically to the Lightning Experiments platform.
GPU available: True (cuda), used: True
TPU available: False, using: 0 TPU cores
💡 Tip: For seamless cloud logging and experiment tracking, try installing [litlogger](https://pypi.org/project/litlogger/) to enable LitLogger, which logs metrics and artifacts automatically to the Lightning Experiments platform.
/nas/longleaf/home/zayah/f1tenth_ng_zc/.venv/lib/python3.12/site-packages/lightning/pytorch/callbacks/model_checkpoint.py:881: Checkpoint directory /nas/longleaf/home/zayah/f1tenth_ng_zc/data/models/checkpoints/heading_error_arch8 exists and is not empty.
LOCAL_RANK: 0 - CUDA_VISIBLE_DEVICES: [0]
/nas/longleaf/home/zayah/f1tenth_ng_zc/.venv/lib/python3.12/site-packages/lightning/pytorch/callbacks/model_checkpoint.py:881: Checkpoint directory /nas/longleaf/home/zayah/f1tenth_ng_zc/data/models/checkpoints/track_width_arch8 exists and is not empty.
LOCAL_RANK: 0 - CUDA_VISIBLE_DEVICES: [0]
/nas/longleaf/home/zayah/f1tenth_ng_zc/.venv/lib/python3.12/site-packages/lightning/pytorch/callbacks/model_checkpoint.py:881: Checkpoint directory /nas/longleaf/home/zayah/f1tenth_ng_zc/data/models/checkpoints/left_wall_dist_arch8 exists and is not empty.
LOCAL_RANK: 0 - CUDA_VISIBLE_DEVICES: [0]
SLURM auto-requeueing enabled. Setting signal handlers.
SLURM auto-requeueing enabled. Setting signal handlers.
SLURM auto-requeueing enabled. Setting signal handlers.
`Trainer.fit` stopped: `max_epochs=21` reached.
`Trainer.fit` stopped: `max_epochs=21` reached.
`Trainer.fit` stopped: `max_epochs=21` reached.
[I 2026-04-09 01:22:37,410] Trial 80 finished with value: 0.1345 and parameters: {'left_wall_dist_num_layers': 2, 'left_wall_dist_activation': 'relu', 'left_wall_dist_out_channels_l0': 41, 'left_wall_dist_pool_size_l0': 2, 'left_wall_dist_out_channels_l1': 50, 'left_wall_dist_pool_size_l1': 2, 'track_width_num_layers': 3, 'track_width_activation': 'relu', 'track_width_out_channels_l0': 60, 'track_width_pool_size_l0': 4, 'track_width_out_channels_l1': 89, 'track_width_pool_size_l1': 4, 'track_width_out_channels_l2': 82, 'track_width_pool_size_l2': 4, 'track_width_fc_hidden': 62, 'heading_error_num_layers': 4, 'heading_error_activation': 'elu', 'heading_error_out_channels_l0': 88, 'heading_error_pool_size_l0': 2, 'heading_error_out_channels_l1': 90, 'heading_error_pool_size_l1': 4, 'heading_error_out_channels_l2': 89, 'heading_error_pool_size_l2': 4, 'heading_error_out_channels_l3': 35, 'heading_error_pool_size_l3': 4, 'heading_error_fc_hidden': 58}. Best is trial 71 with value: 0.0953.
[rank: 0] Seed set to 42
[rank: 0] Seed set to 42
[rank: 0] Seed set to 42
GPU available: True (cuda), used: True
TPU available: False, using: 0 TPU cores
💡 Tip: For seamless cloud logging and experiment tracking, try installing [litlogger](https://pypi.org/project/litlogger/) to enable LitLogger, which logs metrics and artifacts automatically to the Lightning Experiments platform.
GPU available: True (cuda), used: True
TPU available: False, using: 0 TPU cores
💡 Tip: For seamless cloud logging and experiment tracking, try installing [litlogger](https://pypi.org/project/litlogger/) to enable LitLogger, which logs metrics and artifacts automatically to the Lightning Experiments platform.
GPU available: True (cuda), used: True
TPU available: False, using: 0 TPU cores
💡 Tip: For seamless cloud logging and experiment tracking, try installing [litlogger](https://pypi.org/project/litlogger/) to enable LitLogger, which logs metrics and artifacts automatically to the Lightning Experiments platform.
/nas/longleaf/home/zayah/f1tenth_ng_zc/.venv/lib/python3.12/site-packages/lightning/pytorch/callbacks/model_checkpoint.py:881: Checkpoint directory /nas/longleaf/home/zayah/f1tenth_ng_zc/data/models/checkpoints/track_width_arch8 exists and is not empty.
LOCAL_RANK: 0 - CUDA_VISIBLE_DEVICES: [0]
/nas/longleaf/home/zayah/f1tenth_ng_zc/.venv/lib/python3.12/site-packages/lightning/pytorch/callbacks/model_checkpoint.py:881: Checkpoint directory /nas/longleaf/home/zayah/f1tenth_ng_zc/data/models/checkpoints/left_wall_dist_arch8 exists and is not empty.
LOCAL_RANK: 0 - CUDA_VISIBLE_DEVICES: [0]
/nas/longleaf/home/zayah/f1tenth_ng_zc/.venv/lib/python3.12/site-packages/lightning/pytorch/callbacks/model_checkpoint.py:881: Checkpoint directory /nas/longleaf/home/zayah/f1tenth_ng_zc/data/models/checkpoints/heading_error_arch8 exists and is not empty.
LOCAL_RANK: 0 - CUDA_VISIBLE_DEVICES: [0]
SLURM auto-requeueing enabled. Setting signal handlers.
SLURM auto-requeueing enabled. Setting signal handlers.
SLURM auto-requeueing enabled. Setting signal handlers.
`Trainer.fit` stopped: `max_epochs=21` reached.
`Trainer.fit` stopped: `max_epochs=21` reached.
`Trainer.fit` stopped: `max_epochs=21` reached.
[I 2026-04-09 01:25:09,123] Trial 81 finished with value: 0.1099 and parameters: {'left_wall_dist_num_layers': 2, 'left_wall_dist_activation': 'relu', 'left_wall_dist_out_channels_l0': 37, 'left_wall_dist_pool_size_l0': 2, 'left_wall_dist_out_channels_l1': 91, 'left_wall_dist_pool_size_l1': 2, 'track_width_num_layers': 4, 'track_width_activation': 'elu', 'track_width_out_channels_l0': 78, 'track_width_pool_size_l0': 4, 'track_width_out_channels_l1': 34, 'track_width_pool_size_l1': 4, 'track_width_out_channels_l2': 94, 'track_width_pool_size_l2': 2, 'track_width_out_channels_l3': 57, 'track_width_pool_size_l3': 2, 'track_width_fc_hidden': 77, 'heading_error_num_layers': 4, 'heading_error_activation': 'elu', 'heading_error_out_channels_l0': 109, 'heading_error_pool_size_l0': 2, 'heading_error_out_channels_l1': 78, 'heading_error_pool_size_l1': 2, 'heading_error_out_channels_l2': 96, 'heading_error_pool_size_l2': 4, 'heading_error_out_channels_l3': 44, 'heading_error_pool_size_l3': 2, 'heading_error_fc_hidden': 47}. Best is trial 71 with value: 0.0953.
[rank: 0] Seed set to 42
[rank: 0] Seed set to 42
[rank: 0] Seed set to 42
GPU available: True (cuda), used: True
TPU available: False, using: 0 TPU cores
💡 Tip: For seamless cloud logging and experiment tracking, try installing [litlogger](https://pypi.org/project/litlogger/) to enable LitLogger, which logs metrics and artifacts automatically to the Lightning Experiments platform.
GPU available: True (cuda), used: True
TPU available: False, using: 0 TPU cores
💡 Tip: For seamless cloud logging and experiment tracking, try installing [litlogger](https://pypi.org/project/litlogger/) to enable LitLogger, which logs metrics and artifacts automatically to the Lightning Experiments platform.
GPU available: True (cuda), used: True
TPU available: False, using: 0 TPU cores
💡 Tip: For seamless cloud logging and experiment tracking, try installing [litlogger](https://pypi.org/project/litlogger/) to enable LitLogger, which logs metrics and artifacts automatically to the Lightning Experiments platform.
/nas/longleaf/home/zayah/f1tenth_ng_zc/.venv/lib/python3.12/site-packages/lightning/pytorch/callbacks/model_checkpoint.py:881: Checkpoint directory /nas/longleaf/home/zayah/f1tenth_ng_zc/data/models/checkpoints/left_wall_dist_arch8 exists and is not empty.
LOCAL_RANK: 0 - CUDA_VISIBLE_DEVICES: [0]
/nas/longleaf/home/zayah/f1tenth_ng_zc/.venv/lib/python3.12/site-packages/lightning/pytorch/callbacks/model_checkpoint.py:881: Checkpoint directory /nas/longleaf/home/zayah/f1tenth_ng_zc/data/models/checkpoints/track_width_arch8 exists and is not empty.
LOCAL_RANK: 0 - CUDA_VISIBLE_DEVICES: [0]
/nas/longleaf/home/zayah/f1tenth_ng_zc/.venv/lib/python3.12/site-packages/lightning/pytorch/callbacks/model_checkpoint.py:881: Checkpoint directory /nas/longleaf/home/zayah/f1tenth_ng_zc/data/models/checkpoints/heading_error_arch8 exists and is not empty.
LOCAL_RANK: 0 - CUDA_VISIBLE_DEVICES: [0]
SLURM auto-requeueing enabled. Setting signal handlers.
SLURM auto-requeueing enabled. Setting signal handlers.
SLURM auto-requeueing enabled. Setting signal handlers.
`Trainer.fit` stopped: `max_epochs=21` reached.
`Trainer.fit` stopped: `max_epochs=21` reached.
`Trainer.fit` stopped: `max_epochs=21` reached.
[I 2026-04-09 01:27:40,184] Trial 82 finished with value: 0.1199 and parameters: {'left_wall_dist_num_layers': 2, 'left_wall_dist_activation': 'elu', 'left_wall_dist_out_channels_l0': 35, 'left_wall_dist_pool_size_l0': 2, 'left_wall_dist_out_channels_l1': 68, 'left_wall_dist_pool_size_l1': 2, 'track_width_num_layers': 4, 'track_width_activation': 'elu', 'track_width_out_channels_l0': 84, 'track_width_pool_size_l0': 4, 'track_width_out_channels_l1': 37, 'track_width_pool_size_l1': 4, 'track_width_out_channels_l2': 110, 'track_width_pool_size_l2': 2, 'track_width_out_channels_l3': 50, 'track_width_pool_size_l3': 2, 'track_width_fc_hidden': 67, 'heading_error_num_layers': 4, 'heading_error_activation': 'elu', 'heading_error_out_channels_l0': 57, 'heading_error_pool_size_l0': 2, 'heading_error_out_channels_l1': 62, 'heading_error_pool_size_l1': 2, 'heading_error_out_channels_l2': 126, 'heading_error_pool_size_l2': 4, 'heading_error_out_channels_l3': 40, 'heading_error_pool_size_l3': 2, 'heading_error_fc_hidden': 73}. Best is trial 71 with value: 0.0953.
[rank: 0] Seed set to 42
[rank: 0] Seed set to 42
[rank: 0] Seed set to 42
GPU available: True (cuda), used: True
TPU available: False, using: 0 TPU cores
💡 Tip: For seamless cloud logging and experiment tracking, try installing [litlogger](https://pypi.org/project/litlogger/) to enable LitLogger, which logs metrics and artifacts automatically to the Lightning Experiments platform.
GPU available: True (cuda), used: True
TPU available: False, using: 0 TPU cores
💡 Tip: For seamless cloud logging and experiment tracking, try installing [litlogger](https://pypi.org/project/litlogger/) to enable LitLogger, which logs metrics and artifacts automatically to the Lightning Experiments platform.
GPU available: True (cuda), used: True
TPU available: False, using: 0 TPU cores
💡 Tip: For seamless cloud logging and experiment tracking, try installing [litlogger](https://pypi.org/project/litlogger/) to enable LitLogger, which logs metrics and artifacts automatically to the Lightning Experiments platform.
/nas/longleaf/home/zayah/f1tenth_ng_zc/.venv/lib/python3.12/site-packages/lightning/pytorch/callbacks/model_checkpoint.py:881: Checkpoint directory /nas/longleaf/home/zayah/f1tenth_ng_zc/data/models/checkpoints/track_width_arch8 exists and is not empty.
LOCAL_RANK: 0 - CUDA_VISIBLE_DEVICES: [0]
/nas/longleaf/home/zayah/f1tenth_ng_zc/.venv/lib/python3.12/site-packages/lightning/pytorch/callbacks/model_checkpoint.py:881: Checkpoint directory /nas/longleaf/home/zayah/f1tenth_ng_zc/data/models/checkpoints/heading_error_arch8 exists and is not empty.
/nas/longleaf/home/zayah/f1tenth_ng_zc/.venv/lib/python3.12/site-packages/lightning/pytorch/callbacks/model_checkpoint.py:881: Checkpoint directory /nas/longleaf/home/zayah/f1tenth_ng_zc/data/models/checkpoints/left_wall_dist_arch8 exists and is not empty.
LOCAL_RANK: 0 - CUDA_VISIBLE_DEVICES: [0]
LOCAL_RANK: 0 - CUDA_VISIBLE_DEVICES: [0]
SLURM auto-requeueing enabled. Setting signal handlers.
SLURM auto-requeueing enabled. Setting signal handlers.
SLURM auto-requeueing enabled. Setting signal handlers.
`Trainer.fit` stopped: `max_epochs=21` reached.
`Trainer.fit` stopped: `max_epochs=21` reached.
[I 2026-04-09 01:30:07,787] Trial 83 finished with value: 0.1262 and parameters: {'left_wall_dist_num_layers': 2, 'left_wall_dist_activation': 'elu', 'left_wall_dist_out_channels_l0': 38, 'left_wall_dist_pool_size_l0': 2, 'left_wall_dist_out_channels_l1': 40, 'left_wall_dist_pool_size_l1': 4, 'left_wall_dist_fc_hidden': 107, 'track_width_num_layers': 4, 'track_width_activation': 'elu', 'track_width_out_channels_l0': 92, 'track_width_pool_size_l0': 4, 'track_width_out_channels_l1': 35, 'track_width_pool_size_l1': 4, 'track_width_out_channels_l2': 104, 'track_width_pool_size_l2': 2, 'track_width_out_channels_l3': 35, 'track_width_pool_size_l3': 2, 'track_width_fc_hidden': 91, 'heading_error_num_layers': 4, 'heading_error_activation': 'elu', 'heading_error_out_channels_l0': 62, 'heading_error_pool_size_l0': 2, 'heading_error_out_channels_l1': 82, 'heading_error_pool_size_l1': 2, 'heading_error_out_channels_l2': 115, 'heading_error_pool_size_l2': 4, 'heading_error_out_channels_l3': 74, 'heading_error_pool_size_l3': 2, 'heading_error_fc_hidden': 54}. Best is trial 71 with value: 0.0953.
[rank: 0] Seed set to 42
[rank: 0] Seed set to 42
[rank: 0] Seed set to 42
GPU available: True (cuda), used: True
TPU available: False, using: 0 TPU cores
GPU available: True (cuda), used: True
💡 Tip: For seamless cloud logging and experiment tracking, try installing [litlogger](https://pypi.org/project/litlogger/) to enable LitLogger, which logs metrics and artifacts automatically to the Lightning Experiments platform.
TPU available: False, using: 0 TPU cores
💡 Tip: For seamless cloud logging and experiment tracking, try installing [litlogger](https://pypi.org/project/litlogger/) to enable LitLogger, which logs metrics and artifacts automatically to the Lightning Experiments platform.
GPU available: True (cuda), used: True
TPU available: False, using: 0 TPU cores
💡 Tip: For seamless cloud logging and experiment tracking, try installing [litlogger](https://pypi.org/project/litlogger/) to enable LitLogger, which logs metrics and artifacts automatically to the Lightning Experiments platform.
/nas/longleaf/home/zayah/f1tenth_ng_zc/.venv/lib/python3.12/site-packages/lightning/pytorch/callbacks/model_checkpoint.py:881: Checkpoint directory /nas/longleaf/home/zayah/f1tenth_ng_zc/data/models/checkpoints/heading_error_arch8 exists and is not empty.
LOCAL_RANK: 0 - CUDA_VISIBLE_DEVICES: [0]
/nas/longleaf/home/zayah/f1tenth_ng_zc/.venv/lib/python3.12/site-packages/lightning/pytorch/callbacks/model_checkpoint.py:881: Checkpoint directory /nas/longleaf/home/zayah/f1tenth_ng_zc/data/models/checkpoints/track_width_arch8 exists and is not empty.
LOCAL_RANK: 0 - CUDA_VISIBLE_DEVICES: [0]
/nas/longleaf/home/zayah/f1tenth_ng_zc/.venv/lib/python3.12/site-packages/lightning/pytorch/callbacks/model_checkpoint.py:881: Checkpoint directory /nas/longleaf/home/zayah/f1tenth_ng_zc/data/models/checkpoints/left_wall_dist_arch8 exists and is not empty.
LOCAL_RANK: 0 - CUDA_VISIBLE_DEVICES: [0]
SLURM auto-requeueing enabled. Setting signal handlers.
SLURM auto-requeueing enabled. Setting signal handlers.
SLURM auto-requeueing enabled. Setting signal handlers.
`Trainer.fit` stopped: `max_epochs=21` reached.
`Trainer.fit` stopped: `max_epochs=21` reached.
`Trainer.fit` stopped: `max_epochs=21` reached.
