[I 2026-04-09 23:41:05,197] Trial 73 finished with value: 0.1641 and parameters: {'left_wall_dist_num_layers': 3, 'left_wall_dist_activation': 'relu', 'left_wall_dist_out_channels_l0': 131, 'left_wall_dist_pool_size_l0': 2, 'left_wall_dist_out_channels_l1': 95, 'left_wall_dist_pool_size_l1': 8, 'left_wall_dist_out_channels_l2': 204, 'left_wall_dist_pool_size_l2': 8, 'left_wall_dist_fc_hidden': 64, 'track_width_num_layers': 5, 'track_width_activation': 'relu', 'track_width_out_channels_l0': 189, 'track_width_pool_size_l0': 8, 'track_width_out_channels_l1': 79, 'track_width_pool_size_l1': 4, 'track_width_out_channels_l2': 81, 'track_width_pool_size_l2': 2, 'track_width_out_channels_l3': 33, 'track_width_pool_size_l3': 8, 'heading_error_num_layers': 2, 'heading_error_activation': 'elu', 'heading_error_out_channels_l0': 42, 'heading_error_pool_size_l0': 4, 'heading_error_out_channels_l1': 41, 'heading_error_pool_size_l1': 2, 'heading_error_fc_hidden': 88}. Best is trial 33 with value: 0.1241.
[rank: 0] Seed set to 42
[rank: 0] Seed set to 42
GPU available: True (cuda), used: True
TPU available: False, using: 0 TPU cores
GPU available: True (cuda), used: True
TPU available: False, using: 0 TPU cores
💡 Tip: For seamless cloud logging and experiment tracking, try installing [litlogger](https://pypi.org/project/litlogger/) to enable LitLogger, which logs metrics and artifacts automatically to the Lightning Experiments platform.
💡 Tip: For seamless cloud logging and experiment tracking, try installing [litlogger](https://pypi.org/project/litlogger/) to enable LitLogger, which logs metrics and artifacts automatically to the Lightning Experiments platform.
[rank: 0] Seed set to 42
GPU available: True (cuda), used: True
TPU available: False, using: 0 TPU cores
💡 Tip: For seamless cloud logging and experiment tracking, try installing [litlogger](https://pypi.org/project/litlogger/) to enable LitLogger, which logs metrics and artifacts automatically to the Lightning Experiments platform.
/nas/longleaf/home/zayah/f1tenth_ng_zc/.venv/lib/python3.12/site-packages/lightning/pytorch/callbacks/model_checkpoint.py:881: Checkpoint directory /nas/longleaf/home/zayah/f1tenth_ng_zc/data/models/checkpoints/track_width_arch8 exists and is not empty.
/nas/longleaf/home/zayah/f1tenth_ng_zc/.venv/lib/python3.12/site-packages/lightning/pytorch/callbacks/model_checkpoint.py:881: Checkpoint directory /nas/longleaf/home/zayah/f1tenth_ng_zc/data/models/checkpoints/left_wall_dist_arch8 exists and is not empty.
LOCAL_RANK: 0 - CUDA_VISIBLE_DEVICES: [0]
LOCAL_RANK: 0 - CUDA_VISIBLE_DEVICES: [0]
/nas/longleaf/home/zayah/f1tenth_ng_zc/.venv/lib/python3.12/site-packages/lightning/pytorch/callbacks/model_checkpoint.py:881: Checkpoint directory /nas/longleaf/home/zayah/f1tenth_ng_zc/data/models/checkpoints/heading_error_arch8 exists and is not empty.
LOCAL_RANK: 0 - CUDA_VISIBLE_DEVICES: [0]
SLURM auto-requeueing enabled. Setting signal handlers.
SLURM auto-requeueing enabled. Setting signal handlers.
SLURM auto-requeueing enabled. Setting signal handlers.
`Trainer.fit` stopped: `max_epochs=21` reached.
`Trainer.fit` stopped: `max_epochs=21` reached.
`Trainer.fit` stopped: `max_epochs=21` reached.
[I 2026-04-09 23:42:40,518] Trial 74 finished with value: 0.2011 and parameters: {'left_wall_dist_num_layers': 3, 'left_wall_dist_activation': 'relu', 'left_wall_dist_out_channels_l0': 122, 'left_wall_dist_pool_size_l0': 2, 'left_wall_dist_out_channels_l1': 87, 'left_wall_dist_pool_size_l1': 8, 'left_wall_dist_out_channels_l2': 255, 'left_wall_dist_pool_size_l2': 8, 'left_wall_dist_fc_hidden': 70, 'track_width_num_layers': 5, 'track_width_activation': 'relu', 'track_width_out_channels_l0': 125, 'track_width_pool_size_l0': 8, 'track_width_out_channels_l1': 113, 'track_width_pool_size_l1': 4, 'track_width_out_channels_l2': 61, 'track_width_pool_size_l2': 2, 'track_width_out_channels_l3': 35, 'track_width_pool_size_l3': 8, 'heading_error_num_layers': 2, 'heading_error_activation': 'elu', 'heading_error_out_channels_l0': 46, 'heading_error_pool_size_l0': 4, 'heading_error_out_channels_l1': 46, 'heading_error_pool_size_l1': 2, 'heading_error_fc_hidden': 109}. Best is trial 33 with value: 0.1241.
