[I 2026-04-11 23:01:45,351] Trial 36 finished with value: 0.2725 and parameters: {'left_wall_dist_num_layers': 4, 'left_wall_dist_activation': 'elu', 'left_wall_dist_out_channels_l0': 160, 'left_wall_dist_pool_size_l0': 8, 'left_wall_dist_out_channels_l1': 202, 'left_wall_dist_pool_size_l1': 2, 'left_wall_dist_out_channels_l2': 34, 'left_wall_dist_pool_size_l2': 4, 'left_wall_dist_out_channels_l3': 52, 'left_wall_dist_pool_size_l3': 8, 'track_width_num_layers': 2, 'track_width_activation': 'relu', 'track_width_out_channels_l0': 225, 'track_width_pool_size_l0': 8, 'track_width_out_channels_l1': 32, 'track_width_pool_size_l1': 4, 'track_width_fc_hidden': 103, 'heading_error_num_layers': 3, 'heading_error_activation': 'relu', 'heading_error_out_channels_l0': 109, 'heading_error_pool_size_l0': 4, 'heading_error_out_channels_l1': 66, 'heading_error_pool_size_l1': 8, 'heading_error_out_channels_l2': 76, 'heading_error_pool_size_l2': 2, 'heading_error_fc_hidden': 43}. Best is trial 34 with value: 0.10282.
[rank: 0] Seed set to 42
[rank: 0] Seed set to 42
[rank: 0] Seed set to 42
GPU available: True (cuda), used: True
TPU available: False, using: 0 TPU cores
GPU available: True (cuda), used: True
TPU available: False, using: 0 TPU cores
💡 Tip: For seamless cloud logging and experiment tracking, try installing [litlogger](https://pypi.org/project/litlogger/) to enable LitLogger, which logs metrics and artifacts automatically to the Lightning Experiments platform.
💡 Tip: For seamless cloud logging and experiment tracking, try installing [litlogger](https://pypi.org/project/litlogger/) to enable LitLogger, which logs metrics and artifacts automatically to the Lightning Experiments platform.
GPU available: True (cuda), used: True
TPU available: False, using: 0 TPU cores
💡 Tip: For seamless cloud logging and experiment tracking, try installing [litlogger](https://pypi.org/project/litlogger/) to enable LitLogger, which logs metrics and artifacts automatically to the Lightning Experiments platform.
/nas/longleaf/home/zayah/f1tenth_ng_zc/.venv/lib/python3.12/site-packages/lightning/pytorch/callbacks/model_checkpoint.py:881: Checkpoint directory /nas/longleaf/home/zayah/f1tenth_ng_zc/data/models/checkpoints/track_width_arch8 exists and is not empty.
LOCAL_RANK: 0 - CUDA_VISIBLE_DEVICES: [0]
/nas/longleaf/home/zayah/f1tenth_ng_zc/.venv/lib/python3.12/site-packages/lightning/pytorch/callbacks/model_checkpoint.py:881: Checkpoint directory /nas/longleaf/home/zayah/f1tenth_ng_zc/data/models/checkpoints/heading_error_arch8 exists and is not empty.
LOCAL_RANK: 0 - CUDA_VISIBLE_DEVICES: [0]
/nas/longleaf/home/zayah/f1tenth_ng_zc/.venv/lib/python3.12/site-packages/lightning/pytorch/callbacks/model_checkpoint.py:881: Checkpoint directory /nas/longleaf/home/zayah/f1tenth_ng_zc/data/models/checkpoints/left_wall_dist_arch8 exists and is not empty.
LOCAL_RANK: 0 - CUDA_VISIBLE_DEVICES: [0]
SLURM auto-requeueing enabled. Setting signal handlers.
Traceback (most recent call last):
  File "/nas/longleaf/home/zayah/f1tenth_ng_zc/packages/f110_scripts/src/f110_scripts/train/train_nn.py", line 584, in <module>
    main()
  File "/nas/longleaf/home/zayah/f1tenth_ng_zc/packages/f110_scripts/src/f110_scripts/train/train_nn.py", line 580, in main
    run_single_training(config, aid)
  File "/nas/longleaf/home/zayah/f1tenth_ng_zc/packages/f110_scripts/src/f110_scripts/train/train_nn.py", line 553, in run_single_training
    trainer.fit(module, datamodule=dm, ckpt_path=ckpt_path)
  File "/nas/longleaf/home/zayah/f1tenth_ng_zc/.venv/lib/python3.12/site-packages/lightning/pytorch/trainer/trainer.py", line 584, in fit
    call._call_and_handle_interrupt(
  File "/nas/longleaf/home/zayah/f1tenth_ng_zc/.venv/lib/python3.12/site-packages/lightning/pytorch/trainer/call.py", line 49, in _call_and_handle_interrupt
    return trainer_fn(*args, **kwargs)
           ^^^^^^^^^^^^^^^^^^^^^^^^^^^
  File "/nas/longleaf/home/zayah/f1tenth_ng_zc/.venv/lib/python3.12/site-packages/lightning/pytorch/trainer/trainer.py", line 630, in _fit_impl
    self._run(model, ckpt_path=ckpt_path, weights_only=weights_only)
  File "/nas/longleaf/home/zayah/f1tenth_ng_zc/.venv/lib/python3.12/site-packages/lightning/pytorch/trainer/trainer.py", line 1057, in _run
    call._call_callback_hooks(self, "on_fit_start")
  File "/nas/longleaf/home/zayah/f1tenth_ng_zc/.venv/lib/python3.12/site-packages/lightning/pytorch/trainer/call.py", line 228, in _call_callback_hooks
    fn(trainer, trainer.lightning_module, *args, **kwargs)
  File "/nas/longleaf/home/zayah/f1tenth_ng_zc/.venv/lib/python3.12/site-packages/lightning/pytorch/callbacks/model_summary.py", line 64, in on_fit_start
    model_summary = self._summary(trainer, pl_module)
                    ^^^^^^^^^^^^^^^^^^^^^^^^^^^^^^^^^
  File "/nas/longleaf/home/zayah/f1tenth_ng_zc/.venv/lib/python3.12/site-packages/lightning/pytorch/callbacks/model_summary.py", line 90, in _summary
    return summarize(pl_module, max_depth=self._max_depth)
           ^^^^^^^^^^^^^^^^^^^^^^^^^^^^^^^^^^^^^^^^^^^^^^^
  File "/nas/longleaf/home/zayah/f1tenth_ng_zc/.venv/lib/python3.12/site-packages/lightning/pytorch/utilities/model_summary/model_summary.py", line 565, in summarize
    return ModelSummary(lightning_module, max_depth=max_depth)
           ^^^^^^^^^^^^^^^^^^^^^^^^^^^^^^^^^^^^^^^^^^^^^^^^^^^
  File "/nas/longleaf/home/zayah/f1tenth_ng_zc/.venv/lib/python3.12/site-packages/lightning/pytorch/utilities/model_summary/model_summary.py", line 228, in __init__
    self._layer_summary = self.summarize()
                          ^^^^^^^^^^^^^^^^
  File "/nas/longleaf/home/zayah/f1tenth_ng_zc/.venv/lib/python3.12/site-packages/lightning/pytorch/utilities/model_summary/model_summary.py", line 328, in summarize
    self._forward_example_input()
  File "/nas/longleaf/home/zayah/f1tenth_ng_zc/.venv/lib/python3.12/site-packages/lightning/pytorch/utilities/model_summary/model_summary.py", line 371, in _forward_example_input
    model(input_)
  File "/nas/longleaf/home/zayah/f1tenth_ng_zc/.venv/lib/python3.12/site-packages/torch/nn/modules/module.py", line 1779, in _wrapped_call_impl
    return self._call_impl(*args, **kwargs)
           ^^^^^^^^^^^^^^^^^^^^^^^^^^^^^^^^
  File "/nas/longleaf/home/zayah/f1tenth_ng_zc/.venv/lib/python3.12/site-packages/torch/nn/modules/module.py", line 1885, in _call_impl
    return inner()
           ^^^^^^^
  File "/nas/longleaf/home/zayah/f1tenth_ng_zc/.venv/lib/python3.12/site-packages/torch/nn/modules/module.py", line 1833, in inner
    result = forward_call(*args, **kwargs)
             ^^^^^^^^^^^^^^^^^^^^^^^^^^^^^
  File "/nas/longleaf/home/zayah/f1tenth_ng_zc/packages/f110_scripts/src/f110_scripts/train/train_nn.py", line 205, in forward
    return self.model(x_in)
           ^^^^^^^^^^^^^^^^
  File "/nas/longleaf/home/zayah/f1tenth_ng_zc/.venv/lib/python3.12/site-packages/torch/nn/modules/module.py", line 1779, in _wrapped_call_impl
    return self._call_impl(*args, **kwargs)
           ^^^^^^^^^^^^^^^^^^^^^^^^^^^^^^^^
  File "/nas/longleaf/home/zayah/f1tenth_ng_zc/.venv/lib/python3.12/site-packages/torch/nn/modules/module.py", line 1885, in _call_impl
    return inner()
           ^^^^^^^
  File "/nas/longleaf/home/zayah/f1tenth_ng_zc/.venv/lib/python3.12/site-packages/torch/nn/modules/module.py", line 1833, in inner
    result = forward_call(*args, **kwargs)
             ^^^^^^^^^^^^^^^^^^^^^^^^^^^^^
  File "/nas/longleaf/home/zayah/f1tenth_ng_zc/.venv/lib/python3.12/site-packages/torch/nn/modules/container.py", line 253, in forward
    input = module(input)
            ^^^^^^^^^^^^^
  File "/nas/longleaf/home/zayah/f1tenth_ng_zc/.venv/lib/python3.12/site-packages/torch/nn/modules/module.py", line 1779, in _wrapped_call_impl
    return self._call_impl(*args, **kwargs)
           ^^^^^^^^^^^^^^^^^^^^^^^^^^^^^^^^
  File "/nas/longleaf/home/zayah/f1tenth_ng_zc/.venv/lib/python3.12/site-packages/torch/nn/modules/module.py", line 1885, in _call_impl
    return inner()
           ^^^^^^^
  File "/nas/longleaf/home/zayah/f1tenth_ng_zc/.venv/lib/python3.12/site-packages/torch/nn/modules/module.py", line 1833, in inner
    result = forward_call(*args, **kwargs)
             ^^^^^^^^^^^^^^^^^^^^^^^^^^^^^
  File "/nas/longleaf/home/zayah/f1tenth_ng_zc/.venv/lib/python3.12/site-packages/torch/nn/modules/pooling.py", line 144, in forward
    return F.max_pool1d(
           ^^^^^^^^^^^^^
  File "/nas/longleaf/home/zayah/f1tenth_ng_zc/.venv/lib/python3.12/site-packages/torch/_jit_internal.py", line 636, in fn
    return if_false(*args, **kwargs)
           ^^^^^^^^^^^^^^^^^^^^^^^^^
  File "/nas/longleaf/home/zayah/f1tenth_ng_zc/.venv/lib/python3.12/site-packages/torch/nn/functional.py", line 745, in _max_pool1d
    return torch.max_pool1d(input, kernel_size, stride, padding, dilation, ceil_mode)
           ^^^^^^^^^^^^^^^^^^^^^^^^^^^^^^^^^^^^^^^^^^^^^^^^^^^^^^^^^^^^^^^^^^^^^^^^^^
RuntimeError: max_pool1d() Invalid computed output size: 0
SLURM auto-requeueing enabled. Setting signal handlers.
`Trainer.fit` stopped: `max_epochs=20` reached.
`Trainer.fit` stopped: `max_epochs=20` reached.
[I 2026-04-11 23:02:32,722] Trial 37 finished with value: inf and parameters: {'left_wall_dist_num_layers': 5, 'left_wall_dist_activation': 'elu', 'left_wall_dist_out_channels_l0': 113, 'left_wall_dist_pool_size_l0': 2, 'left_wall_dist_out_channels_l1': 209, 'left_wall_dist_pool_size_l1': 2, 'left_wall_dist_out_channels_l2': 46, 'left_wall_dist_pool_size_l2': 4, 'left_wall_dist_out_channels_l3': 79, 'left_wall_dist_pool_size_l3': 8, 'left_wall_dist_out_channels_l4': 35, 'left_wall_dist_pool_size_l4': 8, 'track_width_num_layers': 2, 'track_width_activation': 'elu', 'track_width_out_channels_l0': 176, 'track_width_pool_size_l0': 4, 'track_width_out_channels_l1': 47, 'track_width_pool_size_l1': 8, 'track_width_fc_hidden': 67, 'heading_error_num_layers': 4, 'heading_error_activation': 'elu', 'heading_error_out_channels_l0': 165, 'heading_error_pool_size_l0': 4, 'heading_error_out_channels_l1': 134, 'heading_error_pool_size_l1': 4, 'heading_error_out_channels_l2': 150, 'heading_error_pool_size_l2': 8, 'heading_error_out_channels_l3': 55, 'heading_error_pool_size_l3': 4, 'heading_error_fc_hidden': 34}. Best is trial 34 with value: 0.10282.
[rank: 0] Seed set to 42
GPU available: True (cuda), used: True
TPU available: False, using: 0 TPU cores
💡 Tip: For seamless cloud logging and experiment tracking, try installing [litlogger](https://pypi.org/project/litlogger/) to enable LitLogger, which logs metrics and artifacts automatically to the Lightning Experiments platform.
[rank: 0] Seed set to 42
GPU available: True (cuda), used: True
TPU available: False, using: 0 TPU cores
💡 Tip: For seamless cloud logging and experiment tracking, try installing [litlogger](https://pypi.org/project/litlogger/) to enable LitLogger, which logs metrics and artifacts automatically to the Lightning Experiments platform.
[rank: 0] Seed set to 42
GPU available: True (cuda), used: True
TPU available: False, using: 0 TPU cores
💡 Tip: For seamless cloud logging and experiment tracking, try installing [litlogger](https://pypi.org/project/litlogger/) to enable LitLogger, which logs metrics and artifacts automatically to the Lightning Experiments platform.
/nas/longleaf/home/zayah/f1tenth_ng_zc/.venv/lib/python3.12/site-packages/lightning/pytorch/callbacks/model_checkpoint.py:881: Checkpoint directory /nas/longleaf/home/zayah/f1tenth_ng_zc/data/models/checkpoints/track_width_arch8 exists and is not empty.
LOCAL_RANK: 0 - CUDA_VISIBLE_DEVICES: [0]
/nas/longleaf/home/zayah/f1tenth_ng_zc/.venv/lib/python3.12/site-packages/lightning/pytorch/callbacks/model_checkpoint.py:881: Checkpoint directory /nas/longleaf/home/zayah/f1tenth_ng_zc/data/models/checkpoints/heading_error_arch8 exists and is not empty.
LOCAL_RANK: 0 - CUDA_VISIBLE_DEVICES: [0]
/nas/longleaf/home/zayah/f1tenth_ng_zc/.venv/lib/python3.12/site-packages/lightning/pytorch/callbacks/model_checkpoint.py:881: Checkpoint directory /nas/longleaf/home/zayah/f1tenth_ng_zc/data/models/checkpoints/left_wall_dist_arch8 exists and is not empty.
LOCAL_RANK: 0 - CUDA_VISIBLE_DEVICES: [0]
SLURM auto-requeueing enabled. Setting signal handlers.
SLURM auto-requeueing enabled. Setting signal handlers.
SLURM auto-requeueing enabled. Setting signal handlers.
`Trainer.fit` stopped: `max_epochs=20` reached.
`Trainer.fit` stopped: `max_epochs=20` reached.
`Trainer.fit` stopped: `max_epochs=20` reached.
[I 2026-04-11 23:06:39,628] Trial 38 finished with value: 0.24598 and parameters: {'left_wall_dist_num_layers': 4, 'left_wall_dist_activation': 'relu', 'left_wall_dist_out_channels_l0': 141, 'left_wall_dist_pool_size_l0': 2, 'left_wall_dist_out_channels_l1': 242, 'left_wall_dist_pool_size_l1': 4, 'left_wall_dist_out_channels_l2': 64, 'left_wall_dist_pool_size_l2': 4, 'left_wall_dist_out_channels_l3': 43, 'left_wall_dist_pool_size_l3': 8, 'track_width_num_layers': 2, 'track_width_activation': 'relu', 'track_width_out_channels_l0': 77, 'track_width_pool_size_l0': 2, 'track_width_out_channels_l1': 65, 'track_width_pool_size_l1': 4, 'heading_error_num_layers': 4, 'heading_error_activation': 'relu', 'heading_error_out_channels_l0': 182, 'heading_error_pool_size_l0': 2, 'heading_error_out_channels_l1': 48, 'heading_error_pool_size_l1': 8, 'heading_error_out_channels_l2': 207, 'heading_error_pool_size_l2': 2, 'heading_error_out_channels_l3': 33, 'heading_error_pool_size_l3': 4, 'heading_error_fc_hidden': 39}. Best is trial 34 with value: 0.10282.
[rank: 0] Seed set to 42
[rank: 0] Seed set to 42
[rank: 0] Seed set to 42
GPU available: True (cuda), used: True
TPU available: False, using: 0 TPU cores
💡 Tip: For seamless cloud logging and experiment tracking, try installing [litlogger](https://pypi.org/project/litlogger/) to enable LitLogger, which logs metrics and artifacts automatically to the Lightning Experiments platform.
GPU available: True (cuda), used: True
TPU available: False, using: 0 TPU cores
💡 Tip: For seamless cloud logging and experiment tracking, try installing [litlogger](https://pypi.org/project/litlogger/) to enable LitLogger, which logs metrics and artifacts automatically to the Lightning Experiments platform.
GPU available: True (cuda), used: True
TPU available: False, using: 0 TPU cores
💡 Tip: For seamless cloud logging and experiment tracking, try installing [litlogger](https://pypi.org/project/litlogger/) to enable LitLogger, which logs metrics and artifacts automatically to the Lightning Experiments platform.
/nas/longleaf/home/zayah/f1tenth_ng_zc/.venv/lib/python3.12/site-packages/lightning/pytorch/callbacks/model_checkpoint.py:881: Checkpoint directory /nas/longleaf/home/zayah/f1tenth_ng_zc/data/models/checkpoints/heading_error_arch8 exists and is not empty.
/nas/longleaf/home/zayah/f1tenth_ng_zc/.venv/lib/python3.12/site-packages/lightning/pytorch/callbacks/model_checkpoint.py:881: Checkpoint directory /nas/longleaf/home/zayah/f1tenth_ng_zc/data/models/checkpoints/left_wall_dist_arch8 exists and is not empty.
LOCAL_RANK: 0 - CUDA_VISIBLE_DEVICES: [0]
LOCAL_RANK: 0 - CUDA_VISIBLE_DEVICES: [0]
/nas/longleaf/home/zayah/f1tenth_ng_zc/.venv/lib/python3.12/site-packages/lightning/pytorch/callbacks/model_checkpoint.py:881: Checkpoint directory /nas/longleaf/home/zayah/f1tenth_ng_zc/data/models/checkpoints/track_width_arch8 exists and is not empty.
LOCAL_RANK: 0 - CUDA_VISIBLE_DEVICES: [0]
SLURM auto-requeueing enabled. Setting signal handlers.
SLURM auto-requeueing enabled. Setting signal handlers.
SLURM auto-requeueing enabled. Setting signal handlers.
`Trainer.fit` stopped: `max_epochs=20` reached.
`Trainer.fit` stopped: `max_epochs=20` reached.
`Trainer.fit` stopped: `max_epochs=20` reached.
[I 2026-04-11 23:10:41,102] Trial 39 finished with value: 0.11512 and parameters: {'left_wall_dist_num_layers': 5, 'left_wall_dist_activation': 'elu', 'left_wall_dist_out_channels_l0': 86, 'left_wall_dist_pool_size_l0': 2, 'left_wall_dist_out_channels_l1': 190, 'left_wall_dist_pool_size_l1': 2, 'left_wall_dist_out_channels_l2': 37, 'left_wall_dist_pool_size_l2': 4, 'left_wall_dist_out_channels_l3': 76, 'left_wall_dist_pool_size_l3': 8, 'left_wall_dist_out_channels_l4': 38, 'left_wall_dist_pool_size_l4': 2, 'track_width_num_layers': 2, 'track_width_activation': 'elu', 'track_width_out_channels_l0': 171, 'track_width_pool_size_l0': 4, 'track_width_out_channels_l1': 77, 'track_width_pool_size_l1': 2, 'heading_error_num_layers': 4, 'heading_error_activation': 'elu', 'heading_error_out_channels_l0': 146, 'heading_error_pool_size_l0': 8, 'heading_error_out_channels_l1': 101, 'heading_error_pool_size_l1': 8, 'heading_error_out_channels_l2': 97, 'heading_error_pool_size_l2': 2, 'heading_error_out_channels_l3': 56, 'heading_error_pool_size_l3': 8, 'heading_error_fc_hidden': 38}. Best is trial 34 with value: 0.10282.
[rank: 0] Seed set to 42
[rank: 0] Seed set to 42
[rank: 0] Seed set to 42
GPU available: True (cuda), used: True
TPU available: False, using: 0 TPU cores
💡 Tip: For seamless cloud logging and experiment tracking, try installing [litlogger](https://pypi.org/project/litlogger/) to enable LitLogger, which logs metrics and artifacts automatically to the Lightning Experiments platform.
GPU available: True (cuda), used: True
TPU available: False, using: 0 TPU cores
💡 Tip: For seamless cloud logging and experiment tracking, try installing [litlogger](https://pypi.org/project/litlogger/) to enable LitLogger, which logs metrics and artifacts automatically to the Lightning Experiments platform.
GPU available: True (cuda), used: True
TPU available: False, using: 0 TPU cores
💡 Tip: For seamless cloud logging and experiment tracking, try installing [litlogger](https://pypi.org/project/litlogger/) to enable LitLogger, which logs metrics and artifacts automatically to the Lightning Experiments platform.
/nas/longleaf/home/zayah/f1tenth_ng_zc/.venv/lib/python3.12/site-packages/lightning/pytorch/callbacks/model_checkpoint.py:881: Checkpoint directory /nas/longleaf/home/zayah/f1tenth_ng_zc/data/models/checkpoints/track_width_arch8 exists and is not empty.
LOCAL_RANK: 0 - CUDA_VISIBLE_DEVICES: [0]
/nas/longleaf/home/zayah/f1tenth_ng_zc/.venv/lib/python3.12/site-packages/lightning/pytorch/callbacks/model_checkpoint.py:881: Checkpoint directory /nas/longleaf/home/zayah/f1tenth_ng_zc/data/models/checkpoints/heading_error_arch8 exists and is not empty.
LOCAL_RANK: 0 - CUDA_VISIBLE_DEVICES: [0]
/nas/longleaf/home/zayah/f1tenth_ng_zc/.venv/lib/python3.12/site-packages/lightning/pytorch/callbacks/model_checkpoint.py:881: Checkpoint directory /nas/longleaf/home/zayah/f1tenth_ng_zc/data/models/checkpoints/left_wall_dist_arch8 exists and is not empty.
LOCAL_RANK: 0 - CUDA_VISIBLE_DEVICES: [0]
SLURM auto-requeueing enabled. Setting signal handlers.
SLURM auto-requeueing enabled. Setting signal handlers.
SLURM auto-requeueing enabled. Setting signal handlers.
`Trainer.fit` stopped: `max_epochs=20` reached.
`Trainer.fit` stopped: `max_epochs=20` reached.
`Trainer.fit` stopped: `max_epochs=20` reached.
