[I 2026-04-11 18:28:27,507] Trial 62 finished with value: 0.13364 and parameters: {'left_wall_dist_num_layers': 4, 'left_wall_dist_activation': 'elu', 'left_wall_dist_out_channels_l0': 168, 'left_wall_dist_pool_size_l0': 4, 'left_wall_dist_out_channels_l1': 170, 'left_wall_dist_pool_size_l1': 4, 'left_wall_dist_out_channels_l2': 52, 'left_wall_dist_pool_size_l2': 8, 'left_wall_dist_out_channels_l3': 32, 'left_wall_dist_pool_size_l3': 2, 'track_width_num_layers': 4, 'track_width_activation': 'relu', 'track_width_out_channels_l0': 102, 'track_width_pool_size_l0': 8, 'track_width_out_channels_l1': 34, 'track_width_pool_size_l1': 8, 'track_width_out_channels_l2': 208, 'track_width_pool_size_l2': 2, 'track_width_out_channels_l3': 200, 'track_width_pool_size_l3': 4, 'track_width_fc_hidden': 50, 'heading_error_num_layers': 4, 'heading_error_activation': 'elu', 'heading_error_out_channels_l0': 250, 'heading_error_pool_size_l0': 2, 'heading_error_out_channels_l1': 96, 'heading_error_pool_size_l1': 2, 'heading_error_out_channels_l2': 108, 'heading_error_pool_size_l2': 8, 'heading_error_out_channels_l3': 72, 'heading_error_pool_size_l3': 4, 'heading_error_fc_hidden': 86}. Best is trial 59 with value: 0.11208.
[rank: 0] Seed set to 42
[rank: 0] Seed set to 42
[rank: 0] Seed set to 42
GPU available: True (cuda), used: True
TPU available: False, using: 0 TPU cores
💡 Tip: For seamless cloud logging and experiment tracking, try installing [litlogger](https://pypi.org/project/litlogger/) to enable LitLogger, which logs metrics and artifacts automatically to the Lightning Experiments platform.
GPU available: True (cuda), used: True
TPU available: False, using: 0 TPU cores
💡 Tip: For seamless cloud logging and experiment tracking, try installing [litlogger](https://pypi.org/project/litlogger/) to enable LitLogger, which logs metrics and artifacts automatically to the Lightning Experiments platform.
GPU available: True (cuda), used: True
TPU available: False, using: 0 TPU cores
💡 Tip: For seamless cloud logging and experiment tracking, try installing [litlogger](https://pypi.org/project/litlogger/) to enable LitLogger, which logs metrics and artifacts automatically to the Lightning Experiments platform.
/nas/longleaf/home/zayah/f1tenth_ng_zc/.venv/lib/python3.12/site-packages/lightning/pytorch/callbacks/model_checkpoint.py:881: Checkpoint directory /nas/longleaf/home/zayah/f1tenth_ng_zc/data/models/checkpoints/heading_error_arch8 exists and is not empty.
LOCAL_RANK: 0 - CUDA_VISIBLE_DEVICES: [0]
/nas/longleaf/home/zayah/f1tenth_ng_zc/.venv/lib/python3.12/site-packages/lightning/pytorch/callbacks/model_checkpoint.py:881: Checkpoint directory /nas/longleaf/home/zayah/f1tenth_ng_zc/data/models/checkpoints/track_width_arch8 exists and is not empty.
LOCAL_RANK: 0 - CUDA_VISIBLE_DEVICES: [0]
/nas/longleaf/home/zayah/f1tenth_ng_zc/.venv/lib/python3.12/site-packages/lightning/pytorch/callbacks/model_checkpoint.py:881: Checkpoint directory /nas/longleaf/home/zayah/f1tenth_ng_zc/data/models/checkpoints/left_wall_dist_arch8 exists and is not empty.
LOCAL_RANK: 0 - CUDA_VISIBLE_DEVICES: [0]
SLURM auto-requeueing enabled. Setting signal handlers.
SLURM auto-requeueing enabled. Setting signal handlers.
SLURM auto-requeueing enabled. Setting signal handlers.
`Trainer.fit` stopped: `max_epochs=20` reached.
`Trainer.fit` stopped: `max_epochs=20` reached.
`Trainer.fit` stopped: `max_epochs=20` reached.
[I 2026-04-11 18:32:34,506] Trial 63 finished with value: 0.12772 and parameters: {'left_wall_dist_num_layers': 4, 'left_wall_dist_activation': 'elu', 'left_wall_dist_out_channels_l0': 204, 'left_wall_dist_pool_size_l0': 4, 'left_wall_dist_out_channels_l1': 122, 'left_wall_dist_pool_size_l1': 4, 'left_wall_dist_out_channels_l2': 61, 'left_wall_dist_pool_size_l2': 8, 'left_wall_dist_out_channels_l3': 45, 'left_wall_dist_pool_size_l3': 2, 'left_wall_dist_fc_hidden': 32, 'track_width_num_layers': 4, 'track_width_activation': 'relu', 'track_width_out_channels_l0': 51, 'track_width_pool_size_l0': 8, 'track_width_out_channels_l1': 33, 'track_width_pool_size_l1': 8, 'track_width_out_channels_l2': 223, 'track_width_pool_size_l2': 2, 'track_width_out_channels_l3': 147, 'track_width_pool_size_l3': 4, 'track_width_fc_hidden': 52, 'heading_error_num_layers': 4, 'heading_error_activation': 'elu', 'heading_error_out_channels_l0': 231, 'heading_error_pool_size_l0': 2, 'heading_error_out_channels_l1': 68, 'heading_error_pool_size_l1': 2, 'heading_error_out_channels_l2': 135, 'heading_error_pool_size_l2': 8, 'heading_error_out_channels_l3': 101, 'heading_error_pool_size_l3': 4, 'heading_error_fc_hidden': 89}. Best is trial 59 with value: 0.11208.
[rank: 0] Seed set to 42
[rank: 0] Seed set to 42
[rank: 0] Seed set to 42
GPU available: True (cuda), used: True
TPU available: False, using: 0 TPU cores
GPU available: True (cuda), used: True
TPU available: False, using: 0 TPU cores
💡 Tip: For seamless cloud logging and experiment tracking, try installing [litlogger](https://pypi.org/project/litlogger/) to enable LitLogger, which logs metrics and artifacts automatically to the Lightning Experiments platform.
💡 Tip: For seamless cloud logging and experiment tracking, try installing [litlogger](https://pypi.org/project/litlogger/) to enable LitLogger, which logs metrics and artifacts automatically to the Lightning Experiments platform.
GPU available: True (cuda), used: True
TPU available: False, using: 0 TPU cores
💡 Tip: For seamless cloud logging and experiment tracking, try installing [litlogger](https://pypi.org/project/litlogger/) to enable LitLogger, which logs metrics and artifacts automatically to the Lightning Experiments platform.
/nas/longleaf/home/zayah/f1tenth_ng_zc/.venv/lib/python3.12/site-packages/lightning/pytorch/callbacks/model_checkpoint.py:881: Checkpoint directory /nas/longleaf/home/zayah/f1tenth_ng_zc/data/models/checkpoints/left_wall_dist_arch8 exists and is not empty.
/nas/longleaf/home/zayah/f1tenth_ng_zc/.venv/lib/python3.12/site-packages/lightning/pytorch/callbacks/model_checkpoint.py:881: Checkpoint directory /nas/longleaf/home/zayah/f1tenth_ng_zc/data/models/checkpoints/track_width_arch8 exists and is not empty.
LOCAL_RANK: 0 - CUDA_VISIBLE_DEVICES: [0]
LOCAL_RANK: 0 - CUDA_VISIBLE_DEVICES: [0]
/nas/longleaf/home/zayah/f1tenth_ng_zc/.venv/lib/python3.12/site-packages/lightning/pytorch/callbacks/model_checkpoint.py:881: Checkpoint directory /nas/longleaf/home/zayah/f1tenth_ng_zc/data/models/checkpoints/heading_error_arch8 exists and is not empty.
LOCAL_RANK: 0 - CUDA_VISIBLE_DEVICES: [0]
SLURM auto-requeueing enabled. Setting signal handlers.
SLURM auto-requeueing enabled. Setting signal handlers.
SLURM auto-requeueing enabled. Setting signal handlers.
`Trainer.fit` stopped: `max_epochs=20` reached.
`Trainer.fit` stopped: `max_epochs=20` reached.
`Trainer.fit` stopped: `max_epochs=20` reached.
[I 2026-04-11 18:36:49,303] Trial 64 finished with value: 0.11878 and parameters: {'left_wall_dist_num_layers': 4, 'left_wall_dist_activation': 'elu', 'left_wall_dist_out_channels_l0': 206, 'left_wall_dist_pool_size_l0': 4, 'left_wall_dist_out_channels_l1': 146, 'left_wall_dist_pool_size_l1': 4, 'left_wall_dist_out_channels_l2': 59, 'left_wall_dist_pool_size_l2': 8, 'left_wall_dist_out_channels_l3': 45, 'left_wall_dist_pool_size_l3': 2, 'left_wall_dist_fc_hidden': 32, 'track_width_num_layers': 4, 'track_width_activation': 'relu', 'track_width_out_channels_l0': 44, 'track_width_pool_size_l0': 8, 'track_width_out_channels_l1': 33, 'track_width_pool_size_l1': 8, 'track_width_out_channels_l2': 224, 'track_width_pool_size_l2': 2, 'track_width_out_channels_l3': 121, 'track_width_pool_size_l3': 4, 'track_width_fc_hidden': 53, 'heading_error_num_layers': 4, 'heading_error_activation': 'elu', 'heading_error_out_channels_l0': 222, 'heading_error_pool_size_l0': 2, 'heading_error_out_channels_l1': 70, 'heading_error_pool_size_l1': 2, 'heading_error_out_channels_l2': 127, 'heading_error_pool_size_l2': 8, 'heading_error_out_channels_l3': 102, 'heading_error_pool_size_l3': 4, 'heading_error_fc_hidden': 72}. Best is trial 59 with value: 0.11208.
[rank: 0] Seed set to 42
[rank: 0] Seed set to 42
[rank: 0] Seed set to 42
GPU available: True (cuda), used: True
TPU available: False, using: 0 TPU cores
GPU available: True (cuda), used: True
TPU available: False, using: 0 TPU cores
💡 Tip: For seamless cloud logging and experiment tracking, try installing [litlogger](https://pypi.org/project/litlogger/) to enable LitLogger, which logs metrics and artifacts automatically to the Lightning Experiments platform.
💡 Tip: For seamless cloud logging and experiment tracking, try installing [litlogger](https://pypi.org/project/litlogger/) to enable LitLogger, which logs metrics and artifacts automatically to the Lightning Experiments platform.
GPU available: True (cuda), used: True
TPU available: False, using: 0 TPU cores
💡 Tip: For seamless cloud logging and experiment tracking, try installing [litlogger](https://pypi.org/project/litlogger/) to enable LitLogger, which logs metrics and artifacts automatically to the Lightning Experiments platform.
/nas/longleaf/home/zayah/f1tenth_ng_zc/.venv/lib/python3.12/site-packages/lightning/pytorch/callbacks/model_checkpoint.py:881: Checkpoint directory /nas/longleaf/home/zayah/f1tenth_ng_zc/data/models/checkpoints/track_width_arch8 exists and is not empty.
LOCAL_RANK: 0 - CUDA_VISIBLE_DEVICES: [0]
/nas/longleaf/home/zayah/f1tenth_ng_zc/.venv/lib/python3.12/site-packages/lightning/pytorch/callbacks/model_checkpoint.py:881: Checkpoint directory /nas/longleaf/home/zayah/f1tenth_ng_zc/data/models/checkpoints/left_wall_dist_arch8 exists and is not empty.
/nas/longleaf/home/zayah/f1tenth_ng_zc/.venv/lib/python3.12/site-packages/lightning/pytorch/callbacks/model_checkpoint.py:881: Checkpoint directory /nas/longleaf/home/zayah/f1tenth_ng_zc/data/models/checkpoints/heading_error_arch8 exists and is not empty.
LOCAL_RANK: 0 - CUDA_VISIBLE_DEVICES: [0]
LOCAL_RANK: 0 - CUDA_VISIBLE_DEVICES: [0]
SLURM auto-requeueing enabled. Setting signal handlers.
SLURM auto-requeueing enabled. Setting signal handlers.
SLURM auto-requeueing enabled. Setting signal handlers.
`Trainer.fit` stopped: `max_epochs=20` reached.
`Trainer.fit` stopped: `max_epochs=20` reached.
`Trainer.fit` stopped: `max_epochs=20` reached.
[I 2026-04-11 18:41:24,740] Trial 65 finished with value: 0.16776 and parameters: {'left_wall_dist_num_layers': 4, 'left_wall_dist_activation': 'elu', 'left_wall_dist_out_channels_l0': 118, 'left_wall_dist_pool_size_l0': 2, 'left_wall_dist_out_channels_l1': 144, 'left_wall_dist_pool_size_l1': 4, 'left_wall_dist_out_channels_l2': 60, 'left_wall_dist_pool_size_l2': 8, 'left_wall_dist_out_channels_l3': 44, 'left_wall_dist_pool_size_l3': 2, 'left_wall_dist_fc_hidden': 37, 'track_width_num_layers': 5, 'track_width_activation': 'relu', 'track_width_out_channels_l0': 40, 'track_width_pool_size_l0': 8, 'track_width_out_channels_l1': 34, 'track_width_pool_size_l1': 8, 'track_width_out_channels_l2': 219, 'track_width_pool_size_l2': 4, 'track_width_out_channels_l3': 247, 'track_width_pool_size_l3': 4, 'track_width_fc_hidden': 51, 'heading_error_num_layers': 4, 'heading_error_activation': 'elu', 'heading_error_out_channels_l0': 226, 'heading_error_pool_size_l0': 2, 'heading_error_out_channels_l1': 69, 'heading_error_pool_size_l1': 2, 'heading_error_out_channels_l2': 134, 'heading_error_pool_size_l2': 8, 'heading_error_out_channels_l3': 102, 'heading_error_pool_size_l3': 4, 'heading_error_fc_hidden': 82}. Best is trial 59 with value: 0.11208.
[rank: 0] Seed set to 42
[rank: 0] Seed set to 42
[rank: 0] Seed set to 42
GPU available: True (cuda), used: True
TPU available: False, using: 0 TPU cores
GPU available: True (cuda), used: True
GPU available: True (cuda), used: True
TPU available: False, using: 0 TPU cores
TPU available: False, using: 0 TPU cores
💡 Tip: For seamless cloud logging and experiment tracking, try installing [litlogger](https://pypi.org/project/litlogger/) to enable LitLogger, which logs metrics and artifacts automatically to the Lightning Experiments platform.
💡 Tip: For seamless cloud logging and experiment tracking, try installing [litlogger](https://pypi.org/project/litlogger/) to enable LitLogger, which logs metrics and artifacts automatically to the Lightning Experiments platform.
💡 Tip: For seamless cloud logging and experiment tracking, try installing [litlogger](https://pypi.org/project/litlogger/) to enable LitLogger, which logs metrics and artifacts automatically to the Lightning Experiments platform.
/nas/longleaf/home/zayah/f1tenth_ng_zc/.venv/lib/python3.12/site-packages/lightning/pytorch/callbacks/model_checkpoint.py:881: Checkpoint directory /nas/longleaf/home/zayah/f1tenth_ng_zc/data/models/checkpoints/track_width_arch8 exists and is not empty.
LOCAL_RANK: 0 - CUDA_VISIBLE_DEVICES: [0]
/nas/longleaf/home/zayah/f1tenth_ng_zc/.venv/lib/python3.12/site-packages/lightning/pytorch/callbacks/model_checkpoint.py:881: Checkpoint directory /nas/longleaf/home/zayah/f1tenth_ng_zc/data/models/checkpoints/left_wall_dist_arch8 exists and is not empty.
LOCAL_RANK: 0 - CUDA_VISIBLE_DEVICES: [0]
/nas/longleaf/home/zayah/f1tenth_ng_zc/.venv/lib/python3.12/site-packages/lightning/pytorch/callbacks/model_checkpoint.py:881: Checkpoint directory /nas/longleaf/home/zayah/f1tenth_ng_zc/data/models/checkpoints/heading_error_arch8 exists and is not empty.
LOCAL_RANK: 0 - CUDA_VISIBLE_DEVICES: [0]
SLURM auto-requeueing enabled. Setting signal handlers.
SLURM auto-requeueing enabled. Setting signal handlers.
SLURM auto-requeueing enabled. Setting signal handlers.
`Trainer.fit` stopped: `max_epochs=20` reached.
`Trainer.fit` stopped: `max_epochs=20` reached.
`Trainer.fit` stopped: `max_epochs=20` reached.
