[I 2026-04-09 21:15:15,851] Trial 6 finished with value: 0.4974 and parameters: {'left_wall_dist_num_layers': 5, 'left_wall_dist_activation': 'relu', 'left_wall_dist_out_channels_l0': 42, 'left_wall_dist_pool_size_l0': 8, 'left_wall_dist_out_channels_l1': 106, 'left_wall_dist_pool_size_l1': 4, 'left_wall_dist_out_channels_l2': 77, 'left_wall_dist_pool_size_l2': 4, 'left_wall_dist_out_channels_l3': 48, 'left_wall_dist_pool_size_l3': 4, 'track_width_num_layers': 2, 'track_width_activation': 'relu', 'track_width_out_channels_l0': 36, 'track_width_pool_size_l0': 2, 'track_width_out_channels_l1': 97, 'track_width_pool_size_l1': 2, 'heading_error_num_layers': 4, 'heading_error_activation': 'relu', 'heading_error_out_channels_l0': 147, 'heading_error_pool_size_l0': 4, 'heading_error_out_channels_l1': 67, 'heading_error_pool_size_l1': 8, 'heading_error_out_channels_l2': 98, 'heading_error_pool_size_l2': 2, 'heading_error_out_channels_l3': 96, 'heading_error_pool_size_l3': 2, 'heading_error_fc_hidden': 104}. Best is trial 4 with value: 0.1654.
[rank: 0] Seed set to 42
[rank: 0] Seed set to 42
[rank: 0] Seed set to 42
GPU available: True (cuda), used: True
TPU available: False, using: 0 TPU cores
GPU available: True (cuda), used: True
TPU available: False, using: 0 TPU cores
💡 Tip: For seamless cloud logging and experiment tracking, try installing [litlogger](https://pypi.org/project/litlogger/) to enable LitLogger, which logs metrics and artifacts automatically to the Lightning Experiments platform.
💡 Tip: For seamless cloud logging and experiment tracking, try installing [litlogger](https://pypi.org/project/litlogger/) to enable LitLogger, which logs metrics and artifacts automatically to the Lightning Experiments platform.
GPU available: True (cuda), used: True
TPU available: False, using: 0 TPU cores
💡 Tip: For seamless cloud logging and experiment tracking, try installing [litlogger](https://pypi.org/project/litlogger/) to enable LitLogger, which logs metrics and artifacts automatically to the Lightning Experiments platform.
/nas/longleaf/home/zayah/f1tenth_ng_zc/.venv/lib/python3.12/site-packages/lightning/pytorch/callbacks/model_checkpoint.py:881: Checkpoint directory /nas/longleaf/home/zayah/f1tenth_ng_zc/data/models/checkpoints/heading_error_arch8 exists and is not empty.
LOCAL_RANK: 0 - CUDA_VISIBLE_DEVICES: [0]
/nas/longleaf/home/zayah/f1tenth_ng_zc/.venv/lib/python3.12/site-packages/lightning/pytorch/callbacks/model_checkpoint.py:881: Checkpoint directory /nas/longleaf/home/zayah/f1tenth_ng_zc/data/models/checkpoints/left_wall_dist_arch8 exists and is not empty.
/nas/longleaf/home/zayah/f1tenth_ng_zc/.venv/lib/python3.12/site-packages/lightning/pytorch/callbacks/model_checkpoint.py:881: Checkpoint directory /nas/longleaf/home/zayah/f1tenth_ng_zc/data/models/checkpoints/track_width_arch8 exists and is not empty.
LOCAL_RANK: 0 - CUDA_VISIBLE_DEVICES: [0]
LOCAL_RANK: 0 - CUDA_VISIBLE_DEVICES: [0]
SLURM auto-requeueing enabled. Setting signal handlers.
SLURM auto-requeueing enabled. Setting signal handlers.
SLURM auto-requeueing enabled. Setting signal handlers.
`Trainer.fit` stopped: `max_epochs=21` reached.
`Trainer.fit` stopped: `max_epochs=21` reached.
`Trainer.fit` stopped: `max_epochs=21` reached.
[I 2026-04-09 21:17:47,891] Trial 7 finished with value: 0.3474 and parameters: {'left_wall_dist_num_layers': 4, 'left_wall_dist_activation': 'elu', 'left_wall_dist_out_channels_l0': 32, 'left_wall_dist_pool_size_l0': 4, 'left_wall_dist_out_channels_l1': 195, 'left_wall_dist_pool_size_l1': 8, 'left_wall_dist_out_channels_l2': 79, 'left_wall_dist_pool_size_l2': 4, 'left_wall_dist_out_channels_l3': 34, 'left_wall_dist_pool_size_l3': 4, 'track_width_num_layers': 5, 'track_width_activation': 'elu', 'track_width_out_channels_l0': 69, 'track_width_pool_size_l0': 2, 'track_width_out_channels_l1': 207, 'track_width_pool_size_l1': 8, 'track_width_out_channels_l2': 217, 'track_width_pool_size_l2': 4, 'track_width_out_channels_l3': 128, 'track_width_pool_size_l3': 8, 'track_width_fc_hidden': 38, 'heading_error_num_layers': 4, 'heading_error_activation': 'elu', 'heading_error_out_channels_l0': 245, 'heading_error_pool_size_l0': 2, 'heading_error_out_channels_l1': 67, 'heading_error_pool_size_l1': 8, 'heading_error_out_channels_l2': 95, 'heading_error_pool_size_l2': 8, 'heading_error_out_channels_l3': 74, 'heading_error_pool_size_l3': 2, 'heading_error_fc_hidden': 36}. Best is trial 4 with value: 0.1654.
[rank: 0] Seed set to 42
[rank: 0] Seed set to 42
[rank: 0] Seed set to 42
GPU available: True (cuda), used: True
GPU available: True (cuda), used: True
TPU available: False, using: 0 TPU cores
GPU available: True (cuda), used: True
TPU available: False, using: 0 TPU cores
TPU available: False, using: 0 TPU cores
💡 Tip: For seamless cloud logging and experiment tracking, try installing [litlogger](https://pypi.org/project/litlogger/) to enable LitLogger, which logs metrics and artifacts automatically to the Lightning Experiments platform.
💡 Tip: For seamless cloud logging and experiment tracking, try installing [litlogger](https://pypi.org/project/litlogger/) to enable LitLogger, which logs metrics and artifacts automatically to the Lightning Experiments platform.
💡 Tip: For seamless cloud logging and experiment tracking, try installing [litlogger](https://pypi.org/project/litlogger/) to enable LitLogger, which logs metrics and artifacts automatically to the Lightning Experiments platform.
/nas/longleaf/home/zayah/f1tenth_ng_zc/.venv/lib/python3.12/site-packages/lightning/pytorch/callbacks/model_checkpoint.py:881: Checkpoint directory /nas/longleaf/home/zayah/f1tenth_ng_zc/data/models/checkpoints/heading_error_arch8 exists and is not empty.
LOCAL_RANK: 0 - CUDA_VISIBLE_DEVICES: [0]
/nas/longleaf/home/zayah/f1tenth_ng_zc/.venv/lib/python3.12/site-packages/lightning/pytorch/callbacks/model_checkpoint.py:881: Checkpoint directory /nas/longleaf/home/zayah/f1tenth_ng_zc/data/models/checkpoints/track_width_arch8 exists and is not empty.
LOCAL_RANK: 0 - CUDA_VISIBLE_DEVICES: [0]
/nas/longleaf/home/zayah/f1tenth_ng_zc/.venv/lib/python3.12/site-packages/lightning/pytorch/callbacks/model_checkpoint.py:881: Checkpoint directory /nas/longleaf/home/zayah/f1tenth_ng_zc/data/models/checkpoints/left_wall_dist_arch8 exists and is not empty.
LOCAL_RANK: 0 - CUDA_VISIBLE_DEVICES: [0]
SLURM auto-requeueing enabled. Setting signal handlers.
SLURM auto-requeueing enabled. Setting signal handlers.
SLURM auto-requeueing enabled. Setting signal handlers.
`Trainer.fit` stopped: `max_epochs=21` reached.
`Trainer.fit` stopped: `max_epochs=21` reached.
`Trainer.fit` stopped: `max_epochs=21` reached.
[I 2026-04-09 21:19:20,772] Trial 8 finished with value: 0.4762 and parameters: {'left_wall_dist_num_layers': 4, 'left_wall_dist_activation': 'relu', 'left_wall_dist_out_channels_l0': 83, 'left_wall_dist_pool_size_l0': 4, 'left_wall_dist_out_channels_l1': 40, 'left_wall_dist_pool_size_l1': 2, 'left_wall_dist_out_channels_l2': 63, 'left_wall_dist_pool_size_l2': 8, 'left_wall_dist_out_channels_l3': 132, 'left_wall_dist_pool_size_l3': 8, 'track_width_num_layers': 3, 'track_width_activation': 'elu', 'track_width_out_channels_l0': 42, 'track_width_pool_size_l0': 2, 'track_width_out_channels_l1': 45, 'track_width_pool_size_l1': 8, 'track_width_out_channels_l2': 38, 'track_width_pool_size_l2': 4, 'track_width_fc_hidden': 101, 'heading_error_num_layers': 5, 'heading_error_activation': 'relu', 'heading_error_out_channels_l0': 249, 'heading_error_pool_size_l0': 2, 'heading_error_out_channels_l1': 48, 'heading_error_pool_size_l1': 2, 'heading_error_out_channels_l2': 39, 'heading_error_pool_size_l2': 8, 'heading_error_out_channels_l3': 81, 'heading_error_pool_size_l3': 4, 'heading_error_out_channels_l4': 164, 'heading_error_pool_size_l4': 8, 'heading_error_fc_hidden': 81}. Best is trial 4 with value: 0.1654.
[rank: 0] Seed set to 42
[rank: 0] Seed set to 42
[rank: 0] Seed set to 42
GPU available: True (cuda), used: True
GPU available: True (cuda), used: True
TPU available: False, using: 0 TPU cores
TPU available: False, using: 0 TPU cores
GPU available: True (cuda), used: True
TPU available: False, using: 0 TPU cores
💡 Tip: For seamless cloud logging and experiment tracking, try installing [litlogger](https://pypi.org/project/litlogger/) to enable LitLogger, which logs metrics and artifacts automatically to the Lightning Experiments platform.
💡 Tip: For seamless cloud logging and experiment tracking, try installing [litlogger](https://pypi.org/project/litlogger/) to enable LitLogger, which logs metrics and artifacts automatically to the Lightning Experiments platform.
💡 Tip: For seamless cloud logging and experiment tracking, try installing [litlogger](https://pypi.org/project/litlogger/) to enable LitLogger, which logs metrics and artifacts automatically to the Lightning Experiments platform.
/nas/longleaf/home/zayah/f1tenth_ng_zc/.venv/lib/python3.12/site-packages/lightning/pytorch/callbacks/model_checkpoint.py:881: Checkpoint directory /nas/longleaf/home/zayah/f1tenth_ng_zc/data/models/checkpoints/heading_error_arch8 exists and is not empty.
/nas/longleaf/home/zayah/f1tenth_ng_zc/.venv/lib/python3.12/site-packages/lightning/pytorch/callbacks/model_checkpoint.py:881: Checkpoint directory /nas/longleaf/home/zayah/f1tenth_ng_zc/data/models/checkpoints/left_wall_dist_arch8 exists and is not empty.
LOCAL_RANK: 0 - CUDA_VISIBLE_DEVICES: [0]
LOCAL_RANK: 0 - CUDA_VISIBLE_DEVICES: [0]
/nas/longleaf/home/zayah/f1tenth_ng_zc/.venv/lib/python3.12/site-packages/lightning/pytorch/callbacks/model_checkpoint.py:881: Checkpoint directory /nas/longleaf/home/zayah/f1tenth_ng_zc/data/models/checkpoints/track_width_arch8 exists and is not empty.
LOCAL_RANK: 0 - CUDA_VISIBLE_DEVICES: [0]
SLURM auto-requeueing enabled. Setting signal handlers.
SLURM auto-requeueing enabled. Setting signal handlers.
SLURM auto-requeueing enabled. Setting signal handlers.
`Trainer.fit` stopped: `max_epochs=21` reached.
`Trainer.fit` stopped: `max_epochs=21` reached.
`Trainer.fit` stopped: `max_epochs=21` reached.
[I 2026-04-09 21:22:36,261] Trial 9 finished with value: 0.3067 and parameters: {'left_wall_dist_num_layers': 5, 'left_wall_dist_activation': 'elu', 'left_wall_dist_out_channels_l0': 165, 'left_wall_dist_pool_size_l0': 8, 'left_wall_dist_out_channels_l1': 72, 'left_wall_dist_pool_size_l1': 2, 'left_wall_dist_out_channels_l2': 77, 'left_wall_dist_pool_size_l2': 4, 'left_wall_dist_out_channels_l3': 97, 'left_wall_dist_pool_size_l3': 2, 'left_wall_dist_out_channels_l4': 206, 'left_wall_dist_pool_size_l4': 4, 'track_width_num_layers': 5, 'track_width_activation': 'elu', 'track_width_out_channels_l0': 164, 'track_width_pool_size_l0': 4, 'track_width_out_channels_l1': 216, 'track_width_pool_size_l1': 8, 'track_width_out_channels_l2': 33, 'track_width_pool_size_l2': 4, 'track_width_out_channels_l3': 39, 'track_width_pool_size_l3': 4, 'heading_error_num_layers': 4, 'heading_error_activation': 'relu', 'heading_error_out_channels_l0': 47, 'heading_error_pool_size_l0': 4, 'heading_error_out_channels_l1': 95, 'heading_error_pool_size_l1': 4, 'heading_error_out_channels_l2': 62, 'heading_error_pool_size_l2': 8, 'heading_error_out_channels_l3': 93, 'heading_error_pool_size_l3': 4}. Best is trial 4 with value: 0.1654.
[rank: 0] Seed set to 42
[rank: 0] Seed set to 42
[rank: 0] Seed set to 42
GPU available: True (cuda), used: True
TPU available: False, using: 0 TPU cores
GPU available: True (cuda), used: True
TPU available: False, using: 0 TPU cores
💡 Tip: For seamless cloud logging and experiment tracking, try installing [litlogger](https://pypi.org/project/litlogger/) to enable LitLogger, which logs metrics and artifacts automatically to the Lightning Experiments platform.
💡 Tip: For seamless cloud logging and experiment tracking, try installing [litlogger](https://pypi.org/project/litlogger/) to enable LitLogger, which logs metrics and artifacts automatically to the Lightning Experiments platform.
GPU available: True (cuda), used: True
TPU available: False, using: 0 TPU cores
💡 Tip: For seamless cloud logging and experiment tracking, try installing [litlogger](https://pypi.org/project/litlogger/) to enable LitLogger, which logs metrics and artifacts automatically to the Lightning Experiments platform.
/nas/longleaf/home/zayah/f1tenth_ng_zc/.venv/lib/python3.12/site-packages/lightning/pytorch/callbacks/model_checkpoint.py:881: Checkpoint directory /nas/longleaf/home/zayah/f1tenth_ng_zc/data/models/checkpoints/heading_error_arch8 exists and is not empty.
LOCAL_RANK: 0 - CUDA_VISIBLE_DEVICES: [0]
/nas/longleaf/home/zayah/f1tenth_ng_zc/.venv/lib/python3.12/site-packages/lightning/pytorch/callbacks/model_checkpoint.py:881: Checkpoint directory /nas/longleaf/home/zayah/f1tenth_ng_zc/data/models/checkpoints/left_wall_dist_arch8 exists and is not empty.
LOCAL_RANK: 0 - CUDA_VISIBLE_DEVICES: [0]
/nas/longleaf/home/zayah/f1tenth_ng_zc/.venv/lib/python3.12/site-packages/lightning/pytorch/callbacks/model_checkpoint.py:881: Checkpoint directory /nas/longleaf/home/zayah/f1tenth_ng_zc/data/models/checkpoints/track_width_arch8 exists and is not empty.
LOCAL_RANK: 0 - CUDA_VISIBLE_DEVICES: [0]
SLURM auto-requeueing enabled. Setting signal handlers.
SLURM auto-requeueing enabled. Setting signal handlers.
SLURM auto-requeueing enabled. Setting signal handlers.
`Trainer.fit` stopped: `max_epochs=21` reached.
`Trainer.fit` stopped: `max_epochs=21` reached.
`Trainer.fit` stopped: `max_epochs=21` reached.
[I 2026-04-09 21:24:57,521] Trial 10 finished with value: 0.1519 and parameters: {'left_wall_dist_num_layers': 3, 'left_wall_dist_activation': 'relu', 'left_wall_dist_out_channels_l0': 128, 'left_wall_dist_pool_size_l0': 2, 'left_wall_dist_out_channels_l1': 138, 'left_wall_dist_pool_size_l1': 8, 'left_wall_dist_out_channels_l2': 226, 'left_wall_dist_pool_size_l2': 8, 'left_wall_dist_fc_hidden': 32, 'track_width_num_layers': 4, 'track_width_activation': 'relu', 'track_width_out_channels_l0': 189, 'track_width_pool_size_l0': 8, 'track_width_out_channels_l1': 68, 'track_width_pool_size_l1': 4, 'track_width_out_channels_l2': 238, 'track_width_pool_size_l2': 2, 'track_width_out_channels_l3': 245, 'track_width_pool_size_l3': 2, 'track_width_fc_hidden': 52, 'heading_error_num_layers': 2, 'heading_error_activation': 'elu', 'heading_error_out_channels_l0': 69, 'heading_error_pool_size_l0': 8, 'heading_error_out_channels_l1': 34, 'heading_error_pool_size_l1': 4, 'heading_error_fc_hidden': 125}. Best is trial 10 with value: 0.1519.
[rank: 0] Seed set to 42
[rank: 0] Seed set to 42
[rank: 0] Seed set to 42
GPU available: True (cuda), used: True
TPU available: False, using: 0 TPU cores
💡 Tip: For seamless cloud logging and experiment tracking, try installing [litlogger](https://pypi.org/project/litlogger/) to enable LitLogger, which logs metrics and artifacts automatically to the Lightning Experiments platform.
GPU available: True (cuda), used: True
TPU available: False, using: 0 TPU cores
💡 Tip: For seamless cloud logging and experiment tracking, try installing [litlogger](https://pypi.org/project/litlogger/) to enable LitLogger, which logs metrics and artifacts automatically to the Lightning Experiments platform.
GPU available: True (cuda), used: True
TPU available: False, using: 0 TPU cores
💡 Tip: For seamless cloud logging and experiment tracking, try installing [litlogger](https://pypi.org/project/litlogger/) to enable LitLogger, which logs metrics and artifacts automatically to the Lightning Experiments platform.
/nas/longleaf/home/zayah/f1tenth_ng_zc/.venv/lib/python3.12/site-packages/lightning/pytorch/callbacks/model_checkpoint.py:881: Checkpoint directory /nas/longleaf/home/zayah/f1tenth_ng_zc/data/models/checkpoints/heading_error_arch8 exists and is not empty.
/nas/longleaf/home/zayah/f1tenth_ng_zc/.venv/lib/python3.12/site-packages/lightning/pytorch/callbacks/model_checkpoint.py:881: Checkpoint directory /nas/longleaf/home/zayah/f1tenth_ng_zc/data/models/checkpoints/left_wall_dist_arch8 exists and is not empty.
LOCAL_RANK: 0 - CUDA_VISIBLE_DEVICES: [0]
LOCAL_RANK: 0 - CUDA_VISIBLE_DEVICES: [0]
/nas/longleaf/home/zayah/f1tenth_ng_zc/.venv/lib/python3.12/site-packages/lightning/pytorch/callbacks/model_checkpoint.py:881: Checkpoint directory /nas/longleaf/home/zayah/f1tenth_ng_zc/data/models/checkpoints/track_width_arch8 exists and is not empty.
LOCAL_RANK: 0 - CUDA_VISIBLE_DEVICES: [0]
SLURM auto-requeueing enabled. Setting signal handlers.
SLURM auto-requeueing enabled. Setting signal handlers.
SLURM auto-requeueing enabled. Setting signal handlers.
`Trainer.fit` stopped: `max_epochs=21` reached.
`Trainer.fit` stopped: `max_epochs=21` reached.
`Trainer.fit` stopped: `max_epochs=21` reached.
[I 2026-04-09 21:27:25,104] Trial 11 finished with value: 0.2053 and parameters: {'left_wall_dist_num_layers': 3, 'left_wall_dist_activation': 'relu', 'left_wall_dist_out_channels_l0': 122, 'left_wall_dist_pool_size_l0': 2, 'left_wall_dist_out_channels_l1': 140, 'left_wall_dist_pool_size_l1': 8, 'left_wall_dist_out_channels_l2': 224, 'left_wall_dist_pool_size_l2': 8, 'left_wall_dist_fc_hidden': 33, 'track_width_num_layers': 4, 'track_width_activation': 'relu', 'track_width_out_channels_l0': 255, 'track_width_pool_size_l0': 8, 'track_width_out_channels_l1': 59, 'track_width_pool_size_l1': 4, 'track_width_out_channels_l2': 248, 'track_width_pool_size_l2': 2, 'track_width_out_channels_l3': 249, 'track_width_pool_size_l3': 2, 'track_width_fc_hidden': 51, 'heading_error_num_layers': 2, 'heading_error_activation': 'elu', 'heading_error_out_channels_l0': 68, 'heading_error_pool_size_l0': 8, 'heading_error_out_channels_l1': 35, 'heading_error_pool_size_l1': 4, 'heading_error_fc_hidden': 127}. Best is trial 10 with value: 0.1519.
[rank: 0] Seed set to 42
[rank: 0] Seed set to 42
[rank: 0] Seed set to 42
GPU available: True (cuda), used: True
TPU available: False, using: 0 TPU cores
GPU available: True (cuda), used: True
TPU available: False, using: 0 TPU cores
💡 Tip: For seamless cloud logging and experiment tracking, try installing [litlogger](https://pypi.org/project/litlogger/) to enable LitLogger, which logs metrics and artifacts automatically to the Lightning Experiments platform.
💡 Tip: For seamless cloud logging and experiment tracking, try installing [litlogger](https://pypi.org/project/litlogger/) to enable LitLogger, which logs metrics and artifacts automatically to the Lightning Experiments platform.
GPU available: True (cuda), used: True
TPU available: False, using: 0 TPU cores
💡 Tip: For seamless cloud logging and experiment tracking, try installing [litlogger](https://pypi.org/project/litlogger/) to enable LitLogger, which logs metrics and artifacts automatically to the Lightning Experiments platform.
/nas/longleaf/home/zayah/f1tenth_ng_zc/.venv/lib/python3.12/site-packages/lightning/pytorch/callbacks/model_checkpoint.py:881: Checkpoint directory /nas/longleaf/home/zayah/f1tenth_ng_zc/data/models/checkpoints/left_wall_dist_arch8 exists and is not empty.
/nas/longleaf/home/zayah/f1tenth_ng_zc/.venv/lib/python3.12/site-packages/lightning/pytorch/callbacks/model_checkpoint.py:881: Checkpoint directory /nas/longleaf/home/zayah/f1tenth_ng_zc/data/models/checkpoints/track_width_arch8 exists and is not empty.
LOCAL_RANK: 0 - CUDA_VISIBLE_DEVICES: [0]
LOCAL_RANK: 0 - CUDA_VISIBLE_DEVICES: [0]
/nas/longleaf/home/zayah/f1tenth_ng_zc/.venv/lib/python3.12/site-packages/lightning/pytorch/callbacks/model_checkpoint.py:881: Checkpoint directory /nas/longleaf/home/zayah/f1tenth_ng_zc/data/models/checkpoints/heading_error_arch8 exists and is not empty.
LOCAL_RANK: 0 - CUDA_VISIBLE_DEVICES: [0]
SLURM auto-requeueing enabled. Setting signal handlers.
SLURM auto-requeueing enabled. Setting signal handlers.
SLURM auto-requeueing enabled. Setting signal handlers.
`Trainer.fit` stopped: `max_epochs=21` reached.
`Trainer.fit` stopped: `max_epochs=21` reached.
`Trainer.fit` stopped: `max_epochs=21` reached.
