[I 2026-04-23 20:23:02,054] Trial 34 finished with value: 0.0992 and parameters: {'left_wall_dist_num_layers': 3, 'left_wall_dist_activation': 'relu', 'left_wall_dist_max_flattened': 4288, 'left_wall_dist_fc_hidden': 128, 'left_wall_dist_pool_size_l0': 8, 'left_wall_dist_out_channels_l0': 18, 'left_wall_dist_pool_size_l1': 4, 'left_wall_dist_out_channels_l1': 22, 'left_wall_dist_pool_size_l2': 2, 'left_wall_dist_out_channels_l2': 8, 'track_width_num_layers': 3, 'track_width_activation': 'elu', 'track_width_max_flattened': 1072, 'track_width_fc_hidden': 64, 'track_width_pool_size_l0': 2, 'heading_error_num_layers': 1, 'heading_error_activation': 'elu', 'heading_error_max_flattened': 1072, 'heading_error_fc_hidden': 64, 'heading_error_pool_size_l0': 8, 'heading_error_out_channels_l0': 8}. Best is trial 17 with value: 0.0921.
[rank: 0] Seed set to 42
[rank: 0] Seed set to 42
[rank: 0] Seed set to 42
GPU available: True (cuda), used: True
TPU available: False, using: 0 TPU cores
💡 Tip: For seamless cloud logging and experiment tracking, try installing [litlogger](https://pypi.org/project/litlogger/) to enable LitLogger, which logs metrics and artifacts automatically to the Lightning Experiments platform.
GPU available: True (cuda), used: True
TPU available: False, using: 0 TPU cores
💡 Tip: For seamless cloud logging and experiment tracking, try installing [litlogger](https://pypi.org/project/litlogger/) to enable LitLogger, which logs metrics and artifacts automatically to the Lightning Experiments platform.
GPU available: True (cuda), used: True
TPU available: False, using: 0 TPU cores
💡 Tip: For seamless cloud logging and experiment tracking, try installing [litlogger](https://pypi.org/project/litlogger/) to enable LitLogger, which logs metrics and artifacts automatically to the Lightning Experiments platform.
LOCAL_RANK: 0 - CUDA_VISIBLE_DEVICES: [0]
LOCAL_RANK: 0 - CUDA_VISIBLE_DEVICES: [0]
LOCAL_RANK: 0 - CUDA_VISIBLE_DEVICES: [0]
SLURM auto-requeueing enabled. Setting signal handlers.
SLURM auto-requeueing enabled. Setting signal handlers.
SLURM auto-requeueing enabled. Setting signal handlers.
`Trainer.fit` stopped: `max_epochs=30` reached.
`Trainer.fit` stopped: `max_epochs=30` reached.
`Trainer.fit` stopped: `max_epochs=30` reached.
[I 2026-04-23 20:25:10,082] Trial 35 finished with value: 0.1115 and parameters: {'left_wall_dist_num_layers': 2, 'left_wall_dist_activation': 'relu', 'left_wall_dist_max_flattened': 4288, 'left_wall_dist_fc_hidden': 128, 'left_wall_dist_pool_size_l0': 8, 'left_wall_dist_out_channels_l0': 18, 'left_wall_dist_pool_size_l1': 4, 'left_wall_dist_out_channels_l1': 54, 'track_width_num_layers': 2, 'track_width_activation': 'elu', 'track_width_max_flattened': 2144, 'track_width_fc_hidden': 32, 'track_width_pool_size_l0': 2, 'heading_error_num_layers': 1, 'heading_error_activation': 'elu', 'heading_error_max_flattened': 1072, 'heading_error_fc_hidden': 32, 'heading_error_pool_size_l0': 2}. Best is trial 17 with value: 0.0921.
[rank: 0] Seed set to 42
[rank: 0] Seed set to 42
[rank: 0] Seed set to 42
GPU available: True (cuda), used: True
TPU available: False, using: 0 TPU cores
💡 Tip: For seamless cloud logging and experiment tracking, try installing [litlogger](https://pypi.org/project/litlogger/) to enable LitLogger, which logs metrics and artifacts automatically to the Lightning Experiments platform.
GPU available: True (cuda), used: True
TPU available: False, using: 0 TPU cores
💡 Tip: For seamless cloud logging and experiment tracking, try installing [litlogger](https://pypi.org/project/litlogger/) to enable LitLogger, which logs metrics and artifacts automatically to the Lightning Experiments platform.
GPU available: True (cuda), used: True
TPU available: False, using: 0 TPU cores
💡 Tip: For seamless cloud logging and experiment tracking, try installing [litlogger](https://pypi.org/project/litlogger/) to enable LitLogger, which logs metrics and artifacts automatically to the Lightning Experiments platform.
LOCAL_RANK: 0 - CUDA_VISIBLE_DEVICES: [0]
LOCAL_RANK: 0 - CUDA_VISIBLE_DEVICES: [0]
LOCAL_RANK: 0 - CUDA_VISIBLE_DEVICES: [0]
SLURM auto-requeueing enabled. Setting signal handlers.
SLURM auto-requeueing enabled. Setting signal handlers.
SLURM auto-requeueing enabled. Setting signal handlers.
`Trainer.fit` stopped: `max_epochs=30` reached.
`Trainer.fit` stopped: `max_epochs=30` reached.
`Trainer.fit` stopped: `max_epochs=30` reached.
[I 2026-04-23 20:27:39,052] Trial 36 finished with value: 0.1076 and parameters: {'left_wall_dist_num_layers': 4, 'left_wall_dist_activation': 'relu', 'left_wall_dist_max_flattened': 4288, 'left_wall_dist_fc_hidden': 32, 'left_wall_dist_pool_size_l0': 8, 'left_wall_dist_out_channels_l0': 26, 'left_wall_dist_pool_size_l1': 2, 'left_wall_dist_out_channels_l1': 33, 'left_wall_dist_pool_size_l2': 4, 'left_wall_dist_out_channels_l2': 8, 'left_wall_dist_pool_size_l3': 2, 'left_wall_dist_out_channels_l3': 26, 'track_width_num_layers': 3, 'track_width_activation': 'relu', 'track_width_max_flattened': 1072, 'track_width_fc_hidden': 64, 'track_width_pool_size_l0': 8, 'track_width_out_channels_l0': 8, 'track_width_pool_size_l1': 4, 'track_width_out_channels_l1': 8, 'track_width_pool_size_l2': 8, 'track_width_out_channels_l2': 74, 'heading_error_num_layers': 1, 'heading_error_activation': 'elu', 'heading_error_max_flattened': 2144, 'heading_error_fc_hidden': 32, 'heading_error_pool_size_l0': 8, 'heading_error_out_channels_l0': 9}. Best is trial 17 with value: 0.0921.
[rank: 0] Seed set to 42
[rank: 0] Seed set to 42
[rank: 0] Seed set to 42
GPU available: True (cuda), used: True
TPU available: False, using: 0 TPU cores
💡 Tip: For seamless cloud logging and experiment tracking, try installing [litlogger](https://pypi.org/project/litlogger/) to enable LitLogger, which logs metrics and artifacts automatically to the Lightning Experiments platform.
GPU available: True (cuda), used: True
TPU available: False, using: 0 TPU cores
GPU available: True (cuda), used: True
💡 Tip: For seamless cloud logging and experiment tracking, try installing [litlogger](https://pypi.org/project/litlogger/) to enable LitLogger, which logs metrics and artifacts automatically to the Lightning Experiments platform.
TPU available: False, using: 0 TPU cores
💡 Tip: For seamless cloud logging and experiment tracking, try installing [litlogger](https://pypi.org/project/litlogger/) to enable LitLogger, which logs metrics and artifacts automatically to the Lightning Experiments platform.
LOCAL_RANK: 0 - CUDA_VISIBLE_DEVICES: [0]
LOCAL_RANK: 0 - CUDA_VISIBLE_DEVICES: [0]
LOCAL_RANK: 0 - CUDA_VISIBLE_DEVICES: [0]
SLURM auto-requeueing enabled. Setting signal handlers.
SLURM auto-requeueing enabled. Setting signal handlers.
SLURM auto-requeueing enabled. Setting signal handlers.
`Trainer.fit` stopped: `max_epochs=30` reached.
`Trainer.fit` stopped: `max_epochs=30` reached.
`Trainer.fit` stopped: `max_epochs=30` reached.
[I 2026-04-23 20:29:50,259] Trial 37 finished with value: 0.1365 and parameters: {'left_wall_dist_num_layers': 3, 'left_wall_dist_activation': 'relu', 'left_wall_dist_max_flattened': 2144, 'left_wall_dist_fc_hidden': 128, 'left_wall_dist_pool_size_l0': 2, 'track_width_num_layers': 3, 'track_width_activation': 'elu', 'track_width_max_flattened': 4288, 'track_width_fc_hidden': 32, 'track_width_pool_size_l0': 8, 'track_width_out_channels_l0': 18, 'track_width_pool_size_l1': 2, 'track_width_out_channels_l1': 14, 'track_width_pool_size_l2': 2, 'track_width_out_channels_l2': 11, 'heading_error_num_layers': 1, 'heading_error_activation': 'relu', 'heading_error_max_flattened': 1072, 'heading_error_fc_hidden': 64, 'heading_error_pool_size_l0': 2}. Best is trial 17 with value: 0.0921.
[rank: 0] Seed set to 42
[rank: 0] Seed set to 42
[rank: 0] Seed set to 42
GPU available: True (cuda), used: True
TPU available: False, using: 0 TPU cores
GPU available: True (cuda), used: True
TPU available: False, using: 0 TPU cores
💡 Tip: For seamless cloud logging and experiment tracking, try installing [litlogger](https://pypi.org/project/litlogger/) to enable LitLogger, which logs metrics and artifacts automatically to the Lightning Experiments platform.
💡 Tip: For seamless cloud logging and experiment tracking, try installing [litlogger](https://pypi.org/project/litlogger/) to enable LitLogger, which logs metrics and artifacts automatically to the Lightning Experiments platform.
GPU available: True (cuda), used: True
TPU available: False, using: 0 TPU cores
💡 Tip: For seamless cloud logging and experiment tracking, try installing [litlogger](https://pypi.org/project/litlogger/) to enable LitLogger, which logs metrics and artifacts automatically to the Lightning Experiments platform.
LOCAL_RANK: 0 - CUDA_VISIBLE_DEVICES: [0]
LOCAL_RANK: 0 - CUDA_VISIBLE_DEVICES: [0]
LOCAL_RANK: 0 - CUDA_VISIBLE_DEVICES: [0]
SLURM auto-requeueing enabled. Setting signal handlers.
SLURM auto-requeueing enabled. Setting signal handlers.
SLURM auto-requeueing enabled. Setting signal handlers.
`Trainer.fit` stopped: `max_epochs=30` reached.
`Trainer.fit` stopped: `max_epochs=30` reached.
`Trainer.fit` stopped: `max_epochs=30` reached.
[I 2026-04-23 20:32:08,339] Trial 38 finished with value: 0.127 and parameters: {'left_wall_dist_num_layers': 3, 'left_wall_dist_activation': 'relu', 'left_wall_dist_max_flattened': 1072, 'left_wall_dist_fc_hidden': 128, 'left_wall_dist_pool_size_l0': 8, 'left_wall_dist_out_channels_l0': 8, 'left_wall_dist_pool_size_l1': 8, 'left_wall_dist_out_channels_l1': 10, 'left_wall_dist_pool_size_l2': 2, 'left_wall_dist_out_channels_l2': 13, 'track_width_num_layers': 2, 'track_width_activation': 'elu', 'track_width_max_flattened': 1072, 'track_width_fc_hidden': 64, 'track_width_pool_size_l0': 2, 'heading_error_num_layers': 2, 'heading_error_activation': 'elu', 'heading_error_max_flattened': 4288, 'heading_error_fc_hidden': 128, 'heading_error_pool_size_l0': 8, 'heading_error_out_channels_l0': 32, 'heading_error_pool_size_l1': 2, 'heading_error_out_channels_l1': 28}. Best is trial 17 with value: 0.0921.
[rank: 0] Seed set to 42
[rank: 0] Seed set to 42
[rank: 0] Seed set to 42
GPU available: True (cuda), used: True
GPU available: True (cuda), used: True
TPU available: False, using: 0 TPU cores
TPU available: False, using: 0 TPU cores
💡 Tip: For seamless cloud logging and experiment tracking, try installing [litlogger](https://pypi.org/project/litlogger/) to enable LitLogger, which logs metrics and artifacts automatically to the Lightning Experiments platform.
💡 Tip: For seamless cloud logging and experiment tracking, try installing [litlogger](https://pypi.org/project/litlogger/) to enable LitLogger, which logs metrics and artifacts automatically to the Lightning Experiments platform.
GPU available: True (cuda), used: True
TPU available: False, using: 0 TPU cores
💡 Tip: For seamless cloud logging and experiment tracking, try installing [litlogger](https://pypi.org/project/litlogger/) to enable LitLogger, which logs metrics and artifacts automatically to the Lightning Experiments platform.
LOCAL_RANK: 0 - CUDA_VISIBLE_DEVICES: [0]
LOCAL_RANK: 0 - CUDA_VISIBLE_DEVICES: [0]
LOCAL_RANK: 0 - CUDA_VISIBLE_DEVICES: [0]
SLURM auto-requeueing enabled. Setting signal handlers.
SLURM auto-requeueing enabled. Setting signal handlers.
SLURM auto-requeueing enabled. Setting signal handlers.
`Trainer.fit` stopped: `max_epochs=30` reached.
`Trainer.fit` stopped: `max_epochs=30` reached.
`Trainer.fit` stopped: `max_epochs=30` reached.
[I 2026-04-23 20:34:41,980] Trial 39 finished with value: 0.1251 and parameters: {'left_wall_dist_num_layers': 4, 'left_wall_dist_activation': 'elu', 'left_wall_dist_max_flattened': 4288, 'left_wall_dist_fc_hidden': 64, 'left_wall_dist_pool_size_l0': 4, 'left_wall_dist_out_channels_l0': 12, 'left_wall_dist_pool_size_l1': 4, 'left_wall_dist_out_channels_l1': 22, 'left_wall_dist_pool_size_l2': 8, 'left_wall_dist_out_channels_l2': 150, 'left_wall_dist_pool_size_l3': 2, 'left_wall_dist_out_channels_l3': 125, 'track_width_num_layers': 3, 'track_width_activation': 'relu', 'track_width_max_flattened': 4288, 'track_width_fc_hidden': 128, 'track_width_pool_size_l0': 4, 'track_width_out_channels_l0': 9, 'track_width_pool_size_l1': 8, 'track_width_out_channels_l1': 59, 'track_width_pool_size_l2': 2, 'track_width_out_channels_l2': 16, 'heading_error_num_layers': 2, 'heading_error_activation': 'elu', 'heading_error_max_flattened': 1072, 'heading_error_fc_hidden': 64, 'heading_error_pool_size_l0': 8, 'heading_error_out_channels_l0': 8, 'heading_error_pool_size_l1': 4, 'heading_error_out_channels_l1': 17}. Best is trial 17 with value: 0.0921.
[rank: 0] Seed set to 42
[rank: 0] Seed set to 42
[rank: 0] Seed set to 42
GPU available: True (cuda), used: True
GPU available: True (cuda), used: True
TPU available: False, using: 0 TPU cores
TPU available: False, using: 0 TPU cores
💡 Tip: For seamless cloud logging and experiment tracking, try installing [litlogger](https://pypi.org/project/litlogger/) to enable LitLogger, which logs metrics and artifacts automatically to the Lightning Experiments platform.
💡 Tip: For seamless cloud logging and experiment tracking, try installing [litlogger](https://pypi.org/project/litlogger/) to enable LitLogger, which logs metrics and artifacts automatically to the Lightning Experiments platform.
GPU available: True (cuda), used: True
TPU available: False, using: 0 TPU cores
💡 Tip: For seamless cloud logging and experiment tracking, try installing [litlogger](https://pypi.org/project/litlogger/) to enable LitLogger, which logs metrics and artifacts automatically to the Lightning Experiments platform.
LOCAL_RANK: 0 - CUDA_VISIBLE_DEVICES: [0]
LOCAL_RANK: 0 - CUDA_VISIBLE_DEVICES: [0]
LOCAL_RANK: 0 - CUDA_VISIBLE_DEVICES: [0]
SLURM auto-requeueing enabled. Setting signal handlers.
SLURM auto-requeueing enabled. Setting signal handlers.
SLURM auto-requeueing enabled. Setting signal handlers.
`Trainer.fit` stopped: `max_epochs=30` reached.
`Trainer.fit` stopped: `max_epochs=30` reached.
`Trainer.fit` stopped: `max_epochs=30` reached.
[I 2026-04-23 20:37:07,944] Trial 40 finished with value: 0.1499 and parameters: {'left_wall_dist_num_layers': 2, 'left_wall_dist_activation': 'elu', 'left_wall_dist_max_flattened': 4288, 'left_wall_dist_fc_hidden': 32, 'left_wall_dist_pool_size_l0': 8, 'left_wall_dist_out_channels_l0': 18, 'left_wall_dist_pool_size_l1': 4, 'left_wall_dist_out_channels_l1': 120, 'track_width_num_layers': 5, 'track_width_activation': 'elu', 'track_width_max_flattened': 2144, 'track_width_fc_hidden': 64, 'track_width_pool_size_l0': 8, 'track_width_out_channels_l0': 11, 'track_width_pool_size_l1': 2, 'track_width_out_channels_l1': 10, 'track_width_pool_size_l2': 2, 'track_width_out_channels_l2': 10, 'track_width_pool_size_l3': 8, 'track_width_out_channels_l3': 59, 'track_width_pool_size_l4': 8, 'heading_error_num_layers': 1, 'heading_error_activation': 'relu', 'heading_error_max_flattened': 1072, 'heading_error_fc_hidden': 32, 'heading_error_pool_size_l0': 2}. Best is trial 17 with value: 0.0921.
[rank: 0] Seed set to 42
[rank: 0] Seed set to 42
[rank: 0] Seed set to 42
GPU available: True (cuda), used: True
TPU available: False, using: 0 TPU cores
💡 Tip: For seamless cloud logging and experiment tracking, try installing [litlogger](https://pypi.org/project/litlogger/) to enable LitLogger, which logs metrics and artifacts automatically to the Lightning Experiments platform.
GPU available: True (cuda), used: True
TPU available: False, using: 0 TPU cores
GPU available: True (cuda), used: True
TPU available: False, using: 0 TPU cores
💡 Tip: For seamless cloud logging and experiment tracking, try installing [litlogger](https://pypi.org/project/litlogger/) to enable LitLogger, which logs metrics and artifacts automatically to the Lightning Experiments platform.
💡 Tip: For seamless cloud logging and experiment tracking, try installing [litlogger](https://pypi.org/project/litlogger/) to enable LitLogger, which logs metrics and artifacts automatically to the Lightning Experiments platform.
LOCAL_RANK: 0 - CUDA_VISIBLE_DEVICES: [0]
LOCAL_RANK: 0 - CUDA_VISIBLE_DEVICES: [0]
LOCAL_RANK: 0 - CUDA_VISIBLE_DEVICES: [0]
SLURM auto-requeueing enabled. Setting signal handlers.
SLURM auto-requeueing enabled. Setting signal handlers.
SLURM auto-requeueing enabled. Setting signal handlers.
`Trainer.fit` stopped: `max_epochs=30` reached.
`Trainer.fit` stopped: `max_epochs=30` reached.
`Trainer.fit` stopped: `max_epochs=30` reached.
[I 2026-04-23 20:39:35,769] Trial 41 finished with value: 0.1544 and parameters: {'left_wall_dist_num_layers': 3, 'left_wall_dist_activation': 'relu', 'left_wall_dist_max_flattened': 4288, 'left_wall_dist_fc_hidden': 128, 'left_wall_dist_pool_size_l0': 8, 'left_wall_dist_out_channels_l0': 25, 'left_wall_dist_pool_size_l1': 4, 'left_wall_dist_out_channels_l1': 14, 'left_wall_dist_pool_size_l2': 2, 'left_wall_dist_out_channels_l2': 58, 'track_width_num_layers': 4, 'track_width_activation': 'elu', 'track_width_max_flattened': 1072, 'track_width_fc_hidden': 64, 'track_width_pool_size_l0': 2, 'heading_error_num_layers': 5, 'heading_error_activation': 'elu', 'heading_error_max_flattened': 1072, 'heading_error_fc_hidden': 64, 'heading_error_pool_size_l0': 8, 'heading_error_out_channels_l0': 8, 'heading_error_pool_size_l1': 8, 'heading_error_out_channels_l1': 12, 'heading_error_pool_size_l2': 2, 'heading_error_out_channels_l2': 38, 'heading_error_pool_size_l3': 2, 'heading_error_out_channels_l3': 65}. Best is trial 17 with value: 0.0921.
[rank: 0] Seed set to 42
[rank: 0] Seed set to 42
[rank: 0] Seed set to 42
GPU available: True (cuda), used: True
TPU available: False, using: 0 TPU cores
💡 Tip: For seamless cloud logging and experiment tracking, try installing [litlogger](https://pypi.org/project/litlogger/) to enable LitLogger, which logs metrics and artifacts automatically to the Lightning Experiments platform.
GPU available: True (cuda), used: True
TPU available: False, using: 0 TPU cores
GPU available: True (cuda), used: True
TPU available: False, using: 0 TPU cores
💡 Tip: For seamless cloud logging and experiment tracking, try installing [litlogger](https://pypi.org/project/litlogger/) to enable LitLogger, which logs metrics and artifacts automatically to the Lightning Experiments platform.
💡 Tip: For seamless cloud logging and experiment tracking, try installing [litlogger](https://pypi.org/project/litlogger/) to enable LitLogger, which logs metrics and artifacts automatically to the Lightning Experiments platform.
LOCAL_RANK: 0 - CUDA_VISIBLE_DEVICES: [0]
LOCAL_RANK: 0 - CUDA_VISIBLE_DEVICES: [0]
LOCAL_RANK: 0 - CUDA_VISIBLE_DEVICES: [0]
SLURM auto-requeueing enabled. Setting signal handlers.
SLURM auto-requeueing enabled. Setting signal handlers.
SLURM auto-requeueing enabled. Setting signal handlers.
`Trainer.fit` stopped: `max_epochs=30` reached.
`Trainer.fit` stopped: `max_epochs=30` reached.
`Trainer.fit` stopped: `max_epochs=30` reached.
[I 2026-04-23 20:41:24,452] Trial 42 finished with value: 0.1782 and parameters: {'left_wall_dist_num_layers': 3, 'left_wall_dist_activation': 'relu', 'left_wall_dist_max_flattened': 4288, 'left_wall_dist_fc_hidden': 128, 'left_wall_dist_pool_size_l0': 8, 'left_wall_dist_out_channels_l0': 17, 'left_wall_dist_pool_size_l1': 4, 'left_wall_dist_out_channels_l1': 21, 'left_wall_dist_pool_size_l2': 2, 'left_wall_dist_out_channels_l2': 24, 'track_width_num_layers': 4, 'track_width_activation': 'elu', 'track_width_max_flattened': 1072, 'track_width_fc_hidden': 64, 'track_width_pool_size_l0': 2, 'heading_error_num_layers': 4, 'heading_error_activation': 'elu', 'heading_error_max_flattened': 1072, 'heading_error_fc_hidden': 64, 'heading_error_pool_size_l0': 8, 'heading_error_out_channels_l0': 8, 'heading_error_pool_size_l1': 8, 'heading_error_out_channels_l1': 10, 'heading_error_pool_size_l2': 8, 'heading_error_out_channels_l2': 145}. Best is trial 17 with value: 0.0921.
[rank: 0] Seed set to 42
[rank: 0] Seed set to 42
[rank: 0] Seed set to 42
GPU available: True (cuda), used: True
TPU available: False, using: 0 TPU cores
💡 Tip: For seamless cloud logging and experiment tracking, try installing [litlogger](https://pypi.org/project/litlogger/) to enable LitLogger, which logs metrics and artifacts automatically to the Lightning Experiments platform.
GPU available: True (cuda), used: True
TPU available: False, using: 0 TPU cores
💡 Tip: For seamless cloud logging and experiment tracking, try installing [litlogger](https://pypi.org/project/litlogger/) to enable LitLogger, which logs metrics and artifacts automatically to the Lightning Experiments platform.
GPU available: True (cuda), used: True
TPU available: False, using: 0 TPU cores
💡 Tip: For seamless cloud logging and experiment tracking, try installing [litlogger](https://pypi.org/project/litlogger/) to enable LitLogger, which logs metrics and artifacts automatically to the Lightning Experiments platform.
LOCAL_RANK: 0 - CUDA_VISIBLE_DEVICES: [0]
LOCAL_RANK: 0 - CUDA_VISIBLE_DEVICES: [0]
LOCAL_RANK: 0 - CUDA_VISIBLE_DEVICES: [0]
SLURM auto-requeueing enabled. Setting signal handlers.
SLURM auto-requeueing enabled. Setting signal handlers.
SLURM auto-requeueing enabled. Setting signal handlers.
`Trainer.fit` stopped: `max_epochs=30` reached.
`Trainer.fit` stopped: `max_epochs=30` reached.
`Trainer.fit` stopped: `max_epochs=30` reached.
