[I 2026-04-16 01:00:51,875] Trial 84 finished with value: 0.1605 and parameters: {'left_wall_dist_num_layers': 2, 'left_wall_dist_activation': 'relu', 'left_wall_dist_out_channels_l0': 100, 'left_wall_dist_pool_size_l0': 4, 'left_wall_dist_out_channels_l1': 113, 'left_wall_dist_pool_size_l1': 2, 'track_width_num_layers': 2, 'track_width_activation': 'relu', 'track_width_out_channels_l0': 48, 'track_width_pool_size_l0': 2, 'track_width_out_channels_l1': 245, 'track_width_pool_size_l1': 2, 'heading_error_num_layers': 3, 'heading_error_activation': 'elu', 'heading_error_out_channels_l0': 124, 'heading_error_pool_size_l0': 4, 'heading_error_out_channels_l1': 184, 'heading_error_pool_size_l1': 8, 'heading_error_out_channels_l2': 240, 'heading_error_pool_size_l2': 8, 'heading_error_fc_hidden': 35}. Best is trial 10 with value: 0.1074.
[rank: 0] Seed set to 42
[rank: 0] Seed set to 42
[rank: 0] Seed set to 42
GPU available: True (cuda), used: True
TPU available: False, using: 0 TPU cores
💡 Tip: For seamless cloud logging and experiment tracking, try installing [litlogger](https://pypi.org/project/litlogger/) to enable LitLogger, which logs metrics and artifacts automatically to the Lightning Experiments platform.
GPU available: True (cuda), used: True
TPU available: False, using: 0 TPU cores
💡 Tip: For seamless cloud logging and experiment tracking, try installing [litlogger](https://pypi.org/project/litlogger/) to enable LitLogger, which logs metrics and artifacts automatically to the Lightning Experiments platform.
GPU available: True (cuda), used: True
TPU available: False, using: 0 TPU cores
💡 Tip: For seamless cloud logging and experiment tracking, try installing [litlogger](https://pypi.org/project/litlogger/) to enable LitLogger, which logs metrics and artifacts automatically to the Lightning Experiments platform.
LOCAL_RANK: 0 - CUDA_VISIBLE_DEVICES: [0]
LOCAL_RANK: 0 - CUDA_VISIBLE_DEVICES: [0]
LOCAL_RANK: 0 - CUDA_VISIBLE_DEVICES: [0]
SLURM auto-requeueing enabled. Setting signal handlers.
SLURM auto-requeueing enabled. Setting signal handlers.
SLURM auto-requeueing enabled. Setting signal handlers.
`Trainer.fit` stopped: `max_epochs=30` reached.
`Trainer.fit` stopped: `max_epochs=30` reached.
`Trainer.fit` stopped: `max_epochs=30` reached.
[I 2026-04-16 01:03:23,430] Trial 85 finished with value: 0.1235 and parameters: {'left_wall_dist_num_layers': 2, 'left_wall_dist_activation': 'relu', 'left_wall_dist_out_channels_l0': 84, 'left_wall_dist_pool_size_l0': 8, 'left_wall_dist_out_channels_l1': 168, 'left_wall_dist_pool_size_l1': 2, 'track_width_num_layers': 2, 'track_width_activation': 'relu', 'track_width_out_channels_l0': 42, 'track_width_pool_size_l0': 2, 'track_width_out_channels_l1': 154, 'track_width_pool_size_l1': 2, 'heading_error_num_layers': 3, 'heading_error_activation': 'elu', 'heading_error_out_channels_l0': 39, 'heading_error_pool_size_l0': 4, 'heading_error_out_channels_l1': 142, 'heading_error_pool_size_l1': 2, 'heading_error_out_channels_l2': 222, 'heading_error_pool_size_l2': 4, 'heading_error_fc_hidden': 116}. Best is trial 10 with value: 0.1074.
[rank: 0] Seed set to 42
[rank: 0] Seed set to 42
[rank: 0] Seed set to 42
GPU available: True (cuda), used: True
TPU available: False, using: 0 TPU cores
💡 Tip: For seamless cloud logging and experiment tracking, try installing [litlogger](https://pypi.org/project/litlogger/) to enable LitLogger, which logs metrics and artifacts automatically to the Lightning Experiments platform.
GPU available: True (cuda), used: True
TPU available: False, using: 0 TPU cores
💡 Tip: For seamless cloud logging and experiment tracking, try installing [litlogger](https://pypi.org/project/litlogger/) to enable LitLogger, which logs metrics and artifacts automatically to the Lightning Experiments platform.
GPU available: True (cuda), used: True
TPU available: False, using: 0 TPU cores
💡 Tip: For seamless cloud logging and experiment tracking, try installing [litlogger](https://pypi.org/project/litlogger/) to enable LitLogger, which logs metrics and artifacts automatically to the Lightning Experiments platform.
LOCAL_RANK: 0 - CUDA_VISIBLE_DEVICES: [0]
LOCAL_RANK: 0 - CUDA_VISIBLE_DEVICES: [0]
LOCAL_RANK: 0 - CUDA_VISIBLE_DEVICES: [0]
SLURM auto-requeueing enabled. Setting signal handlers.
SLURM auto-requeueing enabled. Setting signal handlers.
SLURM auto-requeueing enabled. Setting signal handlers.
`Trainer.fit` stopped: `max_epochs=30` reached.
`Trainer.fit` stopped: `max_epochs=30` reached.
`Trainer.fit` stopped: `max_epochs=30` reached.
[I 2026-04-16 01:05:51,825] Trial 86 finished with value: 0.1245 and parameters: {'left_wall_dist_num_layers': 2, 'left_wall_dist_activation': 'relu', 'left_wall_dist_out_channels_l0': 94, 'left_wall_dist_pool_size_l0': 4, 'left_wall_dist_out_channels_l1': 36, 'left_wall_dist_pool_size_l1': 2, 'left_wall_dist_fc_hidden': 123, 'track_width_num_layers': 2, 'track_width_activation': 'relu', 'track_width_out_channels_l0': 39, 'track_width_pool_size_l0': 2, 'track_width_out_channels_l1': 138, 'track_width_pool_size_l1': 8, 'heading_error_num_layers': 3, 'heading_error_activation': 'relu', 'heading_error_out_channels_l0': 168, 'heading_error_pool_size_l0': 8, 'heading_error_out_channels_l1': 253, 'heading_error_pool_size_l1': 8, 'heading_error_out_channels_l2': 160, 'heading_error_pool_size_l2': 4, 'heading_error_fc_hidden': 37}. Best is trial 10 with value: 0.1074.
[rank: 0] Seed set to 42
[rank: 0] Seed set to 42
GPU available: True (cuda), used: True
TPU available: False, using: 0 TPU cores
💡 Tip: For seamless cloud logging and experiment tracking, try installing [litlogger](https://pypi.org/project/litlogger/) to enable LitLogger, which logs metrics and artifacts automatically to the Lightning Experiments platform.
GPU available: True (cuda), used: True
TPU available: False, using: 0 TPU cores
💡 Tip: For seamless cloud logging and experiment tracking, try installing [litlogger](https://pypi.org/project/litlogger/) to enable LitLogger, which logs metrics and artifacts automatically to the Lightning Experiments platform.
[rank: 0] Seed set to 42
GPU available: True (cuda), used: True
TPU available: False, using: 0 TPU cores
💡 Tip: For seamless cloud logging and experiment tracking, try installing [litlogger](https://pypi.org/project/litlogger/) to enable LitLogger, which logs metrics and artifacts automatically to the Lightning Experiments platform.
LOCAL_RANK: 0 - CUDA_VISIBLE_DEVICES: [0]
LOCAL_RANK: 0 - CUDA_VISIBLE_DEVICES: [0]
LOCAL_RANK: 0 - CUDA_VISIBLE_DEVICES: [0]
SLURM auto-requeueing enabled. Setting signal handlers.
SLURM auto-requeueing enabled. Setting signal handlers.
SLURM auto-requeueing enabled. Setting signal handlers.
`Trainer.fit` stopped: `max_epochs=30` reached.
`Trainer.fit` stopped: `max_epochs=30` reached.
`Trainer.fit` stopped: `max_epochs=30` reached.
[I 2026-04-16 01:08:28,812] Trial 87 finished with value: 0.2153 and parameters: {'left_wall_dist_num_layers': 4, 'left_wall_dist_activation': 'elu', 'left_wall_dist_out_channels_l0': 145, 'left_wall_dist_pool_size_l0': 4, 'left_wall_dist_out_channels_l1': 32, 'left_wall_dist_pool_size_l1': 4, 'left_wall_dist_out_channels_l2': 41, 'left_wall_dist_pool_size_l2': 2, 'left_wall_dist_out_channels_l3': 190, 'left_wall_dist_pool_size_l3': 8, 'left_wall_dist_fc_hidden': 95, 'track_width_num_layers': 2, 'track_width_activation': 'relu', 'track_width_out_channels_l0': 76, 'track_width_pool_size_l0': 2, 'track_width_out_channels_l1': 233, 'track_width_pool_size_l1': 8, 'heading_error_num_layers': 2, 'heading_error_activation': 'elu', 'heading_error_out_channels_l0': 143, 'heading_error_pool_size_l0': 8, 'heading_error_out_channels_l1': 161, 'heading_error_pool_size_l1': 8, 'heading_error_fc_hidden': 44}. Best is trial 10 with value: 0.1074.
[rank: 0] Seed set to 42
[rank: 0] Seed set to 42
[rank: 0] Seed set to 42
GPU available: True (cuda), used: True
TPU available: False, using: 0 TPU cores
💡 Tip: For seamless cloud logging and experiment tracking, try installing [litlogger](https://pypi.org/project/litlogger/) to enable LitLogger, which logs metrics and artifacts automatically to the Lightning Experiments platform.
GPU available: True (cuda), used: True
TPU available: False, using: 0 TPU cores
💡 Tip: For seamless cloud logging and experiment tracking, try installing [litlogger](https://pypi.org/project/litlogger/) to enable LitLogger, which logs metrics and artifacts automatically to the Lightning Experiments platform.
GPU available: True (cuda), used: True
TPU available: False, using: 0 TPU cores
💡 Tip: For seamless cloud logging and experiment tracking, try installing [litlogger](https://pypi.org/project/litlogger/) to enable LitLogger, which logs metrics and artifacts automatically to the Lightning Experiments platform.
LOCAL_RANK: 0 - CUDA_VISIBLE_DEVICES: [0]
LOCAL_RANK: 0 - CUDA_VISIBLE_DEVICES: [0]
LOCAL_RANK: 0 - CUDA_VISIBLE_DEVICES: [0]
SLURM auto-requeueing enabled. Setting signal handlers.
SLURM auto-requeueing enabled. Setting signal handlers.
SLURM auto-requeueing enabled. Setting signal handlers.
`Trainer.fit` stopped: `max_epochs=30` reached.
`Trainer.fit` stopped: `max_epochs=30` reached.
`Trainer.fit` stopped: `max_epochs=30` reached.
[I 2026-04-16 01:11:06,954] Trial 88 finished with value: 0.1287 and parameters: {'left_wall_dist_num_layers': 2, 'left_wall_dist_activation': 'relu', 'left_wall_dist_out_channels_l0': 117, 'left_wall_dist_pool_size_l0': 4, 'left_wall_dist_out_channels_l1': 34, 'left_wall_dist_pool_size_l1': 2, 'left_wall_dist_fc_hidden': 103, 'track_width_num_layers': 2, 'track_width_activation': 'elu', 'track_width_out_channels_l0': 60, 'track_width_pool_size_l0': 4, 'track_width_out_channels_l1': 219, 'track_width_pool_size_l1': 8, 'track_width_fc_hidden': 119, 'heading_error_num_layers': 4, 'heading_error_activation': 'elu', 'heading_error_out_channels_l0': 213, 'heading_error_pool_size_l0': 4, 'heading_error_out_channels_l1': 106, 'heading_error_pool_size_l1': 2, 'heading_error_out_channels_l2': 186, 'heading_error_pool_size_l2': 4, 'heading_error_out_channels_l3': 61, 'heading_error_pool_size_l3': 2, 'heading_error_fc_hidden': 48}. Best is trial 10 with value: 0.1074.
[rank: 0] Seed set to 42
[rank: 0] Seed set to 42
GPU available: True (cuda), used: True
TPU available: False, using: 0 TPU cores
💡 Tip: For seamless cloud logging and experiment tracking, try installing [litlogger](https://pypi.org/project/litlogger/) to enable LitLogger, which logs metrics and artifacts automatically to the Lightning Experiments platform.
GPU available: True (cuda), used: True
TPU available: False, using: 0 TPU cores
💡 Tip: For seamless cloud logging and experiment tracking, try installing [litlogger](https://pypi.org/project/litlogger/) to enable LitLogger, which logs metrics and artifacts automatically to the Lightning Experiments platform.
[rank: 0] Seed set to 42
GPU available: True (cuda), used: True
TPU available: False, using: 0 TPU cores
💡 Tip: For seamless cloud logging and experiment tracking, try installing [litlogger](https://pypi.org/project/litlogger/) to enable LitLogger, which logs metrics and artifacts automatically to the Lightning Experiments platform.
LOCAL_RANK: 0 - CUDA_VISIBLE_DEVICES: [0]
LOCAL_RANK: 0 - CUDA_VISIBLE_DEVICES: [0]
LOCAL_RANK: 0 - CUDA_VISIBLE_DEVICES: [0]
SLURM auto-requeueing enabled. Setting signal handlers.
SLURM auto-requeueing enabled. Setting signal handlers.
SLURM auto-requeueing enabled. Setting signal handlers.
`Trainer.fit` stopped: `max_epochs=30` reached.
`Trainer.fit` stopped: `max_epochs=30` reached.
`Trainer.fit` stopped: `max_epochs=30` reached.
[I 2026-04-16 01:13:38,947] Trial 89 finished with value: 0.1577 and parameters: {'left_wall_dist_num_layers': 2, 'left_wall_dist_activation': 'relu', 'left_wall_dist_out_channels_l0': 133, 'left_wall_dist_pool_size_l0': 4, 'left_wall_dist_out_channels_l1': 41, 'left_wall_dist_pool_size_l1': 2, 'left_wall_dist_fc_hidden': 111, 'track_width_num_layers': 3, 'track_width_activation': 'relu', 'track_width_out_channels_l0': 55, 'track_width_pool_size_l0': 2, 'track_width_out_channels_l1': 189, 'track_width_pool_size_l1': 8, 'track_width_out_channels_l2': 38, 'track_width_pool_size_l2': 8, 'track_width_fc_hidden': 35, 'heading_error_num_layers': 3, 'heading_error_activation': 'relu', 'heading_error_out_channels_l0': 117, 'heading_error_pool_size_l0': 8, 'heading_error_out_channels_l1': 123, 'heading_error_pool_size_l1': 8, 'heading_error_out_channels_l2': 48, 'heading_error_pool_size_l2': 4, 'heading_error_fc_hidden': 33}. Best is trial 10 with value: 0.1074.
[rank: 0] Seed set to 42
[rank: 0] Seed set to 42
GPU available: True (cuda), used: True
TPU available: False, using: 0 TPU cores
GPU available: True (cuda), used: True
TPU available: False, using: 0 TPU cores
💡 Tip: For seamless cloud logging and experiment tracking, try installing [litlogger](https://pypi.org/project/litlogger/) to enable LitLogger, which logs metrics and artifacts automatically to the Lightning Experiments platform.
💡 Tip: For seamless cloud logging and experiment tracking, try installing [litlogger](https://pypi.org/project/litlogger/) to enable LitLogger, which logs metrics and artifacts automatically to the Lightning Experiments platform.
[rank: 0] Seed set to 42
GPU available: True (cuda), used: True
TPU available: False, using: 0 TPU cores
💡 Tip: For seamless cloud logging and experiment tracking, try installing [litlogger](https://pypi.org/project/litlogger/) to enable LitLogger, which logs metrics and artifacts automatically to the Lightning Experiments platform.
LOCAL_RANK: 0 - CUDA_VISIBLE_DEVICES: [0]
LOCAL_RANK: 0 - CUDA_VISIBLE_DEVICES: [0]
SLURM auto-requeueing enabled. Setting signal handlers.
SLURM auto-requeueing enabled. Setting signal handlers.
LOCAL_RANK: 0 - CUDA_VISIBLE_DEVICES: [0]
SLURM auto-requeueing enabled. Setting signal handlers.
`Trainer.fit` stopped: `max_epochs=30` reached.
`Trainer.fit` stopped: `max_epochs=30` reached.
`Trainer.fit` stopped: `max_epochs=30` reached.
[I 2026-04-16 01:16:38,125] Trial 90 finished with value: 0.1687 and parameters: {'left_wall_dist_num_layers': 3, 'left_wall_dist_activation': 'relu', 'left_wall_dist_out_channels_l0': 109, 'left_wall_dist_pool_size_l0': 4, 'left_wall_dist_out_channels_l1': 178, 'left_wall_dist_pool_size_l1': 2, 'left_wall_dist_out_channels_l2': 74, 'left_wall_dist_pool_size_l2': 8, 'left_wall_dist_fc_hidden': 77, 'track_width_num_layers': 2, 'track_width_activation': 'relu', 'track_width_out_channels_l0': 85, 'track_width_pool_size_l0': 2, 'track_width_out_channels_l1': 208, 'track_width_pool_size_l1': 2, 'heading_error_num_layers': 3, 'heading_error_activation': 'elu', 'heading_error_out_channels_l0': 180, 'heading_error_pool_size_l0': 8, 'heading_error_out_channels_l1': 199, 'heading_error_pool_size_l1': 8, 'heading_error_out_channels_l2': 34, 'heading_error_pool_size_l2': 4}. Best is trial 10 with value: 0.1074.
[rank: 0] Seed set to 42
[rank: 0] Seed set to 42
GPU available: True (cuda), used: True
TPU available: False, using: 0 TPU cores
💡 Tip: For seamless cloud logging and experiment tracking, try installing [litlogger](https://pypi.org/project/litlogger/) to enable LitLogger, which logs metrics and artifacts automatically to the Lightning Experiments platform.
GPU available: True (cuda), used: True
TPU available: False, using: 0 TPU cores
💡 Tip: For seamless cloud logging and experiment tracking, try installing [litlogger](https://pypi.org/project/litlogger/) to enable LitLogger, which logs metrics and artifacts automatically to the Lightning Experiments platform.
[rank: 0] Seed set to 42
GPU available: True (cuda), used: True
TPU available: False, using: 0 TPU cores
💡 Tip: For seamless cloud logging and experiment tracking, try installing [litlogger](https://pypi.org/project/litlogger/) to enable LitLogger, which logs metrics and artifacts automatically to the Lightning Experiments platform.
LOCAL_RANK: 0 - CUDA_VISIBLE_DEVICES: [0]
LOCAL_RANK: 0 - CUDA_VISIBLE_DEVICES: [0]
LOCAL_RANK: 0 - CUDA_VISIBLE_DEVICES: [0]
SLURM auto-requeueing enabled. Setting signal handlers.
SLURM auto-requeueing enabled. Setting signal handlers.
SLURM auto-requeueing enabled. Setting signal handlers.
`Trainer.fit` stopped: `max_epochs=30` reached.
`Trainer.fit` stopped: `max_epochs=30` reached.
`Trainer.fit` stopped: `max_epochs=30` reached.
[I 2026-04-16 01:19:23,739] Trial 91 finished with value: 0.1391 and parameters: {'left_wall_dist_num_layers': 5, 'left_wall_dist_activation': 'relu', 'left_wall_dist_out_channels_l0': 44, 'left_wall_dist_pool_size_l0': 4, 'left_wall_dist_out_channels_l1': 103, 'left_wall_dist_pool_size_l1': 2, 'left_wall_dist_out_channels_l2': 60, 'left_wall_dist_pool_size_l2': 8, 'left_wall_dist_out_channels_l3': 58, 'left_wall_dist_pool_size_l3': 2, 'left_wall_dist_out_channels_l4': 135, 'left_wall_dist_pool_size_l4': 8, 'left_wall_dist_fc_hidden': 128, 'track_width_num_layers': 2, 'track_width_activation': 'relu', 'track_width_out_channels_l0': 45, 'track_width_pool_size_l0': 2, 'track_width_out_channels_l1': 255, 'track_width_pool_size_l1': 8, 'heading_error_num_layers': 3, 'heading_error_activation': 'relu', 'heading_error_out_channels_l0': 139, 'heading_error_pool_size_l0': 4, 'heading_error_out_channels_l1': 242, 'heading_error_pool_size_l1': 8, 'heading_error_out_channels_l2': 39, 'heading_error_pool_size_l2': 4, 'heading_error_fc_hidden': 39}. Best is trial 10 with value: 0.1074.
[rank: 0] Seed set to 42
[rank: 0] Seed set to 42
GPU available: True (cuda), used: True
TPU available: False, using: 0 TPU cores
💡 Tip: For seamless cloud logging and experiment tracking, try installing [litlogger](https://pypi.org/project/litlogger/) to enable LitLogger, which logs metrics and artifacts automatically to the Lightning Experiments platform.
GPU available: True (cuda), used: True
TPU available: False, using: 0 TPU cores
💡 Tip: For seamless cloud logging and experiment tracking, try installing [litlogger](https://pypi.org/project/litlogger/) to enable LitLogger, which logs metrics and artifacts automatically to the Lightning Experiments platform.
[rank: 0] Seed set to 42
GPU available: True (cuda), used: True
TPU available: False, using: 0 TPU cores
💡 Tip: For seamless cloud logging and experiment tracking, try installing [litlogger](https://pypi.org/project/litlogger/) to enable LitLogger, which logs metrics and artifacts automatically to the Lightning Experiments platform.
LOCAL_RANK: 0 - CUDA_VISIBLE_DEVICES: [0]
LOCAL_RANK: 0 - CUDA_VISIBLE_DEVICES: [0]
LOCAL_RANK: 0 - CUDA_VISIBLE_DEVICES: [0]
SLURM auto-requeueing enabled. Setting signal handlers.
SLURM auto-requeueing enabled. Setting signal handlers.
SLURM auto-requeueing enabled. Setting signal handlers.
`Trainer.fit` stopped: `max_epochs=30` reached.
`Trainer.fit` stopped: `max_epochs=30` reached.
`Trainer.fit` stopped: `max_epochs=30` reached.
[I 2026-04-16 01:21:58,088] Trial 92 finished with value: 0.1254 and parameters: {'left_wall_dist_num_layers': 2, 'left_wall_dist_activation': 'relu', 'left_wall_dist_out_channels_l0': 69, 'left_wall_dist_pool_size_l0': 4, 'left_wall_dist_out_channels_l1': 49, 'left_wall_dist_pool_size_l1': 2, 'left_wall_dist_fc_hidden': 109, 'track_width_num_layers': 2, 'track_width_activation': 'relu', 'track_width_out_channels_l0': 46, 'track_width_pool_size_l0': 2, 'track_width_out_channels_l1': 239, 'track_width_pool_size_l1': 8, 'heading_error_num_layers': 3, 'heading_error_activation': 'relu', 'heading_error_out_channels_l0': 158, 'heading_error_pool_size_l0': 4, 'heading_error_out_channels_l1': 213, 'heading_error_pool_size_l1': 8, 'heading_error_out_channels_l2': 38, 'heading_error_pool_size_l2': 4, 'heading_error_fc_hidden': 33}. Best is trial 10 with value: 0.1074.
[rank: 0] Seed set to 42
[rank: 0] Seed set to 42
[rank: 0] Seed set to 42
GPU available: True (cuda), used: True
TPU available: False, using: 0 TPU cores
💡 Tip: For seamless cloud logging and experiment tracking, try installing [litlogger](https://pypi.org/project/litlogger/) to enable LitLogger, which logs metrics and artifacts automatically to the Lightning Experiments platform.
GPU available: True (cuda), used: True
GPU available: True (cuda), used: True
TPU available: False, using: 0 TPU cores
TPU available: False, using: 0 TPU cores
💡 Tip: For seamless cloud logging and experiment tracking, try installing [litlogger](https://pypi.org/project/litlogger/) to enable LitLogger, which logs metrics and artifacts automatically to the Lightning Experiments platform.
💡 Tip: For seamless cloud logging and experiment tracking, try installing [litlogger](https://pypi.org/project/litlogger/) to enable LitLogger, which logs metrics and artifacts automatically to the Lightning Experiments platform.
LOCAL_RANK: 0 - CUDA_VISIBLE_DEVICES: [0]
LOCAL_RANK: 0 - CUDA_VISIBLE_DEVICES: [0]
LOCAL_RANK: 0 - CUDA_VISIBLE_DEVICES: [0]
SLURM auto-requeueing enabled. Setting signal handlers.
SLURM auto-requeueing enabled. Setting signal handlers.
SLURM auto-requeueing enabled. Setting signal handlers.
`Trainer.fit` stopped: `max_epochs=30` reached.
`Trainer.fit` stopped: `max_epochs=30` reached.
