[I 2026-04-15 22:18:15,019] Trial 20 finished with value: 0.2041 and parameters: {'left_wall_dist_num_layers': 3, 'left_wall_dist_activation': 'relu', 'left_wall_dist_out_channels_l0': 138, 'left_wall_dist_pool_size_l0': 4, 'left_wall_dist_out_channels_l1': 154, 'left_wall_dist_pool_size_l1': 8, 'left_wall_dist_out_channels_l2': 50, 'left_wall_dist_pool_size_l2': 8, 'left_wall_dist_fc_hidden': 33, 'track_width_num_layers': 2, 'track_width_activation': 'relu', 'track_width_out_channels_l0': 70, 'track_width_pool_size_l0': 8, 'track_width_out_channels_l1': 92, 'track_width_pool_size_l1': 8, 'track_width_fc_hidden': 66, 'heading_error_num_layers': 4, 'heading_error_activation': 'relu', 'heading_error_out_channels_l0': 104, 'heading_error_pool_size_l0': 8, 'heading_error_out_channels_l1': 204, 'heading_error_pool_size_l1': 8, 'heading_error_out_channels_l2': 32, 'heading_error_pool_size_l2': 4, 'heading_error_out_channels_l3': 117, 'heading_error_pool_size_l3': 8}. Best is trial 10 with value: 0.1074.
[rank: 0] Seed set to 42
[rank: 0] Seed set to 42
GPU available: True (cuda), used: True
TPU available: False, using: 0 TPU cores
💡 Tip: For seamless cloud logging and experiment tracking, try installing [litlogger](https://pypi.org/project/litlogger/) to enable LitLogger, which logs metrics and artifacts automatically to the Lightning Experiments platform.
GPU available: True (cuda), used: True
TPU available: False, using: 0 TPU cores
💡 Tip: For seamless cloud logging and experiment tracking, try installing [litlogger](https://pypi.org/project/litlogger/) to enable LitLogger, which logs metrics and artifacts automatically to the Lightning Experiments platform.
[rank: 0] Seed set to 42
GPU available: True (cuda), used: True
TPU available: False, using: 0 TPU cores
💡 Tip: For seamless cloud logging and experiment tracking, try installing [litlogger](https://pypi.org/project/litlogger/) to enable LitLogger, which logs metrics and artifacts automatically to the Lightning Experiments platform.
LOCAL_RANK: 0 - CUDA_VISIBLE_DEVICES: [0]
LOCAL_RANK: 0 - CUDA_VISIBLE_DEVICES: [0]
LOCAL_RANK: 0 - CUDA_VISIBLE_DEVICES: [0]
SLURM auto-requeueing enabled. Setting signal handlers.
SLURM auto-requeueing enabled. Setting signal handlers.
SLURM auto-requeueing enabled. Setting signal handlers.
`Trainer.fit` stopped: `max_epochs=30` reached.
`Trainer.fit` stopped: `max_epochs=30` reached.
`Trainer.fit` stopped: `max_epochs=30` reached.
[I 2026-04-15 22:20:59,205] Trial 21 finished with value: 0.1348 and parameters: {'left_wall_dist_num_layers': 3, 'left_wall_dist_activation': 'relu', 'left_wall_dist_out_channels_l0': 181, 'left_wall_dist_pool_size_l0': 4, 'left_wall_dist_out_channels_l1': 32, 'left_wall_dist_pool_size_l1': 4, 'left_wall_dist_out_channels_l2': 142, 'left_wall_dist_pool_size_l2': 4, 'left_wall_dist_fc_hidden': 80, 'track_width_num_layers': 5, 'track_width_activation': 'relu', 'track_width_out_channels_l0': 99, 'track_width_pool_size_l0': 4, 'track_width_out_channels_l1': 104, 'track_width_pool_size_l1': 8, 'track_width_out_channels_l2': 62, 'track_width_pool_size_l2': 2, 'track_width_out_channels_l3': 75, 'track_width_pool_size_l3': 4, 'track_width_out_channels_l4': 32, 'track_width_pool_size_l4': 4, 'heading_error_num_layers': 3, 'heading_error_activation': 'elu', 'heading_error_out_channels_l0': 252, 'heading_error_pool_size_l0': 4, 'heading_error_out_channels_l1': 80, 'heading_error_pool_size_l1': 2, 'heading_error_out_channels_l2': 65, 'heading_error_pool_size_l2': 8, 'heading_error_fc_hidden': 48}. Best is trial 10 with value: 0.1074.
[rank: 0] Seed set to 42
[rank: 0] Seed set to 42
[rank: 0] Seed set to 42
GPU available: True (cuda), used: True
TPU available: False, using: 0 TPU cores
GPU available: True (cuda), used: True
TPU available: False, using: 0 TPU cores
💡 Tip: For seamless cloud logging and experiment tracking, try installing [litlogger](https://pypi.org/project/litlogger/) to enable LitLogger, which logs metrics and artifacts automatically to the Lightning Experiments platform.
💡 Tip: For seamless cloud logging and experiment tracking, try installing [litlogger](https://pypi.org/project/litlogger/) to enable LitLogger, which logs metrics and artifacts automatically to the Lightning Experiments platform.
GPU available: True (cuda), used: True
TPU available: False, using: 0 TPU cores
💡 Tip: For seamless cloud logging and experiment tracking, try installing [litlogger](https://pypi.org/project/litlogger/) to enable LitLogger, which logs metrics and artifacts automatically to the Lightning Experiments platform.
LOCAL_RANK: 0 - CUDA_VISIBLE_DEVICES: [0]
LOCAL_RANK: 0 - CUDA_VISIBLE_DEVICES: [0]
LOCAL_RANK: 0 - CUDA_VISIBLE_DEVICES: [0]
SLURM auto-requeueing enabled. Setting signal handlers.
SLURM auto-requeueing enabled. Setting signal handlers.
SLURM auto-requeueing enabled. Setting signal handlers.
`Trainer.fit` stopped: `max_epochs=30` reached.
`Trainer.fit` stopped: `max_epochs=30` reached.
`Trainer.fit` stopped: `max_epochs=30` reached.
[I 2026-04-15 22:23:52,442] Trial 22 finished with value: 0.1328 and parameters: {'left_wall_dist_num_layers': 3, 'left_wall_dist_activation': 'relu', 'left_wall_dist_out_channels_l0': 173, 'left_wall_dist_pool_size_l0': 4, 'left_wall_dist_out_channels_l1': 43, 'left_wall_dist_pool_size_l1': 4, 'left_wall_dist_out_channels_l2': 168, 'left_wall_dist_pool_size_l2': 4, 'left_wall_dist_fc_hidden': 121, 'track_width_num_layers': 5, 'track_width_activation': 'relu', 'track_width_out_channels_l0': 80, 'track_width_pool_size_l0': 4, 'track_width_out_channels_l1': 63, 'track_width_pool_size_l1': 8, 'track_width_out_channels_l2': 48, 'track_width_pool_size_l2': 2, 'track_width_out_channels_l3': 245, 'track_width_pool_size_l3': 4, 'track_width_out_channels_l4': 32, 'track_width_pool_size_l4': 4, 'track_width_fc_hidden': 40, 'heading_error_num_layers': 5, 'heading_error_activation': 'elu', 'heading_error_out_channels_l0': 178, 'heading_error_pool_size_l0': 4, 'heading_error_out_channels_l1': 63, 'heading_error_pool_size_l1': 2, 'heading_error_out_channels_l2': 45, 'heading_error_pool_size_l2': 8, 'heading_error_out_channels_l3': 53, 'heading_error_pool_size_l3': 2, 'heading_error_out_channels_l4': 36, 'heading_error_pool_size_l4': 2}. Best is trial 10 with value: 0.1074.
[rank: 0] Seed set to 42
GPU available: True (cuda), used: True
TPU available: False, using: 0 TPU cores
💡 Tip: For seamless cloud logging and experiment tracking, try installing [litlogger](https://pypi.org/project/litlogger/) to enable LitLogger, which logs metrics and artifacts automatically to the Lightning Experiments platform.
[rank: 0] Seed set to 42
[rank: 0] Seed set to 42
GPU available: True (cuda), used: True
TPU available: False, using: 0 TPU cores
GPU available: True (cuda), used: True
TPU available: False, using: 0 TPU cores
💡 Tip: For seamless cloud logging and experiment tracking, try installing [litlogger](https://pypi.org/project/litlogger/) to enable LitLogger, which logs metrics and artifacts automatically to the Lightning Experiments platform.
💡 Tip: For seamless cloud logging and experiment tracking, try installing [litlogger](https://pypi.org/project/litlogger/) to enable LitLogger, which logs metrics and artifacts automatically to the Lightning Experiments platform.
LOCAL_RANK: 0 - CUDA_VISIBLE_DEVICES: [0]
LOCAL_RANK: 0 - CUDA_VISIBLE_DEVICES: [0]
LOCAL_RANK: 0 - CUDA_VISIBLE_DEVICES: [0]
SLURM auto-requeueing enabled. Setting signal handlers.
SLURM auto-requeueing enabled. Setting signal handlers.
SLURM auto-requeueing enabled. Setting signal handlers.
`Trainer.fit` stopped: `max_epochs=30` reached.
`Trainer.fit` stopped: `max_epochs=30` reached.
`Trainer.fit` stopped: `max_epochs=30` reached.
[I 2026-04-15 22:26:32,507] Trial 23 finished with value: 0.1193 and parameters: {'left_wall_dist_num_layers': 3, 'left_wall_dist_activation': 'relu', 'left_wall_dist_out_channels_l0': 84, 'left_wall_dist_pool_size_l0': 4, 'left_wall_dist_out_channels_l1': 40, 'left_wall_dist_pool_size_l1': 4, 'left_wall_dist_out_channels_l2': 173, 'left_wall_dist_pool_size_l2': 4, 'left_wall_dist_fc_hidden': 102, 'track_width_num_layers': 4, 'track_width_activation': 'relu', 'track_width_out_channels_l0': 41, 'track_width_pool_size_l0': 4, 'track_width_out_channels_l1': 33, 'track_width_pool_size_l1': 8, 'track_width_out_channels_l2': 85, 'track_width_pool_size_l2': 2, 'track_width_out_channels_l3': 77, 'track_width_pool_size_l3': 4, 'track_width_fc_hidden': 43, 'heading_error_num_layers': 4, 'heading_error_activation': 'elu', 'heading_error_out_channels_l0': 183, 'heading_error_pool_size_l0': 4, 'heading_error_out_channels_l1': 57, 'heading_error_pool_size_l1': 2, 'heading_error_out_channels_l2': 42, 'heading_error_pool_size_l2': 8, 'heading_error_out_channels_l3': 34, 'heading_error_pool_size_l3': 4}. Best is trial 10 with value: 0.1074.
[rank: 0] Seed set to 42
[rank: 0] Seed set to 42
[rank: 0] Seed set to 42
GPU available: True (cuda), used: True
TPU available: False, using: 0 TPU cores
💡 Tip: For seamless cloud logging and experiment tracking, try installing [litlogger](https://pypi.org/project/litlogger/) to enable LitLogger, which logs metrics and artifacts automatically to the Lightning Experiments platform.
GPU available: True (cuda), used: True
TPU available: False, using: 0 TPU cores
💡 Tip: For seamless cloud logging and experiment tracking, try installing [litlogger](https://pypi.org/project/litlogger/) to enable LitLogger, which logs metrics and artifacts automatically to the Lightning Experiments platform.
GPU available: True (cuda), used: True
TPU available: False, using: 0 TPU cores
💡 Tip: For seamless cloud logging and experiment tracking, try installing [litlogger](https://pypi.org/project/litlogger/) to enable LitLogger, which logs metrics and artifacts automatically to the Lightning Experiments platform.
LOCAL_RANK: 0 - CUDA_VISIBLE_DEVICES: [0]
LOCAL_RANK: 0 - CUDA_VISIBLE_DEVICES: [0]
LOCAL_RANK: 0 - CUDA_VISIBLE_DEVICES: [0]
SLURM auto-requeueing enabled. Setting signal handlers.
SLURM auto-requeueing enabled. Setting signal handlers.
SLURM auto-requeueing enabled. Setting signal handlers.
`Trainer.fit` stopped: `max_epochs=30` reached.
`Trainer.fit` stopped: `max_epochs=30` reached.
`Trainer.fit` stopped: `max_epochs=30` reached.
[I 2026-04-15 22:29:20,884] Trial 24 finished with value: 0.1696 and parameters: {'left_wall_dist_num_layers': 4, 'left_wall_dist_activation': 'relu', 'left_wall_dist_out_channels_l0': 42, 'left_wall_dist_pool_size_l0': 4, 'left_wall_dist_out_channels_l1': 47, 'left_wall_dist_pool_size_l1': 2, 'left_wall_dist_out_channels_l2': 71, 'left_wall_dist_pool_size_l2': 4, 'left_wall_dist_out_channels_l3': 73, 'left_wall_dist_pool_size_l3': 8, 'left_wall_dist_fc_hidden': 35, 'track_width_num_layers': 5, 'track_width_activation': 'relu', 'track_width_out_channels_l0': 119, 'track_width_pool_size_l0': 2, 'track_width_out_channels_l1': 155, 'track_width_pool_size_l1': 8, 'track_width_out_channels_l2': 32, 'track_width_pool_size_l2': 2, 'track_width_out_channels_l3': 46, 'track_width_pool_size_l3': 4, 'track_width_out_channels_l4': 169, 'track_width_pool_size_l4': 2, 'heading_error_num_layers': 3, 'heading_error_activation': 'elu', 'heading_error_out_channels_l0': 151, 'heading_error_pool_size_l0': 4, 'heading_error_out_channels_l1': 86, 'heading_error_pool_size_l1': 2, 'heading_error_out_channels_l2': 75, 'heading_error_pool_size_l2': 8, 'heading_error_fc_hidden': 89}. Best is trial 10 with value: 0.1074.
[rank: 0] Seed set to 42
[rank: 0] Seed set to 42
[rank: 0] Seed set to 42
GPU available: True (cuda), used: True
TPU available: False, using: 0 TPU cores
💡 Tip: For seamless cloud logging and experiment tracking, try installing [litlogger](https://pypi.org/project/litlogger/) to enable LitLogger, which logs metrics and artifacts automatically to the Lightning Experiments platform.
GPU available: True (cuda), used: True
TPU available: False, using: 0 TPU cores
💡 Tip: For seamless cloud logging and experiment tracking, try installing [litlogger](https://pypi.org/project/litlogger/) to enable LitLogger, which logs metrics and artifacts automatically to the Lightning Experiments platform.
GPU available: True (cuda), used: True
TPU available: False, using: 0 TPU cores
💡 Tip: For seamless cloud logging and experiment tracking, try installing [litlogger](https://pypi.org/project/litlogger/) to enable LitLogger, which logs metrics and artifacts automatically to the Lightning Experiments platform.
LOCAL_RANK: 0 - CUDA_VISIBLE_DEVICES: [0]
LOCAL_RANK: 0 - CUDA_VISIBLE_DEVICES: [0]
LOCAL_RANK: 0 - CUDA_VISIBLE_DEVICES: [0]
SLURM auto-requeueing enabled. Setting signal handlers.
SLURM auto-requeueing enabled. Setting signal handlers.
SLURM auto-requeueing enabled. Setting signal handlers.
`Trainer.fit` stopped: `max_epochs=30` reached.
`Trainer.fit` stopped: `max_epochs=30` reached.
`Trainer.fit` stopped: `max_epochs=30` reached.
[I 2026-04-15 22:31:56,849] Trial 25 finished with value: 0.1218 and parameters: {'left_wall_dist_num_layers': 3, 'left_wall_dist_activation': 'relu', 'left_wall_dist_out_channels_l0': 149, 'left_wall_dist_pool_size_l0': 4, 'left_wall_dist_out_channels_l1': 111, 'left_wall_dist_pool_size_l1': 4, 'left_wall_dist_out_channels_l2': 118, 'left_wall_dist_pool_size_l2': 4, 'left_wall_dist_fc_hidden': 76, 'track_width_num_layers': 4, 'track_width_activation': 'relu', 'track_width_out_channels_l0': 52, 'track_width_pool_size_l0': 4, 'track_width_out_channels_l1': 124, 'track_width_pool_size_l1': 8, 'track_width_out_channels_l2': 45, 'track_width_pool_size_l2': 2, 'track_width_out_channels_l3': 121, 'track_width_pool_size_l3': 4, 'track_width_fc_hidden': 57, 'heading_error_num_layers': 2, 'heading_error_activation': 'elu', 'heading_error_out_channels_l0': 254, 'heading_error_pool_size_l0': 4, 'heading_error_out_channels_l1': 100, 'heading_error_pool_size_l1': 2}. Best is trial 10 with value: 0.1074.
[rank: 0] Seed set to 42
[rank: 0] Seed set to 42
GPU available: True (cuda), used: True
TPU available: False, using: 0 TPU cores
GPU available: True (cuda), used: True
TPU available: False, using: 0 TPU cores
💡 Tip: For seamless cloud logging and experiment tracking, try installing [litlogger](https://pypi.org/project/litlogger/) to enable LitLogger, which logs metrics and artifacts automatically to the Lightning Experiments platform.
💡 Tip: For seamless cloud logging and experiment tracking, try installing [litlogger](https://pypi.org/project/litlogger/) to enable LitLogger, which logs metrics and artifacts automatically to the Lightning Experiments platform.
[rank: 0] Seed set to 42
GPU available: True (cuda), used: True
TPU available: False, using: 0 TPU cores
💡 Tip: For seamless cloud logging and experiment tracking, try installing [litlogger](https://pypi.org/project/litlogger/) to enable LitLogger, which logs metrics and artifacts automatically to the Lightning Experiments platform.
LOCAL_RANK: 0 - CUDA_VISIBLE_DEVICES: [0]
LOCAL_RANK: 0 - CUDA_VISIBLE_DEVICES: [0]
LOCAL_RANK: 0 - CUDA_VISIBLE_DEVICES: [0]
SLURM auto-requeueing enabled. Setting signal handlers.
SLURM auto-requeueing enabled. Setting signal handlers.
SLURM auto-requeueing enabled. Setting signal handlers.
`Trainer.fit` stopped: `max_epochs=30` reached.
`Trainer.fit` stopped: `max_epochs=30` reached.
`Trainer.fit` stopped: `max_epochs=30` reached.
[I 2026-04-15 22:34:54,174] Trial 26 finished with value: 0.1214 and parameters: {'left_wall_dist_num_layers': 4, 'left_wall_dist_activation': 'elu', 'left_wall_dist_out_channels_l0': 114, 'left_wall_dist_pool_size_l0': 4, 'left_wall_dist_out_channels_l1': 81, 'left_wall_dist_pool_size_l1': 2, 'left_wall_dist_out_channels_l2': 256, 'left_wall_dist_pool_size_l2': 2, 'left_wall_dist_out_channels_l3': 42, 'left_wall_dist_pool_size_l3': 4, 'left_wall_dist_fc_hidden': 50, 'track_width_num_layers': 3, 'track_width_activation': 'relu', 'track_width_out_channels_l0': 245, 'track_width_pool_size_l0': 2, 'track_width_out_channels_l1': 91, 'track_width_pool_size_l1': 8, 'track_width_out_channels_l2': 86, 'track_width_pool_size_l2': 2, 'track_width_fc_hidden': 87, 'heading_error_num_layers': 4, 'heading_error_activation': 'elu', 'heading_error_out_channels_l0': 203, 'heading_error_pool_size_l0': 4, 'heading_error_out_channels_l1': 46, 'heading_error_pool_size_l1': 8, 'heading_error_out_channels_l2': 130, 'heading_error_pool_size_l2': 4, 'heading_error_out_channels_l3': 51, 'heading_error_pool_size_l3': 8, 'heading_error_fc_hidden': 38}. Best is trial 10 with value: 0.1074.
[rank: 0] Seed set to 42
[rank: 0] Seed set to 42
[rank: 0] Seed set to 42
GPU available: True (cuda), used: True
TPU available: False, using: 0 TPU cores
💡 Tip: For seamless cloud logging and experiment tracking, try installing [litlogger](https://pypi.org/project/litlogger/) to enable LitLogger, which logs metrics and artifacts automatically to the Lightning Experiments platform.
GPU available: True (cuda), used: True
TPU available: False, using: 0 TPU cores
💡 Tip: For seamless cloud logging and experiment tracking, try installing [litlogger](https://pypi.org/project/litlogger/) to enable LitLogger, which logs metrics and artifacts automatically to the Lightning Experiments platform.
GPU available: True (cuda), used: True
TPU available: False, using: 0 TPU cores
💡 Tip: For seamless cloud logging and experiment tracking, try installing [litlogger](https://pypi.org/project/litlogger/) to enable LitLogger, which logs metrics and artifacts automatically to the Lightning Experiments platform.
LOCAL_RANK: 0 - CUDA_VISIBLE_DEVICES: [0]
LOCAL_RANK: 0 - CUDA_VISIBLE_DEVICES: [0]
LOCAL_RANK: 0 - CUDA_VISIBLE_DEVICES: [0]
SLURM auto-requeueing enabled. Setting signal handlers.
SLURM auto-requeueing enabled. Setting signal handlers.
SLURM auto-requeueing enabled. Setting signal handlers.
`Trainer.fit` stopped: `max_epochs=30` reached.
`Trainer.fit` stopped: `max_epochs=30` reached.
`Trainer.fit` stopped: `max_epochs=30` reached.
[I 2026-04-15 22:38:00,619] Trial 27 finished with value: 0.1272 and parameters: {'left_wall_dist_num_layers': 5, 'left_wall_dist_activation': 'relu', 'left_wall_dist_out_channels_l0': 62, 'left_wall_dist_pool_size_l0': 4, 'left_wall_dist_out_channels_l1': 32, 'left_wall_dist_pool_size_l1': 2, 'left_wall_dist_out_channels_l2': 37, 'left_wall_dist_pool_size_l2': 8, 'left_wall_dist_out_channels_l3': 121, 'left_wall_dist_pool_size_l3': 2, 'left_wall_dist_out_channels_l4': 141, 'left_wall_dist_pool_size_l4': 4, 'track_width_num_layers': 5, 'track_width_activation': 'relu', 'track_width_out_channels_l0': 195, 'track_width_pool_size_l0': 2, 'track_width_out_channels_l1': 208, 'track_width_pool_size_l1': 8, 'track_width_out_channels_l2': 54, 'track_width_pool_size_l2': 2, 'track_width_out_channels_l3': 231, 'track_width_pool_size_l3': 2, 'track_width_out_channels_l4': 71, 'track_width_pool_size_l4': 4, 'track_width_fc_hidden': 36, 'heading_error_num_layers': 3, 'heading_error_activation': 'relu', 'heading_error_out_channels_l0': 70, 'heading_error_pool_size_l0': 4, 'heading_error_out_channels_l1': 206, 'heading_error_pool_size_l1': 8, 'heading_error_out_channels_l2': 55, 'heading_error_pool_size_l2': 8, 'heading_error_fc_hidden': 34}. Best is trial 10 with value: 0.1074.
[rank: 0] Seed set to 42
[rank: 0] Seed set to 42
[rank: 0] Seed set to 42
GPU available: True (cuda), used: True
TPU available: False, using: 0 TPU cores
💡 Tip: For seamless cloud logging and experiment tracking, try installing [litlogger](https://pypi.org/project/litlogger/) to enable LitLogger, which logs metrics and artifacts automatically to the Lightning Experiments platform.
GPU available: True (cuda), used: True
TPU available: False, using: 0 TPU cores
💡 Tip: For seamless cloud logging and experiment tracking, try installing [litlogger](https://pypi.org/project/litlogger/) to enable LitLogger, which logs metrics and artifacts automatically to the Lightning Experiments platform.
GPU available: True (cuda), used: True
TPU available: False, using: 0 TPU cores
💡 Tip: For seamless cloud logging and experiment tracking, try installing [litlogger](https://pypi.org/project/litlogger/) to enable LitLogger, which logs metrics and artifacts automatically to the Lightning Experiments platform.
LOCAL_RANK: 0 - CUDA_VISIBLE_DEVICES: [0]
LOCAL_RANK: 0 - CUDA_VISIBLE_DEVICES: [0]
LOCAL_RANK: 0 - CUDA_VISIBLE_DEVICES: [0]
SLURM auto-requeueing enabled. Setting signal handlers.
SLURM auto-requeueing enabled. Setting signal handlers.
SLURM auto-requeueing enabled. Setting signal handlers.
`Trainer.fit` stopped: `max_epochs=30` reached.
`Trainer.fit` stopped: `max_epochs=30` reached.
`Trainer.fit` stopped: `max_epochs=30` reached.
