[I 2026-04-15 21:29:51,883] Trial 2 finished with value: 0.1526 and parameters: {'left_wall_dist_num_layers': 5, 'left_wall_dist_activation': 'relu', 'left_wall_dist_out_channels_l0': 84, 'left_wall_dist_pool_size_l0': 8, 'left_wall_dist_out_channels_l1': 35, 'left_wall_dist_pool_size_l1': 4, 'left_wall_dist_out_channels_l2': 38, 'left_wall_dist_pool_size_l2': 2, 'left_wall_dist_out_channels_l3': 104, 'left_wall_dist_pool_size_l3': 8, 'track_width_num_layers': 2, 'track_width_activation': 'elu', 'track_width_out_channels_l0': 34, 'track_width_pool_size_l0': 2, 'track_width_out_channels_l1': 188, 'track_width_pool_size_l1': 2, 'heading_error_num_layers': 2, 'heading_error_activation': 'elu', 'heading_error_out_channels_l0': 193, 'heading_error_pool_size_l0': 8, 'heading_error_out_channels_l1': 45, 'heading_error_pool_size_l1': 4, 'heading_error_fc_hidden': 52}. Best is trial 2 with value: 0.1526.
[rank: 0] Seed set to 42
[rank: 0] Seed set to 42
[rank: 0] Seed set to 42
GPU available: True (cuda), used: True
TPU available: False, using: 0 TPU cores
GPU available: True (cuda), used: True
TPU available: False, using: 0 TPU cores
💡 Tip: For seamless cloud logging and experiment tracking, try installing [litlogger](https://pypi.org/project/litlogger/) to enable LitLogger, which logs metrics and artifacts automatically to the Lightning Experiments platform.
💡 Tip: For seamless cloud logging and experiment tracking, try installing [litlogger](https://pypi.org/project/litlogger/) to enable LitLogger, which logs metrics and artifacts automatically to the Lightning Experiments platform.
GPU available: True (cuda), used: True
TPU available: False, using: 0 TPU cores
💡 Tip: For seamless cloud logging and experiment tracking, try installing [litlogger](https://pypi.org/project/litlogger/) to enable LitLogger, which logs metrics and artifacts automatically to the Lightning Experiments platform.
LOCAL_RANK: 0 - CUDA_VISIBLE_DEVICES: [0]
LOCAL_RANK: 0 - CUDA_VISIBLE_DEVICES: [0]
LOCAL_RANK: 0 - CUDA_VISIBLE_DEVICES: [0]
Traceback (most recent call last):
  File "/nas/longleaf/home/zayah/f1tenth_ng_zc/packages/f110_scripts/src/f110_scripts/train/train_nn.py", line 595, in <module>
    main()
  File "/nas/longleaf/home/zayah/f1tenth_ng_zc/packages/f110_scripts/src/f110_scripts/train/train_nn.py", line 591, in main
    run_single_training(config, aid)
  File "/nas/longleaf/home/zayah/f1tenth_ng_zc/packages/f110_scripts/src/f110_scripts/train/train_nn.py", line 564, in run_single_training
    trainer.fit(module, datamodule=dm, ckpt_path=ckpt_path)
  File "/nas/longleaf/home/zayah/f1tenth_ng_zc/.venv/lib/python3.12/site-packages/lightning/pytorch/trainer/trainer.py", line 584, in fit
    call._call_and_handle_interrupt(
  File "/nas/longleaf/home/zayah/f1tenth_ng_zc/.venv/lib/python3.12/site-packages/lightning/pytorch/trainer/call.py", line 49, in _call_and_handle_interrupt
    return trainer_fn(*args, **kwargs)
           ^^^^^^^^^^^^^^^^^^^^^^^^^^^
  File "/nas/longleaf/home/zayah/f1tenth_ng_zc/.venv/lib/python3.12/site-packages/lightning/pytorch/trainer/trainer.py", line 630, in _fit_impl
    self._run(model, ckpt_path=ckpt_path, weights_only=weights_only)
  File "/nas/longleaf/home/zayah/f1tenth_ng_zc/.venv/lib/python3.12/site-packages/lightning/pytorch/trainer/trainer.py", line 1057, in _run
    call._call_callback_hooks(self, "on_fit_start")
  File "/nas/longleaf/home/zayah/f1tenth_ng_zc/.venv/lib/python3.12/site-packages/lightning/pytorch/trainer/call.py", line 228, in _call_callback_hooks
    fn(trainer, trainer.lightning_module, *args, **kwargs)
  File "/nas/longleaf/home/zayah/f1tenth_ng_zc/.venv/lib/python3.12/site-packages/lightning/pytorch/callbacks/model_summary.py", line 64, in on_fit_start
    model_summary = self._summary(trainer, pl_module)
                    ^^^^^^^^^^^^^^^^^^^^^^^^^^^^^^^^^
  File "/nas/longleaf/home/zayah/f1tenth_ng_zc/.venv/lib/python3.12/site-packages/lightning/pytorch/callbacks/model_summary.py", line 90, in _summary
    return summarize(pl_module, max_depth=self._max_depth)
           ^^^^^^^^^^^^^^^^^^^^^^^^^^^^^^^^^^^^^^^^^^^^^^^
  File "/nas/longleaf/home/zayah/f1tenth_ng_zc/.venv/lib/python3.12/site-packages/lightning/pytorch/utilities/model_summary/model_summary.py", line 565, in summarize
    return ModelSummary(lightning_module, max_depth=max_depth)
           ^^^^^^^^^^^^^^^^^^^^^^^^^^^^^^^^^^^^^^^^^^^^^^^^^^^
  File "/nas/longleaf/home/zayah/f1tenth_ng_zc/.venv/lib/python3.12/site-packages/lightning/pytorch/utilities/model_summary/model_summary.py", line 228, in __init__
    self._layer_summary = self.summarize()
                          ^^^^^^^^^^^^^^^^
  File "/nas/longleaf/home/zayah/f1tenth_ng_zc/.venv/lib/python3.12/site-packages/lightning/pytorch/utilities/model_summary/model_summary.py", line 328, in summarize
    self._forward_example_input()
  File "/nas/longleaf/home/zayah/f1tenth_ng_zc/.venv/lib/python3.12/site-packages/lightning/pytorch/utilities/model_summary/model_summary.py", line 371, in _forward_example_input
    model(input_)
  File "/nas/longleaf/home/zayah/f1tenth_ng_zc/.venv/lib/python3.12/site-packages/torch/nn/modules/module.py", line 1779, in _wrapped_call_impl
    return self._call_impl(*args, **kwargs)
           ^^^^^^^^^^^^^^^^^^^^^^^^^^^^^^^^
  File "/nas/longleaf/home/zayah/f1tenth_ng_zc/.venv/lib/python3.12/site-packages/torch/nn/modules/module.py", line 1885, in _call_impl
    return inner()
           ^^^^^^^
  File "/nas/longleaf/home/zayah/f1tenth_ng_zc/.venv/lib/python3.12/site-packages/torch/nn/modules/module.py", line 1833, in inner
    result = forward_call(*args, **kwargs)
             ^^^^^^^^^^^^^^^^^^^^^^^^^^^^^
  File "/nas/longleaf/home/zayah/f1tenth_ng_zc/packages/f110_scripts/src/f110_scripts/train/train_nn.py", line 205, in forward
    return self.model(x_in)
           ^^^^^^^^^^^^^^^^
  File "/nas/longleaf/home/zayah/f1tenth_ng_zc/.venv/lib/python3.12/site-packages/torch/nn/modules/module.py", line 1779, in _wrapped_call_impl
    return self._call_impl(*args, **kwargs)
           ^^^^^^^^^^^^^^^^^^^^^^^^^^^^^^^^
  File "/nas/longleaf/home/zayah/f1tenth_ng_zc/.venv/lib/python3.12/site-packages/torch/nn/modules/module.py", line 1885, in _call_impl
    return inner()
           ^^^^^^^
  File "/nas/longleaf/home/zayah/f1tenth_ng_zc/.venv/lib/python3.12/site-packages/torch/nn/modules/module.py", line 1833, in inner
    result = forward_call(*args, **kwargs)
             ^^^^^^^^^^^^^^^^^^^^^^^^^^^^^
  File "/nas/longleaf/home/zayah/f1tenth_ng_zc/.venv/lib/python3.12/site-packages/torch/nn/modules/container.py", line 253, in forward
    input = module(input)
            ^^^^^^^^^^^^^
  File "/nas/longleaf/home/zayah/f1tenth_ng_zc/.venv/lib/python3.12/site-packages/torch/nn/modules/module.py", line 1779, in _wrapped_call_impl
    return self._call_impl(*args, **kwargs)
           ^^^^^^^^^^^^^^^^^^^^^^^^^^^^^^^^
  File "/nas/longleaf/home/zayah/f1tenth_ng_zc/.venv/lib/python3.12/site-packages/torch/nn/modules/module.py", line 1885, in _call_impl
    return inner()
           ^^^^^^^
  File "/nas/longleaf/home/zayah/f1tenth_ng_zc/.venv/lib/python3.12/site-packages/torch/nn/modules/module.py", line 1833, in inner
    result = forward_call(*args, **kwargs)
             ^^^^^^^^^^^^^^^^^^^^^^^^^^^^^
  File "/nas/longleaf/home/zayah/f1tenth_ng_zc/.venv/lib/python3.12/site-packages/torch/nn/modules/pooling.py", line 144, in forward
    return F.max_pool1d(
           ^^^^^^^^^^^^^
  File "/nas/longleaf/home/zayah/f1tenth_ng_zc/.venv/lib/python3.12/site-packages/torch/_jit_internal.py", line 636, in fn
    return if_false(*args, **kwargs)
           ^^^^^^^^^^^^^^^^^^^^^^^^^
  File "/nas/longleaf/home/zayah/f1tenth_ng_zc/.venv/lib/python3.12/site-packages/torch/nn/functional.py", line 745, in _max_pool1d
    return torch.max_pool1d(input, kernel_size, stride, padding, dilation, ceil_mode)
           ^^^^^^^^^^^^^^^^^^^^^^^^^^^^^^^^^^^^^^^^^^^^^^^^^^^^^^^^^^^^^^^^^^^^^^^^^^
RuntimeError: max_pool1d() Invalid computed output size: 0
SLURM auto-requeueing enabled. Setting signal handlers.
SLURM auto-requeueing enabled. Setting signal handlers.
`Trainer.fit` stopped: `max_epochs=30` reached.
`Trainer.fit` stopped: `max_epochs=30` reached.
[I 2026-04-15 21:31:15,775] Trial 3 finished with value: inf and parameters: {'left_wall_dist_num_layers': 2, 'left_wall_dist_activation': 'elu', 'left_wall_dist_out_channels_l0': 188, 'left_wall_dist_pool_size_l0': 8, 'left_wall_dist_out_channels_l1': 64, 'left_wall_dist_pool_size_l1': 2, 'left_wall_dist_fc_hidden': 82, 'track_width_num_layers': 4, 'track_width_activation': 'elu', 'track_width_out_channels_l0': 53, 'track_width_pool_size_l0': 2, 'track_width_out_channels_l1': 77, 'track_width_pool_size_l1': 4, 'track_width_out_channels_l2': 161, 'track_width_pool_size_l2': 4, 'track_width_out_channels_l3': 139, 'track_width_pool_size_l3': 4, 'track_width_fc_hidden': 38, 'heading_error_num_layers': 5, 'heading_error_activation': 'relu', 'heading_error_out_channels_l0': 155, 'heading_error_pool_size_l0': 8, 'heading_error_out_channels_l1': 57, 'heading_error_pool_size_l1': 4, 'heading_error_out_channels_l2': 164, 'heading_error_pool_size_l2': 8, 'heading_error_out_channels_l3': 140, 'heading_error_pool_size_l3': 2, 'heading_error_fc_hidden': 34}. Best is trial 2 with value: 0.1526.
[rank: 0] Seed set to 42
GPU available: True (cuda), used: True
TPU available: False, using: 0 TPU cores
💡 Tip: For seamless cloud logging and experiment tracking, try installing [litlogger](https://pypi.org/project/litlogger/) to enable LitLogger, which logs metrics and artifacts automatically to the Lightning Experiments platform.
[rank: 0] Seed set to 42
[rank: 0] Seed set to 42
GPU available: True (cuda), used: True
TPU available: False, using: 0 TPU cores
💡 Tip: For seamless cloud logging and experiment tracking, try installing [litlogger](https://pypi.org/project/litlogger/) to enable LitLogger, which logs metrics and artifacts automatically to the Lightning Experiments platform.
GPU available: True (cuda), used: True
TPU available: False, using: 0 TPU cores
💡 Tip: For seamless cloud logging and experiment tracking, try installing [litlogger](https://pypi.org/project/litlogger/) to enable LitLogger, which logs metrics and artifacts automatically to the Lightning Experiments platform.
LOCAL_RANK: 0 - CUDA_VISIBLE_DEVICES: [0]
SLURM auto-requeueing enabled. Setting signal handlers.
LOCAL_RANK: 0 - CUDA_VISIBLE_DEVICES: [0]
LOCAL_RANK: 0 - CUDA_VISIBLE_DEVICES: [0]
SLURM auto-requeueing enabled. Setting signal handlers.
SLURM auto-requeueing enabled. Setting signal handlers.
`Trainer.fit` stopped: `max_epochs=30` reached.
`Trainer.fit` stopped: `max_epochs=30` reached.
`Trainer.fit` stopped: `max_epochs=30` reached.
[I 2026-04-15 21:33:46,393] Trial 4 finished with value: 0.1246 and parameters: {'left_wall_dist_num_layers': 5, 'left_wall_dist_activation': 'relu', 'left_wall_dist_out_channels_l0': 61, 'left_wall_dist_pool_size_l0': 8, 'left_wall_dist_out_channels_l1': 159, 'left_wall_dist_pool_size_l1': 4, 'left_wall_dist_out_channels_l2': 85, 'left_wall_dist_pool_size_l2': 4, 'left_wall_dist_out_channels_l3': 111, 'left_wall_dist_pool_size_l3': 2, 'left_wall_dist_fc_hidden': 42, 'track_width_num_layers': 4, 'track_width_activation': 'relu', 'track_width_out_channels_l0': 67, 'track_width_pool_size_l0': 8, 'track_width_out_channels_l1': 39, 'track_width_pool_size_l1': 2, 'track_width_out_channels_l2': 169, 'track_width_pool_size_l2': 2, 'track_width_out_channels_l3': 112, 'track_width_pool_size_l3': 4, 'track_width_fc_hidden': 47, 'heading_error_num_layers': 2, 'heading_error_activation': 'relu', 'heading_error_out_channels_l0': 54, 'heading_error_pool_size_l0': 4, 'heading_error_out_channels_l1': 200, 'heading_error_pool_size_l1': 2}. Best is trial 4 with value: 0.1246.
[rank: 0] Seed set to 42
[rank: 0] Seed set to 42
[rank: 0] Seed set to 42
GPU available: True (cuda), used: True
TPU available: False, using: 0 TPU cores
💡 Tip: For seamless cloud logging and experiment tracking, try installing [litlogger](https://pypi.org/project/litlogger/) to enable LitLogger, which logs metrics and artifacts automatically to the Lightning Experiments platform.
GPU available: True (cuda), used: True
TPU available: False, using: 0 TPU cores
💡 Tip: For seamless cloud logging and experiment tracking, try installing [litlogger](https://pypi.org/project/litlogger/) to enable LitLogger, which logs metrics and artifacts automatically to the Lightning Experiments platform.
GPU available: True (cuda), used: True
TPU available: False, using: 0 TPU cores
💡 Tip: For seamless cloud logging and experiment tracking, try installing [litlogger](https://pypi.org/project/litlogger/) to enable LitLogger, which logs metrics and artifacts automatically to the Lightning Experiments platform.
LOCAL_RANK: 0 - CUDA_VISIBLE_DEVICES: [0]
LOCAL_RANK: 0 - CUDA_VISIBLE_DEVICES: [0]
LOCAL_RANK: 0 - CUDA_VISIBLE_DEVICES: [0]
SLURM auto-requeueing enabled. Setting signal handlers.
SLURM auto-requeueing enabled. Setting signal handlers.
SLURM auto-requeueing enabled. Setting signal handlers.
`Trainer.fit` stopped: `max_epochs=30` reached.
`Trainer.fit` stopped: `max_epochs=30` reached.
`Trainer.fit` stopped: `max_epochs=30` reached.
[I 2026-04-15 21:36:19,911] Trial 5 finished with value: 0.1165 and parameters: {'left_wall_dist_num_layers': 2, 'left_wall_dist_activation': 'elu', 'left_wall_dist_out_channels_l0': 34, 'left_wall_dist_pool_size_l0': 8, 'left_wall_dist_out_channels_l1': 159, 'left_wall_dist_pool_size_l1': 2, 'track_width_num_layers': 5, 'track_width_activation': 'relu', 'track_width_out_channels_l0': 151, 'track_width_pool_size_l0': 8, 'track_width_out_channels_l1': 218, 'track_width_pool_size_l1': 2, 'track_width_out_channels_l2': 99, 'track_width_pool_size_l2': 4, 'track_width_out_channels_l3': 76, 'track_width_pool_size_l3': 4, 'track_width_out_channels_l4': 50, 'track_width_pool_size_l4': 8, 'heading_error_num_layers': 3, 'heading_error_activation': 'relu', 'heading_error_out_channels_l0': 109, 'heading_error_pool_size_l0': 4, 'heading_error_out_channels_l1': 84, 'heading_error_pool_size_l1': 8, 'heading_error_out_channels_l2': 76, 'heading_error_pool_size_l2': 4, 'heading_error_fc_hidden': 38}. Best is trial 5 with value: 0.1165.
[rank: 0] Seed set to 42
[rank: 0] Seed set to 42
GPU available: True (cuda), used: True
TPU available: False, using: 0 TPU cores
GPU available: True (cuda), used: True
TPU available: False, using: 0 TPU cores
💡 Tip: For seamless cloud logging and experiment tracking, try installing [litlogger](https://pypi.org/project/litlogger/) to enable LitLogger, which logs metrics and artifacts automatically to the Lightning Experiments platform.
💡 Tip: For seamless cloud logging and experiment tracking, try installing [litlogger](https://pypi.org/project/litlogger/) to enable LitLogger, which logs metrics and artifacts automatically to the Lightning Experiments platform.
[rank: 0] Seed set to 42
GPU available: True (cuda), used: True
TPU available: False, using: 0 TPU cores
💡 Tip: For seamless cloud logging and experiment tracking, try installing [litlogger](https://pypi.org/project/litlogger/) to enable LitLogger, which logs metrics and artifacts automatically to the Lightning Experiments platform.
LOCAL_RANK: 0 - CUDA_VISIBLE_DEVICES: [0]
LOCAL_RANK: 0 - CUDA_VISIBLE_DEVICES: [0]
LOCAL_RANK: 0 - CUDA_VISIBLE_DEVICES: [0]
SLURM auto-requeueing enabled. Setting signal handlers.
SLURM auto-requeueing enabled. Setting signal handlers.
SLURM auto-requeueing enabled. Setting signal handlers.
`Trainer.fit` stopped: `max_epochs=30` reached.
`Trainer.fit` stopped: `max_epochs=30` reached.
`Trainer.fit` stopped: `max_epochs=30` reached.
[I 2026-04-15 21:38:55,837] Trial 6 finished with value: 0.145 and parameters: {'left_wall_dist_num_layers': 2, 'left_wall_dist_activation': 'elu', 'left_wall_dist_out_channels_l0': 89, 'left_wall_dist_pool_size_l0': 8, 'left_wall_dist_out_channels_l1': 146, 'left_wall_dist_pool_size_l1': 4, 'left_wall_dist_fc_hidden': 91, 'track_width_num_layers': 5, 'track_width_activation': 'relu', 'track_width_out_channels_l0': 54, 'track_width_pool_size_l0': 4, 'track_width_out_channels_l1': 163, 'track_width_pool_size_l1': 2, 'track_width_out_channels_l2': 130, 'track_width_pool_size_l2': 8, 'track_width_out_channels_l3': 37, 'track_width_pool_size_l3': 8, 'heading_error_num_layers': 4, 'heading_error_activation': 'relu', 'heading_error_out_channels_l0': 44, 'heading_error_pool_size_l0': 2, 'heading_error_out_channels_l1': 112, 'heading_error_pool_size_l1': 8, 'heading_error_out_channels_l2': 95, 'heading_error_pool_size_l2': 4, 'heading_error_out_channels_l3': 95, 'heading_error_pool_size_l3': 4, 'heading_error_fc_hidden': 65}. Best is trial 5 with value: 0.1165.
[rank: 0] Seed set to 42
[rank: 0] Seed set to 42
[rank: 0] Seed set to 42
GPU available: True (cuda), used: True
TPU available: False, using: 0 TPU cores
GPU available: True (cuda), used: True
TPU available: False, using: 0 TPU cores
💡 Tip: For seamless cloud logging and experiment tracking, try installing [litlogger](https://pypi.org/project/litlogger/) to enable LitLogger, which logs metrics and artifacts automatically to the Lightning Experiments platform.
💡 Tip: For seamless cloud logging and experiment tracking, try installing [litlogger](https://pypi.org/project/litlogger/) to enable LitLogger, which logs metrics and artifacts automatically to the Lightning Experiments platform.
GPU available: True (cuda), used: True
TPU available: False, using: 0 TPU cores
💡 Tip: For seamless cloud logging and experiment tracking, try installing [litlogger](https://pypi.org/project/litlogger/) to enable LitLogger, which logs metrics and artifacts automatically to the Lightning Experiments platform.
LOCAL_RANK: 0 - CUDA_VISIBLE_DEVICES: [0]
LOCAL_RANK: 0 - CUDA_VISIBLE_DEVICES: [0]
LOCAL_RANK: 0 - CUDA_VISIBLE_DEVICES: [0]
SLURM auto-requeueing enabled. Setting signal handlers.
SLURM auto-requeueing enabled. Setting signal handlers.
SLURM auto-requeueing enabled. Setting signal handlers.
`Trainer.fit` stopped: `max_epochs=30` reached.
`Trainer.fit` stopped: `max_epochs=30` reached.
`Trainer.fit` stopped: `max_epochs=30` reached.
[I 2026-04-15 21:41:25,295] Trial 7 finished with value: 0.2046 and parameters: {'left_wall_dist_num_layers': 5, 'left_wall_dist_activation': 'relu', 'left_wall_dist_out_channels_l0': 69, 'left_wall_dist_pool_size_l0': 8, 'left_wall_dist_out_channels_l1': 54, 'left_wall_dist_pool_size_l1': 4, 'left_wall_dist_out_channels_l2': 37, 'left_wall_dist_pool_size_l2': 8, 'left_wall_dist_out_channels_l3': 66, 'left_wall_dist_pool_size_l3': 8, 'track_width_num_layers': 2, 'track_width_activation': 'relu', 'track_width_out_channels_l0': 55, 'track_width_pool_size_l0': 4, 'track_width_out_channels_l1': 48, 'track_width_pool_size_l1': 8, 'track_width_fc_hidden': 45, 'heading_error_num_layers': 4, 'heading_error_activation': 'elu', 'heading_error_out_channels_l0': 60, 'heading_error_pool_size_l0': 8, 'heading_error_out_channels_l1': 60, 'heading_error_pool_size_l1': 2, 'heading_error_out_channels_l2': 69, 'heading_error_pool_size_l2': 2, 'heading_error_out_channels_l3': 179, 'heading_error_pool_size_l3': 2, 'heading_error_fc_hidden': 121}. Best is trial 5 with value: 0.1165.
[rank: 0] Seed set to 42
[rank: 0] Seed set to 42
[rank: 0] Seed set to 42
GPU available: True (cuda), used: True
TPU available: False, using: 0 TPU cores
💡 Tip: For seamless cloud logging and experiment tracking, try installing [litlogger](https://pypi.org/project/litlogger/) to enable LitLogger, which logs metrics and artifacts automatically to the Lightning Experiments platform.
GPU available: True (cuda), used: True
TPU available: False, using: 0 TPU cores
💡 Tip: For seamless cloud logging and experiment tracking, try installing [litlogger](https://pypi.org/project/litlogger/) to enable LitLogger, which logs metrics and artifacts automatically to the Lightning Experiments platform.
GPU available: True (cuda), used: True
TPU available: False, using: 0 TPU cores
💡 Tip: For seamless cloud logging and experiment tracking, try installing [litlogger](https://pypi.org/project/litlogger/) to enable LitLogger, which logs metrics and artifacts automatically to the Lightning Experiments platform.
LOCAL_RANK: 0 - CUDA_VISIBLE_DEVICES: [0]
LOCAL_RANK: 0 - CUDA_VISIBLE_DEVICES: [0]
LOCAL_RANK: 0 - CUDA_VISIBLE_DEVICES: [0]
SLURM auto-requeueing enabled. Setting signal handlers.
SLURM auto-requeueing enabled. Setting signal handlers.
SLURM auto-requeueing enabled. Setting signal handlers.
`Trainer.fit` stopped: `max_epochs=30` reached.
`Trainer.fit` stopped: `max_epochs=30` reached.
`Trainer.fit` stopped: `max_epochs=30` reached.
