[I 2026-04-23 21:32:28,530] Trial 52 finished with value: 0.092 and parameters: {'left_wall_dist_num_layers': 1, 'left_wall_dist_activation': 'relu', 'left_wall_dist_max_flattened': 4288, 'left_wall_dist_fc_hidden': 32, 'left_wall_dist_pool_size_l0': 2, 'track_width_num_layers': 2, 'track_width_activation': 'relu', 'track_width_max_flattened': 4288, 'track_width_fc_hidden': 32, 'track_width_pool_size_l0': 2, 'heading_error_num_layers': 2, 'heading_error_activation': 'elu', 'heading_error_max_flattened': 1072, 'heading_error_fc_hidden': 64, 'heading_error_pool_size_l0': 8, 'heading_error_out_channels_l0': 8, 'heading_error_pool_size_l1': 8, 'heading_error_out_channels_l1': 27}. Best is trial 3 with value: 0.0918.
[rank: 0] Seed set to 42
[rank: 0] Seed set to 42
[rank: 0] Seed set to 42
GPU available: True (cuda), used: True
TPU available: False, using: 0 TPU cores
GPU available: True (cuda), used: True
TPU available: False, using: 0 TPU cores
GPU available: True (cuda), used: True
TPU available: False, using: 0 TPU cores
💡 Tip: For seamless cloud logging and experiment tracking, try installing [litlogger](https://pypi.org/project/litlogger/) to enable LitLogger, which logs metrics and artifacts automatically to the Lightning Experiments platform.
💡 Tip: For seamless cloud logging and experiment tracking, try installing [litlogger](https://pypi.org/project/litlogger/) to enable LitLogger, which logs metrics and artifacts automatically to the Lightning Experiments platform.
💡 Tip: For seamless cloud logging and experiment tracking, try installing [litlogger](https://pypi.org/project/litlogger/) to enable LitLogger, which logs metrics and artifacts automatically to the Lightning Experiments platform.
LOCAL_RANK: 0 - CUDA_VISIBLE_DEVICES: [0]
LOCAL_RANK: 0 - CUDA_VISIBLE_DEVICES: [0]
LOCAL_RANK: 0 - CUDA_VISIBLE_DEVICES: [0]
SLURM auto-requeueing enabled. Setting signal handlers.
SLURM auto-requeueing enabled. Setting signal handlers.
SLURM auto-requeueing enabled. Setting signal handlers.
`Trainer.fit` stopped: `max_epochs=30` reached.
`Trainer.fit` stopped: `max_epochs=30` reached.
`Trainer.fit` stopped: `max_epochs=30` reached.
[I 2026-04-23 21:34:34,226] Trial 53 finished with value: 0.0944 and parameters: {'left_wall_dist_num_layers': 1, 'left_wall_dist_activation': 'relu', 'left_wall_dist_max_flattened': 4288, 'left_wall_dist_fc_hidden': 32, 'left_wall_dist_pool_size_l0': 2, 'track_width_num_layers': 2, 'track_width_activation': 'relu', 'track_width_max_flattened': 4288, 'track_width_fc_hidden': 32, 'track_width_pool_size_l0': 2, 'heading_error_num_layers': 2, 'heading_error_activation': 'elu', 'heading_error_max_flattened': 1072, 'heading_error_fc_hidden': 64, 'heading_error_pool_size_l0': 8, 'heading_error_out_channels_l0': 8, 'heading_error_pool_size_l1': 8, 'heading_error_out_channels_l1': 27}. Best is trial 3 with value: 0.0918.
[rank: 0] Seed set to 42
[rank: 0] Seed set to 42
[rank: 0] Seed set to 42
GPU available: True (cuda), used: True
GPU available: True (cuda), used: True
GPU available: True (cuda), used: True
TPU available: False, using: 0 TPU cores
TPU available: False, using: 0 TPU cores
TPU available: False, using: 0 TPU cores
💡 Tip: For seamless cloud logging and experiment tracking, try installing [litlogger](https://pypi.org/project/litlogger/) to enable LitLogger, which logs metrics and artifacts automatically to the Lightning Experiments platform.
💡 Tip: For seamless cloud logging and experiment tracking, try installing [litlogger](https://pypi.org/project/litlogger/) to enable LitLogger, which logs metrics and artifacts automatically to the Lightning Experiments platform.
💡 Tip: For seamless cloud logging and experiment tracking, try installing [litlogger](https://pypi.org/project/litlogger/) to enable LitLogger, which logs metrics and artifacts automatically to the Lightning Experiments platform.
LOCAL_RANK: 0 - CUDA_VISIBLE_DEVICES: [0]
LOCAL_RANK: 0 - CUDA_VISIBLE_DEVICES: [0]
LOCAL_RANK: 0 - CUDA_VISIBLE_DEVICES: [0]
SLURM auto-requeueing enabled. Setting signal handlers.
SLURM auto-requeueing enabled. Setting signal handlers.
SLURM auto-requeueing enabled. Setting signal handlers.
`Trainer.fit` stopped: `max_epochs=30` reached.
`Trainer.fit` stopped: `max_epochs=30` reached.
`Trainer.fit` stopped: `max_epochs=30` reached.
[I 2026-04-23 21:36:41,006] Trial 54 finished with value: 0.0957 and parameters: {'left_wall_dist_num_layers': 1, 'left_wall_dist_activation': 'relu', 'left_wall_dist_max_flattened': 4288, 'left_wall_dist_fc_hidden': 32, 'left_wall_dist_pool_size_l0': 2, 'track_width_num_layers': 2, 'track_width_activation': 'relu', 'track_width_max_flattened': 4288, 'track_width_fc_hidden': 32, 'track_width_pool_size_l0': 2, 'heading_error_num_layers': 2, 'heading_error_activation': 'elu', 'heading_error_max_flattened': 1072, 'heading_error_fc_hidden': 64, 'heading_error_pool_size_l0': 8, 'heading_error_out_channels_l0': 8, 'heading_error_pool_size_l1': 8, 'heading_error_out_channels_l1': 33}. Best is trial 3 with value: 0.0918.
[rank: 0] Seed set to 42
[rank: 0] Seed set to 42
GPU available: True (cuda), used: True
TPU available: False, using: 0 TPU cores
💡 Tip: For seamless cloud logging and experiment tracking, try installing [litlogger](https://pypi.org/project/litlogger/) to enable LitLogger, which logs metrics and artifacts automatically to the Lightning Experiments platform.
GPU available: True (cuda), used: True
TPU available: False, using: 0 TPU cores
💡 Tip: For seamless cloud logging and experiment tracking, try installing [litlogger](https://pypi.org/project/litlogger/) to enable LitLogger, which logs metrics and artifacts automatically to the Lightning Experiments platform.
[rank: 0] Seed set to 42
GPU available: True (cuda), used: True
TPU available: False, using: 0 TPU cores
💡 Tip: For seamless cloud logging and experiment tracking, try installing [litlogger](https://pypi.org/project/litlogger/) to enable LitLogger, which logs metrics and artifacts automatically to the Lightning Experiments platform.
LOCAL_RANK: 0 - CUDA_VISIBLE_DEVICES: [0]
LOCAL_RANK: 0 - CUDA_VISIBLE_DEVICES: [0]
SLURM auto-requeueing enabled. Setting signal handlers.
LOCAL_RANK: 0 - CUDA_VISIBLE_DEVICES: [0]
SLURM auto-requeueing enabled. Setting signal handlers.
SLURM auto-requeueing enabled. Setting signal handlers.
`Trainer.fit` stopped: `max_epochs=30` reached.
`Trainer.fit` stopped: `max_epochs=30` reached.
`Trainer.fit` stopped: `max_epochs=30` reached.
[I 2026-04-23 21:39:13,435] Trial 55 finished with value: 0.1005 and parameters: {'left_wall_dist_num_layers': 1, 'left_wall_dist_activation': 'relu', 'left_wall_dist_max_flattened': 4288, 'left_wall_dist_fc_hidden': 32, 'left_wall_dist_pool_size_l0': 2, 'track_width_num_layers': 1, 'track_width_activation': 'relu', 'track_width_max_flattened': 4288, 'track_width_fc_hidden': 32, 'track_width_pool_size_l0': 2, 'heading_error_num_layers': 1, 'heading_error_activation': 'elu', 'heading_error_max_flattened': 1072, 'heading_error_fc_hidden': 64, 'heading_error_pool_size_l0': 8, 'heading_error_out_channels_l0': 8}. Best is trial 3 with value: 0.0918.
[rank: 0] Seed set to 42
[rank: 0] Seed set to 42
[rank: 0] Seed set to 42
GPU available: True (cuda), used: True
TPU available: False, using: 0 TPU cores
💡 Tip: For seamless cloud logging and experiment tracking, try installing [litlogger](https://pypi.org/project/litlogger/) to enable LitLogger, which logs metrics and artifacts automatically to the Lightning Experiments platform.
GPU available: True (cuda), used: True
TPU available: False, using: 0 TPU cores
💡 Tip: For seamless cloud logging and experiment tracking, try installing [litlogger](https://pypi.org/project/litlogger/) to enable LitLogger, which logs metrics and artifacts automatically to the Lightning Experiments platform.
GPU available: True (cuda), used: True
TPU available: False, using: 0 TPU cores
💡 Tip: For seamless cloud logging and experiment tracking, try installing [litlogger](https://pypi.org/project/litlogger/) to enable LitLogger, which logs metrics and artifacts automatically to the Lightning Experiments platform.
LOCAL_RANK: 0 - CUDA_VISIBLE_DEVICES: [0]
LOCAL_RANK: 0 - CUDA_VISIBLE_DEVICES: [0]
SLURM auto-requeueing enabled. Setting signal handlers.
LOCAL_RANK: 0 - CUDA_VISIBLE_DEVICES: [0]
SLURM auto-requeueing enabled. Setting signal handlers.
SLURM auto-requeueing enabled. Setting signal handlers.
`Trainer.fit` stopped: `max_epochs=30` reached.
`Trainer.fit` stopped: `max_epochs=30` reached.
`Trainer.fit` stopped: `max_epochs=30` reached.
[I 2026-04-23 21:41:50,862] Trial 56 finished with value: 0.106 and parameters: {'left_wall_dist_num_layers': 1, 'left_wall_dist_activation': 'relu', 'left_wall_dist_max_flattened': 1072, 'left_wall_dist_fc_hidden': 32, 'left_wall_dist_pool_size_l0': 4, 'track_width_num_layers': 2, 'track_width_activation': 'relu', 'track_width_max_flattened': 4288, 'track_width_fc_hidden': 32, 'track_width_pool_size_l0': 2, 'heading_error_num_layers': 2, 'heading_error_activation': 'elu', 'heading_error_max_flattened': 4288, 'heading_error_fc_hidden': 64, 'heading_error_pool_size_l0': 8, 'heading_error_out_channels_l0': 12, 'heading_error_pool_size_l1': 8, 'heading_error_out_channels_l1': 29}. Best is trial 3 with value: 0.0918.
[rank: 0] Seed set to 42
[rank: 0] Seed set to 42
[rank: 0] Seed set to 42
GPU available: True (cuda), used: True
TPU available: False, using: 0 TPU cores
💡 Tip: For seamless cloud logging and experiment tracking, try installing [litlogger](https://pypi.org/project/litlogger/) to enable LitLogger, which logs metrics and artifacts automatically to the Lightning Experiments platform.
GPU available: True (cuda), used: True
TPU available: False, using: 0 TPU cores
💡 Tip: For seamless cloud logging and experiment tracking, try installing [litlogger](https://pypi.org/project/litlogger/) to enable LitLogger, which logs metrics and artifacts automatically to the Lightning Experiments platform.
GPU available: True (cuda), used: True
TPU available: False, using: 0 TPU cores
💡 Tip: For seamless cloud logging and experiment tracking, try installing [litlogger](https://pypi.org/project/litlogger/) to enable LitLogger, which logs metrics and artifacts automatically to the Lightning Experiments platform.
LOCAL_RANK: 0 - CUDA_VISIBLE_DEVICES: [0]
LOCAL_RANK: 0 - CUDA_VISIBLE_DEVICES: [0]
LOCAL_RANK: 0 - CUDA_VISIBLE_DEVICES: [0]
SLURM auto-requeueing enabled. Setting signal handlers.
SLURM auto-requeueing enabled. Setting signal handlers.
SLURM auto-requeueing enabled. Setting signal handlers.
`Trainer.fit` stopped: `max_epochs=30` reached.
`Trainer.fit` stopped: `max_epochs=30` reached.
`Trainer.fit` stopped: `max_epochs=30` reached.
[I 2026-04-23 21:44:38,680] Trial 57 finished with value: 0.149 and parameters: {'left_wall_dist_num_layers': 1, 'left_wall_dist_activation': 'relu', 'left_wall_dist_max_flattened': 4288, 'left_wall_dist_fc_hidden': 128, 'left_wall_dist_pool_size_l0': 2, 'track_width_num_layers': 1, 'track_width_activation': 'relu', 'track_width_max_flattened': 4288, 'track_width_fc_hidden': 32, 'track_width_pool_size_l0': 2, 'heading_error_num_layers': 4, 'heading_error_activation': 'elu', 'heading_error_max_flattened': 1072, 'heading_error_fc_hidden': 128, 'heading_error_pool_size_l0': 8, 'heading_error_out_channels_l0': 8, 'heading_error_pool_size_l1': 8, 'heading_error_out_channels_l1': 28, 'heading_error_pool_size_l2': 4, 'heading_error_out_channels_l2': 137, 'heading_error_pool_size_l3': 8}. Best is trial 3 with value: 0.0918.
[rank: 0] Seed set to 42
[rank: 0] Seed set to 42
GPU available: True (cuda), used: True
TPU available: False, using: 0 TPU cores
💡 Tip: For seamless cloud logging and experiment tracking, try installing [litlogger](https://pypi.org/project/litlogger/) to enable LitLogger, which logs metrics and artifacts automatically to the Lightning Experiments platform.
GPU available: True (cuda), used: True
TPU available: False, using: 0 TPU cores
💡 Tip: For seamless cloud logging and experiment tracking, try installing [litlogger](https://pypi.org/project/litlogger/) to enable LitLogger, which logs metrics and artifacts automatically to the Lightning Experiments platform.
[rank: 0] Seed set to 42
GPU available: True (cuda), used: True
TPU available: False, using: 0 TPU cores
💡 Tip: For seamless cloud logging and experiment tracking, try installing [litlogger](https://pypi.org/project/litlogger/) to enable LitLogger, which logs metrics and artifacts automatically to the Lightning Experiments platform.
LOCAL_RANK: 0 - CUDA_VISIBLE_DEVICES: [0]
LOCAL_RANK: 0 - CUDA_VISIBLE_DEVICES: [0]
SLURM auto-requeueing enabled. Setting signal handlers.
SLURM auto-requeueing enabled. Setting signal handlers.
LOCAL_RANK: 0 - CUDA_VISIBLE_DEVICES: [0]
SLURM auto-requeueing enabled. Setting signal handlers.
`Trainer.fit` stopped: `max_epochs=30` reached.
`Trainer.fit` stopped: `max_epochs=30` reached.
`Trainer.fit` stopped: `max_epochs=30` reached.
[I 2026-04-23 21:47:21,026] Trial 58 finished with value: 0.1055 and parameters: {'left_wall_dist_num_layers': 1, 'left_wall_dist_activation': 'elu', 'left_wall_dist_max_flattened': 4288, 'left_wall_dist_fc_hidden': 32, 'left_wall_dist_pool_size_l0': 2, 'track_width_num_layers': 2, 'track_width_activation': 'relu', 'track_width_max_flattened': 4288, 'track_width_fc_hidden': 32, 'track_width_pool_size_l0': 2, 'heading_error_num_layers': 2, 'heading_error_activation': 'elu', 'heading_error_max_flattened': 2144, 'heading_error_fc_hidden': 64, 'heading_error_pool_size_l0': 8, 'heading_error_out_channels_l0': 9, 'heading_error_pool_size_l1': 8, 'heading_error_out_channels_l1': 44}. Best is trial 3 with value: 0.0918.
[rank: 0] Seed set to 42
[rank: 0] Seed set to 42
[rank: 0] Seed set to 42
GPU available: True (cuda), used: True
TPU available: False, using: 0 TPU cores
💡 Tip: For seamless cloud logging and experiment tracking, try installing [litlogger](https://pypi.org/project/litlogger/) to enable LitLogger, which logs metrics and artifacts automatically to the Lightning Experiments platform.
GPU available: True (cuda), used: True
TPU available: False, using: 0 TPU cores
💡 Tip: For seamless cloud logging and experiment tracking, try installing [litlogger](https://pypi.org/project/litlogger/) to enable LitLogger, which logs metrics and artifacts automatically to the Lightning Experiments platform.
GPU available: True (cuda), used: True
TPU available: False, using: 0 TPU cores
💡 Tip: For seamless cloud logging and experiment tracking, try installing [litlogger](https://pypi.org/project/litlogger/) to enable LitLogger, which logs metrics and artifacts automatically to the Lightning Experiments platform.
LOCAL_RANK: 0 - CUDA_VISIBLE_DEVICES: [0]
LOCAL_RANK: 0 - CUDA_VISIBLE_DEVICES: [0]
LOCAL_RANK: 0 - CUDA_VISIBLE_DEVICES: [0]
SLURM auto-requeueing enabled. Setting signal handlers.
SLURM auto-requeueing enabled. Setting signal handlers.
SLURM auto-requeueing enabled. Setting signal handlers.
`Trainer.fit` stopped: `max_epochs=30` reached.
`Trainer.fit` stopped: `max_epochs=30` reached.
`Trainer.fit` stopped: `max_epochs=30` reached.
[I 2026-04-23 21:50:14,639] Trial 59 finished with value: 0.1018 and parameters: {'left_wall_dist_num_layers': 1, 'left_wall_dist_activation': 'relu', 'left_wall_dist_max_flattened': 2144, 'left_wall_dist_fc_hidden': 32, 'left_wall_dist_pool_size_l0': 4, 'track_width_num_layers': 3, 'track_width_activation': 'relu', 'track_width_max_flattened': 1072, 'track_width_fc_hidden': 64, 'track_width_pool_size_l0': 2, 'heading_error_num_layers': 3, 'heading_error_activation': 'elu', 'heading_error_max_flattened': 1072, 'heading_error_fc_hidden': 32, 'heading_error_pool_size_l0': 8, 'heading_error_out_channels_l0': 8, 'heading_error_pool_size_l1': 8, 'heading_error_out_channels_l1': 29, 'heading_error_pool_size_l2': 2, 'heading_error_out_channels_l2': 46}. Best is trial 3 with value: 0.0918.
[rank: 0] Seed set to 42
[rank: 0] Seed set to 42
[rank: 0] Seed set to 42
GPU available: True (cuda), used: True
TPU available: False, using: 0 TPU cores
💡 Tip: For seamless cloud logging and experiment tracking, try installing [litlogger](https://pypi.org/project/litlogger/) to enable LitLogger, which logs metrics and artifacts automatically to the Lightning Experiments platform.
GPU available: True (cuda), used: True
TPU available: False, using: 0 TPU cores
💡 Tip: For seamless cloud logging and experiment tracking, try installing [litlogger](https://pypi.org/project/litlogger/) to enable LitLogger, which logs metrics and artifacts automatically to the Lightning Experiments platform.
GPU available: True (cuda), used: True
TPU available: False, using: 0 TPU cores
💡 Tip: For seamless cloud logging and experiment tracking, try installing [litlogger](https://pypi.org/project/litlogger/) to enable LitLogger, which logs metrics and artifacts automatically to the Lightning Experiments platform.
LOCAL_RANK: 0 - CUDA_VISIBLE_DEVICES: [0]
LOCAL_RANK: 0 - CUDA_VISIBLE_DEVICES: [0]
SLURM auto-requeueing enabled. Setting signal handlers.
LOCAL_RANK: 0 - CUDA_VISIBLE_DEVICES: [0]
SLURM auto-requeueing enabled. Setting signal handlers.
SLURM auto-requeueing enabled. Setting signal handlers.
`Trainer.fit` stopped: `max_epochs=30` reached.
`Trainer.fit` stopped: `max_epochs=30` reached.
`Trainer.fit` stopped: `max_epochs=30` reached.
[I 2026-04-23 21:53:04,386] Trial 60 finished with value: 0.1296 and parameters: {'left_wall_dist_num_layers': 1, 'left_wall_dist_activation': 'relu', 'left_wall_dist_max_flattened': 1072, 'left_wall_dist_fc_hidden': 64, 'left_wall_dist_pool_size_l0': 2, 'track_width_num_layers': 2, 'track_width_activation': 'relu', 'track_width_max_flattened': 4288, 'track_width_fc_hidden': 32, 'track_width_pool_size_l0': 4, 'track_width_out_channels_l0': 10, 'track_width_pool_size_l1': 8, 'track_width_out_channels_l1': 53, 'heading_error_num_layers': 1, 'heading_error_activation': 'elu', 'heading_error_max_flattened': 1072, 'heading_error_fc_hidden': 64, 'heading_error_pool_size_l0': 8, 'heading_error_out_channels_l0': 8}. Best is trial 3 with value: 0.0918.
[rank: 0] Seed set to 42
[rank: 0] Seed set to 42
[rank: 0] Seed set to 42
GPU available: True (cuda), used: True
TPU available: False, using: 0 TPU cores
💡 Tip: For seamless cloud logging and experiment tracking, try installing [litlogger](https://pypi.org/project/litlogger/) to enable LitLogger, which logs metrics and artifacts automatically to the Lightning Experiments platform.
GPU available: True (cuda), used: True
TPU available: False, using: 0 TPU cores
💡 Tip: For seamless cloud logging and experiment tracking, try installing [litlogger](https://pypi.org/project/litlogger/) to enable LitLogger, which logs metrics and artifacts automatically to the Lightning Experiments platform.
GPU available: True (cuda), used: True
TPU available: False, using: 0 TPU cores
💡 Tip: For seamless cloud logging and experiment tracking, try installing [litlogger](https://pypi.org/project/litlogger/) to enable LitLogger, which logs metrics and artifacts automatically to the Lightning Experiments platform.
LOCAL_RANK: 0 - CUDA_VISIBLE_DEVICES: [0]
LOCAL_RANK: 0 - CUDA_VISIBLE_DEVICES: [0]
SLURM auto-requeueing enabled. Setting signal handlers.
SLURM auto-requeueing enabled. Setting signal handlers.
LOCAL_RANK: 0 - CUDA_VISIBLE_DEVICES: [0]
SLURM auto-requeueing enabled. Setting signal handlers.
`Trainer.fit` stopped: `max_epochs=30` reached.
`Trainer.fit` stopped: `max_epochs=30` reached.
`Trainer.fit` stopped: `max_epochs=30` reached.
[I 2026-04-23 21:55:42,257] Trial 61 finished with value: 0.0982 and parameters: {'left_wall_dist_num_layers': 2, 'left_wall_dist_activation': 'relu', 'left_wall_dist_max_flattened': 4288, 'left_wall_dist_fc_hidden': 32, 'left_wall_dist_pool_size_l0': 2, 'track_width_num_layers': 2, 'track_width_activation': 'relu', 'track_width_max_flattened': 4288, 'track_width_fc_hidden': 32, 'track_width_pool_size_l0': 2, 'heading_error_num_layers': 2, 'heading_error_activation': 'elu', 'heading_error_max_flattened': 1072, 'heading_error_fc_hidden': 64, 'heading_error_pool_size_l0': 8, 'heading_error_out_channels_l0': 8, 'heading_error_pool_size_l1': 8, 'heading_error_out_channels_l1': 36}. Best is trial 3 with value: 0.0918.
[rank: 0] Seed set to 42
[rank: 0] Seed set to 42
[rank: 0] Seed set to 42
GPU available: True (cuda), used: True
TPU available: False, using: 0 TPU cores
💡 Tip: For seamless cloud logging and experiment tracking, try installing [litlogger](https://pypi.org/project/litlogger/) to enable LitLogger, which logs metrics and artifacts automatically to the Lightning Experiments platform.
GPU available: True (cuda), used: True
TPU available: False, using: 0 TPU cores
💡 Tip: For seamless cloud logging and experiment tracking, try installing [litlogger](https://pypi.org/project/litlogger/) to enable LitLogger, which logs metrics and artifacts automatically to the Lightning Experiments platform.
GPU available: True (cuda), used: True
TPU available: False, using: 0 TPU cores
💡 Tip: For seamless cloud logging and experiment tracking, try installing [litlogger](https://pypi.org/project/litlogger/) to enable LitLogger, which logs metrics and artifacts automatically to the Lightning Experiments platform.
LOCAL_RANK: 0 - CUDA_VISIBLE_DEVICES: [0]
LOCAL_RANK: 0 - CUDA_VISIBLE_DEVICES: [0]
LOCAL_RANK: 0 - CUDA_VISIBLE_DEVICES: [0]
SLURM auto-requeueing enabled. Setting signal handlers.
SLURM auto-requeueing enabled. Setting signal handlers.
SLURM auto-requeueing enabled. Setting signal handlers.
`Trainer.fit` stopped: `max_epochs=30` reached.
`Trainer.fit` stopped: `max_epochs=30` reached.
`Trainer.fit` stopped: `max_epochs=30` reached.
