[I 2026-04-23 20:01:38,201] Trial 14 finished with value: 0.1013 and parameters: {'left_wall_dist_num_layers': 3, 'left_wall_dist_activation': 'relu', 'left_wall_dist_max_flattened': 1072, 'left_wall_dist_fc_hidden': 128, 'left_wall_dist_pool_size_l0': 2, 'track_width_num_layers': 2, 'track_width_activation': 'relu', 'track_width_max_flattened': 4288, 'track_width_fc_hidden': 64, 'track_width_pool_size_l0': 2, 'heading_error_num_layers': 2, 'heading_error_activation': 'elu', 'heading_error_max_flattened': 4288, 'heading_error_fc_hidden': 64, 'heading_error_pool_size_l0': 8, 'heading_error_out_channels_l0': 28, 'heading_error_pool_size_l1': 4, 'heading_error_out_channels_l1': 9}. Best is trial 3 with value: 0.0918.
[rank: 0] Seed set to 42
[rank: 0] Seed set to 42
[rank: 0] Seed set to 42
GPU available: True (cuda), used: True
TPU available: False, using: 0 TPU cores
GPU available: True (cuda), used: True
TPU available: False, using: 0 TPU cores
💡 Tip: For seamless cloud logging and experiment tracking, try installing [litlogger](https://pypi.org/project/litlogger/) to enable LitLogger, which logs metrics and artifacts automatically to the Lightning Experiments platform.
💡 Tip: For seamless cloud logging and experiment tracking, try installing [litlogger](https://pypi.org/project/litlogger/) to enable LitLogger, which logs metrics and artifacts automatically to the Lightning Experiments platform.
GPU available: True (cuda), used: True
TPU available: False, using: 0 TPU cores
💡 Tip: For seamless cloud logging and experiment tracking, try installing [litlogger](https://pypi.org/project/litlogger/) to enable LitLogger, which logs metrics and artifacts automatically to the Lightning Experiments platform.
LOCAL_RANK: 0 - CUDA_VISIBLE_DEVICES: [0]
LOCAL_RANK: 0 - CUDA_VISIBLE_DEVICES: [0]
LOCAL_RANK: 0 - CUDA_VISIBLE_DEVICES: [0]
SLURM auto-requeueing enabled. Setting signal handlers.
SLURM auto-requeueing enabled. Setting signal handlers.
SLURM auto-requeueing enabled. Setting signal handlers.
`Trainer.fit` stopped: `max_epochs=30` reached.
`Trainer.fit` stopped: `max_epochs=30` reached.
`Trainer.fit` stopped: `max_epochs=30` reached.
[I 2026-04-23 20:03:56,262] Trial 15 finished with value: 0.1275 and parameters: {'left_wall_dist_num_layers': 2, 'left_wall_dist_activation': 'relu', 'left_wall_dist_max_flattened': 4288, 'left_wall_dist_fc_hidden': 32, 'left_wall_dist_pool_size_l0': 4, 'left_wall_dist_out_channels_l0': 13, 'left_wall_dist_pool_size_l1': 8, 'left_wall_dist_out_channels_l1': 122, 'track_width_num_layers': 2, 'track_width_activation': 'relu', 'track_width_max_flattened': 4288, 'track_width_fc_hidden': 64, 'track_width_pool_size_l0': 2, 'heading_error_num_layers': 2, 'heading_error_activation': 'elu', 'heading_error_max_flattened': 4288, 'heading_error_fc_hidden': 32, 'heading_error_pool_size_l0': 8, 'heading_error_out_channels_l0': 32, 'heading_error_pool_size_l1': 2, 'heading_error_out_channels_l1': 15}. Best is trial 3 with value: 0.0918.
[rank: 0] Seed set to 42
[rank: 0] Seed set to 42
[rank: 0] Seed set to 42
GPU available: True (cuda), used: True
TPU available: False, using: 0 TPU cores
💡 Tip: For seamless cloud logging and experiment tracking, try installing [litlogger](https://pypi.org/project/litlogger/) to enable LitLogger, which logs metrics and artifacts automatically to the Lightning Experiments platform.
GPU available: True (cuda), used: True
TPU available: False, using: 0 TPU cores
💡 Tip: For seamless cloud logging and experiment tracking, try installing [litlogger](https://pypi.org/project/litlogger/) to enable LitLogger, which logs metrics and artifacts automatically to the Lightning Experiments platform.
GPU available: True (cuda), used: True
TPU available: False, using: 0 TPU cores
💡 Tip: For seamless cloud logging and experiment tracking, try installing [litlogger](https://pypi.org/project/litlogger/) to enable LitLogger, which logs metrics and artifacts automatically to the Lightning Experiments platform.
LOCAL_RANK: 0 - CUDA_VISIBLE_DEVICES: [0]
LOCAL_RANK: 0 - CUDA_VISIBLE_DEVICES: [0]
LOCAL_RANK: 0 - CUDA_VISIBLE_DEVICES: [0]
SLURM auto-requeueing enabled. Setting signal handlers.
SLURM auto-requeueing enabled. Setting signal handlers.
SLURM auto-requeueing enabled. Setting signal handlers.
`Trainer.fit` stopped: `max_epochs=30` reached.
`Trainer.fit` stopped: `max_epochs=30` reached.
`Trainer.fit` stopped: `max_epochs=30` reached.
[I 2026-04-23 20:06:20,132] Trial 16 finished with value: 0.1722 and parameters: {'left_wall_dist_num_layers': 3, 'left_wall_dist_activation': 'relu', 'left_wall_dist_max_flattened': 1072, 'left_wall_dist_fc_hidden': 32, 'left_wall_dist_pool_size_l0': 4, 'track_width_num_layers': 1, 'track_width_activation': 'relu', 'track_width_max_flattened': 1072, 'track_width_fc_hidden': 64, 'track_width_pool_size_l0': 2, 'heading_error_num_layers': 3, 'heading_error_activation': 'elu', 'heading_error_max_flattened': 1072, 'heading_error_fc_hidden': 64, 'heading_error_pool_size_l0': 8, 'heading_error_out_channels_l0': 8, 'heading_error_pool_size_l1': 4, 'heading_error_out_channels_l1': 12, 'heading_error_pool_size_l2': 8, 'heading_error_out_channels_l2': 238}. Best is trial 3 with value: 0.0918.
[rank: 0] Seed set to 42
[rank: 0] Seed set to 42
[rank: 0] Seed set to 42
GPU available: True (cuda), used: True
TPU available: False, using: 0 TPU cores
💡 Tip: For seamless cloud logging and experiment tracking, try installing [litlogger](https://pypi.org/project/litlogger/) to enable LitLogger, which logs metrics and artifacts automatically to the Lightning Experiments platform.
GPU available: True (cuda), used: True
TPU available: False, using: 0 TPU cores
💡 Tip: For seamless cloud logging and experiment tracking, try installing [litlogger](https://pypi.org/project/litlogger/) to enable LitLogger, which logs metrics and artifacts automatically to the Lightning Experiments platform.
GPU available: True (cuda), used: True
TPU available: False, using: 0 TPU cores
💡 Tip: For seamless cloud logging and experiment tracking, try installing [litlogger](https://pypi.org/project/litlogger/) to enable LitLogger, which logs metrics and artifacts automatically to the Lightning Experiments platform.
LOCAL_RANK: 0 - CUDA_VISIBLE_DEVICES: [0]
LOCAL_RANK: 0 - CUDA_VISIBLE_DEVICES: [0]
LOCAL_RANK: 0 - CUDA_VISIBLE_DEVICES: [0]
SLURM auto-requeueing enabled. Setting signal handlers.
SLURM auto-requeueing enabled. Setting signal handlers.
SLURM auto-requeueing enabled. Setting signal handlers.
`Trainer.fit` stopped: `max_epochs=30` reached.
`Trainer.fit` stopped: `max_epochs=30` reached.
`Trainer.fit` stopped: `max_epochs=30` reached.
[I 2026-04-23 20:08:36,960] Trial 17 finished with value: 0.1381 and parameters: {'left_wall_dist_num_layers': 3, 'left_wall_dist_activation': 'relu', 'left_wall_dist_max_flattened': 1072, 'left_wall_dist_fc_hidden': 128, 'left_wall_dist_pool_size_l0': 2, 'track_width_num_layers': 2, 'track_width_activation': 'relu', 'track_width_max_flattened': 4288, 'track_width_fc_hidden': 64, 'track_width_pool_size_l0': 4, 'track_width_out_channels_l0': 11, 'track_width_pool_size_l1': 8, 'track_width_out_channels_l1': 128, 'heading_error_num_layers': 2, 'heading_error_activation': 'elu', 'heading_error_max_flattened': 4288, 'heading_error_fc_hidden': 32, 'heading_error_pool_size_l0': 8, 'heading_error_out_channels_l0': 32, 'heading_error_pool_size_l1': 4, 'heading_error_out_channels_l1': 21}. Best is trial 3 with value: 0.0918.
[rank: 0] Seed set to 42
[rank: 0] Seed set to 42
[rank: 0] Seed set to 42
GPU available: True (cuda), used: True
TPU available: False, using: 0 TPU cores
💡 Tip: For seamless cloud logging and experiment tracking, try installing [litlogger](https://pypi.org/project/litlogger/) to enable LitLogger, which logs metrics and artifacts automatically to the Lightning Experiments platform.
GPU available: True (cuda), used: True
TPU available: False, using: 0 TPU cores
💡 Tip: For seamless cloud logging and experiment tracking, try installing [litlogger](https://pypi.org/project/litlogger/) to enable LitLogger, which logs metrics and artifacts automatically to the Lightning Experiments platform.
GPU available: True (cuda), used: True
TPU available: False, using: 0 TPU cores
💡 Tip: For seamless cloud logging and experiment tracking, try installing [litlogger](https://pypi.org/project/litlogger/) to enable LitLogger, which logs metrics and artifacts automatically to the Lightning Experiments platform.
LOCAL_RANK: 0 - CUDA_VISIBLE_DEVICES: [0]
LOCAL_RANK: 0 - CUDA_VISIBLE_DEVICES: [0]
LOCAL_RANK: 0 - CUDA_VISIBLE_DEVICES: [0]
SLURM auto-requeueing enabled. Setting signal handlers.
SLURM auto-requeueing enabled. Setting signal handlers.
SLURM auto-requeueing enabled. Setting signal handlers.
`Trainer.fit` stopped: `max_epochs=30` reached.
`Trainer.fit` stopped: `max_epochs=30` reached.
`Trainer.fit` stopped: `max_epochs=30` reached.
[I 2026-04-23 20:10:41,970] Trial 18 finished with value: 0.1005 and parameters: {'left_wall_dist_num_layers': 1, 'left_wall_dist_activation': 'relu', 'left_wall_dist_max_flattened': 4288, 'left_wall_dist_fc_hidden': 32, 'left_wall_dist_pool_size_l0': 2, 'track_width_num_layers': 1, 'track_width_activation': 'relu', 'track_width_max_flattened': 4288, 'track_width_fc_hidden': 32, 'track_width_pool_size_l0': 2, 'heading_error_num_layers': 1, 'heading_error_activation': 'elu', 'heading_error_max_flattened': 1072, 'heading_error_fc_hidden': 64, 'heading_error_pool_size_l0': 8, 'heading_error_out_channels_l0': 8}. Best is trial 3 with value: 0.0918.
[rank: 0] Seed set to 42
[rank: 0] Seed set to 42
[rank: 0] Seed set to 42
GPU available: True (cuda), used: True
TPU available: False, using: 0 TPU cores
GPU available: True (cuda), used: True
TPU available: False, using: 0 TPU cores
GPU available: True (cuda), used: True
TPU available: False, using: 0 TPU cores
💡 Tip: For seamless cloud logging and experiment tracking, try installing [litlogger](https://pypi.org/project/litlogger/) to enable LitLogger, which logs metrics and artifacts automatically to the Lightning Experiments platform.
💡 Tip: For seamless cloud logging and experiment tracking, try installing [litlogger](https://pypi.org/project/litlogger/) to enable LitLogger, which logs metrics and artifacts automatically to the Lightning Experiments platform.
💡 Tip: For seamless cloud logging and experiment tracking, try installing [litlogger](https://pypi.org/project/litlogger/) to enable LitLogger, which logs metrics and artifacts automatically to the Lightning Experiments platform.
LOCAL_RANK: 0 - CUDA_VISIBLE_DEVICES: [0]
LOCAL_RANK: 0 - CUDA_VISIBLE_DEVICES: [0]
SLURM auto-requeueing enabled. Setting signal handlers.
SLURM auto-requeueing enabled. Setting signal handlers.
LOCAL_RANK: 0 - CUDA_VISIBLE_DEVICES: [0]
SLURM auto-requeueing enabled. Setting signal handlers.
`Trainer.fit` stopped: `max_epochs=30` reached.
`Trainer.fit` stopped: `max_epochs=30` reached.
`Trainer.fit` stopped: `max_epochs=30` reached.
[I 2026-04-23 20:12:50,080] Trial 19 finished with value: 0.1252 and parameters: {'left_wall_dist_num_layers': 1, 'left_wall_dist_activation': 'relu', 'left_wall_dist_max_flattened': 4288, 'left_wall_dist_fc_hidden': 32, 'left_wall_dist_pool_size_l0': 4, 'left_wall_dist_out_channels_l0': 13, 'track_width_num_layers': 1, 'track_width_activation': 'relu', 'track_width_max_flattened': 1072, 'track_width_fc_hidden': 32, 'track_width_pool_size_l0': 2, 'heading_error_num_layers': 1, 'heading_error_activation': 'elu', 'heading_error_max_flattened': 1072, 'heading_error_fc_hidden': 32, 'heading_error_pool_size_l0': 8, 'heading_error_out_channels_l0': 8}. Best is trial 3 with value: 0.0918.
[rank: 0] Seed set to 42
[rank: 0] Seed set to 42
[rank: 0] Seed set to 42
GPU available: True (cuda), used: True
TPU available: False, using: 0 TPU cores
💡 Tip: For seamless cloud logging and experiment tracking, try installing [litlogger](https://pypi.org/project/litlogger/) to enable LitLogger, which logs metrics and artifacts automatically to the Lightning Experiments platform.
GPU available: True (cuda), used: True
TPU available: False, using: 0 TPU cores
💡 Tip: For seamless cloud logging and experiment tracking, try installing [litlogger](https://pypi.org/project/litlogger/) to enable LitLogger, which logs metrics and artifacts automatically to the Lightning Experiments platform.
GPU available: True (cuda), used: True
TPU available: False, using: 0 TPU cores
💡 Tip: For seamless cloud logging and experiment tracking, try installing [litlogger](https://pypi.org/project/litlogger/) to enable LitLogger, which logs metrics and artifacts automatically to the Lightning Experiments platform.
LOCAL_RANK: 0 - CUDA_VISIBLE_DEVICES: [0]
LOCAL_RANK: 0 - CUDA_VISIBLE_DEVICES: [0]
LOCAL_RANK: 0 - CUDA_VISIBLE_DEVICES: [0]
SLURM auto-requeueing enabled. Setting signal handlers.
SLURM auto-requeueing enabled. Setting signal handlers.
SLURM auto-requeueing enabled. Setting signal handlers.
`Trainer.fit` stopped: `max_epochs=30` reached.
`Trainer.fit` stopped: `max_epochs=30` reached.
`Trainer.fit` stopped: `max_epochs=30` reached.
[I 2026-04-23 20:15:02,295] Trial 20 finished with value: 0.1072 and parameters: {'left_wall_dist_num_layers': 1, 'left_wall_dist_activation': 'relu', 'left_wall_dist_max_flattened': 4288, 'left_wall_dist_fc_hidden': 32, 'left_wall_dist_pool_size_l0': 4, 'left_wall_dist_out_channels_l0': 11, 'track_width_num_layers': 1, 'track_width_activation': 'relu', 'track_width_max_flattened': 4288, 'track_width_fc_hidden': 32, 'track_width_pool_size_l0': 4, 'track_width_out_channels_l0': 13, 'heading_error_num_layers': 1, 'heading_error_activation': 'elu', 'heading_error_max_flattened': 1072, 'heading_error_fc_hidden': 64, 'heading_error_pool_size_l0': 8, 'heading_error_out_channels_l0': 8}. Best is trial 3 with value: 0.0918.
[rank: 0] Seed set to 42
[rank: 0] Seed set to 42
[rank: 0] Seed set to 42
GPU available: True (cuda), used: True
TPU available: False, using: 0 TPU cores
💡 Tip: For seamless cloud logging and experiment tracking, try installing [litlogger](https://pypi.org/project/litlogger/) to enable LitLogger, which logs metrics and artifacts automatically to the Lightning Experiments platform.
GPU available: True (cuda), used: True
TPU available: False, using: 0 TPU cores
💡 Tip: For seamless cloud logging and experiment tracking, try installing [litlogger](https://pypi.org/project/litlogger/) to enable LitLogger, which logs metrics and artifacts automatically to the Lightning Experiments platform.
GPU available: True (cuda), used: True
TPU available: False, using: 0 TPU cores
💡 Tip: For seamless cloud logging and experiment tracking, try installing [litlogger](https://pypi.org/project/litlogger/) to enable LitLogger, which logs metrics and artifacts automatically to the Lightning Experiments platform.
LOCAL_RANK: 0 - CUDA_VISIBLE_DEVICES: [0]
LOCAL_RANK: 0 - CUDA_VISIBLE_DEVICES: [0]
LOCAL_RANK: 0 - CUDA_VISIBLE_DEVICES: [0]
SLURM auto-requeueing enabled. Setting signal handlers.
SLURM auto-requeueing enabled. Setting signal handlers.
SLURM auto-requeueing enabled. Setting signal handlers.
`Trainer.fit` stopped: `max_epochs=30` reached.
`Trainer.fit` stopped: `max_epochs=30` reached.
`Trainer.fit` stopped: `max_epochs=30` reached.
[I 2026-04-23 20:17:10,023] Trial 21 finished with value: 0.0985 and parameters: {'left_wall_dist_num_layers': 2, 'left_wall_dist_activation': 'relu', 'left_wall_dist_max_flattened': 4288, 'left_wall_dist_fc_hidden': 32, 'left_wall_dist_pool_size_l0': 2, 'track_width_num_layers': 2, 'track_width_activation': 'relu', 'track_width_max_flattened': 4288, 'track_width_fc_hidden': 32, 'track_width_pool_size_l0': 2, 'heading_error_num_layers': 2, 'heading_error_activation': 'elu', 'heading_error_max_flattened': 1072, 'heading_error_fc_hidden': 64, 'heading_error_pool_size_l0': 8, 'heading_error_out_channels_l0': 8, 'heading_error_pool_size_l1': 2, 'heading_error_out_channels_l1': 10}. Best is trial 3 with value: 0.0918.
[rank: 0] Seed set to 42
[rank: 0] Seed set to 42
[rank: 0] Seed set to 42
GPU available: True (cuda), used: True
TPU available: False, using: 0 TPU cores
💡 Tip: For seamless cloud logging and experiment tracking, try installing [litlogger](https://pypi.org/project/litlogger/) to enable LitLogger, which logs metrics and artifacts automatically to the Lightning Experiments platform.
GPU available: True (cuda), used: True
TPU available: False, using: 0 TPU cores
💡 Tip: For seamless cloud logging and experiment tracking, try installing [litlogger](https://pypi.org/project/litlogger/) to enable LitLogger, which logs metrics and artifacts automatically to the Lightning Experiments platform.
GPU available: True (cuda), used: True
TPU available: False, using: 0 TPU cores
💡 Tip: For seamless cloud logging and experiment tracking, try installing [litlogger](https://pypi.org/project/litlogger/) to enable LitLogger, which logs metrics and artifacts automatically to the Lightning Experiments platform.
LOCAL_RANK: 0 - CUDA_VISIBLE_DEVICES: [0]
LOCAL_RANK: 0 - CUDA_VISIBLE_DEVICES: [0]
LOCAL_RANK: 0 - CUDA_VISIBLE_DEVICES: [0]
SLURM auto-requeueing enabled. Setting signal handlers.
SLURM auto-requeueing enabled. Setting signal handlers.
SLURM auto-requeueing enabled. Setting signal handlers.
`Trainer.fit` stopped: `max_epochs=30` reached.
`Trainer.fit` stopped: `max_epochs=30` reached.
`Trainer.fit` stopped: `max_epochs=30` reached.
[I 2026-04-23 20:19:22,981] Trial 22 finished with value: 0.1034 and parameters: {'left_wall_dist_num_layers': 2, 'left_wall_dist_activation': 'relu', 'left_wall_dist_max_flattened': 4288, 'left_wall_dist_fc_hidden': 32, 'left_wall_dist_pool_size_l0': 2, 'track_width_num_layers': 3, 'track_width_activation': 'relu', 'track_width_max_flattened': 4288, 'track_width_fc_hidden': 32, 'track_width_pool_size_l0': 2, 'heading_error_num_layers': 3, 'heading_error_activation': 'elu', 'heading_error_max_flattened': 1072, 'heading_error_fc_hidden': 64, 'heading_error_pool_size_l0': 8, 'heading_error_out_channels_l0': 8, 'heading_error_pool_size_l1': 2, 'heading_error_out_channels_l1': 11, 'heading_error_pool_size_l2': 2, 'heading_error_out_channels_l2': 8}. Best is trial 3 with value: 0.0918.
[rank: 0] Seed set to 42
[rank: 0] Seed set to 42
[rank: 0] Seed set to 42
GPU available: True (cuda), used: True
TPU available: False, using: 0 TPU cores
💡 Tip: For seamless cloud logging and experiment tracking, try installing [litlogger](https://pypi.org/project/litlogger/) to enable LitLogger, which logs metrics and artifacts automatically to the Lightning Experiments platform.
GPU available: True (cuda), used: True
TPU available: False, using: 0 TPU cores
💡 Tip: For seamless cloud logging and experiment tracking, try installing [litlogger](https://pypi.org/project/litlogger/) to enable LitLogger, which logs metrics and artifacts automatically to the Lightning Experiments platform.
GPU available: True (cuda), used: True
TPU available: False, using: 0 TPU cores
💡 Tip: For seamless cloud logging and experiment tracking, try installing [litlogger](https://pypi.org/project/litlogger/) to enable LitLogger, which logs metrics and artifacts automatically to the Lightning Experiments platform.
LOCAL_RANK: 0 - CUDA_VISIBLE_DEVICES: [0]
LOCAL_RANK: 0 - CUDA_VISIBLE_DEVICES: [0]
LOCAL_RANK: 0 - CUDA_VISIBLE_DEVICES: [0]
SLURM auto-requeueing enabled. Setting signal handlers.
SLURM auto-requeueing enabled. Setting signal handlers.
SLURM auto-requeueing enabled. Setting signal handlers.
`Trainer.fit` stopped: `max_epochs=30` reached.
`Trainer.fit` stopped: `max_epochs=30` reached.
`Trainer.fit` stopped: `max_epochs=30` reached.
[I 2026-04-23 20:21:30,691] Trial 23 finished with value: 0.0999 and parameters: {'left_wall_dist_num_layers': 1, 'left_wall_dist_activation': 'relu', 'left_wall_dist_max_flattened': 4288, 'left_wall_dist_fc_hidden': 32, 'left_wall_dist_pool_size_l0': 2, 'track_width_num_layers': 2, 'track_width_activation': 'relu', 'track_width_max_flattened': 4288, 'track_width_fc_hidden': 32, 'track_width_pool_size_l0': 2, 'heading_error_num_layers': 2, 'heading_error_activation': 'elu', 'heading_error_max_flattened': 1072, 'heading_error_fc_hidden': 64, 'heading_error_pool_size_l0': 8, 'heading_error_out_channels_l0': 8, 'heading_error_pool_size_l1': 2, 'heading_error_out_channels_l1': 11}. Best is trial 3 with value: 0.0918.
[rank: 0] Seed set to 42
[rank: 0] Seed set to 42
[rank: 0] Seed set to 42
GPU available: True (cuda), used: True
GPU available: True (cuda), used: True
TPU available: False, using: 0 TPU cores
TPU available: False, using: 0 TPU cores
GPU available: True (cuda), used: True
TPU available: False, using: 0 TPU cores
💡 Tip: For seamless cloud logging and experiment tracking, try installing [litlogger](https://pypi.org/project/litlogger/) to enable LitLogger, which logs metrics and artifacts automatically to the Lightning Experiments platform.
💡 Tip: For seamless cloud logging and experiment tracking, try installing [litlogger](https://pypi.org/project/litlogger/) to enable LitLogger, which logs metrics and artifacts automatically to the Lightning Experiments platform.
💡 Tip: For seamless cloud logging and experiment tracking, try installing [litlogger](https://pypi.org/project/litlogger/) to enable LitLogger, which logs metrics and artifacts automatically to the Lightning Experiments platform.
LOCAL_RANK: 0 - CUDA_VISIBLE_DEVICES: [0]
LOCAL_RANK: 0 - CUDA_VISIBLE_DEVICES: [0]
LOCAL_RANK: 0 - CUDA_VISIBLE_DEVICES: [0]
SLURM auto-requeueing enabled. Setting signal handlers.
SLURM auto-requeueing enabled. Setting signal handlers.
SLURM auto-requeueing enabled. Setting signal handlers.
`Trainer.fit` stopped: `max_epochs=30` reached.
`Trainer.fit` stopped: `max_epochs=30` reached.
`Trainer.fit` stopped: `max_epochs=30` reached.
