[I 2026-05-08 19:12:20,095] Trial 46 finished with value: 0.1399 and parameters: {'optimizer': 'adam', 'left_wall_dist_num_layers': 2, 'left_wall_dist_activation': 'elu', 'left_wall_dist_fc_layers': 'fc16', 'left_wall_dist_pool_size_l0': 4, 'left_wall_dist_out_channels_l0': 1, 'left_wall_dist_pool_size_l1': 3, 'left_wall_dist_out_channels_l1': 24, 'track_width_num_layers': 2, 'track_width_activation': 'relu', 'track_width_fc_layers': 'fc64', 'track_width_pool_size_l0': 2, 'track_width_out_channels_l0': 8, 'track_width_pool_size_l1': 2, 'track_width_out_channels_l1': 8, 'heading_error_num_layers': 3, 'heading_error_activation': 'elu', 'heading_error_fc_layers': 'fc64', 'heading_error_pool_size_l0': 3, 'heading_error_out_channels_l0': 1, 'heading_error_pool_size_l1': 4, 'heading_error_out_channels_l1': 24, 'heading_error_pool_size_l2': 2, 'heading_error_out_channels_l2': 32}. Best is trial 43 with value: 0.0835.
[I 2026-05-08 19:12:20,104] Trial 47 pruned. Conv channel counts must be non-decreasing.
[I 2026-05-08 19:12:20,124] Trial 48 pruned. Conv channel counts must be non-decreasing.
[rank: 0] Seed set to 42
GPU available: True (cuda), used: True
TPU available: False, using: 0 TPU cores
💡 Tip: For seamless cloud logging and experiment tracking, try installing [litlogger](https://pypi.org/project/litlogger/) to enable LitLogger, which logs metrics and artifacts automatically to the Lightning Experiments platform.
[rank: 0] Seed set to 42
GPU available: True (cuda), used: True
TPU available: False, using: 0 TPU cores
💡 Tip: For seamless cloud logging and experiment tracking, try installing [litlogger](https://pypi.org/project/litlogger/) to enable LitLogger, which logs metrics and artifacts automatically to the Lightning Experiments platform.
[rank: 0] Seed set to 42
GPU available: True (cuda), used: True
TPU available: False, using: 0 TPU cores
💡 Tip: For seamless cloud logging and experiment tracking, try installing [litlogger](https://pypi.org/project/litlogger/) to enable LitLogger, which logs metrics and artifacts automatically to the Lightning Experiments platform.
LOCAL_RANK: 0 - CUDA_VISIBLE_DEVICES: [0]
SLURM auto-requeueing enabled. Setting signal handlers.
LOCAL_RANK: 0 - CUDA_VISIBLE_DEVICES: [0]
LOCAL_RANK: 0 - CUDA_VISIBLE_DEVICES: [0]
SLURM auto-requeueing enabled. Setting signal handlers.
SLURM auto-requeueing enabled. Setting signal handlers.
`Trainer.fit` stopped: `max_epochs=30` reached.
`Trainer.fit` stopped: `max_epochs=30` reached.
`Trainer.fit` stopped: `max_epochs=30` reached.
[I 2026-05-08 19:15:11,892] Trial 49 finished with value: 0.1725 and parameters: {'optimizer': 'adam', 'left_wall_dist_num_layers': 2, 'left_wall_dist_activation': 'relu', 'left_wall_dist_fc_layers': 'fc16', 'left_wall_dist_pool_size_l0': 4, 'left_wall_dist_out_channels_l0': 4, 'left_wall_dist_pool_size_l1': 3, 'left_wall_dist_out_channels_l1': 8, 'track_width_num_layers': 2, 'track_width_activation': 'relu', 'track_width_fc_layers': 'fc16', 'track_width_pool_size_l0': 2, 'track_width_out_channels_l0': 4, 'track_width_pool_size_l1': 3, 'track_width_out_channels_l1': 16, 'heading_error_num_layers': 1, 'heading_error_activation': 'elu', 'heading_error_fc_layers': 'fc128_64', 'heading_error_pool_size_l0': 3, 'heading_error_out_channels_l0': 1}. Best is trial 43 with value: 0.0835.
[I 2026-05-08 19:15:11,979] Trial 50 pruned. Conv channel counts must be non-decreasing.
[rank: 0] Seed set to 42
[rank: 0] Seed set to 42
[rank: 0] Seed set to 42
GPU available: True (cuda), used: True
TPU available: False, using: 0 TPU cores
💡 Tip: For seamless cloud logging and experiment tracking, try installing [litlogger](https://pypi.org/project/litlogger/) to enable LitLogger, which logs metrics and artifacts automatically to the Lightning Experiments platform.
GPU available: True (cuda), used: True
TPU available: False, using: 0 TPU cores
💡 Tip: For seamless cloud logging and experiment tracking, try installing [litlogger](https://pypi.org/project/litlogger/) to enable LitLogger, which logs metrics and artifacts automatically to the Lightning Experiments platform.
GPU available: True (cuda), used: True
TPU available: False, using: 0 TPU cores
💡 Tip: For seamless cloud logging and experiment tracking, try installing [litlogger](https://pypi.org/project/litlogger/) to enable LitLogger, which logs metrics and artifacts automatically to the Lightning Experiments platform.
LOCAL_RANK: 0 - CUDA_VISIBLE_DEVICES: [0]
LOCAL_RANK: 0 - CUDA_VISIBLE_DEVICES: [0]
SLURM auto-requeueing enabled. Setting signal handlers.
LOCAL_RANK: 0 - CUDA_VISIBLE_DEVICES: [0]
SLURM auto-requeueing enabled. Setting signal handlers.
SLURM auto-requeueing enabled. Setting signal handlers.
`Trainer.fit` stopped: `max_epochs=30` reached.
`Trainer.fit` stopped: `max_epochs=30` reached.
`Trainer.fit` stopped: `max_epochs=30` reached.
[I 2026-05-08 19:18:25,037] Trial 51 finished with value: 0.0871 and parameters: {'optimizer': 'adam', 'left_wall_dist_num_layers': 2, 'left_wall_dist_activation': 'elu', 'left_wall_dist_fc_layers': 'fc16', 'left_wall_dist_pool_size_l0': 4, 'left_wall_dist_out_channels_l0': 1, 'left_wall_dist_pool_size_l1': 3, 'left_wall_dist_out_channels_l1': 8, 'track_width_num_layers': 2, 'track_width_activation': 'relu', 'track_width_fc_layers': 'fc128_64', 'track_width_pool_size_l0': 2, 'track_width_out_channels_l0': 8, 'track_width_pool_size_l1': 2, 'track_width_out_channels_l1': 24, 'heading_error_num_layers': 3, 'heading_error_activation': 'elu', 'heading_error_fc_layers': 'fc64', 'heading_error_pool_size_l0': 3, 'heading_error_out_channels_l0': 1, 'heading_error_pool_size_l1': 3, 'heading_error_out_channels_l1': 4, 'heading_error_pool_size_l2': 2, 'heading_error_out_channels_l2': 8}. Best is trial 43 with value: 0.0835.
[rank: 0] Seed set to 42
[rank: 0] Seed set to 42
GPU available: True (cuda), used: True
TPU available: False, using: 0 TPU cores
💡 Tip: For seamless cloud logging and experiment tracking, try installing [litlogger](https://pypi.org/project/litlogger/) to enable LitLogger, which logs metrics and artifacts automatically to the Lightning Experiments platform.
[rank: 0] Seed set to 42
GPU available: True (cuda), used: True
TPU available: False, using: 0 TPU cores
💡 Tip: For seamless cloud logging and experiment tracking, try installing [litlogger](https://pypi.org/project/litlogger/) to enable LitLogger, which logs metrics and artifacts automatically to the Lightning Experiments platform.
GPU available: True (cuda), used: True
TPU available: False, using: 0 TPU cores
💡 Tip: For seamless cloud logging and experiment tracking, try installing [litlogger](https://pypi.org/project/litlogger/) to enable LitLogger, which logs metrics and artifacts automatically to the Lightning Experiments platform.
LOCAL_RANK: 0 - CUDA_VISIBLE_DEVICES: [0]
LOCAL_RANK: 0 - CUDA_VISIBLE_DEVICES: [0]
LOCAL_RANK: 0 - CUDA_VISIBLE_DEVICES: [0]
SLURM auto-requeueing enabled. Setting signal handlers.
SLURM auto-requeueing enabled. Setting signal handlers.
SLURM auto-requeueing enabled. Setting signal handlers.
`Trainer.fit` stopped: `max_epochs=30` reached.
`Trainer.fit` stopped: `max_epochs=30` reached.
`Trainer.fit` stopped: `max_epochs=30` reached.
[I 2026-05-08 19:21:32,981] Trial 52 finished with value: 0.0931 and parameters: {'optimizer': 'adam', 'left_wall_dist_num_layers': 2, 'left_wall_dist_activation': 'elu', 'left_wall_dist_fc_layers': 'fc16', 'left_wall_dist_pool_size_l0': 4, 'left_wall_dist_out_channels_l0': 1, 'left_wall_dist_pool_size_l1': 3, 'left_wall_dist_out_channels_l1': 8, 'track_width_num_layers': 2, 'track_width_activation': 'relu', 'track_width_fc_layers': 'fc32', 'track_width_pool_size_l0': 2, 'track_width_out_channels_l0': 8, 'track_width_pool_size_l1': 2, 'track_width_out_channels_l1': 24, 'heading_error_num_layers': 3, 'heading_error_activation': 'elu', 'heading_error_fc_layers': 'fc64', 'heading_error_pool_size_l0': 3, 'heading_error_out_channels_l0': 1, 'heading_error_pool_size_l1': 3, 'heading_error_out_channels_l1': 4, 'heading_error_pool_size_l2': 2, 'heading_error_out_channels_l2': 8}. Best is trial 43 with value: 0.0835.
[I 2026-05-08 19:21:33,004] Trial 53 pruned. Conv channel counts must be non-decreasing.
[rank: 0] Seed set to 42
[rank: 0] Seed set to 42
GPU available: True (cuda), used: True
TPU available: False, using: 0 TPU cores
💡 Tip: For seamless cloud logging and experiment tracking, try installing [litlogger](https://pypi.org/project/litlogger/) to enable LitLogger, which logs metrics and artifacts automatically to the Lightning Experiments platform.
[rank: 0] Seed set to 42
GPU available: True (cuda), used: True
TPU available: False, using: 0 TPU cores
💡 Tip: For seamless cloud logging and experiment tracking, try installing [litlogger](https://pypi.org/project/litlogger/) to enable LitLogger, which logs metrics and artifacts automatically to the Lightning Experiments platform.
GPU available: True (cuda), used: True
TPU available: False, using: 0 TPU cores
💡 Tip: For seamless cloud logging and experiment tracking, try installing [litlogger](https://pypi.org/project/litlogger/) to enable LitLogger, which logs metrics and artifacts automatically to the Lightning Experiments platform.
LOCAL_RANK: 0 - CUDA_VISIBLE_DEVICES: [0]
LOCAL_RANK: 0 - CUDA_VISIBLE_DEVICES: [0]
SLURM auto-requeueing enabled. Setting signal handlers.
SLURM auto-requeueing enabled. Setting signal handlers.
LOCAL_RANK: 0 - CUDA_VISIBLE_DEVICES: [0]
SLURM auto-requeueing enabled. Setting signal handlers.
`Trainer.fit` stopped: `max_epochs=30` reached.
`Trainer.fit` stopped: `max_epochs=30` reached.
`Trainer.fit` stopped: `max_epochs=30` reached.
[I 2026-05-08 19:24:39,203] Trial 54 finished with value: 0.1429 and parameters: {'optimizer': 'adam', 'left_wall_dist_num_layers': 2, 'left_wall_dist_activation': 'elu', 'left_wall_dist_fc_layers': 'fc16', 'left_wall_dist_pool_size_l0': 2, 'left_wall_dist_out_channels_l0': 8, 'left_wall_dist_pool_size_l1': 3, 'left_wall_dist_out_channels_l1': 8, 'track_width_num_layers': 2, 'track_width_activation': 'relu', 'track_width_fc_layers': 'fc32', 'track_width_pool_size_l0': 2, 'track_width_out_channels_l0': 8, 'track_width_pool_size_l1': 2, 'track_width_out_channels_l1': 24, 'heading_error_num_layers': 3, 'heading_error_activation': 'elu', 'heading_error_fc_layers': 'fc32', 'heading_error_pool_size_l0': 2, 'heading_error_out_channels_l0': 1, 'heading_error_pool_size_l1': 3, 'heading_error_out_channels_l1': 4, 'heading_error_pool_size_l2': 2, 'heading_error_out_channels_l2': 8}. Best is trial 43 with value: 0.0835.
[I 2026-05-08 19:24:39,218] Trial 55 pruned. Conv channel counts must be non-decreasing.
[rank: 0] Seed set to 42
[rank: 0] Seed set to 42
[rank: 0] Seed set to 42
GPU available: True (cuda), used: True
TPU available: False, using: 0 TPU cores
💡 Tip: For seamless cloud logging and experiment tracking, try installing [litlogger](https://pypi.org/project/litlogger/) to enable LitLogger, which logs metrics and artifacts automatically to the Lightning Experiments platform.
GPU available: True (cuda), used: True
TPU available: False, using: 0 TPU cores
💡 Tip: For seamless cloud logging and experiment tracking, try installing [litlogger](https://pypi.org/project/litlogger/) to enable LitLogger, which logs metrics and artifacts automatically to the Lightning Experiments platform.
GPU available: True (cuda), used: True
TPU available: False, using: 0 TPU cores
💡 Tip: For seamless cloud logging and experiment tracking, try installing [litlogger](https://pypi.org/project/litlogger/) to enable LitLogger, which logs metrics and artifacts automatically to the Lightning Experiments platform.
LOCAL_RANK: 0 - CUDA_VISIBLE_DEVICES: [0]
LOCAL_RANK: 0 - CUDA_VISIBLE_DEVICES: [0]
LOCAL_RANK: 0 - CUDA_VISIBLE_DEVICES: [0]
SLURM auto-requeueing enabled. Setting signal handlers.
SLURM auto-requeueing enabled. Setting signal handlers.
SLURM auto-requeueing enabled. Setting signal handlers.
`Trainer.fit` stopped: `max_epochs=30` reached.
`Trainer.fit` stopped: `max_epochs=30` reached.
`Trainer.fit` stopped: `max_epochs=30` reached.
[I 2026-05-08 19:27:36,195] Trial 56 finished with value: 0.1509 and parameters: {'optimizer': 'adam', 'left_wall_dist_num_layers': 2, 'left_wall_dist_activation': 'elu', 'left_wall_dist_fc_layers': 'fc16', 'left_wall_dist_pool_size_l0': 4, 'left_wall_dist_out_channels_l0': 1, 'left_wall_dist_pool_size_l1': 3, 'left_wall_dist_out_channels_l1': 16, 'track_width_num_layers': 1, 'track_width_activation': 'relu', 'track_width_fc_layers': 'fc32', 'track_width_pool_size_l0': 3, 'track_width_out_channels_l0': 1, 'heading_error_num_layers': 2, 'heading_error_activation': 'elu', 'heading_error_fc_layers': 'fc64', 'heading_error_pool_size_l0': 3, 'heading_error_out_channels_l0': 1, 'heading_error_pool_size_l1': 3, 'heading_error_out_channels_l1': 16}. Best is trial 43 with value: 0.0835.
[I 2026-05-08 19:27:36,217] Trial 57 pruned. Conv channel counts must be non-decreasing.
[I 2026-05-08 19:27:36,230] Trial 58 pruned. Conv channel counts must be non-decreasing.
[I 2026-05-08 19:27:36,251] Trial 59 pruned. Conv channel counts must be non-decreasing.
[rank: 0] Seed set to 42
[rank: 0] Seed set to 42
[rank: 0] Seed set to 42
GPU available: True (cuda), used: True
TPU available: False, using: 0 TPU cores
💡 Tip: For seamless cloud logging and experiment tracking, try installing [litlogger](https://pypi.org/project/litlogger/) to enable LitLogger, which logs metrics and artifacts automatically to the Lightning Experiments platform.
GPU available: True (cuda), used: True
TPU available: False, using: 0 TPU cores
💡 Tip: For seamless cloud logging and experiment tracking, try installing [litlogger](https://pypi.org/project/litlogger/) to enable LitLogger, which logs metrics and artifacts automatically to the Lightning Experiments platform.
GPU available: True (cuda), used: True
TPU available: False, using: 0 TPU cores
💡 Tip: For seamless cloud logging and experiment tracking, try installing [litlogger](https://pypi.org/project/litlogger/) to enable LitLogger, which logs metrics and artifacts automatically to the Lightning Experiments platform.
LOCAL_RANK: 0 - CUDA_VISIBLE_DEVICES: [0]
LOCAL_RANK: 0 - CUDA_VISIBLE_DEVICES: [0]
LOCAL_RANK: 0 - CUDA_VISIBLE_DEVICES: [0]
SLURM auto-requeueing enabled. Setting signal handlers.
SLURM auto-requeueing enabled. Setting signal handlers.
SLURM auto-requeueing enabled. Setting signal handlers.
`Trainer.fit` stopped: `max_epochs=30` reached.
`Trainer.fit` stopped: `max_epochs=30` reached.
`Trainer.fit` stopped: `max_epochs=30` reached.
[I 2026-05-08 19:30:12,500] Trial 60 finished with value: 0.1489 and parameters: {'optimizer': 'adam', 'left_wall_dist_num_layers': 2, 'left_wall_dist_activation': 'elu', 'left_wall_dist_fc_layers': 'fc32', 'left_wall_dist_pool_size_l0': 4, 'left_wall_dist_out_channels_l0': 1, 'left_wall_dist_pool_size_l1': 4, 'left_wall_dist_out_channels_l1': 4, 'track_width_num_layers': 1, 'track_width_activation': 'elu', 'track_width_fc_layers': 'fc64', 'track_width_pool_size_l0': 3, 'track_width_out_channels_l0': 8, 'heading_error_num_layers': 1, 'heading_error_activation': 'elu', 'heading_error_fc_layers': 'fc64', 'heading_error_pool_size_l0': 3, 'heading_error_out_channels_l0': 1}. Best is trial 43 with value: 0.0835.
[rank: 0] Seed set to 42
[rank: 0] Seed set to 42
[rank: 0] Seed set to 42
GPU available: True (cuda), used: True
TPU available: False, using: 0 TPU cores
💡 Tip: For seamless cloud logging and experiment tracking, try installing [litlogger](https://pypi.org/project/litlogger/) to enable LitLogger, which logs metrics and artifacts automatically to the Lightning Experiments platform.
GPU available: True (cuda), used: True
TPU available: False, using: 0 TPU cores
💡 Tip: For seamless cloud logging and experiment tracking, try installing [litlogger](https://pypi.org/project/litlogger/) to enable LitLogger, which logs metrics and artifacts automatically to the Lightning Experiments platform.
GPU available: True (cuda), used: True
TPU available: False, using: 0 TPU cores
💡 Tip: For seamless cloud logging and experiment tracking, try installing [litlogger](https://pypi.org/project/litlogger/) to enable LitLogger, which logs metrics and artifacts automatically to the Lightning Experiments platform.
LOCAL_RANK: 0 - CUDA_VISIBLE_DEVICES: [0]
LOCAL_RANK: 0 - CUDA_VISIBLE_DEVICES: [0]
LOCAL_RANK: 0 - CUDA_VISIBLE_DEVICES: [0]
SLURM auto-requeueing enabled. Setting signal handlers.
SLURM auto-requeueing enabled. Setting signal handlers.
SLURM auto-requeueing enabled. Setting signal handlers.
`Trainer.fit` stopped: `max_epochs=30` reached.
`Trainer.fit` stopped: `max_epochs=30` reached.
`Trainer.fit` stopped: `max_epochs=30` reached.
[I 2026-05-08 19:32:33,053] Trial 61 finished with value: 0.0858 and parameters: {'optimizer': 'adam', 'left_wall_dist_num_layers': 2, 'left_wall_dist_activation': 'elu', 'left_wall_dist_fc_layers': 'fc16', 'left_wall_dist_pool_size_l0': 4, 'left_wall_dist_out_channels_l0': 1, 'left_wall_dist_pool_size_l1': 3, 'left_wall_dist_out_channels_l1': 8, 'track_width_num_layers': 2, 'track_width_activation': 'relu', 'track_width_fc_layers': 'fc128_64', 'track_width_pool_size_l0': 2, 'track_width_out_channels_l0': 8, 'track_width_pool_size_l1': 2, 'track_width_out_channels_l1': 24, 'heading_error_num_layers': 3, 'heading_error_activation': 'elu', 'heading_error_fc_layers': 'fc64', 'heading_error_pool_size_l0': 3, 'heading_error_out_channels_l0': 1, 'heading_error_pool_size_l1': 3, 'heading_error_out_channels_l1': 4, 'heading_error_pool_size_l2': 2, 'heading_error_out_channels_l2': 8}. Best is trial 43 with value: 0.0835.
[rank: 0] Seed set to 42
[rank: 0] Seed set to 42
GPU available: True (cuda), used: True
TPU available: False, using: 0 TPU cores
💡 Tip: For seamless cloud logging and experiment tracking, try installing [litlogger](https://pypi.org/project/litlogger/) to enable LitLogger, which logs metrics and artifacts automatically to the Lightning Experiments platform.
GPU available: True (cuda), used: True
TPU available: False, using: 0 TPU cores
💡 Tip: For seamless cloud logging and experiment tracking, try installing [litlogger](https://pypi.org/project/litlogger/) to enable LitLogger, which logs metrics and artifacts automatically to the Lightning Experiments platform.
[rank: 0] Seed set to 42
GPU available: True (cuda), used: True
TPU available: False, using: 0 TPU cores
💡 Tip: For seamless cloud logging and experiment tracking, try installing [litlogger](https://pypi.org/project/litlogger/) to enable LitLogger, which logs metrics and artifacts automatically to the Lightning Experiments platform.
LOCAL_RANK: 0 - CUDA_VISIBLE_DEVICES: [0]
LOCAL_RANK: 0 - CUDA_VISIBLE_DEVICES: [0]
LOCAL_RANK: 0 - CUDA_VISIBLE_DEVICES: [0]
SLURM auto-requeueing enabled. Setting signal handlers.
SLURM auto-requeueing enabled. Setting signal handlers.
SLURM auto-requeueing enabled. Setting signal handlers.
`Trainer.fit` stopped: `max_epochs=30` reached.
`Trainer.fit` stopped: `max_epochs=30` reached.
`Trainer.fit` stopped: `max_epochs=30` reached.
[I 2026-05-08 19:34:56,559] Trial 62 finished with value: 0.0864 and parameters: {'optimizer': 'adam', 'left_wall_dist_num_layers': 2, 'left_wall_dist_activation': 'elu', 'left_wall_dist_fc_layers': 'fc16', 'left_wall_dist_pool_size_l0': 4, 'left_wall_dist_out_channels_l0': 1, 'left_wall_dist_pool_size_l1': 3, 'left_wall_dist_out_channels_l1': 8, 'track_width_num_layers': 2, 'track_width_activation': 'relu', 'track_width_fc_layers': 'fc128_64', 'track_width_pool_size_l0': 2, 'track_width_out_channels_l0': 8, 'track_width_pool_size_l1': 2, 'track_width_out_channels_l1': 24, 'heading_error_num_layers': 3, 'heading_error_activation': 'elu', 'heading_error_fc_layers': 'fc64', 'heading_error_pool_size_l0': 3, 'heading_error_out_channels_l0': 1, 'heading_error_pool_size_l1': 3, 'heading_error_out_channels_l1': 4, 'heading_error_pool_size_l2': 2, 'heading_error_out_channels_l2': 8}. Best is trial 43 with value: 0.0835.
[rank: 0] Seed set to 42
GPU available: True (cuda), used: True
TPU available: False, using: 0 TPU cores
💡 Tip: For seamless cloud logging and experiment tracking, try installing [litlogger](https://pypi.org/project/litlogger/) to enable LitLogger, which logs metrics and artifacts automatically to the Lightning Experiments platform.
[rank: 0] Seed set to 42
GPU available: True (cuda), used: True
TPU available: False, using: 0 TPU cores
💡 Tip: For seamless cloud logging and experiment tracking, try installing [litlogger](https://pypi.org/project/litlogger/) to enable LitLogger, which logs metrics and artifacts automatically to the Lightning Experiments platform.
[rank: 0] Seed set to 42
GPU available: True (cuda), used: True
TPU available: False, using: 0 TPU cores
💡 Tip: For seamless cloud logging and experiment tracking, try installing [litlogger](https://pypi.org/project/litlogger/) to enable LitLogger, which logs metrics and artifacts automatically to the Lightning Experiments platform.
LOCAL_RANK: 0 - CUDA_VISIBLE_DEVICES: [0]
LOCAL_RANK: 0 - CUDA_VISIBLE_DEVICES: [0]
LOCAL_RANK: 0 - CUDA_VISIBLE_DEVICES: [0]
SLURM auto-requeueing enabled. Setting signal handlers.
SLURM auto-requeueing enabled. Setting signal handlers.
SLURM auto-requeueing enabled. Setting signal handlers.
`Trainer.fit` stopped: `max_epochs=30` reached.
`Trainer.fit` stopped: `max_epochs=30` reached.
`Trainer.fit` stopped: `max_epochs=30` reached.
