[I 2026-04-23 19:42:23,489] Trial 36 finished with value: 0.2063 and parameters: {'left_wall_dist_num_layers': 2, 'left_wall_dist_activation': 'relu', 'left_wall_dist_max_flattened': 2144, 'left_wall_dist_fc_hidden': 32, 'left_wall_dist_pool_size_l0': 4, 'track_width_num_layers': 5, 'track_width_activation': 'elu', 'track_width_max_flattened': 1072, 'track_width_fc_hidden': 64, 'track_width_pool_size_l0': 4, 'heading_error_num_layers': 1, 'heading_error_activation': 'relu', 'heading_error_max_flattened': 1072, 'heading_error_fc_hidden': 128, 'heading_error_pool_size_l0': 2}. Best is trial 16 with value: 0.119.
[rank: 0] Seed set to 42
[rank: 0] Seed set to 42
[rank: 0] Seed set to 42
GPU available: True (cuda), used: True
TPU available: False, using: 0 TPU cores
GPU available: True (cuda), used: True
TPU available: False, using: 0 TPU cores
💡 Tip: For seamless cloud logging and experiment tracking, try installing [litlogger](https://pypi.org/project/litlogger/) to enable LitLogger, which logs metrics and artifacts automatically to the Lightning Experiments platform.
GPU available: True (cuda), used: True
TPU available: False, using: 0 TPU cores
💡 Tip: For seamless cloud logging and experiment tracking, try installing [litlogger](https://pypi.org/project/litlogger/) to enable LitLogger, which logs metrics and artifacts automatically to the Lightning Experiments platform.
💡 Tip: For seamless cloud logging and experiment tracking, try installing [litlogger](https://pypi.org/project/litlogger/) to enable LitLogger, which logs metrics and artifacts automatically to the Lightning Experiments platform.
LOCAL_RANK: 0 - CUDA_VISIBLE_DEVICES: [0]
LOCAL_RANK: 0 - CUDA_VISIBLE_DEVICES: [0]
LOCAL_RANK: 0 - CUDA_VISIBLE_DEVICES: [0]
SLURM auto-requeueing enabled. Setting signal handlers.
SLURM auto-requeueing enabled. Setting signal handlers.
SLURM auto-requeueing enabled. Setting signal handlers.
`Trainer.fit` stopped: `max_epochs=30` reached.
`Trainer.fit` stopped: `max_epochs=30` reached.
`Trainer.fit` stopped: `max_epochs=30` reached.
[I 2026-04-23 19:44:49,357] Trial 37 finished with value: 0.3246 and parameters: {'left_wall_dist_num_layers': 3, 'left_wall_dist_activation': 'elu', 'left_wall_dist_max_flattened': 1072, 'left_wall_dist_fc_hidden': 64, 'left_wall_dist_pool_size_l0': 8, 'left_wall_dist_out_channels_l0': 8, 'left_wall_dist_pool_size_l1': 8, 'left_wall_dist_out_channels_l1': 61, 'left_wall_dist_pool_size_l2': 4, 'left_wall_dist_out_channels_l2': 9, 'track_width_num_layers': 5, 'track_width_activation': 'relu', 'track_width_max_flattened': 4288, 'track_width_fc_hidden': 64, 'track_width_pool_size_l0': 2, 'heading_error_num_layers': 3, 'heading_error_activation': 'elu', 'heading_error_max_flattened': 2144, 'heading_error_fc_hidden': 128, 'heading_error_pool_size_l0': 2}. Best is trial 16 with value: 0.119.
[rank: 0] Seed set to 42
[rank: 0] Seed set to 42
[rank: 0] Seed set to 42
GPU available: True (cuda), used: True
TPU available: False, using: 0 TPU cores
💡 Tip: For seamless cloud logging and experiment tracking, try installing [litlogger](https://pypi.org/project/litlogger/) to enable LitLogger, which logs metrics and artifacts automatically to the Lightning Experiments platform.
GPU available: True (cuda), used: True
TPU available: False, using: 0 TPU cores
💡 Tip: For seamless cloud logging and experiment tracking, try installing [litlogger](https://pypi.org/project/litlogger/) to enable LitLogger, which logs metrics and artifacts automatically to the Lightning Experiments platform.
GPU available: True (cuda), used: True
TPU available: False, using: 0 TPU cores
💡 Tip: For seamless cloud logging and experiment tracking, try installing [litlogger](https://pypi.org/project/litlogger/) to enable LitLogger, which logs metrics and artifacts automatically to the Lightning Experiments platform.
LOCAL_RANK: 0 - CUDA_VISIBLE_DEVICES: [0]
LOCAL_RANK: 0 - CUDA_VISIBLE_DEVICES: [0]
LOCAL_RANK: 0 - CUDA_VISIBLE_DEVICES: [0]
SLURM auto-requeueing enabled. Setting signal handlers.
SLURM auto-requeueing enabled. Setting signal handlers.
SLURM auto-requeueing enabled. Setting signal handlers.
`Trainer.fit` stopped: `max_epochs=30` reached.
`Trainer.fit` stopped: `max_epochs=30` reached.
`Trainer.fit` stopped: `max_epochs=30` reached.
[I 2026-04-23 19:47:01,041] Trial 38 finished with value: 0.1817 and parameters: {'left_wall_dist_num_layers': 2, 'left_wall_dist_activation': 'relu', 'left_wall_dist_max_flattened': 4288, 'left_wall_dist_fc_hidden': 32, 'left_wall_dist_pool_size_l0': 4, 'left_wall_dist_out_channels_l0': 13, 'left_wall_dist_pool_size_l1': 2, 'left_wall_dist_out_channels_l1': 26, 'track_width_num_layers': 4, 'track_width_activation': 'relu', 'track_width_max_flattened': 1072, 'track_width_fc_hidden': 128, 'track_width_pool_size_l0': 4, 'heading_error_num_layers': 2, 'heading_error_activation': 'relu', 'heading_error_max_flattened': 1072, 'heading_error_fc_hidden': 64, 'heading_error_pool_size_l0': 2}. Best is trial 16 with value: 0.119.
[rank: 0] Seed set to 42
[rank: 0] Seed set to 42
[rank: 0] Seed set to 42
GPU available: True (cuda), used: True
TPU available: False, using: 0 TPU cores
💡 Tip: For seamless cloud logging and experiment tracking, try installing [litlogger](https://pypi.org/project/litlogger/) to enable LitLogger, which logs metrics and artifacts automatically to the Lightning Experiments platform.
GPU available: True (cuda), used: True
TPU available: False, using: 0 TPU cores
💡 Tip: For seamless cloud logging and experiment tracking, try installing [litlogger](https://pypi.org/project/litlogger/) to enable LitLogger, which logs metrics and artifacts automatically to the Lightning Experiments platform.
GPU available: True (cuda), used: True
TPU available: False, using: 0 TPU cores
💡 Tip: For seamless cloud logging and experiment tracking, try installing [litlogger](https://pypi.org/project/litlogger/) to enable LitLogger, which logs metrics and artifacts automatically to the Lightning Experiments platform.
LOCAL_RANK: 0 - CUDA_VISIBLE_DEVICES: [0]
LOCAL_RANK: 0 - CUDA_VISIBLE_DEVICES: [0]
LOCAL_RANK: 0 - CUDA_VISIBLE_DEVICES: [0]
SLURM auto-requeueing enabled. Setting signal handlers.
SLURM auto-requeueing enabled. Setting signal handlers.
SLURM auto-requeueing enabled. Setting signal handlers.
`Trainer.fit` stopped: `max_epochs=30` reached.
`Trainer.fit` stopped: `max_epochs=30` reached.
`Trainer.fit` stopped: `max_epochs=30` reached.
[I 2026-04-23 19:49:35,808] Trial 39 finished with value: 0.1764 and parameters: {'left_wall_dist_num_layers': 3, 'left_wall_dist_activation': 'elu', 'left_wall_dist_max_flattened': 2144, 'left_wall_dist_fc_hidden': 32, 'left_wall_dist_pool_size_l0': 8, 'left_wall_dist_out_channels_l0': 9, 'left_wall_dist_pool_size_l1': 8, 'left_wall_dist_out_channels_l1': 118, 'left_wall_dist_pool_size_l2': 2, 'left_wall_dist_out_channels_l2': 17, 'track_width_num_layers': 3, 'track_width_activation': 'elu', 'track_width_max_flattened': 1072, 'track_width_fc_hidden': 32, 'track_width_pool_size_l0': 8, 'track_width_out_channels_l0': 8, 'track_width_pool_size_l1': 8, 'track_width_out_channels_l1': 65, 'track_width_pool_size_l2': 2, 'track_width_out_channels_l2': 66, 'heading_error_num_layers': 1, 'heading_error_activation': 'relu', 'heading_error_max_flattened': 4288, 'heading_error_fc_hidden': 32, 'heading_error_pool_size_l0': 8, 'heading_error_out_channels_l0': 30}. Best is trial 16 with value: 0.119.
[rank: 0] Seed set to 42
[rank: 0] Seed set to 42
[rank: 0] Seed set to 42
GPU available: True (cuda), used: True
GPU available: True (cuda), used: True
TPU available: False, using: 0 TPU cores
TPU available: False, using: 0 TPU cores
💡 Tip: For seamless cloud logging and experiment tracking, try installing [litlogger](https://pypi.org/project/litlogger/) to enable LitLogger, which logs metrics and artifacts automatically to the Lightning Experiments platform.
💡 Tip: For seamless cloud logging and experiment tracking, try installing [litlogger](https://pypi.org/project/litlogger/) to enable LitLogger, which logs metrics and artifacts automatically to the Lightning Experiments platform.
GPU available: True (cuda), used: True
TPU available: False, using: 0 TPU cores
💡 Tip: For seamless cloud logging and experiment tracking, try installing [litlogger](https://pypi.org/project/litlogger/) to enable LitLogger, which logs metrics and artifacts automatically to the Lightning Experiments platform.
LOCAL_RANK: 0 - CUDA_VISIBLE_DEVICES: [0]
LOCAL_RANK: 0 - CUDA_VISIBLE_DEVICES: [0]
SLURM auto-requeueing enabled. Setting signal handlers.
LOCAL_RANK: 0 - CUDA_VISIBLE_DEVICES: [0]
SLURM auto-requeueing enabled. Setting signal handlers.
SLURM auto-requeueing enabled. Setting signal handlers.
`Trainer.fit` stopped: `max_epochs=30` reached.
`Trainer.fit` stopped: `max_epochs=30` reached.
`Trainer.fit` stopped: `max_epochs=30` reached.
[I 2026-04-23 19:51:37,206] Trial 40 finished with value: 0.1237 and parameters: {'left_wall_dist_num_layers': 1, 'left_wall_dist_activation': 'relu', 'left_wall_dist_max_flattened': 1072, 'left_wall_dist_fc_hidden': 64, 'left_wall_dist_pool_size_l0': 4, 'track_width_num_layers': 4, 'track_width_activation': 'relu', 'track_width_max_flattened': 2144, 'track_width_fc_hidden': 64, 'track_width_pool_size_l0': 2, 'heading_error_num_layers': 2, 'heading_error_activation': 'elu', 'heading_error_max_flattened': 1072, 'heading_error_fc_hidden': 64, 'heading_error_pool_size_l0': 2}. Best is trial 16 with value: 0.119.
[rank: 0] Seed set to 42
[rank: 0] Seed set to 42
[rank: 0] Seed set to 42
GPU available: True (cuda), used: True
TPU available: False, using: 0 TPU cores
💡 Tip: For seamless cloud logging and experiment tracking, try installing [litlogger](https://pypi.org/project/litlogger/) to enable LitLogger, which logs metrics and artifacts automatically to the Lightning Experiments platform.
GPU available: True (cuda), used: True
TPU available: False, using: 0 TPU cores
💡 Tip: For seamless cloud logging and experiment tracking, try installing [litlogger](https://pypi.org/project/litlogger/) to enable LitLogger, which logs metrics and artifacts automatically to the Lightning Experiments platform.
GPU available: True (cuda), used: True
TPU available: False, using: 0 TPU cores
💡 Tip: For seamless cloud logging and experiment tracking, try installing [litlogger](https://pypi.org/project/litlogger/) to enable LitLogger, which logs metrics and artifacts automatically to the Lightning Experiments platform.
LOCAL_RANK: 0 - CUDA_VISIBLE_DEVICES: [0]
LOCAL_RANK: 0 - CUDA_VISIBLE_DEVICES: [0]
LOCAL_RANK: 0 - CUDA_VISIBLE_DEVICES: [0]
SLURM auto-requeueing enabled. Setting signal handlers.
SLURM auto-requeueing enabled. Setting signal handlers.
SLURM auto-requeueing enabled. Setting signal handlers.
`Trainer.fit` stopped: `max_epochs=30` reached.
`Trainer.fit` stopped: `max_epochs=30` reached.
`Trainer.fit` stopped: `max_epochs=30` reached.
[I 2026-04-23 19:53:36,886] Trial 41 finished with value: 0.119 and parameters: {'left_wall_dist_num_layers': 2, 'left_wall_dist_activation': 'relu', 'left_wall_dist_max_flattened': 1072, 'left_wall_dist_fc_hidden': 32, 'left_wall_dist_pool_size_l0': 4, 'track_width_num_layers': 4, 'track_width_activation': 'relu', 'track_width_max_flattened': 2144, 'track_width_fc_hidden': 64, 'track_width_pool_size_l0': 4, 'heading_error_num_layers': 1, 'heading_error_activation': 'relu', 'heading_error_max_flattened': 1072, 'heading_error_fc_hidden': 128, 'heading_error_pool_size_l0': 2}. Best is trial 16 with value: 0.119.
[rank: 0] Seed set to 42
[rank: 0] Seed set to 42
[rank: 0] Seed set to 42
GPU available: True (cuda), used: True
TPU available: False, using: 0 TPU cores
GPU available: True (cuda), used: True
TPU available: False, using: 0 TPU cores
💡 Tip: For seamless cloud logging and experiment tracking, try installing [litlogger](https://pypi.org/project/litlogger/) to enable LitLogger, which logs metrics and artifacts automatically to the Lightning Experiments platform.
💡 Tip: For seamless cloud logging and experiment tracking, try installing [litlogger](https://pypi.org/project/litlogger/) to enable LitLogger, which logs metrics and artifacts automatically to the Lightning Experiments platform.
GPU available: True (cuda), used: True
TPU available: False, using: 0 TPU cores
💡 Tip: For seamless cloud logging and experiment tracking, try installing [litlogger](https://pypi.org/project/litlogger/) to enable LitLogger, which logs metrics and artifacts automatically to the Lightning Experiments platform.
LOCAL_RANK: 0 - CUDA_VISIBLE_DEVICES: [0]
LOCAL_RANK: 0 - CUDA_VISIBLE_DEVICES: [0]
LOCAL_RANK: 0 - CUDA_VISIBLE_DEVICES: [0]
SLURM auto-requeueing enabled. Setting signal handlers.
SLURM auto-requeueing enabled. Setting signal handlers.
SLURM auto-requeueing enabled. Setting signal handlers.
`Trainer.fit` stopped: `max_epochs=30` reached.
`Trainer.fit` stopped: `max_epochs=30` reached.
`Trainer.fit` stopped: `max_epochs=30` reached.
[I 2026-04-23 19:55:36,235] Trial 42 finished with value: 0.119 and parameters: {'left_wall_dist_num_layers': 2, 'left_wall_dist_activation': 'relu', 'left_wall_dist_max_flattened': 1072, 'left_wall_dist_fc_hidden': 32, 'left_wall_dist_pool_size_l0': 4, 'track_width_num_layers': 4, 'track_width_activation': 'relu', 'track_width_max_flattened': 2144, 'track_width_fc_hidden': 64, 'track_width_pool_size_l0': 4, 'heading_error_num_layers': 1, 'heading_error_activation': 'relu', 'heading_error_max_flattened': 1072, 'heading_error_fc_hidden': 128, 'heading_error_pool_size_l0': 2}. Best is trial 16 with value: 0.119.
[rank: 0] Seed set to 42
[rank: 0] Seed set to 42
[rank: 0] Seed set to 42
GPU available: True (cuda), used: True
GPU available: True (cuda), used: True
TPU available: False, using: 0 TPU cores
TPU available: False, using: 0 TPU cores
GPU available: True (cuda), used: True
TPU available: False, using: 0 TPU cores
💡 Tip: For seamless cloud logging and experiment tracking, try installing [litlogger](https://pypi.org/project/litlogger/) to enable LitLogger, which logs metrics and artifacts automatically to the Lightning Experiments platform.
💡 Tip: For seamless cloud logging and experiment tracking, try installing [litlogger](https://pypi.org/project/litlogger/) to enable LitLogger, which logs metrics and artifacts automatically to the Lightning Experiments platform.
💡 Tip: For seamless cloud logging and experiment tracking, try installing [litlogger](https://pypi.org/project/litlogger/) to enable LitLogger, which logs metrics and artifacts automatically to the Lightning Experiments platform.
LOCAL_RANK: 0 - CUDA_VISIBLE_DEVICES: [0]
LOCAL_RANK: 0 - CUDA_VISIBLE_DEVICES: [0]
LOCAL_RANK: 0 - CUDA_VISIBLE_DEVICES: [0]
SLURM auto-requeueing enabled. Setting signal handlers.
SLURM auto-requeueing enabled. Setting signal handlers.
SLURM auto-requeueing enabled. Setting signal handlers.
`Trainer.fit` stopped: `max_epochs=30` reached.
`Trainer.fit` stopped: `max_epochs=30` reached.
`Trainer.fit` stopped: `max_epochs=30` reached.
[I 2026-04-23 19:57:34,636] Trial 43 finished with value: 0.119 and parameters: {'left_wall_dist_num_layers': 2, 'left_wall_dist_activation': 'relu', 'left_wall_dist_max_flattened': 1072, 'left_wall_dist_fc_hidden': 32, 'left_wall_dist_pool_size_l0': 4, 'track_width_num_layers': 5, 'track_width_activation': 'relu', 'track_width_max_flattened': 2144, 'track_width_fc_hidden': 64, 'track_width_pool_size_l0': 4, 'heading_error_num_layers': 1, 'heading_error_activation': 'relu', 'heading_error_max_flattened': 1072, 'heading_error_fc_hidden': 128, 'heading_error_pool_size_l0': 2}. Best is trial 16 with value: 0.119.
[rank: 0] Seed set to 42
[rank: 0] Seed set to 42
[rank: 0] Seed set to 42
GPU available: True (cuda), used: True
GPU available: True (cuda), used: True
TPU available: False, using: 0 TPU cores
TPU available: False, using: 0 TPU cores
💡 Tip: For seamless cloud logging and experiment tracking, try installing [litlogger](https://pypi.org/project/litlogger/) to enable LitLogger, which logs metrics and artifacts automatically to the Lightning Experiments platform.
💡 Tip: For seamless cloud logging and experiment tracking, try installing [litlogger](https://pypi.org/project/litlogger/) to enable LitLogger, which logs metrics and artifacts automatically to the Lightning Experiments platform.
GPU available: True (cuda), used: True
TPU available: False, using: 0 TPU cores
💡 Tip: For seamless cloud logging and experiment tracking, try installing [litlogger](https://pypi.org/project/litlogger/) to enable LitLogger, which logs metrics and artifacts automatically to the Lightning Experiments platform.
LOCAL_RANK: 0 - CUDA_VISIBLE_DEVICES: [0]
LOCAL_RANK: 0 - CUDA_VISIBLE_DEVICES: [0]
LOCAL_RANK: 0 - CUDA_VISIBLE_DEVICES: [0]
SLURM auto-requeueing enabled. Setting signal handlers.
SLURM auto-requeueing enabled. Setting signal handlers.
SLURM auto-requeueing enabled. Setting signal handlers.
`Trainer.fit` stopped: `max_epochs=30` reached.
`Trainer.fit` stopped: `max_epochs=30` reached.
`Trainer.fit` stopped: `max_epochs=30` reached.
[I 2026-04-23 19:59:33,321] Trial 44 finished with value: 0.119 and parameters: {'left_wall_dist_num_layers': 2, 'left_wall_dist_activation': 'relu', 'left_wall_dist_max_flattened': 1072, 'left_wall_dist_fc_hidden': 32, 'left_wall_dist_pool_size_l0': 4, 'track_width_num_layers': 4, 'track_width_activation': 'relu', 'track_width_max_flattened': 2144, 'track_width_fc_hidden': 64, 'track_width_pool_size_l0': 4, 'heading_error_num_layers': 3, 'heading_error_activation': 'relu', 'heading_error_max_flattened': 1072, 'heading_error_fc_hidden': 128, 'heading_error_pool_size_l0': 2}. Best is trial 16 with value: 0.119.
[rank: 0] Seed set to 42
[rank: 0] Seed set to 42
[rank: 0] Seed set to 42
GPU available: True (cuda), used: True
TPU available: False, using: 0 TPU cores
💡 Tip: For seamless cloud logging and experiment tracking, try installing [litlogger](https://pypi.org/project/litlogger/) to enable LitLogger, which logs metrics and artifacts automatically to the Lightning Experiments platform.
GPU available: True (cuda), used: True
TPU available: False, using: 0 TPU cores
💡 Tip: For seamless cloud logging and experiment tracking, try installing [litlogger](https://pypi.org/project/litlogger/) to enable LitLogger, which logs metrics and artifacts automatically to the Lightning Experiments platform.
GPU available: True (cuda), used: True
TPU available: False, using: 0 TPU cores
💡 Tip: For seamless cloud logging and experiment tracking, try installing [litlogger](https://pypi.org/project/litlogger/) to enable LitLogger, which logs metrics and artifacts automatically to the Lightning Experiments platform.
LOCAL_RANK: 0 - CUDA_VISIBLE_DEVICES: [0]
LOCAL_RANK: 0 - CUDA_VISIBLE_DEVICES: [0]
LOCAL_RANK: 0 - CUDA_VISIBLE_DEVICES: [0]
SLURM auto-requeueing enabled. Setting signal handlers.
SLURM auto-requeueing enabled. Setting signal handlers.
SLURM auto-requeueing enabled. Setting signal handlers.
`Trainer.fit` stopped: `max_epochs=30` reached.
`Trainer.fit` stopped: `max_epochs=30` reached.
`Trainer.fit` stopped: `max_epochs=30` reached.
[I 2026-04-23 20:02:15,667] Trial 45 finished with value: 0.1946 and parameters: {'left_wall_dist_num_layers': 3, 'left_wall_dist_activation': 'relu', 'left_wall_dist_max_flattened': 2144, 'left_wall_dist_fc_hidden': 32, 'left_wall_dist_pool_size_l0': 8, 'left_wall_dist_out_channels_l0': 13, 'left_wall_dist_pool_size_l1': 4, 'left_wall_dist_out_channels_l1': 8, 'left_wall_dist_pool_size_l2': 4, 'left_wall_dist_out_channels_l2': 45, 'track_width_num_layers': 3, 'track_width_activation': 'elu', 'track_width_max_flattened': 4288, 'track_width_fc_hidden': 128, 'track_width_pool_size_l0': 4, 'track_width_out_channels_l0': 10, 'track_width_pool_size_l1': 2, 'track_width_out_channels_l1': 12, 'track_width_pool_size_l2': 4, 'track_width_out_channels_l2': 19, 'heading_error_num_layers': 2, 'heading_error_activation': 'relu', 'heading_error_max_flattened': 2144, 'heading_error_fc_hidden': 128, 'heading_error_pool_size_l0': 8, 'heading_error_out_channels_l0': 16, 'heading_error_pool_size_l1': 8, 'heading_error_out_channels_l1': 132}. Best is trial 16 with value: 0.119.
[rank: 0] Seed set to 42
[rank: 0] Seed set to 42
[rank: 0] Seed set to 42
GPU available: True (cuda), used: True
TPU available: False, using: 0 TPU cores
GPU available: True (cuda), used: True
TPU available: False, using: 0 TPU cores
💡 Tip: For seamless cloud logging and experiment tracking, try installing [litlogger](https://pypi.org/project/litlogger/) to enable LitLogger, which logs metrics and artifacts automatically to the Lightning Experiments platform.
💡 Tip: For seamless cloud logging and experiment tracking, try installing [litlogger](https://pypi.org/project/litlogger/) to enable LitLogger, which logs metrics and artifacts automatically to the Lightning Experiments platform.
GPU available: True (cuda), used: True
TPU available: False, using: 0 TPU cores
💡 Tip: For seamless cloud logging and experiment tracking, try installing [litlogger](https://pypi.org/project/litlogger/) to enable LitLogger, which logs metrics and artifacts automatically to the Lightning Experiments platform.
LOCAL_RANK: 0 - CUDA_VISIBLE_DEVICES: [0]
LOCAL_RANK: 0 - CUDA_VISIBLE_DEVICES: [0]
LOCAL_RANK: 0 - CUDA_VISIBLE_DEVICES: [0]
SLURM auto-requeueing enabled. Setting signal handlers.
SLURM auto-requeueing enabled. Setting signal handlers.
SLURM auto-requeueing enabled. Setting signal handlers.
`Trainer.fit` stopped: `max_epochs=30` reached.
`Trainer.fit` stopped: `max_epochs=30` reached.
`Trainer.fit` stopped: `max_epochs=30` reached.
