[I 2026-04-16 01:26:16,881] Trial 93 finished with value: 0.1717 and parameters: {'left_wall_dist_num_layers': 3, 'left_wall_dist_activation': 'elu', 'left_wall_dist_out_channels_l0': 45, 'left_wall_dist_pool_size_l0': 4, 'left_wall_dist_out_channels_l1': 68, 'left_wall_dist_pool_size_l1': 8, 'left_wall_dist_out_channels_l2': 50, 'left_wall_dist_pool_size_l2': 4, 'left_wall_dist_fc_hidden': 82, 'track_width_num_layers': 5, 'track_width_activation': 'relu', 'track_width_out_channels_l0': 108, 'track_width_pool_size_l0': 8, 'track_width_out_channels_l1': 202, 'track_width_pool_size_l1': 2, 'track_width_out_channels_l2': 47, 'track_width_pool_size_l2': 2, 'track_width_out_channels_l3': 50, 'track_width_pool_size_l3': 4, 'track_width_out_channels_l4': 42, 'track_width_pool_size_l4': 2, 'heading_error_num_layers': 3, 'heading_error_activation': 'relu', 'heading_error_out_channels_l0': 74, 'heading_error_pool_size_l0': 4, 'heading_error_out_channels_l1': 94, 'heading_error_pool_size_l1': 8, 'heading_error_out_channels_l2': 179, 'heading_error_pool_size_l2': 8, 'heading_error_fc_hidden': 76}. Best is trial 23 with value: 0.0876.
[rank: 0] Seed set to 42
GPU available: True (cuda), used: True
TPU available: False, using: 0 TPU cores
💡 Tip: For seamless cloud logging and experiment tracking, try installing [litlogger](https://pypi.org/project/litlogger/) to enable LitLogger, which logs metrics and artifacts automatically to the Lightning Experiments platform.
[rank: 0] Seed set to 42
[rank: 0] Seed set to 42
GPU available: True (cuda), used: True
TPU available: False, using: 0 TPU cores
💡 Tip: For seamless cloud logging and experiment tracking, try installing [litlogger](https://pypi.org/project/litlogger/) to enable LitLogger, which logs metrics and artifacts automatically to the Lightning Experiments platform.
GPU available: True (cuda), used: True
TPU available: False, using: 0 TPU cores
💡 Tip: For seamless cloud logging and experiment tracking, try installing [litlogger](https://pypi.org/project/litlogger/) to enable LitLogger, which logs metrics and artifacts automatically to the Lightning Experiments platform.
LOCAL_RANK: 0 - CUDA_VISIBLE_DEVICES: [0]
LOCAL_RANK: 0 - CUDA_VISIBLE_DEVICES: [0]
LOCAL_RANK: 0 - CUDA_VISIBLE_DEVICES: [0]
SLURM auto-requeueing enabled. Setting signal handlers.
SLURM auto-requeueing enabled. Setting signal handlers.
SLURM auto-requeueing enabled. Setting signal handlers.
`Trainer.fit` stopped: `max_epochs=30` reached.
`Trainer.fit` stopped: `max_epochs=30` reached.
`Trainer.fit` stopped: `max_epochs=30` reached.
[I 2026-04-16 01:28:50,920] Trial 94 finished with value: 0.1113 and parameters: {'left_wall_dist_num_layers': 2, 'left_wall_dist_activation': 'elu', 'left_wall_dist_out_channels_l0': 106, 'left_wall_dist_pool_size_l0': 4, 'left_wall_dist_out_channels_l1': 88, 'left_wall_dist_pool_size_l1': 8, 'left_wall_dist_fc_hidden': 78, 'track_width_num_layers': 5, 'track_width_activation': 'relu', 'track_width_out_channels_l0': 116, 'track_width_pool_size_l0': 8, 'track_width_out_channels_l1': 229, 'track_width_pool_size_l1': 2, 'track_width_out_channels_l2': 45, 'track_width_pool_size_l2': 2, 'track_width_out_channels_l3': 44, 'track_width_pool_size_l3': 4, 'track_width_out_channels_l4': 37, 'track_width_pool_size_l4': 8, 'track_width_fc_hidden': 40, 'heading_error_num_layers': 2, 'heading_error_activation': 'elu', 'heading_error_out_channels_l0': 113, 'heading_error_pool_size_l0': 4, 'heading_error_out_channels_l1': 138, 'heading_error_pool_size_l1': 8, 'heading_error_fc_hidden': 77}. Best is trial 23 with value: 0.0876.
[rank: 0] Seed set to 42
[rank: 0] Seed set to 42
[rank: 0] Seed set to 42
GPU available: True (cuda), used: True
TPU available: False, using: 0 TPU cores
GPU available: True (cuda), used: True
TPU available: False, using: 0 TPU cores
💡 Tip: For seamless cloud logging and experiment tracking, try installing [litlogger](https://pypi.org/project/litlogger/) to enable LitLogger, which logs metrics and artifacts automatically to the Lightning Experiments platform.
💡 Tip: For seamless cloud logging and experiment tracking, try installing [litlogger](https://pypi.org/project/litlogger/) to enable LitLogger, which logs metrics and artifacts automatically to the Lightning Experiments platform.
GPU available: True (cuda), used: True
TPU available: False, using: 0 TPU cores
💡 Tip: For seamless cloud logging and experiment tracking, try installing [litlogger](https://pypi.org/project/litlogger/) to enable LitLogger, which logs metrics and artifacts automatically to the Lightning Experiments platform.
LOCAL_RANK: 0 - CUDA_VISIBLE_DEVICES: [0]
LOCAL_RANK: 0 - CUDA_VISIBLE_DEVICES: [0]
LOCAL_RANK: 0 - CUDA_VISIBLE_DEVICES: [0]
SLURM auto-requeueing enabled. Setting signal handlers.
SLURM auto-requeueing enabled. Setting signal handlers.
SLURM auto-requeueing enabled. Setting signal handlers.
`Trainer.fit` stopped: `max_epochs=30` reached.
`Trainer.fit` stopped: `max_epochs=30` reached.
`Trainer.fit` stopped: `max_epochs=30` reached.
[I 2026-04-16 01:31:29,258] Trial 95 finished with value: 0.1019 and parameters: {'left_wall_dist_num_layers': 3, 'left_wall_dist_activation': 'elu', 'left_wall_dist_out_channels_l0': 40, 'left_wall_dist_pool_size_l0': 4, 'left_wall_dist_out_channels_l1': 61, 'left_wall_dist_pool_size_l1': 8, 'left_wall_dist_out_channels_l2': 119, 'left_wall_dist_pool_size_l2': 2, 'left_wall_dist_fc_hidden': 104, 'track_width_num_layers': 5, 'track_width_activation': 'relu', 'track_width_out_channels_l0': 37, 'track_width_pool_size_l0': 2, 'track_width_out_channels_l1': 218, 'track_width_pool_size_l1': 2, 'track_width_out_channels_l2': 60, 'track_width_pool_size_l2': 2, 'track_width_out_channels_l3': 56, 'track_width_pool_size_l3': 4, 'track_width_out_channels_l4': 34, 'track_width_pool_size_l4': 2, 'track_width_fc_hidden': 46, 'heading_error_num_layers': 3, 'heading_error_activation': 'elu', 'heading_error_out_channels_l0': 88, 'heading_error_pool_size_l0': 4, 'heading_error_out_channels_l1': 150, 'heading_error_pool_size_l1': 4, 'heading_error_out_channels_l2': 39, 'heading_error_pool_size_l2': 4, 'heading_error_fc_hidden': 83}. Best is trial 23 with value: 0.0876.
[rank: 0] Seed set to 42
[rank: 0] Seed set to 42
[rank: 0] Seed set to 42
GPU available: True (cuda), used: True
TPU available: False, using: 0 TPU cores
💡 Tip: For seamless cloud logging and experiment tracking, try installing [litlogger](https://pypi.org/project/litlogger/) to enable LitLogger, which logs metrics and artifacts automatically to the Lightning Experiments platform.
GPU available: True (cuda), used: True
TPU available: False, using: 0 TPU cores
💡 Tip: For seamless cloud logging and experiment tracking, try installing [litlogger](https://pypi.org/project/litlogger/) to enable LitLogger, which logs metrics and artifacts automatically to the Lightning Experiments platform.
GPU available: True (cuda), used: True
TPU available: False, using: 0 TPU cores
💡 Tip: For seamless cloud logging and experiment tracking, try installing [litlogger](https://pypi.org/project/litlogger/) to enable LitLogger, which logs metrics and artifacts automatically to the Lightning Experiments platform.
LOCAL_RANK: 0 - CUDA_VISIBLE_DEVICES: [0]
LOCAL_RANK: 0 - CUDA_VISIBLE_DEVICES: [0]
LOCAL_RANK: 0 - CUDA_VISIBLE_DEVICES: [0]
SLURM auto-requeueing enabled. Setting signal handlers.
SLURM auto-requeueing enabled. Setting signal handlers.
SLURM auto-requeueing enabled. Setting signal handlers.
`Trainer.fit` stopped: `max_epochs=30` reached.
`Trainer.fit` stopped: `max_epochs=30` reached.
`Trainer.fit` stopped: `max_epochs=30` reached.
[I 2026-04-16 01:33:58,696] Trial 96 finished with value: 0.1198 and parameters: {'left_wall_dist_num_layers': 3, 'left_wall_dist_activation': 'relu', 'left_wall_dist_out_channels_l0': 64, 'left_wall_dist_pool_size_l0': 4, 'left_wall_dist_out_channels_l1': 81, 'left_wall_dist_pool_size_l1': 2, 'left_wall_dist_out_channels_l2': 132, 'left_wall_dist_pool_size_l2': 8, 'left_wall_dist_fc_hidden': 92, 'track_width_num_layers': 5, 'track_width_activation': 'relu', 'track_width_out_channels_l0': 48, 'track_width_pool_size_l0': 8, 'track_width_out_channels_l1': 171, 'track_width_pool_size_l1': 2, 'track_width_out_channels_l2': 41, 'track_width_pool_size_l2': 4, 'track_width_out_channels_l3': 34, 'track_width_pool_size_l3': 4, 'track_width_out_channels_l4': 41, 'track_width_pool_size_l4': 4, 'heading_error_num_layers': 2, 'heading_error_activation': 'elu', 'heading_error_out_channels_l0': 58, 'heading_error_pool_size_l0': 2, 'heading_error_out_channels_l1': 164, 'heading_error_pool_size_l1': 8}. Best is trial 23 with value: 0.0876.
[rank: 0] Seed set to 42
[rank: 0] Seed set to 42
GPU available: True (cuda), used: True
TPU available: False, using: 0 TPU cores
💡 Tip: For seamless cloud logging and experiment tracking, try installing [litlogger](https://pypi.org/project/litlogger/) to enable LitLogger, which logs metrics and artifacts automatically to the Lightning Experiments platform.
GPU available: True (cuda), used: True
TPU available: False, using: 0 TPU cores
💡 Tip: For seamless cloud logging and experiment tracking, try installing [litlogger](https://pypi.org/project/litlogger/) to enable LitLogger, which logs metrics and artifacts automatically to the Lightning Experiments platform.
[rank: 0] Seed set to 42
GPU available: True (cuda), used: True
TPU available: False, using: 0 TPU cores
💡 Tip: For seamless cloud logging and experiment tracking, try installing [litlogger](https://pypi.org/project/litlogger/) to enable LitLogger, which logs metrics and artifacts automatically to the Lightning Experiments platform.
LOCAL_RANK: 0 - CUDA_VISIBLE_DEVICES: [0]
LOCAL_RANK: 0 - CUDA_VISIBLE_DEVICES: [0]
LOCAL_RANK: 0 - CUDA_VISIBLE_DEVICES: [0]
SLURM auto-requeueing enabled. Setting signal handlers.
SLURM auto-requeueing enabled. Setting signal handlers.
SLURM auto-requeueing enabled. Setting signal handlers.
`Trainer.fit` stopped: `max_epochs=30` reached.
`Trainer.fit` stopped: `max_epochs=30` reached.
`Trainer.fit` stopped: `max_epochs=30` reached.
[I 2026-04-16 01:36:44,524] Trial 97 finished with value: 0.1598 and parameters: {'left_wall_dist_num_layers': 2, 'left_wall_dist_activation': 'elu', 'left_wall_dist_out_channels_l0': 98, 'left_wall_dist_pool_size_l0': 2, 'left_wall_dist_out_channels_l1': 72, 'left_wall_dist_pool_size_l1': 4, 'track_width_num_layers': 5, 'track_width_activation': 'relu', 'track_width_out_channels_l0': 41, 'track_width_pool_size_l0': 8, 'track_width_out_channels_l1': 243, 'track_width_pool_size_l1': 4, 'track_width_out_channels_l2': 113, 'track_width_pool_size_l2': 2, 'track_width_out_channels_l3': 61, 'track_width_pool_size_l3': 4, 'track_width_out_channels_l4': 32, 'track_width_pool_size_l4': 8, 'heading_error_num_layers': 5, 'heading_error_activation': 'elu', 'heading_error_out_channels_l0': 118, 'heading_error_pool_size_l0': 4, 'heading_error_out_channels_l1': 132, 'heading_error_pool_size_l1': 2, 'heading_error_out_channels_l2': 60, 'heading_error_pool_size_l2': 4, 'heading_error_out_channels_l3': 179, 'heading_error_pool_size_l3': 2, 'heading_error_out_channels_l4': 86, 'heading_error_pool_size_l4': 8, 'heading_error_fc_hidden': 43}. Best is trial 23 with value: 0.0876.
[rank: 0] Seed set to 42
GPU available: True (cuda), used: True
TPU available: False, using: 0 TPU cores
💡 Tip: For seamless cloud logging and experiment tracking, try installing [litlogger](https://pypi.org/project/litlogger/) to enable LitLogger, which logs metrics and artifacts automatically to the Lightning Experiments platform.
[rank: 0] Seed set to 42
[rank: 0] Seed set to 42
GPU available: True (cuda), used: True
TPU available: False, using: 0 TPU cores
💡 Tip: For seamless cloud logging and experiment tracking, try installing [litlogger](https://pypi.org/project/litlogger/) to enable LitLogger, which logs metrics and artifacts automatically to the Lightning Experiments platform.
GPU available: True (cuda), used: True
TPU available: False, using: 0 TPU cores
💡 Tip: For seamless cloud logging and experiment tracking, try installing [litlogger](https://pypi.org/project/litlogger/) to enable LitLogger, which logs metrics and artifacts automatically to the Lightning Experiments platform.
LOCAL_RANK: 0 - CUDA_VISIBLE_DEVICES: [0]
SLURM auto-requeueing enabled. Setting signal handlers.
LOCAL_RANK: 0 - CUDA_VISIBLE_DEVICES: [0]
LOCAL_RANK: 0 - CUDA_VISIBLE_DEVICES: [0]
SLURM auto-requeueing enabled. Setting signal handlers.
SLURM auto-requeueing enabled. Setting signal handlers.
`Trainer.fit` stopped: `max_epochs=30` reached.
`Trainer.fit` stopped: `max_epochs=30` reached.
`Trainer.fit` stopped: `max_epochs=30` reached.
[I 2026-04-16 01:39:26,922] Trial 98 finished with value: 0.1278 and parameters: {'left_wall_dist_num_layers': 4, 'left_wall_dist_activation': 'elu', 'left_wall_dist_out_channels_l0': 50, 'left_wall_dist_pool_size_l0': 8, 'left_wall_dist_out_channels_l1': 136, 'left_wall_dist_pool_size_l1': 8, 'left_wall_dist_out_channels_l2': 46, 'left_wall_dist_pool_size_l2': 2, 'left_wall_dist_out_channels_l3': 249, 'left_wall_dist_pool_size_l3': 8, 'left_wall_dist_fc_hidden': 99, 'track_width_num_layers': 5, 'track_width_activation': 'relu', 'track_width_out_channels_l0': 128, 'track_width_pool_size_l0': 4, 'track_width_out_channels_l1': 108, 'track_width_pool_size_l1': 2, 'track_width_out_channels_l2': 36, 'track_width_pool_size_l2': 2, 'track_width_out_channels_l3': 53, 'track_width_pool_size_l3': 4, 'track_width_out_channels_l4': 37, 'track_width_pool_size_l4': 2, 'track_width_fc_hidden': 42, 'heading_error_num_layers': 3, 'heading_error_activation': 'relu', 'heading_error_out_channels_l0': 49, 'heading_error_pool_size_l0': 8, 'heading_error_out_channels_l1': 85, 'heading_error_pool_size_l1': 8, 'heading_error_out_channels_l2': 51, 'heading_error_pool_size_l2': 4, 'heading_error_fc_hidden': 37}. Best is trial 23 with value: 0.0876.
[rank: 0] Seed set to 42
[rank: 0] Seed set to 42
GPU available: True (cuda), used: True
TPU available: False, using: 0 TPU cores
💡 Tip: For seamless cloud logging and experiment tracking, try installing [litlogger](https://pypi.org/project/litlogger/) to enable LitLogger, which logs metrics and artifacts automatically to the Lightning Experiments platform.
GPU available: True (cuda), used: True
TPU available: False, using: 0 TPU cores
💡 Tip: For seamless cloud logging and experiment tracking, try installing [litlogger](https://pypi.org/project/litlogger/) to enable LitLogger, which logs metrics and artifacts automatically to the Lightning Experiments platform.
[rank: 0] Seed set to 42
GPU available: True (cuda), used: True
TPU available: False, using: 0 TPU cores
💡 Tip: For seamless cloud logging and experiment tracking, try installing [litlogger](https://pypi.org/project/litlogger/) to enable LitLogger, which logs metrics and artifacts automatically to the Lightning Experiments platform.
LOCAL_RANK: 0 - CUDA_VISIBLE_DEVICES: [0]
LOCAL_RANK: 0 - CUDA_VISIBLE_DEVICES: [0]
SLURM auto-requeueing enabled. Setting signal handlers.
SLURM auto-requeueing enabled. Setting signal handlers.
LOCAL_RANK: 0 - CUDA_VISIBLE_DEVICES: [0]
SLURM auto-requeueing enabled. Setting signal handlers.
`Trainer.fit` stopped: `max_epochs=30` reached.
`Trainer.fit` stopped: `max_epochs=30` reached.
`Trainer.fit` stopped: `max_epochs=30` reached.
[I 2026-04-16 01:42:04,289] Trial 99 finished with value: 0.1323 and parameters: {'left_wall_dist_num_layers': 3, 'left_wall_dist_activation': 'relu', 'left_wall_dist_out_channels_l0': 37, 'left_wall_dist_pool_size_l0': 2, 'left_wall_dist_out_channels_l1': 55, 'left_wall_dist_pool_size_l1': 8, 'left_wall_dist_out_channels_l2': 37, 'left_wall_dist_pool_size_l2': 2, 'left_wall_dist_fc_hidden': 110, 'track_width_num_layers': 5, 'track_width_activation': 'relu', 'track_width_out_channels_l0': 62, 'track_width_pool_size_l0': 8, 'track_width_out_channels_l1': 45, 'track_width_pool_size_l1': 2, 'track_width_out_channels_l2': 66, 'track_width_pool_size_l2': 2, 'track_width_out_channels_l3': 42, 'track_width_pool_size_l3': 2, 'track_width_out_channels_l4': 46, 'track_width_pool_size_l4': 8, 'heading_error_num_layers': 2, 'heading_error_activation': 'elu', 'heading_error_out_channels_l0': 109, 'heading_error_pool_size_l0': 4, 'heading_error_out_channels_l1': 191, 'heading_error_pool_size_l1': 8, 'heading_error_fc_hidden': 100}. Best is trial 23 with value: 0.0876.
[rank: 0] Seed set to 42
[rank: 0] Seed set to 42
GPU available: True (cuda), used: True
TPU available: False, using: 0 TPU cores
💡 Tip: For seamless cloud logging and experiment tracking, try installing [litlogger](https://pypi.org/project/litlogger/) to enable LitLogger, which logs metrics and artifacts automatically to the Lightning Experiments platform.
GPU available: True (cuda), used: True
TPU available: False, using: 0 TPU cores
💡 Tip: For seamless cloud logging and experiment tracking, try installing [litlogger](https://pypi.org/project/litlogger/) to enable LitLogger, which logs metrics and artifacts automatically to the Lightning Experiments platform.
[rank: 0] Seed set to 42
GPU available: True (cuda), used: True
TPU available: False, using: 0 TPU cores
💡 Tip: For seamless cloud logging and experiment tracking, try installing [litlogger](https://pypi.org/project/litlogger/) to enable LitLogger, which logs metrics and artifacts automatically to the Lightning Experiments platform.
LOCAL_RANK: 0 - CUDA_VISIBLE_DEVICES: [0]
LOCAL_RANK: 0 - CUDA_VISIBLE_DEVICES: [0]
LOCAL_RANK: 0 - CUDA_VISIBLE_DEVICES: [0]
SLURM auto-requeueing enabled. Setting signal handlers.
SLURM auto-requeueing enabled. Setting signal handlers.
SLURM auto-requeueing enabled. Setting signal handlers.
`Trainer.fit` stopped: `max_epochs=30` reached.
`Trainer.fit` stopped: `max_epochs=30` reached.
`Trainer.fit` stopped: `max_epochs=30` reached.
[I 2026-04-16 01:44:45,875] Trial 100 finished with value: 0.1054 and parameters: {'left_wall_dist_num_layers': 2, 'left_wall_dist_activation': 'elu', 'left_wall_dist_out_channels_l0': 125, 'left_wall_dist_pool_size_l0': 4, 'left_wall_dist_out_channels_l1': 240, 'left_wall_dist_pool_size_l1': 8, 'left_wall_dist_fc_hidden': 125, 'track_width_num_layers': 5, 'track_width_activation': 'relu', 'track_width_out_channels_l0': 43, 'track_width_pool_size_l0': 2, 'track_width_out_channels_l1': 185, 'track_width_pool_size_l1': 2, 'track_width_out_channels_l2': 43, 'track_width_pool_size_l2': 2, 'track_width_out_channels_l3': 167, 'track_width_pool_size_l3': 4, 'track_width_out_channels_l4': 40, 'track_width_pool_size_l4': 2, 'track_width_fc_hidden': 84, 'heading_error_num_layers': 3, 'heading_error_activation': 'elu', 'heading_error_out_channels_l0': 53, 'heading_error_pool_size_l0': 4, 'heading_error_out_channels_l1': 203, 'heading_error_pool_size_l1': 8, 'heading_error_out_channels_l2': 32, 'heading_error_pool_size_l2': 4, 'heading_error_fc_hidden': 55}. Best is trial 23 with value: 0.0876.
[rank: 0] Seed set to 42
[rank: 0] Seed set to 42
GPU available: True (cuda), used: True
GPU available: True (cuda), used: True
TPU available: False, using: 0 TPU cores
TPU available: False, using: 0 TPU cores
💡 Tip: For seamless cloud logging and experiment tracking, try installing [litlogger](https://pypi.org/project/litlogger/) to enable LitLogger, which logs metrics and artifacts automatically to the Lightning Experiments platform.
💡 Tip: For seamless cloud logging and experiment tracking, try installing [litlogger](https://pypi.org/project/litlogger/) to enable LitLogger, which logs metrics and artifacts automatically to the Lightning Experiments platform.
[rank: 0] Seed set to 42
GPU available: True (cuda), used: True
TPU available: False, using: 0 TPU cores
💡 Tip: For seamless cloud logging and experiment tracking, try installing [litlogger](https://pypi.org/project/litlogger/) to enable LitLogger, which logs metrics and artifacts automatically to the Lightning Experiments platform.
LOCAL_RANK: 0 - CUDA_VISIBLE_DEVICES: [0]
LOCAL_RANK: 0 - CUDA_VISIBLE_DEVICES: [0]
LOCAL_RANK: 0 - CUDA_VISIBLE_DEVICES: [0]
SLURM auto-requeueing enabled. Setting signal handlers.
SLURM auto-requeueing enabled. Setting signal handlers.
SLURM auto-requeueing enabled. Setting signal handlers.
`Trainer.fit` stopped: `max_epochs=30` reached.
`Trainer.fit` stopped: `max_epochs=30` reached.
`Trainer.fit` stopped: `max_epochs=30` reached.
