[I 2026-04-15 00:25:41,896] Trial 87 finished with value: 0.1277 and parameters: {'left_wall_dist_num_layers': 2, 'left_wall_dist_activation': 'elu', 'left_wall_dist_out_channels_l0': 38, 'left_wall_dist_pool_size_l0': 4, 'left_wall_dist_out_channels_l1': 64, 'left_wall_dist_pool_size_l1': 4, 'left_wall_dist_fc_hidden': 110, 'track_width_num_layers': 2, 'track_width_activation': 'relu', 'track_width_out_channels_l0': 79, 'track_width_pool_size_l0': 4, 'track_width_out_channels_l1': 131, 'track_width_pool_size_l1': 8, 'track_width_fc_hidden': 69, 'heading_error_num_layers': 5, 'heading_error_activation': 'relu', 'heading_error_out_channels_l0': 35, 'heading_error_pool_size_l0': 4, 'heading_error_out_channels_l1': 100, 'heading_error_pool_size_l1': 4, 'heading_error_out_channels_l2': 107, 'heading_error_pool_size_l2': 2, 'heading_error_out_channels_l3': 62, 'heading_error_pool_size_l3': 2, 'heading_error_out_channels_l4': 76, 'heading_error_pool_size_l4': 4, 'heading_error_fc_hidden': 39}. Best is trial 66 with value: 0.0922.
[rank: 0] Seed set to 42
[rank: 0] Seed set to 42
[rank: 0] Seed set to 42
GPU available: True (cuda), used: True
TPU available: False, using: 0 TPU cores
💡 Tip: For seamless cloud logging and experiment tracking, try installing [litlogger](https://pypi.org/project/litlogger/) to enable LitLogger, which logs metrics and artifacts automatically to the Lightning Experiments platform.
GPU available: True (cuda), used: True
GPU available: True (cuda), used: True
TPU available: False, using: 0 TPU cores
TPU available: False, using: 0 TPU cores
💡 Tip: For seamless cloud logging and experiment tracking, try installing [litlogger](https://pypi.org/project/litlogger/) to enable LitLogger, which logs metrics and artifacts automatically to the Lightning Experiments platform.
💡 Tip: For seamless cloud logging and experiment tracking, try installing [litlogger](https://pypi.org/project/litlogger/) to enable LitLogger, which logs metrics and artifacts automatically to the Lightning Experiments platform.
LOCAL_RANK: 0 - CUDA_VISIBLE_DEVICES: [0]
LOCAL_RANK: 0 - CUDA_VISIBLE_DEVICES: [0]
LOCAL_RANK: 0 - CUDA_VISIBLE_DEVICES: [0]
SLURM auto-requeueing enabled. Setting signal handlers.
SLURM auto-requeueing enabled. Setting signal handlers.
SLURM auto-requeueing enabled. Setting signal handlers.
`Trainer.fit` stopped: `max_epochs=30` reached.
`Trainer.fit` stopped: `max_epochs=30` reached.
`Trainer.fit` stopped: `max_epochs=30` reached.
[I 2026-04-15 00:28:26,946] Trial 88 finished with value: 0.1161 and parameters: {'left_wall_dist_num_layers': 2, 'left_wall_dist_activation': 'elu', 'left_wall_dist_out_channels_l0': 34, 'left_wall_dist_pool_size_l0': 4, 'left_wall_dist_out_channels_l1': 69, 'left_wall_dist_pool_size_l1': 8, 'left_wall_dist_fc_hidden': 38, 'track_width_num_layers': 2, 'track_width_activation': 'elu', 'track_width_out_channels_l0': 74, 'track_width_pool_size_l0': 4, 'track_width_out_channels_l1': 78, 'track_width_pool_size_l1': 8, 'track_width_fc_hidden': 42, 'heading_error_num_layers': 5, 'heading_error_activation': 'relu', 'heading_error_out_channels_l0': 90, 'heading_error_pool_size_l0': 4, 'heading_error_out_channels_l1': 140, 'heading_error_pool_size_l1': 8, 'heading_error_out_channels_l2': 90, 'heading_error_pool_size_l2': 2, 'heading_error_out_channels_l3': 48, 'heading_error_pool_size_l3': 2, 'heading_error_out_channels_l4': 45, 'heading_error_pool_size_l4': 4}. Best is trial 66 with value: 0.0922.
[rank: 0] Seed set to 42
[rank: 0] Seed set to 42
GPU available: True (cuda), used: True
TPU available: False, using: 0 TPU cores
💡 Tip: For seamless cloud logging and experiment tracking, try installing [litlogger](https://pypi.org/project/litlogger/) to enable LitLogger, which logs metrics and artifacts automatically to the Lightning Experiments platform.
GPU available: True (cuda), used: True
TPU available: False, using: 0 TPU cores
💡 Tip: For seamless cloud logging and experiment tracking, try installing [litlogger](https://pypi.org/project/litlogger/) to enable LitLogger, which logs metrics and artifacts automatically to the Lightning Experiments platform.
[rank: 0] Seed set to 42
GPU available: True (cuda), used: True
TPU available: False, using: 0 TPU cores
💡 Tip: For seamless cloud logging and experiment tracking, try installing [litlogger](https://pypi.org/project/litlogger/) to enable LitLogger, which logs metrics and artifacts automatically to the Lightning Experiments platform.
LOCAL_RANK: 0 - CUDA_VISIBLE_DEVICES: [0]
LOCAL_RANK: 0 - CUDA_VISIBLE_DEVICES: [0]
SLURM auto-requeueing enabled. Setting signal handlers.
SLURM auto-requeueing enabled. Setting signal handlers.
LOCAL_RANK: 0 - CUDA_VISIBLE_DEVICES: [0]
SLURM auto-requeueing enabled. Setting signal handlers.
`Trainer.fit` stopped: `max_epochs=30` reached.
`Trainer.fit` stopped: `max_epochs=30` reached.
`Trainer.fit` stopped: `max_epochs=30` reached.
[I 2026-04-15 00:31:19,942] Trial 89 finished with value: 0.152 and parameters: {'left_wall_dist_num_layers': 2, 'left_wall_dist_activation': 'elu', 'left_wall_dist_out_channels_l0': 52, 'left_wall_dist_pool_size_l0': 4, 'left_wall_dist_out_channels_l1': 72, 'left_wall_dist_pool_size_l1': 4, 'left_wall_dist_fc_hidden': 116, 'track_width_num_layers': 2, 'track_width_activation': 'elu', 'track_width_out_channels_l0': 106, 'track_width_pool_size_l0': 2, 'track_width_out_channels_l1': 61, 'track_width_pool_size_l1': 4, 'track_width_fc_hidden': 127, 'heading_error_num_layers': 5, 'heading_error_activation': 'relu', 'heading_error_out_channels_l0': 39, 'heading_error_pool_size_l0': 4, 'heading_error_out_channels_l1': 64, 'heading_error_pool_size_l1': 4, 'heading_error_out_channels_l2': 68, 'heading_error_pool_size_l2': 2, 'heading_error_out_channels_l3': 55, 'heading_error_pool_size_l3': 8, 'heading_error_out_channels_l4': 37, 'heading_error_pool_size_l4': 4}. Best is trial 66 with value: 0.0922.
[rank: 0] Seed set to 42
[rank: 0] Seed set to 42
[rank: 0] Seed set to 42
GPU available: True (cuda), used: True
TPU available: False, using: 0 TPU cores
💡 Tip: For seamless cloud logging and experiment tracking, try installing [litlogger](https://pypi.org/project/litlogger/) to enable LitLogger, which logs metrics and artifacts automatically to the Lightning Experiments platform.
GPU available: True (cuda), used: True
TPU available: False, using: 0 TPU cores
💡 Tip: For seamless cloud logging and experiment tracking, try installing [litlogger](https://pypi.org/project/litlogger/) to enable LitLogger, which logs metrics and artifacts automatically to the Lightning Experiments platform.
GPU available: True (cuda), used: True
TPU available: False, using: 0 TPU cores
💡 Tip: For seamless cloud logging and experiment tracking, try installing [litlogger](https://pypi.org/project/litlogger/) to enable LitLogger, which logs metrics and artifacts automatically to the Lightning Experiments platform.
LOCAL_RANK: 0 - CUDA_VISIBLE_DEVICES: [0]
LOCAL_RANK: 0 - CUDA_VISIBLE_DEVICES: [0]
LOCAL_RANK: 0 - CUDA_VISIBLE_DEVICES: [0]
SLURM auto-requeueing enabled. Setting signal handlers.
SLURM auto-requeueing enabled. Setting signal handlers.
SLURM auto-requeueing enabled. Setting signal handlers.
`Trainer.fit` stopped: `max_epochs=30` reached.
`Trainer.fit` stopped: `max_epochs=30` reached.
`Trainer.fit` stopped: `max_epochs=30` reached.
[I 2026-04-15 00:34:05,319] Trial 90 finished with value: 0.12 and parameters: {'left_wall_dist_num_layers': 2, 'left_wall_dist_activation': 'elu', 'left_wall_dist_out_channels_l0': 47, 'left_wall_dist_pool_size_l0': 4, 'left_wall_dist_out_channels_l1': 99, 'left_wall_dist_pool_size_l1': 4, 'left_wall_dist_fc_hidden': 121, 'track_width_num_layers': 2, 'track_width_activation': 'elu', 'track_width_out_channels_l0': 101, 'track_width_pool_size_l0': 4, 'track_width_out_channels_l1': 67, 'track_width_pool_size_l1': 8, 'track_width_fc_hidden': 39, 'heading_error_num_layers': 5, 'heading_error_activation': 'relu', 'heading_error_out_channels_l0': 80, 'heading_error_pool_size_l0': 4, 'heading_error_out_channels_l1': 79, 'heading_error_pool_size_l1': 4, 'heading_error_out_channels_l2': 116, 'heading_error_pool_size_l2': 4, 'heading_error_out_channels_l3': 76, 'heading_error_pool_size_l3': 2, 'heading_error_out_channels_l4': 32, 'heading_error_pool_size_l4': 2, 'heading_error_fc_hidden': 34}. Best is trial 66 with value: 0.0922.
[rank: 0] Seed set to 42
[rank: 0] Seed set to 42
[rank: 0] Seed set to 42
GPU available: True (cuda), used: True
GPU available: True (cuda), used: True
TPU available: False, using: 0 TPU cores
TPU available: False, using: 0 TPU cores
💡 Tip: For seamless cloud logging and experiment tracking, try installing [litlogger](https://pypi.org/project/litlogger/) to enable LitLogger, which logs metrics and artifacts automatically to the Lightning Experiments platform.
💡 Tip: For seamless cloud logging and experiment tracking, try installing [litlogger](https://pypi.org/project/litlogger/) to enable LitLogger, which logs metrics and artifacts automatically to the Lightning Experiments platform.
GPU available: True (cuda), used: True
TPU available: False, using: 0 TPU cores
💡 Tip: For seamless cloud logging and experiment tracking, try installing [litlogger](https://pypi.org/project/litlogger/) to enable LitLogger, which logs metrics and artifacts automatically to the Lightning Experiments platform.
LOCAL_RANK: 0 - CUDA_VISIBLE_DEVICES: [0]
LOCAL_RANK: 0 - CUDA_VISIBLE_DEVICES: [0]
LOCAL_RANK: 0 - CUDA_VISIBLE_DEVICES: [0]
SLURM auto-requeueing enabled. Setting signal handlers.
SLURM auto-requeueing enabled. Setting signal handlers.
SLURM auto-requeueing enabled. Setting signal handlers.
`Trainer.fit` stopped: `max_epochs=30` reached.
`Trainer.fit` stopped: `max_epochs=30` reached.
`Trainer.fit` stopped: `max_epochs=30` reached.
[I 2026-04-15 00:36:55,445] Trial 91 finished with value: 0.1282 and parameters: {'left_wall_dist_num_layers': 2, 'left_wall_dist_activation': 'elu', 'left_wall_dist_out_channels_l0': 39, 'left_wall_dist_pool_size_l0': 4, 'left_wall_dist_out_channels_l1': 106, 'left_wall_dist_pool_size_l1': 4, 'left_wall_dist_fc_hidden': 123, 'track_width_num_layers': 2, 'track_width_activation': 'elu', 'track_width_out_channels_l0': 84, 'track_width_pool_size_l0': 4, 'track_width_out_channels_l1': 95, 'track_width_pool_size_l1': 8, 'track_width_fc_hidden': 52, 'heading_error_num_layers': 5, 'heading_error_activation': 'relu', 'heading_error_out_channels_l0': 46, 'heading_error_pool_size_l0': 4, 'heading_error_out_channels_l1': 69, 'heading_error_pool_size_l1': 4, 'heading_error_out_channels_l2': 120, 'heading_error_pool_size_l2': 2, 'heading_error_out_channels_l3': 67, 'heading_error_pool_size_l3': 2, 'heading_error_out_channels_l4': 42, 'heading_error_pool_size_l4': 4}. Best is trial 66 with value: 0.0922.
[rank: 0] Seed set to 42
[rank: 0] Seed set to 42
[rank: 0] Seed set to 42
GPU available: True (cuda), used: True
TPU available: False, using: 0 TPU cores
💡 Tip: For seamless cloud logging and experiment tracking, try installing [litlogger](https://pypi.org/project/litlogger/) to enable LitLogger, which logs metrics and artifacts automatically to the Lightning Experiments platform.
GPU available: True (cuda), used: True
TPU available: False, using: 0 TPU cores
💡 Tip: For seamless cloud logging and experiment tracking, try installing [litlogger](https://pypi.org/project/litlogger/) to enable LitLogger, which logs metrics and artifacts automatically to the Lightning Experiments platform.
GPU available: True (cuda), used: True
TPU available: False, using: 0 TPU cores
💡 Tip: For seamless cloud logging and experiment tracking, try installing [litlogger](https://pypi.org/project/litlogger/) to enable LitLogger, which logs metrics and artifacts automatically to the Lightning Experiments platform.
LOCAL_RANK: 0 - CUDA_VISIBLE_DEVICES: [0]
LOCAL_RANK: 0 - CUDA_VISIBLE_DEVICES: [0]
SLURM auto-requeueing enabled. Setting signal handlers.
LOCAL_RANK: 0 - CUDA_VISIBLE_DEVICES: [0]
SLURM auto-requeueing enabled. Setting signal handlers.
SLURM auto-requeueing enabled. Setting signal handlers.
`Trainer.fit` stopped: `max_epochs=30` reached.
`Trainer.fit` stopped: `max_epochs=30` reached.
`Trainer.fit` stopped: `max_epochs=30` reached.
[I 2026-04-15 00:39:45,880] Trial 92 finished with value: 0.1178 and parameters: {'left_wall_dist_num_layers': 2, 'left_wall_dist_activation': 'elu', 'left_wall_dist_out_channels_l0': 43, 'left_wall_dist_pool_size_l0': 4, 'left_wall_dist_out_channels_l1': 108, 'left_wall_dist_pool_size_l1': 4, 'left_wall_dist_fc_hidden': 123, 'track_width_num_layers': 2, 'track_width_activation': 'elu', 'track_width_out_channels_l0': 72, 'track_width_pool_size_l0': 4, 'track_width_out_channels_l1': 101, 'track_width_pool_size_l1': 8, 'track_width_fc_hidden': 55, 'heading_error_num_layers': 5, 'heading_error_activation': 'relu', 'heading_error_out_channels_l0': 56, 'heading_error_pool_size_l0': 4, 'heading_error_out_channels_l1': 88, 'heading_error_pool_size_l1': 4, 'heading_error_out_channels_l2': 139, 'heading_error_pool_size_l2': 2, 'heading_error_out_channels_l3': 57, 'heading_error_pool_size_l3': 2, 'heading_error_out_channels_l4': 53, 'heading_error_pool_size_l4': 4, 'heading_error_fc_hidden': 36}. Best is trial 66 with value: 0.0922.
[rank: 0] Seed set to 42
[rank: 0] Seed set to 42
[rank: 0] Seed set to 42
GPU available: True (cuda), used: True
TPU available: False, using: 0 TPU cores
💡 Tip: For seamless cloud logging and experiment tracking, try installing [litlogger](https://pypi.org/project/litlogger/) to enable LitLogger, which logs metrics and artifacts automatically to the Lightning Experiments platform.
GPU available: True (cuda), used: True
TPU available: False, using: 0 TPU cores
💡 Tip: For seamless cloud logging and experiment tracking, try installing [litlogger](https://pypi.org/project/litlogger/) to enable LitLogger, which logs metrics and artifacts automatically to the Lightning Experiments platform.
GPU available: True (cuda), used: True
TPU available: False, using: 0 TPU cores
💡 Tip: For seamless cloud logging and experiment tracking, try installing [litlogger](https://pypi.org/project/litlogger/) to enable LitLogger, which logs metrics and artifacts automatically to the Lightning Experiments platform.
LOCAL_RANK: 0 - CUDA_VISIBLE_DEVICES: [0]
LOCAL_RANK: 0 - CUDA_VISIBLE_DEVICES: [0]
LOCAL_RANK: 0 - CUDA_VISIBLE_DEVICES: [0]
SLURM auto-requeueing enabled. Setting signal handlers.
SLURM auto-requeueing enabled. Setting signal handlers.
SLURM auto-requeueing enabled. Setting signal handlers.
`Trainer.fit` stopped: `max_epochs=30` reached.
`Trainer.fit` stopped: `max_epochs=30` reached.
`Trainer.fit` stopped: `max_epochs=30` reached.
[I 2026-04-15 00:42:32,201] Trial 93 finished with value: 0.1061 and parameters: {'left_wall_dist_num_layers': 2, 'left_wall_dist_activation': 'elu', 'left_wall_dist_out_channels_l0': 38, 'left_wall_dist_pool_size_l0': 4, 'left_wall_dist_out_channels_l1': 130, 'left_wall_dist_pool_size_l1': 4, 'track_width_num_layers': 2, 'track_width_activation': 'elu', 'track_width_out_channels_l0': 87, 'track_width_pool_size_l0': 4, 'track_width_out_channels_l1': 91, 'track_width_pool_size_l1': 8, 'track_width_fc_hidden': 48, 'heading_error_num_layers': 5, 'heading_error_activation': 'relu', 'heading_error_out_channels_l0': 43, 'heading_error_pool_size_l0': 4, 'heading_error_out_channels_l1': 115, 'heading_error_pool_size_l1': 4, 'heading_error_out_channels_l2': 87, 'heading_error_pool_size_l2': 2, 'heading_error_out_channels_l3': 67, 'heading_error_pool_size_l3': 2, 'heading_error_out_channels_l4': 64, 'heading_error_pool_size_l4': 4, 'heading_error_fc_hidden': 41}. Best is trial 66 with value: 0.0922.
[rank: 0] Seed set to 42
[rank: 0] Seed set to 42
[rank: 0] Seed set to 42
GPU available: True (cuda), used: True
TPU available: False, using: 0 TPU cores
💡 Tip: For seamless cloud logging and experiment tracking, try installing [litlogger](https://pypi.org/project/litlogger/) to enable LitLogger, which logs metrics and artifacts automatically to the Lightning Experiments platform.
GPU available: True (cuda), used: True
TPU available: False, using: 0 TPU cores
💡 Tip: For seamless cloud logging and experiment tracking, try installing [litlogger](https://pypi.org/project/litlogger/) to enable LitLogger, which logs metrics and artifacts automatically to the Lightning Experiments platform.
GPU available: True (cuda), used: True
TPU available: False, using: 0 TPU cores
💡 Tip: For seamless cloud logging and experiment tracking, try installing [litlogger](https://pypi.org/project/litlogger/) to enable LitLogger, which logs metrics and artifacts automatically to the Lightning Experiments platform.
LOCAL_RANK: 0 - CUDA_VISIBLE_DEVICES: [0]
LOCAL_RANK: 0 - CUDA_VISIBLE_DEVICES: [0]
LOCAL_RANK: 0 - CUDA_VISIBLE_DEVICES: [0]
SLURM auto-requeueing enabled. Setting signal handlers.
SLURM auto-requeueing enabled. Setting signal handlers.
SLURM auto-requeueing enabled. Setting signal handlers.
`Trainer.fit` stopped: `max_epochs=30` reached.
`Trainer.fit` stopped: `max_epochs=30` reached.
`Trainer.fit` stopped: `max_epochs=30` reached.
[I 2026-04-15 00:45:16,825] Trial 94 finished with value: 0.1019 and parameters: {'left_wall_dist_num_layers': 2, 'left_wall_dist_activation': 'elu', 'left_wall_dist_out_channels_l0': 47, 'left_wall_dist_pool_size_l0': 4, 'left_wall_dist_out_channels_l1': 120, 'left_wall_dist_pool_size_l1': 4, 'left_wall_dist_fc_hidden': 125, 'track_width_num_layers': 2, 'track_width_activation': 'elu', 'track_width_out_channels_l0': 81, 'track_width_pool_size_l0': 4, 'track_width_out_channels_l1': 87, 'track_width_pool_size_l1': 8, 'track_width_fc_hidden': 46, 'heading_error_num_layers': 5, 'heading_error_activation': 'relu', 'heading_error_out_channels_l0': 40, 'heading_error_pool_size_l0': 4, 'heading_error_out_channels_l1': 120, 'heading_error_pool_size_l1': 4, 'heading_error_out_channels_l2': 86, 'heading_error_pool_size_l2': 2, 'heading_error_out_channels_l3': 61, 'heading_error_pool_size_l3': 2, 'heading_error_out_channels_l4': 70, 'heading_error_pool_size_l4': 4, 'heading_error_fc_hidden': 41}. Best is trial 66 with value: 0.0922.
[rank: 0] Seed set to 42
[rank: 0] Seed set to 42
GPU available: True (cuda), used: True
TPU available: False, using: 0 TPU cores
💡 Tip: For seamless cloud logging and experiment tracking, try installing [litlogger](https://pypi.org/project/litlogger/) to enable LitLogger, which logs metrics and artifacts automatically to the Lightning Experiments platform.
GPU available: True (cuda), used: True
TPU available: False, using: 0 TPU cores
💡 Tip: For seamless cloud logging and experiment tracking, try installing [litlogger](https://pypi.org/project/litlogger/) to enable LitLogger, which logs metrics and artifacts automatically to the Lightning Experiments platform.
[rank: 0] Seed set to 42
GPU available: True (cuda), used: True
TPU available: False, using: 0 TPU cores
💡 Tip: For seamless cloud logging and experiment tracking, try installing [litlogger](https://pypi.org/project/litlogger/) to enable LitLogger, which logs metrics and artifacts automatically to the Lightning Experiments platform.
LOCAL_RANK: 0 - CUDA_VISIBLE_DEVICES: [0]
LOCAL_RANK: 0 - CUDA_VISIBLE_DEVICES: [0]
LOCAL_RANK: 0 - CUDA_VISIBLE_DEVICES: [0]
SLURM auto-requeueing enabled. Setting signal handlers.
SLURM auto-requeueing enabled. Setting signal handlers.
SLURM auto-requeueing enabled. Setting signal handlers.
`Trainer.fit` stopped: `max_epochs=30` reached.
`Trainer.fit` stopped: `max_epochs=30` reached.
`Trainer.fit` stopped: `max_epochs=30` reached.
