[I 2026-04-15 21:04:39,945] Trial 28 finished with value: 0.1597 and parameters: {'left_wall_dist_num_layers': 5, 'left_wall_dist_activation': 'elu', 'left_wall_dist_out_channels_l0': 70, 'left_wall_dist_pool_size_l0': 2, 'left_wall_dist_out_channels_l1': 129, 'left_wall_dist_pool_size_l1': 4, 'left_wall_dist_out_channels_l2': 133, 'left_wall_dist_pool_size_l2': 4, 'left_wall_dist_out_channels_l3': 251, 'left_wall_dist_pool_size_l3': 4, 'left_wall_dist_out_channels_l4': 252, 'left_wall_dist_pool_size_l4': 8, 'left_wall_dist_fc_hidden': 79, 'track_width_num_layers': 2, 'track_width_activation': 'relu', 'track_width_out_channels_l0': 41, 'track_width_pool_size_l0': 4, 'track_width_out_channels_l1': 66, 'track_width_pool_size_l1': 4, 'track_width_fc_hidden': 97, 'heading_error_num_layers': 2, 'heading_error_activation': 'elu', 'heading_error_out_channels_l0': 45, 'heading_error_pool_size_l0': 8, 'heading_error_out_channels_l1': 255, 'heading_error_pool_size_l1': 2}. Best is trial 7 with value: 0.1457.
[rank: 0] Seed set to 42
[rank: 0] Seed set to 42
[rank: 0] Seed set to 42
GPU available: True (cuda), used: True
TPU available: False, using: 0 TPU cores
GPU available: True (cuda), used: True
TPU available: False, using: 0 TPU cores
💡 Tip: For seamless cloud logging and experiment tracking, try installing [litlogger](https://pypi.org/project/litlogger/) to enable LitLogger, which logs metrics and artifacts automatically to the Lightning Experiments platform.
💡 Tip: For seamless cloud logging and experiment tracking, try installing [litlogger](https://pypi.org/project/litlogger/) to enable LitLogger, which logs metrics and artifacts automatically to the Lightning Experiments platform.
GPU available: True (cuda), used: True
TPU available: False, using: 0 TPU cores
💡 Tip: For seamless cloud logging and experiment tracking, try installing [litlogger](https://pypi.org/project/litlogger/) to enable LitLogger, which logs metrics and artifacts automatically to the Lightning Experiments platform.
LOCAL_RANK: 0 - CUDA_VISIBLE_DEVICES: [0]
LOCAL_RANK: 0 - CUDA_VISIBLE_DEVICES: [0]
LOCAL_RANK: 0 - CUDA_VISIBLE_DEVICES: [0]
SLURM auto-requeueing enabled. Setting signal handlers.
SLURM auto-requeueing enabled. Setting signal handlers.
SLURM auto-requeueing enabled. Setting signal handlers.
`Trainer.fit` stopped: `max_epochs=30` reached.
`Trainer.fit` stopped: `max_epochs=30` reached.
`Trainer.fit` stopped: `max_epochs=30` reached.
[I 2026-04-15 21:06:46,454] Trial 29 finished with value: 0.1663 and parameters: {'left_wall_dist_num_layers': 3, 'left_wall_dist_activation': 'relu', 'left_wall_dist_out_channels_l0': 93, 'left_wall_dist_pool_size_l0': 2, 'left_wall_dist_out_channels_l1': 171, 'left_wall_dist_pool_size_l1': 4, 'left_wall_dist_out_channels_l2': 93, 'left_wall_dist_pool_size_l2': 2, 'left_wall_dist_fc_hidden': 106, 'track_width_num_layers': 4, 'track_width_activation': 'elu', 'track_width_out_channels_l0': 36, 'track_width_pool_size_l0': 4, 'track_width_out_channels_l1': 227, 'track_width_pool_size_l1': 4, 'track_width_out_channels_l2': 45, 'track_width_pool_size_l2': 4, 'track_width_out_channels_l3': 119, 'track_width_pool_size_l3': 2, 'track_width_fc_hidden': 52, 'heading_error_num_layers': 5, 'heading_error_activation': 'relu', 'heading_error_out_channels_l0': 117, 'heading_error_pool_size_l0': 8, 'heading_error_out_channels_l1': 126, 'heading_error_pool_size_l1': 8, 'heading_error_out_channels_l2': 185, 'heading_error_pool_size_l2': 8}. Best is trial 7 with value: 0.1457.
[rank: 0] Seed set to 42
[rank: 0] Seed set to 42
GPU available: True (cuda), used: True
TPU available: False, using: 0 TPU cores
💡 Tip: For seamless cloud logging and experiment tracking, try installing [litlogger](https://pypi.org/project/litlogger/) to enable LitLogger, which logs metrics and artifacts automatically to the Lightning Experiments platform.
[rank: 0] Seed set to 42
GPU available: True (cuda), used: True
TPU available: False, using: 0 TPU cores
💡 Tip: For seamless cloud logging and experiment tracking, try installing [litlogger](https://pypi.org/project/litlogger/) to enable LitLogger, which logs metrics and artifacts automatically to the Lightning Experiments platform.
GPU available: True (cuda), used: True
TPU available: False, using: 0 TPU cores
💡 Tip: For seamless cloud logging and experiment tracking, try installing [litlogger](https://pypi.org/project/litlogger/) to enable LitLogger, which logs metrics and artifacts automatically to the Lightning Experiments platform.
LOCAL_RANK: 0 - CUDA_VISIBLE_DEVICES: [0]
LOCAL_RANK: 0 - CUDA_VISIBLE_DEVICES: [0]
LOCAL_RANK: 0 - CUDA_VISIBLE_DEVICES: [0]
SLURM auto-requeueing enabled. Setting signal handlers.
SLURM auto-requeueing enabled. Setting signal handlers.
SLURM auto-requeueing enabled. Setting signal handlers.
`Trainer.fit` stopped: `max_epochs=30` reached.
`Trainer.fit` stopped: `max_epochs=30` reached.
`Trainer.fit` stopped: `max_epochs=30` reached.
[I 2026-04-15 21:09:46,293] Trial 30 finished with value: 0.136 and parameters: {'left_wall_dist_num_layers': 4, 'left_wall_dist_activation': 'relu', 'left_wall_dist_out_channels_l0': 165, 'left_wall_dist_pool_size_l0': 2, 'left_wall_dist_out_channels_l1': 219, 'left_wall_dist_pool_size_l1': 4, 'left_wall_dist_out_channels_l2': 171, 'left_wall_dist_pool_size_l2': 2, 'left_wall_dist_out_channels_l3': 125, 'left_wall_dist_pool_size_l3': 8, 'left_wall_dist_fc_hidden': 40, 'track_width_num_layers': 4, 'track_width_activation': 'elu', 'track_width_out_channels_l0': 82, 'track_width_pool_size_l0': 4, 'track_width_out_channels_l1': 101, 'track_width_pool_size_l1': 4, 'track_width_out_channels_l2': 144, 'track_width_pool_size_l2': 4, 'track_width_out_channels_l3': 43, 'track_width_pool_size_l3': 4, 'heading_error_num_layers': 3, 'heading_error_activation': 'relu', 'heading_error_out_channels_l0': 94, 'heading_error_pool_size_l0': 8, 'heading_error_out_channels_l1': 208, 'heading_error_pool_size_l1': 2, 'heading_error_out_channels_l2': 199, 'heading_error_pool_size_l2': 8, 'heading_error_fc_hidden': 94}. Best is trial 30 with value: 0.136.
[rank: 0] Seed set to 42
[rank: 0] Seed set to 42
[rank: 0] Seed set to 42
GPU available: True (cuda), used: True
TPU available: False, using: 0 TPU cores
💡 Tip: For seamless cloud logging and experiment tracking, try installing [litlogger](https://pypi.org/project/litlogger/) to enable LitLogger, which logs metrics and artifacts automatically to the Lightning Experiments platform.
GPU available: True (cuda), used: True
TPU available: False, using: 0 TPU cores
💡 Tip: For seamless cloud logging and experiment tracking, try installing [litlogger](https://pypi.org/project/litlogger/) to enable LitLogger, which logs metrics and artifacts automatically to the Lightning Experiments platform.
GPU available: True (cuda), used: True
TPU available: False, using: 0 TPU cores
💡 Tip: For seamless cloud logging and experiment tracking, try installing [litlogger](https://pypi.org/project/litlogger/) to enable LitLogger, which logs metrics and artifacts automatically to the Lightning Experiments platform.
LOCAL_RANK: 0 - CUDA_VISIBLE_DEVICES: [0]
LOCAL_RANK: 0 - CUDA_VISIBLE_DEVICES: [0]
LOCAL_RANK: 0 - CUDA_VISIBLE_DEVICES: [0]
SLURM auto-requeueing enabled. Setting signal handlers.
SLURM auto-requeueing enabled. Setting signal handlers.
SLURM auto-requeueing enabled. Setting signal handlers.
`Trainer.fit` stopped: `max_epochs=30` reached.
`Trainer.fit` stopped: `max_epochs=30` reached.
`Trainer.fit` stopped: `max_epochs=30` reached.
[I 2026-04-15 21:12:50,559] Trial 31 finished with value: 0.1955 and parameters: {'left_wall_dist_num_layers': 4, 'left_wall_dist_activation': 'relu', 'left_wall_dist_out_channels_l0': 161, 'left_wall_dist_pool_size_l0': 2, 'left_wall_dist_out_channels_l1': 227, 'left_wall_dist_pool_size_l1': 4, 'left_wall_dist_out_channels_l2': 179, 'left_wall_dist_pool_size_l2': 2, 'left_wall_dist_out_channels_l3': 123, 'left_wall_dist_pool_size_l3': 8, 'left_wall_dist_fc_hidden': 39, 'track_width_num_layers': 4, 'track_width_activation': 'elu', 'track_width_out_channels_l0': 82, 'track_width_pool_size_l0': 4, 'track_width_out_channels_l1': 47, 'track_width_pool_size_l1': 4, 'track_width_out_channels_l2': 141, 'track_width_pool_size_l2': 4, 'track_width_out_channels_l3': 42, 'track_width_pool_size_l3': 4, 'heading_error_num_layers': 3, 'heading_error_activation': 'relu', 'heading_error_out_channels_l0': 92, 'heading_error_pool_size_l0': 8, 'heading_error_out_channels_l1': 209, 'heading_error_pool_size_l1': 2, 'heading_error_out_channels_l2': 205, 'heading_error_pool_size_l2': 8, 'heading_error_fc_hidden': 91}. Best is trial 30 with value: 0.136.
[rank: 0] Seed set to 42
GPU available: True (cuda), used: True
TPU available: False, using: 0 TPU cores
💡 Tip: For seamless cloud logging and experiment tracking, try installing [litlogger](https://pypi.org/project/litlogger/) to enable LitLogger, which logs metrics and artifacts automatically to the Lightning Experiments platform.
[rank: 0] Seed set to 42
[rank: 0] Seed set to 42
GPU available: True (cuda), used: True
TPU available: False, using: 0 TPU cores
💡 Tip: For seamless cloud logging and experiment tracking, try installing [litlogger](https://pypi.org/project/litlogger/) to enable LitLogger, which logs metrics and artifacts automatically to the Lightning Experiments platform.
GPU available: True (cuda), used: True
TPU available: False, using: 0 TPU cores
💡 Tip: For seamless cloud logging and experiment tracking, try installing [litlogger](https://pypi.org/project/litlogger/) to enable LitLogger, which logs metrics and artifacts automatically to the Lightning Experiments platform.
LOCAL_RANK: 0 - CUDA_VISIBLE_DEVICES: [0]
LOCAL_RANK: 0 - CUDA_VISIBLE_DEVICES: [0]
LOCAL_RANK: 0 - CUDA_VISIBLE_DEVICES: [0]
SLURM auto-requeueing enabled. Setting signal handlers.
SLURM auto-requeueing enabled. Setting signal handlers.
SLURM auto-requeueing enabled. Setting signal handlers.
`Trainer.fit` stopped: `max_epochs=30` reached.
`Trainer.fit` stopped: `max_epochs=30` reached.
`Trainer.fit` stopped: `max_epochs=30` reached.
[I 2026-04-15 21:15:54,358] Trial 32 finished with value: 0.1675 and parameters: {'left_wall_dist_num_layers': 4, 'left_wall_dist_activation': 'relu', 'left_wall_dist_out_channels_l0': 213, 'left_wall_dist_pool_size_l0': 2, 'left_wall_dist_out_channels_l1': 213, 'left_wall_dist_pool_size_l1': 4, 'left_wall_dist_out_channels_l2': 176, 'left_wall_dist_pool_size_l2': 2, 'left_wall_dist_out_channels_l3': 184, 'left_wall_dist_pool_size_l3': 8, 'left_wall_dist_fc_hidden': 47, 'track_width_num_layers': 4, 'track_width_activation': 'elu', 'track_width_out_channels_l0': 47, 'track_width_pool_size_l0': 4, 'track_width_out_channels_l1': 101, 'track_width_pool_size_l1': 4, 'track_width_out_channels_l2': 165, 'track_width_pool_size_l2': 4, 'track_width_out_channels_l3': 41, 'track_width_pool_size_l3': 4, 'heading_error_num_layers': 3, 'heading_error_activation': 'relu', 'heading_error_out_channels_l0': 107, 'heading_error_pool_size_l0': 8, 'heading_error_out_channels_l1': 212, 'heading_error_pool_size_l1': 2, 'heading_error_out_channels_l2': 164, 'heading_error_pool_size_l2': 8, 'heading_error_fc_hidden': 121}. Best is trial 30 with value: 0.136.
[rank: 0] Seed set to 42
[rank: 0] Seed set to 42
GPU available: True (cuda), used: True
TPU available: False, using: 0 TPU cores
💡 Tip: For seamless cloud logging and experiment tracking, try installing [litlogger](https://pypi.org/project/litlogger/) to enable LitLogger, which logs metrics and artifacts automatically to the Lightning Experiments platform.
GPU available: True (cuda), used: True
TPU available: False, using: 0 TPU cores
💡 Tip: For seamless cloud logging and experiment tracking, try installing [litlogger](https://pypi.org/project/litlogger/) to enable LitLogger, which logs metrics and artifacts automatically to the Lightning Experiments platform.
[rank: 0] Seed set to 42
GPU available: True (cuda), used: True
TPU available: False, using: 0 TPU cores
💡 Tip: For seamless cloud logging and experiment tracking, try installing [litlogger](https://pypi.org/project/litlogger/) to enable LitLogger, which logs metrics and artifacts automatically to the Lightning Experiments platform.
LOCAL_RANK: 0 - CUDA_VISIBLE_DEVICES: [0]
LOCAL_RANK: 0 - CUDA_VISIBLE_DEVICES: [0]
LOCAL_RANK: 0 - CUDA_VISIBLE_DEVICES: [0]
SLURM auto-requeueing enabled. Setting signal handlers.
SLURM auto-requeueing enabled. Setting signal handlers.
SLURM auto-requeueing enabled. Setting signal handlers.
`Trainer.fit` stopped: `max_epochs=30` reached.
`Trainer.fit` stopped: `max_epochs=30` reached.
`Trainer.fit` stopped: `max_epochs=30` reached.
[I 2026-04-15 21:19:03,249] Trial 33 finished with value: 0.1924 and parameters: {'left_wall_dist_num_layers': 4, 'left_wall_dist_activation': 'relu', 'left_wall_dist_out_channels_l0': 145, 'left_wall_dist_pool_size_l0': 2, 'left_wall_dist_out_channels_l1': 168, 'left_wall_dist_pool_size_l1': 4, 'left_wall_dist_out_channels_l2': 130, 'left_wall_dist_pool_size_l2': 2, 'left_wall_dist_out_channels_l3': 80, 'left_wall_dist_pool_size_l3': 8, 'left_wall_dist_fc_hidden': 57, 'track_width_num_layers': 4, 'track_width_activation': 'elu', 'track_width_out_channels_l0': 97, 'track_width_pool_size_l0': 4, 'track_width_out_channels_l1': 214, 'track_width_pool_size_l1': 8, 'track_width_out_channels_l2': 113, 'track_width_pool_size_l2': 4, 'track_width_out_channels_l3': 62, 'track_width_pool_size_l3': 4, 'heading_error_num_layers': 4, 'heading_error_activation': 'relu', 'heading_error_out_channels_l0': 88, 'heading_error_pool_size_l0': 8, 'heading_error_out_channels_l1': 158, 'heading_error_pool_size_l1': 2, 'heading_error_out_channels_l2': 222, 'heading_error_pool_size_l2': 8, 'heading_error_out_channels_l3': 67, 'heading_error_pool_size_l3': 2, 'heading_error_fc_hidden': 44}. Best is trial 30 with value: 0.136.
[rank: 0] Seed set to 42
[rank: 0] Seed set to 42
[rank: 0] Seed set to 42
GPU available: True (cuda), used: True
TPU available: False, using: 0 TPU cores
💡 Tip: For seamless cloud logging and experiment tracking, try installing [litlogger](https://pypi.org/project/litlogger/) to enable LitLogger, which logs metrics and artifacts automatically to the Lightning Experiments platform.
GPU available: True (cuda), used: True
TPU available: False, using: 0 TPU cores
💡 Tip: For seamless cloud logging and experiment tracking, try installing [litlogger](https://pypi.org/project/litlogger/) to enable LitLogger, which logs metrics and artifacts automatically to the Lightning Experiments platform.
GPU available: True (cuda), used: True
TPU available: False, using: 0 TPU cores
💡 Tip: For seamless cloud logging and experiment tracking, try installing [litlogger](https://pypi.org/project/litlogger/) to enable LitLogger, which logs metrics and artifacts automatically to the Lightning Experiments platform.
LOCAL_RANK: 0 - CUDA_VISIBLE_DEVICES: [0]
LOCAL_RANK: 0 - CUDA_VISIBLE_DEVICES: [0]
LOCAL_RANK: 0 - CUDA_VISIBLE_DEVICES: [0]
SLURM auto-requeueing enabled. Setting signal handlers.
SLURM auto-requeueing enabled. Setting signal handlers.
SLURM auto-requeueing enabled. Setting signal handlers.
`Trainer.fit` stopped: `max_epochs=30` reached.
`Trainer.fit` stopped: `max_epochs=30` reached.
`Trainer.fit` stopped: `max_epochs=30` reached.
[I 2026-04-15 21:21:56,523] Trial 34 finished with value: 0.3358 and parameters: {'left_wall_dist_num_layers': 3, 'left_wall_dist_activation': 'relu', 'left_wall_dist_out_channels_l0': 123, 'left_wall_dist_pool_size_l0': 8, 'left_wall_dist_out_channels_l1': 72, 'left_wall_dist_pool_size_l1': 8, 'left_wall_dist_out_channels_l2': 98, 'left_wall_dist_pool_size_l2': 2, 'left_wall_dist_fc_hidden': 42, 'track_width_num_layers': 5, 'track_width_activation': 'elu', 'track_width_out_channels_l0': 63, 'track_width_pool_size_l0': 8, 'track_width_out_channels_l1': 175, 'track_width_pool_size_l1': 4, 'track_width_out_channels_l2': 101, 'track_width_pool_size_l2': 4, 'track_width_out_channels_l3': 40, 'track_width_pool_size_l3': 4, 'heading_error_num_layers': 4, 'heading_error_activation': 'relu', 'heading_error_out_channels_l0': 78, 'heading_error_pool_size_l0': 8, 'heading_error_out_channels_l1': 118, 'heading_error_pool_size_l1': 4, 'heading_error_out_channels_l2': 189, 'heading_error_pool_size_l2': 8, 'heading_error_out_channels_l3': 127, 'heading_error_pool_size_l3': 8, 'heading_error_fc_hidden': 42}. Best is trial 30 with value: 0.136.
[rank: 0] Seed set to 42
[rank: 0] Seed set to 42
[rank: 0] Seed set to 42
GPU available: True (cuda), used: True
TPU available: False, using: 0 TPU cores
💡 Tip: For seamless cloud logging and experiment tracking, try installing [litlogger](https://pypi.org/project/litlogger/) to enable LitLogger, which logs metrics and artifacts automatically to the Lightning Experiments platform.
GPU available: True (cuda), used: True
TPU available: False, using: 0 TPU cores
💡 Tip: For seamless cloud logging and experiment tracking, try installing [litlogger](https://pypi.org/project/litlogger/) to enable LitLogger, which logs metrics and artifacts automatically to the Lightning Experiments platform.
GPU available: True (cuda), used: True
TPU available: False, using: 0 TPU cores
💡 Tip: For seamless cloud logging and experiment tracking, try installing [litlogger](https://pypi.org/project/litlogger/) to enable LitLogger, which logs metrics and artifacts automatically to the Lightning Experiments platform.
LOCAL_RANK: 0 - CUDA_VISIBLE_DEVICES: [0]
LOCAL_RANK: 0 - CUDA_VISIBLE_DEVICES: [0]
LOCAL_RANK: 0 - CUDA_VISIBLE_DEVICES: [0]
SLURM auto-requeueing enabled. Setting signal handlers.
SLURM auto-requeueing enabled. Setting signal handlers.
SLURM auto-requeueing enabled. Setting signal handlers.
`Trainer.fit` stopped: `max_epochs=30` reached.
`Trainer.fit` stopped: `max_epochs=30` reached.
`Trainer.fit` stopped: `max_epochs=30` reached.
