[I 2026-05-08 19:08:50,312] Trial 53 finished with value: 0.0877 and parameters: {'optimizer': 'adamw', 'left_wall_dist_num_layers': 2, 'left_wall_dist_activation': 'relu', 'left_wall_dist_fc_layers': 'fc64', 'left_wall_dist_pool_size_l0': 4, 'left_wall_dist_out_channels_l0': 4, 'left_wall_dist_pool_size_l1': 4, 'left_wall_dist_out_channels_l1': 4, 'track_width_num_layers': 1, 'track_width_activation': 'elu', 'track_width_fc_layers': 'fc64_32', 'track_width_pool_size_l0': 4, 'track_width_out_channels_l0': 4, 'heading_error_num_layers': 2, 'heading_error_activation': 'elu', 'heading_error_fc_layers': 'fc64', 'heading_error_pool_size_l0': 2, 'heading_error_out_channels_l0': 4, 'heading_error_pool_size_l1': 4, 'heading_error_out_channels_l1': 4}. Best is trial 51 with value: 0.0877.
[rank: 0] Seed set to 42
[rank: 0] Seed set to 42
GPU available: True (cuda), used: True
TPU available: False, using: 0 TPU cores
💡 Tip: For seamless cloud logging and experiment tracking, try installing [litlogger](https://pypi.org/project/litlogger/) to enable LitLogger, which logs metrics and artifacts automatically to the Lightning Experiments platform.
[rank: 0] Seed set to 42
GPU available: True (cuda), used: True
TPU available: False, using: 0 TPU cores
💡 Tip: For seamless cloud logging and experiment tracking, try installing [litlogger](https://pypi.org/project/litlogger/) to enable LitLogger, which logs metrics and artifacts automatically to the Lightning Experiments platform.
GPU available: True (cuda), used: True
TPU available: False, using: 0 TPU cores
💡 Tip: For seamless cloud logging and experiment tracking, try installing [litlogger](https://pypi.org/project/litlogger/) to enable LitLogger, which logs metrics and artifacts automatically to the Lightning Experiments platform.
LOCAL_RANK: 0 - CUDA_VISIBLE_DEVICES: [0]
LOCAL_RANK: 0 - CUDA_VISIBLE_DEVICES: [0]
LOCAL_RANK: 0 - CUDA_VISIBLE_DEVICES: [0]
SLURM auto-requeueing enabled. Setting signal handlers.
SLURM auto-requeueing enabled. Setting signal handlers.
SLURM auto-requeueing enabled. Setting signal handlers.
`Trainer.fit` stopped: `max_epochs=30` reached.
`Trainer.fit` stopped: `max_epochs=30` reached.
`Trainer.fit` stopped: `max_epochs=30` reached.
[I 2026-05-08 19:12:11,195] Trial 54 finished with value: 0.1224 and parameters: {'optimizer': 'adamw', 'left_wall_dist_num_layers': 2, 'left_wall_dist_activation': 'elu', 'left_wall_dist_fc_layers': 'fc64', 'left_wall_dist_pool_size_l0': 4, 'left_wall_dist_out_channels_l0': 4, 'left_wall_dist_pool_size_l1': 4, 'left_wall_dist_out_channels_l1': 4, 'track_width_num_layers': 1, 'track_width_activation': 'elu', 'track_width_fc_layers': 'fc64_32', 'track_width_pool_size_l0': 3, 'track_width_out_channels_l0': 4, 'heading_error_num_layers': 2, 'heading_error_activation': 'elu', 'heading_error_fc_layers': 'fc16', 'heading_error_pool_size_l0': 2, 'heading_error_out_channels_l0': 4, 'heading_error_pool_size_l1': 4, 'heading_error_out_channels_l1': 8}. Best is trial 51 with value: 0.0877.
[rank: 0] Seed set to 42
[rank: 0] Seed set to 42
[rank: 0] Seed set to 42
GPU available: True (cuda), used: True
TPU available: False, using: 0 TPU cores
💡 Tip: For seamless cloud logging and experiment tracking, try installing [litlogger](https://pypi.org/project/litlogger/) to enable LitLogger, which logs metrics and artifacts automatically to the Lightning Experiments platform.
GPU available: True (cuda), used: True
TPU available: False, using: 0 TPU cores
💡 Tip: For seamless cloud logging and experiment tracking, try installing [litlogger](https://pypi.org/project/litlogger/) to enable LitLogger, which logs metrics and artifacts automatically to the Lightning Experiments platform.
GPU available: True (cuda), used: True
TPU available: False, using: 0 TPU cores
💡 Tip: For seamless cloud logging and experiment tracking, try installing [litlogger](https://pypi.org/project/litlogger/) to enable LitLogger, which logs metrics and artifacts automatically to the Lightning Experiments platform.
LOCAL_RANK: 0 - CUDA_VISIBLE_DEVICES: [0]
LOCAL_RANK: 0 - CUDA_VISIBLE_DEVICES: [0]
LOCAL_RANK: 0 - CUDA_VISIBLE_DEVICES: [0]
SLURM auto-requeueing enabled. Setting signal handlers.
SLURM auto-requeueing enabled. Setting signal handlers.
SLURM auto-requeueing enabled. Setting signal handlers.
`Trainer.fit` stopped: `max_epochs=30` reached.
`Trainer.fit` stopped: `max_epochs=30` reached.
`Trainer.fit` stopped: `max_epochs=30` reached.
[I 2026-05-08 19:15:18,832] Trial 55 finished with value: 0.1244 and parameters: {'optimizer': 'adamw', 'left_wall_dist_num_layers': 2, 'left_wall_dist_activation': 'relu', 'left_wall_dist_fc_layers': 'fc64', 'left_wall_dist_pool_size_l0': 4, 'left_wall_dist_out_channels_l0': 4, 'left_wall_dist_pool_size_l1': 3, 'left_wall_dist_out_channels_l1': 4, 'track_width_num_layers': 1, 'track_width_activation': 'elu', 'track_width_fc_layers': 'fc64_32', 'track_width_pool_size_l0': 4, 'track_width_out_channels_l0': 4, 'heading_error_num_layers': 1, 'heading_error_activation': 'relu', 'heading_error_fc_layers': 'fc32', 'heading_error_pool_size_l0': 3, 'heading_error_out_channels_l0': 16}. Best is trial 51 with value: 0.0877.
[rank: 0] Seed set to 42
GPU available: True (cuda), used: True
TPU available: False, using: 0 TPU cores
💡 Tip: For seamless cloud logging and experiment tracking, try installing [litlogger](https://pypi.org/project/litlogger/) to enable LitLogger, which logs metrics and artifacts automatically to the Lightning Experiments platform.
[rank: 0] Seed set to 42
GPU available: True (cuda), used: True
TPU available: False, using: 0 TPU cores
💡 Tip: For seamless cloud logging and experiment tracking, try installing [litlogger](https://pypi.org/project/litlogger/) to enable LitLogger, which logs metrics and artifacts automatically to the Lightning Experiments platform.
[rank: 0] Seed set to 42
GPU available: True (cuda), used: True
TPU available: False, using: 0 TPU cores
💡 Tip: For seamless cloud logging and experiment tracking, try installing [litlogger](https://pypi.org/project/litlogger/) to enable LitLogger, which logs metrics and artifacts automatically to the Lightning Experiments platform.
LOCAL_RANK: 0 - CUDA_VISIBLE_DEVICES: [0]
SLURM auto-requeueing enabled. Setting signal handlers.
LOCAL_RANK: 0 - CUDA_VISIBLE_DEVICES: [0]
SLURM auto-requeueing enabled. Setting signal handlers.
LOCAL_RANK: 0 - CUDA_VISIBLE_DEVICES: [0]
SLURM auto-requeueing enabled. Setting signal handlers.
`Trainer.fit` stopped: `max_epochs=30` reached.
`Trainer.fit` stopped: `max_epochs=30` reached.
`Trainer.fit` stopped: `max_epochs=30` reached.
[I 2026-05-08 19:18:30,645] Trial 56 finished with value: 0.1421 and parameters: {'optimizer': 'adam', 'left_wall_dist_num_layers': 2, 'left_wall_dist_activation': 'relu', 'left_wall_dist_fc_layers': 'fc128_64', 'left_wall_dist_pool_size_l0': 3, 'left_wall_dist_out_channels_l0': 4, 'left_wall_dist_pool_size_l1': 4, 'left_wall_dist_out_channels_l1': 16, 'track_width_num_layers': 2, 'track_width_activation': 'elu', 'track_width_fc_layers': 'fc64_32', 'track_width_pool_size_l0': 4, 'track_width_out_channels_l0': 4, 'track_width_pool_size_l1': 2, 'track_width_out_channels_l1': 16, 'heading_error_num_layers': 2, 'heading_error_activation': 'elu', 'heading_error_fc_layers': 'fc128', 'heading_error_pool_size_l0': 2, 'heading_error_out_channels_l0': 4, 'heading_error_pool_size_l1': 4, 'heading_error_out_channels_l1': 4}. Best is trial 51 with value: 0.0877.
[I 2026-05-08 19:18:30,669] Trial 57 pruned. Flattened representation too small.
[rank: 0] Seed set to 42
[rank: 0] Seed set to 42
[rank: 0] Seed set to 42
GPU available: True (cuda), used: True
TPU available: False, using: 0 TPU cores
💡 Tip: For seamless cloud logging and experiment tracking, try installing [litlogger](https://pypi.org/project/litlogger/) to enable LitLogger, which logs metrics and artifacts automatically to the Lightning Experiments platform.
GPU available: True (cuda), used: True
TPU available: False, using: 0 TPU cores
💡 Tip: For seamless cloud logging and experiment tracking, try installing [litlogger](https://pypi.org/project/litlogger/) to enable LitLogger, which logs metrics and artifacts automatically to the Lightning Experiments platform.
GPU available: True (cuda), used: True
TPU available: False, using: 0 TPU cores
💡 Tip: For seamless cloud logging and experiment tracking, try installing [litlogger](https://pypi.org/project/litlogger/) to enable LitLogger, which logs metrics and artifacts automatically to the Lightning Experiments platform.
LOCAL_RANK: 0 - CUDA_VISIBLE_DEVICES: [0]
LOCAL_RANK: 0 - CUDA_VISIBLE_DEVICES: [0]
SLURM auto-requeueing enabled. Setting signal handlers.
SLURM auto-requeueing enabled. Setting signal handlers.
LOCAL_RANK: 0 - CUDA_VISIBLE_DEVICES: [0]
SLURM auto-requeueing enabled. Setting signal handlers.
`Trainer.fit` stopped: `max_epochs=30` reached.
`Trainer.fit` stopped: `max_epochs=30` reached.
`Trainer.fit` stopped: `max_epochs=30` reached.
[I 2026-05-08 19:21:46,969] Trial 58 finished with value: 0.2034 and parameters: {'optimizer': 'adamw', 'left_wall_dist_num_layers': 1, 'left_wall_dist_activation': 'elu', 'left_wall_dist_fc_layers': 'fc64', 'left_wall_dist_pool_size_l0': 2, 'left_wall_dist_out_channels_l0': 4, 'track_width_num_layers': 1, 'track_width_activation': 'elu', 'track_width_fc_layers': 'fc64_32', 'track_width_pool_size_l0': 4, 'track_width_out_channels_l0': 8, 'heading_error_num_layers': 2, 'heading_error_activation': 'relu', 'heading_error_fc_layers': 'fc64', 'heading_error_pool_size_l0': 4, 'heading_error_out_channels_l0': 4, 'heading_error_pool_size_l1': 4, 'heading_error_out_channels_l1': 32}. Best is trial 51 with value: 0.0877.
[rank: 0] Seed set to 42
GPU available: True (cuda), used: True
TPU available: False, using: 0 TPU cores
💡 Tip: For seamless cloud logging and experiment tracking, try installing [litlogger](https://pypi.org/project/litlogger/) to enable LitLogger, which logs metrics and artifacts automatically to the Lightning Experiments platform.
[rank: 0] Seed set to 42
GPU available: True (cuda), used: True
TPU available: False, using: 0 TPU cores
💡 Tip: For seamless cloud logging and experiment tracking, try installing [litlogger](https://pypi.org/project/litlogger/) to enable LitLogger, which logs metrics and artifacts automatically to the Lightning Experiments platform.
[rank: 0] Seed set to 42
GPU available: True (cuda), used: True
TPU available: False, using: 0 TPU cores
💡 Tip: For seamless cloud logging and experiment tracking, try installing [litlogger](https://pypi.org/project/litlogger/) to enable LitLogger, which logs metrics and artifacts automatically to the Lightning Experiments platform.
LOCAL_RANK: 0 - CUDA_VISIBLE_DEVICES: [0]
SLURM auto-requeueing enabled. Setting signal handlers.
LOCAL_RANK: 0 - CUDA_VISIBLE_DEVICES: [0]
SLURM auto-requeueing enabled. Setting signal handlers.
LOCAL_RANK: 0 - CUDA_VISIBLE_DEVICES: [0]
SLURM auto-requeueing enabled. Setting signal handlers.
`Trainer.fit` stopped: `max_epochs=30` reached.
`Trainer.fit` stopped: `max_epochs=30` reached.
`Trainer.fit` stopped: `max_epochs=30` reached.
[I 2026-05-08 19:24:54,607] Trial 59 finished with value: 0.1875 and parameters: {'optimizer': 'adamw', 'left_wall_dist_num_layers': 2, 'left_wall_dist_activation': 'relu', 'left_wall_dist_fc_layers': 'fc32', 'left_wall_dist_pool_size_l0': 4, 'left_wall_dist_out_channels_l0': 1, 'left_wall_dist_pool_size_l1': 4, 'left_wall_dist_out_channels_l1': 4, 'track_width_num_layers': 3, 'track_width_activation': 'elu', 'track_width_fc_layers': 'fc64_32', 'track_width_pool_size_l0': 3, 'track_width_out_channels_l0': 4, 'track_width_pool_size_l1': 4, 'track_width_out_channels_l1': 24, 'track_width_pool_size_l2': 3, 'track_width_out_channels_l2': 24, 'heading_error_num_layers': 2, 'heading_error_activation': 'elu', 'heading_error_fc_layers': 'fc128', 'heading_error_pool_size_l0': 3, 'heading_error_out_channels_l0': 4, 'heading_error_pool_size_l1': 4, 'heading_error_out_channels_l1': 16}. Best is trial 51 with value: 0.0877.
[rank: 0] Seed set to 42
GPU available: True (cuda), used: True
TPU available: False, using: 0 TPU cores
💡 Tip: For seamless cloud logging and experiment tracking, try installing [litlogger](https://pypi.org/project/litlogger/) to enable LitLogger, which logs metrics and artifacts automatically to the Lightning Experiments platform.
[rank: 0] Seed set to 42
GPU available: True (cuda), used: True
TPU available: False, using: 0 TPU cores
💡 Tip: For seamless cloud logging and experiment tracking, try installing [litlogger](https://pypi.org/project/litlogger/) to enable LitLogger, which logs metrics and artifacts automatically to the Lightning Experiments platform.
[rank: 0] Seed set to 42
GPU available: True (cuda), used: True
TPU available: False, using: 0 TPU cores
💡 Tip: For seamless cloud logging and experiment tracking, try installing [litlogger](https://pypi.org/project/litlogger/) to enable LitLogger, which logs metrics and artifacts automatically to the Lightning Experiments platform.
LOCAL_RANK: 0 - CUDA_VISIBLE_DEVICES: [0]
SLURM auto-requeueing enabled. Setting signal handlers.
LOCAL_RANK: 0 - CUDA_VISIBLE_DEVICES: [0]
LOCAL_RANK: 0 - CUDA_VISIBLE_DEVICES: [0]
SLURM auto-requeueing enabled. Setting signal handlers.
SLURM auto-requeueing enabled. Setting signal handlers.
`Trainer.fit` stopped: `max_epochs=30` reached.
`Trainer.fit` stopped: `max_epochs=30` reached.
`Trainer.fit` stopped: `max_epochs=30` reached.
[I 2026-05-08 19:27:53,036] Trial 60 finished with value: 0.1143 and parameters: {'optimizer': 'adamw', 'left_wall_dist_num_layers': 2, 'left_wall_dist_activation': 'relu', 'left_wall_dist_fc_layers': 'fc64', 'left_wall_dist_pool_size_l0': 4, 'left_wall_dist_out_channels_l0': 4, 'left_wall_dist_pool_size_l1': 4, 'left_wall_dist_out_channels_l1': 32, 'track_width_num_layers': 1, 'track_width_activation': 'elu', 'track_width_fc_layers': 'fc64_32', 'track_width_pool_size_l0': 4, 'track_width_out_channels_l0': 4, 'heading_error_num_layers': 2, 'heading_error_activation': 'elu', 'heading_error_fc_layers': 'fc16', 'heading_error_pool_size_l0': 2, 'heading_error_out_channels_l0': 8, 'heading_error_pool_size_l1': 4, 'heading_error_out_channels_l1': 24}. Best is trial 51 with value: 0.0877.
[rank: 0] Seed set to 42
GPU available: True (cuda), used: True
TPU available: False, using: 0 TPU cores
💡 Tip: For seamless cloud logging and experiment tracking, try installing [litlogger](https://pypi.org/project/litlogger/) to enable LitLogger, which logs metrics and artifacts automatically to the Lightning Experiments platform.
[rank: 0] Seed set to 42
GPU available: True (cuda), used: True
TPU available: False, using: 0 TPU cores
💡 Tip: For seamless cloud logging and experiment tracking, try installing [litlogger](https://pypi.org/project/litlogger/) to enable LitLogger, which logs metrics and artifacts automatically to the Lightning Experiments platform.
[rank: 0] Seed set to 42
GPU available: True (cuda), used: True
TPU available: False, using: 0 TPU cores
💡 Tip: For seamless cloud logging and experiment tracking, try installing [litlogger](https://pypi.org/project/litlogger/) to enable LitLogger, which logs metrics and artifacts automatically to the Lightning Experiments platform.
LOCAL_RANK: 0 - CUDA_VISIBLE_DEVICES: [0]
LOCAL_RANK: 0 - CUDA_VISIBLE_DEVICES: [0]
SLURM auto-requeueing enabled. Setting signal handlers.
SLURM auto-requeueing enabled. Setting signal handlers.
LOCAL_RANK: 0 - CUDA_VISIBLE_DEVICES: [0]
SLURM auto-requeueing enabled. Setting signal handlers.
`Trainer.fit` stopped: `max_epochs=30` reached.
`Trainer.fit` stopped: `max_epochs=30` reached.
`Trainer.fit` stopped: `max_epochs=30` reached.
[I 2026-05-08 19:30:29,652] Trial 61 finished with value: 0.0877 and parameters: {'optimizer': 'adamw', 'left_wall_dist_num_layers': 2, 'left_wall_dist_activation': 'relu', 'left_wall_dist_fc_layers': 'fc64', 'left_wall_dist_pool_size_l0': 4, 'left_wall_dist_out_channels_l0': 4, 'left_wall_dist_pool_size_l1': 4, 'left_wall_dist_out_channels_l1': 4, 'track_width_num_layers': 1, 'track_width_activation': 'elu', 'track_width_fc_layers': 'fc64_32', 'track_width_pool_size_l0': 4, 'track_width_out_channels_l0': 4, 'heading_error_num_layers': 2, 'heading_error_activation': 'elu', 'heading_error_fc_layers': 'fc64', 'heading_error_pool_size_l0': 2, 'heading_error_out_channels_l0': 4, 'heading_error_pool_size_l1': 4, 'heading_error_out_channels_l1': 4}. Best is trial 51 with value: 0.0877.
[rank: 0] Seed set to 42
[rank: 0] Seed set to 42
GPU available: True (cuda), used: True
TPU available: False, using: 0 TPU cores
💡 Tip: For seamless cloud logging and experiment tracking, try installing [litlogger](https://pypi.org/project/litlogger/) to enable LitLogger, which logs metrics and artifacts automatically to the Lightning Experiments platform.
GPU available: True (cuda), used: True
TPU available: False, using: 0 TPU cores
💡 Tip: For seamless cloud logging and experiment tracking, try installing [litlogger](https://pypi.org/project/litlogger/) to enable LitLogger, which logs metrics and artifacts automatically to the Lightning Experiments platform.
[rank: 0] Seed set to 42
GPU available: True (cuda), used: True
TPU available: False, using: 0 TPU cores
💡 Tip: For seamless cloud logging and experiment tracking, try installing [litlogger](https://pypi.org/project/litlogger/) to enable LitLogger, which logs metrics and artifacts automatically to the Lightning Experiments platform.
LOCAL_RANK: 0 - CUDA_VISIBLE_DEVICES: [0]
LOCAL_RANK: 0 - CUDA_VISIBLE_DEVICES: [0]
LOCAL_RANK: 0 - CUDA_VISIBLE_DEVICES: [0]
SLURM auto-requeueing enabled. Setting signal handlers.
SLURM auto-requeueing enabled. Setting signal handlers.
SLURM auto-requeueing enabled. Setting signal handlers.
`Trainer.fit` stopped: `max_epochs=30` reached.
`Trainer.fit` stopped: `max_epochs=30` reached.
`Trainer.fit` stopped: `max_epochs=30` reached.
[I 2026-05-08 19:32:50,435] Trial 62 finished with value: 0.0877 and parameters: {'optimizer': 'adamw', 'left_wall_dist_num_layers': 2, 'left_wall_dist_activation': 'relu', 'left_wall_dist_fc_layers': 'fc64', 'left_wall_dist_pool_size_l0': 4, 'left_wall_dist_out_channels_l0': 4, 'left_wall_dist_pool_size_l1': 4, 'left_wall_dist_out_channels_l1': 4, 'track_width_num_layers': 1, 'track_width_activation': 'elu', 'track_width_fc_layers': 'fc64_32', 'track_width_pool_size_l0': 4, 'track_width_out_channels_l0': 4, 'heading_error_num_layers': 2, 'heading_error_activation': 'elu', 'heading_error_fc_layers': 'fc64', 'heading_error_pool_size_l0': 2, 'heading_error_out_channels_l0': 4, 'heading_error_pool_size_l1': 4, 'heading_error_out_channels_l1': 4}. Best is trial 51 with value: 0.0877.
[I 2026-05-08 19:32:50,455] Trial 63 pruned. Conv channel counts must be non-decreasing.
[rank: 0] Seed set to 42
GPU available: True (cuda), used: True
TPU available: False, using: 0 TPU cores
💡 Tip: For seamless cloud logging and experiment tracking, try installing [litlogger](https://pypi.org/project/litlogger/) to enable LitLogger, which logs metrics and artifacts automatically to the Lightning Experiments platform.
[rank: 0] Seed set to 42
GPU available: True (cuda), used: True
TPU available: False, using: 0 TPU cores
💡 Tip: For seamless cloud logging and experiment tracking, try installing [litlogger](https://pypi.org/project/litlogger/) to enable LitLogger, which logs metrics and artifacts automatically to the Lightning Experiments platform.
[rank: 0] Seed set to 42
GPU available: True (cuda), used: True
TPU available: False, using: 0 TPU cores
💡 Tip: For seamless cloud logging and experiment tracking, try installing [litlogger](https://pypi.org/project/litlogger/) to enable LitLogger, which logs metrics and artifacts automatically to the Lightning Experiments platform.
LOCAL_RANK: 0 - CUDA_VISIBLE_DEVICES: [0]
LOCAL_RANK: 0 - CUDA_VISIBLE_DEVICES: [0]
LOCAL_RANK: 0 - CUDA_VISIBLE_DEVICES: [0]
SLURM auto-requeueing enabled. Setting signal handlers.
SLURM auto-requeueing enabled. Setting signal handlers.
SLURM auto-requeueing enabled. Setting signal handlers.
`Trainer.fit` stopped: `max_epochs=30` reached.
`Trainer.fit` stopped: `max_epochs=30` reached.
`Trainer.fit` stopped: `max_epochs=30` reached.
[I 2026-05-08 19:35:19,258] Trial 64 finished with value: 0.1054 and parameters: {'optimizer': 'adamw', 'left_wall_dist_num_layers': 2, 'left_wall_dist_activation': 'relu', 'left_wall_dist_fc_layers': 'fc64', 'left_wall_dist_pool_size_l0': 4, 'left_wall_dist_out_channels_l0': 4, 'left_wall_dist_pool_size_l1': 4, 'left_wall_dist_out_channels_l1': 4, 'track_width_num_layers': 1, 'track_width_activation': 'elu', 'track_width_fc_layers': 'fc64_32', 'track_width_pool_size_l0': 4, 'track_width_out_channels_l0': 4, 'heading_error_num_layers': 3, 'heading_error_activation': 'elu', 'heading_error_fc_layers': 'fc128_64', 'heading_error_pool_size_l0': 2, 'heading_error_out_channels_l0': 4, 'heading_error_pool_size_l1': 2, 'heading_error_out_channels_l1': 4, 'heading_error_pool_size_l2': 2, 'heading_error_out_channels_l2': 8}. Best is trial 51 with value: 0.0877.
[I 2026-05-08 19:35:19,267] Trial 65 pruned. Conv channel counts must be non-decreasing.
