[I 2026-04-15 21:58:00,202] Trial 11 finished with value: 0.1427 and parameters: {'left_wall_dist_num_layers': 4, 'left_wall_dist_activation': 'elu', 'left_wall_dist_out_channels_l0': 134, 'left_wall_dist_pool_size_l0': 4, 'left_wall_dist_out_channels_l1': 83, 'left_wall_dist_pool_size_l1': 4, 'left_wall_dist_out_channels_l2': 256, 'left_wall_dist_pool_size_l2': 2, 'left_wall_dist_out_channels_l3': 44, 'left_wall_dist_pool_size_l3': 2, 'left_wall_dist_fc_hidden': 48, 'track_width_num_layers': 4, 'track_width_activation': 'elu', 'track_width_out_channels_l0': 100, 'track_width_pool_size_l0': 2, 'track_width_out_channels_l1': 36, 'track_width_pool_size_l1': 4, 'track_width_out_channels_l2': 241, 'track_width_pool_size_l2': 2, 'track_width_out_channels_l3': 213, 'track_width_pool_size_l3': 2, 'track_width_fc_hidden': 128, 'heading_error_num_layers': 2, 'heading_error_activation': 'relu', 'heading_error_out_channels_l0': 143, 'heading_error_pool_size_l0': 8, 'heading_error_out_channels_l1': 251, 'heading_error_pool_size_l1': 8, 'heading_error_fc_hidden': 90}. Best is trial 7 with value: 0.1186.
[rank: 0] Seed set to 42
GPU available: True (cuda), used: True
TPU available: False, using: 0 TPU cores
💡 Tip: For seamless cloud logging and experiment tracking, try installing [litlogger](https://pypi.org/project/litlogger/) to enable LitLogger, which logs metrics and artifacts automatically to the Lightning Experiments platform.
[rank: 0] Seed set to 42
GPU available: True (cuda), used: True
TPU available: False, using: 0 TPU cores
💡 Tip: For seamless cloud logging and experiment tracking, try installing [litlogger](https://pypi.org/project/litlogger/) to enable LitLogger, which logs metrics and artifacts automatically to the Lightning Experiments platform.
[rank: 0] Seed set to 42
GPU available: True (cuda), used: True
TPU available: False, using: 0 TPU cores
💡 Tip: For seamless cloud logging and experiment tracking, try installing [litlogger](https://pypi.org/project/litlogger/) to enable LitLogger, which logs metrics and artifacts automatically to the Lightning Experiments platform.
LOCAL_RANK: 0 - CUDA_VISIBLE_DEVICES: [0]
SLURM auto-requeueing enabled. Setting signal handlers.
LOCAL_RANK: 0 - CUDA_VISIBLE_DEVICES: [0]
SLURM auto-requeueing enabled. Setting signal handlers.
LOCAL_RANK: 0 - CUDA_VISIBLE_DEVICES: [0]
SLURM auto-requeueing enabled. Setting signal handlers.
`Trainer.fit` stopped: `max_epochs=30` reached.
`Trainer.fit` stopped: `max_epochs=30` reached.
`Trainer.fit` stopped: `max_epochs=30` reached.
[I 2026-04-15 22:01:01,402] Trial 12 finished with value: 0.1861 and parameters: {'left_wall_dist_num_layers': 4, 'left_wall_dist_activation': 'elu', 'left_wall_dist_out_channels_l0': 118, 'left_wall_dist_pool_size_l0': 4, 'left_wall_dist_out_channels_l1': 256, 'left_wall_dist_pool_size_l1': 4, 'left_wall_dist_out_channels_l2': 108, 'left_wall_dist_pool_size_l2': 4, 'left_wall_dist_out_channels_l3': 35, 'left_wall_dist_pool_size_l3': 2, 'left_wall_dist_fc_hidden': 41, 'track_width_num_layers': 5, 'track_width_activation': 'elu', 'track_width_out_channels_l0': 230, 'track_width_pool_size_l0': 2, 'track_width_out_channels_l1': 160, 'track_width_pool_size_l1': 4, 'track_width_out_channels_l2': 61, 'track_width_pool_size_l2': 2, 'track_width_out_channels_l3': 74, 'track_width_pool_size_l3': 2, 'track_width_out_channels_l4': 58, 'track_width_pool_size_l4': 8, 'track_width_fc_hidden': 36, 'heading_error_num_layers': 4, 'heading_error_activation': 'elu', 'heading_error_out_channels_l0': 148, 'heading_error_pool_size_l0': 8, 'heading_error_out_channels_l1': 124, 'heading_error_pool_size_l1': 8, 'heading_error_out_channels_l2': 246, 'heading_error_pool_size_l2': 8}. Best is trial 7 with value: 0.1186.
[rank: 0] Seed set to 42
[rank: 0] Seed set to 42
GPU available: True (cuda), used: True
TPU available: False, using: 0 TPU cores
💡 Tip: For seamless cloud logging and experiment tracking, try installing [litlogger](https://pypi.org/project/litlogger/) to enable LitLogger, which logs metrics and artifacts automatically to the Lightning Experiments platform.
GPU available: True (cuda), used: True
TPU available: False, using: 0 TPU cores
💡 Tip: For seamless cloud logging and experiment tracking, try installing [litlogger](https://pypi.org/project/litlogger/) to enable LitLogger, which logs metrics and artifacts automatically to the Lightning Experiments platform.
[rank: 0] Seed set to 42
GPU available: True (cuda), used: True
TPU available: False, using: 0 TPU cores
💡 Tip: For seamless cloud logging and experiment tracking, try installing [litlogger](https://pypi.org/project/litlogger/) to enable LitLogger, which logs metrics and artifacts automatically to the Lightning Experiments platform.
LOCAL_RANK: 0 - CUDA_VISIBLE_DEVICES: [0]
LOCAL_RANK: 0 - CUDA_VISIBLE_DEVICES: [0]
LOCAL_RANK: 0 - CUDA_VISIBLE_DEVICES: [0]
SLURM auto-requeueing enabled. Setting signal handlers.
SLURM auto-requeueing enabled. Setting signal handlers.
SLURM auto-requeueing enabled. Setting signal handlers.
`Trainer.fit` stopped: `max_epochs=30` reached.
`Trainer.fit` stopped: `max_epochs=30` reached.
`Trainer.fit` stopped: `max_epochs=30` reached.
[I 2026-04-15 22:03:29,110] Trial 13 finished with value: 0.1188 and parameters: {'left_wall_dist_num_layers': 3, 'left_wall_dist_activation': 'elu', 'left_wall_dist_out_channels_l0': 180, 'left_wall_dist_pool_size_l0': 4, 'left_wall_dist_out_channels_l1': 61, 'left_wall_dist_pool_size_l1': 4, 'left_wall_dist_out_channels_l2': 82, 'left_wall_dist_pool_size_l2': 2, 'left_wall_dist_fc_hidden': 71, 'track_width_num_layers': 3, 'track_width_activation': 'elu', 'track_width_out_channels_l0': 88, 'track_width_pool_size_l0': 2, 'track_width_out_channels_l1': 129, 'track_width_pool_size_l1': 4, 'track_width_out_channels_l2': 137, 'track_width_pool_size_l2': 2, 'heading_error_num_layers': 2, 'heading_error_activation': 'relu', 'heading_error_out_channels_l0': 53, 'heading_error_pool_size_l0': 4, 'heading_error_out_channels_l1': 32, 'heading_error_pool_size_l1': 2, 'heading_error_fc_hidden': 99}. Best is trial 7 with value: 0.1186.
[rank: 0] Seed set to 42
[rank: 0] Seed set to 42
[rank: 0] Seed set to 42
GPU available: True (cuda), used: True
TPU available: False, using: 0 TPU cores
💡 Tip: For seamless cloud logging and experiment tracking, try installing [litlogger](https://pypi.org/project/litlogger/) to enable LitLogger, which logs metrics and artifacts automatically to the Lightning Experiments platform.
GPU available: True (cuda), used: True
TPU available: False, using: 0 TPU cores
💡 Tip: For seamless cloud logging and experiment tracking, try installing [litlogger](https://pypi.org/project/litlogger/) to enable LitLogger, which logs metrics and artifacts automatically to the Lightning Experiments platform.
GPU available: True (cuda), used: True
TPU available: False, using: 0 TPU cores
💡 Tip: For seamless cloud logging and experiment tracking, try installing [litlogger](https://pypi.org/project/litlogger/) to enable LitLogger, which logs metrics and artifacts automatically to the Lightning Experiments platform.
LOCAL_RANK: 0 - CUDA_VISIBLE_DEVICES: [0]
LOCAL_RANK: 0 - CUDA_VISIBLE_DEVICES: [0]
LOCAL_RANK: 0 - CUDA_VISIBLE_DEVICES: [0]
SLURM auto-requeueing enabled. Setting signal handlers.
SLURM auto-requeueing enabled. Setting signal handlers.
SLURM auto-requeueing enabled. Setting signal handlers.
`Trainer.fit` stopped: `max_epochs=30` reached.
`Trainer.fit` stopped: `max_epochs=30` reached.
`Trainer.fit` stopped: `max_epochs=30` reached.
[I 2026-04-15 22:06:13,771] Trial 14 finished with value: 0.1479 and parameters: {'left_wall_dist_num_layers': 3, 'left_wall_dist_activation': 'relu', 'left_wall_dist_out_channels_l0': 185, 'left_wall_dist_pool_size_l0': 2, 'left_wall_dist_out_channels_l1': 106, 'left_wall_dist_pool_size_l1': 2, 'left_wall_dist_out_channels_l2': 63, 'left_wall_dist_pool_size_l2': 2, 'track_width_num_layers': 4, 'track_width_activation': 'elu', 'track_width_out_channels_l0': 86, 'track_width_pool_size_l0': 4, 'track_width_out_channels_l1': 130, 'track_width_pool_size_l1': 2, 'track_width_out_channels_l2': 142, 'track_width_pool_size_l2': 8, 'track_width_out_channels_l3': 39, 'track_width_pool_size_l3': 8, 'track_width_fc_hidden': 32, 'heading_error_num_layers': 4, 'heading_error_activation': 'relu', 'heading_error_out_channels_l0': 50, 'heading_error_pool_size_l0': 2, 'heading_error_out_channels_l1': 182, 'heading_error_pool_size_l1': 2, 'heading_error_out_channels_l2': 32, 'heading_error_pool_size_l2': 8, 'heading_error_out_channels_l3': 82, 'heading_error_pool_size_l3': 2, 'heading_error_fc_hidden': 42}. Best is trial 7 with value: 0.1186.
[rank: 0] Seed set to 42
[rank: 0] Seed set to 42
GPU available: True (cuda), used: True
TPU available: False, using: 0 TPU cores
💡 Tip: For seamless cloud logging and experiment tracking, try installing [litlogger](https://pypi.org/project/litlogger/) to enable LitLogger, which logs metrics and artifacts automatically to the Lightning Experiments platform.
GPU available: True (cuda), used: True
TPU available: False, using: 0 TPU cores
💡 Tip: For seamless cloud logging and experiment tracking, try installing [litlogger](https://pypi.org/project/litlogger/) to enable LitLogger, which logs metrics and artifacts automatically to the Lightning Experiments platform.
[rank: 0] Seed set to 42
GPU available: True (cuda), used: True
TPU available: False, using: 0 TPU cores
💡 Tip: For seamless cloud logging and experiment tracking, try installing [litlogger](https://pypi.org/project/litlogger/) to enable LitLogger, which logs metrics and artifacts automatically to the Lightning Experiments platform.
LOCAL_RANK: 0 - CUDA_VISIBLE_DEVICES: [0]
LOCAL_RANK: 0 - CUDA_VISIBLE_DEVICES: [0]
LOCAL_RANK: 0 - CUDA_VISIBLE_DEVICES: [0]
SLURM auto-requeueing enabled. Setting signal handlers.
SLURM auto-requeueing enabled. Setting signal handlers.
SLURM auto-requeueing enabled. Setting signal handlers.
`Trainer.fit` stopped: `max_epochs=30` reached.
`Trainer.fit` stopped: `max_epochs=30` reached.
`Trainer.fit` stopped: `max_epochs=30` reached.
[I 2026-04-15 22:08:01,102] Trial 15 finished with value: 0.2228 and parameters: {'left_wall_dist_num_layers': 3, 'left_wall_dist_activation': 'elu', 'left_wall_dist_out_channels_l0': 255, 'left_wall_dist_pool_size_l0': 4, 'left_wall_dist_out_channels_l1': 69, 'left_wall_dist_pool_size_l1': 2, 'left_wall_dist_out_channels_l2': 91, 'left_wall_dist_pool_size_l2': 4, 'left_wall_dist_fc_hidden': 69, 'track_width_num_layers': 2, 'track_width_activation': 'elu', 'track_width_out_channels_l0': 65, 'track_width_pool_size_l0': 8, 'track_width_out_channels_l1': 141, 'track_width_pool_size_l1': 4, 'track_width_fc_hidden': 83, 'heading_error_num_layers': 5, 'heading_error_activation': 'elu', 'heading_error_out_channels_l0': 56, 'heading_error_pool_size_l0': 4, 'heading_error_out_channels_l1': 56, 'heading_error_pool_size_l1': 2, 'heading_error_out_channels_l2': 109, 'heading_error_pool_size_l2': 2, 'heading_error_out_channels_l3': 32, 'heading_error_pool_size_l3': 8, 'heading_error_out_channels_l4': 224, 'heading_error_pool_size_l4': 4}. Best is trial 7 with value: 0.1186.
[rank: 0] Seed set to 42
GPU available: True (cuda), used: True
TPU available: False, using: 0 TPU cores
💡 Tip: For seamless cloud logging and experiment tracking, try installing [litlogger](https://pypi.org/project/litlogger/) to enable LitLogger, which logs metrics and artifacts automatically to the Lightning Experiments platform.
[rank: 0] Seed set to 42
[rank: 0] Seed set to 42
GPU available: True (cuda), used: True
TPU available: False, using: 0 TPU cores
💡 Tip: For seamless cloud logging and experiment tracking, try installing [litlogger](https://pypi.org/project/litlogger/) to enable LitLogger, which logs metrics and artifacts automatically to the Lightning Experiments platform.
GPU available: True (cuda), used: True
TPU available: False, using: 0 TPU cores
💡 Tip: For seamless cloud logging and experiment tracking, try installing [litlogger](https://pypi.org/project/litlogger/) to enable LitLogger, which logs metrics and artifacts automatically to the Lightning Experiments platform.
LOCAL_RANK: 0 - CUDA_VISIBLE_DEVICES: [0]
LOCAL_RANK: 0 - CUDA_VISIBLE_DEVICES: [0]
LOCAL_RANK: 0 - CUDA_VISIBLE_DEVICES: [0]
SLURM auto-requeueing enabled. Setting signal handlers.
SLURM auto-requeueing enabled. Setting signal handlers.
SLURM auto-requeueing enabled. Setting signal handlers.
`Trainer.fit` stopped: `max_epochs=30` reached.
`Trainer.fit` stopped: `max_epochs=30` reached.
`Trainer.fit` stopped: `max_epochs=30` reached.
[I 2026-04-15 22:10:38,648] Trial 16 finished with value: 0.1073 and parameters: {'left_wall_dist_num_layers': 2, 'left_wall_dist_activation': 'elu', 'left_wall_dist_out_channels_l0': 159, 'left_wall_dist_pool_size_l0': 2, 'left_wall_dist_out_channels_l1': 38, 'left_wall_dist_pool_size_l1': 4, 'left_wall_dist_fc_hidden': 110, 'track_width_num_layers': 5, 'track_width_activation': 'elu', 'track_width_out_channels_l0': 114, 'track_width_pool_size_l0': 2, 'track_width_out_channels_l1': 248, 'track_width_pool_size_l1': 2, 'track_width_out_channels_l2': 129, 'track_width_pool_size_l2': 2, 'track_width_out_channels_l3': 134, 'track_width_pool_size_l3': 4, 'track_width_out_channels_l4': 202, 'track_width_pool_size_l4': 4, 'track_width_fc_hidden': 51, 'heading_error_num_layers': 2, 'heading_error_activation': 'elu', 'heading_error_out_channels_l0': 49, 'heading_error_pool_size_l0': 8, 'heading_error_out_channels_l1': 109, 'heading_error_pool_size_l1': 2, 'heading_error_fc_hidden': 128}. Best is trial 16 with value: 0.1073.
[rank: 0] Seed set to 42
[rank: 0] Seed set to 42
[rank: 0] Seed set to 42
GPU available: True (cuda), used: True
TPU available: False, using: 0 TPU cores
GPU available: True (cuda), used: True
TPU available: False, using: 0 TPU cores
GPU available: True (cuda), used: True
TPU available: False, using: 0 TPU cores
💡 Tip: For seamless cloud logging and experiment tracking, try installing [litlogger](https://pypi.org/project/litlogger/) to enable LitLogger, which logs metrics and artifacts automatically to the Lightning Experiments platform.
💡 Tip: For seamless cloud logging and experiment tracking, try installing [litlogger](https://pypi.org/project/litlogger/) to enable LitLogger, which logs metrics and artifacts automatically to the Lightning Experiments platform.
💡 Tip: For seamless cloud logging and experiment tracking, try installing [litlogger](https://pypi.org/project/litlogger/) to enable LitLogger, which logs metrics and artifacts automatically to the Lightning Experiments platform.
LOCAL_RANK: 0 - CUDA_VISIBLE_DEVICES: [0]
LOCAL_RANK: 0 - CUDA_VISIBLE_DEVICES: [0]
LOCAL_RANK: 0 - CUDA_VISIBLE_DEVICES: [0]
SLURM auto-requeueing enabled. Setting signal handlers.
SLURM auto-requeueing enabled. Setting signal handlers.
SLURM auto-requeueing enabled. Setting signal handlers.
`Trainer.fit` stopped: `max_epochs=30` reached.
`Trainer.fit` stopped: `max_epochs=30` reached.
`Trainer.fit` stopped: `max_epochs=30` reached.
[I 2026-04-15 22:13:08,868] Trial 17 finished with value: 0.1244 and parameters: {'left_wall_dist_num_layers': 2, 'left_wall_dist_activation': 'elu', 'left_wall_dist_out_channels_l0': 33, 'left_wall_dist_pool_size_l0': 2, 'left_wall_dist_out_channels_l1': 33, 'left_wall_dist_pool_size_l1': 2, 'track_width_num_layers': 5, 'track_width_activation': 'elu', 'track_width_out_channels_l0': 119, 'track_width_pool_size_l0': 8, 'track_width_out_channels_l1': 243, 'track_width_pool_size_l1': 2, 'track_width_out_channels_l2': 115, 'track_width_pool_size_l2': 4, 'track_width_out_channels_l3': 116, 'track_width_pool_size_l3': 4, 'track_width_out_channels_l4': 247, 'track_width_pool_size_l4': 4, 'heading_error_num_layers': 3, 'heading_error_activation': 'elu', 'heading_error_out_channels_l0': 43, 'heading_error_pool_size_l0': 8, 'heading_error_out_channels_l1': 104, 'heading_error_pool_size_l1': 2, 'heading_error_out_channels_l2': 190, 'heading_error_pool_size_l2': 8, 'heading_error_fc_hidden': 76}. Best is trial 16 with value: 0.1073.
[rank: 0] Seed set to 42
[rank: 0] Seed set to 42
[rank: 0] Seed set to 42
GPU available: True (cuda), used: True
TPU available: False, using: 0 TPU cores
💡 Tip: For seamless cloud logging and experiment tracking, try installing [litlogger](https://pypi.org/project/litlogger/) to enable LitLogger, which logs metrics and artifacts automatically to the Lightning Experiments platform.
GPU available: True (cuda), used: True
TPU available: False, using: 0 TPU cores
💡 Tip: For seamless cloud logging and experiment tracking, try installing [litlogger](https://pypi.org/project/litlogger/) to enable LitLogger, which logs metrics and artifacts automatically to the Lightning Experiments platform.
GPU available: True (cuda), used: True
TPU available: False, using: 0 TPU cores
💡 Tip: For seamless cloud logging and experiment tracking, try installing [litlogger](https://pypi.org/project/litlogger/) to enable LitLogger, which logs metrics and artifacts automatically to the Lightning Experiments platform.
LOCAL_RANK: 0 - CUDA_VISIBLE_DEVICES: [0]
LOCAL_RANK: 0 - CUDA_VISIBLE_DEVICES: [0]
LOCAL_RANK: 0 - CUDA_VISIBLE_DEVICES: [0]
SLURM auto-requeueing enabled. Setting signal handlers.
SLURM auto-requeueing enabled. Setting signal handlers.
SLURM auto-requeueing enabled. Setting signal handlers.
`Trainer.fit` stopped: `max_epochs=30` reached.
`Trainer.fit` stopped: `max_epochs=30` reached.
`Trainer.fit` stopped: `max_epochs=30` reached.
[I 2026-04-15 22:15:00,304] Trial 18 finished with value: 0.2725 and parameters: {'left_wall_dist_num_layers': 2, 'left_wall_dist_activation': 'relu', 'left_wall_dist_out_channels_l0': 101, 'left_wall_dist_pool_size_l0': 2, 'left_wall_dist_out_channels_l1': 39, 'left_wall_dist_pool_size_l1': 4, 'left_wall_dist_fc_hidden': 117, 'track_width_num_layers': 5, 'track_width_activation': 'elu', 'track_width_out_channels_l0': 67, 'track_width_pool_size_l0': 2, 'track_width_out_channels_l1': 175, 'track_width_pool_size_l1': 2, 'track_width_out_channels_l2': 62, 'track_width_pool_size_l2': 8, 'track_width_out_channels_l3': 159, 'track_width_pool_size_l3': 4, 'track_width_out_channels_l4': 167, 'track_width_pool_size_l4': 2, 'track_width_fc_hidden': 48, 'heading_error_num_layers': 4, 'heading_error_activation': 'elu', 'heading_error_out_channels_l0': 171, 'heading_error_pool_size_l0': 8, 'heading_error_out_channels_l1': 157, 'heading_error_pool_size_l1': 2, 'heading_error_out_channels_l2': 103, 'heading_error_pool_size_l2': 8, 'heading_error_out_channels_l3': 77, 'heading_error_pool_size_l3': 4}. Best is trial 16 with value: 0.1073.
[rank: 0] Seed set to 42
GPU available: True (cuda), used: True
TPU available: False, using: 0 TPU cores
💡 Tip: For seamless cloud logging and experiment tracking, try installing [litlogger](https://pypi.org/project/litlogger/) to enable LitLogger, which logs metrics and artifacts automatically to the Lightning Experiments platform.
[rank: 0] Seed set to 42
GPU available: True (cuda), used: True
TPU available: False, using: 0 TPU cores
💡 Tip: For seamless cloud logging and experiment tracking, try installing [litlogger](https://pypi.org/project/litlogger/) to enable LitLogger, which logs metrics and artifacts automatically to the Lightning Experiments platform.
[rank: 0] Seed set to 42
GPU available: True (cuda), used: True
TPU available: False, using: 0 TPU cores
💡 Tip: For seamless cloud logging and experiment tracking, try installing [litlogger](https://pypi.org/project/litlogger/) to enable LitLogger, which logs metrics and artifacts automatically to the Lightning Experiments platform.
LOCAL_RANK: 0 - CUDA_VISIBLE_DEVICES: [0]
LOCAL_RANK: 0 - CUDA_VISIBLE_DEVICES: [0]
LOCAL_RANK: 0 - CUDA_VISIBLE_DEVICES: [0]
SLURM auto-requeueing enabled. Setting signal handlers.
SLURM auto-requeueing enabled. Setting signal handlers.
SLURM auto-requeueing enabled. Setting signal handlers.
`Trainer.fit` stopped: `max_epochs=30` reached.
`Trainer.fit` stopped: `max_epochs=30` reached.
`Trainer.fit` stopped: `max_epochs=30` reached.
