[I 2026-04-14 23:18:19,557] Trial 63 finished with value: 0.1155 and parameters: {'left_wall_dist_num_layers': 2, 'left_wall_dist_activation': 'elu', 'left_wall_dist_out_channels_l0': 67, 'left_wall_dist_pool_size_l0': 2, 'left_wall_dist_out_channels_l1': 33, 'left_wall_dist_pool_size_l1': 4, 'left_wall_dist_fc_hidden': 122, 'track_width_num_layers': 2, 'track_width_activation': 'elu', 'track_width_out_channels_l0': 115, 'track_width_pool_size_l0': 4, 'track_width_out_channels_l1': 47, 'track_width_pool_size_l1': 8, 'track_width_fc_hidden': 53, 'heading_error_num_layers': 5, 'heading_error_activation': 'relu', 'heading_error_out_channels_l0': 160, 'heading_error_pool_size_l0': 4, 'heading_error_out_channels_l1': 58, 'heading_error_pool_size_l1': 4, 'heading_error_out_channels_l2': 54, 'heading_error_pool_size_l2': 2, 'heading_error_out_channels_l3': 71, 'heading_error_pool_size_l3': 2, 'heading_error_out_channels_l4': 211, 'heading_error_pool_size_l4': 4, 'heading_error_fc_hidden': 97}. Best is trial 4 with value: 0.0986.
[rank: 0] Seed set to 42
GPU available: True (cuda), used: True
TPU available: False, using: 0 TPU cores
💡 Tip: For seamless cloud logging and experiment tracking, try installing [litlogger](https://pypi.org/project/litlogger/) to enable LitLogger, which logs metrics and artifacts automatically to the Lightning Experiments platform.
[rank: 0] Seed set to 42
GPU available: True (cuda), used: True
TPU available: False, using: 0 TPU cores
💡 Tip: For seamless cloud logging and experiment tracking, try installing [litlogger](https://pypi.org/project/litlogger/) to enable LitLogger, which logs metrics and artifacts automatically to the Lightning Experiments platform.
[rank: 0] Seed set to 42
GPU available: True (cuda), used: True
TPU available: False, using: 0 TPU cores
💡 Tip: For seamless cloud logging and experiment tracking, try installing [litlogger](https://pypi.org/project/litlogger/) to enable LitLogger, which logs metrics and artifacts automatically to the Lightning Experiments platform.
LOCAL_RANK: 0 - CUDA_VISIBLE_DEVICES: [0]
SLURM auto-requeueing enabled. Setting signal handlers.
LOCAL_RANK: 0 - CUDA_VISIBLE_DEVICES: [0]
LOCAL_RANK: 0 - CUDA_VISIBLE_DEVICES: [0]
SLURM auto-requeueing enabled. Setting signal handlers.
SLURM auto-requeueing enabled. Setting signal handlers.
`Trainer.fit` stopped: `max_epochs=30` reached.
`Trainer.fit` stopped: `max_epochs=30` reached.
`Trainer.fit` stopped: `max_epochs=30` reached.
[I 2026-04-14 23:21:07,864] Trial 64 finished with value: 0.1121 and parameters: {'left_wall_dist_num_layers': 2, 'left_wall_dist_activation': 'elu', 'left_wall_dist_out_channels_l0': 54, 'left_wall_dist_pool_size_l0': 2, 'left_wall_dist_out_channels_l1': 48, 'left_wall_dist_pool_size_l1': 4, 'left_wall_dist_fc_hidden': 125, 'track_width_num_layers': 2, 'track_width_activation': 'elu', 'track_width_out_channels_l0': 117, 'track_width_pool_size_l0': 4, 'track_width_out_channels_l1': 47, 'track_width_pool_size_l1': 8, 'track_width_fc_hidden': 50, 'heading_error_num_layers': 5, 'heading_error_activation': 'relu', 'heading_error_out_channels_l0': 107, 'heading_error_pool_size_l0': 4, 'heading_error_out_channels_l1': 57, 'heading_error_pool_size_l1': 4, 'heading_error_out_channels_l2': 82, 'heading_error_pool_size_l2': 2, 'heading_error_out_channels_l3': 72, 'heading_error_pool_size_l3': 2, 'heading_error_out_channels_l4': 209, 'heading_error_pool_size_l4': 4, 'heading_error_fc_hidden': 91}. Best is trial 4 with value: 0.0986.
[rank: 0] Seed set to 42
[rank: 0] Seed set to 42
[rank: 0] Seed set to 42
GPU available: True (cuda), used: True
TPU available: False, using: 0 TPU cores
💡 Tip: For seamless cloud logging and experiment tracking, try installing [litlogger](https://pypi.org/project/litlogger/) to enable LitLogger, which logs metrics and artifacts automatically to the Lightning Experiments platform.
GPU available: True (cuda), used: True
TPU available: False, using: 0 TPU cores
💡 Tip: For seamless cloud logging and experiment tracking, try installing [litlogger](https://pypi.org/project/litlogger/) to enable LitLogger, which logs metrics and artifacts automatically to the Lightning Experiments platform.
GPU available: True (cuda), used: True
TPU available: False, using: 0 TPU cores
💡 Tip: For seamless cloud logging and experiment tracking, try installing [litlogger](https://pypi.org/project/litlogger/) to enable LitLogger, which logs metrics and artifacts automatically to the Lightning Experiments platform.
LOCAL_RANK: 0 - CUDA_VISIBLE_DEVICES: [0]
LOCAL_RANK: 0 - CUDA_VISIBLE_DEVICES: [0]
LOCAL_RANK: 0 - CUDA_VISIBLE_DEVICES: [0]
SLURM auto-requeueing enabled. Setting signal handlers.
SLURM auto-requeueing enabled. Setting signal handlers.
SLURM auto-requeueing enabled. Setting signal handlers.
`Trainer.fit` stopped: `max_epochs=30` reached.
`Trainer.fit` stopped: `max_epochs=30` reached.
`Trainer.fit` stopped: `max_epochs=30` reached.
[I 2026-04-14 23:24:07,609] Trial 65 finished with value: 0.1164 and parameters: {'left_wall_dist_num_layers': 2, 'left_wall_dist_activation': 'elu', 'left_wall_dist_out_channels_l0': 55, 'left_wall_dist_pool_size_l0': 2, 'left_wall_dist_out_channels_l1': 61, 'left_wall_dist_pool_size_l1': 4, 'left_wall_dist_fc_hidden': 128, 'track_width_num_layers': 2, 'track_width_activation': 'elu', 'track_width_out_channels_l0': 153, 'track_width_pool_size_l0': 4, 'track_width_out_channels_l1': 216, 'track_width_pool_size_l1': 8, 'track_width_fc_hidden': 116, 'heading_error_num_layers': 5, 'heading_error_activation': 'relu', 'heading_error_out_channels_l0': 137, 'heading_error_pool_size_l0': 4, 'heading_error_out_channels_l1': 231, 'heading_error_pool_size_l1': 4, 'heading_error_out_channels_l2': 102, 'heading_error_pool_size_l2': 2, 'heading_error_out_channels_l3': 73, 'heading_error_pool_size_l3': 2, 'heading_error_out_channels_l4': 211, 'heading_error_pool_size_l4': 4, 'heading_error_fc_hidden': 101}. Best is trial 4 with value: 0.0986.
[rank: 0] Seed set to 42
[rank: 0] Seed set to 42
[rank: 0] Seed set to 42
GPU available: True (cuda), used: True
TPU available: False, using: 0 TPU cores
💡 Tip: For seamless cloud logging and experiment tracking, try installing [litlogger](https://pypi.org/project/litlogger/) to enable LitLogger, which logs metrics and artifacts automatically to the Lightning Experiments platform.
GPU available: True (cuda), used: True
TPU available: False, using: 0 TPU cores
💡 Tip: For seamless cloud logging and experiment tracking, try installing [litlogger](https://pypi.org/project/litlogger/) to enable LitLogger, which logs metrics and artifacts automatically to the Lightning Experiments platform.
GPU available: True (cuda), used: True
TPU available: False, using: 0 TPU cores
💡 Tip: For seamless cloud logging and experiment tracking, try installing [litlogger](https://pypi.org/project/litlogger/) to enable LitLogger, which logs metrics and artifacts automatically to the Lightning Experiments platform.
LOCAL_RANK: 0 - CUDA_VISIBLE_DEVICES: [0]
LOCAL_RANK: 0 - CUDA_VISIBLE_DEVICES: [0]
LOCAL_RANK: 0 - CUDA_VISIBLE_DEVICES: [0]
SLURM auto-requeueing enabled. Setting signal handlers.
SLURM auto-requeueing enabled. Setting signal handlers.
SLURM auto-requeueing enabled. Setting signal handlers.
`Trainer.fit` stopped: `max_epochs=30` reached.
`Trainer.fit` stopped: `max_epochs=30` reached.
`Trainer.fit` stopped: `max_epochs=30` reached.
[I 2026-04-14 23:26:58,036] Trial 66 finished with value: 0.0922 and parameters: {'left_wall_dist_num_layers': 2, 'left_wall_dist_activation': 'elu', 'left_wall_dist_out_channels_l0': 66, 'left_wall_dist_pool_size_l0': 2, 'left_wall_dist_out_channels_l1': 49, 'left_wall_dist_pool_size_l1': 4, 'left_wall_dist_fc_hidden': 123, 'track_width_num_layers': 2, 'track_width_activation': 'elu', 'track_width_out_channels_l0': 112, 'track_width_pool_size_l0': 4, 'track_width_out_channels_l1': 47, 'track_width_pool_size_l1': 8, 'track_width_fc_hidden': 45, 'heading_error_num_layers': 5, 'heading_error_activation': 'relu', 'heading_error_out_channels_l0': 157, 'heading_error_pool_size_l0': 4, 'heading_error_out_channels_l1': 57, 'heading_error_pool_size_l1': 4, 'heading_error_out_channels_l2': 85, 'heading_error_pool_size_l2': 2, 'heading_error_out_channels_l3': 57, 'heading_error_pool_size_l3': 2, 'heading_error_out_channels_l4': 62, 'heading_error_pool_size_l4': 4, 'heading_error_fc_hidden': 40}. Best is trial 66 with value: 0.0922.
[rank: 0] Seed set to 42
[rank: 0] Seed set to 42
[rank: 0] Seed set to 42
GPU available: True (cuda), used: True
TPU available: False, using: 0 TPU cores
💡 Tip: For seamless cloud logging and experiment tracking, try installing [litlogger](https://pypi.org/project/litlogger/) to enable LitLogger, which logs metrics and artifacts automatically to the Lightning Experiments platform.
GPU available: True (cuda), used: True
TPU available: False, using: 0 TPU cores
💡 Tip: For seamless cloud logging and experiment tracking, try installing [litlogger](https://pypi.org/project/litlogger/) to enable LitLogger, which logs metrics and artifacts automatically to the Lightning Experiments platform.
GPU available: True (cuda), used: True
TPU available: False, using: 0 TPU cores
💡 Tip: For seamless cloud logging and experiment tracking, try installing [litlogger](https://pypi.org/project/litlogger/) to enable LitLogger, which logs metrics and artifacts automatically to the Lightning Experiments platform.
LOCAL_RANK: 0 - CUDA_VISIBLE_DEVICES: [0]
LOCAL_RANK: 0 - CUDA_VISIBLE_DEVICES: [0]
LOCAL_RANK: 0 - CUDA_VISIBLE_DEVICES: [0]
SLURM auto-requeueing enabled. Setting signal handlers.
SLURM auto-requeueing enabled. Setting signal handlers.
SLURM auto-requeueing enabled. Setting signal handlers.
`Trainer.fit` stopped: `max_epochs=30` reached.
`Trainer.fit` stopped: `max_epochs=30` reached.
`Trainer.fit` stopped: `max_epochs=30` reached.
[I 2026-04-14 23:29:45,804] Trial 67 finished with value: 0.0979 and parameters: {'left_wall_dist_num_layers': 2, 'left_wall_dist_activation': 'elu', 'left_wall_dist_out_channels_l0': 52, 'left_wall_dist_pool_size_l0': 2, 'left_wall_dist_out_channels_l1': 49, 'left_wall_dist_pool_size_l1': 4, 'left_wall_dist_fc_hidden': 122, 'track_width_num_layers': 2, 'track_width_activation': 'elu', 'track_width_out_channels_l0': 112, 'track_width_pool_size_l0': 4, 'track_width_out_channels_l1': 47, 'track_width_pool_size_l1': 8, 'track_width_fc_hidden': 49, 'heading_error_num_layers': 5, 'heading_error_activation': 'relu', 'heading_error_out_channels_l0': 82, 'heading_error_pool_size_l0': 4, 'heading_error_out_channels_l1': 57, 'heading_error_pool_size_l1': 4, 'heading_error_out_channels_l2': 80, 'heading_error_pool_size_l2': 2, 'heading_error_out_channels_l3': 59, 'heading_error_pool_size_l3': 2, 'heading_error_out_channels_l4': 55, 'heading_error_pool_size_l4': 4, 'heading_error_fc_hidden': 39}. Best is trial 66 with value: 0.0922.
[rank: 0] Seed set to 42
[rank: 0] Seed set to 42
GPU available: True (cuda), used: True
TPU available: False, using: 0 TPU cores
💡 Tip: For seamless cloud logging and experiment tracking, try installing [litlogger](https://pypi.org/project/litlogger/) to enable LitLogger, which logs metrics and artifacts automatically to the Lightning Experiments platform.
GPU available: True (cuda), used: True
TPU available: False, using: 0 TPU cores
💡 Tip: For seamless cloud logging and experiment tracking, try installing [litlogger](https://pypi.org/project/litlogger/) to enable LitLogger, which logs metrics and artifacts automatically to the Lightning Experiments platform.
[rank: 0] Seed set to 42
GPU available: True (cuda), used: True
TPU available: False, using: 0 TPU cores
💡 Tip: For seamless cloud logging and experiment tracking, try installing [litlogger](https://pypi.org/project/litlogger/) to enable LitLogger, which logs metrics and artifacts automatically to the Lightning Experiments platform.
LOCAL_RANK: 0 - CUDA_VISIBLE_DEVICES: [0]
LOCAL_RANK: 0 - CUDA_VISIBLE_DEVICES: [0]
LOCAL_RANK: 0 - CUDA_VISIBLE_DEVICES: [0]
SLURM auto-requeueing enabled. Setting signal handlers.
SLURM auto-requeueing enabled. Setting signal handlers.
SLURM auto-requeueing enabled. Setting signal handlers.
`Trainer.fit` stopped: `max_epochs=30` reached.
`Trainer.fit` stopped: `max_epochs=30` reached.
`Trainer.fit` stopped: `max_epochs=30` reached.
[I 2026-04-14 23:32:36,333] Trial 68 finished with value: 0.1234 and parameters: {'left_wall_dist_num_layers': 2, 'left_wall_dist_activation': 'elu', 'left_wall_dist_out_channels_l0': 60, 'left_wall_dist_pool_size_l0': 2, 'left_wall_dist_out_channels_l1': 93, 'left_wall_dist_pool_size_l1': 4, 'track_width_num_layers': 2, 'track_width_activation': 'relu', 'track_width_out_channels_l0': 113, 'track_width_pool_size_l0': 4, 'track_width_out_channels_l1': 57, 'track_width_pool_size_l1': 8, 'track_width_fc_hidden': 49, 'heading_error_num_layers': 5, 'heading_error_activation': 'relu', 'heading_error_out_channels_l0': 83, 'heading_error_pool_size_l0': 4, 'heading_error_out_channels_l1': 57, 'heading_error_pool_size_l1': 4, 'heading_error_out_channels_l2': 85, 'heading_error_pool_size_l2': 2, 'heading_error_out_channels_l3': 59, 'heading_error_pool_size_l3': 2, 'heading_error_out_channels_l4': 47, 'heading_error_pool_size_l4': 4, 'heading_error_fc_hidden': 33}. Best is trial 66 with value: 0.0922.
[rank: 0] Seed set to 42
GPU available: True (cuda), used: True
TPU available: False, using: 0 TPU cores
💡 Tip: For seamless cloud logging and experiment tracking, try installing [litlogger](https://pypi.org/project/litlogger/) to enable LitLogger, which logs metrics and artifacts automatically to the Lightning Experiments platform.
[rank: 0] Seed set to 42
[rank: 0] Seed set to 42
GPU available: True (cuda), used: True
TPU available: False, using: 0 TPU cores
💡 Tip: For seamless cloud logging and experiment tracking, try installing [litlogger](https://pypi.org/project/litlogger/) to enable LitLogger, which logs metrics and artifacts automatically to the Lightning Experiments platform.
GPU available: True (cuda), used: True
TPU available: False, using: 0 TPU cores
💡 Tip: For seamless cloud logging and experiment tracking, try installing [litlogger](https://pypi.org/project/litlogger/) to enable LitLogger, which logs metrics and artifacts automatically to the Lightning Experiments platform.
LOCAL_RANK: 0 - CUDA_VISIBLE_DEVICES: [0]
LOCAL_RANK: 0 - CUDA_VISIBLE_DEVICES: [0]
LOCAL_RANK: 0 - CUDA_VISIBLE_DEVICES: [0]
SLURM auto-requeueing enabled. Setting signal handlers.
SLURM auto-requeueing enabled. Setting signal handlers.
SLURM auto-requeueing enabled. Setting signal handlers.
`Trainer.fit` stopped: `max_epochs=30` reached.
`Trainer.fit` stopped: `max_epochs=30` reached.
`Trainer.fit` stopped: `max_epochs=30` reached.
[I 2026-04-14 23:35:18,794] Trial 69 finished with value: 0.1124 and parameters: {'left_wall_dist_num_layers': 2, 'left_wall_dist_activation': 'elu', 'left_wall_dist_out_channels_l0': 51, 'left_wall_dist_pool_size_l0': 2, 'left_wall_dist_out_channels_l1': 64, 'left_wall_dist_pool_size_l1': 4, 'track_width_num_layers': 2, 'track_width_activation': 'elu', 'track_width_out_channels_l0': 97, 'track_width_pool_size_l0': 4, 'track_width_out_channels_l1': 47, 'track_width_pool_size_l1': 8, 'track_width_fc_hidden': 40, 'heading_error_num_layers': 5, 'heading_error_activation': 'relu', 'heading_error_out_channels_l0': 69, 'heading_error_pool_size_l0': 4, 'heading_error_out_channels_l1': 72, 'heading_error_pool_size_l1': 4, 'heading_error_out_channels_l2': 80, 'heading_error_pool_size_l2': 2, 'heading_error_out_channels_l3': 61, 'heading_error_pool_size_l3': 2, 'heading_error_out_channels_l4': 64, 'heading_error_pool_size_l4': 4, 'heading_error_fc_hidden': 40}. Best is trial 66 with value: 0.0922.
[rank: 0] Seed set to 42
[rank: 0] Seed set to 42
GPU available: True (cuda), used: True
TPU available: False, using: 0 TPU cores
💡 Tip: For seamless cloud logging and experiment tracking, try installing [litlogger](https://pypi.org/project/litlogger/) to enable LitLogger, which logs metrics and artifacts automatically to the Lightning Experiments platform.
[rank: 0] Seed set to 42
GPU available: True (cuda), used: True
TPU available: False, using: 0 TPU cores
💡 Tip: For seamless cloud logging and experiment tracking, try installing [litlogger](https://pypi.org/project/litlogger/) to enable LitLogger, which logs metrics and artifacts automatically to the Lightning Experiments platform.
GPU available: True (cuda), used: True
TPU available: False, using: 0 TPU cores
💡 Tip: For seamless cloud logging and experiment tracking, try installing [litlogger](https://pypi.org/project/litlogger/) to enable LitLogger, which logs metrics and artifacts automatically to the Lightning Experiments platform.
LOCAL_RANK: 0 - CUDA_VISIBLE_DEVICES: [0]
LOCAL_RANK: 0 - CUDA_VISIBLE_DEVICES: [0]
SLURM auto-requeueing enabled. Setting signal handlers.
SLURM auto-requeueing enabled. Setting signal handlers.
LOCAL_RANK: 0 - CUDA_VISIBLE_DEVICES: [0]
SLURM auto-requeueing enabled. Setting signal handlers.
`Trainer.fit` stopped: `max_epochs=30` reached.
`Trainer.fit` stopped: `max_epochs=30` reached.
`Trainer.fit` stopped: `max_epochs=30` reached.
[I 2026-04-14 23:38:10,308] Trial 70 finished with value: 0.1341 and parameters: {'left_wall_dist_num_layers': 2, 'left_wall_dist_activation': 'elu', 'left_wall_dist_out_channels_l0': 49, 'left_wall_dist_pool_size_l0': 2, 'left_wall_dist_out_channels_l1': 76, 'left_wall_dist_pool_size_l1': 4, 'track_width_num_layers': 2, 'track_width_activation': 'elu', 'track_width_out_channels_l0': 97, 'track_width_pool_size_l0': 4, 'track_width_out_channels_l1': 148, 'track_width_pool_size_l1': 8, 'track_width_fc_hidden': 79, 'heading_error_num_layers': 5, 'heading_error_activation': 'relu', 'heading_error_out_channels_l0': 69, 'heading_error_pool_size_l0': 4, 'heading_error_out_channels_l1': 76, 'heading_error_pool_size_l1': 8, 'heading_error_out_channels_l2': 107, 'heading_error_pool_size_l2': 2, 'heading_error_out_channels_l3': 56, 'heading_error_pool_size_l3': 2, 'heading_error_out_channels_l4': 61, 'heading_error_pool_size_l4': 4}. Best is trial 66 with value: 0.0922.
[rank: 0] Seed set to 42
[rank: 0] Seed set to 42
GPU available: True (cuda), used: True
TPU available: False, using: 0 TPU cores
💡 Tip: For seamless cloud logging and experiment tracking, try installing [litlogger](https://pypi.org/project/litlogger/) to enable LitLogger, which logs metrics and artifacts automatically to the Lightning Experiments platform.
GPU available: True (cuda), used: True
TPU available: False, using: 0 TPU cores
💡 Tip: For seamless cloud logging and experiment tracking, try installing [litlogger](https://pypi.org/project/litlogger/) to enable LitLogger, which logs metrics and artifacts automatically to the Lightning Experiments platform.
[rank: 0] Seed set to 42
GPU available: True (cuda), used: True
TPU available: False, using: 0 TPU cores
💡 Tip: For seamless cloud logging and experiment tracking, try installing [litlogger](https://pypi.org/project/litlogger/) to enable LitLogger, which logs metrics and artifacts automatically to the Lightning Experiments platform.
LOCAL_RANK: 0 - CUDA_VISIBLE_DEVICES: [0]
LOCAL_RANK: 0 - CUDA_VISIBLE_DEVICES: [0]
LOCAL_RANK: 0 - CUDA_VISIBLE_DEVICES: [0]
SLURM auto-requeueing enabled. Setting signal handlers.
SLURM auto-requeueing enabled. Setting signal handlers.
SLURM auto-requeueing enabled. Setting signal handlers.
`Trainer.fit` stopped: `max_epochs=30` reached.
`Trainer.fit` stopped: `max_epochs=30` reached.
`Trainer.fit` stopped: `max_epochs=30` reached.
