[I 2026-04-12 17:13:10,163] Trial 108 finished with value: 0.1472 and parameters: {'left_wall_dist_num_layers': 3, 'left_wall_dist_activation': 'elu', 'left_wall_dist_out_channels_l0': 84, 'left_wall_dist_pool_size_l0': 4, 'left_wall_dist_out_channels_l1': 106, 'left_wall_dist_pool_size_l1': 2, 'left_wall_dist_out_channels_l2': 102, 'left_wall_dist_pool_size_l2': 4, 'left_wall_dist_fc_hidden': 125, 'track_width_num_layers': 4, 'track_width_activation': 'elu', 'track_width_out_channels_l0': 78, 'track_width_pool_size_l0': 8, 'track_width_out_channels_l1': 120, 'track_width_pool_size_l1': 4, 'track_width_out_channels_l2': 79, 'track_width_pool_size_l2': 4, 'track_width_out_channels_l3': 169, 'track_width_pool_size_l3': 2, 'track_width_fc_hidden': 37, 'heading_error_num_layers': 4, 'heading_error_activation': 'elu', 'heading_error_out_channels_l0': 37, 'heading_error_pool_size_l0': 2, 'heading_error_out_channels_l1': 40, 'heading_error_pool_size_l1': 4, 'heading_error_out_channels_l2': 151, 'heading_error_pool_size_l2': 4, 'heading_error_out_channels_l3': 134, 'heading_error_pool_size_l3': 4, 'heading_error_fc_hidden': 75}. Best is trial 58 with value: 0.0986.
[rank: 0] Seed set to 42
[rank: 0] Seed set to 42
GPU available: True (cuda), used: True
TPU available: False, using: 0 TPU cores
💡 Tip: For seamless cloud logging and experiment tracking, try installing [litlogger](https://pypi.org/project/litlogger/) to enable LitLogger, which logs metrics and artifacts automatically to the Lightning Experiments platform.
GPU available: True (cuda), used: True
TPU available: False, using: 0 TPU cores
💡 Tip: For seamless cloud logging and experiment tracking, try installing [litlogger](https://pypi.org/project/litlogger/) to enable LitLogger, which logs metrics and artifacts automatically to the Lightning Experiments platform.
[rank: 0] Seed set to 42
GPU available: True (cuda), used: True
TPU available: False, using: 0 TPU cores
💡 Tip: For seamless cloud logging and experiment tracking, try installing [litlogger](https://pypi.org/project/litlogger/) to enable LitLogger, which logs metrics and artifacts automatically to the Lightning Experiments platform.
LOCAL_RANK: 0 - CUDA_VISIBLE_DEVICES: [0]
LOCAL_RANK: 0 - CUDA_VISIBLE_DEVICES: [0]
LOCAL_RANK: 0 - CUDA_VISIBLE_DEVICES: [0]
SLURM auto-requeueing enabled. Setting signal handlers.
SLURM auto-requeueing enabled. Setting signal handlers.
SLURM auto-requeueing enabled. Setting signal handlers.
`Trainer.fit` stopped: `max_epochs=20` reached.
`Trainer.fit` stopped: `max_epochs=20` reached.
`Trainer.fit` stopped: `max_epochs=20` reached.
[I 2026-04-12 17:15:33,060] Trial 109 finished with value: 0.154 and parameters: {'left_wall_dist_num_layers': 3, 'left_wall_dist_activation': 'elu', 'left_wall_dist_out_channels_l0': 50, 'left_wall_dist_pool_size_l0': 4, 'left_wall_dist_out_channels_l1': 122, 'left_wall_dist_pool_size_l1': 2, 'left_wall_dist_out_channels_l2': 132, 'left_wall_dist_pool_size_l2': 2, 'track_width_num_layers': 5, 'track_width_activation': 'elu', 'track_width_out_channels_l0': 98, 'track_width_pool_size_l0': 8, 'track_width_out_channels_l1': 84, 'track_width_pool_size_l1': 4, 'track_width_out_channels_l2': 92, 'track_width_pool_size_l2': 4, 'track_width_out_channels_l3': 241, 'track_width_pool_size_l3': 2, 'track_width_fc_hidden': 39, 'heading_error_num_layers': 5, 'heading_error_activation': 'elu', 'heading_error_out_channels_l0': 39, 'heading_error_pool_size_l0': 2, 'heading_error_out_channels_l1': 37, 'heading_error_pool_size_l1': 4, 'heading_error_out_channels_l2': 127, 'heading_error_pool_size_l2': 4, 'heading_error_out_channels_l3': 141, 'heading_error_pool_size_l3': 4, 'heading_error_out_channels_l4': 243, 'heading_error_pool_size_l4': 4, 'heading_error_fc_hidden': 33}. Best is trial 58 with value: 0.0986.
[rank: 0] Seed set to 42
[rank: 0] Seed set to 42
GPU available: True (cuda), used: True
TPU available: False, using: 0 TPU cores
💡 Tip: For seamless cloud logging and experiment tracking, try installing [litlogger](https://pypi.org/project/litlogger/) to enable LitLogger, which logs metrics and artifacts automatically to the Lightning Experiments platform.
GPU available: True (cuda), used: True
TPU available: False, using: 0 TPU cores
💡 Tip: For seamless cloud logging and experiment tracking, try installing [litlogger](https://pypi.org/project/litlogger/) to enable LitLogger, which logs metrics and artifacts automatically to the Lightning Experiments platform.
[rank: 0] Seed set to 42
GPU available: True (cuda), used: True
TPU available: False, using: 0 TPU cores
💡 Tip: For seamless cloud logging and experiment tracking, try installing [litlogger](https://pypi.org/project/litlogger/) to enable LitLogger, which logs metrics and artifacts automatically to the Lightning Experiments platform.
LOCAL_RANK: 0 - CUDA_VISIBLE_DEVICES: [0]
LOCAL_RANK: 0 - CUDA_VISIBLE_DEVICES: [0]
LOCAL_RANK: 0 - CUDA_VISIBLE_DEVICES: [0]
SLURM auto-requeueing enabled. Setting signal handlers.
SLURM auto-requeueing enabled. Setting signal handlers.
SLURM auto-requeueing enabled. Setting signal handlers.
`Trainer.fit` stopped: `max_epochs=20` reached.
`Trainer.fit` stopped: `max_epochs=20` reached.
`Trainer.fit` stopped: `max_epochs=20` reached.
[I 2026-04-12 17:17:48,300] Trial 110 finished with value: 0.1279 and parameters: {'left_wall_dist_num_layers': 3, 'left_wall_dist_activation': 'elu', 'left_wall_dist_out_channels_l0': 73, 'left_wall_dist_pool_size_l0': 4, 'left_wall_dist_out_channels_l1': 115, 'left_wall_dist_pool_size_l1': 2, 'left_wall_dist_out_channels_l2': 166, 'left_wall_dist_pool_size_l2': 2, 'track_width_num_layers': 4, 'track_width_activation': 'relu', 'track_width_out_channels_l0': 83, 'track_width_pool_size_l0': 2, 'track_width_out_channels_l1': 102, 'track_width_pool_size_l1': 4, 'track_width_out_channels_l2': 72, 'track_width_pool_size_l2': 4, 'track_width_out_channels_l3': 217, 'track_width_pool_size_l3': 2, 'track_width_fc_hidden': 52, 'heading_error_num_layers': 4, 'heading_error_activation': 'elu', 'heading_error_out_channels_l0': 32, 'heading_error_pool_size_l0': 2, 'heading_error_out_channels_l1': 43, 'heading_error_pool_size_l1': 4, 'heading_error_out_channels_l2': 161, 'heading_error_pool_size_l2': 4, 'heading_error_out_channels_l3': 117, 'heading_error_pool_size_l3': 4, 'heading_error_fc_hidden': 81}. Best is trial 58 with value: 0.0986.
[rank: 0] Seed set to 42
GPU available: True (cuda), used: True
TPU available: False, using: 0 TPU cores
💡 Tip: For seamless cloud logging and experiment tracking, try installing [litlogger](https://pypi.org/project/litlogger/) to enable LitLogger, which logs metrics and artifacts automatically to the Lightning Experiments platform.
[rank: 0] Seed set to 42
GPU available: True (cuda), used: True
TPU available: False, using: 0 TPU cores
💡 Tip: For seamless cloud logging and experiment tracking, try installing [litlogger](https://pypi.org/project/litlogger/) to enable LitLogger, which logs metrics and artifacts automatically to the Lightning Experiments platform.
[rank: 0] Seed set to 42
GPU available: True (cuda), used: True
TPU available: False, using: 0 TPU cores
💡 Tip: For seamless cloud logging and experiment tracking, try installing [litlogger](https://pypi.org/project/litlogger/) to enable LitLogger, which logs metrics and artifacts automatically to the Lightning Experiments platform.
LOCAL_RANK: 0 - CUDA_VISIBLE_DEVICES: [0]
SLURM auto-requeueing enabled. Setting signal handlers.
LOCAL_RANK: 0 - CUDA_VISIBLE_DEVICES: [0]
LOCAL_RANK: 0 - CUDA_VISIBLE_DEVICES: [0]
SLURM auto-requeueing enabled. Setting signal handlers.
SLURM auto-requeueing enabled. Setting signal handlers.
`Trainer.fit` stopped: `max_epochs=20` reached.
`Trainer.fit` stopped: `max_epochs=20` reached.
`Trainer.fit` stopped: `max_epochs=20` reached.
[I 2026-04-12 17:19:58,903] Trial 111 finished with value: 0.1051 and parameters: {'left_wall_dist_num_layers': 2, 'left_wall_dist_activation': 'elu', 'left_wall_dist_out_channels_l0': 79, 'left_wall_dist_pool_size_l0': 4, 'left_wall_dist_out_channels_l1': 57, 'left_wall_dist_pool_size_l1': 2, 'left_wall_dist_fc_hidden': 120, 'track_width_num_layers': 5, 'track_width_activation': 'elu', 'track_width_out_channels_l0': 93, 'track_width_pool_size_l0': 8, 'track_width_out_channels_l1': 81, 'track_width_pool_size_l1': 4, 'track_width_out_channels_l2': 75, 'track_width_pool_size_l2': 4, 'track_width_out_channels_l3': 200, 'track_width_pool_size_l3': 2, 'track_width_fc_hidden': 36, 'heading_error_num_layers': 4, 'heading_error_activation': 'elu', 'heading_error_out_channels_l0': 44, 'heading_error_pool_size_l0': 2, 'heading_error_out_channels_l1': 34, 'heading_error_pool_size_l1': 4, 'heading_error_out_channels_l2': 175, 'heading_error_pool_size_l2': 4, 'heading_error_out_channels_l3': 110, 'heading_error_pool_size_l3': 4, 'heading_error_fc_hidden': 62}. Best is trial 58 with value: 0.0986.
[rank: 0] Seed set to 42
GPU available: True (cuda), used: True
TPU available: False, using: 0 TPU cores
💡 Tip: For seamless cloud logging and experiment tracking, try installing [litlogger](https://pypi.org/project/litlogger/) to enable LitLogger, which logs metrics and artifacts automatically to the Lightning Experiments platform.
[rank: 0] Seed set to 42
GPU available: True (cuda), used: True
TPU available: False, using: 0 TPU cores
💡 Tip: For seamless cloud logging and experiment tracking, try installing [litlogger](https://pypi.org/project/litlogger/) to enable LitLogger, which logs metrics and artifacts automatically to the Lightning Experiments platform.
[rank: 0] Seed set to 42
GPU available: True (cuda), used: True
TPU available: False, using: 0 TPU cores
💡 Tip: For seamless cloud logging and experiment tracking, try installing [litlogger](https://pypi.org/project/litlogger/) to enable LitLogger, which logs metrics and artifacts automatically to the Lightning Experiments platform.
LOCAL_RANK: 0 - CUDA_VISIBLE_DEVICES: [0]
LOCAL_RANK: 0 - CUDA_VISIBLE_DEVICES: [0]
LOCAL_RANK: 0 - CUDA_VISIBLE_DEVICES: [0]
SLURM auto-requeueing enabled. Setting signal handlers.
SLURM auto-requeueing enabled. Setting signal handlers.
SLURM auto-requeueing enabled. Setting signal handlers.
`Trainer.fit` stopped: `max_epochs=20` reached.
`Trainer.fit` stopped: `max_epochs=20` reached.
`Trainer.fit` stopped: `max_epochs=20` reached.
[I 2026-04-12 17:22:05,367] Trial 112 finished with value: 0.1248 and parameters: {'left_wall_dist_num_layers': 2, 'left_wall_dist_activation': 'elu', 'left_wall_dist_out_channels_l0': 79, 'left_wall_dist_pool_size_l0': 4, 'left_wall_dist_out_channels_l1': 108, 'left_wall_dist_pool_size_l1': 2, 'track_width_num_layers': 5, 'track_width_activation': 'elu', 'track_width_out_channels_l0': 104, 'track_width_pool_size_l0': 8, 'track_width_out_channels_l1': 80, 'track_width_pool_size_l1': 4, 'track_width_out_channels_l2': 87, 'track_width_pool_size_l2': 4, 'track_width_out_channels_l3': 186, 'track_width_pool_size_l3': 2, 'track_width_fc_hidden': 36, 'heading_error_num_layers': 4, 'heading_error_activation': 'elu', 'heading_error_out_channels_l0': 44, 'heading_error_pool_size_l0': 2, 'heading_error_out_channels_l1': 35, 'heading_error_pool_size_l1': 4, 'heading_error_out_channels_l2': 172, 'heading_error_pool_size_l2': 4, 'heading_error_out_channels_l3': 111, 'heading_error_pool_size_l3': 4, 'heading_error_fc_hidden': 66}. Best is trial 58 with value: 0.0986.
[rank: 0] Seed set to 42
[rank: 0] Seed set to 42
[rank: 0] Seed set to 42
GPU available: True (cuda), used: True
TPU available: False, using: 0 TPU cores
💡 Tip: For seamless cloud logging and experiment tracking, try installing [litlogger](https://pypi.org/project/litlogger/) to enable LitLogger, which logs metrics and artifacts automatically to the Lightning Experiments platform.
GPU available: True (cuda), used: True
TPU available: False, using: 0 TPU cores
💡 Tip: For seamless cloud logging and experiment tracking, try installing [litlogger](https://pypi.org/project/litlogger/) to enable LitLogger, which logs metrics and artifacts automatically to the Lightning Experiments platform.
GPU available: True (cuda), used: True
TPU available: False, using: 0 TPU cores
💡 Tip: For seamless cloud logging and experiment tracking, try installing [litlogger](https://pypi.org/project/litlogger/) to enable LitLogger, which logs metrics and artifacts automatically to the Lightning Experiments platform.
LOCAL_RANK: 0 - CUDA_VISIBLE_DEVICES: [0]
LOCAL_RANK: 0 - CUDA_VISIBLE_DEVICES: [0]
LOCAL_RANK: 0 - CUDA_VISIBLE_DEVICES: [0]
SLURM auto-requeueing enabled. Setting signal handlers.
SLURM auto-requeueing enabled. Setting signal handlers.
SLURM auto-requeueing enabled. Setting signal handlers.
`Trainer.fit` stopped: `max_epochs=20` reached.
`Trainer.fit` stopped: `max_epochs=20` reached.
`Trainer.fit` stopped: `max_epochs=20` reached.
[I 2026-04-12 17:24:12,909] Trial 113 finished with value: 0.109 and parameters: {'left_wall_dist_num_layers': 2, 'left_wall_dist_activation': 'elu', 'left_wall_dist_out_channels_l0': 64, 'left_wall_dist_pool_size_l0': 4, 'left_wall_dist_out_channels_l1': 52, 'left_wall_dist_pool_size_l1': 2, 'left_wall_dist_fc_hidden': 120, 'track_width_num_layers': 5, 'track_width_activation': 'elu', 'track_width_out_channels_l0': 98, 'track_width_pool_size_l0': 8, 'track_width_out_channels_l1': 92, 'track_width_pool_size_l1': 4, 'track_width_out_channels_l2': 82, 'track_width_pool_size_l2': 4, 'track_width_out_channels_l3': 204, 'track_width_pool_size_l3': 2, 'track_width_fc_hidden': 37, 'heading_error_num_layers': 4, 'heading_error_activation': 'elu', 'heading_error_out_channels_l0': 39, 'heading_error_pool_size_l0': 2, 'heading_error_out_channels_l1': 39, 'heading_error_pool_size_l1': 4, 'heading_error_out_channels_l2': 222, 'heading_error_pool_size_l2': 4, 'heading_error_out_channels_l3': 104, 'heading_error_pool_size_l3': 4, 'heading_error_fc_hidden': 58}. Best is trial 58 with value: 0.0986.
[rank: 0] Seed set to 42
[rank: 0] Seed set to 42
[rank: 0] Seed set to 42
GPU available: True (cuda), used: True
GPU available: True (cuda), used: True
TPU available: False, using: 0 TPU cores
TPU available: False, using: 0 TPU cores
💡 Tip: For seamless cloud logging and experiment tracking, try installing [litlogger](https://pypi.org/project/litlogger/) to enable LitLogger, which logs metrics and artifacts automatically to the Lightning Experiments platform.
💡 Tip: For seamless cloud logging and experiment tracking, try installing [litlogger](https://pypi.org/project/litlogger/) to enable LitLogger, which logs metrics and artifacts automatically to the Lightning Experiments platform.
GPU available: True (cuda), used: True
TPU available: False, using: 0 TPU cores
💡 Tip: For seamless cloud logging and experiment tracking, try installing [litlogger](https://pypi.org/project/litlogger/) to enable LitLogger, which logs metrics and artifacts automatically to the Lightning Experiments platform.
LOCAL_RANK: 0 - CUDA_VISIBLE_DEVICES: [0]
LOCAL_RANK: 0 - CUDA_VISIBLE_DEVICES: [0]
LOCAL_RANK: 0 - CUDA_VISIBLE_DEVICES: [0]
SLURM auto-requeueing enabled. Setting signal handlers.
SLURM auto-requeueing enabled. Setting signal handlers.
SLURM auto-requeueing enabled. Setting signal handlers.
`Trainer.fit` stopped: `max_epochs=20` reached.
`Trainer.fit` stopped: `max_epochs=20` reached.
`Trainer.fit` stopped: `max_epochs=20` reached.
[I 2026-04-12 17:26:22,132] Trial 114 finished with value: 0.1094 and parameters: {'left_wall_dist_num_layers': 2, 'left_wall_dist_activation': 'elu', 'left_wall_dist_out_channels_l0': 64, 'left_wall_dist_pool_size_l0': 4, 'left_wall_dist_out_channels_l1': 82, 'left_wall_dist_pool_size_l1': 2, 'track_width_num_layers': 5, 'track_width_activation': 'elu', 'track_width_out_channels_l0': 115, 'track_width_pool_size_l0': 8, 'track_width_out_channels_l1': 93, 'track_width_pool_size_l1': 4, 'track_width_out_channels_l2': 81, 'track_width_pool_size_l2': 4, 'track_width_out_channels_l3': 206, 'track_width_pool_size_l3': 2, 'track_width_fc_hidden': 37, 'heading_error_num_layers': 4, 'heading_error_activation': 'elu', 'heading_error_out_channels_l0': 41, 'heading_error_pool_size_l0': 2, 'heading_error_out_channels_l1': 32, 'heading_error_pool_size_l1': 4, 'heading_error_out_channels_l2': 238, 'heading_error_pool_size_l2': 4, 'heading_error_out_channels_l3': 124, 'heading_error_pool_size_l3': 4, 'heading_error_fc_hidden': 58}. Best is trial 58 with value: 0.0986.
[rank: 0] Seed set to 42
[rank: 0] Seed set to 42
[rank: 0] Seed set to 42
GPU available: True (cuda), used: True
TPU available: False, using: 0 TPU cores
💡 Tip: For seamless cloud logging and experiment tracking, try installing [litlogger](https://pypi.org/project/litlogger/) to enable LitLogger, which logs metrics and artifacts automatically to the Lightning Experiments platform.
GPU available: True (cuda), used: True
TPU available: False, using: 0 TPU cores
💡 Tip: For seamless cloud logging and experiment tracking, try installing [litlogger](https://pypi.org/project/litlogger/) to enable LitLogger, which logs metrics and artifacts automatically to the Lightning Experiments platform.
GPU available: True (cuda), used: True
TPU available: False, using: 0 TPU cores
💡 Tip: For seamless cloud logging and experiment tracking, try installing [litlogger](https://pypi.org/project/litlogger/) to enable LitLogger, which logs metrics and artifacts automatically to the Lightning Experiments platform.
LOCAL_RANK: 0 - CUDA_VISIBLE_DEVICES: [0]
LOCAL_RANK: 0 - CUDA_VISIBLE_DEVICES: [0]
LOCAL_RANK: 0 - CUDA_VISIBLE_DEVICES: [0]
SLURM auto-requeueing enabled. Setting signal handlers.
SLURM auto-requeueing enabled. Setting signal handlers.
SLURM auto-requeueing enabled. Setting signal handlers.
`Trainer.fit` stopped: `max_epochs=20` reached.
`Trainer.fit` stopped: `max_epochs=20` reached.
`Trainer.fit` stopped: `max_epochs=20` reached.
[I 2026-04-12 17:28:34,580] Trial 115 finished with value: 0.1409 and parameters: {'left_wall_dist_num_layers': 2, 'left_wall_dist_activation': 'elu', 'left_wall_dist_out_channels_l0': 88, 'left_wall_dist_pool_size_l0': 4, 'left_wall_dist_out_channels_l1': 145, 'left_wall_dist_pool_size_l1': 2, 'track_width_num_layers': 5, 'track_width_activation': 'elu', 'track_width_out_channels_l0': 97, 'track_width_pool_size_l0': 8, 'track_width_out_channels_l1': 92, 'track_width_pool_size_l1': 4, 'track_width_out_channels_l2': 80, 'track_width_pool_size_l2': 4, 'track_width_out_channels_l3': 208, 'track_width_pool_size_l3': 2, 'track_width_fc_hidden': 37, 'heading_error_num_layers': 4, 'heading_error_activation': 'elu', 'heading_error_out_channels_l0': 40, 'heading_error_pool_size_l0': 2, 'heading_error_out_channels_l1': 32, 'heading_error_pool_size_l1': 4, 'heading_error_out_channels_l2': 237, 'heading_error_pool_size_l2': 4, 'heading_error_out_channels_l3': 129, 'heading_error_pool_size_l3': 4, 'heading_error_fc_hidden': 57}. Best is trial 58 with value: 0.0986.
[rank: 0] Seed set to 42
[rank: 0] Seed set to 42
GPU available: True (cuda), used: True
TPU available: False, using: 0 TPU cores
💡 Tip: For seamless cloud logging and experiment tracking, try installing [litlogger](https://pypi.org/project/litlogger/) to enable LitLogger, which logs metrics and artifacts automatically to the Lightning Experiments platform.
GPU available: True (cuda), used: True
TPU available: False, using: 0 TPU cores
💡 Tip: For seamless cloud logging and experiment tracking, try installing [litlogger](https://pypi.org/project/litlogger/) to enable LitLogger, which logs metrics and artifacts automatically to the Lightning Experiments platform.
[rank: 0] Seed set to 42
GPU available: True (cuda), used: True
TPU available: False, using: 0 TPU cores
💡 Tip: For seamless cloud logging and experiment tracking, try installing [litlogger](https://pypi.org/project/litlogger/) to enable LitLogger, which logs metrics and artifacts automatically to the Lightning Experiments platform.
LOCAL_RANK: 0 - CUDA_VISIBLE_DEVICES: [0]
LOCAL_RANK: 0 - CUDA_VISIBLE_DEVICES: [0]
LOCAL_RANK: 0 - CUDA_VISIBLE_DEVICES: [0]
SLURM auto-requeueing enabled. Setting signal handlers.
SLURM auto-requeueing enabled. Setting signal handlers.
SLURM auto-requeueing enabled. Setting signal handlers.
`Trainer.fit` stopped: `max_epochs=20` reached.
`Trainer.fit` stopped: `max_epochs=20` reached.
`Trainer.fit` stopped: `max_epochs=20` reached.
