[I 2026-04-12 17:30:47,726] Trial 116 finished with value: 0.1391 and parameters: {'left_wall_dist_num_layers': 2, 'left_wall_dist_activation': 'elu', 'left_wall_dist_out_channels_l0': 63, 'left_wall_dist_pool_size_l0': 4, 'left_wall_dist_out_channels_l1': 100, 'left_wall_dist_pool_size_l1': 2, 'track_width_num_layers': 5, 'track_width_activation': 'elu', 'track_width_out_channels_l0': 113, 'track_width_pool_size_l0': 4, 'track_width_out_channels_l1': 99, 'track_width_pool_size_l1': 4, 'track_width_out_channels_l2': 82, 'track_width_pool_size_l2': 4, 'track_width_out_channels_l3': 200, 'track_width_pool_size_l3': 2, 'track_width_out_channels_l4': 247, 'track_width_pool_size_l4': 4, 'track_width_fc_hidden': 37, 'heading_error_num_layers': 4, 'heading_error_activation': 'elu', 'heading_error_out_channels_l0': 36, 'heading_error_pool_size_l0': 2, 'heading_error_out_channels_l1': 32, 'heading_error_pool_size_l1': 4, 'heading_error_out_channels_l2': 227, 'heading_error_pool_size_l2': 4, 'heading_error_out_channels_l3': 153, 'heading_error_pool_size_l3': 4, 'heading_error_fc_hidden': 55}. Best is trial 58 with value: 0.0986.
[rank: 0] Seed set to 42
[rank: 0] Seed set to 42
GPU available: True (cuda), used: True
TPU available: False, using: 0 TPU cores
💡 Tip: For seamless cloud logging and experiment tracking, try installing [litlogger](https://pypi.org/project/litlogger/) to enable LitLogger, which logs metrics and artifacts automatically to the Lightning Experiments platform.
GPU available: True (cuda), used: True
TPU available: False, using: 0 TPU cores
💡 Tip: For seamless cloud logging and experiment tracking, try installing [litlogger](https://pypi.org/project/litlogger/) to enable LitLogger, which logs metrics and artifacts automatically to the Lightning Experiments platform.
[rank: 0] Seed set to 42
GPU available: True (cuda), used: True
TPU available: False, using: 0 TPU cores
💡 Tip: For seamless cloud logging and experiment tracking, try installing [litlogger](https://pypi.org/project/litlogger/) to enable LitLogger, which logs metrics and artifacts automatically to the Lightning Experiments platform.
LOCAL_RANK: 0 - CUDA_VISIBLE_DEVICES: [0]
LOCAL_RANK: 0 - CUDA_VISIBLE_DEVICES: [0]
LOCAL_RANK: 0 - CUDA_VISIBLE_DEVICES: [0]
SLURM auto-requeueing enabled. Setting signal handlers.
SLURM auto-requeueing enabled. Setting signal handlers.
SLURM auto-requeueing enabled. Setting signal handlers.
`Trainer.fit` stopped: `max_epochs=20` reached.
`Trainer.fit` stopped: `max_epochs=20` reached.
`Trainer.fit` stopped: `max_epochs=20` reached.
[I 2026-04-12 17:32:56,547] Trial 117 finished with value: 0.1139 and parameters: {'left_wall_dist_num_layers': 2, 'left_wall_dist_activation': 'elu', 'left_wall_dist_out_channels_l0': 77, 'left_wall_dist_pool_size_l0': 4, 'left_wall_dist_out_channels_l1': 129, 'left_wall_dist_pool_size_l1': 2, 'track_width_num_layers': 5, 'track_width_activation': 'elu', 'track_width_out_channels_l0': 124, 'track_width_pool_size_l0': 8, 'track_width_out_channels_l1': 107, 'track_width_pool_size_l1': 4, 'track_width_out_channels_l2': 58, 'track_width_pool_size_l2': 4, 'track_width_out_channels_l3': 234, 'track_width_pool_size_l3': 2, 'heading_error_num_layers': 4, 'heading_error_activation': 'elu', 'heading_error_out_channels_l0': 48, 'heading_error_pool_size_l0': 2, 'heading_error_out_channels_l1': 39, 'heading_error_pool_size_l1': 4, 'heading_error_out_channels_l2': 194, 'heading_error_pool_size_l2': 4, 'heading_error_out_channels_l3': 176, 'heading_error_pool_size_l3': 4, 'heading_error_fc_hidden': 48}. Best is trial 58 with value: 0.0986.
[rank: 0] Seed set to 42
[rank: 0] Seed set to 42
[rank: 0] Seed set to 42
GPU available: True (cuda), used: True
TPU available: False, using: 0 TPU cores
💡 Tip: For seamless cloud logging and experiment tracking, try installing [litlogger](https://pypi.org/project/litlogger/) to enable LitLogger, which logs metrics and artifacts automatically to the Lightning Experiments platform.
GPU available: True (cuda), used: True
TPU available: False, using: 0 TPU cores
💡 Tip: For seamless cloud logging and experiment tracking, try installing [litlogger](https://pypi.org/project/litlogger/) to enable LitLogger, which logs metrics and artifacts automatically to the Lightning Experiments platform.
GPU available: True (cuda), used: True
TPU available: False, using: 0 TPU cores
💡 Tip: For seamless cloud logging and experiment tracking, try installing [litlogger](https://pypi.org/project/litlogger/) to enable LitLogger, which logs metrics and artifacts automatically to the Lightning Experiments platform.
LOCAL_RANK: 0 - CUDA_VISIBLE_DEVICES: [0]
LOCAL_RANK: 0 - CUDA_VISIBLE_DEVICES: [0]
LOCAL_RANK: 0 - CUDA_VISIBLE_DEVICES: [0]
SLURM auto-requeueing enabled. Setting signal handlers.
SLURM auto-requeueing enabled. Setting signal handlers.
SLURM auto-requeueing enabled. Setting signal handlers.
`Trainer.fit` stopped: `max_epochs=20` reached.
`Trainer.fit` stopped: `max_epochs=20` reached.
`Trainer.fit` stopped: `max_epochs=20` reached.
[I 2026-04-12 17:35:05,070] Trial 118 finished with value: 0.0995 and parameters: {'left_wall_dist_num_layers': 2, 'left_wall_dist_activation': 'elu', 'left_wall_dist_out_channels_l0': 67, 'left_wall_dist_pool_size_l0': 4, 'left_wall_dist_out_channels_l1': 51, 'left_wall_dist_pool_size_l1': 2, 'left_wall_dist_fc_hidden': 118, 'track_width_num_layers': 5, 'track_width_activation': 'elu', 'track_width_out_channels_l0': 105, 'track_width_pool_size_l0': 8, 'track_width_out_channels_l1': 85, 'track_width_pool_size_l1': 4, 'track_width_out_channels_l2': 104, 'track_width_pool_size_l2': 4, 'track_width_out_channels_l3': 221, 'track_width_pool_size_l3': 2, 'track_width_fc_hidden': 34, 'heading_error_num_layers': 4, 'heading_error_activation': 'elu', 'heading_error_out_channels_l0': 41, 'heading_error_pool_size_l0': 2, 'heading_error_out_channels_l1': 33, 'heading_error_pool_size_l1': 4, 'heading_error_out_channels_l2': 220, 'heading_error_pool_size_l2': 4, 'heading_error_out_channels_l3': 101, 'heading_error_pool_size_l3': 4, 'heading_error_fc_hidden': 71}. Best is trial 58 with value: 0.0986.
[rank: 0] Seed set to 42
[rank: 0] Seed set to 42
GPU available: True (cuda), used: True
TPU available: False, using: 0 TPU cores
💡 Tip: For seamless cloud logging and experiment tracking, try installing [litlogger](https://pypi.org/project/litlogger/) to enable LitLogger, which logs metrics and artifacts automatically to the Lightning Experiments platform.
GPU available: True (cuda), used: True
TPU available: False, using: 0 TPU cores
💡 Tip: For seamless cloud logging and experiment tracking, try installing [litlogger](https://pypi.org/project/litlogger/) to enable LitLogger, which logs metrics and artifacts automatically to the Lightning Experiments platform.
[rank: 0] Seed set to 42
GPU available: True (cuda), used: True
TPU available: False, using: 0 TPU cores
💡 Tip: For seamless cloud logging and experiment tracking, try installing [litlogger](https://pypi.org/project/litlogger/) to enable LitLogger, which logs metrics and artifacts automatically to the Lightning Experiments platform.
LOCAL_RANK: 0 - CUDA_VISIBLE_DEVICES: [0]
LOCAL_RANK: 0 - CUDA_VISIBLE_DEVICES: [0]
LOCAL_RANK: 0 - CUDA_VISIBLE_DEVICES: [0]
SLURM auto-requeueing enabled. Setting signal handlers.
SLURM auto-requeueing enabled. Setting signal handlers.
SLURM auto-requeueing enabled. Setting signal handlers.
`Trainer.fit` stopped: `max_epochs=20` reached.
`Trainer.fit` stopped: `max_epochs=20` reached.
`Trainer.fit` stopped: `max_epochs=20` reached.
[I 2026-04-12 17:37:15,939] Trial 119 finished with value: 0.097 and parameters: {'left_wall_dist_num_layers': 2, 'left_wall_dist_activation': 'elu', 'left_wall_dist_out_channels_l0': 82, 'left_wall_dist_pool_size_l0': 4, 'left_wall_dist_out_channels_l1': 43, 'left_wall_dist_pool_size_l1': 2, 'left_wall_dist_fc_hidden': 118, 'track_width_num_layers': 5, 'track_width_activation': 'elu', 'track_width_out_channels_l0': 118, 'track_width_pool_size_l0': 8, 'track_width_out_channels_l1': 87, 'track_width_pool_size_l1': 4, 'track_width_out_channels_l2': 107, 'track_width_pool_size_l2': 4, 'track_width_out_channels_l3': 182, 'track_width_pool_size_l3': 2, 'track_width_fc_hidden': 34, 'heading_error_num_layers': 4, 'heading_error_activation': 'elu', 'heading_error_out_channels_l0': 41, 'heading_error_pool_size_l0': 2, 'heading_error_out_channels_l1': 35, 'heading_error_pool_size_l1': 4, 'heading_error_out_channels_l2': 209, 'heading_error_pool_size_l2': 4, 'heading_error_out_channels_l3': 101, 'heading_error_pool_size_l3': 4, 'heading_error_fc_hidden': 70}. Best is trial 119 with value: 0.097.
