[I 2026-04-12 15:57:18,979] Trial 63 finished with value: 0.112 and parameters: {'left_wall_dist_num_layers': 2, 'left_wall_dist_activation': 'relu', 'left_wall_dist_out_channels_l0': 215, 'left_wall_dist_pool_size_l0': 4, 'left_wall_dist_out_channels_l1': 39, 'left_wall_dist_pool_size_l1': 8, 'left_wall_dist_fc_hidden': 40, 'track_width_num_layers': 3, 'track_width_activation': 'elu', 'track_width_out_channels_l0': 120, 'track_width_pool_size_l0': 2, 'track_width_out_channels_l1': 100, 'track_width_pool_size_l1': 8, 'track_width_out_channels_l2': 117, 'track_width_pool_size_l2': 4, 'track_width_fc_hidden': 33, 'heading_error_num_layers': 5, 'heading_error_activation': 'elu', 'heading_error_out_channels_l0': 34, 'heading_error_pool_size_l0': 2, 'heading_error_out_channels_l1': 36, 'heading_error_pool_size_l1': 2, 'heading_error_out_channels_l2': 241, 'heading_error_pool_size_l2': 4, 'heading_error_out_channels_l3': 157, 'heading_error_pool_size_l3': 2, 'heading_error_out_channels_l4': 32, 'heading_error_pool_size_l4': 2, 'heading_error_fc_hidden': 64}. Best is trial 42 with value: 0.1068.
[rank: 0] Seed set to 42
[rank: 0] Seed set to 42
GPU available: True (cuda), used: True
TPU available: False, using: 0 TPU cores
💡 Tip: For seamless cloud logging and experiment tracking, try installing [litlogger](https://pypi.org/project/litlogger/) to enable LitLogger, which logs metrics and artifacts automatically to the Lightning Experiments platform.
GPU available: True (cuda), used: True
TPU available: False, using: 0 TPU cores
💡 Tip: For seamless cloud logging and experiment tracking, try installing [litlogger](https://pypi.org/project/litlogger/) to enable LitLogger, which logs metrics and artifacts automatically to the Lightning Experiments platform.
[rank: 0] Seed set to 42
GPU available: True (cuda), used: True
TPU available: False, using: 0 TPU cores
💡 Tip: For seamless cloud logging and experiment tracking, try installing [litlogger](https://pypi.org/project/litlogger/) to enable LitLogger, which logs metrics and artifacts automatically to the Lightning Experiments platform.
LOCAL_RANK: 0 - CUDA_VISIBLE_DEVICES: [0]
LOCAL_RANK: 0 - CUDA_VISIBLE_DEVICES: [0]
LOCAL_RANK: 0 - CUDA_VISIBLE_DEVICES: [0]
SLURM auto-requeueing enabled. Setting signal handlers.
SLURM auto-requeueing enabled. Setting signal handlers.
SLURM auto-requeueing enabled. Setting signal handlers.
`Trainer.fit` stopped: `max_epochs=20` reached.
`Trainer.fit` stopped: `max_epochs=20` reached.
`Trainer.fit` stopped: `max_epochs=20` reached.
[I 2026-04-12 15:59:34,323] Trial 64 finished with value: 0.1399 and parameters: {'left_wall_dist_num_layers': 2, 'left_wall_dist_activation': 'relu', 'left_wall_dist_out_channels_l0': 215, 'left_wall_dist_pool_size_l0': 4, 'left_wall_dist_out_channels_l1': 40, 'left_wall_dist_pool_size_l1': 8, 'left_wall_dist_fc_hidden': 41, 'track_width_num_layers': 3, 'track_width_activation': 'elu', 'track_width_out_channels_l0': 122, 'track_width_pool_size_l0': 2, 'track_width_out_channels_l1': 103, 'track_width_pool_size_l1': 8, 'track_width_out_channels_l2': 117, 'track_width_pool_size_l2': 4, 'track_width_fc_hidden': 41, 'heading_error_num_layers': 5, 'heading_error_activation': 'elu', 'heading_error_out_channels_l0': 36, 'heading_error_pool_size_l0': 2, 'heading_error_out_channels_l1': 39, 'heading_error_pool_size_l1': 2, 'heading_error_out_channels_l2': 242, 'heading_error_pool_size_l2': 4, 'heading_error_out_channels_l3': 152, 'heading_error_pool_size_l3': 2, 'heading_error_out_channels_l4': 36, 'heading_error_pool_size_l4': 2, 'heading_error_fc_hidden': 64}. Best is trial 42 with value: 0.1068.
[rank: 0] Seed set to 42
[rank: 0] Seed set to 42
[rank: 0] Seed set to 42
GPU available: True (cuda), used: True
TPU available: False, using: 0 TPU cores
💡 Tip: For seamless cloud logging and experiment tracking, try installing [litlogger](https://pypi.org/project/litlogger/) to enable LitLogger, which logs metrics and artifacts automatically to the Lightning Experiments platform.
GPU available: True (cuda), used: True
TPU available: False, using: 0 TPU cores
💡 Tip: For seamless cloud logging and experiment tracking, try installing [litlogger](https://pypi.org/project/litlogger/) to enable LitLogger, which logs metrics and artifacts automatically to the Lightning Experiments platform.
GPU available: True (cuda), used: True
TPU available: False, using: 0 TPU cores
💡 Tip: For seamless cloud logging and experiment tracking, try installing [litlogger](https://pypi.org/project/litlogger/) to enable LitLogger, which logs metrics and artifacts automatically to the Lightning Experiments platform.
LOCAL_RANK: 0 - CUDA_VISIBLE_DEVICES: [0]
LOCAL_RANK: 0 - CUDA_VISIBLE_DEVICES: [0]
LOCAL_RANK: 0 - CUDA_VISIBLE_DEVICES: [0]
SLURM auto-requeueing enabled. Setting signal handlers.
SLURM auto-requeueing enabled. Setting signal handlers.
SLURM auto-requeueing enabled. Setting signal handlers.
`Trainer.fit` stopped: `max_epochs=20` reached.
`Trainer.fit` stopped: `max_epochs=20` reached.
`Trainer.fit` stopped: `max_epochs=20` reached.
[I 2026-04-12 16:01:56,788] Trial 65 finished with value: 0.1476 and parameters: {'left_wall_dist_num_layers': 2, 'left_wall_dist_activation': 'relu', 'left_wall_dist_out_channels_l0': 156, 'left_wall_dist_pool_size_l0': 4, 'left_wall_dist_out_channels_l1': 37, 'left_wall_dist_pool_size_l1': 8, 'left_wall_dist_fc_hidden': 66, 'track_width_num_layers': 3, 'track_width_activation': 'elu', 'track_width_out_channels_l0': 111, 'track_width_pool_size_l0': 2, 'track_width_out_channels_l1': 85, 'track_width_pool_size_l1': 8, 'track_width_out_channels_l2': 128, 'track_width_pool_size_l2': 4, 'track_width_fc_hidden': 37, 'heading_error_num_layers': 5, 'heading_error_activation': 'elu', 'heading_error_out_channels_l0': 42, 'heading_error_pool_size_l0': 2, 'heading_error_out_channels_l1': 35, 'heading_error_pool_size_l1': 2, 'heading_error_out_channels_l2': 253, 'heading_error_pool_size_l2': 4, 'heading_error_out_channels_l3': 142, 'heading_error_pool_size_l3': 2, 'heading_error_out_channels_l4': 35, 'heading_error_pool_size_l4': 8}. Best is trial 42 with value: 0.1068.
[rank: 0] Seed set to 42
[rank: 0] Seed set to 42
[rank: 0] Seed set to 42
GPU available: True (cuda), used: True
TPU available: False, using: 0 TPU cores
💡 Tip: For seamless cloud logging and experiment tracking, try installing [litlogger](https://pypi.org/project/litlogger/) to enable LitLogger, which logs metrics and artifacts automatically to the Lightning Experiments platform.
GPU available: True (cuda), used: True
TPU available: False, using: 0 TPU cores
💡 Tip: For seamless cloud logging and experiment tracking, try installing [litlogger](https://pypi.org/project/litlogger/) to enable LitLogger, which logs metrics and artifacts automatically to the Lightning Experiments platform.
GPU available: True (cuda), used: True
TPU available: False, using: 0 TPU cores
💡 Tip: For seamless cloud logging and experiment tracking, try installing [litlogger](https://pypi.org/project/litlogger/) to enable LitLogger, which logs metrics and artifacts automatically to the Lightning Experiments platform.
LOCAL_RANK: 0 - CUDA_VISIBLE_DEVICES: [0]
LOCAL_RANK: 0 - CUDA_VISIBLE_DEVICES: [0]
LOCAL_RANK: 0 - CUDA_VISIBLE_DEVICES: [0]
SLURM auto-requeueing enabled. Setting signal handlers.
SLURM auto-requeueing enabled. Setting signal handlers.
SLURM auto-requeueing enabled. Setting signal handlers.
`Trainer.fit` stopped: `max_epochs=20` reached.
`Trainer.fit` stopped: `max_epochs=20` reached.
`Trainer.fit` stopped: `max_epochs=20` reached.
[I 2026-04-12 16:04:06,623] Trial 66 finished with value: 0.172 and parameters: {'left_wall_dist_num_layers': 2, 'left_wall_dist_activation': 'relu', 'left_wall_dist_out_channels_l0': 185, 'left_wall_dist_pool_size_l0': 4, 'left_wall_dist_out_channels_l1': 46, 'left_wall_dist_pool_size_l1': 8, 'left_wall_dist_fc_hidden': 40, 'track_width_num_layers': 2, 'track_width_activation': 'elu', 'track_width_out_channels_l0': 33, 'track_width_pool_size_l0': 2, 'track_width_out_channels_l1': 79, 'track_width_pool_size_l1': 8, 'track_width_fc_hidden': 99, 'heading_error_num_layers': 5, 'heading_error_activation': 'elu', 'heading_error_out_channels_l0': 32, 'heading_error_pool_size_l0': 2, 'heading_error_out_channels_l1': 37, 'heading_error_pool_size_l1': 2, 'heading_error_out_channels_l2': 166, 'heading_error_pool_size_l2': 2, 'heading_error_out_channels_l3': 100, 'heading_error_pool_size_l3': 2, 'heading_error_out_channels_l4': 32, 'heading_error_pool_size_l4': 2, 'heading_error_fc_hidden': 57}. Best is trial 42 with value: 0.1068.
[rank: 0] Seed set to 42
[rank: 0] Seed set to 42
[rank: 0] Seed set to 42
GPU available: True (cuda), used: True
TPU available: False, using: 0 TPU cores
💡 Tip: For seamless cloud logging and experiment tracking, try installing [litlogger](https://pypi.org/project/litlogger/) to enable LitLogger, which logs metrics and artifacts automatically to the Lightning Experiments platform.
GPU available: True (cuda), used: True
TPU available: False, using: 0 TPU cores
💡 Tip: For seamless cloud logging and experiment tracking, try installing [litlogger](https://pypi.org/project/litlogger/) to enable LitLogger, which logs metrics and artifacts automatically to the Lightning Experiments platform.
GPU available: True (cuda), used: True
TPU available: False, using: 0 TPU cores
💡 Tip: For seamless cloud logging and experiment tracking, try installing [litlogger](https://pypi.org/project/litlogger/) to enable LitLogger, which logs metrics and artifacts automatically to the Lightning Experiments platform.
LOCAL_RANK: 0 - CUDA_VISIBLE_DEVICES: [0]
LOCAL_RANK: 0 - CUDA_VISIBLE_DEVICES: [0]
LOCAL_RANK: 0 - CUDA_VISIBLE_DEVICES: [0]
SLURM auto-requeueing enabled. Setting signal handlers.
SLURM auto-requeueing enabled. Setting signal handlers.
SLURM auto-requeueing enabled. Setting signal handlers.
`Trainer.fit` stopped: `max_epochs=20` reached.
`Trainer.fit` stopped: `max_epochs=20` reached.
`Trainer.fit` stopped: `max_epochs=20` reached.
[I 2026-04-12 16:06:40,819] Trial 67 finished with value: 0.2516 and parameters: {'left_wall_dist_num_layers': 2, 'left_wall_dist_activation': 'relu', 'left_wall_dist_out_channels_l0': 52, 'left_wall_dist_pool_size_l0': 4, 'left_wall_dist_out_channels_l1': 114, 'left_wall_dist_pool_size_l1': 2, 'track_width_num_layers': 3, 'track_width_activation': 'elu', 'track_width_out_channels_l0': 174, 'track_width_pool_size_l0': 8, 'track_width_out_channels_l1': 98, 'track_width_pool_size_l1': 2, 'track_width_out_channels_l2': 101, 'track_width_pool_size_l2': 4, 'track_width_fc_hidden': 35, 'heading_error_num_layers': 5, 'heading_error_activation': 'relu', 'heading_error_out_channels_l0': 35, 'heading_error_pool_size_l0': 2, 'heading_error_out_channels_l1': 48, 'heading_error_pool_size_l1': 4, 'heading_error_out_channels_l2': 230, 'heading_error_pool_size_l2': 4, 'heading_error_out_channels_l3': 167, 'heading_error_pool_size_l3': 4, 'heading_error_out_channels_l4': 50, 'heading_error_pool_size_l4': 2, 'heading_error_fc_hidden': 59}. Best is trial 42 with value: 0.1068.
[rank: 0] Seed set to 42
[rank: 0] Seed set to 42
[rank: 0] Seed set to 42
GPU available: True (cuda), used: True
TPU available: False, using: 0 TPU cores
GPU available: True (cuda), used: True
TPU available: False, using: 0 TPU cores
GPU available: True (cuda), used: True
TPU available: False, using: 0 TPU cores
💡 Tip: For seamless cloud logging and experiment tracking, try installing [litlogger](https://pypi.org/project/litlogger/) to enable LitLogger, which logs metrics and artifacts automatically to the Lightning Experiments platform.
💡 Tip: For seamless cloud logging and experiment tracking, try installing [litlogger](https://pypi.org/project/litlogger/) to enable LitLogger, which logs metrics and artifacts automatically to the Lightning Experiments platform.
💡 Tip: For seamless cloud logging and experiment tracking, try installing [litlogger](https://pypi.org/project/litlogger/) to enable LitLogger, which logs metrics and artifacts automatically to the Lightning Experiments platform.
LOCAL_RANK: 0 - CUDA_VISIBLE_DEVICES: [0]
LOCAL_RANK: 0 - CUDA_VISIBLE_DEVICES: [0]
LOCAL_RANK: 0 - CUDA_VISIBLE_DEVICES: [0]
SLURM auto-requeueing enabled. Setting signal handlers.
SLURM auto-requeueing enabled. Setting signal handlers.
SLURM auto-requeueing enabled. Setting signal handlers.
`Trainer.fit` stopped: `max_epochs=20` reached.
`Trainer.fit` stopped: `max_epochs=20` reached.
`Trainer.fit` stopped: `max_epochs=20` reached.
[I 2026-04-12 16:08:59,699] Trial 68 finished with value: 0.1104 and parameters: {'left_wall_dist_num_layers': 2, 'left_wall_dist_activation': 'relu', 'left_wall_dist_out_channels_l0': 117, 'left_wall_dist_pool_size_l0': 4, 'left_wall_dist_out_channels_l1': 95, 'left_wall_dist_pool_size_l1': 8, 'left_wall_dist_fc_hidden': 52, 'track_width_num_layers': 5, 'track_width_activation': 'relu', 'track_width_out_channels_l0': 96, 'track_width_pool_size_l0': 2, 'track_width_out_channels_l1': 68, 'track_width_pool_size_l1': 8, 'track_width_out_channels_l2': 153, 'track_width_pool_size_l2': 4, 'track_width_out_channels_l3': 44, 'track_width_pool_size_l3': 4, 'track_width_out_channels_l4': 45, 'track_width_pool_size_l4': 8, 'heading_error_num_layers': 4, 'heading_error_activation': 'elu', 'heading_error_out_channels_l0': 39, 'heading_error_pool_size_l0': 2, 'heading_error_out_channels_l1': 42, 'heading_error_pool_size_l1': 2, 'heading_error_out_channels_l2': 194, 'heading_error_pool_size_l2': 4, 'heading_error_out_channels_l3': 59, 'heading_error_pool_size_l3': 2, 'heading_error_fc_hidden': 51}. Best is trial 42 with value: 0.1068.
[rank: 0] Seed set to 42
[rank: 0] Seed set to 42
GPU available: True (cuda), used: True
TPU available: False, using: 0 TPU cores
💡 Tip: For seamless cloud logging and experiment tracking, try installing [litlogger](https://pypi.org/project/litlogger/) to enable LitLogger, which logs metrics and artifacts automatically to the Lightning Experiments platform.
[rank: 0] Seed set to 42
GPU available: True (cuda), used: True
TPU available: False, using: 0 TPU cores
💡 Tip: For seamless cloud logging and experiment tracking, try installing [litlogger](https://pypi.org/project/litlogger/) to enable LitLogger, which logs metrics and artifacts automatically to the Lightning Experiments platform.
GPU available: True (cuda), used: True
TPU available: False, using: 0 TPU cores
💡 Tip: For seamless cloud logging and experiment tracking, try installing [litlogger](https://pypi.org/project/litlogger/) to enable LitLogger, which logs metrics and artifacts automatically to the Lightning Experiments platform.
LOCAL_RANK: 0 - CUDA_VISIBLE_DEVICES: [0]
LOCAL_RANK: 0 - CUDA_VISIBLE_DEVICES: [0]
LOCAL_RANK: 0 - CUDA_VISIBLE_DEVICES: [0]
SLURM auto-requeueing enabled. Setting signal handlers.
SLURM auto-requeueing enabled. Setting signal handlers.
SLURM auto-requeueing enabled. Setting signal handlers.
`Trainer.fit` stopped: `max_epochs=20` reached.
`Trainer.fit` stopped: `max_epochs=20` reached.
`Trainer.fit` stopped: `max_epochs=20` reached.
[I 2026-04-12 16:11:21,644] Trial 69 finished with value: 0.1991 and parameters: {'left_wall_dist_num_layers': 2, 'left_wall_dist_activation': 'relu', 'left_wall_dist_out_channels_l0': 141, 'left_wall_dist_pool_size_l0': 2, 'left_wall_dist_out_channels_l1': 100, 'left_wall_dist_pool_size_l1': 8, 'left_wall_dist_fc_hidden': 109, 'track_width_num_layers': 5, 'track_width_activation': 'relu', 'track_width_out_channels_l0': 105, 'track_width_pool_size_l0': 2, 'track_width_out_channels_l1': 62, 'track_width_pool_size_l1': 8, 'track_width_out_channels_l2': 171, 'track_width_pool_size_l2': 4, 'track_width_out_channels_l3': 43, 'track_width_pool_size_l3': 8, 'track_width_fc_hidden': 38, 'heading_error_num_layers': 4, 'heading_error_activation': 'elu', 'heading_error_out_channels_l0': 40, 'heading_error_pool_size_l0': 2, 'heading_error_out_channels_l1': 34, 'heading_error_pool_size_l1': 2, 'heading_error_out_channels_l2': 198, 'heading_error_pool_size_l2': 8, 'heading_error_out_channels_l3': 114, 'heading_error_pool_size_l3': 2, 'heading_error_fc_hidden': 50}. Best is trial 42 with value: 0.1068.
[rank: 0] Seed set to 42
[rank: 0] Seed set to 42
[rank: 0] Seed set to 42
GPU available: True (cuda), used: True
TPU available: False, using: 0 TPU cores
💡 Tip: For seamless cloud logging and experiment tracking, try installing [litlogger](https://pypi.org/project/litlogger/) to enable LitLogger, which logs metrics and artifacts automatically to the Lightning Experiments platform.
GPU available: True (cuda), used: True
TPU available: False, using: 0 TPU cores
💡 Tip: For seamless cloud logging and experiment tracking, try installing [litlogger](https://pypi.org/project/litlogger/) to enable LitLogger, which logs metrics and artifacts automatically to the Lightning Experiments platform.
GPU available: True (cuda), used: True
TPU available: False, using: 0 TPU cores
💡 Tip: For seamless cloud logging and experiment tracking, try installing [litlogger](https://pypi.org/project/litlogger/) to enable LitLogger, which logs metrics and artifacts automatically to the Lightning Experiments platform.
LOCAL_RANK: 0 - CUDA_VISIBLE_DEVICES: [0]
LOCAL_RANK: 0 - CUDA_VISIBLE_DEVICES: [0]
LOCAL_RANK: 0 - CUDA_VISIBLE_DEVICES: [0]
SLURM auto-requeueing enabled. Setting signal handlers.
SLURM auto-requeueing enabled. Setting signal handlers.
SLURM auto-requeueing enabled. Setting signal handlers.
`Trainer.fit` stopped: `max_epochs=20` reached.
`Trainer.fit` stopped: `max_epochs=20` reached.
`Trainer.fit` stopped: `max_epochs=20` reached.
[I 2026-04-12 16:13:39,086] Trial 70 finished with value: 0.1311 and parameters: {'left_wall_dist_num_layers': 2, 'left_wall_dist_activation': 'elu', 'left_wall_dist_out_channels_l0': 210, 'left_wall_dist_pool_size_l0': 4, 'left_wall_dist_out_channels_l1': 69, 'left_wall_dist_pool_size_l1': 8, 'left_wall_dist_fc_hidden': 44, 'track_width_num_layers': 5, 'track_width_activation': 'elu', 'track_width_out_channels_l0': 136, 'track_width_pool_size_l0': 2, 'track_width_out_channels_l1': 64, 'track_width_pool_size_l1': 8, 'track_width_out_channels_l2': 157, 'track_width_pool_size_l2': 4, 'track_width_out_channels_l3': 33, 'track_width_pool_size_l3': 2, 'track_width_out_channels_l4': 45, 'track_width_pool_size_l4': 8, 'track_width_fc_hidden': 40, 'heading_error_num_layers': 4, 'heading_error_activation': 'elu', 'heading_error_out_channels_l0': 37, 'heading_error_pool_size_l0': 2, 'heading_error_out_channels_l1': 42, 'heading_error_pool_size_l1': 2, 'heading_error_out_channels_l2': 44, 'heading_error_pool_size_l2': 4, 'heading_error_out_channels_l3': 129, 'heading_error_pool_size_l3': 2, 'heading_error_fc_hidden': 68}. Best is trial 42 with value: 0.1068.
[rank: 0] Seed set to 42
[rank: 0] Seed set to 42
GPU available: True (cuda), used: True
TPU available: False, using: 0 TPU cores
💡 Tip: For seamless cloud logging and experiment tracking, try installing [litlogger](https://pypi.org/project/litlogger/) to enable LitLogger, which logs metrics and artifacts automatically to the Lightning Experiments platform.
GPU available: True (cuda), used: True
TPU available: False, using: 0 TPU cores
💡 Tip: For seamless cloud logging and experiment tracking, try installing [litlogger](https://pypi.org/project/litlogger/) to enable LitLogger, which logs metrics and artifacts automatically to the Lightning Experiments platform.
[rank: 0] Seed set to 42
GPU available: True (cuda), used: True
TPU available: False, using: 0 TPU cores
💡 Tip: For seamless cloud logging and experiment tracking, try installing [litlogger](https://pypi.org/project/litlogger/) to enable LitLogger, which logs metrics and artifacts automatically to the Lightning Experiments platform.
LOCAL_RANK: 0 - CUDA_VISIBLE_DEVICES: [0]
LOCAL_RANK: 0 - CUDA_VISIBLE_DEVICES: [0]
LOCAL_RANK: 0 - CUDA_VISIBLE_DEVICES: [0]
SLURM auto-requeueing enabled. Setting signal handlers.
SLURM auto-requeueing enabled. Setting signal handlers.
SLURM auto-requeueing enabled. Setting signal handlers.
`Trainer.fit` stopped: `max_epochs=20` reached.
`Trainer.fit` stopped: `max_epochs=20` reached.
`Trainer.fit` stopped: `max_epochs=20` reached.
