[I 2026-04-15 23:30:43,502] Trial 48 finished with value: 0.1479 and parameters: {'left_wall_dist_num_layers': 2, 'left_wall_dist_activation': 'elu', 'left_wall_dist_out_channels_l0': 80, 'left_wall_dist_pool_size_l0': 4, 'left_wall_dist_out_channels_l1': 94, 'left_wall_dist_pool_size_l1': 8, 'left_wall_dist_fc_hidden': 70, 'track_width_num_layers': 5, 'track_width_activation': 'relu', 'track_width_out_channels_l0': 162, 'track_width_pool_size_l0': 8, 'track_width_out_channels_l1': 231, 'track_width_pool_size_l1': 4, 'track_width_out_channels_l2': 36, 'track_width_pool_size_l2': 2, 'track_width_out_channels_l3': 35, 'track_width_pool_size_l3': 8, 'heading_error_num_layers': 4, 'heading_error_activation': 'relu', 'heading_error_out_channels_l0': 61, 'heading_error_pool_size_l0': 2, 'heading_error_out_channels_l1': 84, 'heading_error_pool_size_l1': 4, 'heading_error_out_channels_l2': 142, 'heading_error_pool_size_l2': 4, 'heading_error_out_channels_l3': 233, 'heading_error_pool_size_l3': 2, 'heading_error_fc_hidden': 62}. Best is trial 23 with value: 0.0876.
[rank: 0] Seed set to 42
[rank: 0] Seed set to 42
[rank: 0] Seed set to 42
GPU available: True (cuda), used: True
TPU available: False, using: 0 TPU cores
💡 Tip: For seamless cloud logging and experiment tracking, try installing [litlogger](https://pypi.org/project/litlogger/) to enable LitLogger, which logs metrics and artifacts automatically to the Lightning Experiments platform.
GPU available: True (cuda), used: True
TPU available: False, using: 0 TPU cores
💡 Tip: For seamless cloud logging and experiment tracking, try installing [litlogger](https://pypi.org/project/litlogger/) to enable LitLogger, which logs metrics and artifacts automatically to the Lightning Experiments platform.
GPU available: True (cuda), used: True
TPU available: False, using: 0 TPU cores
💡 Tip: For seamless cloud logging and experiment tracking, try installing [litlogger](https://pypi.org/project/litlogger/) to enable LitLogger, which logs metrics and artifacts automatically to the Lightning Experiments platform.
LOCAL_RANK: 0 - CUDA_VISIBLE_DEVICES: [0]
LOCAL_RANK: 0 - CUDA_VISIBLE_DEVICES: [0]
LOCAL_RANK: 0 - CUDA_VISIBLE_DEVICES: [0]
SLURM auto-requeueing enabled. Setting signal handlers.
SLURM auto-requeueing enabled. Setting signal handlers.
SLURM auto-requeueing enabled. Setting signal handlers.
`Trainer.fit` stopped: `max_epochs=30` reached.
`Trainer.fit` stopped: `max_epochs=30` reached.
`Trainer.fit` stopped: `max_epochs=30` reached.
[I 2026-04-15 23:33:34,887] Trial 49 finished with value: 0.2025 and parameters: {'left_wall_dist_num_layers': 3, 'left_wall_dist_activation': 'relu', 'left_wall_dist_out_channels_l0': 93, 'left_wall_dist_pool_size_l0': 8, 'left_wall_dist_out_channels_l1': 256, 'left_wall_dist_pool_size_l1': 8, 'left_wall_dist_out_channels_l2': 76, 'left_wall_dist_pool_size_l2': 8, 'left_wall_dist_fc_hidden': 35, 'track_width_num_layers': 5, 'track_width_activation': 'relu', 'track_width_out_channels_l0': 249, 'track_width_pool_size_l0': 4, 'track_width_out_channels_l1': 255, 'track_width_pool_size_l1': 2, 'track_width_out_channels_l2': 43, 'track_width_pool_size_l2': 4, 'track_width_out_channels_l3': 48, 'track_width_pool_size_l3': 4, 'track_width_out_channels_l4': 127, 'track_width_pool_size_l4': 2, 'heading_error_num_layers': 3, 'heading_error_activation': 'elu', 'heading_error_out_channels_l0': 70, 'heading_error_pool_size_l0': 4, 'heading_error_out_channels_l1': 153, 'heading_error_pool_size_l1': 8, 'heading_error_out_channels_l2': 73, 'heading_error_pool_size_l2': 4, 'heading_error_fc_hidden': 38}. Best is trial 23 with value: 0.0876.
[rank: 0] Seed set to 42
[rank: 0] Seed set to 42
GPU available: True (cuda), used: True
TPU available: False, using: 0 TPU cores
GPU available: True (cuda), used: True
TPU available: False, using: 0 TPU cores
💡 Tip: For seamless cloud logging and experiment tracking, try installing [litlogger](https://pypi.org/project/litlogger/) to enable LitLogger, which logs metrics and artifacts automatically to the Lightning Experiments platform.
💡 Tip: For seamless cloud logging and experiment tracking, try installing [litlogger](https://pypi.org/project/litlogger/) to enable LitLogger, which logs metrics and artifacts automatically to the Lightning Experiments platform.
[rank: 0] Seed set to 42
GPU available: True (cuda), used: True
TPU available: False, using: 0 TPU cores
💡 Tip: For seamless cloud logging and experiment tracking, try installing [litlogger](https://pypi.org/project/litlogger/) to enable LitLogger, which logs metrics and artifacts automatically to the Lightning Experiments platform.
LOCAL_RANK: 0 - CUDA_VISIBLE_DEVICES: [0]
LOCAL_RANK: 0 - CUDA_VISIBLE_DEVICES: [0]
LOCAL_RANK: 0 - CUDA_VISIBLE_DEVICES: [0]
SLURM auto-requeueing enabled. Setting signal handlers.
SLURM auto-requeueing enabled. Setting signal handlers.
SLURM auto-requeueing enabled. Setting signal handlers.
`Trainer.fit` stopped: `max_epochs=30` reached.
`Trainer.fit` stopped: `max_epochs=30` reached.
`Trainer.fit` stopped: `max_epochs=30` reached.
[I 2026-04-15 23:36:06,349] Trial 50 finished with value: 0.1316 and parameters: {'left_wall_dist_num_layers': 3, 'left_wall_dist_activation': 'elu', 'left_wall_dist_out_channels_l0': 51, 'left_wall_dist_pool_size_l0': 4, 'left_wall_dist_out_channels_l1': 163, 'left_wall_dist_pool_size_l1': 4, 'left_wall_dist_out_channels_l2': 43, 'left_wall_dist_pool_size_l2': 8, 'left_wall_dist_fc_hidden': 63, 'track_width_num_layers': 5, 'track_width_activation': 'elu', 'track_width_out_channels_l0': 120, 'track_width_pool_size_l0': 8, 'track_width_out_channels_l1': 58, 'track_width_pool_size_l1': 8, 'track_width_out_channels_l2': 58, 'track_width_pool_size_l2': 2, 'track_width_out_channels_l3': 109, 'track_width_pool_size_l3': 4, 'heading_error_num_layers': 3, 'heading_error_activation': 'elu', 'heading_error_out_channels_l0': 55, 'heading_error_pool_size_l0': 4, 'heading_error_out_channels_l1': 134, 'heading_error_pool_size_l1': 2, 'heading_error_out_channels_l2': 84, 'heading_error_pool_size_l2': 2, 'heading_error_fc_hidden': 93}. Best is trial 23 with value: 0.0876.
[rank: 0] Seed set to 42
[rank: 0] Seed set to 42
[rank: 0] Seed set to 42
GPU available: True (cuda), used: True
TPU available: False, using: 0 TPU cores
💡 Tip: For seamless cloud logging and experiment tracking, try installing [litlogger](https://pypi.org/project/litlogger/) to enable LitLogger, which logs metrics and artifacts automatically to the Lightning Experiments platform.
GPU available: True (cuda), used: True
TPU available: False, using: 0 TPU cores
💡 Tip: For seamless cloud logging and experiment tracking, try installing [litlogger](https://pypi.org/project/litlogger/) to enable LitLogger, which logs metrics and artifacts automatically to the Lightning Experiments platform.
GPU available: True (cuda), used: True
TPU available: False, using: 0 TPU cores
💡 Tip: For seamless cloud logging and experiment tracking, try installing [litlogger](https://pypi.org/project/litlogger/) to enable LitLogger, which logs metrics and artifacts automatically to the Lightning Experiments platform.
LOCAL_RANK: 0 - CUDA_VISIBLE_DEVICES: [0]
LOCAL_RANK: 0 - CUDA_VISIBLE_DEVICES: [0]
LOCAL_RANK: 0 - CUDA_VISIBLE_DEVICES: [0]
SLURM auto-requeueing enabled. Setting signal handlers.
SLURM auto-requeueing enabled. Setting signal handlers.
SLURM auto-requeueing enabled. Setting signal handlers.
`Trainer.fit` stopped: `max_epochs=30` reached.
`Trainer.fit` stopped: `max_epochs=30` reached.
[I 2026-04-15 23:38:37,932] Trial 51 finished with value: 0.0948 and parameters: {'left_wall_dist_num_layers': 3, 'left_wall_dist_activation': 'elu', 'left_wall_dist_out_channels_l0': 40, 'left_wall_dist_pool_size_l0': 2, 'left_wall_dist_out_channels_l1': 248, 'left_wall_dist_pool_size_l1': 8, 'left_wall_dist_out_channels_l2': 154, 'left_wall_dist_pool_size_l2': 2, 'left_wall_dist_fc_hidden': 87, 'track_width_num_layers': 5, 'track_width_activation': 'relu', 'track_width_out_channels_l0': 59, 'track_width_pool_size_l0': 8, 'track_width_out_channels_l1': 120, 'track_width_pool_size_l1': 2, 'track_width_out_channels_l2': 36, 'track_width_pool_size_l2': 2, 'track_width_out_channels_l3': 58, 'track_width_pool_size_l3': 4, 'track_width_out_channels_l4': 38, 'track_width_pool_size_l4': 4, 'heading_error_num_layers': 2, 'heading_error_activation': 'elu', 'heading_error_out_channels_l0': 103, 'heading_error_pool_size_l0': 4, 'heading_error_out_channels_l1': 145, 'heading_error_pool_size_l1': 8, 'heading_error_fc_hidden': 83}. Best is trial 23 with value: 0.0876.
[rank: 0] Seed set to 42
[rank: 0] Seed set to 42
[rank: 0] Seed set to 42
GPU available: True (cuda), used: True
TPU available: False, using: 0 TPU cores
💡 Tip: For seamless cloud logging and experiment tracking, try installing [litlogger](https://pypi.org/project/litlogger/) to enable LitLogger, which logs metrics and artifacts automatically to the Lightning Experiments platform.
GPU available: True (cuda), used: True
TPU available: False, using: 0 TPU cores
GPU available: True (cuda), used: True
TPU available: False, using: 0 TPU cores
💡 Tip: For seamless cloud logging and experiment tracking, try installing [litlogger](https://pypi.org/project/litlogger/) to enable LitLogger, which logs metrics and artifacts automatically to the Lightning Experiments platform.
💡 Tip: For seamless cloud logging and experiment tracking, try installing [litlogger](https://pypi.org/project/litlogger/) to enable LitLogger, which logs metrics and artifacts automatically to the Lightning Experiments platform.
LOCAL_RANK: 0 - CUDA_VISIBLE_DEVICES: [0]
LOCAL_RANK: 0 - CUDA_VISIBLE_DEVICES: [0]
LOCAL_RANK: 0 - CUDA_VISIBLE_DEVICES: [0]
SLURM auto-requeueing enabled. Setting signal handlers.
SLURM auto-requeueing enabled. Setting signal handlers.
SLURM auto-requeueing enabled. Setting signal handlers.
`Trainer.fit` stopped: `max_epochs=30` reached.
`Trainer.fit` stopped: `max_epochs=30` reached.
`Trainer.fit` stopped: `max_epochs=30` reached.
[I 2026-04-15 23:41:10,169] Trial 52 finished with value: 0.1002 and parameters: {'left_wall_dist_num_layers': 3, 'left_wall_dist_activation': 'elu', 'left_wall_dist_out_channels_l0': 41, 'left_wall_dist_pool_size_l0': 2, 'left_wall_dist_out_channels_l1': 188, 'left_wall_dist_pool_size_l1': 8, 'left_wall_dist_out_channels_l2': 143, 'left_wall_dist_pool_size_l2': 2, 'left_wall_dist_fc_hidden': 86, 'track_width_num_layers': 5, 'track_width_activation': 'relu', 'track_width_out_channels_l0': 49, 'track_width_pool_size_l0': 8, 'track_width_out_channels_l1': 114, 'track_width_pool_size_l1': 2, 'track_width_out_channels_l2': 49, 'track_width_pool_size_l2': 2, 'track_width_out_channels_l3': 58, 'track_width_pool_size_l3': 4, 'track_width_out_channels_l4': 38, 'track_width_pool_size_l4': 2, 'heading_error_num_layers': 2, 'heading_error_activation': 'elu', 'heading_error_out_channels_l0': 102, 'heading_error_pool_size_l0': 4, 'heading_error_out_channels_l1': 166, 'heading_error_pool_size_l1': 8, 'heading_error_fc_hidden': 90}. Best is trial 23 with value: 0.0876.
[rank: 0] Seed set to 42
[rank: 0] Seed set to 42
[rank: 0] Seed set to 42
GPU available: True (cuda), used: True
TPU available: False, using: 0 TPU cores
💡 Tip: For seamless cloud logging and experiment tracking, try installing [litlogger](https://pypi.org/project/litlogger/) to enable LitLogger, which logs metrics and artifacts automatically to the Lightning Experiments platform.
GPU available: True (cuda), used: True
GPU available: True (cuda), used: True
TPU available: False, using: 0 TPU cores
TPU available: False, using: 0 TPU cores
💡 Tip: For seamless cloud logging and experiment tracking, try installing [litlogger](https://pypi.org/project/litlogger/) to enable LitLogger, which logs metrics and artifacts automatically to the Lightning Experiments platform.
💡 Tip: For seamless cloud logging and experiment tracking, try installing [litlogger](https://pypi.org/project/litlogger/) to enable LitLogger, which logs metrics and artifacts automatically to the Lightning Experiments platform.
LOCAL_RANK: 0 - CUDA_VISIBLE_DEVICES: [0]
LOCAL_RANK: 0 - CUDA_VISIBLE_DEVICES: [0]
LOCAL_RANK: 0 - CUDA_VISIBLE_DEVICES: [0]
SLURM auto-requeueing enabled. Setting signal handlers.
SLURM auto-requeueing enabled. Setting signal handlers.
SLURM auto-requeueing enabled. Setting signal handlers.
`Trainer.fit` stopped: `max_epochs=30` reached.
`Trainer.fit` stopped: `max_epochs=30` reached.
`Trainer.fit` stopped: `max_epochs=30` reached.
[I 2026-04-15 23:43:44,004] Trial 53 finished with value: 0.1062 and parameters: {'left_wall_dist_num_layers': 3, 'left_wall_dist_activation': 'elu', 'left_wall_dist_out_channels_l0': 43, 'left_wall_dist_pool_size_l0': 2, 'left_wall_dist_out_channels_l1': 225, 'left_wall_dist_pool_size_l1': 8, 'left_wall_dist_out_channels_l2': 156, 'left_wall_dist_pool_size_l2': 2, 'left_wall_dist_fc_hidden': 89, 'track_width_num_layers': 5, 'track_width_activation': 'relu', 'track_width_out_channels_l0': 48, 'track_width_pool_size_l0': 8, 'track_width_out_channels_l1': 113, 'track_width_pool_size_l1': 2, 'track_width_out_channels_l2': 49, 'track_width_pool_size_l2': 2, 'track_width_out_channels_l3': 57, 'track_width_pool_size_l3': 4, 'track_width_out_channels_l4': 36, 'track_width_pool_size_l4': 4, 'heading_error_num_layers': 2, 'heading_error_activation': 'elu', 'heading_error_out_channels_l0': 101, 'heading_error_pool_size_l0': 4, 'heading_error_out_channels_l1': 165, 'heading_error_pool_size_l1': 8, 'heading_error_fc_hidden': 93}. Best is trial 23 with value: 0.0876.
[rank: 0] Seed set to 42
[rank: 0] Seed set to 42
[rank: 0] Seed set to 42
GPU available: True (cuda), used: True
TPU available: False, using: 0 TPU cores
💡 Tip: For seamless cloud logging and experiment tracking, try installing [litlogger](https://pypi.org/project/litlogger/) to enable LitLogger, which logs metrics and artifacts automatically to the Lightning Experiments platform.
GPU available: True (cuda), used: True
TPU available: False, using: 0 TPU cores
💡 Tip: For seamless cloud logging and experiment tracking, try installing [litlogger](https://pypi.org/project/litlogger/) to enable LitLogger, which logs metrics and artifacts automatically to the Lightning Experiments platform.
GPU available: True (cuda), used: True
TPU available: False, using: 0 TPU cores
💡 Tip: For seamless cloud logging and experiment tracking, try installing [litlogger](https://pypi.org/project/litlogger/) to enable LitLogger, which logs metrics and artifacts automatically to the Lightning Experiments platform.
LOCAL_RANK: 0 - CUDA_VISIBLE_DEVICES: [0]
LOCAL_RANK: 0 - CUDA_VISIBLE_DEVICES: [0]
LOCAL_RANK: 0 - CUDA_VISIBLE_DEVICES: [0]
SLURM auto-requeueing enabled. Setting signal handlers.
SLURM auto-requeueing enabled. Setting signal handlers.
SLURM auto-requeueing enabled. Setting signal handlers.
`Trainer.fit` stopped: `max_epochs=30` reached.
`Trainer.fit` stopped: `max_epochs=30` reached.
`Trainer.fit` stopped: `max_epochs=30` reached.
[I 2026-04-15 23:46:16,160] Trial 54 finished with value: 0.0977 and parameters: {'left_wall_dist_num_layers': 3, 'left_wall_dist_activation': 'elu', 'left_wall_dist_out_channels_l0': 32, 'left_wall_dist_pool_size_l0': 2, 'left_wall_dist_out_channels_l1': 239, 'left_wall_dist_pool_size_l1': 8, 'left_wall_dist_out_channels_l2': 143, 'left_wall_dist_pool_size_l2': 2, 'left_wall_dist_fc_hidden': 84, 'track_width_num_layers': 5, 'track_width_activation': 'relu', 'track_width_out_channels_l0': 59, 'track_width_pool_size_l0': 8, 'track_width_out_channels_l1': 134, 'track_width_pool_size_l1': 2, 'track_width_out_channels_l2': 35, 'track_width_pool_size_l2': 2, 'track_width_out_channels_l3': 50, 'track_width_pool_size_l3': 4, 'track_width_out_channels_l4': 38, 'track_width_pool_size_l4': 8, 'track_width_fc_hidden': 34, 'heading_error_num_layers': 2, 'heading_error_activation': 'elu', 'heading_error_out_channels_l0': 127, 'heading_error_pool_size_l0': 4, 'heading_error_out_channels_l1': 190, 'heading_error_pool_size_l1': 8, 'heading_error_fc_hidden': 115}. Best is trial 23 with value: 0.0876.
[rank: 0] Seed set to 42
[rank: 0] Seed set to 42
[rank: 0] Seed set to 42
GPU available: True (cuda), used: True
TPU available: False, using: 0 TPU cores
💡 Tip: For seamless cloud logging and experiment tracking, try installing [litlogger](https://pypi.org/project/litlogger/) to enable LitLogger, which logs metrics and artifacts automatically to the Lightning Experiments platform.
GPU available: True (cuda), used: True
TPU available: False, using: 0 TPU cores
💡 Tip: For seamless cloud logging and experiment tracking, try installing [litlogger](https://pypi.org/project/litlogger/) to enable LitLogger, which logs metrics and artifacts automatically to the Lightning Experiments platform.
GPU available: True (cuda), used: True
TPU available: False, using: 0 TPU cores
💡 Tip: For seamless cloud logging and experiment tracking, try installing [litlogger](https://pypi.org/project/litlogger/) to enable LitLogger, which logs metrics and artifacts automatically to the Lightning Experiments platform.
LOCAL_RANK: 0 - CUDA_VISIBLE_DEVICES: [0]
LOCAL_RANK: 0 - CUDA_VISIBLE_DEVICES: [0]
LOCAL_RANK: 0 - CUDA_VISIBLE_DEVICES: [0]
SLURM auto-requeueing enabled. Setting signal handlers.
SLURM auto-requeueing enabled. Setting signal handlers.
SLURM auto-requeueing enabled. Setting signal handlers.
`Trainer.fit` stopped: `max_epochs=30` reached.
`Trainer.fit` stopped: `max_epochs=30` reached.
`Trainer.fit` stopped: `max_epochs=30` reached.
[I 2026-04-15 23:48:51,399] Trial 55 finished with value: 0.1135 and parameters: {'left_wall_dist_num_layers': 3, 'left_wall_dist_activation': 'elu', 'left_wall_dist_out_channels_l0': 32, 'left_wall_dist_pool_size_l0': 2, 'left_wall_dist_out_channels_l1': 187, 'left_wall_dist_pool_size_l1': 8, 'left_wall_dist_out_channels_l2': 136, 'left_wall_dist_pool_size_l2': 2, 'left_wall_dist_fc_hidden': 83, 'track_width_num_layers': 5, 'track_width_activation': 'relu', 'track_width_out_channels_l0': 59, 'track_width_pool_size_l0': 8, 'track_width_out_channels_l1': 116, 'track_width_pool_size_l1': 2, 'track_width_out_channels_l2': 37, 'track_width_pool_size_l2': 2, 'track_width_out_channels_l3': 68, 'track_width_pool_size_l3': 2, 'track_width_out_channels_l4': 36, 'track_width_pool_size_l4': 8, 'heading_error_num_layers': 2, 'heading_error_activation': 'elu', 'heading_error_out_channels_l0': 128, 'heading_error_pool_size_l0': 4, 'heading_error_out_channels_l1': 217, 'heading_error_pool_size_l1': 8, 'heading_error_fc_hidden': 117}. Best is trial 23 with value: 0.0876.
[rank: 0] Seed set to 42
[rank: 0] Seed set to 42
[rank: 0] Seed set to 42
GPU available: True (cuda), used: True
TPU available: False, using: 0 TPU cores
GPU available: True (cuda), used: True
TPU available: False, using: 0 TPU cores
💡 Tip: For seamless cloud logging and experiment tracking, try installing [litlogger](https://pypi.org/project/litlogger/) to enable LitLogger, which logs metrics and artifacts automatically to the Lightning Experiments platform.
💡 Tip: For seamless cloud logging and experiment tracking, try installing [litlogger](https://pypi.org/project/litlogger/) to enable LitLogger, which logs metrics and artifacts automatically to the Lightning Experiments platform.
GPU available: True (cuda), used: True
TPU available: False, using: 0 TPU cores
💡 Tip: For seamless cloud logging and experiment tracking, try installing [litlogger](https://pypi.org/project/litlogger/) to enable LitLogger, which logs metrics and artifacts automatically to the Lightning Experiments platform.
LOCAL_RANK: 0 - CUDA_VISIBLE_DEVICES: [0]
LOCAL_RANK: 0 - CUDA_VISIBLE_DEVICES: [0]
LOCAL_RANK: 0 - CUDA_VISIBLE_DEVICES: [0]
SLURM auto-requeueing enabled. Setting signal handlers.
SLURM auto-requeueing enabled. Setting signal handlers.
SLURM auto-requeueing enabled. Setting signal handlers.
`Trainer.fit` stopped: `max_epochs=30` reached.
`Trainer.fit` stopped: `max_epochs=30` reached.
`Trainer.fit` stopped: `max_epochs=30` reached.
