[I 2026-05-04 02:01:11,925] Trial 111 finished with value: 0.0882 and parameters: {'optimizer': 'adamw', 'left_wall_dist_num_layers': 1, 'left_wall_dist_activation': 'relu', 'left_wall_dist_fc_layers': 'fc128', 'left_wall_dist_pool_size_l0': 3, 'left_wall_dist_out_channels_l0': 1, 'track_width_num_layers': 1, 'track_width_activation': 'relu', 'track_width_fc_layers': 'fc64_32', 'track_width_pool_size_l0': 3, 'track_width_out_channels_l0': 4, 'heading_error_num_layers': 1, 'heading_error_activation': 'elu', 'heading_error_fc_layers': 'fc32', 'heading_error_pool_size_l0': 3, 'heading_error_out_channels_l0': 8}. Best is trial 105 with value: 0.0861.
[rank: 0] Seed set to 42
[rank: 0] Seed set to 42
[rank: 0] Seed set to 42
GPU available: True (cuda), used: True
GPU available: True (cuda), used: True
GPU available: True (cuda), used: True
TPU available: False, using: 0 TPU cores
TPU available: False, using: 0 TPU cores
TPU available: False, using: 0 TPU cores
💡 Tip: For seamless cloud logging and experiment tracking, try installing [litlogger](https://pypi.org/project/litlogger/) to enable LitLogger, which logs metrics and artifacts automatically to the Lightning Experiments platform.
💡 Tip: For seamless cloud logging and experiment tracking, try installing [litlogger](https://pypi.org/project/litlogger/) to enable LitLogger, which logs metrics and artifacts automatically to the Lightning Experiments platform.
💡 Tip: For seamless cloud logging and experiment tracking, try installing [litlogger](https://pypi.org/project/litlogger/) to enable LitLogger, which logs metrics and artifacts automatically to the Lightning Experiments platform.
LOCAL_RANK: 0 - CUDA_VISIBLE_DEVICES: [0]
LOCAL_RANK: 0 - CUDA_VISIBLE_DEVICES: [0]
LOCAL_RANK: 0 - CUDA_VISIBLE_DEVICES: [0]
SLURM auto-requeueing enabled. Setting signal handlers.
SLURM auto-requeueing enabled. Setting signal handlers.
SLURM auto-requeueing enabled. Setting signal handlers.
`Trainer.fit` stopped: `max_epochs=30` reached.
`Trainer.fit` stopped: `max_epochs=30` reached.
`Trainer.fit` stopped: `max_epochs=30` reached.
[I 2026-05-04 02:03:26,130] Trial 112 finished with value: 0.0882 and parameters: {'optimizer': 'adamw', 'left_wall_dist_num_layers': 1, 'left_wall_dist_activation': 'relu', 'left_wall_dist_fc_layers': 'fc128', 'left_wall_dist_pool_size_l0': 3, 'left_wall_dist_out_channels_l0': 1, 'track_width_num_layers': 1, 'track_width_activation': 'relu', 'track_width_fc_layers': 'fc64_32', 'track_width_pool_size_l0': 3, 'track_width_out_channels_l0': 4, 'heading_error_num_layers': 1, 'heading_error_activation': 'elu', 'heading_error_fc_layers': 'fc32', 'heading_error_pool_size_l0': 3, 'heading_error_out_channels_l0': 8}. Best is trial 105 with value: 0.0861.
[rank: 0] Seed set to 42
[rank: 0] Seed set to 42
GPU available: True (cuda), used: True
TPU available: False, using: 0 TPU cores
GPU available: True (cuda), used: True
TPU available: False, using: 0 TPU cores
💡 Tip: For seamless cloud logging and experiment tracking, try installing [litlogger](https://pypi.org/project/litlogger/) to enable LitLogger, which logs metrics and artifacts automatically to the Lightning Experiments platform.
💡 Tip: For seamless cloud logging and experiment tracking, try installing [litlogger](https://pypi.org/project/litlogger/) to enable LitLogger, which logs metrics and artifacts automatically to the Lightning Experiments platform.
[rank: 0] Seed set to 42
GPU available: True (cuda), used: True
TPU available: False, using: 0 TPU cores
💡 Tip: For seamless cloud logging and experiment tracking, try installing [litlogger](https://pypi.org/project/litlogger/) to enable LitLogger, which logs metrics and artifacts automatically to the Lightning Experiments platform.
LOCAL_RANK: 0 - CUDA_VISIBLE_DEVICES: [0]
LOCAL_RANK: 0 - CUDA_VISIBLE_DEVICES: [0]
LOCAL_RANK: 0 - CUDA_VISIBLE_DEVICES: [0]
SLURM auto-requeueing enabled. Setting signal handlers.
SLURM auto-requeueing enabled. Setting signal handlers.
SLURM auto-requeueing enabled. Setting signal handlers.
`Trainer.fit` stopped: `max_epochs=30` reached.
`Trainer.fit` stopped: `max_epochs=30` reached.
`Trainer.fit` stopped: `max_epochs=30` reached.
[I 2026-05-04 02:05:38,045] Trial 113 finished with value: 0.0882 and parameters: {'optimizer': 'adamw', 'left_wall_dist_num_layers': 1, 'left_wall_dist_activation': 'relu', 'left_wall_dist_fc_layers': 'fc128', 'left_wall_dist_pool_size_l0': 3, 'left_wall_dist_out_channels_l0': 1, 'track_width_num_layers': 1, 'track_width_activation': 'relu', 'track_width_fc_layers': 'fc64_32', 'track_width_pool_size_l0': 3, 'track_width_out_channels_l0': 4, 'heading_error_num_layers': 1, 'heading_error_activation': 'elu', 'heading_error_fc_layers': 'fc32', 'heading_error_pool_size_l0': 3, 'heading_error_out_channels_l0': 8}. Best is trial 105 with value: 0.0861.
[rank: 0] Seed set to 42
[rank: 0] Seed set to 42
[rank: 0] Seed set to 42
GPU available: True (cuda), used: True
TPU available: False, using: 0 TPU cores
💡 Tip: For seamless cloud logging and experiment tracking, try installing [litlogger](https://pypi.org/project/litlogger/) to enable LitLogger, which logs metrics and artifacts automatically to the Lightning Experiments platform.
GPU available: True (cuda), used: True
TPU available: False, using: 0 TPU cores
💡 Tip: For seamless cloud logging and experiment tracking, try installing [litlogger](https://pypi.org/project/litlogger/) to enable LitLogger, which logs metrics and artifacts automatically to the Lightning Experiments platform.
GPU available: True (cuda), used: True
TPU available: False, using: 0 TPU cores
💡 Tip: For seamless cloud logging and experiment tracking, try installing [litlogger](https://pypi.org/project/litlogger/) to enable LitLogger, which logs metrics and artifacts automatically to the Lightning Experiments platform.
LOCAL_RANK: 0 - CUDA_VISIBLE_DEVICES: [0]
LOCAL_RANK: 0 - CUDA_VISIBLE_DEVICES: [0]
LOCAL_RANK: 0 - CUDA_VISIBLE_DEVICES: [0]
SLURM auto-requeueing enabled. Setting signal handlers.
SLURM auto-requeueing enabled. Setting signal handlers.
SLURM auto-requeueing enabled. Setting signal handlers.
`Trainer.fit` stopped: `max_epochs=30` reached.
`Trainer.fit` stopped: `max_epochs=30` reached.
`Trainer.fit` stopped: `max_epochs=30` reached.
[I 2026-05-04 02:07:53,199] Trial 114 finished with value: 0.0882 and parameters: {'optimizer': 'adamw', 'left_wall_dist_num_layers': 1, 'left_wall_dist_activation': 'relu', 'left_wall_dist_fc_layers': 'fc128', 'left_wall_dist_pool_size_l0': 3, 'left_wall_dist_out_channels_l0': 1, 'track_width_num_layers': 1, 'track_width_activation': 'relu', 'track_width_fc_layers': 'fc64_32', 'track_width_pool_size_l0': 3, 'track_width_out_channels_l0': 4, 'heading_error_num_layers': 1, 'heading_error_activation': 'elu', 'heading_error_fc_layers': 'fc32', 'heading_error_pool_size_l0': 3, 'heading_error_out_channels_l0': 8}. Best is trial 105 with value: 0.0861.
[rank: 0] Seed set to 42
[rank: 0] Seed set to 42
[rank: 0] Seed set to 42
GPU available: True (cuda), used: True
GPU available: True (cuda), used: True
GPU available: True (cuda), used: True
TPU available: False, using: 0 TPU cores
TPU available: False, using: 0 TPU cores
TPU available: False, using: 0 TPU cores
💡 Tip: For seamless cloud logging and experiment tracking, try installing [litlogger](https://pypi.org/project/litlogger/) to enable LitLogger, which logs metrics and artifacts automatically to the Lightning Experiments platform.
💡 Tip: For seamless cloud logging and experiment tracking, try installing [litlogger](https://pypi.org/project/litlogger/) to enable LitLogger, which logs metrics and artifacts automatically to the Lightning Experiments platform.
💡 Tip: For seamless cloud logging and experiment tracking, try installing [litlogger](https://pypi.org/project/litlogger/) to enable LitLogger, which logs metrics and artifacts automatically to the Lightning Experiments platform.
LOCAL_RANK: 0 - CUDA_VISIBLE_DEVICES: [0]
LOCAL_RANK: 0 - CUDA_VISIBLE_DEVICES: [0]
LOCAL_RANK: 0 - CUDA_VISIBLE_DEVICES: [0]
SLURM auto-requeueing enabled. Setting signal handlers.
SLURM auto-requeueing enabled. Setting signal handlers.
SLURM auto-requeueing enabled. Setting signal handlers.
`Trainer.fit` stopped: `max_epochs=30` reached.
`Trainer.fit` stopped: `max_epochs=30` reached.
`Trainer.fit` stopped: `max_epochs=30` reached.
[I 2026-05-04 02:10:05,854] Trial 115 finished with value: 0.0882 and parameters: {'optimizer': 'adamw', 'left_wall_dist_num_layers': 1, 'left_wall_dist_activation': 'relu', 'left_wall_dist_fc_layers': 'fc128', 'left_wall_dist_pool_size_l0': 3, 'left_wall_dist_out_channels_l0': 1, 'track_width_num_layers': 1, 'track_width_activation': 'relu', 'track_width_fc_layers': 'fc64_32', 'track_width_pool_size_l0': 3, 'track_width_out_channels_l0': 4, 'heading_error_num_layers': 1, 'heading_error_activation': 'elu', 'heading_error_fc_layers': 'fc32', 'heading_error_pool_size_l0': 3, 'heading_error_out_channels_l0': 8}. Best is trial 105 with value: 0.0861.
[rank: 0] Seed set to 42
GPU available: True (cuda), used: True
TPU available: False, using: 0 TPU cores
💡 Tip: For seamless cloud logging and experiment tracking, try installing [litlogger](https://pypi.org/project/litlogger/) to enable LitLogger, which logs metrics and artifacts automatically to the Lightning Experiments platform.
[rank: 0] Seed set to 42
[rank: 0] Seed set to 42
GPU available: True (cuda), used: True
TPU available: False, using: 0 TPU cores
💡 Tip: For seamless cloud logging and experiment tracking, try installing [litlogger](https://pypi.org/project/litlogger/) to enable LitLogger, which logs metrics and artifacts automatically to the Lightning Experiments platform.
GPU available: True (cuda), used: True
TPU available: False, using: 0 TPU cores
💡 Tip: For seamless cloud logging and experiment tracking, try installing [litlogger](https://pypi.org/project/litlogger/) to enable LitLogger, which logs metrics and artifacts automatically to the Lightning Experiments platform.
LOCAL_RANK: 0 - CUDA_VISIBLE_DEVICES: [0]
LOCAL_RANK: 0 - CUDA_VISIBLE_DEVICES: [0]
LOCAL_RANK: 0 - CUDA_VISIBLE_DEVICES: [0]
SLURM auto-requeueing enabled. Setting signal handlers.
SLURM auto-requeueing enabled. Setting signal handlers.
SLURM auto-requeueing enabled. Setting signal handlers.
`Trainer.fit` stopped: `max_epochs=30` reached.
`Trainer.fit` stopped: `max_epochs=30` reached.
`Trainer.fit` stopped: `max_epochs=30` reached.
[I 2026-05-04 02:12:26,797] Trial 116 finished with value: 0.1214 and parameters: {'optimizer': 'adamw', 'left_wall_dist_num_layers': 1, 'left_wall_dist_activation': 'relu', 'left_wall_dist_fc_layers': 'fc128', 'left_wall_dist_pool_size_l0': 3, 'left_wall_dist_out_channels_l0': 1, 'track_width_num_layers': 1, 'track_width_activation': 'relu', 'track_width_fc_layers': 'fc64_32', 'track_width_pool_size_l0': 3, 'track_width_out_channels_l0': 4, 'heading_error_num_layers': 1, 'heading_error_activation': 'elu', 'heading_error_fc_layers': 'fc32', 'heading_error_pool_size_l0': 3, 'heading_error_out_channels_l0': 16}. Best is trial 105 with value: 0.0861.
[rank: 0] Seed set to 42
[rank: 0] Seed set to 42
GPU available: True (cuda), used: True
TPU available: False, using: 0 TPU cores
💡 Tip: For seamless cloud logging and experiment tracking, try installing [litlogger](https://pypi.org/project/litlogger/) to enable LitLogger, which logs metrics and artifacts automatically to the Lightning Experiments platform.
GPU available: True (cuda), used: True
TPU available: False, using: 0 TPU cores
💡 Tip: For seamless cloud logging and experiment tracking, try installing [litlogger](https://pypi.org/project/litlogger/) to enable LitLogger, which logs metrics and artifacts automatically to the Lightning Experiments platform.
[rank: 0] Seed set to 42
GPU available: True (cuda), used: True
TPU available: False, using: 0 TPU cores
💡 Tip: For seamless cloud logging and experiment tracking, try installing [litlogger](https://pypi.org/project/litlogger/) to enable LitLogger, which logs metrics and artifacts automatically to the Lightning Experiments platform.
LOCAL_RANK: 0 - CUDA_VISIBLE_DEVICES: [0]
LOCAL_RANK: 0 - CUDA_VISIBLE_DEVICES: [0]
LOCAL_RANK: 0 - CUDA_VISIBLE_DEVICES: [0]
SLURM auto-requeueing enabled. Setting signal handlers.
SLURM auto-requeueing enabled. Setting signal handlers.
SLURM auto-requeueing enabled. Setting signal handlers.
`Trainer.fit` stopped: `max_epochs=30` reached.
`Trainer.fit` stopped: `max_epochs=30` reached.
`Trainer.fit` stopped: `max_epochs=30` reached.
[I 2026-05-04 02:14:40,000] Trial 117 finished with value: 0.0882 and parameters: {'optimizer': 'adamw', 'left_wall_dist_num_layers': 1, 'left_wall_dist_activation': 'relu', 'left_wall_dist_fc_layers': 'fc128', 'left_wall_dist_pool_size_l0': 3, 'left_wall_dist_out_channels_l0': 1, 'track_width_num_layers': 1, 'track_width_activation': 'relu', 'track_width_fc_layers': 'fc64_32', 'track_width_pool_size_l0': 3, 'track_width_out_channels_l0': 4, 'heading_error_num_layers': 1, 'heading_error_activation': 'elu', 'heading_error_fc_layers': 'fc32', 'heading_error_pool_size_l0': 3, 'heading_error_out_channels_l0': 8}. Best is trial 105 with value: 0.0861.
[rank: 0] Seed set to 42
GPU available: True (cuda), used: True
TPU available: False, using: 0 TPU cores
💡 Tip: For seamless cloud logging and experiment tracking, try installing [litlogger](https://pypi.org/project/litlogger/) to enable LitLogger, which logs metrics and artifacts automatically to the Lightning Experiments platform.
[rank: 0] Seed set to 42
GPU available: True (cuda), used: True
TPU available: False, using: 0 TPU cores
💡 Tip: For seamless cloud logging and experiment tracking, try installing [litlogger](https://pypi.org/project/litlogger/) to enable LitLogger, which logs metrics and artifacts automatically to the Lightning Experiments platform.
[rank: 0] Seed set to 42
GPU available: True (cuda), used: True
TPU available: False, using: 0 TPU cores
💡 Tip: For seamless cloud logging and experiment tracking, try installing [litlogger](https://pypi.org/project/litlogger/) to enable LitLogger, which logs metrics and artifacts automatically to the Lightning Experiments platform.
LOCAL_RANK: 0 - CUDA_VISIBLE_DEVICES: [0]
LOCAL_RANK: 0 - CUDA_VISIBLE_DEVICES: [0]
LOCAL_RANK: 0 - CUDA_VISIBLE_DEVICES: [0]
SLURM auto-requeueing enabled. Setting signal handlers.
SLURM auto-requeueing enabled. Setting signal handlers.
SLURM auto-requeueing enabled. Setting signal handlers.
`Trainer.fit` stopped: `max_epochs=30` reached.
`Trainer.fit` stopped: `max_epochs=30` reached.
`Trainer.fit` stopped: `max_epochs=30` reached.
[I 2026-05-04 02:16:56,097] Trial 118 finished with value: 0.1037 and parameters: {'optimizer': 'adamw', 'left_wall_dist_num_layers': 1, 'left_wall_dist_activation': 'relu', 'left_wall_dist_fc_layers': 'fc64_32', 'left_wall_dist_pool_size_l0': 3, 'left_wall_dist_out_channels_l0': 1, 'track_width_num_layers': 1, 'track_width_activation': 'relu', 'track_width_fc_layers': 'fc64_32', 'track_width_pool_size_l0': 2, 'track_width_out_channels_l0': 4, 'heading_error_num_layers': 1, 'heading_error_activation': 'elu', 'heading_error_fc_layers': 'fc32', 'heading_error_pool_size_l0': 3, 'heading_error_out_channels_l0': 8}. Best is trial 105 with value: 0.0861.
[rank: 0] Seed set to 42
[rank: 0] Seed set to 42
[rank: 0] Seed set to 42
GPU available: True (cuda), used: True
TPU available: False, using: 0 TPU cores
GPU available: True (cuda), used: True
TPU available: False, using: 0 TPU cores
💡 Tip: For seamless cloud logging and experiment tracking, try installing [litlogger](https://pypi.org/project/litlogger/) to enable LitLogger, which logs metrics and artifacts automatically to the Lightning Experiments platform.
💡 Tip: For seamless cloud logging and experiment tracking, try installing [litlogger](https://pypi.org/project/litlogger/) to enable LitLogger, which logs metrics and artifacts automatically to the Lightning Experiments platform.
GPU available: True (cuda), used: True
TPU available: False, using: 0 TPU cores
💡 Tip: For seamless cloud logging and experiment tracking, try installing [litlogger](https://pypi.org/project/litlogger/) to enable LitLogger, which logs metrics and artifacts automatically to the Lightning Experiments platform.
LOCAL_RANK: 0 - CUDA_VISIBLE_DEVICES: [0]
LOCAL_RANK: 0 - CUDA_VISIBLE_DEVICES: [0]
LOCAL_RANK: 0 - CUDA_VISIBLE_DEVICES: [0]
SLURM auto-requeueing enabled. Setting signal handlers.
SLURM auto-requeueing enabled. Setting signal handlers.
SLURM auto-requeueing enabled. Setting signal handlers.
`Trainer.fit` stopped: `max_epochs=30` reached.
`Trainer.fit` stopped: `max_epochs=30` reached.
`Trainer.fit` stopped: `max_epochs=30` reached.
[I 2026-05-04 02:19:09,375] Trial 119 finished with value: 0.1481 and parameters: {'optimizer': 'adamw', 'left_wall_dist_num_layers': 1, 'left_wall_dist_activation': 'relu', 'left_wall_dist_fc_layers': 'fc128', 'left_wall_dist_pool_size_l0': 3, 'left_wall_dist_out_channels_l0': 1, 'track_width_num_layers': 1, 'track_width_activation': 'elu', 'track_width_fc_layers': 'fc64_32', 'track_width_pool_size_l0': 3, 'track_width_out_channels_l0': 4, 'heading_error_num_layers': 1, 'heading_error_activation': 'elu', 'heading_error_fc_layers': 'fc64', 'heading_error_pool_size_l0': 3, 'heading_error_out_channels_l0': 8}. Best is trial 105 with value: 0.0861.
