[I 2026-04-16 01:15:35,881] Trial 84 finished with value: 0.1121 and parameters: {'left_wall_dist_num_layers': 2, 'left_wall_dist_activation': 'elu', 'left_wall_dist_out_channels_l0': 95, 'left_wall_dist_pool_size_l0': 8, 'left_wall_dist_out_channels_l1': 79, 'left_wall_dist_pool_size_l1': 8, 'left_wall_dist_fc_hidden': 48, 'track_width_num_layers': 3, 'track_width_activation': 'relu', 'track_width_out_channels_l0': 59, 'track_width_pool_size_l0': 2, 'track_width_out_channels_l1': 207, 'track_width_pool_size_l1': 2, 'track_width_out_channels_l2': 54, 'track_width_pool_size_l2': 2, 'track_width_fc_hidden': 127, 'heading_error_num_layers': 4, 'heading_error_activation': 'elu', 'heading_error_out_channels_l0': 35, 'heading_error_pool_size_l0': 2, 'heading_error_out_channels_l1': 99, 'heading_error_pool_size_l1': 8, 'heading_error_out_channels_l2': 68, 'heading_error_pool_size_l2': 4, 'heading_error_out_channels_l3': 189, 'heading_error_pool_size_l3': 4, 'heading_error_fc_hidden': 85}. Best is trial 71 with value: 0.096.
[rank: 0] Seed set to 42
GPU available: True (cuda), used: True
TPU available: False, using: 0 TPU cores
💡 Tip: For seamless cloud logging and experiment tracking, try installing [litlogger](https://pypi.org/project/litlogger/) to enable LitLogger, which logs metrics and artifacts automatically to the Lightning Experiments platform.
[rank: 0] Seed set to 42
[rank: 0] Seed set to 42
GPU available: True (cuda), used: True
TPU available: False, using: 0 TPU cores
💡 Tip: For seamless cloud logging and experiment tracking, try installing [litlogger](https://pypi.org/project/litlogger/) to enable LitLogger, which logs metrics and artifacts automatically to the Lightning Experiments platform.
GPU available: True (cuda), used: True
TPU available: False, using: 0 TPU cores
💡 Tip: For seamless cloud logging and experiment tracking, try installing [litlogger](https://pypi.org/project/litlogger/) to enable LitLogger, which logs metrics and artifacts automatically to the Lightning Experiments platform.
LOCAL_RANK: 0 - CUDA_VISIBLE_DEVICES: [0]
LOCAL_RANK: 0 - CUDA_VISIBLE_DEVICES: [0]
LOCAL_RANK: 0 - CUDA_VISIBLE_DEVICES: [0]
SLURM auto-requeueing enabled. Setting signal handlers.
SLURM auto-requeueing enabled. Setting signal handlers.
SLURM auto-requeueing enabled. Setting signal handlers.
`Trainer.fit` stopped: `max_epochs=30` reached.
`Trainer.fit` stopped: `max_epochs=30` reached.
`Trainer.fit` stopped: `max_epochs=30` reached.
[I 2026-04-16 01:18:26,445] Trial 85 finished with value: 0.1113 and parameters: {'left_wall_dist_num_layers': 2, 'left_wall_dist_activation': 'elu', 'left_wall_dist_out_channels_l0': 94, 'left_wall_dist_pool_size_l0': 8, 'left_wall_dist_out_channels_l1': 80, 'left_wall_dist_pool_size_l1': 8, 'left_wall_dist_fc_hidden': 43, 'track_width_num_layers': 3, 'track_width_activation': 'relu', 'track_width_out_channels_l0': 52, 'track_width_pool_size_l0': 2, 'track_width_out_channels_l1': 206, 'track_width_pool_size_l1': 2, 'track_width_out_channels_l2': 53, 'track_width_pool_size_l2': 2, 'track_width_fc_hidden': 126, 'heading_error_num_layers': 4, 'heading_error_activation': 'elu', 'heading_error_out_channels_l0': 34, 'heading_error_pool_size_l0': 2, 'heading_error_out_channels_l1': 100, 'heading_error_pool_size_l1': 8, 'heading_error_out_channels_l2': 69, 'heading_error_pool_size_l2': 4, 'heading_error_out_channels_l3': 197, 'heading_error_pool_size_l3': 4, 'heading_error_fc_hidden': 85}. Best is trial 71 with value: 0.096.
[rank: 0] Seed set to 42
GPU available: True (cuda), used: True
TPU available: False, using: 0 TPU cores
💡 Tip: For seamless cloud logging and experiment tracking, try installing [litlogger](https://pypi.org/project/litlogger/) to enable LitLogger, which logs metrics and artifacts automatically to the Lightning Experiments platform.
[rank: 0] Seed set to 42
[rank: 0] Seed set to 42
GPU available: True (cuda), used: True
TPU available: False, using: 0 TPU cores
💡 Tip: For seamless cloud logging and experiment tracking, try installing [litlogger](https://pypi.org/project/litlogger/) to enable LitLogger, which logs metrics and artifacts automatically to the Lightning Experiments platform.
GPU available: True (cuda), used: True
TPU available: False, using: 0 TPU cores
💡 Tip: For seamless cloud logging and experiment tracking, try installing [litlogger](https://pypi.org/project/litlogger/) to enable LitLogger, which logs metrics and artifacts automatically to the Lightning Experiments platform.
LOCAL_RANK: 0 - CUDA_VISIBLE_DEVICES: [0]
LOCAL_RANK: 0 - CUDA_VISIBLE_DEVICES: [0]
LOCAL_RANK: 0 - CUDA_VISIBLE_DEVICES: [0]
SLURM auto-requeueing enabled. Setting signal handlers.
SLURM auto-requeueing enabled. Setting signal handlers.
SLURM auto-requeueing enabled. Setting signal handlers.
`Trainer.fit` stopped: `max_epochs=30` reached.
`Trainer.fit` stopped: `max_epochs=30` reached.
`Trainer.fit` stopped: `max_epochs=30` reached.
[I 2026-04-16 01:21:24,889] Trial 86 finished with value: 0.1463 and parameters: {'left_wall_dist_num_layers': 2, 'left_wall_dist_activation': 'elu', 'left_wall_dist_out_channels_l0': 96, 'left_wall_dist_pool_size_l0': 8, 'left_wall_dist_out_channels_l1': 77, 'left_wall_dist_pool_size_l1': 8, 'left_wall_dist_fc_hidden': 42, 'track_width_num_layers': 3, 'track_width_activation': 'relu', 'track_width_out_channels_l0': 52, 'track_width_pool_size_l0': 2, 'track_width_out_channels_l1': 178, 'track_width_pool_size_l1': 2, 'track_width_out_channels_l2': 50, 'track_width_pool_size_l2': 2, 'track_width_fc_hidden': 126, 'heading_error_num_layers': 4, 'heading_error_activation': 'elu', 'heading_error_out_channels_l0': 34, 'heading_error_pool_size_l0': 2, 'heading_error_out_channels_l1': 99, 'heading_error_pool_size_l1': 8, 'heading_error_out_channels_l2': 57, 'heading_error_pool_size_l2': 4, 'heading_error_out_channels_l3': 187, 'heading_error_pool_size_l3': 4, 'heading_error_fc_hidden': 84}. Best is trial 71 with value: 0.096.
[rank: 0] Seed set to 42
GPU available: True (cuda), used: True
TPU available: False, using: 0 TPU cores
💡 Tip: For seamless cloud logging and experiment tracking, try installing [litlogger](https://pypi.org/project/litlogger/) to enable LitLogger, which logs metrics and artifacts automatically to the Lightning Experiments platform.
[rank: 0] Seed set to 42
[rank: 0] Seed set to 42
GPU available: True (cuda), used: True
TPU available: False, using: 0 TPU cores
💡 Tip: For seamless cloud logging and experiment tracking, try installing [litlogger](https://pypi.org/project/litlogger/) to enable LitLogger, which logs metrics and artifacts automatically to the Lightning Experiments platform.
GPU available: True (cuda), used: True
TPU available: False, using: 0 TPU cores
💡 Tip: For seamless cloud logging and experiment tracking, try installing [litlogger](https://pypi.org/project/litlogger/) to enable LitLogger, which logs metrics and artifacts automatically to the Lightning Experiments platform.
LOCAL_RANK: 0 - CUDA_VISIBLE_DEVICES: [0]
LOCAL_RANK: 0 - CUDA_VISIBLE_DEVICES: [0]
LOCAL_RANK: 0 - CUDA_VISIBLE_DEVICES: [0]
SLURM auto-requeueing enabled. Setting signal handlers.
SLURM auto-requeueing enabled. Setting signal handlers.
SLURM auto-requeueing enabled. Setting signal handlers.
`Trainer.fit` stopped: `max_epochs=30` reached.
`Trainer.fit` stopped: `max_epochs=30` reached.
`Trainer.fit` stopped: `max_epochs=30` reached.
[I 2026-04-16 01:24:10,037] Trial 87 finished with value: 0.0923 and parameters: {'left_wall_dist_num_layers': 2, 'left_wall_dist_activation': 'elu', 'left_wall_dist_out_channels_l0': 83, 'left_wall_dist_pool_size_l0': 8, 'left_wall_dist_out_channels_l1': 60, 'left_wall_dist_pool_size_l1': 8, 'left_wall_dist_fc_hidden': 38, 'track_width_num_layers': 3, 'track_width_activation': 'relu', 'track_width_out_channels_l0': 64, 'track_width_pool_size_l0': 2, 'track_width_out_channels_l1': 219, 'track_width_pool_size_l1': 2, 'track_width_out_channels_l2': 70, 'track_width_pool_size_l2': 2, 'heading_error_num_layers': 4, 'heading_error_activation': 'elu', 'heading_error_out_channels_l0': 54, 'heading_error_pool_size_l0': 2, 'heading_error_out_channels_l1': 107, 'heading_error_pool_size_l1': 8, 'heading_error_out_channels_l2': 52, 'heading_error_pool_size_l2': 4, 'heading_error_out_channels_l3': 245, 'heading_error_pool_size_l3': 4, 'heading_error_fc_hidden': 77}. Best is trial 87 with value: 0.0923.
[rank: 0] Seed set to 42
GPU available: True (cuda), used: True
TPU available: False, using: 0 TPU cores
💡 Tip: For seamless cloud logging and experiment tracking, try installing [litlogger](https://pypi.org/project/litlogger/) to enable LitLogger, which logs metrics and artifacts automatically to the Lightning Experiments platform.
[rank: 0] Seed set to 42
[rank: 0] Seed set to 42
GPU available: True (cuda), used: True
TPU available: False, using: 0 TPU cores
💡 Tip: For seamless cloud logging and experiment tracking, try installing [litlogger](https://pypi.org/project/litlogger/) to enable LitLogger, which logs metrics and artifacts automatically to the Lightning Experiments platform.
GPU available: True (cuda), used: True
TPU available: False, using: 0 TPU cores
💡 Tip: For seamless cloud logging and experiment tracking, try installing [litlogger](https://pypi.org/project/litlogger/) to enable LitLogger, which logs metrics and artifacts automatically to the Lightning Experiments platform.
LOCAL_RANK: 0 - CUDA_VISIBLE_DEVICES: [0]
LOCAL_RANK: 0 - CUDA_VISIBLE_DEVICES: [0]
LOCAL_RANK: 0 - CUDA_VISIBLE_DEVICES: [0]
SLURM auto-requeueing enabled. Setting signal handlers.
SLURM auto-requeueing enabled. Setting signal handlers.
SLURM auto-requeueing enabled. Setting signal handlers.
`Trainer.fit` stopped: `max_epochs=30` reached.
`Trainer.fit` stopped: `max_epochs=30` reached.
`Trainer.fit` stopped: `max_epochs=30` reached.
[I 2026-04-16 01:26:55,348] Trial 88 finished with value: 0.0971 and parameters: {'left_wall_dist_num_layers': 2, 'left_wall_dist_activation': 'elu', 'left_wall_dist_out_channels_l0': 83, 'left_wall_dist_pool_size_l0': 8, 'left_wall_dist_out_channels_l1': 54, 'left_wall_dist_pool_size_l1': 8, 'left_wall_dist_fc_hidden': 37, 'track_width_num_layers': 3, 'track_width_activation': 'relu', 'track_width_out_channels_l0': 62, 'track_width_pool_size_l0': 2, 'track_width_out_channels_l1': 213, 'track_width_pool_size_l1': 2, 'track_width_out_channels_l2': 70, 'track_width_pool_size_l2': 2, 'heading_error_num_layers': 4, 'heading_error_activation': 'elu', 'heading_error_out_channels_l0': 55, 'heading_error_pool_size_l0': 2, 'heading_error_out_channels_l1': 107, 'heading_error_pool_size_l1': 8, 'heading_error_out_channels_l2': 51, 'heading_error_pool_size_l2': 4, 'heading_error_out_channels_l3': 203, 'heading_error_pool_size_l3': 4, 'heading_error_fc_hidden': 71}. Best is trial 87 with value: 0.0923.
[rank: 0] Seed set to 42
GPU available: True (cuda), used: True
TPU available: False, using: 0 TPU cores
💡 Tip: For seamless cloud logging and experiment tracking, try installing [litlogger](https://pypi.org/project/litlogger/) to enable LitLogger, which logs metrics and artifacts automatically to the Lightning Experiments platform.
[rank: 0] Seed set to 42
GPU available: True (cuda), used: True
TPU available: False, using: 0 TPU cores
💡 Tip: For seamless cloud logging and experiment tracking, try installing [litlogger](https://pypi.org/project/litlogger/) to enable LitLogger, which logs metrics and artifacts automatically to the Lightning Experiments platform.
[rank: 0] Seed set to 42
GPU available: True (cuda), used: True
TPU available: False, using: 0 TPU cores
💡 Tip: For seamless cloud logging and experiment tracking, try installing [litlogger](https://pypi.org/project/litlogger/) to enable LitLogger, which logs metrics and artifacts automatically to the Lightning Experiments platform.
LOCAL_RANK: 0 - CUDA_VISIBLE_DEVICES: [0]
LOCAL_RANK: 0 - CUDA_VISIBLE_DEVICES: [0]
LOCAL_RANK: 0 - CUDA_VISIBLE_DEVICES: [0]
SLURM auto-requeueing enabled. Setting signal handlers.
SLURM auto-requeueing enabled. Setting signal handlers.
SLURM auto-requeueing enabled. Setting signal handlers.
`Trainer.fit` stopped: `max_epochs=30` reached.
`Trainer.fit` stopped: `max_epochs=30` reached.
`Trainer.fit` stopped: `max_epochs=30` reached.
[I 2026-04-16 01:29:45,417] Trial 89 finished with value: 0.1468 and parameters: {'left_wall_dist_num_layers': 2, 'left_wall_dist_activation': 'elu', 'left_wall_dist_out_channels_l0': 113, 'left_wall_dist_pool_size_l0': 8, 'left_wall_dist_out_channels_l1': 54, 'left_wall_dist_pool_size_l1': 8, 'left_wall_dist_fc_hidden': 36, 'track_width_num_layers': 3, 'track_width_activation': 'relu', 'track_width_out_channels_l0': 58, 'track_width_pool_size_l0': 2, 'track_width_out_channels_l1': 228, 'track_width_pool_size_l1': 2, 'track_width_out_channels_l2': 70, 'track_width_pool_size_l2': 2, 'heading_error_num_layers': 4, 'heading_error_activation': 'elu', 'heading_error_out_channels_l0': 54, 'heading_error_pool_size_l0': 2, 'heading_error_out_channels_l1': 121, 'heading_error_pool_size_l1': 8, 'heading_error_out_channels_l2': 50, 'heading_error_pool_size_l2': 4, 'heading_error_out_channels_l3': 200, 'heading_error_pool_size_l3': 4, 'heading_error_fc_hidden': 70}. Best is trial 87 with value: 0.0923.
[rank: 0] Seed set to 42
GPU available: True (cuda), used: True
TPU available: False, using: 0 TPU cores
💡 Tip: For seamless cloud logging and experiment tracking, try installing [litlogger](https://pypi.org/project/litlogger/) to enable LitLogger, which logs metrics and artifacts automatically to the Lightning Experiments platform.
[rank: 0] Seed set to 42
GPU available: True (cuda), used: True
TPU available: False, using: 0 TPU cores
💡 Tip: For seamless cloud logging and experiment tracking, try installing [litlogger](https://pypi.org/project/litlogger/) to enable LitLogger, which logs metrics and artifacts automatically to the Lightning Experiments platform.
[rank: 0] Seed set to 42
GPU available: True (cuda), used: True
TPU available: False, using: 0 TPU cores
💡 Tip: For seamless cloud logging and experiment tracking, try installing [litlogger](https://pypi.org/project/litlogger/) to enable LitLogger, which logs metrics and artifacts automatically to the Lightning Experiments platform.
LOCAL_RANK: 0 - CUDA_VISIBLE_DEVICES: [0]
LOCAL_RANK: 0 - CUDA_VISIBLE_DEVICES: [0]
SLURM auto-requeueing enabled. Setting signal handlers.
SLURM auto-requeueing enabled. Setting signal handlers.
LOCAL_RANK: 0 - CUDA_VISIBLE_DEVICES: [0]
SLURM auto-requeueing enabled. Setting signal handlers.
`Trainer.fit` stopped: `max_epochs=30` reached.
`Trainer.fit` stopped: `max_epochs=30` reached.
`Trainer.fit` stopped: `max_epochs=30` reached.
[I 2026-04-16 01:32:40,439] Trial 90 finished with value: 0.1493 and parameters: {'left_wall_dist_num_layers': 2, 'left_wall_dist_activation': 'elu', 'left_wall_dist_out_channels_l0': 84, 'left_wall_dist_pool_size_l0': 8, 'left_wall_dist_out_channels_l1': 60, 'left_wall_dist_pool_size_l1': 8, 'left_wall_dist_fc_hidden': 37, 'track_width_num_layers': 3, 'track_width_activation': 'relu', 'track_width_out_channels_l0': 63, 'track_width_pool_size_l0': 2, 'track_width_out_channels_l1': 217, 'track_width_pool_size_l1': 2, 'track_width_out_channels_l2': 84, 'track_width_pool_size_l2': 2, 'heading_error_num_layers': 4, 'heading_error_activation': 'elu', 'heading_error_out_channels_l0': 63, 'heading_error_pool_size_l0': 2, 'heading_error_out_channels_l1': 108, 'heading_error_pool_size_l1': 8, 'heading_error_out_channels_l2': 51, 'heading_error_pool_size_l2': 4, 'heading_error_out_channels_l3': 165, 'heading_error_pool_size_l3': 4, 'heading_error_fc_hidden': 76}. Best is trial 87 with value: 0.0923.
[rank: 0] Seed set to 42
[rank: 0] Seed set to 42
[rank: 0] Seed set to 42
GPU available: True (cuda), used: True
TPU available: False, using: 0 TPU cores
GPU available: True (cuda), used: True
TPU available: False, using: 0 TPU cores
💡 Tip: For seamless cloud logging and experiment tracking, try installing [litlogger](https://pypi.org/project/litlogger/) to enable LitLogger, which logs metrics and artifacts automatically to the Lightning Experiments platform.
💡 Tip: For seamless cloud logging and experiment tracking, try installing [litlogger](https://pypi.org/project/litlogger/) to enable LitLogger, which logs metrics and artifacts automatically to the Lightning Experiments platform.
GPU available: True (cuda), used: True
TPU available: False, using: 0 TPU cores
💡 Tip: For seamless cloud logging and experiment tracking, try installing [litlogger](https://pypi.org/project/litlogger/) to enable LitLogger, which logs metrics and artifacts automatically to the Lightning Experiments platform.
LOCAL_RANK: 0 - CUDA_VISIBLE_DEVICES: [0]
LOCAL_RANK: 0 - CUDA_VISIBLE_DEVICES: [0]
LOCAL_RANK: 0 - CUDA_VISIBLE_DEVICES: [0]
SLURM auto-requeueing enabled. Setting signal handlers.
SLURM auto-requeueing enabled. Setting signal handlers.
SLURM auto-requeueing enabled. Setting signal handlers.
`Trainer.fit` stopped: `max_epochs=30` reached.
`Trainer.fit` stopped: `max_epochs=30` reached.
`Trainer.fit` stopped: `max_epochs=30` reached.
[I 2026-04-16 01:35:31,330] Trial 91 finished with value: 0.0905 and parameters: {'left_wall_dist_num_layers': 2, 'left_wall_dist_activation': 'elu', 'left_wall_dist_out_channels_l0': 72, 'left_wall_dist_pool_size_l0': 8, 'left_wall_dist_out_channels_l1': 85, 'left_wall_dist_pool_size_l1': 8, 'left_wall_dist_fc_hidden': 33, 'track_width_num_layers': 3, 'track_width_activation': 'relu', 'track_width_out_channels_l0': 51, 'track_width_pool_size_l0': 2, 'track_width_out_channels_l1': 245, 'track_width_pool_size_l1': 2, 'track_width_out_channels_l2': 53, 'track_width_pool_size_l2': 2, 'track_width_fc_hidden': 126, 'heading_error_num_layers': 4, 'heading_error_activation': 'elu', 'heading_error_out_channels_l0': 50, 'heading_error_pool_size_l0': 2, 'heading_error_out_channels_l1': 94, 'heading_error_pool_size_l1': 8, 'heading_error_out_channels_l2': 68, 'heading_error_pool_size_l2': 4, 'heading_error_out_channels_l3': 232, 'heading_error_pool_size_l3': 4, 'heading_error_fc_hidden': 79}. Best is trial 91 with value: 0.0905.
[rank: 0] Seed set to 42
GPU available: True (cuda), used: True
TPU available: False, using: 0 TPU cores
💡 Tip: For seamless cloud logging and experiment tracking, try installing [litlogger](https://pypi.org/project/litlogger/) to enable LitLogger, which logs metrics and artifacts automatically to the Lightning Experiments platform.
[rank: 0] Seed set to 42
[rank: 0] Seed set to 42
GPU available: True (cuda), used: True
TPU available: False, using: 0 TPU cores
💡 Tip: For seamless cloud logging and experiment tracking, try installing [litlogger](https://pypi.org/project/litlogger/) to enable LitLogger, which logs metrics and artifacts automatically to the Lightning Experiments platform.
GPU available: True (cuda), used: True
TPU available: False, using: 0 TPU cores
💡 Tip: For seamless cloud logging and experiment tracking, try installing [litlogger](https://pypi.org/project/litlogger/) to enable LitLogger, which logs metrics and artifacts automatically to the Lightning Experiments platform.
LOCAL_RANK: 0 - CUDA_VISIBLE_DEVICES: [0]
LOCAL_RANK: 0 - CUDA_VISIBLE_DEVICES: [0]
LOCAL_RANK: 0 - CUDA_VISIBLE_DEVICES: [0]
SLURM auto-requeueing enabled. Setting signal handlers.
SLURM auto-requeueing enabled. Setting signal handlers.
SLURM auto-requeueing enabled. Setting signal handlers.
`Trainer.fit` stopped: `max_epochs=30` reached.
`Trainer.fit` stopped: `max_epochs=30` reached.
`Trainer.fit` stopped: `max_epochs=30` reached.
