[I 2026-04-15 23:09:00,214] Trial 40 finished with value: 0.2169 and parameters: {'left_wall_dist_num_layers': 2, 'left_wall_dist_activation': 'relu', 'left_wall_dist_out_channels_l0': 62, 'left_wall_dist_pool_size_l0': 8, 'left_wall_dist_out_channels_l1': 53, 'left_wall_dist_pool_size_l1': 8, 'left_wall_dist_fc_hidden': 60, 'track_width_num_layers': 2, 'track_width_activation': 'relu', 'track_width_out_channels_l0': 143, 'track_width_pool_size_l0': 2, 'track_width_out_channels_l1': 222, 'track_width_pool_size_l1': 4, 'heading_error_num_layers': 4, 'heading_error_activation': 'relu', 'heading_error_out_channels_l0': 66, 'heading_error_pool_size_l0': 8, 'heading_error_out_channels_l1': 230, 'heading_error_pool_size_l1': 8, 'heading_error_out_channels_l2': 87, 'heading_error_pool_size_l2': 8, 'heading_error_fc_hidden': 32}. Best is trial 23 with value: 0.0876.
[rank: 0] Seed set to 42
[rank: 0] Seed set to 42
[rank: 0] Seed set to 42
GPU available: True (cuda), used: True
TPU available: False, using: 0 TPU cores
💡 Tip: For seamless cloud logging and experiment tracking, try installing [litlogger](https://pypi.org/project/litlogger/) to enable LitLogger, which logs metrics and artifacts automatically to the Lightning Experiments platform.
GPU available: True (cuda), used: True
TPU available: False, using: 0 TPU cores
💡 Tip: For seamless cloud logging and experiment tracking, try installing [litlogger](https://pypi.org/project/litlogger/) to enable LitLogger, which logs metrics and artifacts automatically to the Lightning Experiments platform.
GPU available: True (cuda), used: True
TPU available: False, using: 0 TPU cores
💡 Tip: For seamless cloud logging and experiment tracking, try installing [litlogger](https://pypi.org/project/litlogger/) to enable LitLogger, which logs metrics and artifacts automatically to the Lightning Experiments platform.
LOCAL_RANK: 0 - CUDA_VISIBLE_DEVICES: [0]
LOCAL_RANK: 0 - CUDA_VISIBLE_DEVICES: [0]
LOCAL_RANK: 0 - CUDA_VISIBLE_DEVICES: [0]
SLURM auto-requeueing enabled. Setting signal handlers.
SLURM auto-requeueing enabled. Setting signal handlers.
SLURM auto-requeueing enabled. Setting signal handlers.
`Trainer.fit` stopped: `max_epochs=30` reached.
`Trainer.fit` stopped: `max_epochs=30` reached.
`Trainer.fit` stopped: `max_epochs=30` reached.
[I 2026-04-15 23:11:44,303] Trial 41 finished with value: 0.1161 and parameters: {'left_wall_dist_num_layers': 2, 'left_wall_dist_activation': 'relu', 'left_wall_dist_out_channels_l0': 85, 'left_wall_dist_pool_size_l0': 4, 'left_wall_dist_out_channels_l1': 198, 'left_wall_dist_pool_size_l1': 4, 'track_width_num_layers': 5, 'track_width_activation': 'relu', 'track_width_out_channels_l0': 175, 'track_width_pool_size_l0': 2, 'track_width_out_channels_l1': 196, 'track_width_pool_size_l1': 2, 'track_width_out_channels_l2': 73, 'track_width_pool_size_l2': 4, 'track_width_out_channels_l3': 44, 'track_width_pool_size_l3': 4, 'track_width_out_channels_l4': 43, 'track_width_pool_size_l4': 2, 'track_width_fc_hidden': 41, 'heading_error_num_layers': 3, 'heading_error_activation': 'relu', 'heading_error_out_channels_l0': 45, 'heading_error_pool_size_l0': 8, 'heading_error_out_channels_l1': 93, 'heading_error_pool_size_l1': 2, 'heading_error_out_channels_l2': 42, 'heading_error_pool_size_l2': 4, 'heading_error_fc_hidden': 71}. Best is trial 23 with value: 0.0876.
[rank: 0] Seed set to 42
[rank: 0] Seed set to 42
[rank: 0] Seed set to 42
GPU available: True (cuda), used: True
TPU available: False, using: 0 TPU cores
💡 Tip: For seamless cloud logging and experiment tracking, try installing [litlogger](https://pypi.org/project/litlogger/) to enable LitLogger, which logs metrics and artifacts automatically to the Lightning Experiments platform.
GPU available: True (cuda), used: True
TPU available: False, using: 0 TPU cores
💡 Tip: For seamless cloud logging and experiment tracking, try installing [litlogger](https://pypi.org/project/litlogger/) to enable LitLogger, which logs metrics and artifacts automatically to the Lightning Experiments platform.
GPU available: True (cuda), used: True
TPU available: False, using: 0 TPU cores
💡 Tip: For seamless cloud logging and experiment tracking, try installing [litlogger](https://pypi.org/project/litlogger/) to enable LitLogger, which logs metrics and artifacts automatically to the Lightning Experiments platform.
LOCAL_RANK: 0 - CUDA_VISIBLE_DEVICES: [0]
LOCAL_RANK: 0 - CUDA_VISIBLE_DEVICES: [0]
LOCAL_RANK: 0 - CUDA_VISIBLE_DEVICES: [0]
SLURM auto-requeueing enabled. Setting signal handlers.
SLURM auto-requeueing enabled. Setting signal handlers.
SLURM auto-requeueing enabled. Setting signal handlers.
`Trainer.fit` stopped: `max_epochs=30` reached.
`Trainer.fit` stopped: `max_epochs=30` reached.
`Trainer.fit` stopped: `max_epochs=30` reached.
[I 2026-04-15 23:14:30,357] Trial 42 finished with value: 0.1157 and parameters: {'left_wall_dist_num_layers': 2, 'left_wall_dist_activation': 'relu', 'left_wall_dist_out_channels_l0': 112, 'left_wall_dist_pool_size_l0': 4, 'left_wall_dist_out_channels_l1': 216, 'left_wall_dist_pool_size_l1': 4, 'track_width_num_layers': 5, 'track_width_activation': 'relu', 'track_width_out_channels_l0': 219, 'track_width_pool_size_l0': 2, 'track_width_out_channels_l1': 202, 'track_width_pool_size_l1': 2, 'track_width_out_channels_l2': 116, 'track_width_pool_size_l2': 4, 'track_width_out_channels_l3': 46, 'track_width_pool_size_l3': 4, 'track_width_out_channels_l4': 39, 'track_width_pool_size_l4': 2, 'track_width_fc_hidden': 42, 'heading_error_num_layers': 3, 'heading_error_activation': 'relu', 'heading_error_out_channels_l0': 43, 'heading_error_pool_size_l0': 8, 'heading_error_out_channels_l1': 80, 'heading_error_pool_size_l1': 2, 'heading_error_out_channels_l2': 47, 'heading_error_pool_size_l2': 4, 'heading_error_fc_hidden': 80}. Best is trial 23 with value: 0.0876.
[rank: 0] Seed set to 42
[rank: 0] Seed set to 42
[rank: 0] Seed set to 42
GPU available: True (cuda), used: True
TPU available: False, using: 0 TPU cores
💡 Tip: For seamless cloud logging and experiment tracking, try installing [litlogger](https://pypi.org/project/litlogger/) to enable LitLogger, which logs metrics and artifacts automatically to the Lightning Experiments platform.
GPU available: True (cuda), used: True
TPU available: False, using: 0 TPU cores
💡 Tip: For seamless cloud logging and experiment tracking, try installing [litlogger](https://pypi.org/project/litlogger/) to enable LitLogger, which logs metrics and artifacts automatically to the Lightning Experiments platform.
GPU available: True (cuda), used: True
TPU available: False, using: 0 TPU cores
💡 Tip: For seamless cloud logging and experiment tracking, try installing [litlogger](https://pypi.org/project/litlogger/) to enable LitLogger, which logs metrics and artifacts automatically to the Lightning Experiments platform.
LOCAL_RANK: 0 - CUDA_VISIBLE_DEVICES: [0]
LOCAL_RANK: 0 - CUDA_VISIBLE_DEVICES: [0]
LOCAL_RANK: 0 - CUDA_VISIBLE_DEVICES: [0]
SLURM auto-requeueing enabled. Setting signal handlers.
SLURM auto-requeueing enabled. Setting signal handlers.
SLURM auto-requeueing enabled. Setting signal handlers.
`Trainer.fit` stopped: `max_epochs=30` reached.
`Trainer.fit` stopped: `max_epochs=30` reached.
`Trainer.fit` stopped: `max_epochs=30` reached.
[I 2026-04-15 23:17:14,905] Trial 43 finished with value: 0.1083 and parameters: {'left_wall_dist_num_layers': 2, 'left_wall_dist_activation': 'relu', 'left_wall_dist_out_channels_l0': 82, 'left_wall_dist_pool_size_l0': 4, 'left_wall_dist_out_channels_l1': 155, 'left_wall_dist_pool_size_l1': 4, 'track_width_num_layers': 5, 'track_width_activation': 'relu', 'track_width_out_channels_l0': 156, 'track_width_pool_size_l0': 2, 'track_width_out_channels_l1': 146, 'track_width_pool_size_l1': 2, 'track_width_out_channels_l2': 80, 'track_width_pool_size_l2': 4, 'track_width_out_channels_l3': 157, 'track_width_pool_size_l3': 4, 'track_width_out_channels_l4': 58, 'track_width_pool_size_l4': 2, 'track_width_fc_hidden': 50, 'heading_error_num_layers': 3, 'heading_error_activation': 'relu', 'heading_error_out_channels_l0': 47, 'heading_error_pool_size_l0': 8, 'heading_error_out_channels_l1': 65, 'heading_error_pool_size_l1': 2, 'heading_error_out_channels_l2': 59, 'heading_error_pool_size_l2': 4, 'heading_error_fc_hidden': 69}. Best is trial 23 with value: 0.0876.
[rank: 0] Seed set to 42
[rank: 0] Seed set to 42
[rank: 0] Seed set to 42
GPU available: True (cuda), used: True
TPU available: False, using: 0 TPU cores
💡 Tip: For seamless cloud logging and experiment tracking, try installing [litlogger](https://pypi.org/project/litlogger/) to enable LitLogger, which logs metrics and artifacts automatically to the Lightning Experiments platform.
GPU available: True (cuda), used: True
TPU available: False, using: 0 TPU cores
💡 Tip: For seamless cloud logging and experiment tracking, try installing [litlogger](https://pypi.org/project/litlogger/) to enable LitLogger, which logs metrics and artifacts automatically to the Lightning Experiments platform.
GPU available: True (cuda), used: True
TPU available: False, using: 0 TPU cores
💡 Tip: For seamless cloud logging and experiment tracking, try installing [litlogger](https://pypi.org/project/litlogger/) to enable LitLogger, which logs metrics and artifacts automatically to the Lightning Experiments platform.
LOCAL_RANK: 0 - CUDA_VISIBLE_DEVICES: [0]
LOCAL_RANK: 0 - CUDA_VISIBLE_DEVICES: [0]
LOCAL_RANK: 0 - CUDA_VISIBLE_DEVICES: [0]
SLURM auto-requeueing enabled. Setting signal handlers.
SLURM auto-requeueing enabled. Setting signal handlers.
SLURM auto-requeueing enabled. Setting signal handlers.
`Trainer.fit` stopped: `max_epochs=30` reached.
`Trainer.fit` stopped: `max_epochs=30` reached.
`Trainer.fit` stopped: `max_epochs=30` reached.
[I 2026-04-15 23:19:55,870] Trial 44 finished with value: 0.1394 and parameters: {'left_wall_dist_num_layers': 2, 'left_wall_dist_activation': 'relu', 'left_wall_dist_out_channels_l0': 92, 'left_wall_dist_pool_size_l0': 4, 'left_wall_dist_out_channels_l1': 216, 'left_wall_dist_pool_size_l1': 4, 'track_width_num_layers': 5, 'track_width_activation': 'relu', 'track_width_out_channels_l0': 114, 'track_width_pool_size_l0': 2, 'track_width_out_channels_l1': 170, 'track_width_pool_size_l1': 2, 'track_width_out_channels_l2': 61, 'track_width_pool_size_l2': 4, 'track_width_out_channels_l3': 40, 'track_width_pool_size_l3': 4, 'track_width_out_channels_l4': 41, 'track_width_pool_size_l4': 2, 'track_width_fc_hidden': 39, 'heading_error_num_layers': 3, 'heading_error_activation': 'relu', 'heading_error_out_channels_l0': 37, 'heading_error_pool_size_l0': 8, 'heading_error_out_channels_l1': 100, 'heading_error_pool_size_l1': 2, 'heading_error_out_channels_l2': 41, 'heading_error_pool_size_l2': 4, 'heading_error_fc_hidden': 54}. Best is trial 23 with value: 0.0876.
[rank: 0] Seed set to 42
[rank: 0] Seed set to 42
[rank: 0] Seed set to 42
GPU available: True (cuda), used: True
TPU available: False, using: 0 TPU cores
💡 Tip: For seamless cloud logging and experiment tracking, try installing [litlogger](https://pypi.org/project/litlogger/) to enable LitLogger, which logs metrics and artifacts automatically to the Lightning Experiments platform.
GPU available: True (cuda), used: True
TPU available: False, using: 0 TPU cores
💡 Tip: For seamless cloud logging and experiment tracking, try installing [litlogger](https://pypi.org/project/litlogger/) to enable LitLogger, which logs metrics and artifacts automatically to the Lightning Experiments platform.
GPU available: True (cuda), used: True
TPU available: False, using: 0 TPU cores
💡 Tip: For seamless cloud logging and experiment tracking, try installing [litlogger](https://pypi.org/project/litlogger/) to enable LitLogger, which logs metrics and artifacts automatically to the Lightning Experiments platform.
LOCAL_RANK: 0 - CUDA_VISIBLE_DEVICES: [0]
LOCAL_RANK: 0 - CUDA_VISIBLE_DEVICES: [0]
LOCAL_RANK: 0 - CUDA_VISIBLE_DEVICES: [0]
SLURM auto-requeueing enabled. Setting signal handlers.
SLURM auto-requeueing enabled. Setting signal handlers.
SLURM auto-requeueing enabled. Setting signal handlers.
`Trainer.fit` stopped: `max_epochs=30` reached.
`Trainer.fit` stopped: `max_epochs=30` reached.
`Trainer.fit` stopped: `max_epochs=30` reached.
[I 2026-04-15 23:22:39,245] Trial 45 finished with value: 0.1465 and parameters: {'left_wall_dist_num_layers': 2, 'left_wall_dist_activation': 'relu', 'left_wall_dist_out_channels_l0': 49, 'left_wall_dist_pool_size_l0': 4, 'left_wall_dist_out_channels_l1': 198, 'left_wall_dist_pool_size_l1': 4, 'track_width_num_layers': 5, 'track_width_activation': 'relu', 'track_width_out_channels_l0': 140, 'track_width_pool_size_l0': 4, 'track_width_out_channels_l1': 230, 'track_width_pool_size_l1': 2, 'track_width_out_channels_l2': 52, 'track_width_pool_size_l2': 4, 'track_width_out_channels_l3': 127, 'track_width_pool_size_l3': 4, 'track_width_out_channels_l4': 73, 'track_width_pool_size_l4': 2, 'track_width_fc_hidden': 35, 'heading_error_num_layers': 3, 'heading_error_activation': 'relu', 'heading_error_out_channels_l0': 51, 'heading_error_pool_size_l0': 2, 'heading_error_out_channels_l1': 143, 'heading_error_pool_size_l1': 2, 'heading_error_out_channels_l2': 114, 'heading_error_pool_size_l2': 2}. Best is trial 23 with value: 0.0876.
[rank: 0] Seed set to 42
[rank: 0] Seed set to 42
[rank: 0] Seed set to 42
GPU available: True (cuda), used: True
TPU available: False, using: 0 TPU cores
GPU available: True (cuda), used: True
TPU available: False, using: 0 TPU cores
💡 Tip: For seamless cloud logging and experiment tracking, try installing [litlogger](https://pypi.org/project/litlogger/) to enable LitLogger, which logs metrics and artifacts automatically to the Lightning Experiments platform.
💡 Tip: For seamless cloud logging and experiment tracking, try installing [litlogger](https://pypi.org/project/litlogger/) to enable LitLogger, which logs metrics and artifacts automatically to the Lightning Experiments platform.
GPU available: True (cuda), used: True
TPU available: False, using: 0 TPU cores
💡 Tip: For seamless cloud logging and experiment tracking, try installing [litlogger](https://pypi.org/project/litlogger/) to enable LitLogger, which logs metrics and artifacts automatically to the Lightning Experiments platform.
LOCAL_RANK: 0 - CUDA_VISIBLE_DEVICES: [0]
LOCAL_RANK: 0 - CUDA_VISIBLE_DEVICES: [0]
LOCAL_RANK: 0 - CUDA_VISIBLE_DEVICES: [0]
SLURM auto-requeueing enabled. Setting signal handlers.
SLURM auto-requeueing enabled. Setting signal handlers.
SLURM auto-requeueing enabled. Setting signal handlers.
`Trainer.fit` stopped: `max_epochs=30` reached.
`Trainer.fit` stopped: `max_epochs=30` reached.
`Trainer.fit` stopped: `max_epochs=30` reached.
[I 2026-04-15 23:25:17,135] Trial 46 finished with value: 0.1521 and parameters: {'left_wall_dist_num_layers': 2, 'left_wall_dist_activation': 'relu', 'left_wall_dist_out_channels_l0': 62, 'left_wall_dist_pool_size_l0': 8, 'left_wall_dist_out_channels_l1': 225, 'left_wall_dist_pool_size_l1': 4, 'left_wall_dist_fc_hidden': 122, 'track_width_num_layers': 5, 'track_width_activation': 'relu', 'track_width_out_channels_l0': 174, 'track_width_pool_size_l0': 2, 'track_width_out_channels_l1': 73, 'track_width_pool_size_l1': 2, 'track_width_out_channels_l2': 96, 'track_width_pool_size_l2': 4, 'track_width_out_channels_l3': 63, 'track_width_pool_size_l3': 4, 'track_width_out_channels_l4': 51, 'track_width_pool_size_l4': 8, 'heading_error_num_layers': 3, 'heading_error_activation': 'relu', 'heading_error_out_channels_l0': 42, 'heading_error_pool_size_l0': 8, 'heading_error_out_channels_l1': 113, 'heading_error_pool_size_l1': 2, 'heading_error_out_channels_l2': 34, 'heading_error_pool_size_l2': 4, 'heading_error_fc_hidden': 70}. Best is trial 23 with value: 0.0876.
[rank: 0] Seed set to 42
[rank: 0] Seed set to 42
GPU available: True (cuda), used: True
TPU available: False, using: 0 TPU cores
💡 Tip: For seamless cloud logging and experiment tracking, try installing [litlogger](https://pypi.org/project/litlogger/) to enable LitLogger, which logs metrics and artifacts automatically to the Lightning Experiments platform.
GPU available: True (cuda), used: True
TPU available: False, using: 0 TPU cores
💡 Tip: For seamless cloud logging and experiment tracking, try installing [litlogger](https://pypi.org/project/litlogger/) to enable LitLogger, which logs metrics and artifacts automatically to the Lightning Experiments platform.
[rank: 0] Seed set to 42
GPU available: True (cuda), used: True
TPU available: False, using: 0 TPU cores
💡 Tip: For seamless cloud logging and experiment tracking, try installing [litlogger](https://pypi.org/project/litlogger/) to enable LitLogger, which logs metrics and artifacts automatically to the Lightning Experiments platform.
LOCAL_RANK: 0 - CUDA_VISIBLE_DEVICES: [0]
LOCAL_RANK: 0 - CUDA_VISIBLE_DEVICES: [0]
LOCAL_RANK: 0 - CUDA_VISIBLE_DEVICES: [0]
SLURM auto-requeueing enabled. Setting signal handlers.
SLURM auto-requeueing enabled. Setting signal handlers.
SLURM auto-requeueing enabled. Setting signal handlers.
`Trainer.fit` stopped: `max_epochs=30` reached.
`Trainer.fit` stopped: `max_epochs=30` reached.
`Trainer.fit` stopped: `max_epochs=30` reached.
[I 2026-04-15 23:28:05,064] Trial 47 finished with value: 0.1399 and parameters: {'left_wall_dist_num_layers': 3, 'left_wall_dist_activation': 'relu', 'left_wall_dist_out_channels_l0': 36, 'left_wall_dist_pool_size_l0': 4, 'left_wall_dist_out_channels_l1': 79, 'left_wall_dist_pool_size_l1': 2, 'left_wall_dist_out_channels_l2': 113, 'left_wall_dist_pool_size_l2': 4, 'left_wall_dist_fc_hidden': 81, 'track_width_num_layers': 4, 'track_width_activation': 'relu', 'track_width_out_channels_l0': 98, 'track_width_pool_size_l0': 2, 'track_width_out_channels_l1': 190, 'track_width_pool_size_l1': 2, 'track_width_out_channels_l2': 72, 'track_width_pool_size_l2': 2, 'track_width_out_channels_l3': 85, 'track_width_pool_size_l3': 4, 'track_width_fc_hidden': 48, 'heading_error_num_layers': 5, 'heading_error_activation': 'elu', 'heading_error_out_channels_l0': 84, 'heading_error_pool_size_l0': 4, 'heading_error_out_channels_l1': 187, 'heading_error_pool_size_l1': 8, 'heading_error_out_channels_l2': 104, 'heading_error_pool_size_l2': 8, 'heading_error_out_channels_l3': 53, 'heading_error_pool_size_l3': 8}. Best is trial 23 with value: 0.0876.
[rank: 0] Seed set to 42
[rank: 0] Seed set to 42
[rank: 0] Seed set to 42
GPU available: True (cuda), used: True
TPU available: False, using: 0 TPU cores
💡 Tip: For seamless cloud logging and experiment tracking, try installing [litlogger](https://pypi.org/project/litlogger/) to enable LitLogger, which logs metrics and artifacts automatically to the Lightning Experiments platform.
GPU available: True (cuda), used: True
TPU available: False, using: 0 TPU cores
💡 Tip: For seamless cloud logging and experiment tracking, try installing [litlogger](https://pypi.org/project/litlogger/) to enable LitLogger, which logs metrics and artifacts automatically to the Lightning Experiments platform.
GPU available: True (cuda), used: True
TPU available: False, using: 0 TPU cores
💡 Tip: For seamless cloud logging and experiment tracking, try installing [litlogger](https://pypi.org/project/litlogger/) to enable LitLogger, which logs metrics and artifacts automatically to the Lightning Experiments platform.
LOCAL_RANK: 0 - CUDA_VISIBLE_DEVICES: [0]
LOCAL_RANK: 0 - CUDA_VISIBLE_DEVICES: [0]
LOCAL_RANK: 0 - CUDA_VISIBLE_DEVICES: [0]
SLURM auto-requeueing enabled. Setting signal handlers.
SLURM auto-requeueing enabled. Setting signal handlers.
SLURM auto-requeueing enabled. Setting signal handlers.
`Trainer.fit` stopped: `max_epochs=30` reached.
`Trainer.fit` stopped: `max_epochs=30` reached.
`Trainer.fit` stopped: `max_epochs=30` reached.
