[I 2026-04-16 01:56:29,014] Trial 114 finished with value: 0.117 and parameters: {'left_wall_dist_num_layers': 2, 'left_wall_dist_activation': 'elu', 'left_wall_dist_out_channels_l0': 112, 'left_wall_dist_pool_size_l0': 8, 'left_wall_dist_out_channels_l1': 124, 'left_wall_dist_pool_size_l1': 8, 'left_wall_dist_fc_hidden': 80, 'track_width_num_layers': 3, 'track_width_activation': 'relu', 'track_width_out_channels_l0': 68, 'track_width_pool_size_l0': 4, 'track_width_out_channels_l1': 52, 'track_width_pool_size_l1': 4, 'track_width_out_channels_l2': 65, 'track_width_pool_size_l2': 4, 'track_width_fc_hidden': 70, 'heading_error_num_layers': 3, 'heading_error_activation': 'elu', 'heading_error_out_channels_l0': 255, 'heading_error_pool_size_l0': 8, 'heading_error_out_channels_l1': 85, 'heading_error_pool_size_l1': 4, 'heading_error_out_channels_l2': 153, 'heading_error_pool_size_l2': 4, 'heading_error_fc_hidden': 58}. Best is trial 56 with value: 0.0844.
[rank: 0] Seed set to 42
[rank: 0] Seed set to 42
[rank: 0] Seed set to 42
GPU available: True (cuda), used: True
TPU available: False, using: 0 TPU cores
GPU available: True (cuda), used: True
TPU available: False, using: 0 TPU cores
GPU available: True (cuda), used: True
TPU available: False, using: 0 TPU cores
💡 Tip: For seamless cloud logging and experiment tracking, try installing [litlogger](https://pypi.org/project/litlogger/) to enable LitLogger, which logs metrics and artifacts automatically to the Lightning Experiments platform.
💡 Tip: For seamless cloud logging and experiment tracking, try installing [litlogger](https://pypi.org/project/litlogger/) to enable LitLogger, which logs metrics and artifacts automatically to the Lightning Experiments platform.
💡 Tip: For seamless cloud logging and experiment tracking, try installing [litlogger](https://pypi.org/project/litlogger/) to enable LitLogger, which logs metrics and artifacts automatically to the Lightning Experiments platform.
LOCAL_RANK: 0 - CUDA_VISIBLE_DEVICES: [0]
LOCAL_RANK: 0 - CUDA_VISIBLE_DEVICES: [0]
LOCAL_RANK: 0 - CUDA_VISIBLE_DEVICES: [0]
SLURM auto-requeueing enabled. Setting signal handlers.
SLURM auto-requeueing enabled. Setting signal handlers.
SLURM auto-requeueing enabled. Setting signal handlers.
`Trainer.fit` stopped: `max_epochs=30` reached.
`Trainer.fit` stopped: `max_epochs=30` reached.
`Trainer.fit` stopped: `max_epochs=30` reached.
[I 2026-04-16 01:58:54,036] Trial 115 finished with value: 0.0985 and parameters: {'left_wall_dist_num_layers': 2, 'left_wall_dist_activation': 'elu', 'left_wall_dist_out_channels_l0': 82, 'left_wall_dist_pool_size_l0': 8, 'left_wall_dist_out_channels_l1': 91, 'left_wall_dist_pool_size_l1': 8, 'left_wall_dist_fc_hidden': 87, 'track_width_num_layers': 3, 'track_width_activation': 'relu', 'track_width_out_channels_l0': 71, 'track_width_pool_size_l0': 4, 'track_width_out_channels_l1': 37, 'track_width_pool_size_l1': 4, 'track_width_out_channels_l2': 89, 'track_width_pool_size_l2': 4, 'track_width_fc_hidden': 80, 'heading_error_num_layers': 3, 'heading_error_activation': 'elu', 'heading_error_out_channels_l0': 214, 'heading_error_pool_size_l0': 2, 'heading_error_out_channels_l1': 88, 'heading_error_pool_size_l1': 4, 'heading_error_out_channels_l2': 137, 'heading_error_pool_size_l2': 4, 'heading_error_fc_hidden': 72}. Best is trial 56 with value: 0.0844.
[rank: 0] Seed set to 42
[rank: 0] Seed set to 42
[rank: 0] Seed set to 42
GPU available: True (cuda), used: True
TPU available: False, using: 0 TPU cores
💡 Tip: For seamless cloud logging and experiment tracking, try installing [litlogger](https://pypi.org/project/litlogger/) to enable LitLogger, which logs metrics and artifacts automatically to the Lightning Experiments platform.
GPU available: True (cuda), used: True
TPU available: False, using: 0 TPU cores
💡 Tip: For seamless cloud logging and experiment tracking, try installing [litlogger](https://pypi.org/project/litlogger/) to enable LitLogger, which logs metrics and artifacts automatically to the Lightning Experiments platform.
GPU available: True (cuda), used: True
TPU available: False, using: 0 TPU cores
💡 Tip: For seamless cloud logging and experiment tracking, try installing [litlogger](https://pypi.org/project/litlogger/) to enable LitLogger, which logs metrics and artifacts automatically to the Lightning Experiments platform.
LOCAL_RANK: 0 - CUDA_VISIBLE_DEVICES: [0]
LOCAL_RANK: 0 - CUDA_VISIBLE_DEVICES: [0]
LOCAL_RANK: 0 - CUDA_VISIBLE_DEVICES: [0]
SLURM auto-requeueing enabled. Setting signal handlers.
SLURM auto-requeueing enabled. Setting signal handlers.
SLURM auto-requeueing enabled. Setting signal handlers.
`Trainer.fit` stopped: `max_epochs=30` reached.
`Trainer.fit` stopped: `max_epochs=30` reached.
`Trainer.fit` stopped: `max_epochs=30` reached.
[I 2026-04-16 02:01:20,195] Trial 116 finished with value: 0.1083 and parameters: {'left_wall_dist_num_layers': 2, 'left_wall_dist_activation': 'elu', 'left_wall_dist_out_channels_l0': 104, 'left_wall_dist_pool_size_l0': 8, 'left_wall_dist_out_channels_l1': 111, 'left_wall_dist_pool_size_l1': 8, 'left_wall_dist_fc_hidden': 87, 'track_width_num_layers': 3, 'track_width_activation': 'relu', 'track_width_out_channels_l0': 43, 'track_width_pool_size_l0': 4, 'track_width_out_channels_l1': 45, 'track_width_pool_size_l1': 4, 'track_width_out_channels_l2': 83, 'track_width_pool_size_l2': 8, 'track_width_fc_hidden': 71, 'heading_error_num_layers': 3, 'heading_error_activation': 'elu', 'heading_error_out_channels_l0': 238, 'heading_error_pool_size_l0': 2, 'heading_error_out_channels_l1': 92, 'heading_error_pool_size_l1': 4, 'heading_error_out_channels_l2': 179, 'heading_error_pool_size_l2': 4, 'heading_error_fc_hidden': 94}. Best is trial 56 with value: 0.0844.
[rank: 0] Seed set to 42
[rank: 0] Seed set to 42
[rank: 0] Seed set to 42
GPU available: True (cuda), used: True
TPU available: False, using: 0 TPU cores
💡 Tip: For seamless cloud logging and experiment tracking, try installing [litlogger](https://pypi.org/project/litlogger/) to enable LitLogger, which logs metrics and artifacts automatically to the Lightning Experiments platform.
GPU available: True (cuda), used: True
TPU available: False, using: 0 TPU cores
💡 Tip: For seamless cloud logging and experiment tracking, try installing [litlogger](https://pypi.org/project/litlogger/) to enable LitLogger, which logs metrics and artifacts automatically to the Lightning Experiments platform.
GPU available: True (cuda), used: True
TPU available: False, using: 0 TPU cores
💡 Tip: For seamless cloud logging and experiment tracking, try installing [litlogger](https://pypi.org/project/litlogger/) to enable LitLogger, which logs metrics and artifacts automatically to the Lightning Experiments platform.
LOCAL_RANK: 0 - CUDA_VISIBLE_DEVICES: [0]
LOCAL_RANK: 0 - CUDA_VISIBLE_DEVICES: [0]
LOCAL_RANK: 0 - CUDA_VISIBLE_DEVICES: [0]
SLURM auto-requeueing enabled. Setting signal handlers.
SLURM auto-requeueing enabled. Setting signal handlers.
SLURM auto-requeueing enabled. Setting signal handlers.
`Trainer.fit` stopped: `max_epochs=30` reached.
`Trainer.fit` stopped: `max_epochs=30` reached.
`Trainer.fit` stopped: `max_epochs=30` reached.
[I 2026-04-16 02:03:42,295] Trial 117 finished with value: 0.1074 and parameters: {'left_wall_dist_num_layers': 2, 'left_wall_dist_activation': 'elu', 'left_wall_dist_out_channels_l0': 192, 'left_wall_dist_pool_size_l0': 8, 'left_wall_dist_out_channels_l1': 108, 'left_wall_dist_pool_size_l1': 8, 'left_wall_dist_fc_hidden': 78, 'track_width_num_layers': 3, 'track_width_activation': 'relu', 'track_width_out_channels_l0': 95, 'track_width_pool_size_l0': 4, 'track_width_out_channels_l1': 34, 'track_width_pool_size_l1': 4, 'track_width_out_channels_l2': 109, 'track_width_pool_size_l2': 4, 'track_width_fc_hidden': 65, 'heading_error_num_layers': 3, 'heading_error_activation': 'elu', 'heading_error_out_channels_l0': 77, 'heading_error_pool_size_l0': 2, 'heading_error_out_channels_l1': 73, 'heading_error_pool_size_l1': 4, 'heading_error_out_channels_l2': 144, 'heading_error_pool_size_l2': 4, 'heading_error_fc_hidden': 76}. Best is trial 56 with value: 0.0844.
[rank: 0] Seed set to 42
[rank: 0] Seed set to 42
[rank: 0] Seed set to 42
GPU available: True (cuda), used: True
GPU available: True (cuda), used: True
TPU available: False, using: 0 TPU cores
GPU available: True (cuda), used: True
TPU available: False, using: 0 TPU cores
TPU available: False, using: 0 TPU cores
💡 Tip: For seamless cloud logging and experiment tracking, try installing [litlogger](https://pypi.org/project/litlogger/) to enable LitLogger, which logs metrics and artifacts automatically to the Lightning Experiments platform.
💡 Tip: For seamless cloud logging and experiment tracking, try installing [litlogger](https://pypi.org/project/litlogger/) to enable LitLogger, which logs metrics and artifacts automatically to the Lightning Experiments platform.
💡 Tip: For seamless cloud logging and experiment tracking, try installing [litlogger](https://pypi.org/project/litlogger/) to enable LitLogger, which logs metrics and artifacts automatically to the Lightning Experiments platform.
LOCAL_RANK: 0 - CUDA_VISIBLE_DEVICES: [0]
LOCAL_RANK: 0 - CUDA_VISIBLE_DEVICES: [0]
LOCAL_RANK: 0 - CUDA_VISIBLE_DEVICES: [0]
SLURM auto-requeueing enabled. Setting signal handlers.
SLURM auto-requeueing enabled. Setting signal handlers.
SLURM auto-requeueing enabled. Setting signal handlers.
`Trainer.fit` stopped: `max_epochs=30` reached.
`Trainer.fit` stopped: `max_epochs=30` reached.
`Trainer.fit` stopped: `max_epochs=30` reached.
[I 2026-04-16 02:06:02,925] Trial 118 finished with value: 0.0978 and parameters: {'left_wall_dist_num_layers': 2, 'left_wall_dist_activation': 'elu', 'left_wall_dist_out_channels_l0': 124, 'left_wall_dist_pool_size_l0': 8, 'left_wall_dist_out_channels_l1': 121, 'left_wall_dist_pool_size_l1': 8, 'left_wall_dist_fc_hidden': 75, 'track_width_num_layers': 3, 'track_width_activation': 'relu', 'track_width_out_channels_l0': 47, 'track_width_pool_size_l0': 4, 'track_width_out_channels_l1': 36, 'track_width_pool_size_l1': 8, 'track_width_out_channels_l2': 58, 'track_width_pool_size_l2': 4, 'track_width_fc_hidden': 73, 'heading_error_num_layers': 3, 'heading_error_activation': 'elu', 'heading_error_out_channels_l0': 206, 'heading_error_pool_size_l0': 2, 'heading_error_out_channels_l1': 49, 'heading_error_pool_size_l1': 4, 'heading_error_out_channels_l2': 108, 'heading_error_pool_size_l2': 2, 'heading_error_fc_hidden': 113}. Best is trial 56 with value: 0.0844.
[rank: 0] Seed set to 42
[rank: 0] Seed set to 42
[rank: 0] Seed set to 42
GPU available: True (cuda), used: True
TPU available: False, using: 0 TPU cores
💡 Tip: For seamless cloud logging and experiment tracking, try installing [litlogger](https://pypi.org/project/litlogger/) to enable LitLogger, which logs metrics and artifacts automatically to the Lightning Experiments platform.
GPU available: True (cuda), used: True
TPU available: False, using: 0 TPU cores
💡 Tip: For seamless cloud logging and experiment tracking, try installing [litlogger](https://pypi.org/project/litlogger/) to enable LitLogger, which logs metrics and artifacts automatically to the Lightning Experiments platform.
GPU available: True (cuda), used: True
TPU available: False, using: 0 TPU cores
💡 Tip: For seamless cloud logging and experiment tracking, try installing [litlogger](https://pypi.org/project/litlogger/) to enable LitLogger, which logs metrics and artifacts automatically to the Lightning Experiments platform.
LOCAL_RANK: 0 - CUDA_VISIBLE_DEVICES: [0]
LOCAL_RANK: 0 - CUDA_VISIBLE_DEVICES: [0]
LOCAL_RANK: 0 - CUDA_VISIBLE_DEVICES: [0]
SLURM auto-requeueing enabled. Setting signal handlers.
SLURM auto-requeueing enabled. Setting signal handlers.
SLURM auto-requeueing enabled. Setting signal handlers.
`Trainer.fit` stopped: `max_epochs=30` reached.
`Trainer.fit` stopped: `max_epochs=30` reached.
`Trainer.fit` stopped: `max_epochs=30` reached.
[I 2026-04-16 02:08:30,481] Trial 119 finished with value: 0.0992 and parameters: {'left_wall_dist_num_layers': 2, 'left_wall_dist_activation': 'elu', 'left_wall_dist_out_channels_l0': 136, 'left_wall_dist_pool_size_l0': 8, 'left_wall_dist_out_channels_l1': 95, 'left_wall_dist_pool_size_l1': 8, 'left_wall_dist_fc_hidden': 72, 'track_width_num_layers': 3, 'track_width_activation': 'relu', 'track_width_out_channels_l0': 76, 'track_width_pool_size_l0': 4, 'track_width_out_channels_l1': 42, 'track_width_pool_size_l1': 4, 'track_width_out_channels_l2': 64, 'track_width_pool_size_l2': 4, 'track_width_fc_hidden': 62, 'heading_error_num_layers': 3, 'heading_error_activation': 'elu', 'heading_error_out_channels_l0': 253, 'heading_error_pool_size_l0': 2, 'heading_error_out_channels_l1': 32, 'heading_error_pool_size_l1': 4, 'heading_error_out_channels_l2': 115, 'heading_error_pool_size_l2': 4, 'heading_error_fc_hidden': 64}. Best is trial 56 with value: 0.0844.
