[I 2026-05-08 19:03:51,686] Trial 48 pruned. Conv channel counts must be non-decreasing.
[rank: 0] Seed set to 42
[rank: 0] Seed set to 42
[rank: 0] Seed set to 42
GPU available: True (cuda), used: True
TPU available: False, using: 0 TPU cores
💡 Tip: For seamless cloud logging and experiment tracking, try installing [litlogger](https://pypi.org/project/litlogger/) to enable LitLogger, which logs metrics and artifacts automatically to the Lightning Experiments platform.
GPU available: True (cuda), used: True
TPU available: False, using: 0 TPU cores
💡 Tip: For seamless cloud logging and experiment tracking, try installing [litlogger](https://pypi.org/project/litlogger/) to enable LitLogger, which logs metrics and artifacts automatically to the Lightning Experiments platform.
GPU available: True (cuda), used: True
TPU available: False, using: 0 TPU cores
💡 Tip: For seamless cloud logging and experiment tracking, try installing [litlogger](https://pypi.org/project/litlogger/) to enable LitLogger, which logs metrics and artifacts automatically to the Lightning Experiments platform.
LOCAL_RANK: 0 - CUDA_VISIBLE_DEVICES: [0]
LOCAL_RANK: 0 - CUDA_VISIBLE_DEVICES: [0]
LOCAL_RANK: 0 - CUDA_VISIBLE_DEVICES: [0]
SLURM auto-requeueing enabled. Setting signal handlers.
SLURM auto-requeueing enabled. Setting signal handlers.
SLURM auto-requeueing enabled. Setting signal handlers.
`Trainer.fit` stopped: `max_epochs=30` reached.
`Trainer.fit` stopped: `max_epochs=30` reached.
`Trainer.fit` stopped: `max_epochs=30` reached.
[I 2026-05-08 19:06:59,741] Trial 49 finished with value: 0.1127 and parameters: {'optimizer': 'adam', 'left_wall_dist_num_layers': 3, 'left_wall_dist_activation': 'relu', 'left_wall_dist_fc_layers': 'fc64', 'left_wall_dist_pool_size_l0': 4, 'left_wall_dist_out_channels_l0': 16, 'left_wall_dist_pool_size_l1': 3, 'left_wall_dist_out_channels_l1': 16, 'left_wall_dist_pool_size_l2': 4, 'left_wall_dist_out_channels_l2': 24, 'track_width_num_layers': 2, 'track_width_activation': 'elu', 'track_width_fc_layers': 'fc64', 'track_width_pool_size_l0': 4, 'track_width_out_channels_l0': 4, 'track_width_pool_size_l1': 2, 'track_width_out_channels_l1': 32, 'heading_error_num_layers': 2, 'heading_error_activation': 'elu', 'heading_error_fc_layers': 'fc32', 'heading_error_pool_size_l0': 3, 'heading_error_out_channels_l0': 8, 'heading_error_pool_size_l1': 4, 'heading_error_out_channels_l1': 8}. Best is trial 6 with value: 0.0997.
[rank: 0] Seed set to 42
[rank: 0] Seed set to 42
[rank: 0] Seed set to 42
GPU available: True (cuda), used: True
TPU available: False, using: 0 TPU cores
💡 Tip: For seamless cloud logging and experiment tracking, try installing [litlogger](https://pypi.org/project/litlogger/) to enable LitLogger, which logs metrics and artifacts automatically to the Lightning Experiments platform.
GPU available: True (cuda), used: True
TPU available: False, using: 0 TPU cores
💡 Tip: For seamless cloud logging and experiment tracking, try installing [litlogger](https://pypi.org/project/litlogger/) to enable LitLogger, which logs metrics and artifacts automatically to the Lightning Experiments platform.
GPU available: True (cuda), used: True
TPU available: False, using: 0 TPU cores
💡 Tip: For seamless cloud logging and experiment tracking, try installing [litlogger](https://pypi.org/project/litlogger/) to enable LitLogger, which logs metrics and artifacts automatically to the Lightning Experiments platform.
LOCAL_RANK: 0 - CUDA_VISIBLE_DEVICES: [0]
LOCAL_RANK: 0 - CUDA_VISIBLE_DEVICES: [0]
LOCAL_RANK: 0 - CUDA_VISIBLE_DEVICES: [0]
SLURM auto-requeueing enabled. Setting signal handlers.
SLURM auto-requeueing enabled. Setting signal handlers.
SLURM auto-requeueing enabled. Setting signal handlers.
`Trainer.fit` stopped: `max_epochs=30` reached.
`Trainer.fit` stopped: `max_epochs=30` reached.
`Trainer.fit` stopped: `max_epochs=30` reached.
[I 2026-05-08 19:09:27,795] Trial 50 finished with value: 0.1464 and parameters: {'optimizer': 'adam', 'left_wall_dist_num_layers': 2, 'left_wall_dist_activation': 'elu', 'left_wall_dist_fc_layers': 'fc64_32', 'left_wall_dist_pool_size_l0': 3, 'left_wall_dist_out_channels_l0': 4, 'left_wall_dist_pool_size_l1': 3, 'left_wall_dist_out_channels_l1': 24, 'track_width_num_layers': 1, 'track_width_activation': 'relu', 'track_width_fc_layers': 'fc16', 'track_width_pool_size_l0': 2, 'track_width_out_channels_l0': 8, 'heading_error_num_layers': 1, 'heading_error_activation': 'relu', 'heading_error_fc_layers': 'fc128_64', 'heading_error_pool_size_l0': 2, 'heading_error_out_channels_l0': 16}. Best is trial 6 with value: 0.0997.
[rank: 0] Seed set to 42
GPU available: True (cuda), used: True
TPU available: False, using: 0 TPU cores
💡 Tip: For seamless cloud logging and experiment tracking, try installing [litlogger](https://pypi.org/project/litlogger/) to enable LitLogger, which logs metrics and artifacts automatically to the Lightning Experiments platform.
[rank: 0] Seed set to 42
[rank: 0] Seed set to 42
GPU available: True (cuda), used: True
TPU available: False, using: 0 TPU cores
💡 Tip: For seamless cloud logging and experiment tracking, try installing [litlogger](https://pypi.org/project/litlogger/) to enable LitLogger, which logs metrics and artifacts automatically to the Lightning Experiments platform.
GPU available: True (cuda), used: True
TPU available: False, using: 0 TPU cores
💡 Tip: For seamless cloud logging and experiment tracking, try installing [litlogger](https://pypi.org/project/litlogger/) to enable LitLogger, which logs metrics and artifacts automatically to the Lightning Experiments platform.
LOCAL_RANK: 0 - CUDA_VISIBLE_DEVICES: [0]
SLURM auto-requeueing enabled. Setting signal handlers.
LOCAL_RANK: 0 - CUDA_VISIBLE_DEVICES: [0]
LOCAL_RANK: 0 - CUDA_VISIBLE_DEVICES: [0]
SLURM auto-requeueing enabled. Setting signal handlers.
SLURM auto-requeueing enabled. Setting signal handlers.
`Trainer.fit` stopped: `max_epochs=30` reached.
`Trainer.fit` stopped: `max_epochs=30` reached.
`Trainer.fit` stopped: `max_epochs=30` reached.
[I 2026-05-08 19:12:34,070] Trial 51 finished with value: 0.1072 and parameters: {'optimizer': 'adam', 'left_wall_dist_num_layers': 2, 'left_wall_dist_activation': 'elu', 'left_wall_dist_fc_layers': 'fc64', 'left_wall_dist_pool_size_l0': 4, 'left_wall_dist_out_channels_l0': 4, 'left_wall_dist_pool_size_l1': 3, 'left_wall_dist_out_channels_l1': 24, 'track_width_num_layers': 1, 'track_width_activation': 'relu', 'track_width_fc_layers': 'fc64', 'track_width_pool_size_l0': 2, 'track_width_out_channels_l0': 16, 'heading_error_num_layers': 2, 'heading_error_activation': 'relu', 'heading_error_fc_layers': 'fc32', 'heading_error_pool_size_l0': 4, 'heading_error_out_channels_l0': 4, 'heading_error_pool_size_l1': 4, 'heading_error_out_channels_l1': 8}. Best is trial 6 with value: 0.0997.
[rank: 0] Seed set to 42
[rank: 0] Seed set to 42
[rank: 0] Seed set to 42
GPU available: True (cuda), used: True
TPU available: False, using: 0 TPU cores
💡 Tip: For seamless cloud logging and experiment tracking, try installing [litlogger](https://pypi.org/project/litlogger/) to enable LitLogger, which logs metrics and artifacts automatically to the Lightning Experiments platform.
GPU available: True (cuda), used: True
TPU available: False, using: 0 TPU cores
💡 Tip: For seamless cloud logging and experiment tracking, try installing [litlogger](https://pypi.org/project/litlogger/) to enable LitLogger, which logs metrics and artifacts automatically to the Lightning Experiments platform.
GPU available: True (cuda), used: True
TPU available: False, using: 0 TPU cores
💡 Tip: For seamless cloud logging and experiment tracking, try installing [litlogger](https://pypi.org/project/litlogger/) to enable LitLogger, which logs metrics and artifacts automatically to the Lightning Experiments platform.
LOCAL_RANK: 0 - CUDA_VISIBLE_DEVICES: [0]
LOCAL_RANK: 0 - CUDA_VISIBLE_DEVICES: [0]
SLURM auto-requeueing enabled. Setting signal handlers.
SLURM auto-requeueing enabled. Setting signal handlers.
LOCAL_RANK: 0 - CUDA_VISIBLE_DEVICES: [0]
SLURM auto-requeueing enabled. Setting signal handlers.
`Trainer.fit` stopped: `max_epochs=30` reached.
`Trainer.fit` stopped: `max_epochs=30` reached.
`Trainer.fit` stopped: `max_epochs=30` reached.
[I 2026-05-08 19:15:29,983] Trial 52 finished with value: 0.1057 and parameters: {'optimizer': 'adam', 'left_wall_dist_num_layers': 2, 'left_wall_dist_activation': 'elu', 'left_wall_dist_fc_layers': 'fc64', 'left_wall_dist_pool_size_l0': 4, 'left_wall_dist_out_channels_l0': 4, 'left_wall_dist_pool_size_l1': 3, 'left_wall_dist_out_channels_l1': 24, 'track_width_num_layers': 1, 'track_width_activation': 'relu', 'track_width_fc_layers': 'fc64', 'track_width_pool_size_l0': 2, 'track_width_out_channels_l0': 16, 'heading_error_num_layers': 2, 'heading_error_activation': 'relu', 'heading_error_fc_layers': 'fc32', 'heading_error_pool_size_l0': 4, 'heading_error_out_channels_l0': 4, 'heading_error_pool_size_l1': 4, 'heading_error_out_channels_l1': 8}. Best is trial 6 with value: 0.0997.
[rank: 0] Seed set to 42
[rank: 0] Seed set to 42
[rank: 0] Seed set to 42
GPU available: True (cuda), used: True
TPU available: False, using: 0 TPU cores
💡 Tip: For seamless cloud logging and experiment tracking, try installing [litlogger](https://pypi.org/project/litlogger/) to enable LitLogger, which logs metrics and artifacts automatically to the Lightning Experiments platform.
GPU available: True (cuda), used: True
TPU available: False, using: 0 TPU cores
💡 Tip: For seamless cloud logging and experiment tracking, try installing [litlogger](https://pypi.org/project/litlogger/) to enable LitLogger, which logs metrics and artifacts automatically to the Lightning Experiments platform.
GPU available: True (cuda), used: True
TPU available: False, using: 0 TPU cores
💡 Tip: For seamless cloud logging and experiment tracking, try installing [litlogger](https://pypi.org/project/litlogger/) to enable LitLogger, which logs metrics and artifacts automatically to the Lightning Experiments platform.
LOCAL_RANK: 0 - CUDA_VISIBLE_DEVICES: [0]
LOCAL_RANK: 0 - CUDA_VISIBLE_DEVICES: [0]
LOCAL_RANK: 0 - CUDA_VISIBLE_DEVICES: [0]
SLURM auto-requeueing enabled. Setting signal handlers.
SLURM auto-requeueing enabled. Setting signal handlers.
SLURM auto-requeueing enabled. Setting signal handlers.
`Trainer.fit` stopped: `max_epochs=30` reached.
`Trainer.fit` stopped: `max_epochs=30` reached.
`Trainer.fit` stopped: `max_epochs=30` reached.
[I 2026-05-08 19:18:35,774] Trial 53 finished with value: 0.1055 and parameters: {'optimizer': 'adam', 'left_wall_dist_num_layers': 2, 'left_wall_dist_activation': 'elu', 'left_wall_dist_fc_layers': 'fc64', 'left_wall_dist_pool_size_l0': 4, 'left_wall_dist_out_channels_l0': 4, 'left_wall_dist_pool_size_l1': 3, 'left_wall_dist_out_channels_l1': 24, 'track_width_num_layers': 1, 'track_width_activation': 'relu', 'track_width_fc_layers': 'fc64', 'track_width_pool_size_l0': 2, 'track_width_out_channels_l0': 16, 'heading_error_num_layers': 2, 'heading_error_activation': 'relu', 'heading_error_fc_layers': 'fc32', 'heading_error_pool_size_l0': 4, 'heading_error_out_channels_l0': 4, 'heading_error_pool_size_l1': 4, 'heading_error_out_channels_l1': 8}. Best is trial 6 with value: 0.0997.
[rank: 0] Seed set to 42
[rank: 0] Seed set to 42
GPU available: True (cuda), used: True
TPU available: False, using: 0 TPU cores
💡 Tip: For seamless cloud logging and experiment tracking, try installing [litlogger](https://pypi.org/project/litlogger/) to enable LitLogger, which logs metrics and artifacts automatically to the Lightning Experiments platform.
GPU available: True (cuda), used: True
TPU available: False, using: 0 TPU cores
💡 Tip: For seamless cloud logging and experiment tracking, try installing [litlogger](https://pypi.org/project/litlogger/) to enable LitLogger, which logs metrics and artifacts automatically to the Lightning Experiments platform.
[rank: 0] Seed set to 42
GPU available: True (cuda), used: True
TPU available: False, using: 0 TPU cores
💡 Tip: For seamless cloud logging and experiment tracking, try installing [litlogger](https://pypi.org/project/litlogger/) to enable LitLogger, which logs metrics and artifacts automatically to the Lightning Experiments platform.
LOCAL_RANK: 0 - CUDA_VISIBLE_DEVICES: [0]
LOCAL_RANK: 0 - CUDA_VISIBLE_DEVICES: [0]
SLURM auto-requeueing enabled. Setting signal handlers.
SLURM auto-requeueing enabled. Setting signal handlers.
LOCAL_RANK: 0 - CUDA_VISIBLE_DEVICES: [0]
SLURM auto-requeueing enabled. Setting signal handlers.
`Trainer.fit` stopped: `max_epochs=30` reached.
`Trainer.fit` stopped: `max_epochs=30` reached.
`Trainer.fit` stopped: `max_epochs=30` reached.
[I 2026-05-08 19:21:39,582] Trial 54 finished with value: 0.1951 and parameters: {'optimizer': 'adam', 'left_wall_dist_num_layers': 2, 'left_wall_dist_activation': 'elu', 'left_wall_dist_fc_layers': 'fc64', 'left_wall_dist_pool_size_l0': 4, 'left_wall_dist_out_channels_l0': 4, 'left_wall_dist_pool_size_l1': 3, 'left_wall_dist_out_channels_l1': 24, 'track_width_num_layers': 1, 'track_width_activation': 'relu', 'track_width_fc_layers': 'fc64', 'track_width_pool_size_l0': 2, 'track_width_out_channels_l0': 16, 'heading_error_num_layers': 2, 'heading_error_activation': 'relu', 'heading_error_fc_layers': 'fc32', 'heading_error_pool_size_l0': 4, 'heading_error_out_channels_l0': 4, 'heading_error_pool_size_l1': 2, 'heading_error_out_channels_l1': 16}. Best is trial 6 with value: 0.0997.
[rank: 0] Seed set to 42
[rank: 0] Seed set to 42
[rank: 0] Seed set to 42
GPU available: True (cuda), used: True
TPU available: False, using: 0 TPU cores
💡 Tip: For seamless cloud logging and experiment tracking, try installing [litlogger](https://pypi.org/project/litlogger/) to enable LitLogger, which logs metrics and artifacts automatically to the Lightning Experiments platform.
GPU available: True (cuda), used: True
TPU available: False, using: 0 TPU cores
💡 Tip: For seamless cloud logging and experiment tracking, try installing [litlogger](https://pypi.org/project/litlogger/) to enable LitLogger, which logs metrics and artifacts automatically to the Lightning Experiments platform.
GPU available: True (cuda), used: True
TPU available: False, using: 0 TPU cores
💡 Tip: For seamless cloud logging and experiment tracking, try installing [litlogger](https://pypi.org/project/litlogger/) to enable LitLogger, which logs metrics and artifacts automatically to the Lightning Experiments platform.
LOCAL_RANK: 0 - CUDA_VISIBLE_DEVICES: [0]
LOCAL_RANK: 0 - CUDA_VISIBLE_DEVICES: [0]
LOCAL_RANK: 0 - CUDA_VISIBLE_DEVICES: [0]
SLURM auto-requeueing enabled. Setting signal handlers.
SLURM auto-requeueing enabled. Setting signal handlers.
SLURM auto-requeueing enabled. Setting signal handlers.
`Trainer.fit` stopped: `max_epochs=30` reached.
`Trainer.fit` stopped: `max_epochs=30` reached.
`Trainer.fit` stopped: `max_epochs=30` reached.
[I 2026-05-08 19:24:42,094] Trial 55 finished with value: 0.0961 and parameters: {'optimizer': 'adam', 'left_wall_dist_num_layers': 2, 'left_wall_dist_activation': 'elu', 'left_wall_dist_fc_layers': 'fc64', 'left_wall_dist_pool_size_l0': 4, 'left_wall_dist_out_channels_l0': 1, 'left_wall_dist_pool_size_l1': 2, 'left_wall_dist_out_channels_l1': 24, 'track_width_num_layers': 1, 'track_width_activation': 'relu', 'track_width_fc_layers': 'fc128_64', 'track_width_pool_size_l0': 2, 'track_width_out_channels_l0': 16, 'heading_error_num_layers': 2, 'heading_error_activation': 'relu', 'heading_error_fc_layers': 'fc32', 'heading_error_pool_size_l0': 4, 'heading_error_out_channels_l0': 4, 'heading_error_pool_size_l1': 4, 'heading_error_out_channels_l1': 8}. Best is trial 55 with value: 0.0961.
[rank: 0] Seed set to 42
[rank: 0] Seed set to 42
[rank: 0] Seed set to 42
GPU available: True (cuda), used: True
TPU available: False, using: 0 TPU cores
💡 Tip: For seamless cloud logging and experiment tracking, try installing [litlogger](https://pypi.org/project/litlogger/) to enable LitLogger, which logs metrics and artifacts automatically to the Lightning Experiments platform.
GPU available: True (cuda), used: True
TPU available: False, using: 0 TPU cores
💡 Tip: For seamless cloud logging and experiment tracking, try installing [litlogger](https://pypi.org/project/litlogger/) to enable LitLogger, which logs metrics and artifacts automatically to the Lightning Experiments platform.
GPU available: True (cuda), used: True
TPU available: False, using: 0 TPU cores
💡 Tip: For seamless cloud logging and experiment tracking, try installing [litlogger](https://pypi.org/project/litlogger/) to enable LitLogger, which logs metrics and artifacts automatically to the Lightning Experiments platform.
LOCAL_RANK: 0 - CUDA_VISIBLE_DEVICES: [0]
LOCAL_RANK: 0 - CUDA_VISIBLE_DEVICES: [0]
SLURM auto-requeueing enabled. Setting signal handlers.
LOCAL_RANK: 0 - CUDA_VISIBLE_DEVICES: [0]
SLURM auto-requeueing enabled. Setting signal handlers.
SLURM auto-requeueing enabled. Setting signal handlers.
`Trainer.fit` stopped: `max_epochs=30` reached.
`Trainer.fit` stopped: `max_epochs=30` reached.
`Trainer.fit` stopped: `max_epochs=30` reached.
[I 2026-05-08 19:27:38,621] Trial 56 finished with value: 0.1027 and parameters: {'optimizer': 'adam', 'left_wall_dist_num_layers': 2, 'left_wall_dist_activation': 'elu', 'left_wall_dist_fc_layers': 'fc16', 'left_wall_dist_pool_size_l0': 4, 'left_wall_dist_out_channels_l0': 1, 'left_wall_dist_pool_size_l1': 2, 'left_wall_dist_out_channels_l1': 24, 'track_width_num_layers': 1, 'track_width_activation': 'relu', 'track_width_fc_layers': 'fc128_64', 'track_width_pool_size_l0': 2, 'track_width_out_channels_l0': 1, 'heading_error_num_layers': 2, 'heading_error_activation': 'relu', 'heading_error_fc_layers': 'fc128', 'heading_error_pool_size_l0': 4, 'heading_error_out_channels_l0': 4, 'heading_error_pool_size_l1': 2, 'heading_error_out_channels_l1': 32}. Best is trial 55 with value: 0.0961.
[rank: 0] Seed set to 42
[rank: 0] Seed set to 42
[rank: 0] Seed set to 42
GPU available: True (cuda), used: True
TPU available: False, using: 0 TPU cores
💡 Tip: For seamless cloud logging and experiment tracking, try installing [litlogger](https://pypi.org/project/litlogger/) to enable LitLogger, which logs metrics and artifacts automatically to the Lightning Experiments platform.
GPU available: True (cuda), used: True
TPU available: False, using: 0 TPU cores
💡 Tip: For seamless cloud logging and experiment tracking, try installing [litlogger](https://pypi.org/project/litlogger/) to enable LitLogger, which logs metrics and artifacts automatically to the Lightning Experiments platform.
GPU available: True (cuda), used: True
TPU available: False, using: 0 TPU cores
💡 Tip: For seamless cloud logging and experiment tracking, try installing [litlogger](https://pypi.org/project/litlogger/) to enable LitLogger, which logs metrics and artifacts automatically to the Lightning Experiments platform.
LOCAL_RANK: 0 - CUDA_VISIBLE_DEVICES: [0]
LOCAL_RANK: 0 - CUDA_VISIBLE_DEVICES: [0]
LOCAL_RANK: 0 - CUDA_VISIBLE_DEVICES: [0]
SLURM auto-requeueing enabled. Setting signal handlers.
SLURM auto-requeueing enabled. Setting signal handlers.
SLURM auto-requeueing enabled. Setting signal handlers.
`Trainer.fit` stopped: `max_epochs=30` reached.
`Trainer.fit` stopped: `max_epochs=30` reached.
`Trainer.fit` stopped: `max_epochs=30` reached.
[I 2026-05-08 19:30:05,093] Trial 57 finished with value: 0.13 and parameters: {'optimizer': 'adam', 'left_wall_dist_num_layers': 2, 'left_wall_dist_activation': 'elu', 'left_wall_dist_fc_layers': 'fc16', 'left_wall_dist_pool_size_l0': 4, 'left_wall_dist_out_channels_l0': 1, 'left_wall_dist_pool_size_l1': 2, 'left_wall_dist_out_channels_l1': 24, 'track_width_num_layers': 1, 'track_width_activation': 'relu', 'track_width_fc_layers': 'fc128_64', 'track_width_pool_size_l0': 2, 'track_width_out_channels_l0': 1, 'heading_error_num_layers': 1, 'heading_error_activation': 'relu', 'heading_error_fc_layers': 'fc128', 'heading_error_pool_size_l0': 4, 'heading_error_out_channels_l0': 4}. Best is trial 55 with value: 0.0961.
[rank: 0] Seed set to 42
[rank: 0] Seed set to 42
GPU available: True (cuda), used: True
TPU available: False, using: 0 TPU cores
💡 Tip: For seamless cloud logging and experiment tracking, try installing [litlogger](https://pypi.org/project/litlogger/) to enable LitLogger, which logs metrics and artifacts automatically to the Lightning Experiments platform.
[rank: 0] Seed set to 42
GPU available: True (cuda), used: True
TPU available: False, using: 0 TPU cores
💡 Tip: For seamless cloud logging and experiment tracking, try installing [litlogger](https://pypi.org/project/litlogger/) to enable LitLogger, which logs metrics and artifacts automatically to the Lightning Experiments platform.
GPU available: True (cuda), used: True
TPU available: False, using: 0 TPU cores
💡 Tip: For seamless cloud logging and experiment tracking, try installing [litlogger](https://pypi.org/project/litlogger/) to enable LitLogger, which logs metrics and artifacts automatically to the Lightning Experiments platform.
LOCAL_RANK: 0 - CUDA_VISIBLE_DEVICES: [0]
LOCAL_RANK: 0 - CUDA_VISIBLE_DEVICES: [0]
SLURM auto-requeueing enabled. Setting signal handlers.
SLURM auto-requeueing enabled. Setting signal handlers.
LOCAL_RANK: 0 - CUDA_VISIBLE_DEVICES: [0]
SLURM auto-requeueing enabled. Setting signal handlers.
`Trainer.fit` stopped: `max_epochs=30` reached.
`Trainer.fit` stopped: `max_epochs=30` reached.
`Trainer.fit` stopped: `max_epochs=30` reached.
