[I 2026-04-12 15:04:44,463] Trial 41 finished with value: 0.1357 and parameters: {'left_wall_dist_num_layers': 2, 'left_wall_dist_activation': 'relu', 'left_wall_dist_out_channels_l0': 80, 'left_wall_dist_pool_size_l0': 8, 'left_wall_dist_out_channels_l1': 255, 'left_wall_dist_pool_size_l1': 8, 'left_wall_dist_fc_hidden': 82, 'track_width_num_layers': 4, 'track_width_activation': 'relu', 'track_width_out_channels_l0': 64, 'track_width_pool_size_l0': 2, 'track_width_out_channels_l1': 60, 'track_width_pool_size_l1': 4, 'track_width_out_channels_l2': 153, 'track_width_pool_size_l2': 8, 'track_width_out_channels_l3': 33, 'track_width_pool_size_l3': 2, 'track_width_fc_hidden': 40, 'heading_error_num_layers': 5, 'heading_error_activation': 'elu', 'heading_error_out_channels_l0': 33, 'heading_error_pool_size_l0': 2, 'heading_error_out_channels_l1': 222, 'heading_error_pool_size_l1': 8, 'heading_error_out_channels_l2': 38, 'heading_error_pool_size_l2': 4, 'heading_error_out_channels_l3': 64, 'heading_error_pool_size_l3': 4, 'heading_error_out_channels_l4': 84, 'heading_error_pool_size_l4': 4}. Best is trial 7 with value: 0.1063.
[rank: 0] Seed set to 42
[rank: 0] Seed set to 42
[rank: 0] Seed set to 42
GPU available: True (cuda), used: True
TPU available: False, using: 0 TPU cores
💡 Tip: For seamless cloud logging and experiment tracking, try installing [litlogger](https://pypi.org/project/litlogger/) to enable LitLogger, which logs metrics and artifacts automatically to the Lightning Experiments platform.
GPU available: True (cuda), used: True
TPU available: False, using: 0 TPU cores
💡 Tip: For seamless cloud logging and experiment tracking, try installing [litlogger](https://pypi.org/project/litlogger/) to enable LitLogger, which logs metrics and artifacts automatically to the Lightning Experiments platform.
GPU available: True (cuda), used: True
TPU available: False, using: 0 TPU cores
💡 Tip: For seamless cloud logging and experiment tracking, try installing [litlogger](https://pypi.org/project/litlogger/) to enable LitLogger, which logs metrics and artifacts automatically to the Lightning Experiments platform.
LOCAL_RANK: 0 - CUDA_VISIBLE_DEVICES: [0]
LOCAL_RANK: 0 - CUDA_VISIBLE_DEVICES: [0]
LOCAL_RANK: 0 - CUDA_VISIBLE_DEVICES: [0]
SLURM auto-requeueing enabled. Setting signal handlers.
SLURM auto-requeueing enabled. Setting signal handlers.
SLURM auto-requeueing enabled. Setting signal handlers.
`Trainer.fit` stopped: `max_epochs=20` reached.
`Trainer.fit` stopped: `max_epochs=20` reached.
`Trainer.fit` stopped: `max_epochs=20` reached.
[I 2026-04-12 15:07:04,078] Trial 42 finished with value: 0.1194 and parameters: {'left_wall_dist_num_layers': 2, 'left_wall_dist_activation': 'relu', 'left_wall_dist_out_channels_l0': 78, 'left_wall_dist_pool_size_l0': 8, 'left_wall_dist_out_channels_l1': 230, 'left_wall_dist_pool_size_l1': 8, 'left_wall_dist_fc_hidden': 96, 'track_width_num_layers': 4, 'track_width_activation': 'relu', 'track_width_out_channels_l0': 51, 'track_width_pool_size_l0': 2, 'track_width_out_channels_l1': 49, 'track_width_pool_size_l1': 4, 'track_width_out_channels_l2': 120, 'track_width_pool_size_l2': 8, 'track_width_out_channels_l3': 38, 'track_width_pool_size_l3': 2, 'track_width_fc_hidden': 40, 'heading_error_num_layers': 5, 'heading_error_activation': 'elu', 'heading_error_out_channels_l0': 40, 'heading_error_pool_size_l0': 2, 'heading_error_out_channels_l1': 193, 'heading_error_pool_size_l1': 8, 'heading_error_out_channels_l2': 58, 'heading_error_pool_size_l2': 4, 'heading_error_out_channels_l3': 59, 'heading_error_pool_size_l3': 4, 'heading_error_out_channels_l4': 110, 'heading_error_pool_size_l4': 4}. Best is trial 7 with value: 0.1063.
[rank: 0] Seed set to 42
[rank: 0] Seed set to 42
GPU available: True (cuda), used: True
TPU available: False, using: 0 TPU cores
💡 Tip: For seamless cloud logging and experiment tracking, try installing [litlogger](https://pypi.org/project/litlogger/) to enable LitLogger, which logs metrics and artifacts automatically to the Lightning Experiments platform.
[rank: 0] Seed set to 42
GPU available: True (cuda), used: True
TPU available: False, using: 0 TPU cores
💡 Tip: For seamless cloud logging and experiment tracking, try installing [litlogger](https://pypi.org/project/litlogger/) to enable LitLogger, which logs metrics and artifacts automatically to the Lightning Experiments platform.
GPU available: True (cuda), used: True
TPU available: False, using: 0 TPU cores
💡 Tip: For seamless cloud logging and experiment tracking, try installing [litlogger](https://pypi.org/project/litlogger/) to enable LitLogger, which logs metrics and artifacts automatically to the Lightning Experiments platform.
LOCAL_RANK: 0 - CUDA_VISIBLE_DEVICES: [0]
LOCAL_RANK: 0 - CUDA_VISIBLE_DEVICES: [0]
LOCAL_RANK: 0 - CUDA_VISIBLE_DEVICES: [0]
SLURM auto-requeueing enabled. Setting signal handlers.
SLURM auto-requeueing enabled. Setting signal handlers.
SLURM auto-requeueing enabled. Setting signal handlers.
`Trainer.fit` stopped: `max_epochs=20` reached.
`Trainer.fit` stopped: `max_epochs=20` reached.
`Trainer.fit` stopped: `max_epochs=20` reached.
[I 2026-04-12 15:09:25,178] Trial 43 finished with value: 0.1138 and parameters: {'left_wall_dist_num_layers': 2, 'left_wall_dist_activation': 'relu', 'left_wall_dist_out_channels_l0': 69, 'left_wall_dist_pool_size_l0': 8, 'left_wall_dist_out_channels_l1': 170, 'left_wall_dist_pool_size_l1': 8, 'left_wall_dist_fc_hidden': 104, 'track_width_num_layers': 4, 'track_width_activation': 'relu', 'track_width_out_channels_l0': 50, 'track_width_pool_size_l0': 2, 'track_width_out_channels_l1': 46, 'track_width_pool_size_l1': 4, 'track_width_out_channels_l2': 78, 'track_width_pool_size_l2': 8, 'track_width_out_channels_l3': 40, 'track_width_pool_size_l3': 2, 'track_width_fc_hidden': 45, 'heading_error_num_layers': 5, 'heading_error_activation': 'elu', 'heading_error_out_channels_l0': 52, 'heading_error_pool_size_l0': 2, 'heading_error_out_channels_l1': 190, 'heading_error_pool_size_l1': 8, 'heading_error_out_channels_l2': 58, 'heading_error_pool_size_l2': 4, 'heading_error_out_channels_l3': 93, 'heading_error_pool_size_l3': 4, 'heading_error_out_channels_l4': 244, 'heading_error_pool_size_l4': 4}. Best is trial 7 with value: 0.1063.
[rank: 0] Seed set to 42
[rank: 0] Seed set to 42
[rank: 0] Seed set to 42
GPU available: True (cuda), used: True
TPU available: False, using: 0 TPU cores
💡 Tip: For seamless cloud logging and experiment tracking, try installing [litlogger](https://pypi.org/project/litlogger/) to enable LitLogger, which logs metrics and artifacts automatically to the Lightning Experiments platform.
GPU available: True (cuda), used: True
TPU available: False, using: 0 TPU cores
💡 Tip: For seamless cloud logging and experiment tracking, try installing [litlogger](https://pypi.org/project/litlogger/) to enable LitLogger, which logs metrics and artifacts automatically to the Lightning Experiments platform.
GPU available: True (cuda), used: True
TPU available: False, using: 0 TPU cores
💡 Tip: For seamless cloud logging and experiment tracking, try installing [litlogger](https://pypi.org/project/litlogger/) to enable LitLogger, which logs metrics and artifacts automatically to the Lightning Experiments platform.
LOCAL_RANK: 0 - CUDA_VISIBLE_DEVICES: [0]
LOCAL_RANK: 0 - CUDA_VISIBLE_DEVICES: [0]
LOCAL_RANK: 0 - CUDA_VISIBLE_DEVICES: [0]
SLURM auto-requeueing enabled. Setting signal handlers.
SLURM auto-requeueing enabled. Setting signal handlers.
SLURM auto-requeueing enabled. Setting signal handlers.
`Trainer.fit` stopped: `max_epochs=20` reached.
`Trainer.fit` stopped: `max_epochs=20` reached.
`Trainer.fit` stopped: `max_epochs=20` reached.
[I 2026-04-12 15:11:42,369] Trial 44 finished with value: 0.1174 and parameters: {'left_wall_dist_num_layers': 2, 'left_wall_dist_activation': 'relu', 'left_wall_dist_out_channels_l0': 66, 'left_wall_dist_pool_size_l0': 8, 'left_wall_dist_out_channels_l1': 166, 'left_wall_dist_pool_size_l1': 8, 'left_wall_dist_fc_hidden': 109, 'track_width_num_layers': 4, 'track_width_activation': 'relu', 'track_width_out_channels_l0': 51, 'track_width_pool_size_l0': 2, 'track_width_out_channels_l1': 37, 'track_width_pool_size_l1': 4, 'track_width_out_channels_l2': 80, 'track_width_pool_size_l2': 8, 'track_width_out_channels_l3': 39, 'track_width_pool_size_l3': 2, 'track_width_fc_hidden': 44, 'heading_error_num_layers': 5, 'heading_error_activation': 'elu', 'heading_error_out_channels_l0': 56, 'heading_error_pool_size_l0': 2, 'heading_error_out_channels_l1': 162, 'heading_error_pool_size_l1': 8, 'heading_error_out_channels_l2': 59, 'heading_error_pool_size_l2': 4, 'heading_error_out_channels_l3': 96, 'heading_error_pool_size_l3': 4, 'heading_error_out_channels_l4': 253, 'heading_error_pool_size_l4': 8}. Best is trial 7 with value: 0.1063.
[rank: 0] Seed set to 42
[rank: 0] Seed set to 42
[rank: 0] Seed set to 42
GPU available: True (cuda), used: True
TPU available: False, using: 0 TPU cores
💡 Tip: For seamless cloud logging and experiment tracking, try installing [litlogger](https://pypi.org/project/litlogger/) to enable LitLogger, which logs metrics and artifacts automatically to the Lightning Experiments platform.
GPU available: True (cuda), used: True
TPU available: False, using: 0 TPU cores
💡 Tip: For seamless cloud logging and experiment tracking, try installing [litlogger](https://pypi.org/project/litlogger/) to enable LitLogger, which logs metrics and artifacts automatically to the Lightning Experiments platform.
GPU available: True (cuda), used: True
TPU available: False, using: 0 TPU cores
💡 Tip: For seamless cloud logging and experiment tracking, try installing [litlogger](https://pypi.org/project/litlogger/) to enable LitLogger, which logs metrics and artifacts automatically to the Lightning Experiments platform.
LOCAL_RANK: 0 - CUDA_VISIBLE_DEVICES: [0]
LOCAL_RANK: 0 - CUDA_VISIBLE_DEVICES: [0]
LOCAL_RANK: 0 - CUDA_VISIBLE_DEVICES: [0]
SLURM auto-requeueing enabled. Setting signal handlers.
SLURM auto-requeueing enabled. Setting signal handlers.
SLURM auto-requeueing enabled. Setting signal handlers.
`Trainer.fit` stopped: `max_epochs=20` reached.
`Trainer.fit` stopped: `max_epochs=20` reached.
`Trainer.fit` stopped: `max_epochs=20` reached.
[I 2026-04-12 15:14:48,718] Trial 45 finished with value: 0.3643 and parameters: {'left_wall_dist_num_layers': 2, 'left_wall_dist_activation': 'elu', 'left_wall_dist_out_channels_l0': 66, 'left_wall_dist_pool_size_l0': 8, 'left_wall_dist_out_channels_l1': 223, 'left_wall_dist_pool_size_l1': 8, 'left_wall_dist_fc_hidden': 109, 'track_width_num_layers': 4, 'track_width_activation': 'relu', 'track_width_out_channels_l0': 50, 'track_width_pool_size_l0': 4, 'track_width_out_channels_l1': 36, 'track_width_pool_size_l1': 4, 'track_width_out_channels_l2': 80, 'track_width_pool_size_l2': 4, 'track_width_out_channels_l3': 39, 'track_width_pool_size_l3': 2, 'track_width_fc_hidden': 46, 'heading_error_num_layers': 5, 'heading_error_activation': 'relu', 'heading_error_out_channels_l0': 52, 'heading_error_pool_size_l0': 2, 'heading_error_out_channels_l1': 166, 'heading_error_pool_size_l1': 4, 'heading_error_out_channels_l2': 58, 'heading_error_pool_size_l2': 4, 'heading_error_out_channels_l3': 91, 'heading_error_pool_size_l3': 2, 'heading_error_out_channels_l4': 254, 'heading_error_pool_size_l4': 8}. Best is trial 7 with value: 0.1063.
[rank: 0] Seed set to 42
[rank: 0] Seed set to 42
[rank: 0] Seed set to 42
GPU available: True (cuda), used: True
GPU available: True (cuda), used: True
TPU available: False, using: 0 TPU cores
TPU available: False, using: 0 TPU cores
GPU available: True (cuda), used: True
TPU available: False, using: 0 TPU cores
💡 Tip: For seamless cloud logging and experiment tracking, try installing [litlogger](https://pypi.org/project/litlogger/) to enable LitLogger, which logs metrics and artifacts automatically to the Lightning Experiments platform.
💡 Tip: For seamless cloud logging and experiment tracking, try installing [litlogger](https://pypi.org/project/litlogger/) to enable LitLogger, which logs metrics and artifacts automatically to the Lightning Experiments platform.
💡 Tip: For seamless cloud logging and experiment tracking, try installing [litlogger](https://pypi.org/project/litlogger/) to enable LitLogger, which logs metrics and artifacts automatically to the Lightning Experiments platform.
LOCAL_RANK: 0 - CUDA_VISIBLE_DEVICES: [0]
LOCAL_RANK: 0 - CUDA_VISIBLE_DEVICES: [0]
LOCAL_RANK: 0 - CUDA_VISIBLE_DEVICES: [0]
SLURM auto-requeueing enabled. Setting signal handlers.
SLURM auto-requeueing enabled. Setting signal handlers.
SLURM auto-requeueing enabled. Setting signal handlers.
`Trainer.fit` stopped: `max_epochs=20` reached.
`Trainer.fit` stopped: `max_epochs=20` reached.
`Trainer.fit` stopped: `max_epochs=20` reached.
[I 2026-04-12 15:17:17,492] Trial 46 finished with value: 0.1671 and parameters: {'left_wall_dist_num_layers': 3, 'left_wall_dist_activation': 'relu', 'left_wall_dist_out_channels_l0': 56, 'left_wall_dist_pool_size_l0': 4, 'left_wall_dist_out_channels_l1': 163, 'left_wall_dist_pool_size_l1': 8, 'left_wall_dist_out_channels_l2': 32, 'left_wall_dist_pool_size_l2': 2, 'left_wall_dist_fc_hidden': 107, 'track_width_num_layers': 5, 'track_width_activation': 'elu', 'track_width_out_channels_l0': 54, 'track_width_pool_size_l0': 2, 'track_width_out_channels_l1': 38, 'track_width_pool_size_l1': 4, 'track_width_out_channels_l2': 60, 'track_width_pool_size_l2': 8, 'track_width_out_channels_l3': 39, 'track_width_pool_size_l3': 2, 'track_width_out_channels_l4': 201, 'track_width_pool_size_l4': 2, 'heading_error_num_layers': 5, 'heading_error_activation': 'elu', 'heading_error_out_channels_l0': 41, 'heading_error_pool_size_l0': 8, 'heading_error_out_channels_l1': 158, 'heading_error_pool_size_l1': 8, 'heading_error_out_channels_l2': 77, 'heading_error_pool_size_l2': 8, 'heading_error_fc_hidden': 36}. Best is trial 7 with value: 0.1063.
[rank: 0] Seed set to 42
[rank: 0] Seed set to 42
[rank: 0] Seed set to 42
GPU available: True (cuda), used: True
GPU available: True (cuda), used: True
TPU available: False, using: 0 TPU cores
TPU available: False, using: 0 TPU cores
💡 Tip: For seamless cloud logging and experiment tracking, try installing [litlogger](https://pypi.org/project/litlogger/) to enable LitLogger, which logs metrics and artifacts automatically to the Lightning Experiments platform.
💡 Tip: For seamless cloud logging and experiment tracking, try installing [litlogger](https://pypi.org/project/litlogger/) to enable LitLogger, which logs metrics and artifacts automatically to the Lightning Experiments platform.
GPU available: True (cuda), used: True
TPU available: False, using: 0 TPU cores
💡 Tip: For seamless cloud logging and experiment tracking, try installing [litlogger](https://pypi.org/project/litlogger/) to enable LitLogger, which logs metrics and artifacts automatically to the Lightning Experiments platform.
LOCAL_RANK: 0 - CUDA_VISIBLE_DEVICES: [0]
LOCAL_RANK: 0 - CUDA_VISIBLE_DEVICES: [0]
LOCAL_RANK: 0 - CUDA_VISIBLE_DEVICES: [0]
SLURM auto-requeueing enabled. Setting signal handlers.
SLURM auto-requeueing enabled. Setting signal handlers.
SLURM auto-requeueing enabled. Setting signal handlers.
`Trainer.fit` stopped: `max_epochs=20` reached.
`Trainer.fit` stopped: `max_epochs=20` reached.
`Trainer.fit` stopped: `max_epochs=20` reached.
[I 2026-04-12 15:19:46,479] Trial 47 finished with value: 0.2037 and parameters: {'left_wall_dist_num_layers': 4, 'left_wall_dist_activation': 'relu', 'left_wall_dist_out_channels_l0': 69, 'left_wall_dist_pool_size_l0': 8, 'left_wall_dist_out_channels_l1': 148, 'left_wall_dist_pool_size_l1': 4, 'left_wall_dist_out_channels_l2': 115, 'left_wall_dist_pool_size_l2': 8, 'left_wall_dist_out_channels_l3': 123, 'left_wall_dist_pool_size_l3': 8, 'track_width_num_layers': 4, 'track_width_activation': 'relu', 'track_width_out_channels_l0': 57, 'track_width_pool_size_l0': 2, 'track_width_out_channels_l1': 48, 'track_width_pool_size_l1': 4, 'track_width_out_channels_l2': 74, 'track_width_pool_size_l2': 8, 'track_width_out_channels_l3': 48, 'track_width_pool_size_l3': 2, 'track_width_fc_hidden': 49, 'heading_error_num_layers': 4, 'heading_error_activation': 'elu', 'heading_error_out_channels_l0': 51, 'heading_error_pool_size_l0': 4, 'heading_error_out_channels_l1': 123, 'heading_error_pool_size_l1': 8, 'heading_error_out_channels_l2': 60, 'heading_error_pool_size_l2': 2, 'heading_error_out_channels_l3': 56, 'heading_error_pool_size_l3': 4, 'heading_error_fc_hidden': 38}. Best is trial 7 with value: 0.1063.
[rank: 0] Seed set to 42
[rank: 0] Seed set to 42
[rank: 0] Seed set to 42
GPU available: True (cuda), used: True
TPU available: False, using: 0 TPU cores
💡 Tip: For seamless cloud logging and experiment tracking, try installing [litlogger](https://pypi.org/project/litlogger/) to enable LitLogger, which logs metrics and artifacts automatically to the Lightning Experiments platform.
GPU available: True (cuda), used: True
TPU available: False, using: 0 TPU cores
💡 Tip: For seamless cloud logging and experiment tracking, try installing [litlogger](https://pypi.org/project/litlogger/) to enable LitLogger, which logs metrics and artifacts automatically to the Lightning Experiments platform.
GPU available: True (cuda), used: True
TPU available: False, using: 0 TPU cores
💡 Tip: For seamless cloud logging and experiment tracking, try installing [litlogger](https://pypi.org/project/litlogger/) to enable LitLogger, which logs metrics and artifacts automatically to the Lightning Experiments platform.
LOCAL_RANK: 0 - CUDA_VISIBLE_DEVICES: [0]
LOCAL_RANK: 0 - CUDA_VISIBLE_DEVICES: [0]
LOCAL_RANK: 0 - CUDA_VISIBLE_DEVICES: [0]
SLURM auto-requeueing enabled. Setting signal handlers.
SLURM auto-requeueing enabled. Setting signal handlers.
SLURM auto-requeueing enabled. Setting signal handlers.
`Trainer.fit` stopped: `max_epochs=20` reached.
`Trainer.fit` stopped: `max_epochs=20` reached.
`Trainer.fit` stopped: `max_epochs=20` reached.
