[I 2026-04-12 16:12:23,404] Trial 80 finished with value: inf and parameters: {'left_wall_dist_num_layers': 4, 'left_wall_dist_activation': 'elu', 'left_wall_dist_out_channels_l0': 36, 'left_wall_dist_pool_size_l0': 8, 'left_wall_dist_out_channels_l1': 33, 'left_wall_dist_pool_size_l1': 8, 'left_wall_dist_out_channels_l2': 98, 'left_wall_dist_pool_size_l2': 8, 'track_width_num_layers': 4, 'track_width_activation': 'elu', 'track_width_out_channels_l0': 64, 'track_width_pool_size_l0': 4, 'track_width_out_channels_l1': 80, 'track_width_pool_size_l1': 8, 'track_width_out_channels_l2': 35, 'track_width_pool_size_l2': 8, 'track_width_out_channels_l3': 116, 'track_width_pool_size_l3': 2, 'heading_error_num_layers': 4, 'heading_error_activation': 'elu', 'heading_error_out_channels_l0': 106, 'heading_error_pool_size_l0': 8, 'heading_error_out_channels_l1': 43, 'heading_error_pool_size_l1': 8, 'heading_error_out_channels_l2': 76, 'heading_error_pool_size_l2': 2, 'heading_error_out_channels_l3': 92, 'heading_error_pool_size_l3': 2, 'heading_error_fc_hidden': 37}. Best is trial 58 with value: 0.0986.
[rank: 0] Seed set to 42
[rank: 0] Seed set to 42
GPU available: True (cuda), used: True
TPU available: False, using: 0 TPU cores
💡 Tip: For seamless cloud logging and experiment tracking, try installing [litlogger](https://pypi.org/project/litlogger/) to enable LitLogger, which logs metrics and artifacts automatically to the Lightning Experiments platform.
GPU available: True (cuda), used: True
TPU available: False, using: 0 TPU cores
💡 Tip: For seamless cloud logging and experiment tracking, try installing [litlogger](https://pypi.org/project/litlogger/) to enable LitLogger, which logs metrics and artifacts automatically to the Lightning Experiments platform.
[rank: 0] Seed set to 42
GPU available: True (cuda), used: True
TPU available: False, using: 0 TPU cores
💡 Tip: For seamless cloud logging and experiment tracking, try installing [litlogger](https://pypi.org/project/litlogger/) to enable LitLogger, which logs metrics and artifacts automatically to the Lightning Experiments platform.
LOCAL_RANK: 0 - CUDA_VISIBLE_DEVICES: [0]
LOCAL_RANK: 0 - CUDA_VISIBLE_DEVICES: [0]
LOCAL_RANK: 0 - CUDA_VISIBLE_DEVICES: [0]
SLURM auto-requeueing enabled. Setting signal handlers.
SLURM auto-requeueing enabled. Setting signal handlers.
SLURM auto-requeueing enabled. Setting signal handlers.
`Trainer.fit` stopped: `max_epochs=20` reached.
`Trainer.fit` stopped: `max_epochs=20` reached.
`Trainer.fit` stopped: `max_epochs=20` reached.
[I 2026-04-12 16:14:34,270] Trial 81 finished with value: 0.1059 and parameters: {'left_wall_dist_num_layers': 4, 'left_wall_dist_activation': 'relu', 'left_wall_dist_out_channels_l0': 35, 'left_wall_dist_pool_size_l0': 2, 'left_wall_dist_out_channels_l1': 48, 'left_wall_dist_pool_size_l1': 4, 'left_wall_dist_out_channels_l2': 112, 'left_wall_dist_pool_size_l2': 2, 'left_wall_dist_out_channels_l3': 38, 'left_wall_dist_pool_size_l3': 8, 'left_wall_dist_fc_hidden': 63, 'track_width_num_layers': 5, 'track_width_activation': 'elu', 'track_width_out_channels_l0': 102, 'track_width_pool_size_l0': 8, 'track_width_out_channels_l1': 68, 'track_width_pool_size_l1': 8, 'track_width_out_channels_l2': 32, 'track_width_pool_size_l2': 8, 'heading_error_num_layers': 4, 'heading_error_activation': 'elu', 'heading_error_out_channels_l0': 63, 'heading_error_pool_size_l0': 8, 'heading_error_out_channels_l1': 66, 'heading_error_pool_size_l1': 2, 'heading_error_out_channels_l2': 96, 'heading_error_pool_size_l2': 2, 'heading_error_out_channels_l3': 78, 'heading_error_pool_size_l3': 2, 'heading_error_fc_hidden': 67}. Best is trial 58 with value: 0.0986.
[rank: 0] Seed set to 42
GPU available: True (cuda), used: True
TPU available: False, using: 0 TPU cores
💡 Tip: For seamless cloud logging and experiment tracking, try installing [litlogger](https://pypi.org/project/litlogger/) to enable LitLogger, which logs metrics and artifacts automatically to the Lightning Experiments platform.
[rank: 0] Seed set to 42
[rank: 0] Seed set to 42
GPU available: True (cuda), used: True
TPU available: False, using: 0 TPU cores
💡 Tip: For seamless cloud logging and experiment tracking, try installing [litlogger](https://pypi.org/project/litlogger/) to enable LitLogger, which logs metrics and artifacts automatically to the Lightning Experiments platform.
GPU available: True (cuda), used: True
TPU available: False, using: 0 TPU cores
💡 Tip: For seamless cloud logging and experiment tracking, try installing [litlogger](https://pypi.org/project/litlogger/) to enable LitLogger, which logs metrics and artifacts automatically to the Lightning Experiments platform.
LOCAL_RANK: 0 - CUDA_VISIBLE_DEVICES: [0]
LOCAL_RANK: 0 - CUDA_VISIBLE_DEVICES: [0]
LOCAL_RANK: 0 - CUDA_VISIBLE_DEVICES: [0]
SLURM auto-requeueing enabled. Setting signal handlers.
SLURM auto-requeueing enabled. Setting signal handlers.
SLURM auto-requeueing enabled. Setting signal handlers.
`Trainer.fit` stopped: `max_epochs=20` reached.
`Trainer.fit` stopped: `max_epochs=20` reached.
`Trainer.fit` stopped: `max_epochs=20` reached.
[I 2026-04-12 16:16:44,470] Trial 82 finished with value: 0.1258 and parameters: {'left_wall_dist_num_layers': 4, 'left_wall_dist_activation': 'relu', 'left_wall_dist_out_channels_l0': 35, 'left_wall_dist_pool_size_l0': 2, 'left_wall_dist_out_channels_l1': 46, 'left_wall_dist_pool_size_l1': 4, 'left_wall_dist_out_channels_l2': 112, 'left_wall_dist_pool_size_l2': 2, 'left_wall_dist_out_channels_l3': 41, 'left_wall_dist_pool_size_l3': 8, 'left_wall_dist_fc_hidden': 64, 'track_width_num_layers': 5, 'track_width_activation': 'elu', 'track_width_out_channels_l0': 53, 'track_width_pool_size_l0': 8, 'track_width_out_channels_l1': 66, 'track_width_pool_size_l1': 8, 'track_width_out_channels_l2': 32, 'track_width_pool_size_l2': 8, 'heading_error_num_layers': 4, 'heading_error_activation': 'elu', 'heading_error_out_channels_l0': 63, 'heading_error_pool_size_l0': 8, 'heading_error_out_channels_l1': 55, 'heading_error_pool_size_l1': 2, 'heading_error_out_channels_l2': 87, 'heading_error_pool_size_l2': 2, 'heading_error_out_channels_l3': 76, 'heading_error_pool_size_l3': 2, 'heading_error_fc_hidden': 65}. Best is trial 58 with value: 0.0986.
[rank: 0] Seed set to 42
GPU available: True (cuda), used: True
TPU available: False, using: 0 TPU cores
💡 Tip: For seamless cloud logging and experiment tracking, try installing [litlogger](https://pypi.org/project/litlogger/) to enable LitLogger, which logs metrics and artifacts automatically to the Lightning Experiments platform.
[rank: 0] Seed set to 42
LOCAL_RANK: 0 - CUDA_VISIBLE_DEVICES: [0]
[rank: 0] Seed set to 42
GPU available: True (cuda), used: True
TPU available: False, using: 0 TPU cores
💡 Tip: For seamless cloud logging and experiment tracking, try installing [litlogger](https://pypi.org/project/litlogger/) to enable LitLogger, which logs metrics and artifacts automatically to the Lightning Experiments platform.
GPU available: True (cuda), used: True
TPU available: False, using: 0 TPU cores
💡 Tip: For seamless cloud logging and experiment tracking, try installing [litlogger](https://pypi.org/project/litlogger/) to enable LitLogger, which logs metrics and artifacts automatically to the Lightning Experiments platform.
SLURM auto-requeueing enabled. Setting signal handlers.
LOCAL_RANK: 0 - CUDA_VISIBLE_DEVICES: [0]
LOCAL_RANK: 0 - CUDA_VISIBLE_DEVICES: [0]
SLURM auto-requeueing enabled. Setting signal handlers.
SLURM auto-requeueing enabled. Setting signal handlers.
`Trainer.fit` stopped: `max_epochs=20` reached.
`Trainer.fit` stopped: `max_epochs=20` reached.
`Trainer.fit` stopped: `max_epochs=20` reached.
[I 2026-04-12 16:18:54,864] Trial 83 finished with value: 0.14 and parameters: {'left_wall_dist_num_layers': 4, 'left_wall_dist_activation': 'relu', 'left_wall_dist_out_channels_l0': 34, 'left_wall_dist_pool_size_l0': 2, 'left_wall_dist_out_channels_l1': 43, 'left_wall_dist_pool_size_l1': 4, 'left_wall_dist_out_channels_l2': 127, 'left_wall_dist_pool_size_l2': 2, 'left_wall_dist_out_channels_l3': 37, 'left_wall_dist_pool_size_l3': 8, 'left_wall_dist_fc_hidden': 66, 'track_width_num_layers': 5, 'track_width_activation': 'elu', 'track_width_out_channels_l0': 76, 'track_width_pool_size_l0': 8, 'track_width_out_channels_l1': 73, 'track_width_pool_size_l1': 8, 'track_width_out_channels_l2': 40, 'track_width_pool_size_l2': 8, 'heading_error_num_layers': 4, 'heading_error_activation': 'elu', 'heading_error_out_channels_l0': 59, 'heading_error_pool_size_l0': 8, 'heading_error_out_channels_l1': 65, 'heading_error_pool_size_l1': 2, 'heading_error_out_channels_l2': 180, 'heading_error_pool_size_l2': 2, 'heading_error_out_channels_l3': 82, 'heading_error_pool_size_l3': 2, 'heading_error_fc_hidden': 32}. Best is trial 58 with value: 0.0986.
[rank: 0] Seed set to 42
[rank: 0] Seed set to 42
GPU available: True (cuda), used: True
TPU available: False, using: 0 TPU cores
💡 Tip: For seamless cloud logging and experiment tracking, try installing [litlogger](https://pypi.org/project/litlogger/) to enable LitLogger, which logs metrics and artifacts automatically to the Lightning Experiments platform.
GPU available: True (cuda), used: True
TPU available: False, using: 0 TPU cores
💡 Tip: For seamless cloud logging and experiment tracking, try installing [litlogger](https://pypi.org/project/litlogger/) to enable LitLogger, which logs metrics and artifacts automatically to the Lightning Experiments platform.
[rank: 0] Seed set to 42
GPU available: True (cuda), used: True
TPU available: False, using: 0 TPU cores
💡 Tip: For seamless cloud logging and experiment tracking, try installing [litlogger](https://pypi.org/project/litlogger/) to enable LitLogger, which logs metrics and artifacts automatically to the Lightning Experiments platform.
LOCAL_RANK: 0 - CUDA_VISIBLE_DEVICES: [0]
LOCAL_RANK: 0 - CUDA_VISIBLE_DEVICES: [0]
LOCAL_RANK: 0 - CUDA_VISIBLE_DEVICES: [0]
SLURM auto-requeueing enabled. Setting signal handlers.
SLURM auto-requeueing enabled. Setting signal handlers.
SLURM auto-requeueing enabled. Setting signal handlers.
`Trainer.fit` stopped: `max_epochs=20` reached.
`Trainer.fit` stopped: `max_epochs=20` reached.
`Trainer.fit` stopped: `max_epochs=20` reached.
[I 2026-04-12 16:21:05,036] Trial 84 finished with value: 0.1253 and parameters: {'left_wall_dist_num_layers': 4, 'left_wall_dist_activation': 'relu', 'left_wall_dist_out_channels_l0': 40, 'left_wall_dist_pool_size_l0': 2, 'left_wall_dist_out_channels_l1': 50, 'left_wall_dist_pool_size_l1': 4, 'left_wall_dist_out_channels_l2': 110, 'left_wall_dist_pool_size_l2': 2, 'left_wall_dist_out_channels_l3': 36, 'left_wall_dist_pool_size_l3': 8, 'left_wall_dist_fc_hidden': 69, 'track_width_num_layers': 5, 'track_width_activation': 'elu', 'track_width_out_channels_l0': 43, 'track_width_pool_size_l0': 8, 'track_width_out_channels_l1': 70, 'track_width_pool_size_l1': 8, 'track_width_out_channels_l2': 35, 'track_width_pool_size_l2': 8, 'heading_error_num_layers': 4, 'heading_error_activation': 'elu', 'heading_error_out_channels_l0': 118, 'heading_error_pool_size_l0': 8, 'heading_error_out_channels_l1': 52, 'heading_error_pool_size_l1': 2, 'heading_error_out_channels_l2': 98, 'heading_error_pool_size_l2': 2, 'heading_error_out_channels_l3': 67, 'heading_error_pool_size_l3': 2, 'heading_error_fc_hidden': 69}. Best is trial 58 with value: 0.0986.
[rank: 0] Seed set to 42
[rank: 0] Seed set to 42
GPU available: True (cuda), used: True
TPU available: False, using: 0 TPU cores
💡 Tip: For seamless cloud logging and experiment tracking, try installing [litlogger](https://pypi.org/project/litlogger/) to enable LitLogger, which logs metrics and artifacts automatically to the Lightning Experiments platform.
GPU available: True (cuda), used: True
TPU available: False, using: 0 TPU cores
💡 Tip: For seamless cloud logging and experiment tracking, try installing [litlogger](https://pypi.org/project/litlogger/) to enable LitLogger, which logs metrics and artifacts automatically to the Lightning Experiments platform.
[rank: 0] Seed set to 42
GPU available: True (cuda), used: True
TPU available: False, using: 0 TPU cores
💡 Tip: For seamless cloud logging and experiment tracking, try installing [litlogger](https://pypi.org/project/litlogger/) to enable LitLogger, which logs metrics and artifacts automatically to the Lightning Experiments platform.
LOCAL_RANK: 0 - CUDA_VISIBLE_DEVICES: [0]
LOCAL_RANK: 0 - CUDA_VISIBLE_DEVICES: [0]
LOCAL_RANK: 0 - CUDA_VISIBLE_DEVICES: [0]
SLURM auto-requeueing enabled. Setting signal handlers.
SLURM auto-requeueing enabled. Setting signal handlers.
SLURM auto-requeueing enabled. Setting signal handlers.
`Trainer.fit` stopped: `max_epochs=20` reached.
`Trainer.fit` stopped: `max_epochs=20` reached.
`Trainer.fit` stopped: `max_epochs=20` reached.
[I 2026-04-12 16:23:15,016] Trial 85 finished with value: 0.113 and parameters: {'left_wall_dist_num_layers': 4, 'left_wall_dist_activation': 'relu', 'left_wall_dist_out_channels_l0': 32, 'left_wall_dist_pool_size_l0': 2, 'left_wall_dist_out_channels_l1': 37, 'left_wall_dist_pool_size_l1': 4, 'left_wall_dist_out_channels_l2': 89, 'left_wall_dist_pool_size_l2': 2, 'left_wall_dist_out_channels_l3': 43, 'left_wall_dist_pool_size_l3': 8, 'left_wall_dist_fc_hidden': 62, 'track_width_num_layers': 5, 'track_width_activation': 'elu', 'track_width_out_channels_l0': 108, 'track_width_pool_size_l0': 8, 'track_width_out_channels_l1': 67, 'track_width_pool_size_l1': 8, 'track_width_out_channels_l2': 36, 'track_width_pool_size_l2': 8, 'heading_error_num_layers': 4, 'heading_error_activation': 'elu', 'heading_error_out_channels_l0': 67, 'heading_error_pool_size_l0': 8, 'heading_error_out_channels_l1': 66, 'heading_error_pool_size_l1': 2, 'heading_error_out_channels_l2': 79, 'heading_error_pool_size_l2': 2, 'heading_error_out_channels_l3': 73, 'heading_error_pool_size_l3': 2, 'heading_error_fc_hidden': 53}. Best is trial 58 with value: 0.0986.
[rank: 0] Seed set to 42
[rank: 0] Seed set to 42
GPU available: True (cuda), used: True
TPU available: False, using: 0 TPU cores
💡 Tip: For seamless cloud logging and experiment tracking, try installing [litlogger](https://pypi.org/project/litlogger/) to enable LitLogger, which logs metrics and artifacts automatically to the Lightning Experiments platform.
GPU available: True (cuda), used: True
TPU available: False, using: 0 TPU cores
💡 Tip: For seamless cloud logging and experiment tracking, try installing [litlogger](https://pypi.org/project/litlogger/) to enable LitLogger, which logs metrics and artifacts automatically to the Lightning Experiments platform.
[rank: 0] Seed set to 42
GPU available: True (cuda), used: True
TPU available: False, using: 0 TPU cores
💡 Tip: For seamless cloud logging and experiment tracking, try installing [litlogger](https://pypi.org/project/litlogger/) to enable LitLogger, which logs metrics and artifacts automatically to the Lightning Experiments platform.
LOCAL_RANK: 0 - CUDA_VISIBLE_DEVICES: [0]
LOCAL_RANK: 0 - CUDA_VISIBLE_DEVICES: [0]
LOCAL_RANK: 0 - CUDA_VISIBLE_DEVICES: [0]
SLURM auto-requeueing enabled. Setting signal handlers.
SLURM auto-requeueing enabled. Setting signal handlers.
SLURM auto-requeueing enabled. Setting signal handlers.
`Trainer.fit` stopped: `max_epochs=20` reached.
`Trainer.fit` stopped: `max_epochs=20` reached.
`Trainer.fit` stopped: `max_epochs=20` reached.
[I 2026-04-12 16:25:20,837] Trial 86 finished with value: 0.1567 and parameters: {'left_wall_dist_num_layers': 3, 'left_wall_dist_activation': 'relu', 'left_wall_dist_out_channels_l0': 33, 'left_wall_dist_pool_size_l0': 2, 'left_wall_dist_out_channels_l1': 38, 'left_wall_dist_pool_size_l1': 4, 'left_wall_dist_out_channels_l2': 88, 'left_wall_dist_pool_size_l2': 2, 'left_wall_dist_fc_hidden': 92, 'track_width_num_layers': 4, 'track_width_activation': 'elu', 'track_width_out_channels_l0': 113, 'track_width_pool_size_l0': 8, 'track_width_out_channels_l1': 62, 'track_width_pool_size_l1': 8, 'track_width_out_channels_l2': 47, 'track_width_pool_size_l2': 8, 'heading_error_num_layers': 4, 'heading_error_activation': 'elu', 'heading_error_out_channels_l0': 68, 'heading_error_pool_size_l0': 8, 'heading_error_out_channels_l1': 70, 'heading_error_pool_size_l1': 2, 'heading_error_out_channels_l2': 68, 'heading_error_pool_size_l2': 2, 'heading_error_out_channels_l3': 53, 'heading_error_pool_size_l3': 2, 'heading_error_fc_hidden': 52}. Best is trial 58 with value: 0.0986.
[rank: 0] Seed set to 42
[rank: 0] Seed set to 42
[rank: 0] Seed set to 42
GPU available: True (cuda), used: True
TPU available: False, using: 0 TPU cores
💡 Tip: For seamless cloud logging and experiment tracking, try installing [litlogger](https://pypi.org/project/litlogger/) to enable LitLogger, which logs metrics and artifacts automatically to the Lightning Experiments platform.
GPU available: True (cuda), used: True
TPU available: False, using: 0 TPU cores
💡 Tip: For seamless cloud logging and experiment tracking, try installing [litlogger](https://pypi.org/project/litlogger/) to enable LitLogger, which logs metrics and artifacts automatically to the Lightning Experiments platform.
GPU available: True (cuda), used: True
TPU available: False, using: 0 TPU cores
💡 Tip: For seamless cloud logging and experiment tracking, try installing [litlogger](https://pypi.org/project/litlogger/) to enable LitLogger, which logs metrics and artifacts automatically to the Lightning Experiments platform.
LOCAL_RANK: 0 - CUDA_VISIBLE_DEVICES: [0]
LOCAL_RANK: 0 - CUDA_VISIBLE_DEVICES: [0]
LOCAL_RANK: 0 - CUDA_VISIBLE_DEVICES: [0]
SLURM auto-requeueing enabled. Setting signal handlers.
SLURM auto-requeueing enabled. Setting signal handlers.
SLURM auto-requeueing enabled. Setting signal handlers.
`Trainer.fit` stopped: `max_epochs=20` reached.
`Trainer.fit` stopped: `max_epochs=20` reached.
`Trainer.fit` stopped: `max_epochs=20` reached.
[I 2026-04-12 16:27:34,581] Trial 87 finished with value: 0.2941 and parameters: {'left_wall_dist_num_layers': 4, 'left_wall_dist_activation': 'elu', 'left_wall_dist_out_channels_l0': 151, 'left_wall_dist_pool_size_l0': 8, 'left_wall_dist_out_channels_l1': 36, 'left_wall_dist_pool_size_l1': 4, 'left_wall_dist_out_channels_l2': 98, 'left_wall_dist_pool_size_l2': 2, 'left_wall_dist_out_channels_l3': 46, 'left_wall_dist_pool_size_l3': 8, 'track_width_num_layers': 5, 'track_width_activation': 'elu', 'track_width_out_channels_l0': 102, 'track_width_pool_size_l0': 4, 'track_width_out_channels_l1': 78, 'track_width_pool_size_l1': 8, 'track_width_out_channels_l2': 60, 'track_width_pool_size_l2': 8, 'track_width_out_channels_l3': 236, 'track_width_pool_size_l3': 8, 'heading_error_num_layers': 4, 'heading_error_activation': 'relu', 'heading_error_out_channels_l0': 75, 'heading_error_pool_size_l0': 8, 'heading_error_out_channels_l1': 83, 'heading_error_pool_size_l1': 2, 'heading_error_out_channels_l2': 51, 'heading_error_pool_size_l2': 2, 'heading_error_out_channels_l3': 109, 'heading_error_pool_size_l3': 2, 'heading_error_fc_hidden': 45}. Best is trial 58 with value: 0.0986.
[rank: 0] Seed set to 42
[rank: 0] Seed set to 42
[rank: 0] Seed set to 42
GPU available: True (cuda), used: True
TPU available: False, using: 0 TPU cores
GPU available: True (cuda), used: True
💡 Tip: For seamless cloud logging and experiment tracking, try installing [litlogger](https://pypi.org/project/litlogger/) to enable LitLogger, which logs metrics and artifacts automatically to the Lightning Experiments platform.
TPU available: False, using: 0 TPU cores
💡 Tip: For seamless cloud logging and experiment tracking, try installing [litlogger](https://pypi.org/project/litlogger/) to enable LitLogger, which logs metrics and artifacts automatically to the Lightning Experiments platform.
GPU available: True (cuda), used: True
TPU available: False, using: 0 TPU cores
💡 Tip: For seamless cloud logging and experiment tracking, try installing [litlogger](https://pypi.org/project/litlogger/) to enable LitLogger, which logs metrics and artifacts automatically to the Lightning Experiments platform.
LOCAL_RANK: 0 - CUDA_VISIBLE_DEVICES: [0]
LOCAL_RANK: 0 - CUDA_VISIBLE_DEVICES: [0]
LOCAL_RANK: 0 - CUDA_VISIBLE_DEVICES: [0]
SLURM auto-requeueing enabled. Setting signal handlers.
SLURM auto-requeueing enabled. Setting signal handlers.
SLURM auto-requeueing enabled. Setting signal handlers.
`Trainer.fit` stopped: `max_epochs=20` reached.
`Trainer.fit` stopped: `max_epochs=20` reached.
`Trainer.fit` stopped: `max_epochs=20` reached.
