[I 2026-04-16 02:08:00,893] Trial 109 finished with value: 0.1251 and parameters: {'left_wall_dist_num_layers': 2, 'left_wall_dist_activation': 'relu', 'left_wall_dist_out_channels_l0': 72, 'left_wall_dist_pool_size_l0': 2, 'left_wall_dist_out_channels_l1': 68, 'left_wall_dist_pool_size_l1': 8, 'left_wall_dist_fc_hidden': 109, 'track_width_num_layers': 3, 'track_width_activation': 'relu', 'track_width_out_channels_l0': 158, 'track_width_pool_size_l0': 8, 'track_width_out_channels_l1': 119, 'track_width_pool_size_l1': 2, 'track_width_out_channels_l2': 39, 'track_width_pool_size_l2': 4, 'track_width_fc_hidden': 35, 'heading_error_num_layers': 2, 'heading_error_activation': 'relu', 'heading_error_out_channels_l0': 71, 'heading_error_pool_size_l0': 8, 'heading_error_out_channels_l1': 104, 'heading_error_pool_size_l1': 8, 'heading_error_fc_hidden': 65}. Best is trial 23 with value: 0.0876.
[rank: 0] Seed set to 42
[rank: 0] Seed set to 42
[rank: 0] Seed set to 42
GPU available: True (cuda), used: True
TPU available: False, using: 0 TPU cores
💡 Tip: For seamless cloud logging and experiment tracking, try installing [litlogger](https://pypi.org/project/litlogger/) to enable LitLogger, which logs metrics and artifacts automatically to the Lightning Experiments platform.
GPU available: True (cuda), used: True
TPU available: False, using: 0 TPU cores
💡 Tip: For seamless cloud logging and experiment tracking, try installing [litlogger](https://pypi.org/project/litlogger/) to enable LitLogger, which logs metrics and artifacts automatically to the Lightning Experiments platform.
GPU available: True (cuda), used: True
TPU available: False, using: 0 TPU cores
💡 Tip: For seamless cloud logging and experiment tracking, try installing [litlogger](https://pypi.org/project/litlogger/) to enable LitLogger, which logs metrics and artifacts automatically to the Lightning Experiments platform.
LOCAL_RANK: 0 - CUDA_VISIBLE_DEVICES: [0]
LOCAL_RANK: 0 - CUDA_VISIBLE_DEVICES: [0]
LOCAL_RANK: 0 - CUDA_VISIBLE_DEVICES: [0]
SLURM auto-requeueing enabled. Setting signal handlers.
SLURM auto-requeueing enabled. Setting signal handlers.
SLURM auto-requeueing enabled. Setting signal handlers.
`Trainer.fit` stopped: `max_epochs=30` reached.
`Trainer.fit` stopped: `max_epochs=30` reached.
`Trainer.fit` stopped: `max_epochs=30` reached.
[I 2026-04-16 02:10:32,500] Trial 110 finished with value: 0.1004 and parameters: {'left_wall_dist_num_layers': 3, 'left_wall_dist_activation': 'relu', 'left_wall_dist_out_channels_l0': 37, 'left_wall_dist_pool_size_l0': 2, 'left_wall_dist_out_channels_l1': 193, 'left_wall_dist_pool_size_l1': 8, 'left_wall_dist_out_channels_l2': 197, 'left_wall_dist_pool_size_l2': 4, 'left_wall_dist_fc_hidden': 96, 'track_width_num_layers': 3, 'track_width_activation': 'relu', 'track_width_out_channels_l0': 140, 'track_width_pool_size_l0': 8, 'track_width_out_channels_l1': 252, 'track_width_pool_size_l1': 2, 'track_width_out_channels_l2': 37, 'track_width_pool_size_l2': 4, 'track_width_fc_hidden': 32, 'heading_error_num_layers': 2, 'heading_error_activation': 'elu', 'heading_error_out_channels_l0': 175, 'heading_error_pool_size_l0': 8, 'heading_error_out_channels_l1': 114, 'heading_error_pool_size_l1': 8, 'heading_error_fc_hidden': 70}. Best is trial 23 with value: 0.0876.
[rank: 0] Seed set to 42
GPU available: True (cuda), used: True
TPU available: False, using: 0 TPU cores
💡 Tip: For seamless cloud logging and experiment tracking, try installing [litlogger](https://pypi.org/project/litlogger/) to enable LitLogger, which logs metrics and artifacts automatically to the Lightning Experiments platform.
[rank: 0] Seed set to 42
[rank: 0] Seed set to 42
GPU available: True (cuda), used: True
TPU available: False, using: 0 TPU cores
💡 Tip: For seamless cloud logging and experiment tracking, try installing [litlogger](https://pypi.org/project/litlogger/) to enable LitLogger, which logs metrics and artifacts automatically to the Lightning Experiments platform.
GPU available: True (cuda), used: True
TPU available: False, using: 0 TPU cores
💡 Tip: For seamless cloud logging and experiment tracking, try installing [litlogger](https://pypi.org/project/litlogger/) to enable LitLogger, which logs metrics and artifacts automatically to the Lightning Experiments platform.
LOCAL_RANK: 0 - CUDA_VISIBLE_DEVICES: [0]
LOCAL_RANK: 0 - CUDA_VISIBLE_DEVICES: [0]
LOCAL_RANK: 0 - CUDA_VISIBLE_DEVICES: [0]
SLURM auto-requeueing enabled. Setting signal handlers.
SLURM auto-requeueing enabled. Setting signal handlers.
SLURM auto-requeueing enabled. Setting signal handlers.
`Trainer.fit` stopped: `max_epochs=30` reached.
`Trainer.fit` stopped: `max_epochs=30` reached.
`Trainer.fit` stopped: `max_epochs=30` reached.
[I 2026-04-16 02:13:02,696] Trial 111 finished with value: 0.1174 and parameters: {'left_wall_dist_num_layers': 3, 'left_wall_dist_activation': 'relu', 'left_wall_dist_out_channels_l0': 37, 'left_wall_dist_pool_size_l0': 2, 'left_wall_dist_out_channels_l1': 180, 'left_wall_dist_pool_size_l1': 8, 'left_wall_dist_out_channels_l2': 192, 'left_wall_dist_pool_size_l2': 4, 'left_wall_dist_fc_hidden': 75, 'track_width_num_layers': 3, 'track_width_activation': 'relu', 'track_width_out_channels_l0': 143, 'track_width_pool_size_l0': 8, 'track_width_out_channels_l1': 249, 'track_width_pool_size_l1': 2, 'track_width_out_channels_l2': 34, 'track_width_pool_size_l2': 4, 'track_width_fc_hidden': 32, 'heading_error_num_layers': 2, 'heading_error_activation': 'elu', 'heading_error_out_channels_l0': 151, 'heading_error_pool_size_l0': 8, 'heading_error_out_channels_l1': 116, 'heading_error_pool_size_l1': 8, 'heading_error_fc_hidden': 70}. Best is trial 23 with value: 0.0876.
[rank: 0] Seed set to 42
GPU available: True (cuda), used: True
TPU available: False, using: 0 TPU cores
💡 Tip: For seamless cloud logging and experiment tracking, try installing [litlogger](https://pypi.org/project/litlogger/) to enable LitLogger, which logs metrics and artifacts automatically to the Lightning Experiments platform.
[rank: 0] Seed set to 42
GPU available: True (cuda), used: True
TPU available: False, using: 0 TPU cores
💡 Tip: For seamless cloud logging and experiment tracking, try installing [litlogger](https://pypi.org/project/litlogger/) to enable LitLogger, which logs metrics and artifacts automatically to the Lightning Experiments platform.
[rank: 0] Seed set to 42
GPU available: True (cuda), used: True
TPU available: False, using: 0 TPU cores
💡 Tip: For seamless cloud logging and experiment tracking, try installing [litlogger](https://pypi.org/project/litlogger/) to enable LitLogger, which logs metrics and artifacts automatically to the Lightning Experiments platform.
LOCAL_RANK: 0 - CUDA_VISIBLE_DEVICES: [0]
SLURM auto-requeueing enabled. Setting signal handlers.
LOCAL_RANK: 0 - CUDA_VISIBLE_DEVICES: [0]
LOCAL_RANK: 0 - CUDA_VISIBLE_DEVICES: [0]
SLURM auto-requeueing enabled. Setting signal handlers.
SLURM auto-requeueing enabled. Setting signal handlers.
`Trainer.fit` stopped: `max_epochs=30` reached.
`Trainer.fit` stopped: `max_epochs=30` reached.
`Trainer.fit` stopped: `max_epochs=30` reached.
[I 2026-04-16 02:15:33,263] Trial 112 finished with value: 0.1027 and parameters: {'left_wall_dist_num_layers': 3, 'left_wall_dist_activation': 'relu', 'left_wall_dist_out_channels_l0': 34, 'left_wall_dist_pool_size_l0': 2, 'left_wall_dist_out_channels_l1': 194, 'left_wall_dist_pool_size_l1': 8, 'left_wall_dist_out_channels_l2': 206, 'left_wall_dist_pool_size_l2': 4, 'left_wall_dist_fc_hidden': 96, 'track_width_num_layers': 3, 'track_width_activation': 'relu', 'track_width_out_channels_l0': 131, 'track_width_pool_size_l0': 8, 'track_width_out_channels_l1': 250, 'track_width_pool_size_l1': 2, 'track_width_out_channels_l2': 37, 'track_width_pool_size_l2': 4, 'track_width_fc_hidden': 35, 'heading_error_num_layers': 2, 'heading_error_activation': 'elu', 'heading_error_out_channels_l0': 198, 'heading_error_pool_size_l0': 8, 'heading_error_out_channels_l1': 98, 'heading_error_pool_size_l1': 8, 'heading_error_fc_hidden': 72}. Best is trial 23 with value: 0.0876.
[rank: 0] Seed set to 42
GPU available: True (cuda), used: True
TPU available: False, using: 0 TPU cores
💡 Tip: For seamless cloud logging and experiment tracking, try installing [litlogger](https://pypi.org/project/litlogger/) to enable LitLogger, which logs metrics and artifacts automatically to the Lightning Experiments platform.
[rank: 0] Seed set to 42
GPU available: True (cuda), used: True
TPU available: False, using: 0 TPU cores
💡 Tip: For seamless cloud logging and experiment tracking, try installing [litlogger](https://pypi.org/project/litlogger/) to enable LitLogger, which logs metrics and artifacts automatically to the Lightning Experiments platform.
[rank: 0] Seed set to 42
GPU available: True (cuda), used: True
TPU available: False, using: 0 TPU cores
💡 Tip: For seamless cloud logging and experiment tracking, try installing [litlogger](https://pypi.org/project/litlogger/) to enable LitLogger, which logs metrics and artifacts automatically to the Lightning Experiments platform.
LOCAL_RANK: 0 - CUDA_VISIBLE_DEVICES: [0]
LOCAL_RANK: 0 - CUDA_VISIBLE_DEVICES: [0]
LOCAL_RANK: 0 - CUDA_VISIBLE_DEVICES: [0]
SLURM auto-requeueing enabled. Setting signal handlers.
SLURM auto-requeueing enabled. Setting signal handlers.
SLURM auto-requeueing enabled. Setting signal handlers.
`Trainer.fit` stopped: `max_epochs=30` reached.
`Trainer.fit` stopped: `max_epochs=30` reached.
`Trainer.fit` stopped: `max_epochs=30` reached.
[I 2026-04-16 02:18:05,959] Trial 113 finished with value: 0.107 and parameters: {'left_wall_dist_num_layers': 3, 'left_wall_dist_activation': 'relu', 'left_wall_dist_out_channels_l0': 90, 'left_wall_dist_pool_size_l0': 2, 'left_wall_dist_out_channels_l1': 162, 'left_wall_dist_pool_size_l1': 8, 'left_wall_dist_out_channels_l2': 187, 'left_wall_dist_pool_size_l2': 4, 'left_wall_dist_fc_hidden': 100, 'track_width_num_layers': 3, 'track_width_activation': 'relu', 'track_width_out_channels_l0': 147, 'track_width_pool_size_l0': 8, 'track_width_out_channels_l1': 239, 'track_width_pool_size_l1': 2, 'track_width_out_channels_l2': 40, 'track_width_pool_size_l2': 4, 'track_width_fc_hidden': 63, 'heading_error_num_layers': 2, 'heading_error_activation': 'elu', 'heading_error_out_channels_l0': 229, 'heading_error_pool_size_l0': 8, 'heading_error_out_channels_l1': 122, 'heading_error_pool_size_l1': 8, 'heading_error_fc_hidden': 109}. Best is trial 23 with value: 0.0876.
[rank: 0] Seed set to 42
[rank: 0] Seed set to 42
GPU available: True (cuda), used: True
TPU available: False, using: 0 TPU cores
💡 Tip: For seamless cloud logging and experiment tracking, try installing [litlogger](https://pypi.org/project/litlogger/) to enable LitLogger, which logs metrics and artifacts automatically to the Lightning Experiments platform.
GPU available: True (cuda), used: True
TPU available: False, using: 0 TPU cores
💡 Tip: For seamless cloud logging and experiment tracking, try installing [litlogger](https://pypi.org/project/litlogger/) to enable LitLogger, which logs metrics and artifacts automatically to the Lightning Experiments platform.
[rank: 0] Seed set to 42
GPU available: True (cuda), used: True
TPU available: False, using: 0 TPU cores
💡 Tip: For seamless cloud logging and experiment tracking, try installing [litlogger](https://pypi.org/project/litlogger/) to enable LitLogger, which logs metrics and artifacts automatically to the Lightning Experiments platform.
LOCAL_RANK: 0 - CUDA_VISIBLE_DEVICES: [0]
LOCAL_RANK: 0 - CUDA_VISIBLE_DEVICES: [0]
LOCAL_RANK: 0 - CUDA_VISIBLE_DEVICES: [0]
SLURM auto-requeueing enabled. Setting signal handlers.
SLURM auto-requeueing enabled. Setting signal handlers.
SLURM auto-requeueing enabled. Setting signal handlers.
`Trainer.fit` stopped: `max_epochs=30` reached.
`Trainer.fit` stopped: `max_epochs=30` reached.
`Trainer.fit` stopped: `max_epochs=30` reached.
[I 2026-04-16 02:20:31,706] Trial 114 finished with value: 0.1026 and parameters: {'left_wall_dist_num_layers': 3, 'left_wall_dist_activation': 'relu', 'left_wall_dist_out_channels_l0': 38, 'left_wall_dist_pool_size_l0': 2, 'left_wall_dist_out_channels_l1': 227, 'left_wall_dist_pool_size_l1': 8, 'left_wall_dist_out_channels_l2': 228, 'left_wall_dist_pool_size_l2': 4, 'left_wall_dist_fc_hidden': 92, 'track_width_num_layers': 2, 'track_width_activation': 'relu', 'track_width_out_channels_l0': 137, 'track_width_pool_size_l0': 8, 'track_width_out_channels_l1': 205, 'track_width_pool_size_l1': 2, 'heading_error_num_layers': 2, 'heading_error_activation': 'elu', 'heading_error_out_channels_l0': 65, 'heading_error_pool_size_l0': 8, 'heading_error_out_channels_l1': 130, 'heading_error_pool_size_l1': 8, 'heading_error_fc_hidden': 60}. Best is trial 23 with value: 0.0876.
[rank: 0] Seed set to 42
GPU available: True (cuda), used: True
TPU available: False, using: 0 TPU cores
💡 Tip: For seamless cloud logging and experiment tracking, try installing [litlogger](https://pypi.org/project/litlogger/) to enable LitLogger, which logs metrics and artifacts automatically to the Lightning Experiments platform.
[rank: 0] Seed set to 42
[rank: 0] Seed set to 42
GPU available: True (cuda), used: True
TPU available: False, using: 0 TPU cores
💡 Tip: For seamless cloud logging and experiment tracking, try installing [litlogger](https://pypi.org/project/litlogger/) to enable LitLogger, which logs metrics and artifacts automatically to the Lightning Experiments platform.
GPU available: True (cuda), used: True
TPU available: False, using: 0 TPU cores
💡 Tip: For seamless cloud logging and experiment tracking, try installing [litlogger](https://pypi.org/project/litlogger/) to enable LitLogger, which logs metrics and artifacts automatically to the Lightning Experiments platform.
LOCAL_RANK: 0 - CUDA_VISIBLE_DEVICES: [0]
LOCAL_RANK: 0 - CUDA_VISIBLE_DEVICES: [0]
SLURM auto-requeueing enabled. Setting signal handlers.
LOCAL_RANK: 0 - CUDA_VISIBLE_DEVICES: [0]
SLURM auto-requeueing enabled. Setting signal handlers.
SLURM auto-requeueing enabled. Setting signal handlers.
`Trainer.fit` stopped: `max_epochs=30` reached.
`Trainer.fit` stopped: `max_epochs=30` reached.
`Trainer.fit` stopped: `max_epochs=30` reached.
[I 2026-04-16 02:23:02,560] Trial 115 finished with value: 0.1069 and parameters: {'left_wall_dist_num_layers': 3, 'left_wall_dist_activation': 'relu', 'left_wall_dist_out_channels_l0': 41, 'left_wall_dist_pool_size_l0': 2, 'left_wall_dist_out_channels_l1': 251, 'left_wall_dist_pool_size_l1': 8, 'left_wall_dist_out_channels_l2': 177, 'left_wall_dist_pool_size_l2': 4, 'left_wall_dist_fc_hidden': 79, 'track_width_num_layers': 3, 'track_width_activation': 'relu', 'track_width_out_channels_l0': 172, 'track_width_pool_size_l0': 8, 'track_width_out_channels_l1': 128, 'track_width_pool_size_l1': 2, 'track_width_out_channels_l2': 35, 'track_width_pool_size_l2': 4, 'track_width_fc_hidden': 32, 'heading_error_num_layers': 2, 'heading_error_activation': 'elu', 'heading_error_out_channels_l0': 38, 'heading_error_pool_size_l0': 8, 'heading_error_out_channels_l1': 109, 'heading_error_pool_size_l1': 8, 'heading_error_fc_hidden': 80}. Best is trial 23 with value: 0.0876.
[rank: 0] Seed set to 42
[rank: 0] Seed set to 42
[rank: 0] Seed set to 42
GPU available: True (cuda), used: True
GPU available: True (cuda), used: True
TPU available: False, using: 0 TPU cores
TPU available: False, using: 0 TPU cores
💡 Tip: For seamless cloud logging and experiment tracking, try installing [litlogger](https://pypi.org/project/litlogger/) to enable LitLogger, which logs metrics and artifacts automatically to the Lightning Experiments platform.
💡 Tip: For seamless cloud logging and experiment tracking, try installing [litlogger](https://pypi.org/project/litlogger/) to enable LitLogger, which logs metrics and artifacts automatically to the Lightning Experiments platform.
GPU available: True (cuda), used: True
TPU available: False, using: 0 TPU cores
💡 Tip: For seamless cloud logging and experiment tracking, try installing [litlogger](https://pypi.org/project/litlogger/) to enable LitLogger, which logs metrics and artifacts automatically to the Lightning Experiments platform.
LOCAL_RANK: 0 - CUDA_VISIBLE_DEVICES: [0]
LOCAL_RANK: 0 - CUDA_VISIBLE_DEVICES: [0]
LOCAL_RANK: 0 - CUDA_VISIBLE_DEVICES: [0]
SLURM auto-requeueing enabled. Setting signal handlers.
SLURM auto-requeueing enabled. Setting signal handlers.
SLURM auto-requeueing enabled. Setting signal handlers.
`Trainer.fit` stopped: `max_epochs=30` reached.
`Trainer.fit` stopped: `max_epochs=30` reached.
`Trainer.fit` stopped: `max_epochs=30` reached.
[I 2026-04-16 02:25:38,562] Trial 116 finished with value: 0.1141 and parameters: {'left_wall_dist_num_layers': 3, 'left_wall_dist_activation': 'relu', 'left_wall_dist_out_channels_l0': 44, 'left_wall_dist_pool_size_l0': 2, 'left_wall_dist_out_channels_l1': 84, 'left_wall_dist_pool_size_l1': 8, 'left_wall_dist_out_channels_l2': 172, 'left_wall_dist_pool_size_l2': 8, 'left_wall_dist_fc_hidden': 119, 'track_width_num_layers': 3, 'track_width_activation': 'relu', 'track_width_out_channels_l0': 164, 'track_width_pool_size_l0': 2, 'track_width_out_channels_l1': 253, 'track_width_pool_size_l1': 2, 'track_width_out_channels_l2': 38, 'track_width_pool_size_l2': 4, 'track_width_fc_hidden': 41, 'heading_error_num_layers': 2, 'heading_error_activation': 'elu', 'heading_error_out_channels_l0': 159, 'heading_error_pool_size_l0': 8, 'heading_error_out_channels_l1': 114, 'heading_error_pool_size_l1': 8, 'heading_error_fc_hidden': 63}. Best is trial 23 with value: 0.0876.
[rank: 0] Seed set to 42
[rank: 0] Seed set to 42
[rank: 0] Seed set to 42
GPU available: True (cuda), used: True
TPU available: False, using: 0 TPU cores
💡 Tip: For seamless cloud logging and experiment tracking, try installing [litlogger](https://pypi.org/project/litlogger/) to enable LitLogger, which logs metrics and artifacts automatically to the Lightning Experiments platform.
GPU available: True (cuda), used: True
TPU available: False, using: 0 TPU cores
💡 Tip: For seamless cloud logging and experiment tracking, try installing [litlogger](https://pypi.org/project/litlogger/) to enable LitLogger, which logs metrics and artifacts automatically to the Lightning Experiments platform.
GPU available: True (cuda), used: True
TPU available: False, using: 0 TPU cores
💡 Tip: For seamless cloud logging and experiment tracking, try installing [litlogger](https://pypi.org/project/litlogger/) to enable LitLogger, which logs metrics and artifacts automatically to the Lightning Experiments platform.
LOCAL_RANK: 0 - CUDA_VISIBLE_DEVICES: [0]
LOCAL_RANK: 0 - CUDA_VISIBLE_DEVICES: [0]
LOCAL_RANK: 0 - CUDA_VISIBLE_DEVICES: [0]
SLURM auto-requeueing enabled. Setting signal handlers.
SLURM auto-requeueing enabled. Setting signal handlers.
SLURM auto-requeueing enabled. Setting signal handlers.
`Trainer.fit` stopped: `max_epochs=30` reached.
`Trainer.fit` stopped: `max_epochs=30` reached.
`Trainer.fit` stopped: `max_epochs=30` reached.
[I 2026-04-16 02:28:15,827] Trial 117 finished with value: 0.1096 and parameters: {'left_wall_dist_num_layers': 4, 'left_wall_dist_activation': 'relu', 'left_wall_dist_out_channels_l0': 35, 'left_wall_dist_pool_size_l0': 2, 'left_wall_dist_out_channels_l1': 204, 'left_wall_dist_pool_size_l1': 2, 'left_wall_dist_out_channels_l2': 164, 'left_wall_dist_pool_size_l2': 2, 'left_wall_dist_out_channels_l3': 59, 'left_wall_dist_pool_size_l3': 2, 'left_wall_dist_fc_hidden': 114, 'track_width_num_layers': 3, 'track_width_activation': 'relu', 'track_width_out_channels_l0': 121, 'track_width_pool_size_l0': 8, 'track_width_out_channels_l1': 231, 'track_width_pool_size_l1': 4, 'track_width_out_channels_l2': 43, 'track_width_pool_size_l2': 4, 'track_width_fc_hidden': 33, 'heading_error_num_layers': 2, 'heading_error_activation': 'elu', 'heading_error_out_channels_l0': 77, 'heading_error_pool_size_l0': 8, 'heading_error_out_channels_l1': 91, 'heading_error_pool_size_l1': 8, 'heading_error_fc_hidden': 34}. Best is trial 23 with value: 0.0876.
[rank: 0] Seed set to 42
[rank: 0] Seed set to 42
[rank: 0] Seed set to 42
GPU available: True (cuda), used: True
TPU available: False, using: 0 TPU cores
💡 Tip: For seamless cloud logging and experiment tracking, try installing [litlogger](https://pypi.org/project/litlogger/) to enable LitLogger, which logs metrics and artifacts automatically to the Lightning Experiments platform.
GPU available: True (cuda), used: True
TPU available: False, using: 0 TPU cores
💡 Tip: For seamless cloud logging and experiment tracking, try installing [litlogger](https://pypi.org/project/litlogger/) to enable LitLogger, which logs metrics and artifacts automatically to the Lightning Experiments platform.
GPU available: True (cuda), used: True
TPU available: False, using: 0 TPU cores
💡 Tip: For seamless cloud logging and experiment tracking, try installing [litlogger](https://pypi.org/project/litlogger/) to enable LitLogger, which logs metrics and artifacts automatically to the Lightning Experiments platform.
LOCAL_RANK: 0 - CUDA_VISIBLE_DEVICES: [0]
LOCAL_RANK: 0 - CUDA_VISIBLE_DEVICES: [0]
LOCAL_RANK: 0 - CUDA_VISIBLE_DEVICES: [0]
SLURM auto-requeueing enabled. Setting signal handlers.
SLURM auto-requeueing enabled. Setting signal handlers.
SLURM auto-requeueing enabled. Setting signal handlers.
`Trainer.fit` stopped: `max_epochs=30` reached.
`Trainer.fit` stopped: `max_epochs=30` reached.
`Trainer.fit` stopped: `max_epochs=30` reached.
