[I 2026-04-12 15:32:22,848] Trial 61 finished with value: 0.1091 and parameters: {'left_wall_dist_num_layers': 5, 'left_wall_dist_activation': 'relu', 'left_wall_dist_out_channels_l0': 122, 'left_wall_dist_pool_size_l0': 4, 'left_wall_dist_out_channels_l1': 47, 'left_wall_dist_pool_size_l1': 2, 'left_wall_dist_out_channels_l2': 138, 'left_wall_dist_pool_size_l2': 2, 'left_wall_dist_out_channels_l3': 120, 'left_wall_dist_pool_size_l3': 4, 'left_wall_dist_out_channels_l4': 60, 'left_wall_dist_pool_size_l4': 2, 'left_wall_dist_fc_hidden': 58, 'track_width_num_layers': 4, 'track_width_activation': 'elu', 'track_width_out_channels_l0': 88, 'track_width_pool_size_l0': 8, 'track_width_out_channels_l1': 79, 'track_width_pool_size_l1': 4, 'track_width_out_channels_l2': 43, 'track_width_pool_size_l2': 2, 'track_width_out_channels_l3': 37, 'track_width_pool_size_l3': 4, 'heading_error_num_layers': 5, 'heading_error_activation': 'elu', 'heading_error_out_channels_l0': 51, 'heading_error_pool_size_l0': 2, 'heading_error_out_channels_l1': 48, 'heading_error_pool_size_l1': 4, 'heading_error_out_channels_l2': 111, 'heading_error_pool_size_l2': 4, 'heading_error_out_channels_l3': 149, 'heading_error_pool_size_l3': 8, 'heading_error_out_channels_l4': 135, 'heading_error_pool_size_l4': 8, 'heading_error_fc_hidden': 35}. Best is trial 58 with value: 0.0986.
[rank: 0] Seed set to 42
[rank: 0] Seed set to 42
GPU available: True (cuda), used: True
TPU available: False, using: 0 TPU cores
💡 Tip: For seamless cloud logging and experiment tracking, try installing [litlogger](https://pypi.org/project/litlogger/) to enable LitLogger, which logs metrics and artifacts automatically to the Lightning Experiments platform.
GPU available: True (cuda), used: True
TPU available: False, using: 0 TPU cores
💡 Tip: For seamless cloud logging and experiment tracking, try installing [litlogger](https://pypi.org/project/litlogger/) to enable LitLogger, which logs metrics and artifacts automatically to the Lightning Experiments platform.
[rank: 0] Seed set to 42
GPU available: True (cuda), used: True
TPU available: False, using: 0 TPU cores
💡 Tip: For seamless cloud logging and experiment tracking, try installing [litlogger](https://pypi.org/project/litlogger/) to enable LitLogger, which logs metrics and artifacts automatically to the Lightning Experiments platform.
LOCAL_RANK: 0 - CUDA_VISIBLE_DEVICES: [0]
LOCAL_RANK: 0 - CUDA_VISIBLE_DEVICES: [0]
LOCAL_RANK: 0 - CUDA_VISIBLE_DEVICES: [0]
SLURM auto-requeueing enabled. Setting signal handlers.
SLURM auto-requeueing enabled. Setting signal handlers.
SLURM auto-requeueing enabled. Setting signal handlers.
`Trainer.fit` stopped: `max_epochs=20` reached.
`Trainer.fit` stopped: `max_epochs=20` reached.
`Trainer.fit` stopped: `max_epochs=20` reached.
[I 2026-04-12 15:34:49,968] Trial 62 finished with value: 0.1302 and parameters: {'left_wall_dist_num_layers': 5, 'left_wall_dist_activation': 'relu', 'left_wall_dist_out_channels_l0': 122, 'left_wall_dist_pool_size_l0': 4, 'left_wall_dist_out_channels_l1': 41, 'left_wall_dist_pool_size_l1': 2, 'left_wall_dist_out_channels_l2': 113, 'left_wall_dist_pool_size_l2': 2, 'left_wall_dist_out_channels_l3': 119, 'left_wall_dist_pool_size_l3': 4, 'left_wall_dist_out_channels_l4': 62, 'left_wall_dist_pool_size_l4': 2, 'left_wall_dist_fc_hidden': 65, 'track_width_num_layers': 4, 'track_width_activation': 'elu', 'track_width_out_channels_l0': 86, 'track_width_pool_size_l0': 8, 'track_width_out_channels_l1': 77, 'track_width_pool_size_l1': 4, 'track_width_out_channels_l2': 42, 'track_width_pool_size_l2': 2, 'track_width_out_channels_l3': 36, 'track_width_pool_size_l3': 4, 'heading_error_num_layers': 5, 'heading_error_activation': 'elu', 'heading_error_out_channels_l0': 50, 'heading_error_pool_size_l0': 2, 'heading_error_out_channels_l1': 46, 'heading_error_pool_size_l1': 4, 'heading_error_out_channels_l2': 111, 'heading_error_pool_size_l2': 4, 'heading_error_out_channels_l3': 152, 'heading_error_pool_size_l3': 8, 'heading_error_out_channels_l4': 145, 'heading_error_pool_size_l4': 8, 'heading_error_fc_hidden': 35}. Best is trial 58 with value: 0.0986.
[rank: 0] Seed set to 42
[rank: 0] Seed set to 42
[rank: 0] Seed set to 42
GPU available: True (cuda), used: True
TPU available: False, using: 0 TPU cores
💡 Tip: For seamless cloud logging and experiment tracking, try installing [litlogger](https://pypi.org/project/litlogger/) to enable LitLogger, which logs metrics and artifacts automatically to the Lightning Experiments platform.
GPU available: True (cuda), used: True
TPU available: False, using: 0 TPU cores
GPU available: True (cuda), used: True
TPU available: False, using: 0 TPU cores
💡 Tip: For seamless cloud logging and experiment tracking, try installing [litlogger](https://pypi.org/project/litlogger/) to enable LitLogger, which logs metrics and artifacts automatically to the Lightning Experiments platform.
💡 Tip: For seamless cloud logging and experiment tracking, try installing [litlogger](https://pypi.org/project/litlogger/) to enable LitLogger, which logs metrics and artifacts automatically to the Lightning Experiments platform.
LOCAL_RANK: 0 - CUDA_VISIBLE_DEVICES: [0]
LOCAL_RANK: 0 - CUDA_VISIBLE_DEVICES: [0]
LOCAL_RANK: 0 - CUDA_VISIBLE_DEVICES: [0]
SLURM auto-requeueing enabled. Setting signal handlers.
SLURM auto-requeueing enabled. Setting signal handlers.
SLURM auto-requeueing enabled. Setting signal handlers.
`Trainer.fit` stopped: `max_epochs=20` reached.
`Trainer.fit` stopped: `max_epochs=20` reached.
`Trainer.fit` stopped: `max_epochs=20` reached.
[I 2026-04-12 15:37:25,558] Trial 63 finished with value: 0.1164 and parameters: {'left_wall_dist_num_layers': 5, 'left_wall_dist_activation': 'relu', 'left_wall_dist_out_channels_l0': 160, 'left_wall_dist_pool_size_l0': 4, 'left_wall_dist_out_channels_l1': 51, 'left_wall_dist_pool_size_l1': 2, 'left_wall_dist_out_channels_l2': 145, 'left_wall_dist_pool_size_l2': 2, 'left_wall_dist_out_channels_l3': 161, 'left_wall_dist_pool_size_l3': 4, 'left_wall_dist_out_channels_l4': 51, 'left_wall_dist_pool_size_l4': 2, 'left_wall_dist_fc_hidden': 63, 'track_width_num_layers': 4, 'track_width_activation': 'elu', 'track_width_out_channels_l0': 94, 'track_width_pool_size_l0': 8, 'track_width_out_channels_l1': 82, 'track_width_pool_size_l1': 4, 'track_width_out_channels_l2': 44, 'track_width_pool_size_l2': 2, 'track_width_out_channels_l3': 40, 'track_width_pool_size_l3': 4, 'heading_error_num_layers': 5, 'heading_error_activation': 'elu', 'heading_error_out_channels_l0': 45, 'heading_error_pool_size_l0': 2, 'heading_error_out_channels_l1': 51, 'heading_error_pool_size_l1': 4, 'heading_error_out_channels_l2': 99, 'heading_error_pool_size_l2': 4, 'heading_error_out_channels_l3': 186, 'heading_error_pool_size_l3': 8, 'heading_error_out_channels_l4': 127, 'heading_error_pool_size_l4': 8, 'heading_error_fc_hidden': 43}. Best is trial 58 with value: 0.0986.
[rank: 0] Seed set to 42
[rank: 0] Seed set to 42
[rank: 0] Seed set to 42
GPU available: True (cuda), used: True
TPU available: False, using: 0 TPU cores
GPU available: True (cuda), used: True
TPU available: False, using: 0 TPU cores
💡 Tip: For seamless cloud logging and experiment tracking, try installing [litlogger](https://pypi.org/project/litlogger/) to enable LitLogger, which logs metrics and artifacts automatically to the Lightning Experiments platform.
💡 Tip: For seamless cloud logging and experiment tracking, try installing [litlogger](https://pypi.org/project/litlogger/) to enable LitLogger, which logs metrics and artifacts automatically to the Lightning Experiments platform.
GPU available: True (cuda), used: True
TPU available: False, using: 0 TPU cores
💡 Tip: For seamless cloud logging and experiment tracking, try installing [litlogger](https://pypi.org/project/litlogger/) to enable LitLogger, which logs metrics and artifacts automatically to the Lightning Experiments platform.
LOCAL_RANK: 0 - CUDA_VISIBLE_DEVICES: [0]
LOCAL_RANK: 0 - CUDA_VISIBLE_DEVICES: [0]
LOCAL_RANK: 0 - CUDA_VISIBLE_DEVICES: [0]
SLURM auto-requeueing enabled. Setting signal handlers.
SLURM auto-requeueing enabled. Setting signal handlers.
SLURM auto-requeueing enabled. Setting signal handlers.
`Trainer.fit` stopped: `max_epochs=20` reached.
`Trainer.fit` stopped: `max_epochs=20` reached.
`Trainer.fit` stopped: `max_epochs=20` reached.
[I 2026-04-12 15:39:50,430] Trial 64 finished with value: 0.1527 and parameters: {'left_wall_dist_num_layers': 5, 'left_wall_dist_activation': 'relu', 'left_wall_dist_out_channels_l0': 119, 'left_wall_dist_pool_size_l0': 4, 'left_wall_dist_out_channels_l1': 45, 'left_wall_dist_pool_size_l1': 2, 'left_wall_dist_out_channels_l2': 85, 'left_wall_dist_pool_size_l2': 4, 'left_wall_dist_out_channels_l3': 246, 'left_wall_dist_pool_size_l3': 4, 'left_wall_dist_out_channels_l4': 154, 'left_wall_dist_pool_size_l4': 2, 'left_wall_dist_fc_hidden': 48, 'track_width_num_layers': 4, 'track_width_activation': 'elu', 'track_width_out_channels_l0': 78, 'track_width_pool_size_l0': 8, 'track_width_out_channels_l1': 61, 'track_width_pool_size_l1': 4, 'track_width_out_channels_l2': 78, 'track_width_pool_size_l2': 2, 'track_width_out_channels_l3': 45, 'track_width_pool_size_l3': 4, 'track_width_fc_hidden': 32, 'heading_error_num_layers': 5, 'heading_error_activation': 'elu', 'heading_error_out_channels_l0': 41, 'heading_error_pool_size_l0': 2, 'heading_error_out_channels_l1': 76, 'heading_error_pool_size_l1': 4, 'heading_error_out_channels_l2': 32, 'heading_error_pool_size_l2': 4, 'heading_error_out_channels_l3': 121, 'heading_error_pool_size_l3': 8, 'heading_error_out_channels_l4': 73, 'heading_error_pool_size_l4': 8}. Best is trial 58 with value: 0.0986.
[rank: 0] Seed set to 42
[rank: 0] Seed set to 42
GPU available: True (cuda), used: True
TPU available: False, using: 0 TPU cores
GPU available: True (cuda), used: True
TPU available: False, using: 0 TPU cores
💡 Tip: For seamless cloud logging and experiment tracking, try installing [litlogger](https://pypi.org/project/litlogger/) to enable LitLogger, which logs metrics and artifacts automatically to the Lightning Experiments platform.
💡 Tip: For seamless cloud logging and experiment tracking, try installing [litlogger](https://pypi.org/project/litlogger/) to enable LitLogger, which logs metrics and artifacts automatically to the Lightning Experiments platform.
[rank: 0] Seed set to 42
GPU available: True (cuda), used: True
TPU available: False, using: 0 TPU cores
💡 Tip: For seamless cloud logging and experiment tracking, try installing [litlogger](https://pypi.org/project/litlogger/) to enable LitLogger, which logs metrics and artifacts automatically to the Lightning Experiments platform.
LOCAL_RANK: 0 - CUDA_VISIBLE_DEVICES: [0]
LOCAL_RANK: 0 - CUDA_VISIBLE_DEVICES: [0]
LOCAL_RANK: 0 - CUDA_VISIBLE_DEVICES: [0]
SLURM auto-requeueing enabled. Setting signal handlers.
SLURM auto-requeueing enabled. Setting signal handlers.
SLURM auto-requeueing enabled. Setting signal handlers.
`Trainer.fit` stopped: `max_epochs=20` reached.
`Trainer.fit` stopped: `max_epochs=20` reached.
`Trainer.fit` stopped: `max_epochs=20` reached.
[I 2026-04-12 15:42:14,767] Trial 65 finished with value: 0.1175 and parameters: {'left_wall_dist_num_layers': 5, 'left_wall_dist_activation': 'relu', 'left_wall_dist_out_channels_l0': 142, 'left_wall_dist_pool_size_l0': 4, 'left_wall_dist_out_channels_l1': 39, 'left_wall_dist_pool_size_l1': 2, 'left_wall_dist_out_channels_l2': 126, 'left_wall_dist_pool_size_l2': 2, 'left_wall_dist_out_channels_l3': 113, 'left_wall_dist_pool_size_l3': 4, 'left_wall_dist_out_channels_l4': 34, 'left_wall_dist_pool_size_l4': 2, 'left_wall_dist_fc_hidden': 49, 'track_width_num_layers': 4, 'track_width_activation': 'elu', 'track_width_out_channels_l0': 69, 'track_width_pool_size_l0': 8, 'track_width_out_channels_l1': 114, 'track_width_pool_size_l1': 4, 'track_width_out_channels_l2': 33, 'track_width_pool_size_l2': 2, 'track_width_out_channels_l3': 59, 'track_width_pool_size_l3': 4, 'track_width_fc_hidden': 38, 'heading_error_num_layers': 5, 'heading_error_activation': 'elu', 'heading_error_out_channels_l0': 37, 'heading_error_pool_size_l0': 2, 'heading_error_out_channels_l1': 62, 'heading_error_pool_size_l1': 4, 'heading_error_out_channels_l2': 112, 'heading_error_pool_size_l2': 4, 'heading_error_out_channels_l3': 164, 'heading_error_pool_size_l3': 8, 'heading_error_out_channels_l4': 40, 'heading_error_pool_size_l4': 8, 'heading_error_fc_hidden': 37}. Best is trial 58 with value: 0.0986.
[rank: 0] Seed set to 42
[rank: 0] Seed set to 42
[rank: 0] Seed set to 42
GPU available: True (cuda), used: True
TPU available: False, using: 0 TPU cores
💡 Tip: For seamless cloud logging and experiment tracking, try installing [litlogger](https://pypi.org/project/litlogger/) to enable LitLogger, which logs metrics and artifacts automatically to the Lightning Experiments platform.
GPU available: True (cuda), used: True
TPU available: False, using: 0 TPU cores
💡 Tip: For seamless cloud logging and experiment tracking, try installing [litlogger](https://pypi.org/project/litlogger/) to enable LitLogger, which logs metrics and artifacts automatically to the Lightning Experiments platform.
GPU available: True (cuda), used: True
TPU available: False, using: 0 TPU cores
💡 Tip: For seamless cloud logging and experiment tracking, try installing [litlogger](https://pypi.org/project/litlogger/) to enable LitLogger, which logs metrics and artifacts automatically to the Lightning Experiments platform.
LOCAL_RANK: 0 - CUDA_VISIBLE_DEVICES: [0]
LOCAL_RANK: 0 - CUDA_VISIBLE_DEVICES: [0]
LOCAL_RANK: 0 - CUDA_VISIBLE_DEVICES: [0]
SLURM auto-requeueing enabled. Setting signal handlers.
SLURM auto-requeueing enabled. Setting signal handlers.
SLURM auto-requeueing enabled. Setting signal handlers.
`Trainer.fit` stopped: `max_epochs=20` reached.
`Trainer.fit` stopped: `max_epochs=20` reached.
`Trainer.fit` stopped: `max_epochs=20` reached.
[I 2026-04-12 15:44:35,313] Trial 66 finished with value: 0.1442 and parameters: {'left_wall_dist_num_layers': 5, 'left_wall_dist_activation': 'elu', 'left_wall_dist_out_channels_l0': 186, 'left_wall_dist_pool_size_l0': 4, 'left_wall_dist_out_channels_l1': 104, 'left_wall_dist_pool_size_l1': 2, 'left_wall_dist_out_channels_l2': 117, 'left_wall_dist_pool_size_l2': 2, 'left_wall_dist_out_channels_l3': 92, 'left_wall_dist_pool_size_l3': 4, 'left_wall_dist_out_channels_l4': 74, 'left_wall_dist_pool_size_l4': 2, 'left_wall_dist_fc_hidden': 79, 'track_width_num_layers': 3, 'track_width_activation': 'elu', 'track_width_out_channels_l0': 56, 'track_width_pool_size_l0': 8, 'track_width_out_channels_l1': 69, 'track_width_pool_size_l1': 8, 'track_width_out_channels_l2': 48, 'track_width_pool_size_l2': 2, 'track_width_fc_hidden': 49, 'heading_error_num_layers': 5, 'heading_error_activation': 'elu', 'heading_error_out_channels_l0': 110, 'heading_error_pool_size_l0': 2, 'heading_error_out_channels_l1': 41, 'heading_error_pool_size_l1': 4, 'heading_error_out_channels_l2': 138, 'heading_error_pool_size_l2': 2, 'heading_error_out_channels_l3': 145, 'heading_error_pool_size_l3': 8, 'heading_error_out_channels_l4': 148, 'heading_error_pool_size_l4': 2, 'heading_error_fc_hidden': 60}. Best is trial 58 with value: 0.0986.
[rank: 0] Seed set to 42
[rank: 0] Seed set to 42
[rank: 0] Seed set to 42
GPU available: True (cuda), used: True
TPU available: False, using: 0 TPU cores
💡 Tip: For seamless cloud logging and experiment tracking, try installing [litlogger](https://pypi.org/project/litlogger/) to enable LitLogger, which logs metrics and artifacts automatically to the Lightning Experiments platform.
GPU available: True (cuda), used: True
GPU available: True (cuda), used: True
TPU available: False, using: 0 TPU cores
TPU available: False, using: 0 TPU cores
💡 Tip: For seamless cloud logging and experiment tracking, try installing [litlogger](https://pypi.org/project/litlogger/) to enable LitLogger, which logs metrics and artifacts automatically to the Lightning Experiments platform.
💡 Tip: For seamless cloud logging and experiment tracking, try installing [litlogger](https://pypi.org/project/litlogger/) to enable LitLogger, which logs metrics and artifacts automatically to the Lightning Experiments platform.
LOCAL_RANK: 0 - CUDA_VISIBLE_DEVICES: [0]
LOCAL_RANK: 0 - CUDA_VISIBLE_DEVICES: [0]
LOCAL_RANK: 0 - CUDA_VISIBLE_DEVICES: [0]
SLURM auto-requeueing enabled. Setting signal handlers.
SLURM auto-requeueing enabled. Setting signal handlers.
SLURM auto-requeueing enabled. Setting signal handlers.
`Trainer.fit` stopped: `max_epochs=20` reached.
`Trainer.fit` stopped: `max_epochs=20` reached.
`Trainer.fit` stopped: `max_epochs=20` reached.
[I 2026-04-12 15:46:06,618] Trial 67 finished with value: 0.2616 and parameters: {'left_wall_dist_num_layers': 5, 'left_wall_dist_activation': 'relu', 'left_wall_dist_out_channels_l0': 131, 'left_wall_dist_pool_size_l0': 4, 'left_wall_dist_out_channels_l1': 48, 'left_wall_dist_pool_size_l1': 2, 'left_wall_dist_out_channels_l2': 143, 'left_wall_dist_pool_size_l2': 2, 'left_wall_dist_out_channels_l3': 158, 'left_wall_dist_pool_size_l3': 4, 'left_wall_dist_out_channels_l4': 131, 'left_wall_dist_pool_size_l4': 8, 'left_wall_dist_fc_hidden': 38, 'track_width_num_layers': 4, 'track_width_activation': 'relu', 'track_width_out_channels_l0': 89, 'track_width_pool_size_l0': 2, 'track_width_out_channels_l1': 97, 'track_width_pool_size_l1': 4, 'track_width_out_channels_l2': 52, 'track_width_pool_size_l2': 2, 'track_width_out_channels_l3': 55, 'track_width_pool_size_l3': 4, 'track_width_fc_hidden': 111, 'heading_error_num_layers': 5, 'heading_error_activation': 'elu', 'heading_error_out_channels_l0': 245, 'heading_error_pool_size_l0': 2, 'heading_error_out_channels_l1': 54, 'heading_error_pool_size_l1': 8, 'heading_error_out_channels_l2': 92, 'heading_error_pool_size_l2': 8, 'heading_error_out_channels_l3': 130, 'heading_error_pool_size_l3': 2, 'heading_error_out_channels_l4': 77, 'heading_error_pool_size_l4': 4}. Best is trial 58 with value: 0.0986.
[rank: 0] Seed set to 42
GPU available: True (cuda), used: True
TPU available: False, using: 0 TPU cores
💡 Tip: For seamless cloud logging and experiment tracking, try installing [litlogger](https://pypi.org/project/litlogger/) to enable LitLogger, which logs metrics and artifacts automatically to the Lightning Experiments platform.
[rank: 0] Seed set to 42
GPU available: True (cuda), used: True
TPU available: False, using: 0 TPU cores
💡 Tip: For seamless cloud logging and experiment tracking, try installing [litlogger](https://pypi.org/project/litlogger/) to enable LitLogger, which logs metrics and artifacts automatically to the Lightning Experiments platform.
LOCAL_RANK: 0 - CUDA_VISIBLE_DEVICES: [0]
[rank: 0] Seed set to 42
GPU available: True (cuda), used: True
TPU available: False, using: 0 TPU cores
💡 Tip: For seamless cloud logging and experiment tracking, try installing [litlogger](https://pypi.org/project/litlogger/) to enable LitLogger, which logs metrics and artifacts automatically to the Lightning Experiments platform.
SLURM auto-requeueing enabled. Setting signal handlers.
LOCAL_RANK: 0 - CUDA_VISIBLE_DEVICES: [0]
SLURM auto-requeueing enabled. Setting signal handlers.
LOCAL_RANK: 0 - CUDA_VISIBLE_DEVICES: [0]
SLURM auto-requeueing enabled. Setting signal handlers.
`Trainer.fit` stopped: `max_epochs=20` reached.
`Trainer.fit` stopped: `max_epochs=20` reached.
`Trainer.fit` stopped: `max_epochs=20` reached.
