[I 2026-04-15 23:07:00,553] Trial 48 finished with value: 0.1422 and parameters: {'left_wall_dist_num_layers': 2, 'left_wall_dist_activation': 'relu', 'left_wall_dist_out_channels_l0': 77, 'left_wall_dist_pool_size_l0': 4, 'left_wall_dist_out_channels_l1': 116, 'left_wall_dist_pool_size_l1': 8, 'left_wall_dist_fc_hidden': 89, 'track_width_num_layers': 2, 'track_width_activation': 'elu', 'track_width_out_channels_l0': 150, 'track_width_pool_size_l0': 8, 'track_width_out_channels_l1': 45, 'track_width_pool_size_l1': 4, 'track_width_fc_hidden': 103, 'heading_error_num_layers': 2, 'heading_error_activation': 'elu', 'heading_error_out_channels_l0': 135, 'heading_error_pool_size_l0': 8, 'heading_error_out_channels_l1': 239, 'heading_error_pool_size_l1': 8, 'heading_error_fc_hidden': 110}. Best is trial 41 with value: 0.1191.
[rank: 0] Seed set to 42
GPU available: True (cuda), used: True
TPU available: False, using: 0 TPU cores
💡 Tip: For seamless cloud logging and experiment tracking, try installing [litlogger](https://pypi.org/project/litlogger/) to enable LitLogger, which logs metrics and artifacts automatically to the Lightning Experiments platform.
[rank: 0] Seed set to 42
[rank: 0] Seed set to 42
GPU available: True (cuda), used: True
TPU available: False, using: 0 TPU cores
💡 Tip: For seamless cloud logging and experiment tracking, try installing [litlogger](https://pypi.org/project/litlogger/) to enable LitLogger, which logs metrics and artifacts automatically to the Lightning Experiments platform.
GPU available: True (cuda), used: True
TPU available: False, using: 0 TPU cores
💡 Tip: For seamless cloud logging and experiment tracking, try installing [litlogger](https://pypi.org/project/litlogger/) to enable LitLogger, which logs metrics and artifacts automatically to the Lightning Experiments platform.
LOCAL_RANK: 0 - CUDA_VISIBLE_DEVICES: [0]
LOCAL_RANK: 0 - CUDA_VISIBLE_DEVICES: [0]
LOCAL_RANK: 0 - CUDA_VISIBLE_DEVICES: [0]
SLURM auto-requeueing enabled. Setting signal handlers.
SLURM auto-requeueing enabled. Setting signal handlers.
SLURM auto-requeueing enabled. Setting signal handlers.
`Trainer.fit` stopped: `max_epochs=30` reached.
`Trainer.fit` stopped: `max_epochs=30` reached.
`Trainer.fit` stopped: `max_epochs=30` reached.
[I 2026-04-15 23:09:37,047] Trial 49 finished with value: 0.1403 and parameters: {'left_wall_dist_num_layers': 3, 'left_wall_dist_activation': 'relu', 'left_wall_dist_out_channels_l0': 62, 'left_wall_dist_pool_size_l0': 8, 'left_wall_dist_out_channels_l1': 36, 'left_wall_dist_pool_size_l1': 8, 'left_wall_dist_out_channels_l2': 131, 'left_wall_dist_pool_size_l2': 4, 'left_wall_dist_fc_hidden': 52, 'track_width_num_layers': 4, 'track_width_activation': 'elu', 'track_width_out_channels_l0': 87, 'track_width_pool_size_l0': 8, 'track_width_out_channels_l1': 52, 'track_width_pool_size_l1': 4, 'track_width_out_channels_l2': 136, 'track_width_pool_size_l2': 2, 'track_width_out_channels_l3': 64, 'track_width_pool_size_l3': 4, 'track_width_fc_hidden': 41, 'heading_error_num_layers': 3, 'heading_error_activation': 'elu', 'heading_error_out_channels_l0': 97, 'heading_error_pool_size_l0': 8, 'heading_error_out_channels_l1': 152, 'heading_error_pool_size_l1': 2, 'heading_error_out_channels_l2': 227, 'heading_error_pool_size_l2': 8, 'heading_error_fc_hidden': 105}. Best is trial 41 with value: 0.1191.
[rank: 0] Seed set to 42
GPU available: True (cuda), used: True
TPU available: False, using: 0 TPU cores
💡 Tip: For seamless cloud logging and experiment tracking, try installing [litlogger](https://pypi.org/project/litlogger/) to enable LitLogger, which logs metrics and artifacts automatically to the Lightning Experiments platform.
[rank: 0] Seed set to 42
GPU available: True (cuda), used: True
TPU available: False, using: 0 TPU cores
💡 Tip: For seamless cloud logging and experiment tracking, try installing [litlogger](https://pypi.org/project/litlogger/) to enable LitLogger, which logs metrics and artifacts automatically to the Lightning Experiments platform.
[rank: 0] Seed set to 42
GPU available: True (cuda), used: True
TPU available: False, using: 0 TPU cores
💡 Tip: For seamless cloud logging and experiment tracking, try installing [litlogger](https://pypi.org/project/litlogger/) to enable LitLogger, which logs metrics and artifacts automatically to the Lightning Experiments platform.
LOCAL_RANK: 0 - CUDA_VISIBLE_DEVICES: [0]
LOCAL_RANK: 0 - CUDA_VISIBLE_DEVICES: [0]
LOCAL_RANK: 0 - CUDA_VISIBLE_DEVICES: [0]
SLURM auto-requeueing enabled. Setting signal handlers.
SLURM auto-requeueing enabled. Setting signal handlers.
SLURM auto-requeueing enabled. Setting signal handlers.
`Trainer.fit` stopped: `max_epochs=30` reached.
`Trainer.fit` stopped: `max_epochs=30` reached.
`Trainer.fit` stopped: `max_epochs=30` reached.
[I 2026-04-15 23:12:26,288] Trial 50 finished with value: 0.1696 and parameters: {'left_wall_dist_num_layers': 5, 'left_wall_dist_activation': 'relu', 'left_wall_dist_out_channels_l0': 116, 'left_wall_dist_pool_size_l0': 4, 'left_wall_dist_out_channels_l1': 96, 'left_wall_dist_pool_size_l1': 8, 'left_wall_dist_out_channels_l2': 148, 'left_wall_dist_pool_size_l2': 2, 'left_wall_dist_out_channels_l3': 203, 'left_wall_dist_pool_size_l3': 2, 'left_wall_dist_out_channels_l4': 57, 'left_wall_dist_pool_size_l4': 4, 'left_wall_dist_fc_hidden': 39, 'track_width_num_layers': 3, 'track_width_activation': 'elu', 'track_width_out_channels_l0': 130, 'track_width_pool_size_l0': 8, 'track_width_out_channels_l1': 173, 'track_width_pool_size_l1': 4, 'track_width_out_channels_l2': 181, 'track_width_pool_size_l2': 2, 'track_width_fc_hidden': 127, 'heading_error_num_layers': 3, 'heading_error_activation': 'elu', 'heading_error_out_channels_l0': 134, 'heading_error_pool_size_l0': 8, 'heading_error_out_channels_l1': 172, 'heading_error_pool_size_l1': 8, 'heading_error_out_channels_l2': 134, 'heading_error_pool_size_l2': 2, 'heading_error_fc_hidden': 92}. Best is trial 41 with value: 0.1191.
[rank: 0] Seed set to 42
GPU available: True (cuda), used: True
TPU available: False, using: 0 TPU cores
💡 Tip: For seamless cloud logging and experiment tracking, try installing [litlogger](https://pypi.org/project/litlogger/) to enable LitLogger, which logs metrics and artifacts automatically to the Lightning Experiments platform.
[rank: 0] Seed set to 42
GPU available: True (cuda), used: True
TPU available: False, using: 0 TPU cores
💡 Tip: For seamless cloud logging and experiment tracking, try installing [litlogger](https://pypi.org/project/litlogger/) to enable LitLogger, which logs metrics and artifacts automatically to the Lightning Experiments platform.
[rank: 0] Seed set to 42
GPU available: True (cuda), used: True
TPU available: False, using: 0 TPU cores
💡 Tip: For seamless cloud logging and experiment tracking, try installing [litlogger](https://pypi.org/project/litlogger/) to enable LitLogger, which logs metrics and artifacts automatically to the Lightning Experiments platform.
LOCAL_RANK: 0 - CUDA_VISIBLE_DEVICES: [0]
SLURM auto-requeueing enabled. Setting signal handlers.
LOCAL_RANK: 0 - CUDA_VISIBLE_DEVICES: [0]
LOCAL_RANK: 0 - CUDA_VISIBLE_DEVICES: [0]
SLURM auto-requeueing enabled. Setting signal handlers.
SLURM auto-requeueing enabled. Setting signal handlers.
`Trainer.fit` stopped: `max_epochs=30` reached.
`Trainer.fit` stopped: `max_epochs=30` reached.
`Trainer.fit` stopped: `max_epochs=30` reached.
[I 2026-04-15 23:15:12,097] Trial 51 finished with value: 0.1301 and parameters: {'left_wall_dist_num_layers': 4, 'left_wall_dist_activation': 'elu', 'left_wall_dist_out_channels_l0': 83, 'left_wall_dist_pool_size_l0': 4, 'left_wall_dist_out_channels_l1': 72, 'left_wall_dist_pool_size_l1': 8, 'left_wall_dist_out_channels_l2': 108, 'left_wall_dist_pool_size_l2': 2, 'left_wall_dist_out_channels_l3': 44, 'left_wall_dist_pool_size_l3': 8, 'track_width_num_layers': 4, 'track_width_activation': 'elu', 'track_width_out_channels_l0': 202, 'track_width_pool_size_l0': 4, 'track_width_out_channels_l1': 60, 'track_width_pool_size_l1': 8, 'track_width_out_channels_l2': 170, 'track_width_pool_size_l2': 8, 'track_width_out_channels_l3': 36, 'track_width_pool_size_l3': 4, 'track_width_fc_hidden': 35, 'heading_error_num_layers': 3, 'heading_error_activation': 'elu', 'heading_error_out_channels_l0': 40, 'heading_error_pool_size_l0': 8, 'heading_error_out_channels_l1': 203, 'heading_error_pool_size_l1': 4, 'heading_error_out_channels_l2': 225, 'heading_error_pool_size_l2': 2, 'heading_error_fc_hidden': 114}. Best is trial 41 with value: 0.1191.
[rank: 0] Seed set to 42
GPU available: True (cuda), used: True
TPU available: False, using: 0 TPU cores
💡 Tip: For seamless cloud logging and experiment tracking, try installing [litlogger](https://pypi.org/project/litlogger/) to enable LitLogger, which logs metrics and artifacts automatically to the Lightning Experiments platform.
[rank: 0] Seed set to 42
[rank: 0] Seed set to 42
GPU available: True (cuda), used: True
TPU available: False, using: 0 TPU cores
💡 Tip: For seamless cloud logging and experiment tracking, try installing [litlogger](https://pypi.org/project/litlogger/) to enable LitLogger, which logs metrics and artifacts automatically to the Lightning Experiments platform.
GPU available: True (cuda), used: True
TPU available: False, using: 0 TPU cores
💡 Tip: For seamless cloud logging and experiment tracking, try installing [litlogger](https://pypi.org/project/litlogger/) to enable LitLogger, which logs metrics and artifacts automatically to the Lightning Experiments platform.
LOCAL_RANK: 0 - CUDA_VISIBLE_DEVICES: [0]
LOCAL_RANK: 0 - CUDA_VISIBLE_DEVICES: [0]
LOCAL_RANK: 0 - CUDA_VISIBLE_DEVICES: [0]
SLURM auto-requeueing enabled. Setting signal handlers.
SLURM auto-requeueing enabled. Setting signal handlers.
SLURM auto-requeueing enabled. Setting signal handlers.
`Trainer.fit` stopped: `max_epochs=30` reached.
`Trainer.fit` stopped: `max_epochs=30` reached.
`Trainer.fit` stopped: `max_epochs=30` reached.
[I 2026-04-15 23:17:58,872] Trial 52 finished with value: 0.142 and parameters: {'left_wall_dist_num_layers': 4, 'left_wall_dist_activation': 'elu', 'left_wall_dist_out_channels_l0': 82, 'left_wall_dist_pool_size_l0': 4, 'left_wall_dist_out_channels_l1': 53, 'left_wall_dist_pool_size_l1': 8, 'left_wall_dist_out_channels_l2': 93, 'left_wall_dist_pool_size_l2': 2, 'left_wall_dist_out_channels_l3': 41, 'left_wall_dist_pool_size_l3': 8, 'track_width_num_layers': 4, 'track_width_activation': 'elu', 'track_width_out_channels_l0': 190, 'track_width_pool_size_l0': 4, 'track_width_out_channels_l1': 65, 'track_width_pool_size_l1': 8, 'track_width_out_channels_l2': 253, 'track_width_pool_size_l2': 8, 'track_width_out_channels_l3': 41, 'track_width_pool_size_l3': 4, 'track_width_fc_hidden': 51, 'heading_error_num_layers': 3, 'heading_error_activation': 'elu', 'heading_error_out_channels_l0': 35, 'heading_error_pool_size_l0': 8, 'heading_error_out_channels_l1': 201, 'heading_error_pool_size_l1': 2, 'heading_error_out_channels_l2': 200, 'heading_error_pool_size_l2': 2, 'heading_error_fc_hidden': 124}. Best is trial 41 with value: 0.1191.
[rank: 0] Seed set to 42
GPU available: True (cuda), used: True
TPU available: False, using: 0 TPU cores
💡 Tip: For seamless cloud logging and experiment tracking, try installing [litlogger](https://pypi.org/project/litlogger/) to enable LitLogger, which logs metrics and artifacts automatically to the Lightning Experiments platform.
[rank: 0] Seed set to 42
GPU available: True (cuda), used: True
TPU available: False, using: 0 TPU cores
💡 Tip: For seamless cloud logging and experiment tracking, try installing [litlogger](https://pypi.org/project/litlogger/) to enable LitLogger, which logs metrics and artifacts automatically to the Lightning Experiments platform.
[rank: 0] Seed set to 42
GPU available: True (cuda), used: True
TPU available: False, using: 0 TPU cores
💡 Tip: For seamless cloud logging and experiment tracking, try installing [litlogger](https://pypi.org/project/litlogger/) to enable LitLogger, which logs metrics and artifacts automatically to the Lightning Experiments platform.
LOCAL_RANK: 0 - CUDA_VISIBLE_DEVICES: [0]
LOCAL_RANK: 0 - CUDA_VISIBLE_DEVICES: [0]
SLURM auto-requeueing enabled. Setting signal handlers.
SLURM auto-requeueing enabled. Setting signal handlers.
LOCAL_RANK: 0 - CUDA_VISIBLE_DEVICES: [0]
SLURM auto-requeueing enabled. Setting signal handlers.
`Trainer.fit` stopped: `max_epochs=30` reached.
`Trainer.fit` stopped: `max_epochs=30` reached.
`Trainer.fit` stopped: `max_epochs=30` reached.
[I 2026-04-15 23:20:45,927] Trial 53 finished with value: 0.1298 and parameters: {'left_wall_dist_num_layers': 4, 'left_wall_dist_activation': 'relu', 'left_wall_dist_out_channels_l0': 92, 'left_wall_dist_pool_size_l0': 4, 'left_wall_dist_out_channels_l1': 59, 'left_wall_dist_pool_size_l1': 8, 'left_wall_dist_out_channels_l2': 110, 'left_wall_dist_pool_size_l2': 2, 'left_wall_dist_out_channels_l3': 37, 'left_wall_dist_pool_size_l3': 8, 'track_width_num_layers': 4, 'track_width_activation': 'elu', 'track_width_out_channels_l0': 137, 'track_width_pool_size_l0': 8, 'track_width_out_channels_l1': 55, 'track_width_pool_size_l1': 4, 'track_width_out_channels_l2': 112, 'track_width_pool_size_l2': 4, 'track_width_out_channels_l3': 36, 'track_width_pool_size_l3': 4, 'heading_error_num_layers': 3, 'heading_error_activation': 'elu', 'heading_error_out_channels_l0': 46, 'heading_error_pool_size_l0': 8, 'heading_error_out_channels_l1': 236, 'heading_error_pool_size_l1': 4, 'heading_error_out_channels_l2': 228, 'heading_error_pool_size_l2': 2, 'heading_error_fc_hidden': 115}. Best is trial 41 with value: 0.1191.
[rank: 0] Seed set to 42
[rank: 0] Seed set to 42
GPU available: True (cuda), used: True
TPU available: False, using: 0 TPU cores
💡 Tip: For seamless cloud logging and experiment tracking, try installing [litlogger](https://pypi.org/project/litlogger/) to enable LitLogger, which logs metrics and artifacts automatically to the Lightning Experiments platform.
GPU available: True (cuda), used: True
TPU available: False, using: 0 TPU cores
💡 Tip: For seamless cloud logging and experiment tracking, try installing [litlogger](https://pypi.org/project/litlogger/) to enable LitLogger, which logs metrics and artifacts automatically to the Lightning Experiments platform.
[rank: 0] Seed set to 42
GPU available: True (cuda), used: True
TPU available: False, using: 0 TPU cores
💡 Tip: For seamless cloud logging and experiment tracking, try installing [litlogger](https://pypi.org/project/litlogger/) to enable LitLogger, which logs metrics and artifacts automatically to the Lightning Experiments platform.
LOCAL_RANK: 0 - CUDA_VISIBLE_DEVICES: [0]
LOCAL_RANK: 0 - CUDA_VISIBLE_DEVICES: [0]
SLURM auto-requeueing enabled. Setting signal handlers.
SLURM auto-requeueing enabled. Setting signal handlers.
LOCAL_RANK: 0 - CUDA_VISIBLE_DEVICES: [0]
SLURM auto-requeueing enabled. Setting signal handlers.
`Trainer.fit` stopped: `max_epochs=30` reached.
`Trainer.fit` stopped: `max_epochs=30` reached.
`Trainer.fit` stopped: `max_epochs=30` reached.
[I 2026-04-15 23:23:33,836] Trial 54 finished with value: 0.1636 and parameters: {'left_wall_dist_num_layers': 3, 'left_wall_dist_activation': 'relu', 'left_wall_dist_out_channels_l0': 95, 'left_wall_dist_pool_size_l0': 4, 'left_wall_dist_out_channels_l1': 153, 'left_wall_dist_pool_size_l1': 8, 'left_wall_dist_out_channels_l2': 127, 'left_wall_dist_pool_size_l2': 2, 'left_wall_dist_fc_hidden': 111, 'track_width_num_layers': 4, 'track_width_activation': 'elu', 'track_width_out_channels_l0': 121, 'track_width_pool_size_l0': 8, 'track_width_out_channels_l1': 82, 'track_width_pool_size_l1': 4, 'track_width_out_channels_l2': 116, 'track_width_pool_size_l2': 4, 'track_width_out_channels_l3': 38, 'track_width_pool_size_l3': 4, 'heading_error_num_layers': 4, 'heading_error_activation': 'elu', 'heading_error_out_channels_l0': 200, 'heading_error_pool_size_l0': 8, 'heading_error_out_channels_l1': 241, 'heading_error_pool_size_l1': 8, 'heading_error_out_channels_l2': 175, 'heading_error_pool_size_l2': 2, 'heading_error_out_channels_l3': 44, 'heading_error_pool_size_l3': 8, 'heading_error_fc_hidden': 35}. Best is trial 41 with value: 0.1191.
[rank: 0] Seed set to 42
[rank: 0] Seed set to 42
[rank: 0] Seed set to 42
GPU available: True (cuda), used: True
TPU available: False, using: 0 TPU cores
GPU available: True (cuda), used: True
💡 Tip: For seamless cloud logging and experiment tracking, try installing [litlogger](https://pypi.org/project/litlogger/) to enable LitLogger, which logs metrics and artifacts automatically to the Lightning Experiments platform.
TPU available: False, using: 0 TPU cores
💡 Tip: For seamless cloud logging and experiment tracking, try installing [litlogger](https://pypi.org/project/litlogger/) to enable LitLogger, which logs metrics and artifacts automatically to the Lightning Experiments platform.
GPU available: True (cuda), used: True
TPU available: False, using: 0 TPU cores
💡 Tip: For seamless cloud logging and experiment tracking, try installing [litlogger](https://pypi.org/project/litlogger/) to enable LitLogger, which logs metrics and artifacts automatically to the Lightning Experiments platform.
LOCAL_RANK: 0 - CUDA_VISIBLE_DEVICES: [0]
LOCAL_RANK: 0 - CUDA_VISIBLE_DEVICES: [0]
LOCAL_RANK: 0 - CUDA_VISIBLE_DEVICES: [0]
SLURM auto-requeueing enabled. Setting signal handlers.
SLURM auto-requeueing enabled. Setting signal handlers.
SLURM auto-requeueing enabled. Setting signal handlers.
`Trainer.fit` stopped: `max_epochs=30` reached.
`Trainer.fit` stopped: `max_epochs=30` reached.
`Trainer.fit` stopped: `max_epochs=30` reached.
[I 2026-04-15 23:26:20,679] Trial 55 finished with value: 0.1531 and parameters: {'left_wall_dist_num_layers': 4, 'left_wall_dist_activation': 'relu', 'left_wall_dist_out_channels_l0': 110, 'left_wall_dist_pool_size_l0': 2, 'left_wall_dist_out_channels_l1': 60, 'left_wall_dist_pool_size_l1': 8, 'left_wall_dist_out_channels_l2': 72, 'left_wall_dist_pool_size_l2': 2, 'left_wall_dist_out_channels_l3': 47, 'left_wall_dist_pool_size_l3': 8, 'left_wall_dist_fc_hidden': 33, 'track_width_num_layers': 4, 'track_width_activation': 'elu', 'track_width_out_channels_l0': 140, 'track_width_pool_size_l0': 8, 'track_width_out_channels_l1': 54, 'track_width_pool_size_l1': 4, 'track_width_out_channels_l2': 110, 'track_width_pool_size_l2': 4, 'track_width_out_channels_l3': 51, 'track_width_pool_size_l3': 4, 'heading_error_num_layers': 3, 'heading_error_activation': 'elu', 'heading_error_out_channels_l0': 46, 'heading_error_pool_size_l0': 8, 'heading_error_out_channels_l1': 185, 'heading_error_pool_size_l1': 2, 'heading_error_out_channels_l2': 79, 'heading_error_pool_size_l2': 2, 'heading_error_fc_hidden': 103}. Best is trial 41 with value: 0.1191.
[rank: 0] Seed set to 42
GPU available: True (cuda), used: True
TPU available: False, using: 0 TPU cores
💡 Tip: For seamless cloud logging and experiment tracking, try installing [litlogger](https://pypi.org/project/litlogger/) to enable LitLogger, which logs metrics and artifacts automatically to the Lightning Experiments platform.
[rank: 0] Seed set to 42
GPU available: True (cuda), used: True
TPU available: False, using: 0 TPU cores
💡 Tip: For seamless cloud logging and experiment tracking, try installing [litlogger](https://pypi.org/project/litlogger/) to enable LitLogger, which logs metrics and artifacts automatically to the Lightning Experiments platform.
[rank: 0] Seed set to 42
GPU available: True (cuda), used: True
TPU available: False, using: 0 TPU cores
💡 Tip: For seamless cloud logging and experiment tracking, try installing [litlogger](https://pypi.org/project/litlogger/) to enable LitLogger, which logs metrics and artifacts automatically to the Lightning Experiments platform.
LOCAL_RANK: 0 - CUDA_VISIBLE_DEVICES: [0]
LOCAL_RANK: 0 - CUDA_VISIBLE_DEVICES: [0]
LOCAL_RANK: 0 - CUDA_VISIBLE_DEVICES: [0]
SLURM auto-requeueing enabled. Setting signal handlers.
SLURM auto-requeueing enabled. Setting signal handlers.
SLURM auto-requeueing enabled. Setting signal handlers.
`Trainer.fit` stopped: `max_epochs=30` reached.
`Trainer.fit` stopped: `max_epochs=30` reached.
`Trainer.fit` stopped: `max_epochs=30` reached.
