[I 2026-04-15 22:51:00,204] Trial 33 finished with value: 0.1061 and parameters: {'left_wall_dist_num_layers': 2, 'left_wall_dist_activation': 'relu', 'left_wall_dist_out_channels_l0': 176, 'left_wall_dist_pool_size_l0': 8, 'left_wall_dist_out_channels_l1': 45, 'left_wall_dist_pool_size_l1': 4, 'left_wall_dist_fc_hidden': 124, 'track_width_num_layers': 4, 'track_width_activation': 'relu', 'track_width_out_channels_l0': 127, 'track_width_pool_size_l0': 2, 'track_width_out_channels_l1': 39, 'track_width_pool_size_l1': 2, 'track_width_out_channels_l2': 97, 'track_width_pool_size_l2': 4, 'track_width_out_channels_l3': 129, 'track_width_pool_size_l3': 4, 'track_width_fc_hidden': 56, 'heading_error_num_layers': 2, 'heading_error_activation': 'elu', 'heading_error_out_channels_l0': 55, 'heading_error_pool_size_l0': 2, 'heading_error_out_channels_l1': 87, 'heading_error_pool_size_l1': 4}. Best is trial 29 with value: 0.0976.
[rank: 0] Seed set to 42
GPU available: True (cuda), used: True
TPU available: False, using: 0 TPU cores
💡 Tip: For seamless cloud logging and experiment tracking, try installing [litlogger](https://pypi.org/project/litlogger/) to enable LitLogger, which logs metrics and artifacts automatically to the Lightning Experiments platform.
[rank: 0] Seed set to 42
[rank: 0] Seed set to 42
GPU available: True (cuda), used: True
TPU available: False, using: 0 TPU cores
💡 Tip: For seamless cloud logging and experiment tracking, try installing [litlogger](https://pypi.org/project/litlogger/) to enable LitLogger, which logs metrics and artifacts automatically to the Lightning Experiments platform.
GPU available: True (cuda), used: True
TPU available: False, using: 0 TPU cores
💡 Tip: For seamless cloud logging and experiment tracking, try installing [litlogger](https://pypi.org/project/litlogger/) to enable LitLogger, which logs metrics and artifacts automatically to the Lightning Experiments platform.
LOCAL_RANK: 0 - CUDA_VISIBLE_DEVICES: [0]
SLURM auto-requeueing enabled. Setting signal handlers.
LOCAL_RANK: 0 - CUDA_VISIBLE_DEVICES: [0]
LOCAL_RANK: 0 - CUDA_VISIBLE_DEVICES: [0]
SLURM auto-requeueing enabled. Setting signal handlers.
SLURM auto-requeueing enabled. Setting signal handlers.
`Trainer.fit` stopped: `max_epochs=30` reached.
`Trainer.fit` stopped: `max_epochs=30` reached.
`Trainer.fit` stopped: `max_epochs=30` reached.
[I 2026-04-15 22:53:23,018] Trial 34 finished with value: 0.1 and parameters: {'left_wall_dist_num_layers': 2, 'left_wall_dist_activation': 'relu', 'left_wall_dist_out_channels_l0': 114, 'left_wall_dist_pool_size_l0': 8, 'left_wall_dist_out_channels_l1': 46, 'left_wall_dist_pool_size_l1': 4, 'left_wall_dist_fc_hidden': 127, 'track_width_num_layers': 4, 'track_width_activation': 'relu', 'track_width_out_channels_l0': 143, 'track_width_pool_size_l0': 2, 'track_width_out_channels_l1': 33, 'track_width_pool_size_l1': 2, 'track_width_out_channels_l2': 98, 'track_width_pool_size_l2': 4, 'track_width_out_channels_l3': 116, 'track_width_pool_size_l3': 4, 'track_width_fc_hidden': 56, 'heading_error_num_layers': 2, 'heading_error_activation': 'elu', 'heading_error_out_channels_l0': 64, 'heading_error_pool_size_l0': 2, 'heading_error_out_channels_l1': 84, 'heading_error_pool_size_l1': 4}. Best is trial 29 with value: 0.0976.
[rank: 0] Seed set to 42
[rank: 0] Seed set to 42
GPU available: True (cuda), used: True
TPU available: False, using: 0 TPU cores
💡 Tip: For seamless cloud logging and experiment tracking, try installing [litlogger](https://pypi.org/project/litlogger/) to enable LitLogger, which logs metrics and artifacts automatically to the Lightning Experiments platform.
GPU available: True (cuda), used: True
TPU available: False, using: 0 TPU cores
💡 Tip: For seamless cloud logging and experiment tracking, try installing [litlogger](https://pypi.org/project/litlogger/) to enable LitLogger, which logs metrics and artifacts automatically to the Lightning Experiments platform.
[rank: 0] Seed set to 42
GPU available: True (cuda), used: True
TPU available: False, using: 0 TPU cores
💡 Tip: For seamless cloud logging and experiment tracking, try installing [litlogger](https://pypi.org/project/litlogger/) to enable LitLogger, which logs metrics and artifacts automatically to the Lightning Experiments platform.
LOCAL_RANK: 0 - CUDA_VISIBLE_DEVICES: [0]
LOCAL_RANK: 0 - CUDA_VISIBLE_DEVICES: [0]
LOCAL_RANK: 0 - CUDA_VISIBLE_DEVICES: [0]
SLURM auto-requeueing enabled. Setting signal handlers.
SLURM auto-requeueing enabled. Setting signal handlers.
SLURM auto-requeueing enabled. Setting signal handlers.
`Trainer.fit` stopped: `max_epochs=30` reached.
`Trainer.fit` stopped: `max_epochs=30` reached.
`Trainer.fit` stopped: `max_epochs=30` reached.
[I 2026-04-15 22:55:47,692] Trial 35 finished with value: 0.1227 and parameters: {'left_wall_dist_num_layers': 2, 'left_wall_dist_activation': 'relu', 'left_wall_dist_out_channels_l0': 119, 'left_wall_dist_pool_size_l0': 8, 'left_wall_dist_out_channels_l1': 45, 'left_wall_dist_pool_size_l1': 8, 'left_wall_dist_fc_hidden': 128, 'track_width_num_layers': 4, 'track_width_activation': 'relu', 'track_width_out_channels_l0': 143, 'track_width_pool_size_l0': 4, 'track_width_out_channels_l1': 32, 'track_width_pool_size_l1': 8, 'track_width_out_channels_l2': 71, 'track_width_pool_size_l2': 4, 'track_width_out_channels_l3': 114, 'track_width_pool_size_l3': 4, 'heading_error_num_layers': 2, 'heading_error_activation': 'elu', 'heading_error_out_channels_l0': 66, 'heading_error_pool_size_l0': 2, 'heading_error_out_channels_l1': 81, 'heading_error_pool_size_l1': 4}. Best is trial 29 with value: 0.0976.
[rank: 0] Seed set to 42
[rank: 0] Seed set to 42
GPU available: True (cuda), used: True
TPU available: False, using: 0 TPU cores
💡 Tip: For seamless cloud logging and experiment tracking, try installing [litlogger](https://pypi.org/project/litlogger/) to enable LitLogger, which logs metrics and artifacts automatically to the Lightning Experiments platform.
GPU available: True (cuda), used: True
TPU available: False, using: 0 TPU cores
💡 Tip: For seamless cloud logging and experiment tracking, try installing [litlogger](https://pypi.org/project/litlogger/) to enable LitLogger, which logs metrics and artifacts automatically to the Lightning Experiments platform.
[rank: 0] Seed set to 42
GPU available: True (cuda), used: True
TPU available: False, using: 0 TPU cores
💡 Tip: For seamless cloud logging and experiment tracking, try installing [litlogger](https://pypi.org/project/litlogger/) to enable LitLogger, which logs metrics and artifacts automatically to the Lightning Experiments platform.
LOCAL_RANK: 0 - CUDA_VISIBLE_DEVICES: [0]
LOCAL_RANK: 0 - CUDA_VISIBLE_DEVICES: [0]
LOCAL_RANK: 0 - CUDA_VISIBLE_DEVICES: [0]
SLURM auto-requeueing enabled. Setting signal handlers.
SLURM auto-requeueing enabled. Setting signal handlers.
SLURM auto-requeueing enabled. Setting signal handlers.
`Trainer.fit` stopped: `max_epochs=30` reached.
`Trainer.fit` stopped: `max_epochs=30` reached.
`Trainer.fit` stopped: `max_epochs=30` reached.
[I 2026-04-15 22:58:04,789] Trial 36 finished with value: 0.1137 and parameters: {'left_wall_dist_num_layers': 2, 'left_wall_dist_activation': 'relu', 'left_wall_dist_out_channels_l0': 74, 'left_wall_dist_pool_size_l0': 8, 'left_wall_dist_out_channels_l1': 49, 'left_wall_dist_pool_size_l1': 4, 'left_wall_dist_fc_hidden': 118, 'track_width_num_layers': 3, 'track_width_activation': 'relu', 'track_width_out_channels_l0': 152, 'track_width_pool_size_l0': 2, 'track_width_out_channels_l1': 40, 'track_width_pool_size_l1': 2, 'track_width_out_channels_l2': 95, 'track_width_pool_size_l2': 4, 'track_width_fc_hidden': 121, 'heading_error_num_layers': 2, 'heading_error_activation': 'elu', 'heading_error_out_channels_l0': 84, 'heading_error_pool_size_l0': 2, 'heading_error_out_channels_l1': 66, 'heading_error_pool_size_l1': 4}. Best is trial 29 with value: 0.0976.
[rank: 0] Seed set to 42
GPU available: True (cuda), used: True
TPU available: False, using: 0 TPU cores
💡 Tip: For seamless cloud logging and experiment tracking, try installing [litlogger](https://pypi.org/project/litlogger/) to enable LitLogger, which logs metrics and artifacts automatically to the Lightning Experiments platform.
[rank: 0] Seed set to 42
GPU available: True (cuda), used: True
TPU available: False, using: 0 TPU cores
💡 Tip: For seamless cloud logging and experiment tracking, try installing [litlogger](https://pypi.org/project/litlogger/) to enable LitLogger, which logs metrics and artifacts automatically to the Lightning Experiments platform.
[rank: 0] Seed set to 42
GPU available: True (cuda), used: True
TPU available: False, using: 0 TPU cores
💡 Tip: For seamless cloud logging and experiment tracking, try installing [litlogger](https://pypi.org/project/litlogger/) to enable LitLogger, which logs metrics and artifacts automatically to the Lightning Experiments platform.
LOCAL_RANK: 0 - CUDA_VISIBLE_DEVICES: [0]
LOCAL_RANK: 0 - CUDA_VISIBLE_DEVICES: [0]
LOCAL_RANK: 0 - CUDA_VISIBLE_DEVICES: [0]
SLURM auto-requeueing enabled. Setting signal handlers.
SLURM auto-requeueing enabled. Setting signal handlers.
SLURM auto-requeueing enabled. Setting signal handlers.
`Trainer.fit` stopped: `max_epochs=30` reached.
`Trainer.fit` stopped: `max_epochs=30` reached.
`Trainer.fit` stopped: `max_epochs=30` reached.
[I 2026-04-15 23:00:23,382] Trial 37 finished with value: 0.1399 and parameters: {'left_wall_dist_num_layers': 2, 'left_wall_dist_activation': 'relu', 'left_wall_dist_out_channels_l0': 89, 'left_wall_dist_pool_size_l0': 8, 'left_wall_dist_out_channels_l1': 59, 'left_wall_dist_pool_size_l1': 4, 'left_wall_dist_fc_hidden': 118, 'track_width_num_layers': 4, 'track_width_activation': 'relu', 'track_width_out_channels_l0': 125, 'track_width_pool_size_l0': 2, 'track_width_out_channels_l1': 32, 'track_width_pool_size_l1': 8, 'track_width_out_channels_l2': 89, 'track_width_pool_size_l2': 4, 'track_width_out_channels_l3': 115, 'track_width_pool_size_l3': 4, 'track_width_fc_hidden': 57, 'heading_error_num_layers': 2, 'heading_error_activation': 'elu', 'heading_error_out_channels_l0': 68, 'heading_error_pool_size_l0': 2, 'heading_error_out_channels_l1': 88, 'heading_error_pool_size_l1': 4}. Best is trial 29 with value: 0.0976.
[rank: 0] Seed set to 42
[rank: 0] Seed set to 42
GPU available: True (cuda), used: True
TPU available: False, using: 0 TPU cores
💡 Tip: For seamless cloud logging and experiment tracking, try installing [litlogger](https://pypi.org/project/litlogger/) to enable LitLogger, which logs metrics and artifacts automatically to the Lightning Experiments platform.
GPU available: True (cuda), used: True
TPU available: False, using: 0 TPU cores
💡 Tip: For seamless cloud logging and experiment tracking, try installing [litlogger](https://pypi.org/project/litlogger/) to enable LitLogger, which logs metrics and artifacts automatically to the Lightning Experiments platform.
[rank: 0] Seed set to 42
GPU available: True (cuda), used: True
TPU available: False, using: 0 TPU cores
💡 Tip: For seamless cloud logging and experiment tracking, try installing [litlogger](https://pypi.org/project/litlogger/) to enable LitLogger, which logs metrics and artifacts automatically to the Lightning Experiments platform.
LOCAL_RANK: 0 - CUDA_VISIBLE_DEVICES: [0]
LOCAL_RANK: 0 - CUDA_VISIBLE_DEVICES: [0]
SLURM auto-requeueing enabled. Setting signal handlers.
SLURM auto-requeueing enabled. Setting signal handlers.
LOCAL_RANK: 0 - CUDA_VISIBLE_DEVICES: [0]
SLURM auto-requeueing enabled. Setting signal handlers.
`Trainer.fit` stopped: `max_epochs=30` reached.
`Trainer.fit` stopped: `max_epochs=30` reached.
`Trainer.fit` stopped: `max_epochs=30` reached.
[I 2026-04-15 23:02:35,594] Trial 38 finished with value: 0.1166 and parameters: {'left_wall_dist_num_layers': 2, 'left_wall_dist_activation': 'relu', 'left_wall_dist_out_channels_l0': 64, 'left_wall_dist_pool_size_l0': 8, 'left_wall_dist_out_channels_l1': 34, 'left_wall_dist_pool_size_l1': 4, 'left_wall_dist_fc_hidden': 94, 'track_width_num_layers': 2, 'track_width_activation': 'relu', 'track_width_out_channels_l0': 95, 'track_width_pool_size_l0': 2, 'track_width_out_channels_l1': 40, 'track_width_pool_size_l1': 2, 'heading_error_num_layers': 2, 'heading_error_activation': 'elu', 'heading_error_out_channels_l0': 58, 'heading_error_pool_size_l0': 2, 'heading_error_out_channels_l1': 140, 'heading_error_pool_size_l1': 4}. Best is trial 29 with value: 0.0976.
[rank: 0] Seed set to 42
GPU available: True (cuda), used: True
TPU available: False, using: 0 TPU cores
💡 Tip: For seamless cloud logging and experiment tracking, try installing [litlogger](https://pypi.org/project/litlogger/) to enable LitLogger, which logs metrics and artifacts automatically to the Lightning Experiments platform.
[rank: 0] Seed set to 42
GPU available: True (cuda), used: True
TPU available: False, using: 0 TPU cores
💡 Tip: For seamless cloud logging and experiment tracking, try installing [litlogger](https://pypi.org/project/litlogger/) to enable LitLogger, which logs metrics and artifacts automatically to the Lightning Experiments platform.
[rank: 0] Seed set to 42
GPU available: True (cuda), used: True
TPU available: False, using: 0 TPU cores
💡 Tip: For seamless cloud logging and experiment tracking, try installing [litlogger](https://pypi.org/project/litlogger/) to enable LitLogger, which logs metrics and artifacts automatically to the Lightning Experiments platform.
LOCAL_RANK: 0 - CUDA_VISIBLE_DEVICES: [0]
SLURM auto-requeueing enabled. Setting signal handlers.
LOCAL_RANK: 0 - CUDA_VISIBLE_DEVICES: [0]
SLURM auto-requeueing enabled. Setting signal handlers.
LOCAL_RANK: 0 - CUDA_VISIBLE_DEVICES: [0]
SLURM auto-requeueing enabled. Setting signal handlers.
`Trainer.fit` stopped: `max_epochs=30` reached.
`Trainer.fit` stopped: `max_epochs=30` reached.
`Trainer.fit` stopped: `max_epochs=30` reached.
[I 2026-04-15 23:04:52,457] Trial 39 finished with value: 0.1046 and parameters: {'left_wall_dist_num_layers': 2, 'left_wall_dist_activation': 'relu', 'left_wall_dist_out_channels_l0': 182, 'left_wall_dist_pool_size_l0': 8, 'left_wall_dist_out_channels_l1': 47, 'left_wall_dist_pool_size_l1': 8, 'left_wall_dist_fc_hidden': 95, 'track_width_num_layers': 3, 'track_width_activation': 'relu', 'track_width_out_channels_l0': 42, 'track_width_pool_size_l0': 4, 'track_width_out_channels_l1': 36, 'track_width_pool_size_l1': 2, 'track_width_out_channels_l2': 106, 'track_width_pool_size_l2': 4, 'track_width_fc_hidden': 61, 'heading_error_num_layers': 3, 'heading_error_activation': 'elu', 'heading_error_out_channels_l0': 74, 'heading_error_pool_size_l0': 2, 'heading_error_out_channels_l1': 72, 'heading_error_pool_size_l1': 4, 'heading_error_out_channels_l2': 92, 'heading_error_pool_size_l2': 4, 'heading_error_fc_hidden': 64}. Best is trial 29 with value: 0.0976.
[rank: 0] Seed set to 42
[rank: 0] Seed set to 42
GPU available: True (cuda), used: True
TPU available: False, using: 0 TPU cores
💡 Tip: For seamless cloud logging and experiment tracking, try installing [litlogger](https://pypi.org/project/litlogger/) to enable LitLogger, which logs metrics and artifacts automatically to the Lightning Experiments platform.
GPU available: True (cuda), used: True
TPU available: False, using: 0 TPU cores
💡 Tip: For seamless cloud logging and experiment tracking, try installing [litlogger](https://pypi.org/project/litlogger/) to enable LitLogger, which logs metrics and artifacts automatically to the Lightning Experiments platform.
[rank: 0] Seed set to 42
GPU available: True (cuda), used: True
TPU available: False, using: 0 TPU cores
💡 Tip: For seamless cloud logging and experiment tracking, try installing [litlogger](https://pypi.org/project/litlogger/) to enable LitLogger, which logs metrics and artifacts automatically to the Lightning Experiments platform.
LOCAL_RANK: 0 - CUDA_VISIBLE_DEVICES: [0]
LOCAL_RANK: 0 - CUDA_VISIBLE_DEVICES: [0]
LOCAL_RANK: 0 - CUDA_VISIBLE_DEVICES: [0]
SLURM auto-requeueing enabled. Setting signal handlers.
SLURM auto-requeueing enabled. Setting signal handlers.
SLURM auto-requeueing enabled. Setting signal handlers.
`Trainer.fit` stopped: `max_epochs=30` reached.
`Trainer.fit` stopped: `max_epochs=30` reached.
`Trainer.fit` stopped: `max_epochs=30` reached.
[I 2026-04-15 23:07:12,038] Trial 40 finished with value: 0.093 and parameters: {'left_wall_dist_num_layers': 2, 'left_wall_dist_activation': 'relu', 'left_wall_dist_out_channels_l0': 193, 'left_wall_dist_pool_size_l0': 8, 'left_wall_dist_out_channels_l1': 40, 'left_wall_dist_pool_size_l1': 8, 'left_wall_dist_fc_hidden': 79, 'track_width_num_layers': 3, 'track_width_activation': 'relu', 'track_width_out_channels_l0': 45, 'track_width_pool_size_l0': 4, 'track_width_out_channels_l1': 35, 'track_width_pool_size_l1': 8, 'track_width_out_channels_l2': 107, 'track_width_pool_size_l2': 4, 'track_width_fc_hidden': 76, 'heading_error_num_layers': 3, 'heading_error_activation': 'elu', 'heading_error_out_channels_l0': 104, 'heading_error_pool_size_l0': 2, 'heading_error_out_channels_l1': 68, 'heading_error_pool_size_l1': 4, 'heading_error_out_channels_l2': 97, 'heading_error_pool_size_l2': 4, 'heading_error_fc_hidden': 66}. Best is trial 40 with value: 0.093.
[rank: 0] Seed set to 42
[rank: 0] Seed set to 42
[rank: 0] Seed set to 42
GPU available: True (cuda), used: True
TPU available: False, using: 0 TPU cores
💡 Tip: For seamless cloud logging and experiment tracking, try installing [litlogger](https://pypi.org/project/litlogger/) to enable LitLogger, which logs metrics and artifacts automatically to the Lightning Experiments platform.
GPU available: True (cuda), used: True
TPU available: False, using: 0 TPU cores
💡 Tip: For seamless cloud logging and experiment tracking, try installing [litlogger](https://pypi.org/project/litlogger/) to enable LitLogger, which logs metrics and artifacts automatically to the Lightning Experiments platform.
GPU available: True (cuda), used: True
TPU available: False, using: 0 TPU cores
💡 Tip: For seamless cloud logging and experiment tracking, try installing [litlogger](https://pypi.org/project/litlogger/) to enable LitLogger, which logs metrics and artifacts automatically to the Lightning Experiments platform.
LOCAL_RANK: 0 - CUDA_VISIBLE_DEVICES: [0]
LOCAL_RANK: 0 - CUDA_VISIBLE_DEVICES: [0]
LOCAL_RANK: 0 - CUDA_VISIBLE_DEVICES: [0]
SLURM auto-requeueing enabled. Setting signal handlers.
SLURM auto-requeueing enabled. Setting signal handlers.
SLURM auto-requeueing enabled. Setting signal handlers.
`Trainer.fit` stopped: `max_epochs=30` reached.
`Trainer.fit` stopped: `max_epochs=30` reached.
`Trainer.fit` stopped: `max_epochs=30` reached.
[I 2026-04-15 23:09:32,606] Trial 41 finished with value: 0.097 and parameters: {'left_wall_dist_num_layers': 2, 'left_wall_dist_activation': 'relu', 'left_wall_dist_out_channels_l0': 190, 'left_wall_dist_pool_size_l0': 8, 'left_wall_dist_out_channels_l1': 40, 'left_wall_dist_pool_size_l1': 8, 'left_wall_dist_fc_hidden': 77, 'track_width_num_layers': 3, 'track_width_activation': 'relu', 'track_width_out_channels_l0': 43, 'track_width_pool_size_l0': 4, 'track_width_out_channels_l1': 35, 'track_width_pool_size_l1': 8, 'track_width_out_channels_l2': 107, 'track_width_pool_size_l2': 4, 'track_width_fc_hidden': 74, 'heading_error_num_layers': 3, 'heading_error_activation': 'elu', 'heading_error_out_channels_l0': 103, 'heading_error_pool_size_l0': 2, 'heading_error_out_channels_l1': 66, 'heading_error_pool_size_l1': 4, 'heading_error_out_channels_l2': 93, 'heading_error_pool_size_l2': 4, 'heading_error_fc_hidden': 63}. Best is trial 40 with value: 0.093.
[rank: 0] Seed set to 42
[rank: 0] Seed set to 42
[rank: 0] Seed set to 42
GPU available: True (cuda), used: True
TPU available: False, using: 0 TPU cores
💡 Tip: For seamless cloud logging and experiment tracking, try installing [litlogger](https://pypi.org/project/litlogger/) to enable LitLogger, which logs metrics and artifacts automatically to the Lightning Experiments platform.
GPU available: True (cuda), used: True
TPU available: False, using: 0 TPU cores
💡 Tip: For seamless cloud logging and experiment tracking, try installing [litlogger](https://pypi.org/project/litlogger/) to enable LitLogger, which logs metrics and artifacts automatically to the Lightning Experiments platform.
GPU available: True (cuda), used: True
TPU available: False, using: 0 TPU cores
💡 Tip: For seamless cloud logging and experiment tracking, try installing [litlogger](https://pypi.org/project/litlogger/) to enable LitLogger, which logs metrics and artifacts automatically to the Lightning Experiments platform.
LOCAL_RANK: 0 - CUDA_VISIBLE_DEVICES: [0]
LOCAL_RANK: 0 - CUDA_VISIBLE_DEVICES: [0]
LOCAL_RANK: 0 - CUDA_VISIBLE_DEVICES: [0]
SLURM auto-requeueing enabled. Setting signal handlers.
SLURM auto-requeueing enabled. Setting signal handlers.
SLURM auto-requeueing enabled. Setting signal handlers.
`Trainer.fit` stopped: `max_epochs=30` reached.
`Trainer.fit` stopped: `max_epochs=30` reached.
`Trainer.fit` stopped: `max_epochs=30` reached.
