[I 2026-04-16 00:15:44,316] Trial 72 finished with value: 0.1309 and parameters: {'left_wall_dist_num_layers': 5, 'left_wall_dist_activation': 'relu', 'left_wall_dist_out_channels_l0': 126, 'left_wall_dist_pool_size_l0': 8, 'left_wall_dist_out_channels_l1': 98, 'left_wall_dist_pool_size_l1': 2, 'left_wall_dist_out_channels_l2': 232, 'left_wall_dist_pool_size_l2': 4, 'left_wall_dist_out_channels_l3': 128, 'left_wall_dist_pool_size_l3': 8, 'left_wall_dist_fc_hidden': 40, 'track_width_num_layers': 4, 'track_width_activation': 'elu', 'track_width_out_channels_l0': 232, 'track_width_pool_size_l0': 2, 'track_width_out_channels_l1': 159, 'track_width_pool_size_l1': 4, 'track_width_out_channels_l2': 106, 'track_width_pool_size_l2': 2, 'track_width_out_channels_l3': 58, 'track_width_pool_size_l3': 2, 'track_width_fc_hidden': 79, 'heading_error_num_layers': 5, 'heading_error_activation': 'elu', 'heading_error_out_channels_l0': 103, 'heading_error_pool_size_l0': 8, 'heading_error_out_channels_l1': 77, 'heading_error_pool_size_l1': 2, 'heading_error_out_channels_l2': 216, 'heading_error_pool_size_l2': 4, 'heading_error_out_channels_l3': 175, 'heading_error_pool_size_l3': 4, 'heading_error_out_channels_l4': 115, 'heading_error_pool_size_l4': 4, 'heading_error_fc_hidden': 37}. Best is trial 70 with value: 0.1122.
[rank: 0] Seed set to 42
[rank: 0] Seed set to 42
GPU available: True (cuda), used: True
TPU available: False, using: 0 TPU cores
GPU available: True (cuda), used: True
TPU available: False, using: 0 TPU cores
💡 Tip: For seamless cloud logging and experiment tracking, try installing [litlogger](https://pypi.org/project/litlogger/) to enable LitLogger, which logs metrics and artifacts automatically to the Lightning Experiments platform.
💡 Tip: For seamless cloud logging and experiment tracking, try installing [litlogger](https://pypi.org/project/litlogger/) to enable LitLogger, which logs metrics and artifacts automatically to the Lightning Experiments platform.
[rank: 0] Seed set to 42
GPU available: True (cuda), used: True
TPU available: False, using: 0 TPU cores
💡 Tip: For seamless cloud logging and experiment tracking, try installing [litlogger](https://pypi.org/project/litlogger/) to enable LitLogger, which logs metrics and artifacts automatically to the Lightning Experiments platform.
LOCAL_RANK: 0 - CUDA_VISIBLE_DEVICES: [0]
LOCAL_RANK: 0 - CUDA_VISIBLE_DEVICES: [0]
LOCAL_RANK: 0 - CUDA_VISIBLE_DEVICES: [0]
SLURM auto-requeueing enabled. Setting signal handlers.
SLURM auto-requeueing enabled. Setting signal handlers.
SLURM auto-requeueing enabled. Setting signal handlers.
`Trainer.fit` stopped: `max_epochs=30` reached.
`Trainer.fit` stopped: `max_epochs=30` reached.
`Trainer.fit` stopped: `max_epochs=30` reached.
[I 2026-04-16 00:18:50,566] Trial 73 finished with value: 0.1539 and parameters: {'left_wall_dist_num_layers': 5, 'left_wall_dist_activation': 'relu', 'left_wall_dist_out_channels_l0': 161, 'left_wall_dist_pool_size_l0': 8, 'left_wall_dist_out_channels_l1': 106, 'left_wall_dist_pool_size_l1': 2, 'left_wall_dist_out_channels_l2': 203, 'left_wall_dist_pool_size_l2': 4, 'left_wall_dist_out_channels_l3': 168, 'left_wall_dist_pool_size_l3': 8, 'left_wall_dist_fc_hidden': 41, 'track_width_num_layers': 4, 'track_width_activation': 'elu', 'track_width_out_channels_l0': 185, 'track_width_pool_size_l0': 2, 'track_width_out_channels_l1': 201, 'track_width_pool_size_l1': 4, 'track_width_out_channels_l2': 131, 'track_width_pool_size_l2': 2, 'track_width_out_channels_l3': 47, 'track_width_pool_size_l3': 2, 'track_width_fc_hidden': 58, 'heading_error_num_layers': 5, 'heading_error_activation': 'elu', 'heading_error_out_channels_l0': 119, 'heading_error_pool_size_l0': 8, 'heading_error_out_channels_l1': 104, 'heading_error_pool_size_l1': 2, 'heading_error_out_channels_l2': 174, 'heading_error_pool_size_l2': 4, 'heading_error_out_channels_l3': 211, 'heading_error_pool_size_l3': 4, 'heading_error_out_channels_l4': 201, 'heading_error_pool_size_l4': 4, 'heading_error_fc_hidden': 42}. Best is trial 70 with value: 0.1122.
[rank: 0] Seed set to 42
[rank: 0] Seed set to 42
[rank: 0] Seed set to 42
GPU available: True (cuda), used: True
TPU available: False, using: 0 TPU cores
💡 Tip: For seamless cloud logging and experiment tracking, try installing [litlogger](https://pypi.org/project/litlogger/) to enable LitLogger, which logs metrics and artifacts automatically to the Lightning Experiments platform.
GPU available: True (cuda), used: True
TPU available: False, using: 0 TPU cores
💡 Tip: For seamless cloud logging and experiment tracking, try installing [litlogger](https://pypi.org/project/litlogger/) to enable LitLogger, which logs metrics and artifacts automatically to the Lightning Experiments platform.
GPU available: True (cuda), used: True
TPU available: False, using: 0 TPU cores
💡 Tip: For seamless cloud logging and experiment tracking, try installing [litlogger](https://pypi.org/project/litlogger/) to enable LitLogger, which logs metrics and artifacts automatically to the Lightning Experiments platform.
LOCAL_RANK: 0 - CUDA_VISIBLE_DEVICES: [0]
LOCAL_RANK: 0 - CUDA_VISIBLE_DEVICES: [0]
LOCAL_RANK: 0 - CUDA_VISIBLE_DEVICES: [0]
SLURM auto-requeueing enabled. Setting signal handlers.
SLURM auto-requeueing enabled. Setting signal handlers.
SLURM auto-requeueing enabled. Setting signal handlers.
`Trainer.fit` stopped: `max_epochs=30` reached.
`Trainer.fit` stopped: `max_epochs=30` reached.
`Trainer.fit` stopped: `max_epochs=30` reached.
[I 2026-04-16 00:22:04,503] Trial 74 finished with value: 0.128 and parameters: {'left_wall_dist_num_layers': 5, 'left_wall_dist_activation': 'relu', 'left_wall_dist_out_channels_l0': 189, 'left_wall_dist_pool_size_l0': 8, 'left_wall_dist_out_channels_l1': 142, 'left_wall_dist_pool_size_l1': 2, 'left_wall_dist_out_channels_l2': 224, 'left_wall_dist_pool_size_l2': 4, 'left_wall_dist_out_channels_l3': 140, 'left_wall_dist_pool_size_l3': 8, 'left_wall_dist_fc_hidden': 37, 'track_width_num_layers': 4, 'track_width_activation': 'elu', 'track_width_out_channels_l0': 211, 'track_width_pool_size_l0': 2, 'track_width_out_channels_l1': 134, 'track_width_pool_size_l1': 4, 'track_width_out_channels_l2': 149, 'track_width_pool_size_l2': 2, 'track_width_out_channels_l3': 40, 'track_width_pool_size_l3': 2, 'track_width_fc_hidden': 50, 'heading_error_num_layers': 5, 'heading_error_activation': 'elu', 'heading_error_out_channels_l0': 139, 'heading_error_pool_size_l0': 8, 'heading_error_out_channels_l1': 91, 'heading_error_pool_size_l1': 2, 'heading_error_out_channels_l2': 237, 'heading_error_pool_size_l2': 4, 'heading_error_out_channels_l3': 223, 'heading_error_pool_size_l3': 4, 'heading_error_out_channels_l4': 176, 'heading_error_pool_size_l4': 4, 'heading_error_fc_hidden': 49}. Best is trial 70 with value: 0.1122.
[rank: 0] Seed set to 42
GPU available: True (cuda), used: True
TPU available: False, using: 0 TPU cores
💡 Tip: For seamless cloud logging and experiment tracking, try installing [litlogger](https://pypi.org/project/litlogger/) to enable LitLogger, which logs metrics and artifacts automatically to the Lightning Experiments platform.
[rank: 0] Seed set to 42
GPU available: True (cuda), used: True
TPU available: False, using: 0 TPU cores
💡 Tip: For seamless cloud logging and experiment tracking, try installing [litlogger](https://pypi.org/project/litlogger/) to enable LitLogger, which logs metrics and artifacts automatically to the Lightning Experiments platform.
[rank: 0] Seed set to 42
GPU available: True (cuda), used: True
TPU available: False, using: 0 TPU cores
💡 Tip: For seamless cloud logging and experiment tracking, try installing [litlogger](https://pypi.org/project/litlogger/) to enable LitLogger, which logs metrics and artifacts automatically to the Lightning Experiments platform.
LOCAL_RANK: 0 - CUDA_VISIBLE_DEVICES: [0]
LOCAL_RANK: 0 - CUDA_VISIBLE_DEVICES: [0]
SLURM auto-requeueing enabled. Setting signal handlers.
LOCAL_RANK: 0 - CUDA_VISIBLE_DEVICES: [0]
SLURM auto-requeueing enabled. Setting signal handlers.
SLURM auto-requeueing enabled. Setting signal handlers.
`Trainer.fit` stopped: `max_epochs=30` reached.
`Trainer.fit` stopped: `max_epochs=30` reached.
`Trainer.fit` stopped: `max_epochs=30` reached.
[I 2026-04-16 00:25:14,736] Trial 75 finished with value: 0.1276 and parameters: {'left_wall_dist_num_layers': 5, 'left_wall_dist_activation': 'relu', 'left_wall_dist_out_channels_l0': 141, 'left_wall_dist_pool_size_l0': 8, 'left_wall_dist_out_channels_l1': 83, 'left_wall_dist_pool_size_l1': 2, 'left_wall_dist_out_channels_l2': 45, 'left_wall_dist_pool_size_l2': 4, 'left_wall_dist_out_channels_l3': 200, 'left_wall_dist_pool_size_l3': 8, 'track_width_num_layers': 4, 'track_width_activation': 'elu', 'track_width_out_channels_l0': 236, 'track_width_pool_size_l0': 2, 'track_width_out_channels_l1': 116, 'track_width_pool_size_l1': 8, 'track_width_out_channels_l2': 194, 'track_width_pool_size_l2': 2, 'track_width_out_channels_l3': 47, 'track_width_pool_size_l3': 2, 'track_width_fc_hidden': 67, 'heading_error_num_layers': 5, 'heading_error_activation': 'elu', 'heading_error_out_channels_l0': 100, 'heading_error_pool_size_l0': 2, 'heading_error_out_channels_l1': 82, 'heading_error_pool_size_l1': 2, 'heading_error_out_channels_l2': 198, 'heading_error_pool_size_l2': 4, 'heading_error_out_channels_l3': 187, 'heading_error_pool_size_l3': 4, 'heading_error_out_channels_l4': 105, 'heading_error_pool_size_l4': 4, 'heading_error_fc_hidden': 60}. Best is trial 70 with value: 0.1122.
[rank: 0] Seed set to 42
GPU available: True (cuda), used: True
TPU available: False, using: 0 TPU cores
💡 Tip: For seamless cloud logging and experiment tracking, try installing [litlogger](https://pypi.org/project/litlogger/) to enable LitLogger, which logs metrics and artifacts automatically to the Lightning Experiments platform.
[rank: 0] Seed set to 42
[rank: 0] Seed set to 42
GPU available: True (cuda), used: True
TPU available: False, using: 0 TPU cores
💡 Tip: For seamless cloud logging and experiment tracking, try installing [litlogger](https://pypi.org/project/litlogger/) to enable LitLogger, which logs metrics and artifacts automatically to the Lightning Experiments platform.
GPU available: True (cuda), used: True
TPU available: False, using: 0 TPU cores
💡 Tip: For seamless cloud logging and experiment tracking, try installing [litlogger](https://pypi.org/project/litlogger/) to enable LitLogger, which logs metrics and artifacts automatically to the Lightning Experiments platform.
LOCAL_RANK: 0 - CUDA_VISIBLE_DEVICES: [0]
LOCAL_RANK: 0 - CUDA_VISIBLE_DEVICES: [0]
LOCAL_RANK: 0 - CUDA_VISIBLE_DEVICES: [0]
SLURM auto-requeueing enabled. Setting signal handlers.
SLURM auto-requeueing enabled. Setting signal handlers.
SLURM auto-requeueing enabled. Setting signal handlers.
`Trainer.fit` stopped: `max_epochs=30` reached.
`Trainer.fit` stopped: `max_epochs=30` reached.
`Trainer.fit` stopped: `max_epochs=30` reached.
[I 2026-04-16 00:28:21,150] Trial 76 finished with value: 0.1429 and parameters: {'left_wall_dist_num_layers': 5, 'left_wall_dist_activation': 'relu', 'left_wall_dist_out_channels_l0': 100, 'left_wall_dist_pool_size_l0': 8, 'left_wall_dist_out_channels_l1': 93, 'left_wall_dist_pool_size_l1': 2, 'left_wall_dist_out_channels_l2': 180, 'left_wall_dist_pool_size_l2': 4, 'left_wall_dist_out_channels_l3': 108, 'left_wall_dist_pool_size_l3': 8, 'left_wall_dist_fc_hidden': 33, 'track_width_num_layers': 4, 'track_width_activation': 'elu', 'track_width_out_channels_l0': 247, 'track_width_pool_size_l0': 2, 'track_width_out_channels_l1': 148, 'track_width_pool_size_l1': 4, 'track_width_out_channels_l2': 81, 'track_width_pool_size_l2': 2, 'track_width_out_channels_l3': 56, 'track_width_pool_size_l3': 2, 'track_width_fc_hidden': 70, 'heading_error_num_layers': 5, 'heading_error_activation': 'elu', 'heading_error_out_channels_l0': 85, 'heading_error_pool_size_l0': 4, 'heading_error_out_channels_l1': 100, 'heading_error_pool_size_l1': 2, 'heading_error_out_channels_l2': 141, 'heading_error_pool_size_l2': 4, 'heading_error_out_channels_l3': 256, 'heading_error_pool_size_l3': 4, 'heading_error_out_channels_l4': 69, 'heading_error_pool_size_l4': 8, 'heading_error_fc_hidden': 58}. Best is trial 70 with value: 0.1122.
[rank: 0] Seed set to 42
[rank: 0] Seed set to 42
[rank: 0] Seed set to 42
GPU available: True (cuda), used: True
TPU available: False, using: 0 TPU cores
💡 Tip: For seamless cloud logging and experiment tracking, try installing [litlogger](https://pypi.org/project/litlogger/) to enable LitLogger, which logs metrics and artifacts automatically to the Lightning Experiments platform.
GPU available: True (cuda), used: True
TPU available: False, using: 0 TPU cores
💡 Tip: For seamless cloud logging and experiment tracking, try installing [litlogger](https://pypi.org/project/litlogger/) to enable LitLogger, which logs metrics and artifacts automatically to the Lightning Experiments platform.
GPU available: True (cuda), used: True
TPU available: False, using: 0 TPU cores
💡 Tip: For seamless cloud logging and experiment tracking, try installing [litlogger](https://pypi.org/project/litlogger/) to enable LitLogger, which logs metrics and artifacts automatically to the Lightning Experiments platform.
LOCAL_RANK: 0 - CUDA_VISIBLE_DEVICES: [0]
LOCAL_RANK: 0 - CUDA_VISIBLE_DEVICES: [0]
LOCAL_RANK: 0 - CUDA_VISIBLE_DEVICES: [0]
SLURM auto-requeueing enabled. Setting signal handlers.
SLURM auto-requeueing enabled. Setting signal handlers.
SLURM auto-requeueing enabled. Setting signal handlers.
`Trainer.fit` stopped: `max_epochs=30` reached.
`Trainer.fit` stopped: `max_epochs=30` reached.
`Trainer.fit` stopped: `max_epochs=30` reached.
[I 2026-04-16 00:31:30,992] Trial 77 finished with value: 0.1318 and parameters: {'left_wall_dist_num_layers': 5, 'left_wall_dist_activation': 'relu', 'left_wall_dist_out_channels_l0': 157, 'left_wall_dist_pool_size_l0': 8, 'left_wall_dist_out_channels_l1': 164, 'left_wall_dist_pool_size_l1': 2, 'left_wall_dist_out_channels_l2': 240, 'left_wall_dist_pool_size_l2': 4, 'left_wall_dist_out_channels_l3': 147, 'left_wall_dist_pool_size_l3': 8, 'left_wall_dist_fc_hidden': 38, 'track_width_num_layers': 4, 'track_width_activation': 'elu', 'track_width_out_channels_l0': 199, 'track_width_pool_size_l0': 2, 'track_width_out_channels_l1': 193, 'track_width_pool_size_l1': 8, 'track_width_out_channels_l2': 232, 'track_width_pool_size_l2': 2, 'track_width_out_channels_l3': 45, 'track_width_pool_size_l3': 2, 'track_width_fc_hidden': 87, 'heading_error_num_layers': 5, 'heading_error_activation': 'elu', 'heading_error_out_channels_l0': 128, 'heading_error_pool_size_l0': 8, 'heading_error_out_channels_l1': 118, 'heading_error_pool_size_l1': 2, 'heading_error_out_channels_l2': 98, 'heading_error_pool_size_l2': 4, 'heading_error_out_channels_l3': 162, 'heading_error_pool_size_l3': 4, 'heading_error_out_channels_l4': 110, 'heading_error_pool_size_l4': 4, 'heading_error_fc_hidden': 36}. Best is trial 70 with value: 0.1122.
[rank: 0] Seed set to 42
GPU available: True (cuda), used: True
TPU available: False, using: 0 TPU cores
💡 Tip: For seamless cloud logging and experiment tracking, try installing [litlogger](https://pypi.org/project/litlogger/) to enable LitLogger, which logs metrics and artifacts automatically to the Lightning Experiments platform.
[rank: 0] Seed set to 42
GPU available: True (cuda), used: True
TPU available: False, using: 0 TPU cores
💡 Tip: For seamless cloud logging and experiment tracking, try installing [litlogger](https://pypi.org/project/litlogger/) to enable LitLogger, which logs metrics and artifacts automatically to the Lightning Experiments platform.
[rank: 0] Seed set to 42
GPU available: True (cuda), used: True
TPU available: False, using: 0 TPU cores
💡 Tip: For seamless cloud logging and experiment tracking, try installing [litlogger](https://pypi.org/project/litlogger/) to enable LitLogger, which logs metrics and artifacts automatically to the Lightning Experiments platform.
LOCAL_RANK: 0 - CUDA_VISIBLE_DEVICES: [0]
LOCAL_RANK: 0 - CUDA_VISIBLE_DEVICES: [0]
LOCAL_RANK: 0 - CUDA_VISIBLE_DEVICES: [0]
SLURM auto-requeueing enabled. Setting signal handlers.
SLURM auto-requeueing enabled. Setting signal handlers.
SLURM auto-requeueing enabled. Setting signal handlers.
`Trainer.fit` stopped: `max_epochs=30` reached.
`Trainer.fit` stopped: `max_epochs=30` reached.
`Trainer.fit` stopped: `max_epochs=30` reached.
