[I 2026-04-15 22:19:54,059] Trial 55 finished with value: 0.5026 and parameters: {'left_wall_dist_num_layers': 4, 'left_wall_dist_activation': 'relu', 'left_wall_dist_out_channels_l0': 32, 'left_wall_dist_pool_size_l0': 4, 'left_wall_dist_out_channels_l1': 37, 'left_wall_dist_pool_size_l1': 4, 'left_wall_dist_out_channels_l2': 124, 'left_wall_dist_pool_size_l2': 2, 'left_wall_dist_out_channels_l3': 104, 'left_wall_dist_pool_size_l3': 8, 'left_wall_dist_fc_hidden': 59, 'track_width_num_layers': 3, 'track_width_activation': 'relu', 'track_width_out_channels_l0': 80, 'track_width_pool_size_l0': 4, 'track_width_out_channels_l1': 230, 'track_width_pool_size_l1': 4, 'track_width_out_channels_l2': 69, 'track_width_pool_size_l2': 2, 'track_width_fc_hidden': 86, 'heading_error_num_layers': 4, 'heading_error_activation': 'elu', 'heading_error_out_channels_l0': 64, 'heading_error_pool_size_l0': 8, 'heading_error_out_channels_l1': 198, 'heading_error_pool_size_l1': 2, 'heading_error_out_channels_l2': 43, 'heading_error_pool_size_l2': 8, 'heading_error_out_channels_l3': 74, 'heading_error_pool_size_l3': 4}. Best is trial 30 with value: 0.136.
[rank: 0] Seed set to 42
[rank: 0] Seed set to 42
GPU available: True (cuda), used: True
TPU available: False, using: 0 TPU cores
💡 Tip: For seamless cloud logging and experiment tracking, try installing [litlogger](https://pypi.org/project/litlogger/) to enable LitLogger, which logs metrics and artifacts automatically to the Lightning Experiments platform.
GPU available: True (cuda), used: True
TPU available: False, using: 0 TPU cores
💡 Tip: For seamless cloud logging and experiment tracking, try installing [litlogger](https://pypi.org/project/litlogger/) to enable LitLogger, which logs metrics and artifacts automatically to the Lightning Experiments platform.
[rank: 0] Seed set to 42
GPU available: True (cuda), used: True
TPU available: False, using: 0 TPU cores
💡 Tip: For seamless cloud logging and experiment tracking, try installing [litlogger](https://pypi.org/project/litlogger/) to enable LitLogger, which logs metrics and artifacts automatically to the Lightning Experiments platform.
LOCAL_RANK: 0 - CUDA_VISIBLE_DEVICES: [0]
LOCAL_RANK: 0 - CUDA_VISIBLE_DEVICES: [0]
LOCAL_RANK: 0 - CUDA_VISIBLE_DEVICES: [0]
SLURM auto-requeueing enabled. Setting signal handlers.
SLURM auto-requeueing enabled. Setting signal handlers.
SLURM auto-requeueing enabled. Setting signal handlers.
`Trainer.fit` stopped: `max_epochs=30` reached.
`Trainer.fit` stopped: `max_epochs=30` reached.
`Trainer.fit` stopped: `max_epochs=30` reached.
[I 2026-04-15 22:22:33,950] Trial 56 finished with value: 0.1783 and parameters: {'left_wall_dist_num_layers': 3, 'left_wall_dist_activation': 'elu', 'left_wall_dist_out_channels_l0': 56, 'left_wall_dist_pool_size_l0': 2, 'left_wall_dist_out_channels_l1': 217, 'left_wall_dist_pool_size_l1': 8, 'left_wall_dist_out_channels_l2': 94, 'left_wall_dist_pool_size_l2': 2, 'left_wall_dist_fc_hidden': 68, 'track_width_num_layers': 2, 'track_width_activation': 'relu', 'track_width_out_channels_l0': 74, 'track_width_pool_size_l0': 2, 'track_width_out_channels_l1': 154, 'track_width_pool_size_l1': 2, 'heading_error_num_layers': 2, 'heading_error_activation': 'relu', 'heading_error_out_channels_l0': 35, 'heading_error_pool_size_l0': 2, 'heading_error_out_channels_l1': 104, 'heading_error_pool_size_l1': 8, 'heading_error_fc_hidden': 116}. Best is trial 30 with value: 0.136.
[rank: 0] Seed set to 42
[rank: 0] Seed set to 42
[rank: 0] Seed set to 42
GPU available: True (cuda), used: True
TPU available: False, using: 0 TPU cores
GPU available: True (cuda), used: True
TPU available: False, using: 0 TPU cores
💡 Tip: For seamless cloud logging and experiment tracking, try installing [litlogger](https://pypi.org/project/litlogger/) to enable LitLogger, which logs metrics and artifacts automatically to the Lightning Experiments platform.
💡 Tip: For seamless cloud logging and experiment tracking, try installing [litlogger](https://pypi.org/project/litlogger/) to enable LitLogger, which logs metrics and artifacts automatically to the Lightning Experiments platform.
GPU available: True (cuda), used: True
TPU available: False, using: 0 TPU cores
💡 Tip: For seamless cloud logging and experiment tracking, try installing [litlogger](https://pypi.org/project/litlogger/) to enable LitLogger, which logs metrics and artifacts automatically to the Lightning Experiments platform.
LOCAL_RANK: 0 - CUDA_VISIBLE_DEVICES: [0]
LOCAL_RANK: 0 - CUDA_VISIBLE_DEVICES: [0]
LOCAL_RANK: 0 - CUDA_VISIBLE_DEVICES: [0]
SLURM auto-requeueing enabled. Setting signal handlers.
SLURM auto-requeueing enabled. Setting signal handlers.
SLURM auto-requeueing enabled. Setting signal handlers.
`Trainer.fit` stopped: `max_epochs=30` reached.
`Trainer.fit` stopped: `max_epochs=30` reached.
`Trainer.fit` stopped: `max_epochs=30` reached.
[I 2026-04-15 22:25:30,210] Trial 57 finished with value: 0.1621 and parameters: {'left_wall_dist_num_layers': 4, 'left_wall_dist_activation': 'relu', 'left_wall_dist_out_channels_l0': 138, 'left_wall_dist_pool_size_l0': 2, 'left_wall_dist_out_channels_l1': 188, 'left_wall_dist_pool_size_l1': 4, 'left_wall_dist_out_channels_l2': 109, 'left_wall_dist_pool_size_l2': 2, 'left_wall_dist_out_channels_l3': 48, 'left_wall_dist_pool_size_l3': 8, 'left_wall_dist_fc_hidden': 46, 'track_width_num_layers': 4, 'track_width_activation': 'elu', 'track_width_out_channels_l0': 59, 'track_width_pool_size_l0': 4, 'track_width_out_channels_l1': 195, 'track_width_pool_size_l1': 4, 'track_width_out_channels_l2': 93, 'track_width_pool_size_l2': 4, 'track_width_out_channels_l3': 71, 'track_width_pool_size_l3': 4, 'track_width_fc_hidden': 36, 'heading_error_num_layers': 3, 'heading_error_activation': 'relu', 'heading_error_out_channels_l0': 76, 'heading_error_pool_size_l0': 8, 'heading_error_out_channels_l1': 219, 'heading_error_pool_size_l1': 2, 'heading_error_out_channels_l2': 162, 'heading_error_pool_size_l2': 2, 'heading_error_fc_hidden': 104}. Best is trial 30 with value: 0.136.
[rank: 0] Seed set to 42
[rank: 0] Seed set to 42
[rank: 0] Seed set to 42
GPU available: True (cuda), used: True
TPU available: False, using: 0 TPU cores
GPU available: True (cuda), used: True
TPU available: False, using: 0 TPU cores
💡 Tip: For seamless cloud logging and experiment tracking, try installing [litlogger](https://pypi.org/project/litlogger/) to enable LitLogger, which logs metrics and artifacts automatically to the Lightning Experiments platform.
💡 Tip: For seamless cloud logging and experiment tracking, try installing [litlogger](https://pypi.org/project/litlogger/) to enable LitLogger, which logs metrics and artifacts automatically to the Lightning Experiments platform.
GPU available: True (cuda), used: True
TPU available: False, using: 0 TPU cores
💡 Tip: For seamless cloud logging and experiment tracking, try installing [litlogger](https://pypi.org/project/litlogger/) to enable LitLogger, which logs metrics and artifacts automatically to the Lightning Experiments platform.
LOCAL_RANK: 0 - CUDA_VISIBLE_DEVICES: [0]
LOCAL_RANK: 0 - CUDA_VISIBLE_DEVICES: [0]
LOCAL_RANK: 0 - CUDA_VISIBLE_DEVICES: [0]
SLURM auto-requeueing enabled. Setting signal handlers.
SLURM auto-requeueing enabled. Setting signal handlers.
SLURM auto-requeueing enabled. Setting signal handlers.
`Trainer.fit` stopped: `max_epochs=30` reached.
`Trainer.fit` stopped: `max_epochs=30` reached.
`Trainer.fit` stopped: `max_epochs=30` reached.
[I 2026-04-15 22:28:30,271] Trial 58 finished with value: 0.2153 and parameters: {'left_wall_dist_num_layers': 4, 'left_wall_dist_activation': 'relu', 'left_wall_dist_out_channels_l0': 224, 'left_wall_dist_pool_size_l0': 2, 'left_wall_dist_out_channels_l1': 61, 'left_wall_dist_pool_size_l1': 4, 'left_wall_dist_out_channels_l2': 153, 'left_wall_dist_pool_size_l2': 8, 'left_wall_dist_out_channels_l3': 151, 'left_wall_dist_pool_size_l3': 4, 'left_wall_dist_fc_hidden': 51, 'track_width_num_layers': 3, 'track_width_activation': 'relu', 'track_width_out_channels_l0': 43, 'track_width_pool_size_l0': 4, 'track_width_out_channels_l1': 138, 'track_width_pool_size_l1': 4, 'track_width_out_channels_l2': 255, 'track_width_pool_size_l2': 8, 'track_width_fc_hidden': 127, 'heading_error_num_layers': 5, 'heading_error_activation': 'elu', 'heading_error_out_channels_l0': 56, 'heading_error_pool_size_l0': 8, 'heading_error_out_channels_l1': 129, 'heading_error_pool_size_l1': 2, 'heading_error_out_channels_l2': 238, 'heading_error_pool_size_l2': 8, 'heading_error_out_channels_l3': 255, 'heading_error_pool_size_l3': 4, 'heading_error_fc_hidden': 47}. Best is trial 30 with value: 0.136.
[rank: 0] Seed set to 42
GPU available: True (cuda), used: True
TPU available: False, using: 0 TPU cores
💡 Tip: For seamless cloud logging and experiment tracking, try installing [litlogger](https://pypi.org/project/litlogger/) to enable LitLogger, which logs metrics and artifacts automatically to the Lightning Experiments platform.
[rank: 0] Seed set to 42
[rank: 0] Seed set to 42
GPU available: True (cuda), used: True
TPU available: False, using: 0 TPU cores
💡 Tip: For seamless cloud logging and experiment tracking, try installing [litlogger](https://pypi.org/project/litlogger/) to enable LitLogger, which logs metrics and artifacts automatically to the Lightning Experiments platform.
GPU available: True (cuda), used: True
TPU available: False, using: 0 TPU cores
💡 Tip: For seamless cloud logging and experiment tracking, try installing [litlogger](https://pypi.org/project/litlogger/) to enable LitLogger, which logs metrics and artifacts automatically to the Lightning Experiments platform.
LOCAL_RANK: 0 - CUDA_VISIBLE_DEVICES: [0]
LOCAL_RANK: 0 - CUDA_VISIBLE_DEVICES: [0]
LOCAL_RANK: 0 - CUDA_VISIBLE_DEVICES: [0]
SLURM auto-requeueing enabled. Setting signal handlers.
SLURM auto-requeueing enabled. Setting signal handlers.
SLURM auto-requeueing enabled. Setting signal handlers.
`Trainer.fit` stopped: `max_epochs=30` reached.
`Trainer.fit` stopped: `max_epochs=30` reached.
`Trainer.fit` stopped: `max_epochs=30` reached.
[I 2026-04-15 22:30:36,602] Trial 59 finished with value: 0.1514 and parameters: {'left_wall_dist_num_layers': 3, 'left_wall_dist_activation': 'elu', 'left_wall_dist_out_channels_l0': 37, 'left_wall_dist_pool_size_l0': 8, 'left_wall_dist_out_channels_l1': 81, 'left_wall_dist_pool_size_l1': 2, 'left_wall_dist_out_channels_l2': 76, 'left_wall_dist_pool_size_l2': 2, 'left_wall_dist_fc_hidden': 74, 'track_width_num_layers': 4, 'track_width_activation': 'elu', 'track_width_out_channels_l0': 37, 'track_width_pool_size_l0': 4, 'track_width_out_channels_l1': 37, 'track_width_pool_size_l1': 8, 'track_width_out_channels_l2': 209, 'track_width_pool_size_l2': 4, 'track_width_out_channels_l3': 32, 'track_width_pool_size_l3': 2, 'track_width_fc_hidden': 35, 'heading_error_num_layers': 3, 'heading_error_activation': 'relu', 'heading_error_out_channels_l0': 44, 'heading_error_pool_size_l0': 8, 'heading_error_out_channels_l1': 148, 'heading_error_pool_size_l1': 8, 'heading_error_out_channels_l2': 104, 'heading_error_pool_size_l2': 8, 'heading_error_fc_hidden': 35}. Best is trial 30 with value: 0.136.
[rank: 0] Seed set to 42
[rank: 0] Seed set to 42
[rank: 0] Seed set to 42
GPU available: True (cuda), used: True
TPU available: False, using: 0 TPU cores
💡 Tip: For seamless cloud logging and experiment tracking, try installing [litlogger](https://pypi.org/project/litlogger/) to enable LitLogger, which logs metrics and artifacts automatically to the Lightning Experiments platform.
GPU available: True (cuda), used: True
TPU available: False, using: 0 TPU cores
GPU available: True (cuda), used: True
TPU available: False, using: 0 TPU cores
💡 Tip: For seamless cloud logging and experiment tracking, try installing [litlogger](https://pypi.org/project/litlogger/) to enable LitLogger, which logs metrics and artifacts automatically to the Lightning Experiments platform.
💡 Tip: For seamless cloud logging and experiment tracking, try installing [litlogger](https://pypi.org/project/litlogger/) to enable LitLogger, which logs metrics and artifacts automatically to the Lightning Experiments platform.
LOCAL_RANK: 0 - CUDA_VISIBLE_DEVICES: [0]
LOCAL_RANK: 0 - CUDA_VISIBLE_DEVICES: [0]
LOCAL_RANK: 0 - CUDA_VISIBLE_DEVICES: [0]
Traceback (most recent call last):
  File "/nas/longleaf/home/zayah/f1tenth_ng_zc/packages/f110_scripts/src/f110_scripts/train/train_nn.py", line 595, in <module>
    main()
  File "/nas/longleaf/home/zayah/f1tenth_ng_zc/packages/f110_scripts/src/f110_scripts/train/train_nn.py", line 591, in main
    run_single_training(config, aid)
  File "/nas/longleaf/home/zayah/f1tenth_ng_zc/packages/f110_scripts/src/f110_scripts/train/train_nn.py", line 564, in run_single_training
    trainer.fit(module, datamodule=dm, ckpt_path=ckpt_path)
  File "/nas/longleaf/home/zayah/f1tenth_ng_zc/.venv/lib/python3.12/site-packages/lightning/pytorch/trainer/trainer.py", line 584, in fit
    call._call_and_handle_interrupt(
  File "/nas/longleaf/home/zayah/f1tenth_ng_zc/.venv/lib/python3.12/site-packages/lightning/pytorch/trainer/call.py", line 49, in _call_and_handle_interrupt
    return trainer_fn(*args, **kwargs)
           ^^^^^^^^^^^^^^^^^^^^^^^^^^^
  File "/nas/longleaf/home/zayah/f1tenth_ng_zc/.venv/lib/python3.12/site-packages/lightning/pytorch/trainer/trainer.py", line 630, in _fit_impl
    self._run(model, ckpt_path=ckpt_path, weights_only=weights_only)
  File "/nas/longleaf/home/zayah/f1tenth_ng_zc/.venv/lib/python3.12/site-packages/lightning/pytorch/trainer/trainer.py", line 1057, in _run
    call._call_callback_hooks(self, "on_fit_start")
  File "/nas/longleaf/home/zayah/f1tenth_ng_zc/.venv/lib/python3.12/site-packages/lightning/pytorch/trainer/call.py", line 228, in _call_callback_hooks
    fn(trainer, trainer.lightning_module, *args, **kwargs)
  File "/nas/longleaf/home/zayah/f1tenth_ng_zc/.venv/lib/python3.12/site-packages/lightning/pytorch/callbacks/model_summary.py", line 64, in on_fit_start
    model_summary = self._summary(trainer, pl_module)
                    ^^^^^^^^^^^^^^^^^^^^^^^^^^^^^^^^^
  File "/nas/longleaf/home/zayah/f1tenth_ng_zc/.venv/lib/python3.12/site-packages/lightning/pytorch/callbacks/model_summary.py", line 90, in _summary
    return summarize(pl_module, max_depth=self._max_depth)
           ^^^^^^^^^^^^^^^^^^^^^^^^^^^^^^^^^^^^^^^^^^^^^^^
  File "/nas/longleaf/home/zayah/f1tenth_ng_zc/.venv/lib/python3.12/site-packages/lightning/pytorch/utilities/model_summary/model_summary.py", line 565, in summarize
    return ModelSummary(lightning_module, max_depth=max_depth)
           ^^^^^^^^^^^^^^^^^^^^^^^^^^^^^^^^^^^^^^^^^^^^^^^^^^^
  File "/nas/longleaf/home/zayah/f1tenth_ng_zc/.venv/lib/python3.12/site-packages/lightning/pytorch/utilities/model_summary/model_summary.py", line 228, in __init__
    self._layer_summary = self.summarize()
                          ^^^^^^^^^^^^^^^^
  File "/nas/longleaf/home/zayah/f1tenth_ng_zc/.venv/lib/python3.12/site-packages/lightning/pytorch/utilities/model_summary/model_summary.py", line 328, in summarize
    self._forward_example_input()
  File "/nas/longleaf/home/zayah/f1tenth_ng_zc/.venv/lib/python3.12/site-packages/lightning/pytorch/utilities/model_summary/model_summary.py", line 371, in _forward_example_input
    model(input_)
  File "/nas/longleaf/home/zayah/f1tenth_ng_zc/.venv/lib/python3.12/site-packages/torch/nn/modules/module.py", line 1779, in _wrapped_call_impl
    return self._call_impl(*args, **kwargs)
           ^^^^^^^^^^^^^^^^^^^^^^^^^^^^^^^^
  File "/nas/longleaf/home/zayah/f1tenth_ng_zc/.venv/lib/python3.12/site-packages/torch/nn/modules/module.py", line 1885, in _call_impl
    return inner()
           ^^^^^^^
  File "/nas/longleaf/home/zayah/f1tenth_ng_zc/.venv/lib/python3.12/site-packages/torch/nn/modules/module.py", line 1833, in inner
    result = forward_call(*args, **kwargs)
             ^^^^^^^^^^^^^^^^^^^^^^^^^^^^^
  File "/nas/longleaf/home/zayah/f1tenth_ng_zc/packages/f110_scripts/src/f110_scripts/train/train_nn.py", line 205, in forward
    return self.model(x_in)
           ^^^^^^^^^^^^^^^^
  File "/nas/longleaf/home/zayah/f1tenth_ng_zc/.venv/lib/python3.12/site-packages/torch/nn/modules/module.py", line 1779, in _wrapped_call_impl
    return self._call_impl(*args, **kwargs)
           ^^^^^^^^^^^^^^^^^^^^^^^^^^^^^^^^
  File "/nas/longleaf/home/zayah/f1tenth_ng_zc/.venv/lib/python3.12/site-packages/torch/nn/modules/module.py", line 1885, in _call_impl
    return inner()
           ^^^^^^^
  File "/nas/longleaf/home/zayah/f1tenth_ng_zc/.venv/lib/python3.12/site-packages/torch/nn/modules/module.py", line 1833, in inner
    result = forward_call(*args, **kwargs)
             ^^^^^^^^^^^^^^^^^^^^^^^^^^^^^
  File "/nas/longleaf/home/zayah/f1tenth_ng_zc/.venv/lib/python3.12/site-packages/torch/nn/modules/container.py", line 253, in forward
    input = module(input)
            ^^^^^^^^^^^^^
  File "/nas/longleaf/home/zayah/f1tenth_ng_zc/.venv/lib/python3.12/site-packages/torch/nn/modules/module.py", line 1779, in _wrapped_call_impl
    return self._call_impl(*args, **kwargs)
           ^^^^^^^^^^^^^^^^^^^^^^^^^^^^^^^^
  File "/nas/longleaf/home/zayah/f1tenth_ng_zc/.venv/lib/python3.12/site-packages/torch/nn/modules/module.py", line 1885, in _call_impl
    return inner()
           ^^^^^^^
  File "/nas/longleaf/home/zayah/f1tenth_ng_zc/.venv/lib/python3.12/site-packages/torch/nn/modules/module.py", line 1833, in inner
    result = forward_call(*args, **kwargs)
             ^^^^^^^^^^^^^^^^^^^^^^^^^^^^^
  File "/nas/longleaf/home/zayah/f1tenth_ng_zc/.venv/lib/python3.12/site-packages/torch/nn/modules/pooling.py", line 144, in forward
    return F.max_pool1d(
           ^^^^^^^^^^^^^
  File "/nas/longleaf/home/zayah/f1tenth_ng_zc/.venv/lib/python3.12/site-packages/torch/_jit_internal.py", line 636, in fn
    return if_false(*args, **kwargs)
           ^^^^^^^^^^^^^^^^^^^^^^^^^
  File "/nas/longleaf/home/zayah/f1tenth_ng_zc/.venv/lib/python3.12/site-packages/torch/nn/functional.py", line 745, in _max_pool1d
    return torch.max_pool1d(input, kernel_size, stride, padding, dilation, ceil_mode)
           ^^^^^^^^^^^^^^^^^^^^^^^^^^^^^^^^^^^^^^^^^^^^^^^^^^^^^^^^^^^^^^^^^^^^^^^^^^
RuntimeError: max_pool1d() Invalid computed output size: 0
SLURM auto-requeueing enabled. Setting signal handlers.
SLURM auto-requeueing enabled. Setting signal handlers.
`Trainer.fit` stopped: `max_epochs=30` reached.
`Trainer.fit` stopped: `max_epochs=30` reached.
[I 2026-04-15 22:31:47,117] Trial 60 finished with value: inf and parameters: {'left_wall_dist_num_layers': 3, 'left_wall_dist_activation': 'elu', 'left_wall_dist_out_channels_l0': 37, 'left_wall_dist_pool_size_l0': 8, 'left_wall_dist_out_channels_l1': 86, 'left_wall_dist_pool_size_l1': 2, 'left_wall_dist_out_channels_l2': 79, 'left_wall_dist_pool_size_l2': 2, 'left_wall_dist_fc_hidden': 73, 'track_width_num_layers': 5, 'track_width_activation': 'elu', 'track_width_out_channels_l0': 33, 'track_width_pool_size_l0': 8, 'track_width_out_channels_l1': 33, 'track_width_pool_size_l1': 8, 'track_width_out_channels_l2': 210, 'track_width_pool_size_l2': 4, 'track_width_out_channels_l3': 32, 'track_width_pool_size_l3': 2, 'track_width_fc_hidden': 38, 'heading_error_num_layers': 2, 'heading_error_activation': 'relu', 'heading_error_out_channels_l0': 42, 'heading_error_pool_size_l0': 4, 'heading_error_out_channels_l1': 157, 'heading_error_pool_size_l1': 8, 'heading_error_fc_hidden': 86}. Best is trial 30 with value: 0.136.
[rank: 0] Seed set to 42
[rank: 0] Seed set to 42
GPU available: True (cuda), used: True
TPU available: False, using: 0 TPU cores
💡 Tip: For seamless cloud logging and experiment tracking, try installing [litlogger](https://pypi.org/project/litlogger/) to enable LitLogger, which logs metrics and artifacts automatically to the Lightning Experiments platform.
GPU available: True (cuda), used: True
TPU available: False, using: 0 TPU cores
💡 Tip: For seamless cloud logging and experiment tracking, try installing [litlogger](https://pypi.org/project/litlogger/) to enable LitLogger, which logs metrics and artifacts automatically to the Lightning Experiments platform.
[rank: 0] Seed set to 42
GPU available: True (cuda), used: True
TPU available: False, using: 0 TPU cores
💡 Tip: For seamless cloud logging and experiment tracking, try installing [litlogger](https://pypi.org/project/litlogger/) to enable LitLogger, which logs metrics and artifacts automatically to the Lightning Experiments platform.
LOCAL_RANK: 0 - CUDA_VISIBLE_DEVICES: [0]
LOCAL_RANK: 0 - CUDA_VISIBLE_DEVICES: [0]
LOCAL_RANK: 0 - CUDA_VISIBLE_DEVICES: [0]
SLURM auto-requeueing enabled. Setting signal handlers.
SLURM auto-requeueing enabled. Setting signal handlers.
SLURM auto-requeueing enabled. Setting signal handlers.
`Trainer.fit` stopped: `max_epochs=30` reached.
`Trainer.fit` stopped: `max_epochs=30` reached.
`Trainer.fit` stopped: `max_epochs=30` reached.
