[I 2026-04-15 00:50:28,389] Trial 97 finished with value: 0.1071 and parameters: {'left_wall_dist_num_layers': 3, 'left_wall_dist_activation': 'relu', 'left_wall_dist_out_channels_l0': 35, 'left_wall_dist_pool_size_l0': 2, 'left_wall_dist_out_channels_l1': 39, 'left_wall_dist_pool_size_l1': 8, 'left_wall_dist_out_channels_l2': 62, 'left_wall_dist_pool_size_l2': 4, 'left_wall_dist_fc_hidden': 88, 'track_width_num_layers': 2, 'track_width_activation': 'relu', 'track_width_out_channels_l0': 95, 'track_width_pool_size_l0': 8, 'track_width_out_channels_l1': 65, 'track_width_pool_size_l1': 8, 'track_width_fc_hidden': 37, 'heading_error_num_layers': 3, 'heading_error_activation': 'elu', 'heading_error_out_channels_l0': 46, 'heading_error_pool_size_l0': 8, 'heading_error_out_channels_l1': 34, 'heading_error_pool_size_l1': 4, 'heading_error_out_channels_l2': 64, 'heading_error_pool_size_l2': 4, 'heading_error_fc_hidden': 104}. Best is trial 22 with value: 0.0946.
[rank: 0] Seed set to 42
[rank: 0] Seed set to 42
GPU available: True (cuda), used: True
TPU available: False, using: 0 TPU cores
💡 Tip: For seamless cloud logging and experiment tracking, try installing [litlogger](https://pypi.org/project/litlogger/) to enable LitLogger, which logs metrics and artifacts automatically to the Lightning Experiments platform.
GPU available: True (cuda), used: True
TPU available: False, using: 0 TPU cores
💡 Tip: For seamless cloud logging and experiment tracking, try installing [litlogger](https://pypi.org/project/litlogger/) to enable LitLogger, which logs metrics and artifacts automatically to the Lightning Experiments platform.
[rank: 0] Seed set to 42
GPU available: True (cuda), used: True
TPU available: False, using: 0 TPU cores
💡 Tip: For seamless cloud logging and experiment tracking, try installing [litlogger](https://pypi.org/project/litlogger/) to enable LitLogger, which logs metrics and artifacts automatically to the Lightning Experiments platform.
LOCAL_RANK: 0 - CUDA_VISIBLE_DEVICES: [0]
LOCAL_RANK: 0 - CUDA_VISIBLE_DEVICES: [0]
LOCAL_RANK: 0 - CUDA_VISIBLE_DEVICES: [0]
SLURM auto-requeueing enabled. Setting signal handlers.
SLURM auto-requeueing enabled. Setting signal handlers.
SLURM auto-requeueing enabled. Setting signal handlers.
`Trainer.fit` stopped: `max_epochs=30` reached.
`Trainer.fit` stopped: `max_epochs=30` reached.
`Trainer.fit` stopped: `max_epochs=30` reached.
[I 2026-04-15 00:53:06,697] Trial 98 finished with value: 0.1055 and parameters: {'left_wall_dist_num_layers': 3, 'left_wall_dist_activation': 'relu', 'left_wall_dist_out_channels_l0': 34, 'left_wall_dist_pool_size_l0': 2, 'left_wall_dist_out_channels_l1': 33, 'left_wall_dist_pool_size_l1': 4, 'left_wall_dist_out_channels_l2': 54, 'left_wall_dist_pool_size_l2': 8, 'left_wall_dist_fc_hidden': 96, 'track_width_num_layers': 2, 'track_width_activation': 'relu', 'track_width_out_channels_l0': 110, 'track_width_pool_size_l0': 8, 'track_width_out_channels_l1': 60, 'track_width_pool_size_l1': 8, 'track_width_fc_hidden': 44, 'heading_error_num_layers': 3, 'heading_error_activation': 'elu', 'heading_error_out_channels_l0': 58, 'heading_error_pool_size_l0': 8, 'heading_error_out_channels_l1': 38, 'heading_error_pool_size_l1': 4, 'heading_error_out_channels_l2': 112, 'heading_error_pool_size_l2': 4, 'heading_error_fc_hidden': 37}. Best is trial 22 with value: 0.0946.
[rank: 0] Seed set to 42
[rank: 0] Seed set to 42
[rank: 0] Seed set to 42
GPU available: True (cuda), used: True
TPU available: False, using: 0 TPU cores
GPU available: True (cuda), used: True
TPU available: False, using: 0 TPU cores
💡 Tip: For seamless cloud logging and experiment tracking, try installing [litlogger](https://pypi.org/project/litlogger/) to enable LitLogger, which logs metrics and artifacts automatically to the Lightning Experiments platform.
💡 Tip: For seamless cloud logging and experiment tracking, try installing [litlogger](https://pypi.org/project/litlogger/) to enable LitLogger, which logs metrics and artifacts automatically to the Lightning Experiments platform.
GPU available: True (cuda), used: True
TPU available: False, using: 0 TPU cores
💡 Tip: For seamless cloud logging and experiment tracking, try installing [litlogger](https://pypi.org/project/litlogger/) to enable LitLogger, which logs metrics and artifacts automatically to the Lightning Experiments platform.
LOCAL_RANK: 0 - CUDA_VISIBLE_DEVICES: [0]
LOCAL_RANK: 0 - CUDA_VISIBLE_DEVICES: [0]
LOCAL_RANK: 0 - CUDA_VISIBLE_DEVICES: [0]
SLURM auto-requeueing enabled. Setting signal handlers.
SLURM auto-requeueing enabled. Setting signal handlers.
SLURM auto-requeueing enabled. Setting signal handlers.
`Trainer.fit` stopped: `max_epochs=30` reached.
`Trainer.fit` stopped: `max_epochs=30` reached.
`Trainer.fit` stopped: `max_epochs=30` reached.
[I 2026-04-15 00:55:46,484] Trial 99 finished with value: 0.1961 and parameters: {'left_wall_dist_num_layers': 3, 'left_wall_dist_activation': 'relu', 'left_wall_dist_out_channels_l0': 37, 'left_wall_dist_pool_size_l0': 8, 'left_wall_dist_out_channels_l1': 48, 'left_wall_dist_pool_size_l1': 4, 'left_wall_dist_out_channels_l2': 46, 'left_wall_dist_pool_size_l2': 8, 'left_wall_dist_fc_hidden': 33, 'track_width_num_layers': 2, 'track_width_activation': 'relu', 'track_width_out_channels_l0': 102, 'track_width_pool_size_l0': 8, 'track_width_out_channels_l1': 88, 'track_width_pool_size_l1': 8, 'track_width_fc_hidden': 38, 'heading_error_num_layers': 3, 'heading_error_activation': 'elu', 'heading_error_out_channels_l0': 63, 'heading_error_pool_size_l0': 4, 'heading_error_out_channels_l1': 55, 'heading_error_pool_size_l1': 4, 'heading_error_out_channels_l2': 89, 'heading_error_pool_size_l2': 4, 'heading_error_fc_hidden': 94}. Best is trial 22 with value: 0.0946.
[rank: 0] Seed set to 42
[rank: 0] Seed set to 42
[rank: 0] Seed set to 42
GPU available: True (cuda), used: True
TPU available: False, using: 0 TPU cores
💡 Tip: For seamless cloud logging and experiment tracking, try installing [litlogger](https://pypi.org/project/litlogger/) to enable LitLogger, which logs metrics and artifacts automatically to the Lightning Experiments platform.
GPU available: True (cuda), used: True
TPU available: False, using: 0 TPU cores
💡 Tip: For seamless cloud logging and experiment tracking, try installing [litlogger](https://pypi.org/project/litlogger/) to enable LitLogger, which logs metrics and artifacts automatically to the Lightning Experiments platform.
GPU available: True (cuda), used: True
TPU available: False, using: 0 TPU cores
💡 Tip: For seamless cloud logging and experiment tracking, try installing [litlogger](https://pypi.org/project/litlogger/) to enable LitLogger, which logs metrics and artifacts automatically to the Lightning Experiments platform.
LOCAL_RANK: 0 - CUDA_VISIBLE_DEVICES: [0]
LOCAL_RANK: 0 - CUDA_VISIBLE_DEVICES: [0]
LOCAL_RANK: 0 - CUDA_VISIBLE_DEVICES: [0]
SLURM auto-requeueing enabled. Setting signal handlers.
SLURM auto-requeueing enabled. Setting signal handlers.
SLURM auto-requeueing enabled. Setting signal handlers.
`Trainer.fit` stopped: `max_epochs=30` reached.
`Trainer.fit` stopped: `max_epochs=30` reached.
`Trainer.fit` stopped: `max_epochs=30` reached.
[I 2026-04-15 00:58:31,963] Trial 100 finished with value: 0.12 and parameters: {'left_wall_dist_num_layers': 3, 'left_wall_dist_activation': 'relu', 'left_wall_dist_out_channels_l0': 99, 'left_wall_dist_pool_size_l0': 2, 'left_wall_dist_out_channels_l1': 37, 'left_wall_dist_pool_size_l1': 2, 'left_wall_dist_out_channels_l2': 49, 'left_wall_dist_pool_size_l2': 4, 'left_wall_dist_fc_hidden': 90, 'track_width_num_layers': 2, 'track_width_activation': 'relu', 'track_width_out_channels_l0': 148, 'track_width_pool_size_l0': 8, 'track_width_out_channels_l1': 74, 'track_width_pool_size_l1': 8, 'track_width_fc_hidden': 47, 'heading_error_num_layers': 3, 'heading_error_activation': 'elu', 'heading_error_out_channels_l0': 48, 'heading_error_pool_size_l0': 8, 'heading_error_out_channels_l1': 32, 'heading_error_pool_size_l1': 4, 'heading_error_out_channels_l2': 40, 'heading_error_pool_size_l2': 8}. Best is trial 22 with value: 0.0946.
[rank: 0] Seed set to 42
[rank: 0] Seed set to 42
[rank: 0] Seed set to 42
GPU available: True (cuda), used: True
TPU available: False, using: 0 TPU cores
GPU available: True (cuda), used: True
TPU available: False, using: 0 TPU cores
💡 Tip: For seamless cloud logging and experiment tracking, try installing [litlogger](https://pypi.org/project/litlogger/) to enable LitLogger, which logs metrics and artifacts automatically to the Lightning Experiments platform.
GPU available: True (cuda), used: True
TPU available: False, using: 0 TPU cores
💡 Tip: For seamless cloud logging and experiment tracking, try installing [litlogger](https://pypi.org/project/litlogger/) to enable LitLogger, which logs metrics and artifacts automatically to the Lightning Experiments platform.
💡 Tip: For seamless cloud logging and experiment tracking, try installing [litlogger](https://pypi.org/project/litlogger/) to enable LitLogger, which logs metrics and artifacts automatically to the Lightning Experiments platform.
LOCAL_RANK: 0 - CUDA_VISIBLE_DEVICES: [0]
LOCAL_RANK: 0 - CUDA_VISIBLE_DEVICES: [0]
LOCAL_RANK: 0 - CUDA_VISIBLE_DEVICES: [0]
SLURM auto-requeueing enabled. Setting signal handlers.
SLURM auto-requeueing enabled. Setting signal handlers.
SLURM auto-requeueing enabled. Setting signal handlers.
`Trainer.fit` stopped: `max_epochs=30` reached.
`Trainer.fit` stopped: `max_epochs=30` reached.
`Trainer.fit` stopped: `max_epochs=30` reached.
[I 2026-04-15 01:01:20,808] Trial 101 finished with value: 0.1096 and parameters: {'left_wall_dist_num_layers': 3, 'left_wall_dist_activation': 'relu', 'left_wall_dist_out_channels_l0': 40, 'left_wall_dist_pool_size_l0': 2, 'left_wall_dist_out_channels_l1': 49, 'left_wall_dist_pool_size_l1': 4, 'left_wall_dist_out_channels_l2': 43, 'left_wall_dist_pool_size_l2': 8, 'left_wall_dist_fc_hidden': 84, 'track_width_num_layers': 4, 'track_width_activation': 'relu', 'track_width_out_channels_l0': 91, 'track_width_pool_size_l0': 8, 'track_width_out_channels_l1': 63, 'track_width_pool_size_l1': 8, 'track_width_out_channels_l2': 250, 'track_width_pool_size_l2': 8, 'heading_error_num_layers': 3, 'heading_error_activation': 'elu', 'heading_error_out_channels_l0': 56, 'heading_error_pool_size_l0': 8, 'heading_error_out_channels_l1': 95, 'heading_error_pool_size_l1': 4, 'heading_error_out_channels_l2': 107, 'heading_error_pool_size_l2': 4, 'heading_error_fc_hidden': 70}. Best is trial 22 with value: 0.0946.
[rank: 0] Seed set to 42
[rank: 0] Seed set to 42
[rank: 0] Seed set to 42
GPU available: True (cuda), used: True
TPU available: False, using: 0 TPU cores
💡 Tip: For seamless cloud logging and experiment tracking, try installing [litlogger](https://pypi.org/project/litlogger/) to enable LitLogger, which logs metrics and artifacts automatically to the Lightning Experiments platform.
GPU available: True (cuda), used: True
TPU available: False, using: 0 TPU cores
💡 Tip: For seamless cloud logging and experiment tracking, try installing [litlogger](https://pypi.org/project/litlogger/) to enable LitLogger, which logs metrics and artifacts automatically to the Lightning Experiments platform.
GPU available: True (cuda), used: True
TPU available: False, using: 0 TPU cores
💡 Tip: For seamless cloud logging and experiment tracking, try installing [litlogger](https://pypi.org/project/litlogger/) to enable LitLogger, which logs metrics and artifacts automatically to the Lightning Experiments platform.
LOCAL_RANK: 0 - CUDA_VISIBLE_DEVICES: [0]
LOCAL_RANK: 0 - CUDA_VISIBLE_DEVICES: [0]
LOCAL_RANK: 0 - CUDA_VISIBLE_DEVICES: [0]
SLURM auto-requeueing enabled. Setting signal handlers.
SLURM auto-requeueing enabled. Setting signal handlers.
SLURM auto-requeueing enabled. Setting signal handlers.
`Trainer.fit` stopped: `max_epochs=30` reached.
`Trainer.fit` stopped: `max_epochs=30` reached.
`Trainer.fit` stopped: `max_epochs=30` reached.
[I 2026-04-15 01:04:01,862] Trial 102 finished with value: 0.1159 and parameters: {'left_wall_dist_num_layers': 3, 'left_wall_dist_activation': 'relu', 'left_wall_dist_out_channels_l0': 79, 'left_wall_dist_pool_size_l0': 2, 'left_wall_dist_out_channels_l1': 53, 'left_wall_dist_pool_size_l1': 4, 'left_wall_dist_out_channels_l2': 57, 'left_wall_dist_pool_size_l2': 8, 'left_wall_dist_fc_hidden': 94, 'track_width_num_layers': 2, 'track_width_activation': 'relu', 'track_width_out_channels_l0': 74, 'track_width_pool_size_l0': 8, 'track_width_out_channels_l1': 69, 'track_width_pool_size_l1': 2, 'track_width_fc_hidden': 72, 'heading_error_num_layers': 3, 'heading_error_activation': 'elu', 'heading_error_out_channels_l0': 96, 'heading_error_pool_size_l0': 8, 'heading_error_out_channels_l1': 173, 'heading_error_pool_size_l1': 4, 'heading_error_out_channels_l2': 92, 'heading_error_pool_size_l2': 4, 'heading_error_fc_hidden': 116}. Best is trial 22 with value: 0.0946.
[rank: 0] Seed set to 42
[rank: 0] Seed set to 42
[rank: 0] Seed set to 42
GPU available: True (cuda), used: True
TPU available: False, using: 0 TPU cores
GPU available: True (cuda), used: True
TPU available: False, using: 0 TPU cores
💡 Tip: For seamless cloud logging and experiment tracking, try installing [litlogger](https://pypi.org/project/litlogger/) to enable LitLogger, which logs metrics and artifacts automatically to the Lightning Experiments platform.
💡 Tip: For seamless cloud logging and experiment tracking, try installing [litlogger](https://pypi.org/project/litlogger/) to enable LitLogger, which logs metrics and artifacts automatically to the Lightning Experiments platform.
GPU available: True (cuda), used: True
TPU available: False, using: 0 TPU cores
💡 Tip: For seamless cloud logging and experiment tracking, try installing [litlogger](https://pypi.org/project/litlogger/) to enable LitLogger, which logs metrics and artifacts automatically to the Lightning Experiments platform.
LOCAL_RANK: 0 - CUDA_VISIBLE_DEVICES: [0]
LOCAL_RANK: 0 - CUDA_VISIBLE_DEVICES: [0]
LOCAL_RANK: 0 - CUDA_VISIBLE_DEVICES: [0]
SLURM auto-requeueing enabled. Setting signal handlers.
SLURM auto-requeueing enabled. Setting signal handlers.
SLURM auto-requeueing enabled. Setting signal handlers.
`Trainer.fit` stopped: `max_epochs=30` reached.
`Trainer.fit` stopped: `max_epochs=30` reached.
`Trainer.fit` stopped: `max_epochs=30` reached.
[I 2026-04-15 01:06:41,060] Trial 103 finished with value: 0.1359 and parameters: {'left_wall_dist_num_layers': 3, 'left_wall_dist_activation': 'relu', 'left_wall_dist_out_channels_l0': 41, 'left_wall_dist_pool_size_l0': 2, 'left_wall_dist_out_channels_l1': 35, 'left_wall_dist_pool_size_l1': 4, 'left_wall_dist_out_channels_l2': 40, 'left_wall_dist_pool_size_l2': 8, 'left_wall_dist_fc_hidden': 85, 'track_width_num_layers': 2, 'track_width_activation': 'relu', 'track_width_out_channels_l0': 59, 'track_width_pool_size_l0': 4, 'track_width_out_channels_l1': 79, 'track_width_pool_size_l1': 8, 'track_width_fc_hidden': 42, 'heading_error_num_layers': 3, 'heading_error_activation': 'elu', 'heading_error_out_channels_l0': 64, 'heading_error_pool_size_l0': 8, 'heading_error_out_channels_l1': 134, 'heading_error_pool_size_l1': 4, 'heading_error_out_channels_l2': 81, 'heading_error_pool_size_l2': 4, 'heading_error_fc_hidden': 103}. Best is trial 22 with value: 0.0946.
[rank: 0] Seed set to 42
[rank: 0] Seed set to 42
[rank: 0] Seed set to 42
GPU available: True (cuda), used: True
TPU available: False, using: 0 TPU cores
GPU available: True (cuda), used: True
TPU available: False, using: 0 TPU cores
💡 Tip: For seamless cloud logging and experiment tracking, try installing [litlogger](https://pypi.org/project/litlogger/) to enable LitLogger, which logs metrics and artifacts automatically to the Lightning Experiments platform.
💡 Tip: For seamless cloud logging and experiment tracking, try installing [litlogger](https://pypi.org/project/litlogger/) to enable LitLogger, which logs metrics and artifacts automatically to the Lightning Experiments platform.
GPU available: True (cuda), used: True
TPU available: False, using: 0 TPU cores
💡 Tip: For seamless cloud logging and experiment tracking, try installing [litlogger](https://pypi.org/project/litlogger/) to enable LitLogger, which logs metrics and artifacts automatically to the Lightning Experiments platform.
LOCAL_RANK: 0 - CUDA_VISIBLE_DEVICES: [0]
LOCAL_RANK: 0 - CUDA_VISIBLE_DEVICES: [0]
LOCAL_RANK: 0 - CUDA_VISIBLE_DEVICES: [0]
SLURM auto-requeueing enabled. Setting signal handlers.
SLURM auto-requeueing enabled. Setting signal handlers.
SLURM auto-requeueing enabled. Setting signal handlers.
`Trainer.fit` stopped: `max_epochs=30` reached.
`Trainer.fit` stopped: `max_epochs=30` reached.
`Trainer.fit` stopped: `max_epochs=30` reached.
[I 2026-04-15 01:09:25,370] Trial 104 finished with value: 0.101 and parameters: {'left_wall_dist_num_layers': 3, 'left_wall_dist_activation': 'relu', 'left_wall_dist_out_channels_l0': 66, 'left_wall_dist_pool_size_l0': 2, 'left_wall_dist_out_channels_l1': 61, 'left_wall_dist_pool_size_l1': 4, 'left_wall_dist_out_channels_l2': 85, 'left_wall_dist_pool_size_l2': 8, 'left_wall_dist_fc_hidden': 97, 'track_width_num_layers': 2, 'track_width_activation': 'relu', 'track_width_out_channels_l0': 121, 'track_width_pool_size_l0': 8, 'track_width_out_channels_l1': 66, 'track_width_pool_size_l1': 4, 'track_width_fc_hidden': 69, 'heading_error_num_layers': 3, 'heading_error_activation': 'elu', 'heading_error_out_channels_l0': 118, 'heading_error_pool_size_l0': 8, 'heading_error_out_channels_l1': 212, 'heading_error_pool_size_l1': 4, 'heading_error_out_channels_l2': 151, 'heading_error_pool_size_l2': 4, 'heading_error_fc_hidden': 97}. Best is trial 22 with value: 0.0946.
[rank: 0] Seed set to 42
[rank: 0] Seed set to 42
[rank: 0] Seed set to 42
GPU available: True (cuda), used: True
GPU available: True (cuda), used: True
TPU available: False, using: 0 TPU cores
TPU available: False, using: 0 TPU cores
💡 Tip: For seamless cloud logging and experiment tracking, try installing [litlogger](https://pypi.org/project/litlogger/) to enable LitLogger, which logs metrics and artifacts automatically to the Lightning Experiments platform.
💡 Tip: For seamless cloud logging and experiment tracking, try installing [litlogger](https://pypi.org/project/litlogger/) to enable LitLogger, which logs metrics and artifacts automatically to the Lightning Experiments platform.
GPU available: True (cuda), used: True
TPU available: False, using: 0 TPU cores
💡 Tip: For seamless cloud logging and experiment tracking, try installing [litlogger](https://pypi.org/project/litlogger/) to enable LitLogger, which logs metrics and artifacts automatically to the Lightning Experiments platform.
LOCAL_RANK: 0 - CUDA_VISIBLE_DEVICES: [0]
LOCAL_RANK: 0 - CUDA_VISIBLE_DEVICES: [0]
LOCAL_RANK: 0 - CUDA_VISIBLE_DEVICES: [0]
SLURM auto-requeueing enabled. Setting signal handlers.
SLURM auto-requeueing enabled. Setting signal handlers.
SLURM auto-requeueing enabled. Setting signal handlers.
`Trainer.fit` stopped: `max_epochs=30` reached.
`Trainer.fit` stopped: `max_epochs=30` reached.
`Trainer.fit` stopped: `max_epochs=30` reached.
[I 2026-04-15 01:12:07,487] Trial 105 finished with value: 0.1107 and parameters: {'left_wall_dist_num_layers': 3, 'left_wall_dist_activation': 'relu', 'left_wall_dist_out_channels_l0': 66, 'left_wall_dist_pool_size_l0': 2, 'left_wall_dist_out_channels_l1': 44, 'left_wall_dist_pool_size_l1': 4, 'left_wall_dist_out_channels_l2': 72, 'left_wall_dist_pool_size_l2': 8, 'left_wall_dist_fc_hidden': 98, 'track_width_num_layers': 2, 'track_width_activation': 'relu', 'track_width_out_channels_l0': 120, 'track_width_pool_size_l0': 8, 'track_width_out_channels_l1': 58, 'track_width_pool_size_l1': 8, 'track_width_fc_hidden': 69, 'heading_error_num_layers': 3, 'heading_error_activation': 'elu', 'heading_error_out_channels_l0': 118, 'heading_error_pool_size_l0': 8, 'heading_error_out_channels_l1': 201, 'heading_error_pool_size_l1': 4, 'heading_error_out_channels_l2': 148, 'heading_error_pool_size_l2': 4, 'heading_error_fc_hidden': 88}. Best is trial 22 with value: 0.0946.
[rank: 0] Seed set to 42
[rank: 0] Seed set to 42
[rank: 0] Seed set to 42
GPU available: True (cuda), used: True
TPU available: False, using: 0 TPU cores
💡 Tip: For seamless cloud logging and experiment tracking, try installing [litlogger](https://pypi.org/project/litlogger/) to enable LitLogger, which logs metrics and artifacts automatically to the Lightning Experiments platform.
GPU available: True (cuda), used: True
TPU available: False, using: 0 TPU cores
💡 Tip: For seamless cloud logging and experiment tracking, try installing [litlogger](https://pypi.org/project/litlogger/) to enable LitLogger, which logs metrics and artifacts automatically to the Lightning Experiments platform.
GPU available: True (cuda), used: True
TPU available: False, using: 0 TPU cores
💡 Tip: For seamless cloud logging and experiment tracking, try installing [litlogger](https://pypi.org/project/litlogger/) to enable LitLogger, which logs metrics and artifacts automatically to the Lightning Experiments platform.
LOCAL_RANK: 0 - CUDA_VISIBLE_DEVICES: [0]
LOCAL_RANK: 0 - CUDA_VISIBLE_DEVICES: [0]
LOCAL_RANK: 0 - CUDA_VISIBLE_DEVICES: [0]
SLURM auto-requeueing enabled. Setting signal handlers.
SLURM auto-requeueing enabled. Setting signal handlers.
SLURM auto-requeueing enabled. Setting signal handlers.
`Trainer.fit` stopped: `max_epochs=30` reached.
`Trainer.fit` stopped: `max_epochs=30` reached.
`Trainer.fit` stopped: `max_epochs=30` reached.
