[I 2026-04-12 15:10:38,792] Trial 50 finished with value: inf and parameters: {'left_wall_dist_num_layers': 4, 'left_wall_dist_activation': 'relu', 'left_wall_dist_out_channels_l0': 36, 'left_wall_dist_pool_size_l0': 2, 'left_wall_dist_out_channels_l1': 150, 'left_wall_dist_pool_size_l1': 4, 'left_wall_dist_out_channels_l2': 181, 'left_wall_dist_pool_size_l2': 2, 'left_wall_dist_out_channels_l3': 63, 'left_wall_dist_pool_size_l3': 4, 'left_wall_dist_fc_hidden': 67, 'track_width_num_layers': 5, 'track_width_activation': 'elu', 'track_width_out_channels_l0': 100, 'track_width_pool_size_l0': 8, 'track_width_out_channels_l1': 60, 'track_width_pool_size_l1': 8, 'track_width_out_channels_l2': 46, 'track_width_pool_size_l2': 4, 'track_width_out_channels_l3': 176, 'track_width_pool_size_l3': 2, 'heading_error_num_layers': 3, 'heading_error_activation': 'elu', 'heading_error_out_channels_l0': 36, 'heading_error_pool_size_l0': 4, 'heading_error_out_channels_l1': 200, 'heading_error_pool_size_l1': 2, 'heading_error_out_channels_l2': 131, 'heading_error_pool_size_l2': 4, 'heading_error_fc_hidden': 87}. Best is trial 43 with value: 0.1052.
[rank: 0] Seed set to 42
[rank: 0] Seed set to 42
GPU available: True (cuda), used: True
TPU available: False, using: 0 TPU cores
💡 Tip: For seamless cloud logging and experiment tracking, try installing [litlogger](https://pypi.org/project/litlogger/) to enable LitLogger, which logs metrics and artifacts automatically to the Lightning Experiments platform.
GPU available: True (cuda), used: True
TPU available: False, using: 0 TPU cores
💡 Tip: For seamless cloud logging and experiment tracking, try installing [litlogger](https://pypi.org/project/litlogger/) to enable LitLogger, which logs metrics and artifacts automatically to the Lightning Experiments platform.
[rank: 0] Seed set to 42
GPU available: True (cuda), used: True
TPU available: False, using: 0 TPU cores
💡 Tip: For seamless cloud logging and experiment tracking, try installing [litlogger](https://pypi.org/project/litlogger/) to enable LitLogger, which logs metrics and artifacts automatically to the Lightning Experiments platform.
LOCAL_RANK: 0 - CUDA_VISIBLE_DEVICES: [0]
LOCAL_RANK: 0 - CUDA_VISIBLE_DEVICES: [0]
LOCAL_RANK: 0 - CUDA_VISIBLE_DEVICES: [0]
SLURM auto-requeueing enabled. Setting signal handlers.
SLURM auto-requeueing enabled. Setting signal handlers.
SLURM auto-requeueing enabled. Setting signal handlers.
`Trainer.fit` stopped: `max_epochs=20` reached.
`Trainer.fit` stopped: `max_epochs=20` reached.
`Trainer.fit` stopped: `max_epochs=20` reached.
[I 2026-04-12 15:12:52,910] Trial 51 finished with value: 0.1507 and parameters: {'left_wall_dist_num_layers': 4, 'left_wall_dist_activation': 'elu', 'left_wall_dist_out_channels_l0': 53, 'left_wall_dist_pool_size_l0': 8, 'left_wall_dist_out_channels_l1': 152, 'left_wall_dist_pool_size_l1': 4, 'left_wall_dist_out_channels_l2': 32, 'left_wall_dist_pool_size_l2': 4, 'left_wall_dist_out_channels_l3': 83, 'left_wall_dist_pool_size_l3': 8, 'left_wall_dist_fc_hidden': 94, 'track_width_num_layers': 4, 'track_width_activation': 'elu', 'track_width_out_channels_l0': 238, 'track_width_pool_size_l0': 4, 'track_width_out_channels_l1': 47, 'track_width_pool_size_l1': 4, 'track_width_out_channels_l2': 59, 'track_width_pool_size_l2': 4, 'track_width_out_channels_l3': 255, 'track_width_pool_size_l3': 2, 'track_width_fc_hidden': 66, 'heading_error_num_layers': 4, 'heading_error_activation': 'elu', 'heading_error_out_channels_l0': 70, 'heading_error_pool_size_l0': 2, 'heading_error_out_channels_l1': 134, 'heading_error_pool_size_l1': 8, 'heading_error_out_channels_l2': 47, 'heading_error_pool_size_l2': 2, 'heading_error_out_channels_l3': 105, 'heading_error_pool_size_l3': 2, 'heading_error_fc_hidden': 70}. Best is trial 43 with value: 0.1052.
[rank: 0] Seed set to 42
[rank: 0] Seed set to 42
[rank: 0] Seed set to 42
GPU available: True (cuda), used: True
GPU available: True (cuda), used: True
TPU available: False, using: 0 TPU cores
TPU available: False, using: 0 TPU cores
💡 Tip: For seamless cloud logging and experiment tracking, try installing [litlogger](https://pypi.org/project/litlogger/) to enable LitLogger, which logs metrics and artifacts automatically to the Lightning Experiments platform.
💡 Tip: For seamless cloud logging and experiment tracking, try installing [litlogger](https://pypi.org/project/litlogger/) to enable LitLogger, which logs metrics and artifacts automatically to the Lightning Experiments platform.
GPU available: True (cuda), used: True
TPU available: False, using: 0 TPU cores
💡 Tip: For seamless cloud logging and experiment tracking, try installing [litlogger](https://pypi.org/project/litlogger/) to enable LitLogger, which logs metrics and artifacts automatically to the Lightning Experiments platform.
LOCAL_RANK: 0 - CUDA_VISIBLE_DEVICES: [0]
LOCAL_RANK: 0 - CUDA_VISIBLE_DEVICES: [0]
LOCAL_RANK: 0 - CUDA_VISIBLE_DEVICES: [0]
SLURM auto-requeueing enabled. Setting signal handlers.
SLURM auto-requeueing enabled. Setting signal handlers.
SLURM auto-requeueing enabled. Setting signal handlers.
`Trainer.fit` stopped: `max_epochs=20` reached.
`Trainer.fit` stopped: `max_epochs=20` reached.
`Trainer.fit` stopped: `max_epochs=20` reached.
[I 2026-04-12 15:15:09,710] Trial 52 finished with value: 0.1348 and parameters: {'left_wall_dist_num_layers': 3, 'left_wall_dist_activation': 'elu', 'left_wall_dist_out_channels_l0': 251, 'left_wall_dist_pool_size_l0': 8, 'left_wall_dist_out_channels_l1': 135, 'left_wall_dist_pool_size_l1': 4, 'left_wall_dist_out_channels_l2': 217, 'left_wall_dist_pool_size_l2': 2, 'left_wall_dist_fc_hidden': 89, 'track_width_num_layers': 4, 'track_width_activation': 'elu', 'track_width_out_channels_l0': 205, 'track_width_pool_size_l0': 4, 'track_width_out_channels_l1': 47, 'track_width_pool_size_l1': 4, 'track_width_out_channels_l2': 82, 'track_width_pool_size_l2': 4, 'track_width_out_channels_l3': 222, 'track_width_pool_size_l3': 2, 'track_width_fc_hidden': 43, 'heading_error_num_layers': 4, 'heading_error_activation': 'elu', 'heading_error_out_channels_l0': 49, 'heading_error_pool_size_l0': 4, 'heading_error_out_channels_l1': 151, 'heading_error_pool_size_l1': 8, 'heading_error_out_channels_l2': 96, 'heading_error_pool_size_l2': 2, 'heading_error_out_channels_l3': 110, 'heading_error_pool_size_l3': 2, 'heading_error_fc_hidden': 75}. Best is trial 43 with value: 0.1052.
[rank: 0] Seed set to 42
[rank: 0] Seed set to 42
GPU available: True (cuda), used: True
TPU available: False, using: 0 TPU cores
💡 Tip: For seamless cloud logging and experiment tracking, try installing [litlogger](https://pypi.org/project/litlogger/) to enable LitLogger, which logs metrics and artifacts automatically to the Lightning Experiments platform.
GPU available: True (cuda), used: True
TPU available: False, using: 0 TPU cores
💡 Tip: For seamless cloud logging and experiment tracking, try installing [litlogger](https://pypi.org/project/litlogger/) to enable LitLogger, which logs metrics and artifacts automatically to the Lightning Experiments platform.
[rank: 0] Seed set to 42
GPU available: True (cuda), used: True
TPU available: False, using: 0 TPU cores
💡 Tip: For seamless cloud logging and experiment tracking, try installing [litlogger](https://pypi.org/project/litlogger/) to enable LitLogger, which logs metrics and artifacts automatically to the Lightning Experiments platform.
LOCAL_RANK: 0 - CUDA_VISIBLE_DEVICES: [0]
LOCAL_RANK: 0 - CUDA_VISIBLE_DEVICES: [0]
LOCAL_RANK: 0 - CUDA_VISIBLE_DEVICES: [0]
SLURM auto-requeueing enabled. Setting signal handlers.
SLURM auto-requeueing enabled. Setting signal handlers.
SLURM auto-requeueing enabled. Setting signal handlers.
`Trainer.fit` stopped: `max_epochs=20` reached.
`Trainer.fit` stopped: `max_epochs=20` reached.
`Trainer.fit` stopped: `max_epochs=20` reached.
[I 2026-04-12 15:17:20,477] Trial 53 finished with value: 0.1155 and parameters: {'left_wall_dist_num_layers': 2, 'left_wall_dist_activation': 'elu', 'left_wall_dist_out_channels_l0': 194, 'left_wall_dist_pool_size_l0': 8, 'left_wall_dist_out_channels_l1': 117, 'left_wall_dist_pool_size_l1': 4, 'left_wall_dist_fc_hidden': 102, 'track_width_num_layers': 4, 'track_width_activation': 'elu', 'track_width_out_channels_l0': 111, 'track_width_pool_size_l0': 4, 'track_width_out_channels_l1': 37, 'track_width_pool_size_l1': 4, 'track_width_out_channels_l2': 67, 'track_width_pool_size_l2': 4, 'track_width_out_channels_l3': 193, 'track_width_pool_size_l3': 2, 'track_width_fc_hidden': 54, 'heading_error_num_layers': 4, 'heading_error_activation': 'elu', 'heading_error_out_channels_l0': 77, 'heading_error_pool_size_l0': 2, 'heading_error_out_channels_l1': 177, 'heading_error_pool_size_l1': 8, 'heading_error_out_channels_l2': 82, 'heading_error_pool_size_l2': 2, 'heading_error_out_channels_l3': 89, 'heading_error_pool_size_l3': 2, 'heading_error_fc_hidden': 66}. Best is trial 43 with value: 0.1052.
[rank: 0] Seed set to 42
GPU available: True (cuda), used: True
TPU available: False, using: 0 TPU cores
💡 Tip: For seamless cloud logging and experiment tracking, try installing [litlogger](https://pypi.org/project/litlogger/) to enable LitLogger, which logs metrics and artifacts automatically to the Lightning Experiments platform.
[rank: 0] Seed set to 42
GPU available: True (cuda), used: True
TPU available: False, using: 0 TPU cores
💡 Tip: For seamless cloud logging and experiment tracking, try installing [litlogger](https://pypi.org/project/litlogger/) to enable LitLogger, which logs metrics and artifacts automatically to the Lightning Experiments platform.
[rank: 0] Seed set to 42
GPU available: True (cuda), used: True
TPU available: False, using: 0 TPU cores
💡 Tip: For seamless cloud logging and experiment tracking, try installing [litlogger](https://pypi.org/project/litlogger/) to enable LitLogger, which logs metrics and artifacts automatically to the Lightning Experiments platform.
LOCAL_RANK: 0 - CUDA_VISIBLE_DEVICES: [0]
LOCAL_RANK: 0 - CUDA_VISIBLE_DEVICES: [0]
LOCAL_RANK: 0 - CUDA_VISIBLE_DEVICES: [0]
SLURM auto-requeueing enabled. Setting signal handlers.
SLURM auto-requeueing enabled. Setting signal handlers.
SLURM auto-requeueing enabled. Setting signal handlers.
`Trainer.fit` stopped: `max_epochs=20` reached.
`Trainer.fit` stopped: `max_epochs=20` reached.
`Trainer.fit` stopped: `max_epochs=20` reached.
[I 2026-04-12 15:19:32,813] Trial 54 finished with value: 0.1219 and parameters: {'left_wall_dist_num_layers': 4, 'left_wall_dist_activation': 'elu', 'left_wall_dist_out_channels_l0': 47, 'left_wall_dist_pool_size_l0': 8, 'left_wall_dist_out_channels_l1': 203, 'left_wall_dist_pool_size_l1': 4, 'left_wall_dist_out_channels_l2': 81, 'left_wall_dist_pool_size_l2': 2, 'left_wall_dist_out_channels_l3': 75, 'left_wall_dist_pool_size_l3': 2, 'left_wall_dist_fc_hidden': 50, 'track_width_num_layers': 4, 'track_width_activation': 'elu', 'track_width_out_channels_l0': 74, 'track_width_pool_size_l0': 4, 'track_width_out_channels_l1': 32, 'track_width_pool_size_l1': 4, 'track_width_out_channels_l2': 57, 'track_width_pool_size_l2': 4, 'track_width_out_channels_l3': 232, 'track_width_pool_size_l3': 2, 'track_width_fc_hidden': 51, 'heading_error_num_layers': 4, 'heading_error_activation': 'elu', 'heading_error_out_channels_l0': 59, 'heading_error_pool_size_l0': 8, 'heading_error_out_channels_l1': 160, 'heading_error_pool_size_l1': 2, 'heading_error_out_channels_l2': 37, 'heading_error_pool_size_l2': 4, 'heading_error_out_channels_l3': 135, 'heading_error_pool_size_l3': 2, 'heading_error_fc_hidden': 55}. Best is trial 43 with value: 0.1052.
[rank: 0] Seed set to 42
[rank: 0] Seed set to 42
GPU available: True (cuda), used: True
TPU available: False, using: 0 TPU cores
💡 Tip: For seamless cloud logging and experiment tracking, try installing [litlogger](https://pypi.org/project/litlogger/) to enable LitLogger, which logs metrics and artifacts automatically to the Lightning Experiments platform.
GPU available: True (cuda), used: True
TPU available: False, using: 0 TPU cores
💡 Tip: For seamless cloud logging and experiment tracking, try installing [litlogger](https://pypi.org/project/litlogger/) to enable LitLogger, which logs metrics and artifacts automatically to the Lightning Experiments platform.
[rank: 0] Seed set to 42
GPU available: True (cuda), used: True
TPU available: False, using: 0 TPU cores
💡 Tip: For seamless cloud logging and experiment tracking, try installing [litlogger](https://pypi.org/project/litlogger/) to enable LitLogger, which logs metrics and artifacts automatically to the Lightning Experiments platform.
LOCAL_RANK: 0 - CUDA_VISIBLE_DEVICES: [0]
LOCAL_RANK: 0 - CUDA_VISIBLE_DEVICES: [0]
LOCAL_RANK: 0 - CUDA_VISIBLE_DEVICES: [0]
SLURM auto-requeueing enabled. Setting signal handlers.
SLURM auto-requeueing enabled. Setting signal handlers.
SLURM auto-requeueing enabled. Setting signal handlers.
`Trainer.fit` stopped: `max_epochs=20` reached.
`Trainer.fit` stopped: `max_epochs=20` reached.
[I 2026-04-12 15:21:42,837] Trial 55 finished with value: 0.1204 and parameters: {'left_wall_dist_num_layers': 2, 'left_wall_dist_activation': 'elu', 'left_wall_dist_out_channels_l0': 61, 'left_wall_dist_pool_size_l0': 8, 'left_wall_dist_out_channels_l1': 154, 'left_wall_dist_pool_size_l1': 4, 'left_wall_dist_fc_hidden': 88, 'track_width_num_layers': 4, 'track_width_activation': 'elu', 'track_width_out_channels_l0': 159, 'track_width_pool_size_l0': 4, 'track_width_out_channels_l1': 65, 'track_width_pool_size_l1': 4, 'track_width_out_channels_l2': 98, 'track_width_pool_size_l2': 4, 'track_width_out_channels_l3': 256, 'track_width_pool_size_l3': 2, 'track_width_fc_hidden': 69, 'heading_error_num_layers': 4, 'heading_error_activation': 'elu', 'heading_error_out_channels_l0': 66, 'heading_error_pool_size_l0': 4, 'heading_error_out_channels_l1': 230, 'heading_error_pool_size_l1': 8, 'heading_error_out_channels_l2': 167, 'heading_error_pool_size_l2': 2, 'heading_error_out_channels_l3': 73, 'heading_error_pool_size_l3': 2, 'heading_error_fc_hidden': 79}. Best is trial 43 with value: 0.1052.
[rank: 0] Seed set to 42
GPU available: True (cuda), used: True
TPU available: False, using: 0 TPU cores
💡 Tip: For seamless cloud logging and experiment tracking, try installing [litlogger](https://pypi.org/project/litlogger/) to enable LitLogger, which logs metrics and artifacts automatically to the Lightning Experiments platform.
[rank: 0] Seed set to 42
GPU available: True (cuda), used: True
TPU available: False, using: 0 TPU cores
💡 Tip: For seamless cloud logging and experiment tracking, try installing [litlogger](https://pypi.org/project/litlogger/) to enable LitLogger, which logs metrics and artifacts automatically to the Lightning Experiments platform.
[rank: 0] Seed set to 42
GPU available: True (cuda), used: True
TPU available: False, using: 0 TPU cores
💡 Tip: For seamless cloud logging and experiment tracking, try installing [litlogger](https://pypi.org/project/litlogger/) to enable LitLogger, which logs metrics and artifacts automatically to the Lightning Experiments platform.
LOCAL_RANK: 0 - CUDA_VISIBLE_DEVICES: [0]
LOCAL_RANK: 0 - CUDA_VISIBLE_DEVICES: [0]
LOCAL_RANK: 0 - CUDA_VISIBLE_DEVICES: [0]
SLURM auto-requeueing enabled. Setting signal handlers.
SLURM auto-requeueing enabled. Setting signal handlers.
SLURM auto-requeueing enabled. Setting signal handlers.
`Trainer.fit` stopped: `max_epochs=20` reached.
`Trainer.fit` stopped: `max_epochs=20` reached.
`Trainer.fit` stopped: `max_epochs=20` reached.
[I 2026-04-12 15:23:53,943] Trial 56 finished with value: 0.1116 and parameters: {'left_wall_dist_num_layers': 4, 'left_wall_dist_activation': 'elu', 'left_wall_dist_out_channels_l0': 142, 'left_wall_dist_pool_size_l0': 8, 'left_wall_dist_out_channels_l1': 81, 'left_wall_dist_pool_size_l1': 2, 'left_wall_dist_out_channels_l2': 96, 'left_wall_dist_pool_size_l2': 2, 'left_wall_dist_out_channels_l3': 122, 'left_wall_dist_pool_size_l3': 4, 'left_wall_dist_fc_hidden': 74, 'track_width_num_layers': 4, 'track_width_activation': 'elu', 'track_width_out_channels_l0': 76, 'track_width_pool_size_l0': 8, 'track_width_out_channels_l1': 55, 'track_width_pool_size_l1': 4, 'track_width_out_channels_l2': 76, 'track_width_pool_size_l2': 2, 'track_width_out_channels_l3': 35, 'track_width_pool_size_l3': 4, 'heading_error_num_layers': 4, 'heading_error_activation': 'elu', 'heading_error_out_channels_l0': 51, 'heading_error_pool_size_l0': 2, 'heading_error_out_channels_l1': 61, 'heading_error_pool_size_l1': 8, 'heading_error_out_channels_l2': 55, 'heading_error_pool_size_l2': 2, 'heading_error_out_channels_l3': 122, 'heading_error_pool_size_l3': 2, 'heading_error_fc_hidden': 59}. Best is trial 43 with value: 0.1052.
[rank: 0] Seed set to 42
GPU available: True (cuda), used: True
TPU available: False, using: 0 TPU cores
💡 Tip: For seamless cloud logging and experiment tracking, try installing [litlogger](https://pypi.org/project/litlogger/) to enable LitLogger, which logs metrics and artifacts automatically to the Lightning Experiments platform.
[rank: 0] Seed set to 42
GPU available: True (cuda), used: True
TPU available: False, using: 0 TPU cores
💡 Tip: For seamless cloud logging and experiment tracking, try installing [litlogger](https://pypi.org/project/litlogger/) to enable LitLogger, which logs metrics and artifacts automatically to the Lightning Experiments platform.
[rank: 0] Seed set to 42
GPU available: True (cuda), used: True
TPU available: False, using: 0 TPU cores
💡 Tip: For seamless cloud logging and experiment tracking, try installing [litlogger](https://pypi.org/project/litlogger/) to enable LitLogger, which logs metrics and artifacts automatically to the Lightning Experiments platform.
LOCAL_RANK: 0 - CUDA_VISIBLE_DEVICES: [0]
LOCAL_RANK: 0 - CUDA_VISIBLE_DEVICES: [0]
SLURM auto-requeueing enabled. Setting signal handlers.
LOCAL_RANK: 0 - CUDA_VISIBLE_DEVICES: [0]
SLURM auto-requeueing enabled. Setting signal handlers.
SLURM auto-requeueing enabled. Setting signal handlers.
`Trainer.fit` stopped: `max_epochs=20` reached.
`Trainer.fit` stopped: `max_epochs=20` reached.
[I 2026-04-12 15:26:03,611] Trial 57 finished with value: 0.121 and parameters: {'left_wall_dist_num_layers': 4, 'left_wall_dist_activation': 'elu', 'left_wall_dist_out_channels_l0': 98, 'left_wall_dist_pool_size_l0': 8, 'left_wall_dist_out_channels_l1': 78, 'left_wall_dist_pool_size_l1': 2, 'left_wall_dist_out_channels_l2': 59, 'left_wall_dist_pool_size_l2': 2, 'left_wall_dist_out_channels_l3': 130, 'left_wall_dist_pool_size_l3': 4, 'left_wall_dist_fc_hidden': 74, 'track_width_num_layers': 3, 'track_width_activation': 'elu', 'track_width_out_channels_l0': 66, 'track_width_pool_size_l0': 8, 'track_width_out_channels_l1': 55, 'track_width_pool_size_l1': 4, 'track_width_out_channels_l2': 112, 'track_width_pool_size_l2': 2, 'track_width_fc_hidden': 77, 'heading_error_num_layers': 4, 'heading_error_activation': 'elu', 'heading_error_out_channels_l0': 45, 'heading_error_pool_size_l0': 4, 'heading_error_out_channels_l1': 65, 'heading_error_pool_size_l1': 2, 'heading_error_out_channels_l2': 144, 'heading_error_pool_size_l2': 2, 'heading_error_out_channels_l3': 123, 'heading_error_pool_size_l3': 2, 'heading_error_fc_hidden': 64}. Best is trial 43 with value: 0.1052.
[rank: 0] Seed set to 42
[rank: 0] Seed set to 42
GPU available: True (cuda), used: True
TPU available: False, using: 0 TPU cores
💡 Tip: For seamless cloud logging and experiment tracking, try installing [litlogger](https://pypi.org/project/litlogger/) to enable LitLogger, which logs metrics and artifacts automatically to the Lightning Experiments platform.
GPU available: True (cuda), used: True
TPU available: False, using: 0 TPU cores
💡 Tip: For seamless cloud logging and experiment tracking, try installing [litlogger](https://pypi.org/project/litlogger/) to enable LitLogger, which logs metrics and artifacts automatically to the Lightning Experiments platform.
[rank: 0] Seed set to 42
GPU available: True (cuda), used: True
TPU available: False, using: 0 TPU cores
💡 Tip: For seamless cloud logging and experiment tracking, try installing [litlogger](https://pypi.org/project/litlogger/) to enable LitLogger, which logs metrics and artifacts automatically to the Lightning Experiments platform.
LOCAL_RANK: 0 - CUDA_VISIBLE_DEVICES: [0]
LOCAL_RANK: 0 - CUDA_VISIBLE_DEVICES: [0]
LOCAL_RANK: 0 - CUDA_VISIBLE_DEVICES: [0]
SLURM auto-requeueing enabled. Setting signal handlers.
SLURM auto-requeueing enabled. Setting signal handlers.
SLURM auto-requeueing enabled. Setting signal handlers.
`Trainer.fit` stopped: `max_epochs=20` reached.
`Trainer.fit` stopped: `max_epochs=20` reached.
`Trainer.fit` stopped: `max_epochs=20` reached.
