[I 2026-04-15 20:04:41,760] Trial 6 finished with value: 0.3839 and parameters: {'left_wall_dist_num_layers': 3, 'left_wall_dist_activation': 'elu', 'left_wall_dist_out_channels_l0': 89, 'left_wall_dist_pool_size_l0': 4, 'left_wall_dist_out_channels_l1': 57, 'left_wall_dist_pool_size_l1': 8, 'left_wall_dist_out_channels_l2': 47, 'left_wall_dist_pool_size_l2': 8, 'left_wall_dist_fc_hidden': 32, 'track_width_num_layers': 3, 'track_width_activation': 'relu', 'track_width_out_channels_l0': 111, 'track_width_pool_size_l0': 4, 'track_width_out_channels_l1': 58, 'track_width_pool_size_l1': 4, 'track_width_out_channels_l2': 242, 'track_width_pool_size_l2': 2, 'track_width_fc_hidden': 127, 'heading_error_num_layers': 5, 'heading_error_activation': 'elu', 'heading_error_out_channels_l0': 46, 'heading_error_pool_size_l0': 4, 'heading_error_out_channels_l1': 182, 'heading_error_pool_size_l1': 4, 'heading_error_out_channels_l2': 122, 'heading_error_pool_size_l2': 2, 'heading_error_out_channels_l3': 171, 'heading_error_pool_size_l3': 8, 'heading_error_out_channels_l4': 32, 'heading_error_pool_size_l4': 4, 'heading_error_fc_hidden': 32}. Best is trial 1 with value: 0.2569.
[rank: 0] Seed set to 42
[rank: 0] Seed set to 42
[rank: 0] Seed set to 42
GPU available: True (cuda), used: True
TPU available: False, using: 0 TPU cores
💡 Tip: For seamless cloud logging and experiment tracking, try installing [litlogger](https://pypi.org/project/litlogger/) to enable LitLogger, which logs metrics and artifacts automatically to the Lightning Experiments platform.
GPU available: True (cuda), used: True
TPU available: False, using: 0 TPU cores
GPU available: True (cuda), used: True
TPU available: False, using: 0 TPU cores
💡 Tip: For seamless cloud logging and experiment tracking, try installing [litlogger](https://pypi.org/project/litlogger/) to enable LitLogger, which logs metrics and artifacts automatically to the Lightning Experiments platform.
💡 Tip: For seamless cloud logging and experiment tracking, try installing [litlogger](https://pypi.org/project/litlogger/) to enable LitLogger, which logs metrics and artifacts automatically to the Lightning Experiments platform.
LOCAL_RANK: 0 - CUDA_VISIBLE_DEVICES: [0]
LOCAL_RANK: 0 - CUDA_VISIBLE_DEVICES: [0]
LOCAL_RANK: 0 - CUDA_VISIBLE_DEVICES: [0]
SLURM auto-requeueing enabled. Setting signal handlers.
SLURM auto-requeueing enabled. Setting signal handlers.
SLURM auto-requeueing enabled. Setting signal handlers.
`Trainer.fit` stopped: `max_epochs=30` reached.
`Trainer.fit` stopped: `max_epochs=30` reached.
`Trainer.fit` stopped: `max_epochs=30` reached.
[I 2026-04-15 20:07:27,570] Trial 7 finished with value: 0.1457 and parameters: {'left_wall_dist_num_layers': 3, 'left_wall_dist_activation': 'relu', 'left_wall_dist_out_channels_l0': 32, 'left_wall_dist_pool_size_l0': 2, 'left_wall_dist_out_channels_l1': 35, 'left_wall_dist_pool_size_l1': 4, 'left_wall_dist_out_channels_l2': 116, 'left_wall_dist_pool_size_l2': 2, 'left_wall_dist_fc_hidden': 127, 'track_width_num_layers': 3, 'track_width_activation': 'elu', 'track_width_out_channels_l0': 67, 'track_width_pool_size_l0': 4, 'track_width_out_channels_l1': 210, 'track_width_pool_size_l1': 4, 'track_width_out_channels_l2': 123, 'track_width_pool_size_l2': 4, 'track_width_fc_hidden': 80, 'heading_error_num_layers': 4, 'heading_error_activation': 'relu', 'heading_error_out_channels_l0': 45, 'heading_error_pool_size_l0': 8, 'heading_error_out_channels_l1': 164, 'heading_error_pool_size_l1': 2, 'heading_error_out_channels_l2': 221, 'heading_error_pool_size_l2': 8, 'heading_error_out_channels_l3': 88, 'heading_error_pool_size_l3': 4, 'heading_error_fc_hidden': 43}. Best is trial 7 with value: 0.1457.
[rank: 0] Seed set to 42
[rank: 0] Seed set to 42
[rank: 0] Seed set to 42
GPU available: True (cuda), used: True
TPU available: False, using: 0 TPU cores
💡 Tip: For seamless cloud logging and experiment tracking, try installing [litlogger](https://pypi.org/project/litlogger/) to enable LitLogger, which logs metrics and artifacts automatically to the Lightning Experiments platform.
GPU available: True (cuda), used: True
TPU available: False, using: 0 TPU cores
GPU available: True (cuda), used: True
TPU available: False, using: 0 TPU cores
💡 Tip: For seamless cloud logging and experiment tracking, try installing [litlogger](https://pypi.org/project/litlogger/) to enable LitLogger, which logs metrics and artifacts automatically to the Lightning Experiments platform.
💡 Tip: For seamless cloud logging and experiment tracking, try installing [litlogger](https://pypi.org/project/litlogger/) to enable LitLogger, which logs metrics and artifacts automatically to the Lightning Experiments platform.
LOCAL_RANK: 0 - CUDA_VISIBLE_DEVICES: [0]
LOCAL_RANK: 0 - CUDA_VISIBLE_DEVICES: [0]
LOCAL_RANK: 0 - CUDA_VISIBLE_DEVICES: [0]
SLURM auto-requeueing enabled. Setting signal handlers.
SLURM auto-requeueing enabled. Setting signal handlers.
SLURM auto-requeueing enabled. Setting signal handlers.
`Trainer.fit` stopped: `max_epochs=30` reached.
`Trainer.fit` stopped: `max_epochs=30` reached.
`Trainer.fit` stopped: `max_epochs=30` reached.
[I 2026-04-15 20:10:22,759] Trial 8 finished with value: 0.1734 and parameters: {'left_wall_dist_num_layers': 2, 'left_wall_dist_activation': 'elu', 'left_wall_dist_out_channels_l0': 171, 'left_wall_dist_pool_size_l0': 4, 'left_wall_dist_out_channels_l1': 43, 'left_wall_dist_pool_size_l1': 2, 'left_wall_dist_fc_hidden': 126, 'track_width_num_layers': 5, 'track_width_activation': 'elu', 'track_width_out_channels_l0': 57, 'track_width_pool_size_l0': 2, 'track_width_out_channels_l1': 83, 'track_width_pool_size_l1': 2, 'track_width_out_channels_l2': 200, 'track_width_pool_size_l2': 4, 'track_width_out_channels_l3': 212, 'track_width_pool_size_l3': 4, 'track_width_out_channels_l4': 141, 'track_width_pool_size_l4': 4, 'track_width_fc_hidden': 34, 'heading_error_num_layers': 4, 'heading_error_activation': 'relu', 'heading_error_out_channels_l0': 33, 'heading_error_pool_size_l0': 2, 'heading_error_out_channels_l1': 85, 'heading_error_pool_size_l1': 8, 'heading_error_out_channels_l2': 178, 'heading_error_pool_size_l2': 2, 'heading_error_out_channels_l3': 35, 'heading_error_pool_size_l3': 2, 'heading_error_fc_hidden': 103}. Best is trial 7 with value: 0.1457.
[rank: 0] Seed set to 42
[rank: 0] Seed set to 42
[rank: 0] Seed set to 42
GPU available: True (cuda), used: True
TPU available: False, using: 0 TPU cores
💡 Tip: For seamless cloud logging and experiment tracking, try installing [litlogger](https://pypi.org/project/litlogger/) to enable LitLogger, which logs metrics and artifacts automatically to the Lightning Experiments platform.
GPU available: True (cuda), used: True
TPU available: False, using: 0 TPU cores
💡 Tip: For seamless cloud logging and experiment tracking, try installing [litlogger](https://pypi.org/project/litlogger/) to enable LitLogger, which logs metrics and artifacts automatically to the Lightning Experiments platform.
GPU available: True (cuda), used: True
TPU available: False, using: 0 TPU cores
💡 Tip: For seamless cloud logging and experiment tracking, try installing [litlogger](https://pypi.org/project/litlogger/) to enable LitLogger, which logs metrics and artifacts automatically to the Lightning Experiments platform.
LOCAL_RANK: 0 - CUDA_VISIBLE_DEVICES: [0]
LOCAL_RANK: 0 - CUDA_VISIBLE_DEVICES: [0]
LOCAL_RANK: 0 - CUDA_VISIBLE_DEVICES: [0]
SLURM auto-requeueing enabled. Setting signal handlers.
SLURM auto-requeueing enabled. Setting signal handlers.
SLURM auto-requeueing enabled. Setting signal handlers.
`Trainer.fit` stopped: `max_epochs=30` reached.
`Trainer.fit` stopped: `max_epochs=30` reached.
`Trainer.fit` stopped: `max_epochs=30` reached.
[I 2026-04-15 20:13:18,237] Trial 9 finished with value: 0.1961 and parameters: {'left_wall_dist_num_layers': 5, 'left_wall_dist_activation': 'elu', 'left_wall_dist_out_channels_l0': 54, 'left_wall_dist_pool_size_l0': 2, 'left_wall_dist_out_channels_l1': 39, 'left_wall_dist_pool_size_l1': 2, 'left_wall_dist_out_channels_l2': 46, 'left_wall_dist_pool_size_l2': 2, 'left_wall_dist_out_channels_l3': 197, 'left_wall_dist_pool_size_l3': 2, 'left_wall_dist_out_channels_l4': 47, 'left_wall_dist_pool_size_l4': 2, 'left_wall_dist_fc_hidden': 33, 'track_width_num_layers': 3, 'track_width_activation': 'elu', 'track_width_out_channels_l0': 62, 'track_width_pool_size_l0': 4, 'track_width_out_channels_l1': 32, 'track_width_pool_size_l1': 2, 'track_width_out_channels_l2': 105, 'track_width_pool_size_l2': 2, 'track_width_fc_hidden': 109, 'heading_error_num_layers': 3, 'heading_error_activation': 'relu', 'heading_error_out_channels_l0': 162, 'heading_error_pool_size_l0': 4, 'heading_error_out_channels_l1': 60, 'heading_error_pool_size_l1': 2, 'heading_error_out_channels_l2': 59, 'heading_error_pool_size_l2': 2, 'heading_error_fc_hidden': 89}. Best is trial 7 with value: 0.1457.
[rank: 0] Seed set to 42
[rank: 0] Seed set to 42
[rank: 0] Seed set to 42
GPU available: True (cuda), used: True
TPU available: False, using: 0 TPU cores
💡 Tip: For seamless cloud logging and experiment tracking, try installing [litlogger](https://pypi.org/project/litlogger/) to enable LitLogger, which logs metrics and artifacts automatically to the Lightning Experiments platform.
GPU available: True (cuda), used: True
TPU available: False, using: 0 TPU cores
💡 Tip: For seamless cloud logging and experiment tracking, try installing [litlogger](https://pypi.org/project/litlogger/) to enable LitLogger, which logs metrics and artifacts automatically to the Lightning Experiments platform.
GPU available: True (cuda), used: True
TPU available: False, using: 0 TPU cores
💡 Tip: For seamless cloud logging and experiment tracking, try installing [litlogger](https://pypi.org/project/litlogger/) to enable LitLogger, which logs metrics and artifacts automatically to the Lightning Experiments platform.
LOCAL_RANK: 0 - CUDA_VISIBLE_DEVICES: [0]
LOCAL_RANK: 0 - CUDA_VISIBLE_DEVICES: [0]
LOCAL_RANK: 0 - CUDA_VISIBLE_DEVICES: [0]
SLURM auto-requeueing enabled. Setting signal handlers.
SLURM auto-requeueing enabled. Setting signal handlers.
SLURM auto-requeueing enabled. Setting signal handlers.
`Trainer.fit` stopped: `max_epochs=30` reached.
`Trainer.fit` stopped: `max_epochs=30` reached.
`Trainer.fit` stopped: `max_epochs=30` reached.
[I 2026-04-15 20:16:05,756] Trial 10 finished with value: 0.1917 and parameters: {'left_wall_dist_num_layers': 3, 'left_wall_dist_activation': 'relu', 'left_wall_dist_out_channels_l0': 250, 'left_wall_dist_pool_size_l0': 4, 'left_wall_dist_out_channels_l1': 113, 'left_wall_dist_pool_size_l1': 4, 'left_wall_dist_out_channels_l2': 248, 'left_wall_dist_pool_size_l2': 8, 'left_wall_dist_fc_hidden': 51, 'track_width_num_layers': 2, 'track_width_activation': 'elu', 'track_width_out_channels_l0': 250, 'track_width_pool_size_l0': 4, 'track_width_out_channels_l1': 139, 'track_width_pool_size_l1': 4, 'heading_error_num_layers': 2, 'heading_error_activation': 'elu', 'heading_error_out_channels_l0': 53, 'heading_error_pool_size_l0': 8, 'heading_error_out_channels_l1': 240, 'heading_error_pool_size_l1': 2}. Best is trial 7 with value: 0.1457.
[rank: 0] Seed set to 42
[rank: 0] Seed set to 42
GPU available: True (cuda), used: True
TPU available: False, using: 0 TPU cores
💡 Tip: For seamless cloud logging and experiment tracking, try installing [litlogger](https://pypi.org/project/litlogger/) to enable LitLogger, which logs metrics and artifacts automatically to the Lightning Experiments platform.
GPU available: True (cuda), used: True
TPU available: False, using: 0 TPU cores
💡 Tip: For seamless cloud logging and experiment tracking, try installing [litlogger](https://pypi.org/project/litlogger/) to enable LitLogger, which logs metrics and artifacts automatically to the Lightning Experiments platform.
[rank: 0] Seed set to 42
GPU available: True (cuda), used: True
TPU available: False, using: 0 TPU cores
💡 Tip: For seamless cloud logging and experiment tracking, try installing [litlogger](https://pypi.org/project/litlogger/) to enable LitLogger, which logs metrics and artifacts automatically to the Lightning Experiments platform.
LOCAL_RANK: 0 - CUDA_VISIBLE_DEVICES: [0]
LOCAL_RANK: 0 - CUDA_VISIBLE_DEVICES: [0]
LOCAL_RANK: 0 - CUDA_VISIBLE_DEVICES: [0]
SLURM auto-requeueing enabled. Setting signal handlers.
SLURM auto-requeueing enabled. Setting signal handlers.
SLURM auto-requeueing enabled. Setting signal handlers.
`Trainer.fit` stopped: `max_epochs=30` reached.
`Trainer.fit` stopped: `max_epochs=30` reached.
`Trainer.fit` stopped: `max_epochs=30` reached.
[I 2026-04-15 20:18:41,086] Trial 11 finished with value: 0.213 and parameters: {'left_wall_dist_num_layers': 2, 'left_wall_dist_activation': 'elu', 'left_wall_dist_out_channels_l0': 204, 'left_wall_dist_pool_size_l0': 4, 'left_wall_dist_out_channels_l1': 33, 'left_wall_dist_pool_size_l1': 2, 'left_wall_dist_fc_hidden': 124, 'track_width_num_layers': 2, 'track_width_activation': 'elu', 'track_width_out_channels_l0': 45, 'track_width_pool_size_l0': 2, 'track_width_out_channels_l1': 104, 'track_width_pool_size_l1': 2, 'heading_error_num_layers': 3, 'heading_error_activation': 'relu', 'heading_error_out_channels_l0': 32, 'heading_error_pool_size_l0': 2, 'heading_error_out_channels_l1': 74, 'heading_error_pool_size_l1': 8, 'heading_error_out_channels_l2': 256, 'heading_error_pool_size_l2': 8, 'heading_error_fc_hidden': 60}. Best is trial 7 with value: 0.1457.
[rank: 0] Seed set to 42
[rank: 0] Seed set to 42
[rank: 0] Seed set to 42
GPU available: True (cuda), used: True
TPU available: False, using: 0 TPU cores
💡 Tip: For seamless cloud logging and experiment tracking, try installing [litlogger](https://pypi.org/project/litlogger/) to enable LitLogger, which logs metrics and artifacts automatically to the Lightning Experiments platform.
GPU available: True (cuda), used: True
TPU available: False, using: 0 TPU cores
💡 Tip: For seamless cloud logging and experiment tracking, try installing [litlogger](https://pypi.org/project/litlogger/) to enable LitLogger, which logs metrics and artifacts automatically to the Lightning Experiments platform.
GPU available: True (cuda), used: True
TPU available: False, using: 0 TPU cores
💡 Tip: For seamless cloud logging and experiment tracking, try installing [litlogger](https://pypi.org/project/litlogger/) to enable LitLogger, which logs metrics and artifacts automatically to the Lightning Experiments platform.
LOCAL_RANK: 0 - CUDA_VISIBLE_DEVICES: [0]
LOCAL_RANK: 0 - CUDA_VISIBLE_DEVICES: [0]
LOCAL_RANK: 0 - CUDA_VISIBLE_DEVICES: [0]
SLURM auto-requeueing enabled. Setting signal handlers.
SLURM auto-requeueing enabled. Setting signal handlers.
SLURM auto-requeueing enabled. Setting signal handlers.
`Trainer.fit` stopped: `max_epochs=30` reached.
`Trainer.fit` stopped: `max_epochs=30` reached.
`Trainer.fit` stopped: `max_epochs=30` reached.
[I 2026-04-15 20:20:36,618] Trial 12 finished with value: 0.2196 and parameters: {'left_wall_dist_num_layers': 2, 'left_wall_dist_activation': 'elu', 'left_wall_dist_out_channels_l0': 132, 'left_wall_dist_pool_size_l0': 4, 'left_wall_dist_out_channels_l1': 40, 'left_wall_dist_pool_size_l1': 2, 'left_wall_dist_fc_hidden': 115, 'track_width_num_layers': 3, 'track_width_activation': 'elu', 'track_width_out_channels_l0': 78, 'track_width_pool_size_l0': 4, 'track_width_out_channels_l1': 88, 'track_width_pool_size_l1': 2, 'track_width_out_channels_l2': 153, 'track_width_pool_size_l2': 4, 'track_width_fc_hidden': 79, 'heading_error_num_layers': 4, 'heading_error_activation': 'relu', 'heading_error_out_channels_l0': 54, 'heading_error_pool_size_l0': 8, 'heading_error_out_channels_l1': 44, 'heading_error_pool_size_l1': 8, 'heading_error_out_channels_l2': 154, 'heading_error_pool_size_l2': 8}. Best is trial 7 with value: 0.1457.
[rank: 0] Seed set to 42
[rank: 0] Seed set to 42
GPU available: True (cuda), used: True
TPU available: False, using: 0 TPU cores
💡 Tip: For seamless cloud logging and experiment tracking, try installing [litlogger](https://pypi.org/project/litlogger/) to enable LitLogger, which logs metrics and artifacts automatically to the Lightning Experiments platform.
GPU available: True (cuda), used: True
TPU available: False, using: 0 TPU cores
💡 Tip: For seamless cloud logging and experiment tracking, try installing [litlogger](https://pypi.org/project/litlogger/) to enable LitLogger, which logs metrics and artifacts automatically to the Lightning Experiments platform.
[rank: 0] Seed set to 42
GPU available: True (cuda), used: True
TPU available: False, using: 0 TPU cores
💡 Tip: For seamless cloud logging and experiment tracking, try installing [litlogger](https://pypi.org/project/litlogger/) to enable LitLogger, which logs metrics and artifacts automatically to the Lightning Experiments platform.
LOCAL_RANK: 0 - CUDA_VISIBLE_DEVICES: [0]
LOCAL_RANK: 0 - CUDA_VISIBLE_DEVICES: [0]
SLURM auto-requeueing enabled. Setting signal handlers.
SLURM auto-requeueing enabled. Setting signal handlers.
LOCAL_RANK: 0 - CUDA_VISIBLE_DEVICES: [0]
SLURM auto-requeueing enabled. Setting signal handlers.
`Trainer.fit` stopped: `max_epochs=30` reached.
`Trainer.fit` stopped: `max_epochs=30` reached.
`Trainer.fit` stopped: `max_epochs=30` reached.
[I 2026-04-15 20:23:30,613] Trial 13 finished with value: 0.1658 and parameters: {'left_wall_dist_num_layers': 3, 'left_wall_dist_activation': 'elu', 'left_wall_dist_out_channels_l0': 185, 'left_wall_dist_pool_size_l0': 4, 'left_wall_dist_out_channels_l1': 33, 'left_wall_dist_pool_size_l1': 2, 'left_wall_dist_out_channels_l2': 212, 'left_wall_dist_pool_size_l2': 2, 'track_width_num_layers': 3, 'track_width_activation': 'elu', 'track_width_out_channels_l0': 51, 'track_width_pool_size_l0': 2, 'track_width_out_channels_l1': 240, 'track_width_pool_size_l1': 2, 'track_width_out_channels_l2': 73, 'track_width_pool_size_l2': 4, 'track_width_fc_hidden': 76, 'heading_error_num_layers': 2, 'heading_error_activation': 'relu', 'heading_error_out_channels_l0': 241, 'heading_error_pool_size_l0': 2, 'heading_error_out_channels_l1': 160, 'heading_error_pool_size_l1': 8}. Best is trial 7 with value: 0.1457.
[rank: 0] Seed set to 42
[rank: 0] Seed set to 42
[rank: 0] Seed set to 42
GPU available: True (cuda), used: True
TPU available: False, using: 0 TPU cores
💡 Tip: For seamless cloud logging and experiment tracking, try installing [litlogger](https://pypi.org/project/litlogger/) to enable LitLogger, which logs metrics and artifacts automatically to the Lightning Experiments platform.
GPU available: True (cuda), used: True
TPU available: False, using: 0 TPU cores
💡 Tip: For seamless cloud logging and experiment tracking, try installing [litlogger](https://pypi.org/project/litlogger/) to enable LitLogger, which logs metrics and artifacts automatically to the Lightning Experiments platform.
GPU available: True (cuda), used: True
TPU available: False, using: 0 TPU cores
💡 Tip: For seamless cloud logging and experiment tracking, try installing [litlogger](https://pypi.org/project/litlogger/) to enable LitLogger, which logs metrics and artifacts automatically to the Lightning Experiments platform.
LOCAL_RANK: 0 - CUDA_VISIBLE_DEVICES: [0]
LOCAL_RANK: 0 - CUDA_VISIBLE_DEVICES: [0]
LOCAL_RANK: 0 - CUDA_VISIBLE_DEVICES: [0]
SLURM auto-requeueing enabled. Setting signal handlers.
SLURM auto-requeueing enabled. Setting signal handlers.
SLURM auto-requeueing enabled. Setting signal handlers.
`Trainer.fit` stopped: `max_epochs=30` reached.
`Trainer.fit` stopped: `max_epochs=30` reached.
`Trainer.fit` stopped: `max_epochs=30` reached.
