[I 2026-05-08 18:46:06,795] Trial 33 finished with value: 0.1174 and parameters: {'optimizer': 'adam', 'left_wall_dist_num_layers': 3, 'left_wall_dist_activation': 'elu', 'left_wall_dist_fc_layers': 'fc64_32', 'left_wall_dist_pool_size_l0': 4, 'left_wall_dist_out_channels_l0': 4, 'left_wall_dist_pool_size_l1': 3, 'left_wall_dist_out_channels_l1': 8, 'left_wall_dist_pool_size_l2': 4, 'left_wall_dist_out_channels_l2': 24, 'track_width_num_layers': 2, 'track_width_activation': 'relu', 'track_width_fc_layers': 'fc128_64', 'track_width_pool_size_l0': 2, 'track_width_out_channels_l0': 8, 'track_width_pool_size_l1': 2, 'track_width_out_channels_l1': 24, 'heading_error_num_layers': 3, 'heading_error_activation': 'elu', 'heading_error_fc_layers': 'fc64', 'heading_error_pool_size_l0': 3, 'heading_error_out_channels_l0': 1, 'heading_error_pool_size_l1': 3, 'heading_error_out_channels_l1': 4, 'heading_error_pool_size_l2': 2, 'heading_error_out_channels_l2': 8}. Best is trial 24 with value: 0.0931.
[rank: 0] Seed set to 42
[rank: 0] Seed set to 42
[rank: 0] Seed set to 42
GPU available: True (cuda), used: True
TPU available: False, using: 0 TPU cores
💡 Tip: For seamless cloud logging and experiment tracking, try installing [litlogger](https://pypi.org/project/litlogger/) to enable LitLogger, which logs metrics and artifacts automatically to the Lightning Experiments platform.
GPU available: True (cuda), used: True
TPU available: False, using: 0 TPU cores
💡 Tip: For seamless cloud logging and experiment tracking, try installing [litlogger](https://pypi.org/project/litlogger/) to enable LitLogger, which logs metrics and artifacts automatically to the Lightning Experiments platform.
GPU available: True (cuda), used: True
TPU available: False, using: 0 TPU cores
💡 Tip: For seamless cloud logging and experiment tracking, try installing [litlogger](https://pypi.org/project/litlogger/) to enable LitLogger, which logs metrics and artifacts automatically to the Lightning Experiments platform.
LOCAL_RANK: 0 - CUDA_VISIBLE_DEVICES: [0]
LOCAL_RANK: 0 - CUDA_VISIBLE_DEVICES: [0]
LOCAL_RANK: 0 - CUDA_VISIBLE_DEVICES: [0]
SLURM auto-requeueing enabled. Setting signal handlers.
SLURM auto-requeueing enabled. Setting signal handlers.
SLURM auto-requeueing enabled. Setting signal handlers.
`Trainer.fit` stopped: `max_epochs=30` reached.
`Trainer.fit` stopped: `max_epochs=30` reached.
`Trainer.fit` stopped: `max_epochs=30` reached.
[I 2026-05-08 18:48:32,574] Trial 34 finished with value: 0.1034 and parameters: {'optimizer': 'adam', 'left_wall_dist_num_layers': 3, 'left_wall_dist_activation': 'elu', 'left_wall_dist_fc_layers': 'fc64_32', 'left_wall_dist_pool_size_l0': 4, 'left_wall_dist_out_channels_l0': 1, 'left_wall_dist_pool_size_l1': 3, 'left_wall_dist_out_channels_l1': 8, 'left_wall_dist_pool_size_l2': 4, 'left_wall_dist_out_channels_l2': 24, 'track_width_num_layers': 2, 'track_width_activation': 'relu', 'track_width_fc_layers': 'fc128_64', 'track_width_pool_size_l0': 2, 'track_width_out_channels_l0': 8, 'track_width_pool_size_l1': 2, 'track_width_out_channels_l1': 24, 'heading_error_num_layers': 3, 'heading_error_activation': 'elu', 'heading_error_fc_layers': 'fc64', 'heading_error_pool_size_l0': 3, 'heading_error_out_channels_l0': 1, 'heading_error_pool_size_l1': 3, 'heading_error_out_channels_l1': 4, 'heading_error_pool_size_l2': 2, 'heading_error_out_channels_l2': 8}. Best is trial 24 with value: 0.0931.
[rank: 0] Seed set to 42
[rank: 0] Seed set to 42
[rank: 0] Seed set to 42
GPU available: True (cuda), used: True
TPU available: False, using: 0 TPU cores
💡 Tip: For seamless cloud logging and experiment tracking, try installing [litlogger](https://pypi.org/project/litlogger/) to enable LitLogger, which logs metrics and artifacts automatically to the Lightning Experiments platform.
GPU available: True (cuda), used: True
TPU available: False, using: 0 TPU cores
💡 Tip: For seamless cloud logging and experiment tracking, try installing [litlogger](https://pypi.org/project/litlogger/) to enable LitLogger, which logs metrics and artifacts automatically to the Lightning Experiments platform.
GPU available: True (cuda), used: True
TPU available: False, using: 0 TPU cores
💡 Tip: For seamless cloud logging and experiment tracking, try installing [litlogger](https://pypi.org/project/litlogger/) to enable LitLogger, which logs metrics and artifacts automatically to the Lightning Experiments platform.
LOCAL_RANK: 0 - CUDA_VISIBLE_DEVICES: [0]
LOCAL_RANK: 0 - CUDA_VISIBLE_DEVICES: [0]
LOCAL_RANK: 0 - CUDA_VISIBLE_DEVICES: [0]
SLURM auto-requeueing enabled. Setting signal handlers.
SLURM auto-requeueing enabled. Setting signal handlers.
SLURM auto-requeueing enabled. Setting signal handlers.
`Trainer.fit` stopped: `max_epochs=30` reached.
`Trainer.fit` stopped: `max_epochs=30` reached.
`Trainer.fit` stopped: `max_epochs=30` reached.
[I 2026-05-08 18:50:58,127] Trial 35 finished with value: 0.123 and parameters: {'optimizer': 'adam', 'left_wall_dist_num_layers': 3, 'left_wall_dist_activation': 'elu', 'left_wall_dist_fc_layers': 'fc64_32', 'left_wall_dist_pool_size_l0': 4, 'left_wall_dist_out_channels_l0': 1, 'left_wall_dist_pool_size_l1': 3, 'left_wall_dist_out_channels_l1': 16, 'left_wall_dist_pool_size_l2': 4, 'left_wall_dist_out_channels_l2': 24, 'track_width_num_layers': 2, 'track_width_activation': 'relu', 'track_width_fc_layers': 'fc128_64', 'track_width_pool_size_l0': 2, 'track_width_out_channels_l0': 8, 'track_width_pool_size_l1': 2, 'track_width_out_channels_l1': 24, 'heading_error_num_layers': 3, 'heading_error_activation': 'elu', 'heading_error_fc_layers': 'fc64', 'heading_error_pool_size_l0': 3, 'heading_error_out_channels_l0': 1, 'heading_error_pool_size_l1': 3, 'heading_error_out_channels_l1': 4, 'heading_error_pool_size_l2': 2, 'heading_error_out_channels_l2': 8}. Best is trial 24 with value: 0.0931.
[I 2026-05-08 18:50:58,137] Trial 36 pruned. Conv channel counts must be non-decreasing.
[rank: 0] Seed set to 42
[rank: 0] Seed set to 42
[rank: 0] Seed set to 42
GPU available: True (cuda), used: True
TPU available: False, using: 0 TPU cores
💡 Tip: For seamless cloud logging and experiment tracking, try installing [litlogger](https://pypi.org/project/litlogger/) to enable LitLogger, which logs metrics and artifacts automatically to the Lightning Experiments platform.
GPU available: True (cuda), used: True
TPU available: False, using: 0 TPU cores
💡 Tip: For seamless cloud logging and experiment tracking, try installing [litlogger](https://pypi.org/project/litlogger/) to enable LitLogger, which logs metrics and artifacts automatically to the Lightning Experiments platform.
GPU available: True (cuda), used: True
TPU available: False, using: 0 TPU cores
💡 Tip: For seamless cloud logging and experiment tracking, try installing [litlogger](https://pypi.org/project/litlogger/) to enable LitLogger, which logs metrics and artifacts automatically to the Lightning Experiments platform.
LOCAL_RANK: 0 - CUDA_VISIBLE_DEVICES: [0]
LOCAL_RANK: 0 - CUDA_VISIBLE_DEVICES: [0]
LOCAL_RANK: 0 - CUDA_VISIBLE_DEVICES: [0]
SLURM auto-requeueing enabled. Setting signal handlers.
SLURM auto-requeueing enabled. Setting signal handlers.
SLURM auto-requeueing enabled. Setting signal handlers.
`Trainer.fit` stopped: `max_epochs=30` reached.
`Trainer.fit` stopped: `max_epochs=30` reached.
`Trainer.fit` stopped: `max_epochs=30` reached.
[I 2026-05-08 18:53:49,245] Trial 37 finished with value: 0.0956 and parameters: {'optimizer': 'adam', 'left_wall_dist_num_layers': 2, 'left_wall_dist_activation': 'elu', 'left_wall_dist_fc_layers': 'fc64_32', 'left_wall_dist_pool_size_l0': 4, 'left_wall_dist_out_channels_l0': 1, 'left_wall_dist_pool_size_l1': 3, 'left_wall_dist_out_channels_l1': 8, 'track_width_num_layers': 2, 'track_width_activation': 'relu', 'track_width_fc_layers': 'fc128_64', 'track_width_pool_size_l0': 2, 'track_width_out_channels_l0': 8, 'track_width_pool_size_l1': 2, 'track_width_out_channels_l1': 24, 'heading_error_num_layers': 3, 'heading_error_activation': 'elu', 'heading_error_fc_layers': 'fc64', 'heading_error_pool_size_l0': 3, 'heading_error_out_channels_l0': 1, 'heading_error_pool_size_l1': 3, 'heading_error_out_channels_l1': 4, 'heading_error_pool_size_l2': 2, 'heading_error_out_channels_l2': 8}. Best is trial 24 with value: 0.0931.
[I 2026-05-08 18:53:49,272] Trial 38 pruned. Flattened representation too small.
[rank: 0] Seed set to 42
[rank: 0] Seed set to 42
[rank: 0] Seed set to 42
GPU available: True (cuda), used: True
TPU available: False, using: 0 TPU cores
💡 Tip: For seamless cloud logging and experiment tracking, try installing [litlogger](https://pypi.org/project/litlogger/) to enable LitLogger, which logs metrics and artifacts automatically to the Lightning Experiments platform.
GPU available: True (cuda), used: True
TPU available: False, using: 0 TPU cores
💡 Tip: For seamless cloud logging and experiment tracking, try installing [litlogger](https://pypi.org/project/litlogger/) to enable LitLogger, which logs metrics and artifacts automatically to the Lightning Experiments platform.
GPU available: True (cuda), used: True
TPU available: False, using: 0 TPU cores
💡 Tip: For seamless cloud logging and experiment tracking, try installing [litlogger](https://pypi.org/project/litlogger/) to enable LitLogger, which logs metrics and artifacts automatically to the Lightning Experiments platform.
LOCAL_RANK: 0 - CUDA_VISIBLE_DEVICES: [0]
LOCAL_RANK: 0 - CUDA_VISIBLE_DEVICES: [0]
LOCAL_RANK: 0 - CUDA_VISIBLE_DEVICES: [0]
SLURM auto-requeueing enabled. Setting signal handlers.
SLURM auto-requeueing enabled. Setting signal handlers.
SLURM auto-requeueing enabled. Setting signal handlers.
`Trainer.fit` stopped: `max_epochs=30` reached.
`Trainer.fit` stopped: `max_epochs=30` reached.
`Trainer.fit` stopped: `max_epochs=30` reached.
[I 2026-05-08 18:57:08,952] Trial 39 finished with value: 0.1465 and parameters: {'optimizer': 'adamw', 'left_wall_dist_num_layers': 2, 'left_wall_dist_activation': 'elu', 'left_wall_dist_fc_layers': 'fc64_32', 'left_wall_dist_pool_size_l0': 4, 'left_wall_dist_out_channels_l0': 1, 'left_wall_dist_pool_size_l1': 3, 'left_wall_dist_out_channels_l1': 8, 'track_width_num_layers': 2, 'track_width_activation': 'relu', 'track_width_fc_layers': 'fc128', 'track_width_pool_size_l0': 4, 'track_width_out_channels_l0': 4, 'track_width_pool_size_l1': 2, 'track_width_out_channels_l1': 24, 'heading_error_num_layers': 1, 'heading_error_activation': 'elu', 'heading_error_fc_layers': 'fc64', 'heading_error_pool_size_l0': 3, 'heading_error_out_channels_l0': 8}. Best is trial 24 with value: 0.0931.
[I 2026-05-08 18:57:08,972] Trial 40 pruned. Conv channel counts must be non-decreasing.
[rank: 0] Seed set to 42
[rank: 0] Seed set to 42
[rank: 0] Seed set to 42
GPU available: True (cuda), used: True
TPU available: False, using: 0 TPU cores
💡 Tip: For seamless cloud logging and experiment tracking, try installing [litlogger](https://pypi.org/project/litlogger/) to enable LitLogger, which logs metrics and artifacts automatically to the Lightning Experiments platform.
GPU available: True (cuda), used: True
TPU available: False, using: 0 TPU cores
💡 Tip: For seamless cloud logging and experiment tracking, try installing [litlogger](https://pypi.org/project/litlogger/) to enable LitLogger, which logs metrics and artifacts automatically to the Lightning Experiments platform.
GPU available: True (cuda), used: True
TPU available: False, using: 0 TPU cores
💡 Tip: For seamless cloud logging and experiment tracking, try installing [litlogger](https://pypi.org/project/litlogger/) to enable LitLogger, which logs metrics and artifacts automatically to the Lightning Experiments platform.
LOCAL_RANK: 0 - CUDA_VISIBLE_DEVICES: [0]
LOCAL_RANK: 0 - CUDA_VISIBLE_DEVICES: [0]
LOCAL_RANK: 0 - CUDA_VISIBLE_DEVICES: [0]
SLURM auto-requeueing enabled. Setting signal handlers.
SLURM auto-requeueing enabled. Setting signal handlers.
SLURM auto-requeueing enabled. Setting signal handlers.
`Trainer.fit` stopped: `max_epochs=30` reached.
`Trainer.fit` stopped: `max_epochs=30` reached.
`Trainer.fit` stopped: `max_epochs=30` reached.
[I 2026-05-08 19:00:11,065] Trial 41 finished with value: 0.0864 and parameters: {'optimizer': 'adam', 'left_wall_dist_num_layers': 2, 'left_wall_dist_activation': 'elu', 'left_wall_dist_fc_layers': 'fc16', 'left_wall_dist_pool_size_l0': 4, 'left_wall_dist_out_channels_l0': 1, 'left_wall_dist_pool_size_l1': 3, 'left_wall_dist_out_channels_l1': 8, 'track_width_num_layers': 2, 'track_width_activation': 'relu', 'track_width_fc_layers': 'fc128_64', 'track_width_pool_size_l0': 2, 'track_width_out_channels_l0': 8, 'track_width_pool_size_l1': 2, 'track_width_out_channels_l1': 24, 'heading_error_num_layers': 3, 'heading_error_activation': 'elu', 'heading_error_fc_layers': 'fc64', 'heading_error_pool_size_l0': 3, 'heading_error_out_channels_l0': 1, 'heading_error_pool_size_l1': 3, 'heading_error_out_channels_l1': 4, 'heading_error_pool_size_l2': 2, 'heading_error_out_channels_l2': 8}. Best is trial 41 with value: 0.0864.
[rank: 0] Seed set to 42
[rank: 0] Seed set to 42
GPU available: True (cuda), used: True
TPU available: False, using: 0 TPU cores
💡 Tip: For seamless cloud logging and experiment tracking, try installing [litlogger](https://pypi.org/project/litlogger/) to enable LitLogger, which logs metrics and artifacts automatically to the Lightning Experiments platform.
[rank: 0] Seed set to 42
GPU available: True (cuda), used: True
TPU available: False, using: 0 TPU cores
💡 Tip: For seamless cloud logging and experiment tracking, try installing [litlogger](https://pypi.org/project/litlogger/) to enable LitLogger, which logs metrics and artifacts automatically to the Lightning Experiments platform.
GPU available: True (cuda), used: True
TPU available: False, using: 0 TPU cores
💡 Tip: For seamless cloud logging and experiment tracking, try installing [litlogger](https://pypi.org/project/litlogger/) to enable LitLogger, which logs metrics and artifacts automatically to the Lightning Experiments platform.
LOCAL_RANK: 0 - CUDA_VISIBLE_DEVICES: [0]
LOCAL_RANK: 0 - CUDA_VISIBLE_DEVICES: [0]
LOCAL_RANK: 0 - CUDA_VISIBLE_DEVICES: [0]
SLURM auto-requeueing enabled. Setting signal handlers.
SLURM auto-requeueing enabled. Setting signal handlers.
SLURM auto-requeueing enabled. Setting signal handlers.
`Trainer.fit` stopped: `max_epochs=30` reached.
`Trainer.fit` stopped: `max_epochs=30` reached.
`Trainer.fit` stopped: `max_epochs=30` reached.
[I 2026-05-08 19:03:24,835] Trial 42 finished with value: 0.0864 and parameters: {'optimizer': 'adam', 'left_wall_dist_num_layers': 2, 'left_wall_dist_activation': 'elu', 'left_wall_dist_fc_layers': 'fc16', 'left_wall_dist_pool_size_l0': 4, 'left_wall_dist_out_channels_l0': 1, 'left_wall_dist_pool_size_l1': 3, 'left_wall_dist_out_channels_l1': 8, 'track_width_num_layers': 2, 'track_width_activation': 'relu', 'track_width_fc_layers': 'fc128_64', 'track_width_pool_size_l0': 2, 'track_width_out_channels_l0': 8, 'track_width_pool_size_l1': 2, 'track_width_out_channels_l1': 24, 'heading_error_num_layers': 3, 'heading_error_activation': 'elu', 'heading_error_fc_layers': 'fc64', 'heading_error_pool_size_l0': 3, 'heading_error_out_channels_l0': 1, 'heading_error_pool_size_l1': 3, 'heading_error_out_channels_l1': 4, 'heading_error_pool_size_l2': 2, 'heading_error_out_channels_l2': 8}. Best is trial 41 with value: 0.0864.
[rank: 0] Seed set to 42
[rank: 0] Seed set to 42
[rank: 0] Seed set to 42
GPU available: True (cuda), used: True
TPU available: False, using: 0 TPU cores
💡 Tip: For seamless cloud logging and experiment tracking, try installing [litlogger](https://pypi.org/project/litlogger/) to enable LitLogger, which logs metrics and artifacts automatically to the Lightning Experiments platform.
GPU available: True (cuda), used: True
TPU available: False, using: 0 TPU cores
💡 Tip: For seamless cloud logging and experiment tracking, try installing [litlogger](https://pypi.org/project/litlogger/) to enable LitLogger, which logs metrics and artifacts automatically to the Lightning Experiments platform.
GPU available: True (cuda), used: True
TPU available: False, using: 0 TPU cores
💡 Tip: For seamless cloud logging and experiment tracking, try installing [litlogger](https://pypi.org/project/litlogger/) to enable LitLogger, which logs metrics and artifacts automatically to the Lightning Experiments platform.
LOCAL_RANK: 0 - CUDA_VISIBLE_DEVICES: [0]
LOCAL_RANK: 0 - CUDA_VISIBLE_DEVICES: [0]
LOCAL_RANK: 0 - CUDA_VISIBLE_DEVICES: [0]
SLURM auto-requeueing enabled. Setting signal handlers.
SLURM auto-requeueing enabled. Setting signal handlers.
SLURM auto-requeueing enabled. Setting signal handlers.
`Trainer.fit` stopped: `max_epochs=30` reached.
`Trainer.fit` stopped: `max_epochs=30` reached.
`Trainer.fit` stopped: `max_epochs=30` reached.
[I 2026-05-08 19:06:30,354] Trial 43 finished with value: 0.0835 and parameters: {'optimizer': 'adam', 'left_wall_dist_num_layers': 2, 'left_wall_dist_activation': 'elu', 'left_wall_dist_fc_layers': 'fc16', 'left_wall_dist_pool_size_l0': 4, 'left_wall_dist_out_channels_l0': 1, 'left_wall_dist_pool_size_l1': 3, 'left_wall_dist_out_channels_l1': 8, 'track_width_num_layers': 2, 'track_width_activation': 'relu', 'track_width_fc_layers': 'fc64', 'track_width_pool_size_l0': 2, 'track_width_out_channels_l0': 8, 'track_width_pool_size_l1': 2, 'track_width_out_channels_l1': 24, 'heading_error_num_layers': 3, 'heading_error_activation': 'elu', 'heading_error_fc_layers': 'fc64', 'heading_error_pool_size_l0': 3, 'heading_error_out_channels_l0': 1, 'heading_error_pool_size_l1': 3, 'heading_error_out_channels_l1': 4, 'heading_error_pool_size_l2': 2, 'heading_error_out_channels_l2': 8}. Best is trial 43 with value: 0.0835.
[I 2026-05-08 19:06:30,373] Trial 44 pruned. Conv channel counts must be non-decreasing.
[rank: 0] Seed set to 42
[rank: 0] Seed set to 42
[rank: 0] Seed set to 42
GPU available: True (cuda), used: True
TPU available: False, using: 0 TPU cores
💡 Tip: For seamless cloud logging and experiment tracking, try installing [litlogger](https://pypi.org/project/litlogger/) to enable LitLogger, which logs metrics and artifacts automatically to the Lightning Experiments platform.
GPU available: True (cuda), used: True
TPU available: False, using: 0 TPU cores
💡 Tip: For seamless cloud logging and experiment tracking, try installing [litlogger](https://pypi.org/project/litlogger/) to enable LitLogger, which logs metrics and artifacts automatically to the Lightning Experiments platform.
GPU available: True (cuda), used: True
TPU available: False, using: 0 TPU cores
💡 Tip: For seamless cloud logging and experiment tracking, try installing [litlogger](https://pypi.org/project/litlogger/) to enable LitLogger, which logs metrics and artifacts automatically to the Lightning Experiments platform.
LOCAL_RANK: 0 - CUDA_VISIBLE_DEVICES: [0]
LOCAL_RANK: 0 - CUDA_VISIBLE_DEVICES: [0]
LOCAL_RANK: 0 - CUDA_VISIBLE_DEVICES: [0]
SLURM auto-requeueing enabled. Setting signal handlers.
SLURM auto-requeueing enabled. Setting signal handlers.
SLURM auto-requeueing enabled. Setting signal handlers.
`Trainer.fit` stopped: `max_epochs=30` reached.
`Trainer.fit` stopped: `max_epochs=30` reached.
`Trainer.fit` stopped: `max_epochs=30` reached.
[I 2026-05-08 19:09:21,665] Trial 45 finished with value: 0.1617 and parameters: {'optimizer': 'adamw', 'left_wall_dist_num_layers': 2, 'left_wall_dist_activation': 'elu', 'left_wall_dist_fc_layers': 'fc16', 'left_wall_dist_pool_size_l0': 4, 'left_wall_dist_out_channels_l0': 8, 'left_wall_dist_pool_size_l1': 3, 'left_wall_dist_out_channels_l1': 32, 'track_width_num_layers': 2, 'track_width_activation': 'relu', 'track_width_fc_layers': 'fc64', 'track_width_pool_size_l0': 2, 'track_width_out_channels_l0': 8, 'track_width_pool_size_l1': 2, 'track_width_out_channels_l1': 24, 'heading_error_num_layers': 3, 'heading_error_activation': 'elu', 'heading_error_fc_layers': 'fc64', 'heading_error_pool_size_l0': 3, 'heading_error_out_channels_l0': 1, 'heading_error_pool_size_l1': 3, 'heading_error_out_channels_l1': 4, 'heading_error_pool_size_l2': 2, 'heading_error_out_channels_l2': 16}. Best is trial 43 with value: 0.0835.
[rank: 0] Seed set to 42
GPU available: True (cuda), used: True
TPU available: False, using: 0 TPU cores
💡 Tip: For seamless cloud logging and experiment tracking, try installing [litlogger](https://pypi.org/project/litlogger/) to enable LitLogger, which logs metrics and artifacts automatically to the Lightning Experiments platform.
[rank: 0] Seed set to 42
GPU available: True (cuda), used: True
TPU available: False, using: 0 TPU cores
💡 Tip: For seamless cloud logging and experiment tracking, try installing [litlogger](https://pypi.org/project/litlogger/) to enable LitLogger, which logs metrics and artifacts automatically to the Lightning Experiments platform.
[rank: 0] Seed set to 42
GPU available: True (cuda), used: True
TPU available: False, using: 0 TPU cores
💡 Tip: For seamless cloud logging and experiment tracking, try installing [litlogger](https://pypi.org/project/litlogger/) to enable LitLogger, which logs metrics and artifacts automatically to the Lightning Experiments platform.
LOCAL_RANK: 0 - CUDA_VISIBLE_DEVICES: [0]
SLURM auto-requeueing enabled. Setting signal handlers.
LOCAL_RANK: 0 - CUDA_VISIBLE_DEVICES: [0]
LOCAL_RANK: 0 - CUDA_VISIBLE_DEVICES: [0]
SLURM auto-requeueing enabled. Setting signal handlers.
SLURM auto-requeueing enabled. Setting signal handlers.
`Trainer.fit` stopped: `max_epochs=30` reached.
`Trainer.fit` stopped: `max_epochs=30` reached.
`Trainer.fit` stopped: `max_epochs=30` reached.
