[I 2026-05-04 00:54:40,799] Trial 80 finished with value: 0.114 and parameters: {'optimizer': 'adam', 'left_wall_dist_num_layers': 1, 'left_wall_dist_activation': 'relu', 'left_wall_dist_fc_layers': 'fc32', 'left_wall_dist_pool_size_l0': 4, 'left_wall_dist_out_channels_l0': 8, 'track_width_num_layers': 2, 'track_width_activation': 'relu', 'track_width_fc_layers': 'fc64_32', 'track_width_pool_size_l0': 3, 'track_width_out_channels_l0': 8, 'track_width_pool_size_l1': 4, 'track_width_out_channels_l1': 32, 'heading_error_num_layers': 3, 'heading_error_activation': 'elu', 'heading_error_fc_layers': 'fc32', 'heading_error_pool_size_l0': 2, 'heading_error_out_channels_l0': 16, 'heading_error_pool_size_l1': 2, 'heading_error_out_channels_l1': 24, 'heading_error_pool_size_l2': 3, 'heading_error_out_channels_l2': 32}. Best is trial 25 with value: 0.0902.
[rank: 0] Seed set to 42
[rank: 0] Seed set to 42
[rank: 0] Seed set to 42
GPU available: True (cuda), used: True
TPU available: False, using: 0 TPU cores
💡 Tip: For seamless cloud logging and experiment tracking, try installing [litlogger](https://pypi.org/project/litlogger/) to enable LitLogger, which logs metrics and artifacts automatically to the Lightning Experiments platform.
GPU available: True (cuda), used: True
GPU available: True (cuda), used: True
TPU available: False, using: 0 TPU cores
TPU available: False, using: 0 TPU cores
💡 Tip: For seamless cloud logging and experiment tracking, try installing [litlogger](https://pypi.org/project/litlogger/) to enable LitLogger, which logs metrics and artifacts automatically to the Lightning Experiments platform.
💡 Tip: For seamless cloud logging and experiment tracking, try installing [litlogger](https://pypi.org/project/litlogger/) to enable LitLogger, which logs metrics and artifacts automatically to the Lightning Experiments platform.
LOCAL_RANK: 0 - CUDA_VISIBLE_DEVICES: [0]
LOCAL_RANK: 0 - CUDA_VISIBLE_DEVICES: [0]
LOCAL_RANK: 0 - CUDA_VISIBLE_DEVICES: [0]
SLURM auto-requeueing enabled. Setting signal handlers.
SLURM auto-requeueing enabled. Setting signal handlers.
SLURM auto-requeueing enabled. Setting signal handlers.
`Trainer.fit` stopped: `max_epochs=30` reached.
`Trainer.fit` stopped: `max_epochs=30` reached.
`Trainer.fit` stopped: `max_epochs=30` reached.
[I 2026-05-04 00:57:02,607] Trial 81 finished with value: 0.0956 and parameters: {'optimizer': 'adam', 'left_wall_dist_num_layers': 2, 'left_wall_dist_activation': 'relu', 'left_wall_dist_fc_layers': 'fc128', 'left_wall_dist_pool_size_l0': 3, 'left_wall_dist_out_channels_l0': 4, 'left_wall_dist_pool_size_l1': 4, 'left_wall_dist_out_channels_l1': 32, 'track_width_num_layers': 1, 'track_width_activation': 'relu', 'track_width_fc_layers': 'fc128', 'track_width_pool_size_l0': 3, 'track_width_out_channels_l0': 8, 'heading_error_num_layers': 2, 'heading_error_activation': 'elu', 'heading_error_fc_layers': 'fc32', 'heading_error_pool_size_l0': 4, 'heading_error_out_channels_l0': 8, 'heading_error_pool_size_l1': 2, 'heading_error_out_channels_l1': 24}. Best is trial 25 with value: 0.0902.
[rank: 0] Seed set to 42
[rank: 0] Seed set to 42
[rank: 0] Seed set to 42
GPU available: True (cuda), used: True
GPU available: True (cuda), used: True
TPU available: False, using: 0 TPU cores
TPU available: False, using: 0 TPU cores
💡 Tip: For seamless cloud logging and experiment tracking, try installing [litlogger](https://pypi.org/project/litlogger/) to enable LitLogger, which logs metrics and artifacts automatically to the Lightning Experiments platform.
💡 Tip: For seamless cloud logging and experiment tracking, try installing [litlogger](https://pypi.org/project/litlogger/) to enable LitLogger, which logs metrics and artifacts automatically to the Lightning Experiments platform.
GPU available: True (cuda), used: True
TPU available: False, using: 0 TPU cores
💡 Tip: For seamless cloud logging and experiment tracking, try installing [litlogger](https://pypi.org/project/litlogger/) to enable LitLogger, which logs metrics and artifacts automatically to the Lightning Experiments platform.
LOCAL_RANK: 0 - CUDA_VISIBLE_DEVICES: [0]
LOCAL_RANK: 0 - CUDA_VISIBLE_DEVICES: [0]
LOCAL_RANK: 0 - CUDA_VISIBLE_DEVICES: [0]
SLURM auto-requeueing enabled. Setting signal handlers.
SLURM auto-requeueing enabled. Setting signal handlers.
SLURM auto-requeueing enabled. Setting signal handlers.
`Trainer.fit` stopped: `max_epochs=30` reached.
`Trainer.fit` stopped: `max_epochs=30` reached.
`Trainer.fit` stopped: `max_epochs=30` reached.
[I 2026-05-04 00:59:22,852] Trial 82 finished with value: 0.0949 and parameters: {'optimizer': 'adam', 'left_wall_dist_num_layers': 2, 'left_wall_dist_activation': 'relu', 'left_wall_dist_fc_layers': 'fc128', 'left_wall_dist_pool_size_l0': 3, 'left_wall_dist_out_channels_l0': 4, 'left_wall_dist_pool_size_l1': 4, 'left_wall_dist_out_channels_l1': 32, 'track_width_num_layers': 1, 'track_width_activation': 'relu', 'track_width_fc_layers': 'fc128', 'track_width_pool_size_l0': 3, 'track_width_out_channels_l0': 8, 'heading_error_num_layers': 2, 'heading_error_activation': 'elu', 'heading_error_fc_layers': 'fc32', 'heading_error_pool_size_l0': 4, 'heading_error_out_channels_l0': 8, 'heading_error_pool_size_l1': 2, 'heading_error_out_channels_l1': 24}. Best is trial 25 with value: 0.0902.
[rank: 0] Seed set to 42
[rank: 0] Seed set to 42
GPU available: True (cuda), used: True
TPU available: False, using: 0 TPU cores
GPU available: True (cuda), used: True
TPU available: False, using: 0 TPU cores
💡 Tip: For seamless cloud logging and experiment tracking, try installing [litlogger](https://pypi.org/project/litlogger/) to enable LitLogger, which logs metrics and artifacts automatically to the Lightning Experiments platform.
[rank: 0] Seed set to 42
💡 Tip: For seamless cloud logging and experiment tracking, try installing [litlogger](https://pypi.org/project/litlogger/) to enable LitLogger, which logs metrics and artifacts automatically to the Lightning Experiments platform.
GPU available: True (cuda), used: True
TPU available: False, using: 0 TPU cores
💡 Tip: For seamless cloud logging and experiment tracking, try installing [litlogger](https://pypi.org/project/litlogger/) to enable LitLogger, which logs metrics and artifacts automatically to the Lightning Experiments platform.
LOCAL_RANK: 0 - CUDA_VISIBLE_DEVICES: [0]
LOCAL_RANK: 0 - CUDA_VISIBLE_DEVICES: [0]
LOCAL_RANK: 0 - CUDA_VISIBLE_DEVICES: [0]
SLURM auto-requeueing enabled. Setting signal handlers.
SLURM auto-requeueing enabled. Setting signal handlers.
SLURM auto-requeueing enabled. Setting signal handlers.
`Trainer.fit` stopped: `max_epochs=30` reached.
`Trainer.fit` stopped: `max_epochs=30` reached.
`Trainer.fit` stopped: `max_epochs=30` reached.
[I 2026-05-04 01:01:44,915] Trial 83 finished with value: 0.0945 and parameters: {'optimizer': 'adam', 'left_wall_dist_num_layers': 2, 'left_wall_dist_activation': 'relu', 'left_wall_dist_fc_layers': 'fc128', 'left_wall_dist_pool_size_l0': 3, 'left_wall_dist_out_channels_l0': 4, 'left_wall_dist_pool_size_l1': 4, 'left_wall_dist_out_channels_l1': 32, 'track_width_num_layers': 1, 'track_width_activation': 'relu', 'track_width_fc_layers': 'fc128', 'track_width_pool_size_l0': 3, 'track_width_out_channels_l0': 8, 'heading_error_num_layers': 2, 'heading_error_activation': 'elu', 'heading_error_fc_layers': 'fc32', 'heading_error_pool_size_l0': 4, 'heading_error_out_channels_l0': 8, 'heading_error_pool_size_l1': 2, 'heading_error_out_channels_l1': 24}. Best is trial 25 with value: 0.0902.
[rank: 0] Seed set to 42
[rank: 0] Seed set to 42
GPU available: True (cuda), used: True
GPU available: True (cuda), used: True
TPU available: False, using: 0 TPU cores
TPU available: False, using: 0 TPU cores
💡 Tip: For seamless cloud logging and experiment tracking, try installing [litlogger](https://pypi.org/project/litlogger/) to enable LitLogger, which logs metrics and artifacts automatically to the Lightning Experiments platform.
💡 Tip: For seamless cloud logging and experiment tracking, try installing [litlogger](https://pypi.org/project/litlogger/) to enable LitLogger, which logs metrics and artifacts automatically to the Lightning Experiments platform.
[rank: 0] Seed set to 42
GPU available: True (cuda), used: True
TPU available: False, using: 0 TPU cores
💡 Tip: For seamless cloud logging and experiment tracking, try installing [litlogger](https://pypi.org/project/litlogger/) to enable LitLogger, which logs metrics and artifacts automatically to the Lightning Experiments platform.
LOCAL_RANK: 0 - CUDA_VISIBLE_DEVICES: [0]
LOCAL_RANK: 0 - CUDA_VISIBLE_DEVICES: [0]
LOCAL_RANK: 0 - CUDA_VISIBLE_DEVICES: [0]
SLURM auto-requeueing enabled. Setting signal handlers.
SLURM auto-requeueing enabled. Setting signal handlers.
SLURM auto-requeueing enabled. Setting signal handlers.
`Trainer.fit` stopped: `max_epochs=30` reached.
`Trainer.fit` stopped: `max_epochs=30` reached.
`Trainer.fit` stopped: `max_epochs=30` reached.
[I 2026-05-04 01:04:06,646] Trial 84 finished with value: 0.095 and parameters: {'optimizer': 'adam', 'left_wall_dist_num_layers': 2, 'left_wall_dist_activation': 'relu', 'left_wall_dist_fc_layers': 'fc128', 'left_wall_dist_pool_size_l0': 3, 'left_wall_dist_out_channels_l0': 4, 'left_wall_dist_pool_size_l1': 4, 'left_wall_dist_out_channels_l1': 32, 'track_width_num_layers': 1, 'track_width_activation': 'relu', 'track_width_fc_layers': 'fc128', 'track_width_pool_size_l0': 3, 'track_width_out_channels_l0': 8, 'heading_error_num_layers': 2, 'heading_error_activation': 'elu', 'heading_error_fc_layers': 'fc32', 'heading_error_pool_size_l0': 4, 'heading_error_out_channels_l0': 8, 'heading_error_pool_size_l1': 2, 'heading_error_out_channels_l1': 24}. Best is trial 25 with value: 0.0902.
[rank: 0] Seed set to 42
[rank: 0] Seed set to 42
[rank: 0] Seed set to 42
GPU available: True (cuda), used: True
GPU available: True (cuda), used: True
TPU available: False, using: 0 TPU cores
TPU available: False, using: 0 TPU cores
💡 Tip: For seamless cloud logging and experiment tracking, try installing [litlogger](https://pypi.org/project/litlogger/) to enable LitLogger, which logs metrics and artifacts automatically to the Lightning Experiments platform.
💡 Tip: For seamless cloud logging and experiment tracking, try installing [litlogger](https://pypi.org/project/litlogger/) to enable LitLogger, which logs metrics and artifacts automatically to the Lightning Experiments platform.
GPU available: True (cuda), used: True
TPU available: False, using: 0 TPU cores
💡 Tip: For seamless cloud logging and experiment tracking, try installing [litlogger](https://pypi.org/project/litlogger/) to enable LitLogger, which logs metrics and artifacts automatically to the Lightning Experiments platform.
LOCAL_RANK: 0 - CUDA_VISIBLE_DEVICES: [0]
LOCAL_RANK: 0 - CUDA_VISIBLE_DEVICES: [0]
LOCAL_RANK: 0 - CUDA_VISIBLE_DEVICES: [0]
SLURM auto-requeueing enabled. Setting signal handlers.
SLURM auto-requeueing enabled. Setting signal handlers.
SLURM auto-requeueing enabled. Setting signal handlers.
`Trainer.fit` stopped: `max_epochs=30` reached.
`Trainer.fit` stopped: `max_epochs=30` reached.
`Trainer.fit` stopped: `max_epochs=30` reached.
[I 2026-05-04 01:06:21,863] Trial 85 finished with value: 0.1119 and parameters: {'optimizer': 'adam', 'left_wall_dist_num_layers': 2, 'left_wall_dist_activation': 'relu', 'left_wall_dist_fc_layers': 'fc128', 'left_wall_dist_pool_size_l0': 3, 'left_wall_dist_out_channels_l0': 4, 'left_wall_dist_pool_size_l1': 4, 'left_wall_dist_out_channels_l1': 32, 'track_width_num_layers': 1, 'track_width_activation': 'relu', 'track_width_fc_layers': 'fc128', 'track_width_pool_size_l0': 3, 'track_width_out_channels_l0': 8, 'heading_error_num_layers': 1, 'heading_error_activation': 'elu', 'heading_error_fc_layers': 'fc32', 'heading_error_pool_size_l0': 3, 'heading_error_out_channels_l0': 8}. Best is trial 25 with value: 0.0902.
[rank: 0] Seed set to 42
[rank: 0] Seed set to 42
[rank: 0] Seed set to 42
GPU available: True (cuda), used: True
TPU available: False, using: 0 TPU cores
💡 Tip: For seamless cloud logging and experiment tracking, try installing [litlogger](https://pypi.org/project/litlogger/) to enable LitLogger, which logs metrics and artifacts automatically to the Lightning Experiments platform.
GPU available: True (cuda), used: True
TPU available: False, using: 0 TPU cores
💡 Tip: For seamless cloud logging and experiment tracking, try installing [litlogger](https://pypi.org/project/litlogger/) to enable LitLogger, which logs metrics and artifacts automatically to the Lightning Experiments platform.
GPU available: True (cuda), used: True
TPU available: False, using: 0 TPU cores
💡 Tip: For seamless cloud logging and experiment tracking, try installing [litlogger](https://pypi.org/project/litlogger/) to enable LitLogger, which logs metrics and artifacts automatically to the Lightning Experiments platform.
LOCAL_RANK: 0 - CUDA_VISIBLE_DEVICES: [0]
LOCAL_RANK: 0 - CUDA_VISIBLE_DEVICES: [0]
LOCAL_RANK: 0 - CUDA_VISIBLE_DEVICES: [0]
SLURM auto-requeueing enabled. Setting signal handlers.
SLURM auto-requeueing enabled. Setting signal handlers.
SLURM auto-requeueing enabled. Setting signal handlers.
`Trainer.fit` stopped: `max_epochs=30` reached.
`Trainer.fit` stopped: `max_epochs=30` reached.
`Trainer.fit` stopped: `max_epochs=30` reached.
[I 2026-05-04 01:08:47,901] Trial 86 finished with value: 0.1145 and parameters: {'optimizer': 'adam', 'left_wall_dist_num_layers': 1, 'left_wall_dist_activation': 'relu', 'left_wall_dist_fc_layers': 'fc128', 'left_wall_dist_pool_size_l0': 3, 'left_wall_dist_out_channels_l0': 1, 'track_width_num_layers': 1, 'track_width_activation': 'elu', 'track_width_fc_layers': 'fc64_32', 'track_width_pool_size_l0': 3, 'track_width_out_channels_l0': 8, 'heading_error_num_layers': 2, 'heading_error_activation': 'elu', 'heading_error_fc_layers': 'fc64_32', 'heading_error_pool_size_l0': 4, 'heading_error_out_channels_l0': 1, 'heading_error_pool_size_l1': 2, 'heading_error_out_channels_l1': 4}. Best is trial 25 with value: 0.0902.
[I 2026-05-04 01:08:47,912] Trial 87 pruned. Conv channel counts must be non-decreasing.
[I 2026-05-04 01:08:47,927] Trial 88 pruned. Flattened representation too small.
[rank: 0] Seed set to 42
[rank: 0] Seed set to 42
[rank: 0] Seed set to 42
GPU available: True (cuda), used: True
TPU available: False, using: 0 TPU cores
💡 Tip: For seamless cloud logging and experiment tracking, try installing [litlogger](https://pypi.org/project/litlogger/) to enable LitLogger, which logs metrics and artifacts automatically to the Lightning Experiments platform.
GPU available: True (cuda), used: True
TPU available: False, using: 0 TPU cores
GPU available: True (cuda), used: True
TPU available: False, using: 0 TPU cores
💡 Tip: For seamless cloud logging and experiment tracking, try installing [litlogger](https://pypi.org/project/litlogger/) to enable LitLogger, which logs metrics and artifacts automatically to the Lightning Experiments platform.
💡 Tip: For seamless cloud logging and experiment tracking, try installing [litlogger](https://pypi.org/project/litlogger/) to enable LitLogger, which logs metrics and artifacts automatically to the Lightning Experiments platform.
LOCAL_RANK: 0 - CUDA_VISIBLE_DEVICES: [0]
LOCAL_RANK: 0 - CUDA_VISIBLE_DEVICES: [0]
LOCAL_RANK: 0 - CUDA_VISIBLE_DEVICES: [0]
SLURM auto-requeueing enabled. Setting signal handlers.
SLURM auto-requeueing enabled. Setting signal handlers.
SLURM auto-requeueing enabled. Setting signal handlers.
`Trainer.fit` stopped: `max_epochs=30` reached.
`Trainer.fit` stopped: `max_epochs=30` reached.
`Trainer.fit` stopped: `max_epochs=30` reached.
[I 2026-05-04 01:11:11,175] Trial 89 finished with value: 0.1198 and parameters: {'optimizer': 'adam', 'left_wall_dist_num_layers': 2, 'left_wall_dist_activation': 'relu', 'left_wall_dist_fc_layers': 'fc128', 'left_wall_dist_pool_size_l0': 3, 'left_wall_dist_out_channels_l0': 1, 'left_wall_dist_pool_size_l1': 4, 'left_wall_dist_out_channels_l1': 32, 'track_width_num_layers': 1, 'track_width_activation': 'relu', 'track_width_fc_layers': 'fc64_32', 'track_width_pool_size_l0': 3, 'track_width_out_channels_l0': 1, 'heading_error_num_layers': 1, 'heading_error_activation': 'elu', 'heading_error_fc_layers': 'fc128_64', 'heading_error_pool_size_l0': 3, 'heading_error_out_channels_l0': 8}. Best is trial 25 with value: 0.0902.
[rank: 0] Seed set to 42
[rank: 0] Seed set to 42
[rank: 0] Seed set to 42
GPU available: True (cuda), used: True
TPU available: False, using: 0 TPU cores
💡 Tip: For seamless cloud logging and experiment tracking, try installing [litlogger](https://pypi.org/project/litlogger/) to enable LitLogger, which logs metrics and artifacts automatically to the Lightning Experiments platform.
GPU available: True (cuda), used: True
TPU available: False, using: 0 TPU cores
💡 Tip: For seamless cloud logging and experiment tracking, try installing [litlogger](https://pypi.org/project/litlogger/) to enable LitLogger, which logs metrics and artifacts automatically to the Lightning Experiments platform.
GPU available: True (cuda), used: True
TPU available: False, using: 0 TPU cores
💡 Tip: For seamless cloud logging and experiment tracking, try installing [litlogger](https://pypi.org/project/litlogger/) to enable LitLogger, which logs metrics and artifacts automatically to the Lightning Experiments platform.
LOCAL_RANK: 0 - CUDA_VISIBLE_DEVICES: [0]
LOCAL_RANK: 0 - CUDA_VISIBLE_DEVICES: [0]
LOCAL_RANK: 0 - CUDA_VISIBLE_DEVICES: [0]
SLURM auto-requeueing enabled. Setting signal handlers.
SLURM auto-requeueing enabled. Setting signal handlers.
SLURM auto-requeueing enabled. Setting signal handlers.
`Trainer.fit` stopped: `max_epochs=30` reached.
`Trainer.fit` stopped: `max_epochs=30` reached.
`Trainer.fit` stopped: `max_epochs=30` reached.
[I 2026-05-04 01:13:26,426] Trial 90 finished with value: 0.096 and parameters: {'optimizer': 'adam', 'left_wall_dist_num_layers': 1, 'left_wall_dist_activation': 'relu', 'left_wall_dist_fc_layers': 'fc64_32', 'left_wall_dist_pool_size_l0': 3, 'left_wall_dist_out_channels_l0': 1, 'track_width_num_layers': 1, 'track_width_activation': 'relu', 'track_width_fc_layers': 'fc64_32', 'track_width_pool_size_l0': 3, 'track_width_out_channels_l0': 4, 'heading_error_num_layers': 1, 'heading_error_activation': 'elu', 'heading_error_fc_layers': 'fc32', 'heading_error_pool_size_l0': 3, 'heading_error_out_channels_l0': 8}. Best is trial 25 with value: 0.0902.
[rank: 0] Seed set to 42
[rank: 0] Seed set to 42
[rank: 0] Seed set to 42
GPU available: True (cuda), used: True
TPU available: False, using: 0 TPU cores
GPU available: True (cuda), used: True
💡 Tip: For seamless cloud logging and experiment tracking, try installing [litlogger](https://pypi.org/project/litlogger/) to enable LitLogger, which logs metrics and artifacts automatically to the Lightning Experiments platform.
TPU available: False, using: 0 TPU cores
💡 Tip: For seamless cloud logging and experiment tracking, try installing [litlogger](https://pypi.org/project/litlogger/) to enable LitLogger, which logs metrics and artifacts automatically to the Lightning Experiments platform.
GPU available: True (cuda), used: True
TPU available: False, using: 0 TPU cores
💡 Tip: For seamless cloud logging and experiment tracking, try installing [litlogger](https://pypi.org/project/litlogger/) to enable LitLogger, which logs metrics and artifacts automatically to the Lightning Experiments platform.
LOCAL_RANK: 0 - CUDA_VISIBLE_DEVICES: [0]
LOCAL_RANK: 0 - CUDA_VISIBLE_DEVICES: [0]
LOCAL_RANK: 0 - CUDA_VISIBLE_DEVICES: [0]
SLURM auto-requeueing enabled. Setting signal handlers.
SLURM auto-requeueing enabled. Setting signal handlers.
SLURM auto-requeueing enabled. Setting signal handlers.
`Trainer.fit` stopped: `max_epochs=30` reached.
`Trainer.fit` stopped: `max_epochs=30` reached.
`Trainer.fit` stopped: `max_epochs=30` reached.
