[I 2026-04-12 16:54:52,562] Trial 100 finished with value: 0.1235 and parameters: {'left_wall_dist_num_layers': 2, 'left_wall_dist_activation': 'elu', 'left_wall_dist_out_channels_l0': 58, 'left_wall_dist_pool_size_l0': 8, 'left_wall_dist_out_channels_l1': 65, 'left_wall_dist_pool_size_l1': 2, 'left_wall_dist_fc_hidden': 69, 'track_width_num_layers': 4, 'track_width_activation': 'elu', 'track_width_out_channels_l0': 72, 'track_width_pool_size_l0': 8, 'track_width_out_channels_l1': 96, 'track_width_pool_size_l1': 4, 'track_width_out_channels_l2': 32, 'track_width_pool_size_l2': 4, 'track_width_out_channels_l3': 154, 'track_width_pool_size_l3': 2, 'heading_error_num_layers': 5, 'heading_error_activation': 'relu', 'heading_error_out_channels_l0': 34, 'heading_error_pool_size_l0': 2, 'heading_error_out_channels_l1': 186, 'heading_error_pool_size_l1': 4, 'heading_error_out_channels_l2': 116, 'heading_error_pool_size_l2': 2, 'heading_error_out_channels_l3': 125, 'heading_error_pool_size_l3': 4, 'heading_error_out_channels_l4': 52, 'heading_error_pool_size_l4': 2, 'heading_error_fc_hidden': 57}. Best is trial 58 with value: 0.0986.
[rank: 0] Seed set to 42
GPU available: True (cuda), used: True
TPU available: False, using: 0 TPU cores
💡 Tip: For seamless cloud logging and experiment tracking, try installing [litlogger](https://pypi.org/project/litlogger/) to enable LitLogger, which logs metrics and artifacts automatically to the Lightning Experiments platform.
[rank: 0] Seed set to 42
GPU available: True (cuda), used: True
TPU available: False, using: 0 TPU cores
💡 Tip: For seamless cloud logging and experiment tracking, try installing [litlogger](https://pypi.org/project/litlogger/) to enable LitLogger, which logs metrics and artifacts automatically to the Lightning Experiments platform.
[rank: 0] Seed set to 42
GPU available: True (cuda), used: True
TPU available: False, using: 0 TPU cores
💡 Tip: For seamless cloud logging and experiment tracking, try installing [litlogger](https://pypi.org/project/litlogger/) to enable LitLogger, which logs metrics and artifacts automatically to the Lightning Experiments platform.
LOCAL_RANK: 0 - CUDA_VISIBLE_DEVICES: [0]
LOCAL_RANK: 0 - CUDA_VISIBLE_DEVICES: [0]
LOCAL_RANK: 0 - CUDA_VISIBLE_DEVICES: [0]
SLURM auto-requeueing enabled. Setting signal handlers.
SLURM auto-requeueing enabled. Setting signal handlers.
SLURM auto-requeueing enabled. Setting signal handlers.
`Trainer.fit` stopped: `max_epochs=20` reached.
`Trainer.fit` stopped: `max_epochs=20` reached.
`Trainer.fit` stopped: `max_epochs=20` reached.
[I 2026-04-12 16:57:11,305] Trial 101 finished with value: 0.1362 and parameters: {'left_wall_dist_num_layers': 4, 'left_wall_dist_activation': 'relu', 'left_wall_dist_out_channels_l0': 55, 'left_wall_dist_pool_size_l0': 2, 'left_wall_dist_out_channels_l1': 53, 'left_wall_dist_pool_size_l1': 2, 'left_wall_dist_out_channels_l2': 97, 'left_wall_dist_pool_size_l2': 2, 'left_wall_dist_out_channels_l3': 133, 'left_wall_dist_pool_size_l3': 4, 'left_wall_dist_fc_hidden': 68, 'track_width_num_layers': 5, 'track_width_activation': 'elu', 'track_width_out_channels_l0': 62, 'track_width_pool_size_l0': 8, 'track_width_out_channels_l1': 80, 'track_width_pool_size_l1': 4, 'track_width_out_channels_l2': 34, 'track_width_pool_size_l2': 4, 'track_width_out_channels_l3': 243, 'track_width_pool_size_l3': 2, 'heading_error_num_layers': 4, 'heading_error_activation': 'elu', 'heading_error_out_channels_l0': 38, 'heading_error_pool_size_l0': 2, 'heading_error_out_channels_l1': 52, 'heading_error_pool_size_l1': 4, 'heading_error_out_channels_l2': 106, 'heading_error_pool_size_l2': 2, 'heading_error_out_channels_l3': 105, 'heading_error_pool_size_l3': 4, 'heading_error_fc_hidden': 64}. Best is trial 58 with value: 0.0986.
[rank: 0] Seed set to 42
[rank: 0] Seed set to 42
[rank: 0] Seed set to 42
GPU available: True (cuda), used: True
GPU available: True (cuda), used: True
TPU available: False, using: 0 TPU cores
TPU available: False, using: 0 TPU cores
💡 Tip: For seamless cloud logging and experiment tracking, try installing [litlogger](https://pypi.org/project/litlogger/) to enable LitLogger, which logs metrics and artifacts automatically to the Lightning Experiments platform.
💡 Tip: For seamless cloud logging and experiment tracking, try installing [litlogger](https://pypi.org/project/litlogger/) to enable LitLogger, which logs metrics and artifacts automatically to the Lightning Experiments platform.
GPU available: True (cuda), used: True
TPU available: False, using: 0 TPU cores
💡 Tip: For seamless cloud logging and experiment tracking, try installing [litlogger](https://pypi.org/project/litlogger/) to enable LitLogger, which logs metrics and artifacts automatically to the Lightning Experiments platform.
LOCAL_RANK: 0 - CUDA_VISIBLE_DEVICES: [0]
LOCAL_RANK: 0 - CUDA_VISIBLE_DEVICES: [0]
LOCAL_RANK: 0 - CUDA_VISIBLE_DEVICES: [0]
SLURM auto-requeueing enabled. Setting signal handlers.
SLURM auto-requeueing enabled. Setting signal handlers.
SLURM auto-requeueing enabled. Setting signal handlers.
`Trainer.fit` stopped: `max_epochs=20` reached.
`Trainer.fit` stopped: `max_epochs=20` reached.
`Trainer.fit` stopped: `max_epochs=20` reached.
[I 2026-04-12 16:59:28,274] Trial 102 finished with value: 0.1108 and parameters: {'left_wall_dist_num_layers': 4, 'left_wall_dist_activation': 'relu', 'left_wall_dist_out_channels_l0': 70, 'left_wall_dist_pool_size_l0': 2, 'left_wall_dist_out_channels_l1': 48, 'left_wall_dist_pool_size_l1': 2, 'left_wall_dist_out_channels_l2': 118, 'left_wall_dist_pool_size_l2': 2, 'left_wall_dist_out_channels_l3': 119, 'left_wall_dist_pool_size_l3': 4, 'left_wall_dist_fc_hidden': 63, 'track_width_num_layers': 5, 'track_width_activation': 'elu', 'track_width_out_channels_l0': 92, 'track_width_pool_size_l0': 8, 'track_width_out_channels_l1': 75, 'track_width_pool_size_l1': 4, 'track_width_out_channels_l2': 77, 'track_width_pool_size_l2': 4, 'track_width_out_channels_l3': 217, 'track_width_pool_size_l3': 2, 'track_width_fc_hidden': 36, 'heading_error_num_layers': 4, 'heading_error_activation': 'elu', 'heading_error_out_channels_l0': 42, 'heading_error_pool_size_l0': 2, 'heading_error_out_channels_l1': 38, 'heading_error_pool_size_l1': 4, 'heading_error_out_channels_l2': 122, 'heading_error_pool_size_l2': 2, 'heading_error_out_channels_l3': 144, 'heading_error_pool_size_l3': 4, 'heading_error_fc_hidden': 63}. Best is trial 58 with value: 0.0986.
[rank: 0] Seed set to 42
GPU available: True (cuda), used: True
TPU available: False, using: 0 TPU cores
💡 Tip: For seamless cloud logging and experiment tracking, try installing [litlogger](https://pypi.org/project/litlogger/) to enable LitLogger, which logs metrics and artifacts automatically to the Lightning Experiments platform.
[rank: 0] Seed set to 42
[rank: 0] Seed set to 42
GPU available: True (cuda), used: True
TPU available: False, using: 0 TPU cores
💡 Tip: For seamless cloud logging and experiment tracking, try installing [litlogger](https://pypi.org/project/litlogger/) to enable LitLogger, which logs metrics and artifacts automatically to the Lightning Experiments platform.
GPU available: True (cuda), used: True
TPU available: False, using: 0 TPU cores
💡 Tip: For seamless cloud logging and experiment tracking, try installing [litlogger](https://pypi.org/project/litlogger/) to enable LitLogger, which logs metrics and artifacts automatically to the Lightning Experiments platform.
LOCAL_RANK: 0 - CUDA_VISIBLE_DEVICES: [0]
LOCAL_RANK: 0 - CUDA_VISIBLE_DEVICES: [0]
LOCAL_RANK: 0 - CUDA_VISIBLE_DEVICES: [0]
SLURM auto-requeueing enabled. Setting signal handlers.
SLURM auto-requeueing enabled. Setting signal handlers.
SLURM auto-requeueing enabled. Setting signal handlers.
`Trainer.fit` stopped: `max_epochs=20` reached.
`Trainer.fit` stopped: `max_epochs=20` reached.
`Trainer.fit` stopped: `max_epochs=20` reached.
[I 2026-04-12 17:01:50,048] Trial 103 finished with value: 0.1124 and parameters: {'left_wall_dist_num_layers': 4, 'left_wall_dist_activation': 'relu', 'left_wall_dist_out_channels_l0': 74, 'left_wall_dist_pool_size_l0': 2, 'left_wall_dist_out_channels_l1': 59, 'left_wall_dist_pool_size_l1': 2, 'left_wall_dist_out_channels_l2': 120, 'left_wall_dist_pool_size_l2': 2, 'left_wall_dist_out_channels_l3': 121, 'left_wall_dist_pool_size_l3': 4, 'left_wall_dist_fc_hidden': 64, 'track_width_num_layers': 5, 'track_width_activation': 'elu', 'track_width_out_channels_l0': 91, 'track_width_pool_size_l0': 8, 'track_width_out_channels_l1': 74, 'track_width_pool_size_l1': 4, 'track_width_out_channels_l2': 76, 'track_width_pool_size_l2': 4, 'track_width_out_channels_l3': 195, 'track_width_pool_size_l3': 2, 'track_width_fc_hidden': 36, 'heading_error_num_layers': 4, 'heading_error_activation': 'elu', 'heading_error_out_channels_l0': 43, 'heading_error_pool_size_l0': 2, 'heading_error_out_channels_l1': 36, 'heading_error_pool_size_l1': 4, 'heading_error_out_channels_l2': 136, 'heading_error_pool_size_l2': 2, 'heading_error_out_channels_l3': 159, 'heading_error_pool_size_l3': 4, 'heading_error_fc_hidden': 61}. Best is trial 58 with value: 0.0986.
[rank: 0] Seed set to 42
GPU available: True (cuda), used: True
TPU available: False, using: 0 TPU cores
💡 Tip: For seamless cloud logging and experiment tracking, try installing [litlogger](https://pypi.org/project/litlogger/) to enable LitLogger, which logs metrics and artifacts automatically to the Lightning Experiments platform.
[rank: 0] Seed set to 42
GPU available: True (cuda), used: True
TPU available: False, using: 0 TPU cores
💡 Tip: For seamless cloud logging and experiment tracking, try installing [litlogger](https://pypi.org/project/litlogger/) to enable LitLogger, which logs metrics and artifacts automatically to the Lightning Experiments platform.
[rank: 0] Seed set to 42
GPU available: True (cuda), used: True
TPU available: False, using: 0 TPU cores
💡 Tip: For seamless cloud logging and experiment tracking, try installing [litlogger](https://pypi.org/project/litlogger/) to enable LitLogger, which logs metrics and artifacts automatically to the Lightning Experiments platform.
LOCAL_RANK: 0 - CUDA_VISIBLE_DEVICES: [0]
LOCAL_RANK: 0 - CUDA_VISIBLE_DEVICES: [0]
SLURM auto-requeueing enabled. Setting signal handlers.
LOCAL_RANK: 0 - CUDA_VISIBLE_DEVICES: [0]
SLURM auto-requeueing enabled. Setting signal handlers.
SLURM auto-requeueing enabled. Setting signal handlers.
`Trainer.fit` stopped: `max_epochs=20` reached.
`Trainer.fit` stopped: `max_epochs=20` reached.
`Trainer.fit` stopped: `max_epochs=20` reached.
[I 2026-04-12 17:04:09,601] Trial 104 finished with value: 0.1276 and parameters: {'left_wall_dist_num_layers': 4, 'left_wall_dist_activation': 'relu', 'left_wall_dist_out_channels_l0': 70, 'left_wall_dist_pool_size_l0': 2, 'left_wall_dist_out_channels_l1': 60, 'left_wall_dist_pool_size_l1': 2, 'left_wall_dist_out_channels_l2': 120, 'left_wall_dist_pool_size_l2': 2, 'left_wall_dist_out_channels_l3': 119, 'left_wall_dist_pool_size_l3': 4, 'left_wall_dist_fc_hidden': 64, 'track_width_num_layers': 5, 'track_width_activation': 'elu', 'track_width_out_channels_l0': 89, 'track_width_pool_size_l0': 8, 'track_width_out_channels_l1': 75, 'track_width_pool_size_l1': 4, 'track_width_out_channels_l2': 77, 'track_width_pool_size_l2': 4, 'track_width_out_channels_l3': 193, 'track_width_pool_size_l3': 2, 'track_width_fc_hidden': 36, 'heading_error_num_layers': 4, 'heading_error_activation': 'elu', 'heading_error_out_channels_l0': 43, 'heading_error_pool_size_l0': 2, 'heading_error_out_channels_l1': 34, 'heading_error_pool_size_l1': 4, 'heading_error_out_channels_l2': 136, 'heading_error_pool_size_l2': 2, 'heading_error_out_channels_l3': 146, 'heading_error_pool_size_l3': 4, 'heading_error_fc_hidden': 63}. Best is trial 58 with value: 0.0986.
[rank: 0] Seed set to 42
GPU available: True (cuda), used: True
TPU available: False, using: 0 TPU cores
💡 Tip: For seamless cloud logging and experiment tracking, try installing [litlogger](https://pypi.org/project/litlogger/) to enable LitLogger, which logs metrics and artifacts automatically to the Lightning Experiments platform.
[rank: 0] Seed set to 42
[rank: 0] Seed set to 42
GPU available: True (cuda), used: True
TPU available: False, using: 0 TPU cores
💡 Tip: For seamless cloud logging and experiment tracking, try installing [litlogger](https://pypi.org/project/litlogger/) to enable LitLogger, which logs metrics and artifacts automatically to the Lightning Experiments platform.
GPU available: True (cuda), used: True
TPU available: False, using: 0 TPU cores
💡 Tip: For seamless cloud logging and experiment tracking, try installing [litlogger](https://pypi.org/project/litlogger/) to enable LitLogger, which logs metrics and artifacts automatically to the Lightning Experiments platform.
LOCAL_RANK: 0 - CUDA_VISIBLE_DEVICES: [0]
LOCAL_RANK: 0 - CUDA_VISIBLE_DEVICES: [0]
LOCAL_RANK: 0 - CUDA_VISIBLE_DEVICES: [0]
SLURM auto-requeueing enabled. Setting signal handlers.
SLURM auto-requeueing enabled. Setting signal handlers.
SLURM auto-requeueing enabled. Setting signal handlers.
`Trainer.fit` stopped: `max_epochs=20` reached.
`Trainer.fit` stopped: `max_epochs=20` reached.
`Trainer.fit` stopped: `max_epochs=20` reached.
[I 2026-04-12 17:06:28,722] Trial 105 finished with value: 0.1179 and parameters: {'left_wall_dist_num_layers': 4, 'left_wall_dist_activation': 'relu', 'left_wall_dist_out_channels_l0': 64, 'left_wall_dist_pool_size_l0': 2, 'left_wall_dist_out_channels_l1': 55, 'left_wall_dist_pool_size_l1': 2, 'left_wall_dist_out_channels_l2': 138, 'left_wall_dist_pool_size_l2': 2, 'left_wall_dist_out_channels_l3': 146, 'left_wall_dist_pool_size_l3': 4, 'left_wall_dist_fc_hidden': 75, 'track_width_num_layers': 5, 'track_width_activation': 'elu', 'track_width_out_channels_l0': 85, 'track_width_pool_size_l0': 8, 'track_width_out_channels_l1': 89, 'track_width_pool_size_l1': 4, 'track_width_out_channels_l2': 96, 'track_width_pool_size_l2': 4, 'track_width_out_channels_l3': 214, 'track_width_pool_size_l3': 2, 'track_width_fc_hidden': 38, 'heading_error_num_layers': 4, 'heading_error_activation': 'elu', 'heading_error_out_channels_l0': 35, 'heading_error_pool_size_l0': 2, 'heading_error_out_channels_l1': 38, 'heading_error_pool_size_l1': 4, 'heading_error_out_channels_l2': 145, 'heading_error_pool_size_l2': 2, 'heading_error_out_channels_l3': 159, 'heading_error_pool_size_l3': 4, 'heading_error_fc_hidden': 60}. Best is trial 58 with value: 0.0986.
[rank: 0] Seed set to 42
GPU available: True (cuda), used: True
TPU available: False, using: 0 TPU cores
💡 Tip: For seamless cloud logging and experiment tracking, try installing [litlogger](https://pypi.org/project/litlogger/) to enable LitLogger, which logs metrics and artifacts automatically to the Lightning Experiments platform.
[rank: 0] Seed set to 42
[rank: 0] Seed set to 42
GPU available: True (cuda), used: True
TPU available: False, using: 0 TPU cores
💡 Tip: For seamless cloud logging and experiment tracking, try installing [litlogger](https://pypi.org/project/litlogger/) to enable LitLogger, which logs metrics and artifacts automatically to the Lightning Experiments platform.
GPU available: True (cuda), used: True
TPU available: False, using: 0 TPU cores
💡 Tip: For seamless cloud logging and experiment tracking, try installing [litlogger](https://pypi.org/project/litlogger/) to enable LitLogger, which logs metrics and artifacts automatically to the Lightning Experiments platform.
LOCAL_RANK: 0 - CUDA_VISIBLE_DEVICES: [0]
LOCAL_RANK: 0 - CUDA_VISIBLE_DEVICES: [0]
LOCAL_RANK: 0 - CUDA_VISIBLE_DEVICES: [0]
SLURM auto-requeueing enabled. Setting signal handlers.
SLURM auto-requeueing enabled. Setting signal handlers.
SLURM auto-requeueing enabled. Setting signal handlers.
`Trainer.fit` stopped: `max_epochs=20` reached.
`Trainer.fit` stopped: `max_epochs=20` reached.
`Trainer.fit` stopped: `max_epochs=20` reached.
[I 2026-04-12 17:08:45,216] Trial 106 finished with value: 0.1229 and parameters: {'left_wall_dist_num_layers': 4, 'left_wall_dist_activation': 'relu', 'left_wall_dist_out_channels_l0': 70, 'left_wall_dist_pool_size_l0': 8, 'left_wall_dist_out_channels_l1': 49, 'left_wall_dist_pool_size_l1': 2, 'left_wall_dist_out_channels_l2': 148, 'left_wall_dist_pool_size_l2': 2, 'left_wall_dist_out_channels_l3': 120, 'left_wall_dist_pool_size_l3': 4, 'left_wall_dist_fc_hidden': 87, 'track_width_num_layers': 4, 'track_width_activation': 'elu', 'track_width_out_channels_l0': 93, 'track_width_pool_size_l0': 4, 'track_width_out_channels_l1': 77, 'track_width_pool_size_l1': 4, 'track_width_out_channels_l2': 68, 'track_width_pool_size_l2': 4, 'track_width_out_channels_l3': 225, 'track_width_pool_size_l3': 2, 'track_width_fc_hidden': 43, 'heading_error_num_layers': 4, 'heading_error_activation': 'elu', 'heading_error_out_channels_l0': 41, 'heading_error_pool_size_l0': 2, 'heading_error_out_channels_l1': 45, 'heading_error_pool_size_l1': 4, 'heading_error_out_channels_l2': 122, 'heading_error_pool_size_l2': 2, 'heading_error_out_channels_l3': 165, 'heading_error_pool_size_l3': 4, 'heading_error_fc_hidden': 69}. Best is trial 58 with value: 0.0986.
[rank: 0] Seed set to 42
GPU available: True (cuda), used: True
TPU available: False, using: 0 TPU cores
💡 Tip: For seamless cloud logging and experiment tracking, try installing [litlogger](https://pypi.org/project/litlogger/) to enable LitLogger, which logs metrics and artifacts automatically to the Lightning Experiments platform.
[rank: 0] Seed set to 42
[rank: 0] Seed set to 42
GPU available: True (cuda), used: True
TPU available: False, using: 0 TPU cores
💡 Tip: For seamless cloud logging and experiment tracking, try installing [litlogger](https://pypi.org/project/litlogger/) to enable LitLogger, which logs metrics and artifacts automatically to the Lightning Experiments platform.
GPU available: True (cuda), used: True
TPU available: False, using: 0 TPU cores
💡 Tip: For seamless cloud logging and experiment tracking, try installing [litlogger](https://pypi.org/project/litlogger/) to enable LitLogger, which logs metrics and artifacts automatically to the Lightning Experiments platform.
LOCAL_RANK: 0 - CUDA_VISIBLE_DEVICES: [0]
SLURM auto-requeueing enabled. Setting signal handlers.
LOCAL_RANK: 0 - CUDA_VISIBLE_DEVICES: [0]
LOCAL_RANK: 0 - CUDA_VISIBLE_DEVICES: [0]
SLURM auto-requeueing enabled. Setting signal handlers.
SLURM auto-requeueing enabled. Setting signal handlers.
`Trainer.fit` stopped: `max_epochs=20` reached.
`Trainer.fit` stopped: `max_epochs=20` reached.
`Trainer.fit` stopped: `max_epochs=20` reached.
[I 2026-04-12 17:10:57,098] Trial 107 finished with value: 0.102 and parameters: {'left_wall_dist_num_layers': 3, 'left_wall_dist_activation': 'elu', 'left_wall_dist_out_channels_l0': 78, 'left_wall_dist_pool_size_l0': 4, 'left_wall_dist_out_channels_l1': 107, 'left_wall_dist_pool_size_l1': 2, 'left_wall_dist_out_channels_l2': 117, 'left_wall_dist_pool_size_l2': 2, 'left_wall_dist_fc_hidden': 120, 'track_width_num_layers': 5, 'track_width_activation': 'elu', 'track_width_out_channels_l0': 97, 'track_width_pool_size_l0': 8, 'track_width_out_channels_l1': 84, 'track_width_pool_size_l1': 4, 'track_width_out_channels_l2': 78, 'track_width_pool_size_l2': 4, 'track_width_out_channels_l3': 195, 'track_width_pool_size_l3': 2, 'track_width_fc_hidden': 36, 'heading_error_num_layers': 4, 'heading_error_activation': 'elu', 'heading_error_out_channels_l0': 39, 'heading_error_pool_size_l0': 2, 'heading_error_out_channels_l1': 39, 'heading_error_pool_size_l1': 4, 'heading_error_out_channels_l2': 153, 'heading_error_pool_size_l2': 4, 'heading_error_out_channels_l3': 138, 'heading_error_pool_size_l3': 4, 'heading_error_fc_hidden': 62}. Best is trial 58 with value: 0.0986.
[rank: 0] Seed set to 42
[rank: 0] Seed set to 42
[rank: 0] Seed set to 42
GPU available: True (cuda), used: True
TPU available: False, using: 0 TPU cores
💡 Tip: For seamless cloud logging and experiment tracking, try installing [litlogger](https://pypi.org/project/litlogger/) to enable LitLogger, which logs metrics and artifacts automatically to the Lightning Experiments platform.
GPU available: True (cuda), used: True
TPU available: False, using: 0 TPU cores
💡 Tip: For seamless cloud logging and experiment tracking, try installing [litlogger](https://pypi.org/project/litlogger/) to enable LitLogger, which logs metrics and artifacts automatically to the Lightning Experiments platform.
GPU available: True (cuda), used: True
TPU available: False, using: 0 TPU cores
💡 Tip: For seamless cloud logging and experiment tracking, try installing [litlogger](https://pypi.org/project/litlogger/) to enable LitLogger, which logs metrics and artifacts automatically to the Lightning Experiments platform.
LOCAL_RANK: 0 - CUDA_VISIBLE_DEVICES: [0]
LOCAL_RANK: 0 - CUDA_VISIBLE_DEVICES: [0]
LOCAL_RANK: 0 - CUDA_VISIBLE_DEVICES: [0]
SLURM auto-requeueing enabled. Setting signal handlers.
SLURM auto-requeueing enabled. Setting signal handlers.
SLURM auto-requeueing enabled. Setting signal handlers.
`Trainer.fit` stopped: `max_epochs=20` reached.
`Trainer.fit` stopped: `max_epochs=20` reached.
`Trainer.fit` stopped: `max_epochs=20` reached.
