[I 2026-04-15 22:44:50,124] Trial 40 finished with value: 0.151 and parameters: {'left_wall_dist_num_layers': 3, 'left_wall_dist_activation': 'elu', 'left_wall_dist_out_channels_l0': 120, 'left_wall_dist_pool_size_l0': 8, 'left_wall_dist_out_channels_l1': 82, 'left_wall_dist_pool_size_l1': 8, 'left_wall_dist_out_channels_l2': 125, 'left_wall_dist_pool_size_l2': 2, 'left_wall_dist_fc_hidden': 83, 'track_width_num_layers': 4, 'track_width_activation': 'relu', 'track_width_out_channels_l0': 84, 'track_width_pool_size_l0': 4, 'track_width_out_channels_l1': 106, 'track_width_pool_size_l1': 8, 'track_width_out_channels_l2': 100, 'track_width_pool_size_l2': 8, 'track_width_out_channels_l3': 108, 'track_width_pool_size_l3': 4, 'heading_error_num_layers': 4, 'heading_error_activation': 'elu', 'heading_error_out_channels_l0': 51, 'heading_error_pool_size_l0': 2, 'heading_error_out_channels_l1': 229, 'heading_error_pool_size_l1': 4, 'heading_error_out_channels_l2': 165, 'heading_error_pool_size_l2': 2, 'heading_error_out_channels_l3': 150, 'heading_error_pool_size_l3': 4, 'heading_error_fc_hidden': 92}. Best is trial 4 with value: 0.1247.
[rank: 0] Seed set to 42
GPU available: True (cuda), used: True
TPU available: False, using: 0 TPU cores
💡 Tip: For seamless cloud logging and experiment tracking, try installing [litlogger](https://pypi.org/project/litlogger/) to enable LitLogger, which logs metrics and artifacts automatically to the Lightning Experiments platform.
[rank: 0] Seed set to 42
[rank: 0] Seed set to 42
GPU available: True (cuda), used: True
TPU available: False, using: 0 TPU cores
💡 Tip: For seamless cloud logging and experiment tracking, try installing [litlogger](https://pypi.org/project/litlogger/) to enable LitLogger, which logs metrics and artifacts automatically to the Lightning Experiments platform.
GPU available: True (cuda), used: True
TPU available: False, using: 0 TPU cores
💡 Tip: For seamless cloud logging and experiment tracking, try installing [litlogger](https://pypi.org/project/litlogger/) to enable LitLogger, which logs metrics and artifacts automatically to the Lightning Experiments platform.
LOCAL_RANK: 0 - CUDA_VISIBLE_DEVICES: [0]
LOCAL_RANK: 0 - CUDA_VISIBLE_DEVICES: [0]
LOCAL_RANK: 0 - CUDA_VISIBLE_DEVICES: [0]
SLURM auto-requeueing enabled. Setting signal handlers.
SLURM auto-requeueing enabled. Setting signal handlers.
SLURM auto-requeueing enabled. Setting signal handlers.
`Trainer.fit` stopped: `max_epochs=30` reached.
`Trainer.fit` stopped: `max_epochs=30` reached.
`Trainer.fit` stopped: `max_epochs=30` reached.
[I 2026-04-15 22:47:30,002] Trial 41 finished with value: 0.1191 and parameters: {'left_wall_dist_num_layers': 4, 'left_wall_dist_activation': 'relu', 'left_wall_dist_out_channels_l0': 81, 'left_wall_dist_pool_size_l0': 2, 'left_wall_dist_out_channels_l1': 127, 'left_wall_dist_pool_size_l1': 8, 'left_wall_dist_out_channels_l2': 159, 'left_wall_dist_pool_size_l2': 8, 'left_wall_dist_out_channels_l3': 114, 'left_wall_dist_pool_size_l3': 4, 'left_wall_dist_fc_hidden': 34, 'track_width_num_layers': 2, 'track_width_activation': 'elu', 'track_width_out_channels_l0': 112, 'track_width_pool_size_l0': 8, 'track_width_out_channels_l1': 54, 'track_width_pool_size_l1': 4, 'track_width_fc_hidden': 81, 'heading_error_num_layers': 3, 'heading_error_activation': 'elu', 'heading_error_out_channels_l0': 153, 'heading_error_pool_size_l0': 8, 'heading_error_out_channels_l1': 211, 'heading_error_pool_size_l1': 2, 'heading_error_out_channels_l2': 219, 'heading_error_pool_size_l2': 2, 'heading_error_fc_hidden': 124}. Best is trial 41 with value: 0.1191.
[rank: 0] Seed set to 42
[rank: 0] Seed set to 42
GPU available: True (cuda), used: True
TPU available: False, using: 0 TPU cores
💡 Tip: For seamless cloud logging and experiment tracking, try installing [litlogger](https://pypi.org/project/litlogger/) to enable LitLogger, which logs metrics and artifacts automatically to the Lightning Experiments platform.
[rank: 0] Seed set to 42
GPU available: True (cuda), used: True
TPU available: False, using: 0 TPU cores
💡 Tip: For seamless cloud logging and experiment tracking, try installing [litlogger](https://pypi.org/project/litlogger/) to enable LitLogger, which logs metrics and artifacts automatically to the Lightning Experiments platform.
GPU available: True (cuda), used: True
TPU available: False, using: 0 TPU cores
💡 Tip: For seamless cloud logging and experiment tracking, try installing [litlogger](https://pypi.org/project/litlogger/) to enable LitLogger, which logs metrics and artifacts automatically to the Lightning Experiments platform.
LOCAL_RANK: 0 - CUDA_VISIBLE_DEVICES: [0]
LOCAL_RANK: 0 - CUDA_VISIBLE_DEVICES: [0]
LOCAL_RANK: 0 - CUDA_VISIBLE_DEVICES: [0]
SLURM auto-requeueing enabled. Setting signal handlers.
SLURM auto-requeueing enabled. Setting signal handlers.
SLURM auto-requeueing enabled. Setting signal handlers.
`Trainer.fit` stopped: `max_epochs=30` reached.
`Trainer.fit` stopped: `max_epochs=30` reached.
`Trainer.fit` stopped: `max_epochs=30` reached.
[I 2026-04-15 22:50:22,242] Trial 42 finished with value: 0.1231 and parameters: {'left_wall_dist_num_layers': 5, 'left_wall_dist_activation': 'relu', 'left_wall_dist_out_channels_l0': 69, 'left_wall_dist_pool_size_l0': 4, 'left_wall_dist_out_channels_l1': 134, 'left_wall_dist_pool_size_l1': 8, 'left_wall_dist_out_channels_l2': 154, 'left_wall_dist_pool_size_l2': 2, 'left_wall_dist_out_channels_l3': 41, 'left_wall_dist_pool_size_l3': 2, 'left_wall_dist_out_channels_l4': 91, 'left_wall_dist_pool_size_l4': 4, 'track_width_num_layers': 4, 'track_width_activation': 'elu', 'track_width_out_channels_l0': 119, 'track_width_pool_size_l0': 8, 'track_width_out_channels_l1': 52, 'track_width_pool_size_l1': 4, 'track_width_out_channels_l2': 202, 'track_width_pool_size_l2': 2, 'track_width_out_channels_l3': 37, 'track_width_pool_size_l3': 4, 'heading_error_num_layers': 3, 'heading_error_activation': 'elu', 'heading_error_out_channels_l0': 160, 'heading_error_pool_size_l0': 8, 'heading_error_out_channels_l1': 205, 'heading_error_pool_size_l1': 2, 'heading_error_out_channels_l2': 216, 'heading_error_pool_size_l2': 2, 'heading_error_fc_hidden': 125}. Best is trial 41 with value: 0.1191.
[rank: 0] Seed set to 42
[rank: 0] Seed set to 42
GPU available: True (cuda), used: True
TPU available: False, using: 0 TPU cores
💡 Tip: For seamless cloud logging and experiment tracking, try installing [litlogger](https://pypi.org/project/litlogger/) to enable LitLogger, which logs metrics and artifacts automatically to the Lightning Experiments platform.
GPU available: True (cuda), used: True
TPU available: False, using: 0 TPU cores
💡 Tip: For seamless cloud logging and experiment tracking, try installing [litlogger](https://pypi.org/project/litlogger/) to enable LitLogger, which logs metrics and artifacts automatically to the Lightning Experiments platform.
[rank: 0] Seed set to 42
GPU available: True (cuda), used: True
TPU available: False, using: 0 TPU cores
💡 Tip: For seamless cloud logging and experiment tracking, try installing [litlogger](https://pypi.org/project/litlogger/) to enable LitLogger, which logs metrics and artifacts automatically to the Lightning Experiments platform.
LOCAL_RANK: 0 - CUDA_VISIBLE_DEVICES: [0]
LOCAL_RANK: 0 - CUDA_VISIBLE_DEVICES: [0]
LOCAL_RANK: 0 - CUDA_VISIBLE_DEVICES: [0]
SLURM auto-requeueing enabled. Setting signal handlers.
SLURM auto-requeueing enabled. Setting signal handlers.
SLURM auto-requeueing enabled. Setting signal handlers.
`Trainer.fit` stopped: `max_epochs=30` reached.
`Trainer.fit` stopped: `max_epochs=30` reached.
`Trainer.fit` stopped: `max_epochs=30` reached.
[I 2026-04-15 22:53:07,135] Trial 43 finished with value: 0.1402 and parameters: {'left_wall_dist_num_layers': 5, 'left_wall_dist_activation': 'relu', 'left_wall_dist_out_channels_l0': 68, 'left_wall_dist_pool_size_l0': 2, 'left_wall_dist_out_channels_l1': 143, 'left_wall_dist_pool_size_l1': 8, 'left_wall_dist_out_channels_l2': 156, 'left_wall_dist_pool_size_l2': 8, 'left_wall_dist_out_channels_l3': 141, 'left_wall_dist_pool_size_l3': 2, 'left_wall_dist_out_channels_l4': 87, 'left_wall_dist_pool_size_l4': 4, 'left_wall_dist_fc_hidden': 33, 'track_width_num_layers': 2, 'track_width_activation': 'elu', 'track_width_out_channels_l0': 115, 'track_width_pool_size_l0': 8, 'track_width_out_channels_l1': 48, 'track_width_pool_size_l1': 4, 'track_width_fc_hidden': 89, 'heading_error_num_layers': 3, 'heading_error_activation': 'elu', 'heading_error_out_channels_l0': 165, 'heading_error_pool_size_l0': 8, 'heading_error_out_channels_l1': 203, 'heading_error_pool_size_l1': 2, 'heading_error_out_channels_l2': 214, 'heading_error_pool_size_l2': 2, 'heading_error_fc_hidden': 125}. Best is trial 41 with value: 0.1191.
[rank: 0] Seed set to 42
GPU available: True (cuda), used: True
TPU available: False, using: 0 TPU cores
💡 Tip: For seamless cloud logging and experiment tracking, try installing [litlogger](https://pypi.org/project/litlogger/) to enable LitLogger, which logs metrics and artifacts automatically to the Lightning Experiments platform.
[rank: 0] Seed set to 42
[rank: 0] Seed set to 42
GPU available: True (cuda), used: True
TPU available: False, using: 0 TPU cores
💡 Tip: For seamless cloud logging and experiment tracking, try installing [litlogger](https://pypi.org/project/litlogger/) to enable LitLogger, which logs metrics and artifacts automatically to the Lightning Experiments platform.
GPU available: True (cuda), used: True
TPU available: False, using: 0 TPU cores
💡 Tip: For seamless cloud logging and experiment tracking, try installing [litlogger](https://pypi.org/project/litlogger/) to enable LitLogger, which logs metrics and artifacts automatically to the Lightning Experiments platform.
LOCAL_RANK: 0 - CUDA_VISIBLE_DEVICES: [0]
LOCAL_RANK: 0 - CUDA_VISIBLE_DEVICES: [0]
LOCAL_RANK: 0 - CUDA_VISIBLE_DEVICES: [0]
SLURM auto-requeueing enabled. Setting signal handlers.
SLURM auto-requeueing enabled. Setting signal handlers.
SLURM auto-requeueing enabled. Setting signal handlers.
`Trainer.fit` stopped: `max_epochs=30` reached.
`Trainer.fit` stopped: `max_epochs=30` reached.
`Trainer.fit` stopped: `max_epochs=30` reached.
[I 2026-04-15 22:56:05,605] Trial 44 finished with value: 0.1453 and parameters: {'left_wall_dist_num_layers': 5, 'left_wall_dist_activation': 'relu', 'left_wall_dist_out_channels_l0': 56, 'left_wall_dist_pool_size_l0': 4, 'left_wall_dist_out_channels_l1': 127, 'left_wall_dist_pool_size_l1': 8, 'left_wall_dist_out_channels_l2': 212, 'left_wall_dist_pool_size_l2': 2, 'left_wall_dist_out_channels_l3': 32, 'left_wall_dist_pool_size_l3': 2, 'left_wall_dist_out_channels_l4': 96, 'left_wall_dist_pool_size_l4': 4, 'track_width_num_layers': 5, 'track_width_activation': 'elu', 'track_width_out_channels_l0': 143, 'track_width_pool_size_l0': 8, 'track_width_out_channels_l1': 53, 'track_width_pool_size_l1': 4, 'track_width_out_channels_l2': 214, 'track_width_pool_size_l2': 2, 'track_width_out_channels_l3': 75, 'track_width_pool_size_l3': 4, 'track_width_out_channels_l4': 33, 'track_width_pool_size_l4': 4, 'heading_error_num_layers': 3, 'heading_error_activation': 'elu', 'heading_error_out_channels_l0': 226, 'heading_error_pool_size_l0': 8, 'heading_error_out_channels_l1': 225, 'heading_error_pool_size_l1': 2, 'heading_error_out_channels_l2': 182, 'heading_error_pool_size_l2': 2, 'heading_error_fc_hidden': 121}. Best is trial 41 with value: 0.1191.
[rank: 0] Seed set to 42
GPU available: True (cuda), used: True
TPU available: False, using: 0 TPU cores
💡 Tip: For seamless cloud logging and experiment tracking, try installing [litlogger](https://pypi.org/project/litlogger/) to enable LitLogger, which logs metrics and artifacts automatically to the Lightning Experiments platform.
[rank: 0] Seed set to 42
GPU available: True (cuda), used: True
TPU available: False, using: 0 TPU cores
💡 Tip: For seamless cloud logging and experiment tracking, try installing [litlogger](https://pypi.org/project/litlogger/) to enable LitLogger, which logs metrics and artifacts automatically to the Lightning Experiments platform.
[rank: 0] Seed set to 42
GPU available: True (cuda), used: True
TPU available: False, using: 0 TPU cores
💡 Tip: For seamless cloud logging and experiment tracking, try installing [litlogger](https://pypi.org/project/litlogger/) to enable LitLogger, which logs metrics and artifacts automatically to the Lightning Experiments platform.
LOCAL_RANK: 0 - CUDA_VISIBLE_DEVICES: [0]
LOCAL_RANK: 0 - CUDA_VISIBLE_DEVICES: [0]
LOCAL_RANK: 0 - CUDA_VISIBLE_DEVICES: [0]
SLURM auto-requeueing enabled. Setting signal handlers.
SLURM auto-requeueing enabled. Setting signal handlers.
SLURM auto-requeueing enabled. Setting signal handlers.
`Trainer.fit` stopped: `max_epochs=30` reached.
`Trainer.fit` stopped: `max_epochs=30` reached.
`Trainer.fit` stopped: `max_epochs=30` reached.
[I 2026-04-15 22:58:44,912] Trial 45 finished with value: 0.1482 and parameters: {'left_wall_dist_num_layers': 5, 'left_wall_dist_activation': 'relu', 'left_wall_dist_out_channels_l0': 71, 'left_wall_dist_pool_size_l0': 4, 'left_wall_dist_out_channels_l1': 152, 'left_wall_dist_pool_size_l1': 8, 'left_wall_dist_out_channels_l2': 194, 'left_wall_dist_pool_size_l2': 4, 'left_wall_dist_out_channels_l3': 114, 'left_wall_dist_pool_size_l3': 2, 'left_wall_dist_fc_hidden': 64, 'track_width_num_layers': 3, 'track_width_activation': 'elu', 'track_width_out_channels_l0': 127, 'track_width_pool_size_l0': 8, 'track_width_out_channels_l1': 91, 'track_width_pool_size_l1': 4, 'track_width_out_channels_l2': 60, 'track_width_pool_size_l2': 2, 'track_width_fc_hidden': 83, 'heading_error_num_layers': 2, 'heading_error_activation': 'elu', 'heading_error_out_channels_l0': 152, 'heading_error_pool_size_l0': 8, 'heading_error_out_channels_l1': 252, 'heading_error_pool_size_l1': 2}. Best is trial 41 with value: 0.1191.
[rank: 0] Seed set to 42
[rank: 0] Seed set to 42
[rank: 0] Seed set to 42
GPU available: True (cuda), used: True
TPU available: False, using: 0 TPU cores
💡 Tip: For seamless cloud logging and experiment tracking, try installing [litlogger](https://pypi.org/project/litlogger/) to enable LitLogger, which logs metrics and artifacts automatically to the Lightning Experiments platform.
GPU available: True (cuda), used: True
TPU available: False, using: 0 TPU cores
💡 Tip: For seamless cloud logging and experiment tracking, try installing [litlogger](https://pypi.org/project/litlogger/) to enable LitLogger, which logs metrics and artifacts automatically to the Lightning Experiments platform.
GPU available: True (cuda), used: True
TPU available: False, using: 0 TPU cores
💡 Tip: For seamless cloud logging and experiment tracking, try installing [litlogger](https://pypi.org/project/litlogger/) to enable LitLogger, which logs metrics and artifacts automatically to the Lightning Experiments platform.
LOCAL_RANK: 0 - CUDA_VISIBLE_DEVICES: [0]
LOCAL_RANK: 0 - CUDA_VISIBLE_DEVICES: [0]
LOCAL_RANK: 0 - CUDA_VISIBLE_DEVICES: [0]
SLURM auto-requeueing enabled. Setting signal handlers.
SLURM auto-requeueing enabled. Setting signal handlers.
SLURM auto-requeueing enabled. Setting signal handlers.
`Trainer.fit` stopped: `max_epochs=30` reached.
`Trainer.fit` stopped: `max_epochs=30` reached.
`Trainer.fit` stopped: `max_epochs=30` reached.
[I 2026-04-15 23:01:47,926] Trial 46 finished with value: 0.1389 and parameters: {'left_wall_dist_num_layers': 5, 'left_wall_dist_activation': 'relu', 'left_wall_dist_out_channels_l0': 49, 'left_wall_dist_pool_size_l0': 2, 'left_wall_dist_out_channels_l1': 206, 'left_wall_dist_pool_size_l1': 2, 'left_wall_dist_out_channels_l2': 162, 'left_wall_dist_pool_size_l2': 2, 'left_wall_dist_out_channels_l3': 40, 'left_wall_dist_pool_size_l3': 2, 'left_wall_dist_out_channels_l4': 140, 'left_wall_dist_pool_size_l4': 4, 'left_wall_dist_fc_hidden': 44, 'track_width_num_layers': 5, 'track_width_activation': 'elu', 'track_width_out_channels_l0': 109, 'track_width_pool_size_l0': 8, 'track_width_out_channels_l1': 129, 'track_width_pool_size_l1': 4, 'track_width_out_channels_l2': 90, 'track_width_pool_size_l2': 2, 'track_width_out_channels_l3': 169, 'track_width_pool_size_l3': 8, 'heading_error_num_layers': 3, 'heading_error_activation': 'elu', 'heading_error_out_channels_l0': 202, 'heading_error_pool_size_l0': 8, 'heading_error_out_channels_l1': 177, 'heading_error_pool_size_l1': 2, 'heading_error_out_channels_l2': 189, 'heading_error_pool_size_l2': 2, 'heading_error_fc_hidden': 120}. Best is trial 41 with value: 0.1191.
[rank: 0] Seed set to 42
GPU available: True (cuda), used: True
TPU available: False, using: 0 TPU cores
💡 Tip: For seamless cloud logging and experiment tracking, try installing [litlogger](https://pypi.org/project/litlogger/) to enable LitLogger, which logs metrics and artifacts automatically to the Lightning Experiments platform.
[rank: 0] Seed set to 42
[rank: 0] Seed set to 42
GPU available: True (cuda), used: True
TPU available: False, using: 0 TPU cores
💡 Tip: For seamless cloud logging and experiment tracking, try installing [litlogger](https://pypi.org/project/litlogger/) to enable LitLogger, which logs metrics and artifacts automatically to the Lightning Experiments platform.
GPU available: True (cuda), used: True
TPU available: False, using: 0 TPU cores
💡 Tip: For seamless cloud logging and experiment tracking, try installing [litlogger](https://pypi.org/project/litlogger/) to enable LitLogger, which logs metrics and artifacts automatically to the Lightning Experiments platform.
LOCAL_RANK: 0 - CUDA_VISIBLE_DEVICES: [0]
LOCAL_RANK: 0 - CUDA_VISIBLE_DEVICES: [0]
LOCAL_RANK: 0 - CUDA_VISIBLE_DEVICES: [0]
SLURM auto-requeueing enabled. Setting signal handlers.
SLURM auto-requeueing enabled. Setting signal handlers.
SLURM auto-requeueing enabled. Setting signal handlers.
`Trainer.fit` stopped: `max_epochs=30` reached.
`Trainer.fit` stopped: `max_epochs=30` reached.
`Trainer.fit` stopped: `max_epochs=30` reached.
[I 2026-04-15 23:04:34,740] Trial 47 finished with value: 0.1479 and parameters: {'left_wall_dist_num_layers': 5, 'left_wall_dist_activation': 'relu', 'left_wall_dist_out_channels_l0': 102, 'left_wall_dist_pool_size_l0': 8, 'left_wall_dist_out_channels_l1': 128, 'left_wall_dist_pool_size_l1': 8, 'left_wall_dist_out_channels_l2': 98, 'left_wall_dist_pool_size_l2': 8, 'track_width_num_layers': 4, 'track_width_activation': 'relu', 'track_width_out_channels_l0': 100, 'track_width_pool_size_l0': 8, 'track_width_out_channels_l1': 73, 'track_width_pool_size_l1': 4, 'track_width_out_channels_l2': 204, 'track_width_pool_size_l2': 2, 'track_width_out_channels_l3': 50, 'track_width_pool_size_l3': 2, 'track_width_fc_hidden': 55, 'heading_error_num_layers': 4, 'heading_error_activation': 'elu', 'heading_error_out_channels_l0': 183, 'heading_error_pool_size_l0': 8, 'heading_error_out_channels_l1': 202, 'heading_error_pool_size_l1': 2, 'heading_error_out_channels_l2': 153, 'heading_error_pool_size_l2': 2, 'heading_error_out_channels_l3': 69, 'heading_error_pool_size_l3': 8, 'heading_error_fc_hidden': 37}. Best is trial 41 with value: 0.1191.
[rank: 0] Seed set to 42
GPU available: True (cuda), used: True
TPU available: False, using: 0 TPU cores
💡 Tip: For seamless cloud logging and experiment tracking, try installing [litlogger](https://pypi.org/project/litlogger/) to enable LitLogger, which logs metrics and artifacts automatically to the Lightning Experiments platform.
[rank: 0] Seed set to 42
GPU available: True (cuda), used: True
TPU available: False, using: 0 TPU cores
💡 Tip: For seamless cloud logging and experiment tracking, try installing [litlogger](https://pypi.org/project/litlogger/) to enable LitLogger, which logs metrics and artifacts automatically to the Lightning Experiments platform.
[rank: 0] Seed set to 42
GPU available: True (cuda), used: True
TPU available: False, using: 0 TPU cores
💡 Tip: For seamless cloud logging and experiment tracking, try installing [litlogger](https://pypi.org/project/litlogger/) to enable LitLogger, which logs metrics and artifacts automatically to the Lightning Experiments platform.
LOCAL_RANK: 0 - CUDA_VISIBLE_DEVICES: [0]
LOCAL_RANK: 0 - CUDA_VISIBLE_DEVICES: [0]
LOCAL_RANK: 0 - CUDA_VISIBLE_DEVICES: [0]
SLURM auto-requeueing enabled. Setting signal handlers.
SLURM auto-requeueing enabled. Setting signal handlers.
SLURM auto-requeueing enabled. Setting signal handlers.
`Trainer.fit` stopped: `max_epochs=30` reached.
`Trainer.fit` stopped: `max_epochs=30` reached.
`Trainer.fit` stopped: `max_epochs=30` reached.
