[I 2026-04-16 02:23:25,666] Trial 108 finished with value: 0.1955 and parameters: {'left_wall_dist_num_layers': 2, 'left_wall_dist_activation': 'elu', 'left_wall_dist_out_channels_l0': 91, 'left_wall_dist_pool_size_l0': 8, 'left_wall_dist_out_channels_l1': 122, 'left_wall_dist_pool_size_l1': 8, 'left_wall_dist_fc_hidden': 37, 'track_width_num_layers': 3, 'track_width_activation': 'relu', 'track_width_out_channels_l0': 56, 'track_width_pool_size_l0': 2, 'track_width_out_channels_l1': 256, 'track_width_pool_size_l1': 2, 'track_width_out_channels_l2': 53, 'track_width_pool_size_l2': 2, 'track_width_fc_hidden': 124, 'heading_error_num_layers': 4, 'heading_error_activation': 'elu', 'heading_error_out_channels_l0': 73, 'heading_error_pool_size_l0': 2, 'heading_error_out_channels_l1': 124, 'heading_error_pool_size_l1': 8, 'heading_error_out_channels_l2': 91, 'heading_error_pool_size_l2': 4, 'heading_error_out_channels_l3': 254, 'heading_error_pool_size_l3': 8}. Best is trial 91 with value: 0.0905.
[rank: 0] Seed set to 42
GPU available: True (cuda), used: True
TPU available: False, using: 0 TPU cores
💡 Tip: For seamless cloud logging and experiment tracking, try installing [litlogger](https://pypi.org/project/litlogger/) to enable LitLogger, which logs metrics and artifacts automatically to the Lightning Experiments platform.
[rank: 0] Seed set to 42
[rank: 0] Seed set to 42
GPU available: True (cuda), used: True
TPU available: False, using: 0 TPU cores
💡 Tip: For seamless cloud logging and experiment tracking, try installing [litlogger](https://pypi.org/project/litlogger/) to enable LitLogger, which logs metrics and artifacts automatically to the Lightning Experiments platform.
GPU available: True (cuda), used: True
TPU available: False, using: 0 TPU cores
💡 Tip: For seamless cloud logging and experiment tracking, try installing [litlogger](https://pypi.org/project/litlogger/) to enable LitLogger, which logs metrics and artifacts automatically to the Lightning Experiments platform.
LOCAL_RANK: 0 - CUDA_VISIBLE_DEVICES: [0]
LOCAL_RANK: 0 - CUDA_VISIBLE_DEVICES: [0]
LOCAL_RANK: 0 - CUDA_VISIBLE_DEVICES: [0]
SLURM auto-requeueing enabled. Setting signal handlers.
SLURM auto-requeueing enabled. Setting signal handlers.
SLURM auto-requeueing enabled. Setting signal handlers.
`Trainer.fit` stopped: `max_epochs=30` reached.
`Trainer.fit` stopped: `max_epochs=30` reached.
`Trainer.fit` stopped: `max_epochs=30` reached.
[I 2026-04-16 02:26:27,008] Trial 109 finished with value: 0.1292 and parameters: {'left_wall_dist_num_layers': 2, 'left_wall_dist_activation': 'elu', 'left_wall_dist_out_channels_l0': 117, 'left_wall_dist_pool_size_l0': 8, 'left_wall_dist_out_channels_l1': 102, 'left_wall_dist_pool_size_l1': 8, 'left_wall_dist_fc_hidden': 35, 'track_width_num_layers': 4, 'track_width_activation': 'relu', 'track_width_out_channels_l0': 53, 'track_width_pool_size_l0': 2, 'track_width_out_channels_l1': 238, 'track_width_pool_size_l1': 2, 'track_width_out_channels_l2': 32, 'track_width_pool_size_l2': 2, 'track_width_out_channels_l3': 166, 'track_width_pool_size_l3': 8, 'track_width_fc_hidden': 107, 'heading_error_num_layers': 4, 'heading_error_activation': 'elu', 'heading_error_out_channels_l0': 70, 'heading_error_pool_size_l0': 2, 'heading_error_out_channels_l1': 115, 'heading_error_pool_size_l1': 8, 'heading_error_out_channels_l2': 78, 'heading_error_pool_size_l2': 4, 'heading_error_out_channels_l3': 213, 'heading_error_pool_size_l3': 4, 'heading_error_fc_hidden': 67}. Best is trial 91 with value: 0.0905.
[rank: 0] Seed set to 42
[rank: 0] Seed set to 42
GPU available: True (cuda), used: True
TPU available: False, using: 0 TPU cores
💡 Tip: For seamless cloud logging and experiment tracking, try installing [litlogger](https://pypi.org/project/litlogger/) to enable LitLogger, which logs metrics and artifacts automatically to the Lightning Experiments platform.
GPU available: True (cuda), used: True
TPU available: False, using: 0 TPU cores
💡 Tip: For seamless cloud logging and experiment tracking, try installing [litlogger](https://pypi.org/project/litlogger/) to enable LitLogger, which logs metrics and artifacts automatically to the Lightning Experiments platform.
[rank: 0] Seed set to 42
GPU available: True (cuda), used: True
TPU available: False, using: 0 TPU cores
💡 Tip: For seamless cloud logging and experiment tracking, try installing [litlogger](https://pypi.org/project/litlogger/) to enable LitLogger, which logs metrics and artifacts automatically to the Lightning Experiments platform.
LOCAL_RANK: 0 - CUDA_VISIBLE_DEVICES: [0]
LOCAL_RANK: 0 - CUDA_VISIBLE_DEVICES: [0]
LOCAL_RANK: 0 - CUDA_VISIBLE_DEVICES: [0]
SLURM auto-requeueing enabled. Setting signal handlers.
SLURM auto-requeueing enabled. Setting signal handlers.
SLURM auto-requeueing enabled. Setting signal handlers.
`Trainer.fit` stopped: `max_epochs=30` reached.
`Trainer.fit` stopped: `max_epochs=30` reached.
`Trainer.fit` stopped: `max_epochs=30` reached.
[I 2026-04-16 02:29:20,508] Trial 110 finished with value: 0.1288 and parameters: {'left_wall_dist_num_layers': 2, 'left_wall_dist_activation': 'elu', 'left_wall_dist_out_channels_l0': 84, 'left_wall_dist_pool_size_l0': 8, 'left_wall_dist_out_channels_l1': 84, 'left_wall_dist_pool_size_l1': 8, 'left_wall_dist_fc_hidden': 33, 'track_width_num_layers': 3, 'track_width_activation': 'relu', 'track_width_out_channels_l0': 46, 'track_width_pool_size_l0': 2, 'track_width_out_channels_l1': 211, 'track_width_pool_size_l1': 2, 'track_width_out_channels_l2': 46, 'track_width_pool_size_l2': 8, 'track_width_fc_hidden': 104, 'heading_error_num_layers': 4, 'heading_error_activation': 'elu', 'heading_error_out_channels_l0': 63, 'heading_error_pool_size_l0': 2, 'heading_error_out_channels_l1': 94, 'heading_error_pool_size_l1': 8, 'heading_error_out_channels_l2': 92, 'heading_error_pool_size_l2': 4, 'heading_error_out_channels_l3': 235, 'heading_error_pool_size_l3': 4, 'heading_error_fc_hidden': 87}. Best is trial 91 with value: 0.0905.
[rank: 0] Seed set to 42
[rank: 0] Seed set to 42
[rank: 0] Seed set to 42
GPU available: True (cuda), used: True
TPU available: False, using: 0 TPU cores
💡 Tip: For seamless cloud logging and experiment tracking, try installing [litlogger](https://pypi.org/project/litlogger/) to enable LitLogger, which logs metrics and artifacts automatically to the Lightning Experiments platform.
GPU available: True (cuda), used: True
TPU available: False, using: 0 TPU cores
💡 Tip: For seamless cloud logging and experiment tracking, try installing [litlogger](https://pypi.org/project/litlogger/) to enable LitLogger, which logs metrics and artifacts automatically to the Lightning Experiments platform.
GPU available: True (cuda), used: True
TPU available: False, using: 0 TPU cores
💡 Tip: For seamless cloud logging and experiment tracking, try installing [litlogger](https://pypi.org/project/litlogger/) to enable LitLogger, which logs metrics and artifacts automatically to the Lightning Experiments platform.
LOCAL_RANK: 0 - CUDA_VISIBLE_DEVICES: [0]
LOCAL_RANK: 0 - CUDA_VISIBLE_DEVICES: [0]
LOCAL_RANK: 0 - CUDA_VISIBLE_DEVICES: [0]
SLURM auto-requeueing enabled. Setting signal handlers.
SLURM auto-requeueing enabled. Setting signal handlers.
SLURM auto-requeueing enabled. Setting signal handlers.
`Trainer.fit` stopped: `max_epochs=30` reached.
`Trainer.fit` stopped: `max_epochs=30` reached.
`Trainer.fit` stopped: `max_epochs=30` reached.
[I 2026-04-16 02:32:13,181] Trial 111 finished with value: 0.1088 and parameters: {'left_wall_dist_num_layers': 2, 'left_wall_dist_activation': 'elu', 'left_wall_dist_out_channels_l0': 128, 'left_wall_dist_pool_size_l0': 8, 'left_wall_dist_out_channels_l1': 91, 'left_wall_dist_pool_size_l1': 8, 'left_wall_dist_fc_hidden': 41, 'track_width_num_layers': 3, 'track_width_activation': 'relu', 'track_width_out_channels_l0': 72, 'track_width_pool_size_l0': 2, 'track_width_out_channels_l1': 223, 'track_width_pool_size_l1': 2, 'track_width_out_channels_l2': 68, 'track_width_pool_size_l2': 2, 'heading_error_num_layers': 4, 'heading_error_activation': 'elu', 'heading_error_out_channels_l0': 47, 'heading_error_pool_size_l0': 2, 'heading_error_out_channels_l1': 103, 'heading_error_pool_size_l1': 8, 'heading_error_out_channels_l2': 76, 'heading_error_pool_size_l2': 4, 'heading_error_out_channels_l3': 219, 'heading_error_pool_size_l3': 4, 'heading_error_fc_hidden': 76}. Best is trial 91 with value: 0.0905.
[rank: 0] Seed set to 42
[rank: 0] Seed set to 42
[rank: 0] Seed set to 42
GPU available: True (cuda), used: True
TPU available: False, using: 0 TPU cores
GPU available: True (cuda), used: True
TPU available: False, using: 0 TPU cores
💡 Tip: For seamless cloud logging and experiment tracking, try installing [litlogger](https://pypi.org/project/litlogger/) to enable LitLogger, which logs metrics and artifacts automatically to the Lightning Experiments platform.
💡 Tip: For seamless cloud logging and experiment tracking, try installing [litlogger](https://pypi.org/project/litlogger/) to enable LitLogger, which logs metrics and artifacts automatically to the Lightning Experiments platform.
GPU available: True (cuda), used: True
TPU available: False, using: 0 TPU cores
💡 Tip: For seamless cloud logging and experiment tracking, try installing [litlogger](https://pypi.org/project/litlogger/) to enable LitLogger, which logs metrics and artifacts automatically to the Lightning Experiments platform.
LOCAL_RANK: 0 - CUDA_VISIBLE_DEVICES: [0]
LOCAL_RANK: 0 - CUDA_VISIBLE_DEVICES: [0]
LOCAL_RANK: 0 - CUDA_VISIBLE_DEVICES: [0]
SLURM auto-requeueing enabled. Setting signal handlers.
SLURM auto-requeueing enabled. Setting signal handlers.
SLURM auto-requeueing enabled. Setting signal handlers.
`Trainer.fit` stopped: `max_epochs=30` reached.
`Trainer.fit` stopped: `max_epochs=30` reached.
`Trainer.fit` stopped: `max_epochs=30` reached.
[I 2026-04-16 02:34:58,154] Trial 112 finished with value: 0.104 and parameters: {'left_wall_dist_num_layers': 2, 'left_wall_dist_activation': 'elu', 'left_wall_dist_out_channels_l0': 130, 'left_wall_dist_pool_size_l0': 8, 'left_wall_dist_out_channels_l1': 87, 'left_wall_dist_pool_size_l1': 8, 'left_wall_dist_fc_hidden': 40, 'track_width_num_layers': 3, 'track_width_activation': 'relu', 'track_width_out_channels_l0': 74, 'track_width_pool_size_l0': 2, 'track_width_out_channels_l1': 193, 'track_width_pool_size_l1': 2, 'track_width_out_channels_l2': 74, 'track_width_pool_size_l2': 2, 'heading_error_num_layers': 4, 'heading_error_activation': 'elu', 'heading_error_out_channels_l0': 42, 'heading_error_pool_size_l0': 2, 'heading_error_out_channels_l1': 102, 'heading_error_pool_size_l1': 8, 'heading_error_out_channels_l2': 76, 'heading_error_pool_size_l2': 4, 'heading_error_out_channels_l3': 218, 'heading_error_pool_size_l3': 4, 'heading_error_fc_hidden': 75}. Best is trial 91 with value: 0.0905.
[rank: 0] Seed set to 42
[rank: 0] Seed set to 42
[rank: 0] Seed set to 42
GPU available: True (cuda), used: True
TPU available: False, using: 0 TPU cores
💡 Tip: For seamless cloud logging and experiment tracking, try installing [litlogger](https://pypi.org/project/litlogger/) to enable LitLogger, which logs metrics and artifacts automatically to the Lightning Experiments platform.
GPU available: True (cuda), used: True
TPU available: False, using: 0 TPU cores
💡 Tip: For seamless cloud logging and experiment tracking, try installing [litlogger](https://pypi.org/project/litlogger/) to enable LitLogger, which logs metrics and artifacts automatically to the Lightning Experiments platform.
GPU available: True (cuda), used: True
TPU available: False, using: 0 TPU cores
💡 Tip: For seamless cloud logging and experiment tracking, try installing [litlogger](https://pypi.org/project/litlogger/) to enable LitLogger, which logs metrics and artifacts automatically to the Lightning Experiments platform.
LOCAL_RANK: 0 - CUDA_VISIBLE_DEVICES: [0]
LOCAL_RANK: 0 - CUDA_VISIBLE_DEVICES: [0]
LOCAL_RANK: 0 - CUDA_VISIBLE_DEVICES: [0]
SLURM auto-requeueing enabled. Setting signal handlers.
SLURM auto-requeueing enabled. Setting signal handlers.
SLURM auto-requeueing enabled. Setting signal handlers.
`Trainer.fit` stopped: `max_epochs=30` reached.
`Trainer.fit` stopped: `max_epochs=30` reached.
`Trainer.fit` stopped: `max_epochs=30` reached.
[I 2026-04-16 02:37:45,022] Trial 113 finished with value: 0.1144 and parameters: {'left_wall_dist_num_layers': 2, 'left_wall_dist_activation': 'elu', 'left_wall_dist_out_channels_l0': 148, 'left_wall_dist_pool_size_l0': 8, 'left_wall_dist_out_channels_l1': 91, 'left_wall_dist_pool_size_l1': 8, 'left_wall_dist_fc_hidden': 42, 'track_width_num_layers': 3, 'track_width_activation': 'relu', 'track_width_out_channels_l0': 72, 'track_width_pool_size_l0': 2, 'track_width_out_channels_l1': 231, 'track_width_pool_size_l1': 2, 'track_width_out_channels_l2': 73, 'track_width_pool_size_l2': 2, 'heading_error_num_layers': 4, 'heading_error_activation': 'elu', 'heading_error_out_channels_l0': 43, 'heading_error_pool_size_l0': 2, 'heading_error_out_channels_l1': 118, 'heading_error_pool_size_l1': 8, 'heading_error_out_channels_l2': 71, 'heading_error_pool_size_l2': 4, 'heading_error_out_channels_l3': 217, 'heading_error_pool_size_l3': 4, 'heading_error_fc_hidden': 77}. Best is trial 91 with value: 0.0905.
[rank: 0] Seed set to 42
[rank: 0] Seed set to 42
[rank: 0] Seed set to 42
GPU available: True (cuda), used: True
TPU available: False, using: 0 TPU cores
GPU available: True (cuda), used: True
TPU available: False, using: 0 TPU cores
💡 Tip: For seamless cloud logging and experiment tracking, try installing [litlogger](https://pypi.org/project/litlogger/) to enable LitLogger, which logs metrics and artifacts automatically to the Lightning Experiments platform.
💡 Tip: For seamless cloud logging and experiment tracking, try installing [litlogger](https://pypi.org/project/litlogger/) to enable LitLogger, which logs metrics and artifacts automatically to the Lightning Experiments platform.
GPU available: True (cuda), used: True
TPU available: False, using: 0 TPU cores
💡 Tip: For seamless cloud logging and experiment tracking, try installing [litlogger](https://pypi.org/project/litlogger/) to enable LitLogger, which logs metrics and artifacts automatically to the Lightning Experiments platform.
LOCAL_RANK: 0 - CUDA_VISIBLE_DEVICES: [0]
LOCAL_RANK: 0 - CUDA_VISIBLE_DEVICES: [0]
LOCAL_RANK: 0 - CUDA_VISIBLE_DEVICES: [0]
SLURM auto-requeueing enabled. Setting signal handlers.
SLURM auto-requeueing enabled. Setting signal handlers.
SLURM auto-requeueing enabled. Setting signal handlers.
`Trainer.fit` stopped: `max_epochs=30` reached.
`Trainer.fit` stopped: `max_epochs=30` reached.
`Trainer.fit` stopped: `max_epochs=30` reached.
[I 2026-04-16 02:40:37,022] Trial 114 finished with value: 0.101 and parameters: {'left_wall_dist_num_layers': 2, 'left_wall_dist_activation': 'elu', 'left_wall_dist_out_channels_l0': 127, 'left_wall_dist_pool_size_l0': 8, 'left_wall_dist_out_channels_l1': 93, 'left_wall_dist_pool_size_l1': 8, 'left_wall_dist_fc_hidden': 37, 'track_width_num_layers': 3, 'track_width_activation': 'relu', 'track_width_out_channels_l0': 61, 'track_width_pool_size_l0': 2, 'track_width_out_channels_l1': 194, 'track_width_pool_size_l1': 2, 'track_width_out_channels_l2': 79, 'track_width_pool_size_l2': 2, 'heading_error_num_layers': 4, 'heading_error_activation': 'elu', 'heading_error_out_channels_l0': 46, 'heading_error_pool_size_l0': 2, 'heading_error_out_channels_l1': 103, 'heading_error_pool_size_l1': 8, 'heading_error_out_channels_l2': 77, 'heading_error_pool_size_l2': 4, 'heading_error_out_channels_l3': 201, 'heading_error_pool_size_l3': 4, 'heading_error_fc_hidden': 74}. Best is trial 91 with value: 0.0905.
[rank: 0] Seed set to 42
[rank: 0] Seed set to 42
[rank: 0] Seed set to 42
GPU available: True (cuda), used: True
TPU available: False, using: 0 TPU cores
💡 Tip: For seamless cloud logging and experiment tracking, try installing [litlogger](https://pypi.org/project/litlogger/) to enable LitLogger, which logs metrics and artifacts automatically to the Lightning Experiments platform.
GPU available: True (cuda), used: True
TPU available: False, using: 0 TPU cores
💡 Tip: For seamless cloud logging and experiment tracking, try installing [litlogger](https://pypi.org/project/litlogger/) to enable LitLogger, which logs metrics and artifacts automatically to the Lightning Experiments platform.
GPU available: True (cuda), used: True
TPU available: False, using: 0 TPU cores
💡 Tip: For seamless cloud logging and experiment tracking, try installing [litlogger](https://pypi.org/project/litlogger/) to enable LitLogger, which logs metrics and artifacts automatically to the Lightning Experiments platform.
LOCAL_RANK: 0 - CUDA_VISIBLE_DEVICES: [0]
LOCAL_RANK: 0 - CUDA_VISIBLE_DEVICES: [0]
LOCAL_RANK: 0 - CUDA_VISIBLE_DEVICES: [0]
SLURM auto-requeueing enabled. Setting signal handlers.
SLURM auto-requeueing enabled. Setting signal handlers.
SLURM auto-requeueing enabled. Setting signal handlers.
`Trainer.fit` stopped: `max_epochs=30` reached.
`Trainer.fit` stopped: `max_epochs=30` reached.
`Trainer.fit` stopped: `max_epochs=30` reached.
[I 2026-04-16 02:43:31,853] Trial 115 finished with value: 0.1458 and parameters: {'left_wall_dist_num_layers': 2, 'left_wall_dist_activation': 'elu', 'left_wall_dist_out_channels_l0': 139, 'left_wall_dist_pool_size_l0': 8, 'left_wall_dist_out_channels_l1': 96, 'left_wall_dist_pool_size_l1': 8, 'left_wall_dist_fc_hidden': 38, 'track_width_num_layers': 3, 'track_width_activation': 'relu', 'track_width_out_channels_l0': 60, 'track_width_pool_size_l0': 2, 'track_width_out_channels_l1': 193, 'track_width_pool_size_l1': 2, 'track_width_out_channels_l2': 81, 'track_width_pool_size_l2': 2, 'heading_error_num_layers': 4, 'heading_error_activation': 'elu', 'heading_error_out_channels_l0': 42, 'heading_error_pool_size_l0': 2, 'heading_error_out_channels_l1': 110, 'heading_error_pool_size_l1': 8, 'heading_error_out_channels_l2': 77, 'heading_error_pool_size_l2': 4, 'heading_error_out_channels_l3': 180, 'heading_error_pool_size_l3': 4, 'heading_error_fc_hidden': 69}. Best is trial 91 with value: 0.0905.
[rank: 0] Seed set to 42
[rank: 0] Seed set to 42
GPU available: True (cuda), used: True
TPU available: False, using: 0 TPU cores
💡 Tip: For seamless cloud logging and experiment tracking, try installing [litlogger](https://pypi.org/project/litlogger/) to enable LitLogger, which logs metrics and artifacts automatically to the Lightning Experiments platform.
[rank: 0] Seed set to 42
GPU available: True (cuda), used: True
TPU available: False, using: 0 TPU cores
💡 Tip: For seamless cloud logging and experiment tracking, try installing [litlogger](https://pypi.org/project/litlogger/) to enable LitLogger, which logs metrics and artifacts automatically to the Lightning Experiments platform.
GPU available: True (cuda), used: True
TPU available: False, using: 0 TPU cores
💡 Tip: For seamless cloud logging and experiment tracking, try installing [litlogger](https://pypi.org/project/litlogger/) to enable LitLogger, which logs metrics and artifacts automatically to the Lightning Experiments platform.
LOCAL_RANK: 0 - CUDA_VISIBLE_DEVICES: [0]
LOCAL_RANK: 0 - CUDA_VISIBLE_DEVICES: [0]
LOCAL_RANK: 0 - CUDA_VISIBLE_DEVICES: [0]
SLURM auto-requeueing enabled. Setting signal handlers.
SLURM auto-requeueing enabled. Setting signal handlers.
SLURM auto-requeueing enabled. Setting signal handlers.
`Trainer.fit` stopped: `max_epochs=30` reached.
`Trainer.fit` stopped: `max_epochs=30` reached.
`Trainer.fit` stopped: `max_epochs=30` reached.
