[I 2026-04-15 22:26:16,476] Trial 24 finished with value: 0.1549 and parameters: {'left_wall_dist_num_layers': 3, 'left_wall_dist_activation': 'elu', 'left_wall_dist_out_channels_l0': 102, 'left_wall_dist_pool_size_l0': 4, 'left_wall_dist_out_channels_l1': 72, 'left_wall_dist_pool_size_l1': 8, 'left_wall_dist_out_channels_l2': 198, 'left_wall_dist_pool_size_l2': 2, 'left_wall_dist_fc_hidden': 69, 'track_width_num_layers': 5, 'track_width_activation': 'relu', 'track_width_out_channels_l0': 99, 'track_width_pool_size_l0': 8, 'track_width_out_channels_l1': 141, 'track_width_pool_size_l1': 2, 'track_width_out_channels_l2': 58, 'track_width_pool_size_l2': 2, 'track_width_out_channels_l3': 52, 'track_width_pool_size_l3': 8, 'track_width_out_channels_l4': 79, 'track_width_pool_size_l4': 4, 'heading_error_num_layers': 3, 'heading_error_activation': 'elu', 'heading_error_out_channels_l0': 41, 'heading_error_pool_size_l0': 4, 'heading_error_out_channels_l1': 157, 'heading_error_pool_size_l1': 8, 'heading_error_out_channels_l2': 55, 'heading_error_pool_size_l2': 4, 'heading_error_fc_hidden': 74}. Best is trial 23 with value: 0.0876.
[rank: 0] Seed set to 42
[rank: 0] Seed set to 42
GPU available: True (cuda), used: True
TPU available: False, using: 0 TPU cores
💡 Tip: For seamless cloud logging and experiment tracking, try installing [litlogger](https://pypi.org/project/litlogger/) to enable LitLogger, which logs metrics and artifacts automatically to the Lightning Experiments platform.
GPU available: True (cuda), used: True
TPU available: False, using: 0 TPU cores
💡 Tip: For seamless cloud logging and experiment tracking, try installing [litlogger](https://pypi.org/project/litlogger/) to enable LitLogger, which logs metrics and artifacts automatically to the Lightning Experiments platform.
[rank: 0] Seed set to 42
GPU available: True (cuda), used: True
TPU available: False, using: 0 TPU cores
💡 Tip: For seamless cloud logging and experiment tracking, try installing [litlogger](https://pypi.org/project/litlogger/) to enable LitLogger, which logs metrics and artifacts automatically to the Lightning Experiments platform.
LOCAL_RANK: 0 - CUDA_VISIBLE_DEVICES: [0]
LOCAL_RANK: 0 - CUDA_VISIBLE_DEVICES: [0]
LOCAL_RANK: 0 - CUDA_VISIBLE_DEVICES: [0]
SLURM auto-requeueing enabled. Setting signal handlers.
SLURM auto-requeueing enabled. Setting signal handlers.
SLURM auto-requeueing enabled. Setting signal handlers.
`Trainer.fit` stopped: `max_epochs=30` reached.
`Trainer.fit` stopped: `max_epochs=30` reached.
`Trainer.fit` stopped: `max_epochs=30` reached.
[I 2026-04-15 22:28:43,856] Trial 25 finished with value: 0.1153 and parameters: {'left_wall_dist_num_layers': 3, 'left_wall_dist_activation': 'elu', 'left_wall_dist_out_channels_l0': 54, 'left_wall_dist_pool_size_l0': 2, 'left_wall_dist_out_channels_l1': 76, 'left_wall_dist_pool_size_l1': 8, 'left_wall_dist_out_channels_l2': 126, 'left_wall_dist_pool_size_l2': 2, 'left_wall_dist_fc_hidden': 112, 'track_width_num_layers': 3, 'track_width_activation': 'relu', 'track_width_out_channels_l0': 63, 'track_width_pool_size_l0': 8, 'track_width_out_channels_l1': 204, 'track_width_pool_size_l1': 2, 'track_width_out_channels_l2': 83, 'track_width_pool_size_l2': 2, 'track_width_fc_hidden': 52, 'heading_error_num_layers': 3, 'heading_error_activation': 'elu', 'heading_error_out_channels_l0': 65, 'heading_error_pool_size_l0': 4, 'heading_error_out_channels_l1': 209, 'heading_error_pool_size_l1': 4, 'heading_error_out_channels_l2': 65, 'heading_error_pool_size_l2': 4, 'heading_error_fc_hidden': 78}. Best is trial 23 with value: 0.0876.
[rank: 0] Seed set to 42
[rank: 0] Seed set to 42
[rank: 0] Seed set to 42
GPU available: True (cuda), used: True
TPU available: False, using: 0 TPU cores
💡 Tip: For seamless cloud logging and experiment tracking, try installing [litlogger](https://pypi.org/project/litlogger/) to enable LitLogger, which logs metrics and artifacts automatically to the Lightning Experiments platform.
GPU available: True (cuda), used: True
TPU available: False, using: 0 TPU cores
💡 Tip: For seamless cloud logging and experiment tracking, try installing [litlogger](https://pypi.org/project/litlogger/) to enable LitLogger, which logs metrics and artifacts automatically to the Lightning Experiments platform.
GPU available: True (cuda), used: True
TPU available: False, using: 0 TPU cores
💡 Tip: For seamless cloud logging and experiment tracking, try installing [litlogger](https://pypi.org/project/litlogger/) to enable LitLogger, which logs metrics and artifacts automatically to the Lightning Experiments platform.
LOCAL_RANK: 0 - CUDA_VISIBLE_DEVICES: [0]
LOCAL_RANK: 0 - CUDA_VISIBLE_DEVICES: [0]
LOCAL_RANK: 0 - CUDA_VISIBLE_DEVICES: [0]
SLURM auto-requeueing enabled. Setting signal handlers.
SLURM auto-requeueing enabled. Setting signal handlers.
SLURM auto-requeueing enabled. Setting signal handlers.
`Trainer.fit` stopped: `max_epochs=30` reached.
`Trainer.fit` stopped: `max_epochs=30` reached.
`Trainer.fit` stopped: `max_epochs=30` reached.
[I 2026-04-15 22:31:21,411] Trial 26 finished with value: 0.103 and parameters: {'left_wall_dist_num_layers': 3, 'left_wall_dist_activation': 'relu', 'left_wall_dist_out_channels_l0': 71, 'left_wall_dist_pool_size_l0': 2, 'left_wall_dist_out_channels_l1': 86, 'left_wall_dist_pool_size_l1': 8, 'left_wall_dist_out_channels_l2': 203, 'left_wall_dist_pool_size_l2': 8, 'left_wall_dist_fc_hidden': 86, 'track_width_num_layers': 4, 'track_width_activation': 'elu', 'track_width_out_channels_l0': 44, 'track_width_pool_size_l0': 8, 'track_width_out_channels_l1': 99, 'track_width_pool_size_l1': 2, 'track_width_out_channels_l2': 40, 'track_width_pool_size_l2': 8, 'track_width_out_channels_l3': 69, 'track_width_pool_size_l3': 4, 'heading_error_num_layers': 4, 'heading_error_activation': 'elu', 'heading_error_out_channels_l0': 78, 'heading_error_pool_size_l0': 4, 'heading_error_out_channels_l1': 203, 'heading_error_pool_size_l1': 8, 'heading_error_out_channels_l2': 40, 'heading_error_pool_size_l2': 4, 'heading_error_out_channels_l3': 39, 'heading_error_pool_size_l3': 4}. Best is trial 23 with value: 0.0876.
[rank: 0] Seed set to 42
[rank: 0] Seed set to 42
[rank: 0] Seed set to 42
GPU available: True (cuda), used: True
TPU available: False, using: 0 TPU cores
💡 Tip: For seamless cloud logging and experiment tracking, try installing [litlogger](https://pypi.org/project/litlogger/) to enable LitLogger, which logs metrics and artifacts automatically to the Lightning Experiments platform.
GPU available: True (cuda), used: True
TPU available: False, using: 0 TPU cores
💡 Tip: For seamless cloud logging and experiment tracking, try installing [litlogger](https://pypi.org/project/litlogger/) to enable LitLogger, which logs metrics and artifacts automatically to the Lightning Experiments platform.
GPU available: True (cuda), used: True
TPU available: False, using: 0 TPU cores
💡 Tip: For seamless cloud logging and experiment tracking, try installing [litlogger](https://pypi.org/project/litlogger/) to enable LitLogger, which logs metrics and artifacts automatically to the Lightning Experiments platform.
LOCAL_RANK: 0 - CUDA_VISIBLE_DEVICES: [0]
LOCAL_RANK: 0 - CUDA_VISIBLE_DEVICES: [0]
LOCAL_RANK: 0 - CUDA_VISIBLE_DEVICES: [0]
SLURM auto-requeueing enabled. Setting signal handlers.
SLURM auto-requeueing enabled. Setting signal handlers.
SLURM auto-requeueing enabled. Setting signal handlers.
`Trainer.fit` stopped: `max_epochs=30` reached.
`Trainer.fit` stopped: `max_epochs=30` reached.
`Trainer.fit` stopped: `max_epochs=30` reached.
[I 2026-04-15 22:33:53,658] Trial 27 finished with value: 0.0956 and parameters: {'left_wall_dist_num_layers': 2, 'left_wall_dist_activation': 'elu', 'left_wall_dist_out_channels_l0': 79, 'left_wall_dist_pool_size_l0': 4, 'left_wall_dist_out_channels_l1': 117, 'left_wall_dist_pool_size_l1': 8, 'left_wall_dist_fc_hidden': 78, 'track_width_num_layers': 5, 'track_width_activation': 'relu', 'track_width_out_channels_l0': 125, 'track_width_pool_size_l0': 8, 'track_width_out_channels_l1': 163, 'track_width_pool_size_l1': 2, 'track_width_out_channels_l2': 53, 'track_width_pool_size_l2': 2, 'track_width_out_channels_l3': 47, 'track_width_pool_size_l3': 4, 'track_width_out_channels_l4': 33, 'track_width_pool_size_l4': 2, 'heading_error_num_layers': 3, 'heading_error_activation': 'elu', 'heading_error_out_channels_l0': 41, 'heading_error_pool_size_l0': 4, 'heading_error_out_channels_l1': 154, 'heading_error_pool_size_l1': 8, 'heading_error_out_channels_l2': 114, 'heading_error_pool_size_l2': 4, 'heading_error_fc_hidden': 62}. Best is trial 23 with value: 0.0876.
[rank: 0] Seed set to 42
[rank: 0] Seed set to 42
[rank: 0] Seed set to 42
GPU available: True (cuda), used: True
TPU available: False, using: 0 TPU cores
GPU available: True (cuda), used: True
💡 Tip: For seamless cloud logging and experiment tracking, try installing [litlogger](https://pypi.org/project/litlogger/) to enable LitLogger, which logs metrics and artifacts automatically to the Lightning Experiments platform.
TPU available: False, using: 0 TPU cores
💡 Tip: For seamless cloud logging and experiment tracking, try installing [litlogger](https://pypi.org/project/litlogger/) to enable LitLogger, which logs metrics and artifacts automatically to the Lightning Experiments platform.
GPU available: True (cuda), used: True
TPU available: False, using: 0 TPU cores
💡 Tip: For seamless cloud logging and experiment tracking, try installing [litlogger](https://pypi.org/project/litlogger/) to enable LitLogger, which logs metrics and artifacts automatically to the Lightning Experiments platform.
LOCAL_RANK: 0 - CUDA_VISIBLE_DEVICES: [0]
LOCAL_RANK: 0 - CUDA_VISIBLE_DEVICES: [0]
LOCAL_RANK: 0 - CUDA_VISIBLE_DEVICES: [0]
SLURM auto-requeueing enabled. Setting signal handlers.
SLURM auto-requeueing enabled. Setting signal handlers.
SLURM auto-requeueing enabled. Setting signal handlers.
`Trainer.fit` stopped: `max_epochs=30` reached.
`Trainer.fit` stopped: `max_epochs=30` reached.
`Trainer.fit` stopped: `max_epochs=30` reached.
[I 2026-04-15 22:36:42,303] Trial 28 finished with value: 0.1363 and parameters: {'left_wall_dist_num_layers': 2, 'left_wall_dist_activation': 'elu', 'left_wall_dist_out_channels_l0': 164, 'left_wall_dist_pool_size_l0': 4, 'left_wall_dist_out_channels_l1': 115, 'left_wall_dist_pool_size_l1': 8, 'left_wall_dist_fc_hidden': 76, 'track_width_num_layers': 5, 'track_width_activation': 'relu', 'track_width_out_channels_l0': 183, 'track_width_pool_size_l0': 2, 'track_width_out_channels_l1': 165, 'track_width_pool_size_l1': 8, 'track_width_out_channels_l2': 52, 'track_width_pool_size_l2': 2, 'track_width_out_channels_l3': 46, 'track_width_pool_size_l3': 4, 'track_width_out_channels_l4': 149, 'track_width_pool_size_l4': 2, 'heading_error_num_layers': 3, 'heading_error_activation': 'elu', 'heading_error_out_channels_l0': 39, 'heading_error_pool_size_l0': 8, 'heading_error_out_channels_l1': 118, 'heading_error_pool_size_l1': 8, 'heading_error_out_channels_l2': 112, 'heading_error_pool_size_l2': 4, 'heading_error_fc_hidden': 65}. Best is trial 23 with value: 0.0876.
[rank: 0] Seed set to 42
[rank: 0] Seed set to 42
GPU available: True (cuda), used: True
TPU available: False, using: 0 TPU cores
💡 Tip: For seamless cloud logging and experiment tracking, try installing [litlogger](https://pypi.org/project/litlogger/) to enable LitLogger, which logs metrics and artifacts automatically to the Lightning Experiments platform.
GPU available: True (cuda), used: True
TPU available: False, using: 0 TPU cores
💡 Tip: For seamless cloud logging and experiment tracking, try installing [litlogger](https://pypi.org/project/litlogger/) to enable LitLogger, which logs metrics and artifacts automatically to the Lightning Experiments platform.
[rank: 0] Seed set to 42
GPU available: True (cuda), used: True
TPU available: False, using: 0 TPU cores
💡 Tip: For seamless cloud logging and experiment tracking, try installing [litlogger](https://pypi.org/project/litlogger/) to enable LitLogger, which logs metrics and artifacts automatically to the Lightning Experiments platform.
LOCAL_RANK: 0 - CUDA_VISIBLE_DEVICES: [0]
LOCAL_RANK: 0 - CUDA_VISIBLE_DEVICES: [0]
LOCAL_RANK: 0 - CUDA_VISIBLE_DEVICES: [0]
SLURM auto-requeueing enabled. Setting signal handlers.
SLURM auto-requeueing enabled. Setting signal handlers.
SLURM auto-requeueing enabled. Setting signal handlers.
`Trainer.fit` stopped: `max_epochs=30` reached.
`Trainer.fit` stopped: `max_epochs=30` reached.
`Trainer.fit` stopped: `max_epochs=30` reached.
[I 2026-04-15 22:39:14,017] Trial 29 finished with value: 0.1246 and parameters: {'left_wall_dist_num_layers': 2, 'left_wall_dist_activation': 'relu', 'left_wall_dist_out_channels_l0': 106, 'left_wall_dist_pool_size_l0': 4, 'left_wall_dist_out_channels_l1': 87, 'left_wall_dist_pool_size_l1': 2, 'track_width_num_layers': 4, 'track_width_activation': 'elu', 'track_width_out_channels_l0': 130, 'track_width_pool_size_l0': 4, 'track_width_out_channels_l1': 209, 'track_width_pool_size_l1': 4, 'track_width_out_channels_l2': 66, 'track_width_pool_size_l2': 2, 'track_width_out_channels_l3': 86, 'track_width_pool_size_l3': 2, 'track_width_fc_hidden': 73, 'heading_error_num_layers': 3, 'heading_error_activation': 'elu', 'heading_error_out_channels_l0': 51, 'heading_error_pool_size_l0': 2, 'heading_error_out_channels_l1': 88, 'heading_error_pool_size_l1': 4, 'heading_error_out_channels_l2': 132, 'heading_error_pool_size_l2': 4, 'heading_error_fc_hidden': 85}. Best is trial 23 with value: 0.0876.
[rank: 0] Seed set to 42
[rank: 0] Seed set to 42
[rank: 0] Seed set to 42
GPU available: True (cuda), used: True
TPU available: False, using: 0 TPU cores
💡 Tip: For seamless cloud logging and experiment tracking, try installing [litlogger](https://pypi.org/project/litlogger/) to enable LitLogger, which logs metrics and artifacts automatically to the Lightning Experiments platform.
GPU available: True (cuda), used: True
TPU available: False, using: 0 TPU cores
💡 Tip: For seamless cloud logging and experiment tracking, try installing [litlogger](https://pypi.org/project/litlogger/) to enable LitLogger, which logs metrics and artifacts automatically to the Lightning Experiments platform.
GPU available: True (cuda), used: True
TPU available: False, using: 0 TPU cores
💡 Tip: For seamless cloud logging and experiment tracking, try installing [litlogger](https://pypi.org/project/litlogger/) to enable LitLogger, which logs metrics and artifacts automatically to the Lightning Experiments platform.
LOCAL_RANK: 0 - CUDA_VISIBLE_DEVICES: [0]
LOCAL_RANK: 0 - CUDA_VISIBLE_DEVICES: [0]
LOCAL_RANK: 0 - CUDA_VISIBLE_DEVICES: [0]
SLURM auto-requeueing enabled. Setting signal handlers.
SLURM auto-requeueing enabled. Setting signal handlers.
SLURM auto-requeueing enabled. Setting signal handlers.
`Trainer.fit` stopped: `max_epochs=30` reached.
`Trainer.fit` stopped: `max_epochs=30` reached.
`Trainer.fit` stopped: `max_epochs=30` reached.
[I 2026-04-15 22:41:44,477] Trial 30 finished with value: 0.1084 and parameters: {'left_wall_dist_num_layers': 2, 'left_wall_dist_activation': 'elu', 'left_wall_dist_out_channels_l0': 77, 'left_wall_dist_pool_size_l0': 4, 'left_wall_dist_out_channels_l1': 104, 'left_wall_dist_pool_size_l1': 8, 'left_wall_dist_fc_hidden': 75, 'track_width_num_layers': 4, 'track_width_activation': 'relu', 'track_width_out_channels_l0': 132, 'track_width_pool_size_l0': 4, 'track_width_out_channels_l1': 151, 'track_width_pool_size_l1': 8, 'track_width_out_channels_l2': 100, 'track_width_pool_size_l2': 2, 'track_width_out_channels_l3': 40, 'track_width_pool_size_l3': 8, 'heading_error_num_layers': 4, 'heading_error_activation': 'elu', 'heading_error_out_channels_l0': 55, 'heading_error_pool_size_l0': 8, 'heading_error_out_channels_l1': 73, 'heading_error_pool_size_l1': 8, 'heading_error_out_channels_l2': 80, 'heading_error_pool_size_l2': 4, 'heading_error_out_channels_l3': 240, 'heading_error_pool_size_l3': 8}. Best is trial 23 with value: 0.0876.
[rank: 0] Seed set to 42
[rank: 0] Seed set to 42
[rank: 0] Seed set to 42
GPU available: True (cuda), used: True
TPU available: False, using: 0 TPU cores
💡 Tip: For seamless cloud logging and experiment tracking, try installing [litlogger](https://pypi.org/project/litlogger/) to enable LitLogger, which logs metrics and artifacts automatically to the Lightning Experiments platform.
GPU available: True (cuda), used: True
TPU available: False, using: 0 TPU cores
💡 Tip: For seamless cloud logging and experiment tracking, try installing [litlogger](https://pypi.org/project/litlogger/) to enable LitLogger, which logs metrics and artifacts automatically to the Lightning Experiments platform.
GPU available: True (cuda), used: True
TPU available: False, using: 0 TPU cores
💡 Tip: For seamless cloud logging and experiment tracking, try installing [litlogger](https://pypi.org/project/litlogger/) to enable LitLogger, which logs metrics and artifacts automatically to the Lightning Experiments platform.
LOCAL_RANK: 0 - CUDA_VISIBLE_DEVICES: [0]
LOCAL_RANK: 0 - CUDA_VISIBLE_DEVICES: [0]
LOCAL_RANK: 0 - CUDA_VISIBLE_DEVICES: [0]
SLURM auto-requeueing enabled. Setting signal handlers.
SLURM auto-requeueing enabled. Setting signal handlers.
SLURM auto-requeueing enabled. Setting signal handlers.
`Trainer.fit` stopped: `max_epochs=30` reached.
`Trainer.fit` stopped: `max_epochs=30` reached.
`Trainer.fit` stopped: `max_epochs=30` reached.
[I 2026-04-15 22:44:18,165] Trial 31 finished with value: 0.1199 and parameters: {'left_wall_dist_num_layers': 3, 'left_wall_dist_activation': 'elu', 'left_wall_dist_out_channels_l0': 39, 'left_wall_dist_pool_size_l0': 4, 'left_wall_dist_out_channels_l1': 200, 'left_wall_dist_pool_size_l1': 8, 'left_wall_dist_out_channels_l2': 132, 'left_wall_dist_pool_size_l2': 4, 'left_wall_dist_fc_hidden': 95, 'track_width_num_layers': 5, 'track_width_activation': 'relu', 'track_width_out_channels_l0': 93, 'track_width_pool_size_l0': 8, 'track_width_out_channels_l1': 123, 'track_width_pool_size_l1': 2, 'track_width_out_channels_l2': 38, 'track_width_pool_size_l2': 2, 'track_width_out_channels_l3': 54, 'track_width_pool_size_l3': 4, 'track_width_out_channels_l4': 32, 'track_width_pool_size_l4': 2, 'heading_error_num_layers': 3, 'heading_error_activation': 'elu', 'heading_error_out_channels_l0': 39, 'heading_error_pool_size_l0': 4, 'heading_error_out_channels_l1': 153, 'heading_error_pool_size_l1': 8, 'heading_error_out_channels_l2': 54, 'heading_error_pool_size_l2': 4, 'heading_error_fc_hidden': 51}. Best is trial 23 with value: 0.0876.
[rank: 0] Seed set to 42
[rank: 0] Seed set to 42
GPU available: True (cuda), used: True
TPU available: False, using: 0 TPU cores
💡 Tip: For seamless cloud logging and experiment tracking, try installing [litlogger](https://pypi.org/project/litlogger/) to enable LitLogger, which logs metrics and artifacts automatically to the Lightning Experiments platform.
GPU available: True (cuda), used: True
TPU available: False, using: 0 TPU cores
💡 Tip: For seamless cloud logging and experiment tracking, try installing [litlogger](https://pypi.org/project/litlogger/) to enable LitLogger, which logs metrics and artifacts automatically to the Lightning Experiments platform.
[rank: 0] Seed set to 42
GPU available: True (cuda), used: True
TPU available: False, using: 0 TPU cores
💡 Tip: For seamless cloud logging and experiment tracking, try installing [litlogger](https://pypi.org/project/litlogger/) to enable LitLogger, which logs metrics and artifacts automatically to the Lightning Experiments platform.
LOCAL_RANK: 0 - CUDA_VISIBLE_DEVICES: [0]
LOCAL_RANK: 0 - CUDA_VISIBLE_DEVICES: [0]
LOCAL_RANK: 0 - CUDA_VISIBLE_DEVICES: [0]
SLURM auto-requeueing enabled. Setting signal handlers.
SLURM auto-requeueing enabled. Setting signal handlers.
SLURM auto-requeueing enabled. Setting signal handlers.
`Trainer.fit` stopped: `max_epochs=30` reached.
`Trainer.fit` stopped: `max_epochs=30` reached.
`Trainer.fit` stopped: `max_epochs=30` reached.
