[I 2026-04-15 23:28:52,906] Trial 56 finished with value: 0.1415 and parameters: {'left_wall_dist_num_layers': 3, 'left_wall_dist_activation': 'relu', 'left_wall_dist_out_channels_l0': 134, 'left_wall_dist_pool_size_l0': 4, 'left_wall_dist_out_channels_l1': 50, 'left_wall_dist_pool_size_l1': 8, 'left_wall_dist_out_channels_l2': 88, 'left_wall_dist_pool_size_l2': 4, 'left_wall_dist_fc_hidden': 48, 'track_width_num_layers': 3, 'track_width_activation': 'elu', 'track_width_out_channels_l0': 171, 'track_width_pool_size_l0': 8, 'track_width_out_channels_l1': 45, 'track_width_pool_size_l1': 4, 'track_width_out_channels_l2': 86, 'track_width_pool_size_l2': 4, 'track_width_fc_hidden': 81, 'heading_error_num_layers': 2, 'heading_error_activation': 'elu', 'heading_error_out_channels_l0': 56, 'heading_error_pool_size_l0': 8, 'heading_error_out_channels_l1': 223, 'heading_error_pool_size_l1': 4, 'heading_error_fc_hidden': 126}. Best is trial 41 with value: 0.1191.
[rank: 0] Seed set to 42
GPU available: True (cuda), used: True
TPU available: False, using: 0 TPU cores
💡 Tip: For seamless cloud logging and experiment tracking, try installing [litlogger](https://pypi.org/project/litlogger/) to enable LitLogger, which logs metrics and artifacts automatically to the Lightning Experiments platform.
[rank: 0] Seed set to 42
GPU available: True (cuda), used: True
TPU available: False, using: 0 TPU cores
💡 Tip: For seamless cloud logging and experiment tracking, try installing [litlogger](https://pypi.org/project/litlogger/) to enable LitLogger, which logs metrics and artifacts automatically to the Lightning Experiments platform.
[rank: 0] Seed set to 42
GPU available: True (cuda), used: True
TPU available: False, using: 0 TPU cores
💡 Tip: For seamless cloud logging and experiment tracking, try installing [litlogger](https://pypi.org/project/litlogger/) to enable LitLogger, which logs metrics and artifacts automatically to the Lightning Experiments platform.
LOCAL_RANK: 0 - CUDA_VISIBLE_DEVICES: [0]
LOCAL_RANK: 0 - CUDA_VISIBLE_DEVICES: [0]
SLURM auto-requeueing enabled. Setting signal handlers.
SLURM auto-requeueing enabled. Setting signal handlers.
LOCAL_RANK: 0 - CUDA_VISIBLE_DEVICES: [0]
SLURM auto-requeueing enabled. Setting signal handlers.
`Trainer.fit` stopped: `max_epochs=30` reached.
`Trainer.fit` stopped: `max_epochs=30` reached.
`Trainer.fit` stopped: `max_epochs=30` reached.
[I 2026-04-15 23:31:32,608] Trial 57 finished with value: 0.1414 and parameters: {'left_wall_dist_num_layers': 5, 'left_wall_dist_activation': 'relu', 'left_wall_dist_out_channels_l0': 92, 'left_wall_dist_pool_size_l0': 8, 'left_wall_dist_out_channels_l1': 59, 'left_wall_dist_pool_size_l1': 8, 'left_wall_dist_out_channels_l2': 165, 'left_wall_dist_pool_size_l2': 8, 'track_width_num_layers': 4, 'track_width_activation': 'elu', 'track_width_out_channels_l0': 103, 'track_width_pool_size_l0': 8, 'track_width_out_channels_l1': 69, 'track_width_pool_size_l1': 4, 'track_width_out_channels_l2': 135, 'track_width_pool_size_l2': 4, 'track_width_out_channels_l3': 91, 'track_width_pool_size_l3': 4, 'track_width_fc_hidden': 32, 'heading_error_num_layers': 3, 'heading_error_activation': 'elu', 'heading_error_out_channels_l0': 81, 'heading_error_pool_size_l0': 8, 'heading_error_out_channels_l1': 212, 'heading_error_pool_size_l1': 8, 'heading_error_out_channels_l2': 238, 'heading_error_pool_size_l2': 2, 'heading_error_fc_hidden': 100}. Best is trial 41 with value: 0.1191.
[rank: 0] Seed set to 42
[rank: 0] Seed set to 42
GPU available: True (cuda), used: True
TPU available: False, using: 0 TPU cores
💡 Tip: For seamless cloud logging and experiment tracking, try installing [litlogger](https://pypi.org/project/litlogger/) to enable LitLogger, which logs metrics and artifacts automatically to the Lightning Experiments platform.
GPU available: True (cuda), used: True
TPU available: False, using: 0 TPU cores
💡 Tip: For seamless cloud logging and experiment tracking, try installing [litlogger](https://pypi.org/project/litlogger/) to enable LitLogger, which logs metrics and artifacts automatically to the Lightning Experiments platform.
[rank: 0] Seed set to 42
GPU available: True (cuda), used: True
TPU available: False, using: 0 TPU cores
💡 Tip: For seamless cloud logging and experiment tracking, try installing [litlogger](https://pypi.org/project/litlogger/) to enable LitLogger, which logs metrics and artifacts automatically to the Lightning Experiments platform.
LOCAL_RANK: 0 - CUDA_VISIBLE_DEVICES: [0]
LOCAL_RANK: 0 - CUDA_VISIBLE_DEVICES: [0]
LOCAL_RANK: 0 - CUDA_VISIBLE_DEVICES: [0]
SLURM auto-requeueing enabled. Setting signal handlers.
SLURM auto-requeueing enabled. Setting signal handlers.
SLURM auto-requeueing enabled. Setting signal handlers.
`Trainer.fit` stopped: `max_epochs=30` reached.
`Trainer.fit` stopped: `max_epochs=30` reached.
`Trainer.fit` stopped: `max_epochs=30` reached.
[I 2026-04-15 23:34:07,364] Trial 58 finished with value: 0.1494 and parameters: {'left_wall_dist_num_layers': 4, 'left_wall_dist_activation': 'relu', 'left_wall_dist_out_channels_l0': 71, 'left_wall_dist_pool_size_l0': 4, 'left_wall_dist_out_channels_l1': 136, 'left_wall_dist_pool_size_l1': 8, 'left_wall_dist_out_channels_l2': 108, 'left_wall_dist_pool_size_l2': 2, 'left_wall_dist_out_channels_l3': 36, 'left_wall_dist_pool_size_l3': 8, 'track_width_num_layers': 2, 'track_width_activation': 'relu', 'track_width_out_channels_l0': 115, 'track_width_pool_size_l0': 2, 'track_width_out_channels_l1': 40, 'track_width_pool_size_l1': 4, 'track_width_fc_hidden': 115, 'heading_error_num_layers': 3, 'heading_error_activation': 'elu', 'heading_error_out_channels_l0': 43, 'heading_error_pool_size_l0': 8, 'heading_error_out_channels_l1': 241, 'heading_error_pool_size_l1': 2, 'heading_error_out_channels_l2': 199, 'heading_error_pool_size_l2': 8, 'heading_error_fc_hidden': 83}. Best is trial 41 with value: 0.1191.
[rank: 0] Seed set to 42
[rank: 0] Seed set to 42
GPU available: True (cuda), used: True
TPU available: False, using: 0 TPU cores
💡 Tip: For seamless cloud logging and experiment tracking, try installing [litlogger](https://pypi.org/project/litlogger/) to enable LitLogger, which logs metrics and artifacts automatically to the Lightning Experiments platform.
GPU available: True (cuda), used: True
TPU available: False, using: 0 TPU cores
💡 Tip: For seamless cloud logging and experiment tracking, try installing [litlogger](https://pypi.org/project/litlogger/) to enable LitLogger, which logs metrics and artifacts automatically to the Lightning Experiments platform.
[rank: 0] Seed set to 42
GPU available: True (cuda), used: True
TPU available: False, using: 0 TPU cores
💡 Tip: For seamless cloud logging and experiment tracking, try installing [litlogger](https://pypi.org/project/litlogger/) to enable LitLogger, which logs metrics and artifacts automatically to the Lightning Experiments platform.
LOCAL_RANK: 0 - CUDA_VISIBLE_DEVICES: [0]
LOCAL_RANK: 0 - CUDA_VISIBLE_DEVICES: [0]
LOCAL_RANK: 0 - CUDA_VISIBLE_DEVICES: [0]
SLURM auto-requeueing enabled. Setting signal handlers.
SLURM auto-requeueing enabled. Setting signal handlers.
SLURM auto-requeueing enabled. Setting signal handlers.
`Trainer.fit` stopped: `max_epochs=30` reached.
`Trainer.fit` stopped: `max_epochs=30` reached.
`Trainer.fit` stopped: `max_epochs=30` reached.
[I 2026-04-15 23:36:42,390] Trial 59 finished with value: 0.1405 and parameters: {'left_wall_dist_num_layers': 3, 'left_wall_dist_activation': 'relu', 'left_wall_dist_out_channels_l0': 147, 'left_wall_dist_pool_size_l0': 2, 'left_wall_dist_out_channels_l1': 43, 'left_wall_dist_pool_size_l1': 8, 'left_wall_dist_out_channels_l2': 55, 'left_wall_dist_pool_size_l2': 2, 'left_wall_dist_fc_hidden': 79, 'track_width_num_layers': 3, 'track_width_activation': 'elu', 'track_width_out_channels_l0': 132, 'track_width_pool_size_l0': 8, 'track_width_out_channels_l1': 49, 'track_width_pool_size_l1': 4, 'track_width_out_channels_l2': 68, 'track_width_pool_size_l2': 4, 'track_width_fc_hidden': 66, 'heading_error_num_layers': 2, 'heading_error_activation': 'relu', 'heading_error_out_channels_l0': 158, 'heading_error_pool_size_l0': 8, 'heading_error_out_channels_l1': 136, 'heading_error_pool_size_l1': 4, 'heading_error_fc_hidden': 119}. Best is trial 41 with value: 0.1191.
[rank: 0] Seed set to 42
[rank: 0] Seed set to 42
GPU available: True (cuda), used: True
TPU available: False, using: 0 TPU cores
💡 Tip: For seamless cloud logging and experiment tracking, try installing [litlogger](https://pypi.org/project/litlogger/) to enable LitLogger, which logs metrics and artifacts automatically to the Lightning Experiments platform.
[rank: 0] Seed set to 42
GPU available: True (cuda), used: True
TPU available: False, using: 0 TPU cores
💡 Tip: For seamless cloud logging and experiment tracking, try installing [litlogger](https://pypi.org/project/litlogger/) to enable LitLogger, which logs metrics and artifacts automatically to the Lightning Experiments platform.
GPU available: True (cuda), used: True
TPU available: False, using: 0 TPU cores
💡 Tip: For seamless cloud logging and experiment tracking, try installing [litlogger](https://pypi.org/project/litlogger/) to enable LitLogger, which logs metrics and artifacts automatically to the Lightning Experiments platform.
LOCAL_RANK: 0 - CUDA_VISIBLE_DEVICES: [0]
LOCAL_RANK: 0 - CUDA_VISIBLE_DEVICES: [0]
LOCAL_RANK: 0 - CUDA_VISIBLE_DEVICES: [0]
SLURM auto-requeueing enabled. Setting signal handlers.
SLURM auto-requeueing enabled. Setting signal handlers.
SLURM auto-requeueing enabled. Setting signal handlers.
`Trainer.fit` stopped: `max_epochs=30` reached.
`Trainer.fit` stopped: `max_epochs=30` reached.
`Trainer.fit` stopped: `max_epochs=30` reached.
[I 2026-04-15 23:39:31,903] Trial 60 finished with value: 0.1165 and parameters: {'left_wall_dist_num_layers': 5, 'left_wall_dist_activation': 'relu', 'left_wall_dist_out_channels_l0': 160, 'left_wall_dist_pool_size_l0': 8, 'left_wall_dist_out_channels_l1': 113, 'left_wall_dist_pool_size_l1': 2, 'left_wall_dist_out_channels_l2': 185, 'left_wall_dist_pool_size_l2': 4, 'left_wall_dist_out_channels_l3': 157, 'left_wall_dist_pool_size_l3': 8, 'left_wall_dist_fc_hidden': 35, 'track_width_num_layers': 4, 'track_width_activation': 'elu', 'track_width_out_channels_l0': 153, 'track_width_pool_size_l0': 8, 'track_width_out_channels_l1': 97, 'track_width_pool_size_l1': 4, 'track_width_out_channels_l2': 78, 'track_width_pool_size_l2': 4, 'track_width_out_channels_l3': 65, 'track_width_pool_size_l3': 4, 'heading_error_num_layers': 4, 'heading_error_activation': 'elu', 'heading_error_out_channels_l0': 32, 'heading_error_pool_size_l0': 8, 'heading_error_out_channels_l1': 120, 'heading_error_pool_size_l1': 4, 'heading_error_out_channels_l2': 219, 'heading_error_pool_size_l2': 2, 'heading_error_out_channels_l3': 100, 'heading_error_pool_size_l3': 4, 'heading_error_fc_hidden': 73}. Best is trial 60 with value: 0.1165.
[rank: 0] Seed set to 42
GPU available: True (cuda), used: True
TPU available: False, using: 0 TPU cores
💡 Tip: For seamless cloud logging and experiment tracking, try installing [litlogger](https://pypi.org/project/litlogger/) to enable LitLogger, which logs metrics and artifacts automatically to the Lightning Experiments platform.
[rank: 0] Seed set to 42
GPU available: True (cuda), used: True
TPU available: False, using: 0 TPU cores
💡 Tip: For seamless cloud logging and experiment tracking, try installing [litlogger](https://pypi.org/project/litlogger/) to enable LitLogger, which logs metrics and artifacts automatically to the Lightning Experiments platform.
[rank: 0] Seed set to 42
GPU available: True (cuda), used: True
TPU available: False, using: 0 TPU cores
💡 Tip: For seamless cloud logging and experiment tracking, try installing [litlogger](https://pypi.org/project/litlogger/) to enable LitLogger, which logs metrics and artifacts automatically to the Lightning Experiments platform.
LOCAL_RANK: 0 - CUDA_VISIBLE_DEVICES: [0]
LOCAL_RANK: 0 - CUDA_VISIBLE_DEVICES: [0]
LOCAL_RANK: 0 - CUDA_VISIBLE_DEVICES: [0]
SLURM auto-requeueing enabled. Setting signal handlers.
SLURM auto-requeueing enabled. Setting signal handlers.
SLURM auto-requeueing enabled. Setting signal handlers.
`Trainer.fit` stopped: `max_epochs=30` reached.
`Trainer.fit` stopped: `max_epochs=30` reached.
`Trainer.fit` stopped: `max_epochs=30` reached.
[I 2026-04-15 23:42:20,123] Trial 61 finished with value: 0.148 and parameters: {'left_wall_dist_num_layers': 5, 'left_wall_dist_activation': 'relu', 'left_wall_dist_out_channels_l0': 129, 'left_wall_dist_pool_size_l0': 8, 'left_wall_dist_out_channels_l1': 113, 'left_wall_dist_pool_size_l1': 2, 'left_wall_dist_out_channels_l2': 187, 'left_wall_dist_pool_size_l2': 4, 'left_wall_dist_out_channels_l3': 158, 'left_wall_dist_pool_size_l3': 8, 'left_wall_dist_fc_hidden': 35, 'track_width_num_layers': 4, 'track_width_activation': 'elu', 'track_width_out_channels_l0': 154, 'track_width_pool_size_l0': 8, 'track_width_out_channels_l1': 97, 'track_width_pool_size_l1': 4, 'track_width_out_channels_l2': 96, 'track_width_pool_size_l2': 4, 'track_width_out_channels_l3': 62, 'track_width_pool_size_l3': 4, 'heading_error_num_layers': 4, 'heading_error_activation': 'elu', 'heading_error_out_channels_l0': 33, 'heading_error_pool_size_l0': 8, 'heading_error_out_channels_l1': 86, 'heading_error_pool_size_l1': 4, 'heading_error_out_channels_l2': 223, 'heading_error_pool_size_l2': 2, 'heading_error_out_channels_l3': 96, 'heading_error_pool_size_l3': 4, 'heading_error_fc_hidden': 70}. Best is trial 60 with value: 0.1165.
[rank: 0] Seed set to 42
GPU available: True (cuda), used: True
TPU available: False, using: 0 TPU cores
💡 Tip: For seamless cloud logging and experiment tracking, try installing [litlogger](https://pypi.org/project/litlogger/) to enable LitLogger, which logs metrics and artifacts automatically to the Lightning Experiments platform.
[rank: 0] Seed set to 42
GPU available: True (cuda), used: True
TPU available: False, using: 0 TPU cores
💡 Tip: For seamless cloud logging and experiment tracking, try installing [litlogger](https://pypi.org/project/litlogger/) to enable LitLogger, which logs metrics and artifacts automatically to the Lightning Experiments platform.
[rank: 0] Seed set to 42
GPU available: True (cuda), used: True
TPU available: False, using: 0 TPU cores
💡 Tip: For seamless cloud logging and experiment tracking, try installing [litlogger](https://pypi.org/project/litlogger/) to enable LitLogger, which logs metrics and artifacts automatically to the Lightning Experiments platform.
LOCAL_RANK: 0 - CUDA_VISIBLE_DEVICES: [0]
LOCAL_RANK: 0 - CUDA_VISIBLE_DEVICES: [0]
LOCAL_RANK: 0 - CUDA_VISIBLE_DEVICES: [0]
SLURM auto-requeueing enabled. Setting signal handlers.
SLURM auto-requeueing enabled. Setting signal handlers.
SLURM auto-requeueing enabled. Setting signal handlers.
`Trainer.fit` stopped: `max_epochs=30` reached.
`Trainer.fit` stopped: `max_epochs=30` reached.
`Trainer.fit` stopped: `max_epochs=30` reached.
[I 2026-04-15 23:45:10,392] Trial 62 finished with value: 0.1307 and parameters: {'left_wall_dist_num_layers': 5, 'left_wall_dist_activation': 'relu', 'left_wall_dist_out_channels_l0': 169, 'left_wall_dist_pool_size_l0': 8, 'left_wall_dist_out_channels_l1': 123, 'left_wall_dist_pool_size_l1': 2, 'left_wall_dist_out_channels_l2': 221, 'left_wall_dist_pool_size_l2': 4, 'left_wall_dist_out_channels_l3': 118, 'left_wall_dist_pool_size_l3': 8, 'left_wall_dist_fc_hidden': 38, 'track_width_num_layers': 4, 'track_width_activation': 'elu', 'track_width_out_channels_l0': 122, 'track_width_pool_size_l0': 8, 'track_width_out_channels_l1': 53, 'track_width_pool_size_l1': 4, 'track_width_out_channels_l2': 76, 'track_width_pool_size_l2': 4, 'track_width_out_channels_l3': 72, 'track_width_pool_size_l3': 4, 'heading_error_num_layers': 4, 'heading_error_activation': 'elu', 'heading_error_out_channels_l0': 32, 'heading_error_pool_size_l0': 8, 'heading_error_out_channels_l1': 98, 'heading_error_pool_size_l1': 4, 'heading_error_out_channels_l2': 174, 'heading_error_pool_size_l2': 2, 'heading_error_out_channels_l3': 138, 'heading_error_pool_size_l3': 4, 'heading_error_fc_hidden': 96}. Best is trial 60 with value: 0.1165.
[rank: 0] Seed set to 42
[rank: 0] Seed set to 42
[rank: 0] Seed set to 42
GPU available: True (cuda), used: True
TPU available: False, using: 0 TPU cores
GPU available: True (cuda), used: True
TPU available: False, using: 0 TPU cores
💡 Tip: For seamless cloud logging and experiment tracking, try installing [litlogger](https://pypi.org/project/litlogger/) to enable LitLogger, which logs metrics and artifacts automatically to the Lightning Experiments platform.
💡 Tip: For seamless cloud logging and experiment tracking, try installing [litlogger](https://pypi.org/project/litlogger/) to enable LitLogger, which logs metrics and artifacts automatically to the Lightning Experiments platform.
GPU available: True (cuda), used: True
TPU available: False, using: 0 TPU cores
💡 Tip: For seamless cloud logging and experiment tracking, try installing [litlogger](https://pypi.org/project/litlogger/) to enable LitLogger, which logs metrics and artifacts automatically to the Lightning Experiments platform.
LOCAL_RANK: 0 - CUDA_VISIBLE_DEVICES: [0]
LOCAL_RANK: 0 - CUDA_VISIBLE_DEVICES: [0]
LOCAL_RANK: 0 - CUDA_VISIBLE_DEVICES: [0]
SLURM auto-requeueing enabled. Setting signal handlers.
SLURM auto-requeueing enabled. Setting signal handlers.
SLURM auto-requeueing enabled. Setting signal handlers.
`Trainer.fit` stopped: `max_epochs=30` reached.
`Trainer.fit` stopped: `max_epochs=30` reached.
`Trainer.fit` stopped: `max_epochs=30` reached.
[I 2026-04-15 23:48:03,725] Trial 63 finished with value: 0.131 and parameters: {'left_wall_dist_num_layers': 5, 'left_wall_dist_activation': 'relu', 'left_wall_dist_out_channels_l0': 154, 'left_wall_dist_pool_size_l0': 8, 'left_wall_dist_out_channels_l1': 91, 'left_wall_dist_pool_size_l1': 2, 'left_wall_dist_out_channels_l2': 142, 'left_wall_dist_pool_size_l2': 4, 'left_wall_dist_out_channels_l3': 215, 'left_wall_dist_pool_size_l3': 8, 'left_wall_dist_fc_hidden': 34, 'track_width_num_layers': 4, 'track_width_activation': 'elu', 'track_width_out_channels_l0': 136, 'track_width_pool_size_l0': 8, 'track_width_out_channels_l1': 56, 'track_width_pool_size_l1': 4, 'track_width_out_channels_l2': 67, 'track_width_pool_size_l2': 4, 'track_width_out_channels_l3': 58, 'track_width_pool_size_l3': 4, 'heading_error_num_layers': 4, 'heading_error_activation': 'elu', 'heading_error_out_channels_l0': 45, 'heading_error_pool_size_l0': 8, 'heading_error_out_channels_l1': 164, 'heading_error_pool_size_l1': 4, 'heading_error_out_channels_l2': 157, 'heading_error_pool_size_l2': 2, 'heading_error_out_channels_l3': 78, 'heading_error_pool_size_l3': 4, 'heading_error_fc_hidden': 40}. Best is trial 60 with value: 0.1165.
[rank: 0] Seed set to 42
GPU available: True (cuda), used: True
TPU available: False, using: 0 TPU cores
💡 Tip: For seamless cloud logging and experiment tracking, try installing [litlogger](https://pypi.org/project/litlogger/) to enable LitLogger, which logs metrics and artifacts automatically to the Lightning Experiments platform.
[rank: 0] Seed set to 42
[rank: 0] Seed set to 42
GPU available: True (cuda), used: True
TPU available: False, using: 0 TPU cores
💡 Tip: For seamless cloud logging and experiment tracking, try installing [litlogger](https://pypi.org/project/litlogger/) to enable LitLogger, which logs metrics and artifacts automatically to the Lightning Experiments platform.
GPU available: True (cuda), used: True
TPU available: False, using: 0 TPU cores
💡 Tip: For seamless cloud logging and experiment tracking, try installing [litlogger](https://pypi.org/project/litlogger/) to enable LitLogger, which logs metrics and artifacts automatically to the Lightning Experiments platform.
LOCAL_RANK: 0 - CUDA_VISIBLE_DEVICES: [0]
LOCAL_RANK: 0 - CUDA_VISIBLE_DEVICES: [0]
LOCAL_RANK: 0 - CUDA_VISIBLE_DEVICES: [0]
SLURM auto-requeueing enabled. Setting signal handlers.
SLURM auto-requeueing enabled. Setting signal handlers.
SLURM auto-requeueing enabled. Setting signal handlers.
`Trainer.fit` stopped: `max_epochs=30` reached.
`Trainer.fit` stopped: `max_epochs=30` reached.
`Trainer.fit` stopped: `max_epochs=30` reached.
