[I 2026-04-12 14:08:50,356] Trial 23 finished with value: 0.1168 and parameters: {'left_wall_dist_num_layers': 2, 'left_wall_dist_activation': 'relu', 'left_wall_dist_out_channels_l0': 187, 'left_wall_dist_pool_size_l0': 8, 'left_wall_dist_out_channels_l1': 138, 'left_wall_dist_pool_size_l1': 8, 'left_wall_dist_fc_hidden': 68, 'track_width_num_layers': 3, 'track_width_activation': 'elu', 'track_width_out_channels_l0': 147, 'track_width_pool_size_l0': 2, 'track_width_out_channels_l1': 93, 'track_width_pool_size_l1': 2, 'track_width_out_channels_l2': 256, 'track_width_pool_size_l2': 8, 'heading_error_num_layers': 3, 'heading_error_activation': 'elu', 'heading_error_out_channels_l0': 48, 'heading_error_pool_size_l0': 8, 'heading_error_out_channels_l1': 129, 'heading_error_pool_size_l1': 8, 'heading_error_out_channels_l2': 64, 'heading_error_pool_size_l2': 8}. Best is trial 8 with value: 0.0963.
[rank: 0] Seed set to 42
[rank: 0] Seed set to 42
[rank: 0] Seed set to 42
GPU available: True (cuda), used: True
TPU available: False, using: 0 TPU cores
💡 Tip: For seamless cloud logging and experiment tracking, try installing [litlogger](https://pypi.org/project/litlogger/) to enable LitLogger, which logs metrics and artifacts automatically to the Lightning Experiments platform.
GPU available: True (cuda), used: True
TPU available: False, using: 0 TPU cores
💡 Tip: For seamless cloud logging and experiment tracking, try installing [litlogger](https://pypi.org/project/litlogger/) to enable LitLogger, which logs metrics and artifacts automatically to the Lightning Experiments platform.
GPU available: True (cuda), used: True
TPU available: False, using: 0 TPU cores
💡 Tip: For seamless cloud logging and experiment tracking, try installing [litlogger](https://pypi.org/project/litlogger/) to enable LitLogger, which logs metrics and artifacts automatically to the Lightning Experiments platform.
LOCAL_RANK: 0 - CUDA_VISIBLE_DEVICES: [0]
LOCAL_RANK: 0 - CUDA_VISIBLE_DEVICES: [0]
LOCAL_RANK: 0 - CUDA_VISIBLE_DEVICES: [0]
SLURM auto-requeueing enabled. Setting signal handlers.
SLURM auto-requeueing enabled. Setting signal handlers.
SLURM auto-requeueing enabled. Setting signal handlers.
`Trainer.fit` stopped: `max_epochs=20` reached.
`Trainer.fit` stopped: `max_epochs=20` reached.
`Trainer.fit` stopped: `max_epochs=20` reached.
[I 2026-04-12 14:10:51,807] Trial 24 finished with value: 0.1383 and parameters: {'left_wall_dist_num_layers': 3, 'left_wall_dist_activation': 'relu', 'left_wall_dist_out_channels_l0': 105, 'left_wall_dist_pool_size_l0': 8, 'left_wall_dist_out_channels_l1': 72, 'left_wall_dist_pool_size_l1': 8, 'left_wall_dist_out_channels_l2': 195, 'left_wall_dist_pool_size_l2': 8, 'track_width_num_layers': 2, 'track_width_activation': 'elu', 'track_width_out_channels_l0': 218, 'track_width_pool_size_l0': 4, 'track_width_out_channels_l1': 129, 'track_width_pool_size_l1': 2, 'heading_error_num_layers': 2, 'heading_error_activation': 'elu', 'heading_error_out_channels_l0': 102, 'heading_error_pool_size_l0': 8, 'heading_error_out_channels_l1': 107, 'heading_error_pool_size_l1': 8, 'heading_error_fc_hidden': 66}. Best is trial 8 with value: 0.0963.
[rank: 0] Seed set to 42
[rank: 0] Seed set to 42
[rank: 0] Seed set to 42
GPU available: True (cuda), used: True
TPU available: False, using: 0 TPU cores
💡 Tip: For seamless cloud logging and experiment tracking, try installing [litlogger](https://pypi.org/project/litlogger/) to enable LitLogger, which logs metrics and artifacts automatically to the Lightning Experiments platform.
GPU available: True (cuda), used: True
TPU available: False, using: 0 TPU cores
💡 Tip: For seamless cloud logging and experiment tracking, try installing [litlogger](https://pypi.org/project/litlogger/) to enable LitLogger, which logs metrics and artifacts automatically to the Lightning Experiments platform.
GPU available: True (cuda), used: True
TPU available: False, using: 0 TPU cores
💡 Tip: For seamless cloud logging and experiment tracking, try installing [litlogger](https://pypi.org/project/litlogger/) to enable LitLogger, which logs metrics and artifacts automatically to the Lightning Experiments platform.
LOCAL_RANK: 0 - CUDA_VISIBLE_DEVICES: [0]
LOCAL_RANK: 0 - CUDA_VISIBLE_DEVICES: [0]
LOCAL_RANK: 0 - CUDA_VISIBLE_DEVICES: [0]
SLURM auto-requeueing enabled. Setting signal handlers.
SLURM auto-requeueing enabled. Setting signal handlers.
SLURM auto-requeueing enabled. Setting signal handlers.
`Trainer.fit` stopped: `max_epochs=20` reached.
`Trainer.fit` stopped: `max_epochs=20` reached.
`Trainer.fit` stopped: `max_epochs=20` reached.
[I 2026-04-12 14:13:02,845] Trial 25 finished with value: 0.1216 and parameters: {'left_wall_dist_num_layers': 4, 'left_wall_dist_activation': 'relu', 'left_wall_dist_out_channels_l0': 150, 'left_wall_dist_pool_size_l0': 2, 'left_wall_dist_out_channels_l1': 97, 'left_wall_dist_pool_size_l1': 8, 'left_wall_dist_out_channels_l2': 96, 'left_wall_dist_pool_size_l2': 4, 'left_wall_dist_out_channels_l3': 45, 'left_wall_dist_pool_size_l3': 2, 'left_wall_dist_fc_hidden': 50, 'track_width_num_layers': 3, 'track_width_activation': 'elu', 'track_width_out_channels_l0': 181, 'track_width_pool_size_l0': 2, 'track_width_out_channels_l1': 76, 'track_width_pool_size_l1': 2, 'track_width_out_channels_l2': 72, 'track_width_pool_size_l2': 2, 'heading_error_num_layers': 3, 'heading_error_activation': 'elu', 'heading_error_out_channels_l0': 138, 'heading_error_pool_size_l0': 8, 'heading_error_out_channels_l1': 151, 'heading_error_pool_size_l1': 4, 'heading_error_out_channels_l2': 87, 'heading_error_pool_size_l2': 2, 'heading_error_fc_hidden': 97}. Best is trial 8 with value: 0.0963.
[rank: 0] Seed set to 42
[rank: 0] Seed set to 42
[rank: 0] Seed set to 42
GPU available: True (cuda), used: True
TPU available: False, using: 0 TPU cores
💡 Tip: For seamless cloud logging and experiment tracking, try installing [litlogger](https://pypi.org/project/litlogger/) to enable LitLogger, which logs metrics and artifacts automatically to the Lightning Experiments platform.
GPU available: True (cuda), used: True
TPU available: False, using: 0 TPU cores
💡 Tip: For seamless cloud logging and experiment tracking, try installing [litlogger](https://pypi.org/project/litlogger/) to enable LitLogger, which logs metrics and artifacts automatically to the Lightning Experiments platform.
GPU available: True (cuda), used: True
TPU available: False, using: 0 TPU cores
💡 Tip: For seamless cloud logging and experiment tracking, try installing [litlogger](https://pypi.org/project/litlogger/) to enable LitLogger, which logs metrics and artifacts automatically to the Lightning Experiments platform.
LOCAL_RANK: 0 - CUDA_VISIBLE_DEVICES: [0]
LOCAL_RANK: 0 - CUDA_VISIBLE_DEVICES: [0]
LOCAL_RANK: 0 - CUDA_VISIBLE_DEVICES: [0]
SLURM auto-requeueing enabled. Setting signal handlers.
SLURM auto-requeueing enabled. Setting signal handlers.
SLURM auto-requeueing enabled. Setting signal handlers.
`Trainer.fit` stopped: `max_epochs=20` reached.
`Trainer.fit` stopped: `max_epochs=20` reached.
`Trainer.fit` stopped: `max_epochs=20` reached.
[I 2026-04-12 14:15:13,409] Trial 26 finished with value: 0.1055 and parameters: {'left_wall_dist_num_layers': 3, 'left_wall_dist_activation': 'relu', 'left_wall_dist_out_channels_l0': 77, 'left_wall_dist_pool_size_l0': 8, 'left_wall_dist_out_channels_l1': 207, 'left_wall_dist_pool_size_l1': 8, 'left_wall_dist_out_channels_l2': 40, 'left_wall_dist_pool_size_l2': 4, 'track_width_num_layers': 4, 'track_width_activation': 'elu', 'track_width_out_channels_l0': 64, 'track_width_pool_size_l0': 4, 'track_width_out_channels_l1': 59, 'track_width_pool_size_l1': 4, 'track_width_out_channels_l2': 97, 'track_width_pool_size_l2': 4, 'track_width_out_channels_l3': 65, 'track_width_pool_size_l3': 8, 'heading_error_num_layers': 4, 'heading_error_activation': 'relu', 'heading_error_out_channels_l0': 67, 'heading_error_pool_size_l0': 8, 'heading_error_out_channels_l1': 197, 'heading_error_pool_size_l1': 8, 'heading_error_out_channels_l2': 147, 'heading_error_pool_size_l2': 2, 'heading_error_out_channels_l3': 53, 'heading_error_pool_size_l3': 8, 'heading_error_fc_hidden': 43}. Best is trial 8 with value: 0.0963.
[rank: 0] Seed set to 42
[rank: 0] Seed set to 42
[rank: 0] Seed set to 42
GPU available: True (cuda), used: True
TPU available: False, using: 0 TPU cores
💡 Tip: For seamless cloud logging and experiment tracking, try installing [litlogger](https://pypi.org/project/litlogger/) to enable LitLogger, which logs metrics and artifacts automatically to the Lightning Experiments platform.
GPU available: True (cuda), used: True
TPU available: False, using: 0 TPU cores
💡 Tip: For seamless cloud logging and experiment tracking, try installing [litlogger](https://pypi.org/project/litlogger/) to enable LitLogger, which logs metrics and artifacts automatically to the Lightning Experiments platform.
GPU available: True (cuda), used: True
TPU available: False, using: 0 TPU cores
💡 Tip: For seamless cloud logging and experiment tracking, try installing [litlogger](https://pypi.org/project/litlogger/) to enable LitLogger, which logs metrics and artifacts automatically to the Lightning Experiments platform.
LOCAL_RANK: 0 - CUDA_VISIBLE_DEVICES: [0]
LOCAL_RANK: 0 - CUDA_VISIBLE_DEVICES: [0]
LOCAL_RANK: 0 - CUDA_VISIBLE_DEVICES: [0]
SLURM auto-requeueing enabled. Setting signal handlers.
SLURM auto-requeueing enabled. Setting signal handlers.
SLURM auto-requeueing enabled. Setting signal handlers.
`Trainer.fit` stopped: `max_epochs=20` reached.
`Trainer.fit` stopped: `max_epochs=20` reached.
`Trainer.fit` stopped: `max_epochs=20` reached.
[I 2026-04-12 14:17:20,441] Trial 27 finished with value: 0.1343 and parameters: {'left_wall_dist_num_layers': 3, 'left_wall_dist_activation': 'relu', 'left_wall_dist_out_channels_l0': 73, 'left_wall_dist_pool_size_l0': 8, 'left_wall_dist_out_channels_l1': 200, 'left_wall_dist_pool_size_l1': 8, 'left_wall_dist_out_channels_l2': 38, 'left_wall_dist_pool_size_l2': 4, 'track_width_num_layers': 4, 'track_width_activation': 'elu', 'track_width_out_channels_l0': 65, 'track_width_pool_size_l0': 4, 'track_width_out_channels_l1': 55, 'track_width_pool_size_l1': 4, 'track_width_out_channels_l2': 102, 'track_width_pool_size_l2': 4, 'track_width_out_channels_l3': 63, 'track_width_pool_size_l3': 8, 'heading_error_num_layers': 4, 'heading_error_activation': 'relu', 'heading_error_out_channels_l0': 68, 'heading_error_pool_size_l0': 8, 'heading_error_out_channels_l1': 208, 'heading_error_pool_size_l1': 8, 'heading_error_out_channels_l2': 165, 'heading_error_pool_size_l2': 2, 'heading_error_out_channels_l3': 48, 'heading_error_pool_size_l3': 8, 'heading_error_fc_hidden': 41}. Best is trial 8 with value: 0.0963.
[rank: 0] Seed set to 42
GPU available: True (cuda), used: True
TPU available: False, using: 0 TPU cores
💡 Tip: For seamless cloud logging and experiment tracking, try installing [litlogger](https://pypi.org/project/litlogger/) to enable LitLogger, which logs metrics and artifacts automatically to the Lightning Experiments platform.
[rank: 0] Seed set to 42
GPU available: True (cuda), used: True
TPU available: False, using: 0 TPU cores
💡 Tip: For seamless cloud logging and experiment tracking, try installing [litlogger](https://pypi.org/project/litlogger/) to enable LitLogger, which logs metrics and artifacts automatically to the Lightning Experiments platform.
[rank: 0] Seed set to 42
GPU available: True (cuda), used: True
TPU available: False, using: 0 TPU cores
💡 Tip: For seamless cloud logging and experiment tracking, try installing [litlogger](https://pypi.org/project/litlogger/) to enable LitLogger, which logs metrics and artifacts automatically to the Lightning Experiments platform.
LOCAL_RANK: 0 - CUDA_VISIBLE_DEVICES: [0]
LOCAL_RANK: 0 - CUDA_VISIBLE_DEVICES: [0]
LOCAL_RANK: 0 - CUDA_VISIBLE_DEVICES: [0]
SLURM auto-requeueing enabled. Setting signal handlers.
SLURM auto-requeueing enabled. Setting signal handlers.
SLURM auto-requeueing enabled. Setting signal handlers.
`Trainer.fit` stopped: `max_epochs=20` reached.
`Trainer.fit` stopped: `max_epochs=20` reached.
`Trainer.fit` stopped: `max_epochs=20` reached.
[I 2026-04-12 14:19:43,479] Trial 28 finished with value: 0.1147 and parameters: {'left_wall_dist_num_layers': 4, 'left_wall_dist_activation': 'elu', 'left_wall_dist_out_channels_l0': 54, 'left_wall_dist_pool_size_l0': 4, 'left_wall_dist_out_channels_l1': 166, 'left_wall_dist_pool_size_l1': 4, 'left_wall_dist_out_channels_l2': 42, 'left_wall_dist_pool_size_l2': 4, 'left_wall_dist_out_channels_l3': 84, 'left_wall_dist_pool_size_l3': 4, 'left_wall_dist_fc_hidden': 41, 'track_width_num_layers': 5, 'track_width_activation': 'relu', 'track_width_out_channels_l0': 43, 'track_width_pool_size_l0': 4, 'track_width_out_channels_l1': 62, 'track_width_pool_size_l1': 4, 'track_width_out_channels_l2': 153, 'track_width_pool_size_l2': 4, 'track_width_out_channels_l3': 65, 'track_width_pool_size_l3': 8, 'track_width_fc_hidden': 34, 'heading_error_num_layers': 5, 'heading_error_activation': 'relu', 'heading_error_out_channels_l0': 89, 'heading_error_pool_size_l0': 4, 'heading_error_out_channels_l1': 194, 'heading_error_pool_size_l1': 2, 'heading_error_out_channels_l2': 143, 'heading_error_pool_size_l2': 2, 'heading_error_out_channels_l3': 57, 'heading_error_pool_size_l3': 8, 'heading_error_out_channels_l4': 242, 'heading_error_pool_size_l4': 4}. Best is trial 8 with value: 0.0963.
[rank: 0] Seed set to 42
[rank: 0] Seed set to 42
[rank: 0] Seed set to 42
GPU available: True (cuda), used: True
TPU available: False, using: 0 TPU cores
💡 Tip: For seamless cloud logging and experiment tracking, try installing [litlogger](https://pypi.org/project/litlogger/) to enable LitLogger, which logs metrics and artifacts automatically to the Lightning Experiments platform.
GPU available: True (cuda), used: True
TPU available: False, using: 0 TPU cores
💡 Tip: For seamless cloud logging and experiment tracking, try installing [litlogger](https://pypi.org/project/litlogger/) to enable LitLogger, which logs metrics and artifacts automatically to the Lightning Experiments platform.
GPU available: True (cuda), used: True
TPU available: False, using: 0 TPU cores
💡 Tip: For seamless cloud logging and experiment tracking, try installing [litlogger](https://pypi.org/project/litlogger/) to enable LitLogger, which logs metrics and artifacts automatically to the Lightning Experiments platform.
LOCAL_RANK: 0 - CUDA_VISIBLE_DEVICES: [0]
LOCAL_RANK: 0 - CUDA_VISIBLE_DEVICES: [0]
LOCAL_RANK: 0 - CUDA_VISIBLE_DEVICES: [0]
SLURM auto-requeueing enabled. Setting signal handlers.
SLURM auto-requeueing enabled. Setting signal handlers.
SLURM auto-requeueing enabled. Setting signal handlers.
`Trainer.fit` stopped: `max_epochs=20` reached.
`Trainer.fit` stopped: `max_epochs=20` reached.
`Trainer.fit` stopped: `max_epochs=20` reached.
[I 2026-04-12 14:21:56,631] Trial 29 finished with value: 0.1159 and parameters: {'left_wall_dist_num_layers': 3, 'left_wall_dist_activation': 'relu', 'left_wall_dist_out_channels_l0': 76, 'left_wall_dist_pool_size_l0': 2, 'left_wall_dist_out_channels_l1': 203, 'left_wall_dist_pool_size_l1': 8, 'left_wall_dist_out_channels_l2': 47, 'left_wall_dist_pool_size_l2': 4, 'left_wall_dist_fc_hidden': 96, 'track_width_num_layers': 4, 'track_width_activation': 'elu', 'track_width_out_channels_l0': 61, 'track_width_pool_size_l0': 4, 'track_width_out_channels_l1': 206, 'track_width_pool_size_l1': 4, 'track_width_out_channels_l2': 85, 'track_width_pool_size_l2': 4, 'track_width_out_channels_l3': 44, 'track_width_pool_size_l3': 8, 'heading_error_num_layers': 4, 'heading_error_activation': 'relu', 'heading_error_out_channels_l0': 53, 'heading_error_pool_size_l0': 2, 'heading_error_out_channels_l1': 226, 'heading_error_pool_size_l1': 4, 'heading_error_out_channels_l2': 100, 'heading_error_pool_size_l2': 2, 'heading_error_out_channels_l3': 38, 'heading_error_pool_size_l3': 8, 'heading_error_fc_hidden': 56}. Best is trial 8 with value: 0.0963.
[rank: 0] Seed set to 42
[rank: 0] Seed set to 42
GPU available: True (cuda), used: True
GPU available: True (cuda), used: True
TPU available: False, using: 0 TPU cores
TPU available: False, using: 0 TPU cores
💡 Tip: For seamless cloud logging and experiment tracking, try installing [litlogger](https://pypi.org/project/litlogger/) to enable LitLogger, which logs metrics and artifacts automatically to the Lightning Experiments platform.
💡 Tip: For seamless cloud logging and experiment tracking, try installing [litlogger](https://pypi.org/project/litlogger/) to enable LitLogger, which logs metrics and artifacts automatically to the Lightning Experiments platform.
[rank: 0] Seed set to 42
GPU available: True (cuda), used: True
TPU available: False, using: 0 TPU cores
💡 Tip: For seamless cloud logging and experiment tracking, try installing [litlogger](https://pypi.org/project/litlogger/) to enable LitLogger, which logs metrics and artifacts automatically to the Lightning Experiments platform.
LOCAL_RANK: 0 - CUDA_VISIBLE_DEVICES: [0]
LOCAL_RANK: 0 - CUDA_VISIBLE_DEVICES: [0]
LOCAL_RANK: 0 - CUDA_VISIBLE_DEVICES: [0]
SLURM auto-requeueing enabled. Setting signal handlers.
SLURM auto-requeueing enabled. Setting signal handlers.
SLURM auto-requeueing enabled. Setting signal handlers.
`Trainer.fit` stopped: `max_epochs=20` reached.
`Trainer.fit` stopped: `max_epochs=20` reached.
`Trainer.fit` stopped: `max_epochs=20` reached.
[I 2026-04-12 14:24:09,437] Trial 30 finished with value: 0.1226 and parameters: {'left_wall_dist_num_layers': 3, 'left_wall_dist_activation': 'relu', 'left_wall_dist_out_channels_l0': 45, 'left_wall_dist_pool_size_l0': 4, 'left_wall_dist_out_channels_l1': 141, 'left_wall_dist_pool_size_l1': 2, 'left_wall_dist_out_channels_l2': 65, 'left_wall_dist_pool_size_l2': 4, 'left_wall_dist_fc_hidden': 120, 'track_width_num_layers': 4, 'track_width_activation': 'elu', 'track_width_out_channels_l0': 49, 'track_width_pool_size_l0': 4, 'track_width_out_channels_l1': 38, 'track_width_pool_size_l1': 4, 'track_width_out_channels_l2': 129, 'track_width_pool_size_l2': 4, 'track_width_out_channels_l3': 123, 'track_width_pool_size_l3': 8, 'heading_error_num_layers': 4, 'heading_error_activation': 'relu', 'heading_error_out_channels_l0': 81, 'heading_error_pool_size_l0': 2, 'heading_error_out_channels_l1': 223, 'heading_error_pool_size_l1': 8, 'heading_error_out_channels_l2': 136, 'heading_error_pool_size_l2': 2, 'heading_error_out_channels_l3': 41, 'heading_error_pool_size_l3': 8}. Best is trial 8 with value: 0.0963.
[rank: 0] Seed set to 42
GPU available: True (cuda), used: True
TPU available: False, using: 0 TPU cores
💡 Tip: For seamless cloud logging and experiment tracking, try installing [litlogger](https://pypi.org/project/litlogger/) to enable LitLogger, which logs metrics and artifacts automatically to the Lightning Experiments platform.
[rank: 0] Seed set to 42
GPU available: True (cuda), used: True
TPU available: False, using: 0 TPU cores
💡 Tip: For seamless cloud logging and experiment tracking, try installing [litlogger](https://pypi.org/project/litlogger/) to enable LitLogger, which logs metrics and artifacts automatically to the Lightning Experiments platform.
[rank: 0] Seed set to 42
GPU available: True (cuda), used: True
TPU available: False, using: 0 TPU cores
💡 Tip: For seamless cloud logging and experiment tracking, try installing [litlogger](https://pypi.org/project/litlogger/) to enable LitLogger, which logs metrics and artifacts automatically to the Lightning Experiments platform.
LOCAL_RANK: 0 - CUDA_VISIBLE_DEVICES: [0]
LOCAL_RANK: 0 - CUDA_VISIBLE_DEVICES: [0]
LOCAL_RANK: 0 - CUDA_VISIBLE_DEVICES: [0]
SLURM auto-requeueing enabled. Setting signal handlers.
SLURM auto-requeueing enabled. Setting signal handlers.
SLURM auto-requeueing enabled. Setting signal handlers.
`Trainer.fit` stopped: `max_epochs=20` reached.
`Trainer.fit` stopped: `max_epochs=20` reached.
`Trainer.fit` stopped: `max_epochs=20` reached.
