[I 2026-04-16 02:30:39,103] Trial 118 finished with value: 0.0913 and parameters: {'left_wall_dist_num_layers': 2, 'left_wall_dist_activation': 'relu', 'left_wall_dist_out_channels_l0': 57, 'left_wall_dist_pool_size_l0': 2, 'left_wall_dist_out_channels_l1': 77, 'left_wall_dist_pool_size_l1': 8, 'left_wall_dist_fc_hidden': 94, 'track_width_num_layers': 3, 'track_width_activation': 'relu', 'track_width_out_channels_l0': 115, 'track_width_pool_size_l0': 4, 'track_width_out_channels_l1': 176, 'track_width_pool_size_l1': 2, 'track_width_out_channels_l2': 37, 'track_width_pool_size_l2': 4, 'track_width_fc_hidden': 39, 'heading_error_num_layers': 2, 'heading_error_activation': 'elu', 'heading_error_out_channels_l0': 180, 'heading_error_pool_size_l0': 8, 'heading_error_out_channels_l1': 137, 'heading_error_pool_size_l1': 8, 'heading_error_fc_hidden': 69}. Best is trial 23 with value: 0.0876.
[rank: 0] Seed set to 42
GPU available: True (cuda), used: True
TPU available: False, using: 0 TPU cores
💡 Tip: For seamless cloud logging and experiment tracking, try installing [litlogger](https://pypi.org/project/litlogger/) to enable LitLogger, which logs metrics and artifacts automatically to the Lightning Experiments platform.
[rank: 0] Seed set to 42
[rank: 0] Seed set to 42
GPU available: True (cuda), used: True
TPU available: False, using: 0 TPU cores
💡 Tip: For seamless cloud logging and experiment tracking, try installing [litlogger](https://pypi.org/project/litlogger/) to enable LitLogger, which logs metrics and artifacts automatically to the Lightning Experiments platform.
GPU available: True (cuda), used: True
TPU available: False, using: 0 TPU cores
💡 Tip: For seamless cloud logging and experiment tracking, try installing [litlogger](https://pypi.org/project/litlogger/) to enable LitLogger, which logs metrics and artifacts automatically to the Lightning Experiments platform.
LOCAL_RANK: 0 - CUDA_VISIBLE_DEVICES: [0]
LOCAL_RANK: 0 - CUDA_VISIBLE_DEVICES: [0]
SLURM auto-requeueing enabled. Setting signal handlers.
LOCAL_RANK: 0 - CUDA_VISIBLE_DEVICES: [0]
SLURM auto-requeueing enabled. Setting signal handlers.
SLURM auto-requeueing enabled. Setting signal handlers.
`Trainer.fit` stopped: `max_epochs=30` reached.
`Trainer.fit` stopped: `max_epochs=30` reached.
`Trainer.fit` stopped: `max_epochs=30` reached.
[I 2026-04-16 02:33:11,606] Trial 119 finished with value: 0.1059 and parameters: {'left_wall_dist_num_layers': 3, 'left_wall_dist_activation': 'relu', 'left_wall_dist_out_channels_l0': 56, 'left_wall_dist_pool_size_l0': 2, 'left_wall_dist_out_channels_l1': 79, 'left_wall_dist_pool_size_l1': 8, 'left_wall_dist_out_channels_l2': 208, 'left_wall_dist_pool_size_l2': 2, 'left_wall_dist_fc_hidden': 107, 'track_width_num_layers': 3, 'track_width_activation': 'relu', 'track_width_out_channels_l0': 111, 'track_width_pool_size_l0': 4, 'track_width_out_channels_l1': 179, 'track_width_pool_size_l1': 2, 'track_width_out_channels_l2': 34, 'track_width_pool_size_l2': 4, 'track_width_fc_hidden': 104, 'heading_error_num_layers': 2, 'heading_error_activation': 'elu', 'heading_error_out_channels_l0': 178, 'heading_error_pool_size_l0': 8, 'heading_error_out_channels_l1': 139, 'heading_error_pool_size_l1': 8, 'heading_error_fc_hidden': 64}. Best is trial 23 with value: 0.0876.
