[I 2026-04-14 22:55:42,867] Trial 55 finished with value: 0.1647 and parameters: {'left_wall_dist_num_layers': 3, 'left_wall_dist_activation': 'relu', 'left_wall_dist_out_channels_l0': 107, 'left_wall_dist_pool_size_l0': 8, 'left_wall_dist_out_channels_l1': 35, 'left_wall_dist_pool_size_l1': 2, 'left_wall_dist_out_channels_l2': 48, 'left_wall_dist_pool_size_l2': 4, 'left_wall_dist_fc_hidden': 92, 'track_width_num_layers': 3, 'track_width_activation': 'elu', 'track_width_out_channels_l0': 92, 'track_width_pool_size_l0': 8, 'track_width_out_channels_l1': 35, 'track_width_pool_size_l1': 8, 'track_width_out_channels_l2': 232, 'track_width_pool_size_l2': 4, 'track_width_fc_hidden': 92, 'heading_error_num_layers': 5, 'heading_error_activation': 'elu', 'heading_error_out_channels_l0': 137, 'heading_error_pool_size_l0': 8, 'heading_error_out_channels_l1': 39, 'heading_error_pool_size_l1': 2, 'heading_error_out_channels_l2': 73, 'heading_error_pool_size_l2': 2, 'heading_error_out_channels_l3': 164, 'heading_error_pool_size_l3': 2, 'heading_error_out_channels_l4': 128, 'heading_error_pool_size_l4': 8, 'heading_error_fc_hidden': 37}. Best is trial 4 with value: 0.0986.
[rank: 0] Seed set to 42
[rank: 0] Seed set to 42
[rank: 0] Seed set to 42
GPU available: True (cuda), used: True
TPU available: False, using: 0 TPU cores
GPU available: True (cuda), used: True
💡 Tip: For seamless cloud logging and experiment tracking, try installing [litlogger](https://pypi.org/project/litlogger/) to enable LitLogger, which logs metrics and artifacts automatically to the Lightning Experiments platform.
TPU available: False, using: 0 TPU cores
💡 Tip: For seamless cloud logging and experiment tracking, try installing [litlogger](https://pypi.org/project/litlogger/) to enable LitLogger, which logs metrics and artifacts automatically to the Lightning Experiments platform.
GPU available: True (cuda), used: True
TPU available: False, using: 0 TPU cores
💡 Tip: For seamless cloud logging and experiment tracking, try installing [litlogger](https://pypi.org/project/litlogger/) to enable LitLogger, which logs metrics and artifacts automatically to the Lightning Experiments platform.
LOCAL_RANK: 0 - CUDA_VISIBLE_DEVICES: [0]
LOCAL_RANK: 0 - CUDA_VISIBLE_DEVICES: [0]
LOCAL_RANK: 0 - CUDA_VISIBLE_DEVICES: [0]
SLURM auto-requeueing enabled. Setting signal handlers.
SLURM auto-requeueing enabled. Setting signal handlers.
SLURM auto-requeueing enabled. Setting signal handlers.
`Trainer.fit` stopped: `max_epochs=30` reached.
`Trainer.fit` stopped: `max_epochs=30` reached.
`Trainer.fit` stopped: `max_epochs=30` reached.
[I 2026-04-14 22:58:57,742] Trial 56 finished with value: 0.1319 and parameters: {'left_wall_dist_num_layers': 4, 'left_wall_dist_activation': 'relu', 'left_wall_dist_out_channels_l0': 175, 'left_wall_dist_pool_size_l0': 2, 'left_wall_dist_out_channels_l1': 39, 'left_wall_dist_pool_size_l1': 4, 'left_wall_dist_out_channels_l2': 104, 'left_wall_dist_pool_size_l2': 4, 'left_wall_dist_out_channels_l3': 172, 'left_wall_dist_pool_size_l3': 4, 'left_wall_dist_fc_hidden': 98, 'track_width_num_layers': 4, 'track_width_activation': 'relu', 'track_width_out_channels_l0': 188, 'track_width_pool_size_l0': 2, 'track_width_out_channels_l1': 179, 'track_width_pool_size_l1': 8, 'track_width_out_channels_l2': 126, 'track_width_pool_size_l2': 4, 'track_width_out_channels_l3': 151, 'track_width_pool_size_l3': 2, 'track_width_fc_hidden': 60, 'heading_error_num_layers': 5, 'heading_error_activation': 'elu', 'heading_error_out_channels_l0': 188, 'heading_error_pool_size_l0': 4, 'heading_error_out_channels_l1': 62, 'heading_error_pool_size_l1': 4, 'heading_error_out_channels_l2': 58, 'heading_error_pool_size_l2': 2, 'heading_error_out_channels_l3': 130, 'heading_error_pool_size_l3': 2, 'heading_error_out_channels_l4': 168, 'heading_error_pool_size_l4': 4, 'heading_error_fc_hidden': 68}. Best is trial 4 with value: 0.0986.
[rank: 0] Seed set to 42
[rank: 0] Seed set to 42
[rank: 0] Seed set to 42
GPU available: True (cuda), used: True
TPU available: False, using: 0 TPU cores
💡 Tip: For seamless cloud logging and experiment tracking, try installing [litlogger](https://pypi.org/project/litlogger/) to enable LitLogger, which logs metrics and artifacts automatically to the Lightning Experiments platform.
GPU available: True (cuda), used: True
TPU available: False, using: 0 TPU cores
💡 Tip: For seamless cloud logging and experiment tracking, try installing [litlogger](https://pypi.org/project/litlogger/) to enable LitLogger, which logs metrics and artifacts automatically to the Lightning Experiments platform.
GPU available: True (cuda), used: True
TPU available: False, using: 0 TPU cores
💡 Tip: For seamless cloud logging and experiment tracking, try installing [litlogger](https://pypi.org/project/litlogger/) to enable LitLogger, which logs metrics and artifacts automatically to the Lightning Experiments platform.
LOCAL_RANK: 0 - CUDA_VISIBLE_DEVICES: [0]
LOCAL_RANK: 0 - CUDA_VISIBLE_DEVICES: [0]
LOCAL_RANK: 0 - CUDA_VISIBLE_DEVICES: [0]
SLURM auto-requeueing enabled. Setting signal handlers.
SLURM auto-requeueing enabled. Setting signal handlers.
SLURM auto-requeueing enabled. Setting signal handlers.
`Trainer.fit` stopped: `max_epochs=30` reached.
`Trainer.fit` stopped: `max_epochs=30` reached.
`Trainer.fit` stopped: `max_epochs=30` reached.
[I 2026-04-14 23:01:01,392] Trial 57 finished with value: 0.1764 and parameters: {'left_wall_dist_num_layers': 2, 'left_wall_dist_activation': 'elu', 'left_wall_dist_out_channels_l0': 202, 'left_wall_dist_pool_size_l0': 4, 'left_wall_dist_out_channels_l1': 114, 'left_wall_dist_pool_size_l1': 4, 'left_wall_dist_fc_hidden': 126, 'track_width_num_layers': 3, 'track_width_activation': 'elu', 'track_width_out_channels_l0': 164, 'track_width_pool_size_l0': 8, 'track_width_out_channels_l1': 60, 'track_width_pool_size_l1': 8, 'track_width_out_channels_l2': 161, 'track_width_pool_size_l2': 8, 'heading_error_num_layers': 4, 'heading_error_activation': 'relu', 'heading_error_out_channels_l0': 226, 'heading_error_pool_size_l0': 8, 'heading_error_out_channels_l1': 44, 'heading_error_pool_size_l1': 4, 'heading_error_out_channels_l2': 49, 'heading_error_pool_size_l2': 4, 'heading_error_out_channels_l3': 101, 'heading_error_pool_size_l3': 4}. Best is trial 4 with value: 0.0986.
[rank: 0] Seed set to 42
GPU available: True (cuda), used: True
TPU available: False, using: 0 TPU cores
💡 Tip: For seamless cloud logging and experiment tracking, try installing [litlogger](https://pypi.org/project/litlogger/) to enable LitLogger, which logs metrics and artifacts automatically to the Lightning Experiments platform.
[rank: 0] Seed set to 42
[rank: 0] Seed set to 42
GPU available: True (cuda), used: True
TPU available: False, using: 0 TPU cores
💡 Tip: For seamless cloud logging and experiment tracking, try installing [litlogger](https://pypi.org/project/litlogger/) to enable LitLogger, which logs metrics and artifacts automatically to the Lightning Experiments platform.
GPU available: True (cuda), used: True
TPU available: False, using: 0 TPU cores
💡 Tip: For seamless cloud logging and experiment tracking, try installing [litlogger](https://pypi.org/project/litlogger/) to enable LitLogger, which logs metrics and artifacts automatically to the Lightning Experiments platform.
LOCAL_RANK: 0 - CUDA_VISIBLE_DEVICES: [0]
LOCAL_RANK: 0 - CUDA_VISIBLE_DEVICES: [0]
LOCAL_RANK: 0 - CUDA_VISIBLE_DEVICES: [0]
SLURM auto-requeueing enabled. Setting signal handlers.
SLURM auto-requeueing enabled. Setting signal handlers.
SLURM auto-requeueing enabled. Setting signal handlers.
`Trainer.fit` stopped: `max_epochs=30` reached.
`Trainer.fit` stopped: `max_epochs=30` reached.
`Trainer.fit` stopped: `max_epochs=30` reached.
[I 2026-04-14 23:03:56,508] Trial 58 finished with value: 0.1339 and parameters: {'left_wall_dist_num_layers': 3, 'left_wall_dist_activation': 'relu', 'left_wall_dist_out_channels_l0': 72, 'left_wall_dist_pool_size_l0': 2, 'left_wall_dist_out_channels_l1': 48, 'left_wall_dist_pool_size_l1': 2, 'left_wall_dist_out_channels_l2': 62, 'left_wall_dist_pool_size_l2': 8, 'left_wall_dist_fc_hidden': 72, 'track_width_num_layers': 2, 'track_width_activation': 'elu', 'track_width_out_channels_l0': 68, 'track_width_pool_size_l0': 4, 'track_width_out_channels_l1': 54, 'track_width_pool_size_l1': 2, 'track_width_fc_hidden': 122, 'heading_error_num_layers': 5, 'heading_error_activation': 'relu', 'heading_error_out_channels_l0': 198, 'heading_error_pool_size_l0': 4, 'heading_error_out_channels_l1': 52, 'heading_error_pool_size_l1': 2, 'heading_error_out_channels_l2': 40, 'heading_error_pool_size_l2': 2, 'heading_error_out_channels_l3': 59, 'heading_error_pool_size_l3': 2, 'heading_error_out_channels_l4': 89, 'heading_error_pool_size_l4': 4, 'heading_error_fc_hidden': 58}. Best is trial 4 with value: 0.0986.
[rank: 0] Seed set to 42
[rank: 0] Seed set to 42
GPU available: True (cuda), used: True
TPU available: False, using: 0 TPU cores
💡 Tip: For seamless cloud logging and experiment tracking, try installing [litlogger](https://pypi.org/project/litlogger/) to enable LitLogger, which logs metrics and artifacts automatically to the Lightning Experiments platform.
GPU available: True (cuda), used: True
TPU available: False, using: 0 TPU cores
💡 Tip: For seamless cloud logging and experiment tracking, try installing [litlogger](https://pypi.org/project/litlogger/) to enable LitLogger, which logs metrics and artifacts automatically to the Lightning Experiments platform.
[rank: 0] Seed set to 42
GPU available: True (cuda), used: True
TPU available: False, using: 0 TPU cores
💡 Tip: For seamless cloud logging and experiment tracking, try installing [litlogger](https://pypi.org/project/litlogger/) to enable LitLogger, which logs metrics and artifacts automatically to the Lightning Experiments platform.
LOCAL_RANK: 0 - CUDA_VISIBLE_DEVICES: [0]
LOCAL_RANK: 0 - CUDA_VISIBLE_DEVICES: [0]
LOCAL_RANK: 0 - CUDA_VISIBLE_DEVICES: [0]
SLURM auto-requeueing enabled. Setting signal handlers.
SLURM auto-requeueing enabled. Setting signal handlers.
SLURM auto-requeueing enabled. Setting signal handlers.
`Trainer.fit` stopped: `max_epochs=30` reached.
`Trainer.fit` stopped: `max_epochs=30` reached.
`Trainer.fit` stopped: `max_epochs=30` reached.
[I 2026-04-14 23:06:59,631] Trial 59 finished with value: 0.1425 and parameters: {'left_wall_dist_num_layers': 3, 'left_wall_dist_activation': 'elu', 'left_wall_dist_out_channels_l0': 131, 'left_wall_dist_pool_size_l0': 2, 'left_wall_dist_out_channels_l1': 55, 'left_wall_dist_pool_size_l1': 4, 'left_wall_dist_out_channels_l2': 40, 'left_wall_dist_pool_size_l2': 4, 'left_wall_dist_fc_hidden': 47, 'track_width_num_layers': 2, 'track_width_activation': 'elu', 'track_width_out_channels_l0': 127, 'track_width_pool_size_l0': 2, 'track_width_out_channels_l1': 68, 'track_width_pool_size_l1': 8, 'track_width_fc_hidden': 102, 'heading_error_num_layers': 5, 'heading_error_activation': 'elu', 'heading_error_out_channels_l0': 124, 'heading_error_pool_size_l0': 4, 'heading_error_out_channels_l1': 85, 'heading_error_pool_size_l1': 4, 'heading_error_out_channels_l2': 35, 'heading_error_pool_size_l2': 2, 'heading_error_out_channels_l3': 46, 'heading_error_pool_size_l3': 2, 'heading_error_out_channels_l4': 106, 'heading_error_pool_size_l4': 8}. Best is trial 4 with value: 0.0986.
[rank: 0] Seed set to 42
[rank: 0] Seed set to 42
[rank: 0] Seed set to 42
GPU available: True (cuda), used: True
TPU available: False, using: 0 TPU cores
💡 Tip: For seamless cloud logging and experiment tracking, try installing [litlogger](https://pypi.org/project/litlogger/) to enable LitLogger, which logs metrics and artifacts automatically to the Lightning Experiments platform.
GPU available: True (cuda), used: True
TPU available: False, using: 0 TPU cores
💡 Tip: For seamless cloud logging and experiment tracking, try installing [litlogger](https://pypi.org/project/litlogger/) to enable LitLogger, which logs metrics and artifacts automatically to the Lightning Experiments platform.
GPU available: True (cuda), used: True
TPU available: False, using: 0 TPU cores
💡 Tip: For seamless cloud logging and experiment tracking, try installing [litlogger](https://pypi.org/project/litlogger/) to enable LitLogger, which logs metrics and artifacts automatically to the Lightning Experiments platform.
LOCAL_RANK: 0 - CUDA_VISIBLE_DEVICES: [0]
LOCAL_RANK: 0 - CUDA_VISIBLE_DEVICES: [0]
LOCAL_RANK: 0 - CUDA_VISIBLE_DEVICES: [0]
SLURM auto-requeueing enabled. Setting signal handlers.
SLURM auto-requeueing enabled. Setting signal handlers.
SLURM auto-requeueing enabled. Setting signal handlers.
`Trainer.fit` stopped: `max_epochs=30` reached.
`Trainer.fit` stopped: `max_epochs=30` reached.
`Trainer.fit` stopped: `max_epochs=30` reached.
[I 2026-04-14 23:09:55,582] Trial 60 finished with value: 0.1255 and parameters: {'left_wall_dist_num_layers': 2, 'left_wall_dist_activation': 'elu', 'left_wall_dist_out_channels_l0': 115, 'left_wall_dist_pool_size_l0': 8, 'left_wall_dist_out_channels_l1': 42, 'left_wall_dist_pool_size_l1': 4, 'left_wall_dist_fc_hidden': 62, 'track_width_num_layers': 3, 'track_width_activation': 'elu', 'track_width_out_channels_l0': 207, 'track_width_pool_size_l0': 4, 'track_width_out_channels_l1': 43, 'track_width_pool_size_l1': 2, 'track_width_out_channels_l2': 189, 'track_width_pool_size_l2': 4, 'track_width_fc_hidden': 113, 'heading_error_num_layers': 4, 'heading_error_activation': 'relu', 'heading_error_out_channels_l0': 149, 'heading_error_pool_size_l0': 2, 'heading_error_out_channels_l1': 73, 'heading_error_pool_size_l1': 4, 'heading_error_out_channels_l2': 159, 'heading_error_pool_size_l2': 4, 'heading_error_out_channels_l3': 70, 'heading_error_pool_size_l3': 2, 'heading_error_fc_hidden': 127}. Best is trial 4 with value: 0.0986.
[rank: 0] Seed set to 42
GPU available: True (cuda), used: True
TPU available: False, using: 0 TPU cores
💡 Tip: For seamless cloud logging and experiment tracking, try installing [litlogger](https://pypi.org/project/litlogger/) to enable LitLogger, which logs metrics and artifacts automatically to the Lightning Experiments platform.
[rank: 0] Seed set to 42
GPU available: True (cuda), used: True
TPU available: False, using: 0 TPU cores
💡 Tip: For seamless cloud logging and experiment tracking, try installing [litlogger](https://pypi.org/project/litlogger/) to enable LitLogger, which logs metrics and artifacts automatically to the Lightning Experiments platform.
[rank: 0] Seed set to 42
GPU available: True (cuda), used: True
TPU available: False, using: 0 TPU cores
💡 Tip: For seamless cloud logging and experiment tracking, try installing [litlogger](https://pypi.org/project/litlogger/) to enable LitLogger, which logs metrics and artifacts automatically to the Lightning Experiments platform.
LOCAL_RANK: 0 - CUDA_VISIBLE_DEVICES: [0]
LOCAL_RANK: 0 - CUDA_VISIBLE_DEVICES: [0]
LOCAL_RANK: 0 - CUDA_VISIBLE_DEVICES: [0]
SLURM auto-requeueing enabled. Setting signal handlers.
SLURM auto-requeueing enabled. Setting signal handlers.
SLURM auto-requeueing enabled. Setting signal handlers.
`Trainer.fit` stopped: `max_epochs=30` reached.
`Trainer.fit` stopped: `max_epochs=30` reached.
`Trainer.fit` stopped: `max_epochs=30` reached.
[I 2026-04-14 23:12:41,694] Trial 61 finished with value: 0.1167 and parameters: {'left_wall_dist_num_layers': 2, 'left_wall_dist_activation': 'elu', 'left_wall_dist_out_channels_l0': 75, 'left_wall_dist_pool_size_l0': 2, 'left_wall_dist_out_channels_l1': 38, 'left_wall_dist_pool_size_l1': 4, 'left_wall_dist_fc_hidden': 125, 'track_width_num_layers': 2, 'track_width_activation': 'elu', 'track_width_out_channels_l0': 120, 'track_width_pool_size_l0': 4, 'track_width_out_channels_l1': 41, 'track_width_pool_size_l1': 8, 'track_width_fc_hidden': 78, 'heading_error_num_layers': 5, 'heading_error_activation': 'relu', 'heading_error_out_channels_l0': 108, 'heading_error_pool_size_l0': 4, 'heading_error_out_channels_l1': 61, 'heading_error_pool_size_l1': 4, 'heading_error_out_channels_l2': 61, 'heading_error_pool_size_l2': 2, 'heading_error_out_channels_l3': 72, 'heading_error_pool_size_l3': 2, 'heading_error_out_channels_l4': 245, 'heading_error_pool_size_l4': 4, 'heading_error_fc_hidden': 90}. Best is trial 4 with value: 0.0986.
[rank: 0] Seed set to 42
[rank: 0] Seed set to 42
[rank: 0] Seed set to 42
GPU available: True (cuda), used: True
TPU available: False, using: 0 TPU cores
GPU available: True (cuda), used: True
TPU available: False, using: 0 TPU cores
💡 Tip: For seamless cloud logging and experiment tracking, try installing [litlogger](https://pypi.org/project/litlogger/) to enable LitLogger, which logs metrics and artifacts automatically to the Lightning Experiments platform.
💡 Tip: For seamless cloud logging and experiment tracking, try installing [litlogger](https://pypi.org/project/litlogger/) to enable LitLogger, which logs metrics and artifacts automatically to the Lightning Experiments platform.
GPU available: True (cuda), used: True
TPU available: False, using: 0 TPU cores
💡 Tip: For seamless cloud logging and experiment tracking, try installing [litlogger](https://pypi.org/project/litlogger/) to enable LitLogger, which logs metrics and artifacts automatically to the Lightning Experiments platform.
LOCAL_RANK: 0 - CUDA_VISIBLE_DEVICES: [0]
LOCAL_RANK: 0 - CUDA_VISIBLE_DEVICES: [0]
LOCAL_RANK: 0 - CUDA_VISIBLE_DEVICES: [0]
SLURM auto-requeueing enabled. Setting signal handlers.
SLURM auto-requeueing enabled. Setting signal handlers.
SLURM auto-requeueing enabled. Setting signal handlers.
`Trainer.fit` stopped: `max_epochs=30` reached.
`Trainer.fit` stopped: `max_epochs=30` reached.
`Trainer.fit` stopped: `max_epochs=30` reached.
[I 2026-04-14 23:15:30,787] Trial 62 finished with value: 0.1242 and parameters: {'left_wall_dist_num_layers': 2, 'left_wall_dist_activation': 'elu', 'left_wall_dist_out_channels_l0': 79, 'left_wall_dist_pool_size_l0': 2, 'left_wall_dist_out_channels_l1': 36, 'left_wall_dist_pool_size_l1': 4, 'left_wall_dist_fc_hidden': 124, 'track_width_num_layers': 2, 'track_width_activation': 'elu', 'track_width_out_channels_l0': 134, 'track_width_pool_size_l0': 4, 'track_width_out_channels_l1': 40, 'track_width_pool_size_l1': 8, 'track_width_fc_hidden': 76, 'heading_error_num_layers': 5, 'heading_error_activation': 'relu', 'heading_error_out_channels_l0': 99, 'heading_error_pool_size_l0': 4, 'heading_error_out_channels_l1': 65, 'heading_error_pool_size_l1': 4, 'heading_error_out_channels_l2': 71, 'heading_error_pool_size_l2': 2, 'heading_error_out_channels_l3': 86, 'heading_error_pool_size_l3': 2, 'heading_error_out_channels_l4': 254, 'heading_error_pool_size_l4': 4, 'heading_error_fc_hidden': 76}. Best is trial 4 with value: 0.0986.
[rank: 0] Seed set to 42
[rank: 0] Seed set to 42
[rank: 0] Seed set to 42
GPU available: True (cuda), used: True
TPU available: False, using: 0 TPU cores
💡 Tip: For seamless cloud logging and experiment tracking, try installing [litlogger](https://pypi.org/project/litlogger/) to enable LitLogger, which logs metrics and artifacts automatically to the Lightning Experiments platform.
GPU available: True (cuda), used: True
TPU available: False, using: 0 TPU cores
💡 Tip: For seamless cloud logging and experiment tracking, try installing [litlogger](https://pypi.org/project/litlogger/) to enable LitLogger, which logs metrics and artifacts automatically to the Lightning Experiments platform.
GPU available: True (cuda), used: True
TPU available: False, using: 0 TPU cores
💡 Tip: For seamless cloud logging and experiment tracking, try installing [litlogger](https://pypi.org/project/litlogger/) to enable LitLogger, which logs metrics and artifacts automatically to the Lightning Experiments platform.
LOCAL_RANK: 0 - CUDA_VISIBLE_DEVICES: [0]
LOCAL_RANK: 0 - CUDA_VISIBLE_DEVICES: [0]
LOCAL_RANK: 0 - CUDA_VISIBLE_DEVICES: [0]
SLURM auto-requeueing enabled. Setting signal handlers.
SLURM auto-requeueing enabled. Setting signal handlers.
SLURM auto-requeueing enabled. Setting signal handlers.
`Trainer.fit` stopped: `max_epochs=30` reached.
`Trainer.fit` stopped: `max_epochs=30` reached.
`Trainer.fit` stopped: `max_epochs=30` reached.
