[I 2026-04-12 15:25:58,883] Trial 49 finished with value: 0.1451 and parameters: {'left_wall_dist_num_layers': 2, 'left_wall_dist_activation': 'relu', 'left_wall_dist_out_channels_l0': 100, 'left_wall_dist_pool_size_l0': 4, 'left_wall_dist_out_channels_l1': 51, 'left_wall_dist_pool_size_l1': 2, 'left_wall_dist_fc_hidden': 107, 'track_width_num_layers': 2, 'track_width_activation': 'elu', 'track_width_out_channels_l0': 113, 'track_width_pool_size_l0': 2, 'track_width_out_channels_l1': 56, 'track_width_pool_size_l1': 2, 'heading_error_num_layers': 3, 'heading_error_activation': 'elu', 'heading_error_out_channels_l0': 51, 'heading_error_pool_size_l0': 2, 'heading_error_out_channels_l1': 142, 'heading_error_pool_size_l1': 4, 'heading_error_out_channels_l2': 180, 'heading_error_pool_size_l2': 4, 'heading_error_fc_hidden': 107}. Best is trial 42 with value: 0.1068.
[rank: 0] Seed set to 42
[rank: 0] Seed set to 42
[rank: 0] Seed set to 42
GPU available: True (cuda), used: True
GPU available: True (cuda), used: True
TPU available: False, using: 0 TPU cores
TPU available: False, using: 0 TPU cores
💡 Tip: For seamless cloud logging and experiment tracking, try installing [litlogger](https://pypi.org/project/litlogger/) to enable LitLogger, which logs metrics and artifacts automatically to the Lightning Experiments platform.
💡 Tip: For seamless cloud logging and experiment tracking, try installing [litlogger](https://pypi.org/project/litlogger/) to enable LitLogger, which logs metrics and artifacts automatically to the Lightning Experiments platform.
GPU available: True (cuda), used: True
TPU available: False, using: 0 TPU cores
💡 Tip: For seamless cloud logging and experiment tracking, try installing [litlogger](https://pypi.org/project/litlogger/) to enable LitLogger, which logs metrics and artifacts automatically to the Lightning Experiments platform.
LOCAL_RANK: 0 - CUDA_VISIBLE_DEVICES: [0]
LOCAL_RANK: 0 - CUDA_VISIBLE_DEVICES: [0]
LOCAL_RANK: 0 - CUDA_VISIBLE_DEVICES: [0]
SLURM auto-requeueing enabled. Setting signal handlers.
SLURM auto-requeueing enabled. Setting signal handlers.
SLURM auto-requeueing enabled. Setting signal handlers.
`Trainer.fit` stopped: `max_epochs=20` reached.
`Trainer.fit` stopped: `max_epochs=20` reached.
`Trainer.fit` stopped: `max_epochs=20` reached.
[I 2026-04-12 15:28:29,736] Trial 50 finished with value: 0.1266 and parameters: {'left_wall_dist_num_layers': 4, 'left_wall_dist_activation': 'relu', 'left_wall_dist_out_channels_l0': 72, 'left_wall_dist_pool_size_l0': 2, 'left_wall_dist_out_channels_l1': 188, 'left_wall_dist_pool_size_l1': 2, 'left_wall_dist_out_channels_l2': 43, 'left_wall_dist_pool_size_l2': 2, 'left_wall_dist_out_channels_l3': 136, 'left_wall_dist_pool_size_l3': 2, 'track_width_num_layers': 4, 'track_width_activation': 'relu', 'track_width_out_channels_l0': 101, 'track_width_pool_size_l0': 4, 'track_width_out_channels_l1': 83, 'track_width_pool_size_l1': 2, 'track_width_out_channels_l2': 38, 'track_width_pool_size_l2': 4, 'track_width_out_channels_l3': 57, 'track_width_pool_size_l3': 2, 'track_width_fc_hidden': 59, 'heading_error_num_layers': 5, 'heading_error_activation': 'relu', 'heading_error_out_channels_l0': 63, 'heading_error_pool_size_l0': 2, 'heading_error_out_channels_l1': 73, 'heading_error_pool_size_l1': 2, 'heading_error_out_channels_l2': 114, 'heading_error_pool_size_l2': 2, 'heading_error_out_channels_l3': 33, 'heading_error_pool_size_l3': 4, 'heading_error_out_channels_l4': 95, 'heading_error_pool_size_l4': 4, 'heading_error_fc_hidden': 59}. Best is trial 42 with value: 0.1068.
[rank: 0] Seed set to 42
GPU available: True (cuda), used: True
TPU available: False, using: 0 TPU cores
💡 Tip: For seamless cloud logging and experiment tracking, try installing [litlogger](https://pypi.org/project/litlogger/) to enable LitLogger, which logs metrics and artifacts automatically to the Lightning Experiments platform.
[rank: 0] Seed set to 42
GPU available: True (cuda), used: True
TPU available: False, using: 0 TPU cores
💡 Tip: For seamless cloud logging and experiment tracking, try installing [litlogger](https://pypi.org/project/litlogger/) to enable LitLogger, which logs metrics and artifacts automatically to the Lightning Experiments platform.
LOCAL_RANK: 0 - CUDA_VISIBLE_DEVICES: [0]
LOCAL_RANK: 0 - CUDA_VISIBLE_DEVICES: [0]
SLURM auto-requeueing enabled. Setting signal handlers.
[rank: 0] Seed set to 42
SLURM auto-requeueing enabled. Setting signal handlers.
GPU available: True (cuda), used: True
TPU available: False, using: 0 TPU cores
💡 Tip: For seamless cloud logging and experiment tracking, try installing [litlogger](https://pypi.org/project/litlogger/) to enable LitLogger, which logs metrics and artifacts automatically to the Lightning Experiments platform.
LOCAL_RANK: 0 - CUDA_VISIBLE_DEVICES: [0]
SLURM auto-requeueing enabled. Setting signal handlers.
`Trainer.fit` stopped: `max_epochs=20` reached.
`Trainer.fit` stopped: `max_epochs=20` reached.
`Trainer.fit` stopped: `max_epochs=20` reached.
[I 2026-04-12 15:30:47,884] Trial 51 finished with value: 0.1686 and parameters: {'left_wall_dist_num_layers': 3, 'left_wall_dist_activation': 'relu', 'left_wall_dist_out_channels_l0': 256, 'left_wall_dist_pool_size_l0': 4, 'left_wall_dist_out_channels_l1': 34, 'left_wall_dist_pool_size_l1': 8, 'left_wall_dist_out_channels_l2': 62, 'left_wall_dist_pool_size_l2': 4, 'left_wall_dist_fc_hidden': 35, 'track_width_num_layers': 3, 'track_width_activation': 'elu', 'track_width_out_channels_l0': 81, 'track_width_pool_size_l0': 2, 'track_width_out_channels_l1': 118, 'track_width_pool_size_l1': 8, 'track_width_out_channels_l2': 70, 'track_width_pool_size_l2': 4, 'track_width_fc_hidden': 47, 'heading_error_num_layers': 5, 'heading_error_activation': 'elu', 'heading_error_out_channels_l0': 95, 'heading_error_pool_size_l0': 2, 'heading_error_out_channels_l1': 68, 'heading_error_pool_size_l1': 2, 'heading_error_out_channels_l2': 228, 'heading_error_pool_size_l2': 4, 'heading_error_out_channels_l3': 182, 'heading_error_pool_size_l3': 2, 'heading_error_out_channels_l4': 36, 'heading_error_pool_size_l4': 2, 'heading_error_fc_hidden': 67}. Best is trial 42 with value: 0.1068.
[rank: 0] Seed set to 42
GPU available: True (cuda), used: True
TPU available: False, using: 0 TPU cores
💡 Tip: For seamless cloud logging and experiment tracking, try installing [litlogger](https://pypi.org/project/litlogger/) to enable LitLogger, which logs metrics and artifacts automatically to the Lightning Experiments platform.
[rank: 0] Seed set to 42
[rank: 0] Seed set to 42
GPU available: True (cuda), used: True
TPU available: False, using: 0 TPU cores
💡 Tip: For seamless cloud logging and experiment tracking, try installing [litlogger](https://pypi.org/project/litlogger/) to enable LitLogger, which logs metrics and artifacts automatically to the Lightning Experiments platform.
GPU available: True (cuda), used: True
TPU available: False, using: 0 TPU cores
💡 Tip: For seamless cloud logging and experiment tracking, try installing [litlogger](https://pypi.org/project/litlogger/) to enable LitLogger, which logs metrics and artifacts automatically to the Lightning Experiments platform.
LOCAL_RANK: 0 - CUDA_VISIBLE_DEVICES: [0]
LOCAL_RANK: 0 - CUDA_VISIBLE_DEVICES: [0]
LOCAL_RANK: 0 - CUDA_VISIBLE_DEVICES: [0]
SLURM auto-requeueing enabled. Setting signal handlers.
SLURM auto-requeueing enabled. Setting signal handlers.
SLURM auto-requeueing enabled. Setting signal handlers.
`Trainer.fit` stopped: `max_epochs=20` reached.
`Trainer.fit` stopped: `max_epochs=20` reached.
`Trainer.fit` stopped: `max_epochs=20` reached.
[I 2026-04-12 15:33:09,294] Trial 52 finished with value: 0.1286 and parameters: {'left_wall_dist_num_layers': 3, 'left_wall_dist_activation': 'relu', 'left_wall_dist_out_channels_l0': 230, 'left_wall_dist_pool_size_l0': 4, 'left_wall_dist_out_channels_l1': 32, 'left_wall_dist_pool_size_l1': 8, 'left_wall_dist_out_channels_l2': 50, 'left_wall_dist_pool_size_l2': 4, 'left_wall_dist_fc_hidden': 37, 'track_width_num_layers': 3, 'track_width_activation': 'elu', 'track_width_out_channels_l0': 90, 'track_width_pool_size_l0': 2, 'track_width_out_channels_l1': 119, 'track_width_pool_size_l1': 8, 'track_width_out_channels_l2': 86, 'track_width_pool_size_l2': 4, 'track_width_fc_hidden': 51, 'heading_error_num_layers': 5, 'heading_error_activation': 'elu', 'heading_error_out_channels_l0': 88, 'heading_error_pool_size_l0': 2, 'heading_error_out_channels_l1': 63, 'heading_error_pool_size_l1': 2, 'heading_error_out_channels_l2': 212, 'heading_error_pool_size_l2': 4, 'heading_error_out_channels_l3': 187, 'heading_error_pool_size_l3': 2, 'heading_error_out_channels_l4': 32, 'heading_error_pool_size_l4': 2, 'heading_error_fc_hidden': 74}. Best is trial 42 with value: 0.1068.
[rank: 0] Seed set to 42
GPU available: True (cuda), used: True
TPU available: False, using: 0 TPU cores
💡 Tip: For seamless cloud logging and experiment tracking, try installing [litlogger](https://pypi.org/project/litlogger/) to enable LitLogger, which logs metrics and artifacts automatically to the Lightning Experiments platform.
[rank: 0] Seed set to 42
GPU available: True (cuda), used: True
TPU available: False, using: 0 TPU cores
💡 Tip: For seamless cloud logging and experiment tracking, try installing [litlogger](https://pypi.org/project/litlogger/) to enable LitLogger, which logs metrics and artifacts automatically to the Lightning Experiments platform.
[rank: 0] Seed set to 42
GPU available: True (cuda), used: True
TPU available: False, using: 0 TPU cores
💡 Tip: For seamless cloud logging and experiment tracking, try installing [litlogger](https://pypi.org/project/litlogger/) to enable LitLogger, which logs metrics and artifacts automatically to the Lightning Experiments platform.
LOCAL_RANK: 0 - CUDA_VISIBLE_DEVICES: [0]
LOCAL_RANK: 0 - CUDA_VISIBLE_DEVICES: [0]
LOCAL_RANK: 0 - CUDA_VISIBLE_DEVICES: [0]
SLURM auto-requeueing enabled. Setting signal handlers.
SLURM auto-requeueing enabled. Setting signal handlers.
SLURM auto-requeueing enabled. Setting signal handlers.
`Trainer.fit` stopped: `max_epochs=20` reached.
`Trainer.fit` stopped: `max_epochs=20` reached.
`Trainer.fit` stopped: `max_epochs=20` reached.
[I 2026-04-12 15:35:24,362] Trial 53 finished with value: 0.133 and parameters: {'left_wall_dist_num_layers': 3, 'left_wall_dist_activation': 'relu', 'left_wall_dist_out_channels_l0': 236, 'left_wall_dist_pool_size_l0': 4, 'left_wall_dist_out_channels_l1': 43, 'left_wall_dist_pool_size_l1': 8, 'left_wall_dist_out_channels_l2': 57, 'left_wall_dist_pool_size_l2': 4, 'left_wall_dist_fc_hidden': 33, 'track_width_num_layers': 3, 'track_width_activation': 'elu', 'track_width_out_channels_l0': 78, 'track_width_pool_size_l0': 2, 'track_width_out_channels_l1': 144, 'track_width_pool_size_l1': 8, 'track_width_out_channels_l2': 139, 'track_width_pool_size_l2': 4, 'track_width_fc_hidden': 39, 'heading_error_num_layers': 5, 'heading_error_activation': 'elu', 'heading_error_out_channels_l0': 73, 'heading_error_pool_size_l0': 2, 'heading_error_out_channels_l1': 45, 'heading_error_pool_size_l1': 2, 'heading_error_out_channels_l2': 172, 'heading_error_pool_size_l2': 4, 'heading_error_out_channels_l3': 168, 'heading_error_pool_size_l3': 2, 'heading_error_out_channels_l4': 234, 'heading_error_pool_size_l4': 2, 'heading_error_fc_hidden': 70}. Best is trial 42 with value: 0.1068.
[rank: 0] Seed set to 42
[rank: 0] Seed set to 42
GPU available: True (cuda), used: True
TPU available: False, using: 0 TPU cores
💡 Tip: For seamless cloud logging and experiment tracking, try installing [litlogger](https://pypi.org/project/litlogger/) to enable LitLogger, which logs metrics and artifacts automatically to the Lightning Experiments platform.
GPU available: True (cuda), used: True
TPU available: False, using: 0 TPU cores
💡 Tip: For seamless cloud logging and experiment tracking, try installing [litlogger](https://pypi.org/project/litlogger/) to enable LitLogger, which logs metrics and artifacts automatically to the Lightning Experiments platform.
[rank: 0] Seed set to 42
GPU available: True (cuda), used: True
TPU available: False, using: 0 TPU cores
💡 Tip: For seamless cloud logging and experiment tracking, try installing [litlogger](https://pypi.org/project/litlogger/) to enable LitLogger, which logs metrics and artifacts automatically to the Lightning Experiments platform.
LOCAL_RANK: 0 - CUDA_VISIBLE_DEVICES: [0]
LOCAL_RANK: 0 - CUDA_VISIBLE_DEVICES: [0]
LOCAL_RANK: 0 - CUDA_VISIBLE_DEVICES: [0]
SLURM auto-requeueing enabled. Setting signal handlers.
SLURM auto-requeueing enabled. Setting signal handlers.
SLURM auto-requeueing enabled. Setting signal handlers.
`Trainer.fit` stopped: `max_epochs=20` reached.
`Trainer.fit` stopped: `max_epochs=20` reached.
`Trainer.fit` stopped: `max_epochs=20` reached.
[I 2026-04-12 15:37:39,352] Trial 54 finished with value: 0.1173 and parameters: {'left_wall_dist_num_layers': 2, 'left_wall_dist_activation': 'relu', 'left_wall_dist_out_channels_l0': 199, 'left_wall_dist_pool_size_l0': 4, 'left_wall_dist_out_channels_l1': 40, 'left_wall_dist_pool_size_l1': 8, 'left_wall_dist_fc_hidden': 47, 'track_width_num_layers': 3, 'track_width_activation': 'elu', 'track_width_out_channels_l0': 85, 'track_width_pool_size_l0': 2, 'track_width_out_channels_l1': 109, 'track_width_pool_size_l1': 8, 'track_width_out_channels_l2': 91, 'track_width_pool_size_l2': 4, 'track_width_fc_hidden': 44, 'heading_error_num_layers': 5, 'heading_error_activation': 'elu', 'heading_error_out_channels_l0': 34, 'heading_error_pool_size_l0': 2, 'heading_error_out_channels_l1': 32, 'heading_error_pool_size_l1': 2, 'heading_error_out_channels_l2': 198, 'heading_error_pool_size_l2': 4, 'heading_error_out_channels_l3': 137, 'heading_error_pool_size_l3': 2, 'heading_error_out_channels_l4': 37, 'heading_error_pool_size_l4': 2, 'heading_error_fc_hidden': 61}. Best is trial 42 with value: 0.1068.
[rank: 0] Seed set to 42
GPU available: True (cuda), used: True
TPU available: False, using: 0 TPU cores
💡 Tip: For seamless cloud logging and experiment tracking, try installing [litlogger](https://pypi.org/project/litlogger/) to enable LitLogger, which logs metrics and artifacts automatically to the Lightning Experiments platform.
[rank: 0] Seed set to 42
GPU available: True (cuda), used: True
TPU available: False, using: 0 TPU cores
💡 Tip: For seamless cloud logging and experiment tracking, try installing [litlogger](https://pypi.org/project/litlogger/) to enable LitLogger, which logs metrics and artifacts automatically to the Lightning Experiments platform.
[rank: 0] Seed set to 42
GPU available: True (cuda), used: True
TPU available: False, using: 0 TPU cores
💡 Tip: For seamless cloud logging and experiment tracking, try installing [litlogger](https://pypi.org/project/litlogger/) to enable LitLogger, which logs metrics and artifacts automatically to the Lightning Experiments platform.
LOCAL_RANK: 0 - CUDA_VISIBLE_DEVICES: [0]
SLURM auto-requeueing enabled. Setting signal handlers.
LOCAL_RANK: 0 - CUDA_VISIBLE_DEVICES: [0]
LOCAL_RANK: 0 - CUDA_VISIBLE_DEVICES: [0]
SLURM auto-requeueing enabled. Setting signal handlers.
SLURM auto-requeueing enabled. Setting signal handlers.
`Trainer.fit` stopped: `max_epochs=20` reached.
`Trainer.fit` stopped: `max_epochs=20` reached.
`Trainer.fit` stopped: `max_epochs=20` reached.
[I 2026-04-12 15:40:03,252] Trial 55 finished with value: 0.3492 and parameters: {'left_wall_dist_num_layers': 3, 'left_wall_dist_activation': 'relu', 'left_wall_dist_out_channels_l0': 218, 'left_wall_dist_pool_size_l0': 4, 'left_wall_dist_out_channels_l1': 32, 'left_wall_dist_pool_size_l1': 8, 'left_wall_dist_out_channels_l2': 75, 'left_wall_dist_pool_size_l2': 8, 'left_wall_dist_fc_hidden': 35, 'track_width_num_layers': 4, 'track_width_activation': 'elu', 'track_width_out_channels_l0': 70, 'track_width_pool_size_l0': 2, 'track_width_out_channels_l1': 176, 'track_width_pool_size_l1': 8, 'track_width_out_channels_l2': 58, 'track_width_pool_size_l2': 4, 'track_width_out_channels_l3': 157, 'track_width_pool_size_l3': 4, 'track_width_fc_hidden': 36, 'heading_error_num_layers': 5, 'heading_error_activation': 'elu', 'heading_error_out_channels_l0': 104, 'heading_error_pool_size_l0': 2, 'heading_error_out_channels_l1': 96, 'heading_error_pool_size_l1': 2, 'heading_error_out_channels_l2': 157, 'heading_error_pool_size_l2': 4, 'heading_error_out_channels_l3': 202, 'heading_error_pool_size_l3': 8, 'heading_error_out_channels_l4': 48, 'heading_error_pool_size_l4': 2, 'heading_error_fc_hidden': 35}. Best is trial 42 with value: 0.1068.
[rank: 0] Seed set to 42
GPU available: True (cuda), used: True
TPU available: False, using: 0 TPU cores
💡 Tip: For seamless cloud logging and experiment tracking, try installing [litlogger](https://pypi.org/project/litlogger/) to enable LitLogger, which logs metrics and artifacts automatically to the Lightning Experiments platform.
[rank: 0] Seed set to 42
GPU available: True (cuda), used: True
TPU available: False, using: 0 TPU cores
💡 Tip: For seamless cloud logging and experiment tracking, try installing [litlogger](https://pypi.org/project/litlogger/) to enable LitLogger, which logs metrics and artifacts automatically to the Lightning Experiments platform.
LOCAL_RANK: 0 - CUDA_VISIBLE_DEVICES: [0]
LOCAL_RANK: 0 - CUDA_VISIBLE_DEVICES: [0]
SLURM auto-requeueing enabled. Setting signal handlers.
SLURM auto-requeueing enabled. Setting signal handlers.
[rank: 0] Seed set to 42
GPU available: True (cuda), used: True
TPU available: False, using: 0 TPU cores
💡 Tip: For seamless cloud logging and experiment tracking, try installing [litlogger](https://pypi.org/project/litlogger/) to enable LitLogger, which logs metrics and artifacts automatically to the Lightning Experiments platform.
LOCAL_RANK: 0 - CUDA_VISIBLE_DEVICES: [0]
SLURM auto-requeueing enabled. Setting signal handlers.
`Trainer.fit` stopped: `max_epochs=20` reached.
`Trainer.fit` stopped: `max_epochs=20` reached.
`Trainer.fit` stopped: `max_epochs=20` reached.
[I 2026-04-12 15:42:28,784] Trial 56 finished with value: 0.3604 and parameters: {'left_wall_dist_num_layers': 4, 'left_wall_dist_activation': 'relu', 'left_wall_dist_out_channels_l0': 59, 'left_wall_dist_pool_size_l0': 4, 'left_wall_dist_out_channels_l1': 54, 'left_wall_dist_pool_size_l1': 2, 'left_wall_dist_out_channels_l2': 93, 'left_wall_dist_pool_size_l2': 4, 'left_wall_dist_out_channels_l3': 51, 'left_wall_dist_pool_size_l3': 8, 'left_wall_dist_fc_hidden': 34, 'track_width_num_layers': 3, 'track_width_activation': 'relu', 'track_width_out_channels_l0': 130, 'track_width_pool_size_l0': 4, 'track_width_out_channels_l1': 91, 'track_width_pool_size_l1': 2, 'track_width_out_channels_l2': 64, 'track_width_pool_size_l2': 4, 'track_width_fc_hidden': 53, 'heading_error_num_layers': 5, 'heading_error_activation': 'elu', 'heading_error_out_channels_l0': 57, 'heading_error_pool_size_l0': 2, 'heading_error_out_channels_l1': 58, 'heading_error_pool_size_l1': 2, 'heading_error_out_channels_l2': 220, 'heading_error_pool_size_l2': 4, 'heading_error_out_channels_l3': 233, 'heading_error_pool_size_l3': 4, 'heading_error_out_channels_l4': 37, 'heading_error_pool_size_l4': 2, 'heading_error_fc_hidden': 54}. Best is trial 42 with value: 0.1068.
[rank: 0] Seed set to 42
GPU available: True (cuda), used: True
TPU available: False, using: 0 TPU cores
💡 Tip: For seamless cloud logging and experiment tracking, try installing [litlogger](https://pypi.org/project/litlogger/) to enable LitLogger, which logs metrics and artifacts automatically to the Lightning Experiments platform.
[rank: 0] Seed set to 42
GPU available: True (cuda), used: True
TPU available: False, using: 0 TPU cores
💡 Tip: For seamless cloud logging and experiment tracking, try installing [litlogger](https://pypi.org/project/litlogger/) to enable LitLogger, which logs metrics and artifacts automatically to the Lightning Experiments platform.
LOCAL_RANK: 0 - CUDA_VISIBLE_DEVICES: [0]
LOCAL_RANK: 0 - CUDA_VISIBLE_DEVICES: [0]
SLURM auto-requeueing enabled. Setting signal handlers.
[rank: 0] Seed set to 42
SLURM auto-requeueing enabled. Setting signal handlers.
GPU available: True (cuda), used: True
TPU available: False, using: 0 TPU cores
💡 Tip: For seamless cloud logging and experiment tracking, try installing [litlogger](https://pypi.org/project/litlogger/) to enable LitLogger, which logs metrics and artifacts automatically to the Lightning Experiments platform.
LOCAL_RANK: 0 - CUDA_VISIBLE_DEVICES: [0]
SLURM auto-requeueing enabled. Setting signal handlers.
`Trainer.fit` stopped: `max_epochs=20` reached.
`Trainer.fit` stopped: `max_epochs=20` reached.
`Trainer.fit` stopped: `max_epochs=20` reached.
