[I 2026-04-15 21:44:41,348] Trial 7 finished with value: inf and parameters: {'left_wall_dist_num_layers': 3, 'left_wall_dist_activation': 'elu', 'left_wall_dist_out_channels_l0': 101, 'left_wall_dist_pool_size_l0': 2, 'left_wall_dist_out_channels_l1': 93, 'left_wall_dist_pool_size_l1': 8, 'left_wall_dist_out_channels_l2': 246, 'left_wall_dist_pool_size_l2': 2, 'left_wall_dist_fc_hidden': 128, 'track_width_num_layers': 4, 'track_width_activation': 'elu', 'track_width_out_channels_l0': 147, 'track_width_pool_size_l0': 4, 'track_width_out_channels_l1': 182, 'track_width_pool_size_l1': 4, 'track_width_out_channels_l2': 33, 'track_width_pool_size_l2': 2, 'track_width_out_channels_l3': 130, 'track_width_pool_size_l3': 8, 'track_width_fc_hidden': 54, 'heading_error_num_layers': 5, 'heading_error_activation': 'relu', 'heading_error_out_channels_l0': 54, 'heading_error_pool_size_l0': 4, 'heading_error_out_channels_l1': 33, 'heading_error_pool_size_l1': 8, 'heading_error_out_channels_l2': 76, 'heading_error_pool_size_l2': 8, 'heading_error_out_channels_l3': 122, 'heading_error_pool_size_l3': 2}. Best is trial 3 with value: 0.1186.
[rank: 0] Seed set to 42
[rank: 0] Seed set to 42
GPU available: True (cuda), used: True
TPU available: False, using: 0 TPU cores
💡 Tip: For seamless cloud logging and experiment tracking, try installing [litlogger](https://pypi.org/project/litlogger/) to enable LitLogger, which logs metrics and artifacts automatically to the Lightning Experiments platform.
GPU available: True (cuda), used: True
TPU available: False, using: 0 TPU cores
💡 Tip: For seamless cloud logging and experiment tracking, try installing [litlogger](https://pypi.org/project/litlogger/) to enable LitLogger, which logs metrics and artifacts automatically to the Lightning Experiments platform.
[rank: 0] Seed set to 42
GPU available: True (cuda), used: True
TPU available: False, using: 0 TPU cores
💡 Tip: For seamless cloud logging and experiment tracking, try installing [litlogger](https://pypi.org/project/litlogger/) to enable LitLogger, which logs metrics and artifacts automatically to the Lightning Experiments platform.
LOCAL_RANK: 0 - CUDA_VISIBLE_DEVICES: [0]
LOCAL_RANK: 0 - CUDA_VISIBLE_DEVICES: [0]
LOCAL_RANK: 0 - CUDA_VISIBLE_DEVICES: [0]
SLURM auto-requeueing enabled. Setting signal handlers.
SLURM auto-requeueing enabled. Setting signal handlers.
SLURM auto-requeueing enabled. Setting signal handlers.
`Trainer.fit` stopped: `max_epochs=30` reached.
`Trainer.fit` stopped: `max_epochs=30` reached.
`Trainer.fit` stopped: `max_epochs=30` reached.
[I 2026-04-15 21:47:29,576] Trial 8 finished with value: 0.1189 and parameters: {'left_wall_dist_num_layers': 3, 'left_wall_dist_activation': 'relu', 'left_wall_dist_out_channels_l0': 183, 'left_wall_dist_pool_size_l0': 4, 'left_wall_dist_out_channels_l1': 41, 'left_wall_dist_pool_size_l1': 4, 'left_wall_dist_out_channels_l2': 145, 'left_wall_dist_pool_size_l2': 4, 'left_wall_dist_fc_hidden': 118, 'track_width_num_layers': 5, 'track_width_activation': 'relu', 'track_width_out_channels_l0': 84, 'track_width_pool_size_l0': 4, 'track_width_out_channels_l1': 114, 'track_width_pool_size_l1': 8, 'track_width_out_channels_l2': 49, 'track_width_pool_size_l2': 2, 'track_width_out_channels_l3': 78, 'track_width_pool_size_l3': 4, 'track_width_out_channels_l4': 35, 'track_width_pool_size_l4': 4, 'heading_error_num_layers': 5, 'heading_error_activation': 'elu', 'heading_error_out_channels_l0': 201, 'heading_error_pool_size_l0': 4, 'heading_error_out_channels_l1': 71, 'heading_error_pool_size_l1': 2, 'heading_error_out_channels_l2': 72, 'heading_error_pool_size_l2': 8, 'heading_error_out_channels_l3': 33, 'heading_error_pool_size_l3': 2, 'heading_error_out_channels_l4': 93, 'heading_error_pool_size_l4': 2}. Best is trial 3 with value: 0.1186.
[rank: 0] Seed set to 42
GPU available: True (cuda), used: True
TPU available: False, using: 0 TPU cores
💡 Tip: For seamless cloud logging and experiment tracking, try installing [litlogger](https://pypi.org/project/litlogger/) to enable LitLogger, which logs metrics and artifacts automatically to the Lightning Experiments platform.
[rank: 0] Seed set to 42
[rank: 0] Seed set to 42
GPU available: True (cuda), used: True
TPU available: False, using: 0 TPU cores
💡 Tip: For seamless cloud logging and experiment tracking, try installing [litlogger](https://pypi.org/project/litlogger/) to enable LitLogger, which logs metrics and artifacts automatically to the Lightning Experiments platform.
GPU available: True (cuda), used: True
TPU available: False, using: 0 TPU cores
💡 Tip: For seamless cloud logging and experiment tracking, try installing [litlogger](https://pypi.org/project/litlogger/) to enable LitLogger, which logs metrics and artifacts automatically to the Lightning Experiments platform.
LOCAL_RANK: 0 - CUDA_VISIBLE_DEVICES: [0]
LOCAL_RANK: 0 - CUDA_VISIBLE_DEVICES: [0]
LOCAL_RANK: 0 - CUDA_VISIBLE_DEVICES: [0]
SLURM auto-requeueing enabled. Setting signal handlers.
SLURM auto-requeueing enabled. Setting signal handlers.
SLURM auto-requeueing enabled. Setting signal handlers.
`Trainer.fit` stopped: `max_epochs=30` reached.
`Trainer.fit` stopped: `max_epochs=30` reached.
`Trainer.fit` stopped: `max_epochs=30` reached.
[I 2026-04-15 21:49:59,741] Trial 9 finished with value: 0.1382 and parameters: {'left_wall_dist_num_layers': 2, 'left_wall_dist_activation': 'elu', 'left_wall_dist_out_channels_l0': 34, 'left_wall_dist_pool_size_l0': 8, 'left_wall_dist_out_channels_l1': 186, 'left_wall_dist_pool_size_l1': 2, 'track_width_num_layers': 2, 'track_width_activation': 'relu', 'track_width_out_channels_l0': 156, 'track_width_pool_size_l0': 8, 'track_width_out_channels_l1': 40, 'track_width_pool_size_l1': 2, 'track_width_fc_hidden': 124, 'heading_error_num_layers': 5, 'heading_error_activation': 'relu', 'heading_error_out_channels_l0': 41, 'heading_error_pool_size_l0': 4, 'heading_error_out_channels_l1': 115, 'heading_error_pool_size_l1': 2, 'heading_error_out_channels_l2': 116, 'heading_error_pool_size_l2': 4, 'heading_error_out_channels_l3': 181, 'heading_error_pool_size_l3': 4, 'heading_error_out_channels_l4': 152, 'heading_error_pool_size_l4': 4, 'heading_error_fc_hidden': 35}. Best is trial 3 with value: 0.1186.
[rank: 0] Seed set to 42
[rank: 0] Seed set to 42
[rank: 0] Seed set to 42
GPU available: True (cuda), used: True
TPU available: False, using: 0 TPU cores
💡 Tip: For seamless cloud logging and experiment tracking, try installing [litlogger](https://pypi.org/project/litlogger/) to enable LitLogger, which logs metrics and artifacts automatically to the Lightning Experiments platform.
GPU available: True (cuda), used: True
TPU available: False, using: 0 TPU cores
💡 Tip: For seamless cloud logging and experiment tracking, try installing [litlogger](https://pypi.org/project/litlogger/) to enable LitLogger, which logs metrics and artifacts automatically to the Lightning Experiments platform.
GPU available: True (cuda), used: True
TPU available: False, using: 0 TPU cores
💡 Tip: For seamless cloud logging and experiment tracking, try installing [litlogger](https://pypi.org/project/litlogger/) to enable LitLogger, which logs metrics and artifacts automatically to the Lightning Experiments platform.
LOCAL_RANK: 0 - CUDA_VISIBLE_DEVICES: [0]
LOCAL_RANK: 0 - CUDA_VISIBLE_DEVICES: [0]
LOCAL_RANK: 0 - CUDA_VISIBLE_DEVICES: [0]
SLURM auto-requeueing enabled. Setting signal handlers.
SLURM auto-requeueing enabled. Setting signal handlers.
SLURM auto-requeueing enabled. Setting signal handlers.
`Trainer.fit` stopped: `max_epochs=30` reached.
`Trainer.fit` stopped: `max_epochs=30` reached.
`Trainer.fit` stopped: `max_epochs=30` reached.
[I 2026-04-15 21:52:35,928] Trial 10 finished with value: 0.1074 and parameters: {'left_wall_dist_num_layers': 4, 'left_wall_dist_activation': 'elu', 'left_wall_dist_out_channels_l0': 96, 'left_wall_dist_pool_size_l0': 4, 'left_wall_dist_out_channels_l1': 137, 'left_wall_dist_pool_size_l1': 2, 'left_wall_dist_out_channels_l2': 32, 'left_wall_dist_pool_size_l2': 8, 'left_wall_dist_out_channels_l3': 32, 'left_wall_dist_pool_size_l3': 2, 'left_wall_dist_fc_hidden': 32, 'track_width_num_layers': 2, 'track_width_activation': 'relu', 'track_width_out_channels_l0': 34, 'track_width_pool_size_l0': 2, 'track_width_out_channels_l1': 135, 'track_width_pool_size_l1': 8, 'heading_error_num_layers': 3, 'heading_error_activation': 'relu', 'heading_error_out_channels_l0': 133, 'heading_error_pool_size_l0': 8, 'heading_error_out_channels_l1': 249, 'heading_error_pool_size_l1': 8, 'heading_error_out_channels_l2': 33, 'heading_error_pool_size_l2': 4}. Best is trial 10 with value: 0.1074.
[rank: 0] Seed set to 42
[rank: 0] Seed set to 42
[rank: 0] Seed set to 42
GPU available: True (cuda), used: True
GPU available: True (cuda), used: True
TPU available: False, using: 0 TPU cores
TPU available: False, using: 0 TPU cores
💡 Tip: For seamless cloud logging and experiment tracking, try installing [litlogger](https://pypi.org/project/litlogger/) to enable LitLogger, which logs metrics and artifacts automatically to the Lightning Experiments platform.
💡 Tip: For seamless cloud logging and experiment tracking, try installing [litlogger](https://pypi.org/project/litlogger/) to enable LitLogger, which logs metrics and artifacts automatically to the Lightning Experiments platform.
GPU available: True (cuda), used: True
TPU available: False, using: 0 TPU cores
💡 Tip: For seamless cloud logging and experiment tracking, try installing [litlogger](https://pypi.org/project/litlogger/) to enable LitLogger, which logs metrics and artifacts automatically to the Lightning Experiments platform.
LOCAL_RANK: 0 - CUDA_VISIBLE_DEVICES: [0]
LOCAL_RANK: 0 - CUDA_VISIBLE_DEVICES: [0]
LOCAL_RANK: 0 - CUDA_VISIBLE_DEVICES: [0]
SLURM auto-requeueing enabled. Setting signal handlers.
SLURM auto-requeueing enabled. Setting signal handlers.
SLURM auto-requeueing enabled. Setting signal handlers.
`Trainer.fit` stopped: `max_epochs=30` reached.
`Trainer.fit` stopped: `max_epochs=30` reached.
`Trainer.fit` stopped: `max_epochs=30` reached.
[I 2026-04-15 21:55:21,524] Trial 11 finished with value: 0.1492 and parameters: {'left_wall_dist_num_layers': 4, 'left_wall_dist_activation': 'elu', 'left_wall_dist_out_channels_l0': 110, 'left_wall_dist_pool_size_l0': 4, 'left_wall_dist_out_channels_l1': 140, 'left_wall_dist_pool_size_l1': 2, 'left_wall_dist_out_channels_l2': 33, 'left_wall_dist_pool_size_l2': 8, 'left_wall_dist_out_channels_l3': 32, 'left_wall_dist_pool_size_l3': 2, 'left_wall_dist_fc_hidden': 32, 'track_width_num_layers': 2, 'track_width_activation': 'relu', 'track_width_out_channels_l0': 33, 'track_width_pool_size_l0': 2, 'track_width_out_channels_l1': 140, 'track_width_pool_size_l1': 8, 'heading_error_num_layers': 3, 'heading_error_activation': 'relu', 'heading_error_out_channels_l0': 129, 'heading_error_pool_size_l0': 8, 'heading_error_out_channels_l1': 245, 'heading_error_pool_size_l1': 8, 'heading_error_out_channels_l2': 37, 'heading_error_pool_size_l2': 4}. Best is trial 10 with value: 0.1074.
[rank: 0] Seed set to 42
[rank: 0] Seed set to 42
[rank: 0] Seed set to 42
GPU available: True (cuda), used: True
TPU available: False, using: 0 TPU cores
💡 Tip: For seamless cloud logging and experiment tracking, try installing [litlogger](https://pypi.org/project/litlogger/) to enable LitLogger, which logs metrics and artifacts automatically to the Lightning Experiments platform.
GPU available: True (cuda), used: True
TPU available: False, using: 0 TPU cores
💡 Tip: For seamless cloud logging and experiment tracking, try installing [litlogger](https://pypi.org/project/litlogger/) to enable LitLogger, which logs metrics and artifacts automatically to the Lightning Experiments platform.
GPU available: True (cuda), used: True
TPU available: False, using: 0 TPU cores
💡 Tip: For seamless cloud logging and experiment tracking, try installing [litlogger](https://pypi.org/project/litlogger/) to enable LitLogger, which logs metrics and artifacts automatically to the Lightning Experiments platform.
LOCAL_RANK: 0 - CUDA_VISIBLE_DEVICES: [0]
LOCAL_RANK: 0 - CUDA_VISIBLE_DEVICES: [0]
LOCAL_RANK: 0 - CUDA_VISIBLE_DEVICES: [0]
SLURM auto-requeueing enabled. Setting signal handlers.
SLURM auto-requeueing enabled. Setting signal handlers.
SLURM auto-requeueing enabled. Setting signal handlers.
`Trainer.fit` stopped: `max_epochs=30` reached.
`Trainer.fit` stopped: `max_epochs=30` reached.
`Trainer.fit` stopped: `max_epochs=30` reached.
[I 2026-04-15 21:58:07,642] Trial 12 finished with value: 0.149 and parameters: {'left_wall_dist_num_layers': 5, 'left_wall_dist_activation': 'elu', 'left_wall_dist_out_channels_l0': 56, 'left_wall_dist_pool_size_l0': 4, 'left_wall_dist_out_channels_l1': 138, 'left_wall_dist_pool_size_l1': 2, 'left_wall_dist_out_channels_l2': 60, 'left_wall_dist_pool_size_l2': 8, 'left_wall_dist_out_channels_l3': 32, 'left_wall_dist_pool_size_l3': 2, 'left_wall_dist_out_channels_l4': 65, 'left_wall_dist_pool_size_l4': 8, 'left_wall_dist_fc_hidden': 32, 'track_width_num_layers': 2, 'track_width_activation': 'relu', 'track_width_out_channels_l0': 255, 'track_width_pool_size_l0': 2, 'track_width_out_channels_l1': 72, 'track_width_pool_size_l1': 8, 'track_width_fc_hidden': 91, 'heading_error_num_layers': 3, 'heading_error_activation': 'relu', 'heading_error_out_channels_l0': 118, 'heading_error_pool_size_l0': 8, 'heading_error_out_channels_l1': 168, 'heading_error_pool_size_l1': 8, 'heading_error_out_channels_l2': 32, 'heading_error_pool_size_l2': 4}. Best is trial 10 with value: 0.1074.
[rank: 0] Seed set to 42
[rank: 0] Seed set to 42
[rank: 0] Seed set to 42
GPU available: True (cuda), used: True
TPU available: False, using: 0 TPU cores
💡 Tip: For seamless cloud logging and experiment tracking, try installing [litlogger](https://pypi.org/project/litlogger/) to enable LitLogger, which logs metrics and artifacts automatically to the Lightning Experiments platform.
GPU available: True (cuda), used: True
TPU available: False, using: 0 TPU cores
💡 Tip: For seamless cloud logging and experiment tracking, try installing [litlogger](https://pypi.org/project/litlogger/) to enable LitLogger, which logs metrics and artifacts automatically to the Lightning Experiments platform.
GPU available: True (cuda), used: True
TPU available: False, using: 0 TPU cores
💡 Tip: For seamless cloud logging and experiment tracking, try installing [litlogger](https://pypi.org/project/litlogger/) to enable LitLogger, which logs metrics and artifacts automatically to the Lightning Experiments platform.
LOCAL_RANK: 0 - CUDA_VISIBLE_DEVICES: [0]
LOCAL_RANK: 0 - CUDA_VISIBLE_DEVICES: [0]
LOCAL_RANK: 0 - CUDA_VISIBLE_DEVICES: [0]
SLURM auto-requeueing enabled. Setting signal handlers.
SLURM auto-requeueing enabled. Setting signal handlers.
SLURM auto-requeueing enabled. Setting signal handlers.
`Trainer.fit` stopped: `max_epochs=30` reached.
`Trainer.fit` stopped: `max_epochs=30` reached.
`Trainer.fit` stopped: `max_epochs=30` reached.
[I 2026-04-15 22:00:52,425] Trial 13 finished with value: 0.1408 and parameters: {'left_wall_dist_num_layers': 4, 'left_wall_dist_activation': 'elu', 'left_wall_dist_out_channels_l0': 132, 'left_wall_dist_pool_size_l0': 4, 'left_wall_dist_out_channels_l1': 55, 'left_wall_dist_pool_size_l1': 2, 'left_wall_dist_out_channels_l2': 34, 'left_wall_dist_pool_size_l2': 8, 'left_wall_dist_out_channels_l3': 63, 'left_wall_dist_pool_size_l3': 2, 'left_wall_dist_fc_hidden': 43, 'track_width_num_layers': 4, 'track_width_activation': 'relu', 'track_width_out_channels_l0': 35, 'track_width_pool_size_l0': 2, 'track_width_out_channels_l1': 148, 'track_width_pool_size_l1': 8, 'track_width_out_channels_l2': 65, 'track_width_pool_size_l2': 8, 'track_width_out_channels_l3': 32, 'track_width_pool_size_l3': 2, 'heading_error_num_layers': 3, 'heading_error_activation': 'relu', 'heading_error_out_channels_l0': 152, 'heading_error_pool_size_l0': 8, 'heading_error_out_channels_l1': 170, 'heading_error_pool_size_l1': 8, 'heading_error_out_channels_l2': 50, 'heading_error_pool_size_l2': 4, 'heading_error_fc_hidden': 32}. Best is trial 10 with value: 0.1074.
[rank: 0] Seed set to 42
GPU available: True (cuda), used: True
TPU available: False, using: 0 TPU cores
💡 Tip: For seamless cloud logging and experiment tracking, try installing [litlogger](https://pypi.org/project/litlogger/) to enable LitLogger, which logs metrics and artifacts automatically to the Lightning Experiments platform.
[rank: 0] Seed set to 42
[rank: 0] Seed set to 42
GPU available: True (cuda), used: True
TPU available: False, using: 0 TPU cores
💡 Tip: For seamless cloud logging and experiment tracking, try installing [litlogger](https://pypi.org/project/litlogger/) to enable LitLogger, which logs metrics and artifacts automatically to the Lightning Experiments platform.
GPU available: True (cuda), used: True
TPU available: False, using: 0 TPU cores
💡 Tip: For seamless cloud logging and experiment tracking, try installing [litlogger](https://pypi.org/project/litlogger/) to enable LitLogger, which logs metrics and artifacts automatically to the Lightning Experiments platform.
LOCAL_RANK: 0 - CUDA_VISIBLE_DEVICES: [0]
LOCAL_RANK: 0 - CUDA_VISIBLE_DEVICES: [0]
LOCAL_RANK: 0 - CUDA_VISIBLE_DEVICES: [0]
SLURM auto-requeueing enabled. Setting signal handlers.
SLURM auto-requeueing enabled. Setting signal handlers.
SLURM auto-requeueing enabled. Setting signal handlers.
`Trainer.fit` stopped: `max_epochs=30` reached.
`Trainer.fit` stopped: `max_epochs=30` reached.
`Trainer.fit` stopped: `max_epochs=30` reached.
