[I 2026-04-12 17:12:34,314] Trial 95 finished with value: 0.1566 and parameters: {'left_wall_dist_num_layers': 2, 'left_wall_dist_activation': 'relu', 'left_wall_dist_out_channels_l0': 132, 'left_wall_dist_pool_size_l0': 8, 'left_wall_dist_out_channels_l1': 88, 'left_wall_dist_pool_size_l1': 4, 'left_wall_dist_fc_hidden': 62, 'track_width_num_layers': 5, 'track_width_activation': 'relu', 'track_width_out_channels_l0': 62, 'track_width_pool_size_l0': 2, 'track_width_out_channels_l1': 43, 'track_width_pool_size_l1': 4, 'track_width_out_channels_l2': 254, 'track_width_pool_size_l2': 4, 'track_width_out_channels_l3': 55, 'track_width_pool_size_l3': 4, 'track_width_out_channels_l4': 37, 'track_width_pool_size_l4': 4, 'heading_error_num_layers': 5, 'heading_error_activation': 'elu', 'heading_error_out_channels_l0': 55, 'heading_error_pool_size_l0': 8, 'heading_error_out_channels_l1': 40, 'heading_error_pool_size_l1': 4, 'heading_error_out_channels_l2': 254, 'heading_error_pool_size_l2': 2, 'heading_error_out_channels_l3': 94, 'heading_error_pool_size_l3': 2, 'heading_error_out_channels_l4': 65, 'heading_error_pool_size_l4': 4}. Best is trial 86 with value: 0.0739.
[rank: 0] Seed set to 42
[rank: 0] Seed set to 42
[rank: 0] Seed set to 42
GPU available: True (cuda), used: True
GPU available: True (cuda), used: True
TPU available: False, using: 0 TPU cores
TPU available: False, using: 0 TPU cores
💡 Tip: For seamless cloud logging and experiment tracking, try installing [litlogger](https://pypi.org/project/litlogger/) to enable LitLogger, which logs metrics and artifacts automatically to the Lightning Experiments platform.
💡 Tip: For seamless cloud logging and experiment tracking, try installing [litlogger](https://pypi.org/project/litlogger/) to enable LitLogger, which logs metrics and artifacts automatically to the Lightning Experiments platform.
GPU available: True (cuda), used: True
TPU available: False, using: 0 TPU cores
💡 Tip: For seamless cloud logging and experiment tracking, try installing [litlogger](https://pypi.org/project/litlogger/) to enable LitLogger, which logs metrics and artifacts automatically to the Lightning Experiments platform.
LOCAL_RANK: 0 - CUDA_VISIBLE_DEVICES: [0]
LOCAL_RANK: 0 - CUDA_VISIBLE_DEVICES: [0]
LOCAL_RANK: 0 - CUDA_VISIBLE_DEVICES: [0]
SLURM auto-requeueing enabled. Setting signal handlers.
SLURM auto-requeueing enabled. Setting signal handlers.
SLURM auto-requeueing enabled. Setting signal handlers.
`Trainer.fit` stopped: `max_epochs=20` reached.
`Trainer.fit` stopped: `max_epochs=20` reached.
`Trainer.fit` stopped: `max_epochs=20` reached.
[I 2026-04-12 17:14:50,592] Trial 96 finished with value: 0.1948 and parameters: {'left_wall_dist_num_layers': 2, 'left_wall_dist_activation': 'relu', 'left_wall_dist_out_channels_l0': 94, 'left_wall_dist_pool_size_l0': 8, 'left_wall_dist_out_channels_l1': 107, 'left_wall_dist_pool_size_l1': 4, 'left_wall_dist_fc_hidden': 67, 'track_width_num_layers': 5, 'track_width_activation': 'relu', 'track_width_out_channels_l0': 52, 'track_width_pool_size_l0': 8, 'track_width_out_channels_l1': 39, 'track_width_pool_size_l1': 4, 'track_width_out_channels_l2': 172, 'track_width_pool_size_l2': 4, 'track_width_out_channels_l3': 48, 'track_width_pool_size_l3': 4, 'track_width_fc_hidden': 42, 'heading_error_num_layers': 5, 'heading_error_activation': 'elu', 'heading_error_out_channels_l0': 45, 'heading_error_pool_size_l0': 8, 'heading_error_out_channels_l1': 60, 'heading_error_pool_size_l1': 4, 'heading_error_out_channels_l2': 37, 'heading_error_pool_size_l2': 2, 'heading_error_out_channels_l3': 79, 'heading_error_pool_size_l3': 2, 'heading_error_out_channels_l4': 73, 'heading_error_pool_size_l4': 4}. Best is trial 86 with value: 0.0739.
[rank: 0] Seed set to 42
[rank: 0] Seed set to 42
[rank: 0] Seed set to 42
GPU available: True (cuda), used: True
TPU available: False, using: 0 TPU cores
💡 Tip: For seamless cloud logging and experiment tracking, try installing [litlogger](https://pypi.org/project/litlogger/) to enable LitLogger, which logs metrics and artifacts automatically to the Lightning Experiments platform.
GPU available: True (cuda), used: True
TPU available: False, using: 0 TPU cores
💡 Tip: For seamless cloud logging and experiment tracking, try installing [litlogger](https://pypi.org/project/litlogger/) to enable LitLogger, which logs metrics and artifacts automatically to the Lightning Experiments platform.
GPU available: True (cuda), used: True
TPU available: False, using: 0 TPU cores
💡 Tip: For seamless cloud logging and experiment tracking, try installing [litlogger](https://pypi.org/project/litlogger/) to enable LitLogger, which logs metrics and artifacts automatically to the Lightning Experiments platform.
LOCAL_RANK: 0 - CUDA_VISIBLE_DEVICES: [0]
LOCAL_RANK: 0 - CUDA_VISIBLE_DEVICES: [0]
LOCAL_RANK: 0 - CUDA_VISIBLE_DEVICES: [0]
SLURM auto-requeueing enabled. Setting signal handlers.
SLURM auto-requeueing enabled. Setting signal handlers.
SLURM auto-requeueing enabled. Setting signal handlers.
`Trainer.fit` stopped: `max_epochs=20` reached.
`Trainer.fit` stopped: `max_epochs=20` reached.
`Trainer.fit` stopped: `max_epochs=20` reached.
[I 2026-04-12 17:17:22,970] Trial 97 finished with value: 0.1531 and parameters: {'left_wall_dist_num_layers': 2, 'left_wall_dist_activation': 'relu', 'left_wall_dist_out_channels_l0': 163, 'left_wall_dist_pool_size_l0': 8, 'left_wall_dist_out_channels_l1': 103, 'left_wall_dist_pool_size_l1': 4, 'left_wall_dist_fc_hidden': 75, 'track_width_num_layers': 5, 'track_width_activation': 'relu', 'track_width_out_channels_l0': 47, 'track_width_pool_size_l0': 2, 'track_width_out_channels_l1': 35, 'track_width_pool_size_l1': 4, 'track_width_out_channels_l2': 207, 'track_width_pool_size_l2': 4, 'track_width_out_channels_l3': 61, 'track_width_pool_size_l3': 4, 'track_width_out_channels_l4': 36, 'track_width_pool_size_l4': 8, 'track_width_fc_hidden': 42, 'heading_error_num_layers': 5, 'heading_error_activation': 'relu', 'heading_error_out_channels_l0': 61, 'heading_error_pool_size_l0': 8, 'heading_error_out_channels_l1': 52, 'heading_error_pool_size_l1': 4, 'heading_error_out_channels_l2': 230, 'heading_error_pool_size_l2': 2, 'heading_error_out_channels_l3': 70, 'heading_error_pool_size_l3': 2, 'heading_error_out_channels_l4': 59, 'heading_error_pool_size_l4': 4}. Best is trial 86 with value: 0.0739.
[rank: 0] Seed set to 42
[rank: 0] Seed set to 42
GPU available: True (cuda), used: True
TPU available: False, using: 0 TPU cores
💡 Tip: For seamless cloud logging and experiment tracking, try installing [litlogger](https://pypi.org/project/litlogger/) to enable LitLogger, which logs metrics and artifacts automatically to the Lightning Experiments platform.
GPU available: True (cuda), used: True
TPU available: False, using: 0 TPU cores
💡 Tip: For seamless cloud logging and experiment tracking, try installing [litlogger](https://pypi.org/project/litlogger/) to enable LitLogger, which logs metrics and artifacts automatically to the Lightning Experiments platform.
[rank: 0] Seed set to 42
GPU available: True (cuda), used: True
TPU available: False, using: 0 TPU cores
💡 Tip: For seamless cloud logging and experiment tracking, try installing [litlogger](https://pypi.org/project/litlogger/) to enable LitLogger, which logs metrics and artifacts automatically to the Lightning Experiments platform.
LOCAL_RANK: 0 - CUDA_VISIBLE_DEVICES: [0]
LOCAL_RANK: 0 - CUDA_VISIBLE_DEVICES: [0]
LOCAL_RANK: 0 - CUDA_VISIBLE_DEVICES: [0]
SLURM auto-requeueing enabled. Setting signal handlers.
SLURM auto-requeueing enabled. Setting signal handlers.
SLURM auto-requeueing enabled. Setting signal handlers.
`Trainer.fit` stopped: `max_epochs=20` reached.
`Trainer.fit` stopped: `max_epochs=20` reached.
`Trainer.fit` stopped: `max_epochs=20` reached.
[I 2026-04-12 17:19:53,497] Trial 98 finished with value: 0.1253 and parameters: {'left_wall_dist_num_layers': 2, 'left_wall_dist_activation': 'relu', 'left_wall_dist_out_channels_l0': 108, 'left_wall_dist_pool_size_l0': 8, 'left_wall_dist_out_channels_l1': 124, 'left_wall_dist_pool_size_l1': 4, 'left_wall_dist_fc_hidden': 81, 'track_width_num_layers': 5, 'track_width_activation': 'relu', 'track_width_out_channels_l0': 66, 'track_width_pool_size_l0': 2, 'track_width_out_channels_l1': 51, 'track_width_pool_size_l1': 4, 'track_width_out_channels_l2': 213, 'track_width_pool_size_l2': 4, 'track_width_out_channels_l3': 50, 'track_width_pool_size_l3': 4, 'track_width_out_channels_l4': 41, 'track_width_pool_size_l4': 8, 'track_width_fc_hidden': 44, 'heading_error_num_layers': 5, 'heading_error_activation': 'elu', 'heading_error_out_channels_l0': 49, 'heading_error_pool_size_l0': 8, 'heading_error_out_channels_l1': 46, 'heading_error_pool_size_l1': 4, 'heading_error_out_channels_l2': 236, 'heading_error_pool_size_l2': 2, 'heading_error_out_channels_l3': 94, 'heading_error_pool_size_l3': 2, 'heading_error_out_channels_l4': 58, 'heading_error_pool_size_l4': 4}. Best is trial 86 with value: 0.0739.
[rank: 0] Seed set to 42
[rank: 0] Seed set to 42
[rank: 0] Seed set to 42
GPU available: True (cuda), used: True
TPU available: False, using: 0 TPU cores
💡 Tip: For seamless cloud logging and experiment tracking, try installing [litlogger](https://pypi.org/project/litlogger/) to enable LitLogger, which logs metrics and artifacts automatically to the Lightning Experiments platform.
GPU available: True (cuda), used: True
TPU available: False, using: 0 TPU cores
GPU available: True (cuda), used: True
TPU available: False, using: 0 TPU cores
💡 Tip: For seamless cloud logging and experiment tracking, try installing [litlogger](https://pypi.org/project/litlogger/) to enable LitLogger, which logs metrics and artifacts automatically to the Lightning Experiments platform.
💡 Tip: For seamless cloud logging and experiment tracking, try installing [litlogger](https://pypi.org/project/litlogger/) to enable LitLogger, which logs metrics and artifacts automatically to the Lightning Experiments platform.
LOCAL_RANK: 0 - CUDA_VISIBLE_DEVICES: [0]
LOCAL_RANK: 0 - CUDA_VISIBLE_DEVICES: [0]
LOCAL_RANK: 0 - CUDA_VISIBLE_DEVICES: [0]
SLURM auto-requeueing enabled. Setting signal handlers.
SLURM auto-requeueing enabled. Setting signal handlers.
SLURM auto-requeueing enabled. Setting signal handlers.
`Trainer.fit` stopped: `max_epochs=20` reached.
`Trainer.fit` stopped: `max_epochs=20` reached.
`Trainer.fit` stopped: `max_epochs=20` reached.
[I 2026-04-12 17:22:15,370] Trial 99 finished with value: 0.0639 and parameters: {'left_wall_dist_num_layers': 2, 'left_wall_dist_activation': 'relu', 'left_wall_dist_out_channels_l0': 150, 'left_wall_dist_pool_size_l0': 8, 'left_wall_dist_out_channels_l1': 118, 'left_wall_dist_pool_size_l1': 4, 'left_wall_dist_fc_hidden': 85, 'track_width_num_layers': 5, 'track_width_activation': 'relu', 'track_width_out_channels_l0': 68, 'track_width_pool_size_l0': 2, 'track_width_out_channels_l1': 41, 'track_width_pool_size_l1': 4, 'track_width_out_channels_l2': 195, 'track_width_pool_size_l2': 4, 'track_width_out_channels_l3': 57, 'track_width_pool_size_l3': 4, 'track_width_out_channels_l4': 32, 'track_width_pool_size_l4': 8, 'track_width_fc_hidden': 38, 'heading_error_num_layers': 5, 'heading_error_activation': 'elu', 'heading_error_out_channels_l0': 60, 'heading_error_pool_size_l0': 8, 'heading_error_out_channels_l1': 41, 'heading_error_pool_size_l1': 4, 'heading_error_out_channels_l2': 203, 'heading_error_pool_size_l2': 2, 'heading_error_out_channels_l3': 84, 'heading_error_pool_size_l3': 2, 'heading_error_out_channels_l4': 63, 'heading_error_pool_size_l4': 4}. Best is trial 99 with value: 0.0639.
[rank: 0] Seed set to 42
GPU available: True (cuda), used: True
TPU available: False, using: 0 TPU cores
💡 Tip: For seamless cloud logging and experiment tracking, try installing [litlogger](https://pypi.org/project/litlogger/) to enable LitLogger, which logs metrics and artifacts automatically to the Lightning Experiments platform.
[rank: 0] Seed set to 42
[rank: 0] Seed set to 42
GPU available: True (cuda), used: True
TPU available: False, using: 0 TPU cores
💡 Tip: For seamless cloud logging and experiment tracking, try installing [litlogger](https://pypi.org/project/litlogger/) to enable LitLogger, which logs metrics and artifacts automatically to the Lightning Experiments platform.
GPU available: True (cuda), used: True
TPU available: False, using: 0 TPU cores
💡 Tip: For seamless cloud logging and experiment tracking, try installing [litlogger](https://pypi.org/project/litlogger/) to enable LitLogger, which logs metrics and artifacts automatically to the Lightning Experiments platform.
LOCAL_RANK: 0 - CUDA_VISIBLE_DEVICES: [0]
SLURM auto-requeueing enabled. Setting signal handlers.
LOCAL_RANK: 0 - CUDA_VISIBLE_DEVICES: [0]
LOCAL_RANK: 0 - CUDA_VISIBLE_DEVICES: [0]
SLURM auto-requeueing enabled. Setting signal handlers.
SLURM auto-requeueing enabled. Setting signal handlers.
`Trainer.fit` stopped: `max_epochs=20` reached.
`Trainer.fit` stopped: `max_epochs=20` reached.
`Trainer.fit` stopped: `max_epochs=20` reached.
[I 2026-04-12 17:24:42,480] Trial 100 finished with value: 0.1296 and parameters: {'left_wall_dist_num_layers': 2, 'left_wall_dist_activation': 'relu', 'left_wall_dist_out_channels_l0': 151, 'left_wall_dist_pool_size_l0': 8, 'left_wall_dist_out_channels_l1': 113, 'left_wall_dist_pool_size_l1': 4, 'left_wall_dist_fc_hidden': 93, 'track_width_num_layers': 5, 'track_width_activation': 'relu', 'track_width_out_channels_l0': 56, 'track_width_pool_size_l0': 2, 'track_width_out_channels_l1': 41, 'track_width_pool_size_l1': 4, 'track_width_out_channels_l2': 196, 'track_width_pool_size_l2': 4, 'track_width_out_channels_l3': 67, 'track_width_pool_size_l3': 4, 'track_width_out_channels_l4': 32, 'track_width_pool_size_l4': 8, 'track_width_fc_hidden': 39, 'heading_error_num_layers': 5, 'heading_error_activation': 'elu', 'heading_error_out_channels_l0': 60, 'heading_error_pool_size_l0': 8, 'heading_error_out_channels_l1': 34, 'heading_error_pool_size_l1': 4, 'heading_error_out_channels_l2': 184, 'heading_error_pool_size_l2': 2, 'heading_error_out_channels_l3': 105, 'heading_error_pool_size_l3': 2, 'heading_error_out_channels_l4': 63, 'heading_error_pool_size_l4': 4}. Best is trial 99 with value: 0.0639.
[rank: 0] Seed set to 42
[rank: 0] Seed set to 42
GPU available: True (cuda), used: True
TPU available: False, using: 0 TPU cores
💡 Tip: For seamless cloud logging and experiment tracking, try installing [litlogger](https://pypi.org/project/litlogger/) to enable LitLogger, which logs metrics and artifacts automatically to the Lightning Experiments platform.
GPU available: True (cuda), used: True
TPU available: False, using: 0 TPU cores
💡 Tip: For seamless cloud logging and experiment tracking, try installing [litlogger](https://pypi.org/project/litlogger/) to enable LitLogger, which logs metrics and artifacts automatically to the Lightning Experiments platform.
[rank: 0] Seed set to 42
GPU available: True (cuda), used: True
TPU available: False, using: 0 TPU cores
💡 Tip: For seamless cloud logging and experiment tracking, try installing [litlogger](https://pypi.org/project/litlogger/) to enable LitLogger, which logs metrics and artifacts automatically to the Lightning Experiments platform.
LOCAL_RANK: 0 - CUDA_VISIBLE_DEVICES: [0]
LOCAL_RANK: 0 - CUDA_VISIBLE_DEVICES: [0]
LOCAL_RANK: 0 - CUDA_VISIBLE_DEVICES: [0]
SLURM auto-requeueing enabled. Setting signal handlers.
SLURM auto-requeueing enabled. Setting signal handlers.
SLURM auto-requeueing enabled. Setting signal handlers.
`Trainer.fit` stopped: `max_epochs=20` reached.
`Trainer.fit` stopped: `max_epochs=20` reached.
`Trainer.fit` stopped: `max_epochs=20` reached.
[I 2026-04-12 17:27:03,317] Trial 101 finished with value: 0.0861 and parameters: {'left_wall_dist_num_layers': 2, 'left_wall_dist_activation': 'relu', 'left_wall_dist_out_channels_l0': 170, 'left_wall_dist_pool_size_l0': 8, 'left_wall_dist_out_channels_l1': 121, 'left_wall_dist_pool_size_l1': 4, 'left_wall_dist_fc_hidden': 85, 'track_width_num_layers': 5, 'track_width_activation': 'relu', 'track_width_out_channels_l0': 70, 'track_width_pool_size_l0': 2, 'track_width_out_channels_l1': 45, 'track_width_pool_size_l1': 4, 'track_width_out_channels_l2': 237, 'track_width_pool_size_l2': 4, 'track_width_out_channels_l3': 57, 'track_width_pool_size_l3': 4, 'track_width_out_channels_l4': 35, 'track_width_pool_size_l4': 8, 'track_width_fc_hidden': 41, 'heading_error_num_layers': 5, 'heading_error_activation': 'elu', 'heading_error_out_channels_l0': 51, 'heading_error_pool_size_l0': 8, 'heading_error_out_channels_l1': 41, 'heading_error_pool_size_l1': 4, 'heading_error_out_channels_l2': 205, 'heading_error_pool_size_l2': 2, 'heading_error_out_channels_l3': 86, 'heading_error_pool_size_l3': 2, 'heading_error_out_channels_l4': 72, 'heading_error_pool_size_l4': 4}. Best is trial 99 with value: 0.0639.
[rank: 0] Seed set to 42
GPU available: True (cuda), used: True
TPU available: False, using: 0 TPU cores
💡 Tip: For seamless cloud logging and experiment tracking, try installing [litlogger](https://pypi.org/project/litlogger/) to enable LitLogger, which logs metrics and artifacts automatically to the Lightning Experiments platform.
[rank: 0] Seed set to 42
GPU available: True (cuda), used: True
TPU available: False, using: 0 TPU cores
💡 Tip: For seamless cloud logging and experiment tracking, try installing [litlogger](https://pypi.org/project/litlogger/) to enable LitLogger, which logs metrics and artifacts automatically to the Lightning Experiments platform.
[rank: 0] Seed set to 42
GPU available: True (cuda), used: True
TPU available: False, using: 0 TPU cores
💡 Tip: For seamless cloud logging and experiment tracking, try installing [litlogger](https://pypi.org/project/litlogger/) to enable LitLogger, which logs metrics and artifacts automatically to the Lightning Experiments platform.
LOCAL_RANK: 0 - CUDA_VISIBLE_DEVICES: [0]
LOCAL_RANK: 0 - CUDA_VISIBLE_DEVICES: [0]
LOCAL_RANK: 0 - CUDA_VISIBLE_DEVICES: [0]
SLURM auto-requeueing enabled. Setting signal handlers.
SLURM auto-requeueing enabled. Setting signal handlers.
SLURM auto-requeueing enabled. Setting signal handlers.
`Trainer.fit` stopped: `max_epochs=20` reached.
`Trainer.fit` stopped: `max_epochs=20` reached.
`Trainer.fit` stopped: `max_epochs=20` reached.
[I 2026-04-12 17:29:25,031] Trial 102 finished with value: 0.0943 and parameters: {'left_wall_dist_num_layers': 2, 'left_wall_dist_activation': 'relu', 'left_wall_dist_out_channels_l0': 143, 'left_wall_dist_pool_size_l0': 8, 'left_wall_dist_out_channels_l1': 120, 'left_wall_dist_pool_size_l1': 4, 'left_wall_dist_fc_hidden': 85, 'track_width_num_layers': 5, 'track_width_activation': 'relu', 'track_width_out_channels_l0': 69, 'track_width_pool_size_l0': 2, 'track_width_out_channels_l1': 45, 'track_width_pool_size_l1': 4, 'track_width_out_channels_l2': 236, 'track_width_pool_size_l2': 4, 'track_width_out_channels_l3': 56, 'track_width_pool_size_l3': 4, 'track_width_out_channels_l4': 36, 'track_width_pool_size_l4': 8, 'track_width_fc_hidden': 43, 'heading_error_num_layers': 5, 'heading_error_activation': 'elu', 'heading_error_out_channels_l0': 51, 'heading_error_pool_size_l0': 8, 'heading_error_out_channels_l1': 41, 'heading_error_pool_size_l1': 4, 'heading_error_out_channels_l2': 203, 'heading_error_pool_size_l2': 2, 'heading_error_out_channels_l3': 83, 'heading_error_pool_size_l3': 2, 'heading_error_out_channels_l4': 73, 'heading_error_pool_size_l4': 4}. Best is trial 99 with value: 0.0639.
[rank: 0] Seed set to 42
GPU available: True (cuda), used: True
TPU available: False, using: 0 TPU cores
💡 Tip: For seamless cloud logging and experiment tracking, try installing [litlogger](https://pypi.org/project/litlogger/) to enable LitLogger, which logs metrics and artifacts automatically to the Lightning Experiments platform.
[rank: 0] Seed set to 42
GPU available: True (cuda), used: True
TPU available: False, using: 0 TPU cores
💡 Tip: For seamless cloud logging and experiment tracking, try installing [litlogger](https://pypi.org/project/litlogger/) to enable LitLogger, which logs metrics and artifacts automatically to the Lightning Experiments platform.
[rank: 0] Seed set to 42
GPU available: True (cuda), used: True
TPU available: False, using: 0 TPU cores
💡 Tip: For seamless cloud logging and experiment tracking, try installing [litlogger](https://pypi.org/project/litlogger/) to enable LitLogger, which logs metrics and artifacts automatically to the Lightning Experiments platform.
LOCAL_RANK: 0 - CUDA_VISIBLE_DEVICES: [0]
LOCAL_RANK: 0 - CUDA_VISIBLE_DEVICES: [0]
LOCAL_RANK: 0 - CUDA_VISIBLE_DEVICES: [0]
SLURM auto-requeueing enabled. Setting signal handlers.
SLURM auto-requeueing enabled. Setting signal handlers.
SLURM auto-requeueing enabled. Setting signal handlers.
`Trainer.fit` stopped: `max_epochs=20` reached.
`Trainer.fit` stopped: `max_epochs=20` reached.
`Trainer.fit` stopped: `max_epochs=20` reached.
