[I 2026-04-15 23:01:46,358] Trial 36 finished with value: 0.1188 and parameters: {'left_wall_dist_num_layers': 2, 'left_wall_dist_activation': 'relu', 'left_wall_dist_out_channels_l0': 220, 'left_wall_dist_pool_size_l0': 4, 'left_wall_dist_out_channels_l1': 80, 'left_wall_dist_pool_size_l1': 8, 'left_wall_dist_fc_hidden': 86, 'track_width_num_layers': 2, 'track_width_activation': 'relu', 'track_width_out_channels_l0': 45, 'track_width_pool_size_l0': 8, 'track_width_out_channels_l1': 116, 'track_width_pool_size_l1': 8, 'track_width_fc_hidden': 68, 'heading_error_num_layers': 5, 'heading_error_activation': 'elu', 'heading_error_out_channels_l0': 224, 'heading_error_pool_size_l0': 2, 'heading_error_out_channels_l1': 39, 'heading_error_pool_size_l1': 2, 'heading_error_out_channels_l2': 41, 'heading_error_pool_size_l2': 2, 'heading_error_out_channels_l3': 148, 'heading_error_pool_size_l3': 8, 'heading_error_out_channels_l4': 54, 'heading_error_pool_size_l4': 2, 'heading_error_fc_hidden': 51}. Best is trial 10 with value: 0.1074.
[rank: 0] Seed set to 42
GPU available: True (cuda), used: True
TPU available: False, using: 0 TPU cores
💡 Tip: For seamless cloud logging and experiment tracking, try installing [litlogger](https://pypi.org/project/litlogger/) to enable LitLogger, which logs metrics and artifacts automatically to the Lightning Experiments platform.
[rank: 0] Seed set to 42
GPU available: True (cuda), used: True
TPU available: False, using: 0 TPU cores
💡 Tip: For seamless cloud logging and experiment tracking, try installing [litlogger](https://pypi.org/project/litlogger/) to enable LitLogger, which logs metrics and artifacts automatically to the Lightning Experiments platform.
[rank: 0] Seed set to 42
GPU available: True (cuda), used: True
TPU available: False, using: 0 TPU cores
💡 Tip: For seamless cloud logging and experiment tracking, try installing [litlogger](https://pypi.org/project/litlogger/) to enable LitLogger, which logs metrics and artifacts automatically to the Lightning Experiments platform.
LOCAL_RANK: 0 - CUDA_VISIBLE_DEVICES: [0]
SLURM auto-requeueing enabled. Setting signal handlers.
LOCAL_RANK: 0 - CUDA_VISIBLE_DEVICES: [0]
LOCAL_RANK: 0 - CUDA_VISIBLE_DEVICES: [0]
SLURM auto-requeueing enabled. Setting signal handlers.
SLURM auto-requeueing enabled. Setting signal handlers.
`Trainer.fit` stopped: `max_epochs=30` reached.
`Trainer.fit` stopped: `max_epochs=30` reached.
`Trainer.fit` stopped: `max_epochs=30` reached.
[I 2026-04-15 23:04:19,091] Trial 37 finished with value: 0.1601 and parameters: {'left_wall_dist_num_layers': 2, 'left_wall_dist_activation': 'elu', 'left_wall_dist_out_channels_l0': 256, 'left_wall_dist_pool_size_l0': 4, 'left_wall_dist_out_channels_l1': 81, 'left_wall_dist_pool_size_l1': 8, 'left_wall_dist_fc_hidden': 86, 'track_width_num_layers': 2, 'track_width_activation': 'elu', 'track_width_out_channels_l0': 44, 'track_width_pool_size_l0': 8, 'track_width_out_channels_l1': 173, 'track_width_pool_size_l1': 2, 'heading_error_num_layers': 4, 'heading_error_activation': 'relu', 'heading_error_out_channels_l0': 89, 'heading_error_pool_size_l0': 2, 'heading_error_out_channels_l1': 37, 'heading_error_pool_size_l1': 8, 'heading_error_out_channels_l2': 41, 'heading_error_pool_size_l2': 2, 'heading_error_out_channels_l3': 152, 'heading_error_pool_size_l3': 8, 'heading_error_fc_hidden': 51}. Best is trial 10 with value: 0.1074.
[rank: 0] Seed set to 42
[rank: 0] Seed set to 42
[rank: 0] Seed set to 42
GPU available: True (cuda), used: True
TPU available: False, using: 0 TPU cores
GPU available: True (cuda), used: True
TPU available: False, using: 0 TPU cores
💡 Tip: For seamless cloud logging and experiment tracking, try installing [litlogger](https://pypi.org/project/litlogger/) to enable LitLogger, which logs metrics and artifacts automatically to the Lightning Experiments platform.
💡 Tip: For seamless cloud logging and experiment tracking, try installing [litlogger](https://pypi.org/project/litlogger/) to enable LitLogger, which logs metrics and artifacts automatically to the Lightning Experiments platform.
GPU available: True (cuda), used: True
TPU available: False, using: 0 TPU cores
💡 Tip: For seamless cloud logging and experiment tracking, try installing [litlogger](https://pypi.org/project/litlogger/) to enable LitLogger, which logs metrics and artifacts automatically to the Lightning Experiments platform.
LOCAL_RANK: 0 - CUDA_VISIBLE_DEVICES: [0]
LOCAL_RANK: 0 - CUDA_VISIBLE_DEVICES: [0]
LOCAL_RANK: 0 - CUDA_VISIBLE_DEVICES: [0]
SLURM auto-requeueing enabled. Setting signal handlers.
SLURM auto-requeueing enabled. Setting signal handlers.
SLURM auto-requeueing enabled. Setting signal handlers.
`Trainer.fit` stopped: `max_epochs=30` reached.
`Trainer.fit` stopped: `max_epochs=30` reached.
`Trainer.fit` stopped: `max_epochs=30` reached.
[I 2026-04-15 23:06:50,382] Trial 38 finished with value: 0.12 and parameters: {'left_wall_dist_num_layers': 2, 'left_wall_dist_activation': 'relu', 'left_wall_dist_out_channels_l0': 50, 'left_wall_dist_pool_size_l0': 2, 'left_wall_dist_out_channels_l1': 73, 'left_wall_dist_pool_size_l1': 8, 'left_wall_dist_fc_hidden': 104, 'track_width_num_layers': 2, 'track_width_activation': 'relu', 'track_width_out_channels_l0': 36, 'track_width_pool_size_l0': 8, 'track_width_out_channels_l1': 78, 'track_width_pool_size_l1': 8, 'track_width_fc_hidden': 68, 'heading_error_num_layers': 5, 'heading_error_activation': 'elu', 'heading_error_out_channels_l0': 75, 'heading_error_pool_size_l0': 2, 'heading_error_out_channels_l1': 39, 'heading_error_pool_size_l1': 8, 'heading_error_out_channels_l2': 51, 'heading_error_pool_size_l2': 2, 'heading_error_out_channels_l3': 242, 'heading_error_pool_size_l3': 8, 'heading_error_out_channels_l4': 50, 'heading_error_pool_size_l4': 8, 'heading_error_fc_hidden': 37}. Best is trial 10 with value: 0.1074.
[rank: 0] Seed set to 42
[rank: 0] Seed set to 42
GPU available: True (cuda), used: True
TPU available: False, using: 0 TPU cores
💡 Tip: For seamless cloud logging and experiment tracking, try installing [litlogger](https://pypi.org/project/litlogger/) to enable LitLogger, which logs metrics and artifacts automatically to the Lightning Experiments platform.
[rank: 0] Seed set to 42
GPU available: True (cuda), used: True
TPU available: False, using: 0 TPU cores
💡 Tip: For seamless cloud logging and experiment tracking, try installing [litlogger](https://pypi.org/project/litlogger/) to enable LitLogger, which logs metrics and artifacts automatically to the Lightning Experiments platform.
GPU available: True (cuda), used: True
TPU available: False, using: 0 TPU cores
💡 Tip: For seamless cloud logging and experiment tracking, try installing [litlogger](https://pypi.org/project/litlogger/) to enable LitLogger, which logs metrics and artifacts automatically to the Lightning Experiments platform.
LOCAL_RANK: 0 - CUDA_VISIBLE_DEVICES: [0]
LOCAL_RANK: 0 - CUDA_VISIBLE_DEVICES: [0]
LOCAL_RANK: 0 - CUDA_VISIBLE_DEVICES: [0]
SLURM auto-requeueing enabled. Setting signal handlers.
SLURM auto-requeueing enabled. Setting signal handlers.
SLURM auto-requeueing enabled. Setting signal handlers.
`Trainer.fit` stopped: `max_epochs=30` reached.
`Trainer.fit` stopped: `max_epochs=30` reached.
`Trainer.fit` stopped: `max_epochs=30` reached.
[I 2026-04-15 23:09:34,426] Trial 39 finished with value: 0.1392 and parameters: {'left_wall_dist_num_layers': 2, 'left_wall_dist_activation': 'elu', 'left_wall_dist_out_channels_l0': 67, 'left_wall_dist_pool_size_l0': 8, 'left_wall_dist_out_channels_l1': 63, 'left_wall_dist_pool_size_l1': 8, 'left_wall_dist_fc_hidden': 69, 'track_width_num_layers': 2, 'track_width_activation': 'relu', 'track_width_out_channels_l0': 55, 'track_width_pool_size_l0': 8, 'track_width_out_channels_l1': 63, 'track_width_pool_size_l1': 4, 'track_width_fc_hidden': 79, 'heading_error_num_layers': 2, 'heading_error_activation': 'relu', 'heading_error_out_channels_l0': 232, 'heading_error_pool_size_l0': 2, 'heading_error_out_channels_l1': 221, 'heading_error_pool_size_l1': 2}. Best is trial 10 with value: 0.1074.
[rank: 0] Seed set to 42
[rank: 0] Seed set to 42
[rank: 0] Seed set to 42
GPU available: True (cuda), used: True
TPU available: False, using: 0 TPU cores
GPU available: True (cuda), used: True
TPU available: False, using: 0 TPU cores
💡 Tip: For seamless cloud logging and experiment tracking, try installing [litlogger](https://pypi.org/project/litlogger/) to enable LitLogger, which logs metrics and artifacts automatically to the Lightning Experiments platform.
💡 Tip: For seamless cloud logging and experiment tracking, try installing [litlogger](https://pypi.org/project/litlogger/) to enable LitLogger, which logs metrics and artifacts automatically to the Lightning Experiments platform.
GPU available: True (cuda), used: True
TPU available: False, using: 0 TPU cores
💡 Tip: For seamless cloud logging and experiment tracking, try installing [litlogger](https://pypi.org/project/litlogger/) to enable LitLogger, which logs metrics and artifacts automatically to the Lightning Experiments platform.
LOCAL_RANK: 0 - CUDA_VISIBLE_DEVICES: [0]
LOCAL_RANK: 0 - CUDA_VISIBLE_DEVICES: [0]
LOCAL_RANK: 0 - CUDA_VISIBLE_DEVICES: [0]
SLURM auto-requeueing enabled. Setting signal handlers.
SLURM auto-requeueing enabled. Setting signal handlers.
SLURM auto-requeueing enabled. Setting signal handlers.
`Trainer.fit` stopped: `max_epochs=30` reached.
`Trainer.fit` stopped: `max_epochs=30` reached.
`Trainer.fit` stopped: `max_epochs=30` reached.
[I 2026-04-15 23:12:21,108] Trial 40 finished with value: 0.1391 and parameters: {'left_wall_dist_num_layers': 5, 'left_wall_dist_activation': 'relu', 'left_wall_dist_out_channels_l0': 97, 'left_wall_dist_pool_size_l0': 4, 'left_wall_dist_out_channels_l1': 125, 'left_wall_dist_pool_size_l1': 8, 'left_wall_dist_out_channels_l2': 39, 'left_wall_dist_pool_size_l2': 2, 'left_wall_dist_out_channels_l3': 38, 'left_wall_dist_pool_size_l3': 4, 'left_wall_dist_out_channels_l4': 32, 'left_wall_dist_pool_size_l4': 8, 'track_width_num_layers': 2, 'track_width_activation': 'elu', 'track_width_out_channels_l0': 44, 'track_width_pool_size_l0': 8, 'track_width_out_channels_l1': 158, 'track_width_pool_size_l1': 8, 'track_width_fc_hidden': 63, 'heading_error_num_layers': 5, 'heading_error_activation': 'relu', 'heading_error_out_channels_l0': 113, 'heading_error_pool_size_l0': 2, 'heading_error_out_channels_l1': 52, 'heading_error_pool_size_l1': 4, 'heading_error_out_channels_l2': 35, 'heading_error_pool_size_l2': 2, 'heading_error_out_channels_l3': 146, 'heading_error_pool_size_l3': 8, 'heading_error_out_channels_l4': 58, 'heading_error_pool_size_l4': 2, 'heading_error_fc_hidden': 36}. Best is trial 10 with value: 0.1074.
[rank: 0] Seed set to 42
[rank: 0] Seed set to 42
[rank: 0] Seed set to 42
GPU available: True (cuda), used: True
TPU available: False, using: 0 TPU cores
💡 Tip: For seamless cloud logging and experiment tracking, try installing [litlogger](https://pypi.org/project/litlogger/) to enable LitLogger, which logs metrics and artifacts automatically to the Lightning Experiments platform.
GPU available: True (cuda), used: True
TPU available: False, using: 0 TPU cores
💡 Tip: For seamless cloud logging and experiment tracking, try installing [litlogger](https://pypi.org/project/litlogger/) to enable LitLogger, which logs metrics and artifacts automatically to the Lightning Experiments platform.
GPU available: True (cuda), used: True
TPU available: False, using: 0 TPU cores
💡 Tip: For seamless cloud logging and experiment tracking, try installing [litlogger](https://pypi.org/project/litlogger/) to enable LitLogger, which logs metrics and artifacts automatically to the Lightning Experiments platform.
LOCAL_RANK: 0 - CUDA_VISIBLE_DEVICES: [0]
LOCAL_RANK: 0 - CUDA_VISIBLE_DEVICES: [0]
LOCAL_RANK: 0 - CUDA_VISIBLE_DEVICES: [0]
SLURM auto-requeueing enabled. Setting signal handlers.
SLURM auto-requeueing enabled. Setting signal handlers.
SLURM auto-requeueing enabled. Setting signal handlers.
`Trainer.fit` stopped: `max_epochs=30` reached.
`Trainer.fit` stopped: `max_epochs=30` reached.
`Trainer.fit` stopped: `max_epochs=30` reached.
[I 2026-04-15 23:15:14,602] Trial 41 finished with value: 0.1312 and parameters: {'left_wall_dist_num_layers': 3, 'left_wall_dist_activation': 'relu', 'left_wall_dist_out_channels_l0': 208, 'left_wall_dist_pool_size_l0': 4, 'left_wall_dist_out_channels_l1': 88, 'left_wall_dist_pool_size_l1': 4, 'left_wall_dist_out_channels_l2': 135, 'left_wall_dist_pool_size_l2': 4, 'left_wall_dist_fc_hidden': 37, 'track_width_num_layers': 3, 'track_width_activation': 'relu', 'track_width_out_channels_l0': 68, 'track_width_pool_size_l0': 4, 'track_width_out_channels_l1': 118, 'track_width_pool_size_l1': 8, 'track_width_out_channels_l2': 109, 'track_width_pool_size_l2': 8, 'track_width_fc_hidden': 54, 'heading_error_num_layers': 5, 'heading_error_activation': 'elu', 'heading_error_out_channels_l0': 215, 'heading_error_pool_size_l0': 2, 'heading_error_out_channels_l1': 65, 'heading_error_pool_size_l1': 2, 'heading_error_out_channels_l2': 43, 'heading_error_pool_size_l2': 2, 'heading_error_out_channels_l3': 99, 'heading_error_pool_size_l3': 8, 'heading_error_out_channels_l4': 147, 'heading_error_pool_size_l4': 2, 'heading_error_fc_hidden': 54}. Best is trial 10 with value: 0.1074.
[rank: 0] Seed set to 42
GPU available: True (cuda), used: True
TPU available: False, using: 0 TPU cores
💡 Tip: For seamless cloud logging and experiment tracking, try installing [litlogger](https://pypi.org/project/litlogger/) to enable LitLogger, which logs metrics and artifacts automatically to the Lightning Experiments platform.
[rank: 0] Seed set to 42
[rank: 0] Seed set to 42
GPU available: True (cuda), used: True
TPU available: False, using: 0 TPU cores
💡 Tip: For seamless cloud logging and experiment tracking, try installing [litlogger](https://pypi.org/project/litlogger/) to enable LitLogger, which logs metrics and artifacts automatically to the Lightning Experiments platform.
GPU available: True (cuda), used: True
TPU available: False, using: 0 TPU cores
💡 Tip: For seamless cloud logging and experiment tracking, try installing [litlogger](https://pypi.org/project/litlogger/) to enable LitLogger, which logs metrics and artifacts automatically to the Lightning Experiments platform.
LOCAL_RANK: 0 - CUDA_VISIBLE_DEVICES: [0]
LOCAL_RANK: 0 - CUDA_VISIBLE_DEVICES: [0]
LOCAL_RANK: 0 - CUDA_VISIBLE_DEVICES: [0]
SLURM auto-requeueing enabled. Setting signal handlers.
SLURM auto-requeueing enabled. Setting signal handlers.
SLURM auto-requeueing enabled. Setting signal handlers.
`Trainer.fit` stopped: `max_epochs=30` reached.
`Trainer.fit` stopped: `max_epochs=30` reached.
`Trainer.fit` stopped: `max_epochs=30` reached.
[I 2026-04-15 23:17:47,789] Trial 42 finished with value: 0.1162 and parameters: {'left_wall_dist_num_layers': 2, 'left_wall_dist_activation': 'relu', 'left_wall_dist_out_channels_l0': 158, 'left_wall_dist_pool_size_l0': 4, 'left_wall_dist_out_channels_l1': 38, 'left_wall_dist_pool_size_l1': 2, 'left_wall_dist_fc_hidden': 109, 'track_width_num_layers': 2, 'track_width_activation': 'relu', 'track_width_out_channels_l0': 84, 'track_width_pool_size_l0': 2, 'track_width_out_channels_l1': 101, 'track_width_pool_size_l1': 8, 'track_width_fc_hidden': 117, 'heading_error_num_layers': 5, 'heading_error_activation': 'elu', 'heading_error_out_channels_l0': 187, 'heading_error_pool_size_l0': 8, 'heading_error_out_channels_l1': 118, 'heading_error_pool_size_l1': 2, 'heading_error_out_channels_l2': 93, 'heading_error_pool_size_l2': 4, 'heading_error_out_channels_l3': 101, 'heading_error_pool_size_l3': 2, 'heading_error_out_channels_l4': 32, 'heading_error_pool_size_l4': 2, 'heading_error_fc_hidden': 41}. Best is trial 10 with value: 0.1074.
[rank: 0] Seed set to 42
[rank: 0] Seed set to 42
GPU available: True (cuda), used: True
TPU available: False, using: 0 TPU cores
💡 Tip: For seamless cloud logging and experiment tracking, try installing [litlogger](https://pypi.org/project/litlogger/) to enable LitLogger, which logs metrics and artifacts automatically to the Lightning Experiments platform.
GPU available: True (cuda), used: True
TPU available: False, using: 0 TPU cores
💡 Tip: For seamless cloud logging and experiment tracking, try installing [litlogger](https://pypi.org/project/litlogger/) to enable LitLogger, which logs metrics and artifacts automatically to the Lightning Experiments platform.
[rank: 0] Seed set to 42
GPU available: True (cuda), used: True
TPU available: False, using: 0 TPU cores
💡 Tip: For seamless cloud logging and experiment tracking, try installing [litlogger](https://pypi.org/project/litlogger/) to enable LitLogger, which logs metrics and artifacts automatically to the Lightning Experiments platform.
LOCAL_RANK: 0 - CUDA_VISIBLE_DEVICES: [0]
LOCAL_RANK: 0 - CUDA_VISIBLE_DEVICES: [0]
LOCAL_RANK: 0 - CUDA_VISIBLE_DEVICES: [0]
SLURM auto-requeueing enabled. Setting signal handlers.
SLURM auto-requeueing enabled. Setting signal handlers.
SLURM auto-requeueing enabled. Setting signal handlers.
`Trainer.fit` stopped: `max_epochs=30` reached.
`Trainer.fit` stopped: `max_epochs=30` reached.
`Trainer.fit` stopped: `max_epochs=30` reached.
[I 2026-04-15 23:19:53,146] Trial 43 finished with value: 0.1395 and parameters: {'left_wall_dist_num_layers': 2, 'left_wall_dist_activation': 'relu', 'left_wall_dist_out_channels_l0': 235, 'left_wall_dist_pool_size_l0': 4, 'left_wall_dist_out_channels_l1': 204, 'left_wall_dist_pool_size_l1': 2, 'track_width_num_layers': 2, 'track_width_activation': 'relu', 'track_width_out_channels_l0': 181, 'track_width_pool_size_l0': 2, 'track_width_out_channels_l1': 99, 'track_width_pool_size_l1': 8, 'track_width_fc_hidden': 116, 'heading_error_num_layers': 5, 'heading_error_activation': 'elu', 'heading_error_out_channels_l0': 169, 'heading_error_pool_size_l0': 8, 'heading_error_out_channels_l1': 121, 'heading_error_pool_size_l1': 2, 'heading_error_out_channels_l2': 90, 'heading_error_pool_size_l2': 4, 'heading_error_out_channels_l3': 140, 'heading_error_pool_size_l3': 8}. Best is trial 10 with value: 0.1074.
[rank: 0] Seed set to 42
GPU available: True (cuda), used: True
TPU available: False, using: 0 TPU cores
💡 Tip: For seamless cloud logging and experiment tracking, try installing [litlogger](https://pypi.org/project/litlogger/) to enable LitLogger, which logs metrics and artifacts automatically to the Lightning Experiments platform.
[rank: 0] Seed set to 42
GPU available: True (cuda), used: True
TPU available: False, using: 0 TPU cores
💡 Tip: For seamless cloud logging and experiment tracking, try installing [litlogger](https://pypi.org/project/litlogger/) to enable LitLogger, which logs metrics and artifacts automatically to the Lightning Experiments platform.
[rank: 0] Seed set to 42
GPU available: True (cuda), used: True
TPU available: False, using: 0 TPU cores
💡 Tip: For seamless cloud logging and experiment tracking, try installing [litlogger](https://pypi.org/project/litlogger/) to enable LitLogger, which logs metrics and artifacts automatically to the Lightning Experiments platform.
LOCAL_RANK: 0 - CUDA_VISIBLE_DEVICES: [0]
SLURM auto-requeueing enabled. Setting signal handlers.
LOCAL_RANK: 0 - CUDA_VISIBLE_DEVICES: [0]
SLURM auto-requeueing enabled. Setting signal handlers.
LOCAL_RANK: 0 - CUDA_VISIBLE_DEVICES: [0]
SLURM auto-requeueing enabled. Setting signal handlers.
`Trainer.fit` stopped: `max_epochs=30` reached.
`Trainer.fit` stopped: `max_epochs=30` reached.
