[I 2026-04-12 15:17:35,419] Trial 55 finished with value: 0.156 and parameters: {'left_wall_dist_num_layers': 3, 'left_wall_dist_activation': 'elu', 'left_wall_dist_out_channels_l0': 163, 'left_wall_dist_pool_size_l0': 4, 'left_wall_dist_out_channels_l1': 40, 'left_wall_dist_pool_size_l1': 2, 'left_wall_dist_out_channels_l2': 226, 'left_wall_dist_pool_size_l2': 2, 'track_width_num_layers': 4, 'track_width_activation': 'elu', 'track_width_out_channels_l0': 109, 'track_width_pool_size_l0': 8, 'track_width_out_channels_l1': 157, 'track_width_pool_size_l1': 4, 'track_width_out_channels_l2': 96, 'track_width_pool_size_l2': 2, 'track_width_out_channels_l3': 138, 'track_width_pool_size_l3': 8, 'heading_error_num_layers': 3, 'heading_error_activation': 'elu', 'heading_error_out_channels_l0': 215, 'heading_error_pool_size_l0': 8, 'heading_error_out_channels_l1': 59, 'heading_error_pool_size_l1': 4, 'heading_error_out_channels_l2': 47, 'heading_error_pool_size_l2': 8, 'heading_error_fc_hidden': 33}. Best is trial 31 with value: 0.0984.
[rank: 0] Seed set to 42
[rank: 0] Seed set to 42
GPU available: True (cuda), used: True
TPU available: False, using: 0 TPU cores
💡 Tip: For seamless cloud logging and experiment tracking, try installing [litlogger](https://pypi.org/project/litlogger/) to enable LitLogger, which logs metrics and artifacts automatically to the Lightning Experiments platform.
GPU available: True (cuda), used: True
TPU available: False, using: 0 TPU cores
💡 Tip: For seamless cloud logging and experiment tracking, try installing [litlogger](https://pypi.org/project/litlogger/) to enable LitLogger, which logs metrics and artifacts automatically to the Lightning Experiments platform.
[rank: 0] Seed set to 42
GPU available: True (cuda), used: True
TPU available: False, using: 0 TPU cores
💡 Tip: For seamless cloud logging and experiment tracking, try installing [litlogger](https://pypi.org/project/litlogger/) to enable LitLogger, which logs metrics and artifacts automatically to the Lightning Experiments platform.
LOCAL_RANK: 0 - CUDA_VISIBLE_DEVICES: [0]
LOCAL_RANK: 0 - CUDA_VISIBLE_DEVICES: [0]
LOCAL_RANK: 0 - CUDA_VISIBLE_DEVICES: [0]
SLURM auto-requeueing enabled. Setting signal handlers.
SLURM auto-requeueing enabled. Setting signal handlers.
SLURM auto-requeueing enabled. Setting signal handlers.
`Trainer.fit` stopped: `max_epochs=20` reached.
`Trainer.fit` stopped: `max_epochs=20` reached.
`Trainer.fit` stopped: `max_epochs=20` reached.
[I 2026-04-12 15:19:34,807] Trial 56 finished with value: 0.1355 and parameters: {'left_wall_dist_num_layers': 3, 'left_wall_dist_activation': 'elu', 'left_wall_dist_out_channels_l0': 177, 'left_wall_dist_pool_size_l0': 4, 'left_wall_dist_out_channels_l1': 47, 'left_wall_dist_pool_size_l1': 2, 'left_wall_dist_out_channels_l2': 236, 'left_wall_dist_pool_size_l2': 4, 'left_wall_dist_fc_hidden': 128, 'track_width_num_layers': 3, 'track_width_activation': 'elu', 'track_width_out_channels_l0': 155, 'track_width_pool_size_l0': 8, 'track_width_out_channels_l1': 135, 'track_width_pool_size_l1': 4, 'track_width_out_channels_l2': 118, 'track_width_pool_size_l2': 2, 'track_width_fc_hidden': 43, 'heading_error_num_layers': 2, 'heading_error_activation': 'elu', 'heading_error_out_channels_l0': 181, 'heading_error_pool_size_l0': 8, 'heading_error_out_channels_l1': 52, 'heading_error_pool_size_l1': 4, 'heading_error_fc_hidden': 40}. Best is trial 31 with value: 0.0984.
[rank: 0] Seed set to 42
GPU available: True (cuda), used: True
TPU available: False, using: 0 TPU cores
💡 Tip: For seamless cloud logging and experiment tracking, try installing [litlogger](https://pypi.org/project/litlogger/) to enable LitLogger, which logs metrics and artifacts automatically to the Lightning Experiments platform.
[rank: 0] Seed set to 42
[rank: 0] Seed set to 42
GPU available: True (cuda), used: True
TPU available: False, using: 0 TPU cores
💡 Tip: For seamless cloud logging and experiment tracking, try installing [litlogger](https://pypi.org/project/litlogger/) to enable LitLogger, which logs metrics and artifacts automatically to the Lightning Experiments platform.
GPU available: True (cuda), used: True
TPU available: False, using: 0 TPU cores
💡 Tip: For seamless cloud logging and experiment tracking, try installing [litlogger](https://pypi.org/project/litlogger/) to enable LitLogger, which logs metrics and artifacts automatically to the Lightning Experiments platform.
LOCAL_RANK: 0 - CUDA_VISIBLE_DEVICES: [0]
LOCAL_RANK: 0 - CUDA_VISIBLE_DEVICES: [0]
LOCAL_RANK: 0 - CUDA_VISIBLE_DEVICES: [0]
SLURM auto-requeueing enabled. Setting signal handlers.
SLURM auto-requeueing enabled. Setting signal handlers.
SLURM auto-requeueing enabled. Setting signal handlers.
`Trainer.fit` stopped: `max_epochs=20` reached.
`Trainer.fit` stopped: `max_epochs=20` reached.
`Trainer.fit` stopped: `max_epochs=20` reached.
[I 2026-04-12 15:21:36,411] Trial 57 finished with value: 0.1311 and parameters: {'left_wall_dist_num_layers': 2, 'left_wall_dist_activation': 'elu', 'left_wall_dist_out_channels_l0': 154, 'left_wall_dist_pool_size_l0': 4, 'left_wall_dist_out_channels_l1': 48, 'left_wall_dist_pool_size_l1': 2, 'left_wall_dist_fc_hidden': 119, 'track_width_num_layers': 4, 'track_width_activation': 'elu', 'track_width_out_channels_l0': 143, 'track_width_pool_size_l0': 8, 'track_width_out_channels_l1': 176, 'track_width_pool_size_l1': 4, 'track_width_out_channels_l2': 161, 'track_width_pool_size_l2': 2, 'track_width_out_channels_l3': 164, 'track_width_pool_size_l3': 8, 'track_width_fc_hidden': 33, 'heading_error_num_layers': 3, 'heading_error_activation': 'elu', 'heading_error_out_channels_l0': 116, 'heading_error_pool_size_l0': 8, 'heading_error_out_channels_l1': 64, 'heading_error_pool_size_l1': 4, 'heading_error_out_channels_l2': 118, 'heading_error_pool_size_l2': 8, 'heading_error_fc_hidden': 49}. Best is trial 31 with value: 0.0984.
[rank: 0] Seed set to 42
[rank: 0] Seed set to 42
GPU available: True (cuda), used: True
TPU available: False, using: 0 TPU cores
💡 Tip: For seamless cloud logging and experiment tracking, try installing [litlogger](https://pypi.org/project/litlogger/) to enable LitLogger, which logs metrics and artifacts automatically to the Lightning Experiments platform.
GPU available: True (cuda), used: True
TPU available: False, using: 0 TPU cores
💡 Tip: For seamless cloud logging and experiment tracking, try installing [litlogger](https://pypi.org/project/litlogger/) to enable LitLogger, which logs metrics and artifacts automatically to the Lightning Experiments platform.
[rank: 0] Seed set to 42
GPU available: True (cuda), used: True
TPU available: False, using: 0 TPU cores
💡 Tip: For seamless cloud logging and experiment tracking, try installing [litlogger](https://pypi.org/project/litlogger/) to enable LitLogger, which logs metrics and artifacts automatically to the Lightning Experiments platform.
LOCAL_RANK: 0 - CUDA_VISIBLE_DEVICES: [0]
LOCAL_RANK: 0 - CUDA_VISIBLE_DEVICES: [0]
LOCAL_RANK: 0 - CUDA_VISIBLE_DEVICES: [0]
SLURM auto-requeueing enabled. Setting signal handlers.
SLURM auto-requeueing enabled. Setting signal handlers.
SLURM auto-requeueing enabled. Setting signal handlers.
`Trainer.fit` stopped: `max_epochs=20` reached.
`Trainer.fit` stopped: `max_epochs=20` reached.
`Trainer.fit` stopped: `max_epochs=20` reached.
[I 2026-04-12 15:23:39,063] Trial 58 finished with value: 0.1131 and parameters: {'left_wall_dist_num_layers': 3, 'left_wall_dist_activation': 'elu', 'left_wall_dist_out_channels_l0': 81, 'left_wall_dist_pool_size_l0': 4, 'left_wall_dist_out_channels_l1': 39, 'left_wall_dist_pool_size_l1': 2, 'left_wall_dist_out_channels_l2': 205, 'left_wall_dist_pool_size_l2': 2, 'track_width_num_layers': 4, 'track_width_activation': 'relu', 'track_width_out_channels_l0': 43, 'track_width_pool_size_l0': 2, 'track_width_out_channels_l1': 78, 'track_width_pool_size_l1': 8, 'track_width_out_channels_l2': 77, 'track_width_pool_size_l2': 2, 'track_width_out_channels_l3': 81, 'track_width_pool_size_l3': 8, 'track_width_fc_hidden': 47, 'heading_error_num_layers': 3, 'heading_error_activation': 'elu', 'heading_error_out_channels_l0': 158, 'heading_error_pool_size_l0': 8, 'heading_error_out_channels_l1': 98, 'heading_error_pool_size_l1': 4, 'heading_error_out_channels_l2': 52, 'heading_error_pool_size_l2': 8, 'heading_error_fc_hidden': 34}. Best is trial 31 with value: 0.0984.
[rank: 0] Seed set to 42
[rank: 0] Seed set to 42
[rank: 0] Seed set to 42
GPU available: True (cuda), used: True
TPU available: False, using: 0 TPU cores
GPU available: True (cuda), used: True
TPU available: False, using: 0 TPU cores
💡 Tip: For seamless cloud logging and experiment tracking, try installing [litlogger](https://pypi.org/project/litlogger/) to enable LitLogger, which logs metrics and artifacts automatically to the Lightning Experiments platform.
💡 Tip: For seamless cloud logging and experiment tracking, try installing [litlogger](https://pypi.org/project/litlogger/) to enable LitLogger, which logs metrics and artifacts automatically to the Lightning Experiments platform.
GPU available: True (cuda), used: True
TPU available: False, using: 0 TPU cores
💡 Tip: For seamless cloud logging and experiment tracking, try installing [litlogger](https://pypi.org/project/litlogger/) to enable LitLogger, which logs metrics and artifacts automatically to the Lightning Experiments platform.
LOCAL_RANK: 0 - CUDA_VISIBLE_DEVICES: [0]
LOCAL_RANK: 0 - CUDA_VISIBLE_DEVICES: [0]
LOCAL_RANK: 0 - CUDA_VISIBLE_DEVICES: [0]
SLURM auto-requeueing enabled. Setting signal handlers.
SLURM auto-requeueing enabled. Setting signal handlers.
SLURM auto-requeueing enabled. Setting signal handlers.
`Trainer.fit` stopped: `max_epochs=20` reached.
`Trainer.fit` stopped: `max_epochs=20` reached.
`Trainer.fit` stopped: `max_epochs=20` reached.
[I 2026-04-12 15:25:48,402] Trial 59 finished with value: 0.1184 and parameters: {'left_wall_dist_num_layers': 3, 'left_wall_dist_activation': 'elu', 'left_wall_dist_out_channels_l0': 135, 'left_wall_dist_pool_size_l0': 4, 'left_wall_dist_out_channels_l1': 35, 'left_wall_dist_pool_size_l1': 8, 'left_wall_dist_out_channels_l2': 148, 'left_wall_dist_pool_size_l2': 2, 'left_wall_dist_fc_hidden': 61, 'track_width_num_layers': 4, 'track_width_activation': 'elu', 'track_width_out_channels_l0': 175, 'track_width_pool_size_l0': 8, 'track_width_out_channels_l1': 112, 'track_width_pool_size_l1': 4, 'track_width_out_channels_l2': 83, 'track_width_pool_size_l2': 2, 'track_width_out_channels_l3': 111, 'track_width_pool_size_l3': 8, 'heading_error_num_layers': 4, 'heading_error_activation': 'elu', 'heading_error_out_channels_l0': 205, 'heading_error_pool_size_l0': 8, 'heading_error_out_channels_l1': 78, 'heading_error_pool_size_l1': 4, 'heading_error_out_channels_l2': 41, 'heading_error_pool_size_l2': 8, 'heading_error_out_channels_l3': 71, 'heading_error_pool_size_l3': 8}. Best is trial 31 with value: 0.0984.
[rank: 0] Seed set to 42
[rank: 0] Seed set to 42
[rank: 0] Seed set to 42
GPU available: True (cuda), used: True
TPU available: False, using: 0 TPU cores
💡 Tip: For seamless cloud logging and experiment tracking, try installing [litlogger](https://pypi.org/project/litlogger/) to enable LitLogger, which logs metrics and artifacts automatically to the Lightning Experiments platform.
GPU available: True (cuda), used: True
TPU available: False, using: 0 TPU cores
💡 Tip: For seamless cloud logging and experiment tracking, try installing [litlogger](https://pypi.org/project/litlogger/) to enable LitLogger, which logs metrics and artifacts automatically to the Lightning Experiments platform.
GPU available: True (cuda), used: True
TPU available: False, using: 0 TPU cores
💡 Tip: For seamless cloud logging and experiment tracking, try installing [litlogger](https://pypi.org/project/litlogger/) to enable LitLogger, which logs metrics and artifacts automatically to the Lightning Experiments platform.
LOCAL_RANK: 0 - CUDA_VISIBLE_DEVICES: [0]
LOCAL_RANK: 0 - CUDA_VISIBLE_DEVICES: [0]
LOCAL_RANK: 0 - CUDA_VISIBLE_DEVICES: [0]
SLURM auto-requeueing enabled. Setting signal handlers.
SLURM auto-requeueing enabled. Setting signal handlers.
SLURM auto-requeueing enabled. Setting signal handlers.
`Trainer.fit` stopped: `max_epochs=20` reached.
`Trainer.fit` stopped: `max_epochs=20` reached.
`Trainer.fit` stopped: `max_epochs=20` reached.
[I 2026-04-12 15:27:56,896] Trial 60 finished with value: 0.1229 and parameters: {'left_wall_dist_num_layers': 3, 'left_wall_dist_activation': 'elu', 'left_wall_dist_out_channels_l0': 199, 'left_wall_dist_pool_size_l0': 4, 'left_wall_dist_out_channels_l1': 58, 'left_wall_dist_pool_size_l1': 2, 'left_wall_dist_out_channels_l2': 137, 'left_wall_dist_pool_size_l2': 8, 'left_wall_dist_fc_hidden': 56, 'track_width_num_layers': 3, 'track_width_activation': 'elu', 'track_width_out_channels_l0': 96, 'track_width_pool_size_l0': 4, 'track_width_out_channels_l1': 197, 'track_width_pool_size_l1': 2, 'track_width_out_channels_l2': 215, 'track_width_pool_size_l2': 2, 'heading_error_num_layers': 3, 'heading_error_activation': 'elu', 'heading_error_out_channels_l0': 138, 'heading_error_pool_size_l0': 8, 'heading_error_out_channels_l1': 69, 'heading_error_pool_size_l1': 2, 'heading_error_out_channels_l2': 151, 'heading_error_pool_size_l2': 8, 'heading_error_fc_hidden': 118}. Best is trial 31 with value: 0.0984.
[rank: 0] Seed set to 42
[rank: 0] Seed set to 42
[rank: 0] Seed set to 42
GPU available: True (cuda), used: True
TPU available: False, using: 0 TPU cores
💡 Tip: For seamless cloud logging and experiment tracking, try installing [litlogger](https://pypi.org/project/litlogger/) to enable LitLogger, which logs metrics and artifacts automatically to the Lightning Experiments platform.
GPU available: True (cuda), used: True
TPU available: False, using: 0 TPU cores
💡 Tip: For seamless cloud logging and experiment tracking, try installing [litlogger](https://pypi.org/project/litlogger/) to enable LitLogger, which logs metrics and artifacts automatically to the Lightning Experiments platform.
GPU available: True (cuda), used: True
TPU available: False, using: 0 TPU cores
💡 Tip: For seamless cloud logging and experiment tracking, try installing [litlogger](https://pypi.org/project/litlogger/) to enable LitLogger, which logs metrics and artifacts automatically to the Lightning Experiments platform.
LOCAL_RANK: 0 - CUDA_VISIBLE_DEVICES: [0]
LOCAL_RANK: 0 - CUDA_VISIBLE_DEVICES: [0]
LOCAL_RANK: 0 - CUDA_VISIBLE_DEVICES: [0]
SLURM auto-requeueing enabled. Setting signal handlers.
SLURM auto-requeueing enabled. Setting signal handlers.
SLURM auto-requeueing enabled. Setting signal handlers.
`Trainer.fit` stopped: `max_epochs=20` reached.
`Trainer.fit` stopped: `max_epochs=20` reached.
`Trainer.fit` stopped: `max_epochs=20` reached.
[I 2026-04-12 15:30:06,001] Trial 61 finished with value: 0.1113 and parameters: {'left_wall_dist_num_layers': 3, 'left_wall_dist_activation': 'elu', 'left_wall_dist_out_channels_l0': 143, 'left_wall_dist_pool_size_l0': 4, 'left_wall_dist_out_channels_l1': 45, 'left_wall_dist_pool_size_l1': 2, 'left_wall_dist_out_channels_l2': 177, 'left_wall_dist_pool_size_l2': 2, 'track_width_num_layers': 4, 'track_width_activation': 'elu', 'track_width_out_channels_l0': 184, 'track_width_pool_size_l0': 8, 'track_width_out_channels_l1': 168, 'track_width_pool_size_l1': 4, 'track_width_out_channels_l2': 107, 'track_width_pool_size_l2': 2, 'track_width_out_channels_l3': 84, 'track_width_pool_size_l3': 8, 'heading_error_num_layers': 3, 'heading_error_activation': 'elu', 'heading_error_out_channels_l0': 151, 'heading_error_pool_size_l0': 8, 'heading_error_out_channels_l1': 110, 'heading_error_pool_size_l1': 4, 'heading_error_out_channels_l2': 37, 'heading_error_pool_size_l2': 8}. Best is trial 31 with value: 0.0984.
[rank: 0] Seed set to 42
[rank: 0] Seed set to 42
[rank: 0] Seed set to 42
GPU available: True (cuda), used: True
TPU available: False, using: 0 TPU cores
💡 Tip: For seamless cloud logging and experiment tracking, try installing [litlogger](https://pypi.org/project/litlogger/) to enable LitLogger, which logs metrics and artifacts automatically to the Lightning Experiments platform.
GPU available: True (cuda), used: True
TPU available: False, using: 0 TPU cores
💡 Tip: For seamless cloud logging and experiment tracking, try installing [litlogger](https://pypi.org/project/litlogger/) to enable LitLogger, which logs metrics and artifacts automatically to the Lightning Experiments platform.
GPU available: True (cuda), used: True
TPU available: False, using: 0 TPU cores
💡 Tip: For seamless cloud logging and experiment tracking, try installing [litlogger](https://pypi.org/project/litlogger/) to enable LitLogger, which logs metrics and artifacts automatically to the Lightning Experiments platform.
LOCAL_RANK: 0 - CUDA_VISIBLE_DEVICES: [0]
LOCAL_RANK: 0 - CUDA_VISIBLE_DEVICES: [0]
LOCAL_RANK: 0 - CUDA_VISIBLE_DEVICES: [0]
SLURM auto-requeueing enabled. Setting signal handlers.
SLURM auto-requeueing enabled. Setting signal handlers.
SLURM auto-requeueing enabled. Setting signal handlers.
`Trainer.fit` stopped: `max_epochs=20` reached.
`Trainer.fit` stopped: `max_epochs=20` reached.
`Trainer.fit` stopped: `max_epochs=20` reached.
[I 2026-04-12 15:32:13,153] Trial 62 finished with value: 0.109 and parameters: {'left_wall_dist_num_layers': 3, 'left_wall_dist_activation': 'elu', 'left_wall_dist_out_channels_l0': 149, 'left_wall_dist_pool_size_l0': 4, 'left_wall_dist_out_channels_l1': 44, 'left_wall_dist_pool_size_l1': 2, 'left_wall_dist_out_channels_l2': 192, 'left_wall_dist_pool_size_l2': 2, 'track_width_num_layers': 4, 'track_width_activation': 'elu', 'track_width_out_channels_l0': 202, 'track_width_pool_size_l0': 8, 'track_width_out_channels_l1': 149, 'track_width_pool_size_l1': 4, 'track_width_out_channels_l2': 96, 'track_width_pool_size_l2': 2, 'track_width_out_channels_l3': 79, 'track_width_pool_size_l3': 8, 'heading_error_num_layers': 3, 'heading_error_activation': 'elu', 'heading_error_out_channels_l0': 174, 'heading_error_pool_size_l0': 8, 'heading_error_out_channels_l1': 84, 'heading_error_pool_size_l1': 4, 'heading_error_out_channels_l2': 34, 'heading_error_pool_size_l2': 8}. Best is trial 31 with value: 0.0984.
[rank: 0] Seed set to 42
[rank: 0] Seed set to 42
[rank: 0] Seed set to 42
GPU available: True (cuda), used: True
GPU available: True (cuda), used: True
TPU available: False, using: 0 TPU cores
TPU available: False, using: 0 TPU cores
💡 Tip: For seamless cloud logging and experiment tracking, try installing [litlogger](https://pypi.org/project/litlogger/) to enable LitLogger, which logs metrics and artifacts automatically to the Lightning Experiments platform.
💡 Tip: For seamless cloud logging and experiment tracking, try installing [litlogger](https://pypi.org/project/litlogger/) to enable LitLogger, which logs metrics and artifacts automatically to the Lightning Experiments platform.
GPU available: True (cuda), used: True
TPU available: False, using: 0 TPU cores
💡 Tip: For seamless cloud logging and experiment tracking, try installing [litlogger](https://pypi.org/project/litlogger/) to enable LitLogger, which logs metrics and artifacts automatically to the Lightning Experiments platform.
LOCAL_RANK: 0 - CUDA_VISIBLE_DEVICES: [0]
LOCAL_RANK: 0 - CUDA_VISIBLE_DEVICES: [0]
LOCAL_RANK: 0 - CUDA_VISIBLE_DEVICES: [0]
SLURM auto-requeueing enabled. Setting signal handlers.
SLURM auto-requeueing enabled. Setting signal handlers.
SLURM auto-requeueing enabled. Setting signal handlers.
`Trainer.fit` stopped: `max_epochs=20` reached.
`Trainer.fit` stopped: `max_epochs=20` reached.
`Trainer.fit` stopped: `max_epochs=20` reached.
