[I 2026-04-15 01:07:20,016] Trial 97 finished with value: 0.1071 and parameters: {'left_wall_dist_num_layers': 2, 'left_wall_dist_activation': 'relu', 'left_wall_dist_out_channels_l0': 61, 'left_wall_dist_pool_size_l0': 4, 'left_wall_dist_out_channels_l1': 79, 'left_wall_dist_pool_size_l1': 4, 'left_wall_dist_fc_hidden': 90, 'track_width_num_layers': 4, 'track_width_activation': 'elu', 'track_width_out_channels_l0': 152, 'track_width_pool_size_l0': 4, 'track_width_out_channels_l1': 47, 'track_width_pool_size_l1': 2, 'track_width_out_channels_l2': 91, 'track_width_pool_size_l2': 2, 'track_width_out_channels_l3': 188, 'track_width_pool_size_l3': 8, 'track_width_fc_hidden': 111, 'heading_error_num_layers': 3, 'heading_error_activation': 'elu', 'heading_error_out_channels_l0': 104, 'heading_error_pool_size_l0': 4, 'heading_error_out_channels_l1': 169, 'heading_error_pool_size_l1': 4, 'heading_error_out_channels_l2': 125, 'heading_error_pool_size_l2': 2, 'heading_error_fc_hidden': 63}. Best is trial 26 with value: 0.0907.
[rank: 0] Seed set to 42
[rank: 0] Seed set to 42
[rank: 0] Seed set to 42
GPU available: True (cuda), used: True
TPU available: False, using: 0 TPU cores
💡 Tip: For seamless cloud logging and experiment tracking, try installing [litlogger](https://pypi.org/project/litlogger/) to enable LitLogger, which logs metrics and artifacts automatically to the Lightning Experiments platform.
GPU available: True (cuda), used: True
TPU available: False, using: 0 TPU cores
💡 Tip: For seamless cloud logging and experiment tracking, try installing [litlogger](https://pypi.org/project/litlogger/) to enable LitLogger, which logs metrics and artifacts automatically to the Lightning Experiments platform.
GPU available: True (cuda), used: True
TPU available: False, using: 0 TPU cores
💡 Tip: For seamless cloud logging and experiment tracking, try installing [litlogger](https://pypi.org/project/litlogger/) to enable LitLogger, which logs metrics and artifacts automatically to the Lightning Experiments platform.
LOCAL_RANK: 0 - CUDA_VISIBLE_DEVICES: [0]
LOCAL_RANK: 0 - CUDA_VISIBLE_DEVICES: [0]
LOCAL_RANK: 0 - CUDA_VISIBLE_DEVICES: [0]
SLURM auto-requeueing enabled. Setting signal handlers.
SLURM auto-requeueing enabled. Setting signal handlers.
SLURM auto-requeueing enabled. Setting signal handlers.
`Trainer.fit` stopped: `max_epochs=30` reached.
`Trainer.fit` stopped: `max_epochs=30` reached.
`Trainer.fit` stopped: `max_epochs=30` reached.
[I 2026-04-15 01:10:01,709] Trial 98 finished with value: 0.1071 and parameters: {'left_wall_dist_num_layers': 2, 'left_wall_dist_activation': 'elu', 'left_wall_dist_out_channels_l0': 57, 'left_wall_dist_pool_size_l0': 2, 'left_wall_dist_out_channels_l1': 52, 'left_wall_dist_pool_size_l1': 4, 'left_wall_dist_fc_hidden': 109, 'track_width_num_layers': 4, 'track_width_activation': 'relu', 'track_width_out_channels_l0': 47, 'track_width_pool_size_l0': 8, 'track_width_out_channels_l1': 50, 'track_width_pool_size_l1': 2, 'track_width_out_channels_l2': 191, 'track_width_pool_size_l2': 2, 'track_width_out_channels_l3': 153, 'track_width_pool_size_l3': 8, 'track_width_fc_hidden': 108, 'heading_error_num_layers': 3, 'heading_error_activation': 'elu', 'heading_error_out_channels_l0': 90, 'heading_error_pool_size_l0': 8, 'heading_error_out_channels_l1': 138, 'heading_error_pool_size_l1': 8, 'heading_error_out_channels_l2': 167, 'heading_error_pool_size_l2': 4, 'heading_error_fc_hidden': 33}. Best is trial 26 with value: 0.0907.
[rank: 0] Seed set to 42
[rank: 0] Seed set to 42
[rank: 0] Seed set to 42
GPU available: True (cuda), used: True
TPU available: False, using: 0 TPU cores
💡 Tip: For seamless cloud logging and experiment tracking, try installing [litlogger](https://pypi.org/project/litlogger/) to enable LitLogger, which logs metrics and artifacts automatically to the Lightning Experiments platform.
GPU available: True (cuda), used: True
TPU available: False, using: 0 TPU cores
💡 Tip: For seamless cloud logging and experiment tracking, try installing [litlogger](https://pypi.org/project/litlogger/) to enable LitLogger, which logs metrics and artifacts automatically to the Lightning Experiments platform.
GPU available: True (cuda), used: True
TPU available: False, using: 0 TPU cores
💡 Tip: For seamless cloud logging and experiment tracking, try installing [litlogger](https://pypi.org/project/litlogger/) to enable LitLogger, which logs metrics and artifacts automatically to the Lightning Experiments platform.
LOCAL_RANK: 0 - CUDA_VISIBLE_DEVICES: [0]
LOCAL_RANK: 0 - CUDA_VISIBLE_DEVICES: [0]
LOCAL_RANK: 0 - CUDA_VISIBLE_DEVICES: [0]
SLURM auto-requeueing enabled. Setting signal handlers.
SLURM auto-requeueing enabled. Setting signal handlers.
SLURM auto-requeueing enabled. Setting signal handlers.
`Trainer.fit` stopped: `max_epochs=30` reached.
`Trainer.fit` stopped: `max_epochs=30` reached.
`Trainer.fit` stopped: `max_epochs=30` reached.
[I 2026-04-15 01:12:46,255] Trial 99 finished with value: 0.1045 and parameters: {'left_wall_dist_num_layers': 2, 'left_wall_dist_activation': 'relu', 'left_wall_dist_out_channels_l0': 78, 'left_wall_dist_pool_size_l0': 4, 'left_wall_dist_out_channels_l1': 93, 'left_wall_dist_pool_size_l1': 4, 'left_wall_dist_fc_hidden': 100, 'track_width_num_layers': 3, 'track_width_activation': 'relu', 'track_width_out_channels_l0': 71, 'track_width_pool_size_l0': 4, 'track_width_out_channels_l1': 36, 'track_width_pool_size_l1': 2, 'track_width_out_channels_l2': 162, 'track_width_pool_size_l2': 2, 'heading_error_num_layers': 4, 'heading_error_activation': 'elu', 'heading_error_out_channels_l0': 120, 'heading_error_pool_size_l0': 4, 'heading_error_out_channels_l1': 34, 'heading_error_pool_size_l1': 2, 'heading_error_out_channels_l2': 255, 'heading_error_pool_size_l2': 4, 'heading_error_out_channels_l3': 33, 'heading_error_pool_size_l3': 4, 'heading_error_fc_hidden': 46}. Best is trial 26 with value: 0.0907.
[rank: 0] Seed set to 42
[rank: 0] Seed set to 42
[rank: 0] Seed set to 42
GPU available: True (cuda), used: True
TPU available: False, using: 0 TPU cores
💡 Tip: For seamless cloud logging and experiment tracking, try installing [litlogger](https://pypi.org/project/litlogger/) to enable LitLogger, which logs metrics and artifacts automatically to the Lightning Experiments platform.
GPU available: True (cuda), used: True
TPU available: False, using: 0 TPU cores
💡 Tip: For seamless cloud logging and experiment tracking, try installing [litlogger](https://pypi.org/project/litlogger/) to enable LitLogger, which logs metrics and artifacts automatically to the Lightning Experiments platform.
GPU available: True (cuda), used: True
TPU available: False, using: 0 TPU cores
💡 Tip: For seamless cloud logging and experiment tracking, try installing [litlogger](https://pypi.org/project/litlogger/) to enable LitLogger, which logs metrics and artifacts automatically to the Lightning Experiments platform.
LOCAL_RANK: 0 - CUDA_VISIBLE_DEVICES: [0]
LOCAL_RANK: 0 - CUDA_VISIBLE_DEVICES: [0]
LOCAL_RANK: 0 - CUDA_VISIBLE_DEVICES: [0]
SLURM auto-requeueing enabled. Setting signal handlers.
SLURM auto-requeueing enabled. Setting signal handlers.
SLURM auto-requeueing enabled. Setting signal handlers.
`Trainer.fit` stopped: `max_epochs=30` reached.
`Trainer.fit` stopped: `max_epochs=30` reached.
`Trainer.fit` stopped: `max_epochs=30` reached.
[I 2026-04-15 01:15:23,693] Trial 100 finished with value: 0.1332 and parameters: {'left_wall_dist_num_layers': 2, 'left_wall_dist_activation': 'relu', 'left_wall_dist_out_channels_l0': 89, 'left_wall_dist_pool_size_l0': 4, 'left_wall_dist_out_channels_l1': 75, 'left_wall_dist_pool_size_l1': 4, 'left_wall_dist_fc_hidden': 98, 'track_width_num_layers': 4, 'track_width_activation': 'relu', 'track_width_out_channels_l0': 32, 'track_width_pool_size_l0': 2, 'track_width_out_channels_l1': 74, 'track_width_pool_size_l1': 2, 'track_width_out_channels_l2': 98, 'track_width_pool_size_l2': 2, 'track_width_out_channels_l3': 86, 'track_width_pool_size_l3': 4, 'track_width_fc_hidden': 122, 'heading_error_num_layers': 2, 'heading_error_activation': 'elu', 'heading_error_out_channels_l0': 82, 'heading_error_pool_size_l0': 4, 'heading_error_out_channels_l1': 119, 'heading_error_pool_size_l1': 8, 'heading_error_fc_hidden': 62}. Best is trial 26 with value: 0.0907.
[rank: 0] Seed set to 42
[rank: 0] Seed set to 42
[rank: 0] Seed set to 42
GPU available: True (cuda), used: True
TPU available: False, using: 0 TPU cores
💡 Tip: For seamless cloud logging and experiment tracking, try installing [litlogger](https://pypi.org/project/litlogger/) to enable LitLogger, which logs metrics and artifacts automatically to the Lightning Experiments platform.
GPU available: True (cuda), used: True
TPU available: False, using: 0 TPU cores
💡 Tip: For seamless cloud logging and experiment tracking, try installing [litlogger](https://pypi.org/project/litlogger/) to enable LitLogger, which logs metrics and artifacts automatically to the Lightning Experiments platform.
GPU available: True (cuda), used: True
TPU available: False, using: 0 TPU cores
💡 Tip: For seamless cloud logging and experiment tracking, try installing [litlogger](https://pypi.org/project/litlogger/) to enable LitLogger, which logs metrics and artifacts automatically to the Lightning Experiments platform.
LOCAL_RANK: 0 - CUDA_VISIBLE_DEVICES: [0]
LOCAL_RANK: 0 - CUDA_VISIBLE_DEVICES: [0]
LOCAL_RANK: 0 - CUDA_VISIBLE_DEVICES: [0]
SLURM auto-requeueing enabled. Setting signal handlers.
SLURM auto-requeueing enabled. Setting signal handlers.
SLURM auto-requeueing enabled. Setting signal handlers.
`Trainer.fit` stopped: `max_epochs=30` reached.
`Trainer.fit` stopped: `max_epochs=30` reached.
`Trainer.fit` stopped: `max_epochs=30` reached.
[I 2026-04-15 01:18:04,825] Trial 101 finished with value: 0.0985 and parameters: {'left_wall_dist_num_layers': 2, 'left_wall_dist_activation': 'relu', 'left_wall_dist_out_channels_l0': 75, 'left_wall_dist_pool_size_l0': 4, 'left_wall_dist_out_channels_l1': 125, 'left_wall_dist_pool_size_l1': 4, 'track_width_num_layers': 4, 'track_width_activation': 'relu', 'track_width_out_channels_l0': 84, 'track_width_pool_size_l0': 4, 'track_width_out_channels_l1': 34, 'track_width_pool_size_l1': 2, 'track_width_out_channels_l2': 89, 'track_width_pool_size_l2': 2, 'track_width_out_channels_l3': 171, 'track_width_pool_size_l3': 4, 'track_width_fc_hidden': 128, 'heading_error_num_layers': 3, 'heading_error_activation': 'elu', 'heading_error_out_channels_l0': 111, 'heading_error_pool_size_l0': 4, 'heading_error_out_channels_l1': 64, 'heading_error_pool_size_l1': 8, 'heading_error_out_channels_l2': 83, 'heading_error_pool_size_l2': 4, 'heading_error_fc_hidden': 50}. Best is trial 26 with value: 0.0907.
[rank: 0] Seed set to 42
[rank: 0] Seed set to 42
[rank: 0] Seed set to 42
GPU available: True (cuda), used: True
TPU available: False, using: 0 TPU cores
💡 Tip: For seamless cloud logging and experiment tracking, try installing [litlogger](https://pypi.org/project/litlogger/) to enable LitLogger, which logs metrics and artifacts automatically to the Lightning Experiments platform.
GPU available: True (cuda), used: True
TPU available: False, using: 0 TPU cores
💡 Tip: For seamless cloud logging and experiment tracking, try installing [litlogger](https://pypi.org/project/litlogger/) to enable LitLogger, which logs metrics and artifacts automatically to the Lightning Experiments platform.
GPU available: True (cuda), used: True
TPU available: False, using: 0 TPU cores
💡 Tip: For seamless cloud logging and experiment tracking, try installing [litlogger](https://pypi.org/project/litlogger/) to enable LitLogger, which logs metrics and artifacts automatically to the Lightning Experiments platform.
LOCAL_RANK: 0 - CUDA_VISIBLE_DEVICES: [0]
LOCAL_RANK: 0 - CUDA_VISIBLE_DEVICES: [0]
LOCAL_RANK: 0 - CUDA_VISIBLE_DEVICES: [0]
SLURM auto-requeueing enabled. Setting signal handlers.
SLURM auto-requeueing enabled. Setting signal handlers.
SLURM auto-requeueing enabled. Setting signal handlers.
`Trainer.fit` stopped: `max_epochs=30` reached.
`Trainer.fit` stopped: `max_epochs=30` reached.
`Trainer.fit` stopped: `max_epochs=30` reached.
[I 2026-04-15 01:20:46,645] Trial 102 finished with value: 0.1215 and parameters: {'left_wall_dist_num_layers': 2, 'left_wall_dist_activation': 'relu', 'left_wall_dist_out_channels_l0': 79, 'left_wall_dist_pool_size_l0': 4, 'left_wall_dist_out_channels_l1': 99, 'left_wall_dist_pool_size_l1': 4, 'left_wall_dist_fc_hidden': 104, 'track_width_num_layers': 4, 'track_width_activation': 'relu', 'track_width_out_channels_l0': 80, 'track_width_pool_size_l0': 4, 'track_width_out_channels_l1': 33, 'track_width_pool_size_l1': 2, 'track_width_out_channels_l2': 129, 'track_width_pool_size_l2': 2, 'track_width_out_channels_l3': 168, 'track_width_pool_size_l3': 4, 'track_width_fc_hidden': 117, 'heading_error_num_layers': 3, 'heading_error_activation': 'elu', 'heading_error_out_channels_l0': 107, 'heading_error_pool_size_l0': 4, 'heading_error_out_channels_l1': 63, 'heading_error_pool_size_l1': 8, 'heading_error_out_channels_l2': 80, 'heading_error_pool_size_l2': 4, 'heading_error_fc_hidden': 48}. Best is trial 26 with value: 0.0907.
[rank: 0] Seed set to 42
[rank: 0] Seed set to 42
[rank: 0] Seed set to 42
GPU available: True (cuda), used: True
TPU available: False, using: 0 TPU cores
💡 Tip: For seamless cloud logging and experiment tracking, try installing [litlogger](https://pypi.org/project/litlogger/) to enable LitLogger, which logs metrics and artifacts automatically to the Lightning Experiments platform.
GPU available: True (cuda), used: True
TPU available: False, using: 0 TPU cores
💡 Tip: For seamless cloud logging and experiment tracking, try installing [litlogger](https://pypi.org/project/litlogger/) to enable LitLogger, which logs metrics and artifacts automatically to the Lightning Experiments platform.
GPU available: True (cuda), used: True
TPU available: False, using: 0 TPU cores
💡 Tip: For seamless cloud logging and experiment tracking, try installing [litlogger](https://pypi.org/project/litlogger/) to enable LitLogger, which logs metrics and artifacts automatically to the Lightning Experiments platform.
LOCAL_RANK: 0 - CUDA_VISIBLE_DEVICES: [0]
LOCAL_RANK: 0 - CUDA_VISIBLE_DEVICES: [0]
LOCAL_RANK: 0 - CUDA_VISIBLE_DEVICES: [0]
SLURM auto-requeueing enabled. Setting signal handlers.
SLURM auto-requeueing enabled. Setting signal handlers.
SLURM auto-requeueing enabled. Setting signal handlers.
`Trainer.fit` stopped: `max_epochs=30` reached.
`Trainer.fit` stopped: `max_epochs=30` reached.
`Trainer.fit` stopped: `max_epochs=30` reached.
[I 2026-04-15 01:23:28,582] Trial 103 finished with value: 0.1022 and parameters: {'left_wall_dist_num_layers': 2, 'left_wall_dist_activation': 'relu', 'left_wall_dist_out_channels_l0': 67, 'left_wall_dist_pool_size_l0': 4, 'left_wall_dist_out_channels_l1': 108, 'left_wall_dist_pool_size_l1': 4, 'left_wall_dist_fc_hidden': 112, 'track_width_num_layers': 4, 'track_width_activation': 'relu', 'track_width_out_channels_l0': 98, 'track_width_pool_size_l0': 4, 'track_width_out_channels_l1': 39, 'track_width_pool_size_l1': 2, 'track_width_out_channels_l2': 95, 'track_width_pool_size_l2': 2, 'track_width_out_channels_l3': 149, 'track_width_pool_size_l3': 4, 'track_width_fc_hidden': 122, 'heading_error_num_layers': 3, 'heading_error_activation': 'elu', 'heading_error_out_channels_l0': 96, 'heading_error_pool_size_l0': 4, 'heading_error_out_channels_l1': 67, 'heading_error_pool_size_l1': 8, 'heading_error_out_channels_l2': 74, 'heading_error_pool_size_l2': 4, 'heading_error_fc_hidden': 42}. Best is trial 26 with value: 0.0907.
[rank: 0] Seed set to 42
[rank: 0] Seed set to 42
[rank: 0] Seed set to 42
GPU available: True (cuda), used: True
TPU available: False, using: 0 TPU cores
💡 Tip: For seamless cloud logging and experiment tracking, try installing [litlogger](https://pypi.org/project/litlogger/) to enable LitLogger, which logs metrics and artifacts automatically to the Lightning Experiments platform.
GPU available: True (cuda), used: True
TPU available: False, using: 0 TPU cores
💡 Tip: For seamless cloud logging and experiment tracking, try installing [litlogger](https://pypi.org/project/litlogger/) to enable LitLogger, which logs metrics and artifacts automatically to the Lightning Experiments platform.
GPU available: True (cuda), used: True
TPU available: False, using: 0 TPU cores
💡 Tip: For seamless cloud logging and experiment tracking, try installing [litlogger](https://pypi.org/project/litlogger/) to enable LitLogger, which logs metrics and artifacts automatically to the Lightning Experiments platform.
LOCAL_RANK: 0 - CUDA_VISIBLE_DEVICES: [0]
LOCAL_RANK: 0 - CUDA_VISIBLE_DEVICES: [0]
LOCAL_RANK: 0 - CUDA_VISIBLE_DEVICES: [0]
SLURM auto-requeueing enabled. Setting signal handlers.
SLURM auto-requeueing enabled. Setting signal handlers.
SLURM auto-requeueing enabled. Setting signal handlers.
`Trainer.fit` stopped: `max_epochs=30` reached.
`Trainer.fit` stopped: `max_epochs=30` reached.
`Trainer.fit` stopped: `max_epochs=30` reached.
[I 2026-04-15 01:26:11,145] Trial 104 finished with value: 0.0987 and parameters: {'left_wall_dist_num_layers': 2, 'left_wall_dist_activation': 'relu', 'left_wall_dist_out_channels_l0': 83, 'left_wall_dist_pool_size_l0': 4, 'left_wall_dist_out_channels_l1': 96, 'left_wall_dist_pool_size_l1': 4, 'left_wall_dist_fc_hidden': 101, 'track_width_num_layers': 4, 'track_width_activation': 'relu', 'track_width_out_channels_l0': 67, 'track_width_pool_size_l0': 4, 'track_width_out_channels_l1': 35, 'track_width_pool_size_l1': 2, 'track_width_out_channels_l2': 111, 'track_width_pool_size_l2': 2, 'track_width_out_channels_l3': 135, 'track_width_pool_size_l3': 4, 'track_width_fc_hidden': 128, 'heading_error_num_layers': 3, 'heading_error_activation': 'elu', 'heading_error_out_channels_l0': 126, 'heading_error_pool_size_l0': 4, 'heading_error_out_channels_l1': 95, 'heading_error_pool_size_l1': 8, 'heading_error_out_channels_l2': 88, 'heading_error_pool_size_l2': 4, 'heading_error_fc_hidden': 48}. Best is trial 26 with value: 0.0907.
[rank: 0] Seed set to 42
[rank: 0] Seed set to 42
[rank: 0] Seed set to 42
GPU available: True (cuda), used: True
TPU available: False, using: 0 TPU cores
GPU available: True (cuda), used: True
TPU available: False, using: 0 TPU cores
GPU available: True (cuda), used: True
TPU available: False, using: 0 TPU cores
💡 Tip: For seamless cloud logging and experiment tracking, try installing [litlogger](https://pypi.org/project/litlogger/) to enable LitLogger, which logs metrics and artifacts automatically to the Lightning Experiments platform.
💡 Tip: For seamless cloud logging and experiment tracking, try installing [litlogger](https://pypi.org/project/litlogger/) to enable LitLogger, which logs metrics and artifacts automatically to the Lightning Experiments platform.
💡 Tip: For seamless cloud logging and experiment tracking, try installing [litlogger](https://pypi.org/project/litlogger/) to enable LitLogger, which logs metrics and artifacts automatically to the Lightning Experiments platform.
LOCAL_RANK: 0 - CUDA_VISIBLE_DEVICES: [0]
LOCAL_RANK: 0 - CUDA_VISIBLE_DEVICES: [0]
LOCAL_RANK: 0 - CUDA_VISIBLE_DEVICES: [0]
SLURM auto-requeueing enabled. Setting signal handlers.
SLURM auto-requeueing enabled. Setting signal handlers.
SLURM auto-requeueing enabled. Setting signal handlers.
`Trainer.fit` stopped: `max_epochs=30` reached.
`Trainer.fit` stopped: `max_epochs=30` reached.
`Trainer.fit` stopped: `max_epochs=30` reached.
