[I 2026-04-16 02:00:46,532] Trial 100 finished with value: 0.1044 and parameters: {'left_wall_dist_num_layers': 2, 'left_wall_dist_activation': 'elu', 'left_wall_dist_out_channels_l0': 101, 'left_wall_dist_pool_size_l0': 8, 'left_wall_dist_out_channels_l1': 87, 'left_wall_dist_pool_size_l1': 8, 'left_wall_dist_fc_hidden': 34, 'track_width_num_layers': 3, 'track_width_activation': 'relu', 'track_width_out_channels_l0': 62, 'track_width_pool_size_l0': 2, 'track_width_out_channels_l1': 248, 'track_width_pool_size_l1': 2, 'track_width_out_channels_l2': 56, 'track_width_pool_size_l2': 2, 'track_width_fc_hidden': 125, 'heading_error_num_layers': 4, 'heading_error_activation': 'elu', 'heading_error_out_channels_l0': 59, 'heading_error_pool_size_l0': 2, 'heading_error_out_channels_l1': 110, 'heading_error_pool_size_l1': 8, 'heading_error_out_channels_l2': 84, 'heading_error_pool_size_l2': 4, 'heading_error_out_channels_l3': 236, 'heading_error_pool_size_l3': 4, 'heading_error_fc_hidden': 81}. Best is trial 91 with value: 0.0905.
[rank: 0] Seed set to 42
[rank: 0] Seed set to 42
GPU available: True (cuda), used: True
TPU available: False, using: 0 TPU cores
💡 Tip: For seamless cloud logging and experiment tracking, try installing [litlogger](https://pypi.org/project/litlogger/) to enable LitLogger, which logs metrics and artifacts automatically to the Lightning Experiments platform.
[rank: 0] Seed set to 42
GPU available: True (cuda), used: True
TPU available: False, using: 0 TPU cores
💡 Tip: For seamless cloud logging and experiment tracking, try installing [litlogger](https://pypi.org/project/litlogger/) to enable LitLogger, which logs metrics and artifacts automatically to the Lightning Experiments platform.
GPU available: True (cuda), used: True
TPU available: False, using: 0 TPU cores
💡 Tip: For seamless cloud logging and experiment tracking, try installing [litlogger](https://pypi.org/project/litlogger/) to enable LitLogger, which logs metrics and artifacts automatically to the Lightning Experiments platform.
LOCAL_RANK: 0 - CUDA_VISIBLE_DEVICES: [0]
LOCAL_RANK: 0 - CUDA_VISIBLE_DEVICES: [0]
LOCAL_RANK: 0 - CUDA_VISIBLE_DEVICES: [0]
SLURM auto-requeueing enabled. Setting signal handlers.
SLURM auto-requeueing enabled. Setting signal handlers.
SLURM auto-requeueing enabled. Setting signal handlers.
`Trainer.fit` stopped: `max_epochs=30` reached.
`Trainer.fit` stopped: `max_epochs=30` reached.
`Trainer.fit` stopped: `max_epochs=30` reached.
[I 2026-04-16 02:03:37,928] Trial 101 finished with value: 0.1091 and parameters: {'left_wall_dist_num_layers': 2, 'left_wall_dist_activation': 'elu', 'left_wall_dist_out_channels_l0': 104, 'left_wall_dist_pool_size_l0': 8, 'left_wall_dist_out_channels_l1': 85, 'left_wall_dist_pool_size_l1': 8, 'left_wall_dist_fc_hidden': 34, 'track_width_num_layers': 3, 'track_width_activation': 'relu', 'track_width_out_channels_l0': 64, 'track_width_pool_size_l0': 2, 'track_width_out_channels_l1': 248, 'track_width_pool_size_l1': 2, 'track_width_out_channels_l2': 39, 'track_width_pool_size_l2': 2, 'track_width_fc_hidden': 118, 'heading_error_num_layers': 4, 'heading_error_activation': 'elu', 'heading_error_out_channels_l0': 58, 'heading_error_pool_size_l0': 2, 'heading_error_out_channels_l1': 91, 'heading_error_pool_size_l1': 8, 'heading_error_out_channels_l2': 93, 'heading_error_pool_size_l2': 4, 'heading_error_out_channels_l3': 234, 'heading_error_pool_size_l3': 4, 'heading_error_fc_hidden': 81}. Best is trial 91 with value: 0.0905.
[rank: 0] Seed set to 42
[rank: 0] Seed set to 42
[rank: 0] Seed set to 42
GPU available: True (cuda), used: True
TPU available: False, using: 0 TPU cores
💡 Tip: For seamless cloud logging and experiment tracking, try installing [litlogger](https://pypi.org/project/litlogger/) to enable LitLogger, which logs metrics and artifacts automatically to the Lightning Experiments platform.
GPU available: True (cuda), used: True
TPU available: False, using: 0 TPU cores
💡 Tip: For seamless cloud logging and experiment tracking, try installing [litlogger](https://pypi.org/project/litlogger/) to enable LitLogger, which logs metrics and artifacts automatically to the Lightning Experiments platform.
GPU available: True (cuda), used: True
TPU available: False, using: 0 TPU cores
💡 Tip: For seamless cloud logging and experiment tracking, try installing [litlogger](https://pypi.org/project/litlogger/) to enable LitLogger, which logs metrics and artifacts automatically to the Lightning Experiments platform.
LOCAL_RANK: 0 - CUDA_VISIBLE_DEVICES: [0]
LOCAL_RANK: 0 - CUDA_VISIBLE_DEVICES: [0]
LOCAL_RANK: 0 - CUDA_VISIBLE_DEVICES: [0]
SLURM auto-requeueing enabled. Setting signal handlers.
SLURM auto-requeueing enabled. Setting signal handlers.
SLURM auto-requeueing enabled. Setting signal handlers.
`Trainer.fit` stopped: `max_epochs=30` reached.
`Trainer.fit` stopped: `max_epochs=30` reached.
`Trainer.fit` stopped: `max_epochs=30` reached.
[I 2026-04-16 02:06:24,827] Trial 102 finished with value: 0.1334 and parameters: {'left_wall_dist_num_layers': 2, 'left_wall_dist_activation': 'elu', 'left_wall_dist_out_channels_l0': 105, 'left_wall_dist_pool_size_l0': 8, 'left_wall_dist_out_channels_l1': 85, 'left_wall_dist_pool_size_l1': 8, 'left_wall_dist_fc_hidden': 34, 'track_width_num_layers': 3, 'track_width_activation': 'relu', 'track_width_out_channels_l0': 62, 'track_width_pool_size_l0': 2, 'track_width_out_channels_l1': 249, 'track_width_pool_size_l1': 2, 'track_width_out_channels_l2': 39, 'track_width_pool_size_l2': 2, 'track_width_fc_hidden': 118, 'heading_error_num_layers': 4, 'heading_error_activation': 'elu', 'heading_error_out_channels_l0': 60, 'heading_error_pool_size_l0': 2, 'heading_error_out_channels_l1': 112, 'heading_error_pool_size_l1': 8, 'heading_error_out_channels_l2': 84, 'heading_error_pool_size_l2': 4, 'heading_error_out_channels_l3': 238, 'heading_error_pool_size_l3': 4, 'heading_error_fc_hidden': 81}. Best is trial 91 with value: 0.0905.
[rank: 0] Seed set to 42
[rank: 0] Seed set to 42
GPU available: True (cuda), used: True
TPU available: False, using: 0 TPU cores
💡 Tip: For seamless cloud logging and experiment tracking, try installing [litlogger](https://pypi.org/project/litlogger/) to enable LitLogger, which logs metrics and artifacts automatically to the Lightning Experiments platform.
GPU available: True (cuda), used: True
TPU available: False, using: 0 TPU cores
💡 Tip: For seamless cloud logging and experiment tracking, try installing [litlogger](https://pypi.org/project/litlogger/) to enable LitLogger, which logs metrics and artifacts automatically to the Lightning Experiments platform.
[rank: 0] Seed set to 42
GPU available: True (cuda), used: True
TPU available: False, using: 0 TPU cores
💡 Tip: For seamless cloud logging and experiment tracking, try installing [litlogger](https://pypi.org/project/litlogger/) to enable LitLogger, which logs metrics and artifacts automatically to the Lightning Experiments platform.
LOCAL_RANK: 0 - CUDA_VISIBLE_DEVICES: [0]
LOCAL_RANK: 0 - CUDA_VISIBLE_DEVICES: [0]
LOCAL_RANK: 0 - CUDA_VISIBLE_DEVICES: [0]
SLURM auto-requeueing enabled. Setting signal handlers.
SLURM auto-requeueing enabled. Setting signal handlers.
SLURM auto-requeueing enabled. Setting signal handlers.
`Trainer.fit` stopped: `max_epochs=30` reached.
`Trainer.fit` stopped: `max_epochs=30` reached.
`Trainer.fit` stopped: `max_epochs=30` reached.
[I 2026-04-16 02:09:15,477] Trial 103 finished with value: 0.1158 and parameters: {'left_wall_dist_num_layers': 2, 'left_wall_dist_activation': 'elu', 'left_wall_dist_out_channels_l0': 91, 'left_wall_dist_pool_size_l0': 8, 'left_wall_dist_out_channels_l1': 98, 'left_wall_dist_pool_size_l1': 8, 'left_wall_dist_fc_hidden': 33, 'track_width_num_layers': 3, 'track_width_activation': 'relu', 'track_width_out_channels_l0': 65, 'track_width_pool_size_l0': 2, 'track_width_out_channels_l1': 234, 'track_width_pool_size_l1': 2, 'track_width_out_channels_l2': 34, 'track_width_pool_size_l2': 2, 'track_width_fc_hidden': 113, 'heading_error_num_layers': 4, 'heading_error_activation': 'elu', 'heading_error_out_channels_l0': 66, 'heading_error_pool_size_l0': 2, 'heading_error_out_channels_l1': 93, 'heading_error_pool_size_l1': 8, 'heading_error_out_channels_l2': 82, 'heading_error_pool_size_l2': 4, 'heading_error_out_channels_l3': 210, 'heading_error_pool_size_l3': 4, 'heading_error_fc_hidden': 73}. Best is trial 91 with value: 0.0905.
[rank: 0] Seed set to 42
[rank: 0] Seed set to 42
GPU available: True (cuda), used: True
[rank: 0] Seed set to 42
TPU available: False, using: 0 TPU cores
💡 Tip: For seamless cloud logging and experiment tracking, try installing [litlogger](https://pypi.org/project/litlogger/) to enable LitLogger, which logs metrics and artifacts automatically to the Lightning Experiments platform.
GPU available: True (cuda), used: True
TPU available: False, using: 0 TPU cores
💡 Tip: For seamless cloud logging and experiment tracking, try installing [litlogger](https://pypi.org/project/litlogger/) to enable LitLogger, which logs metrics and artifacts automatically to the Lightning Experiments platform.
GPU available: True (cuda), used: True
TPU available: False, using: 0 TPU cores
💡 Tip: For seamless cloud logging and experiment tracking, try installing [litlogger](https://pypi.org/project/litlogger/) to enable LitLogger, which logs metrics and artifacts automatically to the Lightning Experiments platform.
LOCAL_RANK: 0 - CUDA_VISIBLE_DEVICES: [0]
LOCAL_RANK: 0 - CUDA_VISIBLE_DEVICES: [0]
LOCAL_RANK: 0 - CUDA_VISIBLE_DEVICES: [0]
SLURM auto-requeueing enabled. Setting signal handlers.
SLURM auto-requeueing enabled. Setting signal handlers.
SLURM auto-requeueing enabled. Setting signal handlers.
`Trainer.fit` stopped: `max_epochs=30` reached.
`Trainer.fit` stopped: `max_epochs=30` reached.
`Trainer.fit` stopped: `max_epochs=30` reached.
[I 2026-04-16 02:12:00,210] Trial 104 finished with value: 0.0973 and parameters: {'left_wall_dist_num_layers': 2, 'left_wall_dist_activation': 'elu', 'left_wall_dist_out_channels_l0': 114, 'left_wall_dist_pool_size_l0': 8, 'left_wall_dist_out_channels_l1': 87, 'left_wall_dist_pool_size_l1': 8, 'left_wall_dist_fc_hidden': 36, 'track_width_num_layers': 3, 'track_width_activation': 'relu', 'track_width_out_channels_l0': 43, 'track_width_pool_size_l0': 2, 'track_width_out_channels_l1': 256, 'track_width_pool_size_l1': 2, 'track_width_out_channels_l2': 55, 'track_width_pool_size_l2': 2, 'track_width_fc_hidden': 125, 'heading_error_num_layers': 4, 'heading_error_activation': 'elu', 'heading_error_out_channels_l0': 71, 'heading_error_pool_size_l0': 2, 'heading_error_out_channels_l1': 104, 'heading_error_pool_size_l1': 8, 'heading_error_out_channels_l2': 95, 'heading_error_pool_size_l2': 4, 'heading_error_out_channels_l3': 234, 'heading_error_pool_size_l3': 4, 'heading_error_fc_hidden': 82}. Best is trial 91 with value: 0.0905.
[rank: 0] Seed set to 42
GPU available: True (cuda), used: True
TPU available: False, using: 0 TPU cores
💡 Tip: For seamless cloud logging and experiment tracking, try installing [litlogger](https://pypi.org/project/litlogger/) to enable LitLogger, which logs metrics and artifacts automatically to the Lightning Experiments platform.
[rank: 0] Seed set to 42
[rank: 0] Seed set to 42
GPU available: True (cuda), used: True
TPU available: False, using: 0 TPU cores
💡 Tip: For seamless cloud logging and experiment tracking, try installing [litlogger](https://pypi.org/project/litlogger/) to enable LitLogger, which logs metrics and artifacts automatically to the Lightning Experiments platform.
GPU available: True (cuda), used: True
TPU available: False, using: 0 TPU cores
💡 Tip: For seamless cloud logging and experiment tracking, try installing [litlogger](https://pypi.org/project/litlogger/) to enable LitLogger, which logs metrics and artifacts automatically to the Lightning Experiments platform.
LOCAL_RANK: 0 - CUDA_VISIBLE_DEVICES: [0]
LOCAL_RANK: 0 - CUDA_VISIBLE_DEVICES: [0]
LOCAL_RANK: 0 - CUDA_VISIBLE_DEVICES: [0]
SLURM auto-requeueing enabled. Setting signal handlers.
SLURM auto-requeueing enabled. Setting signal handlers.
SLURM auto-requeueing enabled. Setting signal handlers.
`Trainer.fit` stopped: `max_epochs=30` reached.
`Trainer.fit` stopped: `max_epochs=30` reached.
`Trainer.fit` stopped: `max_epochs=30` reached.
[I 2026-04-16 02:15:00,537] Trial 105 finished with value: 0.1287 and parameters: {'left_wall_dist_num_layers': 5, 'left_wall_dist_activation': 'elu', 'left_wall_dist_out_channels_l0': 114, 'left_wall_dist_pool_size_l0': 8, 'left_wall_dist_out_channels_l1': 88, 'left_wall_dist_pool_size_l1': 8, 'left_wall_dist_out_channels_l2': 67, 'left_wall_dist_pool_size_l2': 2, 'left_wall_dist_out_channels_l3': 45, 'left_wall_dist_pool_size_l3': 2, 'left_wall_dist_fc_hidden': 32, 'track_width_num_layers': 3, 'track_width_activation': 'relu', 'track_width_out_channels_l0': 44, 'track_width_pool_size_l0': 2, 'track_width_out_channels_l1': 254, 'track_width_pool_size_l1': 2, 'track_width_out_channels_l2': 56, 'track_width_pool_size_l2': 2, 'track_width_fc_hidden': 125, 'heading_error_num_layers': 4, 'heading_error_activation': 'elu', 'heading_error_out_channels_l0': 56, 'heading_error_pool_size_l0': 2, 'heading_error_out_channels_l1': 130, 'heading_error_pool_size_l1': 8, 'heading_error_out_channels_l2': 108, 'heading_error_pool_size_l2': 4, 'heading_error_out_channels_l3': 240, 'heading_error_pool_size_l3': 4, 'heading_error_fc_hidden': 77}. Best is trial 91 with value: 0.0905.
[rank: 0] Seed set to 42
[rank: 0] Seed set to 42
[rank: 0] Seed set to 42
GPU available: True (cuda), used: True
TPU available: False, using: 0 TPU cores
💡 Tip: For seamless cloud logging and experiment tracking, try installing [litlogger](https://pypi.org/project/litlogger/) to enable LitLogger, which logs metrics and artifacts automatically to the Lightning Experiments platform.
GPU available: True (cuda), used: True
TPU available: False, using: 0 TPU cores
💡 Tip: For seamless cloud logging and experiment tracking, try installing [litlogger](https://pypi.org/project/litlogger/) to enable LitLogger, which logs metrics and artifacts automatically to the Lightning Experiments platform.
GPU available: True (cuda), used: True
TPU available: False, using: 0 TPU cores
💡 Tip: For seamless cloud logging and experiment tracking, try installing [litlogger](https://pypi.org/project/litlogger/) to enable LitLogger, which logs metrics and artifacts automatically to the Lightning Experiments platform.
LOCAL_RANK: 0 - CUDA_VISIBLE_DEVICES: [0]
LOCAL_RANK: 0 - CUDA_VISIBLE_DEVICES: [0]
LOCAL_RANK: 0 - CUDA_VISIBLE_DEVICES: [0]
SLURM auto-requeueing enabled. Setting signal handlers.
SLURM auto-requeueing enabled. Setting signal handlers.
SLURM auto-requeueing enabled. Setting signal handlers.
`Trainer.fit` stopped: `max_epochs=30` reached.
`Trainer.fit` stopped: `max_epochs=30` reached.
`Trainer.fit` stopped: `max_epochs=30` reached.
[I 2026-04-16 02:17:46,782] Trial 106 finished with value: 0.1239 and parameters: {'left_wall_dist_num_layers': 2, 'left_wall_dist_activation': 'elu', 'left_wall_dist_out_channels_l0': 101, 'left_wall_dist_pool_size_l0': 8, 'left_wall_dist_out_channels_l1': 97, 'left_wall_dist_pool_size_l1': 8, 'left_wall_dist_fc_hidden': 36, 'track_width_num_layers': 3, 'track_width_activation': 'relu', 'track_width_out_channels_l0': 38, 'track_width_pool_size_l0': 2, 'track_width_out_channels_l1': 244, 'track_width_pool_size_l1': 2, 'track_width_out_channels_l2': 48, 'track_width_pool_size_l2': 2, 'track_width_fc_hidden': 121, 'heading_error_num_layers': 4, 'heading_error_activation': 'elu', 'heading_error_out_channels_l0': 59, 'heading_error_pool_size_l0': 2, 'heading_error_out_channels_l1': 90, 'heading_error_pool_size_l1': 8, 'heading_error_out_channels_l2': 98, 'heading_error_pool_size_l2': 4, 'heading_error_out_channels_l3': 200, 'heading_error_pool_size_l3': 4, 'heading_error_fc_hidden': 71}. Best is trial 91 with value: 0.0905.
[rank: 0] Seed set to 42
[rank: 0] Seed set to 42
[rank: 0] Seed set to 42
GPU available: True (cuda), used: True
TPU available: False, using: 0 TPU cores
💡 Tip: For seamless cloud logging and experiment tracking, try installing [litlogger](https://pypi.org/project/litlogger/) to enable LitLogger, which logs metrics and artifacts automatically to the Lightning Experiments platform.
GPU available: True (cuda), used: True
TPU available: False, using: 0 TPU cores
💡 Tip: For seamless cloud logging and experiment tracking, try installing [litlogger](https://pypi.org/project/litlogger/) to enable LitLogger, which logs metrics and artifacts automatically to the Lightning Experiments platform.
GPU available: True (cuda), used: True
TPU available: False, using: 0 TPU cores
💡 Tip: For seamless cloud logging and experiment tracking, try installing [litlogger](https://pypi.org/project/litlogger/) to enable LitLogger, which logs metrics and artifacts automatically to the Lightning Experiments platform.
LOCAL_RANK: 0 - CUDA_VISIBLE_DEVICES: [0]
LOCAL_RANK: 0 - CUDA_VISIBLE_DEVICES: [0]
SLURM auto-requeueing enabled. Setting signal handlers.
SLURM auto-requeueing enabled. Setting signal handlers.
LOCAL_RANK: 0 - CUDA_VISIBLE_DEVICES: [0]
SLURM auto-requeueing enabled. Setting signal handlers.
`Trainer.fit` stopped: `max_epochs=30` reached.
`Trainer.fit` stopped: `max_epochs=30` reached.
`Trainer.fit` stopped: `max_epochs=30` reached.
[I 2026-04-16 02:20:34,435] Trial 107 finished with value: 0.1434 and parameters: {'left_wall_dist_num_layers': 2, 'left_wall_dist_activation': 'elu', 'left_wall_dist_out_channels_l0': 135, 'left_wall_dist_pool_size_l0': 8, 'left_wall_dist_out_channels_l1': 109, 'left_wall_dist_pool_size_l1': 8, 'left_wall_dist_fc_hidden': 34, 'track_width_num_layers': 3, 'track_width_activation': 'relu', 'track_width_out_channels_l0': 50, 'track_width_pool_size_l0': 2, 'track_width_out_channels_l1': 219, 'track_width_pool_size_l1': 2, 'track_width_out_channels_l2': 39, 'track_width_pool_size_l2': 2, 'track_width_fc_hidden': 119, 'heading_error_num_layers': 4, 'heading_error_activation': 'elu', 'heading_error_out_channels_l0': 52, 'heading_error_pool_size_l0': 2, 'heading_error_out_channels_l1': 108, 'heading_error_pool_size_l1': 4, 'heading_error_out_channels_l2': 96, 'heading_error_pool_size_l2': 4, 'heading_error_out_channels_l3': 185, 'heading_error_pool_size_l3': 4, 'heading_error_fc_hidden': 82}. Best is trial 91 with value: 0.0905.
[rank: 0] Seed set to 42
GPU available: True (cuda), used: True
TPU available: False, using: 0 TPU cores
💡 Tip: For seamless cloud logging and experiment tracking, try installing [litlogger](https://pypi.org/project/litlogger/) to enable LitLogger, which logs metrics and artifacts automatically to the Lightning Experiments platform.
[rank: 0] Seed set to 42
[rank: 0] Seed set to 42
GPU available: True (cuda), used: True
TPU available: False, using: 0 TPU cores
💡 Tip: For seamless cloud logging and experiment tracking, try installing [litlogger](https://pypi.org/project/litlogger/) to enable LitLogger, which logs metrics and artifacts automatically to the Lightning Experiments platform.
GPU available: True (cuda), used: True
TPU available: False, using: 0 TPU cores
💡 Tip: For seamless cloud logging and experiment tracking, try installing [litlogger](https://pypi.org/project/litlogger/) to enable LitLogger, which logs metrics and artifacts automatically to the Lightning Experiments platform.
LOCAL_RANK: 0 - CUDA_VISIBLE_DEVICES: [0]
LOCAL_RANK: 0 - CUDA_VISIBLE_DEVICES: [0]
LOCAL_RANK: 0 - CUDA_VISIBLE_DEVICES: [0]
SLURM auto-requeueing enabled. Setting signal handlers.
SLURM auto-requeueing enabled. Setting signal handlers.
SLURM auto-requeueing enabled. Setting signal handlers.
`Trainer.fit` stopped: `max_epochs=30` reached.
`Trainer.fit` stopped: `max_epochs=30` reached.
`Trainer.fit` stopped: `max_epochs=30` reached.
