[I 2026-04-14 23:40:56,872] Trial 71 finished with value: 0.0987 and parameters: {'left_wall_dist_num_layers': 2, 'left_wall_dist_activation': 'elu', 'left_wall_dist_out_channels_l0': 43, 'left_wall_dist_pool_size_l0': 2, 'left_wall_dist_out_channels_l1': 67, 'left_wall_dist_pool_size_l1': 4, 'track_width_num_layers': 2, 'track_width_activation': 'elu', 'track_width_out_channels_l0': 106, 'track_width_pool_size_l0': 4, 'track_width_out_channels_l1': 47, 'track_width_pool_size_l1': 8, 'track_width_fc_hidden': 41, 'heading_error_num_layers': 5, 'heading_error_activation': 'relu', 'heading_error_out_channels_l0': 75, 'heading_error_pool_size_l0': 4, 'heading_error_out_channels_l1': 70, 'heading_error_pool_size_l1': 4, 'heading_error_out_channels_l2': 80, 'heading_error_pool_size_l2': 2, 'heading_error_out_channels_l3': 62, 'heading_error_pool_size_l3': 2, 'heading_error_out_channels_l4': 58, 'heading_error_pool_size_l4': 4, 'heading_error_fc_hidden': 40}. Best is trial 66 with value: 0.0922.
[rank: 0] Seed set to 42
GPU available: True (cuda), used: True
TPU available: False, using: 0 TPU cores
💡 Tip: For seamless cloud logging and experiment tracking, try installing [litlogger](https://pypi.org/project/litlogger/) to enable LitLogger, which logs metrics and artifacts automatically to the Lightning Experiments platform.
[rank: 0] Seed set to 42
[rank: 0] Seed set to 42
GPU available: True (cuda), used: True
TPU available: False, using: 0 TPU cores
💡 Tip: For seamless cloud logging and experiment tracking, try installing [litlogger](https://pypi.org/project/litlogger/) to enable LitLogger, which logs metrics and artifacts automatically to the Lightning Experiments platform.
GPU available: True (cuda), used: True
TPU available: False, using: 0 TPU cores
💡 Tip: For seamless cloud logging and experiment tracking, try installing [litlogger](https://pypi.org/project/litlogger/) to enable LitLogger, which logs metrics and artifacts automatically to the Lightning Experiments platform.
LOCAL_RANK: 0 - CUDA_VISIBLE_DEVICES: [0]
LOCAL_RANK: 0 - CUDA_VISIBLE_DEVICES: [0]
LOCAL_RANK: 0 - CUDA_VISIBLE_DEVICES: [0]
SLURM auto-requeueing enabled. Setting signal handlers.
SLURM auto-requeueing enabled. Setting signal handlers.
SLURM auto-requeueing enabled. Setting signal handlers.
`Trainer.fit` stopped: `max_epochs=30` reached.
`Trainer.fit` stopped: `max_epochs=30` reached.
`Trainer.fit` stopped: `max_epochs=30` reached.
[I 2026-04-14 23:43:46,336] Trial 72 finished with value: 0.0974 and parameters: {'left_wall_dist_num_layers': 2, 'left_wall_dist_activation': 'elu', 'left_wall_dist_out_channels_l0': 43, 'left_wall_dist_pool_size_l0': 2, 'left_wall_dist_out_channels_l1': 65, 'left_wall_dist_pool_size_l1': 4, 'track_width_num_layers': 2, 'track_width_activation': 'elu', 'track_width_out_channels_l0': 105, 'track_width_pool_size_l0': 4, 'track_width_out_channels_l1': 52, 'track_width_pool_size_l1': 8, 'track_width_fc_hidden': 41, 'heading_error_num_layers': 5, 'heading_error_activation': 'relu', 'heading_error_out_channels_l0': 64, 'heading_error_pool_size_l0': 4, 'heading_error_out_channels_l1': 69, 'heading_error_pool_size_l1': 4, 'heading_error_out_channels_l2': 81, 'heading_error_pool_size_l2': 2, 'heading_error_out_channels_l3': 63, 'heading_error_pool_size_l3': 2, 'heading_error_out_channels_l4': 60, 'heading_error_pool_size_l4': 4, 'heading_error_fc_hidden': 40}. Best is trial 66 with value: 0.0922.
[rank: 0] Seed set to 42
GPU available: True (cuda), used: True
TPU available: False, using: 0 TPU cores
💡 Tip: For seamless cloud logging and experiment tracking, try installing [litlogger](https://pypi.org/project/litlogger/) to enable LitLogger, which logs metrics and artifacts automatically to the Lightning Experiments platform.
[rank: 0] Seed set to 42
GPU available: True (cuda), used: True
TPU available: False, using: 0 TPU cores
💡 Tip: For seamless cloud logging and experiment tracking, try installing [litlogger](https://pypi.org/project/litlogger/) to enable LitLogger, which logs metrics and artifacts automatically to the Lightning Experiments platform.
[rank: 0] Seed set to 42
GPU available: True (cuda), used: True
TPU available: False, using: 0 TPU cores
💡 Tip: For seamless cloud logging and experiment tracking, try installing [litlogger](https://pypi.org/project/litlogger/) to enable LitLogger, which logs metrics and artifacts automatically to the Lightning Experiments platform.
LOCAL_RANK: 0 - CUDA_VISIBLE_DEVICES: [0]
SLURM auto-requeueing enabled. Setting signal handlers.
LOCAL_RANK: 0 - CUDA_VISIBLE_DEVICES: [0]
LOCAL_RANK: 0 - CUDA_VISIBLE_DEVICES: [0]
SLURM auto-requeueing enabled. Setting signal handlers.
SLURM auto-requeueing enabled. Setting signal handlers.
`Trainer.fit` stopped: `max_epochs=30` reached.
`Trainer.fit` stopped: `max_epochs=30` reached.
`Trainer.fit` stopped: `max_epochs=30` reached.
[I 2026-04-14 23:46:37,254] Trial 73 finished with value: 0.1157 and parameters: {'left_wall_dist_num_layers': 2, 'left_wall_dist_activation': 'elu', 'left_wall_dist_out_channels_l0': 42, 'left_wall_dist_pool_size_l0': 2, 'left_wall_dist_out_channels_l1': 70, 'left_wall_dist_pool_size_l1': 4, 'track_width_num_layers': 2, 'track_width_activation': 'elu', 'track_width_out_channels_l0': 106, 'track_width_pool_size_l0': 4, 'track_width_out_channels_l1': 52, 'track_width_pool_size_l1': 8, 'track_width_fc_hidden': 41, 'heading_error_num_layers': 5, 'heading_error_activation': 'relu', 'heading_error_out_channels_l0': 53, 'heading_error_pool_size_l0': 4, 'heading_error_out_channels_l1': 71, 'heading_error_pool_size_l1': 4, 'heading_error_out_channels_l2': 80, 'heading_error_pool_size_l2': 2, 'heading_error_out_channels_l3': 63, 'heading_error_pool_size_l3': 2, 'heading_error_out_channels_l4': 59, 'heading_error_pool_size_l4': 4, 'heading_error_fc_hidden': 40}. Best is trial 66 with value: 0.0922.
[rank: 0] Seed set to 42
GPU available: True (cuda), used: True
TPU available: False, using: 0 TPU cores
💡 Tip: For seamless cloud logging and experiment tracking, try installing [litlogger](https://pypi.org/project/litlogger/) to enable LitLogger, which logs metrics and artifacts automatically to the Lightning Experiments platform.
[rank: 0] Seed set to 42
[rank: 0] Seed set to 42
GPU available: True (cuda), used: True
TPU available: False, using: 0 TPU cores
💡 Tip: For seamless cloud logging and experiment tracking, try installing [litlogger](https://pypi.org/project/litlogger/) to enable LitLogger, which logs metrics and artifacts automatically to the Lightning Experiments platform.
GPU available: True (cuda), used: True
TPU available: False, using: 0 TPU cores
💡 Tip: For seamless cloud logging and experiment tracking, try installing [litlogger](https://pypi.org/project/litlogger/) to enable LitLogger, which logs metrics and artifacts automatically to the Lightning Experiments platform.
LOCAL_RANK: 0 - CUDA_VISIBLE_DEVICES: [0]
LOCAL_RANK: 0 - CUDA_VISIBLE_DEVICES: [0]
SLURM auto-requeueing enabled. Setting signal handlers.
SLURM auto-requeueing enabled. Setting signal handlers.
LOCAL_RANK: 0 - CUDA_VISIBLE_DEVICES: [0]
SLURM auto-requeueing enabled. Setting signal handlers.
`Trainer.fit` stopped: `max_epochs=30` reached.
`Trainer.fit` stopped: `max_epochs=30` reached.
`Trainer.fit` stopped: `max_epochs=30` reached.
[I 2026-04-14 23:49:30,731] Trial 74 finished with value: 0.1066 and parameters: {'left_wall_dist_num_layers': 2, 'left_wall_dist_activation': 'elu', 'left_wall_dist_out_channels_l0': 53, 'left_wall_dist_pool_size_l0': 2, 'left_wall_dist_out_channels_l1': 64, 'left_wall_dist_pool_size_l1': 4, 'track_width_num_layers': 2, 'track_width_activation': 'elu', 'track_width_out_channels_l0': 93, 'track_width_pool_size_l0': 4, 'track_width_out_channels_l1': 60, 'track_width_pool_size_l1': 8, 'track_width_fc_hidden': 37, 'heading_error_num_layers': 5, 'heading_error_activation': 'relu', 'heading_error_out_channels_l0': 67, 'heading_error_pool_size_l0': 4, 'heading_error_out_channels_l1': 68, 'heading_error_pool_size_l1': 4, 'heading_error_out_channels_l2': 91, 'heading_error_pool_size_l2': 2, 'heading_error_out_channels_l3': 61, 'heading_error_pool_size_l3': 2, 'heading_error_out_channels_l4': 52, 'heading_error_pool_size_l4': 4, 'heading_error_fc_hidden': 35}. Best is trial 66 with value: 0.0922.
[rank: 0] Seed set to 42
[rank: 0] Seed set to 42
[rank: 0] Seed set to 42
GPU available: True (cuda), used: True
TPU available: False, using: 0 TPU cores
💡 Tip: For seamless cloud logging and experiment tracking, try installing [litlogger](https://pypi.org/project/litlogger/) to enable LitLogger, which logs metrics and artifacts automatically to the Lightning Experiments platform.
GPU available: True (cuda), used: True
TPU available: False, using: 0 TPU cores
💡 Tip: For seamless cloud logging and experiment tracking, try installing [litlogger](https://pypi.org/project/litlogger/) to enable LitLogger, which logs metrics and artifacts automatically to the Lightning Experiments platform.
GPU available: True (cuda), used: True
TPU available: False, using: 0 TPU cores
💡 Tip: For seamless cloud logging and experiment tracking, try installing [litlogger](https://pypi.org/project/litlogger/) to enable LitLogger, which logs metrics and artifacts automatically to the Lightning Experiments platform.
LOCAL_RANK: 0 - CUDA_VISIBLE_DEVICES: [0]
LOCAL_RANK: 0 - CUDA_VISIBLE_DEVICES: [0]
LOCAL_RANK: 0 - CUDA_VISIBLE_DEVICES: [0]
SLURM auto-requeueing enabled. Setting signal handlers.
SLURM auto-requeueing enabled. Setting signal handlers.
SLURM auto-requeueing enabled. Setting signal handlers.
`Trainer.fit` stopped: `max_epochs=30` reached.
`Trainer.fit` stopped: `max_epochs=30` reached.
`Trainer.fit` stopped: `max_epochs=30` reached.
[I 2026-04-14 23:52:25,943] Trial 75 finished with value: 0.1082 and parameters: {'left_wall_dist_num_layers': 2, 'left_wall_dist_activation': 'elu', 'left_wall_dist_out_channels_l0': 40, 'left_wall_dist_pool_size_l0': 2, 'left_wall_dist_out_channels_l1': 79, 'left_wall_dist_pool_size_l1': 4, 'track_width_num_layers': 2, 'track_width_activation': 'elu', 'track_width_out_channels_l0': 88, 'track_width_pool_size_l0': 4, 'track_width_out_channels_l1': 73, 'track_width_pool_size_l1': 8, 'track_width_fc_hidden': 43, 'heading_error_num_layers': 5, 'heading_error_activation': 'relu', 'heading_error_out_channels_l0': 75, 'heading_error_pool_size_l0': 4, 'heading_error_out_channels_l1': 67, 'heading_error_pool_size_l1': 4, 'heading_error_out_channels_l2': 126, 'heading_error_pool_size_l2': 2, 'heading_error_out_channels_l3': 66, 'heading_error_pool_size_l3': 2, 'heading_error_out_channels_l4': 49, 'heading_error_pool_size_l4': 4, 'heading_error_fc_hidden': 33}. Best is trial 66 with value: 0.0922.
[rank: 0] Seed set to 42
[rank: 0] Seed set to 42
[rank: 0] Seed set to 42
GPU available: True (cuda), used: True
GPU available: True (cuda), used: True
TPU available: False, using: 0 TPU cores
TPU available: False, using: 0 TPU cores
💡 Tip: For seamless cloud logging and experiment tracking, try installing [litlogger](https://pypi.org/project/litlogger/) to enable LitLogger, which logs metrics and artifacts automatically to the Lightning Experiments platform.
💡 Tip: For seamless cloud logging and experiment tracking, try installing [litlogger](https://pypi.org/project/litlogger/) to enable LitLogger, which logs metrics and artifacts automatically to the Lightning Experiments platform.
GPU available: True (cuda), used: True
TPU available: False, using: 0 TPU cores
💡 Tip: For seamless cloud logging and experiment tracking, try installing [litlogger](https://pypi.org/project/litlogger/) to enable LitLogger, which logs metrics and artifacts automatically to the Lightning Experiments platform.
LOCAL_RANK: 0 - CUDA_VISIBLE_DEVICES: [0]
LOCAL_RANK: 0 - CUDA_VISIBLE_DEVICES: [0]
LOCAL_RANK: 0 - CUDA_VISIBLE_DEVICES: [0]
SLURM auto-requeueing enabled. Setting signal handlers.
SLURM auto-requeueing enabled. Setting signal handlers.
SLURM auto-requeueing enabled. Setting signal handlers.
`Trainer.fit` stopped: `max_epochs=30` reached.
`Trainer.fit` stopped: `max_epochs=30` reached.
`Trainer.fit` stopped: `max_epochs=30` reached.
[I 2026-04-14 23:55:15,926] Trial 76 finished with value: 0.1359 and parameters: {'left_wall_dist_num_layers': 2, 'left_wall_dist_activation': 'elu', 'left_wall_dist_out_channels_l0': 36, 'left_wall_dist_pool_size_l0': 2, 'left_wall_dist_out_channels_l1': 77, 'left_wall_dist_pool_size_l1': 8, 'left_wall_dist_fc_hidden': 117, 'track_width_num_layers': 2, 'track_width_activation': 'elu', 'track_width_out_channels_l0': 90, 'track_width_pool_size_l0': 4, 'track_width_out_channels_l1': 73, 'track_width_pool_size_l1': 8, 'track_width_fc_hidden': 44, 'heading_error_num_layers': 5, 'heading_error_activation': 'relu', 'heading_error_out_channels_l0': 63, 'heading_error_pool_size_l0': 4, 'heading_error_out_channels_l1': 82, 'heading_error_pool_size_l1': 4, 'heading_error_out_channels_l2': 134, 'heading_error_pool_size_l2': 2, 'heading_error_out_channels_l3': 53, 'heading_error_pool_size_l3': 8, 'heading_error_out_channels_l4': 49, 'heading_error_pool_size_l4': 4}. Best is trial 66 with value: 0.0922.
[rank: 0] Seed set to 42
GPU available: True (cuda), used: True
TPU available: False, using: 0 TPU cores
💡 Tip: For seamless cloud logging and experiment tracking, try installing [litlogger](https://pypi.org/project/litlogger/) to enable LitLogger, which logs metrics and artifacts automatically to the Lightning Experiments platform.
[rank: 0] Seed set to 42
GPU available: True (cuda), used: True
TPU available: False, using: 0 TPU cores
💡 Tip: For seamless cloud logging and experiment tracking, try installing [litlogger](https://pypi.org/project/litlogger/) to enable LitLogger, which logs metrics and artifacts automatically to the Lightning Experiments platform.
[rank: 0] Seed set to 42
GPU available: True (cuda), used: True
TPU available: False, using: 0 TPU cores
💡 Tip: For seamless cloud logging and experiment tracking, try installing [litlogger](https://pypi.org/project/litlogger/) to enable LitLogger, which logs metrics and artifacts automatically to the Lightning Experiments platform.
LOCAL_RANK: 0 - CUDA_VISIBLE_DEVICES: [0]
SLURM auto-requeueing enabled. Setting signal handlers.
LOCAL_RANK: 0 - CUDA_VISIBLE_DEVICES: [0]
LOCAL_RANK: 0 - CUDA_VISIBLE_DEVICES: [0]
SLURM auto-requeueing enabled. Setting signal handlers.
SLURM auto-requeueing enabled. Setting signal handlers.
`Trainer.fit` stopped: `max_epochs=30` reached.
`Trainer.fit` stopped: `max_epochs=30` reached.
`Trainer.fit` stopped: `max_epochs=30` reached.
[I 2026-04-14 23:58:05,489] Trial 77 finished with value: 0.0993 and parameters: {'left_wall_dist_num_layers': 2, 'left_wall_dist_activation': 'elu', 'left_wall_dist_out_channels_l0': 37, 'left_wall_dist_pool_size_l0': 4, 'left_wall_dist_out_channels_l1': 86, 'left_wall_dist_pool_size_l1': 4, 'left_wall_dist_fc_hidden': 119, 'track_width_num_layers': 2, 'track_width_activation': 'elu', 'track_width_out_channels_l0': 81, 'track_width_pool_size_l0': 2, 'track_width_out_channels_l1': 79, 'track_width_pool_size_l1': 8, 'track_width_fc_hidden': 82, 'heading_error_num_layers': 5, 'heading_error_activation': 'relu', 'heading_error_out_channels_l0': 77, 'heading_error_pool_size_l0': 4, 'heading_error_out_channels_l1': 90, 'heading_error_pool_size_l1': 4, 'heading_error_out_channels_l2': 91, 'heading_error_pool_size_l2': 2, 'heading_error_out_channels_l3': 50, 'heading_error_pool_size_l3': 2, 'heading_error_out_channels_l4': 42, 'heading_error_pool_size_l4': 4}. Best is trial 66 with value: 0.0922.
[rank: 0] Seed set to 42
[rank: 0] Seed set to 42
[rank: 0] Seed set to 42
GPU available: True (cuda), used: True
TPU available: False, using: 0 TPU cores
💡 Tip: For seamless cloud logging and experiment tracking, try installing [litlogger](https://pypi.org/project/litlogger/) to enable LitLogger, which logs metrics and artifacts automatically to the Lightning Experiments platform.
GPU available: True (cuda), used: True
TPU available: False, using: 0 TPU cores
💡 Tip: For seamless cloud logging and experiment tracking, try installing [litlogger](https://pypi.org/project/litlogger/) to enable LitLogger, which logs metrics and artifacts automatically to the Lightning Experiments platform.
GPU available: True (cuda), used: True
TPU available: False, using: 0 TPU cores
💡 Tip: For seamless cloud logging and experiment tracking, try installing [litlogger](https://pypi.org/project/litlogger/) to enable LitLogger, which logs metrics and artifacts automatically to the Lightning Experiments platform.
LOCAL_RANK: 0 - CUDA_VISIBLE_DEVICES: [0]
LOCAL_RANK: 0 - CUDA_VISIBLE_DEVICES: [0]
LOCAL_RANK: 0 - CUDA_VISIBLE_DEVICES: [0]
SLURM auto-requeueing enabled. Setting signal handlers.
SLURM auto-requeueing enabled. Setting signal handlers.
SLURM auto-requeueing enabled. Setting signal handlers.
`Trainer.fit` stopped: `max_epochs=30` reached.
`Trainer.fit` stopped: `max_epochs=30` reached.
`Trainer.fit` stopped: `max_epochs=30` reached.
[I 2026-04-15 00:00:49,654] Trial 78 finished with value: 0.1243 and parameters: {'left_wall_dist_num_layers': 2, 'left_wall_dist_activation': 'elu', 'left_wall_dist_out_channels_l0': 43, 'left_wall_dist_pool_size_l0': 4, 'left_wall_dist_out_channels_l1': 84, 'left_wall_dist_pool_size_l1': 4, 'left_wall_dist_fc_hidden': 118, 'track_width_num_layers': 2, 'track_width_activation': 'elu', 'track_width_out_channels_l0': 75, 'track_width_pool_size_l0': 2, 'track_width_out_channels_l1': 78, 'track_width_pool_size_l1': 8, 'track_width_fc_hidden': 86, 'heading_error_num_layers': 5, 'heading_error_activation': 'relu', 'heading_error_out_channels_l0': 77, 'heading_error_pool_size_l0': 4, 'heading_error_out_channels_l1': 93, 'heading_error_pool_size_l1': 4, 'heading_error_out_channels_l2': 91, 'heading_error_pool_size_l2': 2, 'heading_error_out_channels_l3': 50, 'heading_error_pool_size_l3': 2, 'heading_error_out_channels_l4': 42, 'heading_error_pool_size_l4': 4}. Best is trial 66 with value: 0.0922.
[rank: 0] Seed set to 42
GPU available: True (cuda), used: True
TPU available: False, using: 0 TPU cores
💡 Tip: For seamless cloud logging and experiment tracking, try installing [litlogger](https://pypi.org/project/litlogger/) to enable LitLogger, which logs metrics and artifacts automatically to the Lightning Experiments platform.
[rank: 0] Seed set to 42
GPU available: True (cuda), used: True
TPU available: False, using: 0 TPU cores
💡 Tip: For seamless cloud logging and experiment tracking, try installing [litlogger](https://pypi.org/project/litlogger/) to enable LitLogger, which logs metrics and artifacts automatically to the Lightning Experiments platform.
[rank: 0] Seed set to 42
GPU available: True (cuda), used: True
TPU available: False, using: 0 TPU cores
💡 Tip: For seamless cloud logging and experiment tracking, try installing [litlogger](https://pypi.org/project/litlogger/) to enable LitLogger, which logs metrics and artifacts automatically to the Lightning Experiments platform.
LOCAL_RANK: 0 - CUDA_VISIBLE_DEVICES: [0]
SLURM auto-requeueing enabled. Setting signal handlers.
LOCAL_RANK: 0 - CUDA_VISIBLE_DEVICES: [0]
LOCAL_RANK: 0 - CUDA_VISIBLE_DEVICES: [0]
SLURM auto-requeueing enabled. Setting signal handlers.
SLURM auto-requeueing enabled. Setting signal handlers.
`Trainer.fit` stopped: `max_epochs=30` reached.
`Trainer.fit` stopped: `max_epochs=30` reached.
`Trainer.fit` stopped: `max_epochs=30` reached.
