[I 2026-04-15 21:57:06,628] Trial 47 finished with value: 0.3665 and parameters: {'left_wall_dist_num_layers': 3, 'left_wall_dist_activation': 'elu', 'left_wall_dist_out_channels_l0': 35, 'left_wall_dist_pool_size_l0': 8, 'left_wall_dist_out_channels_l1': 52, 'left_wall_dist_pool_size_l1': 8, 'left_wall_dist_out_channels_l2': 199, 'left_wall_dist_pool_size_l2': 8, 'track_width_num_layers': 5, 'track_width_activation': 'elu', 'track_width_out_channels_l0': 45, 'track_width_pool_size_l0': 8, 'track_width_out_channels_l1': 193, 'track_width_pool_size_l1': 4, 'track_width_out_channels_l2': 226, 'track_width_pool_size_l2': 8, 'track_width_out_channels_l3': 183, 'track_width_pool_size_l3': 8, 'track_width_fc_hidden': 44, 'heading_error_num_layers': 5, 'heading_error_activation': 'relu', 'heading_error_out_channels_l0': 37, 'heading_error_pool_size_l0': 8, 'heading_error_out_channels_l1': 173, 'heading_error_pool_size_l1': 4, 'heading_error_out_channels_l2': 174, 'heading_error_pool_size_l2': 2, 'heading_error_out_channels_l3': 59, 'heading_error_pool_size_l3': 4, 'heading_error_out_channels_l4': 160, 'heading_error_pool_size_l4': 4}. Best is trial 30 with value: 0.136.
[rank: 0] Seed set to 42
[rank: 0] Seed set to 42
[rank: 0] Seed set to 42
GPU available: True (cuda), used: True
TPU available: False, using: 0 TPU cores
💡 Tip: For seamless cloud logging and experiment tracking, try installing [litlogger](https://pypi.org/project/litlogger/) to enable LitLogger, which logs metrics and artifacts automatically to the Lightning Experiments platform.
GPU available: True (cuda), used: True
TPU available: False, using: 0 TPU cores
💡 Tip: For seamless cloud logging and experiment tracking, try installing [litlogger](https://pypi.org/project/litlogger/) to enable LitLogger, which logs metrics and artifacts automatically to the Lightning Experiments platform.
GPU available: True (cuda), used: True
TPU available: False, using: 0 TPU cores
💡 Tip: For seamless cloud logging and experiment tracking, try installing [litlogger](https://pypi.org/project/litlogger/) to enable LitLogger, which logs metrics and artifacts automatically to the Lightning Experiments platform.
LOCAL_RANK: 0 - CUDA_VISIBLE_DEVICES: [0]
LOCAL_RANK: 0 - CUDA_VISIBLE_DEVICES: [0]
LOCAL_RANK: 0 - CUDA_VISIBLE_DEVICES: [0]
SLURM auto-requeueing enabled. Setting signal handlers.
SLURM auto-requeueing enabled. Setting signal handlers.
SLURM auto-requeueing enabled. Setting signal handlers.
`Trainer.fit` stopped: `max_epochs=30` reached.
`Trainer.fit` stopped: `max_epochs=30` reached.
`Trainer.fit` stopped: `max_epochs=30` reached.
[I 2026-04-15 22:00:03,639] Trial 48 finished with value: 0.4586 and parameters: {'left_wall_dist_num_layers': 3, 'left_wall_dist_activation': 'relu', 'left_wall_dist_out_channels_l0': 41, 'left_wall_dist_pool_size_l0': 4, 'left_wall_dist_out_channels_l1': 163, 'left_wall_dist_pool_size_l1': 8, 'left_wall_dist_out_channels_l2': 234, 'left_wall_dist_pool_size_l2': 8, 'left_wall_dist_fc_hidden': 88, 'track_width_num_layers': 3, 'track_width_activation': 'elu', 'track_width_out_channels_l0': 63, 'track_width_pool_size_l0': 2, 'track_width_out_channels_l1': 52, 'track_width_pool_size_l1': 4, 'track_width_out_channels_l2': 174, 'track_width_pool_size_l2': 8, 'track_width_fc_hidden': 58, 'heading_error_num_layers': 4, 'heading_error_activation': 'relu', 'heading_error_out_channels_l0': 46, 'heading_error_pool_size_l0': 2, 'heading_error_out_channels_l1': 66, 'heading_error_pool_size_l1': 2, 'heading_error_out_channels_l2': 223, 'heading_error_pool_size_l2': 2, 'heading_error_out_channels_l3': 179, 'heading_error_pool_size_l3': 4, 'heading_error_fc_hidden': 117}. Best is trial 30 with value: 0.136.
[rank: 0] Seed set to 42
[rank: 0] Seed set to 42
[rank: 0] Seed set to 42
GPU available: True (cuda), used: True
TPU available: False, using: 0 TPU cores
💡 Tip: For seamless cloud logging and experiment tracking, try installing [litlogger](https://pypi.org/project/litlogger/) to enable LitLogger, which logs metrics and artifacts automatically to the Lightning Experiments platform.
GPU available: True (cuda), used: True
TPU available: False, using: 0 TPU cores
💡 Tip: For seamless cloud logging and experiment tracking, try installing [litlogger](https://pypi.org/project/litlogger/) to enable LitLogger, which logs metrics and artifacts automatically to the Lightning Experiments platform.
GPU available: True (cuda), used: True
TPU available: False, using: 0 TPU cores
💡 Tip: For seamless cloud logging and experiment tracking, try installing [litlogger](https://pypi.org/project/litlogger/) to enable LitLogger, which logs metrics and artifacts automatically to the Lightning Experiments platform.
LOCAL_RANK: 0 - CUDA_VISIBLE_DEVICES: [0]
LOCAL_RANK: 0 - CUDA_VISIBLE_DEVICES: [0]
LOCAL_RANK: 0 - CUDA_VISIBLE_DEVICES: [0]
SLURM auto-requeueing enabled. Setting signal handlers.
SLURM auto-requeueing enabled. Setting signal handlers.
SLURM auto-requeueing enabled. Setting signal handlers.
`Trainer.fit` stopped: `max_epochs=30` reached.
`Trainer.fit` stopped: `max_epochs=30` reached.
`Trainer.fit` stopped: `max_epochs=30` reached.
[I 2026-04-15 22:02:16,854] Trial 49 finished with value: 0.1675 and parameters: {'left_wall_dist_num_layers': 2, 'left_wall_dist_activation': 'elu', 'left_wall_dist_out_channels_l0': 183, 'left_wall_dist_pool_size_l0': 2, 'left_wall_dist_out_channels_l1': 199, 'left_wall_dist_pool_size_l1': 8, 'track_width_num_layers': 5, 'track_width_activation': 'relu', 'track_width_out_channels_l0': 84, 'track_width_pool_size_l0': 4, 'track_width_out_channels_l1': 75, 'track_width_pool_size_l1': 2, 'track_width_out_channels_l2': 160, 'track_width_pool_size_l2': 2, 'track_width_out_channels_l3': 45, 'track_width_pool_size_l3': 2, 'track_width_out_channels_l4': 253, 'track_width_pool_size_l4': 8, 'track_width_fc_hidden': 74, 'heading_error_num_layers': 5, 'heading_error_activation': 'relu', 'heading_error_out_channels_l0': 58, 'heading_error_pool_size_l0': 8, 'heading_error_out_channels_l1': 36, 'heading_error_pool_size_l1': 8, 'heading_error_out_channels_l2': 187, 'heading_error_pool_size_l2': 8}. Best is trial 30 with value: 0.136.
[rank: 0] Seed set to 42
[rank: 0] Seed set to 42
[rank: 0] Seed set to 42
GPU available: True (cuda), used: True
TPU available: False, using: 0 TPU cores
GPU available: True (cuda), used: True
TPU available: False, using: 0 TPU cores
💡 Tip: For seamless cloud logging and experiment tracking, try installing [litlogger](https://pypi.org/project/litlogger/) to enable LitLogger, which logs metrics and artifacts automatically to the Lightning Experiments platform.
💡 Tip: For seamless cloud logging and experiment tracking, try installing [litlogger](https://pypi.org/project/litlogger/) to enable LitLogger, which logs metrics and artifacts automatically to the Lightning Experiments platform.
GPU available: True (cuda), used: True
TPU available: False, using: 0 TPU cores
💡 Tip: For seamless cloud logging and experiment tracking, try installing [litlogger](https://pypi.org/project/litlogger/) to enable LitLogger, which logs metrics and artifacts automatically to the Lightning Experiments platform.
LOCAL_RANK: 0 - CUDA_VISIBLE_DEVICES: [0]
LOCAL_RANK: 0 - CUDA_VISIBLE_DEVICES: [0]
LOCAL_RANK: 0 - CUDA_VISIBLE_DEVICES: [0]
SLURM auto-requeueing enabled. Setting signal handlers.
SLURM auto-requeueing enabled. Setting signal handlers.
SLURM auto-requeueing enabled. Setting signal handlers.
`Trainer.fit` stopped: `max_epochs=30` reached.
`Trainer.fit` stopped: `max_epochs=30` reached.
`Trainer.fit` stopped: `max_epochs=30` reached.
[I 2026-04-15 22:05:30,937] Trial 50 finished with value: 0.1694 and parameters: {'left_wall_dist_num_layers': 3, 'left_wall_dist_activation': 'relu', 'left_wall_dist_out_channels_l0': 33, 'left_wall_dist_pool_size_l0': 2, 'left_wall_dist_out_channels_l1': 124, 'left_wall_dist_pool_size_l1': 2, 'left_wall_dist_out_channels_l2': 142, 'left_wall_dist_pool_size_l2': 8, 'left_wall_dist_fc_hidden': 86, 'track_width_num_layers': 5, 'track_width_activation': 'elu', 'track_width_out_channels_l0': 57, 'track_width_pool_size_l0': 4, 'track_width_out_channels_l1': 97, 'track_width_pool_size_l1': 4, 'track_width_out_channels_l2': 127, 'track_width_pool_size_l2': 8, 'track_width_out_channels_l3': 55, 'track_width_pool_size_l3': 4, 'heading_error_num_layers': 4, 'heading_error_activation': 'relu', 'heading_error_out_channels_l0': 50, 'heading_error_pool_size_l0': 8, 'heading_error_out_channels_l1': 163, 'heading_error_pool_size_l1': 2, 'heading_error_out_channels_l2': 123, 'heading_error_pool_size_l2': 4, 'heading_error_out_channels_l3': 45, 'heading_error_pool_size_l3': 8}. Best is trial 30 with value: 0.136.
[rank: 0] Seed set to 42
GPU available: True (cuda), used: True
TPU available: False, using: 0 TPU cores
💡 Tip: For seamless cloud logging and experiment tracking, try installing [litlogger](https://pypi.org/project/litlogger/) to enable LitLogger, which logs metrics and artifacts automatically to the Lightning Experiments platform.
[rank: 0] Seed set to 42
[rank: 0] Seed set to 42
GPU available: True (cuda), used: True
TPU available: False, using: 0 TPU cores
💡 Tip: For seamless cloud logging and experiment tracking, try installing [litlogger](https://pypi.org/project/litlogger/) to enable LitLogger, which logs metrics and artifacts automatically to the Lightning Experiments platform.
GPU available: True (cuda), used: True
TPU available: False, using: 0 TPU cores
💡 Tip: For seamless cloud logging and experiment tracking, try installing [litlogger](https://pypi.org/project/litlogger/) to enable LitLogger, which logs metrics and artifacts automatically to the Lightning Experiments platform.
LOCAL_RANK: 0 - CUDA_VISIBLE_DEVICES: [0]
LOCAL_RANK: 0 - CUDA_VISIBLE_DEVICES: [0]
LOCAL_RANK: 0 - CUDA_VISIBLE_DEVICES: [0]
SLURM auto-requeueing enabled. Setting signal handlers.
SLURM auto-requeueing enabled. Setting signal handlers.
SLURM auto-requeueing enabled. Setting signal handlers.
`Trainer.fit` stopped: `max_epochs=30` reached.
`Trainer.fit` stopped: `max_epochs=30` reached.
`Trainer.fit` stopped: `max_epochs=30` reached.
[I 2026-04-15 22:08:30,209] Trial 51 finished with value: 0.3689 and parameters: {'left_wall_dist_num_layers': 4, 'left_wall_dist_activation': 'relu', 'left_wall_dist_out_channels_l0': 39, 'left_wall_dist_pool_size_l0': 2, 'left_wall_dist_out_channels_l1': 176, 'left_wall_dist_pool_size_l1': 4, 'left_wall_dist_out_channels_l2': 103, 'left_wall_dist_pool_size_l2': 8, 'left_wall_dist_out_channels_l3': 224, 'left_wall_dist_pool_size_l3': 8, 'track_width_num_layers': 3, 'track_width_activation': 'relu', 'track_width_out_channels_l0': 57, 'track_width_pool_size_l0': 4, 'track_width_out_channels_l1': 229, 'track_width_pool_size_l1': 4, 'track_width_out_channels_l2': 189, 'track_width_pool_size_l2': 8, 'track_width_fc_hidden': 51, 'heading_error_num_layers': 5, 'heading_error_activation': 'relu', 'heading_error_out_channels_l0': 86, 'heading_error_pool_size_l0': 8, 'heading_error_out_channels_l1': 222, 'heading_error_pool_size_l1': 2, 'heading_error_out_channels_l2': 237, 'heading_error_pool_size_l2': 8, 'heading_error_out_channels_l3': 116, 'heading_error_pool_size_l3': 2, 'heading_error_out_channels_l4': 91, 'heading_error_pool_size_l4': 8}. Best is trial 30 with value: 0.136.
[rank: 0] Seed set to 42
GPU available: True (cuda), used: True
TPU available: False, using: 0 TPU cores
💡 Tip: For seamless cloud logging and experiment tracking, try installing [litlogger](https://pypi.org/project/litlogger/) to enable LitLogger, which logs metrics and artifacts automatically to the Lightning Experiments platform.
[rank: 0] Seed set to 42
GPU available: True (cuda), used: True
TPU available: False, using: 0 TPU cores
💡 Tip: For seamless cloud logging and experiment tracking, try installing [litlogger](https://pypi.org/project/litlogger/) to enable LitLogger, which logs metrics and artifacts automatically to the Lightning Experiments platform.
[rank: 0] Seed set to 42
GPU available: True (cuda), used: True
TPU available: False, using: 0 TPU cores
💡 Tip: For seamless cloud logging and experiment tracking, try installing [litlogger](https://pypi.org/project/litlogger/) to enable LitLogger, which logs metrics and artifacts automatically to the Lightning Experiments platform.
LOCAL_RANK: 0 - CUDA_VISIBLE_DEVICES: [0]
LOCAL_RANK: 0 - CUDA_VISIBLE_DEVICES: [0]
SLURM auto-requeueing enabled. Setting signal handlers.
SLURM auto-requeueing enabled. Setting signal handlers.
LOCAL_RANK: 0 - CUDA_VISIBLE_DEVICES: [0]
SLURM auto-requeueing enabled. Setting signal handlers.
`Trainer.fit` stopped: `max_epochs=30` reached.
`Trainer.fit` stopped: `max_epochs=30` reached.
`Trainer.fit` stopped: `max_epochs=30` reached.
[I 2026-04-15 22:11:29,467] Trial 52 finished with value: 0.215 and parameters: {'left_wall_dist_num_layers': 3, 'left_wall_dist_activation': 'relu', 'left_wall_dist_out_channels_l0': 63, 'left_wall_dist_pool_size_l0': 2, 'left_wall_dist_out_channels_l1': 157, 'left_wall_dist_pool_size_l1': 8, 'left_wall_dist_out_channels_l2': 117, 'left_wall_dist_pool_size_l2': 8, 'left_wall_dist_fc_hidden': 52, 'track_width_num_layers': 4, 'track_width_activation': 'relu', 'track_width_out_channels_l0': 67, 'track_width_pool_size_l0': 4, 'track_width_out_channels_l1': 208, 'track_width_pool_size_l1': 4, 'track_width_out_channels_l2': 234, 'track_width_pool_size_l2': 4, 'track_width_out_channels_l3': 46, 'track_width_pool_size_l3': 4, 'track_width_fc_hidden': 32, 'heading_error_num_layers': 4, 'heading_error_activation': 'relu', 'heading_error_out_channels_l0': 32, 'heading_error_pool_size_l0': 8, 'heading_error_out_channels_l1': 256, 'heading_error_pool_size_l1': 2, 'heading_error_out_channels_l2': 234, 'heading_error_pool_size_l2': 8, 'heading_error_out_channels_l3': 92, 'heading_error_pool_size_l3': 4, 'heading_error_fc_hidden': 42}. Best is trial 30 with value: 0.136.
[rank: 0] Seed set to 42
[rank: 0] Seed set to 42
GPU available: True (cuda), used: True
TPU available: False, using: 0 TPU cores
💡 Tip: For seamless cloud logging and experiment tracking, try installing [litlogger](https://pypi.org/project/litlogger/) to enable LitLogger, which logs metrics and artifacts automatically to the Lightning Experiments platform.
GPU available: True (cuda), used: True
TPU available: False, using: 0 TPU cores
💡 Tip: For seamless cloud logging and experiment tracking, try installing [litlogger](https://pypi.org/project/litlogger/) to enable LitLogger, which logs metrics and artifacts automatically to the Lightning Experiments platform.
[rank: 0] Seed set to 42
GPU available: True (cuda), used: True
TPU available: False, using: 0 TPU cores
💡 Tip: For seamless cloud logging and experiment tracking, try installing [litlogger](https://pypi.org/project/litlogger/) to enable LitLogger, which logs metrics and artifacts automatically to the Lightning Experiments platform.
LOCAL_RANK: 0 - CUDA_VISIBLE_DEVICES: [0]
LOCAL_RANK: 0 - CUDA_VISIBLE_DEVICES: [0]
SLURM auto-requeueing enabled. Setting signal handlers.
SLURM auto-requeueing enabled. Setting signal handlers.
LOCAL_RANK: 0 - CUDA_VISIBLE_DEVICES: [0]
SLURM auto-requeueing enabled. Setting signal handlers.
`Trainer.fit` stopped: `max_epochs=30` reached.
`Trainer.fit` stopped: `max_epochs=30` reached.
`Trainer.fit` stopped: `max_epochs=30` reached.
[I 2026-04-15 22:14:16,421] Trial 53 finished with value: 0.3987 and parameters: {'left_wall_dist_num_layers': 4, 'left_wall_dist_activation': 'relu', 'left_wall_dist_out_channels_l0': 51, 'left_wall_dist_pool_size_l0': 2, 'left_wall_dist_out_channels_l1': 181, 'left_wall_dist_pool_size_l1': 4, 'left_wall_dist_out_channels_l2': 87, 'left_wall_dist_pool_size_l2': 4, 'left_wall_dist_out_channels_l3': 87, 'left_wall_dist_pool_size_l3': 8, 'left_wall_dist_fc_hidden': 55, 'track_width_num_layers': 4, 'track_width_activation': 'relu', 'track_width_out_channels_l0': 61, 'track_width_pool_size_l0': 4, 'track_width_out_channels_l1': 175, 'track_width_pool_size_l1': 4, 'track_width_out_channels_l2': 106, 'track_width_pool_size_l2': 4, 'track_width_out_channels_l3': 44, 'track_width_pool_size_l3': 4, 'track_width_fc_hidden': 32, 'heading_error_num_layers': 2, 'heading_error_activation': 'elu', 'heading_error_out_channels_l0': 41, 'heading_error_pool_size_l0': 8, 'heading_error_out_channels_l1': 194, 'heading_error_pool_size_l1': 2}. Best is trial 30 with value: 0.136.
[rank: 0] Seed set to 42
[rank: 0] Seed set to 42
[rank: 0] Seed set to 42
GPU available: True (cuda), used: True
TPU available: False, using: 0 TPU cores
💡 Tip: For seamless cloud logging and experiment tracking, try installing [litlogger](https://pypi.org/project/litlogger/) to enable LitLogger, which logs metrics and artifacts automatically to the Lightning Experiments platform.
GPU available: True (cuda), used: True
TPU available: False, using: 0 TPU cores
💡 Tip: For seamless cloud logging and experiment tracking, try installing [litlogger](https://pypi.org/project/litlogger/) to enable LitLogger, which logs metrics and artifacts automatically to the Lightning Experiments platform.
GPU available: True (cuda), used: True
TPU available: False, using: 0 TPU cores
💡 Tip: For seamless cloud logging and experiment tracking, try installing [litlogger](https://pypi.org/project/litlogger/) to enable LitLogger, which logs metrics and artifacts automatically to the Lightning Experiments platform.
LOCAL_RANK: 0 - CUDA_VISIBLE_DEVICES: [0]
LOCAL_RANK: 0 - CUDA_VISIBLE_DEVICES: [0]
LOCAL_RANK: 0 - CUDA_VISIBLE_DEVICES: [0]
SLURM auto-requeueing enabled. Setting signal handlers.
SLURM auto-requeueing enabled. Setting signal handlers.
SLURM auto-requeueing enabled. Setting signal handlers.
`Trainer.fit` stopped: `max_epochs=30` reached.
`Trainer.fit` stopped: `max_epochs=30` reached.
`Trainer.fit` stopped: `max_epochs=30` reached.
[I 2026-04-15 22:17:09,026] Trial 54 finished with value: 0.1542 and parameters: {'left_wall_dist_num_layers': 3, 'left_wall_dist_activation': 'relu', 'left_wall_dist_out_channels_l0': 44, 'left_wall_dist_pool_size_l0': 2, 'left_wall_dist_out_channels_l1': 235, 'left_wall_dist_pool_size_l1': 2, 'left_wall_dist_out_channels_l2': 70, 'left_wall_dist_pool_size_l2': 8, 'left_wall_dist_fc_hidden': 64, 'track_width_num_layers': 4, 'track_width_activation': 'relu', 'track_width_out_channels_l0': 49, 'track_width_pool_size_l0': 4, 'track_width_out_channels_l1': 256, 'track_width_pool_size_l1': 4, 'track_width_out_channels_l2': 80, 'track_width_pool_size_l2': 4, 'track_width_out_channels_l3': 36, 'track_width_pool_size_l3': 4, 'heading_error_num_layers': 3, 'heading_error_activation': 'relu', 'heading_error_out_channels_l0': 96, 'heading_error_pool_size_l0': 8, 'heading_error_out_channels_l1': 226, 'heading_error_pool_size_l1': 2, 'heading_error_out_channels_l2': 194, 'heading_error_pool_size_l2': 8, 'heading_error_fc_hidden': 36}. Best is trial 30 with value: 0.136.
[rank: 0] Seed set to 42
GPU available: True (cuda), used: True
TPU available: False, using: 0 TPU cores
💡 Tip: For seamless cloud logging and experiment tracking, try installing [litlogger](https://pypi.org/project/litlogger/) to enable LitLogger, which logs metrics and artifacts automatically to the Lightning Experiments platform.
[rank: 0] Seed set to 42
GPU available: True (cuda), used: True
TPU available: False, using: 0 TPU cores
💡 Tip: For seamless cloud logging and experiment tracking, try installing [litlogger](https://pypi.org/project/litlogger/) to enable LitLogger, which logs metrics and artifacts automatically to the Lightning Experiments platform.
[rank: 0] Seed set to 42
GPU available: True (cuda), used: True
TPU available: False, using: 0 TPU cores
💡 Tip: For seamless cloud logging and experiment tracking, try installing [litlogger](https://pypi.org/project/litlogger/) to enable LitLogger, which logs metrics and artifacts automatically to the Lightning Experiments platform.
LOCAL_RANK: 0 - CUDA_VISIBLE_DEVICES: [0]
SLURM auto-requeueing enabled. Setting signal handlers.
LOCAL_RANK: 0 - CUDA_VISIBLE_DEVICES: [0]
LOCAL_RANK: 0 - CUDA_VISIBLE_DEVICES: [0]
SLURM auto-requeueing enabled. Setting signal handlers.
SLURM auto-requeueing enabled. Setting signal handlers.
`Trainer.fit` stopped: `max_epochs=30` reached.
`Trainer.fit` stopped: `max_epochs=30` reached.
`Trainer.fit` stopped: `max_epochs=30` reached.
