[I 2026-04-14 21:13:50,717] Trial 9 finished with value: inf and parameters: {'left_wall_dist_num_layers': 5, 'left_wall_dist_activation': 'elu', 'left_wall_dist_out_channels_l0': 162, 'left_wall_dist_pool_size_l0': 8, 'left_wall_dist_out_channels_l1': 56, 'left_wall_dist_pool_size_l1': 4, 'left_wall_dist_out_channels_l2': 50, 'left_wall_dist_pool_size_l2': 2, 'left_wall_dist_out_channels_l3': 35, 'left_wall_dist_pool_size_l3': 4, 'left_wall_dist_out_channels_l4': 143, 'left_wall_dist_pool_size_l4': 2, 'track_width_num_layers': 3, 'track_width_activation': 'relu', 'track_width_out_channels_l0': 47, 'track_width_pool_size_l0': 8, 'track_width_out_channels_l1': 212, 'track_width_pool_size_l1': 2, 'track_width_out_channels_l2': 124, 'track_width_pool_size_l2': 2, 'track_width_fc_hidden': 92, 'heading_error_num_layers': 5, 'heading_error_activation': 'relu', 'heading_error_out_channels_l0': 83, 'heading_error_pool_size_l0': 8, 'heading_error_out_channels_l1': 114, 'heading_error_pool_size_l1': 4, 'heading_error_out_channels_l2': 37, 'heading_error_pool_size_l2': 8, 'heading_error_out_channels_l3': 130, 'heading_error_pool_size_l3': 4}. Best is trial 5 with value: 0.1351.
[rank: 0] Seed set to 42
[rank: 0] Seed set to 42
GPU available: True (cuda), used: True
TPU available: False, using: 0 TPU cores
💡 Tip: For seamless cloud logging and experiment tracking, try installing [litlogger](https://pypi.org/project/litlogger/) to enable LitLogger, which logs metrics and artifacts automatically to the Lightning Experiments platform.
[rank: 0] Seed set to 42
GPU available: True (cuda), used: True
TPU available: False, using: 0 TPU cores
💡 Tip: For seamless cloud logging and experiment tracking, try installing [litlogger](https://pypi.org/project/litlogger/) to enable LitLogger, which logs metrics and artifacts automatically to the Lightning Experiments platform.
GPU available: True (cuda), used: True
TPU available: False, using: 0 TPU cores
💡 Tip: For seamless cloud logging and experiment tracking, try installing [litlogger](https://pypi.org/project/litlogger/) to enable LitLogger, which logs metrics and artifacts automatically to the Lightning Experiments platform.
LOCAL_RANK: 0 - CUDA_VISIBLE_DEVICES: [0]
LOCAL_RANK: 0 - CUDA_VISIBLE_DEVICES: [0]
LOCAL_RANK: 0 - CUDA_VISIBLE_DEVICES: [0]
SLURM auto-requeueing enabled. Setting signal handlers.
SLURM auto-requeueing enabled. Setting signal handlers.
SLURM auto-requeueing enabled. Setting signal handlers.
`Trainer.fit` stopped: `max_epochs=30` reached.
`Trainer.fit` stopped: `max_epochs=30` reached.
`Trainer.fit` stopped: `max_epochs=30` reached.
[I 2026-04-14 21:16:48,429] Trial 10 finished with value: 0.1407 and parameters: {'left_wall_dist_num_layers': 2, 'left_wall_dist_activation': 'elu', 'left_wall_dist_out_channels_l0': 72, 'left_wall_dist_pool_size_l0': 2, 'left_wall_dist_out_channels_l1': 224, 'left_wall_dist_pool_size_l1': 4, 'track_width_num_layers': 4, 'track_width_activation': 'relu', 'track_width_out_channels_l0': 173, 'track_width_pool_size_l0': 2, 'track_width_out_channels_l1': 35, 'track_width_pool_size_l1': 4, 'track_width_out_channels_l2': 234, 'track_width_pool_size_l2': 8, 'track_width_out_channels_l3': 34, 'track_width_pool_size_l3': 2, 'track_width_fc_hidden': 32, 'heading_error_num_layers': 3, 'heading_error_activation': 'relu', 'heading_error_out_channels_l0': 33, 'heading_error_pool_size_l0': 4, 'heading_error_out_channels_l1': 199, 'heading_error_pool_size_l1': 4, 'heading_error_out_channels_l2': 69, 'heading_error_pool_size_l2': 2, 'heading_error_fc_hidden': 108}. Best is trial 5 with value: 0.1351.
[rank: 0] Seed set to 42
[rank: 0] Seed set to 42
[rank: 0] Seed set to 42
GPU available: True (cuda), used: True
TPU available: False, using: 0 TPU cores
💡 Tip: For seamless cloud logging and experiment tracking, try installing [litlogger](https://pypi.org/project/litlogger/) to enable LitLogger, which logs metrics and artifacts automatically to the Lightning Experiments platform.
GPU available: True (cuda), used: True
TPU available: False, using: 0 TPU cores
💡 Tip: For seamless cloud logging and experiment tracking, try installing [litlogger](https://pypi.org/project/litlogger/) to enable LitLogger, which logs metrics and artifacts automatically to the Lightning Experiments platform.
GPU available: True (cuda), used: True
TPU available: False, using: 0 TPU cores
💡 Tip: For seamless cloud logging and experiment tracking, try installing [litlogger](https://pypi.org/project/litlogger/) to enable LitLogger, which logs metrics and artifacts automatically to the Lightning Experiments platform.
LOCAL_RANK: 0 - CUDA_VISIBLE_DEVICES: [0]
LOCAL_RANK: 0 - CUDA_VISIBLE_DEVICES: [0]
LOCAL_RANK: 0 - CUDA_VISIBLE_DEVICES: [0]
SLURM auto-requeueing enabled. Setting signal handlers.
SLURM auto-requeueing enabled. Setting signal handlers.
SLURM auto-requeueing enabled. Setting signal handlers.
`Trainer.fit` stopped: `max_epochs=30` reached.
`Trainer.fit` stopped: `max_epochs=30` reached.
`Trainer.fit` stopped: `max_epochs=30` reached.
[I 2026-04-14 21:19:21,476] Trial 11 finished with value: 0.1621 and parameters: {'left_wall_dist_num_layers': 2, 'left_wall_dist_activation': 'elu', 'left_wall_dist_out_channels_l0': 32, 'left_wall_dist_pool_size_l0': 2, 'left_wall_dist_out_channels_l1': 33, 'left_wall_dist_pool_size_l1': 2, 'track_width_num_layers': 2, 'track_width_activation': 'elu', 'track_width_out_channels_l0': 76, 'track_width_pool_size_l0': 2, 'track_width_out_channels_l1': 67, 'track_width_pool_size_l1': 8, 'track_width_fc_hidden': 112, 'heading_error_num_layers': 2, 'heading_error_activation': 'relu', 'heading_error_out_channels_l0': 34, 'heading_error_pool_size_l0': 4, 'heading_error_out_channels_l1': 50, 'heading_error_pool_size_l1': 2, 'heading_error_fc_hidden': 126}. Best is trial 5 with value: 0.1351.
[rank: 0] Seed set to 42
[rank: 0] Seed set to 42
[rank: 0] Seed set to 42
GPU available: True (cuda), used: True
TPU available: False, using: 0 TPU cores
GPU available: True (cuda), used: True
TPU available: False, using: 0 TPU cores
💡 Tip: For seamless cloud logging and experiment tracking, try installing [litlogger](https://pypi.org/project/litlogger/) to enable LitLogger, which logs metrics and artifacts automatically to the Lightning Experiments platform.
💡 Tip: For seamless cloud logging and experiment tracking, try installing [litlogger](https://pypi.org/project/litlogger/) to enable LitLogger, which logs metrics and artifacts automatically to the Lightning Experiments platform.
GPU available: True (cuda), used: True
TPU available: False, using: 0 TPU cores
💡 Tip: For seamless cloud logging and experiment tracking, try installing [litlogger](https://pypi.org/project/litlogger/) to enable LitLogger, which logs metrics and artifacts automatically to the Lightning Experiments platform.
LOCAL_RANK: 0 - CUDA_VISIBLE_DEVICES: [0]
LOCAL_RANK: 0 - CUDA_VISIBLE_DEVICES: [0]
LOCAL_RANK: 0 - CUDA_VISIBLE_DEVICES: [0]
SLURM auto-requeueing enabled. Setting signal handlers.
SLURM auto-requeueing enabled. Setting signal handlers.
SLURM auto-requeueing enabled. Setting signal handlers.
`Trainer.fit` stopped: `max_epochs=30` reached.
`Trainer.fit` stopped: `max_epochs=30` reached.
`Trainer.fit` stopped: `max_epochs=30` reached.
[I 2026-04-14 21:22:15,048] Trial 12 finished with value: 0.2216 and parameters: {'left_wall_dist_num_layers': 3, 'left_wall_dist_activation': 'elu', 'left_wall_dist_out_channels_l0': 63, 'left_wall_dist_pool_size_l0': 2, 'left_wall_dist_out_channels_l1': 157, 'left_wall_dist_pool_size_l1': 2, 'left_wall_dist_out_channels_l2': 75, 'left_wall_dist_pool_size_l2': 4, 'left_wall_dist_fc_hidden': 126, 'track_width_num_layers': 4, 'track_width_activation': 'elu', 'track_width_out_channels_l0': 32, 'track_width_pool_size_l0': 2, 'track_width_out_channels_l1': 65, 'track_width_pool_size_l1': 8, 'track_width_out_channels_l2': 252, 'track_width_pool_size_l2': 4, 'track_width_out_channels_l3': 254, 'track_width_pool_size_l3': 8, 'track_width_fc_hidden': 42, 'heading_error_num_layers': 2, 'heading_error_activation': 'elu', 'heading_error_out_channels_l0': 53, 'heading_error_pool_size_l0': 4, 'heading_error_out_channels_l1': 65, 'heading_error_pool_size_l1': 4, 'heading_error_fc_hidden': 88}. Best is trial 5 with value: 0.1351.
[rank: 0] Seed set to 42
[rank: 0] Seed set to 42
[rank: 0] Seed set to 42
GPU available: True (cuda), used: True
TPU available: False, using: 0 TPU cores
💡 Tip: For seamless cloud logging and experiment tracking, try installing [litlogger](https://pypi.org/project/litlogger/) to enable LitLogger, which logs metrics and artifacts automatically to the Lightning Experiments platform.
GPU available: True (cuda), used: True
TPU available: False, using: 0 TPU cores
💡 Tip: For seamless cloud logging and experiment tracking, try installing [litlogger](https://pypi.org/project/litlogger/) to enable LitLogger, which logs metrics and artifacts automatically to the Lightning Experiments platform.
GPU available: True (cuda), used: True
TPU available: False, using: 0 TPU cores
💡 Tip: For seamless cloud logging and experiment tracking, try installing [litlogger](https://pypi.org/project/litlogger/) to enable LitLogger, which logs metrics and artifacts automatically to the Lightning Experiments platform.
LOCAL_RANK: 0 - CUDA_VISIBLE_DEVICES: [0]
LOCAL_RANK: 0 - CUDA_VISIBLE_DEVICES: [0]
LOCAL_RANK: 0 - CUDA_VISIBLE_DEVICES: [0]
SLURM auto-requeueing enabled. Setting signal handlers.
SLURM auto-requeueing enabled. Setting signal handlers.
SLURM auto-requeueing enabled. Setting signal handlers.
`Trainer.fit` stopped: `max_epochs=30` reached.
`Trainer.fit` stopped: `max_epochs=30` reached.
`Trainer.fit` stopped: `max_epochs=30` reached.
[I 2026-04-14 21:25:08,999] Trial 13 finished with value: 0.1436 and parameters: {'left_wall_dist_num_layers': 3, 'left_wall_dist_activation': 'elu', 'left_wall_dist_out_channels_l0': 57, 'left_wall_dist_pool_size_l0': 2, 'left_wall_dist_out_channels_l1': 68, 'left_wall_dist_pool_size_l1': 2, 'left_wall_dist_out_channels_l2': 51, 'left_wall_dist_pool_size_l2': 4, 'left_wall_dist_fc_hidden': 103, 'track_width_num_layers': 2, 'track_width_activation': 'elu', 'track_width_out_channels_l0': 230, 'track_width_pool_size_l0': 2, 'track_width_out_channels_l1': 44, 'track_width_pool_size_l1': 4, 'track_width_fc_hidden': 127, 'heading_error_num_layers': 3, 'heading_error_activation': 'relu', 'heading_error_out_channels_l0': 160, 'heading_error_pool_size_l0': 2, 'heading_error_out_channels_l1': 32, 'heading_error_pool_size_l1': 4, 'heading_error_out_channels_l2': 65, 'heading_error_pool_size_l2': 2, 'heading_error_fc_hidden': 90}. Best is trial 5 with value: 0.1351.
[rank: 0] Seed set to 42
[rank: 0] Seed set to 42
[rank: 0] Seed set to 42
GPU available: True (cuda), used: True
TPU available: False, using: 0 TPU cores
💡 Tip: For seamless cloud logging and experiment tracking, try installing [litlogger](https://pypi.org/project/litlogger/) to enable LitLogger, which logs metrics and artifacts automatically to the Lightning Experiments platform.
GPU available: True (cuda), used: True
TPU available: False, using: 0 TPU cores
💡 Tip: For seamless cloud logging and experiment tracking, try installing [litlogger](https://pypi.org/project/litlogger/) to enable LitLogger, which logs metrics and artifacts automatically to the Lightning Experiments platform.
GPU available: True (cuda), used: True
TPU available: False, using: 0 TPU cores
💡 Tip: For seamless cloud logging and experiment tracking, try installing [litlogger](https://pypi.org/project/litlogger/) to enable LitLogger, which logs metrics and artifacts automatically to the Lightning Experiments platform.
LOCAL_RANK: 0 - CUDA_VISIBLE_DEVICES: [0]
LOCAL_RANK: 0 - CUDA_VISIBLE_DEVICES: [0]
LOCAL_RANK: 0 - CUDA_VISIBLE_DEVICES: [0]
SLURM auto-requeueing enabled. Setting signal handlers.
SLURM auto-requeueing enabled. Setting signal handlers.
SLURM auto-requeueing enabled. Setting signal handlers.
`Trainer.fit` stopped: `max_epochs=30` reached.
`Trainer.fit` stopped: `max_epochs=30` reached.
`Trainer.fit` stopped: `max_epochs=30` reached.
[I 2026-04-14 21:27:59,261] Trial 14 finished with value: 0.1143 and parameters: {'left_wall_dist_num_layers': 2, 'left_wall_dist_activation': 'elu', 'left_wall_dist_out_channels_l0': 111, 'left_wall_dist_pool_size_l0': 2, 'left_wall_dist_out_channels_l1': 177, 'left_wall_dist_pool_size_l1': 4, 'track_width_num_layers': 3, 'track_width_activation': 'elu', 'track_width_out_channels_l0': 81, 'track_width_pool_size_l0': 8, 'track_width_out_channels_l1': 80, 'track_width_pool_size_l1': 8, 'track_width_out_channels_l2': 171, 'track_width_pool_size_l2': 4, 'track_width_fc_hidden': 57, 'heading_error_num_layers': 2, 'heading_error_activation': 'elu', 'heading_error_out_channels_l0': 66, 'heading_error_pool_size_l0': 4, 'heading_error_out_channels_l1': 57, 'heading_error_pool_size_l1': 2, 'heading_error_fc_hidden': 128}. Best is trial 14 with value: 0.1143.
[rank: 0] Seed set to 42
[rank: 0] Seed set to 42
[rank: 0] Seed set to 42
GPU available: True (cuda), used: True
TPU available: False, using: 0 TPU cores
💡 Tip: For seamless cloud logging and experiment tracking, try installing [litlogger](https://pypi.org/project/litlogger/) to enable LitLogger, which logs metrics and artifacts automatically to the Lightning Experiments platform.
GPU available: True (cuda), used: True
TPU available: False, using: 0 TPU cores
💡 Tip: For seamless cloud logging and experiment tracking, try installing [litlogger](https://pypi.org/project/litlogger/) to enable LitLogger, which logs metrics and artifacts automatically to the Lightning Experiments platform.
GPU available: True (cuda), used: True
TPU available: False, using: 0 TPU cores
💡 Tip: For seamless cloud logging and experiment tracking, try installing [litlogger](https://pypi.org/project/litlogger/) to enable LitLogger, which logs metrics and artifacts automatically to the Lightning Experiments platform.
LOCAL_RANK: 0 - CUDA_VISIBLE_DEVICES: [0]
LOCAL_RANK: 0 - CUDA_VISIBLE_DEVICES: [0]
LOCAL_RANK: 0 - CUDA_VISIBLE_DEVICES: [0]
SLURM auto-requeueing enabled. Setting signal handlers.
SLURM auto-requeueing enabled. Setting signal handlers.
SLURM auto-requeueing enabled. Setting signal handlers.
`Trainer.fit` stopped: `max_epochs=30` reached.
`Trainer.fit` stopped: `max_epochs=30` reached.
[I 2026-04-14 21:30:51,781] Trial 15 finished with value: 0.1457 and parameters: {'left_wall_dist_num_layers': 2, 'left_wall_dist_activation': 'elu', 'left_wall_dist_out_channels_l0': 115, 'left_wall_dist_pool_size_l0': 2, 'left_wall_dist_out_channels_l1': 194, 'left_wall_dist_pool_size_l1': 4, 'track_width_num_layers': 4, 'track_width_activation': 'elu', 'track_width_out_channels_l0': 106, 'track_width_pool_size_l0': 8, 'track_width_out_channels_l1': 71, 'track_width_pool_size_l1': 4, 'track_width_out_channels_l2': 179, 'track_width_pool_size_l2': 4, 'track_width_out_channels_l3': 51, 'track_width_pool_size_l3': 2, 'track_width_fc_hidden': 63, 'heading_error_num_layers': 2, 'heading_error_activation': 'relu', 'heading_error_out_channels_l0': 50, 'heading_error_pool_size_l0': 4, 'heading_error_out_channels_l1': 114, 'heading_error_pool_size_l1': 2}. Best is trial 14 with value: 0.1143.
[rank: 0] Seed set to 42
[rank: 0] Seed set to 42
[rank: 0] Seed set to 42
GPU available: True (cuda), used: True
TPU available: False, using: 0 TPU cores
💡 Tip: For seamless cloud logging and experiment tracking, try installing [litlogger](https://pypi.org/project/litlogger/) to enable LitLogger, which logs metrics and artifacts automatically to the Lightning Experiments platform.
GPU available: True (cuda), used: True
TPU available: False, using: 0 TPU cores
💡 Tip: For seamless cloud logging and experiment tracking, try installing [litlogger](https://pypi.org/project/litlogger/) to enable LitLogger, which logs metrics and artifacts automatically to the Lightning Experiments platform.
GPU available: True (cuda), used: True
TPU available: False, using: 0 TPU cores
💡 Tip: For seamless cloud logging and experiment tracking, try installing [litlogger](https://pypi.org/project/litlogger/) to enable LitLogger, which logs metrics and artifacts automatically to the Lightning Experiments platform.
LOCAL_RANK: 0 - CUDA_VISIBLE_DEVICES: [0]
LOCAL_RANK: 0 - CUDA_VISIBLE_DEVICES: [0]
LOCAL_RANK: 0 - CUDA_VISIBLE_DEVICES: [0]
SLURM auto-requeueing enabled. Setting signal handlers.
SLURM auto-requeueing enabled. Setting signal handlers.
SLURM auto-requeueing enabled. Setting signal handlers.
`Trainer.fit` stopped: `max_epochs=30` reached.
`Trainer.fit` stopped: `max_epochs=30` reached.
`Trainer.fit` stopped: `max_epochs=30` reached.
[I 2026-04-14 21:33:55,847] Trial 16 finished with value: 0.1427 and parameters: {'left_wall_dist_num_layers': 2, 'left_wall_dist_activation': 'elu', 'left_wall_dist_out_channels_l0': 254, 'left_wall_dist_pool_size_l0': 2, 'left_wall_dist_out_channels_l1': 172, 'left_wall_dist_pool_size_l1': 4, 'track_width_num_layers': 3, 'track_width_activation': 'elu', 'track_width_out_channels_l0': 143, 'track_width_pool_size_l0': 8, 'track_width_out_channels_l1': 52, 'track_width_pool_size_l1': 4, 'track_width_out_channels_l2': 114, 'track_width_pool_size_l2': 4, 'track_width_fc_hidden': 56, 'heading_error_num_layers': 3, 'heading_error_activation': 'elu', 'heading_error_out_channels_l0': 68, 'heading_error_pool_size_l0': 4, 'heading_error_out_channels_l1': 69, 'heading_error_pool_size_l1': 4, 'heading_error_out_channels_l2': 135, 'heading_error_pool_size_l2': 2, 'heading_error_fc_hidden': 127}. Best is trial 14 with value: 0.1143.
[rank: 0] Seed set to 42
[rank: 0] Seed set to 42
[rank: 0] Seed set to 42
GPU available: True (cuda), used: True
TPU available: False, using: 0 TPU cores
💡 Tip: For seamless cloud logging and experiment tracking, try installing [litlogger](https://pypi.org/project/litlogger/) to enable LitLogger, which logs metrics and artifacts automatically to the Lightning Experiments platform.
GPU available: True (cuda), used: True
TPU available: False, using: 0 TPU cores
💡 Tip: For seamless cloud logging and experiment tracking, try installing [litlogger](https://pypi.org/project/litlogger/) to enable LitLogger, which logs metrics and artifacts automatically to the Lightning Experiments platform.
GPU available: True (cuda), used: True
TPU available: False, using: 0 TPU cores
💡 Tip: For seamless cloud logging and experiment tracking, try installing [litlogger](https://pypi.org/project/litlogger/) to enable LitLogger, which logs metrics and artifacts automatically to the Lightning Experiments platform.
LOCAL_RANK: 0 - CUDA_VISIBLE_DEVICES: [0]
LOCAL_RANK: 0 - CUDA_VISIBLE_DEVICES: [0]
LOCAL_RANK: 0 - CUDA_VISIBLE_DEVICES: [0]
SLURM auto-requeueing enabled. Setting signal handlers.
SLURM auto-requeueing enabled. Setting signal handlers.
SLURM auto-requeueing enabled. Setting signal handlers.
`Trainer.fit` stopped: `max_epochs=30` reached.
`Trainer.fit` stopped: `max_epochs=30` reached.
`Trainer.fit` stopped: `max_epochs=30` reached.
[I 2026-04-14 21:37:04,764] Trial 17 finished with value: 0.1223 and parameters: {'left_wall_dist_num_layers': 3, 'left_wall_dist_activation': 'elu', 'left_wall_dist_out_channels_l0': 109, 'left_wall_dist_pool_size_l0': 2, 'left_wall_dist_out_channels_l1': 255, 'left_wall_dist_pool_size_l1': 4, 'left_wall_dist_out_channels_l2': 98, 'left_wall_dist_pool_size_l2': 2, 'left_wall_dist_fc_hidden': 127, 'track_width_num_layers': 4, 'track_width_activation': 'elu', 'track_width_out_channels_l0': 72, 'track_width_pool_size_l0': 8, 'track_width_out_channels_l1': 81, 'track_width_pool_size_l1': 8, 'track_width_out_channels_l2': 198, 'track_width_pool_size_l2': 4, 'track_width_out_channels_l3': 67, 'track_width_pool_size_l3': 8, 'track_width_fc_hidden': 35, 'heading_error_num_layers': 2, 'heading_error_activation': 'relu', 'heading_error_out_channels_l0': 41, 'heading_error_pool_size_l0': 4, 'heading_error_out_channels_l1': 32, 'heading_error_pool_size_l1': 4, 'heading_error_fc_hidden': 67}. Best is trial 14 with value: 0.1143.
[rank: 0] Seed set to 42
[rank: 0] Seed set to 42
[rank: 0] Seed set to 42
GPU available: True (cuda), used: True
TPU available: False, using: 0 TPU cores
💡 Tip: For seamless cloud logging and experiment tracking, try installing [litlogger](https://pypi.org/project/litlogger/) to enable LitLogger, which logs metrics and artifacts automatically to the Lightning Experiments platform.
GPU available: True (cuda), used: True
TPU available: False, using: 0 TPU cores
💡 Tip: For seamless cloud logging and experiment tracking, try installing [litlogger](https://pypi.org/project/litlogger/) to enable LitLogger, which logs metrics and artifacts automatically to the Lightning Experiments platform.
GPU available: True (cuda), used: True
TPU available: False, using: 0 TPU cores
💡 Tip: For seamless cloud logging and experiment tracking, try installing [litlogger](https://pypi.org/project/litlogger/) to enable LitLogger, which logs metrics and artifacts automatically to the Lightning Experiments platform.
LOCAL_RANK: 0 - CUDA_VISIBLE_DEVICES: [0]
LOCAL_RANK: 0 - CUDA_VISIBLE_DEVICES: [0]
LOCAL_RANK: 0 - CUDA_VISIBLE_DEVICES: [0]
SLURM auto-requeueing enabled. Setting signal handlers.
SLURM auto-requeueing enabled. Setting signal handlers.
SLURM auto-requeueing enabled. Setting signal handlers.
`Trainer.fit` stopped: `max_epochs=30` reached.
`Trainer.fit` stopped: `max_epochs=30` reached.
`Trainer.fit` stopped: `max_epochs=30` reached.
