[I 2026-05-08 17:26:57,066] Trial 83 finished with value: 0.1151 and parameters: {'optimizer': 'adamw', 'left_wall_dist_num_layers': 1, 'left_wall_dist_activation': 'relu', 'left_wall_dist_fc_layers': 'fc64', 'left_wall_dist_pool_size_l0': 3, 'left_wall_dist_out_channels_l0': 16, 'track_width_num_layers': 3, 'track_width_activation': 'elu', 'track_width_fc_layers': 'fc16', 'track_width_pool_size_l0': 4, 'track_width_out_channels_l0': 4, 'track_width_pool_size_l1': 4, 'track_width_out_channels_l1': 4, 'track_width_pool_size_l2': 2, 'track_width_out_channels_l2': 8, 'heading_error_num_layers': 1, 'heading_error_activation': 'relu', 'heading_error_fc_layers': 'fc128_64', 'heading_error_pool_size_l0': 3, 'heading_error_out_channels_l0': 1}. Best is trial 24 with value: 0.1113.
[I 2026-05-08 17:26:57,090] Trial 84 pruned. Conv channel counts must be non-decreasing.
[rank: 0] Seed set to 42
[rank: 0] Seed set to 42
[rank: 0] Seed set to 42
GPU available: True (cuda), used: True
TPU available: False, using: 0 TPU cores
💡 Tip: For seamless cloud logging and experiment tracking, try installing [litlogger](https://pypi.org/project/litlogger/) to enable LitLogger, which logs metrics and artifacts automatically to the Lightning Experiments platform.
GPU available: True (cuda), used: True
TPU available: False, using: 0 TPU cores
💡 Tip: For seamless cloud logging and experiment tracking, try installing [litlogger](https://pypi.org/project/litlogger/) to enable LitLogger, which logs metrics and artifacts automatically to the Lightning Experiments platform.
GPU available: True (cuda), used: True
TPU available: False, using: 0 TPU cores
💡 Tip: For seamless cloud logging and experiment tracking, try installing [litlogger](https://pypi.org/project/litlogger/) to enable LitLogger, which logs metrics and artifacts automatically to the Lightning Experiments platform.
LOCAL_RANK: 0 - CUDA_VISIBLE_DEVICES: [0]
LOCAL_RANK: 0 - CUDA_VISIBLE_DEVICES: [0]
LOCAL_RANK: 0 - CUDA_VISIBLE_DEVICES: [0]
SLURM auto-requeueing enabled. Setting signal handlers.
SLURM auto-requeueing enabled. Setting signal handlers.
SLURM auto-requeueing enabled. Setting signal handlers.
`Trainer.fit` stopped: `max_epochs=30` reached.
`Trainer.fit` stopped: `max_epochs=30` reached.
`Trainer.fit` stopped: `max_epochs=30` reached.
[I 2026-05-08 17:30:10,365] Trial 85 finished with value: 0.1392 and parameters: {'optimizer': 'adamw', 'left_wall_dist_num_layers': 1, 'left_wall_dist_activation': 'relu', 'left_wall_dist_fc_layers': 'fc128', 'left_wall_dist_pool_size_l0': 2, 'left_wall_dist_out_channels_l0': 16, 'track_width_num_layers': 3, 'track_width_activation': 'elu', 'track_width_fc_layers': 'fc128', 'track_width_pool_size_l0': 4, 'track_width_out_channels_l0': 1, 'track_width_pool_size_l1': 4, 'track_width_out_channels_l1': 4, 'track_width_pool_size_l2': 2, 'track_width_out_channels_l2': 24, 'heading_error_num_layers': 2, 'heading_error_activation': 'elu', 'heading_error_fc_layers': 'fc64', 'heading_error_pool_size_l0': 4, 'heading_error_out_channels_l0': 1, 'heading_error_pool_size_l1': 2, 'heading_error_out_channels_l1': 4}. Best is trial 24 with value: 0.1113.
[rank: 0] Seed set to 42
[rank: 0] Seed set to 42
GPU available: True (cuda), used: True
TPU available: False, using: 0 TPU cores
💡 Tip: For seamless cloud logging and experiment tracking, try installing [litlogger](https://pypi.org/project/litlogger/) to enable LitLogger, which logs metrics and artifacts automatically to the Lightning Experiments platform.
[rank: 0] Seed set to 42
GPU available: True (cuda), used: True
TPU available: False, using: 0 TPU cores
💡 Tip: For seamless cloud logging and experiment tracking, try installing [litlogger](https://pypi.org/project/litlogger/) to enable LitLogger, which logs metrics and artifacts automatically to the Lightning Experiments platform.
GPU available: True (cuda), used: True
TPU available: False, using: 0 TPU cores
💡 Tip: For seamless cloud logging and experiment tracking, try installing [litlogger](https://pypi.org/project/litlogger/) to enable LitLogger, which logs metrics and artifacts automatically to the Lightning Experiments platform.
LOCAL_RANK: 0 - CUDA_VISIBLE_DEVICES: [0]
LOCAL_RANK: 0 - CUDA_VISIBLE_DEVICES: [0]
LOCAL_RANK: 0 - CUDA_VISIBLE_DEVICES: [0]
SLURM auto-requeueing enabled. Setting signal handlers.
SLURM auto-requeueing enabled. Setting signal handlers.
SLURM auto-requeueing enabled. Setting signal handlers.
`Trainer.fit` stopped: `max_epochs=30` reached.
`Trainer.fit` stopped: `max_epochs=30` reached.
`Trainer.fit` stopped: `max_epochs=30` reached.
[I 2026-05-08 17:33:34,378] Trial 86 finished with value: 0.1342 and parameters: {'optimizer': 'adamw', 'left_wall_dist_num_layers': 1, 'left_wall_dist_activation': 'relu', 'left_wall_dist_fc_layers': 'fc64', 'left_wall_dist_pool_size_l0': 3, 'left_wall_dist_out_channels_l0': 1, 'track_width_num_layers': 3, 'track_width_activation': 'elu', 'track_width_fc_layers': 'fc16', 'track_width_pool_size_l0': 2, 'track_width_out_channels_l0': 4, 'track_width_pool_size_l1': 4, 'track_width_out_channels_l1': 4, 'track_width_pool_size_l2': 2, 'track_width_out_channels_l2': 8, 'heading_error_num_layers': 1, 'heading_error_activation': 'relu', 'heading_error_fc_layers': 'fc32', 'heading_error_pool_size_l0': 3, 'heading_error_out_channels_l0': 8}. Best is trial 24 with value: 0.1113.
[I 2026-05-08 17:33:34,394] Trial 87 pruned. Conv channel counts must be non-decreasing.
[I 2026-05-08 17:33:34,407] Trial 88 pruned. Conv channel counts must be non-decreasing.
[rank: 0] Seed set to 42
[rank: 0] Seed set to 42
GPU available: True (cuda), used: True
TPU available: False, using: 0 TPU cores
💡 Tip: For seamless cloud logging and experiment tracking, try installing [litlogger](https://pypi.org/project/litlogger/) to enable LitLogger, which logs metrics and artifacts automatically to the Lightning Experiments platform.
GPU available: True (cuda), used: True
TPU available: False, using: 0 TPU cores
💡 Tip: For seamless cloud logging and experiment tracking, try installing [litlogger](https://pypi.org/project/litlogger/) to enable LitLogger, which logs metrics and artifacts automatically to the Lightning Experiments platform.
[rank: 0] Seed set to 42
GPU available: True (cuda), used: True
TPU available: False, using: 0 TPU cores
💡 Tip: For seamless cloud logging and experiment tracking, try installing [litlogger](https://pypi.org/project/litlogger/) to enable LitLogger, which logs metrics and artifacts automatically to the Lightning Experiments platform.
LOCAL_RANK: 0 - CUDA_VISIBLE_DEVICES: [0]
LOCAL_RANK: 0 - CUDA_VISIBLE_DEVICES: [0]
LOCAL_RANK: 0 - CUDA_VISIBLE_DEVICES: [0]
SLURM auto-requeueing enabled. Setting signal handlers.
SLURM auto-requeueing enabled. Setting signal handlers.
SLURM auto-requeueing enabled. Setting signal handlers.
`Trainer.fit` stopped: `max_epochs=30` reached.
`Trainer.fit` stopped: `max_epochs=30` reached.
[I 2026-05-08 17:35:58,132] Trial 89 finished with value: 0.3351 and parameters: {'optimizer': 'adamw', 'left_wall_dist_num_layers': 1, 'left_wall_dist_activation': 'relu', 'left_wall_dist_fc_layers': 'fc64', 'left_wall_dist_pool_size_l0': 3, 'left_wall_dist_out_channels_l0': 1, 'track_width_num_layers': 3, 'track_width_activation': 'relu', 'track_width_fc_layers': 'fc32', 'track_width_pool_size_l0': 2, 'track_width_out_channels_l0': 4, 'track_width_pool_size_l1': 4, 'track_width_out_channels_l1': 8, 'track_width_pool_size_l2': 4, 'track_width_out_channels_l2': 8, 'heading_error_num_layers': 2, 'heading_error_activation': 'relu', 'heading_error_fc_layers': 'fc128', 'heading_error_pool_size_l0': 4, 'heading_error_out_channels_l0': 1, 'heading_error_pool_size_l1': 3, 'heading_error_out_channels_l1': 24}. Best is trial 24 with value: 0.1113.
[rank: 0] Seed set to 42
GPU available: True (cuda), used: True
TPU available: False, using: 0 TPU cores
💡 Tip: For seamless cloud logging and experiment tracking, try installing [litlogger](https://pypi.org/project/litlogger/) to enable LitLogger, which logs metrics and artifacts automatically to the Lightning Experiments platform.
[rank: 0] Seed set to 42
[rank: 0] Seed set to 42
GPU available: True (cuda), used: True
TPU available: False, using: 0 TPU cores
💡 Tip: For seamless cloud logging and experiment tracking, try installing [litlogger](https://pypi.org/project/litlogger/) to enable LitLogger, which logs metrics and artifacts automatically to the Lightning Experiments platform.
GPU available: True (cuda), used: True
TPU available: False, using: 0 TPU cores
💡 Tip: For seamless cloud logging and experiment tracking, try installing [litlogger](https://pypi.org/project/litlogger/) to enable LitLogger, which logs metrics and artifacts automatically to the Lightning Experiments platform.
LOCAL_RANK: 0 - CUDA_VISIBLE_DEVICES: [0]
LOCAL_RANK: 0 - CUDA_VISIBLE_DEVICES: [0]
SLURM auto-requeueing enabled. Setting signal handlers.
LOCAL_RANK: 0 - CUDA_VISIBLE_DEVICES: [0]
SLURM auto-requeueing enabled. Setting signal handlers.
SLURM auto-requeueing enabled. Setting signal handlers.
`Trainer.fit` stopped: `max_epochs=30` reached.
`Trainer.fit` stopped: `max_epochs=30` reached.
`Trainer.fit` stopped: `max_epochs=30` reached.
[I 2026-05-08 17:39:13,808] Trial 90 finished with value: 0.1078 and parameters: {'optimizer': 'adam', 'left_wall_dist_num_layers': 1, 'left_wall_dist_activation': 'relu', 'left_wall_dist_fc_layers': 'fc64', 'left_wall_dist_pool_size_l0': 3, 'left_wall_dist_out_channels_l0': 16, 'track_width_num_layers': 3, 'track_width_activation': 'elu', 'track_width_fc_layers': 'fc64_32', 'track_width_pool_size_l0': 4, 'track_width_out_channels_l0': 1, 'track_width_pool_size_l1': 2, 'track_width_out_channels_l1': 4, 'track_width_pool_size_l2': 2, 'track_width_out_channels_l2': 32, 'heading_error_num_layers': 2, 'heading_error_activation': 'relu', 'heading_error_fc_layers': 'fc64', 'heading_error_pool_size_l0': 4, 'heading_error_out_channels_l0': 1, 'heading_error_pool_size_l1': 4, 'heading_error_out_channels_l1': 32}. Best is trial 90 with value: 0.1078.
[rank: 0] Seed set to 42
GPU available: True (cuda), used: True
TPU available: False, using: 0 TPU cores
💡 Tip: For seamless cloud logging and experiment tracking, try installing [litlogger](https://pypi.org/project/litlogger/) to enable LitLogger, which logs metrics and artifacts automatically to the Lightning Experiments platform.
[rank: 0] Seed set to 42
[rank: 0] Seed set to 42
GPU available: True (cuda), used: True
TPU available: False, using: 0 TPU cores
💡 Tip: For seamless cloud logging and experiment tracking, try installing [litlogger](https://pypi.org/project/litlogger/) to enable LitLogger, which logs metrics and artifacts automatically to the Lightning Experiments platform.
GPU available: True (cuda), used: True
TPU available: False, using: 0 TPU cores
💡 Tip: For seamless cloud logging and experiment tracking, try installing [litlogger](https://pypi.org/project/litlogger/) to enable LitLogger, which logs metrics and artifacts automatically to the Lightning Experiments platform.
LOCAL_RANK: 0 - CUDA_VISIBLE_DEVICES: [0]
LOCAL_RANK: 0 - CUDA_VISIBLE_DEVICES: [0]
LOCAL_RANK: 0 - CUDA_VISIBLE_DEVICES: [0]
SLURM auto-requeueing enabled. Setting signal handlers.
SLURM auto-requeueing enabled. Setting signal handlers.
SLURM auto-requeueing enabled. Setting signal handlers.
`Trainer.fit` stopped: `max_epochs=30` reached.
`Trainer.fit` stopped: `max_epochs=30` reached.
`Trainer.fit` stopped: `max_epochs=30` reached.
[I 2026-05-08 17:42:29,111] Trial 91 finished with value: 0.1075 and parameters: {'optimizer': 'adam', 'left_wall_dist_num_layers': 1, 'left_wall_dist_activation': 'relu', 'left_wall_dist_fc_layers': 'fc64', 'left_wall_dist_pool_size_l0': 3, 'left_wall_dist_out_channels_l0': 16, 'track_width_num_layers': 3, 'track_width_activation': 'elu', 'track_width_fc_layers': 'fc64_32', 'track_width_pool_size_l0': 4, 'track_width_out_channels_l0': 1, 'track_width_pool_size_l1': 2, 'track_width_out_channels_l1': 4, 'track_width_pool_size_l2': 2, 'track_width_out_channels_l2': 32, 'heading_error_num_layers': 2, 'heading_error_activation': 'relu', 'heading_error_fc_layers': 'fc64', 'heading_error_pool_size_l0': 4, 'heading_error_out_channels_l0': 1, 'heading_error_pool_size_l1': 4, 'heading_error_out_channels_l1': 32}. Best is trial 91 with value: 0.1075.
[rank: 0] Seed set to 42
[rank: 0] Seed set to 42
GPU available: True (cuda), used: True
TPU available: False, using: 0 TPU cores
💡 Tip: For seamless cloud logging and experiment tracking, try installing [litlogger](https://pypi.org/project/litlogger/) to enable LitLogger, which logs metrics and artifacts automatically to the Lightning Experiments platform.
[rank: 0] Seed set to 42
GPU available: True (cuda), used: True
TPU available: False, using: 0 TPU cores
💡 Tip: For seamless cloud logging and experiment tracking, try installing [litlogger](https://pypi.org/project/litlogger/) to enable LitLogger, which logs metrics and artifacts automatically to the Lightning Experiments platform.
GPU available: True (cuda), used: True
TPU available: False, using: 0 TPU cores
💡 Tip: For seamless cloud logging and experiment tracking, try installing [litlogger](https://pypi.org/project/litlogger/) to enable LitLogger, which logs metrics and artifacts automatically to the Lightning Experiments platform.
LOCAL_RANK: 0 - CUDA_VISIBLE_DEVICES: [0]
LOCAL_RANK: 0 - CUDA_VISIBLE_DEVICES: [0]
SLURM auto-requeueing enabled. Setting signal handlers.
SLURM auto-requeueing enabled. Setting signal handlers.
LOCAL_RANK: 0 - CUDA_VISIBLE_DEVICES: [0]
SLURM auto-requeueing enabled. Setting signal handlers.
`Trainer.fit` stopped: `max_epochs=30` reached.
`Trainer.fit` stopped: `max_epochs=30` reached.
`Trainer.fit` stopped: `max_epochs=30` reached.
[I 2026-05-08 17:45:45,012] Trial 92 finished with value: 0.109 and parameters: {'optimizer': 'adam', 'left_wall_dist_num_layers': 1, 'left_wall_dist_activation': 'relu', 'left_wall_dist_fc_layers': 'fc64', 'left_wall_dist_pool_size_l0': 3, 'left_wall_dist_out_channels_l0': 16, 'track_width_num_layers': 3, 'track_width_activation': 'elu', 'track_width_fc_layers': 'fc64_32', 'track_width_pool_size_l0': 4, 'track_width_out_channels_l0': 1, 'track_width_pool_size_l1': 2, 'track_width_out_channels_l1': 4, 'track_width_pool_size_l2': 2, 'track_width_out_channels_l2': 32, 'heading_error_num_layers': 2, 'heading_error_activation': 'relu', 'heading_error_fc_layers': 'fc64', 'heading_error_pool_size_l0': 4, 'heading_error_out_channels_l0': 1, 'heading_error_pool_size_l1': 4, 'heading_error_out_channels_l1': 32}. Best is trial 91 with value: 0.1075.
[rank: 0] Seed set to 42
[rank: 0] Seed set to 42
[rank: 0] Seed set to 42
GPU available: True (cuda), used: True
TPU available: False, using: 0 TPU cores
GPU available: True (cuda), used: True
TPU available: False, using: 0 TPU cores
💡 Tip: For seamless cloud logging and experiment tracking, try installing [litlogger](https://pypi.org/project/litlogger/) to enable LitLogger, which logs metrics and artifacts automatically to the Lightning Experiments platform.
💡 Tip: For seamless cloud logging and experiment tracking, try installing [litlogger](https://pypi.org/project/litlogger/) to enable LitLogger, which logs metrics and artifacts automatically to the Lightning Experiments platform.
GPU available: True (cuda), used: True
TPU available: False, using: 0 TPU cores
💡 Tip: For seamless cloud logging and experiment tracking, try installing [litlogger](https://pypi.org/project/litlogger/) to enable LitLogger, which logs metrics and artifacts automatically to the Lightning Experiments platform.
LOCAL_RANK: 0 - CUDA_VISIBLE_DEVICES: [0]
LOCAL_RANK: 0 - CUDA_VISIBLE_DEVICES: [0]
LOCAL_RANK: 0 - CUDA_VISIBLE_DEVICES: [0]
SLURM auto-requeueing enabled. Setting signal handlers.
SLURM auto-requeueing enabled. Setting signal handlers.
SLURM auto-requeueing enabled. Setting signal handlers.
`Trainer.fit` stopped: `max_epochs=30` reached.
`Trainer.fit` stopped: `max_epochs=30` reached.
`Trainer.fit` stopped: `max_epochs=30` reached.
[I 2026-05-08 17:49:06,529] Trial 93 finished with value: 0.1082 and parameters: {'optimizer': 'adam', 'left_wall_dist_num_layers': 1, 'left_wall_dist_activation': 'relu', 'left_wall_dist_fc_layers': 'fc64', 'left_wall_dist_pool_size_l0': 3, 'left_wall_dist_out_channels_l0': 16, 'track_width_num_layers': 3, 'track_width_activation': 'elu', 'track_width_fc_layers': 'fc64_32', 'track_width_pool_size_l0': 4, 'track_width_out_channels_l0': 1, 'track_width_pool_size_l1': 2, 'track_width_out_channels_l1': 4, 'track_width_pool_size_l2': 2, 'track_width_out_channels_l2': 32, 'heading_error_num_layers': 2, 'heading_error_activation': 'relu', 'heading_error_fc_layers': 'fc64', 'heading_error_pool_size_l0': 4, 'heading_error_out_channels_l0': 1, 'heading_error_pool_size_l1': 4, 'heading_error_out_channels_l1': 32}. Best is trial 91 with value: 0.1075.
[rank: 0] Seed set to 42
[rank: 0] Seed set to 42
[rank: 0] Seed set to 42
GPU available: True (cuda), used: True
TPU available: False, using: 0 TPU cores
💡 Tip: For seamless cloud logging and experiment tracking, try installing [litlogger](https://pypi.org/project/litlogger/) to enable LitLogger, which logs metrics and artifacts automatically to the Lightning Experiments platform.
GPU available: True (cuda), used: True
TPU available: False, using: 0 TPU cores
💡 Tip: For seamless cloud logging and experiment tracking, try installing [litlogger](https://pypi.org/project/litlogger/) to enable LitLogger, which logs metrics and artifacts automatically to the Lightning Experiments platform.
GPU available: True (cuda), used: True
TPU available: False, using: 0 TPU cores
💡 Tip: For seamless cloud logging and experiment tracking, try installing [litlogger](https://pypi.org/project/litlogger/) to enable LitLogger, which logs metrics and artifacts automatically to the Lightning Experiments platform.
LOCAL_RANK: 0 - CUDA_VISIBLE_DEVICES: [0]
LOCAL_RANK: 0 - CUDA_VISIBLE_DEVICES: [0]
LOCAL_RANK: 0 - CUDA_VISIBLE_DEVICES: [0]
SLURM auto-requeueing enabled. Setting signal handlers.
SLURM auto-requeueing enabled. Setting signal handlers.
SLURM auto-requeueing enabled. Setting signal handlers.
`Trainer.fit` stopped: `max_epochs=30` reached.
`Trainer.fit` stopped: `max_epochs=30` reached.
`Trainer.fit` stopped: `max_epochs=30` reached.
[I 2026-05-08 17:51:40,136] Trial 94 finished with value: 0.1084 and parameters: {'optimizer': 'adam', 'left_wall_dist_num_layers': 1, 'left_wall_dist_activation': 'relu', 'left_wall_dist_fc_layers': 'fc64', 'left_wall_dist_pool_size_l0': 3, 'left_wall_dist_out_channels_l0': 16, 'track_width_num_layers': 3, 'track_width_activation': 'elu', 'track_width_fc_layers': 'fc64_32', 'track_width_pool_size_l0': 4, 'track_width_out_channels_l0': 1, 'track_width_pool_size_l1': 2, 'track_width_out_channels_l1': 4, 'track_width_pool_size_l2': 2, 'track_width_out_channels_l2': 32, 'heading_error_num_layers': 2, 'heading_error_activation': 'relu', 'heading_error_fc_layers': 'fc64', 'heading_error_pool_size_l0': 4, 'heading_error_out_channels_l0': 1, 'heading_error_pool_size_l1': 4, 'heading_error_out_channels_l1': 32}. Best is trial 91 with value: 0.1075.
[rank: 0] Seed set to 42
[rank: 0] Seed set to 42
[rank: 0] Seed set to 42
GPU available: True (cuda), used: True
TPU available: False, using: 0 TPU cores
💡 Tip: For seamless cloud logging and experiment tracking, try installing [litlogger](https://pypi.org/project/litlogger/) to enable LitLogger, which logs metrics and artifacts automatically to the Lightning Experiments platform.
GPU available: True (cuda), used: True
TPU available: False, using: 0 TPU cores
💡 Tip: For seamless cloud logging and experiment tracking, try installing [litlogger](https://pypi.org/project/litlogger/) to enable LitLogger, which logs metrics and artifacts automatically to the Lightning Experiments platform.
GPU available: True (cuda), used: True
TPU available: False, using: 0 TPU cores
💡 Tip: For seamless cloud logging and experiment tracking, try installing [litlogger](https://pypi.org/project/litlogger/) to enable LitLogger, which logs metrics and artifacts automatically to the Lightning Experiments platform.
LOCAL_RANK: 0 - CUDA_VISIBLE_DEVICES: [0]
LOCAL_RANK: 0 - CUDA_VISIBLE_DEVICES: [0]
LOCAL_RANK: 0 - CUDA_VISIBLE_DEVICES: [0]
SLURM auto-requeueing enabled. Setting signal handlers.
SLURM auto-requeueing enabled. Setting signal handlers.
SLURM auto-requeueing enabled. Setting signal handlers.
`Trainer.fit` stopped: `max_epochs=30` reached.
`Trainer.fit` stopped: `max_epochs=30` reached.
`Trainer.fit` stopped: `max_epochs=30` reached.
