[I 2026-04-16 01:26:30,945] Trial 96 finished with value: 0.1545 and parameters: {'left_wall_dist_num_layers': 5, 'left_wall_dist_activation': 'relu', 'left_wall_dist_out_channels_l0': 67, 'left_wall_dist_pool_size_l0': 8, 'left_wall_dist_out_channels_l1': 161, 'left_wall_dist_pool_size_l1': 4, 'left_wall_dist_out_channels_l2': 146, 'left_wall_dist_pool_size_l2': 8, 'left_wall_dist_out_channels_l3': 161, 'left_wall_dist_pool_size_l3': 8, 'left_wall_dist_fc_hidden': 35, 'track_width_num_layers': 4, 'track_width_activation': 'elu', 'track_width_out_channels_l0': 125, 'track_width_pool_size_l0': 8, 'track_width_out_channels_l1': 201, 'track_width_pool_size_l1': 8, 'track_width_out_channels_l2': 93, 'track_width_pool_size_l2': 8, 'track_width_fc_hidden': 47, 'heading_error_num_layers': 5, 'heading_error_activation': 'elu', 'heading_error_out_channels_l0': 213, 'heading_error_pool_size_l0': 8, 'heading_error_out_channels_l1': 113, 'heading_error_pool_size_l1': 2, 'heading_error_out_channels_l2': 205, 'heading_error_pool_size_l2': 2, 'heading_error_out_channels_l3': 91, 'heading_error_pool_size_l3': 4, 'heading_error_out_channels_l4': 220, 'heading_error_pool_size_l4': 4}. Best is trial 70 with value: 0.1122.
[rank: 0] Seed set to 42
[rank: 0] Seed set to 42
[rank: 0] Seed set to 42
GPU available: True (cuda), used: True
TPU available: False, using: 0 TPU cores
💡 Tip: For seamless cloud logging and experiment tracking, try installing [litlogger](https://pypi.org/project/litlogger/) to enable LitLogger, which logs metrics and artifacts automatically to the Lightning Experiments platform.
GPU available: True (cuda), used: True
GPU available: True (cuda), used: True
TPU available: False, using: 0 TPU cores
TPU available: False, using: 0 TPU cores
💡 Tip: For seamless cloud logging and experiment tracking, try installing [litlogger](https://pypi.org/project/litlogger/) to enable LitLogger, which logs metrics and artifacts automatically to the Lightning Experiments platform.
💡 Tip: For seamless cloud logging and experiment tracking, try installing [litlogger](https://pypi.org/project/litlogger/) to enable LitLogger, which logs metrics and artifacts automatically to the Lightning Experiments platform.
LOCAL_RANK: 0 - CUDA_VISIBLE_DEVICES: [0]
LOCAL_RANK: 0 - CUDA_VISIBLE_DEVICES: [0]
LOCAL_RANK: 0 - CUDA_VISIBLE_DEVICES: [0]
SLURM auto-requeueing enabled. Setting signal handlers.
Traceback (most recent call last):
  File "/nas/longleaf/home/zayah/f1tenth_ng_zc/packages/f110_scripts/src/f110_scripts/train/train_nn.py", line 595, in <module>
    main()
  File "/nas/longleaf/home/zayah/f1tenth_ng_zc/packages/f110_scripts/src/f110_scripts/train/train_nn.py", line 591, in main
    run_single_training(config, aid)
  File "/nas/longleaf/home/zayah/f1tenth_ng_zc/packages/f110_scripts/src/f110_scripts/train/train_nn.py", line 564, in run_single_training
    trainer.fit(module, datamodule=dm, ckpt_path=ckpt_path)
  File "/nas/longleaf/home/zayah/f1tenth_ng_zc/.venv/lib/python3.12/site-packages/lightning/pytorch/trainer/trainer.py", line 584, in fit
    call._call_and_handle_interrupt(
  File "/nas/longleaf/home/zayah/f1tenth_ng_zc/.venv/lib/python3.12/site-packages/lightning/pytorch/trainer/call.py", line 49, in _call_and_handle_interrupt
    return trainer_fn(*args, **kwargs)
           ^^^^^^^^^^^^^^^^^^^^^^^^^^^
  File "/nas/longleaf/home/zayah/f1tenth_ng_zc/.venv/lib/python3.12/site-packages/lightning/pytorch/trainer/trainer.py", line 630, in _fit_impl
    self._run(model, ckpt_path=ckpt_path, weights_only=weights_only)
  File "/nas/longleaf/home/zayah/f1tenth_ng_zc/.venv/lib/python3.12/site-packages/lightning/pytorch/trainer/trainer.py", line 1057, in _run
    call._call_callback_hooks(self, "on_fit_start")
  File "/nas/longleaf/home/zayah/f1tenth_ng_zc/.venv/lib/python3.12/site-packages/lightning/pytorch/trainer/call.py", line 228, in _call_callback_hooks
    fn(trainer, trainer.lightning_module, *args, **kwargs)
  File "/nas/longleaf/home/zayah/f1tenth_ng_zc/.venv/lib/python3.12/site-packages/lightning/pytorch/callbacks/model_summary.py", line 64, in on_fit_start
    model_summary = self._summary(trainer, pl_module)
                    ^^^^^^^^^^^^^^^^^^^^^^^^^^^^^^^^^
  File "/nas/longleaf/home/zayah/f1tenth_ng_zc/.venv/lib/python3.12/site-packages/lightning/pytorch/callbacks/model_summary.py", line 90, in _summary
    return summarize(pl_module, max_depth=self._max_depth)
           ^^^^^^^^^^^^^^^^^^^^^^^^^^^^^^^^^^^^^^^^^^^^^^^
  File "/nas/longleaf/home/zayah/f1tenth_ng_zc/.venv/lib/python3.12/site-packages/lightning/pytorch/utilities/model_summary/model_summary.py", line 565, in summarize
    return ModelSummary(lightning_module, max_depth=max_depth)
           ^^^^^^^^^^^^^^^^^^^^^^^^^^^^^^^^^^^^^^^^^^^^^^^^^^^
  File "/nas/longleaf/home/zayah/f1tenth_ng_zc/.venv/lib/python3.12/site-packages/lightning/pytorch/utilities/model_summary/model_summary.py", line 228, in __init__
    self._layer_summary = self.summarize()
                          ^^^^^^^^^^^^^^^^
  File "/nas/longleaf/home/zayah/f1tenth_ng_zc/.venv/lib/python3.12/site-packages/lightning/pytorch/utilities/model_summary/model_summary.py", line 328, in summarize
SLURM auto-requeueing enabled. Setting signal handlers.
    self._forward_example_input()
  File "/nas/longleaf/home/zayah/f1tenth_ng_zc/.venv/lib/python3.12/site-packages/lightning/pytorch/utilities/model_summary/model_summary.py", line 371, in _forward_example_input
    model(input_)
  File "/nas/longleaf/home/zayah/f1tenth_ng_zc/.venv/lib/python3.12/site-packages/torch/nn/modules/module.py", line 1779, in _wrapped_call_impl
    return self._call_impl(*args, **kwargs)
           ^^^^^^^^^^^^^^^^^^^^^^^^^^^^^^^^
  File "/nas/longleaf/home/zayah/f1tenth_ng_zc/.venv/lib/python3.12/site-packages/torch/nn/modules/module.py", line 1885, in _call_impl
    return inner()
           ^^^^^^^
  File "/nas/longleaf/home/zayah/f1tenth_ng_zc/.venv/lib/python3.12/site-packages/torch/nn/modules/module.py", line 1833, in inner
    result = forward_call(*args, **kwargs)
             ^^^^^^^^^^^^^^^^^^^^^^^^^^^^^
  File "/nas/longleaf/home/zayah/f1tenth_ng_zc/packages/f110_scripts/src/f110_scripts/train/train_nn.py", line 205, in forward
    return self.model(x_in)
           ^^^^^^^^^^^^^^^^
  File "/nas/longleaf/home/zayah/f1tenth_ng_zc/.venv/lib/python3.12/site-packages/torch/nn/modules/module.py", line 1779, in _wrapped_call_impl
    return self._call_impl(*args, **kwargs)
           ^^^^^^^^^^^^^^^^^^^^^^^^^^^^^^^^
  File "/nas/longleaf/home/zayah/f1tenth_ng_zc/.venv/lib/python3.12/site-packages/torch/nn/modules/module.py", line 1885, in _call_impl
    return inner()
           ^^^^^^^
  File "/nas/longleaf/home/zayah/f1tenth_ng_zc/.venv/lib/python3.12/site-packages/torch/nn/modules/module.py", line 1833, in inner
    result = forward_call(*args, **kwargs)
             ^^^^^^^^^^^^^^^^^^^^^^^^^^^^^
  File "/nas/longleaf/home/zayah/f1tenth_ng_zc/.venv/lib/python3.12/site-packages/torch/nn/modules/container.py", line 253, in forward
    input = module(input)
            ^^^^^^^^^^^^^
  File "/nas/longleaf/home/zayah/f1tenth_ng_zc/.venv/lib/python3.12/site-packages/torch/nn/modules/module.py", line 1779, in _wrapped_call_impl
    return self._call_impl(*args, **kwargs)
           ^^^^^^^^^^^^^^^^^^^^^^^^^^^^^^^^
  File "/nas/longleaf/home/zayah/f1tenth_ng_zc/.venv/lib/python3.12/site-packages/torch/nn/modules/module.py", line 1885, in _call_impl
    return inner()
           ^^^^^^^
  File "/nas/longleaf/home/zayah/f1tenth_ng_zc/.venv/lib/python3.12/site-packages/torch/nn/modules/module.py", line 1833, in inner
    result = forward_call(*args, **kwargs)
             ^^^^^^^^^^^^^^^^^^^^^^^^^^^^^
  File "/nas/longleaf/home/zayah/f1tenth_ng_zc/.venv/lib/python3.12/site-packages/torch/nn/modules/pooling.py", line 144, in forward
    return F.max_pool1d(
           ^^^^^^^^^^^^^
  File "/nas/longleaf/home/zayah/f1tenth_ng_zc/.venv/lib/python3.12/site-packages/torch/_jit_internal.py", line 636, in fn
    return if_false(*args, **kwargs)
           ^^^^^^^^^^^^^^^^^^^^^^^^^
  File "/nas/longleaf/home/zayah/f1tenth_ng_zc/.venv/lib/python3.12/site-packages/torch/nn/functional.py", line 745, in _max_pool1d
    return torch.max_pool1d(input, kernel_size, stride, padding, dilation, ceil_mode)
           ^^^^^^^^^^^^^^^^^^^^^^^^^^^^^^^^^^^^^^^^^^^^^^^^^^^^^^^^^^^^^^^^^^^^^^^^^^
RuntimeError: max_pool1d() Invalid computed output size: 0
`Trainer.fit` stopped: `max_epochs=30` reached.
`Trainer.fit` stopped: `max_epochs=30` reached.
[I 2026-04-16 01:27:45,163] Trial 97 finished with value: inf and parameters: {'left_wall_dist_num_layers': 5, 'left_wall_dist_activation': 'relu', 'left_wall_dist_out_channels_l0': 98, 'left_wall_dist_pool_size_l0': 8, 'left_wall_dist_out_channels_l1': 111, 'left_wall_dist_pool_size_l1': 2, 'left_wall_dist_out_channels_l2': 190, 'left_wall_dist_pool_size_l2': 4, 'left_wall_dist_out_channels_l3': 69, 'left_wall_dist_pool_size_l3': 4, 'left_wall_dist_out_channels_l4': 45, 'left_wall_dist_pool_size_l4': 2, 'track_width_num_layers': 4, 'track_width_activation': 'elu', 'track_width_out_channels_l0': 135, 'track_width_pool_size_l0': 8, 'track_width_out_channels_l1': 216, 'track_width_pool_size_l1': 4, 'track_width_out_channels_l2': 104, 'track_width_pool_size_l2': 2, 'track_width_out_channels_l3': 37, 'track_width_pool_size_l3': 4, 'heading_error_num_layers': 2, 'heading_error_activation': 'elu', 'heading_error_out_channels_l0': 70, 'heading_error_pool_size_l0': 8, 'heading_error_out_channels_l1': 140, 'heading_error_pool_size_l1': 4, 'heading_error_fc_hidden': 76}. Best is trial 70 with value: 0.1122.
[rank: 0] Seed set to 42
GPU available: True (cuda), used: True
TPU available: False, using: 0 TPU cores
💡 Tip: For seamless cloud logging and experiment tracking, try installing [litlogger](https://pypi.org/project/litlogger/) to enable LitLogger, which logs metrics and artifacts automatically to the Lightning Experiments platform.
[rank: 0] Seed set to 42
[rank: 0] Seed set to 42
GPU available: True (cuda), used: True
TPU available: False, using: 0 TPU cores
💡 Tip: For seamless cloud logging and experiment tracking, try installing [litlogger](https://pypi.org/project/litlogger/) to enable LitLogger, which logs metrics and artifacts automatically to the Lightning Experiments platform.
GPU available: True (cuda), used: True
TPU available: False, using: 0 TPU cores
💡 Tip: For seamless cloud logging and experiment tracking, try installing [litlogger](https://pypi.org/project/litlogger/) to enable LitLogger, which logs metrics and artifacts automatically to the Lightning Experiments platform.
LOCAL_RANK: 0 - CUDA_VISIBLE_DEVICES: [0]
LOCAL_RANK: 0 - CUDA_VISIBLE_DEVICES: [0]
LOCAL_RANK: 0 - CUDA_VISIBLE_DEVICES: [0]
SLURM auto-requeueing enabled. Setting signal handlers.
Traceback (most recent call last):
  File "/nas/longleaf/home/zayah/f1tenth_ng_zc/packages/f110_scripts/src/f110_scripts/train/train_nn.py", line 595, in <module>
    main()
  File "/nas/longleaf/home/zayah/f1tenth_ng_zc/packages/f110_scripts/src/f110_scripts/train/train_nn.py", line 591, in main
    run_single_training(config, aid)
  File "/nas/longleaf/home/zayah/f1tenth_ng_zc/packages/f110_scripts/src/f110_scripts/train/train_nn.py", line 564, in run_single_training
    trainer.fit(module, datamodule=dm, ckpt_path=ckpt_path)
  File "/nas/longleaf/home/zayah/f1tenth_ng_zc/.venv/lib/python3.12/site-packages/lightning/pytorch/trainer/trainer.py", line 584, in fit
    call._call_and_handle_interrupt(
  File "/nas/longleaf/home/zayah/f1tenth_ng_zc/.venv/lib/python3.12/site-packages/lightning/pytorch/trainer/call.py", line 49, in _call_and_handle_interrupt
    return trainer_fn(*args, **kwargs)
           ^^^^^^^^^^^^^^^^^^^^^^^^^^^
  File "/nas/longleaf/home/zayah/f1tenth_ng_zc/.venv/lib/python3.12/site-packages/lightning/pytorch/trainer/trainer.py", line 630, in _fit_impl
    self._run(model, ckpt_path=ckpt_path, weights_only=weights_only)
  File "/nas/longleaf/home/zayah/f1tenth_ng_zc/.venv/lib/python3.12/site-packages/lightning/pytorch/trainer/trainer.py", line 1057, in _run
    call._call_callback_hooks(self, "on_fit_start")
  File "/nas/longleaf/home/zayah/f1tenth_ng_zc/.venv/lib/python3.12/site-packages/lightning/pytorch/trainer/call.py", line 228, in _call_callback_hooks
    fn(trainer, trainer.lightning_module, *args, **kwargs)
  File "/nas/longleaf/home/zayah/f1tenth_ng_zc/.venv/lib/python3.12/site-packages/lightning/pytorch/callbacks/model_summary.py", line 64, in on_fit_start
    model_summary = self._summary(trainer, pl_module)
                    ^^^^^^^^^^^^^^^^^^^^^^^^^^^^^^^^^
  File "/nas/longleaf/home/zayah/f1tenth_ng_zc/.venv/lib/python3.12/site-packages/lightning/pytorch/callbacks/model_summary.py", line 90, in _summary
    return summarize(pl_module, max_depth=self._max_depth)
           ^^^^^^^^^^^^^^^^^^^^^^^^^^^^^^^^^^^^^^^^^^^^^^^
  File "/nas/longleaf/home/zayah/f1tenth_ng_zc/.venv/lib/python3.12/site-packages/lightning/pytorch/utilities/model_summary/model_summary.py", line 565, in summarize
    return ModelSummary(lightning_module, max_depth=max_depth)
           ^^^^^^^^^^^^^^^^^^^^^^^^^^^^^^^^^^^^^^^^^^^^^^^^^^^
  File "/nas/longleaf/home/zayah/f1tenth_ng_zc/.venv/lib/python3.12/site-packages/lightning/pytorch/utilities/model_summary/model_summary.py", line 228, in __init__
    self._layer_summary = self.summarize()
                          ^^^^^^^^^^^^^^^^
  File "/nas/longleaf/home/zayah/f1tenth_ng_zc/.venv/lib/python3.12/site-packages/lightning/pytorch/utilities/model_summary/model_summary.py", line 328, in summarize
    self._forward_example_input()
  File "/nas/longleaf/home/zayah/f1tenth_ng_zc/.venv/lib/python3.12/site-packages/lightning/pytorch/utilities/model_summary/model_summary.py", line 371, in _forward_example_input
    model(input_)
  File "/nas/longleaf/home/zayah/f1tenth_ng_zc/.venv/lib/python3.12/site-packages/torch/nn/modules/module.py", line 1779, in _wrapped_call_impl
    return self._call_impl(*args, **kwargs)
           ^^^^^^^^^^^^^^^^^^^^^^^^^^^^^^^^
  File "/nas/longleaf/home/zayah/f1tenth_ng_zc/.venv/lib/python3.12/site-packages/torch/nn/modules/module.py", line 1885, in _call_impl
    return inner()
           ^^^^^^^
  File "/nas/longleaf/home/zayah/f1tenth_ng_zc/.venv/lib/python3.12/site-packages/torch/nn/modules/module.py", line 1833, in inner
    result = forward_call(*args, **kwargs)
             ^^^^^^^^^^^^^^^^^^^^^^^^^^^^^
  File "/nas/longleaf/home/zayah/f1tenth_ng_zc/packages/f110_scripts/src/f110_scripts/train/train_nn.py", line 205, in forward
    return self.model(x_in)
           ^^^^^^^^^^^^^^^^
  File "/nas/longleaf/home/zayah/f1tenth_ng_zc/.venv/lib/python3.12/site-packages/torch/nn/modules/module.py", line 1779, in _wrapped_call_impl
    return self._call_impl(*args, **kwargs)
           ^^^^^^^^^^^^^^^^^^^^^^^^^^^^^^^^
  File "/nas/longleaf/home/zayah/f1tenth_ng_zc/.venv/lib/python3.12/site-packages/torch/nn/modules/module.py", line 1885, in _call_impl
    return inner()
           ^^^^^^^
  File "/nas/longleaf/home/zayah/f1tenth_ng_zc/.venv/lib/python3.12/site-packages/torch/nn/modules/module.py", line 1833, in inner
    result = forward_call(*args, **kwargs)
             ^^^^^^^^^^^^^^^^^^^^^^^^^^^^^
  File "/nas/longleaf/home/zayah/f1tenth_ng_zc/.venv/lib/python3.12/site-packages/torch/nn/modules/container.py", line 253, in forward
    input = module(input)
            ^^^^^^^^^^^^^
  File "/nas/longleaf/home/zayah/f1tenth_ng_zc/.venv/lib/python3.12/site-packages/torch/nn/modules/module.py", line 1779, in _wrapped_call_impl
    return self._call_impl(*args, **kwargs)
           ^^^^^^^^^^^^^^^^^^^^^^^^^^^^^^^^
  File "/nas/longleaf/home/zayah/f1tenth_ng_zc/.venv/lib/python3.12/site-packages/torch/nn/modules/module.py", line 1885, in _call_impl
    return inner()
           ^^^^^^^
  File "/nas/longleaf/home/zayah/f1tenth_ng_zc/.venv/lib/python3.12/site-packages/torch/nn/modules/module.py", line 1833, in inner
    result = forward_call(*args, **kwargs)
             ^^^^^^^^^^^^^^^^^^^^^^^^^^^^^
  File "/nas/longleaf/home/zayah/f1tenth_ng_zc/.venv/lib/python3.12/site-packages/torch/nn/modules/pooling.py", line 144, in forward
    return F.max_pool1d(
           ^^^^^^^^^^^^^
  File "/nas/longleaf/home/zayah/f1tenth_ng_zc/.venv/lib/python3.12/site-packages/torch/_jit_internal.py", line 636, in fn
    return if_false(*args, **kwargs)
           ^^^^^^^^^^^^^^^^^^^^^^^^^
  File "/nas/longleaf/home/zayah/f1tenth_ng_zc/.venv/lib/python3.12/site-packages/torch/nn/functional.py", line 745, in _max_pool1d
    return torch.max_pool1d(input, kernel_size, stride, padding, dilation, ceil_mode)
           ^^^^^^^^^^^^^^^^^^^^^^^^^^^^^^^^^^^^^^^^^^^^^^^^^^^^^^^^^^^^^^^^^^^^^^^^^^
RuntimeError: max_pool1d() Invalid computed output size: 0
SLURM auto-requeueing enabled. Setting signal handlers.
`Trainer.fit` stopped: `max_epochs=30` reached.
`Trainer.fit` stopped: `max_epochs=30` reached.
[I 2026-04-16 01:29:16,353] Trial 98 finished with value: inf and parameters: {'left_wall_dist_num_layers': 5, 'left_wall_dist_activation': 'relu', 'left_wall_dist_out_channels_l0': 122, 'left_wall_dist_pool_size_l0': 8, 'left_wall_dist_out_channels_l1': 139, 'left_wall_dist_pool_size_l1': 2, 'left_wall_dist_out_channels_l2': 256, 'left_wall_dist_pool_size_l2': 4, 'left_wall_dist_out_channels_l3': 137, 'left_wall_dist_pool_size_l3': 8, 'left_wall_dist_fc_hidden': 39, 'track_width_num_layers': 4, 'track_width_activation': 'elu', 'track_width_out_channels_l0': 113, 'track_width_pool_size_l0': 8, 'track_width_out_channels_l1': 228, 'track_width_pool_size_l1': 8, 'track_width_out_channels_l2': 115, 'track_width_pool_size_l2': 4, 'track_width_out_channels_l3': 68, 'track_width_pool_size_l3': 2, 'heading_error_num_layers': 4, 'heading_error_activation': 'elu', 'heading_error_out_channels_l0': 181, 'heading_error_pool_size_l0': 2, 'heading_error_out_channels_l1': 126, 'heading_error_pool_size_l1': 2, 'heading_error_out_channels_l2': 190, 'heading_error_pool_size_l2': 2, 'heading_error_out_channels_l3': 232, 'heading_error_pool_size_l3': 4, 'heading_error_fc_hidden': 127}. Best is trial 70 with value: 0.1122.
[rank: 0] Seed set to 42
GPU available: True (cuda), used: True
TPU available: False, using: 0 TPU cores
💡 Tip: For seamless cloud logging and experiment tracking, try installing [litlogger](https://pypi.org/project/litlogger/) to enable LitLogger, which logs metrics and artifacts automatically to the Lightning Experiments platform.
[rank: 0] Seed set to 42
[rank: 0] Seed set to 42
GPU available: True (cuda), used: True
TPU available: False, using: 0 TPU cores
💡 Tip: For seamless cloud logging and experiment tracking, try installing [litlogger](https://pypi.org/project/litlogger/) to enable LitLogger, which logs metrics and artifacts automatically to the Lightning Experiments platform.
GPU available: True (cuda), used: True
TPU available: False, using: 0 TPU cores
💡 Tip: For seamless cloud logging and experiment tracking, try installing [litlogger](https://pypi.org/project/litlogger/) to enable LitLogger, which logs metrics and artifacts automatically to the Lightning Experiments platform.
LOCAL_RANK: 0 - CUDA_VISIBLE_DEVICES: [0]
LOCAL_RANK: 0 - CUDA_VISIBLE_DEVICES: [0]
LOCAL_RANK: 0 - CUDA_VISIBLE_DEVICES: [0]
SLURM auto-requeueing enabled. Setting signal handlers.
SLURM auto-requeueing enabled. Setting signal handlers.
SLURM auto-requeueing enabled. Setting signal handlers.
`Trainer.fit` stopped: `max_epochs=30` reached.
`Trainer.fit` stopped: `max_epochs=30` reached.
`Trainer.fit` stopped: `max_epochs=30` reached.
