[I 2026-04-16 00:49:52,665] Trial 83 finished with value: 0.1418 and parameters: {'left_wall_dist_num_layers': 5, 'left_wall_dist_activation': 'relu', 'left_wall_dist_out_channels_l0': 88, 'left_wall_dist_pool_size_l0': 2, 'left_wall_dist_out_channels_l1': 87, 'left_wall_dist_pool_size_l1': 2, 'left_wall_dist_out_channels_l2': 156, 'left_wall_dist_pool_size_l2': 8, 'left_wall_dist_out_channels_l3': 164, 'left_wall_dist_pool_size_l3': 4, 'left_wall_dist_out_channels_l4': 130, 'left_wall_dist_pool_size_l4': 8, 'left_wall_dist_fc_hidden': 44, 'track_width_num_layers': 4, 'track_width_activation': 'elu', 'track_width_out_channels_l0': 33, 'track_width_pool_size_l0': 2, 'track_width_out_channels_l1': 186, 'track_width_pool_size_l1': 2, 'track_width_out_channels_l2': 143, 'track_width_pool_size_l2': 2, 'track_width_out_channels_l3': 49, 'track_width_pool_size_l3': 2, 'track_width_fc_hidden': 76, 'heading_error_num_layers': 5, 'heading_error_activation': 'elu', 'heading_error_out_channels_l0': 92, 'heading_error_pool_size_l0': 2, 'heading_error_out_channels_l1': 57, 'heading_error_pool_size_l1': 2, 'heading_error_out_channels_l2': 194, 'heading_error_pool_size_l2': 4, 'heading_error_out_channels_l3': 236, 'heading_error_pool_size_l3': 4, 'heading_error_out_channels_l4': 93, 'heading_error_pool_size_l4': 4, 'heading_error_fc_hidden': 61}. Best is trial 70 with value: 0.1122.
[rank: 0] Seed set to 42
[rank: 0] Seed set to 42
[rank: 0] Seed set to 42
GPU available: True (cuda), used: True
TPU available: False, using: 0 TPU cores
💡 Tip: For seamless cloud logging and experiment tracking, try installing [litlogger](https://pypi.org/project/litlogger/) to enable LitLogger, which logs metrics and artifacts automatically to the Lightning Experiments platform.
GPU available: True (cuda), used: True
TPU available: False, using: 0 TPU cores
💡 Tip: For seamless cloud logging and experiment tracking, try installing [litlogger](https://pypi.org/project/litlogger/) to enable LitLogger, which logs metrics and artifacts automatically to the Lightning Experiments platform.
GPU available: True (cuda), used: True
TPU available: False, using: 0 TPU cores
💡 Tip: For seamless cloud logging and experiment tracking, try installing [litlogger](https://pypi.org/project/litlogger/) to enable LitLogger, which logs metrics and artifacts automatically to the Lightning Experiments platform.
LOCAL_RANK: 0 - CUDA_VISIBLE_DEVICES: [0]
LOCAL_RANK: 0 - CUDA_VISIBLE_DEVICES: [0]
LOCAL_RANK: 0 - CUDA_VISIBLE_DEVICES: [0]
SLURM auto-requeueing enabled. Setting signal handlers.
SLURM auto-requeueing enabled. Setting signal handlers.
SLURM auto-requeueing enabled. Setting signal handlers.
`Trainer.fit` stopped: `max_epochs=30` reached.
`Trainer.fit` stopped: `max_epochs=30` reached.
`Trainer.fit` stopped: `max_epochs=30` reached.
[I 2026-04-16 00:53:15,957] Trial 84 finished with value: 0.1365 and parameters: {'left_wall_dist_num_layers': 5, 'left_wall_dist_activation': 'relu', 'left_wall_dist_out_channels_l0': 164, 'left_wall_dist_pool_size_l0': 2, 'left_wall_dist_out_channels_l1': 112, 'left_wall_dist_pool_size_l1': 2, 'left_wall_dist_out_channels_l2': 188, 'left_wall_dist_pool_size_l2': 8, 'left_wall_dist_out_channels_l3': 219, 'left_wall_dist_pool_size_l3': 4, 'left_wall_dist_out_channels_l4': 41, 'left_wall_dist_pool_size_l4': 4, 'left_wall_dist_fc_hidden': 36, 'track_width_num_layers': 4, 'track_width_activation': 'elu', 'track_width_out_channels_l0': 162, 'track_width_pool_size_l0': 2, 'track_width_out_channels_l1': 145, 'track_width_pool_size_l1': 2, 'track_width_out_channels_l2': 155, 'track_width_pool_size_l2': 2, 'track_width_out_channels_l3': 34, 'track_width_pool_size_l3': 2, 'track_width_fc_hidden': 53, 'heading_error_num_layers': 5, 'heading_error_activation': 'elu', 'heading_error_out_channels_l0': 106, 'heading_error_pool_size_l0': 2, 'heading_error_out_channels_l1': 110, 'heading_error_pool_size_l1': 2, 'heading_error_out_channels_l2': 32, 'heading_error_pool_size_l2': 4, 'heading_error_out_channels_l3': 169, 'heading_error_pool_size_l3': 8, 'heading_error_out_channels_l4': 102, 'heading_error_pool_size_l4': 4, 'heading_error_fc_hidden': 38}. Best is trial 70 with value: 0.1122.
[rank: 0] Seed set to 42
GPU available: True (cuda), used: True
TPU available: False, using: 0 TPU cores
💡 Tip: For seamless cloud logging and experiment tracking, try installing [litlogger](https://pypi.org/project/litlogger/) to enable LitLogger, which logs metrics and artifacts automatically to the Lightning Experiments platform.
[rank: 0] Seed set to 42
[rank: 0] Seed set to 42
GPU available: True (cuda), used: True
TPU available: False, using: 0 TPU cores
💡 Tip: For seamless cloud logging and experiment tracking, try installing [litlogger](https://pypi.org/project/litlogger/) to enable LitLogger, which logs metrics and artifacts automatically to the Lightning Experiments platform.
GPU available: True (cuda), used: True
TPU available: False, using: 0 TPU cores
💡 Tip: For seamless cloud logging and experiment tracking, try installing [litlogger](https://pypi.org/project/litlogger/) to enable LitLogger, which logs metrics and artifacts automatically to the Lightning Experiments platform.
LOCAL_RANK: 0 - CUDA_VISIBLE_DEVICES: [0]
LOCAL_RANK: 0 - CUDA_VISIBLE_DEVICES: [0]
LOCAL_RANK: 0 - CUDA_VISIBLE_DEVICES: [0]
SLURM auto-requeueing enabled. Setting signal handlers.
SLURM auto-requeueing enabled. Setting signal handlers.
SLURM auto-requeueing enabled. Setting signal handlers.
`Trainer.fit` stopped: `max_epochs=30` reached.
`Trainer.fit` stopped: `max_epochs=30` reached.
`Trainer.fit` stopped: `max_epochs=30` reached.
[I 2026-04-16 00:55:56,150] Trial 85 finished with value: 0.1981 and parameters: {'left_wall_dist_num_layers': 5, 'left_wall_dist_activation': 'relu', 'left_wall_dist_out_channels_l0': 129, 'left_wall_dist_pool_size_l0': 2, 'left_wall_dist_out_channels_l1': 97, 'left_wall_dist_pool_size_l1': 2, 'left_wall_dist_out_channels_l2': 228, 'left_wall_dist_pool_size_l2': 4, 'left_wall_dist_out_channels_l3': 184, 'left_wall_dist_pool_size_l3': 2, 'left_wall_dist_out_channels_l4': 74, 'left_wall_dist_pool_size_l4': 8, 'left_wall_dist_fc_hidden': 43, 'track_width_num_layers': 4, 'track_width_activation': 'elu', 'track_width_out_channels_l0': 146, 'track_width_pool_size_l0': 2, 'track_width_out_channels_l1': 120, 'track_width_pool_size_l1': 2, 'track_width_out_channels_l2': 126, 'track_width_pool_size_l2': 2, 'track_width_out_channels_l3': 54, 'track_width_pool_size_l3': 8, 'track_width_fc_hidden': 65, 'heading_error_num_layers': 5, 'heading_error_activation': 'elu', 'heading_error_out_channels_l0': 97, 'heading_error_pool_size_l0': 2, 'heading_error_out_channels_l1': 123, 'heading_error_pool_size_l1': 2, 'heading_error_out_channels_l2': 153, 'heading_error_pool_size_l2': 4, 'heading_error_out_channels_l3': 155, 'heading_error_pool_size_l3': 4, 'heading_error_out_channels_l4': 121, 'heading_error_pool_size_l4': 8, 'heading_error_fc_hidden': 35}. Best is trial 70 with value: 0.1122.
[rank: 0] Seed set to 42
[rank: 0] Seed set to 42
GPU available: True (cuda), used: True
TPU available: False, using: 0 TPU cores
💡 Tip: For seamless cloud logging and experiment tracking, try installing [litlogger](https://pypi.org/project/litlogger/) to enable LitLogger, which logs metrics and artifacts automatically to the Lightning Experiments platform.
GPU available: True (cuda), used: True
TPU available: False, using: 0 TPU cores
💡 Tip: For seamless cloud logging and experiment tracking, try installing [litlogger](https://pypi.org/project/litlogger/) to enable LitLogger, which logs metrics and artifacts automatically to the Lightning Experiments platform.
[rank: 0] Seed set to 42
GPU available: True (cuda), used: True
TPU available: False, using: 0 TPU cores
💡 Tip: For seamless cloud logging and experiment tracking, try installing [litlogger](https://pypi.org/project/litlogger/) to enable LitLogger, which logs metrics and artifacts automatically to the Lightning Experiments platform.
LOCAL_RANK: 0 - CUDA_VISIBLE_DEVICES: [0]
LOCAL_RANK: 0 - CUDA_VISIBLE_DEVICES: [0]
LOCAL_RANK: 0 - CUDA_VISIBLE_DEVICES: [0]
SLURM auto-requeueing enabled. Setting signal handlers.
SLURM auto-requeueing enabled. Setting signal handlers.
SLURM auto-requeueing enabled. Setting signal handlers.
`Trainer.fit` stopped: `max_epochs=30` reached.
`Trainer.fit` stopped: `max_epochs=30` reached.
`Trainer.fit` stopped: `max_epochs=30` reached.
[I 2026-04-16 00:59:06,330] Trial 86 finished with value: 0.1156 and parameters: {'left_wall_dist_num_layers': 5, 'left_wall_dist_activation': 'relu', 'left_wall_dist_out_channels_l0': 147, 'left_wall_dist_pool_size_l0': 8, 'left_wall_dist_out_channels_l1': 123, 'left_wall_dist_pool_size_l1': 4, 'left_wall_dist_out_channels_l2': 210, 'left_wall_dist_pool_size_l2': 4, 'left_wall_dist_out_channels_l3': 148, 'left_wall_dist_pool_size_l3': 4, 'left_wall_dist_fc_hidden': 35, 'track_width_num_layers': 4, 'track_width_activation': 'elu', 'track_width_out_channels_l0': 192, 'track_width_pool_size_l0': 8, 'track_width_out_channels_l1': 209, 'track_width_pool_size_l1': 8, 'track_width_out_channels_l2': 73, 'track_width_pool_size_l2': 2, 'track_width_out_channels_l3': 44, 'track_width_pool_size_l3': 2, 'track_width_fc_hidden': 35, 'heading_error_num_layers': 5, 'heading_error_activation': 'elu', 'heading_error_out_channels_l0': 188, 'heading_error_pool_size_l0': 2, 'heading_error_out_channels_l1': 104, 'heading_error_pool_size_l1': 2, 'heading_error_out_channels_l2': 245, 'heading_error_pool_size_l2': 4, 'heading_error_out_channels_l3': 136, 'heading_error_pool_size_l3': 4, 'heading_error_out_channels_l4': 199, 'heading_error_pool_size_l4': 4, 'heading_error_fc_hidden': 70}. Best is trial 70 with value: 0.1122.
[rank: 0] Seed set to 42
[rank: 0] Seed set to 42
[rank: 0] Seed set to 42
GPU available: True (cuda), used: True
TPU available: False, using: 0 TPU cores
GPU available: True (cuda), used: True
TPU available: False, using: 0 TPU cores
💡 Tip: For seamless cloud logging and experiment tracking, try installing [litlogger](https://pypi.org/project/litlogger/) to enable LitLogger, which logs metrics and artifacts automatically to the Lightning Experiments platform.
💡 Tip: For seamless cloud logging and experiment tracking, try installing [litlogger](https://pypi.org/project/litlogger/) to enable LitLogger, which logs metrics and artifacts automatically to the Lightning Experiments platform.
GPU available: True (cuda), used: True
TPU available: False, using: 0 TPU cores
💡 Tip: For seamless cloud logging and experiment tracking, try installing [litlogger](https://pypi.org/project/litlogger/) to enable LitLogger, which logs metrics and artifacts automatically to the Lightning Experiments platform.
LOCAL_RANK: 0 - CUDA_VISIBLE_DEVICES: [0]
LOCAL_RANK: 0 - CUDA_VISIBLE_DEVICES: [0]
LOCAL_RANK: 0 - CUDA_VISIBLE_DEVICES: [0]
SLURM auto-requeueing enabled. Setting signal handlers.
SLURM auto-requeueing enabled. Setting signal handlers.
SLURM auto-requeueing enabled. Setting signal handlers.
`Trainer.fit` stopped: `max_epochs=30` reached.
`Trainer.fit` stopped: `max_epochs=30` reached.
`Trainer.fit` stopped: `max_epochs=30` reached.
[I 2026-04-16 01:02:08,749] Trial 87 finished with value: 0.14 and parameters: {'left_wall_dist_num_layers': 5, 'left_wall_dist_activation': 'relu', 'left_wall_dist_out_channels_l0': 151, 'left_wall_dist_pool_size_l0': 8, 'left_wall_dist_out_channels_l1': 121, 'left_wall_dist_pool_size_l1': 4, 'left_wall_dist_out_channels_l2': 216, 'left_wall_dist_pool_size_l2': 4, 'left_wall_dist_out_channels_l3': 148, 'left_wall_dist_pool_size_l3': 4, 'left_wall_dist_fc_hidden': 35, 'track_width_num_layers': 4, 'track_width_activation': 'elu', 'track_width_out_channels_l0': 193, 'track_width_pool_size_l0': 8, 'track_width_out_channels_l1': 164, 'track_width_pool_size_l1': 8, 'track_width_out_channels_l2': 74, 'track_width_pool_size_l2': 2, 'track_width_out_channels_l3': 40, 'track_width_pool_size_l3': 2, 'track_width_fc_hidden': 36, 'heading_error_num_layers': 4, 'heading_error_activation': 'elu', 'heading_error_out_channels_l0': 218, 'heading_error_pool_size_l0': 8, 'heading_error_out_channels_l1': 135, 'heading_error_pool_size_l1': 2, 'heading_error_out_channels_l2': 238, 'heading_error_pool_size_l2': 8, 'heading_error_out_channels_l3': 126, 'heading_error_pool_size_l3': 4, 'heading_error_fc_hidden': 51}. Best is trial 70 with value: 0.1122.
[rank: 0] Seed set to 42
[rank: 0] Seed set to 42
[rank: 0] Seed set to 42
GPU available: True (cuda), used: True
TPU available: False, using: 0 TPU cores
GPU available: True (cuda), used: True
TPU available: False, using: 0 TPU cores
💡 Tip: For seamless cloud logging and experiment tracking, try installing [litlogger](https://pypi.org/project/litlogger/) to enable LitLogger, which logs metrics and artifacts automatically to the Lightning Experiments platform.
💡 Tip: For seamless cloud logging and experiment tracking, try installing [litlogger](https://pypi.org/project/litlogger/) to enable LitLogger, which logs metrics and artifacts automatically to the Lightning Experiments platform.
GPU available: True (cuda), used: True
TPU available: False, using: 0 TPU cores
💡 Tip: For seamless cloud logging and experiment tracking, try installing [litlogger](https://pypi.org/project/litlogger/) to enable LitLogger, which logs metrics and artifacts automatically to the Lightning Experiments platform.
LOCAL_RANK: 0 - CUDA_VISIBLE_DEVICES: [0]
LOCAL_RANK: 0 - CUDA_VISIBLE_DEVICES: [0]
LOCAL_RANK: 0 - CUDA_VISIBLE_DEVICES: [0]
SLURM auto-requeueing enabled. Setting signal handlers.
SLURM auto-requeueing enabled. Setting signal handlers.
SLURM auto-requeueing enabled. Setting signal handlers.
`Trainer.fit` stopped: `max_epochs=30` reached.
`Trainer.fit` stopped: `max_epochs=30` reached.
`Trainer.fit` stopped: `max_epochs=30` reached.
