[I 2026-04-15 01:50:33,831] Trial 113 finished with value: 0.0964 and parameters: {'left_wall_dist_num_layers': 2, 'left_wall_dist_activation': 'relu', 'left_wall_dist_out_channels_l0': 42, 'left_wall_dist_pool_size_l0': 4, 'left_wall_dist_out_channels_l1': 41, 'left_wall_dist_pool_size_l1': 4, 'left_wall_dist_fc_hidden': 93, 'track_width_num_layers': 4, 'track_width_activation': 'relu', 'track_width_out_channels_l0': 94, 'track_width_pool_size_l0': 4, 'track_width_out_channels_l1': 37, 'track_width_pool_size_l1': 2, 'track_width_out_channels_l2': 73, 'track_width_pool_size_l2': 2, 'track_width_out_channels_l3': 162, 'track_width_pool_size_l3': 8, 'track_width_fc_hidden': 124, 'heading_error_num_layers': 3, 'heading_error_activation': 'elu', 'heading_error_out_channels_l0': 113, 'heading_error_pool_size_l0': 4, 'heading_error_out_channels_l1': 55, 'heading_error_pool_size_l1': 8, 'heading_error_out_channels_l2': 76, 'heading_error_pool_size_l2': 4, 'heading_error_fc_hidden': 35}. Best is trial 26 with value: 0.0907.
[rank: 0] Seed set to 42
[rank: 0] Seed set to 42
[rank: 0] Seed set to 42
GPU available: True (cuda), used: True
TPU available: False, using: 0 TPU cores
💡 Tip: For seamless cloud logging and experiment tracking, try installing [litlogger](https://pypi.org/project/litlogger/) to enable LitLogger, which logs metrics and artifacts automatically to the Lightning Experiments platform.
GPU available: True (cuda), used: True
TPU available: False, using: 0 TPU cores
💡 Tip: For seamless cloud logging and experiment tracking, try installing [litlogger](https://pypi.org/project/litlogger/) to enable LitLogger, which logs metrics and artifacts automatically to the Lightning Experiments platform.
GPU available: True (cuda), used: True
TPU available: False, using: 0 TPU cores
💡 Tip: For seamless cloud logging and experiment tracking, try installing [litlogger](https://pypi.org/project/litlogger/) to enable LitLogger, which logs metrics and artifacts automatically to the Lightning Experiments platform.
LOCAL_RANK: 0 - CUDA_VISIBLE_DEVICES: [0]
LOCAL_RANK: 0 - CUDA_VISIBLE_DEVICES: [0]
LOCAL_RANK: 0 - CUDA_VISIBLE_DEVICES: [0]
SLURM auto-requeueing enabled. Setting signal handlers.
SLURM auto-requeueing enabled. Setting signal handlers.
SLURM auto-requeueing enabled. Setting signal handlers.
`Trainer.fit` stopped: `max_epochs=30` reached.
`Trainer.fit` stopped: `max_epochs=30` reached.
`Trainer.fit` stopped: `max_epochs=30` reached.
[I 2026-04-15 01:53:12,692] Trial 114 finished with value: 0.093 and parameters: {'left_wall_dist_num_layers': 2, 'left_wall_dist_activation': 'relu', 'left_wall_dist_out_channels_l0': 66, 'left_wall_dist_pool_size_l0': 4, 'left_wall_dist_out_channels_l1': 76, 'left_wall_dist_pool_size_l1': 4, 'left_wall_dist_fc_hidden': 107, 'track_width_num_layers': 4, 'track_width_activation': 'relu', 'track_width_out_channels_l0': 77, 'track_width_pool_size_l0': 4, 'track_width_out_channels_l1': 40, 'track_width_pool_size_l1': 2, 'track_width_out_channels_l2': 143, 'track_width_pool_size_l2': 2, 'track_width_out_channels_l3': 184, 'track_width_pool_size_l3': 8, 'track_width_fc_hidden': 114, 'heading_error_num_layers': 3, 'heading_error_activation': 'elu', 'heading_error_out_channels_l0': 107, 'heading_error_pool_size_l0': 4, 'heading_error_out_channels_l1': 50, 'heading_error_pool_size_l1': 8, 'heading_error_out_channels_l2': 59, 'heading_error_pool_size_l2': 4, 'heading_error_fc_hidden': 47}. Best is trial 26 with value: 0.0907.
[rank: 0] Seed set to 42
[rank: 0] Seed set to 42
[rank: 0] Seed set to 42
GPU available: True (cuda), used: True
GPU available: True (cuda), used: True
TPU available: False, using: 0 TPU cores
TPU available: False, using: 0 TPU cores
💡 Tip: For seamless cloud logging and experiment tracking, try installing [litlogger](https://pypi.org/project/litlogger/) to enable LitLogger, which logs metrics and artifacts automatically to the Lightning Experiments platform.
💡 Tip: For seamless cloud logging and experiment tracking, try installing [litlogger](https://pypi.org/project/litlogger/) to enable LitLogger, which logs metrics and artifacts automatically to the Lightning Experiments platform.
GPU available: True (cuda), used: True
TPU available: False, using: 0 TPU cores
💡 Tip: For seamless cloud logging and experiment tracking, try installing [litlogger](https://pypi.org/project/litlogger/) to enable LitLogger, which logs metrics and artifacts automatically to the Lightning Experiments platform.
LOCAL_RANK: 0 - CUDA_VISIBLE_DEVICES: [0]
LOCAL_RANK: 0 - CUDA_VISIBLE_DEVICES: [0]
LOCAL_RANK: 0 - CUDA_VISIBLE_DEVICES: [0]
SLURM auto-requeueing enabled. Setting signal handlers.
SLURM auto-requeueing enabled. Setting signal handlers.
SLURM auto-requeueing enabled. Setting signal handlers.
`Trainer.fit` stopped: `max_epochs=30` reached.
`Trainer.fit` stopped: `max_epochs=30` reached.
`Trainer.fit` stopped: `max_epochs=30` reached.
[I 2026-04-15 01:55:52,529] Trial 115 finished with value: 0.0973 and parameters: {'left_wall_dist_num_layers': 2, 'left_wall_dist_activation': 'relu', 'left_wall_dist_out_channels_l0': 66, 'left_wall_dist_pool_size_l0': 4, 'left_wall_dist_out_channels_l1': 76, 'left_wall_dist_pool_size_l1': 4, 'left_wall_dist_fc_hidden': 107, 'track_width_num_layers': 4, 'track_width_activation': 'relu', 'track_width_out_channels_l0': 76, 'track_width_pool_size_l0': 4, 'track_width_out_channels_l1': 34, 'track_width_pool_size_l1': 2, 'track_width_out_channels_l2': 140, 'track_width_pool_size_l2': 2, 'track_width_out_channels_l3': 155, 'track_width_pool_size_l3': 8, 'track_width_fc_hidden': 106, 'heading_error_num_layers': 3, 'heading_error_activation': 'elu', 'heading_error_out_channels_l0': 131, 'heading_error_pool_size_l0': 4, 'heading_error_out_channels_l1': 48, 'heading_error_pool_size_l1': 8, 'heading_error_out_channels_l2': 60, 'heading_error_pool_size_l2': 4, 'heading_error_fc_hidden': 43}. Best is trial 26 with value: 0.0907.
[rank: 0] Seed set to 42
[rank: 0] Seed set to 42
[rank: 0] Seed set to 42
GPU available: True (cuda), used: True
TPU available: False, using: 0 TPU cores
💡 Tip: For seamless cloud logging and experiment tracking, try installing [litlogger](https://pypi.org/project/litlogger/) to enable LitLogger, which logs metrics and artifacts automatically to the Lightning Experiments platform.
GPU available: True (cuda), used: True
TPU available: False, using: 0 TPU cores
GPU available: True (cuda), used: True
TPU available: False, using: 0 TPU cores
💡 Tip: For seamless cloud logging and experiment tracking, try installing [litlogger](https://pypi.org/project/litlogger/) to enable LitLogger, which logs metrics and artifacts automatically to the Lightning Experiments platform.
💡 Tip: For seamless cloud logging and experiment tracking, try installing [litlogger](https://pypi.org/project/litlogger/) to enable LitLogger, which logs metrics and artifacts automatically to the Lightning Experiments platform.
LOCAL_RANK: 0 - CUDA_VISIBLE_DEVICES: [0]
LOCAL_RANK: 0 - CUDA_VISIBLE_DEVICES: [0]
LOCAL_RANK: 0 - CUDA_VISIBLE_DEVICES: [0]
SLURM auto-requeueing enabled. Setting signal handlers.
SLURM auto-requeueing enabled. Setting signal handlers.
SLURM auto-requeueing enabled. Setting signal handlers.
`Trainer.fit` stopped: `max_epochs=30` reached.
`Trainer.fit` stopped: `max_epochs=30` reached.
`Trainer.fit` stopped: `max_epochs=30` reached.
[I 2026-04-15 01:58:33,847] Trial 116 finished with value: 0.0999 and parameters: {'left_wall_dist_num_layers': 2, 'left_wall_dist_activation': 'relu', 'left_wall_dist_out_channels_l0': 74, 'left_wall_dist_pool_size_l0': 4, 'left_wall_dist_out_channels_l1': 83, 'left_wall_dist_pool_size_l1': 8, 'left_wall_dist_fc_hidden': 114, 'track_width_num_layers': 4, 'track_width_activation': 'relu', 'track_width_out_channels_l0': 70, 'track_width_pool_size_l0': 4, 'track_width_out_channels_l1': 40, 'track_width_pool_size_l1': 2, 'track_width_out_channels_l2': 157, 'track_width_pool_size_l2': 2, 'track_width_out_channels_l3': 183, 'track_width_pool_size_l3': 4, 'track_width_fc_hidden': 124, 'heading_error_num_layers': 3, 'heading_error_activation': 'elu', 'heading_error_out_channels_l0': 96, 'heading_error_pool_size_l0': 4, 'heading_error_out_channels_l1': 51, 'heading_error_pool_size_l1': 8, 'heading_error_out_channels_l2': 63, 'heading_error_pool_size_l2': 4, 'heading_error_fc_hidden': 45}. Best is trial 26 with value: 0.0907.
[rank: 0] Seed set to 42
[rank: 0] Seed set to 42
[rank: 0] Seed set to 42
GPU available: True (cuda), used: True
TPU available: False, using: 0 TPU cores
💡 Tip: For seamless cloud logging and experiment tracking, try installing [litlogger](https://pypi.org/project/litlogger/) to enable LitLogger, which logs metrics and artifacts automatically to the Lightning Experiments platform.
GPU available: True (cuda), used: True
TPU available: False, using: 0 TPU cores
💡 Tip: For seamless cloud logging and experiment tracking, try installing [litlogger](https://pypi.org/project/litlogger/) to enable LitLogger, which logs metrics and artifacts automatically to the Lightning Experiments platform.
GPU available: True (cuda), used: True
TPU available: False, using: 0 TPU cores
💡 Tip: For seamless cloud logging and experiment tracking, try installing [litlogger](https://pypi.org/project/litlogger/) to enable LitLogger, which logs metrics and artifacts automatically to the Lightning Experiments platform.
LOCAL_RANK: 0 - CUDA_VISIBLE_DEVICES: [0]
LOCAL_RANK: 0 - CUDA_VISIBLE_DEVICES: [0]
LOCAL_RANK: 0 - CUDA_VISIBLE_DEVICES: [0]
SLURM auto-requeueing enabled. Setting signal handlers.
SLURM auto-requeueing enabled. Setting signal handlers.
SLURM auto-requeueing enabled. Setting signal handlers.
`Trainer.fit` stopped: `max_epochs=30` reached.
`Trainer.fit` stopped: `max_epochs=30` reached.
`Trainer.fit` stopped: `max_epochs=30` reached.
[I 2026-04-15 02:01:22,681] Trial 117 finished with value: 0.1004 and parameters: {'left_wall_dist_num_layers': 2, 'left_wall_dist_activation': 'relu', 'left_wall_dist_out_channels_l0': 70, 'left_wall_dist_pool_size_l0': 4, 'left_wall_dist_out_channels_l1': 69, 'left_wall_dist_pool_size_l1': 4, 'left_wall_dist_fc_hidden': 96, 'track_width_num_layers': 4, 'track_width_activation': 'relu', 'track_width_out_channels_l0': 84, 'track_width_pool_size_l0': 4, 'track_width_out_channels_l1': 38, 'track_width_pool_size_l1': 2, 'track_width_out_channels_l2': 95, 'track_width_pool_size_l2': 2, 'track_width_out_channels_l3': 199, 'track_width_pool_size_l3': 8, 'track_width_fc_hidden': 71, 'heading_error_num_layers': 3, 'heading_error_activation': 'elu', 'heading_error_out_channels_l0': 99, 'heading_error_pool_size_l0': 4, 'heading_error_out_channels_l1': 37, 'heading_error_pool_size_l1': 8, 'heading_error_out_channels_l2': 55, 'heading_error_pool_size_l2': 4, 'heading_error_fc_hidden': 48}. Best is trial 26 with value: 0.0907.
[rank: 0] Seed set to 42
[rank: 0] Seed set to 42
[rank: 0] Seed set to 42
GPU available: True (cuda), used: True
TPU available: False, using: 0 TPU cores
💡 Tip: For seamless cloud logging and experiment tracking, try installing [litlogger](https://pypi.org/project/litlogger/) to enable LitLogger, which logs metrics and artifacts automatically to the Lightning Experiments platform.
GPU available: True (cuda), used: True
TPU available: False, using: 0 TPU cores
💡 Tip: For seamless cloud logging and experiment tracking, try installing [litlogger](https://pypi.org/project/litlogger/) to enable LitLogger, which logs metrics and artifacts automatically to the Lightning Experiments platform.
GPU available: True (cuda), used: True
TPU available: False, using: 0 TPU cores
💡 Tip: For seamless cloud logging and experiment tracking, try installing [litlogger](https://pypi.org/project/litlogger/) to enable LitLogger, which logs metrics and artifacts automatically to the Lightning Experiments platform.
LOCAL_RANK: 0 - CUDA_VISIBLE_DEVICES: [0]
LOCAL_RANK: 0 - CUDA_VISIBLE_DEVICES: [0]
LOCAL_RANK: 0 - CUDA_VISIBLE_DEVICES: [0]
SLURM auto-requeueing enabled. Setting signal handlers.
SLURM auto-requeueing enabled. Setting signal handlers.
SLURM auto-requeueing enabled. Setting signal handlers.
`Trainer.fit` stopped: `max_epochs=30` reached.
`Trainer.fit` stopped: `max_epochs=30` reached.
`Trainer.fit` stopped: `max_epochs=30` reached.
[I 2026-04-15 02:04:03,533] Trial 118 finished with value: 0.1197 and parameters: {'left_wall_dist_num_layers': 2, 'left_wall_dist_activation': 'elu', 'left_wall_dist_out_channels_l0': 47, 'left_wall_dist_pool_size_l0': 8, 'left_wall_dist_out_channels_l1': 100, 'left_wall_dist_pool_size_l1': 4, 'left_wall_dist_fc_hidden': 99, 'track_width_num_layers': 4, 'track_width_activation': 'elu', 'track_width_out_channels_l0': 64, 'track_width_pool_size_l0': 8, 'track_width_out_channels_l1': 44, 'track_width_pool_size_l1': 2, 'track_width_out_channels_l2': 170, 'track_width_pool_size_l2': 2, 'track_width_out_channels_l3': 110, 'track_width_pool_size_l3': 8, 'track_width_fc_hidden': 81, 'heading_error_num_layers': 3, 'heading_error_activation': 'elu', 'heading_error_out_channels_l0': 124, 'heading_error_pool_size_l0': 4, 'heading_error_out_channels_l1': 256, 'heading_error_pool_size_l1': 8, 'heading_error_out_channels_l2': 58, 'heading_error_pool_size_l2': 4, 'heading_error_fc_hidden': 40}. Best is trial 26 with value: 0.0907.
[rank: 0] Seed set to 42
[rank: 0] Seed set to 42
[rank: 0] Seed set to 42
GPU available: True (cuda), used: True
TPU available: False, using: 0 TPU cores
💡 Tip: For seamless cloud logging and experiment tracking, try installing [litlogger](https://pypi.org/project/litlogger/) to enable LitLogger, which logs metrics and artifacts automatically to the Lightning Experiments platform.
GPU available: True (cuda), used: True
TPU available: False, using: 0 TPU cores
💡 Tip: For seamless cloud logging and experiment tracking, try installing [litlogger](https://pypi.org/project/litlogger/) to enable LitLogger, which logs metrics and artifacts automatically to the Lightning Experiments platform.
GPU available: True (cuda), used: True
TPU available: False, using: 0 TPU cores
💡 Tip: For seamless cloud logging and experiment tracking, try installing [litlogger](https://pypi.org/project/litlogger/) to enable LitLogger, which logs metrics and artifacts automatically to the Lightning Experiments platform.
LOCAL_RANK: 0 - CUDA_VISIBLE_DEVICES: [0]
LOCAL_RANK: 0 - CUDA_VISIBLE_DEVICES: [0]
LOCAL_RANK: 0 - CUDA_VISIBLE_DEVICES: [0]
SLURM auto-requeueing enabled. Setting signal handlers.
SLURM auto-requeueing enabled. Setting signal handlers.
SLURM auto-requeueing enabled. Setting signal handlers.
`Trainer.fit` stopped: `max_epochs=30` reached.
`Trainer.fit` stopped: `max_epochs=30` reached.
`Trainer.fit` stopped: `max_epochs=30` reached.
[I 2026-04-15 02:06:55,376] Trial 119 finished with value: 0.1199 and parameters: {'left_wall_dist_num_layers': 2, 'left_wall_dist_activation': 'relu', 'left_wall_dist_out_channels_l0': 86, 'left_wall_dist_pool_size_l0': 4, 'left_wall_dist_out_channels_l1': 81, 'left_wall_dist_pool_size_l1': 4, 'left_wall_dist_fc_hidden': 106, 'track_width_num_layers': 4, 'track_width_activation': 'relu', 'track_width_out_channels_l0': 73, 'track_width_pool_size_l0': 4, 'track_width_out_channels_l1': 32, 'track_width_pool_size_l1': 2, 'track_width_out_channels_l2': 182, 'track_width_pool_size_l2': 2, 'track_width_out_channels_l3': 147, 'track_width_pool_size_l3': 4, 'track_width_fc_hidden': 114, 'heading_error_num_layers': 3, 'heading_error_activation': 'elu', 'heading_error_out_channels_l0': 115, 'heading_error_pool_size_l0': 8, 'heading_error_out_channels_l1': 52, 'heading_error_pool_size_l1': 2, 'heading_error_out_channels_l2': 83, 'heading_error_pool_size_l2': 2, 'heading_error_fc_hidden': 43}. Best is trial 26 with value: 0.0907.
