[I 2026-04-15 01:31:19,758] Trial 111 finished with value: 0.1093 and parameters: {'left_wall_dist_num_layers': 2, 'left_wall_dist_activation': 'elu', 'left_wall_dist_out_channels_l0': 40, 'left_wall_dist_pool_size_l0': 4, 'left_wall_dist_out_channels_l1': 137, 'left_wall_dist_pool_size_l1': 8, 'left_wall_dist_fc_hidden': 128, 'track_width_num_layers': 2, 'track_width_activation': 'elu', 'track_width_out_channels_l0': 88, 'track_width_pool_size_l0': 4, 'track_width_out_channels_l1': 86, 'track_width_pool_size_l1': 8, 'track_width_fc_hidden': 46, 'heading_error_num_layers': 5, 'heading_error_activation': 'relu', 'heading_error_out_channels_l0': 71, 'heading_error_pool_size_l0': 4, 'heading_error_out_channels_l1': 120, 'heading_error_pool_size_l1': 4, 'heading_error_out_channels_l2': 78, 'heading_error_pool_size_l2': 2, 'heading_error_out_channels_l3': 65, 'heading_error_pool_size_l3': 2, 'heading_error_out_channels_l4': 61, 'heading_error_pool_size_l4': 4, 'heading_error_fc_hidden': 39}. Best is trial 96 with value: 0.0915.
[rank: 0] Seed set to 42
[rank: 0] Seed set to 42
[rank: 0] Seed set to 42
GPU available: True (cuda), used: True
TPU available: False, using: 0 TPU cores
💡 Tip: For seamless cloud logging and experiment tracking, try installing [litlogger](https://pypi.org/project/litlogger/) to enable LitLogger, which logs metrics and artifacts automatically to the Lightning Experiments platform.
GPU available: True (cuda), used: True
TPU available: False, using: 0 TPU cores
💡 Tip: For seamless cloud logging and experiment tracking, try installing [litlogger](https://pypi.org/project/litlogger/) to enable LitLogger, which logs metrics and artifacts automatically to the Lightning Experiments platform.
GPU available: True (cuda), used: True
TPU available: False, using: 0 TPU cores
💡 Tip: For seamless cloud logging and experiment tracking, try installing [litlogger](https://pypi.org/project/litlogger/) to enable LitLogger, which logs metrics and artifacts automatically to the Lightning Experiments platform.
LOCAL_RANK: 0 - CUDA_VISIBLE_DEVICES: [0]
LOCAL_RANK: 0 - CUDA_VISIBLE_DEVICES: [0]
LOCAL_RANK: 0 - CUDA_VISIBLE_DEVICES: [0]
SLURM auto-requeueing enabled. Setting signal handlers.
SLURM auto-requeueing enabled. Setting signal handlers.
SLURM auto-requeueing enabled. Setting signal handlers.
`Trainer.fit` stopped: `max_epochs=30` reached.
`Trainer.fit` stopped: `max_epochs=30` reached.
`Trainer.fit` stopped: `max_epochs=30` reached.
[I 2026-04-15 01:34:04,689] Trial 112 finished with value: 0.1116 and parameters: {'left_wall_dist_num_layers': 2, 'left_wall_dist_activation': 'elu', 'left_wall_dist_out_channels_l0': 44, 'left_wall_dist_pool_size_l0': 4, 'left_wall_dist_out_channels_l1': 103, 'left_wall_dist_pool_size_l1': 8, 'left_wall_dist_fc_hidden': 106, 'track_width_num_layers': 2, 'track_width_activation': 'elu', 'track_width_out_channels_l0': 33, 'track_width_pool_size_l0': 4, 'track_width_out_channels_l1': 64, 'track_width_pool_size_l1': 8, 'track_width_fc_hidden': 51, 'heading_error_num_layers': 5, 'heading_error_activation': 'relu', 'heading_error_out_channels_l0': 38, 'heading_error_pool_size_l0': 4, 'heading_error_out_channels_l1': 130, 'heading_error_pool_size_l1': 4, 'heading_error_out_channels_l2': 85, 'heading_error_pool_size_l2': 2, 'heading_error_out_channels_l3': 77, 'heading_error_pool_size_l3': 2, 'heading_error_out_channels_l4': 57, 'heading_error_pool_size_l4': 4, 'heading_error_fc_hidden': 40}. Best is trial 96 with value: 0.0915.
[rank: 0] Seed set to 42
[rank: 0] Seed set to 42
[rank: 0] Seed set to 42
GPU available: True (cuda), used: True
TPU available: False, using: 0 TPU cores
💡 Tip: For seamless cloud logging and experiment tracking, try installing [litlogger](https://pypi.org/project/litlogger/) to enable LitLogger, which logs metrics and artifacts automatically to the Lightning Experiments platform.
GPU available: True (cuda), used: True
TPU available: False, using: 0 TPU cores
💡 Tip: For seamless cloud logging and experiment tracking, try installing [litlogger](https://pypi.org/project/litlogger/) to enable LitLogger, which logs metrics and artifacts automatically to the Lightning Experiments platform.
GPU available: True (cuda), used: True
TPU available: False, using: 0 TPU cores
💡 Tip: For seamless cloud logging and experiment tracking, try installing [litlogger](https://pypi.org/project/litlogger/) to enable LitLogger, which logs metrics and artifacts automatically to the Lightning Experiments platform.
LOCAL_RANK: 0 - CUDA_VISIBLE_DEVICES: [0]
LOCAL_RANK: 0 - CUDA_VISIBLE_DEVICES: [0]
LOCAL_RANK: 0 - CUDA_VISIBLE_DEVICES: [0]
SLURM auto-requeueing enabled. Setting signal handlers.
SLURM auto-requeueing enabled. Setting signal handlers.
SLURM auto-requeueing enabled. Setting signal handlers.
`Trainer.fit` stopped: `max_epochs=30` reached.
`Trainer.fit` stopped: `max_epochs=30` reached.
`Trainer.fit` stopped: `max_epochs=30` reached.
[I 2026-04-15 01:36:53,142] Trial 113 finished with value: 0.1167 and parameters: {'left_wall_dist_num_layers': 2, 'left_wall_dist_activation': 'elu', 'left_wall_dist_out_channels_l0': 37, 'left_wall_dist_pool_size_l0': 4, 'left_wall_dist_out_channels_l1': 83, 'left_wall_dist_pool_size_l1': 4, 'left_wall_dist_fc_hidden': 100, 'track_width_num_layers': 2, 'track_width_activation': 'elu', 'track_width_out_channels_l0': 94, 'track_width_pool_size_l0': 4, 'track_width_out_channels_l1': 49, 'track_width_pool_size_l1': 8, 'track_width_fc_hidden': 45, 'heading_error_num_layers': 5, 'heading_error_activation': 'relu', 'heading_error_out_channels_l0': 86, 'heading_error_pool_size_l0': 4, 'heading_error_out_channels_l1': 91, 'heading_error_pool_size_l1': 4, 'heading_error_out_channels_l2': 88, 'heading_error_pool_size_l2': 2, 'heading_error_out_channels_l3': 75, 'heading_error_pool_size_l3': 2, 'heading_error_out_channels_l4': 51, 'heading_error_pool_size_l4': 2, 'heading_error_fc_hidden': 53}. Best is trial 96 with value: 0.0915.
[rank: 0] Seed set to 42
[rank: 0] Seed set to 42
[rank: 0] Seed set to 42
GPU available: True (cuda), used: True
TPU available: False, using: 0 TPU cores
💡 Tip: For seamless cloud logging and experiment tracking, try installing [litlogger](https://pypi.org/project/litlogger/) to enable LitLogger, which logs metrics and artifacts automatically to the Lightning Experiments platform.
GPU available: True (cuda), used: True
TPU available: False, using: 0 TPU cores
💡 Tip: For seamless cloud logging and experiment tracking, try installing [litlogger](https://pypi.org/project/litlogger/) to enable LitLogger, which logs metrics and artifacts automatically to the Lightning Experiments platform.
GPU available: True (cuda), used: True
TPU available: False, using: 0 TPU cores
💡 Tip: For seamless cloud logging and experiment tracking, try installing [litlogger](https://pypi.org/project/litlogger/) to enable LitLogger, which logs metrics and artifacts automatically to the Lightning Experiments platform.
LOCAL_RANK: 0 - CUDA_VISIBLE_DEVICES: [0]
LOCAL_RANK: 0 - CUDA_VISIBLE_DEVICES: [0]
LOCAL_RANK: 0 - CUDA_VISIBLE_DEVICES: [0]
SLURM auto-requeueing enabled. Setting signal handlers.
SLURM auto-requeueing enabled. Setting signal handlers.
SLURM auto-requeueing enabled. Setting signal handlers.
`Trainer.fit` stopped: `max_epochs=30` reached.
`Trainer.fit` stopped: `max_epochs=30` reached.
`Trainer.fit` stopped: `max_epochs=30` reached.
[I 2026-04-15 01:39:39,742] Trial 114 finished with value: 0.1023 and parameters: {'left_wall_dist_num_layers': 2, 'left_wall_dist_activation': 'elu', 'left_wall_dist_out_channels_l0': 41, 'left_wall_dist_pool_size_l0': 4, 'left_wall_dist_out_channels_l1': 130, 'left_wall_dist_pool_size_l1': 4, 'track_width_num_layers': 2, 'track_width_activation': 'elu', 'track_width_out_channels_l0': 89, 'track_width_pool_size_l0': 4, 'track_width_out_channels_l1': 45, 'track_width_pool_size_l1': 8, 'track_width_fc_hidden': 39, 'heading_error_num_layers': 5, 'heading_error_activation': 'relu', 'heading_error_out_channels_l0': 95, 'heading_error_pool_size_l0': 4, 'heading_error_out_channels_l1': 101, 'heading_error_pool_size_l1': 4, 'heading_error_out_channels_l2': 70, 'heading_error_pool_size_l2': 2, 'heading_error_out_channels_l3': 56, 'heading_error_pool_size_l3': 2, 'heading_error_out_channels_l4': 64, 'heading_error_pool_size_l4': 4, 'heading_error_fc_hidden': 42}. Best is trial 96 with value: 0.0915.
[rank: 0] Seed set to 42
[rank: 0] Seed set to 42
[rank: 0] Seed set to 42
GPU available: True (cuda), used: True
TPU available: False, using: 0 TPU cores
💡 Tip: For seamless cloud logging and experiment tracking, try installing [litlogger](https://pypi.org/project/litlogger/) to enable LitLogger, which logs metrics and artifacts automatically to the Lightning Experiments platform.
GPU available: True (cuda), used: True
TPU available: False, using: 0 TPU cores
GPU available: True (cuda), used: True
TPU available: False, using: 0 TPU cores
💡 Tip: For seamless cloud logging and experiment tracking, try installing [litlogger](https://pypi.org/project/litlogger/) to enable LitLogger, which logs metrics and artifacts automatically to the Lightning Experiments platform.
💡 Tip: For seamless cloud logging and experiment tracking, try installing [litlogger](https://pypi.org/project/litlogger/) to enable LitLogger, which logs metrics and artifacts automatically to the Lightning Experiments platform.
LOCAL_RANK: 0 - CUDA_VISIBLE_DEVICES: [0]
LOCAL_RANK: 0 - CUDA_VISIBLE_DEVICES: [0]
LOCAL_RANK: 0 - CUDA_VISIBLE_DEVICES: [0]
SLURM auto-requeueing enabled. Setting signal handlers.
SLURM auto-requeueing enabled. Setting signal handlers.
SLURM auto-requeueing enabled. Setting signal handlers.
`Trainer.fit` stopped: `max_epochs=30` reached.
`Trainer.fit` stopped: `max_epochs=30` reached.
`Trainer.fit` stopped: `max_epochs=30` reached.
[I 2026-04-15 01:42:24,803] Trial 115 finished with value: 0.1098 and parameters: {'left_wall_dist_num_layers': 2, 'left_wall_dist_activation': 'elu', 'left_wall_dist_out_channels_l0': 42, 'left_wall_dist_pool_size_l0': 4, 'left_wall_dist_out_channels_l1': 110, 'left_wall_dist_pool_size_l1': 4, 'left_wall_dist_fc_hidden': 122, 'track_width_num_layers': 2, 'track_width_activation': 'elu', 'track_width_out_channels_l0': 99, 'track_width_pool_size_l0': 4, 'track_width_out_channels_l1': 56, 'track_width_pool_size_l1': 8, 'track_width_fc_hidden': 38, 'heading_error_num_layers': 5, 'heading_error_activation': 'relu', 'heading_error_out_channels_l0': 80, 'heading_error_pool_size_l0': 4, 'heading_error_out_channels_l1': 109, 'heading_error_pool_size_l1': 4, 'heading_error_out_channels_l2': 65, 'heading_error_pool_size_l2': 2, 'heading_error_out_channels_l3': 57, 'heading_error_pool_size_l3': 2, 'heading_error_out_channels_l4': 47, 'heading_error_pool_size_l4': 4, 'heading_error_fc_hidden': 32}. Best is trial 96 with value: 0.0915.
[rank: 0] Seed set to 42
GPU available: True (cuda), used: True
TPU available: False, using: 0 TPU cores
💡 Tip: For seamless cloud logging and experiment tracking, try installing [litlogger](https://pypi.org/project/litlogger/) to enable LitLogger, which logs metrics and artifacts automatically to the Lightning Experiments platform.
[rank: 0] Seed set to 42
[rank: 0] Seed set to 42
GPU available: True (cuda), used: True
TPU available: False, using: 0 TPU cores
💡 Tip: For seamless cloud logging and experiment tracking, try installing [litlogger](https://pypi.org/project/litlogger/) to enable LitLogger, which logs metrics and artifacts automatically to the Lightning Experiments platform.
GPU available: True (cuda), used: True
TPU available: False, using: 0 TPU cores
💡 Tip: For seamless cloud logging and experiment tracking, try installing [litlogger](https://pypi.org/project/litlogger/) to enable LitLogger, which logs metrics and artifacts automatically to the Lightning Experiments platform.
LOCAL_RANK: 0 - CUDA_VISIBLE_DEVICES: [0]
LOCAL_RANK: 0 - CUDA_VISIBLE_DEVICES: [0]
LOCAL_RANK: 0 - CUDA_VISIBLE_DEVICES: [0]
SLURM auto-requeueing enabled. Setting signal handlers.
SLURM auto-requeueing enabled. Setting signal handlers.
SLURM auto-requeueing enabled. Setting signal handlers.
`Trainer.fit` stopped: `max_epochs=30` reached.
`Trainer.fit` stopped: `max_epochs=30` reached.
`Trainer.fit` stopped: `max_epochs=30` reached.
[I 2026-04-15 01:44:55,569] Trial 116 finished with value: 0.1301 and parameters: {'left_wall_dist_num_layers': 2, 'left_wall_dist_activation': 'elu', 'left_wall_dist_out_channels_l0': 52, 'left_wall_dist_pool_size_l0': 4, 'left_wall_dist_out_channels_l1': 119, 'left_wall_dist_pool_size_l1': 4, 'left_wall_dist_fc_hidden': 124, 'track_width_num_layers': 2, 'track_width_activation': 'elu', 'track_width_out_channels_l0': 84, 'track_width_pool_size_l0': 2, 'track_width_out_channels_l1': 37, 'track_width_pool_size_l1': 8, 'track_width_fc_hidden': 41, 'heading_error_num_layers': 2, 'heading_error_activation': 'relu', 'heading_error_out_channels_l0': 94, 'heading_error_pool_size_l0': 4, 'heading_error_out_channels_l1': 52, 'heading_error_pool_size_l1': 4, 'heading_error_fc_hidden': 54}. Best is trial 96 with value: 0.0915.
[rank: 0] Seed set to 42
[rank: 0] Seed set to 42
[rank: 0] Seed set to 42
GPU available: True (cuda), used: True
TPU available: False, using: 0 TPU cores
💡 Tip: For seamless cloud logging and experiment tracking, try installing [litlogger](https://pypi.org/project/litlogger/) to enable LitLogger, which logs metrics and artifacts automatically to the Lightning Experiments platform.
GPU available: True (cuda), used: True
TPU available: False, using: 0 TPU cores
💡 Tip: For seamless cloud logging and experiment tracking, try installing [litlogger](https://pypi.org/project/litlogger/) to enable LitLogger, which logs metrics and artifacts automatically to the Lightning Experiments platform.
GPU available: True (cuda), used: True
TPU available: False, using: 0 TPU cores
💡 Tip: For seamless cloud logging and experiment tracking, try installing [litlogger](https://pypi.org/project/litlogger/) to enable LitLogger, which logs metrics and artifacts automatically to the Lightning Experiments platform.
LOCAL_RANK: 0 - CUDA_VISIBLE_DEVICES: [0]
LOCAL_RANK: 0 - CUDA_VISIBLE_DEVICES: [0]
LOCAL_RANK: 0 - CUDA_VISIBLE_DEVICES: [0]
SLURM auto-requeueing enabled. Setting signal handlers.
SLURM auto-requeueing enabled. Setting signal handlers.
SLURM auto-requeueing enabled. Setting signal handlers.
`Trainer.fit` stopped: `max_epochs=30` reached.
`Trainer.fit` stopped: `max_epochs=30` reached.
`Trainer.fit` stopped: `max_epochs=30` reached.
[I 2026-04-15 01:47:44,429] Trial 117 finished with value: 0.1251 and parameters: {'left_wall_dist_num_layers': 2, 'left_wall_dist_activation': 'relu', 'left_wall_dist_out_channels_l0': 91, 'left_wall_dist_pool_size_l0': 4, 'left_wall_dist_out_channels_l1': 166, 'left_wall_dist_pool_size_l1': 4, 'track_width_num_layers': 2, 'track_width_activation': 'elu', 'track_width_out_channels_l0': 109, 'track_width_pool_size_l0': 4, 'track_width_out_channels_l1': 70, 'track_width_pool_size_l1': 8, 'track_width_fc_hidden': 45, 'heading_error_num_layers': 5, 'heading_error_activation': 'relu', 'heading_error_out_channels_l0': 58, 'heading_error_pool_size_l0': 4, 'heading_error_out_channels_l1': 102, 'heading_error_pool_size_l1': 4, 'heading_error_out_channels_l2': 104, 'heading_error_pool_size_l2': 2, 'heading_error_out_channels_l3': 49, 'heading_error_pool_size_l3': 2, 'heading_error_out_channels_l4': 68, 'heading_error_pool_size_l4': 4, 'heading_error_fc_hidden': 38}. Best is trial 96 with value: 0.0915.
[rank: 0] Seed set to 42
GPU available: True (cuda), used: True
TPU available: False, using: 0 TPU cores
💡 Tip: For seamless cloud logging and experiment tracking, try installing [litlogger](https://pypi.org/project/litlogger/) to enable LitLogger, which logs metrics and artifacts automatically to the Lightning Experiments platform.
[rank: 0] Seed set to 42
GPU available: True (cuda), used: True
TPU available: False, using: 0 TPU cores
💡 Tip: For seamless cloud logging and experiment tracking, try installing [litlogger](https://pypi.org/project/litlogger/) to enable LitLogger, which logs metrics and artifacts automatically to the Lightning Experiments platform.
[rank: 0] Seed set to 42
GPU available: True (cuda), used: True
TPU available: False, using: 0 TPU cores
💡 Tip: For seamless cloud logging and experiment tracking, try installing [litlogger](https://pypi.org/project/litlogger/) to enable LitLogger, which logs metrics and artifacts automatically to the Lightning Experiments platform.
LOCAL_RANK: 0 - CUDA_VISIBLE_DEVICES: [0]
SLURM auto-requeueing enabled. Setting signal handlers.
LOCAL_RANK: 0 - CUDA_VISIBLE_DEVICES: [0]
LOCAL_RANK: 0 - CUDA_VISIBLE_DEVICES: [0]
SLURM auto-requeueing enabled. Setting signal handlers.
SLURM auto-requeueing enabled. Setting signal handlers.
`Trainer.fit` stopped: `max_epochs=30` reached.
`Trainer.fit` stopped: `max_epochs=30` reached.
`Trainer.fit` stopped: `max_epochs=30` reached.
[I 2026-04-15 01:50:42,775] Trial 118 finished with value: 0.1789 and parameters: {'left_wall_dist_num_layers': 2, 'left_wall_dist_activation': 'elu', 'left_wall_dist_out_channels_l0': 65, 'left_wall_dist_pool_size_l0': 4, 'left_wall_dist_out_channels_l1': 91, 'left_wall_dist_pool_size_l1': 4, 'left_wall_dist_fc_hidden': 127, 'track_width_num_layers': 2, 'track_width_activation': 'elu', 'track_width_out_channels_l0': 90, 'track_width_pool_size_l0': 4, 'track_width_out_channels_l1': 48, 'track_width_pool_size_l1': 8, 'track_width_fc_hidden': 34, 'heading_error_num_layers': 5, 'heading_error_activation': 'relu', 'heading_error_out_channels_l0': 65, 'heading_error_pool_size_l0': 4, 'heading_error_out_channels_l1': 96, 'heading_error_pool_size_l1': 4, 'heading_error_out_channels_l2': 71, 'heading_error_pool_size_l2': 2, 'heading_error_out_channels_l3': 61, 'heading_error_pool_size_l3': 2, 'heading_error_out_channels_l4': 59, 'heading_error_pool_size_l4': 8}. Best is trial 96 with value: 0.0915.
[rank: 0] Seed set to 42
GPU available: True (cuda), used: True
TPU available: False, using: 0 TPU cores
💡 Tip: For seamless cloud logging and experiment tracking, try installing [litlogger](https://pypi.org/project/litlogger/) to enable LitLogger, which logs metrics and artifacts automatically to the Lightning Experiments platform.
[rank: 0] Seed set to 42
GPU available: True (cuda), used: True
TPU available: False, using: 0 TPU cores
💡 Tip: For seamless cloud logging and experiment tracking, try installing [litlogger](https://pypi.org/project/litlogger/) to enable LitLogger, which logs metrics and artifacts automatically to the Lightning Experiments platform.
[rank: 0] Seed set to 42
GPU available: True (cuda), used: True
TPU available: False, using: 0 TPU cores
💡 Tip: For seamless cloud logging and experiment tracking, try installing [litlogger](https://pypi.org/project/litlogger/) to enable LitLogger, which logs metrics and artifacts automatically to the Lightning Experiments platform.
LOCAL_RANK: 0 - CUDA_VISIBLE_DEVICES: [0]
SLURM auto-requeueing enabled. Setting signal handlers.
LOCAL_RANK: 0 - CUDA_VISIBLE_DEVICES: [0]
LOCAL_RANK: 0 - CUDA_VISIBLE_DEVICES: [0]
SLURM auto-requeueing enabled. Setting signal handlers.
SLURM auto-requeueing enabled. Setting signal handlers.
`Trainer.fit` stopped: `max_epochs=30` reached.
`Trainer.fit` stopped: `max_epochs=30` reached.
`Trainer.fit` stopped: `max_epochs=30` reached.
[I 2026-04-15 01:53:32,772] Trial 119 finished with value: 0.1146 and parameters: {'left_wall_dist_num_layers': 2, 'left_wall_dist_activation': 'elu', 'left_wall_dist_out_channels_l0': 84, 'left_wall_dist_pool_size_l0': 2, 'left_wall_dist_out_channels_l1': 54, 'left_wall_dist_pool_size_l1': 8, 'left_wall_dist_fc_hidden': 79, 'track_width_num_layers': 2, 'track_width_activation': 'relu', 'track_width_out_channels_l0': 81, 'track_width_pool_size_l0': 4, 'track_width_out_channels_l1': 42, 'track_width_pool_size_l1': 8, 'track_width_fc_hidden': 40, 'heading_error_num_layers': 5, 'heading_error_activation': 'relu', 'heading_error_out_channels_l0': 84, 'heading_error_pool_size_l0': 4, 'heading_error_out_channels_l1': 75, 'heading_error_pool_size_l1': 4, 'heading_error_out_channels_l2': 95, 'heading_error_pool_size_l2': 2, 'heading_error_out_channels_l3': 44, 'heading_error_pool_size_l3': 2, 'heading_error_out_channels_l4': 55, 'heading_error_pool_size_l4': 4, 'heading_error_fc_hidden': 40}. Best is trial 96 with value: 0.0915.
