[I 2026-04-12 16:14:10,792] Trial 83 finished with value: 0.1146 and parameters: {'left_wall_dist_num_layers': 3, 'left_wall_dist_activation': 'relu', 'left_wall_dist_out_channels_l0': 191, 'left_wall_dist_pool_size_l0': 8, 'left_wall_dist_out_channels_l1': 75, 'left_wall_dist_pool_size_l1': 2, 'left_wall_dist_out_channels_l2': 90, 'left_wall_dist_pool_size_l2': 2, 'left_wall_dist_fc_hidden': 52, 'track_width_num_layers': 4, 'track_width_activation': 'elu', 'track_width_out_channels_l0': 221, 'track_width_pool_size_l0': 8, 'track_width_out_channels_l1': 205, 'track_width_pool_size_l1': 4, 'track_width_out_channels_l2': 149, 'track_width_pool_size_l2': 2, 'track_width_out_channels_l3': 98, 'track_width_pool_size_l3': 2, 'track_width_fc_hidden': 62, 'heading_error_num_layers': 3, 'heading_error_activation': 'elu', 'heading_error_out_channels_l0': 217, 'heading_error_pool_size_l0': 8, 'heading_error_out_channels_l1': 69, 'heading_error_pool_size_l1': 4, 'heading_error_out_channels_l2': 41, 'heading_error_pool_size_l2': 2, 'heading_error_fc_hidden': 95}. Best is trial 31 with value: 0.0984.
[rank: 0] Seed set to 42
[rank: 0] Seed set to 42
[rank: 0] Seed set to 42
GPU available: True (cuda), used: True
TPU available: False, using: 0 TPU cores
💡 Tip: For seamless cloud logging and experiment tracking, try installing [litlogger](https://pypi.org/project/litlogger/) to enable LitLogger, which logs metrics and artifacts automatically to the Lightning Experiments platform.
GPU available: True (cuda), used: True
TPU available: False, using: 0 TPU cores
💡 Tip: For seamless cloud logging and experiment tracking, try installing [litlogger](https://pypi.org/project/litlogger/) to enable LitLogger, which logs metrics and artifacts automatically to the Lightning Experiments platform.
GPU available: True (cuda), used: True
TPU available: False, using: 0 TPU cores
💡 Tip: For seamless cloud logging and experiment tracking, try installing [litlogger](https://pypi.org/project/litlogger/) to enable LitLogger, which logs metrics and artifacts automatically to the Lightning Experiments platform.
LOCAL_RANK: 0 - CUDA_VISIBLE_DEVICES: [0]
LOCAL_RANK: 0 - CUDA_VISIBLE_DEVICES: [0]
LOCAL_RANK: 0 - CUDA_VISIBLE_DEVICES: [0]
SLURM auto-requeueing enabled. Setting signal handlers.
SLURM auto-requeueing enabled. Setting signal handlers.
SLURM auto-requeueing enabled. Setting signal handlers.
`Trainer.fit` stopped: `max_epochs=20` reached.
`Trainer.fit` stopped: `max_epochs=20` reached.
`Trainer.fit` stopped: `max_epochs=20` reached.
[I 2026-04-12 16:16:16,487] Trial 84 finished with value: 0.1118 and parameters: {'left_wall_dist_num_layers': 3, 'left_wall_dist_activation': 'relu', 'left_wall_dist_out_channels_l0': 234, 'left_wall_dist_pool_size_l0': 8, 'left_wall_dist_out_channels_l1': 73, 'left_wall_dist_pool_size_l1': 2, 'left_wall_dist_out_channels_l2': 97, 'left_wall_dist_pool_size_l2': 2, 'left_wall_dist_fc_hidden': 56, 'track_width_num_layers': 4, 'track_width_activation': 'elu', 'track_width_out_channels_l0': 154, 'track_width_pool_size_l0': 8, 'track_width_out_channels_l1': 210, 'track_width_pool_size_l1': 4, 'track_width_out_channels_l2': 125, 'track_width_pool_size_l2': 2, 'track_width_out_channels_l3': 35, 'track_width_pool_size_l3': 2, 'track_width_fc_hidden': 48, 'heading_error_num_layers': 3, 'heading_error_activation': 'elu', 'heading_error_out_channels_l0': 89, 'heading_error_pool_size_l0': 8, 'heading_error_out_channels_l1': 76, 'heading_error_pool_size_l1': 4, 'heading_error_out_channels_l2': 34, 'heading_error_pool_size_l2': 2, 'heading_error_fc_hidden': 107}. Best is trial 31 with value: 0.0984.
[rank: 0] Seed set to 42
[rank: 0] Seed set to 42
[rank: 0] Seed set to 42
GPU available: True (cuda), used: True
TPU available: False, using: 0 TPU cores
💡 Tip: For seamless cloud logging and experiment tracking, try installing [litlogger](https://pypi.org/project/litlogger/) to enable LitLogger, which logs metrics and artifacts automatically to the Lightning Experiments platform.
GPU available: True (cuda), used: True
TPU available: False, using: 0 TPU cores
GPU available: True (cuda), used: True
TPU available: False, using: 0 TPU cores
💡 Tip: For seamless cloud logging and experiment tracking, try installing [litlogger](https://pypi.org/project/litlogger/) to enable LitLogger, which logs metrics and artifacts automatically to the Lightning Experiments platform.
💡 Tip: For seamless cloud logging and experiment tracking, try installing [litlogger](https://pypi.org/project/litlogger/) to enable LitLogger, which logs metrics and artifacts automatically to the Lightning Experiments platform.
LOCAL_RANK: 0 - CUDA_VISIBLE_DEVICES: [0]
LOCAL_RANK: 0 - CUDA_VISIBLE_DEVICES: [0]
LOCAL_RANK: 0 - CUDA_VISIBLE_DEVICES: [0]
SLURM auto-requeueing enabled. Setting signal handlers.
SLURM auto-requeueing enabled. Setting signal handlers.
SLURM auto-requeueing enabled. Setting signal handlers.
`Trainer.fit` stopped: `max_epochs=20` reached.
`Trainer.fit` stopped: `max_epochs=20` reached.
`Trainer.fit` stopped: `max_epochs=20` reached.
[I 2026-04-12 16:18:23,367] Trial 85 finished with value: 0.1144 and parameters: {'left_wall_dist_num_layers': 3, 'left_wall_dist_activation': 'relu', 'left_wall_dist_out_channels_l0': 222, 'left_wall_dist_pool_size_l0': 8, 'left_wall_dist_out_channels_l1': 34, 'left_wall_dist_pool_size_l1': 2, 'left_wall_dist_out_channels_l2': 71, 'left_wall_dist_pool_size_l2': 2, 'left_wall_dist_fc_hidden': 46, 'track_width_num_layers': 4, 'track_width_activation': 'elu', 'track_width_out_channels_l0': 179, 'track_width_pool_size_l0': 4, 'track_width_out_channels_l1': 189, 'track_width_pool_size_l1': 4, 'track_width_out_channels_l2': 135, 'track_width_pool_size_l2': 8, 'track_width_out_channels_l3': 90, 'track_width_pool_size_l3': 2, 'track_width_fc_hidden': 55, 'heading_error_num_layers': 3, 'heading_error_activation': 'elu', 'heading_error_out_channels_l0': 161, 'heading_error_pool_size_l0': 8, 'heading_error_out_channels_l1': 62, 'heading_error_pool_size_l1': 8, 'heading_error_out_channels_l2': 38, 'heading_error_pool_size_l2': 2, 'heading_error_fc_hidden': 63}. Best is trial 31 with value: 0.0984.
[rank: 0] Seed set to 42
[rank: 0] Seed set to 42
[rank: 0] Seed set to 42
GPU available: True (cuda), used: True
TPU available: False, using: 0 TPU cores
💡 Tip: For seamless cloud logging and experiment tracking, try installing [litlogger](https://pypi.org/project/litlogger/) to enable LitLogger, which logs metrics and artifacts automatically to the Lightning Experiments platform.
GPU available: True (cuda), used: True
TPU available: False, using: 0 TPU cores
💡 Tip: For seamless cloud logging and experiment tracking, try installing [litlogger](https://pypi.org/project/litlogger/) to enable LitLogger, which logs metrics and artifacts automatically to the Lightning Experiments platform.
GPU available: True (cuda), used: True
TPU available: False, using: 0 TPU cores
💡 Tip: For seamless cloud logging and experiment tracking, try installing [litlogger](https://pypi.org/project/litlogger/) to enable LitLogger, which logs metrics and artifacts automatically to the Lightning Experiments platform.
LOCAL_RANK: 0 - CUDA_VISIBLE_DEVICES: [0]
LOCAL_RANK: 0 - CUDA_VISIBLE_DEVICES: [0]
LOCAL_RANK: 0 - CUDA_VISIBLE_DEVICES: [0]
SLURM auto-requeueing enabled. Setting signal handlers.
SLURM auto-requeueing enabled. Setting signal handlers.
SLURM auto-requeueing enabled. Setting signal handlers.
`Trainer.fit` stopped: `max_epochs=20` reached.
`Trainer.fit` stopped: `max_epochs=20` reached.
`Trainer.fit` stopped: `max_epochs=20` reached.
[I 2026-04-12 16:20:36,993] Trial 86 finished with value: 0.1386 and parameters: {'left_wall_dist_num_layers': 3, 'left_wall_dist_activation': 'relu', 'left_wall_dist_out_channels_l0': 181, 'left_wall_dist_pool_size_l0': 8, 'left_wall_dist_out_channels_l1': 51, 'left_wall_dist_pool_size_l1': 2, 'left_wall_dist_out_channels_l2': 255, 'left_wall_dist_pool_size_l2': 2, 'left_wall_dist_fc_hidden': 128, 'track_width_num_layers': 4, 'track_width_activation': 'elu', 'track_width_out_channels_l0': 209, 'track_width_pool_size_l0': 8, 'track_width_out_channels_l1': 201, 'track_width_pool_size_l1': 4, 'track_width_out_channels_l2': 256, 'track_width_pool_size_l2': 2, 'track_width_out_channels_l3': 128, 'track_width_pool_size_l3': 2, 'track_width_fc_hidden': 72, 'heading_error_num_layers': 3, 'heading_error_activation': 'elu', 'heading_error_out_channels_l0': 178, 'heading_error_pool_size_l0': 2, 'heading_error_out_channels_l1': 91, 'heading_error_pool_size_l1': 4, 'heading_error_out_channels_l2': 231, 'heading_error_pool_size_l2': 2}. Best is trial 31 with value: 0.0984.
[rank: 0] Seed set to 42
[rank: 0] Seed set to 42
[rank: 0] Seed set to 42
GPU available: True (cuda), used: True
TPU available: False, using: 0 TPU cores
💡 Tip: For seamless cloud logging and experiment tracking, try installing [litlogger](https://pypi.org/project/litlogger/) to enable LitLogger, which logs metrics and artifacts automatically to the Lightning Experiments platform.
GPU available: True (cuda), used: True
TPU available: False, using: 0 TPU cores
GPU available: True (cuda), used: True
TPU available: False, using: 0 TPU cores
💡 Tip: For seamless cloud logging and experiment tracking, try installing [litlogger](https://pypi.org/project/litlogger/) to enable LitLogger, which logs metrics and artifacts automatically to the Lightning Experiments platform.
💡 Tip: For seamless cloud logging and experiment tracking, try installing [litlogger](https://pypi.org/project/litlogger/) to enable LitLogger, which logs metrics and artifacts automatically to the Lightning Experiments platform.
LOCAL_RANK: 0 - CUDA_VISIBLE_DEVICES: [0]
LOCAL_RANK: 0 - CUDA_VISIBLE_DEVICES: [0]
LOCAL_RANK: 0 - CUDA_VISIBLE_DEVICES: [0]
SLURM auto-requeueing enabled. Setting signal handlers.
SLURM auto-requeueing enabled. Setting signal handlers.
SLURM auto-requeueing enabled. Setting signal handlers.
`Trainer.fit` stopped: `max_epochs=20` reached.
`Trainer.fit` stopped: `max_epochs=20` reached.
`Trainer.fit` stopped: `max_epochs=20` reached.
[I 2026-04-12 16:22:43,849] Trial 87 finished with value: 0.1215 and parameters: {'left_wall_dist_num_layers': 3, 'left_wall_dist_activation': 'relu', 'left_wall_dist_out_channels_l0': 215, 'left_wall_dist_pool_size_l0': 8, 'left_wall_dist_out_channels_l1': 195, 'left_wall_dist_pool_size_l1': 2, 'left_wall_dist_out_channels_l2': 81, 'left_wall_dist_pool_size_l2': 4, 'left_wall_dist_fc_hidden': 61, 'track_width_num_layers': 4, 'track_width_activation': 'elu', 'track_width_out_channels_l0': 166, 'track_width_pool_size_l0': 8, 'track_width_out_channels_l1': 243, 'track_width_pool_size_l1': 8, 'track_width_out_channels_l2': 112, 'track_width_pool_size_l2': 2, 'track_width_out_channels_l3': 143, 'track_width_pool_size_l3': 2, 'track_width_fc_hidden': 52, 'heading_error_num_layers': 3, 'heading_error_activation': 'relu', 'heading_error_out_channels_l0': 135, 'heading_error_pool_size_l0': 8, 'heading_error_out_channels_l1': 46, 'heading_error_pool_size_l1': 4, 'heading_error_out_channels_l2': 49, 'heading_error_pool_size_l2': 2, 'heading_error_fc_hidden': 113}. Best is trial 31 with value: 0.0984.
[rank: 0] Seed set to 42
[rank: 0] Seed set to 42
[rank: 0] Seed set to 42
GPU available: True (cuda), used: True
TPU available: False, using: 0 TPU cores
💡 Tip: For seamless cloud logging and experiment tracking, try installing [litlogger](https://pypi.org/project/litlogger/) to enable LitLogger, which logs metrics and artifacts automatically to the Lightning Experiments platform.
GPU available: True (cuda), used: True
TPU available: False, using: 0 TPU cores
GPU available: True (cuda), used: True
TPU available: False, using: 0 TPU cores
💡 Tip: For seamless cloud logging and experiment tracking, try installing [litlogger](https://pypi.org/project/litlogger/) to enable LitLogger, which logs metrics and artifacts automatically to the Lightning Experiments platform.
💡 Tip: For seamless cloud logging and experiment tracking, try installing [litlogger](https://pypi.org/project/litlogger/) to enable LitLogger, which logs metrics and artifacts automatically to the Lightning Experiments platform.
LOCAL_RANK: 0 - CUDA_VISIBLE_DEVICES: [0]
LOCAL_RANK: 0 - CUDA_VISIBLE_DEVICES: [0]
LOCAL_RANK: 0 - CUDA_VISIBLE_DEVICES: [0]
Traceback (most recent call last):
  File "/nas/longleaf/home/zayah/f1tenth_ng_zc/packages/f110_scripts/src/f110_scripts/train/train_nn.py", line 595, in <module>
    main()
  File "/nas/longleaf/home/zayah/f1tenth_ng_zc/packages/f110_scripts/src/f110_scripts/train/train_nn.py", line 591, in main
    run_single_training(config, aid)
  File "/nas/longleaf/home/zayah/f1tenth_ng_zc/packages/f110_scripts/src/f110_scripts/train/train_nn.py", line 564, in run_single_training
    trainer.fit(module, datamodule=dm, ckpt_path=ckpt_path)
  File "/nas/longleaf/home/zayah/f1tenth_ng_zc/.venv/lib/python3.12/site-packages/lightning/pytorch/trainer/trainer.py", line 584, in fit
    call._call_and_handle_interrupt(
  File "/nas/longleaf/home/zayah/f1tenth_ng_zc/.venv/lib/python3.12/site-packages/lightning/pytorch/trainer/call.py", line 49, in _call_and_handle_interrupt
    return trainer_fn(*args, **kwargs)
           ^^^^^^^^^^^^^^^^^^^^^^^^^^^
  File "/nas/longleaf/home/zayah/f1tenth_ng_zc/.venv/lib/python3.12/site-packages/lightning/pytorch/trainer/trainer.py", line 630, in _fit_impl
    self._run(model, ckpt_path=ckpt_path, weights_only=weights_only)
  File "/nas/longleaf/home/zayah/f1tenth_ng_zc/.venv/lib/python3.12/site-packages/lightning/pytorch/trainer/trainer.py", line 1057, in _run
    call._call_callback_hooks(self, "on_fit_start")
  File "/nas/longleaf/home/zayah/f1tenth_ng_zc/.venv/lib/python3.12/site-packages/lightning/pytorch/trainer/call.py", line 228, in _call_callback_hooks
    fn(trainer, trainer.lightning_module, *args, **kwargs)
  File "/nas/longleaf/home/zayah/f1tenth_ng_zc/.venv/lib/python3.12/site-packages/lightning/pytorch/callbacks/model_summary.py", line 64, in on_fit_start
    model_summary = self._summary(trainer, pl_module)
                    ^^^^^^^^^^^^^^^^^^^^^^^^^^^^^^^^^
  File "/nas/longleaf/home/zayah/f1tenth_ng_zc/.venv/lib/python3.12/site-packages/lightning/pytorch/callbacks/model_summary.py", line 90, in _summary
    return summarize(pl_module, max_depth=self._max_depth)
           ^^^^^^^^^^^^^^^^^^^^^^^^^^^^^^^^^^^^^^^^^^^^^^^
  File "/nas/longleaf/home/zayah/f1tenth_ng_zc/.venv/lib/python3.12/site-packages/lightning/pytorch/utilities/model_summary/model_summary.py", line 565, in summarize
    return ModelSummary(lightning_module, max_depth=max_depth)
           ^^^^^^^^^^^^^^^^^^^^^^^^^^^^^^^^^^^^^^^^^^^^^^^^^^^
  File "/nas/longleaf/home/zayah/f1tenth_ng_zc/.venv/lib/python3.12/site-packages/lightning/pytorch/utilities/model_summary/model_summary.py", line 228, in __init__
    self._layer_summary = self.summarize()
                          ^^^^^^^^^^^^^^^^
  File "/nas/longleaf/home/zayah/f1tenth_ng_zc/.venv/lib/python3.12/site-packages/lightning/pytorch/utilities/model_summary/model_summary.py", line 328, in summarize
    self._forward_example_input()
  File "/nas/longleaf/home/zayah/f1tenth_ng_zc/.venv/lib/python3.12/site-packages/lightning/pytorch/utilities/model_summary/model_summary.py", line 371, in _forward_example_input
    model(input_)
  File "/nas/longleaf/home/zayah/f1tenth_ng_zc/.venv/lib/python3.12/site-packages/torch/nn/modules/module.py", line 1779, in _wrapped_call_impl
    return self._call_impl(*args, **kwargs)
           ^^^^^^^^^^^^^^^^^^^^^^^^^^^^^^^^
  File "/nas/longleaf/home/zayah/f1tenth_ng_zc/.venv/lib/python3.12/site-packages/torch/nn/modules/module.py", line 1885, in _call_impl
    return inner()
           ^^^^^^^
  File "/nas/longleaf/home/zayah/f1tenth_ng_zc/.venv/lib/python3.12/site-packages/torch/nn/modules/module.py", line 1833, in inner
    result = forward_call(*args, **kwargs)
             ^^^^^^^^^^^^^^^^^^^^^^^^^^^^^
  File "/nas/longleaf/home/zayah/f1tenth_ng_zc/packages/f110_scripts/src/f110_scripts/train/train_nn.py", line 205, in forward
    return self.model(x_in)
           ^^^^^^^^^^^^^^^^
  File "/nas/longleaf/home/zayah/f1tenth_ng_zc/.venv/lib/python3.12/site-packages/torch/nn/modules/module.py", line 1779, in _wrapped_call_impl
    return self._call_impl(*args, **kwargs)
           ^^^^^^^^^^^^^^^^^^^^^^^^^^^^^^^^
  File "/nas/longleaf/home/zayah/f1tenth_ng_zc/.venv/lib/python3.12/site-packages/torch/nn/modules/module.py", line 1885, in _call_impl
    return inner()
           ^^^^^^^
  File "/nas/longleaf/home/zayah/f1tenth_ng_zc/.venv/lib/python3.12/site-packages/torch/nn/modules/module.py", line 1833, in inner
    result = forward_call(*args, **kwargs)
             ^^^^^^^^^^^^^^^^^^^^^^^^^^^^^
  File "/nas/longleaf/home/zayah/f1tenth_ng_zc/.venv/lib/python3.12/site-packages/torch/nn/modules/container.py", line 253, in forward
    input = module(input)
            ^^^^^^^^^^^^^
  File "/nas/longleaf/home/zayah/f1tenth_ng_zc/.venv/lib/python3.12/site-packages/torch/nn/modules/module.py", line 1779, in _wrapped_call_impl
    return self._call_impl(*args, **kwargs)
           ^^^^^^^^^^^^^^^^^^^^^^^^^^^^^^^^
  File "/nas/longleaf/home/zayah/f1tenth_ng_zc/.venv/lib/python3.12/site-packages/torch/nn/modules/module.py", line 1885, in _call_impl
    return inner()
           ^^^^^^^
  File "/nas/longleaf/home/zayah/f1tenth_ng_zc/.venv/lib/python3.12/site-packages/torch/nn/modules/module.py", line 1833, in inner
    result = forward_call(*args, **kwargs)
             ^^^^^^^^^^^^^^^^^^^^^^^^^^^^^
  File "/nas/longleaf/home/zayah/f1tenth_ng_zc/.venv/lib/python3.12/site-packages/torch/nn/modules/pooling.py", line 144, in forward
    return F.max_pool1d(
           ^^^^^^^^^^^^^
  File "/nas/longleaf/home/zayah/f1tenth_ng_zc/.venv/lib/python3.12/site-packages/torch/_jit_internal.py", line 636, in fn
    return if_false(*args, **kwargs)
           ^^^^^^^^^^^^^^^^^^^^^^^^^
  File "/nas/longleaf/home/zayah/f1tenth_ng_zc/.venv/lib/python3.12/site-packages/torch/nn/functional.py", line 745, in _max_pool1d
    return torch.max_pool1d(input, kernel_size, stride, padding, dilation, ceil_mode)
           ^^^^^^^^^^^^^^^^^^^^^^^^^^^^^^^^^^^^^^^^^^^^^^^^^^^^^^^^^^^^^^^^^^^^^^^^^^
RuntimeError: max_pool1d() Invalid computed output size: 0
SLURM auto-requeueing enabled. Setting signal handlers.
SLURM auto-requeueing enabled. Setting signal handlers.
`Trainer.fit` stopped: `max_epochs=20` reached.
`Trainer.fit` stopped: `max_epochs=20` reached.
[I 2026-04-12 16:23:28,969] Trial 88 finished with value: inf and parameters: {'left_wall_dist_num_layers': 5, 'left_wall_dist_activation': 'relu', 'left_wall_dist_out_channels_l0': 169, 'left_wall_dist_pool_size_l0': 8, 'left_wall_dist_out_channels_l1': 32, 'left_wall_dist_pool_size_l1': 2, 'left_wall_dist_out_channels_l2': 108, 'left_wall_dist_pool_size_l2': 8, 'left_wall_dist_out_channels_l3': 72, 'left_wall_dist_pool_size_l3': 8, 'track_width_num_layers': 4, 'track_width_activation': 'elu', 'track_width_out_channels_l0': 230, 'track_width_pool_size_l0': 8, 'track_width_out_channels_l1': 97, 'track_width_pool_size_l1': 4, 'track_width_out_channels_l2': 164, 'track_width_pool_size_l2': 2, 'track_width_out_channels_l3': 118, 'track_width_pool_size_l3': 2, 'track_width_fc_hidden': 80, 'heading_error_num_layers': 3, 'heading_error_activation': 'elu', 'heading_error_out_channels_l0': 199, 'heading_error_pool_size_l0': 8, 'heading_error_out_channels_l1': 72, 'heading_error_pool_size_l1': 8, 'heading_error_out_channels_l2': 43, 'heading_error_pool_size_l2': 2, 'heading_error_fc_hidden': 71}. Best is trial 31 with value: 0.0984.
[rank: 0] Seed set to 42
[rank: 0] Seed set to 42
[rank: 0] Seed set to 42
GPU available: True (cuda), used: True
TPU available: False, using: 0 TPU cores
💡 Tip: For seamless cloud logging and experiment tracking, try installing [litlogger](https://pypi.org/project/litlogger/) to enable LitLogger, which logs metrics and artifacts automatically to the Lightning Experiments platform.
GPU available: True (cuda), used: True
TPU available: False, using: 0 TPU cores
💡 Tip: For seamless cloud logging and experiment tracking, try installing [litlogger](https://pypi.org/project/litlogger/) to enable LitLogger, which logs metrics and artifacts automatically to the Lightning Experiments platform.
GPU available: True (cuda), used: True
TPU available: False, using: 0 TPU cores
💡 Tip: For seamless cloud logging and experiment tracking, try installing [litlogger](https://pypi.org/project/litlogger/) to enable LitLogger, which logs metrics and artifacts automatically to the Lightning Experiments platform.
LOCAL_RANK: 0 - CUDA_VISIBLE_DEVICES: [0]
LOCAL_RANK: 0 - CUDA_VISIBLE_DEVICES: [0]
LOCAL_RANK: 0 - CUDA_VISIBLE_DEVICES: [0]
SLURM auto-requeueing enabled. Setting signal handlers.
SLURM auto-requeueing enabled. Setting signal handlers.
SLURM auto-requeueing enabled. Setting signal handlers.
`Trainer.fit` stopped: `max_epochs=20` reached.
`Trainer.fit` stopped: `max_epochs=20` reached.
`Trainer.fit` stopped: `max_epochs=20` reached.
