[I 2026-04-15 23:51:28,846] Trial 56 finished with value: 0.1059 and parameters: {'left_wall_dist_num_layers': 4, 'left_wall_dist_activation': 'elu', 'left_wall_dist_out_channels_l0': 35, 'left_wall_dist_pool_size_l0': 2, 'left_wall_dist_out_channels_l1': 234, 'left_wall_dist_pool_size_l1': 8, 'left_wall_dist_out_channels_l2': 173, 'left_wall_dist_pool_size_l2': 2, 'left_wall_dist_out_channels_l3': 248, 'left_wall_dist_pool_size_l3': 4, 'left_wall_dist_fc_hidden': 77, 'track_width_num_layers': 3, 'track_width_activation': 'relu', 'track_width_out_channels_l0': 39, 'track_width_pool_size_l0': 8, 'track_width_out_channels_l1': 129, 'track_width_pool_size_l1': 2, 'track_width_out_channels_l2': 35, 'track_width_pool_size_l2': 2, 'track_width_fc_hidden': 69, 'heading_error_num_layers': 2, 'heading_error_activation': 'elu', 'heading_error_out_channels_l0': 183, 'heading_error_pool_size_l0': 4, 'heading_error_out_channels_l1': 186, 'heading_error_pool_size_l1': 8, 'heading_error_fc_hidden': 116}. Best is trial 23 with value: 0.0876.
[rank: 0] Seed set to 42
[rank: 0] Seed set to 42
[rank: 0] Seed set to 42
GPU available: True (cuda), used: True
TPU available: False, using: 0 TPU cores
💡 Tip: For seamless cloud logging and experiment tracking, try installing [litlogger](https://pypi.org/project/litlogger/) to enable LitLogger, which logs metrics and artifacts automatically to the Lightning Experiments platform.
GPU available: True (cuda), used: True
TPU available: False, using: 0 TPU cores
💡 Tip: For seamless cloud logging and experiment tracking, try installing [litlogger](https://pypi.org/project/litlogger/) to enable LitLogger, which logs metrics and artifacts automatically to the Lightning Experiments platform.
GPU available: True (cuda), used: True
TPU available: False, using: 0 TPU cores
💡 Tip: For seamless cloud logging and experiment tracking, try installing [litlogger](https://pypi.org/project/litlogger/) to enable LitLogger, which logs metrics and artifacts automatically to the Lightning Experiments platform.
LOCAL_RANK: 0 - CUDA_VISIBLE_DEVICES: [0]
LOCAL_RANK: 0 - CUDA_VISIBLE_DEVICES: [0]
LOCAL_RANK: 0 - CUDA_VISIBLE_DEVICES: [0]
SLURM auto-requeueing enabled. Setting signal handlers.
SLURM auto-requeueing enabled. Setting signal handlers.
SLURM auto-requeueing enabled. Setting signal handlers.
`Trainer.fit` stopped: `max_epochs=30` reached.
`Trainer.fit` stopped: `max_epochs=30` reached.
`Trainer.fit` stopped: `max_epochs=30` reached.
[I 2026-04-15 23:54:00,836] Trial 57 finished with value: 0.1165 and parameters: {'left_wall_dist_num_layers': 3, 'left_wall_dist_activation': 'elu', 'left_wall_dist_out_channels_l0': 40, 'left_wall_dist_pool_size_l0': 2, 'left_wall_dist_out_channels_l1': 168, 'left_wall_dist_pool_size_l1': 8, 'left_wall_dist_out_channels_l2': 146, 'left_wall_dist_pool_size_l2': 2, 'left_wall_dist_fc_hidden': 85, 'track_width_num_layers': 5, 'track_width_activation': 'relu', 'track_width_out_channels_l0': 50, 'track_width_pool_size_l0': 8, 'track_width_out_channels_l1': 104, 'track_width_pool_size_l1': 2, 'track_width_out_channels_l2': 40, 'track_width_pool_size_l2': 2, 'track_width_out_channels_l3': 78, 'track_width_pool_size_l3': 4, 'track_width_out_channels_l4': 38, 'track_width_pool_size_l4': 8, 'track_width_fc_hidden': 33, 'heading_error_num_layers': 2, 'heading_error_activation': 'elu', 'heading_error_out_channels_l0': 154, 'heading_error_pool_size_l0': 4, 'heading_error_out_channels_l1': 239, 'heading_error_pool_size_l1': 8, 'heading_error_fc_hidden': 128}. Best is trial 23 with value: 0.0876.
[rank: 0] Seed set to 42
[rank: 0] Seed set to 42
[rank: 0] Seed set to 42
GPU available: True (cuda), used: True
TPU available: False, using: 0 TPU cores
💡 Tip: For seamless cloud logging and experiment tracking, try installing [litlogger](https://pypi.org/project/litlogger/) to enable LitLogger, which logs metrics and artifacts automatically to the Lightning Experiments platform.
GPU available: True (cuda), used: True
TPU available: False, using: 0 TPU cores
💡 Tip: For seamless cloud logging and experiment tracking, try installing [litlogger](https://pypi.org/project/litlogger/) to enable LitLogger, which logs metrics and artifacts automatically to the Lightning Experiments platform.
GPU available: True (cuda), used: True
TPU available: False, using: 0 TPU cores
💡 Tip: For seamless cloud logging and experiment tracking, try installing [litlogger](https://pypi.org/project/litlogger/) to enable LitLogger, which logs metrics and artifacts automatically to the Lightning Experiments platform.
LOCAL_RANK: 0 - CUDA_VISIBLE_DEVICES: [0]
LOCAL_RANK: 0 - CUDA_VISIBLE_DEVICES: [0]
LOCAL_RANK: 0 - CUDA_VISIBLE_DEVICES: [0]
SLURM auto-requeueing enabled. Setting signal handlers.
SLURM auto-requeueing enabled. Setting signal handlers.
SLURM auto-requeueing enabled. Setting signal handlers.
`Trainer.fit` stopped: `max_epochs=30` reached.
`Trainer.fit` stopped: `max_epochs=30` reached.
`Trainer.fit` stopped: `max_epochs=30` reached.
[I 2026-04-15 23:56:33,702] Trial 58 finished with value: 0.1179 and parameters: {'left_wall_dist_num_layers': 3, 'left_wall_dist_activation': 'elu', 'left_wall_dist_out_channels_l0': 34, 'left_wall_dist_pool_size_l0': 2, 'left_wall_dist_out_channels_l1': 130, 'left_wall_dist_pool_size_l1': 8, 'left_wall_dist_out_channels_l2': 99, 'left_wall_dist_pool_size_l2': 2, 'left_wall_dist_fc_hidden': 92, 'track_width_num_layers': 4, 'track_width_activation': 'relu', 'track_width_out_channels_l0': 32, 'track_width_pool_size_l0': 8, 'track_width_out_channels_l1': 87, 'track_width_pool_size_l1': 2, 'track_width_out_channels_l2': 195, 'track_width_pool_size_l2': 2, 'track_width_out_channels_l3': 59, 'track_width_pool_size_l3': 4, 'track_width_fc_hidden': 35, 'heading_error_num_layers': 2, 'heading_error_activation': 'elu', 'heading_error_out_channels_l0': 107, 'heading_error_pool_size_l0': 4, 'heading_error_out_channels_l1': 194, 'heading_error_pool_size_l1': 8, 'heading_error_fc_hidden': 112}. Best is trial 23 with value: 0.0876.
[rank: 0] Seed set to 42
GPU available: True (cuda), used: True
TPU available: False, using: 0 TPU cores
💡 Tip: For seamless cloud logging and experiment tracking, try installing [litlogger](https://pypi.org/project/litlogger/) to enable LitLogger, which logs metrics and artifacts automatically to the Lightning Experiments platform.
[rank: 0] Seed set to 42
GPU available: True (cuda), used: True
TPU available: False, using: 0 TPU cores
💡 Tip: For seamless cloud logging and experiment tracking, try installing [litlogger](https://pypi.org/project/litlogger/) to enable LitLogger, which logs metrics and artifacts automatically to the Lightning Experiments platform.
[rank: 0] Seed set to 42
GPU available: True (cuda), used: True
TPU available: False, using: 0 TPU cores
💡 Tip: For seamless cloud logging and experiment tracking, try installing [litlogger](https://pypi.org/project/litlogger/) to enable LitLogger, which logs metrics and artifacts automatically to the Lightning Experiments platform.
LOCAL_RANK: 0 - CUDA_VISIBLE_DEVICES: [0]
LOCAL_RANK: 0 - CUDA_VISIBLE_DEVICES: [0]
LOCAL_RANK: 0 - CUDA_VISIBLE_DEVICES: [0]
SLURM auto-requeueing enabled. Setting signal handlers.
SLURM auto-requeueing enabled. Setting signal handlers.
SLURM auto-requeueing enabled. Setting signal handlers.
`Trainer.fit` stopped: `max_epochs=30` reached.
`Trainer.fit` stopped: `max_epochs=30` reached.
`Trainer.fit` stopped: `max_epochs=30` reached.
[I 2026-04-15 23:59:08,831] Trial 59 finished with value: 0.1563 and parameters: {'left_wall_dist_num_layers': 4, 'left_wall_dist_activation': 'elu', 'left_wall_dist_out_channels_l0': 45, 'left_wall_dist_pool_size_l0': 2, 'left_wall_dist_out_channels_l1': 233, 'left_wall_dist_pool_size_l1': 8, 'left_wall_dist_out_channels_l2': 115, 'left_wall_dist_pool_size_l2': 2, 'left_wall_dist_out_channels_l3': 129, 'left_wall_dist_pool_size_l3': 8, 'left_wall_dist_fc_hidden': 79, 'track_width_num_layers': 4, 'track_width_activation': 'relu', 'track_width_out_channels_l0': 71, 'track_width_pool_size_l0': 8, 'track_width_out_channels_l1': 153, 'track_width_pool_size_l1': 8, 'track_width_out_channels_l2': 34, 'track_width_pool_size_l2': 2, 'track_width_out_channels_l3': 54, 'track_width_pool_size_l3': 8, 'track_width_fc_hidden': 37, 'heading_error_num_layers': 2, 'heading_error_activation': 'elu', 'heading_error_out_channels_l0': 121, 'heading_error_pool_size_l0': 4, 'heading_error_out_channels_l1': 145, 'heading_error_pool_size_l1': 8, 'heading_error_fc_hidden': 85}. Best is trial 23 with value: 0.0876.
[rank: 0] Seed set to 42
[rank: 0] Seed set to 42
[rank: 0] Seed set to 42
GPU available: True (cuda), used: True
TPU available: False, using: 0 TPU cores
💡 Tip: For seamless cloud logging and experiment tracking, try installing [litlogger](https://pypi.org/project/litlogger/) to enable LitLogger, which logs metrics and artifacts automatically to the Lightning Experiments platform.
GPU available: True (cuda), used: True
TPU available: False, using: 0 TPU cores
💡 Tip: For seamless cloud logging and experiment tracking, try installing [litlogger](https://pypi.org/project/litlogger/) to enable LitLogger, which logs metrics and artifacts automatically to the Lightning Experiments platform.
GPU available: True (cuda), used: True
TPU available: False, using: 0 TPU cores
💡 Tip: For seamless cloud logging and experiment tracking, try installing [litlogger](https://pypi.org/project/litlogger/) to enable LitLogger, which logs metrics and artifacts automatically to the Lightning Experiments platform.
LOCAL_RANK: 0 - CUDA_VISIBLE_DEVICES: [0]
LOCAL_RANK: 0 - CUDA_VISIBLE_DEVICES: [0]
LOCAL_RANK: 0 - CUDA_VISIBLE_DEVICES: [0]
SLURM auto-requeueing enabled. Setting signal handlers.
SLURM auto-requeueing enabled. Setting signal handlers.
SLURM auto-requeueing enabled. Setting signal handlers.
`Trainer.fit` stopped: `max_epochs=30` reached.
`Trainer.fit` stopped: `max_epochs=30` reached.
`Trainer.fit` stopped: `max_epochs=30` reached.
[I 2026-04-16 00:01:33,684] Trial 60 finished with value: 0.1223 and parameters: {'left_wall_dist_num_layers': 3, 'left_wall_dist_activation': 'elu', 'left_wall_dist_out_channels_l0': 40, 'left_wall_dist_pool_size_l0': 2, 'left_wall_dist_out_channels_l1': 209, 'left_wall_dist_pool_size_l1': 8, 'left_wall_dist_out_channels_l2': 183, 'left_wall_dist_pool_size_l2': 2, 'left_wall_dist_fc_hidden': 98, 'track_width_num_layers': 2, 'track_width_activation': 'relu', 'track_width_out_channels_l0': 57, 'track_width_pool_size_l0': 8, 'track_width_out_channels_l1': 132, 'track_width_pool_size_l1': 2, 'heading_error_num_layers': 2, 'heading_error_activation': 'elu', 'heading_error_out_channels_l0': 228, 'heading_error_pool_size_l0': 4, 'heading_error_out_channels_l1': 164, 'heading_error_pool_size_l1': 8, 'heading_error_fc_hidden': 97}. Best is trial 23 with value: 0.0876.
[rank: 0] Seed set to 42
[rank: 0] Seed set to 42
[rank: 0] Seed set to 42
GPU available: True (cuda), used: True
TPU available: False, using: 0 TPU cores
GPU available: True (cuda), used: True
TPU available: False, using: 0 TPU cores
💡 Tip: For seamless cloud logging and experiment tracking, try installing [litlogger](https://pypi.org/project/litlogger/) to enable LitLogger, which logs metrics and artifacts automatically to the Lightning Experiments platform.
GPU available: True (cuda), used: True
TPU available: False, using: 0 TPU cores
💡 Tip: For seamless cloud logging and experiment tracking, try installing [litlogger](https://pypi.org/project/litlogger/) to enable LitLogger, which logs metrics and artifacts automatically to the Lightning Experiments platform.
💡 Tip: For seamless cloud logging and experiment tracking, try installing [litlogger](https://pypi.org/project/litlogger/) to enable LitLogger, which logs metrics and artifacts automatically to the Lightning Experiments platform.
LOCAL_RANK: 0 - CUDA_VISIBLE_DEVICES: [0]
LOCAL_RANK: 0 - CUDA_VISIBLE_DEVICES: [0]
LOCAL_RANK: 0 - CUDA_VISIBLE_DEVICES: [0]
SLURM auto-requeueing enabled. Setting signal handlers.
SLURM auto-requeueing enabled. Setting signal handlers.
SLURM auto-requeueing enabled. Setting signal handlers.
`Trainer.fit` stopped: `max_epochs=30` reached.
`Trainer.fit` stopped: `max_epochs=30` reached.
`Trainer.fit` stopped: `max_epochs=30` reached.
[I 2026-04-16 00:04:07,577] Trial 61 finished with value: 0.1053 and parameters: {'left_wall_dist_num_layers': 3, 'left_wall_dist_activation': 'elu', 'left_wall_dist_out_channels_l0': 37, 'left_wall_dist_pool_size_l0': 2, 'left_wall_dist_out_channels_l1': 256, 'left_wall_dist_pool_size_l1': 8, 'left_wall_dist_out_channels_l2': 213, 'left_wall_dist_pool_size_l2': 2, 'left_wall_dist_fc_hidden': 118, 'track_width_num_layers': 5, 'track_width_activation': 'relu', 'track_width_out_channels_l0': 37, 'track_width_pool_size_l0': 8, 'track_width_out_channels_l1': 97, 'track_width_pool_size_l1': 2, 'track_width_out_channels_l2': 48, 'track_width_pool_size_l2': 2, 'track_width_out_channels_l3': 50, 'track_width_pool_size_l3': 4, 'track_width_out_channels_l4': 40, 'track_width_pool_size_l4': 8, 'track_width_fc_hidden': 34, 'heading_error_num_layers': 2, 'heading_error_activation': 'elu', 'heading_error_out_channels_l0': 135, 'heading_error_pool_size_l0': 4, 'heading_error_out_channels_l1': 131, 'heading_error_pool_size_l1': 8, 'heading_error_fc_hidden': 81}. Best is trial 23 with value: 0.0876.
[rank: 0] Seed set to 42
[rank: 0] Seed set to 42
[rank: 0] Seed set to 42
GPU available: True (cuda), used: True
TPU available: False, using: 0 TPU cores
💡 Tip: For seamless cloud logging and experiment tracking, try installing [litlogger](https://pypi.org/project/litlogger/) to enable LitLogger, which logs metrics and artifacts automatically to the Lightning Experiments platform.
GPU available: True (cuda), used: True
TPU available: False, using: 0 TPU cores
💡 Tip: For seamless cloud logging and experiment tracking, try installing [litlogger](https://pypi.org/project/litlogger/) to enable LitLogger, which logs metrics and artifacts automatically to the Lightning Experiments platform.
GPU available: True (cuda), used: True
TPU available: False, using: 0 TPU cores
💡 Tip: For seamless cloud logging and experiment tracking, try installing [litlogger](https://pypi.org/project/litlogger/) to enable LitLogger, which logs metrics and artifacts automatically to the Lightning Experiments platform.
LOCAL_RANK: 0 - CUDA_VISIBLE_DEVICES: [0]
LOCAL_RANK: 0 - CUDA_VISIBLE_DEVICES: [0]
LOCAL_RANK: 0 - CUDA_VISIBLE_DEVICES: [0]
SLURM auto-requeueing enabled. Setting signal handlers.
SLURM auto-requeueing enabled. Setting signal handlers.
SLURM auto-requeueing enabled. Setting signal handlers.
`Trainer.fit` stopped: `max_epochs=30` reached.
`Trainer.fit` stopped: `max_epochs=30` reached.
`Trainer.fit` stopped: `max_epochs=30` reached.
[I 2026-04-16 00:06:35,367] Trial 62 finished with value: 0.1085 and parameters: {'left_wall_dist_num_layers': 3, 'left_wall_dist_activation': 'elu', 'left_wall_dist_out_channels_l0': 44, 'left_wall_dist_pool_size_l0': 2, 'left_wall_dist_out_channels_l1': 64, 'left_wall_dist_pool_size_l1': 8, 'left_wall_dist_out_channels_l2': 87, 'left_wall_dist_pool_size_l2': 8, 'left_wall_dist_fc_hidden': 72, 'track_width_num_layers': 5, 'track_width_activation': 'relu', 'track_width_out_channels_l0': 51, 'track_width_pool_size_l0': 8, 'track_width_out_channels_l1': 137, 'track_width_pool_size_l1': 2, 'track_width_out_channels_l2': 42, 'track_width_pool_size_l2': 2, 'track_width_out_channels_l3': 42, 'track_width_pool_size_l3': 4, 'track_width_out_channels_l4': 47, 'track_width_pool_size_l4': 8, 'track_width_fc_hidden': 44, 'heading_error_num_layers': 2, 'heading_error_activation': 'elu', 'heading_error_out_channels_l0': 85, 'heading_error_pool_size_l0': 4, 'heading_error_out_channels_l1': 153, 'heading_error_pool_size_l1': 8, 'heading_error_fc_hidden': 88}. Best is trial 23 with value: 0.0876.
[rank: 0] Seed set to 42
[rank: 0] Seed set to 42
[rank: 0] Seed set to 42
GPU available: True (cuda), used: True
TPU available: False, using: 0 TPU cores
💡 Tip: For seamless cloud logging and experiment tracking, try installing [litlogger](https://pypi.org/project/litlogger/) to enable LitLogger, which logs metrics and artifacts automatically to the Lightning Experiments platform.
GPU available: True (cuda), used: True
GPU available: True (cuda), used: True
TPU available: False, using: 0 TPU cores
TPU available: False, using: 0 TPU cores
💡 Tip: For seamless cloud logging and experiment tracking, try installing [litlogger](https://pypi.org/project/litlogger/) to enable LitLogger, which logs metrics and artifacts automatically to the Lightning Experiments platform.
💡 Tip: For seamless cloud logging and experiment tracking, try installing [litlogger](https://pypi.org/project/litlogger/) to enable LitLogger, which logs metrics and artifacts automatically to the Lightning Experiments platform.
LOCAL_RANK: 0 - CUDA_VISIBLE_DEVICES: [0]
LOCAL_RANK: 0 - CUDA_VISIBLE_DEVICES: [0]
LOCAL_RANK: 0 - CUDA_VISIBLE_DEVICES: [0]
SLURM auto-requeueing enabled. Setting signal handlers.
SLURM auto-requeueing enabled. Setting signal handlers.
SLURM auto-requeueing enabled. Setting signal handlers.
`Trainer.fit` stopped: `max_epochs=30` reached.
`Trainer.fit` stopped: `max_epochs=30` reached.
`Trainer.fit` stopped: `max_epochs=30` reached.
