[I 2026-04-12 15:10:20,347] Trial 52 finished with value: inf and parameters: {'left_wall_dist_num_layers': 2, 'left_wall_dist_activation': 'elu', 'left_wall_dist_out_channels_l0': 81, 'left_wall_dist_pool_size_l0': 8, 'left_wall_dist_out_channels_l1': 96, 'left_wall_dist_pool_size_l1': 8, 'left_wall_dist_fc_hidden': 45, 'track_width_num_layers': 4, 'track_width_activation': 'relu', 'track_width_out_channels_l0': 232, 'track_width_pool_size_l0': 4, 'track_width_out_channels_l1': 60, 'track_width_pool_size_l1': 8, 'track_width_out_channels_l2': 75, 'track_width_pool_size_l2': 8, 'track_width_out_channels_l3': 93, 'track_width_pool_size_l3': 2, 'heading_error_num_layers': 5, 'heading_error_activation': 'elu', 'heading_error_out_channels_l0': 36, 'heading_error_pool_size_l0': 8, 'heading_error_out_channels_l1': 72, 'heading_error_pool_size_l1': 8, 'heading_error_out_channels_l2': 77, 'heading_error_pool_size_l2': 2, 'heading_error_out_channels_l3': 208, 'heading_error_pool_size_l3': 2, 'heading_error_fc_hidden': 33}. Best is trial 46 with value: 0.0885.
[rank: 0] Seed set to 42
[rank: 0] Seed set to 42
[rank: 0] Seed set to 42
GPU available: True (cuda), used: True
TPU available: False, using: 0 TPU cores
💡 Tip: For seamless cloud logging and experiment tracking, try installing [litlogger](https://pypi.org/project/litlogger/) to enable LitLogger, which logs metrics and artifacts automatically to the Lightning Experiments platform.
GPU available: True (cuda), used: True
GPU available: True (cuda), used: True
TPU available: False, using: 0 TPU cores
TPU available: False, using: 0 TPU cores
💡 Tip: For seamless cloud logging and experiment tracking, try installing [litlogger](https://pypi.org/project/litlogger/) to enable LitLogger, which logs metrics and artifacts automatically to the Lightning Experiments platform.
💡 Tip: For seamless cloud logging and experiment tracking, try installing [litlogger](https://pypi.org/project/litlogger/) to enable LitLogger, which logs metrics and artifacts automatically to the Lightning Experiments platform.
LOCAL_RANK: 0 - CUDA_VISIBLE_DEVICES: [0]
LOCAL_RANK: 0 - CUDA_VISIBLE_DEVICES: [0]
LOCAL_RANK: 0 - CUDA_VISIBLE_DEVICES: [0]
SLURM auto-requeueing enabled. Setting signal handlers.
SLURM auto-requeueing enabled. Setting signal handlers.
SLURM auto-requeueing enabled. Setting signal handlers.
`Trainer.fit` stopped: `max_epochs=20` reached.
`Trainer.fit` stopped: `max_epochs=20` reached.
`Trainer.fit` stopped: `max_epochs=20` reached.
[I 2026-04-12 15:12:28,441] Trial 53 finished with value: 0.124 and parameters: {'left_wall_dist_num_layers': 2, 'left_wall_dist_activation': 'relu', 'left_wall_dist_out_channels_l0': 69, 'left_wall_dist_pool_size_l0': 8, 'left_wall_dist_out_channels_l1': 147, 'left_wall_dist_pool_size_l1': 8, 'left_wall_dist_fc_hidden': 47, 'track_width_num_layers': 3, 'track_width_activation': 'elu', 'track_width_out_channels_l0': 182, 'track_width_pool_size_l0': 8, 'track_width_out_channels_l1': 76, 'track_width_pool_size_l1': 4, 'track_width_out_channels_l2': 152, 'track_width_pool_size_l2': 4, 'track_width_fc_hidden': 42, 'heading_error_num_layers': 4, 'heading_error_activation': 'elu', 'heading_error_out_channels_l0': 96, 'heading_error_pool_size_l0': 8, 'heading_error_out_channels_l1': 164, 'heading_error_pool_size_l1': 4, 'heading_error_out_channels_l2': 36, 'heading_error_pool_size_l2': 2, 'heading_error_out_channels_l3': 32, 'heading_error_pool_size_l3': 8}. Best is trial 46 with value: 0.0885.
[rank: 0] Seed set to 42
[rank: 0] Seed set to 42
[rank: 0] Seed set to 42
GPU available: True (cuda), used: True
TPU available: False, using: 0 TPU cores
💡 Tip: For seamless cloud logging and experiment tracking, try installing [litlogger](https://pypi.org/project/litlogger/) to enable LitLogger, which logs metrics and artifacts automatically to the Lightning Experiments platform.
GPU available: True (cuda), used: True
TPU available: False, using: 0 TPU cores
💡 Tip: For seamless cloud logging and experiment tracking, try installing [litlogger](https://pypi.org/project/litlogger/) to enable LitLogger, which logs metrics and artifacts automatically to the Lightning Experiments platform.
GPU available: True (cuda), used: True
TPU available: False, using: 0 TPU cores
💡 Tip: For seamless cloud logging and experiment tracking, try installing [litlogger](https://pypi.org/project/litlogger/) to enable LitLogger, which logs metrics and artifacts automatically to the Lightning Experiments platform.
LOCAL_RANK: 0 - CUDA_VISIBLE_DEVICES: [0]
LOCAL_RANK: 0 - CUDA_VISIBLE_DEVICES: [0]
LOCAL_RANK: 0 - CUDA_VISIBLE_DEVICES: [0]
SLURM auto-requeueing enabled. Setting signal handlers.
SLURM auto-requeueing enabled. Setting signal handlers.
SLURM auto-requeueing enabled. Setting signal handlers.
`Trainer.fit` stopped: `max_epochs=20` reached.
`Trainer.fit` stopped: `max_epochs=20` reached.
`Trainer.fit` stopped: `max_epochs=20` reached.
[I 2026-04-12 15:14:44,249] Trial 54 finished with value: 0.121 and parameters: {'left_wall_dist_num_layers': 2, 'left_wall_dist_activation': 'relu', 'left_wall_dist_out_channels_l0': 244, 'left_wall_dist_pool_size_l0': 8, 'left_wall_dist_out_channels_l1': 110, 'left_wall_dist_pool_size_l1': 8, 'left_wall_dist_fc_hidden': 35, 'track_width_num_layers': 5, 'track_width_activation': 'elu', 'track_width_out_channels_l0': 128, 'track_width_pool_size_l0': 4, 'track_width_out_channels_l1': 220, 'track_width_pool_size_l1': 2, 'track_width_out_channels_l2': 61, 'track_width_pool_size_l2': 2, 'track_width_out_channels_l3': 39, 'track_width_pool_size_l3': 8, 'track_width_out_channels_l4': 60, 'track_width_pool_size_l4': 4, 'heading_error_num_layers': 5, 'heading_error_activation': 'elu', 'heading_error_out_channels_l0': 84, 'heading_error_pool_size_l0': 8, 'heading_error_out_channels_l1': 215, 'heading_error_pool_size_l1': 8, 'heading_error_out_channels_l2': 159, 'heading_error_pool_size_l2': 2, 'heading_error_out_channels_l3': 136, 'heading_error_pool_size_l3': 8, 'heading_error_out_channels_l4': 197, 'heading_error_pool_size_l4': 8, 'heading_error_fc_hidden': 58}. Best is trial 46 with value: 0.0885.
[rank: 0] Seed set to 42
[rank: 0] Seed set to 42
[rank: 0] Seed set to 42
GPU available: True (cuda), used: True
TPU available: False, using: 0 TPU cores
💡 Tip: For seamless cloud logging and experiment tracking, try installing [litlogger](https://pypi.org/project/litlogger/) to enable LitLogger, which logs metrics and artifacts automatically to the Lightning Experiments platform.
GPU available: True (cuda), used: True
TPU available: False, using: 0 TPU cores
💡 Tip: For seamless cloud logging and experiment tracking, try installing [litlogger](https://pypi.org/project/litlogger/) to enable LitLogger, which logs metrics and artifacts automatically to the Lightning Experiments platform.
GPU available: True (cuda), used: True
TPU available: False, using: 0 TPU cores
💡 Tip: For seamless cloud logging and experiment tracking, try installing [litlogger](https://pypi.org/project/litlogger/) to enable LitLogger, which logs metrics and artifacts automatically to the Lightning Experiments platform.
LOCAL_RANK: 0 - CUDA_VISIBLE_DEVICES: [0]
LOCAL_RANK: 0 - CUDA_VISIBLE_DEVICES: [0]
LOCAL_RANK: 0 - CUDA_VISIBLE_DEVICES: [0]
SLURM auto-requeueing enabled. Setting signal handlers.
SLURM auto-requeueing enabled. Setting signal handlers.
SLURM auto-requeueing enabled. Setting signal handlers.
`Trainer.fit` stopped: `max_epochs=20` reached.
`Trainer.fit` stopped: `max_epochs=20` reached.
`Trainer.fit` stopped: `max_epochs=20` reached.
[I 2026-04-12 15:16:43,554] Trial 55 finished with value: 0.1352 and parameters: {'left_wall_dist_num_layers': 3, 'left_wall_dist_activation': 'elu', 'left_wall_dist_out_channels_l0': 111, 'left_wall_dist_pool_size_l0': 8, 'left_wall_dist_out_channels_l1': 127, 'left_wall_dist_pool_size_l1': 8, 'left_wall_dist_out_channels_l2': 70, 'left_wall_dist_pool_size_l2': 2, 'left_wall_dist_fc_hidden': 57, 'track_width_num_layers': 2, 'track_width_activation': 'relu', 'track_width_out_channels_l0': 71, 'track_width_pool_size_l0': 2, 'track_width_out_channels_l1': 86, 'track_width_pool_size_l1': 8, 'track_width_fc_hidden': 101, 'heading_error_num_layers': 2, 'heading_error_activation': 'elu', 'heading_error_out_channels_l0': 55, 'heading_error_pool_size_l0': 8, 'heading_error_out_channels_l1': 178, 'heading_error_pool_size_l1': 8, 'heading_error_fc_hidden': 53}. Best is trial 46 with value: 0.0885.
[rank: 0] Seed set to 42
[rank: 0] Seed set to 42
[rank: 0] Seed set to 42
GPU available: True (cuda), used: True
TPU available: False, using: 0 TPU cores
💡 Tip: For seamless cloud logging and experiment tracking, try installing [litlogger](https://pypi.org/project/litlogger/) to enable LitLogger, which logs metrics and artifacts automatically to the Lightning Experiments platform.
GPU available: True (cuda), used: True
TPU available: False, using: 0 TPU cores
💡 Tip: For seamless cloud logging and experiment tracking, try installing [litlogger](https://pypi.org/project/litlogger/) to enable LitLogger, which logs metrics and artifacts automatically to the Lightning Experiments platform.
GPU available: True (cuda), used: True
TPU available: False, using: 0 TPU cores
💡 Tip: For seamless cloud logging and experiment tracking, try installing [litlogger](https://pypi.org/project/litlogger/) to enable LitLogger, which logs metrics and artifacts automatically to the Lightning Experiments platform.
LOCAL_RANK: 0 - CUDA_VISIBLE_DEVICES: [0]
LOCAL_RANK: 0 - CUDA_VISIBLE_DEVICES: [0]
LOCAL_RANK: 0 - CUDA_VISIBLE_DEVICES: [0]
SLURM auto-requeueing enabled. Setting signal handlers.
SLURM auto-requeueing enabled. Setting signal handlers.
SLURM auto-requeueing enabled. Setting signal handlers.
`Trainer.fit` stopped: `max_epochs=20` reached.
`Trainer.fit` stopped: `max_epochs=20` reached.
`Trainer.fit` stopped: `max_epochs=20` reached.
[I 2026-04-12 15:18:58,692] Trial 56 finished with value: 0.1207 and parameters: {'left_wall_dist_num_layers': 4, 'left_wall_dist_activation': 'relu', 'left_wall_dist_out_channels_l0': 83, 'left_wall_dist_pool_size_l0': 8, 'left_wall_dist_out_channels_l1': 85, 'left_wall_dist_pool_size_l1': 8, 'left_wall_dist_out_channels_l2': 88, 'left_wall_dist_pool_size_l2': 4, 'left_wall_dist_out_channels_l3': 78, 'left_wall_dist_pool_size_l3': 8, 'track_width_num_layers': 5, 'track_width_activation': 'elu', 'track_width_out_channels_l0': 236, 'track_width_pool_size_l0': 4, 'track_width_out_channels_l1': 145, 'track_width_pool_size_l1': 4, 'track_width_out_channels_l2': 247, 'track_width_pool_size_l2': 4, 'track_width_out_channels_l3': 51, 'track_width_pool_size_l3': 8, 'track_width_fc_hidden': 36, 'heading_error_num_layers': 3, 'heading_error_activation': 'elu', 'heading_error_out_channels_l0': 43, 'heading_error_pool_size_l0': 8, 'heading_error_out_channels_l1': 140, 'heading_error_pool_size_l1': 2, 'heading_error_out_channels_l2': 51, 'heading_error_pool_size_l2': 4, 'heading_error_fc_hidden': 76}. Best is trial 46 with value: 0.0885.
[rank: 0] Seed set to 42
[rank: 0] Seed set to 42
[rank: 0] Seed set to 42
GPU available: True (cuda), used: True
TPU available: False, using: 0 TPU cores
💡 Tip: For seamless cloud logging and experiment tracking, try installing [litlogger](https://pypi.org/project/litlogger/) to enable LitLogger, which logs metrics and artifacts automatically to the Lightning Experiments platform.
GPU available: True (cuda), used: True
TPU available: False, using: 0 TPU cores
💡 Tip: For seamless cloud logging and experiment tracking, try installing [litlogger](https://pypi.org/project/litlogger/) to enable LitLogger, which logs metrics and artifacts automatically to the Lightning Experiments platform.
GPU available: True (cuda), used: True
TPU available: False, using: 0 TPU cores
💡 Tip: For seamless cloud logging and experiment tracking, try installing [litlogger](https://pypi.org/project/litlogger/) to enable LitLogger, which logs metrics and artifacts automatically to the Lightning Experiments platform.
LOCAL_RANK: 0 - CUDA_VISIBLE_DEVICES: [0]
LOCAL_RANK: 0 - CUDA_VISIBLE_DEVICES: [0]
LOCAL_RANK: 0 - CUDA_VISIBLE_DEVICES: [0]
SLURM auto-requeueing enabled. Setting signal handlers.
SLURM auto-requeueing enabled. Setting signal handlers.
SLURM auto-requeueing enabled. Setting signal handlers.
`Trainer.fit` stopped: `max_epochs=20` reached.
`Trainer.fit` stopped: `max_epochs=20` reached.
`Trainer.fit` stopped: `max_epochs=20` reached.
[I 2026-04-12 15:21:22,459] Trial 57 finished with value: 0.1809 and parameters: {'left_wall_dist_num_layers': 2, 'left_wall_dist_activation': 'relu', 'left_wall_dist_out_channels_l0': 143, 'left_wall_dist_pool_size_l0': 8, 'left_wall_dist_out_channels_l1': 191, 'left_wall_dist_pool_size_l1': 8, 'left_wall_dist_fc_hidden': 52, 'track_width_num_layers': 3, 'track_width_activation': 'relu', 'track_width_out_channels_l0': 192, 'track_width_pool_size_l0': 4, 'track_width_out_channels_l1': 58, 'track_width_pool_size_l1': 2, 'track_width_out_channels_l2': 175, 'track_width_pool_size_l2': 2, 'heading_error_num_layers': 4, 'heading_error_activation': 'relu', 'heading_error_out_channels_l0': 256, 'heading_error_pool_size_l0': 2, 'heading_error_out_channels_l1': 240, 'heading_error_pool_size_l1': 4, 'heading_error_out_channels_l2': 94, 'heading_error_pool_size_l2': 8, 'heading_error_out_channels_l3': 104, 'heading_error_pool_size_l3': 8}. Best is trial 46 with value: 0.0885.
[rank: 0] Seed set to 42
[rank: 0] Seed set to 42
[rank: 0] Seed set to 42
GPU available: True (cuda), used: True
TPU available: False, using: 0 TPU cores
💡 Tip: For seamless cloud logging and experiment tracking, try installing [litlogger](https://pypi.org/project/litlogger/) to enable LitLogger, which logs metrics and artifacts automatically to the Lightning Experiments platform.
GPU available: True (cuda), used: True
TPU available: False, using: 0 TPU cores
💡 Tip: For seamless cloud logging and experiment tracking, try installing [litlogger](https://pypi.org/project/litlogger/) to enable LitLogger, which logs metrics and artifacts automatically to the Lightning Experiments platform.
GPU available: True (cuda), used: True
TPU available: False, using: 0 TPU cores
💡 Tip: For seamless cloud logging and experiment tracking, try installing [litlogger](https://pypi.org/project/litlogger/) to enable LitLogger, which logs metrics and artifacts automatically to the Lightning Experiments platform.
LOCAL_RANK: 0 - CUDA_VISIBLE_DEVICES: [0]
LOCAL_RANK: 0 - CUDA_VISIBLE_DEVICES: [0]
LOCAL_RANK: 0 - CUDA_VISIBLE_DEVICES: [0]
SLURM auto-requeueing enabled. Setting signal handlers.
SLURM auto-requeueing enabled. Setting signal handlers.
SLURM auto-requeueing enabled. Setting signal handlers.
`Trainer.fit` stopped: `max_epochs=20` reached.
`Trainer.fit` stopped: `max_epochs=20` reached.
`Trainer.fit` stopped: `max_epochs=20` reached.
[I 2026-04-12 15:23:48,367] Trial 58 finished with value: 0.1383 and parameters: {'left_wall_dist_num_layers': 5, 'left_wall_dist_activation': 'elu', 'left_wall_dist_out_channels_l0': 171, 'left_wall_dist_pool_size_l0': 2, 'left_wall_dist_out_channels_l1': 240, 'left_wall_dist_pool_size_l1': 4, 'left_wall_dist_out_channels_l2': 149, 'left_wall_dist_pool_size_l2': 8, 'left_wall_dist_out_channels_l3': 39, 'left_wall_dist_pool_size_l3': 4, 'left_wall_dist_out_channels_l4': 228, 'left_wall_dist_pool_size_l4': 4, 'track_width_num_layers': 4, 'track_width_activation': 'elu', 'track_width_out_channels_l0': 49, 'track_width_pool_size_l0': 2, 'track_width_out_channels_l1': 103, 'track_width_pool_size_l1': 8, 'track_width_out_channels_l2': 119, 'track_width_pool_size_l2': 4, 'track_width_out_channels_l3': 45, 'track_width_pool_size_l3': 8, 'heading_error_num_layers': 5, 'heading_error_activation': 'elu', 'heading_error_out_channels_l0': 110, 'heading_error_pool_size_l0': 8, 'heading_error_out_channels_l1': 95, 'heading_error_pool_size_l1': 8, 'heading_error_out_channels_l2': 137, 'heading_error_pool_size_l2': 2, 'heading_error_out_channels_l3': 51, 'heading_error_pool_size_l3': 8, 'heading_error_out_channels_l4': 195, 'heading_error_pool_size_l4': 2}. Best is trial 46 with value: 0.0885.
[rank: 0] Seed set to 42
[rank: 0] Seed set to 42
GPU available: True (cuda), used: True
TPU available: False, using: 0 TPU cores
💡 Tip: For seamless cloud logging and experiment tracking, try installing [litlogger](https://pypi.org/project/litlogger/) to enable LitLogger, which logs metrics and artifacts automatically to the Lightning Experiments platform.
GPU available: True (cuda), used: True
TPU available: False, using: 0 TPU cores
💡 Tip: For seamless cloud logging and experiment tracking, try installing [litlogger](https://pypi.org/project/litlogger/) to enable LitLogger, which logs metrics and artifacts automatically to the Lightning Experiments platform.
[rank: 0] Seed set to 42
GPU available: True (cuda), used: True
TPU available: False, using: 0 TPU cores
💡 Tip: For seamless cloud logging and experiment tracking, try installing [litlogger](https://pypi.org/project/litlogger/) to enable LitLogger, which logs metrics and artifacts automatically to the Lightning Experiments platform.
LOCAL_RANK: 0 - CUDA_VISIBLE_DEVICES: [0]
LOCAL_RANK: 0 - CUDA_VISIBLE_DEVICES: [0]
LOCAL_RANK: 0 - CUDA_VISIBLE_DEVICES: [0]
SLURM auto-requeueing enabled. Setting signal handlers.
SLURM auto-requeueing enabled. Setting signal handlers.
SLURM auto-requeueing enabled. Setting signal handlers.
`Trainer.fit` stopped: `max_epochs=20` reached.
`Trainer.fit` stopped: `max_epochs=20` reached.
`Trainer.fit` stopped: `max_epochs=20` reached.
[I 2026-04-12 15:26:10,238] Trial 59 finished with value: 0.1257 and parameters: {'left_wall_dist_num_layers': 4, 'left_wall_dist_activation': 'relu', 'left_wall_dist_out_channels_l0': 215, 'left_wall_dist_pool_size_l0': 4, 'left_wall_dist_out_channels_l1': 175, 'left_wall_dist_pool_size_l1': 2, 'left_wall_dist_out_channels_l2': 175, 'left_wall_dist_pool_size_l2': 4, 'left_wall_dist_out_channels_l3': 112, 'left_wall_dist_pool_size_l3': 2, 'left_wall_dist_fc_hidden': 38, 'track_width_num_layers': 4, 'track_width_activation': 'elu', 'track_width_out_channels_l0': 254, 'track_width_pool_size_l0': 4, 'track_width_out_channels_l1': 70, 'track_width_pool_size_l1': 4, 'track_width_out_channels_l2': 63, 'track_width_pool_size_l2': 2, 'track_width_out_channels_l3': 126, 'track_width_pool_size_l3': 8, 'track_width_fc_hidden': 49, 'heading_error_num_layers': 5, 'heading_error_activation': 'relu', 'heading_error_out_channels_l0': 63, 'heading_error_pool_size_l0': 8, 'heading_error_out_channels_l1': 157, 'heading_error_pool_size_l1': 8, 'heading_error_out_channels_l2': 108, 'heading_error_pool_size_l2': 2, 'heading_error_out_channels_l3': 76, 'heading_error_pool_size_l3': 2, 'heading_error_fc_hidden': 45}. Best is trial 46 with value: 0.0885.
[rank: 0] Seed set to 42
GPU available: True (cuda), used: True
TPU available: False, using: 0 TPU cores
💡 Tip: For seamless cloud logging and experiment tracking, try installing [litlogger](https://pypi.org/project/litlogger/) to enable LitLogger, which logs metrics and artifacts automatically to the Lightning Experiments platform.
[rank: 0] Seed set to 42
[rank: 0] Seed set to 42
GPU available: True (cuda), used: True
TPU available: False, using: 0 TPU cores
💡 Tip: For seamless cloud logging and experiment tracking, try installing [litlogger](https://pypi.org/project/litlogger/) to enable LitLogger, which logs metrics and artifacts automatically to the Lightning Experiments platform.
GPU available: True (cuda), used: True
TPU available: False, using: 0 TPU cores
💡 Tip: For seamless cloud logging and experiment tracking, try installing [litlogger](https://pypi.org/project/litlogger/) to enable LitLogger, which logs metrics and artifacts automatically to the Lightning Experiments platform.
LOCAL_RANK: 0 - CUDA_VISIBLE_DEVICES: [0]
LOCAL_RANK: 0 - CUDA_VISIBLE_DEVICES: [0]
LOCAL_RANK: 0 - CUDA_VISIBLE_DEVICES: [0]
SLURM auto-requeueing enabled. Setting signal handlers.
SLURM auto-requeueing enabled. Setting signal handlers.
SLURM auto-requeueing enabled. Setting signal handlers.
`Trainer.fit` stopped: `max_epochs=20` reached.
`Trainer.fit` stopped: `max_epochs=20` reached.
`Trainer.fit` stopped: `max_epochs=20` reached.
