[I 2026-04-15 00:25:28,552] Trial 81 finished with value: 0.0988 and parameters: {'left_wall_dist_num_layers': 2, 'left_wall_dist_activation': 'relu', 'left_wall_dist_out_channels_l0': 69, 'left_wall_dist_pool_size_l0': 4, 'left_wall_dist_out_channels_l1': 72, 'left_wall_dist_pool_size_l1': 4, 'left_wall_dist_fc_hidden': 102, 'track_width_num_layers': 4, 'track_width_activation': 'relu', 'track_width_out_channels_l0': 68, 'track_width_pool_size_l0': 4, 'track_width_out_channels_l1': 37, 'track_width_pool_size_l1': 2, 'track_width_out_channels_l2': 121, 'track_width_pool_size_l2': 2, 'track_width_out_channels_l3': 138, 'track_width_pool_size_l3': 4, 'track_width_fc_hidden': 123, 'heading_error_num_layers': 3, 'heading_error_activation': 'elu', 'heading_error_out_channels_l0': 117, 'heading_error_pool_size_l0': 4, 'heading_error_out_channels_l1': 56, 'heading_error_pool_size_l1': 8, 'heading_error_out_channels_l2': 96, 'heading_error_pool_size_l2': 4, 'heading_error_fc_hidden': 43}. Best is trial 26 with value: 0.0907.
[rank: 0] Seed set to 42
[rank: 0] Seed set to 42
[rank: 0] Seed set to 42
GPU available: True (cuda), used: True
TPU available: False, using: 0 TPU cores
💡 Tip: For seamless cloud logging and experiment tracking, try installing [litlogger](https://pypi.org/project/litlogger/) to enable LitLogger, which logs metrics and artifacts automatically to the Lightning Experiments platform.
GPU available: True (cuda), used: True
TPU available: False, using: 0 TPU cores
GPU available: True (cuda), used: True
TPU available: False, using: 0 TPU cores
💡 Tip: For seamless cloud logging and experiment tracking, try installing [litlogger](https://pypi.org/project/litlogger/) to enable LitLogger, which logs metrics and artifacts automatically to the Lightning Experiments platform.
💡 Tip: For seamless cloud logging and experiment tracking, try installing [litlogger](https://pypi.org/project/litlogger/) to enable LitLogger, which logs metrics and artifacts automatically to the Lightning Experiments platform.
LOCAL_RANK: 0 - CUDA_VISIBLE_DEVICES: [0]
LOCAL_RANK: 0 - CUDA_VISIBLE_DEVICES: [0]
LOCAL_RANK: 0 - CUDA_VISIBLE_DEVICES: [0]
SLURM auto-requeueing enabled. Setting signal handlers.
SLURM auto-requeueing enabled. Setting signal handlers.
SLURM auto-requeueing enabled. Setting signal handlers.
`Trainer.fit` stopped: `max_epochs=30` reached.
`Trainer.fit` stopped: `max_epochs=30` reached.
`Trainer.fit` stopped: `max_epochs=30` reached.
[I 2026-04-15 00:28:12,148] Trial 82 finished with value: 0.0945 and parameters: {'left_wall_dist_num_layers': 2, 'left_wall_dist_activation': 'relu', 'left_wall_dist_out_channels_l0': 78, 'left_wall_dist_pool_size_l0': 4, 'left_wall_dist_out_channels_l1': 79, 'left_wall_dist_pool_size_l1': 4, 'left_wall_dist_fc_hidden': 95, 'track_width_num_layers': 4, 'track_width_activation': 'relu', 'track_width_out_channels_l0': 88, 'track_width_pool_size_l0': 4, 'track_width_out_channels_l1': 39, 'track_width_pool_size_l1': 2, 'track_width_out_channels_l2': 91, 'track_width_pool_size_l2': 2, 'track_width_out_channels_l3': 167, 'track_width_pool_size_l3': 4, 'track_width_fc_hidden': 108, 'heading_error_num_layers': 3, 'heading_error_activation': 'elu', 'heading_error_out_channels_l0': 108, 'heading_error_pool_size_l0': 4, 'heading_error_out_channels_l1': 49, 'heading_error_pool_size_l1': 8, 'heading_error_out_channels_l2': 82, 'heading_error_pool_size_l2': 4, 'heading_error_fc_hidden': 55}. Best is trial 26 with value: 0.0907.
[rank: 0] Seed set to 42
[rank: 0] Seed set to 42
[rank: 0] Seed set to 42
GPU available: True (cuda), used: True
TPU available: False, using: 0 TPU cores
💡 Tip: For seamless cloud logging and experiment tracking, try installing [litlogger](https://pypi.org/project/litlogger/) to enable LitLogger, which logs metrics and artifacts automatically to the Lightning Experiments platform.
GPU available: True (cuda), used: True
GPU available: True (cuda), used: True
TPU available: False, using: 0 TPU cores
TPU available: False, using: 0 TPU cores
💡 Tip: For seamless cloud logging and experiment tracking, try installing [litlogger](https://pypi.org/project/litlogger/) to enable LitLogger, which logs metrics and artifacts automatically to the Lightning Experiments platform.
💡 Tip: For seamless cloud logging and experiment tracking, try installing [litlogger](https://pypi.org/project/litlogger/) to enable LitLogger, which logs metrics and artifacts automatically to the Lightning Experiments platform.
LOCAL_RANK: 0 - CUDA_VISIBLE_DEVICES: [0]
LOCAL_RANK: 0 - CUDA_VISIBLE_DEVICES: [0]
LOCAL_RANK: 0 - CUDA_VISIBLE_DEVICES: [0]
SLURM auto-requeueing enabled. Setting signal handlers.
SLURM auto-requeueing enabled. Setting signal handlers.
SLURM auto-requeueing enabled. Setting signal handlers.
`Trainer.fit` stopped: `max_epochs=30` reached.
`Trainer.fit` stopped: `max_epochs=30` reached.
`Trainer.fit` stopped: `max_epochs=30` reached.
[I 2026-04-15 00:30:51,087] Trial 83 finished with value: 0.0946 and parameters: {'left_wall_dist_num_layers': 2, 'left_wall_dist_activation': 'relu', 'left_wall_dist_out_channels_l0': 78, 'left_wall_dist_pool_size_l0': 4, 'left_wall_dist_out_channels_l1': 98, 'left_wall_dist_pool_size_l1': 4, 'left_wall_dist_fc_hidden': 103, 'track_width_num_layers': 4, 'track_width_activation': 'relu', 'track_width_out_channels_l0': 83, 'track_width_pool_size_l0': 4, 'track_width_out_channels_l1': 34, 'track_width_pool_size_l1': 2, 'track_width_out_channels_l2': 94, 'track_width_pool_size_l2': 2, 'track_width_out_channels_l3': 169, 'track_width_pool_size_l3': 4, 'track_width_fc_hidden': 128, 'heading_error_num_layers': 3, 'heading_error_activation': 'elu', 'heading_error_out_channels_l0': 109, 'heading_error_pool_size_l0': 4, 'heading_error_out_channels_l1': 62, 'heading_error_pool_size_l1': 8, 'heading_error_out_channels_l2': 81, 'heading_error_pool_size_l2': 4, 'heading_error_fc_hidden': 48}. Best is trial 26 with value: 0.0907.
[rank: 0] Seed set to 42
[rank: 0] Seed set to 42
[rank: 0] Seed set to 42
GPU available: True (cuda), used: True
TPU available: False, using: 0 TPU cores
💡 Tip: For seamless cloud logging and experiment tracking, try installing [litlogger](https://pypi.org/project/litlogger/) to enable LitLogger, which logs metrics and artifacts automatically to the Lightning Experiments platform.
GPU available: True (cuda), used: True
TPU available: False, using: 0 TPU cores
💡 Tip: For seamless cloud logging and experiment tracking, try installing [litlogger](https://pypi.org/project/litlogger/) to enable LitLogger, which logs metrics and artifacts automatically to the Lightning Experiments platform.
GPU available: True (cuda), used: True
TPU available: False, using: 0 TPU cores
💡 Tip: For seamless cloud logging and experiment tracking, try installing [litlogger](https://pypi.org/project/litlogger/) to enable LitLogger, which logs metrics and artifacts automatically to the Lightning Experiments platform.
LOCAL_RANK: 0 - CUDA_VISIBLE_DEVICES: [0]
LOCAL_RANK: 0 - CUDA_VISIBLE_DEVICES: [0]
LOCAL_RANK: 0 - CUDA_VISIBLE_DEVICES: [0]
SLURM auto-requeueing enabled. Setting signal handlers.
SLURM auto-requeueing enabled. Setting signal handlers.
SLURM auto-requeueing enabled. Setting signal handlers.
`Trainer.fit` stopped: `max_epochs=30` reached.
`Trainer.fit` stopped: `max_epochs=30` reached.
`Trainer.fit` stopped: `max_epochs=30` reached.
[I 2026-04-15 00:33:30,607] Trial 84 finished with value: 0.1037 and parameters: {'left_wall_dist_num_layers': 2, 'left_wall_dist_activation': 'relu', 'left_wall_dist_out_channels_l0': 98, 'left_wall_dist_pool_size_l0': 2, 'left_wall_dist_out_channels_l1': 78, 'left_wall_dist_pool_size_l1': 4, 'track_width_num_layers': 4, 'track_width_activation': 'relu', 'track_width_out_channels_l0': 61, 'track_width_pool_size_l0': 4, 'track_width_out_channels_l1': 43, 'track_width_pool_size_l1': 2, 'track_width_out_channels_l2': 85, 'track_width_pool_size_l2': 2, 'track_width_out_channels_l3': 205, 'track_width_pool_size_l3': 4, 'track_width_fc_hidden': 117, 'heading_error_num_layers': 3, 'heading_error_activation': 'elu', 'heading_error_out_channels_l0': 104, 'heading_error_pool_size_l0': 4, 'heading_error_out_channels_l1': 104, 'heading_error_pool_size_l1': 8, 'heading_error_out_channels_l2': 66, 'heading_error_pool_size_l2': 4, 'heading_error_fc_hidden': 42}. Best is trial 26 with value: 0.0907.
[rank: 0] Seed set to 42
[rank: 0] Seed set to 42
[rank: 0] Seed set to 42
GPU available: True (cuda), used: True
TPU available: False, using: 0 TPU cores
💡 Tip: For seamless cloud logging and experiment tracking, try installing [litlogger](https://pypi.org/project/litlogger/) to enable LitLogger, which logs metrics and artifacts automatically to the Lightning Experiments platform.
GPU available: True (cuda), used: True
TPU available: False, using: 0 TPU cores
💡 Tip: For seamless cloud logging and experiment tracking, try installing [litlogger](https://pypi.org/project/litlogger/) to enable LitLogger, which logs metrics and artifacts automatically to the Lightning Experiments platform.
GPU available: True (cuda), used: True
TPU available: False, using: 0 TPU cores
💡 Tip: For seamless cloud logging and experiment tracking, try installing [litlogger](https://pypi.org/project/litlogger/) to enable LitLogger, which logs metrics and artifacts automatically to the Lightning Experiments platform.
LOCAL_RANK: 0 - CUDA_VISIBLE_DEVICES: [0]
LOCAL_RANK: 0 - CUDA_VISIBLE_DEVICES: [0]
LOCAL_RANK: 0 - CUDA_VISIBLE_DEVICES: [0]
SLURM auto-requeueing enabled. Setting signal handlers.
SLURM auto-requeueing enabled. Setting signal handlers.
SLURM auto-requeueing enabled. Setting signal handlers.
`Trainer.fit` stopped: `max_epochs=30` reached.
`Trainer.fit` stopped: `max_epochs=30` reached.
`Trainer.fit` stopped: `max_epochs=30` reached.
[I 2026-04-15 00:36:09,998] Trial 85 finished with value: 0.0978 and parameters: {'left_wall_dist_num_layers': 2, 'left_wall_dist_activation': 'relu', 'left_wall_dist_out_channels_l0': 60, 'left_wall_dist_pool_size_l0': 4, 'left_wall_dist_out_channels_l1': 113, 'left_wall_dist_pool_size_l1': 4, 'left_wall_dist_fc_hidden': 118, 'track_width_num_layers': 4, 'track_width_activation': 'relu', 'track_width_out_channels_l0': 43, 'track_width_pool_size_l0': 4, 'track_width_out_channels_l1': 40, 'track_width_pool_size_l1': 2, 'track_width_out_channels_l2': 100, 'track_width_pool_size_l2': 2, 'track_width_out_channels_l3': 186, 'track_width_pool_size_l3': 8, 'track_width_fc_hidden': 109, 'heading_error_num_layers': 3, 'heading_error_activation': 'elu', 'heading_error_out_channels_l0': 96, 'heading_error_pool_size_l0': 4, 'heading_error_out_channels_l1': 41, 'heading_error_pool_size_l1': 8, 'heading_error_out_channels_l2': 97, 'heading_error_pool_size_l2': 4, 'heading_error_fc_hidden': 50}. Best is trial 26 with value: 0.0907.
[rank: 0] Seed set to 42
[rank: 0] Seed set to 42
[rank: 0] Seed set to 42
GPU available: True (cuda), used: True
TPU available: False, using: 0 TPU cores
💡 Tip: For seamless cloud logging and experiment tracking, try installing [litlogger](https://pypi.org/project/litlogger/) to enable LitLogger, which logs metrics and artifacts automatically to the Lightning Experiments platform.
GPU available: True (cuda), used: True
TPU available: False, using: 0 TPU cores
💡 Tip: For seamless cloud logging and experiment tracking, try installing [litlogger](https://pypi.org/project/litlogger/) to enable LitLogger, which logs metrics and artifacts automatically to the Lightning Experiments platform.
GPU available: True (cuda), used: True
TPU available: False, using: 0 TPU cores
💡 Tip: For seamless cloud logging and experiment tracking, try installing [litlogger](https://pypi.org/project/litlogger/) to enable LitLogger, which logs metrics and artifacts automatically to the Lightning Experiments platform.
LOCAL_RANK: 0 - CUDA_VISIBLE_DEVICES: [0]
LOCAL_RANK: 0 - CUDA_VISIBLE_DEVICES: [0]
LOCAL_RANK: 0 - CUDA_VISIBLE_DEVICES: [0]
SLURM auto-requeueing enabled. Setting signal handlers.
SLURM auto-requeueing enabled. Setting signal handlers.
SLURM auto-requeueing enabled. Setting signal handlers.
`Trainer.fit` stopped: `max_epochs=30` reached.
`Trainer.fit` stopped: `max_epochs=30` reached.
`Trainer.fit` stopped: `max_epochs=30` reached.
[I 2026-04-15 00:38:46,423] Trial 86 finished with value: 0.1043 and parameters: {'left_wall_dist_num_layers': 2, 'left_wall_dist_activation': 'relu', 'left_wall_dist_out_channels_l0': 73, 'left_wall_dist_pool_size_l0': 4, 'left_wall_dist_out_channels_l1': 64, 'left_wall_dist_pool_size_l1': 4, 'left_wall_dist_fc_hidden': 96, 'track_width_num_layers': 4, 'track_width_activation': 'elu', 'track_width_out_channels_l0': 35, 'track_width_pool_size_l0': 4, 'track_width_out_channels_l1': 33, 'track_width_pool_size_l1': 2, 'track_width_out_channels_l2': 90, 'track_width_pool_size_l2': 2, 'track_width_out_channels_l3': 157, 'track_width_pool_size_l3': 8, 'track_width_fc_hidden': 110, 'heading_error_num_layers': 3, 'heading_error_activation': 'elu', 'heading_error_out_channels_l0': 121, 'heading_error_pool_size_l0': 4, 'heading_error_out_channels_l1': 57, 'heading_error_pool_size_l1': 8, 'heading_error_out_channels_l2': 72, 'heading_error_pool_size_l2': 4, 'heading_error_fc_hidden': 38}. Best is trial 26 with value: 0.0907.
[rank: 0] Seed set to 42
[rank: 0] Seed set to 42
[rank: 0] Seed set to 42
GPU available: True (cuda), used: True
TPU available: False, using: 0 TPU cores
💡 Tip: For seamless cloud logging and experiment tracking, try installing [litlogger](https://pypi.org/project/litlogger/) to enable LitLogger, which logs metrics and artifacts automatically to the Lightning Experiments platform.
GPU available: True (cuda), used: True
TPU available: False, using: 0 TPU cores
💡 Tip: For seamless cloud logging and experiment tracking, try installing [litlogger](https://pypi.org/project/litlogger/) to enable LitLogger, which logs metrics and artifacts automatically to the Lightning Experiments platform.
GPU available: True (cuda), used: True
TPU available: False, using: 0 TPU cores
💡 Tip: For seamless cloud logging and experiment tracking, try installing [litlogger](https://pypi.org/project/litlogger/) to enable LitLogger, which logs metrics and artifacts automatically to the Lightning Experiments platform.
LOCAL_RANK: 0 - CUDA_VISIBLE_DEVICES: [0]
LOCAL_RANK: 0 - CUDA_VISIBLE_DEVICES: [0]
LOCAL_RANK: 0 - CUDA_VISIBLE_DEVICES: [0]
SLURM auto-requeueing enabled. Setting signal handlers.
SLURM auto-requeueing enabled. Setting signal handlers.
SLURM auto-requeueing enabled. Setting signal handlers.
`Trainer.fit` stopped: `max_epochs=30` reached.
`Trainer.fit` stopped: `max_epochs=30` reached.
`Trainer.fit` stopped: `max_epochs=30` reached.
[I 2026-04-15 00:41:24,292] Trial 87 finished with value: 0.1081 and parameters: {'left_wall_dist_num_layers': 2, 'left_wall_dist_activation': 'relu', 'left_wall_dist_out_channels_l0': 87, 'left_wall_dist_pool_size_l0': 4, 'left_wall_dist_out_channels_l1': 81, 'left_wall_dist_pool_size_l1': 4, 'left_wall_dist_fc_hidden': 108, 'track_width_num_layers': 4, 'track_width_activation': 'relu', 'track_width_out_channels_l0': 86, 'track_width_pool_size_l0': 4, 'track_width_out_channels_l1': 36, 'track_width_pool_size_l1': 2, 'track_width_out_channels_l2': 210, 'track_width_pool_size_l2': 2, 'track_width_out_channels_l3': 170, 'track_width_pool_size_l3': 4, 'track_width_fc_hidden': 124, 'heading_error_num_layers': 3, 'heading_error_activation': 'elu', 'heading_error_out_channels_l0': 51, 'heading_error_pool_size_l0': 8, 'heading_error_out_channels_l1': 51, 'heading_error_pool_size_l1': 4, 'heading_error_out_channels_l2': 53, 'heading_error_pool_size_l2': 2, 'heading_error_fc_hidden': 44}. Best is trial 26 with value: 0.0907.
[rank: 0] Seed set to 42
[rank: 0] Seed set to 42
[rank: 0] Seed set to 42
GPU available: True (cuda), used: True
TPU available: False, using: 0 TPU cores
💡 Tip: For seamless cloud logging and experiment tracking, try installing [litlogger](https://pypi.org/project/litlogger/) to enable LitLogger, which logs metrics and artifacts automatically to the Lightning Experiments platform.
GPU available: True (cuda), used: True
TPU available: False, using: 0 TPU cores
💡 Tip: For seamless cloud logging and experiment tracking, try installing [litlogger](https://pypi.org/project/litlogger/) to enable LitLogger, which logs metrics and artifacts automatically to the Lightning Experiments platform.
GPU available: True (cuda), used: True
TPU available: False, using: 0 TPU cores
💡 Tip: For seamless cloud logging and experiment tracking, try installing [litlogger](https://pypi.org/project/litlogger/) to enable LitLogger, which logs metrics and artifacts automatically to the Lightning Experiments platform.
LOCAL_RANK: 0 - CUDA_VISIBLE_DEVICES: [0]
LOCAL_RANK: 0 - CUDA_VISIBLE_DEVICES: [0]
LOCAL_RANK: 0 - CUDA_VISIBLE_DEVICES: [0]
SLURM auto-requeueing enabled. Setting signal handlers.
SLURM auto-requeueing enabled. Setting signal handlers.
SLURM auto-requeueing enabled. Setting signal handlers.
`Trainer.fit` stopped: `max_epochs=30` reached.
`Trainer.fit` stopped: `max_epochs=30` reached.
[I 2026-04-15 00:43:53,432] Trial 88 finished with value: 0.1167 and parameters: {'left_wall_dist_num_layers': 2, 'left_wall_dist_activation': 'relu', 'left_wall_dist_out_channels_l0': 92, 'left_wall_dist_pool_size_l0': 8, 'left_wall_dist_out_channels_l1': 90, 'left_wall_dist_pool_size_l1': 2, 'left_wall_dist_fc_hidden': 104, 'track_width_num_layers': 2, 'track_width_activation': 'relu', 'track_width_out_channels_l0': 75, 'track_width_pool_size_l0': 4, 'track_width_out_channels_l1': 38, 'track_width_pool_size_l1': 2, 'track_width_fc_hidden': 126, 'heading_error_num_layers': 3, 'heading_error_activation': 'elu', 'heading_error_out_channels_l0': 87, 'heading_error_pool_size_l0': 4, 'heading_error_out_channels_l1': 43, 'heading_error_pool_size_l1': 8, 'heading_error_out_channels_l2': 46, 'heading_error_pool_size_l2': 4, 'heading_error_fc_hidden': 47}. Best is trial 26 with value: 0.0907.
[rank: 0] Seed set to 42
[rank: 0] Seed set to 42
[rank: 0] Seed set to 42
GPU available: True (cuda), used: True
TPU available: False, using: 0 TPU cores
💡 Tip: For seamless cloud logging and experiment tracking, try installing [litlogger](https://pypi.org/project/litlogger/) to enable LitLogger, which logs metrics and artifacts automatically to the Lightning Experiments platform.
GPU available: True (cuda), used: True
TPU available: False, using: 0 TPU cores
💡 Tip: For seamless cloud logging and experiment tracking, try installing [litlogger](https://pypi.org/project/litlogger/) to enable LitLogger, which logs metrics and artifacts automatically to the Lightning Experiments platform.
GPU available: True (cuda), used: True
TPU available: False, using: 0 TPU cores
💡 Tip: For seamless cloud logging and experiment tracking, try installing [litlogger](https://pypi.org/project/litlogger/) to enable LitLogger, which logs metrics and artifacts automatically to the Lightning Experiments platform.
LOCAL_RANK: 0 - CUDA_VISIBLE_DEVICES: [0]
LOCAL_RANK: 0 - CUDA_VISIBLE_DEVICES: [0]
LOCAL_RANK: 0 - CUDA_VISIBLE_DEVICES: [0]
SLURM auto-requeueing enabled. Setting signal handlers.
SLURM auto-requeueing enabled. Setting signal handlers.
SLURM auto-requeueing enabled. Setting signal handlers.
`Trainer.fit` stopped: `max_epochs=30` reached.
`Trainer.fit` stopped: `max_epochs=30` reached.
`Trainer.fit` stopped: `max_epochs=30` reached.
