[I 2026-04-16 00:33:05,332] Trial 78 finished with value: 0.1013 and parameters: {'left_wall_dist_num_layers': 2, 'left_wall_dist_activation': 'relu', 'left_wall_dist_out_channels_l0': 87, 'left_wall_dist_pool_size_l0': 4, 'left_wall_dist_out_channels_l1': 60, 'left_wall_dist_pool_size_l1': 8, 'left_wall_dist_fc_hidden': 66, 'track_width_num_layers': 3, 'track_width_activation': 'relu', 'track_width_out_channels_l0': 91, 'track_width_pool_size_l0': 4, 'track_width_out_channels_l1': 95, 'track_width_pool_size_l1': 8, 'track_width_out_channels_l2': 59, 'track_width_pool_size_l2': 4, 'track_width_fc_hidden': 63, 'heading_error_num_layers': 3, 'heading_error_activation': 'elu', 'heading_error_out_channels_l0': 83, 'heading_error_pool_size_l0': 2, 'heading_error_out_channels_l1': 53, 'heading_error_pool_size_l1': 4, 'heading_error_out_channels_l2': 84, 'heading_error_pool_size_l2': 2, 'heading_error_fc_hidden': 88}. Best is trial 56 with value: 0.0844.
[rank: 0] Seed set to 42
[rank: 0] Seed set to 42
[rank: 0] Seed set to 42
GPU available: True (cuda), used: True
TPU available: False, using: 0 TPU cores
💡 Tip: For seamless cloud logging and experiment tracking, try installing [litlogger](https://pypi.org/project/litlogger/) to enable LitLogger, which logs metrics and artifacts automatically to the Lightning Experiments platform.
GPU available: True (cuda), used: True
TPU available: False, using: 0 TPU cores
💡 Tip: For seamless cloud logging and experiment tracking, try installing [litlogger](https://pypi.org/project/litlogger/) to enable LitLogger, which logs metrics and artifacts automatically to the Lightning Experiments platform.
GPU available: True (cuda), used: True
TPU available: False, using: 0 TPU cores
💡 Tip: For seamless cloud logging and experiment tracking, try installing [litlogger](https://pypi.org/project/litlogger/) to enable LitLogger, which logs metrics and artifacts automatically to the Lightning Experiments platform.
LOCAL_RANK: 0 - CUDA_VISIBLE_DEVICES: [0]
LOCAL_RANK: 0 - CUDA_VISIBLE_DEVICES: [0]
LOCAL_RANK: 0 - CUDA_VISIBLE_DEVICES: [0]
SLURM auto-requeueing enabled. Setting signal handlers.
SLURM auto-requeueing enabled. Setting signal handlers.
SLURM auto-requeueing enabled. Setting signal handlers.
`Trainer.fit` stopped: `max_epochs=30` reached.
`Trainer.fit` stopped: `max_epochs=30` reached.
`Trainer.fit` stopped: `max_epochs=30` reached.
[I 2026-04-16 00:35:23,592] Trial 79 finished with value: 0.1071 and parameters: {'left_wall_dist_num_layers': 2, 'left_wall_dist_activation': 'relu', 'left_wall_dist_out_channels_l0': 32, 'left_wall_dist_pool_size_l0': 4, 'left_wall_dist_out_channels_l1': 65, 'left_wall_dist_pool_size_l1': 8, 'left_wall_dist_fc_hidden': 62, 'track_width_num_layers': 3, 'track_width_activation': 'relu', 'track_width_out_channels_l0': 66, 'track_width_pool_size_l0': 4, 'track_width_out_channels_l1': 80, 'track_width_pool_size_l1': 8, 'track_width_out_channels_l2': 103, 'track_width_pool_size_l2': 4, 'track_width_fc_hidden': 97, 'heading_error_num_layers': 3, 'heading_error_activation': 'elu', 'heading_error_out_channels_l0': 124, 'heading_error_pool_size_l0': 2, 'heading_error_out_channels_l1': 81, 'heading_error_pool_size_l1': 4, 'heading_error_out_channels_l2': 75, 'heading_error_pool_size_l2': 4, 'heading_error_fc_hidden': 67}. Best is trial 56 with value: 0.0844.
[rank: 0] Seed set to 42
[rank: 0] Seed set to 42
[rank: 0] Seed set to 42
GPU available: True (cuda), used: True
TPU available: False, using: 0 TPU cores
💡 Tip: For seamless cloud logging and experiment tracking, try installing [litlogger](https://pypi.org/project/litlogger/) to enable LitLogger, which logs metrics and artifacts automatically to the Lightning Experiments platform.
GPU available: True (cuda), used: True
TPU available: False, using: 0 TPU cores
💡 Tip: For seamless cloud logging and experiment tracking, try installing [litlogger](https://pypi.org/project/litlogger/) to enable LitLogger, which logs metrics and artifacts automatically to the Lightning Experiments platform.
GPU available: True (cuda), used: True
TPU available: False, using: 0 TPU cores
💡 Tip: For seamless cloud logging and experiment tracking, try installing [litlogger](https://pypi.org/project/litlogger/) to enable LitLogger, which logs metrics and artifacts automatically to the Lightning Experiments platform.
LOCAL_RANK: 0 - CUDA_VISIBLE_DEVICES: [0]
LOCAL_RANK: 0 - CUDA_VISIBLE_DEVICES: [0]
LOCAL_RANK: 0 - CUDA_VISIBLE_DEVICES: [0]
SLURM auto-requeueing enabled. Setting signal handlers.
SLURM auto-requeueing enabled. Setting signal handlers.
SLURM auto-requeueing enabled. Setting signal handlers.
`Trainer.fit` stopped: `max_epochs=30` reached.
`Trainer.fit` stopped: `max_epochs=30` reached.
`Trainer.fit` stopped: `max_epochs=30` reached.
[I 2026-04-16 00:37:40,738] Trial 80 finished with value: 0.0969 and parameters: {'left_wall_dist_num_layers': 2, 'left_wall_dist_activation': 'relu', 'left_wall_dist_out_channels_l0': 76, 'left_wall_dist_pool_size_l0': 4, 'left_wall_dist_out_channels_l1': 56, 'left_wall_dist_pool_size_l1': 8, 'left_wall_dist_fc_hidden': 54, 'track_width_num_layers': 3, 'track_width_activation': 'relu', 'track_width_out_channels_l0': 40, 'track_width_pool_size_l0': 4, 'track_width_out_channels_l1': 50, 'track_width_pool_size_l1': 8, 'track_width_out_channels_l2': 116, 'track_width_pool_size_l2': 4, 'track_width_fc_hidden': 105, 'heading_error_num_layers': 3, 'heading_error_activation': 'elu', 'heading_error_out_channels_l0': 110, 'heading_error_pool_size_l0': 2, 'heading_error_out_channels_l1': 62, 'heading_error_pool_size_l1': 4, 'heading_error_out_channels_l2': 114, 'heading_error_pool_size_l2': 4, 'heading_error_fc_hidden': 71}. Best is trial 56 with value: 0.0844.
[rank: 0] Seed set to 42
[rank: 0] Seed set to 42
[rank: 0] Seed set to 42
GPU available: True (cuda), used: True
TPU available: False, using: 0 TPU cores
GPU available: True (cuda), used: True
TPU available: False, using: 0 TPU cores
GPU available: True (cuda), used: True
TPU available: False, using: 0 TPU cores
💡 Tip: For seamless cloud logging and experiment tracking, try installing [litlogger](https://pypi.org/project/litlogger/) to enable LitLogger, which logs metrics and artifacts automatically to the Lightning Experiments platform.
💡 Tip: For seamless cloud logging and experiment tracking, try installing [litlogger](https://pypi.org/project/litlogger/) to enable LitLogger, which logs metrics and artifacts automatically to the Lightning Experiments platform.
💡 Tip: For seamless cloud logging and experiment tracking, try installing [litlogger](https://pypi.org/project/litlogger/) to enable LitLogger, which logs metrics and artifacts automatically to the Lightning Experiments platform.
LOCAL_RANK: 0 - CUDA_VISIBLE_DEVICES: [0]
LOCAL_RANK: 0 - CUDA_VISIBLE_DEVICES: [0]
LOCAL_RANK: 0 - CUDA_VISIBLE_DEVICES: [0]
SLURM auto-requeueing enabled. Setting signal handlers.
SLURM auto-requeueing enabled. Setting signal handlers.
SLURM auto-requeueing enabled. Setting signal handlers.
`Trainer.fit` stopped: `max_epochs=30` reached.
`Trainer.fit` stopped: `max_epochs=30` reached.
`Trainer.fit` stopped: `max_epochs=30` reached.
[I 2026-04-16 00:39:58,524] Trial 81 finished with value: 0.1009 and parameters: {'left_wall_dist_num_layers': 2, 'left_wall_dist_activation': 'relu', 'left_wall_dist_out_channels_l0': 79, 'left_wall_dist_pool_size_l0': 4, 'left_wall_dist_out_channels_l1': 57, 'left_wall_dist_pool_size_l1': 8, 'left_wall_dist_fc_hidden': 54, 'track_width_num_layers': 3, 'track_width_activation': 'relu', 'track_width_out_channels_l0': 41, 'track_width_pool_size_l0': 4, 'track_width_out_channels_l1': 49, 'track_width_pool_size_l1': 8, 'track_width_out_channels_l2': 125, 'track_width_pool_size_l2': 4, 'track_width_fc_hidden': 109, 'heading_error_num_layers': 3, 'heading_error_activation': 'elu', 'heading_error_out_channels_l0': 111, 'heading_error_pool_size_l0': 2, 'heading_error_out_channels_l1': 61, 'heading_error_pool_size_l1': 4, 'heading_error_out_channels_l2': 104, 'heading_error_pool_size_l2': 4, 'heading_error_fc_hidden': 71}. Best is trial 56 with value: 0.0844.
[rank: 0] Seed set to 42
[rank: 0] Seed set to 42
[rank: 0] Seed set to 42
GPU available: True (cuda), used: True
TPU available: False, using: 0 TPU cores
GPU available: True (cuda), used: True
TPU available: False, using: 0 TPU cores
💡 Tip: For seamless cloud logging and experiment tracking, try installing [litlogger](https://pypi.org/project/litlogger/) to enable LitLogger, which logs metrics and artifacts automatically to the Lightning Experiments platform.
💡 Tip: For seamless cloud logging and experiment tracking, try installing [litlogger](https://pypi.org/project/litlogger/) to enable LitLogger, which logs metrics and artifacts automatically to the Lightning Experiments platform.
GPU available: True (cuda), used: True
TPU available: False, using: 0 TPU cores
💡 Tip: For seamless cloud logging and experiment tracking, try installing [litlogger](https://pypi.org/project/litlogger/) to enable LitLogger, which logs metrics and artifacts automatically to the Lightning Experiments platform.
LOCAL_RANK: 0 - CUDA_VISIBLE_DEVICES: [0]
LOCAL_RANK: 0 - CUDA_VISIBLE_DEVICES: [0]
LOCAL_RANK: 0 - CUDA_VISIBLE_DEVICES: [0]
SLURM auto-requeueing enabled. Setting signal handlers.
SLURM auto-requeueing enabled. Setting signal handlers.
SLURM auto-requeueing enabled. Setting signal handlers.
`Trainer.fit` stopped: `max_epochs=30` reached.
`Trainer.fit` stopped: `max_epochs=30` reached.
`Trainer.fit` stopped: `max_epochs=30` reached.
[I 2026-04-16 00:42:15,756] Trial 82 finished with value: 0.101 and parameters: {'left_wall_dist_num_layers': 2, 'left_wall_dist_activation': 'relu', 'left_wall_dist_out_channels_l0': 69, 'left_wall_dist_pool_size_l0': 4, 'left_wall_dist_out_channels_l1': 51, 'left_wall_dist_pool_size_l1': 8, 'left_wall_dist_fc_hidden': 50, 'track_width_num_layers': 3, 'track_width_activation': 'relu', 'track_width_out_channels_l0': 33, 'track_width_pool_size_l0': 4, 'track_width_out_channels_l1': 38, 'track_width_pool_size_l1': 8, 'track_width_out_channels_l2': 115, 'track_width_pool_size_l2': 4, 'track_width_fc_hidden': 108, 'heading_error_num_layers': 3, 'heading_error_activation': 'elu', 'heading_error_out_channels_l0': 88, 'heading_error_pool_size_l0': 2, 'heading_error_out_channels_l1': 71, 'heading_error_pool_size_l1': 4, 'heading_error_out_channels_l2': 113, 'heading_error_pool_size_l2': 4, 'heading_error_fc_hidden': 76}. Best is trial 56 with value: 0.0844.
[rank: 0] Seed set to 42
[rank: 0] Seed set to 42
[rank: 0] Seed set to 42
GPU available: True (cuda), used: True
TPU available: False, using: 0 TPU cores
💡 Tip: For seamless cloud logging and experiment tracking, try installing [litlogger](https://pypi.org/project/litlogger/) to enable LitLogger, which logs metrics and artifacts automatically to the Lightning Experiments platform.
GPU available: True (cuda), used: True
TPU available: False, using: 0 TPU cores
💡 Tip: For seamless cloud logging and experiment tracking, try installing [litlogger](https://pypi.org/project/litlogger/) to enable LitLogger, which logs metrics and artifacts automatically to the Lightning Experiments platform.
GPU available: True (cuda), used: True
TPU available: False, using: 0 TPU cores
💡 Tip: For seamless cloud logging and experiment tracking, try installing [litlogger](https://pypi.org/project/litlogger/) to enable LitLogger, which logs metrics and artifacts automatically to the Lightning Experiments platform.
LOCAL_RANK: 0 - CUDA_VISIBLE_DEVICES: [0]
LOCAL_RANK: 0 - CUDA_VISIBLE_DEVICES: [0]
LOCAL_RANK: 0 - CUDA_VISIBLE_DEVICES: [0]
SLURM auto-requeueing enabled. Setting signal handlers.
SLURM auto-requeueing enabled. Setting signal handlers.
SLURM auto-requeueing enabled. Setting signal handlers.
`Trainer.fit` stopped: `max_epochs=30` reached.
`Trainer.fit` stopped: `max_epochs=30` reached.
`Trainer.fit` stopped: `max_epochs=30` reached.
[I 2026-04-16 00:44:31,808] Trial 83 finished with value: 0.1173 and parameters: {'left_wall_dist_num_layers': 2, 'left_wall_dist_activation': 'relu', 'left_wall_dist_out_channels_l0': 75, 'left_wall_dist_pool_size_l0': 4, 'left_wall_dist_out_channels_l1': 47, 'left_wall_dist_pool_size_l1': 8, 'left_wall_dist_fc_hidden': 61, 'track_width_num_layers': 3, 'track_width_activation': 'relu', 'track_width_out_channels_l0': 45, 'track_width_pool_size_l0': 4, 'track_width_out_channels_l1': 67, 'track_width_pool_size_l1': 8, 'track_width_out_channels_l2': 138, 'track_width_pool_size_l2': 4, 'track_width_fc_hidden': 71, 'heading_error_num_layers': 3, 'heading_error_activation': 'elu', 'heading_error_out_channels_l0': 96, 'heading_error_pool_size_l0': 2, 'heading_error_out_channels_l1': 44, 'heading_error_pool_size_l1': 4, 'heading_error_out_channels_l2': 120, 'heading_error_pool_size_l2': 4, 'heading_error_fc_hidden': 74}. Best is trial 56 with value: 0.0844.
[rank: 0] Seed set to 42
[rank: 0] Seed set to 42
[rank: 0] Seed set to 42
GPU available: True (cuda), used: True
TPU available: False, using: 0 TPU cores
💡 Tip: For seamless cloud logging and experiment tracking, try installing [litlogger](https://pypi.org/project/litlogger/) to enable LitLogger, which logs metrics and artifacts automatically to the Lightning Experiments platform.
GPU available: True (cuda), used: True
TPU available: False, using: 0 TPU cores
💡 Tip: For seamless cloud logging and experiment tracking, try installing [litlogger](https://pypi.org/project/litlogger/) to enable LitLogger, which logs metrics and artifacts automatically to the Lightning Experiments platform.
GPU available: True (cuda), used: True
TPU available: False, using: 0 TPU cores
💡 Tip: For seamless cloud logging and experiment tracking, try installing [litlogger](https://pypi.org/project/litlogger/) to enable LitLogger, which logs metrics and artifacts automatically to the Lightning Experiments platform.
LOCAL_RANK: 0 - CUDA_VISIBLE_DEVICES: [0]
LOCAL_RANK: 0 - CUDA_VISIBLE_DEVICES: [0]
LOCAL_RANK: 0 - CUDA_VISIBLE_DEVICES: [0]
SLURM auto-requeueing enabled. Setting signal handlers.
SLURM auto-requeueing enabled. Setting signal handlers.
SLURM auto-requeueing enabled. Setting signal handlers.
`Trainer.fit` stopped: `max_epochs=30` reached.
`Trainer.fit` stopped: `max_epochs=30` reached.
`Trainer.fit` stopped: `max_epochs=30` reached.
[I 2026-04-16 00:46:50,403] Trial 84 finished with value: 0.1101 and parameters: {'left_wall_dist_num_layers': 2, 'left_wall_dist_activation': 'relu', 'left_wall_dist_out_channels_l0': 59, 'left_wall_dist_pool_size_l0': 4, 'left_wall_dist_out_channels_l1': 44, 'left_wall_dist_pool_size_l1': 8, 'left_wall_dist_fc_hidden': 56, 'track_width_num_layers': 3, 'track_width_activation': 'relu', 'track_width_out_channels_l0': 36, 'track_width_pool_size_l0': 4, 'track_width_out_channels_l1': 45, 'track_width_pool_size_l1': 8, 'track_width_out_channels_l2': 67, 'track_width_pool_size_l2': 4, 'track_width_fc_hidden': 76, 'heading_error_num_layers': 3, 'heading_error_activation': 'elu', 'heading_error_out_channels_l0': 152, 'heading_error_pool_size_l0': 2, 'heading_error_out_channels_l1': 58, 'heading_error_pool_size_l1': 4, 'heading_error_out_channels_l2': 160, 'heading_error_pool_size_l2': 4, 'heading_error_fc_hidden': 84}. Best is trial 56 with value: 0.0844.
[rank: 0] Seed set to 42
[rank: 0] Seed set to 42
[rank: 0] Seed set to 42
GPU available: True (cuda), used: True
TPU available: False, using: 0 TPU cores
💡 Tip: For seamless cloud logging and experiment tracking, try installing [litlogger](https://pypi.org/project/litlogger/) to enable LitLogger, which logs metrics and artifacts automatically to the Lightning Experiments platform.
GPU available: True (cuda), used: True
TPU available: False, using: 0 TPU cores
💡 Tip: For seamless cloud logging and experiment tracking, try installing [litlogger](https://pypi.org/project/litlogger/) to enable LitLogger, which logs metrics and artifacts automatically to the Lightning Experiments platform.
GPU available: True (cuda), used: True
TPU available: False, using: 0 TPU cores
💡 Tip: For seamless cloud logging and experiment tracking, try installing [litlogger](https://pypi.org/project/litlogger/) to enable LitLogger, which logs metrics and artifacts automatically to the Lightning Experiments platform.
LOCAL_RANK: 0 - CUDA_VISIBLE_DEVICES: [0]
LOCAL_RANK: 0 - CUDA_VISIBLE_DEVICES: [0]
LOCAL_RANK: 0 - CUDA_VISIBLE_DEVICES: [0]
SLURM auto-requeueing enabled. Setting signal handlers.
SLURM auto-requeueing enabled. Setting signal handlers.
SLURM auto-requeueing enabled. Setting signal handlers.
`Trainer.fit` stopped: `max_epochs=30` reached.
`Trainer.fit` stopped: `max_epochs=30` reached.
`Trainer.fit` stopped: `max_epochs=30` reached.
[I 2026-04-16 00:49:10,996] Trial 85 finished with value: 0.0946 and parameters: {'left_wall_dist_num_layers': 2, 'left_wall_dist_activation': 'relu', 'left_wall_dist_out_channels_l0': 98, 'left_wall_dist_pool_size_l0': 4, 'left_wall_dist_out_channels_l1': 54, 'left_wall_dist_pool_size_l1': 8, 'left_wall_dist_fc_hidden': 65, 'track_width_num_layers': 3, 'track_width_activation': 'relu', 'track_width_out_channels_l0': 51, 'track_width_pool_size_l0': 4, 'track_width_out_channels_l1': 41, 'track_width_pool_size_l1': 4, 'track_width_out_channels_l2': 73, 'track_width_pool_size_l2': 4, 'track_width_fc_hidden': 59, 'heading_error_num_layers': 3, 'heading_error_activation': 'elu', 'heading_error_out_channels_l0': 128, 'heading_error_pool_size_l0': 2, 'heading_error_out_channels_l1': 69, 'heading_error_pool_size_l1': 4, 'heading_error_out_channels_l2': 127, 'heading_error_pool_size_l2': 4, 'heading_error_fc_hidden': 70}. Best is trial 56 with value: 0.0844.
[rank: 0] Seed set to 42
[rank: 0] Seed set to 42
[rank: 0] Seed set to 42
GPU available: True (cuda), used: True
TPU available: False, using: 0 TPU cores
💡 Tip: For seamless cloud logging and experiment tracking, try installing [litlogger](https://pypi.org/project/litlogger/) to enable LitLogger, which logs metrics and artifacts automatically to the Lightning Experiments platform.
GPU available: True (cuda), used: True
TPU available: False, using: 0 TPU cores
💡 Tip: For seamless cloud logging and experiment tracking, try installing [litlogger](https://pypi.org/project/litlogger/) to enable LitLogger, which logs metrics and artifacts automatically to the Lightning Experiments platform.
GPU available: True (cuda), used: True
TPU available: False, using: 0 TPU cores
💡 Tip: For seamless cloud logging and experiment tracking, try installing [litlogger](https://pypi.org/project/litlogger/) to enable LitLogger, which logs metrics and artifacts automatically to the Lightning Experiments platform.
LOCAL_RANK: 0 - CUDA_VISIBLE_DEVICES: [0]
LOCAL_RANK: 0 - CUDA_VISIBLE_DEVICES: [0]
LOCAL_RANK: 0 - CUDA_VISIBLE_DEVICES: [0]
SLURM auto-requeueing enabled. Setting signal handlers.
SLURM auto-requeueing enabled. Setting signal handlers.
SLURM auto-requeueing enabled. Setting signal handlers.
`Trainer.fit` stopped: `max_epochs=30` reached.
`Trainer.fit` stopped: `max_epochs=30` reached.
`Trainer.fit` stopped: `max_epochs=30` reached.
[I 2026-04-16 00:51:33,240] Trial 86 finished with value: 0.0952 and parameters: {'left_wall_dist_num_layers': 2, 'left_wall_dist_activation': 'elu', 'left_wall_dist_out_channels_l0': 99, 'left_wall_dist_pool_size_l0': 8, 'left_wall_dist_out_channels_l1': 48, 'left_wall_dist_pool_size_l1': 8, 'left_wall_dist_fc_hidden': 70, 'track_width_num_layers': 3, 'track_width_activation': 'relu', 'track_width_out_channels_l0': 51, 'track_width_pool_size_l0': 4, 'track_width_out_channels_l1': 40, 'track_width_pool_size_l1': 4, 'track_width_out_channels_l2': 72, 'track_width_pool_size_l2': 4, 'track_width_fc_hidden': 59, 'heading_error_num_layers': 3, 'heading_error_activation': 'elu', 'heading_error_out_channels_l0': 124, 'heading_error_pool_size_l0': 2, 'heading_error_out_channels_l1': 69, 'heading_error_pool_size_l1': 4, 'heading_error_out_channels_l2': 129, 'heading_error_pool_size_l2': 4, 'heading_error_fc_hidden': 69}. Best is trial 56 with value: 0.0844.
[rank: 0] Seed set to 42
[rank: 0] Seed set to 42
[rank: 0] Seed set to 42
GPU available: True (cuda), used: True
TPU available: False, using: 0 TPU cores
💡 Tip: For seamless cloud logging and experiment tracking, try installing [litlogger](https://pypi.org/project/litlogger/) to enable LitLogger, which logs metrics and artifacts automatically to the Lightning Experiments platform.
GPU available: True (cuda), used: True
TPU available: False, using: 0 TPU cores
💡 Tip: For seamless cloud logging and experiment tracking, try installing [litlogger](https://pypi.org/project/litlogger/) to enable LitLogger, which logs metrics and artifacts automatically to the Lightning Experiments platform.
GPU available: True (cuda), used: True
TPU available: False, using: 0 TPU cores
💡 Tip: For seamless cloud logging and experiment tracking, try installing [litlogger](https://pypi.org/project/litlogger/) to enable LitLogger, which logs metrics and artifacts automatically to the Lightning Experiments platform.
LOCAL_RANK: 0 - CUDA_VISIBLE_DEVICES: [0]
LOCAL_RANK: 0 - CUDA_VISIBLE_DEVICES: [0]
LOCAL_RANK: 0 - CUDA_VISIBLE_DEVICES: [0]
SLURM auto-requeueing enabled. Setting signal handlers.
SLURM auto-requeueing enabled. Setting signal handlers.
SLURM auto-requeueing enabled. Setting signal handlers.
`Trainer.fit` stopped: `max_epochs=30` reached.
`Trainer.fit` stopped: `max_epochs=30` reached.
`Trainer.fit` stopped: `max_epochs=30` reached.
