[I 2026-04-15 23:01:41,612] Trial 34 finished with value: inf and parameters: {'left_wall_dist_num_layers': 3, 'left_wall_dist_activation': 'elu', 'left_wall_dist_out_channels_l0': 194, 'left_wall_dist_pool_size_l0': 2, 'left_wall_dist_out_channels_l1': 112, 'left_wall_dist_pool_size_l1': 4, 'left_wall_dist_out_channels_l2': 186, 'left_wall_dist_pool_size_l2': 8, 'left_wall_dist_fc_hidden': 71, 'track_width_num_layers': 4, 'track_width_activation': 'elu', 'track_width_out_channels_l0': 75, 'track_width_pool_size_l0': 2, 'track_width_out_channels_l1': 83, 'track_width_pool_size_l1': 4, 'track_width_out_channels_l2': 186, 'track_width_pool_size_l2': 4, 'track_width_out_channels_l3': 43, 'track_width_pool_size_l3': 8, 'heading_error_num_layers': 5, 'heading_error_activation': 'elu', 'heading_error_out_channels_l0': 90, 'heading_error_pool_size_l0': 4, 'heading_error_out_channels_l1': 68, 'heading_error_pool_size_l1': 4, 'heading_error_out_channels_l2': 43, 'heading_error_pool_size_l2': 8, 'heading_error_out_channels_l3': 41, 'heading_error_pool_size_l3': 2, 'heading_error_out_channels_l4': 63, 'heading_error_pool_size_l4': 2}. Best is trial 27 with value: 0.13.
[rank: 0] Seed set to 42
[rank: 0] Seed set to 42
[rank: 0] Seed set to 42
GPU available: True (cuda), used: True
TPU available: False, using: 0 TPU cores
💡 Tip: For seamless cloud logging and experiment tracking, try installing [litlogger](https://pypi.org/project/litlogger/) to enable LitLogger, which logs metrics and artifacts automatically to the Lightning Experiments platform.
GPU available: True (cuda), used: True
TPU available: False, using: 0 TPU cores
💡 Tip: For seamless cloud logging and experiment tracking, try installing [litlogger](https://pypi.org/project/litlogger/) to enable LitLogger, which logs metrics and artifacts automatically to the Lightning Experiments platform.
GPU available: True (cuda), used: True
TPU available: False, using: 0 TPU cores
💡 Tip: For seamless cloud logging and experiment tracking, try installing [litlogger](https://pypi.org/project/litlogger/) to enable LitLogger, which logs metrics and artifacts automatically to the Lightning Experiments platform.
LOCAL_RANK: 0 - CUDA_VISIBLE_DEVICES: [0]
LOCAL_RANK: 0 - CUDA_VISIBLE_DEVICES: [0]
LOCAL_RANK: 0 - CUDA_VISIBLE_DEVICES: [0]
Traceback (most recent call last):
  File "/nas/longleaf/home/zayah/f1tenth_ng_zc/packages/f110_scripts/src/f110_scripts/train/train_nn.py", line 595, in <module>
    main()
  File "/nas/longleaf/home/zayah/f1tenth_ng_zc/packages/f110_scripts/src/f110_scripts/train/train_nn.py", line 591, in main
    run_single_training(config, aid)
  File "/nas/longleaf/home/zayah/f1tenth_ng_zc/packages/f110_scripts/src/f110_scripts/train/train_nn.py", line 564, in run_single_training
    trainer.fit(module, datamodule=dm, ckpt_path=ckpt_path)
  File "/nas/longleaf/home/zayah/f1tenth_ng_zc/.venv/lib/python3.12/site-packages/lightning/pytorch/trainer/trainer.py", line 584, in fit
    call._call_and_handle_interrupt(
  File "/nas/longleaf/home/zayah/f1tenth_ng_zc/.venv/lib/python3.12/site-packages/lightning/pytorch/trainer/call.py", line 49, in _call_and_handle_interrupt
    return trainer_fn(*args, **kwargs)
           ^^^^^^^^^^^^^^^^^^^^^^^^^^^
  File "/nas/longleaf/home/zayah/f1tenth_ng_zc/.venv/lib/python3.12/site-packages/lightning/pytorch/trainer/trainer.py", line 630, in _fit_impl
    self._run(model, ckpt_path=ckpt_path, weights_only=weights_only)
  File "/nas/longleaf/home/zayah/f1tenth_ng_zc/.venv/lib/python3.12/site-packages/lightning/pytorch/trainer/trainer.py", line 1057, in _run
    call._call_callback_hooks(self, "on_fit_start")
  File "/nas/longleaf/home/zayah/f1tenth_ng_zc/.venv/lib/python3.12/site-packages/lightning/pytorch/trainer/call.py", line 228, in _call_callback_hooks
    fn(trainer, trainer.lightning_module, *args, **kwargs)
  File "/nas/longleaf/home/zayah/f1tenth_ng_zc/.venv/lib/python3.12/site-packages/lightning/pytorch/callbacks/model_summary.py", line 64, in on_fit_start
    model_summary = self._summary(trainer, pl_module)
                    ^^^^^^^^^^^^^^^^^^^^^^^^^^^^^^^^^
  File "/nas/longleaf/home/zayah/f1tenth_ng_zc/.venv/lib/python3.12/site-packages/lightning/pytorch/callbacks/model_summary.py", line 90, in _summary
    return summarize(pl_module, max_depth=self._max_depth)
           ^^^^^^^^^^^^^^^^^^^^^^^^^^^^^^^^^^^^^^^^^^^^^^^
  File "/nas/longleaf/home/zayah/f1tenth_ng_zc/.venv/lib/python3.12/site-packages/lightning/pytorch/utilities/model_summary/model_summary.py", line 565, in summarize
    return ModelSummary(lightning_module, max_depth=max_depth)
           ^^^^^^^^^^^^^^^^^^^^^^^^^^^^^^^^^^^^^^^^^^^^^^^^^^^
  File "/nas/longleaf/home/zayah/f1tenth_ng_zc/.venv/lib/python3.12/site-packages/lightning/pytorch/utilities/model_summary/model_summary.py", line 228, in __init__
    self._layer_summary = self.summarize()
                          ^^^^^^^^^^^^^^^^
  File "/nas/longleaf/home/zayah/f1tenth_ng_zc/.venv/lib/python3.12/site-packages/lightning/pytorch/utilities/model_summary/model_summary.py", line 328, in summarize
    self._forward_example_input()
  File "/nas/longleaf/home/zayah/f1tenth_ng_zc/.venv/lib/python3.12/site-packages/lightning/pytorch/utilities/model_summary/model_summary.py", line 371, in _forward_example_input
    model(input_)
  File "/nas/longleaf/home/zayah/f1tenth_ng_zc/.venv/lib/python3.12/site-packages/torch/nn/modules/module.py", line 1779, in _wrapped_call_impl
    return self._call_impl(*args, **kwargs)
           ^^^^^^^^^^^^^^^^^^^^^^^^^^^^^^^^
  File "/nas/longleaf/home/zayah/f1tenth_ng_zc/.venv/lib/python3.12/site-packages/torch/nn/modules/module.py", line 1885, in _call_impl
    return inner()
           ^^^^^^^
  File "/nas/longleaf/home/zayah/f1tenth_ng_zc/.venv/lib/python3.12/site-packages/torch/nn/modules/module.py", line 1833, in inner
    result = forward_call(*args, **kwargs)
             ^^^^^^^^^^^^^^^^^^^^^^^^^^^^^
  File "/nas/longleaf/home/zayah/f1tenth_ng_zc/packages/f110_scripts/src/f110_scripts/train/train_nn.py", line 205, in forward
    return self.model(x_in)
           ^^^^^^^^^^^^^^^^
  File "/nas/longleaf/home/zayah/f1tenth_ng_zc/.venv/lib/python3.12/site-packages/torch/nn/modules/module.py", line 1779, in _wrapped_call_impl
    return self._call_impl(*args, **kwargs)
           ^^^^^^^^^^^^^^^^^^^^^^^^^^^^^^^^
  File "/nas/longleaf/home/zayah/f1tenth_ng_zc/.venv/lib/python3.12/site-packages/torch/nn/modules/module.py", line 1885, in _call_impl
    return inner()
           ^^^^^^^
  File "/nas/longleaf/home/zayah/f1tenth_ng_zc/.venv/lib/python3.12/site-packages/torch/nn/modules/module.py", line 1833, in inner
    result = forward_call(*args, **kwargs)
             ^^^^^^^^^^^^^^^^^^^^^^^^^^^^^
  File "/nas/longleaf/home/zayah/f1tenth_ng_zc/.venv/lib/python3.12/site-packages/torch/nn/modules/container.py", line 253, in forward
    input = module(input)
            ^^^^^^^^^^^^^
  File "/nas/longleaf/home/zayah/f1tenth_ng_zc/.venv/lib/python3.12/site-packages/torch/nn/modules/module.py", line 1779, in _wrapped_call_impl
    return self._call_impl(*args, **kwargs)
           ^^^^^^^^^^^^^^^^^^^^^^^^^^^^^^^^
  File "/nas/longleaf/home/zayah/f1tenth_ng_zc/.venv/lib/python3.12/site-packages/torch/nn/modules/module.py", line 1885, in _call_impl
    return inner()
           ^^^^^^^
  File "/nas/longleaf/home/zayah/f1tenth_ng_zc/.venv/lib/python3.12/site-packages/torch/nn/modules/module.py", line 1833, in inner
    result = forward_call(*args, **kwargs)
             ^^^^^^^^^^^^^^^^^^^^^^^^^^^^^
  File "/nas/longleaf/home/zayah/f1tenth_ng_zc/.venv/lib/python3.12/site-packages/torch/nn/modules/pooling.py", line 144, in forward
    return F.max_pool1d(
           ^^^^^^^^^^^^^
  File "/nas/longleaf/home/zayah/f1tenth_ng_zc/.venv/lib/python3.12/site-packages/torch/_jit_internal.py", line 636, in fn
    return if_false(*args, **kwargs)
           ^^^^^^^^^^^^^^^^^^^^^^^^^
  File "/nas/longleaf/home/zayah/f1tenth_ng_zc/.venv/lib/python3.12/site-packages/torch/nn/functional.py", line 745, in _max_pool1d
    return torch.max_pool1d(input, kernel_size, stride, padding, dilation, ceil_mode)
           ^^^^^^^^^^^^^^^^^^^^^^^^^^^^^^^^^^^^^^^^^^^^^^^^^^^^^^^^^^^^^^^^^^^^^^^^^^
RuntimeError: max_pool1d() Invalid computed output size: 0
SLURM auto-requeueing enabled. Setting signal handlers.
SLURM auto-requeueing enabled. Setting signal handlers.
`Trainer.fit` stopped: `max_epochs=30` reached.
`Trainer.fit` stopped: `max_epochs=30` reached.
[I 2026-04-15 23:03:11,743] Trial 35 finished with value: inf and parameters: {'left_wall_dist_num_layers': 2, 'left_wall_dist_activation': 'elu', 'left_wall_dist_out_channels_l0': 183, 'left_wall_dist_pool_size_l0': 2, 'left_wall_dist_out_channels_l1': 63, 'left_wall_dist_pool_size_l1': 4, 'track_width_num_layers': 3, 'track_width_activation': 'elu', 'track_width_out_channels_l0': 220, 'track_width_pool_size_l0': 2, 'track_width_out_channels_l1': 160, 'track_width_pool_size_l1': 8, 'track_width_out_channels_l2': 144, 'track_width_pool_size_l2': 4, 'track_width_fc_hidden': 91, 'heading_error_num_layers': 4, 'heading_error_activation': 'elu', 'heading_error_out_channels_l0': 75, 'heading_error_pool_size_l0': 4, 'heading_error_out_channels_l1': 116, 'heading_error_pool_size_l1': 4, 'heading_error_out_channels_l2': 110, 'heading_error_pool_size_l2': 8, 'heading_error_out_channels_l3': 52, 'heading_error_pool_size_l3': 8}. Best is trial 27 with value: 0.13.
[rank: 0] Seed set to 42
[rank: 0] Seed set to 42
GPU available: True (cuda), used: True
TPU available: False, using: 0 TPU cores
💡 Tip: For seamless cloud logging and experiment tracking, try installing [litlogger](https://pypi.org/project/litlogger/) to enable LitLogger, which logs metrics and artifacts automatically to the Lightning Experiments platform.
GPU available: True (cuda), used: True
TPU available: False, using: 0 TPU cores
💡 Tip: For seamless cloud logging and experiment tracking, try installing [litlogger](https://pypi.org/project/litlogger/) to enable LitLogger, which logs metrics and artifacts automatically to the Lightning Experiments platform.
[rank: 0] Seed set to 42
GPU available: True (cuda), used: True
TPU available: False, using: 0 TPU cores
💡 Tip: For seamless cloud logging and experiment tracking, try installing [litlogger](https://pypi.org/project/litlogger/) to enable LitLogger, which logs metrics and artifacts automatically to the Lightning Experiments platform.
LOCAL_RANK: 0 - CUDA_VISIBLE_DEVICES: [0]
LOCAL_RANK: 0 - CUDA_VISIBLE_DEVICES: [0]
LOCAL_RANK: 0 - CUDA_VISIBLE_DEVICES: [0]
SLURM auto-requeueing enabled. Setting signal handlers.
SLURM auto-requeueing enabled. Setting signal handlers.
SLURM auto-requeueing enabled. Setting signal handlers.
`Trainer.fit` stopped: `max_epochs=30` reached.
`Trainer.fit` stopped: `max_epochs=30` reached.
`Trainer.fit` stopped: `max_epochs=30` reached.
[I 2026-04-15 23:06:08,806] Trial 36 finished with value: 0.1485 and parameters: {'left_wall_dist_num_layers': 3, 'left_wall_dist_activation': 'elu', 'left_wall_dist_out_channels_l0': 62, 'left_wall_dist_pool_size_l0': 2, 'left_wall_dist_out_channels_l1': 54, 'left_wall_dist_pool_size_l1': 4, 'left_wall_dist_out_channels_l2': 110, 'left_wall_dist_pool_size_l2': 8, 'left_wall_dist_fc_hidden': 50, 'track_width_num_layers': 5, 'track_width_activation': 'relu', 'track_width_out_channels_l0': 177, 'track_width_pool_size_l0': 4, 'track_width_out_channels_l1': 37, 'track_width_pool_size_l1': 4, 'track_width_out_channels_l2': 110, 'track_width_pool_size_l2': 4, 'track_width_out_channels_l3': 123, 'track_width_pool_size_l3': 2, 'track_width_out_channels_l4': 43, 'track_width_pool_size_l4': 2, 'track_width_fc_hidden': 39, 'heading_error_num_layers': 5, 'heading_error_activation': 'elu', 'heading_error_out_channels_l0': 100, 'heading_error_pool_size_l0': 8, 'heading_error_out_channels_l1': 77, 'heading_error_pool_size_l1': 2, 'heading_error_out_channels_l2': 98, 'heading_error_pool_size_l2': 4, 'heading_error_out_channels_l3': 93, 'heading_error_pool_size_l3': 2, 'heading_error_out_channels_l4': 53, 'heading_error_pool_size_l4': 8, 'heading_error_fc_hidden': 41}. Best is trial 27 with value: 0.13.
[rank: 0] Seed set to 42
[rank: 0] Seed set to 42
[rank: 0] Seed set to 42
GPU available: True (cuda), used: True
TPU available: False, using: 0 TPU cores
💡 Tip: For seamless cloud logging and experiment tracking, try installing [litlogger](https://pypi.org/project/litlogger/) to enable LitLogger, which logs metrics and artifacts automatically to the Lightning Experiments platform.
GPU available: True (cuda), used: True
TPU available: False, using: 0 TPU cores
💡 Tip: For seamless cloud logging and experiment tracking, try installing [litlogger](https://pypi.org/project/litlogger/) to enable LitLogger, which logs metrics and artifacts automatically to the Lightning Experiments platform.
GPU available: True (cuda), used: True
TPU available: False, using: 0 TPU cores
💡 Tip: For seamless cloud logging and experiment tracking, try installing [litlogger](https://pypi.org/project/litlogger/) to enable LitLogger, which logs metrics and artifacts automatically to the Lightning Experiments platform.
LOCAL_RANK: 0 - CUDA_VISIBLE_DEVICES: [0]
LOCAL_RANK: 0 - CUDA_VISIBLE_DEVICES: [0]
LOCAL_RANK: 0 - CUDA_VISIBLE_DEVICES: [0]
SLURM auto-requeueing enabled. Setting signal handlers.
SLURM auto-requeueing enabled. Setting signal handlers.
SLURM auto-requeueing enabled. Setting signal handlers.
`Trainer.fit` stopped: `max_epochs=30` reached.
`Trainer.fit` stopped: `max_epochs=30` reached.
`Trainer.fit` stopped: `max_epochs=30` reached.
[I 2026-04-15 23:08:41,199] Trial 37 finished with value: 0.1273 and parameters: {'left_wall_dist_num_layers': 3, 'left_wall_dist_activation': 'relu', 'left_wall_dist_out_channels_l0': 61, 'left_wall_dist_pool_size_l0': 2, 'left_wall_dist_out_channels_l1': 32, 'left_wall_dist_pool_size_l1': 4, 'left_wall_dist_out_channels_l2': 106, 'left_wall_dist_pool_size_l2': 8, 'left_wall_dist_fc_hidden': 51, 'track_width_num_layers': 2, 'track_width_activation': 'elu', 'track_width_out_channels_l0': 180, 'track_width_pool_size_l0': 4, 'track_width_out_channels_l1': 36, 'track_width_pool_size_l1': 4, 'track_width_fc_hidden': 42, 'heading_error_num_layers': 2, 'heading_error_activation': 'elu', 'heading_error_out_channels_l0': 126, 'heading_error_pool_size_l0': 8, 'heading_error_out_channels_l1': 87, 'heading_error_pool_size_l1': 2, 'heading_error_fc_hidden': 115}. Best is trial 37 with value: 0.1273.
[rank: 0] Seed set to 42
[rank: 0] Seed set to 42
[rank: 0] Seed set to 42
GPU available: True (cuda), used: True
TPU available: False, using: 0 TPU cores
💡 Tip: For seamless cloud logging and experiment tracking, try installing [litlogger](https://pypi.org/project/litlogger/) to enable LitLogger, which logs metrics and artifacts automatically to the Lightning Experiments platform.
GPU available: True (cuda), used: True
TPU available: False, using: 0 TPU cores
💡 Tip: For seamless cloud logging and experiment tracking, try installing [litlogger](https://pypi.org/project/litlogger/) to enable LitLogger, which logs metrics and artifacts automatically to the Lightning Experiments platform.
GPU available: True (cuda), used: True
TPU available: False, using: 0 TPU cores
💡 Tip: For seamless cloud logging and experiment tracking, try installing [litlogger](https://pypi.org/project/litlogger/) to enable LitLogger, which logs metrics and artifacts automatically to the Lightning Experiments platform.
LOCAL_RANK: 0 - CUDA_VISIBLE_DEVICES: [0]
LOCAL_RANK: 0 - CUDA_VISIBLE_DEVICES: [0]
LOCAL_RANK: 0 - CUDA_VISIBLE_DEVICES: [0]
SLURM auto-requeueing enabled. Setting signal handlers.
SLURM auto-requeueing enabled. Setting signal handlers.
SLURM auto-requeueing enabled. Setting signal handlers.
`Trainer.fit` stopped: `max_epochs=30` reached.
`Trainer.fit` stopped: `max_epochs=30` reached.
`Trainer.fit` stopped: `max_epochs=30` reached.
[I 2026-04-15 23:11:17,072] Trial 38 finished with value: 0.1397 and parameters: {'left_wall_dist_num_layers': 3, 'left_wall_dist_activation': 'relu', 'left_wall_dist_out_channels_l0': 52, 'left_wall_dist_pool_size_l0': 2, 'left_wall_dist_out_channels_l1': 34, 'left_wall_dist_pool_size_l1': 4, 'left_wall_dist_out_channels_l2': 204, 'left_wall_dist_pool_size_l2': 8, 'left_wall_dist_fc_hidden': 65, 'track_width_num_layers': 2, 'track_width_activation': 'elu', 'track_width_out_channels_l0': 207, 'track_width_pool_size_l0': 4, 'track_width_out_channels_l1': 36, 'track_width_pool_size_l1': 8, 'track_width_fc_hidden': 32, 'heading_error_num_layers': 2, 'heading_error_activation': 'elu', 'heading_error_out_channels_l0': 166, 'heading_error_pool_size_l0': 8, 'heading_error_out_channels_l1': 94, 'heading_error_pool_size_l1': 2, 'heading_error_fc_hidden': 115}. Best is trial 37 with value: 0.1273.
[rank: 0] Seed set to 42
[rank: 0] Seed set to 42
[rank: 0] Seed set to 42
GPU available: True (cuda), used: True
TPU available: False, using: 0 TPU cores
💡 Tip: For seamless cloud logging and experiment tracking, try installing [litlogger](https://pypi.org/project/litlogger/) to enable LitLogger, which logs metrics and artifacts automatically to the Lightning Experiments platform.
GPU available: True (cuda), used: True
TPU available: False, using: 0 TPU cores
💡 Tip: For seamless cloud logging and experiment tracking, try installing [litlogger](https://pypi.org/project/litlogger/) to enable LitLogger, which logs metrics and artifacts automatically to the Lightning Experiments platform.
GPU available: True (cuda), used: True
TPU available: False, using: 0 TPU cores
💡 Tip: For seamless cloud logging and experiment tracking, try installing [litlogger](https://pypi.org/project/litlogger/) to enable LitLogger, which logs metrics and artifacts automatically to the Lightning Experiments platform.
LOCAL_RANK: 0 - CUDA_VISIBLE_DEVICES: [0]
LOCAL_RANK: 0 - CUDA_VISIBLE_DEVICES: [0]
LOCAL_RANK: 0 - CUDA_VISIBLE_DEVICES: [0]
SLURM auto-requeueing enabled. Setting signal handlers.
SLURM auto-requeueing enabled. Setting signal handlers.
SLURM auto-requeueing enabled. Setting signal handlers.
`Trainer.fit` stopped: `max_epochs=30` reached.
`Trainer.fit` stopped: `max_epochs=30` reached.
`Trainer.fit` stopped: `max_epochs=30` reached.
[I 2026-04-15 23:13:51,434] Trial 39 finished with value: 0.1408 and parameters: {'left_wall_dist_num_layers': 3, 'left_wall_dist_activation': 'relu', 'left_wall_dist_out_channels_l0': 55, 'left_wall_dist_pool_size_l0': 2, 'left_wall_dist_out_channels_l1': 35, 'left_wall_dist_pool_size_l1': 4, 'left_wall_dist_out_channels_l2': 220, 'left_wall_dist_pool_size_l2': 8, 'left_wall_dist_fc_hidden': 66, 'track_width_num_layers': 2, 'track_width_activation': 'elu', 'track_width_out_channels_l0': 208, 'track_width_pool_size_l0': 4, 'track_width_out_channels_l1': 32, 'track_width_pool_size_l1': 8, 'track_width_fc_hidden': 33, 'heading_error_num_layers': 2, 'heading_error_activation': 'elu', 'heading_error_out_channels_l0': 166, 'heading_error_pool_size_l0': 8, 'heading_error_out_channels_l1': 89, 'heading_error_pool_size_l1': 2, 'heading_error_fc_hidden': 114}. Best is trial 37 with value: 0.1273.
[rank: 0] Seed set to 42
[rank: 0] Seed set to 42
[rank: 0] Seed set to 42
GPU available: True (cuda), used: True
TPU available: False, using: 0 TPU cores
💡 Tip: For seamless cloud logging and experiment tracking, try installing [litlogger](https://pypi.org/project/litlogger/) to enable LitLogger, which logs metrics and artifacts automatically to the Lightning Experiments platform.
GPU available: True (cuda), used: True
TPU available: False, using: 0 TPU cores
💡 Tip: For seamless cloud logging and experiment tracking, try installing [litlogger](https://pypi.org/project/litlogger/) to enable LitLogger, which logs metrics and artifacts automatically to the Lightning Experiments platform.
GPU available: True (cuda), used: True
TPU available: False, using: 0 TPU cores
💡 Tip: For seamless cloud logging and experiment tracking, try installing [litlogger](https://pypi.org/project/litlogger/) to enable LitLogger, which logs metrics and artifacts automatically to the Lightning Experiments platform.
LOCAL_RANK: 0 - CUDA_VISIBLE_DEVICES: [0]
LOCAL_RANK: 0 - CUDA_VISIBLE_DEVICES: [0]
LOCAL_RANK: 0 - CUDA_VISIBLE_DEVICES: [0]
SLURM auto-requeueing enabled. Setting signal handlers.
SLURM auto-requeueing enabled. Setting signal handlers.
SLURM auto-requeueing enabled. Setting signal handlers.
`Trainer.fit` stopped: `max_epochs=30` reached.
`Trainer.fit` stopped: `max_epochs=30` reached.
`Trainer.fit` stopped: `max_epochs=30` reached.
