[I 2026-04-12 16:34:41,846] Trial 79 finished with value: 0.3742 and parameters: {'left_wall_dist_num_layers': 5, 'left_wall_dist_activation': 'relu', 'left_wall_dist_out_channels_l0': 124, 'left_wall_dist_pool_size_l0': 8, 'left_wall_dist_out_channels_l1': 128, 'left_wall_dist_pool_size_l1': 8, 'left_wall_dist_out_channels_l2': 171, 'left_wall_dist_pool_size_l2': 8, 'track_width_num_layers': 5, 'track_width_activation': 'relu', 'track_width_out_channels_l0': 151, 'track_width_pool_size_l0': 2, 'track_width_out_channels_l1': 45, 'track_width_pool_size_l1': 8, 'track_width_out_channels_l2': 242, 'track_width_pool_size_l2': 2, 'track_width_out_channels_l3': 72, 'track_width_pool_size_l3': 4, 'track_width_out_channels_l4': 85, 'track_width_pool_size_l4': 8, 'track_width_fc_hidden': 45, 'heading_error_num_layers': 4, 'heading_error_activation': 'relu', 'heading_error_out_channels_l0': 39, 'heading_error_pool_size_l0': 4, 'heading_error_out_channels_l1': 47, 'heading_error_pool_size_l1': 2, 'heading_error_out_channels_l2': 225, 'heading_error_pool_size_l2': 2, 'heading_error_out_channels_l3': 51, 'heading_error_pool_size_l3': 2, 'heading_error_fc_hidden': 46}. Best is trial 72 with value: 0.0895.
[rank: 0] Seed set to 42
GPU available: True (cuda), used: True
TPU available: False, using: 0 TPU cores
💡 Tip: For seamless cloud logging and experiment tracking, try installing [litlogger](https://pypi.org/project/litlogger/) to enable LitLogger, which logs metrics and artifacts automatically to the Lightning Experiments platform.
[rank: 0] Seed set to 42
GPU available: True (cuda), used: True
TPU available: False, using: 0 TPU cores
💡 Tip: For seamless cloud logging and experiment tracking, try installing [litlogger](https://pypi.org/project/litlogger/) to enable LitLogger, which logs metrics and artifacts automatically to the Lightning Experiments platform.
LOCAL_RANK: 0 - CUDA_VISIBLE_DEVICES: [0]
[rank: 0] Seed set to 42
GPU available: True (cuda), used: True
TPU available: False, using: 0 TPU cores
💡 Tip: For seamless cloud logging and experiment tracking, try installing [litlogger](https://pypi.org/project/litlogger/) to enable LitLogger, which logs metrics and artifacts automatically to the Lightning Experiments platform.
SLURM auto-requeueing enabled. Setting signal handlers.
LOCAL_RANK: 0 - CUDA_VISIBLE_DEVICES: [0]
SLURM auto-requeueing enabled. Setting signal handlers.
LOCAL_RANK: 0 - CUDA_VISIBLE_DEVICES: [0]
SLURM auto-requeueing enabled. Setting signal handlers.
`Trainer.fit` stopped: `max_epochs=20` reached.
`Trainer.fit` stopped: `max_epochs=20` reached.
`Trainer.fit` stopped: `max_epochs=20` reached.
[I 2026-04-12 16:36:59,852] Trial 80 finished with value: 0.1167 and parameters: {'left_wall_dist_num_layers': 2, 'left_wall_dist_activation': 'relu', 'left_wall_dist_out_channels_l0': 133, 'left_wall_dist_pool_size_l0': 8, 'left_wall_dist_out_channels_l1': 153, 'left_wall_dist_pool_size_l1': 8, 'left_wall_dist_fc_hidden': 73, 'track_width_num_layers': 5, 'track_width_activation': 'relu', 'track_width_out_channels_l0': 128, 'track_width_pool_size_l0': 2, 'track_width_out_channels_l1': 32, 'track_width_pool_size_l1': 8, 'track_width_out_channels_l2': 224, 'track_width_pool_size_l2': 2, 'track_width_out_channels_l3': 53, 'track_width_pool_size_l3': 4, 'track_width_out_channels_l4': 77, 'track_width_pool_size_l4': 8, 'track_width_fc_hidden': 67, 'heading_error_num_layers': 3, 'heading_error_activation': 'elu', 'heading_error_out_channels_l0': 37, 'heading_error_pool_size_l0': 4, 'heading_error_out_channels_l1': 37, 'heading_error_pool_size_l1': 2, 'heading_error_out_channels_l2': 188, 'heading_error_pool_size_l2': 2}. Best is trial 72 with value: 0.0895.
[rank: 0] Seed set to 42
[rank: 0] Seed set to 42
[rank: 0] Seed set to 42
GPU available: True (cuda), used: True
TPU available: False, using: 0 TPU cores
💡 Tip: For seamless cloud logging and experiment tracking, try installing [litlogger](https://pypi.org/project/litlogger/) to enable LitLogger, which logs metrics and artifacts automatically to the Lightning Experiments platform.
GPU available: True (cuda), used: True
TPU available: False, using: 0 TPU cores
💡 Tip: For seamless cloud logging and experiment tracking, try installing [litlogger](https://pypi.org/project/litlogger/) to enable LitLogger, which logs metrics and artifacts automatically to the Lightning Experiments platform.
GPU available: True (cuda), used: True
TPU available: False, using: 0 TPU cores
💡 Tip: For seamless cloud logging and experiment tracking, try installing [litlogger](https://pypi.org/project/litlogger/) to enable LitLogger, which logs metrics and artifacts automatically to the Lightning Experiments platform.
LOCAL_RANK: 0 - CUDA_VISIBLE_DEVICES: [0]
LOCAL_RANK: 0 - CUDA_VISIBLE_DEVICES: [0]
LOCAL_RANK: 0 - CUDA_VISIBLE_DEVICES: [0]
SLURM auto-requeueing enabled. Setting signal handlers.
SLURM auto-requeueing enabled. Setting signal handlers.
SLURM auto-requeueing enabled. Setting signal handlers.
`Trainer.fit` stopped: `max_epochs=20` reached.
`Trainer.fit` stopped: `max_epochs=20` reached.
`Trainer.fit` stopped: `max_epochs=20` reached.
[I 2026-04-12 16:39:20,577] Trial 81 finished with value: 0.1841 and parameters: {'left_wall_dist_num_layers': 2, 'left_wall_dist_activation': 'relu', 'left_wall_dist_out_channels_l0': 111, 'left_wall_dist_pool_size_l0': 8, 'left_wall_dist_out_channels_l1': 137, 'left_wall_dist_pool_size_l1': 8, 'left_wall_dist_fc_hidden': 92, 'track_width_num_layers': 5, 'track_width_activation': 'relu', 'track_width_out_channels_l0': 166, 'track_width_pool_size_l0': 2, 'track_width_out_channels_l1': 39, 'track_width_pool_size_l1': 8, 'track_width_out_channels_l2': 182, 'track_width_pool_size_l2': 8, 'track_width_out_channels_l3': 94, 'track_width_pool_size_l3': 4, 'track_width_fc_hidden': 33, 'heading_error_num_layers': 5, 'heading_error_activation': 'elu', 'heading_error_out_channels_l0': 45, 'heading_error_pool_size_l0': 4, 'heading_error_out_channels_l1': 41, 'heading_error_pool_size_l1': 2, 'heading_error_out_channels_l2': 79, 'heading_error_pool_size_l2': 2, 'heading_error_out_channels_l3': 39, 'heading_error_pool_size_l3': 2, 'heading_error_out_channels_l4': 55, 'heading_error_pool_size_l4': 4, 'heading_error_fc_hidden': 55}. Best is trial 72 with value: 0.0895.
[rank: 0] Seed set to 42
GPU available: True (cuda), used: True
TPU available: False, using: 0 TPU cores
💡 Tip: For seamless cloud logging and experiment tracking, try installing [litlogger](https://pypi.org/project/litlogger/) to enable LitLogger, which logs metrics and artifacts automatically to the Lightning Experiments platform.
[rank: 0] Seed set to 42
[rank: 0] Seed set to 42
GPU available: True (cuda), used: True
TPU available: False, using: 0 TPU cores
GPU available: True (cuda), used: True
TPU available: False, using: 0 TPU cores
💡 Tip: For seamless cloud logging and experiment tracking, try installing [litlogger](https://pypi.org/project/litlogger/) to enable LitLogger, which logs metrics and artifacts automatically to the Lightning Experiments platform.
💡 Tip: For seamless cloud logging and experiment tracking, try installing [litlogger](https://pypi.org/project/litlogger/) to enable LitLogger, which logs metrics and artifacts automatically to the Lightning Experiments platform.
LOCAL_RANK: 0 - CUDA_VISIBLE_DEVICES: [0]
LOCAL_RANK: 0 - CUDA_VISIBLE_DEVICES: [0]
LOCAL_RANK: 0 - CUDA_VISIBLE_DEVICES: [0]
SLURM auto-requeueing enabled. Setting signal handlers.
SLURM auto-requeueing enabled. Setting signal handlers.
SLURM auto-requeueing enabled. Setting signal handlers.
`Trainer.fit` stopped: `max_epochs=20` reached.
`Trainer.fit` stopped: `max_epochs=20` reached.
`Trainer.fit` stopped: `max_epochs=20` reached.
[I 2026-04-12 16:41:43,103] Trial 82 finished with value: 0.0778 and parameters: {'left_wall_dist_num_layers': 2, 'left_wall_dist_activation': 'relu', 'left_wall_dist_out_channels_l0': 148, 'left_wall_dist_pool_size_l0': 8, 'left_wall_dist_out_channels_l1': 167, 'left_wall_dist_pool_size_l1': 8, 'left_wall_dist_fc_hidden': 82, 'track_width_num_layers': 5, 'track_width_activation': 'relu', 'track_width_out_channels_l0': 137, 'track_width_pool_size_l0': 2, 'track_width_out_channels_l1': 43, 'track_width_pool_size_l1': 8, 'track_width_out_channels_l2': 151, 'track_width_pool_size_l2': 4, 'track_width_out_channels_l3': 90, 'track_width_pool_size_l3': 4, 'track_width_out_channels_l4': 41, 'track_width_pool_size_l4': 8, 'heading_error_num_layers': 5, 'heading_error_activation': 'elu', 'heading_error_out_channels_l0': 41, 'heading_error_pool_size_l0': 8, 'heading_error_out_channels_l1': 52, 'heading_error_pool_size_l1': 2, 'heading_error_out_channels_l2': 247, 'heading_error_pool_size_l2': 2, 'heading_error_out_channels_l3': 54, 'heading_error_pool_size_l3': 2, 'heading_error_out_channels_l4': 59, 'heading_error_pool_size_l4': 4, 'heading_error_fc_hidden': 42}. Best is trial 82 with value: 0.0778.
[rank: 0] Seed set to 42
[rank: 0] Seed set to 42
[rank: 0] Seed set to 42
GPU available: True (cuda), used: True
TPU available: False, using: 0 TPU cores
GPU available: True (cuda), used: True
TPU available: False, using: 0 TPU cores
💡 Tip: For seamless cloud logging and experiment tracking, try installing [litlogger](https://pypi.org/project/litlogger/) to enable LitLogger, which logs metrics and artifacts automatically to the Lightning Experiments platform.
💡 Tip: For seamless cloud logging and experiment tracking, try installing [litlogger](https://pypi.org/project/litlogger/) to enable LitLogger, which logs metrics and artifacts automatically to the Lightning Experiments platform.
GPU available: True (cuda), used: True
TPU available: False, using: 0 TPU cores
💡 Tip: For seamless cloud logging and experiment tracking, try installing [litlogger](https://pypi.org/project/litlogger/) to enable LitLogger, which logs metrics and artifacts automatically to the Lightning Experiments platform.
LOCAL_RANK: 0 - CUDA_VISIBLE_DEVICES: [0]
LOCAL_RANK: 0 - CUDA_VISIBLE_DEVICES: [0]
LOCAL_RANK: 0 - CUDA_VISIBLE_DEVICES: [0]
SLURM auto-requeueing enabled. Setting signal handlers.
SLURM auto-requeueing enabled. Setting signal handlers.
SLURM auto-requeueing enabled. Setting signal handlers.
`Trainer.fit` stopped: `max_epochs=20` reached.
`Trainer.fit` stopped: `max_epochs=20` reached.
`Trainer.fit` stopped: `max_epochs=20` reached.
[I 2026-04-12 16:44:04,967] Trial 83 finished with value: 0.1262 and parameters: {'left_wall_dist_num_layers': 2, 'left_wall_dist_activation': 'relu', 'left_wall_dist_out_channels_l0': 145, 'left_wall_dist_pool_size_l0': 8, 'left_wall_dist_out_channels_l1': 207, 'left_wall_dist_pool_size_l1': 8, 'left_wall_dist_fc_hidden': 83, 'track_width_num_layers': 5, 'track_width_activation': 'relu', 'track_width_out_channels_l0': 118, 'track_width_pool_size_l0': 2, 'track_width_out_channels_l1': 32, 'track_width_pool_size_l1': 8, 'track_width_out_channels_l2': 193, 'track_width_pool_size_l2': 4, 'track_width_out_channels_l3': 86, 'track_width_pool_size_l3': 4, 'track_width_out_channels_l4': 51, 'track_width_pool_size_l4': 8, 'heading_error_num_layers': 5, 'heading_error_activation': 'elu', 'heading_error_out_channels_l0': 39, 'heading_error_pool_size_l0': 8, 'heading_error_out_channels_l1': 54, 'heading_error_pool_size_l1': 2, 'heading_error_out_channels_l2': 240, 'heading_error_pool_size_l2': 2, 'heading_error_out_channels_l3': 47, 'heading_error_pool_size_l3': 2, 'heading_error_out_channels_l4': 124, 'heading_error_pool_size_l4': 4, 'heading_error_fc_hidden': 74}. Best is trial 82 with value: 0.0778.
[rank: 0] Seed set to 42
GPU available: True (cuda), used: True
TPU available: False, using: 0 TPU cores
💡 Tip: For seamless cloud logging and experiment tracking, try installing [litlogger](https://pypi.org/project/litlogger/) to enable LitLogger, which logs metrics and artifacts automatically to the Lightning Experiments platform.
[rank: 0] Seed set to 42
GPU available: True (cuda), used: True
TPU available: False, using: 0 TPU cores
💡 Tip: For seamless cloud logging and experiment tracking, try installing [litlogger](https://pypi.org/project/litlogger/) to enable LitLogger, which logs metrics and artifacts automatically to the Lightning Experiments platform.
[rank: 0] Seed set to 42
GPU available: True (cuda), used: True
TPU available: False, using: 0 TPU cores
💡 Tip: For seamless cloud logging and experiment tracking, try installing [litlogger](https://pypi.org/project/litlogger/) to enable LitLogger, which logs metrics and artifacts automatically to the Lightning Experiments platform.
LOCAL_RANK: 0 - CUDA_VISIBLE_DEVICES: [0]
LOCAL_RANK: 0 - CUDA_VISIBLE_DEVICES: [0]
SLURM auto-requeueing enabled. Setting signal handlers.
LOCAL_RANK: 0 - CUDA_VISIBLE_DEVICES: [0]
SLURM auto-requeueing enabled. Setting signal handlers.
SLURM auto-requeueing enabled. Setting signal handlers.
`Trainer.fit` stopped: `max_epochs=20` reached.
`Trainer.fit` stopped: `max_epochs=20` reached.
`Trainer.fit` stopped: `max_epochs=20` reached.
[I 2026-04-12 16:46:22,773] Trial 84 finished with value: 0.1454 and parameters: {'left_wall_dist_num_layers': 2, 'left_wall_dist_activation': 'relu', 'left_wall_dist_out_channels_l0': 151, 'left_wall_dist_pool_size_l0': 8, 'left_wall_dist_out_channels_l1': 168, 'left_wall_dist_pool_size_l1': 8, 'left_wall_dist_fc_hidden': 71, 'track_width_num_layers': 5, 'track_width_activation': 'relu', 'track_width_out_channels_l0': 138, 'track_width_pool_size_l0': 2, 'track_width_out_channels_l1': 42, 'track_width_pool_size_l1': 8, 'track_width_out_channels_l2': 149, 'track_width_pool_size_l2': 2, 'track_width_out_channels_l3': 101, 'track_width_pool_size_l3': 4, 'track_width_out_channels_l4': 41, 'track_width_pool_size_l4': 8, 'track_width_fc_hidden': 33, 'heading_error_num_layers': 4, 'heading_error_activation': 'elu', 'heading_error_out_channels_l0': 41, 'heading_error_pool_size_l0': 8, 'heading_error_out_channels_l1': 50, 'heading_error_pool_size_l1': 2, 'heading_error_out_channels_l2': 207, 'heading_error_pool_size_l2': 2, 'heading_error_out_channels_l3': 52, 'heading_error_pool_size_l3': 2, 'heading_error_fc_hidden': 42}. Best is trial 82 with value: 0.0778.
[rank: 0] Seed set to 42
GPU available: True (cuda), used: True
TPU available: False, using: 0 TPU cores
💡 Tip: For seamless cloud logging and experiment tracking, try installing [litlogger](https://pypi.org/project/litlogger/) to enable LitLogger, which logs metrics and artifacts automatically to the Lightning Experiments platform.
[rank: 0] Seed set to 42
[rank: 0] Seed set to 42
GPU available: True (cuda), used: True
TPU available: False, using: 0 TPU cores
💡 Tip: For seamless cloud logging and experiment tracking, try installing [litlogger](https://pypi.org/project/litlogger/) to enable LitLogger, which logs metrics and artifacts automatically to the Lightning Experiments platform.
GPU available: True (cuda), used: True
TPU available: False, using: 0 TPU cores
💡 Tip: For seamless cloud logging and experiment tracking, try installing [litlogger](https://pypi.org/project/litlogger/) to enable LitLogger, which logs metrics and artifacts automatically to the Lightning Experiments platform.
LOCAL_RANK: 0 - CUDA_VISIBLE_DEVICES: [0]
LOCAL_RANK: 0 - CUDA_VISIBLE_DEVICES: [0]
LOCAL_RANK: 0 - CUDA_VISIBLE_DEVICES: [0]
SLURM auto-requeueing enabled. Setting signal handlers.
SLURM auto-requeueing enabled. Setting signal handlers.
SLURM auto-requeueing enabled. Setting signal handlers.
`Trainer.fit` stopped: `max_epochs=20` reached.
`Trainer.fit` stopped: `max_epochs=20` reached.
`Trainer.fit` stopped: `max_epochs=20` reached.
[I 2026-04-12 16:48:42,079] Trial 85 finished with value: 0.0932 and parameters: {'left_wall_dist_num_layers': 2, 'left_wall_dist_activation': 'relu', 'left_wall_dist_out_channels_l0': 119, 'left_wall_dist_pool_size_l0': 8, 'left_wall_dist_out_channels_l1': 116, 'left_wall_dist_pool_size_l1': 8, 'left_wall_dist_fc_hidden': 67, 'track_width_num_layers': 5, 'track_width_activation': 'relu', 'track_width_out_channels_l0': 72, 'track_width_pool_size_l0': 2, 'track_width_out_channels_l1': 34, 'track_width_pool_size_l1': 8, 'track_width_out_channels_l2': 160, 'track_width_pool_size_l2': 4, 'track_width_out_channels_l3': 59, 'track_width_pool_size_l3': 4, 'track_width_out_channels_l4': 38, 'track_width_pool_size_l4': 8, 'heading_error_num_layers': 5, 'heading_error_activation': 'elu', 'heading_error_out_channels_l0': 34, 'heading_error_pool_size_l0': 8, 'heading_error_out_channels_l1': 43, 'heading_error_pool_size_l1': 4, 'heading_error_out_channels_l2': 254, 'heading_error_pool_size_l2': 2, 'heading_error_out_channels_l3': 76, 'heading_error_pool_size_l3': 2, 'heading_error_out_channels_l4': 64, 'heading_error_pool_size_l4': 4}. Best is trial 82 with value: 0.0778.
[rank: 0] Seed set to 42
GPU available: True (cuda), used: True
TPU available: False, using: 0 TPU cores
💡 Tip: For seamless cloud logging and experiment tracking, try installing [litlogger](https://pypi.org/project/litlogger/) to enable LitLogger, which logs metrics and artifacts automatically to the Lightning Experiments platform.
[rank: 0] Seed set to 42
[rank: 0] Seed set to 42
GPU available: True (cuda), used: True
TPU available: False, using: 0 TPU cores
💡 Tip: For seamless cloud logging and experiment tracking, try installing [litlogger](https://pypi.org/project/litlogger/) to enable LitLogger, which logs metrics and artifacts automatically to the Lightning Experiments platform.
GPU available: True (cuda), used: True
TPU available: False, using: 0 TPU cores
💡 Tip: For seamless cloud logging and experiment tracking, try installing [litlogger](https://pypi.org/project/litlogger/) to enable LitLogger, which logs metrics and artifacts automatically to the Lightning Experiments platform.
LOCAL_RANK: 0 - CUDA_VISIBLE_DEVICES: [0]
SLURM auto-requeueing enabled. Setting signal handlers.
LOCAL_RANK: 0 - CUDA_VISIBLE_DEVICES: [0]
LOCAL_RANK: 0 - CUDA_VISIBLE_DEVICES: [0]
SLURM auto-requeueing enabled. Setting signal handlers.
SLURM auto-requeueing enabled. Setting signal handlers.
`Trainer.fit` stopped: `max_epochs=20` reached.
`Trainer.fit` stopped: `max_epochs=20` reached.
`Trainer.fit` stopped: `max_epochs=20` reached.
[I 2026-04-12 16:51:05,389] Trial 86 finished with value: 0.0739 and parameters: {'left_wall_dist_num_layers': 2, 'left_wall_dist_activation': 'relu', 'left_wall_dist_out_channels_l0': 115, 'left_wall_dist_pool_size_l0': 8, 'left_wall_dist_out_channels_l1': 114, 'left_wall_dist_pool_size_l1': 8, 'left_wall_dist_fc_hidden': 62, 'track_width_num_layers': 5, 'track_width_activation': 'relu', 'track_width_out_channels_l0': 72, 'track_width_pool_size_l0': 2, 'track_width_out_channels_l1': 35, 'track_width_pool_size_l1': 8, 'track_width_out_channels_l2': 167, 'track_width_pool_size_l2': 4, 'track_width_out_channels_l3': 59, 'track_width_pool_size_l3': 4, 'track_width_out_channels_l4': 38, 'track_width_pool_size_l4': 8, 'heading_error_num_layers': 5, 'heading_error_activation': 'elu', 'heading_error_out_channels_l0': 33, 'heading_error_pool_size_l0': 8, 'heading_error_out_channels_l1': 43, 'heading_error_pool_size_l1': 4, 'heading_error_out_channels_l2': 254, 'heading_error_pool_size_l2': 2, 'heading_error_out_channels_l3': 73, 'heading_error_pool_size_l3': 2, 'heading_error_out_channels_l4': 63, 'heading_error_pool_size_l4': 4}. Best is trial 86 with value: 0.0739.
[rank: 0] Seed set to 42
GPU available: True (cuda), used: True
TPU available: False, using: 0 TPU cores
💡 Tip: For seamless cloud logging and experiment tracking, try installing [litlogger](https://pypi.org/project/litlogger/) to enable LitLogger, which logs metrics and artifacts automatically to the Lightning Experiments platform.
[rank: 0] Seed set to 42
[rank: 0] Seed set to 42
GPU available: True (cuda), used: True
TPU available: False, using: 0 TPU cores
💡 Tip: For seamless cloud logging and experiment tracking, try installing [litlogger](https://pypi.org/project/litlogger/) to enable LitLogger, which logs metrics and artifacts automatically to the Lightning Experiments platform.
GPU available: True (cuda), used: True
TPU available: False, using: 0 TPU cores
💡 Tip: For seamless cloud logging and experiment tracking, try installing [litlogger](https://pypi.org/project/litlogger/) to enable LitLogger, which logs metrics and artifacts automatically to the Lightning Experiments platform.
LOCAL_RANK: 0 - CUDA_VISIBLE_DEVICES: [0]
SLURM auto-requeueing enabled. Setting signal handlers.
LOCAL_RANK: 0 - CUDA_VISIBLE_DEVICES: [0]
LOCAL_RANK: 0 - CUDA_VISIBLE_DEVICES: [0]
SLURM auto-requeueing enabled. Setting signal handlers.
SLURM auto-requeueing enabled. Setting signal handlers.
`Trainer.fit` stopped: `max_epochs=20` reached.
`Trainer.fit` stopped: `max_epochs=20` reached.
`Trainer.fit` stopped: `max_epochs=20` reached.
