[I 2026-04-12 16:29:23,887] Trial 90 finished with value: 0.117 and parameters: {'left_wall_dist_num_layers': 4, 'left_wall_dist_activation': 'elu', 'left_wall_dist_out_channels_l0': 66, 'left_wall_dist_pool_size_l0': 2, 'left_wall_dist_out_channels_l1': 185, 'left_wall_dist_pool_size_l1': 2, 'left_wall_dist_out_channels_l2': 102, 'left_wall_dist_pool_size_l2': 4, 'left_wall_dist_out_channels_l3': 32, 'left_wall_dist_pool_size_l3': 2, 'left_wall_dist_fc_hidden': 53, 'track_width_num_layers': 4, 'track_width_activation': 'elu', 'track_width_out_channels_l0': 51, 'track_width_pool_size_l0': 2, 'track_width_out_channels_l1': 108, 'track_width_pool_size_l1': 4, 'track_width_out_channels_l2': 158, 'track_width_pool_size_l2': 8, 'track_width_out_channels_l3': 46, 'track_width_pool_size_l3': 8, 'track_width_fc_hidden': 34, 'heading_error_num_layers': 5, 'heading_error_activation': 'elu', 'heading_error_out_channels_l0': 118, 'heading_error_pool_size_l0': 8, 'heading_error_out_channels_l1': 83, 'heading_error_pool_size_l1': 8, 'heading_error_out_channels_l2': 70, 'heading_error_pool_size_l2': 2, 'heading_error_out_channels_l3': 55, 'heading_error_pool_size_l3': 2, 'heading_error_fc_hidden': 32}. Best is trial 46 with value: 0.0885.
[rank: 0] Seed set to 42
[rank: 0] Seed set to 42
[rank: 0] Seed set to 42
GPU available: True (cuda), used: True
TPU available: False, using: 0 TPU cores
GPU available: True (cuda), used: True
TPU available: False, using: 0 TPU cores
💡 Tip: For seamless cloud logging and experiment tracking, try installing [litlogger](https://pypi.org/project/litlogger/) to enable LitLogger, which logs metrics and artifacts automatically to the Lightning Experiments platform.
💡 Tip: For seamless cloud logging and experiment tracking, try installing [litlogger](https://pypi.org/project/litlogger/) to enable LitLogger, which logs metrics and artifacts automatically to the Lightning Experiments platform.
GPU available: True (cuda), used: True
TPU available: False, using: 0 TPU cores
💡 Tip: For seamless cloud logging and experiment tracking, try installing [litlogger](https://pypi.org/project/litlogger/) to enable LitLogger, which logs metrics and artifacts automatically to the Lightning Experiments platform.
LOCAL_RANK: 0 - CUDA_VISIBLE_DEVICES: [0]
LOCAL_RANK: 0 - CUDA_VISIBLE_DEVICES: [0]
LOCAL_RANK: 0 - CUDA_VISIBLE_DEVICES: [0]
SLURM auto-requeueing enabled. Setting signal handlers.
SLURM auto-requeueing enabled. Setting signal handlers.
SLURM auto-requeueing enabled. Setting signal handlers.
`Trainer.fit` stopped: `max_epochs=20` reached.
`Trainer.fit` stopped: `max_epochs=20` reached.
`Trainer.fit` stopped: `max_epochs=20` reached.
[I 2026-04-12 16:31:38,072] Trial 91 finished with value: 0.113 and parameters: {'left_wall_dist_num_layers': 3, 'left_wall_dist_activation': 'elu', 'left_wall_dist_out_channels_l0': 120, 'left_wall_dist_pool_size_l0': 8, 'left_wall_dist_out_channels_l1': 173, 'left_wall_dist_pool_size_l1': 2, 'left_wall_dist_out_channels_l2': 97, 'left_wall_dist_pool_size_l2': 4, 'left_wall_dist_fc_hidden': 42, 'track_width_num_layers': 5, 'track_width_activation': 'elu', 'track_width_out_channels_l0': 46, 'track_width_pool_size_l0': 4, 'track_width_out_channels_l1': 76, 'track_width_pool_size_l1': 4, 'track_width_out_channels_l2': 200, 'track_width_pool_size_l2': 4, 'track_width_out_channels_l3': 43, 'track_width_pool_size_l3': 8, 'track_width_fc_hidden': 36, 'heading_error_num_layers': 5, 'heading_error_activation': 'elu', 'heading_error_out_channels_l0': 192, 'heading_error_pool_size_l0': 4, 'heading_error_out_channels_l1': 90, 'heading_error_pool_size_l1': 8, 'heading_error_out_channels_l2': 161, 'heading_error_pool_size_l2': 4, 'heading_error_out_channels_l3': 34, 'heading_error_pool_size_l3': 8, 'heading_error_out_channels_l4': 101, 'heading_error_pool_size_l4': 8, 'heading_error_fc_hidden': 41}. Best is trial 46 with value: 0.0885.
[rank: 0] Seed set to 42
[rank: 0] Seed set to 42
[rank: 0] Seed set to 42
GPU available: True (cuda), used: True
TPU available: False, using: 0 TPU cores
💡 Tip: For seamless cloud logging and experiment tracking, try installing [litlogger](https://pypi.org/project/litlogger/) to enable LitLogger, which logs metrics and artifacts automatically to the Lightning Experiments platform.
GPU available: True (cuda), used: True
TPU available: False, using: 0 TPU cores
💡 Tip: For seamless cloud logging and experiment tracking, try installing [litlogger](https://pypi.org/project/litlogger/) to enable LitLogger, which logs metrics and artifacts automatically to the Lightning Experiments platform.
GPU available: True (cuda), used: True
TPU available: False, using: 0 TPU cores
💡 Tip: For seamless cloud logging and experiment tracking, try installing [litlogger](https://pypi.org/project/litlogger/) to enable LitLogger, which logs metrics and artifacts automatically to the Lightning Experiments platform.
LOCAL_RANK: 0 - CUDA_VISIBLE_DEVICES: [0]
LOCAL_RANK: 0 - CUDA_VISIBLE_DEVICES: [0]
LOCAL_RANK: 0 - CUDA_VISIBLE_DEVICES: [0]
SLURM auto-requeueing enabled. Setting signal handlers.
SLURM auto-requeueing enabled. Setting signal handlers.
SLURM auto-requeueing enabled. Setting signal handlers.
`Trainer.fit` stopped: `max_epochs=20` reached.
`Trainer.fit` stopped: `max_epochs=20` reached.
`Trainer.fit` stopped: `max_epochs=20` reached.
[I 2026-04-12 16:33:51,534] Trial 92 finished with value: 0.1216 and parameters: {'left_wall_dist_num_layers': 3, 'left_wall_dist_activation': 'elu', 'left_wall_dist_out_channels_l0': 129, 'left_wall_dist_pool_size_l0': 8, 'left_wall_dist_out_channels_l1': 170, 'left_wall_dist_pool_size_l1': 2, 'left_wall_dist_out_channels_l2': 131, 'left_wall_dist_pool_size_l2': 4, 'left_wall_dist_fc_hidden': 49, 'track_width_num_layers': 5, 'track_width_activation': 'elu', 'track_width_out_channels_l0': 59, 'track_width_pool_size_l0': 4, 'track_width_out_channels_l1': 87, 'track_width_pool_size_l1': 4, 'track_width_out_channels_l2': 197, 'track_width_pool_size_l2': 4, 'track_width_out_channels_l3': 43, 'track_width_pool_size_l3': 8, 'track_width_fc_hidden': 37, 'heading_error_num_layers': 5, 'heading_error_activation': 'elu', 'heading_error_out_channels_l0': 191, 'heading_error_pool_size_l0': 4, 'heading_error_out_channels_l1': 76, 'heading_error_pool_size_l1': 8, 'heading_error_out_channels_l2': 135, 'heading_error_pool_size_l2': 4, 'heading_error_out_channels_l3': 42, 'heading_error_pool_size_l3': 8, 'heading_error_out_channels_l4': 100, 'heading_error_pool_size_l4': 8, 'heading_error_fc_hidden': 41}. Best is trial 46 with value: 0.0885.
[rank: 0] Seed set to 42
[rank: 0] Seed set to 42
[rank: 0] Seed set to 42
GPU available: True (cuda), used: True
TPU available: False, using: 0 TPU cores
💡 Tip: For seamless cloud logging and experiment tracking, try installing [litlogger](https://pypi.org/project/litlogger/) to enable LitLogger, which logs metrics and artifacts automatically to the Lightning Experiments platform.
GPU available: True (cuda), used: True
TPU available: False, using: 0 TPU cores
GPU available: True (cuda), used: True
TPU available: False, using: 0 TPU cores
💡 Tip: For seamless cloud logging and experiment tracking, try installing [litlogger](https://pypi.org/project/litlogger/) to enable LitLogger, which logs metrics and artifacts automatically to the Lightning Experiments platform.
💡 Tip: For seamless cloud logging and experiment tracking, try installing [litlogger](https://pypi.org/project/litlogger/) to enable LitLogger, which logs metrics and artifacts automatically to the Lightning Experiments platform.
LOCAL_RANK: 0 - CUDA_VISIBLE_DEVICES: [0]
LOCAL_RANK: 0 - CUDA_VISIBLE_DEVICES: [0]
LOCAL_RANK: 0 - CUDA_VISIBLE_DEVICES: [0]
SLURM auto-requeueing enabled. Setting signal handlers.
SLURM auto-requeueing enabled. Setting signal handlers.
SLURM auto-requeueing enabled. Setting signal handlers.
`Trainer.fit` stopped: `max_epochs=20` reached.
`Trainer.fit` stopped: `max_epochs=20` reached.
`Trainer.fit` stopped: `max_epochs=20` reached.
[I 2026-04-12 16:36:05,640] Trial 93 finished with value: 0.1098 and parameters: {'left_wall_dist_num_layers': 3, 'left_wall_dist_activation': 'elu', 'left_wall_dist_out_channels_l0': 168, 'left_wall_dist_pool_size_l0': 8, 'left_wall_dist_out_channels_l1': 136, 'left_wall_dist_pool_size_l1': 2, 'left_wall_dist_out_channels_l2': 86, 'left_wall_dist_pool_size_l2': 4, 'left_wall_dist_fc_hidden': 42, 'track_width_num_layers': 5, 'track_width_activation': 'elu', 'track_width_out_channels_l0': 55, 'track_width_pool_size_l0': 4, 'track_width_out_channels_l1': 144, 'track_width_pool_size_l1': 4, 'track_width_out_channels_l2': 200, 'track_width_pool_size_l2': 4, 'track_width_out_channels_l3': 33, 'track_width_pool_size_l3': 8, 'track_width_fc_hidden': 32, 'heading_error_num_layers': 5, 'heading_error_activation': 'elu', 'heading_error_out_channels_l0': 213, 'heading_error_pool_size_l0': 4, 'heading_error_out_channels_l1': 89, 'heading_error_pool_size_l1': 8, 'heading_error_out_channels_l2': 168, 'heading_error_pool_size_l2': 4, 'heading_error_out_channels_l3': 32, 'heading_error_pool_size_l3': 8, 'heading_error_out_channels_l4': 161, 'heading_error_pool_size_l4': 2}. Best is trial 46 with value: 0.0885.
[rank: 0] Seed set to 42
[rank: 0] Seed set to 42
[rank: 0] Seed set to 42
GPU available: True (cuda), used: True
TPU available: False, using: 0 TPU cores
💡 Tip: For seamless cloud logging and experiment tracking, try installing [litlogger](https://pypi.org/project/litlogger/) to enable LitLogger, which logs metrics and artifacts automatically to the Lightning Experiments platform.
GPU available: True (cuda), used: True
TPU available: False, using: 0 TPU cores
GPU available: True (cuda), used: True
TPU available: False, using: 0 TPU cores
💡 Tip: For seamless cloud logging and experiment tracking, try installing [litlogger](https://pypi.org/project/litlogger/) to enable LitLogger, which logs metrics and artifacts automatically to the Lightning Experiments platform.
💡 Tip: For seamless cloud logging and experiment tracking, try installing [litlogger](https://pypi.org/project/litlogger/) to enable LitLogger, which logs metrics and artifacts automatically to the Lightning Experiments platform.
LOCAL_RANK: 0 - CUDA_VISIBLE_DEVICES: [0]
LOCAL_RANK: 0 - CUDA_VISIBLE_DEVICES: [0]
LOCAL_RANK: 0 - CUDA_VISIBLE_DEVICES: [0]
SLURM auto-requeueing enabled. Setting signal handlers.
SLURM auto-requeueing enabled. Setting signal handlers.
SLURM auto-requeueing enabled. Setting signal handlers.
`Trainer.fit` stopped: `max_epochs=20` reached.
`Trainer.fit` stopped: `max_epochs=20` reached.
`Trainer.fit` stopped: `max_epochs=20` reached.
[I 2026-04-12 16:38:20,003] Trial 94 finished with value: 0.1288 and parameters: {'left_wall_dist_num_layers': 3, 'left_wall_dist_activation': 'elu', 'left_wall_dist_out_channels_l0': 166, 'left_wall_dist_pool_size_l0': 8, 'left_wall_dist_out_channels_l1': 135, 'left_wall_dist_pool_size_l1': 2, 'left_wall_dist_out_channels_l2': 44, 'left_wall_dist_pool_size_l2': 4, 'left_wall_dist_fc_hidden': 41, 'track_width_num_layers': 5, 'track_width_activation': 'elu', 'track_width_out_channels_l0': 57, 'track_width_pool_size_l0': 4, 'track_width_out_channels_l1': 145, 'track_width_pool_size_l1': 4, 'track_width_out_channels_l2': 110, 'track_width_pool_size_l2': 4, 'track_width_out_channels_l3': 34, 'track_width_pool_size_l3': 8, 'heading_error_num_layers': 5, 'heading_error_activation': 'elu', 'heading_error_out_channels_l0': 71, 'heading_error_pool_size_l0': 4, 'heading_error_out_channels_l1': 88, 'heading_error_pool_size_l1': 8, 'heading_error_out_channels_l2': 167, 'heading_error_pool_size_l2': 4, 'heading_error_out_channels_l3': 36, 'heading_error_pool_size_l3': 8, 'heading_error_out_channels_l4': 155, 'heading_error_pool_size_l4': 2}. Best is trial 46 with value: 0.0885.
[rank: 0] Seed set to 42
[rank: 0] Seed set to 42
[rank: 0] Seed set to 42
GPU available: True (cuda), used: True
TPU available: False, using: 0 TPU cores
💡 Tip: For seamless cloud logging and experiment tracking, try installing [litlogger](https://pypi.org/project/litlogger/) to enable LitLogger, which logs metrics and artifacts automatically to the Lightning Experiments platform.
GPU available: True (cuda), used: True
TPU available: False, using: 0 TPU cores
💡 Tip: For seamless cloud logging and experiment tracking, try installing [litlogger](https://pypi.org/project/litlogger/) to enable LitLogger, which logs metrics and artifacts automatically to the Lightning Experiments platform.
GPU available: True (cuda), used: True
TPU available: False, using: 0 TPU cores
💡 Tip: For seamless cloud logging and experiment tracking, try installing [litlogger](https://pypi.org/project/litlogger/) to enable LitLogger, which logs metrics and artifacts automatically to the Lightning Experiments platform.
LOCAL_RANK: 0 - CUDA_VISIBLE_DEVICES: [0]
LOCAL_RANK: 0 - CUDA_VISIBLE_DEVICES: [0]
LOCAL_RANK: 0 - CUDA_VISIBLE_DEVICES: [0]
SLURM auto-requeueing enabled. Setting signal handlers.
SLURM auto-requeueing enabled. Setting signal handlers.
SLURM auto-requeueing enabled. Setting signal handlers.
`Trainer.fit` stopped: `max_epochs=20` reached.
`Trainer.fit` stopped: `max_epochs=20` reached.
`Trainer.fit` stopped: `max_epochs=20` reached.
[I 2026-04-12 16:40:37,755] Trial 95 finished with value: 0.1266 and parameters: {'left_wall_dist_num_layers': 3, 'left_wall_dist_activation': 'elu', 'left_wall_dist_out_channels_l0': 116, 'left_wall_dist_pool_size_l0': 8, 'left_wall_dist_out_channels_l1': 147, 'left_wall_dist_pool_size_l1': 2, 'left_wall_dist_out_channels_l2': 32, 'left_wall_dist_pool_size_l2': 4, 'left_wall_dist_fc_hidden': 39, 'track_width_num_layers': 5, 'track_width_activation': 'elu', 'track_width_out_channels_l0': 55, 'track_width_pool_size_l0': 4, 'track_width_out_channels_l1': 156, 'track_width_pool_size_l1': 8, 'track_width_out_channels_l2': 219, 'track_width_pool_size_l2': 4, 'track_width_out_channels_l3': 32, 'track_width_pool_size_l3': 8, 'track_width_out_channels_l4': 201, 'track_width_pool_size_l4': 2, 'heading_error_num_layers': 5, 'heading_error_activation': 'elu', 'heading_error_out_channels_l0': 164, 'heading_error_pool_size_l0': 4, 'heading_error_out_channels_l1': 188, 'heading_error_pool_size_l1': 8, 'heading_error_out_channels_l2': 181, 'heading_error_pool_size_l2': 4, 'heading_error_out_channels_l3': 38, 'heading_error_pool_size_l3': 8, 'heading_error_out_channels_l4': 178, 'heading_error_pool_size_l4': 2}. Best is trial 46 with value: 0.0885.
[rank: 0] Seed set to 42
[rank: 0] Seed set to 42
[rank: 0] Seed set to 42
GPU available: True (cuda), used: True
GPU available: True (cuda), used: True
TPU available: False, using: 0 TPU cores
TPU available: False, using: 0 TPU cores
💡 Tip: For seamless cloud logging and experiment tracking, try installing [litlogger](https://pypi.org/project/litlogger/) to enable LitLogger, which logs metrics and artifacts automatically to the Lightning Experiments platform.
💡 Tip: For seamless cloud logging and experiment tracking, try installing [litlogger](https://pypi.org/project/litlogger/) to enable LitLogger, which logs metrics and artifacts automatically to the Lightning Experiments platform.
GPU available: True (cuda), used: True
TPU available: False, using: 0 TPU cores
💡 Tip: For seamless cloud logging and experiment tracking, try installing [litlogger](https://pypi.org/project/litlogger/) to enable LitLogger, which logs metrics and artifacts automatically to the Lightning Experiments platform.
LOCAL_RANK: 0 - CUDA_VISIBLE_DEVICES: [0]
LOCAL_RANK: 0 - CUDA_VISIBLE_DEVICES: [0]
LOCAL_RANK: 0 - CUDA_VISIBLE_DEVICES: [0]
SLURM auto-requeueing enabled. Setting signal handlers.
SLURM auto-requeueing enabled. Setting signal handlers.
SLURM auto-requeueing enabled. Setting signal handlers.
`Trainer.fit` stopped: `max_epochs=20` reached.
`Trainer.fit` stopped: `max_epochs=20` reached.
`Trainer.fit` stopped: `max_epochs=20` reached.
