[I 2026-04-12 17:30:40,162] Trial 105 finished with value: 0.0974 and parameters: {'left_wall_dist_num_layers': 2, 'left_wall_dist_activation': 'relu', 'left_wall_dist_out_channels_l0': 68, 'left_wall_dist_pool_size_l0': 4, 'left_wall_dist_out_channels_l1': 108, 'left_wall_dist_pool_size_l1': 8, 'left_wall_dist_fc_hidden': 115, 'track_width_num_layers': 3, 'track_width_activation': 'elu', 'track_width_out_channels_l0': 130, 'track_width_pool_size_l0': 2, 'track_width_out_channels_l1': 135, 'track_width_pool_size_l1': 4, 'track_width_out_channels_l2': 64, 'track_width_pool_size_l2': 8, 'track_width_fc_hidden': 88, 'heading_error_num_layers': 3, 'heading_error_activation': 'elu', 'heading_error_out_channels_l0': 83, 'heading_error_pool_size_l0': 8, 'heading_error_out_channels_l1': 69, 'heading_error_pool_size_l1': 8, 'heading_error_out_channels_l2': 131, 'heading_error_pool_size_l2': 4, 'heading_error_fc_hidden': 41}. Best is trial 84 with value: 0.0815.
[rank: 0] Seed set to 42
[rank: 0] Seed set to 42
[rank: 0] Seed set to 42
GPU available: True (cuda), used: True
TPU available: False, using: 0 TPU cores
💡 Tip: For seamless cloud logging and experiment tracking, try installing [litlogger](https://pypi.org/project/litlogger/) to enable LitLogger, which logs metrics and artifacts automatically to the Lightning Experiments platform.
GPU available: True (cuda), used: True
TPU available: False, using: 0 TPU cores
💡 Tip: For seamless cloud logging and experiment tracking, try installing [litlogger](https://pypi.org/project/litlogger/) to enable LitLogger, which logs metrics and artifacts automatically to the Lightning Experiments platform.
GPU available: True (cuda), used: True
TPU available: False, using: 0 TPU cores
💡 Tip: For seamless cloud logging and experiment tracking, try installing [litlogger](https://pypi.org/project/litlogger/) to enable LitLogger, which logs metrics and artifacts automatically to the Lightning Experiments platform.
LOCAL_RANK: 0 - CUDA_VISIBLE_DEVICES: [0]
LOCAL_RANK: 0 - CUDA_VISIBLE_DEVICES: [0]
LOCAL_RANK: 0 - CUDA_VISIBLE_DEVICES: [0]
SLURM auto-requeueing enabled. Setting signal handlers.
SLURM auto-requeueing enabled. Setting signal handlers.
SLURM auto-requeueing enabled. Setting signal handlers.
`Trainer.fit` stopped: `max_epochs=20` reached.
`Trainer.fit` stopped: `max_epochs=20` reached.
`Trainer.fit` stopped: `max_epochs=20` reached.
[I 2026-04-12 17:32:55,294] Trial 106 finished with value: 0.0931 and parameters: {'left_wall_dist_num_layers': 2, 'left_wall_dist_activation': 'relu', 'left_wall_dist_out_channels_l0': 80, 'left_wall_dist_pool_size_l0': 4, 'left_wall_dist_out_channels_l1': 106, 'left_wall_dist_pool_size_l1': 8, 'left_wall_dist_fc_hidden': 115, 'track_width_num_layers': 3, 'track_width_activation': 'elu', 'track_width_out_channels_l0': 137, 'track_width_pool_size_l0': 2, 'track_width_out_channels_l1': 138, 'track_width_pool_size_l1': 4, 'track_width_out_channels_l2': 66, 'track_width_pool_size_l2': 8, 'track_width_fc_hidden': 88, 'heading_error_num_layers': 3, 'heading_error_activation': 'elu', 'heading_error_out_channels_l0': 85, 'heading_error_pool_size_l0': 8, 'heading_error_out_channels_l1': 64, 'heading_error_pool_size_l1': 8, 'heading_error_out_channels_l2': 143, 'heading_error_pool_size_l2': 4, 'heading_error_fc_hidden': 42}. Best is trial 84 with value: 0.0815.
[rank: 0] Seed set to 42
[rank: 0] Seed set to 42
GPU available: True (cuda), used: True
TPU available: False, using: 0 TPU cores
💡 Tip: For seamless cloud logging and experiment tracking, try installing [litlogger](https://pypi.org/project/litlogger/) to enable LitLogger, which logs metrics and artifacts automatically to the Lightning Experiments platform.
GPU available: True (cuda), used: True
TPU available: False, using: 0 TPU cores
💡 Tip: For seamless cloud logging and experiment tracking, try installing [litlogger](https://pypi.org/project/litlogger/) to enable LitLogger, which logs metrics and artifacts automatically to the Lightning Experiments platform.
[rank: 0] Seed set to 42
GPU available: True (cuda), used: True
TPU available: False, using: 0 TPU cores
💡 Tip: For seamless cloud logging and experiment tracking, try installing [litlogger](https://pypi.org/project/litlogger/) to enable LitLogger, which logs metrics and artifacts automatically to the Lightning Experiments platform.
LOCAL_RANK: 0 - CUDA_VISIBLE_DEVICES: [0]
LOCAL_RANK: 0 - CUDA_VISIBLE_DEVICES: [0]
LOCAL_RANK: 0 - CUDA_VISIBLE_DEVICES: [0]
SLURM auto-requeueing enabled. Setting signal handlers.
SLURM auto-requeueing enabled. Setting signal handlers.
SLURM auto-requeueing enabled. Setting signal handlers.
`Trainer.fit` stopped: `max_epochs=20` reached.
`Trainer.fit` stopped: `max_epochs=20` reached.
`Trainer.fit` stopped: `max_epochs=20` reached.
[I 2026-04-12 17:35:18,785] Trial 107 finished with value: 0.0928 and parameters: {'left_wall_dist_num_layers': 2, 'left_wall_dist_activation': 'relu', 'left_wall_dist_out_channels_l0': 79, 'left_wall_dist_pool_size_l0': 4, 'left_wall_dist_out_channels_l1': 103, 'left_wall_dist_pool_size_l1': 8, 'left_wall_dist_fc_hidden': 115, 'track_width_num_layers': 3, 'track_width_activation': 'elu', 'track_width_out_channels_l0': 155, 'track_width_pool_size_l0': 2, 'track_width_out_channels_l1': 135, 'track_width_pool_size_l1': 4, 'track_width_out_channels_l2': 58, 'track_width_pool_size_l2': 8, 'track_width_fc_hidden': 91, 'heading_error_num_layers': 3, 'heading_error_activation': 'elu', 'heading_error_out_channels_l0': 79, 'heading_error_pool_size_l0': 8, 'heading_error_out_channels_l1': 66, 'heading_error_pool_size_l1': 8, 'heading_error_out_channels_l2': 138, 'heading_error_pool_size_l2': 4, 'heading_error_fc_hidden': 42}. Best is trial 84 with value: 0.0815.
[rank: 0] Seed set to 42
[rank: 0] Seed set to 42
[rank: 0] Seed set to 42
GPU available: True (cuda), used: True
TPU available: False, using: 0 TPU cores
💡 Tip: For seamless cloud logging and experiment tracking, try installing [litlogger](https://pypi.org/project/litlogger/) to enable LitLogger, which logs metrics and artifacts automatically to the Lightning Experiments platform.
GPU available: True (cuda), used: True
TPU available: False, using: 0 TPU cores
💡 Tip: For seamless cloud logging and experiment tracking, try installing [litlogger](https://pypi.org/project/litlogger/) to enable LitLogger, which logs metrics and artifacts automatically to the Lightning Experiments platform.
GPU available: True (cuda), used: True
TPU available: False, using: 0 TPU cores
💡 Tip: For seamless cloud logging and experiment tracking, try installing [litlogger](https://pypi.org/project/litlogger/) to enable LitLogger, which logs metrics and artifacts automatically to the Lightning Experiments platform.
LOCAL_RANK: 0 - CUDA_VISIBLE_DEVICES: [0]
LOCAL_RANK: 0 - CUDA_VISIBLE_DEVICES: [0]
LOCAL_RANK: 0 - CUDA_VISIBLE_DEVICES: [0]
SLURM auto-requeueing enabled. Setting signal handlers.
SLURM auto-requeueing enabled. Setting signal handlers.
SLURM auto-requeueing enabled. Setting signal handlers.
`Trainer.fit` stopped: `max_epochs=20` reached.
`Trainer.fit` stopped: `max_epochs=20` reached.
`Trainer.fit` stopped: `max_epochs=20` reached.
[I 2026-04-12 17:37:41,892] Trial 108 finished with value: 0.1439 and parameters: {'left_wall_dist_num_layers': 2, 'left_wall_dist_activation': 'relu', 'left_wall_dist_out_channels_l0': 67, 'left_wall_dist_pool_size_l0': 4, 'left_wall_dist_out_channels_l1': 108, 'left_wall_dist_pool_size_l1': 8, 'left_wall_dist_fc_hidden': 117, 'track_width_num_layers': 3, 'track_width_activation': 'elu', 'track_width_out_channels_l0': 133, 'track_width_pool_size_l0': 2, 'track_width_out_channels_l1': 134, 'track_width_pool_size_l1': 4, 'track_width_out_channels_l2': 58, 'track_width_pool_size_l2': 8, 'track_width_fc_hidden': 92, 'heading_error_num_layers': 3, 'heading_error_activation': 'relu', 'heading_error_out_channels_l0': 78, 'heading_error_pool_size_l0': 8, 'heading_error_out_channels_l1': 67, 'heading_error_pool_size_l1': 8, 'heading_error_out_channels_l2': 152, 'heading_error_pool_size_l2': 4, 'heading_error_fc_hidden': 42}. Best is trial 84 with value: 0.0815.
[rank: 0] Seed set to 42
[rank: 0] Seed set to 42
[rank: 0] Seed set to 42
GPU available: True (cuda), used: True
TPU available: False, using: 0 TPU cores
💡 Tip: For seamless cloud logging and experiment tracking, try installing [litlogger](https://pypi.org/project/litlogger/) to enable LitLogger, which logs metrics and artifacts automatically to the Lightning Experiments platform.
GPU available: True (cuda), used: True
TPU available: False, using: 0 TPU cores
💡 Tip: For seamless cloud logging and experiment tracking, try installing [litlogger](https://pypi.org/project/litlogger/) to enable LitLogger, which logs metrics and artifacts automatically to the Lightning Experiments platform.
GPU available: True (cuda), used: True
TPU available: False, using: 0 TPU cores
💡 Tip: For seamless cloud logging and experiment tracking, try installing [litlogger](https://pypi.org/project/litlogger/) to enable LitLogger, which logs metrics and artifacts automatically to the Lightning Experiments platform.
LOCAL_RANK: 0 - CUDA_VISIBLE_DEVICES: [0]
LOCAL_RANK: 0 - CUDA_VISIBLE_DEVICES: [0]
LOCAL_RANK: 0 - CUDA_VISIBLE_DEVICES: [0]
SLURM auto-requeueing enabled. Setting signal handlers.
SLURM auto-requeueing enabled. Setting signal handlers.
SLURM auto-requeueing enabled. Setting signal handlers.
`Trainer.fit` stopped: `max_epochs=20` reached.
`Trainer.fit` stopped: `max_epochs=20` reached.
`Trainer.fit` stopped: `max_epochs=20` reached.
[I 2026-04-12 17:39:57,305] Trial 109 finished with value: 0.1162 and parameters: {'left_wall_dist_num_layers': 2, 'left_wall_dist_activation': 'relu', 'left_wall_dist_out_channels_l0': 79, 'left_wall_dist_pool_size_l0': 4, 'left_wall_dist_out_channels_l1': 88, 'left_wall_dist_pool_size_l1': 8, 'left_wall_dist_fc_hidden': 112, 'track_width_num_layers': 3, 'track_width_activation': 'elu', 'track_width_out_channels_l0': 170, 'track_width_pool_size_l0': 8, 'track_width_out_channels_l1': 120, 'track_width_pool_size_l1': 2, 'track_width_out_channels_l2': 61, 'track_width_pool_size_l2': 8, 'track_width_fc_hidden': 98, 'heading_error_num_layers': 3, 'heading_error_activation': 'elu', 'heading_error_out_channels_l0': 84, 'heading_error_pool_size_l0': 8, 'heading_error_out_channels_l1': 59, 'heading_error_pool_size_l1': 8, 'heading_error_out_channels_l2': 138, 'heading_error_pool_size_l2': 4, 'heading_error_fc_hidden': 40}. Best is trial 84 with value: 0.0815.
[rank: 0] Seed set to 42
[rank: 0] Seed set to 42
[rank: 0] Seed set to 42
GPU available: True (cuda), used: True
TPU available: False, using: 0 TPU cores
GPU available: True (cuda), used: True
GPU available: True (cuda), used: True
TPU available: False, using: 0 TPU cores
TPU available: False, using: 0 TPU cores
💡 Tip: For seamless cloud logging and experiment tracking, try installing [litlogger](https://pypi.org/project/litlogger/) to enable LitLogger, which logs metrics and artifacts automatically to the Lightning Experiments platform.
💡 Tip: For seamless cloud logging and experiment tracking, try installing [litlogger](https://pypi.org/project/litlogger/) to enable LitLogger, which logs metrics and artifacts automatically to the Lightning Experiments platform.
💡 Tip: For seamless cloud logging and experiment tracking, try installing [litlogger](https://pypi.org/project/litlogger/) to enable LitLogger, which logs metrics and artifacts automatically to the Lightning Experiments platform.
LOCAL_RANK: 0 - CUDA_VISIBLE_DEVICES: [0]
LOCAL_RANK: 0 - CUDA_VISIBLE_DEVICES: [0]
LOCAL_RANK: 0 - CUDA_VISIBLE_DEVICES: [0]
SLURM auto-requeueing enabled. Setting signal handlers.
SLURM auto-requeueing enabled. Setting signal handlers.
SLURM auto-requeueing enabled. Setting signal handlers.
`Trainer.fit` stopped: `max_epochs=20` reached.
`Trainer.fit` stopped: `max_epochs=20` reached.
`Trainer.fit` stopped: `max_epochs=20` reached.
[I 2026-04-12 17:42:14,195] Trial 110 finished with value: 0.1651 and parameters: {'left_wall_dist_num_layers': 3, 'left_wall_dist_activation': 'relu', 'left_wall_dist_out_channels_l0': 74, 'left_wall_dist_pool_size_l0': 4, 'left_wall_dist_out_channels_l1': 99, 'left_wall_dist_pool_size_l1': 8, 'left_wall_dist_out_channels_l2': 50, 'left_wall_dist_pool_size_l2': 2, 'left_wall_dist_fc_hidden': 54, 'track_width_num_layers': 3, 'track_width_activation': 'elu', 'track_width_out_channels_l0': 153, 'track_width_pool_size_l0': 2, 'track_width_out_channels_l1': 138, 'track_width_pool_size_l1': 8, 'track_width_out_channels_l2': 52, 'track_width_pool_size_l2': 4, 'track_width_fc_hidden': 85, 'heading_error_num_layers': 3, 'heading_error_activation': 'elu', 'heading_error_out_channels_l0': 69, 'heading_error_pool_size_l0': 8, 'heading_error_out_channels_l1': 74, 'heading_error_pool_size_l1': 2, 'heading_error_out_channels_l2': 131, 'heading_error_pool_size_l2': 8, 'heading_error_fc_hidden': 41}. Best is trial 84 with value: 0.0815.
[rank: 0] Seed set to 42
[rank: 0] Seed set to 42
[rank: 0] Seed set to 42
GPU available: True (cuda), used: True
TPU available: False, using: 0 TPU cores
GPU available: True (cuda), used: True
TPU available: False, using: 0 TPU cores
💡 Tip: For seamless cloud logging and experiment tracking, try installing [litlogger](https://pypi.org/project/litlogger/) to enable LitLogger, which logs metrics and artifacts automatically to the Lightning Experiments platform.
💡 Tip: For seamless cloud logging and experiment tracking, try installing [litlogger](https://pypi.org/project/litlogger/) to enable LitLogger, which logs metrics and artifacts automatically to the Lightning Experiments platform.
GPU available: True (cuda), used: True
TPU available: False, using: 0 TPU cores
💡 Tip: For seamless cloud logging and experiment tracking, try installing [litlogger](https://pypi.org/project/litlogger/) to enable LitLogger, which logs metrics and artifacts automatically to the Lightning Experiments platform.
LOCAL_RANK: 0 - CUDA_VISIBLE_DEVICES: [0]
LOCAL_RANK: 0 - CUDA_VISIBLE_DEVICES: [0]
LOCAL_RANK: 0 - CUDA_VISIBLE_DEVICES: [0]
SLURM auto-requeueing enabled. Setting signal handlers.
SLURM auto-requeueing enabled. Setting signal handlers.
SLURM auto-requeueing enabled. Setting signal handlers.
`Trainer.fit` stopped: `max_epochs=20` reached.
`Trainer.fit` stopped: `max_epochs=20` reached.
`Trainer.fit` stopped: `max_epochs=20` reached.
[I 2026-04-12 17:44:39,753] Trial 111 finished with value: 0.1107 and parameters: {'left_wall_dist_num_layers': 2, 'left_wall_dist_activation': 'relu', 'left_wall_dist_out_channels_l0': 77, 'left_wall_dist_pool_size_l0': 4, 'left_wall_dist_out_channels_l1': 115, 'left_wall_dist_pool_size_l1': 8, 'left_wall_dist_fc_hidden': 115, 'track_width_num_layers': 3, 'track_width_activation': 'elu', 'track_width_out_channels_l0': 139, 'track_width_pool_size_l0': 2, 'track_width_out_channels_l1': 126, 'track_width_pool_size_l1': 4, 'track_width_out_channels_l2': 67, 'track_width_pool_size_l2': 8, 'track_width_fc_hidden': 77, 'heading_error_num_layers': 3, 'heading_error_activation': 'elu', 'heading_error_out_channels_l0': 79, 'heading_error_pool_size_l0': 8, 'heading_error_out_channels_l1': 66, 'heading_error_pool_size_l1': 8, 'heading_error_out_channels_l2': 175, 'heading_error_pool_size_l2': 4, 'heading_error_fc_hidden': 42}. Best is trial 84 with value: 0.0815.
[rank: 0] Seed set to 42
[rank: 0] Seed set to 42
[rank: 0] Seed set to 42
GPU available: True (cuda), used: True
TPU available: False, using: 0 TPU cores
💡 Tip: For seamless cloud logging and experiment tracking, try installing [litlogger](https://pypi.org/project/litlogger/) to enable LitLogger, which logs metrics and artifacts automatically to the Lightning Experiments platform.
GPU available: True (cuda), used: True
TPU available: False, using: 0 TPU cores
💡 Tip: For seamless cloud logging and experiment tracking, try installing [litlogger](https://pypi.org/project/litlogger/) to enable LitLogger, which logs metrics and artifacts automatically to the Lightning Experiments platform.
GPU available: True (cuda), used: True
TPU available: False, using: 0 TPU cores
💡 Tip: For seamless cloud logging and experiment tracking, try installing [litlogger](https://pypi.org/project/litlogger/) to enable LitLogger, which logs metrics and artifacts automatically to the Lightning Experiments platform.
LOCAL_RANK: 0 - CUDA_VISIBLE_DEVICES: [0]
LOCAL_RANK: 0 - CUDA_VISIBLE_DEVICES: [0]
LOCAL_RANK: 0 - CUDA_VISIBLE_DEVICES: [0]
SLURM auto-requeueing enabled. Setting signal handlers.
SLURM auto-requeueing enabled. Setting signal handlers.
SLURM auto-requeueing enabled. Setting signal handlers.
`Trainer.fit` stopped: `max_epochs=20` reached.
`Trainer.fit` stopped: `max_epochs=20` reached.
`Trainer.fit` stopped: `max_epochs=20` reached.
[I 2026-04-12 17:47:08,209] Trial 112 finished with value: 0.1522 and parameters: {'left_wall_dist_num_layers': 2, 'left_wall_dist_activation': 'relu', 'left_wall_dist_out_channels_l0': 88, 'left_wall_dist_pool_size_l0': 4, 'left_wall_dist_out_channels_l1': 104, 'left_wall_dist_pool_size_l1': 8, 'left_wall_dist_fc_hidden': 114, 'track_width_num_layers': 3, 'track_width_activation': 'elu', 'track_width_out_channels_l0': 183, 'track_width_pool_size_l0': 2, 'track_width_out_channels_l1': 148, 'track_width_pool_size_l1': 4, 'track_width_out_channels_l2': 64, 'track_width_pool_size_l2': 8, 'track_width_fc_hidden': 96, 'heading_error_num_layers': 3, 'heading_error_activation': 'elu', 'heading_error_out_channels_l0': 90, 'heading_error_pool_size_l0': 8, 'heading_error_out_channels_l1': 57, 'heading_error_pool_size_l1': 8, 'heading_error_out_channels_l2': 148, 'heading_error_pool_size_l2': 4, 'heading_error_fc_hidden': 38}. Best is trial 84 with value: 0.0815.
[rank: 0] Seed set to 42
[rank: 0] Seed set to 42
[rank: 0] Seed set to 42
GPU available: True (cuda), used: True
TPU available: False, using: 0 TPU cores
GPU available: True (cuda), used: True
TPU available: False, using: 0 TPU cores
💡 Tip: For seamless cloud logging and experiment tracking, try installing [litlogger](https://pypi.org/project/litlogger/) to enable LitLogger, which logs metrics and artifacts automatically to the Lightning Experiments platform.
💡 Tip: For seamless cloud logging and experiment tracking, try installing [litlogger](https://pypi.org/project/litlogger/) to enable LitLogger, which logs metrics and artifacts automatically to the Lightning Experiments platform.
GPU available: True (cuda), used: True
TPU available: False, using: 0 TPU cores
💡 Tip: For seamless cloud logging and experiment tracking, try installing [litlogger](https://pypi.org/project/litlogger/) to enable LitLogger, which logs metrics and artifacts automatically to the Lightning Experiments platform.
LOCAL_RANK: 0 - CUDA_VISIBLE_DEVICES: [0]
LOCAL_RANK: 0 - CUDA_VISIBLE_DEVICES: [0]
LOCAL_RANK: 0 - CUDA_VISIBLE_DEVICES: [0]
SLURM auto-requeueing enabled. Setting signal handlers.
SLURM auto-requeueing enabled. Setting signal handlers.
SLURM auto-requeueing enabled. Setting signal handlers.
`Trainer.fit` stopped: `max_epochs=20` reached.
`Trainer.fit` stopped: `max_epochs=20` reached.
`Trainer.fit` stopped: `max_epochs=20` reached.
[I 2026-04-12 17:49:24,698] Trial 113 finished with value: 0.1146 and parameters: {'left_wall_dist_num_layers': 2, 'left_wall_dist_activation': 'relu', 'left_wall_dist_out_channels_l0': 82, 'left_wall_dist_pool_size_l0': 4, 'left_wall_dist_out_channels_l1': 93, 'left_wall_dist_pool_size_l1': 8, 'left_wall_dist_fc_hidden': 120, 'track_width_num_layers': 3, 'track_width_activation': 'elu', 'track_width_out_channels_l0': 156, 'track_width_pool_size_l0': 2, 'track_width_out_channels_l1': 113, 'track_width_pool_size_l1': 4, 'track_width_out_channels_l2': 58, 'track_width_pool_size_l2': 8, 'track_width_fc_hidden': 88, 'heading_error_num_layers': 3, 'heading_error_activation': 'elu', 'heading_error_out_channels_l0': 74, 'heading_error_pool_size_l0': 8, 'heading_error_out_channels_l1': 54, 'heading_error_pool_size_l1': 8, 'heading_error_out_channels_l2': 120, 'heading_error_pool_size_l2': 4, 'heading_error_fc_hidden': 43}. Best is trial 84 with value: 0.0815.
[rank: 0] Seed set to 42
[rank: 0] Seed set to 42
[rank: 0] Seed set to 42
GPU available: True (cuda), used: True
TPU available: False, using: 0 TPU cores
💡 Tip: For seamless cloud logging and experiment tracking, try installing [litlogger](https://pypi.org/project/litlogger/) to enable LitLogger, which logs metrics and artifacts automatically to the Lightning Experiments platform.
GPU available: True (cuda), used: True
TPU available: False, using: 0 TPU cores
💡 Tip: For seamless cloud logging and experiment tracking, try installing [litlogger](https://pypi.org/project/litlogger/) to enable LitLogger, which logs metrics and artifacts automatically to the Lightning Experiments platform.
GPU available: True (cuda), used: True
TPU available: False, using: 0 TPU cores
💡 Tip: For seamless cloud logging and experiment tracking, try installing [litlogger](https://pypi.org/project/litlogger/) to enable LitLogger, which logs metrics and artifacts automatically to the Lightning Experiments platform.
LOCAL_RANK: 0 - CUDA_VISIBLE_DEVICES: [0]
LOCAL_RANK: 0 - CUDA_VISIBLE_DEVICES: [0]
LOCAL_RANK: 0 - CUDA_VISIBLE_DEVICES: [0]
SLURM auto-requeueing enabled. Setting signal handlers.
SLURM auto-requeueing enabled. Setting signal handlers.
SLURM auto-requeueing enabled. Setting signal handlers.
`Trainer.fit` stopped: `max_epochs=20` reached.
`Trainer.fit` stopped: `max_epochs=20` reached.
`Trainer.fit` stopped: `max_epochs=20` reached.
