[I 2026-04-12 14:14:55,345] Trial 24 finished with value: 0.1307 and parameters: {'left_wall_dist_num_layers': 5, 'left_wall_dist_activation': 'relu', 'left_wall_dist_out_channels_l0': 112, 'left_wall_dist_pool_size_l0': 2, 'left_wall_dist_out_channels_l1': 128, 'left_wall_dist_pool_size_l1': 4, 'left_wall_dist_out_channels_l2': 33, 'left_wall_dist_pool_size_l2': 2, 'left_wall_dist_out_channels_l3': 256, 'left_wall_dist_pool_size_l3': 2, 'left_wall_dist_out_channels_l4': 120, 'left_wall_dist_pool_size_l4': 8, 'left_wall_dist_fc_hidden': 44, 'track_width_num_layers': 3, 'track_width_activation': 'elu', 'track_width_out_channels_l0': 181, 'track_width_pool_size_l0': 8, 'track_width_out_channels_l1': 152, 'track_width_pool_size_l1': 4, 'track_width_out_channels_l2': 102, 'track_width_pool_size_l2': 4, 'track_width_fc_hidden': 81, 'heading_error_num_layers': 3, 'heading_error_activation': 'elu', 'heading_error_out_channels_l0': 37, 'heading_error_pool_size_l0': 4, 'heading_error_out_channels_l1': 176, 'heading_error_pool_size_l1': 8, 'heading_error_out_channels_l2': 39, 'heading_error_pool_size_l2': 4, 'heading_error_fc_hidden': 41}. Best is trial 0 with value: 0.1027.
[rank: 0] Seed set to 42
[rank: 0] Seed set to 42
[rank: 0] Seed set to 42
GPU available: True (cuda), used: True
TPU available: False, using: 0 TPU cores
💡 Tip: For seamless cloud logging and experiment tracking, try installing [litlogger](https://pypi.org/project/litlogger/) to enable LitLogger, which logs metrics and artifacts automatically to the Lightning Experiments platform.
GPU available: True (cuda), used: True
TPU available: False, using: 0 TPU cores
💡 Tip: For seamless cloud logging and experiment tracking, try installing [litlogger](https://pypi.org/project/litlogger/) to enable LitLogger, which logs metrics and artifacts automatically to the Lightning Experiments platform.
GPU available: True (cuda), used: True
TPU available: False, using: 0 TPU cores
💡 Tip: For seamless cloud logging and experiment tracking, try installing [litlogger](https://pypi.org/project/litlogger/) to enable LitLogger, which logs metrics and artifacts automatically to the Lightning Experiments platform.
LOCAL_RANK: 0 - CUDA_VISIBLE_DEVICES: [0]
LOCAL_RANK: 0 - CUDA_VISIBLE_DEVICES: [0]
LOCAL_RANK: 0 - CUDA_VISIBLE_DEVICES: [0]
SLURM auto-requeueing enabled. Setting signal handlers.
SLURM auto-requeueing enabled. Setting signal handlers.
SLURM auto-requeueing enabled. Setting signal handlers.
`Trainer.fit` stopped: `max_epochs=20` reached.
`Trainer.fit` stopped: `max_epochs=20` reached.
`Trainer.fit` stopped: `max_epochs=20` reached.
[I 2026-04-12 14:17:06,929] Trial 25 finished with value: 0.1318 and parameters: {'left_wall_dist_num_layers': 4, 'left_wall_dist_activation': 'relu', 'left_wall_dist_out_channels_l0': 160, 'left_wall_dist_pool_size_l0': 4, 'left_wall_dist_out_channels_l1': 158, 'left_wall_dist_pool_size_l1': 4, 'left_wall_dist_out_channels_l2': 122, 'left_wall_dist_pool_size_l2': 2, 'left_wall_dist_out_channels_l3': 148, 'left_wall_dist_pool_size_l3': 2, 'left_wall_dist_fc_hidden': 97, 'track_width_num_layers': 4, 'track_width_activation': 'elu', 'track_width_out_channels_l0': 93, 'track_width_pool_size_l0': 4, 'track_width_out_channels_l1': 84, 'track_width_pool_size_l1': 4, 'track_width_out_channels_l2': 67, 'track_width_pool_size_l2': 4, 'track_width_out_channels_l3': 51, 'track_width_pool_size_l3': 4, 'track_width_fc_hidden': 35, 'heading_error_num_layers': 4, 'heading_error_activation': 'elu', 'heading_error_out_channels_l0': 67, 'heading_error_pool_size_l0': 4, 'heading_error_out_channels_l1': 104, 'heading_error_pool_size_l1': 4, 'heading_error_out_channels_l2': 66, 'heading_error_pool_size_l2': 4, 'heading_error_out_channels_l3': 130, 'heading_error_pool_size_l3': 2, 'heading_error_fc_hidden': 56}. Best is trial 0 with value: 0.1027.
[rank: 0] Seed set to 42
[rank: 0] Seed set to 42
[rank: 0] Seed set to 42
GPU available: True (cuda), used: True
TPU available: False, using: 0 TPU cores
💡 Tip: For seamless cloud logging and experiment tracking, try installing [litlogger](https://pypi.org/project/litlogger/) to enable LitLogger, which logs metrics and artifacts automatically to the Lightning Experiments platform.
GPU available: True (cuda), used: True
GPU available: True (cuda), used: True
TPU available: False, using: 0 TPU cores
TPU available: False, using: 0 TPU cores
💡 Tip: For seamless cloud logging and experiment tracking, try installing [litlogger](https://pypi.org/project/litlogger/) to enable LitLogger, which logs metrics and artifacts automatically to the Lightning Experiments platform.
💡 Tip: For seamless cloud logging and experiment tracking, try installing [litlogger](https://pypi.org/project/litlogger/) to enable LitLogger, which logs metrics and artifacts automatically to the Lightning Experiments platform.
LOCAL_RANK: 0 - CUDA_VISIBLE_DEVICES: [0]
LOCAL_RANK: 0 - CUDA_VISIBLE_DEVICES: [0]
LOCAL_RANK: 0 - CUDA_VISIBLE_DEVICES: [0]
SLURM auto-requeueing enabled. Setting signal handlers.
SLURM auto-requeueing enabled. Setting signal handlers.
SLURM auto-requeueing enabled. Setting signal handlers.
`Trainer.fit` stopped: `max_epochs=20` reached.
`Trainer.fit` stopped: `max_epochs=20` reached.
`Trainer.fit` stopped: `max_epochs=20` reached.
[I 2026-04-12 14:19:14,176] Trial 26 finished with value: 0.1237 and parameters: {'left_wall_dist_num_layers': 3, 'left_wall_dist_activation': 'elu', 'left_wall_dist_out_channels_l0': 81, 'left_wall_dist_pool_size_l0': 2, 'left_wall_dist_out_channels_l1': 244, 'left_wall_dist_pool_size_l1': 2, 'left_wall_dist_out_channels_l2': 60, 'left_wall_dist_pool_size_l2': 8, 'left_wall_dist_fc_hidden': 65, 'track_width_num_layers': 5, 'track_width_activation': 'relu', 'track_width_out_channels_l0': 127, 'track_width_pool_size_l0': 8, 'track_width_out_channels_l1': 56, 'track_width_pool_size_l1': 4, 'track_width_out_channels_l2': 32, 'track_width_pool_size_l2': 4, 'track_width_out_channels_l3': 134, 'track_width_pool_size_l3': 2, 'heading_error_num_layers': 3, 'heading_error_activation': 'elu', 'heading_error_out_channels_l0': 187, 'heading_error_pool_size_l0': 2, 'heading_error_out_channels_l1': 43, 'heading_error_pool_size_l1': 8, 'heading_error_out_channels_l2': 91, 'heading_error_pool_size_l2': 4, 'heading_error_fc_hidden': 43}. Best is trial 0 with value: 0.1027.
[rank: 0] Seed set to 42
[rank: 0] Seed set to 42
[rank: 0] Seed set to 42
GPU available: True (cuda), used: True
TPU available: False, using: 0 TPU cores
💡 Tip: For seamless cloud logging and experiment tracking, try installing [litlogger](https://pypi.org/project/litlogger/) to enable LitLogger, which logs metrics and artifacts automatically to the Lightning Experiments platform.
GPU available: True (cuda), used: True
TPU available: False, using: 0 TPU cores
💡 Tip: For seamless cloud logging and experiment tracking, try installing [litlogger](https://pypi.org/project/litlogger/) to enable LitLogger, which logs metrics and artifacts automatically to the Lightning Experiments platform.
GPU available: True (cuda), used: True
TPU available: False, using: 0 TPU cores
💡 Tip: For seamless cloud logging and experiment tracking, try installing [litlogger](https://pypi.org/project/litlogger/) to enable LitLogger, which logs metrics and artifacts automatically to the Lightning Experiments platform.
LOCAL_RANK: 0 - CUDA_VISIBLE_DEVICES: [0]
LOCAL_RANK: 0 - CUDA_VISIBLE_DEVICES: [0]
LOCAL_RANK: 0 - CUDA_VISIBLE_DEVICES: [0]
SLURM auto-requeueing enabled. Setting signal handlers.
SLURM auto-requeueing enabled. Setting signal handlers.
SLURM auto-requeueing enabled. Setting signal handlers.
`Trainer.fit` stopped: `max_epochs=20` reached.
`Trainer.fit` stopped: `max_epochs=20` reached.
`Trainer.fit` stopped: `max_epochs=20` reached.
[I 2026-04-12 14:21:18,730] Trial 27 finished with value: 0.1349 and parameters: {'left_wall_dist_num_layers': 4, 'left_wall_dist_activation': 'relu', 'left_wall_dist_out_channels_l0': 54, 'left_wall_dist_pool_size_l0': 2, 'left_wall_dist_out_channels_l1': 112, 'left_wall_dist_pool_size_l1': 4, 'left_wall_dist_out_channels_l2': 196, 'left_wall_dist_pool_size_l2': 4, 'left_wall_dist_out_channels_l3': 76, 'left_wall_dist_pool_size_l3': 8, 'left_wall_dist_fc_hidden': 43, 'track_width_num_layers': 3, 'track_width_activation': 'elu', 'track_width_out_channels_l0': 159, 'track_width_pool_size_l0': 8, 'track_width_out_channels_l1': 206, 'track_width_pool_size_l1': 4, 'track_width_out_channels_l2': 121, 'track_width_pool_size_l2': 2, 'track_width_fc_hidden': 57, 'heading_error_num_layers': 2, 'heading_error_activation': 'elu', 'heading_error_out_channels_l0': 105, 'heading_error_pool_size_l0': 4, 'heading_error_out_channels_l1': 149, 'heading_error_pool_size_l1': 8, 'heading_error_fc_hidden': 99}. Best is trial 0 with value: 0.1027.
[rank: 0] Seed set to 42
GPU available: True (cuda), used: True
TPU available: False, using: 0 TPU cores
💡 Tip: For seamless cloud logging and experiment tracking, try installing [litlogger](https://pypi.org/project/litlogger/) to enable LitLogger, which logs metrics and artifacts automatically to the Lightning Experiments platform.
[rank: 0] Seed set to 42
[rank: 0] Seed set to 42
GPU available: True (cuda), used: True
TPU available: False, using: 0 TPU cores
GPU available: True (cuda), used: True
TPU available: False, using: 0 TPU cores
💡 Tip: For seamless cloud logging and experiment tracking, try installing [litlogger](https://pypi.org/project/litlogger/) to enable LitLogger, which logs metrics and artifacts automatically to the Lightning Experiments platform.
💡 Tip: For seamless cloud logging and experiment tracking, try installing [litlogger](https://pypi.org/project/litlogger/) to enable LitLogger, which logs metrics and artifacts automatically to the Lightning Experiments platform.
LOCAL_RANK: 0 - CUDA_VISIBLE_DEVICES: [0]
LOCAL_RANK: 0 - CUDA_VISIBLE_DEVICES: [0]
LOCAL_RANK: 0 - CUDA_VISIBLE_DEVICES: [0]
SLURM auto-requeueing enabled. Setting signal handlers.
SLURM auto-requeueing enabled. Setting signal handlers.
SLURM auto-requeueing enabled. Setting signal handlers.
`Trainer.fit` stopped: `max_epochs=20` reached.
`Trainer.fit` stopped: `max_epochs=20` reached.
`Trainer.fit` stopped: `max_epochs=20` reached.
[I 2026-04-12 14:23:43,567] Trial 28 finished with value: 0.1452 and parameters: {'left_wall_dist_num_layers': 5, 'left_wall_dist_activation': 'relu', 'left_wall_dist_out_channels_l0': 98, 'left_wall_dist_pool_size_l0': 8, 'left_wall_dist_out_channels_l1': 82, 'left_wall_dist_pool_size_l1': 2, 'left_wall_dist_out_channels_l2': 40, 'left_wall_dist_pool_size_l2': 2, 'left_wall_dist_out_channels_l3': 114, 'left_wall_dist_pool_size_l3': 2, 'left_wall_dist_out_channels_l4': 37, 'left_wall_dist_pool_size_l4': 4, 'track_width_num_layers': 4, 'track_width_activation': 'relu', 'track_width_out_channels_l0': 200, 'track_width_pool_size_l0': 2, 'track_width_out_channels_l1': 71, 'track_width_pool_size_l1': 2, 'track_width_out_channels_l2': 195, 'track_width_pool_size_l2': 4, 'track_width_out_channels_l3': 84, 'track_width_pool_size_l3': 4, 'track_width_fc_hidden': 41, 'heading_error_num_layers': 4, 'heading_error_activation': 'elu', 'heading_error_out_channels_l0': 49, 'heading_error_pool_size_l0': 2, 'heading_error_out_channels_l1': 208, 'heading_error_pool_size_l1': 2, 'heading_error_out_channels_l2': 50, 'heading_error_pool_size_l2': 8, 'heading_error_out_channels_l3': 100, 'heading_error_pool_size_l3': 8, 'heading_error_fc_hidden': 61}. Best is trial 0 with value: 0.1027.
[rank: 0] Seed set to 42
[rank: 0] Seed set to 42
[rank: 0] Seed set to 42
GPU available: True (cuda), used: True
TPU available: False, using: 0 TPU cores
💡 Tip: For seamless cloud logging and experiment tracking, try installing [litlogger](https://pypi.org/project/litlogger/) to enable LitLogger, which logs metrics and artifacts automatically to the Lightning Experiments platform.
GPU available: True (cuda), used: True
TPU available: False, using: 0 TPU cores
💡 Tip: For seamless cloud logging and experiment tracking, try installing [litlogger](https://pypi.org/project/litlogger/) to enable LitLogger, which logs metrics and artifacts automatically to the Lightning Experiments platform.
GPU available: True (cuda), used: True
TPU available: False, using: 0 TPU cores
💡 Tip: For seamless cloud logging and experiment tracking, try installing [litlogger](https://pypi.org/project/litlogger/) to enable LitLogger, which logs metrics and artifacts automatically to the Lightning Experiments platform.
LOCAL_RANK: 0 - CUDA_VISIBLE_DEVICES: [0]
LOCAL_RANK: 0 - CUDA_VISIBLE_DEVICES: [0]
LOCAL_RANK: 0 - CUDA_VISIBLE_DEVICES: [0]
SLURM auto-requeueing enabled. Setting signal handlers.
SLURM auto-requeueing enabled. Setting signal handlers.
SLURM auto-requeueing enabled. Setting signal handlers.
`Trainer.fit` stopped: `max_epochs=20` reached.
`Trainer.fit` stopped: `max_epochs=20` reached.
`Trainer.fit` stopped: `max_epochs=20` reached.
[I 2026-04-12 14:25:48,978] Trial 29 finished with value: 0.1436 and parameters: {'left_wall_dist_num_layers': 3, 'left_wall_dist_activation': 'relu', 'left_wall_dist_out_channels_l0': 221, 'left_wall_dist_pool_size_l0': 4, 'left_wall_dist_out_channels_l1': 204, 'left_wall_dist_pool_size_l1': 8, 'left_wall_dist_out_channels_l2': 85, 'left_wall_dist_pool_size_l2': 8, 'left_wall_dist_fc_hidden': 39, 'track_width_num_layers': 3, 'track_width_activation': 'elu', 'track_width_out_channels_l0': 232, 'track_width_pool_size_l0': 4, 'track_width_out_channels_l1': 127, 'track_width_pool_size_l1': 8, 'track_width_out_channels_l2': 52, 'track_width_pool_size_l2': 2, 'track_width_fc_hidden': 78, 'heading_error_num_layers': 3, 'heading_error_activation': 'relu', 'heading_error_out_channels_l0': 65, 'heading_error_pool_size_l0': 8, 'heading_error_out_channels_l1': 40, 'heading_error_pool_size_l1': 4, 'heading_error_out_channels_l2': 140, 'heading_error_pool_size_l2': 2, 'heading_error_fc_hidden': 71}. Best is trial 0 with value: 0.1027.
[rank: 0] Seed set to 42
GPU available: True (cuda), used: True
TPU available: False, using: 0 TPU cores
💡 Tip: For seamless cloud logging and experiment tracking, try installing [litlogger](https://pypi.org/project/litlogger/) to enable LitLogger, which logs metrics and artifacts automatically to the Lightning Experiments platform.
[rank: 0] Seed set to 42
[rank: 0] Seed set to 42
GPU available: True (cuda), used: True
TPU available: False, using: 0 TPU cores
💡 Tip: For seamless cloud logging and experiment tracking, try installing [litlogger](https://pypi.org/project/litlogger/) to enable LitLogger, which logs metrics and artifacts automatically to the Lightning Experiments platform.
GPU available: True (cuda), used: True
TPU available: False, using: 0 TPU cores
💡 Tip: For seamless cloud logging and experiment tracking, try installing [litlogger](https://pypi.org/project/litlogger/) to enable LitLogger, which logs metrics and artifacts automatically to the Lightning Experiments platform.
LOCAL_RANK: 0 - CUDA_VISIBLE_DEVICES: [0]
LOCAL_RANK: 0 - CUDA_VISIBLE_DEVICES: [0]
LOCAL_RANK: 0 - CUDA_VISIBLE_DEVICES: [0]
SLURM auto-requeueing enabled. Setting signal handlers.
SLURM auto-requeueing enabled. Setting signal handlers.
SLURM auto-requeueing enabled. Setting signal handlers.
`Trainer.fit` stopped: `max_epochs=20` reached.
`Trainer.fit` stopped: `max_epochs=20` reached.
`Trainer.fit` stopped: `max_epochs=20` reached.
[I 2026-04-12 14:28:01,818] Trial 30 finished with value: 0.1291 and parameters: {'left_wall_dist_num_layers': 4, 'left_wall_dist_activation': 'relu', 'left_wall_dist_out_channels_l0': 238, 'left_wall_dist_pool_size_l0': 8, 'left_wall_dist_out_channels_l1': 141, 'left_wall_dist_pool_size_l1': 2, 'left_wall_dist_out_channels_l2': 253, 'left_wall_dist_pool_size_l2': 2, 'left_wall_dist_out_channels_l3': 181, 'left_wall_dist_pool_size_l3': 2, 'left_wall_dist_fc_hidden': 88, 'track_width_num_layers': 4, 'track_width_activation': 'elu', 'track_width_out_channels_l0': 99, 'track_width_pool_size_l0': 4, 'track_width_out_channels_l1': 145, 'track_width_pool_size_l1': 2, 'track_width_out_channels_l2': 40, 'track_width_pool_size_l2': 8, 'track_width_out_channels_l3': 55, 'track_width_pool_size_l3': 8, 'heading_error_num_layers': 3, 'heading_error_activation': 'elu', 'heading_error_out_channels_l0': 79, 'heading_error_pool_size_l0': 8, 'heading_error_out_channels_l1': 146, 'heading_error_pool_size_l1': 4, 'heading_error_out_channels_l2': 40, 'heading_error_pool_size_l2': 4, 'heading_error_fc_hidden': 36}. Best is trial 0 with value: 0.1027.
[rank: 0] Seed set to 42
[rank: 0] Seed set to 42
[rank: 0] Seed set to 42
GPU available: True (cuda), used: True
TPU available: False, using: 0 TPU cores
💡 Tip: For seamless cloud logging and experiment tracking, try installing [litlogger](https://pypi.org/project/litlogger/) to enable LitLogger, which logs metrics and artifacts automatically to the Lightning Experiments platform.
GPU available: True (cuda), used: True
TPU available: False, using: 0 TPU cores
💡 Tip: For seamless cloud logging and experiment tracking, try installing [litlogger](https://pypi.org/project/litlogger/) to enable LitLogger, which logs metrics and artifacts automatically to the Lightning Experiments platform.
GPU available: True (cuda), used: True
TPU available: False, using: 0 TPU cores
💡 Tip: For seamless cloud logging and experiment tracking, try installing [litlogger](https://pypi.org/project/litlogger/) to enable LitLogger, which logs metrics and artifacts automatically to the Lightning Experiments platform.
LOCAL_RANK: 0 - CUDA_VISIBLE_DEVICES: [0]
LOCAL_RANK: 0 - CUDA_VISIBLE_DEVICES: [0]
LOCAL_RANK: 0 - CUDA_VISIBLE_DEVICES: [0]
SLURM auto-requeueing enabled. Setting signal handlers.
SLURM auto-requeueing enabled. Setting signal handlers.
SLURM auto-requeueing enabled. Setting signal handlers.
`Trainer.fit` stopped: `max_epochs=20` reached.
`Trainer.fit` stopped: `max_epochs=20` reached.
`Trainer.fit` stopped: `max_epochs=20` reached.
[I 2026-04-12 14:30:13,246] Trial 31 finished with value: 0.0984 and parameters: {'left_wall_dist_num_layers': 4, 'left_wall_dist_activation': 'relu', 'left_wall_dist_out_channels_l0': 37, 'left_wall_dist_pool_size_l0': 2, 'left_wall_dist_out_channels_l1': 128, 'left_wall_dist_pool_size_l1': 4, 'left_wall_dist_out_channels_l2': 41, 'left_wall_dist_pool_size_l2': 2, 'left_wall_dist_out_channels_l3': 203, 'left_wall_dist_pool_size_l3': 2, 'left_wall_dist_fc_hidden': 126, 'track_width_num_layers': 4, 'track_width_activation': 'elu', 'track_width_out_channels_l0': 253, 'track_width_pool_size_l0': 8, 'track_width_out_channels_l1': 243, 'track_width_pool_size_l1': 4, 'track_width_out_channels_l2': 50, 'track_width_pool_size_l2': 4, 'track_width_out_channels_l3': 70, 'track_width_pool_size_l3': 4, 'heading_error_num_layers': 3, 'heading_error_activation': 'elu', 'heading_error_out_channels_l0': 55, 'heading_error_pool_size_l0': 4, 'heading_error_out_channels_l1': 209, 'heading_error_pool_size_l1': 8, 'heading_error_out_channels_l2': 40, 'heading_error_pool_size_l2': 4, 'heading_error_fc_hidden': 57}. Best is trial 31 with value: 0.0984.
[rank: 0] Seed set to 42
GPU available: True (cuda), used: True
TPU available: False, using: 0 TPU cores
💡 Tip: For seamless cloud logging and experiment tracking, try installing [litlogger](https://pypi.org/project/litlogger/) to enable LitLogger, which logs metrics and artifacts automatically to the Lightning Experiments platform.
[rank: 0] Seed set to 42
[rank: 0] Seed set to 42
GPU available: True (cuda), used: True
TPU available: False, using: 0 TPU cores
💡 Tip: For seamless cloud logging and experiment tracking, try installing [litlogger](https://pypi.org/project/litlogger/) to enable LitLogger, which logs metrics and artifacts automatically to the Lightning Experiments platform.
GPU available: True (cuda), used: True
TPU available: False, using: 0 TPU cores
💡 Tip: For seamless cloud logging and experiment tracking, try installing [litlogger](https://pypi.org/project/litlogger/) to enable LitLogger, which logs metrics and artifacts automatically to the Lightning Experiments platform.
LOCAL_RANK: 0 - CUDA_VISIBLE_DEVICES: [0]
LOCAL_RANK: 0 - CUDA_VISIBLE_DEVICES: [0]
LOCAL_RANK: 0 - CUDA_VISIBLE_DEVICES: [0]
SLURM auto-requeueing enabled. Setting signal handlers.
SLURM auto-requeueing enabled. Setting signal handlers.
SLURM auto-requeueing enabled. Setting signal handlers.
`Trainer.fit` stopped: `max_epochs=20` reached.
`Trainer.fit` stopped: `max_epochs=20` reached.
`Trainer.fit` stopped: `max_epochs=20` reached.
