[I 2026-04-14 23:49:00,510] Trial 67 finished with value: 0.1053 and parameters: {'left_wall_dist_num_layers': 2, 'left_wall_dist_activation': 'relu', 'left_wall_dist_out_channels_l0': 110, 'left_wall_dist_pool_size_l0': 4, 'left_wall_dist_out_channels_l1': 54, 'left_wall_dist_pool_size_l1': 4, 'left_wall_dist_fc_hidden': 92, 'track_width_num_layers': 4, 'track_width_activation': 'relu', 'track_width_out_channels_l0': 104, 'track_width_pool_size_l0': 2, 'track_width_out_channels_l1': 149, 'track_width_pool_size_l1': 2, 'track_width_out_channels_l2': 88, 'track_width_pool_size_l2': 2, 'track_width_out_channels_l3': 104, 'track_width_pool_size_l3': 8, 'track_width_fc_hidden': 89, 'heading_error_num_layers': 3, 'heading_error_activation': 'elu', 'heading_error_out_channels_l0': 127, 'heading_error_pool_size_l0': 4, 'heading_error_out_channels_l1': 80, 'heading_error_pool_size_l1': 8, 'heading_error_out_channels_l2': 48, 'heading_error_pool_size_l2': 4, 'heading_error_fc_hidden': 49}. Best is trial 26 with value: 0.0907.
[rank: 0] Seed set to 42
[rank: 0] Seed set to 42
[rank: 0] Seed set to 42
GPU available: True (cuda), used: True
TPU available: False, using: 0 TPU cores
💡 Tip: For seamless cloud logging and experiment tracking, try installing [litlogger](https://pypi.org/project/litlogger/) to enable LitLogger, which logs metrics and artifacts automatically to the Lightning Experiments platform.
GPU available: True (cuda), used: True
TPU available: False, using: 0 TPU cores
💡 Tip: For seamless cloud logging and experiment tracking, try installing [litlogger](https://pypi.org/project/litlogger/) to enable LitLogger, which logs metrics and artifacts automatically to the Lightning Experiments platform.
GPU available: True (cuda), used: True
TPU available: False, using: 0 TPU cores
💡 Tip: For seamless cloud logging and experiment tracking, try installing [litlogger](https://pypi.org/project/litlogger/) to enable LitLogger, which logs metrics and artifacts automatically to the Lightning Experiments platform.
LOCAL_RANK: 0 - CUDA_VISIBLE_DEVICES: [0]
LOCAL_RANK: 0 - CUDA_VISIBLE_DEVICES: [0]
LOCAL_RANK: 0 - CUDA_VISIBLE_DEVICES: [0]
SLURM auto-requeueing enabled. Setting signal handlers.
SLURM auto-requeueing enabled. Setting signal handlers.
SLURM auto-requeueing enabled. Setting signal handlers.
`Trainer.fit` stopped: `max_epochs=30` reached.
`Trainer.fit` stopped: `max_epochs=30` reached.
`Trainer.fit` stopped: `max_epochs=30` reached.
[I 2026-04-14 23:51:47,381] Trial 68 finished with value: 0.1003 and parameters: {'left_wall_dist_num_layers': 2, 'left_wall_dist_activation': 'relu', 'left_wall_dist_out_channels_l0': 64, 'left_wall_dist_pool_size_l0': 4, 'left_wall_dist_out_channels_l1': 87, 'left_wall_dist_pool_size_l1': 4, 'left_wall_dist_fc_hidden': 110, 'track_width_num_layers': 4, 'track_width_activation': 'relu', 'track_width_out_channels_l0': 80, 'track_width_pool_size_l0': 4, 'track_width_out_channels_l1': 50, 'track_width_pool_size_l1': 2, 'track_width_out_channels_l2': 134, 'track_width_pool_size_l2': 2, 'track_width_out_channels_l3': 178, 'track_width_pool_size_l3': 8, 'track_width_fc_hidden': 55, 'heading_error_num_layers': 3, 'heading_error_activation': 'elu', 'heading_error_out_channels_l0': 101, 'heading_error_pool_size_l0': 4, 'heading_error_out_channels_l1': 40, 'heading_error_pool_size_l1': 8, 'heading_error_out_channels_l2': 85, 'heading_error_pool_size_l2': 2, 'heading_error_fc_hidden': 107}. Best is trial 26 with value: 0.0907.
[rank: 0] Seed set to 42
[rank: 0] Seed set to 42
[rank: 0] Seed set to 42
GPU available: True (cuda), used: True
TPU available: False, using: 0 TPU cores
GPU available: True (cuda), used: True
TPU available: False, using: 0 TPU cores
💡 Tip: For seamless cloud logging and experiment tracking, try installing [litlogger](https://pypi.org/project/litlogger/) to enable LitLogger, which logs metrics and artifacts automatically to the Lightning Experiments platform.
💡 Tip: For seamless cloud logging and experiment tracking, try installing [litlogger](https://pypi.org/project/litlogger/) to enable LitLogger, which logs metrics and artifacts automatically to the Lightning Experiments platform.
GPU available: True (cuda), used: True
TPU available: False, using: 0 TPU cores
💡 Tip: For seamless cloud logging and experiment tracking, try installing [litlogger](https://pypi.org/project/litlogger/) to enable LitLogger, which logs metrics and artifacts automatically to the Lightning Experiments platform.
LOCAL_RANK: 0 - CUDA_VISIBLE_DEVICES: [0]
LOCAL_RANK: 0 - CUDA_VISIBLE_DEVICES: [0]
LOCAL_RANK: 0 - CUDA_VISIBLE_DEVICES: [0]
SLURM auto-requeueing enabled. Setting signal handlers.
SLURM auto-requeueing enabled. Setting signal handlers.
SLURM auto-requeueing enabled. Setting signal handlers.
`Trainer.fit` stopped: `max_epochs=30` reached.
`Trainer.fit` stopped: `max_epochs=30` reached.
`Trainer.fit` stopped: `max_epochs=30` reached.
[I 2026-04-14 23:54:33,561] Trial 69 finished with value: 0.1137 and parameters: {'left_wall_dist_num_layers': 3, 'left_wall_dist_activation': 'relu', 'left_wall_dist_out_channels_l0': 102, 'left_wall_dist_pool_size_l0': 4, 'left_wall_dist_out_channels_l1': 38, 'left_wall_dist_pool_size_l1': 2, 'left_wall_dist_out_channels_l2': 80, 'left_wall_dist_pool_size_l2': 4, 'left_wall_dist_fc_hidden': 123, 'track_width_num_layers': 3, 'track_width_activation': 'relu', 'track_width_out_channels_l0': 74, 'track_width_pool_size_l0': 4, 'track_width_out_channels_l1': 66, 'track_width_pool_size_l1': 2, 'track_width_out_channels_l2': 66, 'track_width_pool_size_l2': 8, 'track_width_fc_hidden': 114, 'heading_error_num_layers': 3, 'heading_error_activation': 'elu', 'heading_error_out_channels_l0': 184, 'heading_error_pool_size_l0': 2, 'heading_error_out_channels_l1': 68, 'heading_error_pool_size_l1': 4, 'heading_error_out_channels_l2': 70, 'heading_error_pool_size_l2': 4, 'heading_error_fc_hidden': 41}. Best is trial 26 with value: 0.0907.
[rank: 0] Seed set to 42
[rank: 0] Seed set to 42
[rank: 0] Seed set to 42
GPU available: True (cuda), used: True
TPU available: False, using: 0 TPU cores
💡 Tip: For seamless cloud logging and experiment tracking, try installing [litlogger](https://pypi.org/project/litlogger/) to enable LitLogger, which logs metrics and artifacts automatically to the Lightning Experiments platform.
GPU available: True (cuda), used: True
TPU available: False, using: 0 TPU cores
GPU available: True (cuda), used: True
TPU available: False, using: 0 TPU cores
💡 Tip: For seamless cloud logging and experiment tracking, try installing [litlogger](https://pypi.org/project/litlogger/) to enable LitLogger, which logs metrics and artifacts automatically to the Lightning Experiments platform.
💡 Tip: For seamless cloud logging and experiment tracking, try installing [litlogger](https://pypi.org/project/litlogger/) to enable LitLogger, which logs metrics and artifacts automatically to the Lightning Experiments platform.
LOCAL_RANK: 0 - CUDA_VISIBLE_DEVICES: [0]
LOCAL_RANK: 0 - CUDA_VISIBLE_DEVICES: [0]
LOCAL_RANK: 0 - CUDA_VISIBLE_DEVICES: [0]
SLURM auto-requeueing enabled. Setting signal handlers.
SLURM auto-requeueing enabled. Setting signal handlers.
SLURM auto-requeueing enabled. Setting signal handlers.
`Trainer.fit` stopped: `max_epochs=30` reached.
`Trainer.fit` stopped: `max_epochs=30` reached.
`Trainer.fit` stopped: `max_epochs=30` reached.
[I 2026-04-14 23:57:18,221] Trial 70 finished with value: 0.1291 and parameters: {'left_wall_dist_num_layers': 2, 'left_wall_dist_activation': 'relu', 'left_wall_dist_out_channels_l0': 78, 'left_wall_dist_pool_size_l0': 2, 'left_wall_dist_out_channels_l1': 67, 'left_wall_dist_pool_size_l1': 4, 'track_width_num_layers': 4, 'track_width_activation': 'elu', 'track_width_out_channels_l0': 35, 'track_width_pool_size_l0': 4, 'track_width_out_channels_l1': 53, 'track_width_pool_size_l1': 2, 'track_width_out_channels_l2': 50, 'track_width_pool_size_l2': 2, 'track_width_out_channels_l3': 149, 'track_width_pool_size_l3': 8, 'track_width_fc_hidden': 122, 'heading_error_num_layers': 4, 'heading_error_activation': 'relu', 'heading_error_out_channels_l0': 112, 'heading_error_pool_size_l0': 8, 'heading_error_out_channels_l1': 72, 'heading_error_pool_size_l1': 8, 'heading_error_out_channels_l2': 58, 'heading_error_pool_size_l2': 4, 'heading_error_out_channels_l3': 48, 'heading_error_pool_size_l3': 8}. Best is trial 26 with value: 0.0907.
[rank: 0] Seed set to 42
[rank: 0] Seed set to 42
[rank: 0] Seed set to 42
GPU available: True (cuda), used: True
TPU available: False, using: 0 TPU cores
💡 Tip: For seamless cloud logging and experiment tracking, try installing [litlogger](https://pypi.org/project/litlogger/) to enable LitLogger, which logs metrics and artifacts automatically to the Lightning Experiments platform.
GPU available: True (cuda), used: True
TPU available: False, using: 0 TPU cores
💡 Tip: For seamless cloud logging and experiment tracking, try installing [litlogger](https://pypi.org/project/litlogger/) to enable LitLogger, which logs metrics and artifacts automatically to the Lightning Experiments platform.
GPU available: True (cuda), used: True
TPU available: False, using: 0 TPU cores
💡 Tip: For seamless cloud logging and experiment tracking, try installing [litlogger](https://pypi.org/project/litlogger/) to enable LitLogger, which logs metrics and artifacts automatically to the Lightning Experiments platform.
LOCAL_RANK: 0 - CUDA_VISIBLE_DEVICES: [0]
LOCAL_RANK: 0 - CUDA_VISIBLE_DEVICES: [0]
LOCAL_RANK: 0 - CUDA_VISIBLE_DEVICES: [0]
SLURM auto-requeueing enabled. Setting signal handlers.
SLURM auto-requeueing enabled. Setting signal handlers.
SLURM auto-requeueing enabled. Setting signal handlers.
`Trainer.fit` stopped: `max_epochs=30` reached.
`Trainer.fit` stopped: `max_epochs=30` reached.
`Trainer.fit` stopped: `max_epochs=30` reached.
[I 2026-04-14 23:59:59,279] Trial 71 finished with value: 0.0966 and parameters: {'left_wall_dist_num_layers': 2, 'left_wall_dist_activation': 'relu', 'left_wall_dist_out_channels_l0': 68, 'left_wall_dist_pool_size_l0': 4, 'left_wall_dist_out_channels_l1': 72, 'left_wall_dist_pool_size_l1': 4, 'left_wall_dist_fc_hidden': 102, 'track_width_num_layers': 4, 'track_width_activation': 'relu', 'track_width_out_channels_l0': 91, 'track_width_pool_size_l0': 4, 'track_width_out_channels_l1': 39, 'track_width_pool_size_l1': 2, 'track_width_out_channels_l2': 124, 'track_width_pool_size_l2': 2, 'track_width_out_channels_l3': 145, 'track_width_pool_size_l3': 4, 'track_width_fc_hidden': 107, 'heading_error_num_layers': 3, 'heading_error_activation': 'elu', 'heading_error_out_channels_l0': 116, 'heading_error_pool_size_l0': 4, 'heading_error_out_channels_l1': 46, 'heading_error_pool_size_l1': 8, 'heading_error_out_channels_l2': 77, 'heading_error_pool_size_l2': 4, 'heading_error_fc_hidden': 53}. Best is trial 26 with value: 0.0907.
[rank: 0] Seed set to 42
[rank: 0] Seed set to 42
[rank: 0] Seed set to 42
GPU available: True (cuda), used: True
TPU available: False, using: 0 TPU cores
💡 Tip: For seamless cloud logging and experiment tracking, try installing [litlogger](https://pypi.org/project/litlogger/) to enable LitLogger, which logs metrics and artifacts automatically to the Lightning Experiments platform.
GPU available: True (cuda), used: True
TPU available: False, using: 0 TPU cores
💡 Tip: For seamless cloud logging and experiment tracking, try installing [litlogger](https://pypi.org/project/litlogger/) to enable LitLogger, which logs metrics and artifacts automatically to the Lightning Experiments platform.
GPU available: True (cuda), used: True
TPU available: False, using: 0 TPU cores
💡 Tip: For seamless cloud logging and experiment tracking, try installing [litlogger](https://pypi.org/project/litlogger/) to enable LitLogger, which logs metrics and artifacts automatically to the Lightning Experiments platform.
LOCAL_RANK: 0 - CUDA_VISIBLE_DEVICES: [0]
LOCAL_RANK: 0 - CUDA_VISIBLE_DEVICES: [0]
LOCAL_RANK: 0 - CUDA_VISIBLE_DEVICES: [0]
SLURM auto-requeueing enabled. Setting signal handlers.
SLURM auto-requeueing enabled. Setting signal handlers.
SLURM auto-requeueing enabled. Setting signal handlers.
`Trainer.fit` stopped: `max_epochs=30` reached.
`Trainer.fit` stopped: `max_epochs=30` reached.
`Trainer.fit` stopped: `max_epochs=30` reached.
[I 2026-04-15 00:02:40,794] Trial 72 finished with value: 0.1018 and parameters: {'left_wall_dist_num_layers': 2, 'left_wall_dist_activation': 'relu', 'left_wall_dist_out_channels_l0': 83, 'left_wall_dist_pool_size_l0': 4, 'left_wall_dist_out_channels_l1': 63, 'left_wall_dist_pool_size_l1': 4, 'left_wall_dist_fc_hidden': 99, 'track_width_num_layers': 4, 'track_width_activation': 'relu', 'track_width_out_channels_l0': 84, 'track_width_pool_size_l0': 4, 'track_width_out_channels_l1': 37, 'track_width_pool_size_l1': 2, 'track_width_out_channels_l2': 149, 'track_width_pool_size_l2': 2, 'track_width_out_channels_l3': 127, 'track_width_pool_size_l3': 4, 'track_width_fc_hidden': 104, 'heading_error_num_layers': 3, 'heading_error_activation': 'elu', 'heading_error_out_channels_l0': 88, 'heading_error_pool_size_l0': 4, 'heading_error_out_channels_l1': 43, 'heading_error_pool_size_l1': 8, 'heading_error_out_channels_l2': 68, 'heading_error_pool_size_l2': 4, 'heading_error_fc_hidden': 58}. Best is trial 26 with value: 0.0907.
[rank: 0] Seed set to 42
[rank: 0] Seed set to 42
[rank: 0] Seed set to 42
GPU available: True (cuda), used: True
TPU available: False, using: 0 TPU cores
GPU available: True (cuda), used: True
TPU available: False, using: 0 TPU cores
💡 Tip: For seamless cloud logging and experiment tracking, try installing [litlogger](https://pypi.org/project/litlogger/) to enable LitLogger, which logs metrics and artifacts automatically to the Lightning Experiments platform.
GPU available: True (cuda), used: True
TPU available: False, using: 0 TPU cores
💡 Tip: For seamless cloud logging and experiment tracking, try installing [litlogger](https://pypi.org/project/litlogger/) to enable LitLogger, which logs metrics and artifacts automatically to the Lightning Experiments platform.
💡 Tip: For seamless cloud logging and experiment tracking, try installing [litlogger](https://pypi.org/project/litlogger/) to enable LitLogger, which logs metrics and artifacts automatically to the Lightning Experiments platform.
LOCAL_RANK: 0 - CUDA_VISIBLE_DEVICES: [0]
LOCAL_RANK: 0 - CUDA_VISIBLE_DEVICES: [0]
LOCAL_RANK: 0 - CUDA_VISIBLE_DEVICES: [0]
SLURM auto-requeueing enabled. Setting signal handlers.
SLURM auto-requeueing enabled. Setting signal handlers.
SLURM auto-requeueing enabled. Setting signal handlers.
`Trainer.fit` stopped: `max_epochs=30` reached.
`Trainer.fit` stopped: `max_epochs=30` reached.
`Trainer.fit` stopped: `max_epochs=30` reached.
[I 2026-04-15 00:05:21,183] Trial 73 finished with value: 0.0994 and parameters: {'left_wall_dist_num_layers': 2, 'left_wall_dist_activation': 'relu', 'left_wall_dist_out_channels_l0': 69, 'left_wall_dist_pool_size_l0': 4, 'left_wall_dist_out_channels_l1': 46, 'left_wall_dist_pool_size_l1': 4, 'left_wall_dist_fc_hidden': 110, 'track_width_num_layers': 4, 'track_width_activation': 'relu', 'track_width_out_channels_l0': 95, 'track_width_pool_size_l0': 4, 'track_width_out_channels_l1': 45, 'track_width_pool_size_l1': 2, 'track_width_out_channels_l2': 118, 'track_width_pool_size_l2': 2, 'track_width_out_channels_l3': 84, 'track_width_pool_size_l3': 4, 'track_width_fc_hidden': 127, 'heading_error_num_layers': 3, 'heading_error_activation': 'elu', 'heading_error_out_channels_l0': 136, 'heading_error_pool_size_l0': 4, 'heading_error_out_channels_l1': 53, 'heading_error_pool_size_l1': 8, 'heading_error_out_channels_l2': 79, 'heading_error_pool_size_l2': 4, 'heading_error_fc_hidden': 52}. Best is trial 26 with value: 0.0907.
[rank: 0] Seed set to 42
[rank: 0] Seed set to 42
[rank: 0] Seed set to 42
GPU available: True (cuda), used: True
TPU available: False, using: 0 TPU cores
💡 Tip: For seamless cloud logging and experiment tracking, try installing [litlogger](https://pypi.org/project/litlogger/) to enable LitLogger, which logs metrics and artifacts automatically to the Lightning Experiments platform.
GPU available: True (cuda), used: True
TPU available: False, using: 0 TPU cores
💡 Tip: For seamless cloud logging and experiment tracking, try installing [litlogger](https://pypi.org/project/litlogger/) to enable LitLogger, which logs metrics and artifacts automatically to the Lightning Experiments platform.
GPU available: True (cuda), used: True
TPU available: False, using: 0 TPU cores
💡 Tip: For seamless cloud logging and experiment tracking, try installing [litlogger](https://pypi.org/project/litlogger/) to enable LitLogger, which logs metrics and artifacts automatically to the Lightning Experiments platform.
LOCAL_RANK: 0 - CUDA_VISIBLE_DEVICES: [0]
LOCAL_RANK: 0 - CUDA_VISIBLE_DEVICES: [0]
LOCAL_RANK: 0 - CUDA_VISIBLE_DEVICES: [0]
SLURM auto-requeueing enabled. Setting signal handlers.
SLURM auto-requeueing enabled. Setting signal handlers.
SLURM auto-requeueing enabled. Setting signal handlers.
`Trainer.fit` stopped: `max_epochs=30` reached.
`Trainer.fit` stopped: `max_epochs=30` reached.
`Trainer.fit` stopped: `max_epochs=30` reached.
[I 2026-04-15 00:08:06,730] Trial 74 finished with value: 0.1019 and parameters: {'left_wall_dist_num_layers': 2, 'left_wall_dist_activation': 'relu', 'left_wall_dist_out_channels_l0': 92, 'left_wall_dist_pool_size_l0': 4, 'left_wall_dist_out_channels_l1': 69, 'left_wall_dist_pool_size_l1': 4, 'left_wall_dist_fc_hidden': 106, 'track_width_num_layers': 4, 'track_width_activation': 'relu', 'track_width_out_channels_l0': 102, 'track_width_pool_size_l0': 4, 'track_width_out_channels_l1': 43, 'track_width_pool_size_l1': 2, 'track_width_out_channels_l2': 174, 'track_width_pool_size_l2': 2, 'track_width_out_channels_l3': 72, 'track_width_pool_size_l3': 4, 'track_width_fc_hidden': 115, 'heading_error_num_layers': 3, 'heading_error_activation': 'elu', 'heading_error_out_channels_l0': 153, 'heading_error_pool_size_l0': 4, 'heading_error_out_channels_l1': 47, 'heading_error_pool_size_l1': 8, 'heading_error_out_channels_l2': 73, 'heading_error_pool_size_l2': 4, 'heading_error_fc_hidden': 47}. Best is trial 26 with value: 0.0907.
[rank: 0] Seed set to 42
[rank: 0] Seed set to 42
[rank: 0] Seed set to 42
GPU available: True (cuda), used: True
TPU available: False, using: 0 TPU cores
💡 Tip: For seamless cloud logging and experiment tracking, try installing [litlogger](https://pypi.org/project/litlogger/) to enable LitLogger, which logs metrics and artifacts automatically to the Lightning Experiments platform.
GPU available: True (cuda), used: True
TPU available: False, using: 0 TPU cores
💡 Tip: For seamless cloud logging and experiment tracking, try installing [litlogger](https://pypi.org/project/litlogger/) to enable LitLogger, which logs metrics and artifacts automatically to the Lightning Experiments platform.
GPU available: True (cuda), used: True
TPU available: False, using: 0 TPU cores
💡 Tip: For seamless cloud logging and experiment tracking, try installing [litlogger](https://pypi.org/project/litlogger/) to enable LitLogger, which logs metrics and artifacts automatically to the Lightning Experiments platform.
LOCAL_RANK: 0 - CUDA_VISIBLE_DEVICES: [0]
LOCAL_RANK: 0 - CUDA_VISIBLE_DEVICES: [0]
LOCAL_RANK: 0 - CUDA_VISIBLE_DEVICES: [0]
SLURM auto-requeueing enabled. Setting signal handlers.
SLURM auto-requeueing enabled. Setting signal handlers.
SLURM auto-requeueing enabled. Setting signal handlers.
`Trainer.fit` stopped: `max_epochs=30` reached.
`Trainer.fit` stopped: `max_epochs=30` reached.
`Trainer.fit` stopped: `max_epochs=30` reached.
