[I 2026-04-16 02:16:35,181] Trial 116 finished with value: 0.1489 and parameters: {'left_wall_dist_num_layers': 5, 'left_wall_dist_activation': 'elu', 'left_wall_dist_out_channels_l0': 177, 'left_wall_dist_pool_size_l0': 8, 'left_wall_dist_out_channels_l1': 68, 'left_wall_dist_pool_size_l1': 8, 'left_wall_dist_out_channels_l2': 149, 'left_wall_dist_pool_size_l2': 8, 'track_width_num_layers': 2, 'track_width_activation': 'relu', 'track_width_out_channels_l0': 94, 'track_width_pool_size_l0': 2, 'track_width_out_channels_l1': 61, 'track_width_pool_size_l1': 4, 'track_width_fc_hidden': 128, 'heading_error_num_layers': 5, 'heading_error_activation': 'elu', 'heading_error_out_channels_l0': 137, 'heading_error_pool_size_l0': 2, 'heading_error_out_channels_l1': 116, 'heading_error_pool_size_l1': 2, 'heading_error_out_channels_l2': 105, 'heading_error_pool_size_l2': 4, 'heading_error_out_channels_l3': 185, 'heading_error_pool_size_l3': 4, 'heading_error_out_channels_l4': 182, 'heading_error_pool_size_l4': 4, 'heading_error_fc_hidden': 67}. Best is trial 70 with value: 0.1122.
[rank: 0] Seed set to 42
GPU available: True (cuda), used: True
TPU available: False, using: 0 TPU cores
💡 Tip: For seamless cloud logging and experiment tracking, try installing [litlogger](https://pypi.org/project/litlogger/) to enable LitLogger, which logs metrics and artifacts automatically to the Lightning Experiments platform.
[rank: 0] Seed set to 42
GPU available: True (cuda), used: True
TPU available: False, using: 0 TPU cores
💡 Tip: For seamless cloud logging and experiment tracking, try installing [litlogger](https://pypi.org/project/litlogger/) to enable LitLogger, which logs metrics and artifacts automatically to the Lightning Experiments platform.
[rank: 0] Seed set to 42
GPU available: True (cuda), used: True
TPU available: False, using: 0 TPU cores
💡 Tip: For seamless cloud logging and experiment tracking, try installing [litlogger](https://pypi.org/project/litlogger/) to enable LitLogger, which logs metrics and artifacts automatically to the Lightning Experiments platform.
LOCAL_RANK: 0 - CUDA_VISIBLE_DEVICES: [0]
LOCAL_RANK: 0 - CUDA_VISIBLE_DEVICES: [0]
SLURM auto-requeueing enabled. Setting signal handlers.
LOCAL_RANK: 0 - CUDA_VISIBLE_DEVICES: [0]
SLURM auto-requeueing enabled. Setting signal handlers.
SLURM auto-requeueing enabled. Setting signal handlers.
`Trainer.fit` stopped: `max_epochs=30` reached.
`Trainer.fit` stopped: `max_epochs=30` reached.
`Trainer.fit` stopped: `max_epochs=30` reached.
[I 2026-04-16 02:19:20,893] Trial 117 finished with value: 0.1287 and parameters: {'left_wall_dist_num_layers': 5, 'left_wall_dist_activation': 'relu', 'left_wall_dist_out_channels_l0': 146, 'left_wall_dist_pool_size_l0': 2, 'left_wall_dist_out_channels_l1': 95, 'left_wall_dist_pool_size_l1': 4, 'left_wall_dist_out_channels_l2': 142, 'left_wall_dist_pool_size_l2': 4, 'left_wall_dist_out_channels_l3': 144, 'left_wall_dist_pool_size_l3': 4, 'left_wall_dist_out_channels_l4': 38, 'left_wall_dist_pool_size_l4': 8, 'left_wall_dist_fc_hidden': 36, 'track_width_num_layers': 4, 'track_width_activation': 'elu', 'track_width_out_channels_l0': 138, 'track_width_pool_size_l0': 8, 'track_width_out_channels_l1': 46, 'track_width_pool_size_l1': 8, 'track_width_out_channels_l2': 96, 'track_width_pool_size_l2': 4, 'track_width_out_channels_l3': 42, 'track_width_pool_size_l3': 4, 'heading_error_num_layers': 2, 'heading_error_activation': 'elu', 'heading_error_out_channels_l0': 58, 'heading_error_pool_size_l0': 8, 'heading_error_out_channels_l1': 38, 'heading_error_pool_size_l1': 2, 'heading_error_fc_hidden': 57}. Best is trial 70 with value: 0.1122.
[rank: 0] Seed set to 42
[rank: 0] Seed set to 42
GPU available: True (cuda), used: True
TPU available: False, using: 0 TPU cores
💡 Tip: For seamless cloud logging and experiment tracking, try installing [litlogger](https://pypi.org/project/litlogger/) to enable LitLogger, which logs metrics and artifacts automatically to the Lightning Experiments platform.
GPU available: True (cuda), used: True
TPU available: False, using: 0 TPU cores
💡 Tip: For seamless cloud logging and experiment tracking, try installing [litlogger](https://pypi.org/project/litlogger/) to enable LitLogger, which logs metrics and artifacts automatically to the Lightning Experiments platform.
[rank: 0] Seed set to 42
GPU available: True (cuda), used: True
TPU available: False, using: 0 TPU cores
💡 Tip: For seamless cloud logging and experiment tracking, try installing [litlogger](https://pypi.org/project/litlogger/) to enable LitLogger, which logs metrics and artifacts automatically to the Lightning Experiments platform.
LOCAL_RANK: 0 - CUDA_VISIBLE_DEVICES: [0]
LOCAL_RANK: 0 - CUDA_VISIBLE_DEVICES: [0]
LOCAL_RANK: 0 - CUDA_VISIBLE_DEVICES: [0]
SLURM auto-requeueing enabled. Setting signal handlers.
SLURM auto-requeueing enabled. Setting signal handlers.
SLURM auto-requeueing enabled. Setting signal handlers.
`Trainer.fit` stopped: `max_epochs=30` reached.
`Trainer.fit` stopped: `max_epochs=30` reached.
`Trainer.fit` stopped: `max_epochs=30` reached.
[I 2026-04-16 02:22:28,943] Trial 118 finished with value: 0.1456 and parameters: {'left_wall_dist_num_layers': 5, 'left_wall_dist_activation': 'relu', 'left_wall_dist_out_channels_l0': 122, 'left_wall_dist_pool_size_l0': 8, 'left_wall_dist_out_channels_l1': 86, 'left_wall_dist_pool_size_l1': 2, 'left_wall_dist_out_channels_l2': 189, 'left_wall_dist_pool_size_l2': 2, 'left_wall_dist_out_channels_l3': 169, 'left_wall_dist_pool_size_l3': 8, 'left_wall_dist_out_channels_l4': 152, 'left_wall_dist_pool_size_l4': 8, 'left_wall_dist_fc_hidden': 34, 'track_width_num_layers': 4, 'track_width_activation': 'elu', 'track_width_out_channels_l0': 153, 'track_width_pool_size_l0': 2, 'track_width_out_channels_l1': 230, 'track_width_pool_size_l1': 4, 'track_width_out_channels_l2': 145, 'track_width_pool_size_l2': 4, 'track_width_out_channels_l3': 49, 'track_width_pool_size_l3': 2, 'track_width_fc_hidden': 42, 'heading_error_num_layers': 4, 'heading_error_activation': 'elu', 'heading_error_out_channels_l0': 55, 'heading_error_pool_size_l0': 2, 'heading_error_out_channels_l1': 101, 'heading_error_pool_size_l1': 8, 'heading_error_out_channels_l2': 132, 'heading_error_pool_size_l2': 2, 'heading_error_out_channels_l3': 116, 'heading_error_pool_size_l3': 2, 'heading_error_fc_hidden': 62}. Best is trial 70 with value: 0.1122.
[rank: 0] Seed set to 42
[rank: 0] Seed set to 42
GPU available: True (cuda), used: True
TPU available: False, using: 0 TPU cores
💡 Tip: For seamless cloud logging and experiment tracking, try installing [litlogger](https://pypi.org/project/litlogger/) to enable LitLogger, which logs metrics and artifacts automatically to the Lightning Experiments platform.
GPU available: True (cuda), used: True
TPU available: False, using: 0 TPU cores
💡 Tip: For seamless cloud logging and experiment tracking, try installing [litlogger](https://pypi.org/project/litlogger/) to enable LitLogger, which logs metrics and artifacts automatically to the Lightning Experiments platform.
[rank: 0] Seed set to 42
GPU available: True (cuda), used: True
TPU available: False, using: 0 TPU cores
💡 Tip: For seamless cloud logging and experiment tracking, try installing [litlogger](https://pypi.org/project/litlogger/) to enable LitLogger, which logs metrics and artifacts automatically to the Lightning Experiments platform.
LOCAL_RANK: 0 - CUDA_VISIBLE_DEVICES: [0]
LOCAL_RANK: 0 - CUDA_VISIBLE_DEVICES: [0]
LOCAL_RANK: 0 - CUDA_VISIBLE_DEVICES: [0]
SLURM auto-requeueing enabled. Setting signal handlers.
SLURM auto-requeueing enabled. Setting signal handlers.
SLURM auto-requeueing enabled. Setting signal handlers.
`Trainer.fit` stopped: `max_epochs=30` reached.
`Trainer.fit` stopped: `max_epochs=30` reached.
`Trainer.fit` stopped: `max_epochs=30` reached.
[I 2026-04-16 02:25:21,940] Trial 119 finished with value: 0.1413 and parameters: {'left_wall_dist_num_layers': 5, 'left_wall_dist_activation': 'relu', 'left_wall_dist_out_channels_l0': 134, 'left_wall_dist_pool_size_l0': 4, 'left_wall_dist_out_channels_l1': 99, 'left_wall_dist_pool_size_l1': 8, 'left_wall_dist_out_channels_l2': 241, 'left_wall_dist_pool_size_l2': 4, 'left_wall_dist_out_channels_l3': 59, 'left_wall_dist_pool_size_l3': 2, 'left_wall_dist_fc_hidden': 62, 'track_width_num_layers': 4, 'track_width_activation': 'elu', 'track_width_out_channels_l0': 181, 'track_width_pool_size_l0': 8, 'track_width_out_channels_l1': 51, 'track_width_pool_size_l1': 8, 'track_width_out_channels_l2': 152, 'track_width_pool_size_l2': 2, 'track_width_out_channels_l3': 56, 'track_width_pool_size_l3': 4, 'track_width_fc_hidden': 37, 'heading_error_num_layers': 5, 'heading_error_activation': 'elu', 'heading_error_out_channels_l0': 52, 'heading_error_pool_size_l0': 8, 'heading_error_out_channels_l1': 108, 'heading_error_pool_size_l1': 4, 'heading_error_out_channels_l2': 168, 'heading_error_pool_size_l2': 4, 'heading_error_out_channels_l3': 49, 'heading_error_pool_size_l3': 4, 'heading_error_fc_hidden': 40}. Best is trial 70 with value: 0.1122.
