[I 2026-05-08 17:55:22,413] Trial 13 finished with value: 0.1274 and parameters: {'optimizer': 'adam', 'left_wall_dist_num_layers': 2, 'left_wall_dist_activation': 'elu', 'left_wall_dist_fc_layers': 'fc64', 'left_wall_dist_pool_size_l0': 4, 'left_wall_dist_out_channels_l0': 4, 'left_wall_dist_pool_size_l1': 2, 'left_wall_dist_out_channels_l1': 24, 'track_width_num_layers': 1, 'track_width_activation': 'relu', 'track_width_fc_layers': 'fc64', 'track_width_pool_size_l0': 2, 'track_width_out_channels_l0': 16, 'heading_error_num_layers': 2, 'heading_error_activation': 'relu', 'heading_error_fc_layers': 'fc32', 'heading_error_pool_size_l0': 4, 'heading_error_out_channels_l0': 1, 'heading_error_pool_size_l1': 4, 'heading_error_out_channels_l1': 24}. Best is trial 6 with value: 0.0997.
[rank: 0] Seed set to 42
GPU available: True (cuda), used: True
TPU available: False, using: 0 TPU cores
💡 Tip: For seamless cloud logging and experiment tracking, try installing [litlogger](https://pypi.org/project/litlogger/) to enable LitLogger, which logs metrics and artifacts automatically to the Lightning Experiments platform.
[rank: 0] Seed set to 42
GPU available: True (cuda), used: True
TPU available: False, using: 0 TPU cores
💡 Tip: For seamless cloud logging and experiment tracking, try installing [litlogger](https://pypi.org/project/litlogger/) to enable LitLogger, which logs metrics and artifacts automatically to the Lightning Experiments platform.
[rank: 0] Seed set to 42
GPU available: True (cuda), used: True
TPU available: False, using: 0 TPU cores
💡 Tip: For seamless cloud logging and experiment tracking, try installing [litlogger](https://pypi.org/project/litlogger/) to enable LitLogger, which logs metrics and artifacts automatically to the Lightning Experiments platform.
LOCAL_RANK: 0 - CUDA_VISIBLE_DEVICES: [0]
LOCAL_RANK: 0 - CUDA_VISIBLE_DEVICES: [0]
LOCAL_RANK: 0 - CUDA_VISIBLE_DEVICES: [0]
SLURM auto-requeueing enabled. Setting signal handlers.
SLURM auto-requeueing enabled. Setting signal handlers.
SLURM auto-requeueing enabled. Setting signal handlers.
`Trainer.fit` stopped: `max_epochs=30` reached.
`Trainer.fit` stopped: `max_epochs=30` reached.
`Trainer.fit` stopped: `max_epochs=30` reached.
[I 2026-05-08 17:57:24,646] Trial 14 finished with value: 0.1156 and parameters: {'optimizer': 'adam', 'left_wall_dist_num_layers': 2, 'left_wall_dist_activation': 'elu', 'left_wall_dist_fc_layers': 'fc64', 'left_wall_dist_pool_size_l0': 4, 'left_wall_dist_out_channels_l0': 4, 'left_wall_dist_pool_size_l1': 3, 'left_wall_dist_out_channels_l1': 24, 'track_width_num_layers': 1, 'track_width_activation': 'relu', 'track_width_fc_layers': 'fc32', 'track_width_pool_size_l0': 2, 'track_width_out_channels_l0': 8, 'heading_error_num_layers': 1, 'heading_error_activation': 'relu', 'heading_error_fc_layers': 'fc64', 'heading_error_pool_size_l0': 4, 'heading_error_out_channels_l0': 4}. Best is trial 6 with value: 0.0997.
[rank: 0] Seed set to 42
[rank: 0] Seed set to 42
[rank: 0] Seed set to 42
GPU available: True (cuda), used: True
TPU available: False, using: 0 TPU cores
💡 Tip: For seamless cloud logging and experiment tracking, try installing [litlogger](https://pypi.org/project/litlogger/) to enable LitLogger, which logs metrics and artifacts automatically to the Lightning Experiments platform.
GPU available: True (cuda), used: True
TPU available: False, using: 0 TPU cores
💡 Tip: For seamless cloud logging and experiment tracking, try installing [litlogger](https://pypi.org/project/litlogger/) to enable LitLogger, which logs metrics and artifacts automatically to the Lightning Experiments platform.
GPU available: True (cuda), used: True
TPU available: False, using: 0 TPU cores
💡 Tip: For seamless cloud logging and experiment tracking, try installing [litlogger](https://pypi.org/project/litlogger/) to enable LitLogger, which logs metrics and artifacts automatically to the Lightning Experiments platform.
LOCAL_RANK: 0 - CUDA_VISIBLE_DEVICES: [0]
LOCAL_RANK: 0 - CUDA_VISIBLE_DEVICES: [0]
LOCAL_RANK: 0 - CUDA_VISIBLE_DEVICES: [0]
SLURM auto-requeueing enabled. Setting signal handlers.
SLURM auto-requeueing enabled. Setting signal handlers.
SLURM auto-requeueing enabled. Setting signal handlers.
`Trainer.fit` stopped: `max_epochs=30` reached.
`Trainer.fit` stopped: `max_epochs=30` reached.
`Trainer.fit` stopped: `max_epochs=30` reached.
[I 2026-05-08 17:59:41,962] Trial 15 finished with value: 0.1257 and parameters: {'optimizer': 'adam', 'left_wall_dist_num_layers': 2, 'left_wall_dist_activation': 'elu', 'left_wall_dist_fc_layers': 'fc64', 'left_wall_dist_pool_size_l0': 4, 'left_wall_dist_out_channels_l0': 1, 'left_wall_dist_pool_size_l1': 3, 'left_wall_dist_out_channels_l1': 8, 'track_width_num_layers': 1, 'track_width_activation': 'relu', 'track_width_fc_layers': 'fc64_32', 'track_width_pool_size_l0': 2, 'track_width_out_channels_l0': 4, 'heading_error_num_layers': 2, 'heading_error_activation': 'relu', 'heading_error_fc_layers': 'fc16', 'heading_error_pool_size_l0': 4, 'heading_error_out_channels_l0': 4, 'heading_error_pool_size_l1': 3, 'heading_error_out_channels_l1': 8}. Best is trial 6 with value: 0.0997.
[rank: 0] Seed set to 42
GPU available: True (cuda), used: True
TPU available: False, using: 0 TPU cores
💡 Tip: For seamless cloud logging and experiment tracking, try installing [litlogger](https://pypi.org/project/litlogger/) to enable LitLogger, which logs metrics and artifacts automatically to the Lightning Experiments platform.
[rank: 0] Seed set to 42
GPU available: True (cuda), used: True
TPU available: False, using: 0 TPU cores
💡 Tip: For seamless cloud logging and experiment tracking, try installing [litlogger](https://pypi.org/project/litlogger/) to enable LitLogger, which logs metrics and artifacts automatically to the Lightning Experiments platform.
[rank: 0] Seed set to 42
GPU available: True (cuda), used: True
TPU available: False, using: 0 TPU cores
💡 Tip: For seamless cloud logging and experiment tracking, try installing [litlogger](https://pypi.org/project/litlogger/) to enable LitLogger, which logs metrics and artifacts automatically to the Lightning Experiments platform.
LOCAL_RANK: 0 - CUDA_VISIBLE_DEVICES: [0]
LOCAL_RANK: 0 - CUDA_VISIBLE_DEVICES: [0]
SLURM auto-requeueing enabled. Setting signal handlers.
LOCAL_RANK: 0 - CUDA_VISIBLE_DEVICES: [0]
SLURM auto-requeueing enabled. Setting signal handlers.
SLURM auto-requeueing enabled. Setting signal handlers.
`Trainer.fit` stopped: `max_epochs=30` reached.
`Trainer.fit` stopped: `max_epochs=30` reached.
`Trainer.fit` stopped: `max_epochs=30` reached.
[I 2026-05-08 18:01:46,489] Trial 16 finished with value: 0.1768 and parameters: {'optimizer': 'adam', 'left_wall_dist_num_layers': 1, 'left_wall_dist_activation': 'elu', 'left_wall_dist_fc_layers': 'fc32', 'left_wall_dist_pool_size_l0': 4, 'left_wall_dist_out_channels_l0': 4, 'track_width_num_layers': 1, 'track_width_activation': 'relu', 'track_width_fc_layers': 'fc16', 'track_width_pool_size_l0': 2, 'track_width_out_channels_l0': 16, 'heading_error_num_layers': 1, 'heading_error_activation': 'relu', 'heading_error_fc_layers': 'fc32', 'heading_error_pool_size_l0': 4, 'heading_error_out_channels_l0': 1}. Best is trial 6 with value: 0.0997.
[I 2026-05-08 18:01:46,507] Trial 17 pruned. Conv channel counts must be non-decreasing.
[rank: 0] Seed set to 42
GPU available: True (cuda), used: True
TPU available: False, using: 0 TPU cores
💡 Tip: For seamless cloud logging and experiment tracking, try installing [litlogger](https://pypi.org/project/litlogger/) to enable LitLogger, which logs metrics and artifacts automatically to the Lightning Experiments platform.
[rank: 0] Seed set to 42
[rank: 0] Seed set to 42
GPU available: True (cuda), used: True
TPU available: False, using: 0 TPU cores
💡 Tip: For seamless cloud logging and experiment tracking, try installing [litlogger](https://pypi.org/project/litlogger/) to enable LitLogger, which logs metrics and artifacts automatically to the Lightning Experiments platform.
GPU available: True (cuda), used: True
TPU available: False, using: 0 TPU cores
💡 Tip: For seamless cloud logging and experiment tracking, try installing [litlogger](https://pypi.org/project/litlogger/) to enable LitLogger, which logs metrics and artifacts automatically to the Lightning Experiments platform.
LOCAL_RANK: 0 - CUDA_VISIBLE_DEVICES: [0]
LOCAL_RANK: 0 - CUDA_VISIBLE_DEVICES: [0]
LOCAL_RANK: 0 - CUDA_VISIBLE_DEVICES: [0]
SLURM auto-requeueing enabled. Setting signal handlers.
SLURM auto-requeueing enabled. Setting signal handlers.
SLURM auto-requeueing enabled. Setting signal handlers.
`Trainer.fit` stopped: `max_epochs=30` reached.
`Trainer.fit` stopped: `max_epochs=30` reached.
`Trainer.fit` stopped: `max_epochs=30` reached.
[I 2026-05-08 18:04:15,799] Trial 18 finished with value: 0.2372 and parameters: {'optimizer': 'adam', 'left_wall_dist_num_layers': 2, 'left_wall_dist_activation': 'relu', 'left_wall_dist_fc_layers': 'fc64', 'left_wall_dist_pool_size_l0': 4, 'left_wall_dist_out_channels_l0': 1, 'left_wall_dist_pool_size_l1': 2, 'left_wall_dist_out_channels_l1': 4, 'track_width_num_layers': 1, 'track_width_activation': 'relu', 'track_width_fc_layers': 'fc64', 'track_width_pool_size_l0': 2, 'track_width_out_channels_l0': 16, 'heading_error_num_layers': 2, 'heading_error_activation': 'relu', 'heading_error_fc_layers': 'fc64', 'heading_error_pool_size_l0': 3, 'heading_error_out_channels_l0': 4, 'heading_error_pool_size_l1': 4, 'heading_error_out_channels_l1': 32}. Best is trial 6 with value: 0.0997.
[rank: 0] Seed set to 42
GPU available: True (cuda), used: True
TPU available: False, using: 0 TPU cores
💡 Tip: For seamless cloud logging and experiment tracking, try installing [litlogger](https://pypi.org/project/litlogger/) to enable LitLogger, which logs metrics and artifacts automatically to the Lightning Experiments platform.
[rank: 0] Seed set to 42
GPU available: True (cuda), used: True
TPU available: False, using: 0 TPU cores
💡 Tip: For seamless cloud logging and experiment tracking, try installing [litlogger](https://pypi.org/project/litlogger/) to enable LitLogger, which logs metrics and artifacts automatically to the Lightning Experiments platform.
[rank: 0] Seed set to 42
GPU available: True (cuda), used: True
TPU available: False, using: 0 TPU cores
💡 Tip: For seamless cloud logging and experiment tracking, try installing [litlogger](https://pypi.org/project/litlogger/) to enable LitLogger, which logs metrics and artifacts automatically to the Lightning Experiments platform.
LOCAL_RANK: 0 - CUDA_VISIBLE_DEVICES: [0]
LOCAL_RANK: 0 - CUDA_VISIBLE_DEVICES: [0]
SLURM auto-requeueing enabled. Setting signal handlers.
SLURM auto-requeueing enabled. Setting signal handlers.
LOCAL_RANK: 0 - CUDA_VISIBLE_DEVICES: [0]
SLURM auto-requeueing enabled. Setting signal handlers.
`Trainer.fit` stopped: `max_epochs=30` reached.
`Trainer.fit` stopped: `max_epochs=30` reached.
`Trainer.fit` stopped: `max_epochs=30` reached.
[I 2026-05-08 18:06:37,016] Trial 19 finished with value: 0.1609 and parameters: {'optimizer': 'adam', 'left_wall_dist_num_layers': 1, 'left_wall_dist_activation': 'elu', 'left_wall_dist_fc_layers': 'fc64', 'left_wall_dist_pool_size_l0': 2, 'left_wall_dist_out_channels_l0': 4, 'track_width_num_layers': 1, 'track_width_activation': 'relu', 'track_width_fc_layers': 'fc128_64', 'track_width_pool_size_l0': 3, 'track_width_out_channels_l0': 8, 'heading_error_num_layers': 1, 'heading_error_activation': 'relu', 'heading_error_fc_layers': 'fc16', 'heading_error_pool_size_l0': 4, 'heading_error_out_channels_l0': 4}. Best is trial 6 with value: 0.0997.
[rank: 0] Seed set to 42
GPU available: True (cuda), used: True
TPU available: False, using: 0 TPU cores
💡 Tip: For seamless cloud logging and experiment tracking, try installing [litlogger](https://pypi.org/project/litlogger/) to enable LitLogger, which logs metrics and artifacts automatically to the Lightning Experiments platform.
[rank: 0] Seed set to 42
[rank: 0] Seed set to 42
GPU available: True (cuda), used: True
TPU available: False, using: 0 TPU cores
💡 Tip: For seamless cloud logging and experiment tracking, try installing [litlogger](https://pypi.org/project/litlogger/) to enable LitLogger, which logs metrics and artifacts automatically to the Lightning Experiments platform.
GPU available: True (cuda), used: True
TPU available: False, using: 0 TPU cores
💡 Tip: For seamless cloud logging and experiment tracking, try installing [litlogger](https://pypi.org/project/litlogger/) to enable LitLogger, which logs metrics and artifacts automatically to the Lightning Experiments platform.
LOCAL_RANK: 0 - CUDA_VISIBLE_DEVICES: [0]
LOCAL_RANK: 0 - CUDA_VISIBLE_DEVICES: [0]
LOCAL_RANK: 0 - CUDA_VISIBLE_DEVICES: [0]
SLURM auto-requeueing enabled. Setting signal handlers.
SLURM auto-requeueing enabled. Setting signal handlers.
SLURM auto-requeueing enabled. Setting signal handlers.
`Trainer.fit` stopped: `max_epochs=30` reached.
`Trainer.fit` stopped: `max_epochs=30` reached.
`Trainer.fit` stopped: `max_epochs=30` reached.
[I 2026-05-08 18:09:22,114] Trial 20 finished with value: 0.1283 and parameters: {'optimizer': 'adam', 'left_wall_dist_num_layers': 2, 'left_wall_dist_activation': 'elu', 'left_wall_dist_fc_layers': 'fc64', 'left_wall_dist_pool_size_l0': 4, 'left_wall_dist_out_channels_l0': 1, 'left_wall_dist_pool_size_l1': 3, 'left_wall_dist_out_channels_l1': 24, 'track_width_num_layers': 1, 'track_width_activation': 'relu', 'track_width_fc_layers': 'fc32', 'track_width_pool_size_l0': 2, 'track_width_out_channels_l0': 4, 'heading_error_num_layers': 2, 'heading_error_activation': 'relu', 'heading_error_fc_layers': 'fc64_32', 'heading_error_pool_size_l0': 4, 'heading_error_out_channels_l0': 1, 'heading_error_pool_size_l1': 2, 'heading_error_out_channels_l1': 4}. Best is trial 6 with value: 0.0997.
[rank: 0] Seed set to 42
[rank: 0] Seed set to 42
[rank: 0] Seed set to 42
GPU available: True (cuda), used: True
TPU available: False, using: 0 TPU cores
💡 Tip: For seamless cloud logging and experiment tracking, try installing [litlogger](https://pypi.org/project/litlogger/) to enable LitLogger, which logs metrics and artifacts automatically to the Lightning Experiments platform.
GPU available: True (cuda), used: True
TPU available: False, using: 0 TPU cores
💡 Tip: For seamless cloud logging and experiment tracking, try installing [litlogger](https://pypi.org/project/litlogger/) to enable LitLogger, which logs metrics and artifacts automatically to the Lightning Experiments platform.
GPU available: True (cuda), used: True
TPU available: False, using: 0 TPU cores
💡 Tip: For seamless cloud logging and experiment tracking, try installing [litlogger](https://pypi.org/project/litlogger/) to enable LitLogger, which logs metrics and artifacts automatically to the Lightning Experiments platform.
LOCAL_RANK: 0 - CUDA_VISIBLE_DEVICES: [0]
LOCAL_RANK: 0 - CUDA_VISIBLE_DEVICES: [0]
SLURM auto-requeueing enabled. Setting signal handlers.
LOCAL_RANK: 0 - CUDA_VISIBLE_DEVICES: [0]
SLURM auto-requeueing enabled. Setting signal handlers.
SLURM auto-requeueing enabled. Setting signal handlers.
`Trainer.fit` stopped: `max_epochs=30` reached.
`Trainer.fit` stopped: `max_epochs=30` reached.
`Trainer.fit` stopped: `max_epochs=30` reached.
[I 2026-05-08 18:12:25,207] Trial 21 finished with value: 0.1073 and parameters: {'optimizer': 'adam', 'left_wall_dist_num_layers': 2, 'left_wall_dist_activation': 'elu', 'left_wall_dist_fc_layers': 'fc64', 'left_wall_dist_pool_size_l0': 4, 'left_wall_dist_out_channels_l0': 4, 'left_wall_dist_pool_size_l1': 3, 'left_wall_dist_out_channels_l1': 24, 'track_width_num_layers': 1, 'track_width_activation': 'relu', 'track_width_fc_layers': 'fc64', 'track_width_pool_size_l0': 2, 'track_width_out_channels_l0': 16, 'heading_error_num_layers': 2, 'heading_error_activation': 'relu', 'heading_error_fc_layers': 'fc32', 'heading_error_pool_size_l0': 4, 'heading_error_out_channels_l0': 4, 'heading_error_pool_size_l1': 4, 'heading_error_out_channels_l1': 8}. Best is trial 6 with value: 0.0997.
[rank: 0] Seed set to 42
[rank: 0] Seed set to 42
[rank: 0] Seed set to 42
GPU available: True (cuda), used: True
TPU available: False, using: 0 TPU cores
💡 Tip: For seamless cloud logging and experiment tracking, try installing [litlogger](https://pypi.org/project/litlogger/) to enable LitLogger, which logs metrics and artifacts automatically to the Lightning Experiments platform.
GPU available: True (cuda), used: True
TPU available: False, using: 0 TPU cores
💡 Tip: For seamless cloud logging and experiment tracking, try installing [litlogger](https://pypi.org/project/litlogger/) to enable LitLogger, which logs metrics and artifacts automatically to the Lightning Experiments platform.
GPU available: True (cuda), used: True
TPU available: False, using: 0 TPU cores
💡 Tip: For seamless cloud logging and experiment tracking, try installing [litlogger](https://pypi.org/project/litlogger/) to enable LitLogger, which logs metrics and artifacts automatically to the Lightning Experiments platform.
LOCAL_RANK: 0 - CUDA_VISIBLE_DEVICES: [0]
LOCAL_RANK: 0 - CUDA_VISIBLE_DEVICES: [0]
SLURM auto-requeueing enabled. Setting signal handlers.
SLURM auto-requeueing enabled. Setting signal handlers.
LOCAL_RANK: 0 - CUDA_VISIBLE_DEVICES: [0]
SLURM auto-requeueing enabled. Setting signal handlers.
`Trainer.fit` stopped: `max_epochs=30` reached.
`Trainer.fit` stopped: `max_epochs=30` reached.
`Trainer.fit` stopped: `max_epochs=30` reached.
[I 2026-05-08 18:15:27,280] Trial 22 finished with value: 0.1077 and parameters: {'optimizer': 'adam', 'left_wall_dist_num_layers': 2, 'left_wall_dist_activation': 'elu', 'left_wall_dist_fc_layers': 'fc64', 'left_wall_dist_pool_size_l0': 4, 'left_wall_dist_out_channels_l0': 4, 'left_wall_dist_pool_size_l1': 3, 'left_wall_dist_out_channels_l1': 24, 'track_width_num_layers': 1, 'track_width_activation': 'relu', 'track_width_fc_layers': 'fc64', 'track_width_pool_size_l0': 2, 'track_width_out_channels_l0': 16, 'heading_error_num_layers': 2, 'heading_error_activation': 'relu', 'heading_error_fc_layers': 'fc32', 'heading_error_pool_size_l0': 4, 'heading_error_out_channels_l0': 4, 'heading_error_pool_size_l1': 4, 'heading_error_out_channels_l1': 8}. Best is trial 6 with value: 0.0997.
[rank: 0] Seed set to 42
GPU available: True (cuda), used: True
TPU available: False, using: 0 TPU cores
💡 Tip: For seamless cloud logging and experiment tracking, try installing [litlogger](https://pypi.org/project/litlogger/) to enable LitLogger, which logs metrics and artifacts automatically to the Lightning Experiments platform.
[rank: 0] Seed set to 42
GPU available: True (cuda), used: True
TPU available: False, using: 0 TPU cores
💡 Tip: For seamless cloud logging and experiment tracking, try installing [litlogger](https://pypi.org/project/litlogger/) to enable LitLogger, which logs metrics and artifacts automatically to the Lightning Experiments platform.
[rank: 0] Seed set to 42
GPU available: True (cuda), used: True
TPU available: False, using: 0 TPU cores
💡 Tip: For seamless cloud logging and experiment tracking, try installing [litlogger](https://pypi.org/project/litlogger/) to enable LitLogger, which logs metrics and artifacts automatically to the Lightning Experiments platform.
LOCAL_RANK: 0 - CUDA_VISIBLE_DEVICES: [0]
SLURM auto-requeueing enabled. Setting signal handlers.
LOCAL_RANK: 0 - CUDA_VISIBLE_DEVICES: [0]
LOCAL_RANK: 0 - CUDA_VISIBLE_DEVICES: [0]
SLURM auto-requeueing enabled. Setting signal handlers.
SLURM auto-requeueing enabled. Setting signal handlers.
`Trainer.fit` stopped: `max_epochs=30` reached.
`Trainer.fit` stopped: `max_epochs=30` reached.
`Trainer.fit` stopped: `max_epochs=30` reached.
