[I 2026-05-08 19:08:05,257] Trial 108 finished with value: 0.046 and parameters: {'optimizer': 'adamw', 'left_wall_dist_num_layers': 2, 'left_wall_dist_activation': 'relu', 'left_wall_dist_fc_layers': 'fc64_32', 'left_wall_dist_pool_size_l0': 3, 'left_wall_dist_out_channels_l0': 16, 'left_wall_dist_pool_size_l1': 2, 'left_wall_dist_out_channels_l1': 24, 'track_width_num_layers': 3, 'track_width_activation': 'relu', 'track_width_fc_layers': 'fc128_64', 'track_width_pool_size_l0': 3, 'track_width_out_channels_l0': 8, 'track_width_pool_size_l1': 2, 'track_width_out_channels_l1': 8, 'track_width_pool_size_l2': 2, 'track_width_out_channels_l2': 24, 'heading_error_num_layers': 3, 'heading_error_activation': 'elu', 'heading_error_fc_layers': 'fc128_64', 'heading_error_pool_size_l0': 4, 'heading_error_out_channels_l0': 1, 'heading_error_pool_size_l1': 4, 'heading_error_out_channels_l1': 4, 'heading_error_pool_size_l2': 2, 'heading_error_out_channels_l2': 16}. Best is trial 87 with value: 0.0247.
[rank: 0] Seed set to 42
[rank: 0] Seed set to 42
[rank: 0] Seed set to 42
GPU available: True (cuda), used: True
TPU available: False, using: 0 TPU cores
💡 Tip: For seamless cloud logging and experiment tracking, try installing [litlogger](https://pypi.org/project/litlogger/) to enable LitLogger, which logs metrics and artifacts automatically to the Lightning Experiments platform.
GPU available: True (cuda), used: True
TPU available: False, using: 0 TPU cores
💡 Tip: For seamless cloud logging and experiment tracking, try installing [litlogger](https://pypi.org/project/litlogger/) to enable LitLogger, which logs metrics and artifacts automatically to the Lightning Experiments platform.
GPU available: True (cuda), used: True
TPU available: False, using: 0 TPU cores
💡 Tip: For seamless cloud logging and experiment tracking, try installing [litlogger](https://pypi.org/project/litlogger/) to enable LitLogger, which logs metrics and artifacts automatically to the Lightning Experiments platform.
LOCAL_RANK: 0 - CUDA_VISIBLE_DEVICES: [0]
LOCAL_RANK: 0 - CUDA_VISIBLE_DEVICES: [0]
LOCAL_RANK: 0 - CUDA_VISIBLE_DEVICES: [0]
SLURM auto-requeueing enabled. Setting signal handlers.
SLURM auto-requeueing enabled. Setting signal handlers.
SLURM auto-requeueing enabled. Setting signal handlers.
`Trainer.fit` stopped: `max_epochs=30` reached.
`Trainer.fit` stopped: `max_epochs=30` reached.
`Trainer.fit` stopped: `max_epochs=30` reached.
[I 2026-05-08 19:11:08,513] Trial 109 finished with value: 0.0335 and parameters: {'optimizer': 'adam', 'left_wall_dist_num_layers': 2, 'left_wall_dist_activation': 'elu', 'left_wall_dist_fc_layers': 'fc64_32', 'left_wall_dist_pool_size_l0': 3, 'left_wall_dist_out_channels_l0': 16, 'left_wall_dist_pool_size_l1': 2, 'left_wall_dist_out_channels_l1': 24, 'track_width_num_layers': 3, 'track_width_activation': 'relu', 'track_width_fc_layers': 'fc32', 'track_width_pool_size_l0': 3, 'track_width_out_channels_l0': 8, 'track_width_pool_size_l1': 2, 'track_width_out_channels_l1': 8, 'track_width_pool_size_l2': 2, 'track_width_out_channels_l2': 8, 'heading_error_num_layers': 1, 'heading_error_activation': 'elu', 'heading_error_fc_layers': 'fc128', 'heading_error_pool_size_l0': 4, 'heading_error_out_channels_l0': 1}. Best is trial 87 with value: 0.0247.
[rank: 0] Seed set to 42
[rank: 0] Seed set to 42
[rank: 0] Seed set to 42
GPU available: True (cuda), used: True
TPU available: False, using: 0 TPU cores
💡 Tip: For seamless cloud logging and experiment tracking, try installing [litlogger](https://pypi.org/project/litlogger/) to enable LitLogger, which logs metrics and artifacts automatically to the Lightning Experiments platform.
GPU available: True (cuda), used: True
TPU available: False, using: 0 TPU cores
💡 Tip: For seamless cloud logging and experiment tracking, try installing [litlogger](https://pypi.org/project/litlogger/) to enable LitLogger, which logs metrics and artifacts automatically to the Lightning Experiments platform.
GPU available: True (cuda), used: True
TPU available: False, using: 0 TPU cores
💡 Tip: For seamless cloud logging and experiment tracking, try installing [litlogger](https://pypi.org/project/litlogger/) to enable LitLogger, which logs metrics and artifacts automatically to the Lightning Experiments platform.
LOCAL_RANK: 0 - CUDA_VISIBLE_DEVICES: [0]
LOCAL_RANK: 0 - CUDA_VISIBLE_DEVICES: [0]
SLURM auto-requeueing enabled. Setting signal handlers.
SLURM auto-requeueing enabled. Setting signal handlers.
LOCAL_RANK: 0 - CUDA_VISIBLE_DEVICES: [0]
SLURM auto-requeueing enabled. Setting signal handlers.
`Trainer.fit` stopped: `max_epochs=30` reached.
`Trainer.fit` stopped: `max_epochs=30` reached.
`Trainer.fit` stopped: `max_epochs=30` reached.
[I 2026-05-08 19:14:08,841] Trial 110 finished with value: 0.0322 and parameters: {'optimizer': 'adamw', 'left_wall_dist_num_layers': 2, 'left_wall_dist_activation': 'relu', 'left_wall_dist_fc_layers': 'fc64_32', 'left_wall_dist_pool_size_l0': 3, 'left_wall_dist_out_channels_l0': 16, 'left_wall_dist_pool_size_l1': 2, 'left_wall_dist_out_channels_l1': 24, 'track_width_num_layers': 3, 'track_width_activation': 'relu', 'track_width_fc_layers': 'fc128', 'track_width_pool_size_l0': 3, 'track_width_out_channels_l0': 8, 'track_width_pool_size_l1': 2, 'track_width_out_channels_l1': 8, 'track_width_pool_size_l2': 2, 'track_width_out_channels_l2': 24, 'heading_error_num_layers': 1, 'heading_error_activation': 'elu', 'heading_error_fc_layers': 'fc64_32', 'heading_error_pool_size_l0': 4, 'heading_error_out_channels_l0': 1}. Best is trial 87 with value: 0.0247.
[rank: 0] Seed set to 42
[rank: 0] Seed set to 42
[rank: 0] Seed set to 42
GPU available: True (cuda), used: True
GPU available: True (cuda), used: True
TPU available: False, using: 0 TPU cores
TPU available: False, using: 0 TPU cores
💡 Tip: For seamless cloud logging and experiment tracking, try installing [litlogger](https://pypi.org/project/litlogger/) to enable LitLogger, which logs metrics and artifacts automatically to the Lightning Experiments platform.
💡 Tip: For seamless cloud logging and experiment tracking, try installing [litlogger](https://pypi.org/project/litlogger/) to enable LitLogger, which logs metrics and artifacts automatically to the Lightning Experiments platform.
GPU available: True (cuda), used: True
TPU available: False, using: 0 TPU cores
💡 Tip: For seamless cloud logging and experiment tracking, try installing [litlogger](https://pypi.org/project/litlogger/) to enable LitLogger, which logs metrics and artifacts automatically to the Lightning Experiments platform.
LOCAL_RANK: 0 - CUDA_VISIBLE_DEVICES: [0]
LOCAL_RANK: 0 - CUDA_VISIBLE_DEVICES: [0]
LOCAL_RANK: 0 - CUDA_VISIBLE_DEVICES: [0]
SLURM auto-requeueing enabled. Setting signal handlers.
SLURM auto-requeueing enabled. Setting signal handlers.
SLURM auto-requeueing enabled. Setting signal handlers.
`Trainer.fit` stopped: `max_epochs=30` reached.
`Trainer.fit` stopped: `max_epochs=30` reached.
`Trainer.fit` stopped: `max_epochs=30` reached.
[I 2026-05-08 19:17:04,634] Trial 111 finished with value: 0.0289 and parameters: {'optimizer': 'adamw', 'left_wall_dist_num_layers': 2, 'left_wall_dist_activation': 'relu', 'left_wall_dist_fc_layers': 'fc64_32', 'left_wall_dist_pool_size_l0': 3, 'left_wall_dist_out_channels_l0': 16, 'left_wall_dist_pool_size_l1': 2, 'left_wall_dist_out_channels_l1': 24, 'track_width_num_layers': 3, 'track_width_activation': 'relu', 'track_width_fc_layers': 'fc64_32', 'track_width_pool_size_l0': 3, 'track_width_out_channels_l0': 8, 'track_width_pool_size_l1': 2, 'track_width_out_channels_l1': 8, 'track_width_pool_size_l2': 2, 'track_width_out_channels_l2': 24, 'heading_error_num_layers': 1, 'heading_error_activation': 'elu', 'heading_error_fc_layers': 'fc64_32', 'heading_error_pool_size_l0': 4, 'heading_error_out_channels_l0': 1}. Best is trial 87 with value: 0.0247.
[rank: 0] Seed set to 42
[rank: 0] Seed set to 42
[rank: 0] Seed set to 42
GPU available: True (cuda), used: True
TPU available: False, using: 0 TPU cores
💡 Tip: For seamless cloud logging and experiment tracking, try installing [litlogger](https://pypi.org/project/litlogger/) to enable LitLogger, which logs metrics and artifacts automatically to the Lightning Experiments platform.
GPU available: True (cuda), used: True
TPU available: False, using: 0 TPU cores
💡 Tip: For seamless cloud logging and experiment tracking, try installing [litlogger](https://pypi.org/project/litlogger/) to enable LitLogger, which logs metrics and artifacts automatically to the Lightning Experiments platform.
GPU available: True (cuda), used: True
TPU available: False, using: 0 TPU cores
💡 Tip: For seamless cloud logging and experiment tracking, try installing [litlogger](https://pypi.org/project/litlogger/) to enable LitLogger, which logs metrics and artifacts automatically to the Lightning Experiments platform.
LOCAL_RANK: 0 - CUDA_VISIBLE_DEVICES: [0]
LOCAL_RANK: 0 - CUDA_VISIBLE_DEVICES: [0]
LOCAL_RANK: 0 - CUDA_VISIBLE_DEVICES: [0]
SLURM auto-requeueing enabled. Setting signal handlers.
SLURM auto-requeueing enabled. Setting signal handlers.
SLURM auto-requeueing enabled. Setting signal handlers.
`Trainer.fit` stopped: `max_epochs=30` reached.
`Trainer.fit` stopped: `max_epochs=30` reached.
`Trainer.fit` stopped: `max_epochs=30` reached.
[I 2026-05-08 19:20:10,629] Trial 112 finished with value: 0.0301 and parameters: {'optimizer': 'adamw', 'left_wall_dist_num_layers': 2, 'left_wall_dist_activation': 'relu', 'left_wall_dist_fc_layers': 'fc64_32', 'left_wall_dist_pool_size_l0': 3, 'left_wall_dist_out_channels_l0': 16, 'left_wall_dist_pool_size_l1': 2, 'left_wall_dist_out_channels_l1': 24, 'track_width_num_layers': 3, 'track_width_activation': 'relu', 'track_width_fc_layers': 'fc64_32', 'track_width_pool_size_l0': 3, 'track_width_out_channels_l0': 8, 'track_width_pool_size_l1': 2, 'track_width_out_channels_l1': 8, 'track_width_pool_size_l2': 2, 'track_width_out_channels_l2': 24, 'heading_error_num_layers': 1, 'heading_error_activation': 'elu', 'heading_error_fc_layers': 'fc64_32', 'heading_error_pool_size_l0': 4, 'heading_error_out_channels_l0': 1}. Best is trial 87 with value: 0.0247.
[rank: 0] Seed set to 42
[rank: 0] Seed set to 42
[rank: 0] Seed set to 42
GPU available: True (cuda), used: True
TPU available: False, using: 0 TPU cores
💡 Tip: For seamless cloud logging and experiment tracking, try installing [litlogger](https://pypi.org/project/litlogger/) to enable LitLogger, which logs metrics and artifacts automatically to the Lightning Experiments platform.
GPU available: True (cuda), used: True
TPU available: False, using: 0 TPU cores
💡 Tip: For seamless cloud logging and experiment tracking, try installing [litlogger](https://pypi.org/project/litlogger/) to enable LitLogger, which logs metrics and artifacts automatically to the Lightning Experiments platform.
GPU available: True (cuda), used: True
TPU available: False, using: 0 TPU cores
💡 Tip: For seamless cloud logging and experiment tracking, try installing [litlogger](https://pypi.org/project/litlogger/) to enable LitLogger, which logs metrics and artifacts automatically to the Lightning Experiments platform.
LOCAL_RANK: 0 - CUDA_VISIBLE_DEVICES: [0]
SLURM auto-requeueing enabled. Setting signal handlers.
LOCAL_RANK: 0 - CUDA_VISIBLE_DEVICES: [0]
LOCAL_RANK: 0 - CUDA_VISIBLE_DEVICES: [0]
SLURM auto-requeueing enabled. Setting signal handlers.
SLURM auto-requeueing enabled. Setting signal handlers.
`Trainer.fit` stopped: `max_epochs=30` reached.
`Trainer.fit` stopped: `max_epochs=30` reached.
`Trainer.fit` stopped: `max_epochs=30` reached.
[I 2026-05-08 19:23:13,672] Trial 113 finished with value: 0.0314 and parameters: {'optimizer': 'adamw', 'left_wall_dist_num_layers': 2, 'left_wall_dist_activation': 'relu', 'left_wall_dist_fc_layers': 'fc64_32', 'left_wall_dist_pool_size_l0': 3, 'left_wall_dist_out_channels_l0': 16, 'left_wall_dist_pool_size_l1': 2, 'left_wall_dist_out_channels_l1': 24, 'track_width_num_layers': 3, 'track_width_activation': 'relu', 'track_width_fc_layers': 'fc64_32', 'track_width_pool_size_l0': 3, 'track_width_out_channels_l0': 8, 'track_width_pool_size_l1': 2, 'track_width_out_channels_l1': 8, 'track_width_pool_size_l2': 4, 'track_width_out_channels_l2': 24, 'heading_error_num_layers': 1, 'heading_error_activation': 'elu', 'heading_error_fc_layers': 'fc64_32', 'heading_error_pool_size_l0': 4, 'heading_error_out_channels_l0': 1}. Best is trial 87 with value: 0.0247.
[I 2026-05-08 19:23:13,692] Trial 114 pruned. Conv channel counts must be non-decreasing.
[rank: 0] Seed set to 42
[rank: 0] Seed set to 42
[rank: 0] Seed set to 42
GPU available: True (cuda), used: True
TPU available: False, using: 0 TPU cores
💡 Tip: For seamless cloud logging and experiment tracking, try installing [litlogger](https://pypi.org/project/litlogger/) to enable LitLogger, which logs metrics and artifacts automatically to the Lightning Experiments platform.
GPU available: True (cuda), used: True
TPU available: False, using: 0 TPU cores
💡 Tip: For seamless cloud logging and experiment tracking, try installing [litlogger](https://pypi.org/project/litlogger/) to enable LitLogger, which logs metrics and artifacts automatically to the Lightning Experiments platform.
GPU available: True (cuda), used: True
TPU available: False, using: 0 TPU cores
💡 Tip: For seamless cloud logging and experiment tracking, try installing [litlogger](https://pypi.org/project/litlogger/) to enable LitLogger, which logs metrics and artifacts automatically to the Lightning Experiments platform.
LOCAL_RANK: 0 - CUDA_VISIBLE_DEVICES: [0]
LOCAL_RANK: 0 - CUDA_VISIBLE_DEVICES: [0]
LOCAL_RANK: 0 - CUDA_VISIBLE_DEVICES: [0]
SLURM auto-requeueing enabled. Setting signal handlers.
SLURM auto-requeueing enabled. Setting signal handlers.
SLURM auto-requeueing enabled. Setting signal handlers.
`Trainer.fit` stopped: `max_epochs=30` reached.
`Trainer.fit` stopped: `max_epochs=30` reached.
`Trainer.fit` stopped: `max_epochs=30` reached.
[I 2026-05-08 19:26:15,071] Trial 115 finished with value: 0.0348 and parameters: {'optimizer': 'adamw', 'left_wall_dist_num_layers': 2, 'left_wall_dist_activation': 'relu', 'left_wall_dist_fc_layers': 'fc64_32', 'left_wall_dist_pool_size_l0': 3, 'left_wall_dist_out_channels_l0': 16, 'left_wall_dist_pool_size_l1': 2, 'left_wall_dist_out_channels_l1': 24, 'track_width_num_layers': 3, 'track_width_activation': 'relu', 'track_width_fc_layers': 'fc64_32', 'track_width_pool_size_l0': 3, 'track_width_out_channels_l0': 8, 'track_width_pool_size_l1': 2, 'track_width_out_channels_l1': 8, 'track_width_pool_size_l2': 2, 'track_width_out_channels_l2': 24, 'heading_error_num_layers': 1, 'heading_error_activation': 'elu', 'heading_error_fc_layers': 'fc32', 'heading_error_pool_size_l0': 4, 'heading_error_out_channels_l0': 1}. Best is trial 87 with value: 0.0247.
[rank: 0] Seed set to 42
[rank: 0] Seed set to 42
[rank: 0] Seed set to 42
GPU available: True (cuda), used: True
TPU available: False, using: 0 TPU cores
💡 Tip: For seamless cloud logging and experiment tracking, try installing [litlogger](https://pypi.org/project/litlogger/) to enable LitLogger, which logs metrics and artifacts automatically to the Lightning Experiments platform.
GPU available: True (cuda), used: True
TPU available: False, using: 0 TPU cores
💡 Tip: For seamless cloud logging and experiment tracking, try installing [litlogger](https://pypi.org/project/litlogger/) to enable LitLogger, which logs metrics and artifacts automatically to the Lightning Experiments platform.
GPU available: True (cuda), used: True
TPU available: False, using: 0 TPU cores
💡 Tip: For seamless cloud logging and experiment tracking, try installing [litlogger](https://pypi.org/project/litlogger/) to enable LitLogger, which logs metrics and artifacts automatically to the Lightning Experiments platform.
LOCAL_RANK: 0 - CUDA_VISIBLE_DEVICES: [0]
LOCAL_RANK: 0 - CUDA_VISIBLE_DEVICES: [0]
LOCAL_RANK: 0 - CUDA_VISIBLE_DEVICES: [0]
SLURM auto-requeueing enabled. Setting signal handlers.
SLURM auto-requeueing enabled. Setting signal handlers.
SLURM auto-requeueing enabled. Setting signal handlers.
`Trainer.fit` stopped: `max_epochs=30` reached.
`Trainer.fit` stopped: `max_epochs=30` reached.
`Trainer.fit` stopped: `max_epochs=30` reached.
[I 2026-05-08 19:29:07,123] Trial 116 finished with value: 0.0897 and parameters: {'optimizer': 'adamw', 'left_wall_dist_num_layers': 2, 'left_wall_dist_activation': 'relu', 'left_wall_dist_fc_layers': 'fc64_32', 'left_wall_dist_pool_size_l0': 3, 'left_wall_dist_out_channels_l0': 16, 'left_wall_dist_pool_size_l1': 2, 'left_wall_dist_out_channels_l1': 32, 'track_width_num_layers': 3, 'track_width_activation': 'relu', 'track_width_fc_layers': 'fc64_32', 'track_width_pool_size_l0': 3, 'track_width_out_channels_l0': 8, 'track_width_pool_size_l1': 2, 'track_width_out_channels_l1': 8, 'track_width_pool_size_l2': 2, 'track_width_out_channels_l2': 24, 'heading_error_num_layers': 1, 'heading_error_activation': 'elu', 'heading_error_fc_layers': 'fc64_32', 'heading_error_pool_size_l0': 4, 'heading_error_out_channels_l0': 16}. Best is trial 87 with value: 0.0247.
[rank: 0] Seed set to 42
GPU available: True (cuda), used: True
TPU available: False, using: 0 TPU cores
💡 Tip: For seamless cloud logging and experiment tracking, try installing [litlogger](https://pypi.org/project/litlogger/) to enable LitLogger, which logs metrics and artifacts automatically to the Lightning Experiments platform.
[rank: 0] Seed set to 42
GPU available: True (cuda), used: True
TPU available: False, using: 0 TPU cores
💡 Tip: For seamless cloud logging and experiment tracking, try installing [litlogger](https://pypi.org/project/litlogger/) to enable LitLogger, which logs metrics and artifacts automatically to the Lightning Experiments platform.
[rank: 0] Seed set to 42
GPU available: True (cuda), used: True
TPU available: False, using: 0 TPU cores
💡 Tip: For seamless cloud logging and experiment tracking, try installing [litlogger](https://pypi.org/project/litlogger/) to enable LitLogger, which logs metrics and artifacts automatically to the Lightning Experiments platform.
LOCAL_RANK: 0 - CUDA_VISIBLE_DEVICES: [0]
LOCAL_RANK: 0 - CUDA_VISIBLE_DEVICES: [0]
LOCAL_RANK: 0 - CUDA_VISIBLE_DEVICES: [0]
SLURM auto-requeueing enabled. Setting signal handlers.
SLURM auto-requeueing enabled. Setting signal handlers.
SLURM auto-requeueing enabled. Setting signal handlers.
`Trainer.fit` stopped: `max_epochs=30` reached.
`Trainer.fit` stopped: `max_epochs=30` reached.
`Trainer.fit` stopped: `max_epochs=30` reached.
[I 2026-05-08 19:31:19,051] Trial 117 finished with value: 0.0329 and parameters: {'optimizer': 'adamw', 'left_wall_dist_num_layers': 2, 'left_wall_dist_activation': 'relu', 'left_wall_dist_fc_layers': 'fc64_32', 'left_wall_dist_pool_size_l0': 3, 'left_wall_dist_out_channels_l0': 16, 'left_wall_dist_pool_size_l1': 2, 'left_wall_dist_out_channels_l1': 24, 'track_width_num_layers': 3, 'track_width_activation': 'relu', 'track_width_fc_layers': 'fc64_32', 'track_width_pool_size_l0': 3, 'track_width_out_channels_l0': 8, 'track_width_pool_size_l1': 2, 'track_width_out_channels_l1': 16, 'track_width_pool_size_l2': 4, 'track_width_out_channels_l2': 24, 'heading_error_num_layers': 1, 'heading_error_activation': 'elu', 'heading_error_fc_layers': 'fc64_32', 'heading_error_pool_size_l0': 4, 'heading_error_out_channels_l0': 1}. Best is trial 87 with value: 0.0247.
[rank: 0] Seed set to 42
[rank: 0] Seed set to 42
GPU available: True (cuda), used: True
TPU available: False, using: 0 TPU cores
💡 Tip: For seamless cloud logging and experiment tracking, try installing [litlogger](https://pypi.org/project/litlogger/) to enable LitLogger, which logs metrics and artifacts automatically to the Lightning Experiments platform.
GPU available: True (cuda), used: True
TPU available: False, using: 0 TPU cores
💡 Tip: For seamless cloud logging and experiment tracking, try installing [litlogger](https://pypi.org/project/litlogger/) to enable LitLogger, which logs metrics and artifacts automatically to the Lightning Experiments platform.
[rank: 0] Seed set to 42
GPU available: True (cuda), used: True
TPU available: False, using: 0 TPU cores
💡 Tip: For seamless cloud logging and experiment tracking, try installing [litlogger](https://pypi.org/project/litlogger/) to enable LitLogger, which logs metrics and artifacts automatically to the Lightning Experiments platform.
LOCAL_RANK: 0 - CUDA_VISIBLE_DEVICES: [0]
LOCAL_RANK: 0 - CUDA_VISIBLE_DEVICES: [0]
LOCAL_RANK: 0 - CUDA_VISIBLE_DEVICES: [0]
SLURM auto-requeueing enabled. Setting signal handlers.
SLURM auto-requeueing enabled. Setting signal handlers.
SLURM auto-requeueing enabled. Setting signal handlers.
`Trainer.fit` stopped: `max_epochs=30` reached.
`Trainer.fit` stopped: `max_epochs=30` reached.
`Trainer.fit` stopped: `max_epochs=30` reached.
