[I 2026-04-15 23:50:54,738] Trial 64 finished with value: 0.1196 and parameters: {'left_wall_dist_num_layers': 5, 'left_wall_dist_activation': 'relu', 'left_wall_dist_out_channels_l0': 100, 'left_wall_dist_pool_size_l0': 8, 'left_wall_dist_out_channels_l1': 103, 'left_wall_dist_pool_size_l1': 2, 'left_wall_dist_out_channels_l2': 171, 'left_wall_dist_pool_size_l2': 4, 'left_wall_dist_out_channels_l3': 160, 'left_wall_dist_pool_size_l3': 8, 'left_wall_dist_fc_hidden': 35, 'track_width_num_layers': 4, 'track_width_activation': 'elu', 'track_width_out_channels_l0': 142, 'track_width_pool_size_l0': 8, 'track_width_out_channels_l1': 134, 'track_width_pool_size_l1': 4, 'track_width_out_channels_l2': 106, 'track_width_pool_size_l2': 4, 'track_width_out_channels_l3': 45, 'track_width_pool_size_l3': 4, 'heading_error_num_layers': 5, 'heading_error_activation': 'elu', 'heading_error_out_channels_l0': 67, 'heading_error_pool_size_l0': 8, 'heading_error_out_channels_l1': 122, 'heading_error_pool_size_l1': 4, 'heading_error_out_channels_l2': 236, 'heading_error_pool_size_l2': 2, 'heading_error_out_channels_l3': 169, 'heading_error_pool_size_l3': 4, 'heading_error_out_channels_l4': 81, 'heading_error_pool_size_l4': 4, 'heading_error_fc_hidden': 37}. Best is trial 60 with value: 0.1165.
[rank: 0] Seed set to 42
GPU available: True (cuda), used: True
TPU available: False, using: 0 TPU cores
💡 Tip: For seamless cloud logging and experiment tracking, try installing [litlogger](https://pypi.org/project/litlogger/) to enable LitLogger, which logs metrics and artifacts automatically to the Lightning Experiments platform.
[rank: 0] Seed set to 42
GPU available: True (cuda), used: True
TPU available: False, using: 0 TPU cores
[rank: 0] Seed set to 42
💡 Tip: For seamless cloud logging and experiment tracking, try installing [litlogger](https://pypi.org/project/litlogger/) to enable LitLogger, which logs metrics and artifacts automatically to the Lightning Experiments platform.
GPU available: True (cuda), used: True
TPU available: False, using: 0 TPU cores
💡 Tip: For seamless cloud logging and experiment tracking, try installing [litlogger](https://pypi.org/project/litlogger/) to enable LitLogger, which logs metrics and artifacts automatically to the Lightning Experiments platform.
LOCAL_RANK: 0 - CUDA_VISIBLE_DEVICES: [0]
LOCAL_RANK: 0 - CUDA_VISIBLE_DEVICES: [0]
LOCAL_RANK: 0 - CUDA_VISIBLE_DEVICES: [0]
SLURM auto-requeueing enabled. Setting signal handlers.
SLURM auto-requeueing enabled. Setting signal handlers.
SLURM auto-requeueing enabled. Setting signal handlers.
`Trainer.fit` stopped: `max_epochs=30` reached.
`Trainer.fit` stopped: `max_epochs=30` reached.
`Trainer.fit` stopped: `max_epochs=30` reached.
[I 2026-04-15 23:53:44,664] Trial 65 finished with value: 0.1748 and parameters: {'left_wall_dist_num_layers': 5, 'left_wall_dist_activation': 'relu', 'left_wall_dist_out_channels_l0': 102, 'left_wall_dist_pool_size_l0': 8, 'left_wall_dist_out_channels_l1': 103, 'left_wall_dist_pool_size_l1': 2, 'left_wall_dist_out_channels_l2': 174, 'left_wall_dist_pool_size_l2': 4, 'left_wall_dist_out_channels_l3': 157, 'left_wall_dist_pool_size_l3': 8, 'left_wall_dist_fc_hidden': 35, 'track_width_num_layers': 5, 'track_width_activation': 'elu', 'track_width_out_channels_l0': 106, 'track_width_pool_size_l0': 8, 'track_width_out_channels_l1': 125, 'track_width_pool_size_l1': 8, 'track_width_out_channels_l2': 83, 'track_width_pool_size_l2': 4, 'track_width_out_channels_l3': 81, 'track_width_pool_size_l3': 8, 'heading_error_num_layers': 5, 'heading_error_activation': 'relu', 'heading_error_out_channels_l0': 70, 'heading_error_pool_size_l0': 8, 'heading_error_out_channels_l1': 80, 'heading_error_pool_size_l1': 8, 'heading_error_out_channels_l2': 254, 'heading_error_pool_size_l2': 2, 'heading_error_out_channels_l3': 164, 'heading_error_pool_size_l3': 4, 'heading_error_fc_hidden': 44}. Best is trial 60 with value: 0.1165.
[rank: 0] Seed set to 42
GPU available: True (cuda), used: True
TPU available: False, using: 0 TPU cores
💡 Tip: For seamless cloud logging and experiment tracking, try installing [litlogger](https://pypi.org/project/litlogger/) to enable LitLogger, which logs metrics and artifacts automatically to the Lightning Experiments platform.
[rank: 0] Seed set to 42
[rank: 0] Seed set to 42
GPU available: True (cuda), used: True
TPU available: False, using: 0 TPU cores
💡 Tip: For seamless cloud logging and experiment tracking, try installing [litlogger](https://pypi.org/project/litlogger/) to enable LitLogger, which logs metrics and artifacts automatically to the Lightning Experiments platform.
GPU available: True (cuda), used: True
TPU available: False, using: 0 TPU cores
💡 Tip: For seamless cloud logging and experiment tracking, try installing [litlogger](https://pypi.org/project/litlogger/) to enable LitLogger, which logs metrics and artifacts automatically to the Lightning Experiments platform.
LOCAL_RANK: 0 - CUDA_VISIBLE_DEVICES: [0]
LOCAL_RANK: 0 - CUDA_VISIBLE_DEVICES: [0]
LOCAL_RANK: 0 - CUDA_VISIBLE_DEVICES: [0]
SLURM auto-requeueing enabled. Setting signal handlers.
SLURM auto-requeueing enabled. Setting signal handlers.
SLURM auto-requeueing enabled. Setting signal handlers.
`Trainer.fit` stopped: `max_epochs=30` reached.
`Trainer.fit` stopped: `max_epochs=30` reached.
`Trainer.fit` stopped: `max_epochs=30` reached.
[I 2026-04-15 23:56:36,185] Trial 66 finished with value: 0.147 and parameters: {'left_wall_dist_num_layers': 5, 'left_wall_dist_activation': 'relu', 'left_wall_dist_out_channels_l0': 186, 'left_wall_dist_pool_size_l0': 8, 'left_wall_dist_out_channels_l1': 131, 'left_wall_dist_pool_size_l1': 2, 'left_wall_dist_out_channels_l2': 193, 'left_wall_dist_pool_size_l2': 4, 'left_wall_dist_out_channels_l3': 127, 'left_wall_dist_pool_size_l3': 8, 'left_wall_dist_fc_hidden': 34, 'track_width_num_layers': 3, 'track_width_activation': 'elu', 'track_width_out_channels_l0': 161, 'track_width_pool_size_l0': 8, 'track_width_out_channels_l1': 216, 'track_width_pool_size_l1': 4, 'track_width_out_channels_l2': 97, 'track_width_pool_size_l2': 4, 'track_width_fc_hidden': 71, 'heading_error_num_layers': 5, 'heading_error_activation': 'elu', 'heading_error_out_channels_l0': 61, 'heading_error_pool_size_l0': 4, 'heading_error_out_channels_l1': 120, 'heading_error_pool_size_l1': 4, 'heading_error_out_channels_l2': 190, 'heading_error_pool_size_l2': 2, 'heading_error_out_channels_l3': 121, 'heading_error_pool_size_l3': 4, 'heading_error_out_channels_l4': 87, 'heading_error_pool_size_l4': 4}. Best is trial 60 with value: 0.1165.
[rank: 0] Seed set to 42
[rank: 0] Seed set to 42
GPU available: True (cuda), used: True
TPU available: False, using: 0 TPU cores
💡 Tip: For seamless cloud logging and experiment tracking, try installing [litlogger](https://pypi.org/project/litlogger/) to enable LitLogger, which logs metrics and artifacts automatically to the Lightning Experiments platform.
GPU available: True (cuda), used: True
TPU available: False, using: 0 TPU cores
💡 Tip: For seamless cloud logging and experiment tracking, try installing [litlogger](https://pypi.org/project/litlogger/) to enable LitLogger, which logs metrics and artifacts automatically to the Lightning Experiments platform.
[rank: 0] Seed set to 42
GPU available: True (cuda), used: True
TPU available: False, using: 0 TPU cores
💡 Tip: For seamless cloud logging and experiment tracking, try installing [litlogger](https://pypi.org/project/litlogger/) to enable LitLogger, which logs metrics and artifacts automatically to the Lightning Experiments platform.
LOCAL_RANK: 0 - CUDA_VISIBLE_DEVICES: [0]
LOCAL_RANK: 0 - CUDA_VISIBLE_DEVICES: [0]
LOCAL_RANK: 0 - CUDA_VISIBLE_DEVICES: [0]
SLURM auto-requeueing enabled. Setting signal handlers.
SLURM auto-requeueing enabled. Setting signal handlers.
SLURM auto-requeueing enabled. Setting signal handlers.
`Trainer.fit` stopped: `max_epochs=30` reached.
`Trainer.fit` stopped: `max_epochs=30` reached.
`Trainer.fit` stopped: `max_epochs=30` reached.
[I 2026-04-15 23:59:50,623] Trial 67 finished with value: 0.1211 and parameters: {'left_wall_dist_num_layers': 5, 'left_wall_dist_activation': 'relu', 'left_wall_dist_out_channels_l0': 112, 'left_wall_dist_pool_size_l0': 8, 'left_wall_dist_out_channels_l1': 99, 'left_wall_dist_pool_size_l1': 2, 'left_wall_dist_out_channels_l2': 157, 'left_wall_dist_pool_size_l2': 4, 'left_wall_dist_out_channels_l3': 103, 'left_wall_dist_pool_size_l3': 8, 'left_wall_dist_fc_hidden': 35, 'track_width_num_layers': 4, 'track_width_activation': 'elu', 'track_width_out_channels_l0': 178, 'track_width_pool_size_l0': 2, 'track_width_out_channels_l1': 159, 'track_width_pool_size_l1': 8, 'track_width_out_channels_l2': 130, 'track_width_pool_size_l2': 2, 'track_width_out_channels_l3': 48, 'track_width_pool_size_l3': 2, 'track_width_fc_hidden': 58, 'heading_error_num_layers': 5, 'heading_error_activation': 'elu', 'heading_error_out_channels_l0': 53, 'heading_error_pool_size_l0': 2, 'heading_error_out_channels_l1': 93, 'heading_error_pool_size_l1': 2, 'heading_error_out_channels_l2': 210, 'heading_error_pool_size_l2': 4, 'heading_error_out_channels_l3': 254, 'heading_error_pool_size_l3': 4, 'heading_error_out_channels_l4': 152, 'heading_error_pool_size_l4': 4, 'heading_error_fc_hidden': 57}. Best is trial 60 with value: 0.1165.
[rank: 0] Seed set to 42
GPU available: True (cuda), used: True
TPU available: False, using: 0 TPU cores
💡 Tip: For seamless cloud logging and experiment tracking, try installing [litlogger](https://pypi.org/project/litlogger/) to enable LitLogger, which logs metrics and artifacts automatically to the Lightning Experiments platform.
[rank: 0] Seed set to 42
GPU available: True (cuda), used: True
TPU available: False, using: 0 TPU cores
💡 Tip: For seamless cloud logging and experiment tracking, try installing [litlogger](https://pypi.org/project/litlogger/) to enable LitLogger, which logs metrics and artifacts automatically to the Lightning Experiments platform.
[rank: 0] Seed set to 42
GPU available: True (cuda), used: True
TPU available: False, using: 0 TPU cores
💡 Tip: For seamless cloud logging and experiment tracking, try installing [litlogger](https://pypi.org/project/litlogger/) to enable LitLogger, which logs metrics and artifacts automatically to the Lightning Experiments platform.
LOCAL_RANK: 0 - CUDA_VISIBLE_DEVICES: [0]
LOCAL_RANK: 0 - CUDA_VISIBLE_DEVICES: [0]
SLURM auto-requeueing enabled. Setting signal handlers.
LOCAL_RANK: 0 - CUDA_VISIBLE_DEVICES: [0]
SLURM auto-requeueing enabled. Setting signal handlers.
SLURM auto-requeueing enabled. Setting signal handlers.
`Trainer.fit` stopped: `max_epochs=30` reached.
`Trainer.fit` stopped: `max_epochs=30` reached.
`Trainer.fit` stopped: `max_epochs=30` reached.
[I 2026-04-16 00:03:01,737] Trial 68 finished with value: 0.1635 and parameters: {'left_wall_dist_num_layers': 5, 'left_wall_dist_activation': 'relu', 'left_wall_dist_out_channels_l0': 113, 'left_wall_dist_pool_size_l0': 8, 'left_wall_dist_out_channels_l1': 109, 'left_wall_dist_pool_size_l1': 2, 'left_wall_dist_out_channels_l2': 155, 'left_wall_dist_pool_size_l2': 4, 'left_wall_dist_out_channels_l3': 97, 'left_wall_dist_pool_size_l3': 8, 'left_wall_dist_fc_hidden': 35, 'track_width_num_layers': 4, 'track_width_activation': 'elu', 'track_width_out_channels_l0': 179, 'track_width_pool_size_l0': 2, 'track_width_out_channels_l1': 153, 'track_width_pool_size_l1': 2, 'track_width_out_channels_l2': 46, 'track_width_pool_size_l2': 2, 'track_width_out_channels_l3': 32, 'track_width_pool_size_l3': 2, 'track_width_fc_hidden': 74, 'heading_error_num_layers': 5, 'heading_error_activation': 'relu', 'heading_error_out_channels_l0': 82, 'heading_error_pool_size_l0': 8, 'heading_error_out_channels_l1': 115, 'heading_error_pool_size_l1': 2, 'heading_error_out_channels_l2': 239, 'heading_error_pool_size_l2': 4, 'heading_error_out_channels_l3': 243, 'heading_error_pool_size_l3': 4, 'heading_error_out_channels_l4': 143, 'heading_error_pool_size_l4': 4, 'heading_error_fc_hidden': 49}. Best is trial 60 with value: 0.1165.
[rank: 0] Seed set to 42
GPU available: True (cuda), used: True
TPU available: False, using: 0 TPU cores
💡 Tip: For seamless cloud logging and experiment tracking, try installing [litlogger](https://pypi.org/project/litlogger/) to enable LitLogger, which logs metrics and artifacts automatically to the Lightning Experiments platform.
[rank: 0] Seed set to 42
[rank: 0] Seed set to 42
GPU available: True (cuda), used: True
TPU available: False, using: 0 TPU cores
💡 Tip: For seamless cloud logging and experiment tracking, try installing [litlogger](https://pypi.org/project/litlogger/) to enable LitLogger, which logs metrics and artifacts automatically to the Lightning Experiments platform.
GPU available: True (cuda), used: True
TPU available: False, using: 0 TPU cores
💡 Tip: For seamless cloud logging and experiment tracking, try installing [litlogger](https://pypi.org/project/litlogger/) to enable LitLogger, which logs metrics and artifacts automatically to the Lightning Experiments platform.
LOCAL_RANK: 0 - CUDA_VISIBLE_DEVICES: [0]
LOCAL_RANK: 0 - CUDA_VISIBLE_DEVICES: [0]
LOCAL_RANK: 0 - CUDA_VISIBLE_DEVICES: [0]
SLURM auto-requeueing enabled. Setting signal handlers.
SLURM auto-requeueing enabled. Setting signal handlers.
SLURM auto-requeueing enabled. Setting signal handlers.
`Trainer.fit` stopped: `max_epochs=30` reached.
`Trainer.fit` stopped: `max_epochs=30` reached.
`Trainer.fit` stopped: `max_epochs=30` reached.
[I 2026-04-16 00:06:15,717] Trial 69 finished with value: 0.1212 and parameters: {'left_wall_dist_num_layers': 5, 'left_wall_dist_activation': 'relu', 'left_wall_dist_out_channels_l0': 125, 'left_wall_dist_pool_size_l0': 8, 'left_wall_dist_out_channels_l1': 99, 'left_wall_dist_pool_size_l1': 2, 'left_wall_dist_out_channels_l2': 230, 'left_wall_dist_pool_size_l2': 4, 'left_wall_dist_out_channels_l3': 154, 'left_wall_dist_pool_size_l3': 8, 'left_wall_dist_fc_hidden': 41, 'track_width_num_layers': 4, 'track_width_activation': 'elu', 'track_width_out_channels_l0': 228, 'track_width_pool_size_l0': 2, 'track_width_out_channels_l1': 163, 'track_width_pool_size_l1': 8, 'track_width_out_channels_l2': 148, 'track_width_pool_size_l2': 2, 'track_width_out_channels_l3': 46, 'track_width_pool_size_l3': 2, 'track_width_fc_hidden': 58, 'heading_error_num_layers': 5, 'heading_error_activation': 'elu', 'heading_error_out_channels_l0': 100, 'heading_error_pool_size_l0': 2, 'heading_error_out_channels_l1': 99, 'heading_error_pool_size_l1': 2, 'heading_error_out_channels_l2': 127, 'heading_error_pool_size_l2': 4, 'heading_error_out_channels_l3': 188, 'heading_error_pool_size_l3': 4, 'heading_error_out_channels_l4': 137, 'heading_error_pool_size_l4': 4, 'heading_error_fc_hidden': 60}. Best is trial 60 with value: 0.1165.
[rank: 0] Seed set to 42
[rank: 0] Seed set to 42
GPU available: True (cuda), used: True
GPU available: True (cuda), used: True
TPU available: False, using: 0 TPU cores
TPU available: False, using: 0 TPU cores
💡 Tip: For seamless cloud logging and experiment tracking, try installing [litlogger](https://pypi.org/project/litlogger/) to enable LitLogger, which logs metrics and artifacts automatically to the Lightning Experiments platform.
💡 Tip: For seamless cloud logging and experiment tracking, try installing [litlogger](https://pypi.org/project/litlogger/) to enable LitLogger, which logs metrics and artifacts automatically to the Lightning Experiments platform.
[rank: 0] Seed set to 42
GPU available: True (cuda), used: True
TPU available: False, using: 0 TPU cores
💡 Tip: For seamless cloud logging and experiment tracking, try installing [litlogger](https://pypi.org/project/litlogger/) to enable LitLogger, which logs metrics and artifacts automatically to the Lightning Experiments platform.
LOCAL_RANK: 0 - CUDA_VISIBLE_DEVICES: [0]
LOCAL_RANK: 0 - CUDA_VISIBLE_DEVICES: [0]
LOCAL_RANK: 0 - CUDA_VISIBLE_DEVICES: [0]
SLURM auto-requeueing enabled. Setting signal handlers.
SLURM auto-requeueing enabled. Setting signal handlers.
SLURM auto-requeueing enabled. Setting signal handlers.
`Trainer.fit` stopped: `max_epochs=30` reached.
`Trainer.fit` stopped: `max_epochs=30` reached.
`Trainer.fit` stopped: `max_epochs=30` reached.
[I 2026-04-16 00:09:24,896] Trial 70 finished with value: 0.1122 and parameters: {'left_wall_dist_num_layers': 5, 'left_wall_dist_activation': 'relu', 'left_wall_dist_out_channels_l0': 143, 'left_wall_dist_pool_size_l0': 8, 'left_wall_dist_out_channels_l1': 85, 'left_wall_dist_pool_size_l1': 2, 'left_wall_dist_out_channels_l2': 249, 'left_wall_dist_pool_size_l2': 4, 'left_wall_dist_out_channels_l3': 154, 'left_wall_dist_pool_size_l3': 8, 'left_wall_dist_fc_hidden': 40, 'track_width_num_layers': 4, 'track_width_activation': 'elu', 'track_width_out_channels_l0': 223, 'track_width_pool_size_l0': 2, 'track_width_out_channels_l1': 166, 'track_width_pool_size_l1': 4, 'track_width_out_channels_l2': 149, 'track_width_pool_size_l2': 2, 'track_width_out_channels_l3': 47, 'track_width_pool_size_l3': 2, 'track_width_fc_hidden': 59, 'heading_error_num_layers': 5, 'heading_error_activation': 'elu', 'heading_error_out_channels_l0': 119, 'heading_error_pool_size_l0': 8, 'heading_error_out_channels_l1': 96, 'heading_error_pool_size_l1': 2, 'heading_error_out_channels_l2': 213, 'heading_error_pool_size_l2': 4, 'heading_error_out_channels_l3': 196, 'heading_error_pool_size_l3': 4, 'heading_error_out_channels_l4': 137, 'heading_error_pool_size_l4': 4, 'heading_error_fc_hidden': 38}. Best is trial 70 with value: 0.1122.
[rank: 0] Seed set to 42
[rank: 0] Seed set to 42
[rank: 0] Seed set to 42
GPU available: True (cuda), used: True
TPU available: False, using: 0 TPU cores
💡 Tip: For seamless cloud logging and experiment tracking, try installing [litlogger](https://pypi.org/project/litlogger/) to enable LitLogger, which logs metrics and artifacts automatically to the Lightning Experiments platform.
GPU available: True (cuda), used: True
TPU available: False, using: 0 TPU cores
GPU available: True (cuda), used: True
TPU available: False, using: 0 TPU cores
💡 Tip: For seamless cloud logging and experiment tracking, try installing [litlogger](https://pypi.org/project/litlogger/) to enable LitLogger, which logs metrics and artifacts automatically to the Lightning Experiments platform.
💡 Tip: For seamless cloud logging and experiment tracking, try installing [litlogger](https://pypi.org/project/litlogger/) to enable LitLogger, which logs metrics and artifacts automatically to the Lightning Experiments platform.
LOCAL_RANK: 0 - CUDA_VISIBLE_DEVICES: [0]
LOCAL_RANK: 0 - CUDA_VISIBLE_DEVICES: [0]
LOCAL_RANK: 0 - CUDA_VISIBLE_DEVICES: [0]
SLURM auto-requeueing enabled. Setting signal handlers.
SLURM auto-requeueing enabled. Setting signal handlers.
SLURM auto-requeueing enabled. Setting signal handlers.
`Trainer.fit` stopped: `max_epochs=30` reached.
`Trainer.fit` stopped: `max_epochs=30` reached.
`Trainer.fit` stopped: `max_epochs=30` reached.
[I 2026-04-16 00:12:35,914] Trial 71 finished with value: 0.1558 and parameters: {'left_wall_dist_num_layers': 5, 'left_wall_dist_activation': 'relu', 'left_wall_dist_out_channels_l0': 137, 'left_wall_dist_pool_size_l0': 8, 'left_wall_dist_out_channels_l1': 88, 'left_wall_dist_pool_size_l1': 2, 'left_wall_dist_out_channels_l2': 249, 'left_wall_dist_pool_size_l2': 4, 'left_wall_dist_out_channels_l3': 153, 'left_wall_dist_pool_size_l3': 8, 'left_wall_dist_fc_hidden': 42, 'track_width_num_layers': 4, 'track_width_activation': 'elu', 'track_width_out_channels_l0': 225, 'track_width_pool_size_l0': 2, 'track_width_out_channels_l1': 179, 'track_width_pool_size_l1': 4, 'track_width_out_channels_l2': 148, 'track_width_pool_size_l2': 2, 'track_width_out_channels_l3': 47, 'track_width_pool_size_l3': 2, 'track_width_fc_hidden': 59, 'heading_error_num_layers': 5, 'heading_error_activation': 'elu', 'heading_error_out_channels_l0': 123, 'heading_error_pool_size_l0': 8, 'heading_error_out_channels_l1': 95, 'heading_error_pool_size_l1': 2, 'heading_error_out_channels_l2': 215, 'heading_error_pool_size_l2': 4, 'heading_error_out_channels_l3': 199, 'heading_error_pool_size_l3': 4, 'heading_error_out_channels_l4': 137, 'heading_error_pool_size_l4': 4, 'heading_error_fc_hidden': 38}. Best is trial 70 with value: 0.1122.
[rank: 0] Seed set to 42
GPU available: True (cuda), used: True
TPU available: False, using: 0 TPU cores
💡 Tip: For seamless cloud logging and experiment tracking, try installing [litlogger](https://pypi.org/project/litlogger/) to enable LitLogger, which logs metrics and artifacts automatically to the Lightning Experiments platform.
[rank: 0] Seed set to 42
[rank: 0] Seed set to 42
GPU available: True (cuda), used: True
TPU available: False, using: 0 TPU cores
💡 Tip: For seamless cloud logging and experiment tracking, try installing [litlogger](https://pypi.org/project/litlogger/) to enable LitLogger, which logs metrics and artifacts automatically to the Lightning Experiments platform.
GPU available: True (cuda), used: True
TPU available: False, using: 0 TPU cores
💡 Tip: For seamless cloud logging and experiment tracking, try installing [litlogger](https://pypi.org/project/litlogger/) to enable LitLogger, which logs metrics and artifacts automatically to the Lightning Experiments platform.
LOCAL_RANK: 0 - CUDA_VISIBLE_DEVICES: [0]
LOCAL_RANK: 0 - CUDA_VISIBLE_DEVICES: [0]
LOCAL_RANK: 0 - CUDA_VISIBLE_DEVICES: [0]
SLURM auto-requeueing enabled. Setting signal handlers.
SLURM auto-requeueing enabled. Setting signal handlers.
SLURM auto-requeueing enabled. Setting signal handlers.
`Trainer.fit` stopped: `max_epochs=30` reached.
`Trainer.fit` stopped: `max_epochs=30` reached.
`Trainer.fit` stopped: `max_epochs=30` reached.
