[I 2026-04-12 15:57:18,278] Trial 75 finished with value: 0.1438 and parameters: {'left_wall_dist_num_layers': 3, 'left_wall_dist_activation': 'elu', 'left_wall_dist_out_channels_l0': 173, 'left_wall_dist_pool_size_l0': 4, 'left_wall_dist_out_channels_l1': 48, 'left_wall_dist_pool_size_l1': 2, 'left_wall_dist_out_channels_l2': 135, 'left_wall_dist_pool_size_l2': 2, 'track_width_num_layers': 4, 'track_width_activation': 'elu', 'track_width_out_channels_l0': 238, 'track_width_pool_size_l0': 2, 'track_width_out_channels_l1': 192, 'track_width_pool_size_l1': 4, 'track_width_out_channels_l2': 86, 'track_width_pool_size_l2': 2, 'track_width_out_channels_l3': 53, 'track_width_pool_size_l3': 8, 'track_width_fc_hidden': 54, 'heading_error_num_layers': 3, 'heading_error_activation': 'elu', 'heading_error_out_channels_l0': 140, 'heading_error_pool_size_l0': 2, 'heading_error_out_channels_l1': 73, 'heading_error_pool_size_l1': 4, 'heading_error_out_channels_l2': 196, 'heading_error_pool_size_l2': 2}. Best is trial 31 with value: 0.0984.
[rank: 0] Seed set to 42
GPU available: True (cuda), used: True
TPU available: False, using: 0 TPU cores
💡 Tip: For seamless cloud logging and experiment tracking, try installing [litlogger](https://pypi.org/project/litlogger/) to enable LitLogger, which logs metrics and artifacts automatically to the Lightning Experiments platform.
[rank: 0] Seed set to 42
[rank: 0] Seed set to 42
GPU available: True (cuda), used: True
TPU available: False, using: 0 TPU cores
GPU available: True (cuda), used: True
TPU available: False, using: 0 TPU cores
💡 Tip: For seamless cloud logging and experiment tracking, try installing [litlogger](https://pypi.org/project/litlogger/) to enable LitLogger, which logs metrics and artifacts automatically to the Lightning Experiments platform.
💡 Tip: For seamless cloud logging and experiment tracking, try installing [litlogger](https://pypi.org/project/litlogger/) to enable LitLogger, which logs metrics and artifacts automatically to the Lightning Experiments platform.
LOCAL_RANK: 0 - CUDA_VISIBLE_DEVICES: [0]
LOCAL_RANK: 0 - CUDA_VISIBLE_DEVICES: [0]
LOCAL_RANK: 0 - CUDA_VISIBLE_DEVICES: [0]
SLURM auto-requeueing enabled. Setting signal handlers.
SLURM auto-requeueing enabled. Setting signal handlers.
SLURM auto-requeueing enabled. Setting signal handlers.
`Trainer.fit` stopped: `max_epochs=20` reached.
`Trainer.fit` stopped: `max_epochs=20` reached.
`Trainer.fit` stopped: `max_epochs=20` reached.
[I 2026-04-12 15:59:26,185] Trial 76 finished with value: 0.1247 and parameters: {'left_wall_dist_num_layers': 3, 'left_wall_dist_activation': 'relu', 'left_wall_dist_out_channels_l0': 146, 'left_wall_dist_pool_size_l0': 4, 'left_wall_dist_out_channels_l1': 36, 'left_wall_dist_pool_size_l1': 8, 'left_wall_dist_out_channels_l2': 215, 'left_wall_dist_pool_size_l2': 2, 'left_wall_dist_fc_hidden': 100, 'track_width_num_layers': 4, 'track_width_activation': 'relu', 'track_width_out_channels_l0': 126, 'track_width_pool_size_l0': 8, 'track_width_out_channels_l1': 122, 'track_width_pool_size_l1': 2, 'track_width_out_channels_l2': 113, 'track_width_pool_size_l2': 2, 'track_width_out_channels_l3': 69, 'track_width_pool_size_l3': 2, 'track_width_fc_hidden': 73, 'heading_error_num_layers': 3, 'heading_error_activation': 'relu', 'heading_error_out_channels_l0': 194, 'heading_error_pool_size_l0': 8, 'heading_error_out_channels_l1': 119, 'heading_error_pool_size_l1': 4, 'heading_error_out_channels_l2': 51, 'heading_error_pool_size_l2': 8, 'heading_error_fc_hidden': 36}. Best is trial 31 with value: 0.0984.
[rank: 0] Seed set to 42
[rank: 0] Seed set to 42
[rank: 0] Seed set to 42
GPU available: True (cuda), used: True
TPU available: False, using: 0 TPU cores
💡 Tip: For seamless cloud logging and experiment tracking, try installing [litlogger](https://pypi.org/project/litlogger/) to enable LitLogger, which logs metrics and artifacts automatically to the Lightning Experiments platform.
GPU available: True (cuda), used: True
TPU available: False, using: 0 TPU cores
GPU available: True (cuda), used: True
TPU available: False, using: 0 TPU cores
💡 Tip: For seamless cloud logging and experiment tracking, try installing [litlogger](https://pypi.org/project/litlogger/) to enable LitLogger, which logs metrics and artifacts automatically to the Lightning Experiments platform.
💡 Tip: For seamless cloud logging and experiment tracking, try installing [litlogger](https://pypi.org/project/litlogger/) to enable LitLogger, which logs metrics and artifacts automatically to the Lightning Experiments platform.
LOCAL_RANK: 0 - CUDA_VISIBLE_DEVICES: [0]
LOCAL_RANK: 0 - CUDA_VISIBLE_DEVICES: [0]
LOCAL_RANK: 0 - CUDA_VISIBLE_DEVICES: [0]
SLURM auto-requeueing enabled. Setting signal handlers.
SLURM auto-requeueing enabled. Setting signal handlers.
SLURM auto-requeueing enabled. Setting signal handlers.
`Trainer.fit` stopped: `max_epochs=20` reached.
`Trainer.fit` stopped: `max_epochs=20` reached.
`Trainer.fit` stopped: `max_epochs=20` reached.
[I 2026-04-12 16:01:36,361] Trial 77 finished with value: 0.1288 and parameters: {'left_wall_dist_num_layers': 5, 'left_wall_dist_activation': 'elu', 'left_wall_dist_out_channels_l0': 160, 'left_wall_dist_pool_size_l0': 4, 'left_wall_dist_out_channels_l1': 39, 'left_wall_dist_pool_size_l1': 2, 'left_wall_dist_out_channels_l2': 112, 'left_wall_dist_pool_size_l2': 8, 'left_wall_dist_out_channels_l3': 45, 'left_wall_dist_pool_size_l3': 4, 'left_wall_dist_out_channels_l4': 80, 'left_wall_dist_pool_size_l4': 4, 'track_width_num_layers': 4, 'track_width_activation': 'elu', 'track_width_out_channels_l0': 145, 'track_width_pool_size_l0': 4, 'track_width_out_channels_l1': 67, 'track_width_pool_size_l1': 4, 'track_width_out_channels_l2': 91, 'track_width_pool_size_l2': 2, 'track_width_out_channels_l3': 76, 'track_width_pool_size_l3': 8, 'track_width_fc_hidden': 46, 'heading_error_num_layers': 3, 'heading_error_activation': 'elu', 'heading_error_out_channels_l0': 125, 'heading_error_pool_size_l0': 8, 'heading_error_out_channels_l1': 65, 'heading_error_pool_size_l1': 2, 'heading_error_out_channels_l2': 46, 'heading_error_pool_size_l2': 2, 'heading_error_fc_hidden': 115}. Best is trial 31 with value: 0.0984.
[rank: 0] Seed set to 42
GPU available: True (cuda), used: True
TPU available: False, using: 0 TPU cores
💡 Tip: For seamless cloud logging and experiment tracking, try installing [litlogger](https://pypi.org/project/litlogger/) to enable LitLogger, which logs metrics and artifacts automatically to the Lightning Experiments platform.
[rank: 0] Seed set to 42
GPU available: True (cuda), used: True
TPU available: False, using: 0 TPU cores
[rank: 0] Seed set to 42
💡 Tip: For seamless cloud logging and experiment tracking, try installing [litlogger](https://pypi.org/project/litlogger/) to enable LitLogger, which logs metrics and artifacts automatically to the Lightning Experiments platform.
GPU available: True (cuda), used: True
TPU available: False, using: 0 TPU cores
💡 Tip: For seamless cloud logging and experiment tracking, try installing [litlogger](https://pypi.org/project/litlogger/) to enable LitLogger, which logs metrics and artifacts automatically to the Lightning Experiments platform.
LOCAL_RANK: 0 - CUDA_VISIBLE_DEVICES: [0]
LOCAL_RANK: 0 - CUDA_VISIBLE_DEVICES: [0]
LOCAL_RANK: 0 - CUDA_VISIBLE_DEVICES: [0]
SLURM auto-requeueing enabled. Setting signal handlers.
SLURM auto-requeueing enabled. Setting signal handlers.
SLURM auto-requeueing enabled. Setting signal handlers.
`Trainer.fit` stopped: `max_epochs=20` reached.
`Trainer.fit` stopped: `max_epochs=20` reached.
`Trainer.fit` stopped: `max_epochs=20` reached.
[I 2026-04-12 16:03:44,064] Trial 78 finished with value: 0.1132 and parameters: {'left_wall_dist_num_layers': 2, 'left_wall_dist_activation': 'relu', 'left_wall_dist_out_channels_l0': 74, 'left_wall_dist_pool_size_l0': 4, 'left_wall_dist_out_channels_l1': 222, 'left_wall_dist_pool_size_l1': 2, 'track_width_num_layers': 5, 'track_width_activation': 'elu', 'track_width_out_channels_l0': 210, 'track_width_pool_size_l0': 8, 'track_width_out_channels_l1': 45, 'track_width_pool_size_l1': 8, 'track_width_out_channels_l2': 80, 'track_width_pool_size_l2': 2, 'track_width_out_channels_l3': 120, 'track_width_pool_size_l3': 8, 'track_width_out_channels_l4': 32, 'track_width_pool_size_l4': 2, 'heading_error_num_layers': 4, 'heading_error_activation': 'elu', 'heading_error_out_channels_l0': 85, 'heading_error_pool_size_l0': 2, 'heading_error_out_channels_l1': 43, 'heading_error_pool_size_l1': 4, 'heading_error_out_channels_l2': 38, 'heading_error_pool_size_l2': 8, 'heading_error_out_channels_l3': 52, 'heading_error_pool_size_l3': 2, 'heading_error_fc_hidden': 52}. Best is trial 31 with value: 0.0984.
[rank: 0] Seed set to 42
[rank: 0] Seed set to 42
GPU available: True (cuda), used: True
TPU available: False, using: 0 TPU cores
GPU available: True (cuda), used: True
💡 Tip: For seamless cloud logging and experiment tracking, try installing [litlogger](https://pypi.org/project/litlogger/) to enable LitLogger, which logs metrics and artifacts automatically to the Lightning Experiments platform.
TPU available: False, using: 0 TPU cores
💡 Tip: For seamless cloud logging and experiment tracking, try installing [litlogger](https://pypi.org/project/litlogger/) to enable LitLogger, which logs metrics and artifacts automatically to the Lightning Experiments platform.
[rank: 0] Seed set to 42
GPU available: True (cuda), used: True
TPU available: False, using: 0 TPU cores
💡 Tip: For seamless cloud logging and experiment tracking, try installing [litlogger](https://pypi.org/project/litlogger/) to enable LitLogger, which logs metrics and artifacts automatically to the Lightning Experiments platform.
LOCAL_RANK: 0 - CUDA_VISIBLE_DEVICES: [0]
LOCAL_RANK: 0 - CUDA_VISIBLE_DEVICES: [0]
LOCAL_RANK: 0 - CUDA_VISIBLE_DEVICES: [0]
SLURM auto-requeueing enabled. Setting signal handlers.
SLURM auto-requeueing enabled. Setting signal handlers.
SLURM auto-requeueing enabled. Setting signal handlers.
`Trainer.fit` stopped: `max_epochs=20` reached.
`Trainer.fit` stopped: `max_epochs=20` reached.
`Trainer.fit` stopped: `max_epochs=20` reached.
[I 2026-04-12 16:05:49,460] Trial 79 finished with value: 0.1012 and parameters: {'left_wall_dist_num_layers': 3, 'left_wall_dist_activation': 'relu', 'left_wall_dist_out_channels_l0': 191, 'left_wall_dist_pool_size_l0': 8, 'left_wall_dist_out_channels_l1': 87, 'left_wall_dist_pool_size_l1': 2, 'left_wall_dist_out_channels_l2': 92, 'left_wall_dist_pool_size_l2': 2, 'left_wall_dist_fc_hidden': 66, 'track_width_num_layers': 4, 'track_width_activation': 'elu', 'track_width_out_channels_l0': 191, 'track_width_pool_size_l0': 8, 'track_width_out_channels_l1': 207, 'track_width_pool_size_l1': 4, 'track_width_out_channels_l2': 122, 'track_width_pool_size_l2': 2, 'track_width_out_channels_l3': 103, 'track_width_pool_size_l3': 2, 'track_width_fc_hidden': 62, 'heading_error_num_layers': 3, 'heading_error_activation': 'elu', 'heading_error_out_channels_l0': 151, 'heading_error_pool_size_l0': 8, 'heading_error_out_channels_l1': 91, 'heading_error_pool_size_l1': 4, 'heading_error_out_channels_l2': 32, 'heading_error_pool_size_l2': 2, 'heading_error_fc_hidden': 94}. Best is trial 31 with value: 0.0984.
[rank: 0] Seed set to 42
GPU available: True (cuda), used: True
TPU available: False, using: 0 TPU cores
💡 Tip: For seamless cloud logging and experiment tracking, try installing [litlogger](https://pypi.org/project/litlogger/) to enable LitLogger, which logs metrics and artifacts automatically to the Lightning Experiments platform.
[rank: 0] Seed set to 42
GPU available: True (cuda), used: True
TPU available: False, using: 0 TPU cores
💡 Tip: For seamless cloud logging and experiment tracking, try installing [litlogger](https://pypi.org/project/litlogger/) to enable LitLogger, which logs metrics and artifacts automatically to the Lightning Experiments platform.
[rank: 0] Seed set to 42
GPU available: True (cuda), used: True
TPU available: False, using: 0 TPU cores
💡 Tip: For seamless cloud logging and experiment tracking, try installing [litlogger](https://pypi.org/project/litlogger/) to enable LitLogger, which logs metrics and artifacts automatically to the Lightning Experiments platform.
LOCAL_RANK: 0 - CUDA_VISIBLE_DEVICES: [0]
LOCAL_RANK: 0 - CUDA_VISIBLE_DEVICES: [0]
LOCAL_RANK: 0 - CUDA_VISIBLE_DEVICES: [0]
SLURM auto-requeueing enabled. Setting signal handlers.
SLURM auto-requeueing enabled. Setting signal handlers.
SLURM auto-requeueing enabled. Setting signal handlers.
`Trainer.fit` stopped: `max_epochs=20` reached.
`Trainer.fit` stopped: `max_epochs=20` reached.
`Trainer.fit` stopped: `max_epochs=20` reached.
[I 2026-04-12 16:07:47,764] Trial 80 finished with value: 0.1238 and parameters: {'left_wall_dist_num_layers': 3, 'left_wall_dist_activation': 'relu', 'left_wall_dist_out_channels_l0': 211, 'left_wall_dist_pool_size_l0': 8, 'left_wall_dist_out_channels_l1': 86, 'left_wall_dist_pool_size_l1': 8, 'left_wall_dist_out_channels_l2': 89, 'left_wall_dist_pool_size_l2': 2, 'left_wall_dist_fc_hidden': 67, 'track_width_num_layers': 2, 'track_width_activation': 'relu', 'track_width_out_channels_l0': 138, 'track_width_pool_size_l0': 8, 'track_width_out_channels_l1': 239, 'track_width_pool_size_l1': 4, 'track_width_fc_hidden': 128, 'heading_error_num_layers': 2, 'heading_error_activation': 'elu', 'heading_error_out_channels_l0': 153, 'heading_error_pool_size_l0': 8, 'heading_error_out_channels_l1': 133, 'heading_error_pool_size_l1': 4, 'heading_error_fc_hidden': 90}. Best is trial 31 with value: 0.0984.
[rank: 0] Seed set to 42
[rank: 0] Seed set to 42
[rank: 0] Seed set to 42
GPU available: True (cuda), used: True
TPU available: False, using: 0 TPU cores
💡 Tip: For seamless cloud logging and experiment tracking, try installing [litlogger](https://pypi.org/project/litlogger/) to enable LitLogger, which logs metrics and artifacts automatically to the Lightning Experiments platform.
GPU available: True (cuda), used: True
TPU available: False, using: 0 TPU cores
💡 Tip: For seamless cloud logging and experiment tracking, try installing [litlogger](https://pypi.org/project/litlogger/) to enable LitLogger, which logs metrics and artifacts automatically to the Lightning Experiments platform.
GPU available: True (cuda), used: True
TPU available: False, using: 0 TPU cores
💡 Tip: For seamless cloud logging and experiment tracking, try installing [litlogger](https://pypi.org/project/litlogger/) to enable LitLogger, which logs metrics and artifacts automatically to the Lightning Experiments platform.
LOCAL_RANK: 0 - CUDA_VISIBLE_DEVICES: [0]
LOCAL_RANK: 0 - CUDA_VISIBLE_DEVICES: [0]
LOCAL_RANK: 0 - CUDA_VISIBLE_DEVICES: [0]
SLURM auto-requeueing enabled. Setting signal handlers.
SLURM auto-requeueing enabled. Setting signal handlers.
SLURM auto-requeueing enabled. Setting signal handlers.
`Trainer.fit` stopped: `max_epochs=20` reached.
`Trainer.fit` stopped: `max_epochs=20` reached.
`Trainer.fit` stopped: `max_epochs=20` reached.
[I 2026-04-12 16:09:52,997] Trial 81 finished with value: 0.103 and parameters: {'left_wall_dist_num_layers': 3, 'left_wall_dist_activation': 'relu', 'left_wall_dist_out_channels_l0': 234, 'left_wall_dist_pool_size_l0': 8, 'left_wall_dist_out_channels_l1': 50, 'left_wall_dist_pool_size_l1': 2, 'left_wall_dist_out_channels_l2': 72, 'left_wall_dist_pool_size_l2': 2, 'left_wall_dist_fc_hidden': 52, 'track_width_num_layers': 4, 'track_width_activation': 'elu', 'track_width_out_channels_l0': 196, 'track_width_pool_size_l0': 8, 'track_width_out_channels_l1': 214, 'track_width_pool_size_l1': 4, 'track_width_out_channels_l2': 123, 'track_width_pool_size_l2': 2, 'track_width_out_channels_l3': 103, 'track_width_pool_size_l3': 2, 'track_width_fc_hidden': 64, 'heading_error_num_layers': 3, 'heading_error_activation': 'elu', 'heading_error_out_channels_l0': 166, 'heading_error_pool_size_l0': 8, 'heading_error_out_channels_l1': 62, 'heading_error_pool_size_l1': 4, 'heading_error_out_channels_l2': 32, 'heading_error_pool_size_l2': 2, 'heading_error_fc_hidden': 110}. Best is trial 31 with value: 0.0984.
[rank: 0] Seed set to 42
[rank: 0] Seed set to 42
GPU available: True (cuda), used: True
TPU available: False, using: 0 TPU cores
💡 Tip: For seamless cloud logging and experiment tracking, try installing [litlogger](https://pypi.org/project/litlogger/) to enable LitLogger, which logs metrics and artifacts automatically to the Lightning Experiments platform.
GPU available: True (cuda), used: True
TPU available: False, using: 0 TPU cores
💡 Tip: For seamless cloud logging and experiment tracking, try installing [litlogger](https://pypi.org/project/litlogger/) to enable LitLogger, which logs metrics and artifacts automatically to the Lightning Experiments platform.
[rank: 0] Seed set to 42
GPU available: True (cuda), used: True
TPU available: False, using: 0 TPU cores
💡 Tip: For seamless cloud logging and experiment tracking, try installing [litlogger](https://pypi.org/project/litlogger/) to enable LitLogger, which logs metrics and artifacts automatically to the Lightning Experiments platform.
LOCAL_RANK: 0 - CUDA_VISIBLE_DEVICES: [0]
LOCAL_RANK: 0 - CUDA_VISIBLE_DEVICES: [0]
LOCAL_RANK: 0 - CUDA_VISIBLE_DEVICES: [0]
SLURM auto-requeueing enabled. Setting signal handlers.
SLURM auto-requeueing enabled. Setting signal handlers.
SLURM auto-requeueing enabled. Setting signal handlers.
`Trainer.fit` stopped: `max_epochs=20` reached.
`Trainer.fit` stopped: `max_epochs=20` reached.
`Trainer.fit` stopped: `max_epochs=20` reached.
[I 2026-04-12 16:12:02,773] Trial 82 finished with value: 0.1224 and parameters: {'left_wall_dist_num_layers': 3, 'left_wall_dist_activation': 'relu', 'left_wall_dist_out_channels_l0': 234, 'left_wall_dist_pool_size_l0': 8, 'left_wall_dist_out_channels_l1': 66, 'left_wall_dist_pool_size_l1': 2, 'left_wall_dist_out_channels_l2': 78, 'left_wall_dist_pool_size_l2': 2, 'left_wall_dist_fc_hidden': 50, 'track_width_num_layers': 4, 'track_width_activation': 'elu', 'track_width_out_channels_l0': 193, 'track_width_pool_size_l0': 8, 'track_width_out_channels_l1': 221, 'track_width_pool_size_l1': 4, 'track_width_out_channels_l2': 122, 'track_width_pool_size_l2': 2, 'track_width_out_channels_l3': 107, 'track_width_pool_size_l3': 2, 'track_width_fc_hidden': 63, 'heading_error_num_layers': 3, 'heading_error_activation': 'elu', 'heading_error_out_channels_l0': 171, 'heading_error_pool_size_l0': 8, 'heading_error_out_channels_l1': 55, 'heading_error_pool_size_l1': 4, 'heading_error_out_channels_l2': 36, 'heading_error_pool_size_l2': 2, 'heading_error_fc_hidden': 108}. Best is trial 31 with value: 0.0984.
[rank: 0] Seed set to 42
[rank: 0] Seed set to 42
[rank: 0] Seed set to 42
GPU available: True (cuda), used: True
TPU available: False, using: 0 TPU cores
GPU available: True (cuda), used: True
💡 Tip: For seamless cloud logging and experiment tracking, try installing [litlogger](https://pypi.org/project/litlogger/) to enable LitLogger, which logs metrics and artifacts automatically to the Lightning Experiments platform.
TPU available: False, using: 0 TPU cores
💡 Tip: For seamless cloud logging and experiment tracking, try installing [litlogger](https://pypi.org/project/litlogger/) to enable LitLogger, which logs metrics and artifacts automatically to the Lightning Experiments platform.
GPU available: True (cuda), used: True
TPU available: False, using: 0 TPU cores
💡 Tip: For seamless cloud logging and experiment tracking, try installing [litlogger](https://pypi.org/project/litlogger/) to enable LitLogger, which logs metrics and artifacts automatically to the Lightning Experiments platform.
LOCAL_RANK: 0 - CUDA_VISIBLE_DEVICES: [0]
LOCAL_RANK: 0 - CUDA_VISIBLE_DEVICES: [0]
LOCAL_RANK: 0 - CUDA_VISIBLE_DEVICES: [0]
SLURM auto-requeueing enabled. Setting signal handlers.
SLURM auto-requeueing enabled. Setting signal handlers.
SLURM auto-requeueing enabled. Setting signal handlers.
`Trainer.fit` stopped: `max_epochs=20` reached.
`Trainer.fit` stopped: `max_epochs=20` reached.
`Trainer.fit` stopped: `max_epochs=20` reached.
