[I 2026-04-12 13:59:25,311] Trial 14 finished with value: 0.2307 and parameters: {'left_wall_dist_num_layers': 3, 'left_wall_dist_activation': 'elu', 'left_wall_dist_out_channels_l0': 61, 'left_wall_dist_pool_size_l0': 8, 'left_wall_dist_out_channels_l1': 250, 'left_wall_dist_pool_size_l1': 8, 'left_wall_dist_out_channels_l2': 92, 'left_wall_dist_pool_size_l2': 8, 'left_wall_dist_fc_hidden': 54, 'track_width_num_layers': 3, 'track_width_activation': 'elu', 'track_width_out_channels_l0': 50, 'track_width_pool_size_l0': 8, 'track_width_out_channels_l1': 128, 'track_width_pool_size_l1': 4, 'track_width_out_channels_l2': 113, 'track_width_pool_size_l2': 4, 'track_width_fc_hidden': 123, 'heading_error_num_layers': 4, 'heading_error_activation': 'elu', 'heading_error_out_channels_l0': 243, 'heading_error_pool_size_l0': 4, 'heading_error_out_channels_l1': 71, 'heading_error_pool_size_l1': 2, 'heading_error_out_channels_l2': 144, 'heading_error_pool_size_l2': 8, 'heading_error_out_channels_l3': 171, 'heading_error_pool_size_l3': 2, 'heading_error_fc_hidden': 50}. Best is trial 12 with value: 0.1113.
[rank: 0] Seed set to 42
[rank: 0] Seed set to 42
[rank: 0] Seed set to 42
GPU available: True (cuda), used: True
TPU available: False, using: 0 TPU cores
GPU available: True (cuda), used: True
TPU available: False, using: 0 TPU cores
💡 Tip: For seamless cloud logging and experiment tracking, try installing [litlogger](https://pypi.org/project/litlogger/) to enable LitLogger, which logs metrics and artifacts automatically to the Lightning Experiments platform.
💡 Tip: For seamless cloud logging and experiment tracking, try installing [litlogger](https://pypi.org/project/litlogger/) to enable LitLogger, which logs metrics and artifacts automatically to the Lightning Experiments platform.
GPU available: True (cuda), used: True
TPU available: False, using: 0 TPU cores
💡 Tip: For seamless cloud logging and experiment tracking, try installing [litlogger](https://pypi.org/project/litlogger/) to enable LitLogger, which logs metrics and artifacts automatically to the Lightning Experiments platform.
LOCAL_RANK: 0 - CUDA_VISIBLE_DEVICES: [0]
LOCAL_RANK: 0 - CUDA_VISIBLE_DEVICES: [0]
LOCAL_RANK: 0 - CUDA_VISIBLE_DEVICES: [0]
SLURM auto-requeueing enabled. Setting signal handlers.
SLURM auto-requeueing enabled. Setting signal handlers.
SLURM auto-requeueing enabled. Setting signal handlers.
`Trainer.fit` stopped: `max_epochs=20` reached.
`Trainer.fit` stopped: `max_epochs=20` reached.
`Trainer.fit` stopped: `max_epochs=20` reached.
[I 2026-04-12 14:00:41,010] Trial 15 finished with value: 0.1935 and parameters: {'left_wall_dist_num_layers': 5, 'left_wall_dist_activation': 'elu', 'left_wall_dist_out_channels_l0': 45, 'left_wall_dist_pool_size_l0': 8, 'left_wall_dist_out_channels_l1': 112, 'left_wall_dist_pool_size_l1': 8, 'left_wall_dist_out_channels_l2': 158, 'left_wall_dist_pool_size_l2': 8, 'track_width_num_layers': 4, 'track_width_activation': 'elu', 'track_width_out_channels_l0': 95, 'track_width_pool_size_l0': 8, 'track_width_out_channels_l1': 65, 'track_width_pool_size_l1': 2, 'track_width_out_channels_l2': 51, 'track_width_pool_size_l2': 4, 'track_width_out_channels_l3': 79, 'track_width_pool_size_l3': 4, 'track_width_fc_hidden': 33, 'heading_error_num_layers': 3, 'heading_error_activation': 'elu', 'heading_error_out_channels_l0': 39, 'heading_error_pool_size_l0': 4, 'heading_error_out_channels_l1': 33, 'heading_error_pool_size_l1': 4, 'heading_error_out_channels_l2': 255, 'heading_error_pool_size_l2': 2, 'heading_error_fc_hidden': 128}. Best is trial 12 with value: 0.1113.
[rank: 0] Seed set to 42
[rank: 0] Seed set to 42
GPU available: True (cuda), used: True
TPU available: False, using: 0 TPU cores
💡 Tip: For seamless cloud logging and experiment tracking, try installing [litlogger](https://pypi.org/project/litlogger/) to enable LitLogger, which logs metrics and artifacts automatically to the Lightning Experiments platform.
GPU available: True (cuda), used: True
TPU available: False, using: 0 TPU cores
💡 Tip: For seamless cloud logging and experiment tracking, try installing [litlogger](https://pypi.org/project/litlogger/) to enable LitLogger, which logs metrics and artifacts automatically to the Lightning Experiments platform.
[rank: 0] Seed set to 42
GPU available: True (cuda), used: True
TPU available: False, using: 0 TPU cores
💡 Tip: For seamless cloud logging and experiment tracking, try installing [litlogger](https://pypi.org/project/litlogger/) to enable LitLogger, which logs metrics and artifacts automatically to the Lightning Experiments platform.
LOCAL_RANK: 0 - CUDA_VISIBLE_DEVICES: [0]
LOCAL_RANK: 0 - CUDA_VISIBLE_DEVICES: [0]
LOCAL_RANK: 0 - CUDA_VISIBLE_DEVICES: [0]
SLURM auto-requeueing enabled. Setting signal handlers.
SLURM auto-requeueing enabled. Setting signal handlers.
SLURM auto-requeueing enabled. Setting signal handlers.
`Trainer.fit` stopped: `max_epochs=20` reached.
`Trainer.fit` stopped: `max_epochs=20` reached.
`Trainer.fit` stopped: `max_epochs=20` reached.
[I 2026-04-12 14:02:56,881] Trial 16 finished with value: 0.1264 and parameters: {'left_wall_dist_num_layers': 2, 'left_wall_dist_activation': 'elu', 'left_wall_dist_out_channels_l0': 65, 'left_wall_dist_pool_size_l0': 4, 'left_wall_dist_out_channels_l1': 194, 'left_wall_dist_pool_size_l1': 8, 'left_wall_dist_fc_hidden': 116, 'track_width_num_layers': 3, 'track_width_activation': 'elu', 'track_width_out_channels_l0': 62, 'track_width_pool_size_l0': 8, 'track_width_out_channels_l1': 140, 'track_width_pool_size_l1': 4, 'track_width_out_channels_l2': 32, 'track_width_pool_size_l2': 4, 'track_width_fc_hidden': 38, 'heading_error_num_layers': 5, 'heading_error_activation': 'elu', 'heading_error_out_channels_l0': 62, 'heading_error_pool_size_l0': 4, 'heading_error_out_channels_l1': 51, 'heading_error_pool_size_l1': 8, 'heading_error_out_channels_l2': 133, 'heading_error_pool_size_l2': 8, 'heading_error_out_channels_l3': 62, 'heading_error_pool_size_l3': 4, 'heading_error_fc_hidden': 32}. Best is trial 12 with value: 0.1113.
[rank: 0] Seed set to 42
[rank: 0] Seed set to 42
[rank: 0] Seed set to 42
GPU available: True (cuda), used: True
TPU available: False, using: 0 TPU cores
GPU available: True (cuda), used: True
💡 Tip: For seamless cloud logging and experiment tracking, try installing [litlogger](https://pypi.org/project/litlogger/) to enable LitLogger, which logs metrics and artifacts automatically to the Lightning Experiments platform.
TPU available: False, using: 0 TPU cores
💡 Tip: For seamless cloud logging and experiment tracking, try installing [litlogger](https://pypi.org/project/litlogger/) to enable LitLogger, which logs metrics and artifacts automatically to the Lightning Experiments platform.
GPU available: True (cuda), used: True
TPU available: False, using: 0 TPU cores
💡 Tip: For seamless cloud logging and experiment tracking, try installing [litlogger](https://pypi.org/project/litlogger/) to enable LitLogger, which logs metrics and artifacts automatically to the Lightning Experiments platform.
LOCAL_RANK: 0 - CUDA_VISIBLE_DEVICES: [0]
LOCAL_RANK: 0 - CUDA_VISIBLE_DEVICES: [0]
LOCAL_RANK: 0 - CUDA_VISIBLE_DEVICES: [0]
SLURM auto-requeueing enabled. Setting signal handlers.
SLURM auto-requeueing enabled. Setting signal handlers.
SLURM auto-requeueing enabled. Setting signal handlers.
`Trainer.fit` stopped: `max_epochs=20` reached.
`Trainer.fit` stopped: `max_epochs=20` reached.
`Trainer.fit` stopped: `max_epochs=20` reached.
[I 2026-04-12 14:05:06,602] Trial 17 finished with value: 0.1563 and parameters: {'left_wall_dist_num_layers': 3, 'left_wall_dist_activation': 'elu', 'left_wall_dist_out_channels_l0': 33, 'left_wall_dist_pool_size_l0': 4, 'left_wall_dist_out_channels_l1': 105, 'left_wall_dist_pool_size_l1': 8, 'left_wall_dist_out_channels_l2': 89, 'left_wall_dist_pool_size_l2': 8, 'left_wall_dist_fc_hidden': 62, 'track_width_num_layers': 5, 'track_width_activation': 'elu', 'track_width_out_channels_l0': 111, 'track_width_pool_size_l0': 8, 'track_width_out_channels_l1': 86, 'track_width_pool_size_l1': 4, 'track_width_out_channels_l2': 59, 'track_width_pool_size_l2': 8, 'track_width_out_channels_l3': 158, 'track_width_pool_size_l3': 8, 'heading_error_num_layers': 4, 'heading_error_activation': 'elu', 'heading_error_out_channels_l0': 96, 'heading_error_pool_size_l0': 4, 'heading_error_out_channels_l1': 78, 'heading_error_pool_size_l1': 4, 'heading_error_out_channels_l2': 182, 'heading_error_pool_size_l2': 2, 'heading_error_out_channels_l3': 128, 'heading_error_pool_size_l3': 2, 'heading_error_fc_hidden': 45}. Best is trial 12 with value: 0.1113.
[rank: 0] Seed set to 42
GPU available: True (cuda), used: True
TPU available: False, using: 0 TPU cores
💡 Tip: For seamless cloud logging and experiment tracking, try installing [litlogger](https://pypi.org/project/litlogger/) to enable LitLogger, which logs metrics and artifacts automatically to the Lightning Experiments platform.
[rank: 0] Seed set to 42
[rank: 0] Seed set to 42
GPU available: True (cuda), used: True
TPU available: False, using: 0 TPU cores
💡 Tip: For seamless cloud logging and experiment tracking, try installing [litlogger](https://pypi.org/project/litlogger/) to enable LitLogger, which logs metrics and artifacts automatically to the Lightning Experiments platform.
GPU available: True (cuda), used: True
TPU available: False, using: 0 TPU cores
💡 Tip: For seamless cloud logging and experiment tracking, try installing [litlogger](https://pypi.org/project/litlogger/) to enable LitLogger, which logs metrics and artifacts automatically to the Lightning Experiments platform.
LOCAL_RANK: 0 - CUDA_VISIBLE_DEVICES: [0]
LOCAL_RANK: 0 - CUDA_VISIBLE_DEVICES: [0]
SLURM auto-requeueing enabled. Setting signal handlers.
LOCAL_RANK: 0 - CUDA_VISIBLE_DEVICES: [0]
SLURM auto-requeueing enabled. Setting signal handlers.
SLURM auto-requeueing enabled. Setting signal handlers.
`Trainer.fit` stopped: `max_epochs=20` reached.
`Trainer.fit` stopped: `max_epochs=20` reached.
`Trainer.fit` stopped: `max_epochs=20` reached.
[I 2026-04-12 14:07:15,185] Trial 18 finished with value: 0.2151 and parameters: {'left_wall_dist_num_layers': 4, 'left_wall_dist_activation': 'relu', 'left_wall_dist_out_channels_l0': 50, 'left_wall_dist_pool_size_l0': 8, 'left_wall_dist_out_channels_l1': 150, 'left_wall_dist_pool_size_l1': 8, 'left_wall_dist_out_channels_l2': 37, 'left_wall_dist_pool_size_l2': 8, 'left_wall_dist_fc_hidden': 36, 'track_width_num_layers': 4, 'track_width_activation': 'elu', 'track_width_out_channels_l0': 34, 'track_width_pool_size_l0': 8, 'track_width_out_channels_l1': 59, 'track_width_pool_size_l1': 8, 'track_width_out_channels_l2': 103, 'track_width_pool_size_l2': 2, 'track_width_out_channels_l3': 56, 'track_width_pool_size_l3': 2, 'track_width_fc_hidden': 37, 'heading_error_num_layers': 3, 'heading_error_activation': 'elu', 'heading_error_out_channels_l0': 33, 'heading_error_pool_size_l0': 4, 'heading_error_out_channels_l1': 42, 'heading_error_pool_size_l1': 8, 'heading_error_out_channels_l2': 80, 'heading_error_pool_size_l2': 8, 'heading_error_fc_hidden': 39}. Best is trial 12 with value: 0.1113.
[rank: 0] Seed set to 42
[rank: 0] Seed set to 42
GPU available: True (cuda), used: True
TPU available: False, using: 0 TPU cores
💡 Tip: For seamless cloud logging and experiment tracking, try installing [litlogger](https://pypi.org/project/litlogger/) to enable LitLogger, which logs metrics and artifacts automatically to the Lightning Experiments platform.
GPU available: True (cuda), used: True
TPU available: False, using: 0 TPU cores
💡 Tip: For seamless cloud logging and experiment tracking, try installing [litlogger](https://pypi.org/project/litlogger/) to enable LitLogger, which logs metrics and artifacts automatically to the Lightning Experiments platform.
[rank: 0] Seed set to 42
GPU available: True (cuda), used: True
TPU available: False, using: 0 TPU cores
💡 Tip: For seamless cloud logging and experiment tracking, try installing [litlogger](https://pypi.org/project/litlogger/) to enable LitLogger, which logs metrics and artifacts automatically to the Lightning Experiments platform.
LOCAL_RANK: 0 - CUDA_VISIBLE_DEVICES: [0]
LOCAL_RANK: 0 - CUDA_VISIBLE_DEVICES: [0]
LOCAL_RANK: 0 - CUDA_VISIBLE_DEVICES: [0]
SLURM auto-requeueing enabled. Setting signal handlers.
SLURM auto-requeueing enabled. Setting signal handlers.
SLURM auto-requeueing enabled. Setting signal handlers.
`Trainer.fit` stopped: `max_epochs=20` reached.
`Trainer.fit` stopped: `max_epochs=20` reached.
`Trainer.fit` stopped: `max_epochs=20` reached.
[I 2026-04-12 14:09:33,496] Trial 19 finished with value: 0.1572 and parameters: {'left_wall_dist_num_layers': 5, 'left_wall_dist_activation': 'elu', 'left_wall_dist_out_channels_l0': 74, 'left_wall_dist_pool_size_l0': 2, 'left_wall_dist_out_channels_l1': 200, 'left_wall_dist_pool_size_l1': 8, 'left_wall_dist_out_channels_l2': 123, 'left_wall_dist_pool_size_l2': 4, 'left_wall_dist_out_channels_l3': 33, 'left_wall_dist_pool_size_l3': 2, 'left_wall_dist_out_channels_l4': 32, 'left_wall_dist_pool_size_l4': 4, 'track_width_num_layers': 3, 'track_width_activation': 'elu', 'track_width_out_channels_l0': 81, 'track_width_pool_size_l0': 8, 'track_width_out_channels_l1': 105, 'track_width_pool_size_l1': 2, 'track_width_out_channels_l2': 42, 'track_width_pool_size_l2': 4, 'track_width_fc_hidden': 85, 'heading_error_num_layers': 5, 'heading_error_activation': 'elu', 'heading_error_out_channels_l0': 57, 'heading_error_pool_size_l0': 4, 'heading_error_out_channels_l1': 58, 'heading_error_pool_size_l1': 2, 'heading_error_out_channels_l2': 77, 'heading_error_pool_size_l2': 2, 'heading_error_out_channels_l3': 64, 'heading_error_pool_size_l3': 4, 'heading_error_out_channels_l4': 32, 'heading_error_pool_size_l4': 2, 'heading_error_fc_hidden': 36}. Best is trial 12 with value: 0.1113.
[rank: 0] Seed set to 42
[rank: 0] Seed set to 42
GPU available: True (cuda), used: True
TPU available: False, using: 0 TPU cores
💡 Tip: For seamless cloud logging and experiment tracking, try installing [litlogger](https://pypi.org/project/litlogger/) to enable LitLogger, which logs metrics and artifacts automatically to the Lightning Experiments platform.
GPU available: True (cuda), used: True
TPU available: False, using: 0 TPU cores
💡 Tip: For seamless cloud logging and experiment tracking, try installing [litlogger](https://pypi.org/project/litlogger/) to enable LitLogger, which logs metrics and artifacts automatically to the Lightning Experiments platform.
[rank: 0] Seed set to 42
GPU available: True (cuda), used: True
TPU available: False, using: 0 TPU cores
💡 Tip: For seamless cloud logging and experiment tracking, try installing [litlogger](https://pypi.org/project/litlogger/) to enable LitLogger, which logs metrics and artifacts automatically to the Lightning Experiments platform.
LOCAL_RANK: 0 - CUDA_VISIBLE_DEVICES: [0]
LOCAL_RANK: 0 - CUDA_VISIBLE_DEVICES: [0]
LOCAL_RANK: 0 - CUDA_VISIBLE_DEVICES: [0]
SLURM auto-requeueing enabled. Setting signal handlers.
SLURM auto-requeueing enabled. Setting signal handlers.
SLURM auto-requeueing enabled. Setting signal handlers.
`Trainer.fit` stopped: `max_epochs=20` reached.
`Trainer.fit` stopped: `max_epochs=20` reached.
`Trainer.fit` stopped: `max_epochs=20` reached.
[I 2026-04-12 14:11:47,833] Trial 20 finished with value: 0.1906 and parameters: {'left_wall_dist_num_layers': 2, 'left_wall_dist_activation': 'elu', 'left_wall_dist_out_channels_l0': 43, 'left_wall_dist_pool_size_l0': 8, 'left_wall_dist_out_channels_l1': 34, 'left_wall_dist_pool_size_l1': 2, 'left_wall_dist_fc_hidden': 84, 'track_width_num_layers': 5, 'track_width_activation': 'elu', 'track_width_out_channels_l0': 58, 'track_width_pool_size_l0': 8, 'track_width_out_channels_l1': 251, 'track_width_pool_size_l1': 4, 'track_width_out_channels_l2': 133, 'track_width_pool_size_l2': 4, 'track_width_out_channels_l3': 115, 'track_width_pool_size_l3': 2, 'track_width_fc_hidden': 48, 'heading_error_num_layers': 4, 'heading_error_activation': 'elu', 'heading_error_out_channels_l0': 43, 'heading_error_pool_size_l0': 8, 'heading_error_out_channels_l1': 120, 'heading_error_pool_size_l1': 8, 'heading_error_out_channels_l2': 137, 'heading_error_pool_size_l2': 2, 'heading_error_out_channels_l3': 159, 'heading_error_pool_size_l3': 2, 'heading_error_fc_hidden': 43}. Best is trial 12 with value: 0.1113.
[rank: 0] Seed set to 42
GPU available: True (cuda), used: True
TPU available: False, using: 0 TPU cores
💡 Tip: For seamless cloud logging and experiment tracking, try installing [litlogger](https://pypi.org/project/litlogger/) to enable LitLogger, which logs metrics and artifacts automatically to the Lightning Experiments platform.
[rank: 0] Seed set to 42
[rank: 0] Seed set to 42
GPU available: True (cuda), used: True
TPU available: False, using: 0 TPU cores
💡 Tip: For seamless cloud logging and experiment tracking, try installing [litlogger](https://pypi.org/project/litlogger/) to enable LitLogger, which logs metrics and artifacts automatically to the Lightning Experiments platform.
GPU available: True (cuda), used: True
TPU available: False, using: 0 TPU cores
💡 Tip: For seamless cloud logging and experiment tracking, try installing [litlogger](https://pypi.org/project/litlogger/) to enable LitLogger, which logs metrics and artifacts automatically to the Lightning Experiments platform.
LOCAL_RANK: 0 - CUDA_VISIBLE_DEVICES: [0]
LOCAL_RANK: 0 - CUDA_VISIBLE_DEVICES: [0]
LOCAL_RANK: 0 - CUDA_VISIBLE_DEVICES: [0]
SLURM auto-requeueing enabled. Setting signal handlers.
SLURM auto-requeueing enabled. Setting signal handlers.
SLURM auto-requeueing enabled. Setting signal handlers.
`Trainer.fit` stopped: `max_epochs=20` reached.
`Trainer.fit` stopped: `max_epochs=20` reached.
`Trainer.fit` stopped: `max_epochs=20` reached.
[I 2026-04-12 14:13:59,618] Trial 21 finished with value: 0.1142 and parameters: {'left_wall_dist_num_layers': 2, 'left_wall_dist_activation': 'elu', 'left_wall_dist_out_channels_l0': 251, 'left_wall_dist_pool_size_l0': 8, 'left_wall_dist_out_channels_l1': 145, 'left_wall_dist_pool_size_l1': 4, 'left_wall_dist_fc_hidden': 93, 'track_width_num_layers': 4, 'track_width_activation': 'elu', 'track_width_out_channels_l0': 249, 'track_width_pool_size_l0': 4, 'track_width_out_channels_l1': 48, 'track_width_pool_size_l1': 4, 'track_width_out_channels_l2': 71, 'track_width_pool_size_l2': 4, 'track_width_out_channels_l3': 254, 'track_width_pool_size_l3': 2, 'track_width_fc_hidden': 60, 'heading_error_num_layers': 4, 'heading_error_activation': 'elu', 'heading_error_out_channels_l0': 72, 'heading_error_pool_size_l0': 2, 'heading_error_out_channels_l1': 163, 'heading_error_pool_size_l1': 8, 'heading_error_out_channels_l2': 65, 'heading_error_pool_size_l2': 2, 'heading_error_out_channels_l3': 105, 'heading_error_pool_size_l3': 2, 'heading_error_fc_hidden': 71}. Best is trial 12 with value: 0.1113.
[rank: 0] Seed set to 42
GPU available: True (cuda), used: True
TPU available: False, using: 0 TPU cores
💡 Tip: For seamless cloud logging and experiment tracking, try installing [litlogger](https://pypi.org/project/litlogger/) to enable LitLogger, which logs metrics and artifacts automatically to the Lightning Experiments platform.
[rank: 0] Seed set to 42
GPU available: True (cuda), used: True
TPU available: False, using: 0 TPU cores
💡 Tip: For seamless cloud logging and experiment tracking, try installing [litlogger](https://pypi.org/project/litlogger/) to enable LitLogger, which logs metrics and artifacts automatically to the Lightning Experiments platform.
[rank: 0] Seed set to 42
LOCAL_RANK: 0 - CUDA_VISIBLE_DEVICES: [0]
GPU available: True (cuda), used: True
TPU available: False, using: 0 TPU cores
💡 Tip: For seamless cloud logging and experiment tracking, try installing [litlogger](https://pypi.org/project/litlogger/) to enable LitLogger, which logs metrics and artifacts automatically to the Lightning Experiments platform.
LOCAL_RANK: 0 - CUDA_VISIBLE_DEVICES: [0]
SLURM auto-requeueing enabled. Setting signal handlers.
SLURM auto-requeueing enabled. Setting signal handlers.
LOCAL_RANK: 0 - CUDA_VISIBLE_DEVICES: [0]
SLURM auto-requeueing enabled. Setting signal handlers.
`Trainer.fit` stopped: `max_epochs=20` reached.
`Trainer.fit` stopped: `max_epochs=20` reached.
`Trainer.fit` stopped: `max_epochs=20` reached.
