[I 2026-04-12 15:40:33,471] Trial 57 finished with value: 0.1276 and parameters: {'left_wall_dist_num_layers': 2, 'left_wall_dist_activation': 'relu', 'left_wall_dist_out_channels_l0': 68, 'left_wall_dist_pool_size_l0': 8, 'left_wall_dist_out_channels_l1': 45, 'left_wall_dist_pool_size_l1': 8, 'left_wall_dist_fc_hidden': 113, 'track_width_num_layers': 4, 'track_width_activation': 'relu', 'track_width_out_channels_l0': 216, 'track_width_pool_size_l0': 2, 'track_width_out_channels_l1': 35, 'track_width_pool_size_l1': 4, 'track_width_out_channels_l2': 88, 'track_width_pool_size_l2': 4, 'track_width_out_channels_l3': 53, 'track_width_pool_size_l3': 2, 'track_width_fc_hidden': 46, 'heading_error_num_layers': 4, 'heading_error_activation': 'elu', 'heading_error_out_channels_l0': 58, 'heading_error_pool_size_l0': 8, 'heading_error_out_channels_l1': 145, 'heading_error_pool_size_l1': 2, 'heading_error_out_channels_l2': 66, 'heading_error_pool_size_l2': 4, 'heading_error_out_channels_l3': 73, 'heading_error_pool_size_l3': 4, 'heading_error_fc_hidden': 40}. Best is trial 7 with value: 0.1063.
[rank: 0] Seed set to 42
[rank: 0] Seed set to 42
[rank: 0] Seed set to 42
GPU available: True (cuda), used: True
TPU available: False, using: 0 TPU cores
💡 Tip: For seamless cloud logging and experiment tracking, try installing [litlogger](https://pypi.org/project/litlogger/) to enable LitLogger, which logs metrics and artifacts automatically to the Lightning Experiments platform.
GPU available: True (cuda), used: True
TPU available: False, using: 0 TPU cores
💡 Tip: For seamless cloud logging and experiment tracking, try installing [litlogger](https://pypi.org/project/litlogger/) to enable LitLogger, which logs metrics and artifacts automatically to the Lightning Experiments platform.
GPU available: True (cuda), used: True
TPU available: False, using: 0 TPU cores
💡 Tip: For seamless cloud logging and experiment tracking, try installing [litlogger](https://pypi.org/project/litlogger/) to enable LitLogger, which logs metrics and artifacts automatically to the Lightning Experiments platform.
LOCAL_RANK: 0 - CUDA_VISIBLE_DEVICES: [0]
LOCAL_RANK: 0 - CUDA_VISIBLE_DEVICES: [0]
LOCAL_RANK: 0 - CUDA_VISIBLE_DEVICES: [0]
SLURM auto-requeueing enabled. Setting signal handlers.
SLURM auto-requeueing enabled. Setting signal handlers.
SLURM auto-requeueing enabled. Setting signal handlers.
`Trainer.fit` stopped: `max_epochs=20` reached.
`Trainer.fit` stopped: `max_epochs=20` reached.
`Trainer.fit` stopped: `max_epochs=20` reached.
[I 2026-04-12 15:42:48,760] Trial 58 finished with value: 0.1315 and parameters: {'left_wall_dist_num_layers': 3, 'left_wall_dist_activation': 'relu', 'left_wall_dist_out_channels_l0': 57, 'left_wall_dist_pool_size_l0': 8, 'left_wall_dist_out_channels_l1': 237, 'left_wall_dist_pool_size_l1': 8, 'left_wall_dist_out_channels_l2': 142, 'left_wall_dist_pool_size_l2': 2, 'left_wall_dist_fc_hidden': 120, 'track_width_num_layers': 4, 'track_width_activation': 'relu', 'track_width_out_channels_l0': 41, 'track_width_pool_size_l0': 2, 'track_width_out_channels_l1': 115, 'track_width_pool_size_l1': 4, 'track_width_out_channels_l2': 101, 'track_width_pool_size_l2': 8, 'track_width_out_channels_l3': 45, 'track_width_pool_size_l3': 2, 'track_width_fc_hidden': 43, 'heading_error_num_layers': 2, 'heading_error_activation': 'elu', 'heading_error_out_channels_l0': 37, 'heading_error_pool_size_l0': 2, 'heading_error_out_channels_l1': 32, 'heading_error_pool_size_l1': 8, 'heading_error_fc_hidden': 46}. Best is trial 7 with value: 0.1063.
[rank: 0] Seed set to 42
[rank: 0] Seed set to 42
[rank: 0] Seed set to 42
GPU available: True (cuda), used: True
TPU available: False, using: 0 TPU cores
💡 Tip: For seamless cloud logging and experiment tracking, try installing [litlogger](https://pypi.org/project/litlogger/) to enable LitLogger, which logs metrics and artifacts automatically to the Lightning Experiments platform.
GPU available: True (cuda), used: True
GPU available: True (cuda), used: True
TPU available: False, using: 0 TPU cores
TPU available: False, using: 0 TPU cores
💡 Tip: For seamless cloud logging and experiment tracking, try installing [litlogger](https://pypi.org/project/litlogger/) to enable LitLogger, which logs metrics and artifacts automatically to the Lightning Experiments platform.
💡 Tip: For seamless cloud logging and experiment tracking, try installing [litlogger](https://pypi.org/project/litlogger/) to enable LitLogger, which logs metrics and artifacts automatically to the Lightning Experiments platform.
LOCAL_RANK: 0 - CUDA_VISIBLE_DEVICES: [0]
LOCAL_RANK: 0 - CUDA_VISIBLE_DEVICES: [0]
LOCAL_RANK: 0 - CUDA_VISIBLE_DEVICES: [0]
SLURM auto-requeueing enabled. Setting signal handlers.
SLURM auto-requeueing enabled. Setting signal handlers.
SLURM auto-requeueing enabled. Setting signal handlers.
`Trainer.fit` stopped: `max_epochs=20` reached.
`Trainer.fit` stopped: `max_epochs=20` reached.
`Trainer.fit` stopped: `max_epochs=20` reached.
[I 2026-04-12 15:45:21,734] Trial 59 finished with value: 0.1714 and parameters: {'left_wall_dist_num_layers': 2, 'left_wall_dist_activation': 'relu', 'left_wall_dist_out_channels_l0': 144, 'left_wall_dist_pool_size_l0': 8, 'left_wall_dist_out_channels_l1': 75, 'left_wall_dist_pool_size_l1': 8, 'left_wall_dist_fc_hidden': 102, 'track_width_num_layers': 4, 'track_width_activation': 'relu', 'track_width_out_channels_l0': 47, 'track_width_pool_size_l0': 8, 'track_width_out_channels_l1': 229, 'track_width_pool_size_l1': 4, 'track_width_out_channels_l2': 51, 'track_width_pool_size_l2': 8, 'track_width_out_channels_l3': 40, 'track_width_pool_size_l3': 8, 'heading_error_num_layers': 5, 'heading_error_activation': 'elu', 'heading_error_out_channels_l0': 47, 'heading_error_pool_size_l0': 2, 'heading_error_out_channels_l1': 200, 'heading_error_pool_size_l1': 8, 'heading_error_out_channels_l2': 45, 'heading_error_pool_size_l2': 4, 'heading_error_out_channels_l3': 80, 'heading_error_pool_size_l3': 4, 'heading_error_out_channels_l4': 209, 'heading_error_pool_size_l4': 4}. Best is trial 7 with value: 0.1063.
[rank: 0] Seed set to 42
[rank: 0] Seed set to 42
[rank: 0] Seed set to 42
GPU available: True (cuda), used: True
TPU available: False, using: 0 TPU cores
GPU available: True (cuda), used: True
TPU available: False, using: 0 TPU cores
💡 Tip: For seamless cloud logging and experiment tracking, try installing [litlogger](https://pypi.org/project/litlogger/) to enable LitLogger, which logs metrics and artifacts automatically to the Lightning Experiments platform.
GPU available: True (cuda), used: True
TPU available: False, using: 0 TPU cores
💡 Tip: For seamless cloud logging and experiment tracking, try installing [litlogger](https://pypi.org/project/litlogger/) to enable LitLogger, which logs metrics and artifacts automatically to the Lightning Experiments platform.
💡 Tip: For seamless cloud logging and experiment tracking, try installing [litlogger](https://pypi.org/project/litlogger/) to enable LitLogger, which logs metrics and artifacts automatically to the Lightning Experiments platform.
LOCAL_RANK: 0 - CUDA_VISIBLE_DEVICES: [0]
LOCAL_RANK: 0 - CUDA_VISIBLE_DEVICES: [0]
LOCAL_RANK: 0 - CUDA_VISIBLE_DEVICES: [0]
SLURM auto-requeueing enabled. Setting signal handlers.
SLURM auto-requeueing enabled. Setting signal handlers.
SLURM auto-requeueing enabled. Setting signal handlers.
`Trainer.fit` stopped: `max_epochs=20` reached.
`Trainer.fit` stopped: `max_epochs=20` reached.
`Trainer.fit` stopped: `max_epochs=20` reached.
[I 2026-04-12 15:47:51,314] Trial 60 finished with value: 0.2253 and parameters: {'left_wall_dist_num_layers': 5, 'left_wall_dist_activation': 'relu', 'left_wall_dist_out_channels_l0': 92, 'left_wall_dist_pool_size_l0': 4, 'left_wall_dist_out_channels_l1': 63, 'left_wall_dist_pool_size_l1': 8, 'left_wall_dist_out_channels_l2': 77, 'left_wall_dist_pool_size_l2': 2, 'left_wall_dist_out_channels_l3': 53, 'left_wall_dist_pool_size_l3': 2, 'left_wall_dist_out_channels_l4': 205, 'left_wall_dist_pool_size_l4': 4, 'track_width_num_layers': 4, 'track_width_activation': 'relu', 'track_width_out_channels_l0': 38, 'track_width_pool_size_l0': 2, 'track_width_out_channels_l1': 98, 'track_width_pool_size_l1': 4, 'track_width_out_channels_l2': 54, 'track_width_pool_size_l2': 2, 'track_width_out_channels_l3': 180, 'track_width_pool_size_l3': 4, 'track_width_fc_hidden': 51, 'heading_error_num_layers': 3, 'heading_error_activation': 'relu', 'heading_error_out_channels_l0': 43, 'heading_error_pool_size_l0': 4, 'heading_error_out_channels_l1': 231, 'heading_error_pool_size_l1': 4, 'heading_error_out_channels_l2': 57, 'heading_error_pool_size_l2': 8, 'heading_error_fc_hidden': 63}. Best is trial 7 with value: 0.1063.
[rank: 0] Seed set to 42
[rank: 0] Seed set to 42
[rank: 0] Seed set to 42
GPU available: True (cuda), used: True
TPU available: False, using: 0 TPU cores
GPU available: True (cuda), used: True
TPU available: False, using: 0 TPU cores
💡 Tip: For seamless cloud logging and experiment tracking, try installing [litlogger](https://pypi.org/project/litlogger/) to enable LitLogger, which logs metrics and artifacts automatically to the Lightning Experiments platform.
💡 Tip: For seamless cloud logging and experiment tracking, try installing [litlogger](https://pypi.org/project/litlogger/) to enable LitLogger, which logs metrics and artifacts automatically to the Lightning Experiments platform.
GPU available: True (cuda), used: True
TPU available: False, using: 0 TPU cores
💡 Tip: For seamless cloud logging and experiment tracking, try installing [litlogger](https://pypi.org/project/litlogger/) to enable LitLogger, which logs metrics and artifacts automatically to the Lightning Experiments platform.
LOCAL_RANK: 0 - CUDA_VISIBLE_DEVICES: [0]
LOCAL_RANK: 0 - CUDA_VISIBLE_DEVICES: [0]
LOCAL_RANK: 0 - CUDA_VISIBLE_DEVICES: [0]
SLURM auto-requeueing enabled. Setting signal handlers.
SLURM auto-requeueing enabled. Setting signal handlers.
SLURM auto-requeueing enabled. Setting signal handlers.
`Trainer.fit` stopped: `max_epochs=20` reached.
`Trainer.fit` stopped: `max_epochs=20` reached.
`Trainer.fit` stopped: `max_epochs=20` reached.
[I 2026-04-12 15:50:15,456] Trial 61 finished with value: 0.125 and parameters: {'left_wall_dist_num_layers': 2, 'left_wall_dist_activation': 'relu', 'left_wall_dist_out_channels_l0': 75, 'left_wall_dist_pool_size_l0': 8, 'left_wall_dist_out_channels_l1': 122, 'left_wall_dist_pool_size_l1': 8, 'left_wall_dist_fc_hidden': 111, 'track_width_num_layers': 4, 'track_width_activation': 'relu', 'track_width_out_channels_l0': 44, 'track_width_pool_size_l0': 2, 'track_width_out_channels_l1': 51, 'track_width_pool_size_l1': 4, 'track_width_out_channels_l2': 137, 'track_width_pool_size_l2': 8, 'track_width_out_channels_l3': 67, 'track_width_pool_size_l3': 2, 'track_width_fc_hidden': 35, 'heading_error_num_layers': 5, 'heading_error_activation': 'elu', 'heading_error_out_channels_l0': 71, 'heading_error_pool_size_l0': 2, 'heading_error_out_channels_l1': 210, 'heading_error_pool_size_l1': 8, 'heading_error_out_channels_l2': 129, 'heading_error_pool_size_l2': 4, 'heading_error_out_channels_l3': 86, 'heading_error_pool_size_l3': 4, 'heading_error_out_channels_l4': 142, 'heading_error_pool_size_l4': 4}. Best is trial 7 with value: 0.1063.
[rank: 0] Seed set to 42
[rank: 0] Seed set to 42
[rank: 0] Seed set to 42
GPU available: True (cuda), used: True
TPU available: False, using: 0 TPU cores
GPU available: True (cuda), used: True
TPU available: False, using: 0 TPU cores
💡 Tip: For seamless cloud logging and experiment tracking, try installing [litlogger](https://pypi.org/project/litlogger/) to enable LitLogger, which logs metrics and artifacts automatically to the Lightning Experiments platform.
💡 Tip: For seamless cloud logging and experiment tracking, try installing [litlogger](https://pypi.org/project/litlogger/) to enable LitLogger, which logs metrics and artifacts automatically to the Lightning Experiments platform.
GPU available: True (cuda), used: True
TPU available: False, using: 0 TPU cores
💡 Tip: For seamless cloud logging and experiment tracking, try installing [litlogger](https://pypi.org/project/litlogger/) to enable LitLogger, which logs metrics and artifacts automatically to the Lightning Experiments platform.
LOCAL_RANK: 0 - CUDA_VISIBLE_DEVICES: [0]
LOCAL_RANK: 0 - CUDA_VISIBLE_DEVICES: [0]
LOCAL_RANK: 0 - CUDA_VISIBLE_DEVICES: [0]
SLURM auto-requeueing enabled. Setting signal handlers.
SLURM auto-requeueing enabled. Setting signal handlers.
SLURM auto-requeueing enabled. Setting signal handlers.
`Trainer.fit` stopped: `max_epochs=20` reached.
`Trainer.fit` stopped: `max_epochs=20` reached.
`Trainer.fit` stopped: `max_epochs=20` reached.
[I 2026-04-12 15:52:35,933] Trial 62 finished with value: 0.1153 and parameters: {'left_wall_dist_num_layers': 2, 'left_wall_dist_activation': 'relu', 'left_wall_dist_out_channels_l0': 83, 'left_wall_dist_pool_size_l0': 8, 'left_wall_dist_out_channels_l1': 198, 'left_wall_dist_pool_size_l1': 8, 'left_wall_dist_fc_hidden': 107, 'track_width_num_layers': 4, 'track_width_activation': 'relu', 'track_width_out_channels_l0': 35, 'track_width_pool_size_l0': 2, 'track_width_out_channels_l1': 43, 'track_width_pool_size_l1': 4, 'track_width_out_channels_l2': 70, 'track_width_pool_size_l2': 8, 'track_width_out_channels_l3': 56, 'track_width_pool_size_l3': 2, 'track_width_fc_hidden': 37, 'heading_error_num_layers': 5, 'heading_error_activation': 'elu', 'heading_error_out_channels_l0': 40, 'heading_error_pool_size_l0': 2, 'heading_error_out_channels_l1': 186, 'heading_error_pool_size_l1': 8, 'heading_error_out_channels_l2': 92, 'heading_error_pool_size_l2': 4, 'heading_error_out_channels_l3': 125, 'heading_error_pool_size_l3': 4, 'heading_error_out_channels_l4': 118, 'heading_error_pool_size_l4': 4}. Best is trial 7 with value: 0.1063.
[rank: 0] Seed set to 42
[rank: 0] Seed set to 42
[rank: 0] Seed set to 42
GPU available: True (cuda), used: True
TPU available: False, using: 0 TPU cores
💡 Tip: For seamless cloud logging and experiment tracking, try installing [litlogger](https://pypi.org/project/litlogger/) to enable LitLogger, which logs metrics and artifacts automatically to the Lightning Experiments platform.
GPU available: True (cuda), used: True
TPU available: False, using: 0 TPU cores
GPU available: True (cuda), used: True
TPU available: False, using: 0 TPU cores
💡 Tip: For seamless cloud logging and experiment tracking, try installing [litlogger](https://pypi.org/project/litlogger/) to enable LitLogger, which logs metrics and artifacts automatically to the Lightning Experiments platform.
💡 Tip: For seamless cloud logging and experiment tracking, try installing [litlogger](https://pypi.org/project/litlogger/) to enable LitLogger, which logs metrics and artifacts automatically to the Lightning Experiments platform.
LOCAL_RANK: 0 - CUDA_VISIBLE_DEVICES: [0]
LOCAL_RANK: 0 - CUDA_VISIBLE_DEVICES: [0]
LOCAL_RANK: 0 - CUDA_VISIBLE_DEVICES: [0]
SLURM auto-requeueing enabled. Setting signal handlers.
SLURM auto-requeueing enabled. Setting signal handlers.
SLURM auto-requeueing enabled. Setting signal handlers.
`Trainer.fit` stopped: `max_epochs=20` reached.
`Trainer.fit` stopped: `max_epochs=20` reached.
`Trainer.fit` stopped: `max_epochs=20` reached.
[I 2026-04-12 15:54:59,778] Trial 63 finished with value: 0.11 and parameters: {'left_wall_dist_num_layers': 2, 'left_wall_dist_activation': 'relu', 'left_wall_dist_out_channels_l0': 85, 'left_wall_dist_pool_size_l0': 8, 'left_wall_dist_out_channels_l1': 200, 'left_wall_dist_pool_size_l1': 8, 'left_wall_dist_fc_hidden': 106, 'track_width_num_layers': 4, 'track_width_activation': 'relu', 'track_width_out_channels_l0': 35, 'track_width_pool_size_l0': 2, 'track_width_out_channels_l1': 42, 'track_width_pool_size_l1': 4, 'track_width_out_channels_l2': 69, 'track_width_pool_size_l2': 8, 'track_width_out_channels_l3': 50, 'track_width_pool_size_l3': 2, 'track_width_fc_hidden': 38, 'heading_error_num_layers': 5, 'heading_error_activation': 'elu', 'heading_error_out_channels_l0': 35, 'heading_error_pool_size_l0': 2, 'heading_error_out_channels_l1': 184, 'heading_error_pool_size_l1': 8, 'heading_error_out_channels_l2': 91, 'heading_error_pool_size_l2': 4, 'heading_error_out_channels_l3': 94, 'heading_error_pool_size_l3': 4, 'heading_error_out_channels_l4': 106, 'heading_error_pool_size_l4': 4}. Best is trial 7 with value: 0.1063.
[rank: 0] Seed set to 42
[rank: 0] Seed set to 42
[rank: 0] Seed set to 42
GPU available: True (cuda), used: True
TPU available: False, using: 0 TPU cores
💡 Tip: For seamless cloud logging and experiment tracking, try installing [litlogger](https://pypi.org/project/litlogger/) to enable LitLogger, which logs metrics and artifacts automatically to the Lightning Experiments platform.
GPU available: True (cuda), used: True
TPU available: False, using: 0 TPU cores
💡 Tip: For seamless cloud logging and experiment tracking, try installing [litlogger](https://pypi.org/project/litlogger/) to enable LitLogger, which logs metrics and artifacts automatically to the Lightning Experiments platform.
GPU available: True (cuda), used: True
TPU available: False, using: 0 TPU cores
💡 Tip: For seamless cloud logging and experiment tracking, try installing [litlogger](https://pypi.org/project/litlogger/) to enable LitLogger, which logs metrics and artifacts automatically to the Lightning Experiments platform.
LOCAL_RANK: 0 - CUDA_VISIBLE_DEVICES: [0]
LOCAL_RANK: 0 - CUDA_VISIBLE_DEVICES: [0]
LOCAL_RANK: 0 - CUDA_VISIBLE_DEVICES: [0]
SLURM auto-requeueing enabled. Setting signal handlers.
SLURM auto-requeueing enabled. Setting signal handlers.
SLURM auto-requeueing enabled. Setting signal handlers.
`Trainer.fit` stopped: `max_epochs=20` reached.
`Trainer.fit` stopped: `max_epochs=20` reached.
`Trainer.fit` stopped: `max_epochs=20` reached.
[I 2026-04-12 15:57:18,345] Trial 64 finished with value: 0.1458 and parameters: {'left_wall_dist_num_layers': 2, 'left_wall_dist_activation': 'relu', 'left_wall_dist_out_channels_l0': 83, 'left_wall_dist_pool_size_l0': 8, 'left_wall_dist_out_channels_l1': 187, 'left_wall_dist_pool_size_l1': 8, 'left_wall_dist_fc_hidden': 118, 'track_width_num_layers': 4, 'track_width_activation': 'relu', 'track_width_out_channels_l0': 34, 'track_width_pool_size_l0': 2, 'track_width_out_channels_l1': 43, 'track_width_pool_size_l1': 4, 'track_width_out_channels_l2': 68, 'track_width_pool_size_l2': 8, 'track_width_out_channels_l3': 55, 'track_width_pool_size_l3': 2, 'track_width_fc_hidden': 61, 'heading_error_num_layers': 5, 'heading_error_activation': 'elu', 'heading_error_out_channels_l0': 36, 'heading_error_pool_size_l0': 2, 'heading_error_out_channels_l1': 163, 'heading_error_pool_size_l1': 8, 'heading_error_out_channels_l2': 90, 'heading_error_pool_size_l2': 4, 'heading_error_out_channels_l3': 97, 'heading_error_pool_size_l3': 4, 'heading_error_out_channels_l4': 144, 'heading_error_pool_size_l4': 4}. Best is trial 7 with value: 0.1063.
[rank: 0] Seed set to 42
[rank: 0] Seed set to 42
[rank: 0] Seed set to 42
GPU available: True (cuda), used: True
TPU available: False, using: 0 TPU cores
💡 Tip: For seamless cloud logging and experiment tracking, try installing [litlogger](https://pypi.org/project/litlogger/) to enable LitLogger, which logs metrics and artifacts automatically to the Lightning Experiments platform.
GPU available: True (cuda), used: True
TPU available: False, using: 0 TPU cores
💡 Tip: For seamless cloud logging and experiment tracking, try installing [litlogger](https://pypi.org/project/litlogger/) to enable LitLogger, which logs metrics and artifacts automatically to the Lightning Experiments platform.
GPU available: True (cuda), used: True
TPU available: False, using: 0 TPU cores
💡 Tip: For seamless cloud logging and experiment tracking, try installing [litlogger](https://pypi.org/project/litlogger/) to enable LitLogger, which logs metrics and artifacts automatically to the Lightning Experiments platform.
LOCAL_RANK: 0 - CUDA_VISIBLE_DEVICES: [0]
LOCAL_RANK: 0 - CUDA_VISIBLE_DEVICES: [0]
LOCAL_RANK: 0 - CUDA_VISIBLE_DEVICES: [0]
SLURM auto-requeueing enabled. Setting signal handlers.
SLURM auto-requeueing enabled. Setting signal handlers.
SLURM auto-requeueing enabled. Setting signal handlers.
`Trainer.fit` stopped: `max_epochs=20` reached.
`Trainer.fit` stopped: `max_epochs=20` reached.
`Trainer.fit` stopped: `max_epochs=20` reached.
