[I 2026-05-22 01:48:23,041] Trial 102 finished with value: 0.044051906140032376 and parameters: {'optimizer': 'adamw', 'num_layers': 1, 'activation': 'elu', 'fc_layers': 'fc128_64', 'pool_size_l0': 2, 'out_channels_l0': 16}. Best is trial 86 with value: 0.044051906140032376.
W0522 01:48:32.831000 2656855 .venv/lib/python3.12/site-packages/torch/utils/_pytree.py:630] <enum 'KernelPreference'> is an Enum subclass and is now natively supported by torch.compile as an opaque value type. Calling register_constant() on Enum subclasses is deprecated and will be an error in a future release.
[rank: 0] Seed set to 42
GPU available: True (cuda), used: True
TPU available: False, using: 0 TPU cores
💡 Tip: For seamless cloud logging and experiment tracking, try installing [litlogger](https://pypi.org/project/litlogger/) to enable LitLogger, which logs metrics and artifacts automatically to the Lightning Experiments platform.
LOCAL_RANK: 0 - CUDA_VISIBLE_DEVICES: [0]
SLURM auto-requeueing enabled. Setting signal handlers.
`Trainer.fit` stopped: `max_epochs=30` reached.
[I 2026-05-22 01:48:49,672] Trial 107 finished with value: 0.02994943026957835 and parameters: {'optimizer': 'adam', 'num_layers': 2, 'activation': 'relu', 'fc_layers': 'fc128', 'pool_size_l0': 4, 'out_channels_l0': 8, 'pool_size_l1': 2, 'out_channels_l1': 32}. Best is trial 38 with value: 0.027702430610653885.
`Trainer.fit` stopped: `max_epochs=30` reached.
[I 2026-05-22 01:48:59,322] Trial 105 finished with value: 0.022097016566148542 and parameters: {'optimizer': 'adamw', 'num_layers': 1, 'activation': 'elu', 'fc_layers': 'fc128_64', 'pool_size_l0': 2, 'out_channels_l0': 16}. Best is trial 9 with value: 0.022097016566148542.
W0522 01:49:00.277000 2656946 .venv/lib/python3.12/site-packages/torch/utils/_pytree.py:630] <enum 'KernelPreference'> is an Enum subclass and is now natively supported by torch.compile as an opaque value type. Calling register_constant() on Enum subclasses is deprecated and will be an error in a future release.
[rank: 0] Seed set to 42
GPU available: True (cuda), used: True
TPU available: False, using: 0 TPU cores
💡 Tip: For seamless cloud logging and experiment tracking, try installing [litlogger](https://pypi.org/project/litlogger/) to enable LitLogger, which logs metrics and artifacts automatically to the Lightning Experiments platform.
LOCAL_RANK: 0 - CUDA_VISIBLE_DEVICES: [0]
SLURM auto-requeueing enabled. Setting signal handlers.
W0522 01:49:09.134000 2656951 .venv/lib/python3.12/site-packages/torch/utils/_pytree.py:630] <enum 'KernelPreference'> is an Enum subclass and is now natively supported by torch.compile as an opaque value type. Calling register_constant() on Enum subclasses is deprecated and will be an error in a future release.
[rank: 0] Seed set to 42
GPU available: True (cuda), used: True
TPU available: False, using: 0 TPU cores
💡 Tip: For seamless cloud logging and experiment tracking, try installing [litlogger](https://pypi.org/project/litlogger/) to enable LitLogger, which logs metrics and artifacts automatically to the Lightning Experiments platform.
LOCAL_RANK: 0 - CUDA_VISIBLE_DEVICES: [0]
SLURM auto-requeueing enabled. Setting signal handlers.
`Trainer.fit` stopped: `max_epochs=30` reached.
[I 2026-05-22 01:49:16,044] Trial 103 finished with value: 0.044051906140032376 and parameters: {'optimizer': 'adamw', 'num_layers': 1, 'activation': 'elu', 'fc_layers': 'fc128_64', 'pool_size_l0': 2, 'out_channels_l0': 16}. Best is trial 86 with value: 0.044051906140032376.
W0522 01:49:26.317000 2657102 .venv/lib/python3.12/site-packages/torch/utils/_pytree.py:630] <enum 'KernelPreference'> is an Enum subclass and is now natively supported by torch.compile as an opaque value type. Calling register_constant() on Enum subclasses is deprecated and will be an error in a future release.
[rank: 0] Seed set to 42
GPU available: True (cuda), used: True
TPU available: False, using: 0 TPU cores
💡 Tip: For seamless cloud logging and experiment tracking, try installing [litlogger](https://pypi.org/project/litlogger/) to enable LitLogger, which logs metrics and artifacts automatically to the Lightning Experiments platform.
LOCAL_RANK: 0 - CUDA_VISIBLE_DEVICES: [0]
SLURM auto-requeueing enabled. Setting signal handlers.
`Trainer.fit` stopped: `max_epochs=30` reached.
[I 2026-05-22 01:49:50,802] Trial 108 finished with value: 0.030315197782922725 and parameters: {'optimizer': 'adam', 'num_layers': 2, 'activation': 'relu', 'fc_layers': 'fc32', 'pool_size_l0': 2, 'out_channels_l0': 8, 'pool_size_l1': 3, 'out_channels_l1': 32}. Best is trial 38 with value: 0.027702430610653885.
`Trainer.fit` stopped: `max_epochs=30` reached.
[I 2026-05-22 01:49:59,853] Trial 106 finished with value: 0.022097016566148542 and parameters: {'optimizer': 'adamw', 'num_layers': 1, 'activation': 'elu', 'fc_layers': 'fc128_64', 'pool_size_l0': 2, 'out_channels_l0': 16}. Best is trial 9 with value: 0.022097016566148542.
W0522 01:50:01.100000 2657195 .venv/lib/python3.12/site-packages/torch/utils/_pytree.py:630] <enum 'KernelPreference'> is an Enum subclass and is now natively supported by torch.compile as an opaque value type. Calling register_constant() on Enum subclasses is deprecated and will be an error in a future release.
[rank: 0] Seed set to 42
GPU available: True (cuda), used: True
TPU available: False, using: 0 TPU cores
💡 Tip: For seamless cloud logging and experiment tracking, try installing [litlogger](https://pypi.org/project/litlogger/) to enable LitLogger, which logs metrics and artifacts automatically to the Lightning Experiments platform.
LOCAL_RANK: 0 - CUDA_VISIBLE_DEVICES: [0]
SLURM auto-requeueing enabled. Setting signal handlers.
W0522 01:50:09.423000 2657200 .venv/lib/python3.12/site-packages/torch/utils/_pytree.py:630] <enum 'KernelPreference'> is an Enum subclass and is now natively supported by torch.compile as an opaque value type. Calling register_constant() on Enum subclasses is deprecated and will be an error in a future release.
`Trainer.fit` stopped: `max_epochs=30` reached.
[rank: 0] Seed set to 42
GPU available: True (cuda), used: True
TPU available: False, using: 0 TPU cores
💡 Tip: For seamless cloud logging and experiment tracking, try installing [litlogger](https://pypi.org/project/litlogger/) to enable LitLogger, which logs metrics and artifacts automatically to the Lightning Experiments platform.
LOCAL_RANK: 0 - CUDA_VISIBLE_DEVICES: [0]
SLURM auto-requeueing enabled. Setting signal handlers.
[I 2026-05-22 01:50:13,605] Trial 104 finished with value: 0.044051906140032376 and parameters: {'optimizer': 'adamw', 'num_layers': 1, 'activation': 'elu', 'fc_layers': 'fc128_64', 'pool_size_l0': 2, 'out_channels_l0': 16}. Best is trial 86 with value: 0.044051906140032376.
W0522 01:50:22.712000 2657351 .venv/lib/python3.12/site-packages/torch/utils/_pytree.py:630] <enum 'KernelPreference'> is an Enum subclass and is now natively supported by torch.compile as an opaque value type. Calling register_constant() on Enum subclasses is deprecated and will be an error in a future release.
[rank: 0] Seed set to 42
GPU available: True (cuda), used: True
TPU available: False, using: 0 TPU cores
💡 Tip: For seamless cloud logging and experiment tracking, try installing [litlogger](https://pypi.org/project/litlogger/) to enable LitLogger, which logs metrics and artifacts automatically to the Lightning Experiments platform.
LOCAL_RANK: 0 - CUDA_VISIBLE_DEVICES: [0]
SLURM auto-requeueing enabled. Setting signal handlers.
`Trainer.fit` stopped: `max_epochs=30` reached.
[I 2026-05-22 01:50:47,816] Trial 109 finished with value: 0.027548411443658997 and parameters: {'optimizer': 'adam', 'num_layers': 2, 'activation': 'relu', 'fc_layers': 'fc128', 'pool_size_l0': 4, 'out_channels_l0': 16, 'pool_size_l1': 2, 'out_channels_l1': 32}. Best is trial 109 with value: 0.027548411443658997.
`Trainer.fit` stopped: `max_epochs=30` reached.
W0522 01:50:57.309000 2657441 .venv/lib/python3.12/site-packages/torch/utils/_pytree.py:630] <enum 'KernelPreference'> is an Enum subclass and is now natively supported by torch.compile as an opaque value type. Calling register_constant() on Enum subclasses is deprecated and will be an error in a future release.
[rank: 0] Seed set to 42
GPU available: True (cuda), used: True
TPU available: False, using: 0 TPU cores
💡 Tip: For seamless cloud logging and experiment tracking, try installing [litlogger](https://pypi.org/project/litlogger/) to enable LitLogger, which logs metrics and artifacts automatically to the Lightning Experiments platform.
LOCAL_RANK: 0 - CUDA_VISIBLE_DEVICES: [0]
SLURM auto-requeueing enabled. Setting signal handlers.
[I 2026-05-22 01:51:00,129] Trial 107 finished with value: 0.022097016566148542 and parameters: {'optimizer': 'adamw', 'num_layers': 1, 'activation': 'elu', 'fc_layers': 'fc128_64', 'pool_size_l0': 2, 'out_channels_l0': 16}. Best is trial 9 with value: 0.022097016566148542.
`Trainer.fit` stopped: `max_epochs=30` reached.
[I 2026-05-22 01:51:09,137] Trial 105 finished with value: 0.06554746671357584 and parameters: {'optimizer': 'adamw', 'num_layers': 1, 'activation': 'elu', 'fc_layers': 'fc128_64', 'pool_size_l0': 2, 'out_channels_l0': 4}. Best is trial 86 with value: 0.044051906140032376.
W0522 01:51:10.748000 2657485 .venv/lib/python3.12/site-packages/torch/utils/_pytree.py:630] <enum 'KernelPreference'> is an Enum subclass and is now natively supported by torch.compile as an opaque value type. Calling register_constant() on Enum subclasses is deprecated and will be an error in a future release.
[rank: 0] Seed set to 42
GPU available: True (cuda), used: True
TPU available: False, using: 0 TPU cores
💡 Tip: For seamless cloud logging and experiment tracking, try installing [litlogger](https://pypi.org/project/litlogger/) to enable LitLogger, which logs metrics and artifacts automatically to the Lightning Experiments platform.
LOCAL_RANK: 0 - CUDA_VISIBLE_DEVICES: [0]
SLURM auto-requeueing enabled. Setting signal handlers.
W0522 01:51:18.174000 2657526 .venv/lib/python3.12/site-packages/torch/utils/_pytree.py:630] <enum 'KernelPreference'> is an Enum subclass and is now natively supported by torch.compile as an opaque value type. Calling register_constant() on Enum subclasses is deprecated and will be an error in a future release.
[rank: 0] Seed set to 42
GPU available: True (cuda), used: True
TPU available: False, using: 0 TPU cores
💡 Tip: For seamless cloud logging and experiment tracking, try installing [litlogger](https://pypi.org/project/litlogger/) to enable LitLogger, which logs metrics and artifacts automatically to the Lightning Experiments platform.
LOCAL_RANK: 0 - CUDA_VISIBLE_DEVICES: [0]
SLURM auto-requeueing enabled. Setting signal handlers.
`Trainer.fit` stopped: `max_epochs=30` reached.
[I 2026-05-22 01:51:43,258] Trial 110 finished with value: 0.030832790863267484 and parameters: {'optimizer': 'adam', 'num_layers': 2, 'activation': 'relu', 'fc_layers': 'fc128', 'pool_size_l0': 4, 'out_channels_l0': 16, 'pool_size_l1': 2, 'out_channels_l1': 24}. Best is trial 109 with value: 0.027548411443658997.
W0522 01:51:52.678000 2657686 .venv/lib/python3.12/site-packages/torch/utils/_pytree.py:630] <enum 'KernelPreference'> is an Enum subclass and is now natively supported by torch.compile as an opaque value type. Calling register_constant() on Enum subclasses is deprecated and will be an error in a future release.
[rank: 0] Seed set to 42
GPU available: True (cuda), used: True
TPU available: False, using: 0 TPU cores
💡 Tip: For seamless cloud logging and experiment tracking, try installing [litlogger](https://pypi.org/project/litlogger/) to enable LitLogger, which logs metrics and artifacts automatically to the Lightning Experiments platform.
LOCAL_RANK: 0 - CUDA_VISIBLE_DEVICES: [0]
SLURM auto-requeueing enabled. Setting signal handlers.
`Trainer.fit` stopped: `max_epochs=30` reached.
`Trainer.fit` stopped: `max_epochs=30` reached.
[I 2026-05-22 01:52:01,639] Trial 108 finished with value: 0.022097016566148542 and parameters: {'optimizer': 'adamw', 'num_layers': 1, 'activation': 'elu', 'fc_layers': 'fc128_64', 'pool_size_l0': 2, 'out_channels_l0': 16}. Best is trial 9 with value: 0.022097016566148542.
[I 2026-05-22 01:52:04,080] Trial 106 finished with value: 0.044051906140032376 and parameters: {'optimizer': 'adamw', 'num_layers': 1, 'activation': 'elu', 'fc_layers': 'fc128_64', 'pool_size_l0': 2, 'out_channels_l0': 16}. Best is trial 86 with value: 0.044051906140032376.
W0522 01:52:12.075000 2657771 .venv/lib/python3.12/site-packages/torch/utils/_pytree.py:630] <enum 'KernelPreference'> is an Enum subclass and is now natively supported by torch.compile as an opaque value type. Calling register_constant() on Enum subclasses is deprecated and will be an error in a future release.
[rank: 0] Seed set to 42
GPU available: True (cuda), used: True
TPU available: False, using: 0 TPU cores
💡 Tip: For seamless cloud logging and experiment tracking, try installing [litlogger](https://pypi.org/project/litlogger/) to enable LitLogger, which logs metrics and artifacts automatically to the Lightning Experiments platform.
W0522 01:52:13.571000 2657773 .venv/lib/python3.12/site-packages/torch/utils/_pytree.py:630] <enum 'KernelPreference'> is an Enum subclass and is now natively supported by torch.compile as an opaque value type. Calling register_constant() on Enum subclasses is deprecated and will be an error in a future release.
[rank: 0] Seed set to 42
GPU available: True (cuda), used: True
TPU available: False, using: 0 TPU cores
💡 Tip: For seamless cloud logging and experiment tracking, try installing [litlogger](https://pypi.org/project/litlogger/) to enable LitLogger, which logs metrics and artifacts automatically to the Lightning Experiments platform.
LOCAL_RANK: 0 - CUDA_VISIBLE_DEVICES: [0]
SLURM auto-requeueing enabled. Setting signal handlers.
LOCAL_RANK: 0 - CUDA_VISIBLE_DEVICES: [0]
SLURM auto-requeueing enabled. Setting signal handlers.
`Trainer.fit` stopped: `max_epochs=30` reached.
[I 2026-05-22 01:52:38,689] Trial 111 finished with value: 0.02765886449646422 and parameters: {'optimizer': 'adam', 'num_layers': 2, 'activation': 'relu', 'fc_layers': 'fc128', 'pool_size_l0': 4, 'out_channels_l0': 16, 'pool_size_l1': 2, 'out_channels_l1': 32}. Best is trial 109 with value: 0.027548411443658997.
W0522 01:52:48.060000 2657930 .venv/lib/python3.12/site-packages/torch/utils/_pytree.py:630] <enum 'KernelPreference'> is an Enum subclass and is now natively supported by torch.compile as an opaque value type. Calling register_constant() on Enum subclasses is deprecated and will be an error in a future release.
[rank: 0] Seed set to 42
GPU available: True (cuda), used: True
TPU available: False, using: 0 TPU cores
💡 Tip: For seamless cloud logging and experiment tracking, try installing [litlogger](https://pypi.org/project/litlogger/) to enable LitLogger, which logs metrics and artifacts automatically to the Lightning Experiments platform.
LOCAL_RANK: 0 - CUDA_VISIBLE_DEVICES: [0]
SLURM auto-requeueing enabled. Setting signal handlers.
`Trainer.fit` stopped: `max_epochs=30` reached.
[I 2026-05-22 01:52:56,160] Trial 107 finished with value: 0.13434623741708968 and parameters: {'optimizer': 'adamw', 'num_layers': 1, 'activation': 'elu', 'fc_layers': 'fc16', 'pool_size_l0': 2, 'out_channels_l0': 1}. Best is trial 86 with value: 0.044051906140032376.
[I 2026-05-22 01:52:56,169] Trial 108 pruned. Conv channel counts must be non-decreasing.
`Trainer.fit` stopped: `max_epochs=30` reached.
[I 2026-05-22 01:53:00,977] Trial 109 finished with value: 0.022097016566148542 and parameters: {'optimizer': 'adamw', 'num_layers': 1, 'activation': 'elu', 'fc_layers': 'fc128_64', 'pool_size_l0': 2, 'out_channels_l0': 16}. Best is trial 9 with value: 0.022097016566148542.
W0522 01:53:05.342000 2658014 .venv/lib/python3.12/site-packages/torch/utils/_pytree.py:630] <enum 'KernelPreference'> is an Enum subclass and is now natively supported by torch.compile as an opaque value type. Calling register_constant() on Enum subclasses is deprecated and will be an error in a future release.
[rank: 0] Seed set to 42
GPU available: True (cuda), used: True
TPU available: False, using: 0 TPU cores
💡 Tip: For seamless cloud logging and experiment tracking, try installing [litlogger](https://pypi.org/project/litlogger/) to enable LitLogger, which logs metrics and artifacts automatically to the Lightning Experiments platform.
LOCAL_RANK: 0 - CUDA_VISIBLE_DEVICES: [0]
SLURM auto-requeueing enabled. Setting signal handlers.
W0522 01:53:11.756000 2658018 .venv/lib/python3.12/site-packages/torch/utils/_pytree.py:630] <enum 'KernelPreference'> is an Enum subclass and is now natively supported by torch.compile as an opaque value type. Calling register_constant() on Enum subclasses is deprecated and will be an error in a future release.
[rank: 0] Seed set to 42
GPU available: True (cuda), used: True
TPU available: False, using: 0 TPU cores
💡 Tip: For seamless cloud logging and experiment tracking, try installing [litlogger](https://pypi.org/project/litlogger/) to enable LitLogger, which logs metrics and artifacts automatically to the Lightning Experiments platform.
LOCAL_RANK: 0 - CUDA_VISIBLE_DEVICES: [0]
SLURM auto-requeueing enabled. Setting signal handlers.
`Trainer.fit` stopped: `max_epochs=30` reached.
[I 2026-05-22 01:53:33,811] Trial 112 finished with value: 0.027568890729036524 and parameters: {'optimizer': 'adam', 'num_layers': 2, 'activation': 'relu', 'fc_layers': 'fc128', 'pool_size_l0': 4, 'out_channels_l0': 16, 'pool_size_l1': 2, 'out_channels_l1': 32}. Best is trial 109 with value: 0.027548411443658997.
W0522 01:53:43.508000 2658174 .venv/lib/python3.12/site-packages/torch/utils/_pytree.py:630] <enum 'KernelPreference'> is an Enum subclass and is now natively supported by torch.compile as an opaque value type. Calling register_constant() on Enum subclasses is deprecated and will be an error in a future release.
[rank: 0] Seed set to 42
GPU available: True (cuda), used: True
TPU available: False, using: 0 TPU cores
💡 Tip: For seamless cloud logging and experiment tracking, try installing [litlogger](https://pypi.org/project/litlogger/) to enable LitLogger, which logs metrics and artifacts automatically to the Lightning Experiments platform.
LOCAL_RANK: 0 - CUDA_VISIBLE_DEVICES: [0]
SLURM auto-requeueing enabled. Setting signal handlers.
`Trainer.fit` stopped: `max_epochs=30` reached.
[I 2026-05-22 01:53:50,936] Trial 109 finished with value: 0.044051906140032376 and parameters: {'optimizer': 'adamw', 'num_layers': 1, 'activation': 'elu', 'fc_layers': 'fc128_64', 'pool_size_l0': 2, 'out_channels_l0': 16}. Best is trial 86 with value: 0.044051906140032376.
`Trainer.fit` stopped: `max_epochs=30` reached.
[I 2026-05-22 01:53:59,617] Trial 110 finished with value: 0.022097016566148542 and parameters: {'optimizer': 'adamw', 'num_layers': 1, 'activation': 'elu', 'fc_layers': 'fc128_64', 'pool_size_l0': 2, 'out_channels_l0': 16}. Best is trial 9 with value: 0.022097016566148542.
W0522 01:54:00.093000 2658263 .venv/lib/python3.12/site-packages/torch/utils/_pytree.py:630] <enum 'KernelPreference'> is an Enum subclass and is now natively supported by torch.compile as an opaque value type. Calling register_constant() on Enum subclasses is deprecated and will be an error in a future release.
[rank: 0] Seed set to 42
GPU available: True (cuda), used: True
TPU available: False, using: 0 TPU cores
💡 Tip: For seamless cloud logging and experiment tracking, try installing [litlogger](https://pypi.org/project/litlogger/) to enable LitLogger, which logs metrics and artifacts automatically to the Lightning Experiments platform.
LOCAL_RANK: 0 - CUDA_VISIBLE_DEVICES: [0]
SLURM auto-requeueing enabled. Setting signal handlers.
W0522 01:54:09.098000 2658267 .venv/lib/python3.12/site-packages/torch/utils/_pytree.py:630] <enum 'KernelPreference'> is an Enum subclass and is now natively supported by torch.compile as an opaque value type. Calling register_constant() on Enum subclasses is deprecated and will be an error in a future release.
[rank: 0] Seed set to 42
GPU available: True (cuda), used: True
TPU available: False, using: 0 TPU cores
💡 Tip: For seamless cloud logging and experiment tracking, try installing [litlogger](https://pypi.org/project/litlogger/) to enable LitLogger, which logs metrics and artifacts automatically to the Lightning Experiments platform.
LOCAL_RANK: 0 - CUDA_VISIBLE_DEVICES: [0]
SLURM auto-requeueing enabled. Setting signal handlers.
`Trainer.fit` stopped: `max_epochs=30` reached.
[I 2026-05-22 01:54:30,986] Trial 113 finished with value: 0.027711020340801435 and parameters: {'optimizer': 'adam', 'num_layers': 2, 'activation': 'relu', 'fc_layers': 'fc128', 'pool_size_l0': 4, 'out_channels_l0': 16, 'pool_size_l1': 2, 'out_channels_l1': 32}. Best is trial 109 with value: 0.027548411443658997.
W0522 01:54:40.977000 2658422 .venv/lib/python3.12/site-packages/torch/utils/_pytree.py:630] <enum 'KernelPreference'> is an Enum subclass and is now natively supported by torch.compile as an opaque value type. Calling register_constant() on Enum subclasses is deprecated and will be an error in a future release.
[rank: 0] Seed set to 42
GPU available: True (cuda), used: True
TPU available: False, using: 0 TPU cores
💡 Tip: For seamless cloud logging and experiment tracking, try installing [litlogger](https://pypi.org/project/litlogger/) to enable LitLogger, which logs metrics and artifacts automatically to the Lightning Experiments platform.
LOCAL_RANK: 0 - CUDA_VISIBLE_DEVICES: [0]
SLURM auto-requeueing enabled. Setting signal handlers.
`Trainer.fit` stopped: `max_epochs=30` reached.
