[I 2026-05-22 01:30:14,365] Trial 82 finished with value: 0.04503339323145774 and parameters: {'optimizer': 'adamw', 'num_layers': 1, 'activation': 'elu', 'fc_layers': 'fc128_64', 'pool_size_l0': 3, 'out_channels_l0': 16}. Best is trial 64 with value: 0.04503339323145774.
`Trainer.fit` stopped: `max_epochs=30` reached.
W0522 01:30:25.723000 2651092 .venv/lib/python3.12/site-packages/torch/utils/_pytree.py:630] <enum 'KernelPreference'> is an Enum subclass and is now natively supported by torch.compile as an opaque value type. Calling register_constant() on Enum subclasses is deprecated and will be an error in a future release.
W0522 01:30:26.920000 2651096 .venv/lib/python3.12/site-packages/torch/utils/_pytree.py:630] <enum 'KernelPreference'> is an Enum subclass and is now natively supported by torch.compile as an opaque value type. Calling register_constant() on Enum subclasses is deprecated and will be an error in a future release.
[rank: 0] Seed set to 42
GPU available: True (cuda), used: True
TPU available: False, using: 0 TPU cores
💡 Tip: For seamless cloud logging and experiment tracking, try installing [litlogger](https://pypi.org/project/litlogger/) to enable LitLogger, which logs metrics and artifacts automatically to the Lightning Experiments platform.
[rank: 0] Seed set to 42
GPU available: True (cuda), used: True
TPU available: False, using: 0 TPU cores
💡 Tip: For seamless cloud logging and experiment tracking, try installing [litlogger](https://pypi.org/project/litlogger/) to enable LitLogger, which logs metrics and artifacts automatically to the Lightning Experiments platform.
LOCAL_RANK: 0 - CUDA_VISIBLE_DEVICES: [0]
LOCAL_RANK: 0 - CUDA_VISIBLE_DEVICES: [0]
[I 2026-05-22 01:30:29,257] Trial 86 finished with value: 0.04537411008982879 and parameters: {'optimizer': 'adam', 'num_layers': 2, 'activation': 'elu', 'fc_layers': 'fc128', 'pool_size_l0': 4, 'out_channels_l0': 8, 'pool_size_l1': 2, 'out_channels_l1': 32}. Best is trial 38 with value: 0.027702430610653885.
[I 2026-05-22 01:30:29,270] Trial 87 pruned. Conv channel counts must be non-decreasing.
SLURM auto-requeueing enabled. Setting signal handlers.
SLURM auto-requeueing enabled. Setting signal handlers.
W0522 01:30:38.977000 2651108 .venv/lib/python3.12/site-packages/torch/utils/_pytree.py:630] <enum 'KernelPreference'> is an Enum subclass and is now natively supported by torch.compile as an opaque value type. Calling register_constant() on Enum subclasses is deprecated and will be an error in a future release.
[rank: 0] Seed set to 42
GPU available: True (cuda), used: True
TPU available: False, using: 0 TPU cores
💡 Tip: For seamless cloud logging and experiment tracking, try installing [litlogger](https://pypi.org/project/litlogger/) to enable LitLogger, which logs metrics and artifacts automatically to the Lightning Experiments platform.
LOCAL_RANK: 0 - CUDA_VISIBLE_DEVICES: [0]
SLURM auto-requeueing enabled. Setting signal handlers.
`Trainer.fit` stopped: `max_epochs=30` reached.
`Trainer.fit` stopped: `max_epochs=30` reached.
[I 2026-05-22 01:31:14,567] Trial 85 finished with value: 0.055967816329790754 and parameters: {'optimizer': 'adamw', 'num_layers': 1, 'activation': 'elu', 'fc_layers': 'fc64_32', 'pool_size_l0': 3, 'out_channels_l0': 1}. Best is trial 9 with value: 0.022097016566148542.
[I 2026-05-22 01:31:15,058] Trial 83 finished with value: 0.04503339323145774 and parameters: {'optimizer': 'adamw', 'num_layers': 1, 'activation': 'elu', 'fc_layers': 'fc128_64', 'pool_size_l0': 3, 'out_channels_l0': 16}. Best is trial 64 with value: 0.04503339323145774.
`Trainer.fit` stopped: `max_epochs=30` reached.
W0522 01:31:24.722000 2651342 .venv/lib/python3.12/site-packages/torch/utils/_pytree.py:630] <enum 'KernelPreference'> is an Enum subclass and is now natively supported by torch.compile as an opaque value type. Calling register_constant() on Enum subclasses is deprecated and will be an error in a future release.
W0522 01:31:24.812000 2651341 .venv/lib/python3.12/site-packages/torch/utils/_pytree.py:630] <enum 'KernelPreference'> is an Enum subclass and is now natively supported by torch.compile as an opaque value type. Calling register_constant() on Enum subclasses is deprecated and will be an error in a future release.
[rank: 0] Seed set to 42
GPU available: True (cuda), used: True
TPU available: False, using: 0 TPU cores
💡 Tip: For seamless cloud logging and experiment tracking, try installing [litlogger](https://pypi.org/project/litlogger/) to enable LitLogger, which logs metrics and artifacts automatically to the Lightning Experiments platform.
[rank: 0] Seed set to 42
[I 2026-05-22 01:31:25,774] Trial 88 finished with value: 0.03183518533336977 and parameters: {'optimizer': 'adam', 'num_layers': 2, 'activation': 'relu', 'fc_layers': 'fc16', 'pool_size_l0': 2, 'out_channels_l0': 8, 'pool_size_l1': 2, 'out_channels_l1': 24}. Best is trial 38 with value: 0.027702430610653885.
GPU available: True (cuda), used: True
TPU available: False, using: 0 TPU cores
💡 Tip: For seamless cloud logging and experiment tracking, try installing [litlogger](https://pypi.org/project/litlogger/) to enable LitLogger, which logs metrics and artifacts automatically to the Lightning Experiments platform.
LOCAL_RANK: 0 - CUDA_VISIBLE_DEVICES: [0]
LOCAL_RANK: 0 - CUDA_VISIBLE_DEVICES: [0]
SLURM auto-requeueing enabled. Setting signal handlers.
SLURM auto-requeueing enabled. Setting signal handlers.
W0522 01:31:35.533000 2651357 .venv/lib/python3.12/site-packages/torch/utils/_pytree.py:630] <enum 'KernelPreference'> is an Enum subclass and is now natively supported by torch.compile as an opaque value type. Calling register_constant() on Enum subclasses is deprecated and will be an error in a future release.
[rank: 0] Seed set to 42
GPU available: True (cuda), used: True
TPU available: False, using: 0 TPU cores
💡 Tip: For seamless cloud logging and experiment tracking, try installing [litlogger](https://pypi.org/project/litlogger/) to enable LitLogger, which logs metrics and artifacts automatically to the Lightning Experiments platform.
LOCAL_RANK: 0 - CUDA_VISIBLE_DEVICES: [0]
SLURM auto-requeueing enabled. Setting signal handlers.
`Trainer.fit` stopped: `max_epochs=30` reached.
`Trainer.fit` stopped: `max_epochs=30` reached.
[I 2026-05-22 01:32:13,249] Trial 84 finished with value: 0.04503339323145774 and parameters: {'optimizer': 'adamw', 'num_layers': 1, 'activation': 'elu', 'fc_layers': 'fc128_64', 'pool_size_l0': 3, 'out_channels_l0': 16}. Best is trial 64 with value: 0.04503339323145774.
[I 2026-05-22 01:32:15,004] Trial 86 finished with value: 0.026896736776702523 and parameters: {'optimizer': 'adamw', 'num_layers': 1, 'activation': 'relu', 'fc_layers': 'fc128_64', 'pool_size_l0': 2, 'out_channels_l0': 16}. Best is trial 9 with value: 0.022097016566148542.
`Trainer.fit` stopped: `max_epochs=30` reached.
W0522 01:32:23.357000 2651595 .venv/lib/python3.12/site-packages/torch/utils/_pytree.py:630] <enum 'KernelPreference'> is an Enum subclass and is now natively supported by torch.compile as an opaque value type. Calling register_constant() on Enum subclasses is deprecated and will be an error in a future release.
[I 2026-05-22 01:32:23,648] Trial 89 finished with value: 0.031070374664530623 and parameters: {'optimizer': 'adam', 'num_layers': 2, 'activation': 'relu', 'fc_layers': 'fc128', 'pool_size_l0': 4, 'out_channels_l0': 4, 'pool_size_l1': 2, 'out_channels_l1': 32}. Best is trial 38 with value: 0.027702430610653885.
[rank: 0] Seed set to 42
GPU available: True (cuda), used: True
TPU available: False, using: 0 TPU cores
💡 Tip: For seamless cloud logging and experiment tracking, try installing [litlogger](https://pypi.org/project/litlogger/) to enable LitLogger, which logs metrics and artifacts automatically to the Lightning Experiments platform.
W0522 01:32:25.104000 2651597 .venv/lib/python3.12/site-packages/torch/utils/_pytree.py:630] <enum 'KernelPreference'> is an Enum subclass and is now natively supported by torch.compile as an opaque value type. Calling register_constant() on Enum subclasses is deprecated and will be an error in a future release.
LOCAL_RANK: 0 - CUDA_VISIBLE_DEVICES: [0]
[rank: 0] Seed set to 42
GPU available: True (cuda), used: True
TPU available: False, using: 0 TPU cores
💡 Tip: For seamless cloud logging and experiment tracking, try installing [litlogger](https://pypi.org/project/litlogger/) to enable LitLogger, which logs metrics and artifacts automatically to the Lightning Experiments platform.
SLURM auto-requeueing enabled. Setting signal handlers.
LOCAL_RANK: 0 - CUDA_VISIBLE_DEVICES: [0]
SLURM auto-requeueing enabled. Setting signal handlers.
W0522 01:32:33.201000 2651602 .venv/lib/python3.12/site-packages/torch/utils/_pytree.py:630] <enum 'KernelPreference'> is an Enum subclass and is now natively supported by torch.compile as an opaque value type. Calling register_constant() on Enum subclasses is deprecated and will be an error in a future release.
[rank: 0] Seed set to 42
GPU available: True (cuda), used: True
TPU available: False, using: 0 TPU cores
💡 Tip: For seamless cloud logging and experiment tracking, try installing [litlogger](https://pypi.org/project/litlogger/) to enable LitLogger, which logs metrics and artifacts automatically to the Lightning Experiments platform.
LOCAL_RANK: 0 - CUDA_VISIBLE_DEVICES: [0]
SLURM auto-requeueing enabled. Setting signal handlers.
`Trainer.fit` stopped: `max_epochs=30` reached.
`Trainer.fit` stopped: `max_epochs=30` reached.
[I 2026-05-22 01:33:12,810] Trial 87 finished with value: 0.03567906249158462 and parameters: {'optimizer': 'adamw', 'num_layers': 1, 'activation': 'elu', 'fc_layers': 'fc16', 'pool_size_l0': 2, 'out_channels_l0': 16}. Best is trial 9 with value: 0.022097016566148542.
[I 2026-05-22 01:33:13,965] Trial 85 finished with value: 0.05116651284274125 and parameters: {'optimizer': 'adamw', 'num_layers': 1, 'activation': 'elu', 'fc_layers': 'fc64_32', 'pool_size_l0': 3, 'out_channels_l0': 16}. Best is trial 64 with value: 0.04503339323145774.
`Trainer.fit` stopped: `max_epochs=30` reached.
[I 2026-05-22 01:33:18,449] Trial 90 finished with value: 0.03856567169936243 and parameters: {'optimizer': 'adam', 'num_layers': 2, 'activation': 'relu', 'fc_layers': 'fc128', 'pool_size_l0': 4, 'out_channels_l0': 8, 'pool_size_l1': 2, 'out_channels_l1': 8}. Best is trial 38 with value: 0.027702430610653885.
W0522 01:33:22.847000 2651849 .venv/lib/python3.12/site-packages/torch/utils/_pytree.py:630] <enum 'KernelPreference'> is an Enum subclass and is now natively supported by torch.compile as an opaque value type. Calling register_constant() on Enum subclasses is deprecated and will be an error in a future release.
[rank: 0] Seed set to 42
GPU available: True (cuda), used: True
TPU available: False, using: 0 TPU cores
💡 Tip: For seamless cloud logging and experiment tracking, try installing [litlogger](https://pypi.org/project/litlogger/) to enable LitLogger, which logs metrics and artifacts automatically to the Lightning Experiments platform.
W0522 01:33:24.508000 2651850 .venv/lib/python3.12/site-packages/torch/utils/_pytree.py:630] <enum 'KernelPreference'> is an Enum subclass and is now natively supported by torch.compile as an opaque value type. Calling register_constant() on Enum subclasses is deprecated and will be an error in a future release.
[rank: 0] Seed set to 42
GPU available: True (cuda), used: True
TPU available: False, using: 0 TPU cores
💡 Tip: For seamless cloud logging and experiment tracking, try installing [litlogger](https://pypi.org/project/litlogger/) to enable LitLogger, which logs metrics and artifacts automatically to the Lightning Experiments platform.
LOCAL_RANK: 0 - CUDA_VISIBLE_DEVICES: [0]
SLURM auto-requeueing enabled. Setting signal handlers.
LOCAL_RANK: 0 - CUDA_VISIBLE_DEVICES: [0]
SLURM auto-requeueing enabled. Setting signal handlers.
W0522 01:33:27.662000 2651855 .venv/lib/python3.12/site-packages/torch/utils/_pytree.py:630] <enum 'KernelPreference'> is an Enum subclass and is now natively supported by torch.compile as an opaque value type. Calling register_constant() on Enum subclasses is deprecated and will be an error in a future release.
[rank: 0] Seed set to 42
GPU available: True (cuda), used: True
TPU available: False, using: 0 TPU cores
💡 Tip: For seamless cloud logging and experiment tracking, try installing [litlogger](https://pypi.org/project/litlogger/) to enable LitLogger, which logs metrics and artifacts automatically to the Lightning Experiments platform.
LOCAL_RANK: 0 - CUDA_VISIBLE_DEVICES: [0]
SLURM auto-requeueing enabled. Setting signal handlers.
`Trainer.fit` stopped: `max_epochs=30` reached.
`Trainer.fit` stopped: `max_epochs=30` reached.
`Trainer.fit` stopped: `max_epochs=30` reached.
[I 2026-05-22 01:34:13,555] Trial 88 finished with value: 0.02300240126843357 and parameters: {'optimizer': 'adamw', 'num_layers': 1, 'activation': 'elu', 'fc_layers': 'fc64_32', 'pool_size_l0': 2, 'out_channels_l0': 16}. Best is trial 9 with value: 0.022097016566148542.
[I 2026-05-22 01:34:13,564] Trial 89 pruned. Conv channel counts must be non-decreasing.
[I 2026-05-22 01:34:13,572] Trial 90 pruned. Conv channel counts must be non-decreasing.
[I 2026-05-22 01:34:15,897] Trial 86 finished with value: 0.044051906140032376 and parameters: {'optimizer': 'adamw', 'num_layers': 1, 'activation': 'elu', 'fc_layers': 'fc128_64', 'pool_size_l0': 2, 'out_channels_l0': 16}. Best is trial 86 with value: 0.044051906140032376.
[I 2026-05-22 01:34:16,032] Trial 91 finished with value: 0.03004820560480767 and parameters: {'optimizer': 'adam', 'num_layers': 2, 'activation': 'relu', 'fc_layers': 'fc128', 'pool_size_l0': 4, 'out_channels_l0': 8, 'pool_size_l1': 2, 'out_channels_l1': 32}. Best is trial 38 with value: 0.027702430610653885.
W0522 01:34:23.473000 2652107 .venv/lib/python3.12/site-packages/torch/utils/_pytree.py:630] <enum 'KernelPreference'> is an Enum subclass and is now natively supported by torch.compile as an opaque value type. Calling register_constant() on Enum subclasses is deprecated and will be an error in a future release.
[rank: 0] Seed set to 42
GPU available: True (cuda), used: True
TPU available: False, using: 0 TPU cores
💡 Tip: For seamless cloud logging and experiment tracking, try installing [litlogger](https://pypi.org/project/litlogger/) to enable LitLogger, which logs metrics and artifacts automatically to the Lightning Experiments platform.
W0522 01:34:25.376000 2652109 .venv/lib/python3.12/site-packages/torch/utils/_pytree.py:630] <enum 'KernelPreference'> is an Enum subclass and is now natively supported by torch.compile as an opaque value type. Calling register_constant() on Enum subclasses is deprecated and will be an error in a future release.
W0522 01:34:25.377000 2652110 .venv/lib/python3.12/site-packages/torch/utils/_pytree.py:630] <enum 'KernelPreference'> is an Enum subclass and is now natively supported by torch.compile as an opaque value type. Calling register_constant() on Enum subclasses is deprecated and will be an error in a future release.
[rank: 0] Seed set to 42
[rank: 0] Seed set to 42
GPU available: True (cuda), used: True
TPU available: False, using: 0 TPU cores
💡 Tip: For seamless cloud logging and experiment tracking, try installing [litlogger](https://pypi.org/project/litlogger/) to enable LitLogger, which logs metrics and artifacts automatically to the Lightning Experiments platform.
GPU available: True (cuda), used: True
TPU available: False, using: 0 TPU cores
💡 Tip: For seamless cloud logging and experiment tracking, try installing [litlogger](https://pypi.org/project/litlogger/) to enable LitLogger, which logs metrics and artifacts automatically to the Lightning Experiments platform.
LOCAL_RANK: 0 - CUDA_VISIBLE_DEVICES: [0]
SLURM auto-requeueing enabled. Setting signal handlers.
LOCAL_RANK: 0 - CUDA_VISIBLE_DEVICES: [0]
LOCAL_RANK: 0 - CUDA_VISIBLE_DEVICES: [0]
SLURM auto-requeueing enabled. Setting signal handlers.
SLURM auto-requeueing enabled. Setting signal handlers.
`Trainer.fit` stopped: `max_epochs=30` reached.
`Trainer.fit` stopped: `max_epochs=30` reached.
`Trainer.fit` stopped: `max_epochs=30` reached.
[I 2026-05-22 01:35:13,266] Trial 92 finished with value: 0.03008155225274816 and parameters: {'optimizer': 'adam', 'num_layers': 2, 'activation': 'relu', 'fc_layers': 'fc128', 'pool_size_l0': 4, 'out_channels_l0': 8, 'pool_size_l1': 2, 'out_channels_l1': 32}. Best is trial 38 with value: 0.027702430610653885.
[I 2026-05-22 01:35:13,660] Trial 87 finished with value: 0.06212720391123976 and parameters: {'optimizer': 'adamw', 'num_layers': 1, 'activation': 'elu', 'fc_layers': 'fc128', 'pool_size_l0': 2, 'out_channels_l0': 16}. Best is trial 86 with value: 0.044051906140032376.
[I 2026-05-22 01:35:14,506] Trial 91 finished with value: 0.02300240126843357 and parameters: {'optimizer': 'adamw', 'num_layers': 1, 'activation': 'elu', 'fc_layers': 'fc64_32', 'pool_size_l0': 2, 'out_channels_l0': 16}. Best is trial 9 with value: 0.022097016566148542.
W0522 01:35:22.756000 2652363 .venv/lib/python3.12/site-packages/torch/utils/_pytree.py:630] <enum 'KernelPreference'> is an Enum subclass and is now natively supported by torch.compile as an opaque value type. Calling register_constant() on Enum subclasses is deprecated and will be an error in a future release.
W0522 01:35:22.761000 2652362 .venv/lib/python3.12/site-packages/torch/utils/_pytree.py:630] <enum 'KernelPreference'> is an Enum subclass and is now natively supported by torch.compile as an opaque value type. Calling register_constant() on Enum subclasses is deprecated and will be an error in a future release.
[rank: 0] Seed set to 42
[rank: 0] Seed set to 42
GPU available: True (cuda), used: True
TPU available: False, using: 0 TPU cores
💡 Tip: For seamless cloud logging and experiment tracking, try installing [litlogger](https://pypi.org/project/litlogger/) to enable LitLogger, which logs metrics and artifacts automatically to the Lightning Experiments platform.
GPU available: True (cuda), used: True
TPU available: False, using: 0 TPU cores
💡 Tip: For seamless cloud logging and experiment tracking, try installing [litlogger](https://pypi.org/project/litlogger/) to enable LitLogger, which logs metrics and artifacts automatically to the Lightning Experiments platform.
W0522 01:35:24.329000 2652365 .venv/lib/python3.12/site-packages/torch/utils/_pytree.py:630] <enum 'KernelPreference'> is an Enum subclass and is now natively supported by torch.compile as an opaque value type. Calling register_constant() on Enum subclasses is deprecated and will be an error in a future release.
LOCAL_RANK: 0 - CUDA_VISIBLE_DEVICES: [0]
LOCAL_RANK: 0 - CUDA_VISIBLE_DEVICES: [0]
[rank: 0] Seed set to 42
GPU available: True (cuda), used: True
TPU available: False, using: 0 TPU cores
💡 Tip: For seamless cloud logging and experiment tracking, try installing [litlogger](https://pypi.org/project/litlogger/) to enable LitLogger, which logs metrics and artifacts automatically to the Lightning Experiments platform.
SLURM auto-requeueing enabled. Setting signal handlers.
SLURM auto-requeueing enabled. Setting signal handlers.
LOCAL_RANK: 0 - CUDA_VISIBLE_DEVICES: [0]
SLURM auto-requeueing enabled. Setting signal handlers.
`Trainer.fit` stopped: `max_epochs=30` reached.
`Trainer.fit` stopped: `max_epochs=30` reached.
[I 2026-05-22 01:36:09,508] Trial 88 finished with value: 0.13532583241472879 and parameters: {'optimizer': 'adamw', 'num_layers': 1, 'activation': 'elu', 'fc_layers': 'fc128_64', 'pool_size_l0': 2, 'out_channels_l0': 1}. Best is trial 86 with value: 0.044051906140032376.
`Trainer.fit` stopped: `max_epochs=30` reached.
[I 2026-05-22 01:36:12,002] Trial 93 finished with value: 0.030074322259203 and parameters: {'optimizer': 'adam', 'num_layers': 2, 'activation': 'relu', 'fc_layers': 'fc128', 'pool_size_l0': 4, 'out_channels_l0': 8, 'pool_size_l1': 2, 'out_channels_l1': 32}. Best is trial 38 with value: 0.027702430610653885.
