[I 2026-05-22 00:46:13,654] Trial 38 finished with value: 0.027702430610653885 and parameters: {'optimizer': 'adam', 'num_layers': 2, 'activation': 'relu', 'fc_layers': 'fc128', 'pool_size_l0': 4, 'out_channels_l0': 16, 'pool_size_l1': 2, 'out_channels_l1': 32}. Best is trial 38 with value: 0.027702430610653885.
W0522 00:46:23.268000 2639698 .venv/lib/python3.12/site-packages/torch/utils/_pytree.py:630] <enum 'KernelPreference'> is an Enum subclass and is now natively supported by torch.compile as an opaque value type. Calling register_constant() on Enum subclasses is deprecated and will be an error in a future release.
[rank: 0] Seed set to 42
GPU available: True (cuda), used: True
TPU available: False, using: 0 TPU cores
💡 Tip: For seamless cloud logging and experiment tracking, try installing [litlogger](https://pypi.org/project/litlogger/) to enable LitLogger, which logs metrics and artifacts automatically to the Lightning Experiments platform.
LOCAL_RANK: 0 - CUDA_VISIBLE_DEVICES: [0]
SLURM auto-requeueing enabled. Setting signal handlers.
`Trainer.fit` stopped: `max_epochs=30` reached.
`Trainer.fit` stopped: `max_epochs=30` reached.
[I 2026-05-22 00:46:38,463] Trial 33 finished with value: 0.04755241816438581 and parameters: {'optimizer': 'adam', 'num_layers': 1, 'activation': 'relu', 'fc_layers': 'fc128_64', 'pool_size_l0': 3, 'out_channels_l0': 16}. Best is trial 15 with value: 0.045786147144041764.
[I 2026-05-22 00:46:41,446] Trial 35 finished with value: 0.034108443982897786 and parameters: {'optimizer': 'adamw', 'num_layers': 2, 'activation': 'relu', 'fc_layers': 'fc64_32', 'pool_size_l0': 2, 'out_channels_l0': 16, 'pool_size_l1': 4, 'out_channels_l1': 32}. Best is trial 9 with value: 0.022097016566148542.
W0522 00:46:49.287000 2639785 .venv/lib/python3.12/site-packages/torch/utils/_pytree.py:630] <enum 'KernelPreference'> is an Enum subclass and is now natively supported by torch.compile as an opaque value type. Calling register_constant() on Enum subclasses is deprecated and will be an error in a future release.
[rank: 0] Seed set to 42
GPU available: True (cuda), used: True
TPU available: False, using: 0 TPU cores
💡 Tip: For seamless cloud logging and experiment tracking, try installing [litlogger](https://pypi.org/project/litlogger/) to enable LitLogger, which logs metrics and artifacts automatically to the Lightning Experiments platform.
W0522 00:46:51.506000 2639789 .venv/lib/python3.12/site-packages/torch/utils/_pytree.py:630] <enum 'KernelPreference'> is an Enum subclass and is now natively supported by torch.compile as an opaque value type. Calling register_constant() on Enum subclasses is deprecated and will be an error in a future release.
LOCAL_RANK: 0 - CUDA_VISIBLE_DEVICES: [0]
SLURM auto-requeueing enabled. Setting signal handlers.
[rank: 0] Seed set to 42
GPU available: True (cuda), used: True
TPU available: False, using: 0 TPU cores
💡 Tip: For seamless cloud logging and experiment tracking, try installing [litlogger](https://pypi.org/project/litlogger/) to enable LitLogger, which logs metrics and artifacts automatically to the Lightning Experiments platform.
LOCAL_RANK: 0 - CUDA_VISIBLE_DEVICES: [0]
SLURM auto-requeueing enabled. Setting signal handlers.
`Trainer.fit` stopped: `max_epochs=30` reached.
[I 2026-05-22 00:47:07,119] Trial 39 finished with value: 0.04611190808304178 and parameters: {'optimizer': 'adam', 'num_layers': 2, 'activation': 'elu', 'fc_layers': 'fc128', 'pool_size_l0': 4, 'out_channels_l0': 16, 'pool_size_l1': 2, 'out_channels_l1': 32}. Best is trial 38 with value: 0.027702430610653885.
W0522 00:47:16.244000 2639945 .venv/lib/python3.12/site-packages/torch/utils/_pytree.py:630] <enum 'KernelPreference'> is an Enum subclass and is now natively supported by torch.compile as an opaque value type. Calling register_constant() on Enum subclasses is deprecated and will be an error in a future release.
[rank: 0] Seed set to 42
GPU available: True (cuda), used: True
TPU available: False, using: 0 TPU cores
💡 Tip: For seamless cloud logging and experiment tracking, try installing [litlogger](https://pypi.org/project/litlogger/) to enable LitLogger, which logs metrics and artifacts automatically to the Lightning Experiments platform.
LOCAL_RANK: 0 - CUDA_VISIBLE_DEVICES: [0]
SLURM auto-requeueing enabled. Setting signal handlers.
`Trainer.fit` stopped: `max_epochs=30` reached.
`Trainer.fit` stopped: `max_epochs=30` reached.
[I 2026-05-22 00:47:35,927] Trial 34 finished with value: 0.05593139108841062 and parameters: {'optimizer': 'adam', 'num_layers': 1, 'activation': 'relu', 'fc_layers': 'fc64', 'pool_size_l0': 3, 'out_channels_l0': 16}. Best is trial 15 with value: 0.045786147144041764.
[I 2026-05-22 00:47:36,688] Trial 36 finished with value: 0.049464866986404066 and parameters: {'optimizer': 'adam', 'num_layers': 1, 'activation': 'elu', 'fc_layers': 'fc128', 'pool_size_l0': 4, 'out_channels_l0': 8}. Best is trial 9 with value: 0.022097016566148542.
W0522 00:47:45.886000 2640029 .venv/lib/python3.12/site-packages/torch/utils/_pytree.py:630] <enum 'KernelPreference'> is an Enum subclass and is now natively supported by torch.compile as an opaque value type. Calling register_constant() on Enum subclasses is deprecated and will be an error in a future release.
W0522 00:47:46.175000 2640030 .venv/lib/python3.12/site-packages/torch/utils/_pytree.py:630] <enum 'KernelPreference'> is an Enum subclass and is now natively supported by torch.compile as an opaque value type. Calling register_constant() on Enum subclasses is deprecated and will be an error in a future release.
[rank: 0] Seed set to 42
GPU available: True (cuda), used: True
TPU available: False, using: 0 TPU cores
💡 Tip: For seamless cloud logging and experiment tracking, try installing [litlogger](https://pypi.org/project/litlogger/) to enable LitLogger, which logs metrics and artifacts automatically to the Lightning Experiments platform.
[rank: 0] Seed set to 42
GPU available: True (cuda), used: True
TPU available: False, using: 0 TPU cores
💡 Tip: For seamless cloud logging and experiment tracking, try installing [litlogger](https://pypi.org/project/litlogger/) to enable LitLogger, which logs metrics and artifacts automatically to the Lightning Experiments platform.
LOCAL_RANK: 0 - CUDA_VISIBLE_DEVICES: [0]
SLURM auto-requeueing enabled. Setting signal handlers.
LOCAL_RANK: 0 - CUDA_VISIBLE_DEVICES: [0]
SLURM auto-requeueing enabled. Setting signal handlers.
`Trainer.fit` stopped: `max_epochs=30` reached.
[I 2026-05-22 00:48:02,642] Trial 40 finished with value: 0.030089811662705006 and parameters: {'optimizer': 'adam', 'num_layers': 2, 'activation': 'relu', 'fc_layers': 'fc128', 'pool_size_l0': 4, 'out_channels_l0': 8, 'pool_size_l1': 2, 'out_channels_l1': 32}. Best is trial 38 with value: 0.027702430610653885.
W0522 00:48:15.381000 2640193 .venv/lib/python3.12/site-packages/torch/utils/_pytree.py:630] <enum 'KernelPreference'> is an Enum subclass and is now natively supported by torch.compile as an opaque value type. Calling register_constant() on Enum subclasses is deprecated and will be an error in a future release.
[rank: 0] Seed set to 42
GPU available: True (cuda), used: True
TPU available: False, using: 0 TPU cores
💡 Tip: For seamless cloud logging and experiment tracking, try installing [litlogger](https://pypi.org/project/litlogger/) to enable LitLogger, which logs metrics and artifacts automatically to the Lightning Experiments platform.
LOCAL_RANK: 0 - CUDA_VISIBLE_DEVICES: [0]
SLURM auto-requeueing enabled. Setting signal handlers.
`Trainer.fit` stopped: `max_epochs=30` reached.
`Trainer.fit` stopped: `max_epochs=30` reached.
[I 2026-05-22 00:48:35,128] Trial 35 finished with value: 0.04755241816438581 and parameters: {'optimizer': 'adam', 'num_layers': 1, 'activation': 'relu', 'fc_layers': 'fc128_64', 'pool_size_l0': 3, 'out_channels_l0': 16}. Best is trial 15 with value: 0.045786147144041764.
[I 2026-05-22 00:48:35,896] Trial 37 finished with value: 0.026896736776702523 and parameters: {'optimizer': 'adamw', 'num_layers': 1, 'activation': 'relu', 'fc_layers': 'fc128_64', 'pool_size_l0': 2, 'out_channels_l0': 16}. Best is trial 9 with value: 0.022097016566148542.
W0522 00:48:44.937000 2640276 .venv/lib/python3.12/site-packages/torch/utils/_pytree.py:630] <enum 'KernelPreference'> is an Enum subclass and is now natively supported by torch.compile as an opaque value type. Calling register_constant() on Enum subclasses is deprecated and will be an error in a future release.
W0522 00:48:45.507000 2640278 .venv/lib/python3.12/site-packages/torch/utils/_pytree.py:630] <enum 'KernelPreference'> is an Enum subclass and is now natively supported by torch.compile as an opaque value type. Calling register_constant() on Enum subclasses is deprecated and will be an error in a future release.
[rank: 0] Seed set to 42
GPU available: True (cuda), used: True
TPU available: False, using: 0 TPU cores
💡 Tip: For seamless cloud logging and experiment tracking, try installing [litlogger](https://pypi.org/project/litlogger/) to enable LitLogger, which logs metrics and artifacts automatically to the Lightning Experiments platform.
[rank: 0] Seed set to 42
GPU available: True (cuda), used: True
TPU available: False, using: 0 TPU cores
💡 Tip: For seamless cloud logging and experiment tracking, try installing [litlogger](https://pypi.org/project/litlogger/) to enable LitLogger, which logs metrics and artifacts automatically to the Lightning Experiments platform.
LOCAL_RANK: 0 - CUDA_VISIBLE_DEVICES: [0]
SLURM auto-requeueing enabled. Setting signal handlers.
LOCAL_RANK: 0 - CUDA_VISIBLE_DEVICES: [0]
SLURM auto-requeueing enabled. Setting signal handlers.
`Trainer.fit` stopped: `max_epochs=30` reached.
[I 2026-05-22 00:49:02,083] Trial 41 finished with value: 0.03004251817316124 and parameters: {'optimizer': 'adam', 'num_layers': 2, 'activation': 'relu', 'fc_layers': 'fc128', 'pool_size_l0': 4, 'out_channels_l0': 8, 'pool_size_l1': 2, 'out_channels_l1': 32}. Best is trial 38 with value: 0.027702430610653885.
W0522 00:49:12.178000 2640440 .venv/lib/python3.12/site-packages/torch/utils/_pytree.py:630] <enum 'KernelPreference'> is an Enum subclass and is now natively supported by torch.compile as an opaque value type. Calling register_constant() on Enum subclasses is deprecated and will be an error in a future release.
[rank: 0] Seed set to 42
GPU available: True (cuda), used: True
TPU available: False, using: 0 TPU cores
💡 Tip: For seamless cloud logging and experiment tracking, try installing [litlogger](https://pypi.org/project/litlogger/) to enable LitLogger, which logs metrics and artifacts automatically to the Lightning Experiments platform.
LOCAL_RANK: 0 - CUDA_VISIBLE_DEVICES: [0]
SLURM auto-requeueing enabled. Setting signal handlers.
`Trainer.fit` stopped: `max_epochs=30` reached.
`Trainer.fit` stopped: `max_epochs=30` reached.
[I 2026-05-22 00:49:31,496] Trial 38 finished with value: 0.05415484390693129 and parameters: {'optimizer': 'adam', 'num_layers': 2, 'activation': 'elu', 'fc_layers': 'fc16', 'pool_size_l0': 4, 'out_channels_l0': 4, 'pool_size_l1': 3, 'out_channels_l1': 16}. Best is trial 9 with value: 0.022097016566148542.
[I 2026-05-22 00:49:34,384] Trial 36 finished with value: 0.04880974374141544 and parameters: {'optimizer': 'adam', 'num_layers': 1, 'activation': 'relu', 'fc_layers': 'fc128_64', 'pool_size_l0': 2, 'out_channels_l0': 16}. Best is trial 15 with value: 0.045786147144041764.
W0522 00:49:41.642000 2640521 .venv/lib/python3.12/site-packages/torch/utils/_pytree.py:630] <enum 'KernelPreference'> is an Enum subclass and is now natively supported by torch.compile as an opaque value type. Calling register_constant() on Enum subclasses is deprecated and will be an error in a future release.
[rank: 0] Seed set to 42
GPU available: True (cuda), used: True
TPU available: False, using: 0 TPU cores
💡 Tip: For seamless cloud logging and experiment tracking, try installing [litlogger](https://pypi.org/project/litlogger/) to enable LitLogger, which logs metrics and artifacts automatically to the Lightning Experiments platform.
W0522 00:49:44.281000 2640526 .venv/lib/python3.12/site-packages/torch/utils/_pytree.py:630] <enum 'KernelPreference'> is an Enum subclass and is now natively supported by torch.compile as an opaque value type. Calling register_constant() on Enum subclasses is deprecated and will be an error in a future release.
LOCAL_RANK: 0 - CUDA_VISIBLE_DEVICES: [0]
SLURM auto-requeueing enabled. Setting signal handlers.
[rank: 0] Seed set to 42
GPU available: True (cuda), used: True
TPU available: False, using: 0 TPU cores
💡 Tip: For seamless cloud logging and experiment tracking, try installing [litlogger](https://pypi.org/project/litlogger/) to enable LitLogger, which logs metrics and artifacts automatically to the Lightning Experiments platform.
LOCAL_RANK: 0 - CUDA_VISIBLE_DEVICES: [0]
SLURM auto-requeueing enabled. Setting signal handlers.
`Trainer.fit` stopped: `max_epochs=30` reached.
[I 2026-05-22 00:49:57,719] Trial 42 finished with value: 0.030056637683158218 and parameters: {'optimizer': 'adam', 'num_layers': 2, 'activation': 'relu', 'fc_layers': 'fc128', 'pool_size_l0': 4, 'out_channels_l0': 8, 'pool_size_l1': 2, 'out_channels_l1': 32}. Best is trial 38 with value: 0.027702430610653885.
W0522 00:50:11.211000 2640686 .venv/lib/python3.12/site-packages/torch/utils/_pytree.py:630] <enum 'KernelPreference'> is an Enum subclass and is now natively supported by torch.compile as an opaque value type. Calling register_constant() on Enum subclasses is deprecated and will be an error in a future release.
[rank: 0] Seed set to 42
GPU available: True (cuda), used: True
TPU available: False, using: 0 TPU cores
💡 Tip: For seamless cloud logging and experiment tracking, try installing [litlogger](https://pypi.org/project/litlogger/) to enable LitLogger, which logs metrics and artifacts automatically to the Lightning Experiments platform.
LOCAL_RANK: 0 - CUDA_VISIBLE_DEVICES: [0]
SLURM auto-requeueing enabled. Setting signal handlers.
`Trainer.fit` stopped: `max_epochs=30` reached.
[I 2026-05-22 00:50:32,682] Trial 39 finished with value: 0.02300240126843357 and parameters: {'optimizer': 'adamw', 'num_layers': 1, 'activation': 'elu', 'fc_layers': 'fc64_32', 'pool_size_l0': 2, 'out_channels_l0': 16}. Best is trial 9 with value: 0.022097016566148542.
`Trainer.fit` stopped: `max_epochs=30` reached.
[I 2026-05-22 00:50:36,936] Trial 37 finished with value: 0.047086415335227914 and parameters: {'optimizer': 'adamw', 'num_layers': 1, 'activation': 'relu', 'fc_layers': 'fc128_64', 'pool_size_l0': 3, 'out_channels_l0': 16}. Best is trial 15 with value: 0.045786147144041764.
W0522 00:50:42.924000 2640769 .venv/lib/python3.12/site-packages/torch/utils/_pytree.py:630] <enum 'KernelPreference'> is an Enum subclass and is now natively supported by torch.compile as an opaque value type. Calling register_constant() on Enum subclasses is deprecated and will be an error in a future release.
[rank: 0] Seed set to 42
GPU available: True (cuda), used: True
TPU available: False, using: 0 TPU cores
💡 Tip: For seamless cloud logging and experiment tracking, try installing [litlogger](https://pypi.org/project/litlogger/) to enable LitLogger, which logs metrics and artifacts automatically to the Lightning Experiments platform.
LOCAL_RANK: 0 - CUDA_VISIBLE_DEVICES: [0]
SLURM auto-requeueing enabled. Setting signal handlers.
W0522 00:50:46.673000 2640777 .venv/lib/python3.12/site-packages/torch/utils/_pytree.py:630] <enum 'KernelPreference'> is an Enum subclass and is now natively supported by torch.compile as an opaque value type. Calling register_constant() on Enum subclasses is deprecated and will be an error in a future release.
[rank: 0] Seed set to 42
GPU available: True (cuda), used: True
TPU available: False, using: 0 TPU cores
💡 Tip: For seamless cloud logging and experiment tracking, try installing [litlogger](https://pypi.org/project/litlogger/) to enable LitLogger, which logs metrics and artifacts automatically to the Lightning Experiments platform.
LOCAL_RANK: 0 - CUDA_VISIBLE_DEVICES: [0]
SLURM auto-requeueing enabled. Setting signal handlers.
`Trainer.fit` stopped: `max_epochs=30` reached.
[I 2026-05-22 00:50:58,167] Trial 43 finished with value: 0.030006483378863157 and parameters: {'optimizer': 'adam', 'num_layers': 2, 'activation': 'relu', 'fc_layers': 'fc128', 'pool_size_l0': 4, 'out_channels_l0': 8, 'pool_size_l1': 2, 'out_channels_l1': 32}. Best is trial 38 with value: 0.027702430610653885.
W0522 00:51:07.877000 2640934 .venv/lib/python3.12/site-packages/torch/utils/_pytree.py:630] <enum 'KernelPreference'> is an Enum subclass and is now natively supported by torch.compile as an opaque value type. Calling register_constant() on Enum subclasses is deprecated and will be an error in a future release.
[rank: 0] Seed set to 42
GPU available: True (cuda), used: True
TPU available: False, using: 0 TPU cores
💡 Tip: For seamless cloud logging and experiment tracking, try installing [litlogger](https://pypi.org/project/litlogger/) to enable LitLogger, which logs metrics and artifacts automatically to the Lightning Experiments platform.
LOCAL_RANK: 0 - CUDA_VISIBLE_DEVICES: [0]
SLURM auto-requeueing enabled. Setting signal handlers.
`Trainer.fit` stopped: `max_epochs=30` reached.
[I 2026-05-22 00:51:30,014] Trial 40 finished with value: 0.04656865731453103 and parameters: {'optimizer': 'adamw', 'num_layers': 1, 'activation': 'relu', 'fc_layers': 'fc128_64', 'pool_size_l0': 4, 'out_channels_l0': 4}. Best is trial 9 with value: 0.022097016566148542.
`Trainer.fit` stopped: `max_epochs=30` reached.
[I 2026-05-22 00:51:34,800] Trial 38 finished with value: 0.05170376368788032 and parameters: {'optimizer': 'adamw', 'num_layers': 1, 'activation': 'relu', 'fc_layers': 'fc128_64', 'pool_size_l0': 4, 'out_channels_l0': 16}. Best is trial 15 with value: 0.045786147144041764.
W0522 00:51:40.002000 2641014 .venv/lib/python3.12/site-packages/torch/utils/_pytree.py:630] <enum 'KernelPreference'> is an Enum subclass and is now natively supported by torch.compile as an opaque value type. Calling register_constant() on Enum subclasses is deprecated and will be an error in a future release.
[rank: 0] Seed set to 42
GPU available: True (cuda), used: True
TPU available: False, using: 0 TPU cores
💡 Tip: For seamless cloud logging and experiment tracking, try installing [litlogger](https://pypi.org/project/litlogger/) to enable LitLogger, which logs metrics and artifacts automatically to the Lightning Experiments platform.
LOCAL_RANK: 0 - CUDA_VISIBLE_DEVICES: [0]
SLURM auto-requeueing enabled. Setting signal handlers.
W0522 00:51:44.792000 2641023 .venv/lib/python3.12/site-packages/torch/utils/_pytree.py:630] <enum 'KernelPreference'> is an Enum subclass and is now natively supported by torch.compile as an opaque value type. Calling register_constant() on Enum subclasses is deprecated and will be an error in a future release.
[rank: 0] Seed set to 42
GPU available: True (cuda), used: True
TPU available: False, using: 0 TPU cores
💡 Tip: For seamless cloud logging and experiment tracking, try installing [litlogger](https://pypi.org/project/litlogger/) to enable LitLogger, which logs metrics and artifacts automatically to the Lightning Experiments platform.
LOCAL_RANK: 0 - CUDA_VISIBLE_DEVICES: [0]
SLURM auto-requeueing enabled. Setting signal handlers.
`Trainer.fit` stopped: `max_epochs=30` reached.
[I 2026-05-22 00:51:53,241] Trial 44 finished with value: 0.02992699939468739 and parameters: {'optimizer': 'adam', 'num_layers': 2, 'activation': 'relu', 'fc_layers': 'fc128', 'pool_size_l0': 4, 'out_channels_l0': 8, 'pool_size_l1': 2, 'out_channels_l1': 32}. Best is trial 38 with value: 0.027702430610653885.
W0522 00:52:03.198000 2641183 .venv/lib/python3.12/site-packages/torch/utils/_pytree.py:630] <enum 'KernelPreference'> is an Enum subclass and is now natively supported by torch.compile as an opaque value type. Calling register_constant() on Enum subclasses is deprecated and will be an error in a future release.
[rank: 0] Seed set to 42
GPU available: True (cuda), used: True
TPU available: False, using: 0 TPU cores
💡 Tip: For seamless cloud logging and experiment tracking, try installing [litlogger](https://pypi.org/project/litlogger/) to enable LitLogger, which logs metrics and artifacts automatically to the Lightning Experiments platform.
LOCAL_RANK: 0 - CUDA_VISIBLE_DEVICES: [0]
SLURM auto-requeueing enabled. Setting signal handlers.
`Trainer.fit` stopped: `max_epochs=30` reached.
[I 2026-05-22 00:52:26,735] Trial 39 finished with value: 0.0878811072731824 and parameters: {'optimizer': 'adamw', 'num_layers': 1, 'activation': 'relu', 'fc_layers': 'fc128', 'pool_size_l0': 2, 'out_channels_l0': 1}. Best is trial 15 with value: 0.045786147144041764.
`Trainer.fit` stopped: `max_epochs=30` reached.
