[I 2026-05-22 01:17:44,551] Trial 69 finished with value: 0.05194848063445306 and parameters: {'optimizer': 'adamw', 'num_layers': 1, 'activation': 'elu', 'fc_layers': 'fc128_64', 'pool_size_l0': 3, 'out_channels_l0': 8}. Best is trial 64 with value: 0.04503339323145774.
[I 2026-05-22 01:17:45,139] Trial 70 finished with value: 0.02300240126843357 and parameters: {'optimizer': 'adamw', 'num_layers': 1, 'activation': 'elu', 'fc_layers': 'fc64_32', 'pool_size_l0': 2, 'out_channels_l0': 16}. Best is trial 9 with value: 0.022097016566148542.
W0522 01:17:54.137000 2647874 .venv/lib/python3.12/site-packages/torch/utils/_pytree.py:630] <enum 'KernelPreference'> is an Enum subclass and is now natively supported by torch.compile as an opaque value type. Calling register_constant() on Enum subclasses is deprecated and will be an error in a future release.
W0522 01:17:54.464000 2647875 .venv/lib/python3.12/site-packages/torch/utils/_pytree.py:630] <enum 'KernelPreference'> is an Enum subclass and is now natively supported by torch.compile as an opaque value type. Calling register_constant() on Enum subclasses is deprecated and will be an error in a future release.
[rank: 0] Seed set to 42
GPU available: True (cuda), used: True
TPU available: False, using: 0 TPU cores
💡 Tip: For seamless cloud logging and experiment tracking, try installing [litlogger](https://pypi.org/project/litlogger/) to enable LitLogger, which logs metrics and artifacts automatically to the Lightning Experiments platform.
[rank: 0] Seed set to 42
GPU available: True (cuda), used: True
TPU available: False, using: 0 TPU cores
💡 Tip: For seamless cloud logging and experiment tracking, try installing [litlogger](https://pypi.org/project/litlogger/) to enable LitLogger, which logs metrics and artifacts automatically to the Lightning Experiments platform.
LOCAL_RANK: 0 - CUDA_VISIBLE_DEVICES: [0]
SLURM auto-requeueing enabled. Setting signal handlers.
LOCAL_RANK: 0 - CUDA_VISIBLE_DEVICES: [0]
SLURM auto-requeueing enabled. Setting signal handlers.
`Trainer.fit` stopped: `max_epochs=30` reached.
[I 2026-05-22 01:18:17,215] Trial 72 finished with value: 0.030010141641285126 and parameters: {'optimizer': 'adam', 'num_layers': 2, 'activation': 'relu', 'fc_layers': 'fc128', 'pool_size_l0': 4, 'out_channels_l0': 8, 'pool_size_l1': 2, 'out_channels_l1': 32}. Best is trial 38 with value: 0.027702430610653885.
W0522 01:18:27.280000 2648031 .venv/lib/python3.12/site-packages/torch/utils/_pytree.py:630] <enum 'KernelPreference'> is an Enum subclass and is now natively supported by torch.compile as an opaque value type. Calling register_constant() on Enum subclasses is deprecated and will be an error in a future release.
[rank: 0] Seed set to 42
GPU available: True (cuda), used: True
TPU available: False, using: 0 TPU cores
💡 Tip: For seamless cloud logging and experiment tracking, try installing [litlogger](https://pypi.org/project/litlogger/) to enable LitLogger, which logs metrics and artifacts automatically to the Lightning Experiments platform.
LOCAL_RANK: 0 - CUDA_VISIBLE_DEVICES: [0]
SLURM auto-requeueing enabled. Setting signal handlers.
`Trainer.fit` stopped: `max_epochs=30` reached.
[I 2026-05-22 01:18:38,194] Trial 70 finished with value: 0.06866422989206292 and parameters: {'optimizer': 'adamw', 'num_layers': 1, 'activation': 'elu', 'fc_layers': 'fc64', 'pool_size_l0': 3, 'out_channels_l0': 16}. Best is trial 64 with value: 0.04503339323145774.
`Trainer.fit` stopped: `max_epochs=30` reached.
[I 2026-05-22 01:18:42,792] Trial 71 finished with value: 0.02300240126843357 and parameters: {'optimizer': 'adamw', 'num_layers': 1, 'activation': 'elu', 'fc_layers': 'fc64_32', 'pool_size_l0': 2, 'out_channels_l0': 16}. Best is trial 9 with value: 0.022097016566148542.
W0522 01:18:47.975000 2648115 .venv/lib/python3.12/site-packages/torch/utils/_pytree.py:630] <enum 'KernelPreference'> is an Enum subclass and is now natively supported by torch.compile as an opaque value type. Calling register_constant() on Enum subclasses is deprecated and will be an error in a future release.
[rank: 0] Seed set to 42
GPU available: True (cuda), used: True
TPU available: False, using: 0 TPU cores
💡 Tip: For seamless cloud logging and experiment tracking, try installing [litlogger](https://pypi.org/project/litlogger/) to enable LitLogger, which logs metrics and artifacts automatically to the Lightning Experiments platform.
LOCAL_RANK: 0 - CUDA_VISIBLE_DEVICES: [0]
SLURM auto-requeueing enabled. Setting signal handlers.
W0522 01:18:52.175000 2648125 .venv/lib/python3.12/site-packages/torch/utils/_pytree.py:630] <enum 'KernelPreference'> is an Enum subclass and is now natively supported by torch.compile as an opaque value type. Calling register_constant() on Enum subclasses is deprecated and will be an error in a future release.
[rank: 0] Seed set to 42
GPU available: True (cuda), used: True
TPU available: False, using: 0 TPU cores
💡 Tip: For seamless cloud logging and experiment tracking, try installing [litlogger](https://pypi.org/project/litlogger/) to enable LitLogger, which logs metrics and artifacts automatically to the Lightning Experiments platform.
LOCAL_RANK: 0 - CUDA_VISIBLE_DEVICES: [0]
SLURM auto-requeueing enabled. Setting signal handlers.
`Trainer.fit` stopped: `max_epochs=30` reached.
[I 2026-05-22 01:19:12,655] Trial 73 finished with value: 0.03011111909158094 and parameters: {'optimizer': 'adam', 'num_layers': 2, 'activation': 'relu', 'fc_layers': 'fc128', 'pool_size_l0': 4, 'out_channels_l0': 8, 'pool_size_l1': 2, 'out_channels_l1': 32}. Best is trial 38 with value: 0.027702430610653885.
W0522 01:19:22.111000 2648280 .venv/lib/python3.12/site-packages/torch/utils/_pytree.py:630] <enum 'KernelPreference'> is an Enum subclass and is now natively supported by torch.compile as an opaque value type. Calling register_constant() on Enum subclasses is deprecated and will be an error in a future release.
[rank: 0] Seed set to 42
GPU available: True (cuda), used: True
TPU available: False, using: 0 TPU cores
💡 Tip: For seamless cloud logging and experiment tracking, try installing [litlogger](https://pypi.org/project/litlogger/) to enable LitLogger, which logs metrics and artifacts automatically to the Lightning Experiments platform.
LOCAL_RANK: 0 - CUDA_VISIBLE_DEVICES: [0]
SLURM auto-requeueing enabled. Setting signal handlers.
`Trainer.fit` stopped: `max_epochs=30` reached.
[I 2026-05-22 01:19:35,622] Trial 71 finished with value: 0.04503339323145774 and parameters: {'optimizer': 'adamw', 'num_layers': 1, 'activation': 'elu', 'fc_layers': 'fc128_64', 'pool_size_l0': 3, 'out_channels_l0': 16}. Best is trial 64 with value: 0.04503339323145774.
`Trainer.fit` stopped: `max_epochs=30` reached.
[I 2026-05-22 01:19:39,631] Trial 72 finished with value: 0.02300240126843357 and parameters: {'optimizer': 'adamw', 'num_layers': 1, 'activation': 'elu', 'fc_layers': 'fc64_32', 'pool_size_l0': 2, 'out_channels_l0': 16}. Best is trial 9 with value: 0.022097016566148542.
W0522 01:19:45.797000 2648363 .venv/lib/python3.12/site-packages/torch/utils/_pytree.py:630] <enum 'KernelPreference'> is an Enum subclass and is now natively supported by torch.compile as an opaque value type. Calling register_constant() on Enum subclasses is deprecated and will be an error in a future release.
[rank: 0] Seed set to 42
GPU available: True (cuda), used: True
TPU available: False, using: 0 TPU cores
💡 Tip: For seamless cloud logging and experiment tracking, try installing [litlogger](https://pypi.org/project/litlogger/) to enable LitLogger, which logs metrics and artifacts automatically to the Lightning Experiments platform.
LOCAL_RANK: 0 - CUDA_VISIBLE_DEVICES: [0]
SLURM auto-requeueing enabled. Setting signal handlers.
W0522 01:19:49.373000 2648371 .venv/lib/python3.12/site-packages/torch/utils/_pytree.py:630] <enum 'KernelPreference'> is an Enum subclass and is now natively supported by torch.compile as an opaque value type. Calling register_constant() on Enum subclasses is deprecated and will be an error in a future release.
[rank: 0] Seed set to 42
GPU available: True (cuda), used: True
TPU available: False, using: 0 TPU cores
💡 Tip: For seamless cloud logging and experiment tracking, try installing [litlogger](https://pypi.org/project/litlogger/) to enable LitLogger, which logs metrics and artifacts automatically to the Lightning Experiments platform.
LOCAL_RANK: 0 - CUDA_VISIBLE_DEVICES: [0]
SLURM auto-requeueing enabled. Setting signal handlers.
`Trainer.fit` stopped: `max_epochs=30` reached.
[I 2026-05-22 01:20:05,559] Trial 74 finished with value: 0.03856567169936243 and parameters: {'optimizer': 'adam', 'num_layers': 2, 'activation': 'relu', 'fc_layers': 'fc128', 'pool_size_l0': 4, 'out_channels_l0': 8, 'pool_size_l1': 2, 'out_channels_l1': 8}. Best is trial 38 with value: 0.027702430610653885.
[I 2026-05-22 01:20:05,569] Trial 75 pruned. Conv channel counts must be non-decreasing.
W0522 01:20:14.970000 2648529 .venv/lib/python3.12/site-packages/torch/utils/_pytree.py:630] <enum 'KernelPreference'> is an Enum subclass and is now natively supported by torch.compile as an opaque value type. Calling register_constant() on Enum subclasses is deprecated and will be an error in a future release.
[rank: 0] Seed set to 42
GPU available: True (cuda), used: True
TPU available: False, using: 0 TPU cores
💡 Tip: For seamless cloud logging and experiment tracking, try installing [litlogger](https://pypi.org/project/litlogger/) to enable LitLogger, which logs metrics and artifacts automatically to the Lightning Experiments platform.
LOCAL_RANK: 0 - CUDA_VISIBLE_DEVICES: [0]
SLURM auto-requeueing enabled. Setting signal handlers.
`Trainer.fit` stopped: `max_epochs=30` reached.
`Trainer.fit` stopped: `max_epochs=30` reached.
[I 2026-05-22 01:20:35,253] Trial 72 finished with value: 0.04503339323145774 and parameters: {'optimizer': 'adamw', 'num_layers': 1, 'activation': 'elu', 'fc_layers': 'fc128_64', 'pool_size_l0': 3, 'out_channels_l0': 16}. Best is trial 64 with value: 0.04503339323145774.
[I 2026-05-22 01:20:36,963] Trial 73 finished with value: 0.02300240126843357 and parameters: {'optimizer': 'adamw', 'num_layers': 1, 'activation': 'elu', 'fc_layers': 'fc64_32', 'pool_size_l0': 2, 'out_channels_l0': 16}. Best is trial 9 with value: 0.022097016566148542.
W0522 01:20:45.342000 2648613 .venv/lib/python3.12/site-packages/torch/utils/_pytree.py:630] <enum 'KernelPreference'> is an Enum subclass and is now natively supported by torch.compile as an opaque value type. Calling register_constant() on Enum subclasses is deprecated and will be an error in a future release.
[rank: 0] Seed set to 42
GPU available: True (cuda), used: True
TPU available: False, using: 0 TPU cores
💡 Tip: For seamless cloud logging and experiment tracking, try installing [litlogger](https://pypi.org/project/litlogger/) to enable LitLogger, which logs metrics and artifacts automatically to the Lightning Experiments platform.
W0522 01:20:47.251000 2648617 .venv/lib/python3.12/site-packages/torch/utils/_pytree.py:630] <enum 'KernelPreference'> is an Enum subclass and is now natively supported by torch.compile as an opaque value type. Calling register_constant() on Enum subclasses is deprecated and will be an error in a future release.
LOCAL_RANK: 0 - CUDA_VISIBLE_DEVICES: [0]
SLURM auto-requeueing enabled. Setting signal handlers.
[rank: 0] Seed set to 42
GPU available: True (cuda), used: True
TPU available: False, using: 0 TPU cores
💡 Tip: For seamless cloud logging and experiment tracking, try installing [litlogger](https://pypi.org/project/litlogger/) to enable LitLogger, which logs metrics and artifacts automatically to the Lightning Experiments platform.
LOCAL_RANK: 0 - CUDA_VISIBLE_DEVICES: [0]
SLURM auto-requeueing enabled. Setting signal handlers.
`Trainer.fit` stopped: `max_epochs=30` reached.
[I 2026-05-22 01:20:58,379] Trial 76 finished with value: 0.030557811188297264 and parameters: {'optimizer': 'adam', 'num_layers': 2, 'activation': 'relu', 'fc_layers': 'fc128', 'pool_size_l0': 4, 'out_channels_l0': 8, 'pool_size_l1': 2, 'out_channels_l1': 16}. Best is trial 38 with value: 0.027702430610653885.
W0522 01:21:07.876000 2648774 .venv/lib/python3.12/site-packages/torch/utils/_pytree.py:630] <enum 'KernelPreference'> is an Enum subclass and is now natively supported by torch.compile as an opaque value type. Calling register_constant() on Enum subclasses is deprecated and will be an error in a future release.
[rank: 0] Seed set to 42
GPU available: True (cuda), used: True
TPU available: False, using: 0 TPU cores
💡 Tip: For seamless cloud logging and experiment tracking, try installing [litlogger](https://pypi.org/project/litlogger/) to enable LitLogger, which logs metrics and artifacts automatically to the Lightning Experiments platform.
LOCAL_RANK: 0 - CUDA_VISIBLE_DEVICES: [0]
SLURM auto-requeueing enabled. Setting signal handlers.
`Trainer.fit` stopped: `max_epochs=30` reached.
`Trainer.fit` stopped: `max_epochs=30` reached.
[I 2026-05-22 01:21:33,845] Trial 74 finished with value: 0.04646858127710273 and parameters: {'optimizer': 'adamw', 'num_layers': 1, 'activation': 'elu', 'fc_layers': 'fc32', 'pool_size_l0': 2, 'out_channels_l0': 16}. Best is trial 9 with value: 0.022097016566148542.
[I 2026-05-22 01:21:36,000] Trial 73 finished with value: 0.04503339323145774 and parameters: {'optimizer': 'adamw', 'num_layers': 1, 'activation': 'elu', 'fc_layers': 'fc128_64', 'pool_size_l0': 3, 'out_channels_l0': 16}. Best is trial 64 with value: 0.04503339323145774.
W0522 01:21:44.368000 2648859 .venv/lib/python3.12/site-packages/torch/utils/_pytree.py:630] <enum 'KernelPreference'> is an Enum subclass and is now natively supported by torch.compile as an opaque value type. Calling register_constant() on Enum subclasses is deprecated and will be an error in a future release.
[rank: 0] Seed set to 42
GPU available: True (cuda), used: True
TPU available: False, using: 0 TPU cores
💡 Tip: For seamless cloud logging and experiment tracking, try installing [litlogger](https://pypi.org/project/litlogger/) to enable LitLogger, which logs metrics and artifacts automatically to the Lightning Experiments platform.
W0522 01:21:46.650000 2648863 .venv/lib/python3.12/site-packages/torch/utils/_pytree.py:630] <enum 'KernelPreference'> is an Enum subclass and is now natively supported by torch.compile as an opaque value type. Calling register_constant() on Enum subclasses is deprecated and will be an error in a future release.
LOCAL_RANK: 0 - CUDA_VISIBLE_DEVICES: [0]
SLURM auto-requeueing enabled. Setting signal handlers.
[rank: 0] Seed set to 42
GPU available: True (cuda), used: True
TPU available: False, using: 0 TPU cores
💡 Tip: For seamless cloud logging and experiment tracking, try installing [litlogger](https://pypi.org/project/litlogger/) to enable LitLogger, which logs metrics and artifacts automatically to the Lightning Experiments platform.
LOCAL_RANK: 0 - CUDA_VISIBLE_DEVICES: [0]
SLURM auto-requeueing enabled. Setting signal handlers.
`Trainer.fit` stopped: `max_epochs=30` reached.
[I 2026-05-22 01:21:56,832] Trial 77 finished with value: 0.033963752642469563 and parameters: {'optimizer': 'adam', 'num_layers': 2, 'activation': 'relu', 'fc_layers': 'fc64_32', 'pool_size_l0': 2, 'out_channels_l0': 4, 'pool_size_l1': 2, 'out_channels_l1': 32}. Best is trial 38 with value: 0.027702430610653885.
W0522 01:22:07.099000 2649021 .venv/lib/python3.12/site-packages/torch/utils/_pytree.py:630] <enum 'KernelPreference'> is an Enum subclass and is now natively supported by torch.compile as an opaque value type. Calling register_constant() on Enum subclasses is deprecated and will be an error in a future release.
[rank: 0] Seed set to 42
GPU available: True (cuda), used: True
TPU available: False, using: 0 TPU cores
💡 Tip: For seamless cloud logging and experiment tracking, try installing [litlogger](https://pypi.org/project/litlogger/) to enable LitLogger, which logs metrics and artifacts automatically to the Lightning Experiments platform.
LOCAL_RANK: 0 - CUDA_VISIBLE_DEVICES: [0]
SLURM auto-requeueing enabled. Setting signal handlers.
`Trainer.fit` stopped: `max_epochs=30` reached.
`Trainer.fit` stopped: `max_epochs=30` reached.
[I 2026-05-22 01:22:33,205] Trial 75 finished with value: 0.02300240126843357 and parameters: {'optimizer': 'adamw', 'num_layers': 1, 'activation': 'elu', 'fc_layers': 'fc64_32', 'pool_size_l0': 2, 'out_channels_l0': 16}. Best is trial 9 with value: 0.022097016566148542.
[I 2026-05-22 01:22:36,504] Trial 74 finished with value: 0.04503339323145774 and parameters: {'optimizer': 'adamw', 'num_layers': 1, 'activation': 'elu', 'fc_layers': 'fc128_64', 'pool_size_l0': 3, 'out_channels_l0': 16}. Best is trial 64 with value: 0.04503339323145774.
W0522 01:22:43.210000 2649106 .venv/lib/python3.12/site-packages/torch/utils/_pytree.py:630] <enum 'KernelPreference'> is an Enum subclass and is now natively supported by torch.compile as an opaque value type. Calling register_constant() on Enum subclasses is deprecated and will be an error in a future release.
[rank: 0] Seed set to 42
GPU available: True (cuda), used: True
TPU available: False, using: 0 TPU cores
💡 Tip: For seamless cloud logging and experiment tracking, try installing [litlogger](https://pypi.org/project/litlogger/) to enable LitLogger, which logs metrics and artifacts automatically to the Lightning Experiments platform.
LOCAL_RANK: 0 - CUDA_VISIBLE_DEVICES: [0]
SLURM auto-requeueing enabled. Setting signal handlers.
W0522 01:22:46.587000 2649111 .venv/lib/python3.12/site-packages/torch/utils/_pytree.py:630] <enum 'KernelPreference'> is an Enum subclass and is now natively supported by torch.compile as an opaque value type. Calling register_constant() on Enum subclasses is deprecated and will be an error in a future release.
[rank: 0] Seed set to 42
GPU available: True (cuda), used: True
TPU available: False, using: 0 TPU cores
💡 Tip: For seamless cloud logging and experiment tracking, try installing [litlogger](https://pypi.org/project/litlogger/) to enable LitLogger, which logs metrics and artifacts automatically to the Lightning Experiments platform.
LOCAL_RANK: 0 - CUDA_VISIBLE_DEVICES: [0]
SLURM auto-requeueing enabled. Setting signal handlers.
`Trainer.fit` stopped: `max_epochs=30` reached.
[I 2026-05-22 01:22:57,875] Trial 78 finished with value: 0.030072362187303404 and parameters: {'optimizer': 'adam', 'num_layers': 2, 'activation': 'relu', 'fc_layers': 'fc128', 'pool_size_l0': 4, 'out_channels_l0': 8, 'pool_size_l1': 2, 'out_channels_l1': 32}. Best is trial 38 with value: 0.027702430610653885.
W0522 01:23:07.786000 2649269 .venv/lib/python3.12/site-packages/torch/utils/_pytree.py:630] <enum 'KernelPreference'> is an Enum subclass and is now natively supported by torch.compile as an opaque value type. Calling register_constant() on Enum subclasses is deprecated and will be an error in a future release.
[rank: 0] Seed set to 42
GPU available: True (cuda), used: True
TPU available: False, using: 0 TPU cores
💡 Tip: For seamless cloud logging and experiment tracking, try installing [litlogger](https://pypi.org/project/litlogger/) to enable LitLogger, which logs metrics and artifacts automatically to the Lightning Experiments platform.
LOCAL_RANK: 0 - CUDA_VISIBLE_DEVICES: [0]
SLURM auto-requeueing enabled. Setting signal handlers.
`Trainer.fit` stopped: `max_epochs=30` reached.
`Trainer.fit` stopped: `max_epochs=30` reached.
[I 2026-05-22 01:23:31,044] Trial 76 finished with value: 0.0360549545768168 and parameters: {'optimizer': 'adamw', 'num_layers': 2, 'activation': 'relu', 'fc_layers': 'fc64', 'pool_size_l0': 2, 'out_channels_l0': 16, 'pool_size_l1': 2, 'out_channels_l1': 16}. Best is trial 9 with value: 0.022097016566148542.
[I 2026-05-22 01:23:31,056] Trial 77 pruned. Conv channel counts must be non-decreasing.
[I 2026-05-22 01:23:32,951] Trial 75 finished with value: 0.04503339323145774 and parameters: {'optimizer': 'adamw', 'num_layers': 1, 'activation': 'elu', 'fc_layers': 'fc128_64', 'pool_size_l0': 3, 'out_channels_l0': 16}. Best is trial 64 with value: 0.04503339323145774.
W0522 01:23:39.960000 2649351 .venv/lib/python3.12/site-packages/torch/utils/_pytree.py:630] <enum 'KernelPreference'> is an Enum subclass and is now natively supported by torch.compile as an opaque value type. Calling register_constant() on Enum subclasses is deprecated and will be an error in a future release.
[rank: 0] Seed set to 42
GPU available: True (cuda), used: True
TPU available: False, using: 0 TPU cores
💡 Tip: For seamless cloud logging and experiment tracking, try installing [litlogger](https://pypi.org/project/litlogger/) to enable LitLogger, which logs metrics and artifacts automatically to the Lightning Experiments platform.
W0522 01:23:41.860000 2649354 .venv/lib/python3.12/site-packages/torch/utils/_pytree.py:630] <enum 'KernelPreference'> is an Enum subclass and is now natively supported by torch.compile as an opaque value type. Calling register_constant() on Enum subclasses is deprecated and will be an error in a future release.
LOCAL_RANK: 0 - CUDA_VISIBLE_DEVICES: [0]
SLURM auto-requeueing enabled. Setting signal handlers.
[rank: 0] Seed set to 42
GPU available: True (cuda), used: True
TPU available: False, using: 0 TPU cores
💡 Tip: For seamless cloud logging and experiment tracking, try installing [litlogger](https://pypi.org/project/litlogger/) to enable LitLogger, which logs metrics and artifacts automatically to the Lightning Experiments platform.
LOCAL_RANK: 0 - CUDA_VISIBLE_DEVICES: [0]
SLURM auto-requeueing enabled. Setting signal handlers.
`Trainer.fit` stopped: `max_epochs=30` reached.
