[I 2026-05-22 00:58:30,007] Trial 47 finished with value: 0.04183865554830305 and parameters: {'optimizer': 'adamw', 'num_layers': 1, 'activation': 'elu', 'fc_layers': 'fc64', 'pool_size_l0': 2, 'out_channels_l0': 4}. Best is trial 9 with value: 0.022097016566148542.
W0522 00:58:36.715000 2642782 .venv/lib/python3.12/site-packages/torch/utils/_pytree.py:630] <enum 'KernelPreference'> is an Enum subclass and is now natively supported by torch.compile as an opaque value type. Calling register_constant() on Enum subclasses is deprecated and will be an error in a future release.
[rank: 0] Seed set to 42
GPU available: True (cuda), used: True
TPU available: False, using: 0 TPU cores
💡 Tip: For seamless cloud logging and experiment tracking, try installing [litlogger](https://pypi.org/project/litlogger/) to enable LitLogger, which logs metrics and artifacts automatically to the Lightning Experiments platform.
LOCAL_RANK: 0 - CUDA_VISIBLE_DEVICES: [0]
SLURM auto-requeueing enabled. Setting signal handlers.
W0522 00:58:40.482000 2642844 .venv/lib/python3.12/site-packages/torch/utils/_pytree.py:630] <enum 'KernelPreference'> is an Enum subclass and is now natively supported by torch.compile as an opaque value type. Calling register_constant() on Enum subclasses is deprecated and will be an error in a future release.
[rank: 0] Seed set to 42
GPU available: True (cuda), used: True
TPU available: False, using: 0 TPU cores
💡 Tip: For seamless cloud logging and experiment tracking, try installing [litlogger](https://pypi.org/project/litlogger/) to enable LitLogger, which logs metrics and artifacts automatically to the Lightning Experiments platform.
LOCAL_RANK: 0 - CUDA_VISIBLE_DEVICES: [0]
SLURM auto-requeueing enabled. Setting signal handlers.
`Trainer.fit` stopped: `max_epochs=30` reached.
[I 2026-05-22 00:59:11,168] Trial 48 finished with value: 0.1079034073186456 and parameters: {'optimizer': 'adamw', 'num_layers': 1, 'activation': 'relu', 'fc_layers': 'fc128_64', 'pool_size_l0': 2, 'out_channels_l0': 1}. Best is trial 15 with value: 0.045786147144041764.
`Trainer.fit` stopped: `max_epochs=30` reached.
W0522 00:59:21.645000 2643011 .venv/lib/python3.12/site-packages/torch/utils/_pytree.py:630] <enum 'KernelPreference'> is an Enum subclass and is now natively supported by torch.compile as an opaque value type. Calling register_constant() on Enum subclasses is deprecated and will be an error in a future release.
[rank: 0] Seed set to 42
GPU available: True (cuda), used: True
TPU available: False, using: 0 TPU cores
💡 Tip: For seamless cloud logging and experiment tracking, try installing [litlogger](https://pypi.org/project/litlogger/) to enable LitLogger, which logs metrics and artifacts automatically to the Lightning Experiments platform.
LOCAL_RANK: 0 - CUDA_VISIBLE_DEVICES: [0]
SLURM auto-requeueing enabled. Setting signal handlers.
[I 2026-05-22 00:59:24,542] Trial 52 finished with value: 0.03017176180089514 and parameters: {'optimizer': 'adam', 'num_layers': 2, 'activation': 'relu', 'fc_layers': 'fc128', 'pool_size_l0': 4, 'out_channels_l0': 8, 'pool_size_l1': 2, 'out_channels_l1': 32}. Best is trial 38 with value: 0.027702430610653885.
`Trainer.fit` stopped: `max_epochs=30` reached.
[I 2026-05-22 00:59:30,604] Trial 48 finished with value: 0.027817475403879875 and parameters: {'optimizer': 'adamw', 'num_layers': 1, 'activation': 'elu', 'fc_layers': 'fc64_32', 'pool_size_l0': 3, 'out_channels_l0': 16}. Best is trial 9 with value: 0.022097016566148542.
W0522 00:59:34.043000 2643022 .venv/lib/python3.12/site-packages/torch/utils/_pytree.py:630] <enum 'KernelPreference'> is an Enum subclass and is now natively supported by torch.compile as an opaque value type. Calling register_constant() on Enum subclasses is deprecated and will be an error in a future release.
[rank: 0] Seed set to 42
GPU available: True (cuda), used: True
TPU available: False, using: 0 TPU cores
💡 Tip: For seamless cloud logging and experiment tracking, try installing [litlogger](https://pypi.org/project/litlogger/) to enable LitLogger, which logs metrics and artifacts automatically to the Lightning Experiments platform.
LOCAL_RANK: 0 - CUDA_VISIBLE_DEVICES: [0]
SLURM auto-requeueing enabled. Setting signal handlers.
W0522 00:59:41.363000 2643091 .venv/lib/python3.12/site-packages/torch/utils/_pytree.py:630] <enum 'KernelPreference'> is an Enum subclass and is now natively supported by torch.compile as an opaque value type. Calling register_constant() on Enum subclasses is deprecated and will be an error in a future release.
[rank: 0] Seed set to 42
GPU available: True (cuda), used: True
TPU available: False, using: 0 TPU cores
💡 Tip: For seamless cloud logging and experiment tracking, try installing [litlogger](https://pypi.org/project/litlogger/) to enable LitLogger, which logs metrics and artifacts automatically to the Lightning Experiments platform.
LOCAL_RANK: 0 - CUDA_VISIBLE_DEVICES: [0]
SLURM auto-requeueing enabled. Setting signal handlers.
`Trainer.fit` stopped: `max_epochs=30` reached.
[I 2026-05-22 01:00:10,399] Trial 49 finished with value: 0.047086415335227914 and parameters: {'optimizer': 'adamw', 'num_layers': 1, 'activation': 'relu', 'fc_layers': 'fc128_64', 'pool_size_l0': 3, 'out_channels_l0': 16}. Best is trial 15 with value: 0.045786147144041764.
[I 2026-05-22 01:00:10,410] Trial 50 pruned. Conv channel counts must be non-decreasing.
`Trainer.fit` stopped: `max_epochs=30` reached.
[I 2026-05-22 01:00:25,343] Trial 53 finished with value: 0.029985128315757045 and parameters: {'optimizer': 'adam', 'num_layers': 2, 'activation': 'relu', 'fc_layers': 'fc128', 'pool_size_l0': 4, 'out_channels_l0': 8, 'pool_size_l1': 2, 'out_channels_l1': 32}. Best is trial 38 with value: 0.027702430610653885.
`Trainer.fit` stopped: `max_epochs=30` reached.
W0522 01:00:27.331000 2643259 .venv/lib/python3.12/site-packages/torch/utils/_pytree.py:630] <enum 'KernelPreference'> is an Enum subclass and is now natively supported by torch.compile as an opaque value type. Calling register_constant() on Enum subclasses is deprecated and will be an error in a future release.
[rank: 0] Seed set to 42
GPU available: True (cuda), used: True
TPU available: False, using: 0 TPU cores
💡 Tip: For seamless cloud logging and experiment tracking, try installing [litlogger](https://pypi.org/project/litlogger/) to enable LitLogger, which logs metrics and artifacts automatically to the Lightning Experiments platform.
LOCAL_RANK: 0 - CUDA_VISIBLE_DEVICES: [0]
SLURM auto-requeueing enabled. Setting signal handlers.
[I 2026-05-22 01:00:30,202] Trial 49 finished with value: 0.05401327540495173 and parameters: {'optimizer': 'adamw', 'num_layers': 2, 'activation': 'elu', 'fc_layers': 'fc16', 'pool_size_l0': 4, 'out_channels_l0': 8, 'pool_size_l1': 3, 'out_channels_l1': 24}. Best is trial 9 with value: 0.022097016566148542.
[I 2026-05-22 01:00:30,212] Trial 50 pruned. Conv channel counts must be non-decreasing.
W0522 01:00:35.036000 2643263 .venv/lib/python3.12/site-packages/torch/utils/_pytree.py:630] <enum 'KernelPreference'> is an Enum subclass and is now natively supported by torch.compile as an opaque value type. Calling register_constant() on Enum subclasses is deprecated and will be an error in a future release.
[rank: 0] Seed set to 42
GPU available: True (cuda), used: True
TPU available: False, using: 0 TPU cores
💡 Tip: For seamless cloud logging and experiment tracking, try installing [litlogger](https://pypi.org/project/litlogger/) to enable LitLogger, which logs metrics and artifacts automatically to the Lightning Experiments platform.
LOCAL_RANK: 0 - CUDA_VISIBLE_DEVICES: [0]
SLURM auto-requeueing enabled. Setting signal handlers.
W0522 01:00:39.989000 2643273 .venv/lib/python3.12/site-packages/torch/utils/_pytree.py:630] <enum 'KernelPreference'> is an Enum subclass and is now natively supported by torch.compile as an opaque value type. Calling register_constant() on Enum subclasses is deprecated and will be an error in a future release.
[rank: 0] Seed set to 42
GPU available: True (cuda), used: True
TPU available: False, using: 0 TPU cores
💡 Tip: For seamless cloud logging and experiment tracking, try installing [litlogger](https://pypi.org/project/litlogger/) to enable LitLogger, which logs metrics and artifacts automatically to the Lightning Experiments platform.
LOCAL_RANK: 0 - CUDA_VISIBLE_DEVICES: [0]
SLURM auto-requeueing enabled. Setting signal handlers.
`Trainer.fit` stopped: `max_epochs=30` reached.
[I 2026-05-22 01:01:16,009] Trial 51 finished with value: 0.047086415335227914 and parameters: {'optimizer': 'adamw', 'num_layers': 1, 'activation': 'relu', 'fc_layers': 'fc128_64', 'pool_size_l0': 3, 'out_channels_l0': 16}. Best is trial 15 with value: 0.045786147144041764.
`Trainer.fit` stopped: `max_epochs=30` reached.
`Trainer.fit` stopped: `max_epochs=30` reached.
[I 2026-05-22 01:01:25,164] Trial 54 finished with value: 0.03702866106155716 and parameters: {'optimizer': 'adam', 'num_layers': 2, 'activation': 'relu', 'fc_layers': 'fc64_32', 'pool_size_l0': 4, 'out_channels_l0': 8, 'pool_size_l1': 2, 'out_channels_l1': 32}. Best is trial 38 with value: 0.027702430610653885.
W0522 01:01:27.241000 2643521 .venv/lib/python3.12/site-packages/torch/utils/_pytree.py:630] <enum 'KernelPreference'> is an Enum subclass and is now natively supported by torch.compile as an opaque value type. Calling register_constant() on Enum subclasses is deprecated and will be an error in a future release.
[I 2026-05-22 01:01:27,966] Trial 51 finished with value: 0.02300240126843357 and parameters: {'optimizer': 'adamw', 'num_layers': 1, 'activation': 'elu', 'fc_layers': 'fc64_32', 'pool_size_l0': 2, 'out_channels_l0': 16}. Best is trial 9 with value: 0.022097016566148542.
[rank: 0] Seed set to 42
GPU available: True (cuda), used: True
TPU available: False, using: 0 TPU cores
💡 Tip: For seamless cloud logging and experiment tracking, try installing [litlogger](https://pypi.org/project/litlogger/) to enable LitLogger, which logs metrics and artifacts automatically to the Lightning Experiments platform.
LOCAL_RANK: 0 - CUDA_VISIBLE_DEVICES: [0]
SLURM auto-requeueing enabled. Setting signal handlers.
W0522 01:01:34.403000 2643527 .venv/lib/python3.12/site-packages/torch/utils/_pytree.py:630] <enum 'KernelPreference'> is an Enum subclass and is now natively supported by torch.compile as an opaque value type. Calling register_constant() on Enum subclasses is deprecated and will be an error in a future release.
[rank: 0] Seed set to 42
GPU available: True (cuda), used: True
TPU available: False, using: 0 TPU cores
💡 Tip: For seamless cloud logging and experiment tracking, try installing [litlogger](https://pypi.org/project/litlogger/) to enable LitLogger, which logs metrics and artifacts automatically to the Lightning Experiments platform.
LOCAL_RANK: 0 - CUDA_VISIBLE_DEVICES: [0]
SLURM auto-requeueing enabled. Setting signal handlers.
W0522 01:01:37.839000 2643530 .venv/lib/python3.12/site-packages/torch/utils/_pytree.py:630] <enum 'KernelPreference'> is an Enum subclass and is now natively supported by torch.compile as an opaque value type. Calling register_constant() on Enum subclasses is deprecated and will be an error in a future release.
[rank: 0] Seed set to 42
GPU available: True (cuda), used: True
TPU available: False, using: 0 TPU cores
💡 Tip: For seamless cloud logging and experiment tracking, try installing [litlogger](https://pypi.org/project/litlogger/) to enable LitLogger, which logs metrics and artifacts automatically to the Lightning Experiments platform.
LOCAL_RANK: 0 - CUDA_VISIBLE_DEVICES: [0]
SLURM auto-requeueing enabled. Setting signal handlers.
`Trainer.fit` stopped: `max_epochs=30` reached.
[I 2026-05-22 01:02:15,411] Trial 52 finished with value: 0.047086415335227914 and parameters: {'optimizer': 'adamw', 'num_layers': 1, 'activation': 'relu', 'fc_layers': 'fc128_64', 'pool_size_l0': 3, 'out_channels_l0': 16}. Best is trial 15 with value: 0.045786147144041764.
`Trainer.fit` stopped: `max_epochs=30` reached.
[I 2026-05-22 01:02:20,389] Trial 55 finished with value: 0.03304113702032541 and parameters: {'optimizer': 'adam', 'num_layers': 2, 'activation': 'relu', 'fc_layers': 'fc16', 'pool_size_l0': 4, 'out_channels_l0': 8, 'pool_size_l1': 2, 'out_channels_l1': 32}. Best is trial 38 with value: 0.027702430610653885.
`Trainer.fit` stopped: `max_epochs=30` reached.
W0522 01:02:25.664000 2643776 .venv/lib/python3.12/site-packages/torch/utils/_pytree.py:630] <enum 'KernelPreference'> is an Enum subclass and is now natively supported by torch.compile as an opaque value type. Calling register_constant() on Enum subclasses is deprecated and will be an error in a future release.
[rank: 0] Seed set to 42
GPU available: True (cuda), used: True
TPU available: False, using: 0 TPU cores
💡 Tip: For seamless cloud logging and experiment tracking, try installing [litlogger](https://pypi.org/project/litlogger/) to enable LitLogger, which logs metrics and artifacts automatically to the Lightning Experiments platform.
[I 2026-05-22 01:02:28,333] Trial 52 finished with value: 0.02300240126843357 and parameters: {'optimizer': 'adamw', 'num_layers': 1, 'activation': 'elu', 'fc_layers': 'fc64_32', 'pool_size_l0': 2, 'out_channels_l0': 16}. Best is trial 9 with value: 0.022097016566148542.
LOCAL_RANK: 0 - CUDA_VISIBLE_DEVICES: [0]
SLURM auto-requeueing enabled. Setting signal handlers.
W0522 01:02:30.458000 2643780 .venv/lib/python3.12/site-packages/torch/utils/_pytree.py:630] <enum 'KernelPreference'> is an Enum subclass and is now natively supported by torch.compile as an opaque value type. Calling register_constant() on Enum subclasses is deprecated and will be an error in a future release.
[rank: 0] Seed set to 42
GPU available: True (cuda), used: True
TPU available: False, using: 0 TPU cores
💡 Tip: For seamless cloud logging and experiment tracking, try installing [litlogger](https://pypi.org/project/litlogger/) to enable LitLogger, which logs metrics and artifacts automatically to the Lightning Experiments platform.
LOCAL_RANK: 0 - CUDA_VISIBLE_DEVICES: [0]
SLURM auto-requeueing enabled. Setting signal handlers.
W0522 01:02:38.340000 2643827 .venv/lib/python3.12/site-packages/torch/utils/_pytree.py:630] <enum 'KernelPreference'> is an Enum subclass and is now natively supported by torch.compile as an opaque value type. Calling register_constant() on Enum subclasses is deprecated and will be an error in a future release.
[rank: 0] Seed set to 42
GPU available: True (cuda), used: True
TPU available: False, using: 0 TPU cores
💡 Tip: For seamless cloud logging and experiment tracking, try installing [litlogger](https://pypi.org/project/litlogger/) to enable LitLogger, which logs metrics and artifacts automatically to the Lightning Experiments platform.
LOCAL_RANK: 0 - CUDA_VISIBLE_DEVICES: [0]
SLURM auto-requeueing enabled. Setting signal handlers.
`Trainer.fit` stopped: `max_epochs=30` reached.
`Trainer.fit` stopped: `max_epochs=30` reached.
[I 2026-05-22 01:03:15,422] Trial 53 finished with value: 0.047086415335227914 and parameters: {'optimizer': 'adamw', 'num_layers': 1, 'activation': 'relu', 'fc_layers': 'fc128_64', 'pool_size_l0': 3, 'out_channels_l0': 16}. Best is trial 15 with value: 0.045786147144041764.
[I 2026-05-22 01:03:17,612] Trial 56 finished with value: 0.033572008637722035 and parameters: {'optimizer': 'adam', 'num_layers': 2, 'activation': 'relu', 'fc_layers': 'fc32', 'pool_size_l0': 4, 'out_channels_l0': 8, 'pool_size_l1': 2, 'out_channels_l1': 32}. Best is trial 38 with value: 0.027702430610653885.
`Trainer.fit` stopped: `max_epochs=30` reached.
W0522 01:03:24.765000 2644087 .venv/lib/python3.12/site-packages/torch/utils/_pytree.py:630] <enum 'KernelPreference'> is an Enum subclass and is now natively supported by torch.compile as an opaque value type. Calling register_constant() on Enum subclasses is deprecated and will be an error in a future release.
[rank: 0] Seed set to 42
GPU available: True (cuda), used: True
TPU available: False, using: 0 TPU cores
💡 Tip: For seamless cloud logging and experiment tracking, try installing [litlogger](https://pypi.org/project/litlogger/) to enable LitLogger, which logs metrics and artifacts automatically to the Lightning Experiments platform.
LOCAL_RANK: 0 - CUDA_VISIBLE_DEVICES: [0]
[I 2026-05-22 01:03:27,056] Trial 53 finished with value: 0.02300240126843357 and parameters: {'optimizer': 'adamw', 'num_layers': 1, 'activation': 'elu', 'fc_layers': 'fc64_32', 'pool_size_l0': 2, 'out_channels_l0': 16}. Best is trial 9 with value: 0.022097016566148542.
W0522 01:03:27.260000 2644089 .venv/lib/python3.12/site-packages/torch/utils/_pytree.py:630] <enum 'KernelPreference'> is an Enum subclass and is now natively supported by torch.compile as an opaque value type. Calling register_constant() on Enum subclasses is deprecated and will be an error in a future release.
SLURM auto-requeueing enabled. Setting signal handlers.
[rank: 0] Seed set to 42
GPU available: True (cuda), used: True
TPU available: False, using: 0 TPU cores
💡 Tip: For seamless cloud logging and experiment tracking, try installing [litlogger](https://pypi.org/project/litlogger/) to enable LitLogger, which logs metrics and artifacts automatically to the Lightning Experiments platform.
LOCAL_RANK: 0 - CUDA_VISIBLE_DEVICES: [0]
SLURM auto-requeueing enabled. Setting signal handlers.
W0522 01:03:36.928000 2644097 .venv/lib/python3.12/site-packages/torch/utils/_pytree.py:630] <enum 'KernelPreference'> is an Enum subclass and is now natively supported by torch.compile as an opaque value type. Calling register_constant() on Enum subclasses is deprecated and will be an error in a future release.
[rank: 0] Seed set to 42
GPU available: True (cuda), used: True
TPU available: False, using: 0 TPU cores
💡 Tip: For seamless cloud logging and experiment tracking, try installing [litlogger](https://pypi.org/project/litlogger/) to enable LitLogger, which logs metrics and artifacts automatically to the Lightning Experiments platform.
LOCAL_RANK: 0 - CUDA_VISIBLE_DEVICES: [0]
SLURM auto-requeueing enabled. Setting signal handlers.
`Trainer.fit` stopped: `max_epochs=30` reached.
[I 2026-05-22 01:04:10,090] Trial 54 finished with value: 0.06229273156066038 and parameters: {'optimizer': 'adamw', 'num_layers': 1, 'activation': 'relu', 'fc_layers': 'fc128_64', 'pool_size_l0': 3, 'out_channels_l0': 4}. Best is trial 15 with value: 0.045786147144041764.
`Trainer.fit` stopped: `max_epochs=30` reached.
[I 2026-05-22 01:04:14,645] Trial 57 finished with value: 0.030084054732753593 and parameters: {'optimizer': 'adam', 'num_layers': 2, 'activation': 'relu', 'fc_layers': 'fc128', 'pool_size_l0': 4, 'out_channels_l0': 8, 'pool_size_l1': 2, 'out_channels_l1': 32}. Best is trial 38 with value: 0.027702430610653885.
W0522 01:04:19.823000 2644332 .venv/lib/python3.12/site-packages/torch/utils/_pytree.py:630] <enum 'KernelPreference'> is an Enum subclass and is now natively supported by torch.compile as an opaque value type. Calling register_constant() on Enum subclasses is deprecated and will be an error in a future release.
`Trainer.fit` stopped: `max_epochs=30` reached.
[rank: 0] Seed set to 42
GPU available: True (cuda), used: True
TPU available: False, using: 0 TPU cores
💡 Tip: For seamless cloud logging and experiment tracking, try installing [litlogger](https://pypi.org/project/litlogger/) to enable LitLogger, which logs metrics and artifacts automatically to the Lightning Experiments platform.
LOCAL_RANK: 0 - CUDA_VISIBLE_DEVICES: [0]
SLURM auto-requeueing enabled. Setting signal handlers.
W0522 01:04:23.842000 2644336 .venv/lib/python3.12/site-packages/torch/utils/_pytree.py:630] <enum 'KernelPreference'> is an Enum subclass and is now natively supported by torch.compile as an opaque value type. Calling register_constant() on Enum subclasses is deprecated and will be an error in a future release.
[I 2026-05-22 01:04:23,917] Trial 54 finished with value: 0.02300240126843357 and parameters: {'optimizer': 'adamw', 'num_layers': 1, 'activation': 'elu', 'fc_layers': 'fc64_32', 'pool_size_l0': 2, 'out_channels_l0': 16}. Best is trial 9 with value: 0.022097016566148542.
[rank: 0] Seed set to 42
GPU available: True (cuda), used: True
TPU available: False, using: 0 TPU cores
💡 Tip: For seamless cloud logging and experiment tracking, try installing [litlogger](https://pypi.org/project/litlogger/) to enable LitLogger, which logs metrics and artifacts automatically to the Lightning Experiments platform.
LOCAL_RANK: 0 - CUDA_VISIBLE_DEVICES: [0]
SLURM auto-requeueing enabled. Setting signal handlers.
W0522 01:04:34.630000 2644413 .venv/lib/python3.12/site-packages/torch/utils/_pytree.py:630] <enum 'KernelPreference'> is an Enum subclass and is now natively supported by torch.compile as an opaque value type. Calling register_constant() on Enum subclasses is deprecated and will be an error in a future release.
[rank: 0] Seed set to 42
GPU available: True (cuda), used: True
TPU available: False, using: 0 TPU cores
💡 Tip: For seamless cloud logging and experiment tracking, try installing [litlogger](https://pypi.org/project/litlogger/) to enable LitLogger, which logs metrics and artifacts automatically to the Lightning Experiments platform.
LOCAL_RANK: 0 - CUDA_VISIBLE_DEVICES: [0]
SLURM auto-requeueing enabled. Setting signal handlers.
`Trainer.fit` stopped: `max_epochs=30` reached.
[I 2026-05-22 01:05:04,993] Trial 55 finished with value: 0.057259141520319794 and parameters: {'optimizer': 'adamw', 'num_layers': 1, 'activation': 'relu', 'fc_layers': 'fc64', 'pool_size_l0': 3, 'out_channels_l0': 16}. Best is trial 15 with value: 0.045786147144041764.
`Trainer.fit` stopped: `max_epochs=30` reached.
