W0522 00:16:10.288000 2631784 .venv/lib/python3.12/site-packages/torch/utils/_pytree.py:630] <enum 'KernelPreference'> is an Enum subclass and is now natively supported by torch.compile as an opaque value type. Calling register_constant() on Enum subclasses is deprecated and will be an error in a future release.
[I 2026-05-22 00:16:10,414] A new study created in memory with name: no-name-52ff138e-6d8e-450f-b52a-ddc8d678ac4d
[I 2026-05-22 00:16:10,416] A new study created in memory with name: no-name-a31f5c97-8f87-4ddd-8ed5-26296c5e4c7a
[I 2026-05-22 00:16:10,417] A new study created in memory with name: no-name-dfa6c13b-71fd-4e56-b033-2fbe2798c802
[I 2026-05-22 00:16:10,421] Trial 0 pruned. Conv channel counts must be non-decreasing.
W0522 00:16:20.080000 2631796 .venv/lib/python3.12/site-packages/torch/utils/_pytree.py:630] <enum 'KernelPreference'> is an Enum subclass and is now natively supported by torch.compile as an opaque value type. Calling register_constant() on Enum subclasses is deprecated and will be an error in a future release.
W0522 00:16:20.097000 2631797 .venv/lib/python3.12/site-packages/torch/utils/_pytree.py:630] <enum 'KernelPreference'> is an Enum subclass and is now natively supported by torch.compile as an opaque value type. Calling register_constant() on Enum subclasses is deprecated and will be an error in a future release.
W0522 00:16:20.102000 2631798 .venv/lib/python3.12/site-packages/torch/utils/_pytree.py:630] <enum 'KernelPreference'> is an Enum subclass and is now natively supported by torch.compile as an opaque value type. Calling register_constant() on Enum subclasses is deprecated and will be an error in a future release.
[rank: 0] Seed set to 42
[rank: 0] Seed set to 42
[rank: 0] Seed set to 42
GPU available: True (cuda), used: True
TPU available: False, using: 0 TPU cores
GPU available: True (cuda), used: True
TPU available: False, using: 0 TPU cores
💡 Tip: For seamless cloud logging and experiment tracking, try installing [litlogger](https://pypi.org/project/litlogger/) to enable LitLogger, which logs metrics and artifacts automatically to the Lightning Experiments platform.
💡 Tip: For seamless cloud logging and experiment tracking, try installing [litlogger](https://pypi.org/project/litlogger/) to enable LitLogger, which logs metrics and artifacts automatically to the Lightning Experiments platform.
GPU available: True (cuda), used: True
TPU available: False, using: 0 TPU cores
💡 Tip: For seamless cloud logging and experiment tracking, try installing [litlogger](https://pypi.org/project/litlogger/) to enable LitLogger, which logs metrics and artifacts automatically to the Lightning Experiments platform.
LOCAL_RANK: 0 - CUDA_VISIBLE_DEVICES: [0]
LOCAL_RANK: 0 - CUDA_VISIBLE_DEVICES: [0]
LOCAL_RANK: 0 - CUDA_VISIBLE_DEVICES: [0]
SLURM auto-requeueing enabled. Setting signal handlers.
SLURM auto-requeueing enabled. Setting signal handlers.
SLURM auto-requeueing enabled. Setting signal handlers.
`Trainer.fit` stopped: `max_epochs=30` reached.
`Trainer.fit` stopped: `max_epochs=30` reached.
`Trainer.fit` stopped: `max_epochs=30` reached.
[I 2026-05-22 00:17:09,726] Trial 0 finished with value: 1.9456809371755117 and parameters: {'optimizer': 'adam', 'num_layers': 1, 'activation': 'relu', 'fc_layers': 'fc64', 'pool_size_l0': 2, 'out_channels_l0': 1}. Best is trial 0 with value: 1.9456809371755117.
[I 2026-05-22 00:17:09,749] Trial 1 finished with value: 0.05456459237336861 and parameters: {'optimizer': 'adam', 'num_layers': 1, 'activation': 'relu', 'fc_layers': 'fc16', 'pool_size_l0': 3, 'out_channels_l0': 4}. Best is trial 1 with value: 0.05456459237336861.
[I 2026-05-22 00:17:10,908] Trial 0 finished with value: 0.0408243287919173 and parameters: {'optimizer': 'adam', 'num_layers': 1, 'activation': 'elu', 'fc_layers': 'fc128', 'pool_size_l0': 3, 'out_channels_l0': 16}. Best is trial 0 with value: 0.0408243287919173.
W0522 00:17:19.705000 2632059 .venv/lib/python3.12/site-packages/torch/utils/_pytree.py:630] <enum 'KernelPreference'> is an Enum subclass and is now natively supported by torch.compile as an opaque value type. Calling register_constant() on Enum subclasses is deprecated and will be an error in a future release.
W0522 00:17:19.706000 2632060 .venv/lib/python3.12/site-packages/torch/utils/_pytree.py:630] <enum 'KernelPreference'> is an Enum subclass and is now natively supported by torch.compile as an opaque value type. Calling register_constant() on Enum subclasses is deprecated and will be an error in a future release.
W0522 00:17:20.136000 2632061 .venv/lib/python3.12/site-packages/torch/utils/_pytree.py:630] <enum 'KernelPreference'> is an Enum subclass and is now natively supported by torch.compile as an opaque value type. Calling register_constant() on Enum subclasses is deprecated and will be an error in a future release.
[rank: 0] Seed set to 42
[rank: 0] Seed set to 42
GPU available: True (cuda), used: True
TPU available: False, using: 0 TPU cores
💡 Tip: For seamless cloud logging and experiment tracking, try installing [litlogger](https://pypi.org/project/litlogger/) to enable LitLogger, which logs metrics and artifacts automatically to the Lightning Experiments platform.
GPU available: True (cuda), used: True
TPU available: False, using: 0 TPU cores
💡 Tip: For seamless cloud logging and experiment tracking, try installing [litlogger](https://pypi.org/project/litlogger/) to enable LitLogger, which logs metrics and artifacts automatically to the Lightning Experiments platform.
[rank: 0] Seed set to 42
GPU available: True (cuda), used: True
TPU available: False, using: 0 TPU cores
💡 Tip: For seamless cloud logging and experiment tracking, try installing [litlogger](https://pypi.org/project/litlogger/) to enable LitLogger, which logs metrics and artifacts automatically to the Lightning Experiments platform.
LOCAL_RANK: 0 - CUDA_VISIBLE_DEVICES: [0]
LOCAL_RANK: 0 - CUDA_VISIBLE_DEVICES: [0]
LOCAL_RANK: 0 - CUDA_VISIBLE_DEVICES: [0]
SLURM auto-requeueing enabled. Setting signal handlers.
SLURM auto-requeueing enabled. Setting signal handlers.
SLURM auto-requeueing enabled. Setting signal handlers.
`Trainer.fit` stopped: `max_epochs=30` reached.
`Trainer.fit` stopped: `max_epochs=30` reached.
`Trainer.fit` stopped: `max_epochs=30` reached.
[I 2026-05-22 00:18:05,286] Trial 2 finished with value: 0.08151691296399205 and parameters: {'optimizer': 'adamw', 'num_layers': 1, 'activation': 'elu', 'fc_layers': 'fc32', 'pool_size_l0': 4, 'out_channels_l0': 4}. Best is trial 1 with value: 0.05456459237336861.
[I 2026-05-22 00:18:05,420] Trial 1 finished with value: 0.05293132742489446 and parameters: {'optimizer': 'adamw', 'num_layers': 1, 'activation': 'relu', 'fc_layers': 'fc128', 'pool_size_l0': 3, 'out_channels_l0': 8}. Best is trial 1 with value: 0.05293132742489446.
[I 2026-05-22 00:18:05,421] Trial 2 pruned. Conv channel counts must be non-decreasing.
[I 2026-05-22 00:18:09,024] Trial 1 finished with value: 0.048262429893666886 and parameters: {'optimizer': 'adamw', 'num_layers': 2, 'activation': 'elu', 'fc_layers': 'fc16', 'pool_size_l0': 2, 'out_channels_l0': 8, 'pool_size_l1': 3, 'out_channels_l1': 32}. Best is trial 0 with value: 0.0408243287919173.
W0522 00:18:15.691000 2632314 .venv/lib/python3.12/site-packages/torch/utils/_pytree.py:630] <enum 'KernelPreference'> is an Enum subclass and is now natively supported by torch.compile as an opaque value type. Calling register_constant() on Enum subclasses is deprecated and will be an error in a future release.
W0522 00:18:15.691000 2632315 .venv/lib/python3.12/site-packages/torch/utils/_pytree.py:630] <enum 'KernelPreference'> is an Enum subclass and is now natively supported by torch.compile as an opaque value type. Calling register_constant() on Enum subclasses is deprecated and will be an error in a future release.
[rank: 0] Seed set to 42
[rank: 0] Seed set to 42
GPU available: True (cuda), used: True
TPU available: False, using: 0 TPU cores
💡 Tip: For seamless cloud logging and experiment tracking, try installing [litlogger](https://pypi.org/project/litlogger/) to enable LitLogger, which logs metrics and artifacts automatically to the Lightning Experiments platform.
GPU available: True (cuda), used: True
TPU available: False, using: 0 TPU cores
💡 Tip: For seamless cloud logging and experiment tracking, try installing [litlogger](https://pypi.org/project/litlogger/) to enable LitLogger, which logs metrics and artifacts automatically to the Lightning Experiments platform.
LOCAL_RANK: 0 - CUDA_VISIBLE_DEVICES: [0]
LOCAL_RANK: 0 - CUDA_VISIBLE_DEVICES: [0]
SLURM auto-requeueing enabled. Setting signal handlers.
SLURM auto-requeueing enabled. Setting signal handlers.
W0522 00:18:19.148000 2632318 .venv/lib/python3.12/site-packages/torch/utils/_pytree.py:630] <enum 'KernelPreference'> is an Enum subclass and is now natively supported by torch.compile as an opaque value type. Calling register_constant() on Enum subclasses is deprecated and will be an error in a future release.
[rank: 0] Seed set to 42
GPU available: True (cuda), used: True
TPU available: False, using: 0 TPU cores
💡 Tip: For seamless cloud logging and experiment tracking, try installing [litlogger](https://pypi.org/project/litlogger/) to enable LitLogger, which logs metrics and artifacts automatically to the Lightning Experiments platform.
LOCAL_RANK: 0 - CUDA_VISIBLE_DEVICES: [0]
SLURM auto-requeueing enabled. Setting signal handlers.
`Trainer.fit` stopped: `max_epochs=30` reached.
[I 2026-05-22 00:18:59,985] Trial 3 finished with value: 0.06851160050840133 and parameters: {'optimizer': 'adam', 'num_layers': 1, 'activation': 'relu', 'fc_layers': 'fc16', 'pool_size_l0': 2, 'out_channels_l0': 1}. Best is trial 1 with value: 0.05456459237336861.
`Trainer.fit` stopped: `max_epochs=30` reached.
`Trainer.fit` stopped: `max_epochs=30` reached.
[I 2026-05-22 00:19:07,440] Trial 3 finished with value: 0.08235963516107168 and parameters: {'optimizer': 'adam', 'num_layers': 3, 'activation': 'relu', 'fc_layers': 'fc128', 'pool_size_l0': 4, 'out_channels_l0': 4, 'pool_size_l1': 4, 'out_channels_l1': 4, 'pool_size_l2': 2, 'out_channels_l2': 32}. Best is trial 1 with value: 0.05293132742489446.
[I 2026-05-22 00:19:07,442] Trial 4 pruned. Conv channel counts must be non-decreasing.
[I 2026-05-22 00:19:09,103] Trial 2 finished with value: 0.030121993405462115 and parameters: {'optimizer': 'adamw', 'num_layers': 2, 'activation': 'relu', 'fc_layers': 'fc128_64', 'pool_size_l0': 4, 'out_channels_l0': 4, 'pool_size_l1': 3, 'out_channels_l1': 24}. Best is trial 2 with value: 0.030121993405462115.
W0522 00:19:10.673000 2632561 .venv/lib/python3.12/site-packages/torch/utils/_pytree.py:630] <enum 'KernelPreference'> is an Enum subclass and is now natively supported by torch.compile as an opaque value type. Calling register_constant() on Enum subclasses is deprecated and will be an error in a future release.
[rank: 0] Seed set to 42
GPU available: True (cuda), used: True
TPU available: False, using: 0 TPU cores
💡 Tip: For seamless cloud logging and experiment tracking, try installing [litlogger](https://pypi.org/project/litlogger/) to enable LitLogger, which logs metrics and artifacts automatically to the Lightning Experiments platform.
LOCAL_RANK: 0 - CUDA_VISIBLE_DEVICES: [0]
SLURM auto-requeueing enabled. Setting signal handlers.
W0522 00:19:17.278000 2632570 .venv/lib/python3.12/site-packages/torch/utils/_pytree.py:630] <enum 'KernelPreference'> is an Enum subclass and is now natively supported by torch.compile as an opaque value type. Calling register_constant() on Enum subclasses is deprecated and will be an error in a future release.
[rank: 0] Seed set to 42
GPU available: True (cuda), used: True
TPU available: False, using: 0 TPU cores
💡 Tip: For seamless cloud logging and experiment tracking, try installing [litlogger](https://pypi.org/project/litlogger/) to enable LitLogger, which logs metrics and artifacts automatically to the Lightning Experiments platform.
W0522 00:19:18.686000 2632572 .venv/lib/python3.12/site-packages/torch/utils/_pytree.py:630] <enum 'KernelPreference'> is an Enum subclass and is now natively supported by torch.compile as an opaque value type. Calling register_constant() on Enum subclasses is deprecated and will be an error in a future release.
[rank: 0] Seed set to 42
LOCAL_RANK: 0 - CUDA_VISIBLE_DEVICES: [0]
GPU available: True (cuda), used: True
TPU available: False, using: 0 TPU cores
💡 Tip: For seamless cloud logging and experiment tracking, try installing [litlogger](https://pypi.org/project/litlogger/) to enable LitLogger, which logs metrics and artifacts automatically to the Lightning Experiments platform.
SLURM auto-requeueing enabled. Setting signal handlers.
LOCAL_RANK: 0 - CUDA_VISIBLE_DEVICES: [0]
SLURM auto-requeueing enabled. Setting signal handlers.
`Trainer.fit` stopped: `max_epochs=30` reached.
[I 2026-05-22 00:19:57,764] Trial 4 finished with value: 0.04930976247074907 and parameters: {'optimizer': 'adam', 'num_layers': 2, 'activation': 'elu', 'fc_layers': 'fc128', 'pool_size_l0': 4, 'out_channels_l0': 8, 'pool_size_l1': 4, 'out_channels_l1': 24}. Best is trial 4 with value: 0.04930976247074907.
`Trainer.fit` stopped: `max_epochs=30` reached.
`Trainer.fit` stopped: `max_epochs=30` reached.
[I 2026-05-22 00:20:04,455] Trial 3 finished with value: 0.04324647121857877 and parameters: {'optimizer': 'adam', 'num_layers': 1, 'activation': 'relu', 'fc_layers': 'fc128', 'pool_size_l0': 4, 'out_channels_l0': 4}. Best is trial 2 with value: 0.030121993405462115.
[I 2026-05-22 00:20:06,261] Trial 5 finished with value: 0.08326059225459236 and parameters: {'optimizer': 'adamw', 'num_layers': 3, 'activation': 'relu', 'fc_layers': 'fc128', 'pool_size_l0': 4, 'out_channels_l0': 1, 'pool_size_l1': 2, 'out_channels_l1': 24, 'pool_size_l2': 3, 'out_channels_l2': 24}. Best is trial 1 with value: 0.05293132742489446.
W0522 00:20:07.831000 2632815 .venv/lib/python3.12/site-packages/torch/utils/_pytree.py:630] <enum 'KernelPreference'> is an Enum subclass and is now natively supported by torch.compile as an opaque value type. Calling register_constant() on Enum subclasses is deprecated and will be an error in a future release.
[rank: 0] Seed set to 42
GPU available: True (cuda), used: True
TPU available: False, using: 0 TPU cores
💡 Tip: For seamless cloud logging and experiment tracking, try installing [litlogger](https://pypi.org/project/litlogger/) to enable LitLogger, which logs metrics and artifacts automatically to the Lightning Experiments platform.
LOCAL_RANK: 0 - CUDA_VISIBLE_DEVICES: [0]
SLURM auto-requeueing enabled. Setting signal handlers.
W0522 00:20:14.433000 2632824 .venv/lib/python3.12/site-packages/torch/utils/_pytree.py:630] <enum 'KernelPreference'> is an Enum subclass and is now natively supported by torch.compile as an opaque value type. Calling register_constant() on Enum subclasses is deprecated and will be an error in a future release.
W0522 00:20:15.307000 2632826 .venv/lib/python3.12/site-packages/torch/utils/_pytree.py:630] <enum 'KernelPreference'> is an Enum subclass and is now natively supported by torch.compile as an opaque value type. Calling register_constant() on Enum subclasses is deprecated and will be an error in a future release.
[rank: 0] Seed set to 42
GPU available: True (cuda), used: True
TPU available: False, using: 0 TPU cores
💡 Tip: For seamless cloud logging and experiment tracking, try installing [litlogger](https://pypi.org/project/litlogger/) to enable LitLogger, which logs metrics and artifacts automatically to the Lightning Experiments platform.
[rank: 0] Seed set to 42
GPU available: True (cuda), used: True
TPU available: False, using: 0 TPU cores
💡 Tip: For seamless cloud logging and experiment tracking, try installing [litlogger](https://pypi.org/project/litlogger/) to enable LitLogger, which logs metrics and artifacts automatically to the Lightning Experiments platform.
LOCAL_RANK: 0 - CUDA_VISIBLE_DEVICES: [0]
SLURM auto-requeueing enabled. Setting signal handlers.
LOCAL_RANK: 0 - CUDA_VISIBLE_DEVICES: [0]
SLURM auto-requeueing enabled. Setting signal handlers.
`Trainer.fit` stopped: `max_epochs=30` reached.
[I 2026-05-22 00:20:56,626] Trial 5 finished with value: 0.04017779197626235 and parameters: {'optimizer': 'adam', 'num_layers': 2, 'activation': 'relu', 'fc_layers': 'fc128_64', 'pool_size_l0': 3, 'out_channels_l0': 4, 'pool_size_l1': 3, 'out_channels_l1': 24}. Best is trial 5 with value: 0.04017779197626235.
`Trainer.fit` stopped: `max_epochs=30` reached.
`Trainer.fit` stopped: `max_epochs=30` reached.
[I 2026-05-22 00:21:02,713] Trial 4 finished with value: 0.050901294019172226 and parameters: {'optimizer': 'adam', 'num_layers': 1, 'activation': 'relu', 'fc_layers': 'fc16', 'pool_size_l0': 2, 'out_channels_l0': 16}. Best is trial 2 with value: 0.030121993405462115.
[I 2026-05-22 00:21:04,843] Trial 6 finished with value: 0.09403079917067325 and parameters: {'optimizer': 'adamw', 'num_layers': 3, 'activation': 'elu', 'fc_layers': 'fc32', 'pool_size_l0': 2, 'out_channels_l0': 4, 'pool_size_l1': 3, 'out_channels_l1': 4, 'pool_size_l2': 3, 'out_channels_l2': 32}. Best is trial 1 with value: 0.05293132742489446.
W0522 00:21:06.174000 2633069 .venv/lib/python3.12/site-packages/torch/utils/_pytree.py:630] <enum 'KernelPreference'> is an Enum subclass and is now natively supported by torch.compile as an opaque value type. Calling register_constant() on Enum subclasses is deprecated and will be an error in a future release.
[rank: 0] Seed set to 42
GPU available: True (cuda), used: True
TPU available: False, using: 0 TPU cores
💡 Tip: For seamless cloud logging and experiment tracking, try installing [litlogger](https://pypi.org/project/litlogger/) to enable LitLogger, which logs metrics and artifacts automatically to the Lightning Experiments platform.
LOCAL_RANK: 0 - CUDA_VISIBLE_DEVICES: [0]
SLURM auto-requeueing enabled. Setting signal handlers.
W0522 00:21:12.907000 2633078 .venv/lib/python3.12/site-packages/torch/utils/_pytree.py:630] <enum 'KernelPreference'> is an Enum subclass and is now natively supported by torch.compile as an opaque value type. Calling register_constant() on Enum subclasses is deprecated and will be an error in a future release.
[rank: 0] Seed set to 42
GPU available: True (cuda), used: True
TPU available: False, using: 0 TPU cores
💡 Tip: For seamless cloud logging and experiment tracking, try installing [litlogger](https://pypi.org/project/litlogger/) to enable LitLogger, which logs metrics and artifacts automatically to the Lightning Experiments platform.
W0522 00:21:14.490000 2633080 .venv/lib/python3.12/site-packages/torch/utils/_pytree.py:630] <enum 'KernelPreference'> is an Enum subclass and is now natively supported by torch.compile as an opaque value type. Calling register_constant() on Enum subclasses is deprecated and will be an error in a future release.
LOCAL_RANK: 0 - CUDA_VISIBLE_DEVICES: [0]
[rank: 0] Seed set to 42
SLURM auto-requeueing enabled. Setting signal handlers.
GPU available: True (cuda), used: True
TPU available: False, using: 0 TPU cores
💡 Tip: For seamless cloud logging and experiment tracking, try installing [litlogger](https://pypi.org/project/litlogger/) to enable LitLogger, which logs metrics and artifacts automatically to the Lightning Experiments platform.
LOCAL_RANK: 0 - CUDA_VISIBLE_DEVICES: [0]
SLURM auto-requeueing enabled. Setting signal handlers.
`Trainer.fit` stopped: `max_epochs=30` reached.
[I 2026-05-22 00:21:51,521] Trial 6 finished with value: 0.03609428732124473 and parameters: {'optimizer': 'adamw', 'num_layers': 1, 'activation': 'relu', 'fc_layers': 'fc64_32', 'pool_size_l0': 3, 'out_channels_l0': 4}. Best is trial 6 with value: 0.03609428732124473.
`Trainer.fit` stopped: `max_epochs=30` reached.
W0522 00:22:01.046000 2633323 .venv/lib/python3.12/site-packages/torch/utils/_pytree.py:630] <enum 'KernelPreference'> is an Enum subclass and is now natively supported by torch.compile as an opaque value type. Calling register_constant() on Enum subclasses is deprecated and will be an error in a future release.
[rank: 0] Seed set to 42
GPU available: True (cuda), used: True
TPU available: False, using: 0 TPU cores
💡 Tip: For seamless cloud logging and experiment tracking, try installing [litlogger](https://pypi.org/project/litlogger/) to enable LitLogger, which logs metrics and artifacts automatically to the Lightning Experiments platform.
[I 2026-05-22 00:22:02,446] Trial 5 finished with value: 0.054601542123516006 and parameters: {'optimizer': 'adam', 'num_layers': 2, 'activation': 'elu', 'fc_layers': 'fc128', 'pool_size_l0': 4, 'out_channels_l0': 4, 'pool_size_l1': 3, 'out_channels_l1': 8}. Best is trial 2 with value: 0.030121993405462115.
`Trainer.fit` stopped: `max_epochs=30` reached.
LOCAL_RANK: 0 - CUDA_VISIBLE_DEVICES: [0]
SLURM auto-requeueing enabled. Setting signal handlers.
[I 2026-05-22 00:22:05,949] Trial 7 finished with value: 0.04840258694935141 and parameters: {'optimizer': 'adam', 'num_layers': 2, 'activation': 'elu', 'fc_layers': 'fc128_64', 'pool_size_l0': 3, 'out_channels_l0': 4, 'pool_size_l1': 4, 'out_channels_l1': 24}. Best is trial 7 with value: 0.04840258694935141.
